Tarih,Hisse,open,high,low,close,volume,YuksekKapanis_Fark,AcilisKapanis_Fark,AcilisKapanisFark_Ort,AcilisKapanisFark_OrtalamayaGoreDegisim,AcilisKapanisFarkOrt_MaxSon10,HacimOrtalama,%Hacim_HacimOrtalama,Fark_Orani,Kosul,rsi,MACD_12_26_9,MACDs_12_26_9,MACDh_12_26_9,Tarih1,prev_close,%Deg,isPivot,pointpos,destek,direnc,Tsinyal_Banker_Dip,Tsinyal_Banker_DipKarar
10-12-2025 16:00,SAFKR,25.34,26.06,25.16,25.94,1285663.0,0.12,0.6,0.08,650.0,0.6,668711.4,92.26,0.2,True,74.33,0.24,0.16,0.07,2025-12-10,25.12,3.26,0,,24.28,ATH,False,False
10-12-2025 15:00,GOZDE,21.94,22.36,21.94,22.26,396047.0,0.1,0.32,0.03,841.18,0.32,139027.4,184.87,0.31,True,73.92,0.12,0.1,0.03,2025-12-10,21.68,2.68,0,,21.62,ATH,False,False
10-12-2025 15:00,ZEDUR,8.53,8.67,8.51,8.64,541045.0,0.03,0.11,0.01,685.71,0.11,229588.5,135.66,0.27,True,73.38,0.05,0.04,0.01,2025-12-10,8.49,1.77,0,,8.21,ATH,False,False
10-12-2025 15:00,EGEPO,7.12,7.5,7.11,7.43,2983276.0,0.07,0.31,0.02,1531.58,0.31,562030.2,430.8,0.23,True,65.63,-0.02,-0.03,0.01,2025-12-10,7.18,3.48,0,,7.19,7.66,False,False
10-12-2025 15:00,PKENT,207.9,216.1,207.9,214.4,346906.0,1.7,6.5,1.08,501.85,6.5,148215.6,134.05,0.26,True,70.98,3.88,2.61,1.26,2025-12-10,203.0,5.62,0,,191.7,226.0,False,False
10-12-2025 15:00,SERNT,8.32,8.87,8.31,8.8,5803092.0,0.07,0.48,0.05,860.0,0.48,1152604.0,403.48,0.15,True,81.61,0.09,0.05,0.04,2025-12-10,8.23,6.93,0,,8.14,ATH,False,False
10-12-2025 15:00,ETILR,3.79,3.83,3.78,3.83,713241.0,0.0,0.04,0.01,471.43,0.04,474948.0,50.17,0.0,True,70.13,0.02,0.01,0.01,2025-12-10,3.74,2.41,0,,3.68,3.85,False,False
10-12-2025 15:00,TRMET,100.2,102.8,100.1,102.5,1497552.0,0.3,2.3,0.05,4081.82,2.3,898913.2,66.6,0.13,True,62.13,0.4,0.45,-0.05,2025-12-10,100.4,2.09,0,,98.9,102.6,False,False
10-12-2025 14:00,IHLGM,2.25,2.36,2.24,2.36,10232379.0,0.0,0.11,0.02,587.5,0.11,3021042.0,238.7,0.0,True,77.32,0.01,-0.01,0.01,2025-12-10,2.2,7.27,0,,2.18,2.46,False,False
10-12-2025 14:00,IHGZT,1.74,1.77,1.74,1.77,6684352.0,0.0,0.03,0.01,400.0,0.03,3557758.0,87.88,0.0,True,55.72,-0.01,-0.01,0.0,2025-12-10,1.73,2.31,0,,1.72,1.8,False,False
10-12-2025 14:00,IHLAS,2.63,2.68,2.62,2.68,22949442.0,0.0,0.05,0.0,1566.67,0.05,8839221.6,159.63,0.0,True,57.74,-0.01,-0.02,0.01,2025-12-10,2.63,1.9,0,,2.61,2.73,True,False
10-12-2025 14:00,BMSTL,98.6,104.6,98.5,103.9,216477.0,0.7,5.3,0.49,981.63,5.3,127291.8,70.06,0.13,True,49.52,-2.94,-3.7,0.77,2025-12-10,101.0,2.87,0,,95.2,107.8,True,False
10-12-2025 14:00,SEGMN,18.43,18.94,18.43,18.84,934918.0,0.1,0.41,0.04,831.82,0.41,193485.5,383.2,0.24,True,78.57,0.1,0.07,0.03,2025-12-10,18.35,2.67,0,,18.12,ATH,False,False
10-12-2025 13:00,ESCOM,3.03,3.08,3.02,3.08,3568356.0,0.0,0.05,0.0,4900.0,0.05,1566548.2,127.78,0.0,True,48.98,-0.01,-0.01,-0.0,2025-12-10,3.05,0.98,0,,3.03,3.15,False,False
10-12-2025 13:00,LILAK,26.36,26.88,26.28,26.74,1057349.0,0.14,0.38,0.09,313.04,0.38,351720.1,200.62,0.37,True,79.08,0.16,0.09,0.07,2025-12-10,25.88,3.32,0,,25.6,ATH,False,False
10-12-2025 12:00,RUZYE,13.14,13.39,13.08,13.33,1941704.0,0.06,0.19,0.02,726.09,0.19,790208.4,145.72,0.32,True,59.07,-0.0,-0.01,0.0,2025-12-10,12.98,2.7,0,,12.32,13.79,False,False
10-12-2025 12:00,TUPRS,197.2,199.4,196.8,199.2,2794569.0,0.2,2.0,0.03,6566.67,2.0,1774490.5,57.49,0.1,True,55.27,-0.19,-0.13,-0.07,2025-12-10,197.5,0.86,0,,196.6,201.7,False,False
10-12-2025 12:00,CEMTS,11.66,12.12,11.63,11.99,2879052.0,0.13,0.33,0.04,667.44,0.33,851375.0,238.16,0.39,True,69.58,0.1,0.11,-0.01,2025-12-10,11.74,2.13,0,,11.43,12.13,False,False
10-12-2025 12:00,KLSYN,5.51,5.6,5.49,5.6,1159311.0,0.0,0.09,0.01,500.0,0.09,365860.3,216.87,0.0,True,70.69,0.03,0.02,0.01,2025-12-10,5.44,2.94,0,,5.28,ATH,False,False
10-12-2025 12:00,KOCMT,2.98,3.03,2.98,3.03,10082186.0,0.0,0.05,0.0,1566.67,0.05,6543091.5,54.09,0.0,True,65.6,0.02,0.03,-0.0,2025-12-10,2.99,1.34,0,,2.97,3.05,False,False
10-12-2025 11:00,TAVHL,293.25,298.75,293.0,298.5,491489.0,0.25,5.25,1.18,346.81,5.25,203328.7,141.72,0.05,True,80.13,2.21,1.13,1.08,2025-12-10,290.0,2.93,0,,283.25,ATH,False,False
10-12-2025 11:00,ARSAN,3.18,3.46,3.17,3.45,22770176.0,0.01,0.27,0.03,800.0,0.27,4732496.1,381.15,0.04,True,74.12,0.03,0.02,0.01,2025-12-10,3.19,8.15,0,,3.12,ATH,False,False
10-12-2025 11:00,ARMGD,48.02,50.2,47.94,50.15,800255.0,0.05,2.13,0.23,814.16,2.13,380953.2,110.07,0.02,True,86.98,1.51,1.25,0.26,2025-12-10,47.54,5.49,0,,41.42,ATH,False,False
10-12-2025 11:00,HUBVC,2.7,2.87,2.7,2.87,5977766.0,0.0,0.17,0.02,672.73,0.17,987400.1,505.4,0.0,True,79.41,0.01,-0.01,0.02,2025-12-10,2.61,9.96,0,,2.6,ATH,False,False
10-12-2025 11:00,BRKVY,96.35,102.1,96.3,101.1,881873.0,1.0,4.75,0.56,740.71,4.75,213660.3,312.75,0.21,True,81.95,2.18,1.82,0.37,2025-12-10,94.25,7.27,0,,86.0,ATH,False,False
10-12-2025 11:00,MERCN,18.37,19.19,18.23,18.96,2721084.0,0.23,0.59,0.11,431.53,0.59,808184.2,236.69,0.39,True,70.58,0.13,0.06,0.07,2025-12-10,18.34,3.38,0,,17.64,ATH,False,False
10-12-2025 11:00,GSDHO,4.75,4.81,4.73,4.8,1754632.0,0.01,0.05,0.0,1150.0,0.05,649916.4,169.98,0.2,True,54.64,0.01,0.02,-0.01,2025-12-10,4.79,0.21,0,,4.75,4.87,False,False
10-12-2025 11:00,DERHL,13.9,14.15,13.9,14.1,1514053.0,0.05,0.2,0.03,506.06,0.2,627534.9,141.27,0.25,True,64.54,0.08,0.07,0.01,2025-12-10,13.85,1.81,0,,13.3,ATH,False,False
10-12-2025 11:00,MNDTR,7.31,7.41,7.27,7.39,654939.0,0.02,0.08,0.01,1042.86,0.08,383641.3,70.72,0.25,True,62.34,0.02,0.02,0.0,2025-12-10,7.27,1.65,0,,7.24,7.48,False,False
10-12-2025 11:00,BEGYO,5.1,5.13,5.09,5.13,1468453.0,0.0,0.03,0.0,2900.0,0.03,884523.8,66.02,0.0,True,59.39,-0.0,-0.01,0.0,2025-12-10,5.08,0.98,0,,5.05,5.2,False,False
10-12-2025 11:00,TSPOR,1.21,1.22,1.2,1.22,90918728.0,0.0,0.01,0.0,900.0,0.01,51518700.2,76.48,0.0,True,63.31,0.0,0.0,0.0,2025-12-10,1.19,2.52,0,,1.17,1.26,False,False
10-12-2025 11:00,BARMA,31.92,32.8,31.92,32.76,554141.0,0.04,0.84,0.07,1066.67,0.84,307328.2,80.31,0.05,True,65.45,0.35,0.34,0.01,2025-12-10,32.3,1.42,0,,30.7,ATH,False,False
10-12-2025 10:00,BORLS,6.55,6.69,6.43,6.69,34165229.0,0.0,0.14,0.01,900.0,0.14,5683403.3,501.14,0.0,True,81.13,0.23,0.17,0.06,2025-12-10,6.09,9.85,0,,5.33,ATH,False,False
10-12-2025 10:00,ISFIN,19.05,19.3,19.05,19.23,508836.0,0.07,0.18,0.02,847.37,0.18,142660.7,256.68,0.39,True,60.27,-0.01,-0.02,0.01,2025-12-10,19.04,1.0,0,,18.94,19.34,False,False
10-12-2025 10:00,KLKIM,30.9,32.38,30.9,32.04,1314677.0,0.34,1.14,0.13,763.64,1.14,247381.3,431.44,0.3,True,75.0,0.19,0.11,0.09,2025-12-10,30.88,3.76,0,,30.4,ATH,False,False
10-12-2025 10:00,KLRHO,200.6,205.3,193.1,204.4,418731.0,0.9,3.8,0.32,1087.5,3.8,165362.9,153.22,0.24,True,74.79,6.32,6.6,-0.29,2025-12-10,200.5,1.95,0,,166.3,ATH,False,False
10-12-2025 10:00,RYSAS,14.01,14.25,14.01,14.25,1206266.0,0.0,0.24,0.02,1233.33,0.24,408627.5,195.2,0.0,True,73.72,0.06,0.03,0.02,2025-12-10,14.03,1.57,0,,13.82,ATH,False,False
10-12-2025 10:00,SRVGY,3.55,3.63,3.53,3.63,17922885.0,0.0,0.08,0.02,433.33,0.08,6657054.8,169.23,0.0,True,66.44,0.02,0.01,0.01,2025-12-10,3.55,2.25,0,,3.47,3.64,False,False
10-12-2025 10:00,HATSN,40.6,41.08,40.54,40.98,157352.0,0.1,0.38,0.04,955.56,0.38,82363.8,91.05,0.26,True,47.51,-0.2,-0.23,0.03,2025-12-10,40.84,0.34,0,,40.52,42.7,False,False
10-12-2025 10:00,GZNMI,116.9,122.6,116.9,122.6,1677907.0,0.0,5.7,0.57,900.0,5.7,217361.6,671.94,0.0,True,95.68,6.53,6.01,0.52,2025-12-10,111.5,9.96,0,,79.3,ATH,False,False
10-12-2025 10:00,GSRAY,1.28,1.29,1.27,1.29,71608217.0,0.0,0.01,0.0,900.0,0.01,24878984.1,187.83,0.0,True,45.86,-0.0,0.0,-0.0,2025-12-10,1.3,-0.77,0,,1.26,1.31,False,False
10-12-2025 10:00,GMTAS,45.08,45.3,44.48,45.24,293332.0,0.06,0.16,0.02,700.0,0.16,96356.6,204.42,0.37,True,51.89,-0.06,-0.11,0.05,2025-12-10,45.08,0.35,0,,42.66,45.4,False,False
10-12-2025 10:00,GIPTA,59.7,65.6,59.7,65.6,2678620.0,0.0,5.9,0.6,875.21,5.9,396694.8,575.23,0.0,True,77.44,-0.04,-0.49,0.46,2025-12-10,59.65,9.97,0,,59.0,66.45,True,False
10-12-2025 10:00,DOGUB,51.9,58.65,51.0,57.6,1281957.0,1.05,5.7,1.09,423.42,5.7,334255.6,283.53,0.18,True,73.43,1.76,0.77,0.98,2025-12-10,53.35,7.97,0,,45.44,63.25,False,False
10-12-2025 10:00,FZLGY,12.56,12.73,12.49,12.7,1092321.0,0.03,0.14,0.01,1172.73,0.14,328384.2,232.64,0.21,True,61.15,0.06,0.07,-0.01,2025-12-10,12.56,1.11,0,,12.43,12.83,False,False
10-12-2025 10:00,EKOS,27.28,28.3,27.16,28.08,2091990.0,0.22,0.8,0.14,455.56,0.8,576000.1,263.19,0.28,True,77.8,0.22,0.1,0.12,2025-12-10,27.1,3.62,0,,26.2,ATH,False,False
10-12-2025 10:00,KLYPV,58.45,60.85,58.45,60.6,2031509.0,0.25,2.15,0.21,948.78,2.15,271911.4,647.12,0.12,True,84.87,0.46,0.1,0.36,2025-12-10,56.15,7.93,0,,55.85,ATH,False,False
10-12-2025 10:00,SNICA,4.05,4.07,4.05,4.07,1984536.0,0.0,0.02,0.0,1900.0,0.02,694984.6,185.55,0.0,True,53.55,-0.01,-0.01,0.0,2025-12-10,4.05,0.49,0,,4.02,4.11,False,False
10-12-2025 10:00,ENJSA,84.8,85.6,84.75,85.5,342620.0,0.1,0.7,0.05,1172.73,0.7,170663.2,100.76,0.14,True,62.46,0.32,0.39,-0.07,2025-12-10,84.65,1.0,0,,84.2,86.75,False,False
10-12-2025 10:00,PASEU,142.8,145.3,142.1,145.3,883651.0,0.0,2.5,0.43,481.4,2.5,269365.5,228.05,0.0,True,67.43,1.72,1.34,0.38,2025-12-10,144.0,0.9,0,,135.2,ATH,False,False
10-12-2025 10:00,KOPOL,5.63,5.84,5.63,5.8,5143952.0,0.04,0.17,0.02,962.5,0.17,1094683.7,369.9,0.24,True,74.23,0.02,0.02,0.01,2025-12-10,5.61,3.39,0,,5.57,ATH,False,False
10-12-2025 10:00,ASELS,201.9,208.8,200.9,208.0,18365719.0,0.8,6.1,1.55,293.55,6.1,5300960.6,246.46,0.13,True,87.06,4.03,3.05,0.97,2025-12-10,202.0,2.97,0,,183.0,ATH,False,False
10-12-2025 10:00,YIGIT,23.86,24.1,23.84,24.04,399983.0,0.06,0.18,0.03,462.5,0.18,140490.6,184.7,0.33,True,66.85,0.04,0.02,0.02,2025-12-10,23.86,0.75,0,,23.66,24.48,False,False
10-12-2025 10:00,LIDER,55.9,57.75,54.75,57.65,1501719.0,0.1,1.75,0.12,1300.0,1.75,406669.5,269.27,0.06,True,56.79,0.74,1.19,-0.46,2025-12-10,56.65,1.77,0,,45.32,61.25,False,False
10-12-2025 10:00,KRSTL,10.45,10.7,10.41,10.67,2257656.0,0.03,0.22,0.02,816.67,0.22,761327.9,196.54,0.14,True,66.59,-0.02,-0.06,0.04,2025-12-10,10.43,2.3,0,,10.19,10.68,False,False
10-12-2025 10:00,MOPAS,32.12,34.04,32.0,34.02,2214373.0,0.02,1.9,0.23,711.97,1.9,453462.1,388.33,0.01,True,83.37,0.34,0.2,0.14,2025-12-10,32.02,6.25,0,,31.02,ATH,False,False
10-12-2025 10:00,KOTON,15.16,15.8,15.16,15.63,1786410.0,0.17,0.47,0.08,466.27,0.47,564465.0,216.48,0.36,True,74.17,0.15,0.09,0.06,2025-12-10,15.09,3.58,0,,14.53,ATH,False,False
10-12-2025 10:00,ADEL,31.1,31.52,31.1,31.5,208809.0,0.02,0.4,0.03,1233.33,0.4,65143.9,220.54,0.05,True,59.11,-0.08,-0.12,0.04,2025-12-10,31.08,1.35,0,,30.9,31.74,True,False
09-12-2025 17:00,DZGYO,7.62,7.9,7.6,7.87,5482954.0,0.03,0.25,0.02,1462.5,0.25,1426864.1,284.27,0.12,True,72.18,0.11,0.11,-0.0,2025-12-09,7.74,1.68,0,,7.57,ATH,False,False
09-12-2025 17:00,PATEK,24.62,26.5,24.52,26.44,10538542.0,0.06,1.82,0.22,734.86,1.82,2392770.9,340.43,0.03,True,83.58,0.23,0.08,0.15,2025-12-09,24.16,9.44,0,,24.02,ATH,False,False
09-12-2025 17:00,ODAS,5.41,5.46,5.4,5.45,5797102.0,0.01,0.04,0.0,3900.0,0.04,2786520.6,108.04,0.25,True,59.55,0.02,0.01,0.0,2025-12-09,5.39,1.11,0,,5.26,5.46,False,False
09-12-2025 17:00,TUCLK,9.0,9.67,8.98,9.58,4511469.0,0.09,0.58,0.05,1015.38,0.58,738030.5,511.28,0.16,True,76.93,0.01,-0.03,0.03,2025-12-09,9.05,5.86,1,9.67,8.85,9.67,True,True
09-12-2025 17:00,TATGD,12.78,13.32,12.74,13.2,1785952.0,0.12,0.42,0.03,1400.0,0.42,324978.5,449.56,0.29,True,76.11,0.13,0.1,0.02,2025-12-09,12.88,2.48,3,,12.28,ATH,False,False
09-12-2025 17:00,TERA,306.75,318.0,305.75,315.0,3367540.0,3.0,8.25,0.78,964.52,8.25,880984.2,282.25,0.36,True,83.46,5.87,5.42,0.45,2025-12-09,304.25,3.53,1,318.0,303.25,318.0,False,False
09-12-2025 17:00,DMSAS,11.17,11.41,11.15,11.36,619635.0,0.05,0.19,0.03,475.76,0.19,168264.4,268.25,0.26,True,73.81,0.09,0.07,0.02,2025-12-09,11.05,2.81,0,,10.7,ATH,False,False
09-12-2025 17:00,RALYH,213.2,223.0,212.8,222.6,454713.0,0.4,9.4,1.41,566.67,9.4,113930.8,299.11,0.04,True,76.72,2.16,1.12,1.04,2025-12-09,210.0,6.0,1,223.0,204.4,223.0,False,False
09-12-2025 17:00,ALBRK,8.31,8.39,8.31,8.39,3876561.0,0.0,0.08,0.01,1500.0,0.08,1362924.9,184.43,0.0,True,65.5,0.03,0.03,0.0,2025-12-09,8.31,0.96,0,,8.2,ATH,False,False
09-12-2025 17:00,EGSER,3.02,3.14,3.01,3.12,2123171.0,0.02,0.1,0.01,1150.0,0.1,855679.8,148.13,0.2,True,67.42,0.01,0.0,0.0,2025-12-09,3.04,2.63,3,,3.01,3.25,False,False
09-12-2025 17:00,DGNMO,5.4,5.45,5.4,5.44,229511.0,0.01,0.04,0.01,300.0,0.04,125640.1,82.67,0.25,True,55.27,-0.01,-0.03,0.01,2025-12-09,5.35,1.68,0,,5.29,5.69,False,False
09-12-2025 17:00,DENGE,3.29,3.66,3.28,3.66,7033135.0,0.0,0.37,0.03,1056.25,0.37,1467528.2,379.25,0.0,True,74.44,0.03,0.02,0.01,2025-12-09,3.33,9.91,0,,3.18,ATH,False,False
09-12-2025 17:00,TURSG,12.25,12.33,12.22,12.31,11776104.0,0.02,0.06,0.0,2900.0,0.06,4616485.6,155.09,0.33,True,70.22,0.09,0.09,-0.0,2025-12-09,12.2,0.9,1,12.33,11.57,12.33,False,False
09-12-2025 17:00,ULUUN,6.91,6.96,6.9,6.96,441160.0,0.0,0.05,0.01,400.0,0.05,219050.3,101.4,0.0,True,63.29,0.01,0.01,0.01,2025-12-09,6.88,1.16,0,,6.8,6.97,False,False
09-12-2025 17:00,BIGCH,70.35,75.0,69.55,75.0,552636.0,0.0,4.65,0.3,1476.27,4.65,337858.3,63.57,0.0,True,72.71,1.72,1.93,-0.21,2025-12-09,72.4,3.59,1,75.0,58.55,ATH,False,False
09-12-2025 17:00,BESLR,12.76,12.91,12.76,12.91,754416.0,0.0,0.15,0.02,733.33,0.15,218456.1,245.34,0.0,True,70.07,0.06,0.06,0.0,2025-12-09,12.72,1.49,0,,12.68,ATH,False,False
09-12-2025 17:00,AZTEK,4.37,4.52,4.34,4.49,3340478.0,0.03,0.12,0.01,1400.0,0.12,896328.1,272.68,0.25,True,59.4,-0.03,-0.04,0.01,2025-12-09,4.38,2.51,3,,4.4,4.69,True,True
09-12-2025 17:00,LIDFA,4.35,4.44,4.35,4.43,1855383.0,0.01,0.08,0.0,1900.0,0.08,451863.3,310.61,0.13,True,55.14,-0.02,-0.02,0.0,2025-12-09,4.38,1.14,0,,4.34,4.44,False,False
09-12-2025 16:00,MEGMT,49.52,51.85,48.78,51.85,9334162.0,0.0,2.33,0.45,418.93,2.33,2907044.1,221.09,0.0,True,78.24,1.32,1.02,0.3,2025-12-09,47.18,9.9,0,,42.94,ATH,False,False
09-12-2025 16:00,ICUGS,2.79,2.85,2.77,2.85,4770608.0,0.0,0.06,0.01,566.67,0.06,1145557.6,316.44,0.0,True,61.0,-0.01,-0.01,0.0,2025-12-09,2.79,2.15,2,2.77,2.77,3.08,False,False
09-12-2025 16:00,VAKBN,30.68,31.16,30.62,31.14,9430475.0,0.02,0.46,0.03,1542.86,0.46,4652026.4,102.72,0.04,True,55.66,-0.14,-0.19,0.05,2025-12-09,30.82,1.04,0,,30.3,31.5,True,True
09-12-2025 15:00,ULKER,112.9,115.4,112.9,115.1,2540085.0,0.3,2.2,0.12,1733.33,2.2,633518.0,300.95,0.14,True,62.68,0.31,0.32,-0.01,2025-12-09,113.5,1.41,0,,112.0,ATH,False,False
09-12-2025 15:00,GLYHO,12.34,12.81,12.34,12.81,3135484.0,0.0,0.47,0.04,993.02,0.47,1104908.1,183.78,0.0,True,71.75,0.04,0.02,0.02,2025-12-09,12.24,4.66,0,,12.16,ATH,False,False
09-12-2025 14:00,ANSGR,23.54,23.8,23.52,23.78,1579201.0,0.02,0.24,0.03,757.14,0.24,660395.4,139.13,0.08,True,74.96,0.26,0.22,0.04,2025-12-09,23.28,2.15,0,,22.3,ATH,False,False
09-12-2025 14:00,SISE,41.7,43.0,41.48,42.92,45740806.0,0.08,1.22,0.06,1933.33,1.22,15369100.2,197.62,0.07,True,80.61,1.17,1.12,0.05,2025-12-09,41.52,3.37,0,,41.42,ATH,False,False
09-12-2025 14:00,GWIND,23.58,23.8,23.54,23.76,462409.0,0.04,0.18,0.01,1400.0,0.18,279290.5,65.57,0.22,True,60.9,0.09,0.08,0.01,2025-12-09,23.48,1.19,0,,23.06,23.8,False,False
09-12-2025 14:00,EMKEL,69.35,71.65,69.2,71.55,2329436.0,0.1,2.2,0.36,511.11,2.2,748469.0,211.23,0.05,True,77.01,1.41,1.36,0.05,2025-12-09,67.3,6.32,0,,66.0,ATH,False,False
09-12-2025 14:00,KRDMD,25.78,26.22,25.78,26.12,11332569.0,0.1,0.34,0.01,5566.67,0.34,4302904.9,163.37,0.29,True,61.24,0.06,0.06,0.0,2025-12-09,25.84,1.08,0,,25.48,26.22,False,False
09-12-2025 14:00,KCAER,10.36,10.47,10.36,10.46,1653889.0,0.01,0.1,0.01,900.0,0.1,932470.7,77.37,0.1,True,63.7,0.02,0.01,0.01,2025-12-09,10.33,1.26,0,,10.32,10.5,False,False
09-12-2025 14:00,ALKIM,16.62,17.59,16.6,17.34,3984878.0,0.25,0.72,0.06,1120.34,0.72,747336.4,433.21,0.35,True,77.96,0.18,0.14,0.04,2025-12-09,16.46,5.35,0,,16.32,ATH,False,False
09-12-2025 14:00,KRVGD,2.55,2.59,2.54,2.58,2897175.0,0.01,0.03,0.01,400.0,0.03,1423843.8,103.48,0.33,True,60.14,0.01,0.01,0.0,2025-12-09,2.55,1.18,0,,2.52,2.66,False,False
09-12-2025 14:00,IZENR,10.28,10.68,10.26,10.65,10578866.0,0.03,0.37,0.05,704.35,0.37,3054318.5,246.36,0.08,True,72.85,0.08,0.06,0.03,2025-12-09,10.19,4.51,1,10.68,10.04,10.68,False,False
09-12-2025 13:00,TRENJ,80.55,83.7,80.4,83.7,1422019.0,0.0,3.15,0.08,3837.5,3.15,510754.3,178.42,0.0,True,65.69,0.78,0.94,-0.16,2025-12-09,80.2,4.36,0,,79.55,84.8,False,False
09-12-2025 13:00,SEKUR,4.1,4.18,4.06,4.17,465942.0,0.01,0.07,0.0,3400.0,0.07,179472.4,159.62,0.14,True,51.33,-0.03,-0.03,-0.0,2025-12-09,4.1,1.71,0,,4.06,4.59,False,False
09-12-2025 13:00,CWENE,28.46,29.54,28.2,29.52,9269682.0,0.02,1.06,0.2,424.75,1.06,5683037.6,63.11,0.02,True,66.82,0.26,0.16,0.1,2025-12-09,27.2,8.53,0,,26.66,ATH,False,False
09-12-2025 13:00,GUBRF,324.25,329.5,323.5,329.0,391179.0,0.5,4.75,0.42,1017.65,4.75,227207.6,72.17,0.11,True,73.09,4.18,4.31,-0.13,2025-12-09,326.0,0.92,2,323.5,323.5,330.0,False,False
09-12-2025 12:00,KFEIN,9.05,9.27,9.05,9.24,1045532.0,0.03,0.19,0.01,1800.0,0.19,329051.3,217.74,0.16,True,67.46,0.02,0.0,0.01,2025-12-09,9.1,1.54,1,9.27,9.04,9.27,False,False
09-12-2025 12:00,KAREL,9.18,9.31,9.18,9.28,761334.0,0.03,0.1,0.01,614.29,0.1,378248.7,101.28,0.3,True,67.59,0.06,0.04,0.01,2025-12-09,9.21,0.76,1,9.31,8.9,9.31,False,False
09-12-2025 12:00,ENERY,10.46,10.64,10.46,10.59,6355415.0,0.05,0.13,0.01,983.33,0.13,2254496.3,181.9,0.38,True,65.94,0.05,0.05,0.0,2025-12-09,10.46,1.24,1,10.64,10.07,10.64,False,False
09-12-2025 12:00,SMART,22.92,24.98,22.84,24.52,1575054.0,0.46,1.6,0.14,1042.86,1.6,221382.6,611.46,0.29,True,75.18,0.09,0.01,0.08,2025-12-09,23.14,5.96,3,,22.76,25.4,True,True
09-12-2025 12:00,SKYMD,12.23,12.4,12.2,12.39,1343572.0,0.01,0.16,0.02,661.9,0.16,366682.4,266.41,0.06,True,71.46,0.02,-0.01,0.03,2025-12-09,12.11,2.31,0,,12.1,12.85,False,False
09-12-2025 11:00,TRILC,16.59,17.02,16.58,16.96,1400263.0,0.06,0.37,0.04,957.14,0.37,342174.6,309.22,0.16,True,69.25,0.05,0.03,0.02,2025-12-09,16.49,2.85,0,,16.45,17.04,False,False
09-12-2025 11:00,ARTMS,42.0,42.78,41.9,42.74,274107.0,0.04,0.74,0.07,957.14,0.74,155499.2,76.28,0.05,True,70.9,0.41,0.36,0.06,2025-12-09,41.62,2.69,0,,39.88,43.06,False,False
09-12-2025 11:00,ARENA,28.56,29.64,28.54,29.34,1136528.0,0.3,0.78,0.11,622.22,0.78,220858.6,414.6,0.38,True,75.78,0.35,0.28,0.07,2025-12-09,27.86,5.31,1,29.64,27.76,29.64,False,False
09-12-2025 11:00,NIBAS,22.4,23.3,22.14,23.16,1325514.0,0.14,0.76,0.1,645.1,0.76,272489.0,386.45,0.18,True,65.77,-0.12,-0.21,0.1,2025-12-09,22.06,4.99,0,,22.0,25.66,True,False
09-12-2025 10:00,GENTS,10.41,10.87,10.41,10.78,4147291.0,0.09,0.37,0.01,4525.0,0.37,975025.9,325.35,0.24,True,56.66,-0.11,-0.13,0.02,2025-12-09,10.25,5.17,1,10.87,10.25,10.87,True,True
09-12-2025 10:00,TCELL,100.6,102.1,100.5,101.9,5684176.0,0.2,1.3,0.32,306.25,1.3,2740995.5,107.38,0.15,True,75.93,0.93,0.79,0.14,2025-12-09,100.8,1.09,1,102.1,96.8,102.1,False,False
09-12-2025 10:00,TCKRC,57.1,58.5,56.6,58.15,694213.0,0.35,1.05,0.1,900.0,1.05,452976.2,53.26,0.33,True,77.77,1.41,1.4,0.0,2025-12-09,57.05,1.93,0,,50.0,59.8,False,False
09-12-2025 10:00,MGROS,512.0,520.0,509.5,518.5,820900.0,1.5,6.5,0.85,664.71,6.5,269912.4,204.14,0.23,True,60.86,0.22,-0.54,0.76,2025-12-09,511.0,1.47,3,,505.0,519.0,False,False
09-12-2025 10:00,SAHOL,85.75,86.3,85.15,86.25,4830101.0,0.05,0.5,0.02,1900.0,0.5,2580183.0,87.2,0.1,True,60.08,0.4,0.34,0.06,2025-12-09,85.65,0.7,0,,82.5,86.65,False,False
09-12-2025 10:00,KIMMR,13.27,13.49,13.21,13.44,259541.0,0.05,0.17,0.02,1033.33,0.17,158323.5,63.93,0.29,True,51.37,-0.09,-0.11,0.02,2025-12-09,13.27,1.28,0,,13.16,13.6,True,False
09-12-2025 10:00,EPLAS,5.19,5.27,5.15,5.26,697682.0,0.01,0.07,0.01,1066.67,0.07,214511.8,225.24,0.14,True,64.43,0.0,-0.01,0.01,2025-12-09,5.16,1.94,0,,5.14,5.37,False,False
09-12-2025 10:00,MNDRS,13.87,14.11,13.85,14.1,837000.0,0.01,0.23,0.02,900.0,0.23,271995.1,207.73,0.04,True,67.02,0.05,0.02,0.02,2025-12-09,13.86,1.73,0,,13.61,14.11,False,False
09-12-2025 10:00,LKMNH,15.07,15.91,15.04,15.91,2916892.0,0.0,0.84,0.08,888.24,0.84,423716.1,588.41,0.0,True,88.06,0.16,0.09,0.06,2025-12-09,15.04,5.78,0,,14.58,ATH,False,False
09-12-2025 10:00,KCHOL,173.0,174.5,172.7,174.4,7403890.0,0.1,1.4,0.06,2233.33,1.4,2902191.6,155.11,0.07,True,59.47,0.53,0.38,0.15,2025-12-09,172.6,1.04,0,,169.0,175.2,False,False
09-12-2025 10:00,FONET,2.79,2.84,2.77,2.83,9180584.0,0.01,0.04,0.0,9.00719925474099e+16,0.04,2646975.2,246.83,0.25,True,65.64,0.01,0.01,0.0,2025-12-09,2.76,2.54,1,2.84,2.76,2.84,False,False
09-12-2025 10:00,SELVA,2.11,2.34,2.1,2.34,18063592.0,0.0,0.23,0.02,1177.78,0.23,3222938.5,460.47,0.0,True,72.59,0.07,0.06,0.01,2025-12-09,2.13,9.86,1,2.34,1.86,ATH,False,False
09-12-2025 10:00,ENSRI,70.6,76.0,68.9,74.85,1371048.0,1.15,4.25,0.35,1114.29,4.25,224644.1,510.32,0.27,True,69.42,0.61,0.25,0.36,2025-12-09,69.9,7.08,0,,68.5,77.15,False,False
09-12-2025 10:00,IMASM,4.87,5.17,4.86,5.13,46240826.0,0.04,0.26,0.06,348.28,0.26,10799152.1,328.19,0.15,True,81.37,0.14,0.09,0.05,2025-12-09,4.86,5.56,0,,4.31,ATH,False,False
09-12-2025 10:00,ISCTR,14.24,14.4,14.2,14.39,145088474.0,0.01,0.15,0.01,1400.0,0.15,62542141.4,131.99,0.07,True,67.11,0.11,0.1,0.0,2025-12-09,14.22,1.2,0,,14.1,14.45,False,False
09-12-2025 10:00,ALKA,9.07,9.67,9.05,9.54,7572220.0,0.13,0.47,0.04,944.44,0.47,1038833.2,628.92,0.28,True,75.77,0.06,0.02,0.04,2025-12-09,8.95,6.59,0,,8.91,ATH,False,False
09-12-2025 10:00,BAHKM,58.55,63.6,58.5,63.35,1191641.0,0.25,4.8,0.49,879.59,4.8,208135.8,472.53,0.05,True,72.51,0.09,-0.17,0.26,2025-12-09,58.5,8.29,0,,57.9,63.6,False,False
09-12-2025 10:00,DNISI,20.8,21.16,20.72,21.08,339864.0,0.08,0.28,0.03,833.33,0.28,114392.8,197.1,0.29,True,60.83,0.04,-0.0,0.05,2025-12-09,20.82,1.25,0,,20.32,21.18,False,False
09-12-2025 10:00,ALTNY,62.1,64.95,62.0,64.7,3610778.0,0.25,2.6,0.26,900.0,2.6,581950.6,520.46,0.1,True,82.53,0.34,0.16,0.18,2025-12-09,61.9,4.52,0,,61.05,ATH,False,False
09-12-2025 10:00,DURDO,3.68,3.89,3.67,3.88,5156323.0,0.01,0.2,0.02,1011.11,0.2,780039.9,561.03,0.05,True,73.56,0.02,0.02,0.0,2025-12-09,3.68,5.43,2,3.67,3.67,ATH,False,False
09-12-2025 10:00,ARDYZ,36.16,37.26,35.8,37.04,3432100.0,0.22,0.88,0.06,1275.0,0.88,1112017.8,208.64,0.25,True,63.74,0.21,0.28,-0.07,2025-12-09,35.96,3.0,0,,35.38,37.6,False,False
09-12-2025 10:00,ANGEN,11.6,11.69,11.59,11.69,290022.0,0.0,0.09,0.0,2150.0,0.09,151546.4,91.38,0.0,True,58.77,0.0,-0.0,0.01,2025-12-09,11.56,1.12,0,,11.52,12.32,True,True
09-12-2025 10:00,CEMAS,4.73,5.19,4.68,5.19,41547871.0,0.0,0.46,0.05,878.72,0.46,5137213.2,708.76,0.0,True,86.47,0.03,-0.01,0.04,2025-12-09,4.72,9.96,3,,4.66,ATH,False,False
09-12-2025 10:00,YYAPI,2.06,2.11,2.03,2.1,57243047.0,0.01,0.04,0.0,1900.0,0.04,17395032.6,229.08,0.25,True,67.54,0.02,0.01,0.0,2025-12-09,2.06,1.94,2,2.03,2.03,2.12,False,False
08-12-2025 17:00,BNTAS,6.43,6.83,6.42,6.8,10782388.0,0.03,0.37,0.04,802.44,0.37,1296885.9,731.41,0.08,True,83.32,0.04,0.01,0.03,2025-12-08,6.35,7.09,0,,6.32,ATH,False,False
08-12-2025 17:00,ASTOR,101.8,104.5,101.6,104.0,14436430.0,0.5,2.2,0.41,443.21,2.2,3875386.6,272.52,0.23,True,79.59,1.08,0.81,0.28,2025-12-08,99.35,4.68,1,104.5,97.45,104.5,False,False
08-12-2025 17:00,PAHOL,1.57,1.66,1.56,1.66,684636759.0,0.0,0.09,0.01,650.0,0.09,218782994.8,212.93,0.0,True,72.67,0.01,-0.01,0.01,2025-12-08,1.51,9.93,0,,1.5,1.68,False,False
08-12-2025 17:00,HURGZ,5.86,5.9,5.82,5.9,784576.0,0.0,0.04,0.0,1233.33,0.04,316141.7,148.17,0.0,True,63.68,0.06,0.04,0.01,2025-12-08,5.84,1.03,2,5.82,5.82,6.02,False,False
08-12-2025 16:00,SEGYO,5.53,5.68,5.53,5.66,3475846.0,0.02,0.13,0.0,12900.0,0.13,1391825.5,149.73,0.15,True,51.56,-0.05,-0.05,-0.0,2025-12-08,5.57,1.62,0,,5.43,6.07,False,False
08-12-2025 16:00,MAGEN,33.36,34.3,33.22,34.22,1431059.0,0.08,0.86,0.13,541.79,0.86,741891.9,92.89,0.09,True,73.0,0.32,0.2,0.12,2025-12-08,32.86,4.14,0,,32.02,ATH,False,False
08-12-2025 16:00,SEYKM,4.89,5.1,4.51,5.1,983817.0,0.0,0.21,0.0,6900.0,0.21,212886.5,362.13,0.0,True,56.53,-0.04,-0.05,0.01,2025-12-08,5.01,1.8,2,4.51,4.51,5.38,True,True
08-12-2025 15:00,PETUN,11.08,11.44,11.0,11.39,1162123.0,0.05,0.31,0.06,463.64,0.31,283594.4,309.78,0.16,True,76.58,0.06,0.0,0.05,2025-12-08,10.82,5.27,0,,10.67,ATH,False,False
08-12-2025 15:00,VAKFA,13.35,13.85,13.3,13.84,19042774.0,0.01,0.49,0.0,48900.0,0.49,8065315.8,136.11,0.02,True,50.26,-0.19,-0.19,0.0,2025-12-08,13.72,0.87,0,,13.27,14.68,True,True
08-12-2025 15:00,PNSUT,11.32,11.75,11.3,11.69,1329781.0,0.06,0.37,0.06,549.12,0.37,311042.1,327.52,0.16,True,72.15,0.09,0.05,0.04,2025-12-08,11.0,6.27,0,,10.97,ATH,False,False
08-12-2025 14:00,DURKN,14.3,14.55,14.3,14.51,1121854.0,0.04,0.21,0.01,2900.0,0.21,273849.1,309.66,0.19,True,63.15,0.06,0.05,0.01,2025-12-08,14.3,1.47,0,,14.08,14.7,False,False
08-12-2025 14:00,A1YEN,29.78,30.4,29.74,30.32,197216.0,0.08,0.54,0.05,938.46,0.54,75378.3,161.63,0.15,True,65.66,0.06,-0.02,0.08,2025-12-08,29.44,2.99,0,,29.28,30.74,False,False
08-12-2025 14:00,KRDMA,25.42,25.84,25.38,25.76,530718.0,0.08,0.34,0.07,385.71,0.34,266047.8,99.48,0.24,True,69.25,0.08,-0.03,0.11,2025-12-08,24.82,3.79,0,,24.48,26.14,False,False
08-12-2025 14:00,SUNTK,41.42,42.28,41.28,42.16,521688.0,0.12,0.74,0.07,957.14,0.74,158280.4,229.6,0.16,True,66.7,0.47,0.51,-0.05,2025-12-08,40.5,4.1,0,,40.48,43.0,False,False
08-12-2025 13:00,YKBNK,36.6,37.32,36.58,37.14,45409688.0,0.18,0.54,0.1,451.02,0.54,26201687.0,73.31,0.33,True,68.6,0.12,-0.07,0.19,2025-12-08,35.86,3.57,1,37.32,34.88,37.32,False,False
08-12-2025 13:00,SOKM,48.32,48.9,48.3,48.86,1025956.0,0.04,0.54,0.02,3275.0,0.54,577751.2,77.58,0.07,True,64.07,0.29,0.28,0.01,2025-12-08,48.34,1.08,0,,47.06,ATH,False,False
08-12-2025 13:00,AKBNK,68.1,69.8,68.05,69.4,26945740.0,0.4,1.3,0.21,519.05,1.3,12930055.7,108.4,0.31,True,77.72,0.65,0.35,0.3,2025-12-08,67.0,3.58,1,69.8,63.95,69.8,False,False
08-12-2025 13:00,SILVR,2.78,2.85,2.78,2.83,513687.0,0.02,0.05,0.01,733.33,0.05,316040.4,62.54,0.4,True,57.93,-0.0,-0.01,0.01,2025-12-08,2.81,0.71,0,,2.72,3.01,False,False
08-12-2025 13:00,VSNMD,97.8,101.4,96.8,100.4,1239815.0,1.0,2.6,0.22,1081.82,2.6,488749.8,153.67,0.38,True,68.8,0.98,0.78,0.2,2025-12-08,94.8,5.91,1,101.4,94.05,101.4,False,False
08-12-2025 13:00,XBANK,16543.26,16806.89,16531.67,16735.48,215215212.0,71.41,192.22,42.62,351.0,192.22,126657995.9,69.92,0.37,True,70.67,83.83,28.91,54.91,2025-12-08,16329.08,2.49,1,16806.89,15874.15,16806.89,False,False
08-12-2025 12:00,ISMEN,42.22,42.48,42.16,42.46,754242.0,0.02,0.24,0.05,344.44,0.24,491414.8,53.48,0.08,True,69.71,0.15,0.06,0.09,2025-12-08,41.52,2.26,0,,41.22,ATH,False,False
08-12-2025 12:00,KBORU,14.59,15.81,14.54,15.5,6967545.0,0.31,0.91,0.12,684.48,0.91,1579218.3,341.2,0.34,True,80.12,0.23,0.14,0.09,2025-12-08,14.56,6.46,0,,13.83,ATH,False,False
08-12-2025 12:00,EDATA,5.38,5.56,5.38,5.55,4482812.0,0.01,0.17,0.02,672.73,0.17,812045.7,452.04,0.06,True,76.85,0.03,0.01,0.02,2025-12-08,5.32,4.32,0,,5.27,ATH,False,False
08-12-2025 11:00,YESIL,2.17,2.2,2.16,2.2,6460826.0,0.0,0.03,0.01,500.0,0.03,4101068.1,57.54,0.0,True,68.3,0.01,-0.01,0.01,2025-12-08,2.12,3.77,0,,2.06,2.21,False,False
08-12-2025 11:00,JANTS,19.36,19.44,19.32,19.42,277865.0,0.02,0.06,0.0,2900.0,0.06,156181.2,77.91,0.33,True,59.38,0.0,-0.02,0.02,2025-12-08,19.26,0.83,0,,19.15,19.55,False,False
08-12-2025 11:00,KARSN,9.51,9.64,9.51,9.62,2848183.0,0.02,0.11,0.01,900.0,0.11,778276.9,265.96,0.18,True,74.18,0.02,0.0,0.02,2025-12-08,9.4,2.34,1,9.64,9.34,9.64,False,False
08-12-2025 11:00,VESTL,32.94,34.56,32.92,34.34,3687141.0,0.22,1.4,0.17,704.6,1.4,706302.9,422.03,0.16,True,84.0,0.2,0.01,0.19,2025-12-08,32.46,5.79,1,34.56,31.94,34.56,False,False
08-12-2025 11:00,BRSAN,498.0,508.0,497.5,506.0,495494.0,2.0,8.0,0.98,720.51,8.0,188973.0,162.2,0.25,True,61.67,1.94,2.52,-0.58,2025-12-08,492.75,2.69,0,,488.5,519.5,False,False
08-12-2025 11:00,YEOTK,38.56,39.26,38.56,39.08,851929.0,0.18,0.52,0.04,1138.1,0.52,546481.9,55.89,0.35,True,64.83,0.22,0.18,0.04,2025-12-08,38.52,1.45,1,39.26,37.68,39.26,False,False
08-12-2025 11:00,MERIT,17.66,18.0,17.66,17.92,754282.0,0.08,0.26,0.08,213.25,0.26,427728.4,76.35,0.31,True,73.5,0.16,0.06,0.1,2025-12-08,17.55,2.11,0,,16.67,18.15,False,False
08-12-2025 11:00,ENDAE,14.35,14.51,14.34,14.48,306221.0,0.03,0.13,0.02,622.22,0.13,142615.6,114.72,0.23,True,48.47,-0.11,-0.14,0.03,2025-12-08,14.29,1.33,1,14.51,14.26,14.51,True,False
08-12-2025 11:00,MOGAN,8.43,8.48,8.42,8.47,392696.0,0.01,0.04,0.01,263.64,0.04,221196.0,77.53,0.25,True,69.37,0.02,-0.0,0.02,2025-12-08,8.34,1.56,1,8.48,8.21,8.48,False,False
08-12-2025 11:00,KONKA,14.53,14.78,14.52,14.75,506507.0,0.03,0.22,0.03,609.68,0.22,201029.5,151.96,0.14,True,77.32,0.11,0.08,0.02,2025-12-08,14.23,3.65,0,,14.16,ATH,False,False
08-12-2025 11:00,NATEN,8.57,8.66,8.56,8.65,1049104.0,0.01,0.08,0.01,1233.33,0.08,468888.1,123.74,0.12,True,60.5,-0.01,-0.02,0.01,2025-12-08,8.5,1.76,1,8.66,8.47,8.66,True,False
08-12-2025 11:00,DAPGM,12.14,12.66,11.94,12.55,20515272.0,0.11,0.41,0.12,244.54,0.41,7446086.5,175.52,0.27,True,87.71,0.25,0.14,0.1,2025-12-08,11.94,5.11,0,,11.11,ATH,False,False
08-12-2025 11:00,AFYON,13.2,13.28,13.18,13.27,838423.0,0.01,0.07,0.01,438.46,0.07,381763.9,119.62,0.14,True,67.67,0.02,-0.01,0.02,2025-12-08,13.13,1.07,0,,12.89,13.35,False,False
08-12-2025 11:00,TOASO,237.6,244.2,237.6,243.4,1815130.0,0.8,5.8,0.79,634.18,5.8,507763.2,257.48,0.14,True,82.45,1.56,0.53,1.03,2025-12-08,233.5,4.24,0,,228.3,ATH,False,False
08-12-2025 11:00,AGROT,7.19,7.48,7.19,7.43,18138370.0,0.05,0.24,0.03,727.59,0.24,2556508.8,609.5,0.21,True,81.3,0.04,0.01,0.03,2025-12-08,7.14,4.06,0,,7.0,ATH,False,False
08-12-2025 11:00,TKFEN,69.25,70.5,69.25,70.2,403662.0,0.3,0.95,0.11,763.64,0.95,247147.7,63.33,0.32,True,63.24,0.07,-0.11,0.19,2025-12-08,68.9,1.89,1,70.5,67.55,70.5,False,False
08-12-2025 11:00,PGSUS,200.6,203.4,200.5,203.3,4263575.0,0.1,2.7,0.18,1400.0,2.7,2545021.0,67.53,0.04,True,65.11,-0.67,-1.45,0.78,2025-12-08,195.8,3.83,0,,195.0,207.7,True,False
08-12-2025 11:00,AKFIS,21.46,21.74,21.44,21.74,474455.0,0.0,0.28,0.03,976.92,0.28,194380.4,144.09,0.0,True,69.38,0.02,-0.03,0.05,2025-12-08,21.34,1.87,0,,21.16,21.84,False,False
08-12-2025 11:00,OYAKC,24.86,25.5,24.8,25.38,7911376.0,0.12,0.52,0.06,712.5,0.52,3076743.8,157.13,0.23,True,73.6,0.18,0.13,0.04,2025-12-08,24.8,2.34,0,,24.2,ATH,False,False
08-12-2025 11:00,GSDDE,9.8,9.91,9.79,9.91,399788.0,0.0,0.11,0.01,1733.33,0.11,112692.2,254.76,0.0,True,71.03,0.04,0.04,0.0,2025-12-08,9.8,1.12,1,9.91,9.71,10.06,False,False
08-12-2025 11:00,DITAS,40.02,41.54,39.9,41.54,251648.0,0.0,1.52,0.09,1588.89,1.52,101300.8,148.42,0.0,True,54.99,-0.21,-0.19,-0.01,2025-12-08,40.12,3.54,0,,38.4,43.28,False,False
08-12-2025 11:00,CRDFA,54.6,57.95,54.3,57.5,340421.0,0.45,2.9,0.26,1015.38,2.9,141917.5,139.87,0.16,True,55.81,-0.77,-1.0,0.23,2025-12-08,55.2,4.17,1,57.95,53.0,57.95,True,True
08-12-2025 10:00,ULUFA,3.88,3.92,3.88,3.91,3373977.0,0.01,0.03,0.0,900.0,0.03,1067315.8,216.12,0.33,True,47.46,-0.03,-0.03,0.01,2025-12-08,3.88,0.77,1,3.92,3.81,3.92,True,False
08-12-2025 10:00,BUCIM,6.47,6.6,6.41,6.58,3039549.0,0.02,0.11,0.03,340.0,0.11,1037104.7,193.08,0.18,True,90.02,0.06,0.03,0.03,2025-12-08,6.44,2.17,0,,6.24,ATH,False,False
08-12-2025 10:00,RGYAS,140.5,142.2,140.3,141.9,233580.0,0.3,1.4,0.28,400.0,1.4,132202.4,76.68,0.21,True,68.42,0.29,0.01,0.28,2025-12-08,140.1,1.28,0,,137.9,143.0,False,False
08-12-2025 10:00,MERKO,12.7,13.05,12.7,13.0,771478.0,0.05,0.3,0.03,934.48,0.3,352736.0,118.71,0.17,True,61.57,-0.04,-0.06,0.02,2025-12-08,12.65,2.77,0,,12.61,13.1,False,False
08-12-2025 10:00,EDIP,35.64,36.42,35.64,36.28,373514.0,0.14,0.64,0.07,841.18,0.64,79877.0,367.61,0.22,True,66.54,-0.0,-0.08,0.08,2025-12-08,35.2,3.07,0,,34.7,36.6,False,False
08-12-2025 10:00,IHEVA,2.19,2.26,2.19,2.24,308540.0,0.02,0.05,0.01,455.56,0.05,145660.7,111.82,0.4,True,59.1,-0.0,-0.01,0.01,2025-12-08,2.21,1.36,1,2.26,2.15,2.26,False,False
08-12-2025 10:00,FENER,9.75,9.99,9.72,9.96,13627015.0,0.03,0.21,0.02,900.0,0.21,2755820.6,394.48,0.14,True,38.96,-0.08,-0.07,-0.01,2025-12-08,10.18,-2.16,2,9.72,9.72,10.31,False,False
08-12-2025 10:00,BULGS,44.06,45.86,44.06,45.68,3403381.0,0.18,1.62,0.27,500.0,1.62,1076322.5,216.2,0.11,True,68.39,-0.09,-0.33,0.24,2025-12-08,43.8,4.29,1,45.86,42.68,45.86,True,False
08-12-2025 10:00,LINK,271.25,289.75,270.75,288.0,1384709.0,1.75,16.75,2.82,492.92,16.75,300654.8,360.56,0.1,True,81.79,9.8,8.1,1.7,2025-12-08,264.25,8.99,0,,235.0,ATH,False,False
08-12-2025 10:00,BJKAS,1.78,1.8,1.78,1.8,6315583.0,0.0,0.02,0.0,1900.0,0.02,2361050.6,167.49,0.0,True,60.39,0.0,0.0,0.0,2025-12-08,1.77,1.69,1,1.8,1.76,1.82,False,False
08-12-2025 10:00,FRIGO,10.2,10.46,10.1,10.46,1857531.0,0.0,0.26,0.02,1268.42,0.26,648951.8,186.24,0.0,True,61.0,0.06,0.05,0.01,2025-12-08,10.13,3.26,0,,10.08,10.47,False,False
08-12-2025 10:00,FROTO,91.15,92.85,91.15,92.65,4404918.0,0.2,1.5,0.11,1263.64,1.5,1988900.8,121.47,0.13,True,59.74,-0.23,-0.49,0.25,2025-12-08,90.8,2.04,0,,89.85,93.05,True,False
08-12-2025 10:00,ENKAI,80.05,80.9,80.05,80.85,2053997.0,0.05,0.8,0.11,595.65,0.8,957546.2,114.51,0.06,True,64.03,0.07,0.02,0.05,2025-12-08,79.75,1.38,0,,78.9,81.3,False,False
08-12-2025 10:00,KAYSE,17.39,17.67,17.39,17.62,463456.0,0.05,0.23,0.04,538.89,0.23,183612.1,152.41,0.22,True,67.16,0.04,0.01,0.02,2025-12-08,17.4,1.26,0,,17.21,17.68,False,False
08-12-2025 10:00,DOFRB,75.15,79.25,75.0,78.2,3852190.0,1.05,3.05,0.24,1170.83,3.05,1367159.1,181.77,0.34,True,64.98,0.5,0.47,0.04,2025-12-08,75.0,4.27,0,,73.0,81.75,False,False
08-12-2025 10:00,GLRMK,166.9,172.4,165.8,172.2,1709441.0,0.2,5.3,0.5,960.0,5.3,233925.0,630.76,0.04,True,80.13,0.32,-0.73,1.05,2025-12-08,161.8,6.43,0,,160.8,ATH,False,False
08-12-2025 10:00,BSOKE,15.74,16.15,15.67,16.13,3433234.0,0.02,0.39,0.05,635.85,0.39,2118998.8,62.02,0.05,True,71.69,0.25,0.18,0.07,2025-12-08,15.67,2.94,0,,14.7,ATH,False,False
08-12-2025 10:00,ALTIN,77.69,78.25,77.4,78.2,5764170.0,0.05,0.51,0.07,598.63,0.51,1902546.8,202.97,0.1,True,82.18,0.41,0.36,0.05,2025-12-08,77.74,0.59,2,77.4,77.4,ATH,False,False
08-12-2025 10:00,AKFYE,17.12,17.33,17.12,17.31,1013173.0,0.02,0.19,0.01,1361.54,0.19,226871.0,346.59,0.11,True,72.43,0.02,0.01,0.02,2025-12-08,17.06,1.47,0,,16.95,ATH,False,False
08-12-2025 10:00,AKYHO,2.9,2.93,2.9,2.93,271987.0,0.0,0.03,0.01,400.0,0.03,128966.8,110.9,0.0,True,47.19,-0.01,-0.01,-0.0,2025-12-08,2.9,1.03,0,,2.86,2.98,False,False
08-12-2025 10:00,OSTIM,2.91,2.96,2.91,2.95,3732523.0,0.01,0.04,0.0,900.0,0.04,761825.0,389.94,0.25,True,58.3,-0.01,-0.02,0.01,2025-12-08,2.89,2.08,0,,2.89,2.99,True,False
08-12-2025 10:00,BRLSM,13.79,14.02,13.78,13.97,370997.0,0.05,0.18,0.02,800.0,0.18,164802.6,125.12,0.28,True,65.16,0.0,-0.01,0.01,2025-12-08,13.78,1.38,0,,13.61,13.98,False,False
05-12-2025 17:00,MANAS,9.77,10.1,9.75,10.1,8972201.0,0.0,0.33,0.09,258.7,0.33,4375630.2,105.05,0.0,True,75.56,0.12,0.05,0.07,2025-12-05,9.19,9.9,0,,9.0,10.53,False,False
05-12-2025 17:00,AKGRT,6.72,6.78,6.7,6.77,2384701.0,0.01,0.05,0.01,233.33,0.05,1457811.2,63.58,0.2,True,67.52,0.01,-0.01,0.01,2025-12-05,6.61,2.42,0,,6.58,6.8,False,False
05-12-2025 17:00,GENIL,196.4,199.1,196.3,199.0,210994.0,0.1,2.6,0.44,490.91,2.6,101901.3,107.06,0.04,True,67.69,0.93,0.85,0.08,2025-12-05,195.0,2.05,1,199.1,193.1,199.1,False,False
05-12-2025 17:00,TATEN,14.51,15.86,14.49,15.86,4784868.0,0.0,1.35,0.14,837.5,1.35,831529.2,475.43,0.0,True,69.42,-0.2,-0.33,0.12,2025-12-05,14.42,9.99,0,,14.21,15.88,True,True
05-12-2025 17:00,ISDMR,35.48,35.7,35.48,35.66,307887.0,0.04,0.18,0.02,800.0,0.18,165091.1,86.5,0.22,True,45.0,-0.11,-0.09,-0.02,2025-12-05,35.6,0.17,0,,35.46,36.78,False,False
05-12-2025 17:00,DARDL,2.21,2.24,2.21,2.24,4205163.0,0.0,0.03,0.0,650.0,0.03,1595333.2,163.59,0.0,True,49.15,-0.01,-0.01,-0.0,2025-12-05,2.23,0.45,2,2.21,2.21,2.3,False,False
05-12-2025 17:00,CONSE,3.12,3.18,3.11,3.18,5539294.0,0.0,0.06,0.01,500.0,0.06,1973760.5,180.65,0.0,True,60.21,-0.01,-0.02,0.0,2025-12-05,3.11,2.25,0,,3.06,3.28,True,True
05-12-2025 16:00,SAMAT,6.04,6.14,6.02,6.12,267367.0,0.02,0.08,0.0,1900.0,0.08,110816.4,141.27,0.25,True,53.22,-0.0,0.0,-0.0,2025-12-05,6.09,0.49,0,,6.0,6.14,False,False
05-12-2025 16:00,FORTE,79.25,82.0,79.25,81.95,250531.0,0.05,2.7,0.06,4809.09,2.7,135386.5,85.05,0.02,True,58.93,-0.22,-0.1,-0.13,2025-12-05,81.4,0.68,0,,78.9,84.05,False,False
05-12-2025 16:00,KMPUR,16.53,16.88,16.42,16.79,489568.0,0.09,0.26,0.05,420.0,0.26,315670.4,55.09,0.35,True,67.44,0.14,0.12,0.02,2025-12-05,16.49,1.82,2,16.42,16.42,16.93,False,False
05-12-2025 15:00,DOAS,186.0,187.3,185.5,187.1,270988.0,0.2,1.1,0.2,450.0,1.1,143032.7,89.46,0.18,True,59.67,0.06,-0.22,0.29,2025-12-05,184.4,1.46,0,,183.7,194.0,True,False
05-12-2025 15:00,KNFRT,11.59,11.67,11.56,11.67,331519.0,0.0,0.08,0.01,700.0,0.08,133293.5,148.71,0.0,True,47.98,-0.05,-0.05,0.0,2025-12-05,11.6,0.6,0,,11.52,11.9,False,False
05-12-2025 14:00,LRSHO,5.1,5.19,5.08,5.17,4400164.0,0.02,0.07,0.0,3400.0,0.07,2594828.5,69.57,0.29,True,55.74,-0.02,-0.02,0.0,2025-12-05,5.12,0.98,0,,5.01,5.32,False,False
05-12-2025 13:00,ESEN,7.37,7.51,7.27,7.51,10966456.0,0.0,0.14,0.02,536.36,0.14,3977056.4,175.74,0.0,True,71.19,0.09,0.08,0.01,2025-12-05,7.31,2.74,0,,7.13,ATH,False,False
05-12-2025 12:00,IEYHO,58.5,59.35,57.0,59.25,3573420.0,0.1,0.75,0.09,733.33,0.75,1349831.3,164.73,0.13,True,53.27,0.06,0.14,-0.07,2025-12-05,59.25,0.0,2,57.0,57.0,60.1,False,False
05-12-2025 12:00,PINSU,12.91,13.5,12.88,13.37,3212420.0,0.13,0.46,0.05,858.33,0.46,579593.9,454.25,0.28,True,70.01,-0.03,-0.08,0.04,2025-12-05,12.8,4.45,1,13.5,12.5,13.5,False,False
05-12-2025 12:00,GESAN,44.88,45.44,44.86,45.36,444302.0,0.08,0.48,0.07,585.71,0.48,262110.2,69.51,0.17,True,63.75,0.08,0.08,0.0,2025-12-05,44.62,1.66,0,,44.34,45.68,False,False
05-12-2025 12:00,MIATK,36.24,37.46,36.14,37.14,6210282.0,0.32,0.9,0.16,462.5,0.9,1981091.7,213.48,0.36,True,75.98,0.17,0.01,0.16,2025-12-05,35.9,3.45,0,,35.08,ATH,False,False
05-12-2025 11:00,KONTR,15.62,16.43,15.6,16.33,31486092.38,0.09,0.71,0.04,1871.43,0.71,11073724.05,184.33,0.13,True,54.4,-0.23,-0.28,0.05,2025-12-05,15.68,4.15,0,,15.46,ATH,True,True
05-12-2025 11:00,TEZOL,12.36,12.69,12.35,12.64,1158138.0,0.05,0.28,0.03,723.53,0.28,247220.8,368.46,0.18,True,68.94,0.0,-0.01,0.01,2025-12-05,12.2,3.61,0,,12.17,ATH,False,False
05-12-2025 11:00,TEKTU,12.46,13.39,12.37,13.18,5390413.0,0.21,0.72,0.06,1141.38,0.72,1445024.2,273.03,0.29,True,62.17,0.03,0.03,-0.0,2025-12-05,12.33,6.89,0,,12.12,13.23,False,False
05-12-2025 11:00,MOBTL,8.21,8.7,8.18,8.58,5984657.0,0.12,0.37,0.04,927.78,0.37,1604447.5,273.0,0.32,True,71.0,0.07,0.04,0.03,2025-12-05,8.2,4.63,1,8.7,7.89,8.7,False,False
05-12-2025 11:00,CIMSA,47.3,48.1,47.24,47.96,1645847.0,0.14,0.66,0.0,32900.0,0.66,829569.5,98.4,0.21,True,52.35,-0.07,0.05,-0.12,2025-12-05,47.5,0.97,0,,46.9,49.44,False,False
05-12-2025 11:00,QUAGR,3.53,3.72,3.47,3.67,55882287.0,0.05,0.14,0.01,2233.33,0.14,12711497.2,339.62,0.36,True,60.35,-0.01,-0.01,-0.0,2025-12-05,3.51,4.56,2,3.47,3.47,3.81,True,True
05-12-2025 10:00,ALKLC,124.9,134.4,124.3,134.3,1913312.0,0.1,9.4,1.32,612.12,9.4,486073.8,293.63,0.01,True,83.56,4.13,3.63,0.5,2025-12-05,124.1,8.22,0,,115.2,ATH,False,False
05-12-2025 10:00,BTCIM,3.51,3.85,3.51,3.81,111588316.0,0.04,0.3,0.03,934.48,0.3,14075475.9,692.79,0.13,True,77.24,0.01,-0.0,0.01,2025-12-05,3.51,8.55,0,,3.49,ATH,False,False
05-12-2025 10:00,ALARK,95.9,99.25,95.65,99.0,7338589.0,0.25,3.1,0.38,726.67,3.1,1264985.5,480.13,0.08,True,78.22,0.6,0.33,0.27,2025-12-05,95.25,3.94,0,,92.05,ATH,False,False
05-12-2025 10:00,BURCE,47.7,52.9,47.66,51.6,559291.0,1.3,3.9,0.37,954.05,3.9,139002.4,302.36,0.33,True,57.23,1.74,2.24,-0.5,2025-12-05,52.95,-2.55,2,47.66,47.66,54.6,False,False
05-12-2025 10:00,SMRVA,464.25,505.5,464.0,495.75,324437.0,9.75,31.5,3.12,908.0,31.5,77458.8,318.85,0.31,True,52.58,-4.07,-2.55,-1.52,2025-12-05,476.5,4.04,2,464.0,464.0,516.0,False,False
05-12-2025 10:00,PLTUR,20.9,21.28,20.7,21.24,482507.0,0.04,0.34,0.04,709.52,0.34,193979.2,148.74,0.12,True,61.57,0.08,0.08,0.0,2025-12-05,20.74,2.41,2,20.7,20.7,21.82,False,False
05-12-2025 10:00,ISKPL,9.67,10.5,9.54,10.36,8008844.0,0.14,0.69,0.11,538.89,0.69,1842798.2,334.6,0.2,True,89.08,0.29,0.2,0.09,2025-12-05,9.65,7.36,0,,8.37,ATH,False,False
05-12-2025 10:00,POLHO,17.63,18.07,17.57,18.07,808956.0,0.0,0.44,0.03,1194.12,0.44,470041.1,72.1,0.0,True,60.14,0.08,0.09,-0.02,2025-12-05,17.65,2.38,0,,16.59,18.65,False,False
05-12-2025 10:00,SARKY,15.6,16.03,15.54,15.91,653164.0,0.12,0.31,0.02,1723.53,0.31,197236.7,231.16,0.39,True,70.03,0.13,0.14,-0.01,2025-12-05,15.51,2.58,0,,15.51,ATH,False,False
05-12-2025 10:00,AGHOL,28.06,28.36,27.96,28.3,885880.0,0.06,0.24,0.02,1100.0,0.24,395518.6,123.98,0.25,True,53.99,-0.07,-0.08,0.01,2025-12-05,28.02,1.0,0,,27.8,28.86,False,False
04-12-2025 17:00,YKSLN,6.01,6.22,6.0,6.16,4885505.0,0.06,0.15,0.02,525.0,0.15,1456320.8,235.47,0.4,True,74.39,0.02,-0.0,0.02,2025-12-04,5.92,4.05,1,6.22,5.83,6.22,False,False
04-12-2025 17:00,TRALT,36.44,38.96,36.22,38.96,52363270.0,0.0,2.52,0.35,624.14,2.52,14609992.3,258.41,0.0,True,84.94,0.39,0.13,0.26,2025-12-04,35.42,9.99,0,,35.32,ATH,False,False
04-12-2025 16:00,MEKAG,3.92,3.99,3.91,3.98,1054880.0,0.01,0.06,0.01,757.14,0.06,634759.3,66.19,0.17,True,54.38,-0.01,-0.02,0.0,2025-12-04,3.9,2.05,0,,3.89,4.1,True,True
04-12-2025 16:00,PENTA,13.64,13.82,13.6,13.81,465346.0,0.01,0.17,0.01,1316.67,0.17,224043.9,107.7,0.06,True,58.74,0.01,0.01,0.0,2025-12-04,13.62,1.4,0,,13.57,13.95,False,False
04-12-2025 16:00,BLCYT,38.36,39.4,38.3,39.3,692017.0,0.1,0.94,0.26,264.34,0.94,277647.7,149.24,0.11,True,82.43,1.05,0.92,0.13,2025-12-04,36.42,7.91,0,,32.1,ATH,False,False
04-12-2025 15:00,AKSA,10.35,10.55,10.33,10.51,3376221.0,0.04,0.16,0.01,1042.86,0.16,1194152.2,182.73,0.25,True,62.74,0.01,0.01,-0.0,2025-12-04,10.4,1.06,0,,10.01,10.55,False,False
04-12-2025 15:00,OBAMS,7.56,7.92,7.55,7.87,13606395.0,0.05,0.31,0.03,1007.14,0.31,3503092.4,288.41,0.16,True,67.61,0.02,0.0,0.01,2025-12-04,7.5,4.93,0,,7.22,8.2,False,False
04-12-2025 14:00,BORSK,22.64,23.3,22.54,23.12,732302.0,0.18,0.48,0.04,1100.0,0.48,152193.6,381.16,0.37,True,63.78,0.01,-0.0,0.01,2025-12-04,22.7,1.85,0,,22.52,23.48,False,False
04-12-2025 14:00,BMSCH,24.64,27.36,24.54,26.68,2072859.0,0.68,2.04,0.22,844.44,2.04,497836.7,316.37,0.33,True,72.3,0.4,0.34,0.06,2025-12-04,24.92,7.06,0,,23.7,ATH,False,False
04-12-2025 14:00,BIOEN,19.75,21.92,19.73,21.76,3880843.0,0.16,2.01,0.18,992.39,2.01,562215.7,590.28,0.08,True,83.22,0.13,0.03,0.1,2025-12-04,20.02,8.69,2,19.73,19.73,ATH,False,False
04-12-2025 13:00,BEYAZ,27.12,28.4,27.12,28.4,1050784.0,0.0,1.28,0.26,392.31,1.28,399814.4,162.82,0.0,True,78.09,0.39,0.17,0.22,2025-12-04,25.82,9.99,0,,25.66,ATH,False,False
04-12-2025 13:00,BERA,17.0,17.85,16.99,17.79,4997101.0,0.06,0.79,0.08,939.47,0.79,1312860.5,280.63,0.08,True,76.12,0.08,0.04,0.04,2025-12-04,16.68,6.65,1,17.85,16.58,17.85,False,False
04-12-2025 13:00,CATES,36.26,37.06,36.12,36.9,274754.0,0.16,0.64,0.1,527.45,0.64,163746.1,67.79,0.25,True,69.18,0.3,0.28,0.02,2025-12-04,36.5,1.1,0,,35.64,ATH,False,False
04-12-2025 12:00,DAGI,8.7,8.87,8.62,8.86,2262221.0,0.01,0.16,0.03,433.33,0.16,1327394.6,70.43,0.06,True,69.92,0.15,0.13,0.01,2025-12-04,8.73,1.49,0,,8.23,ATH,False,False
04-12-2025 11:00,VRGYO,2.84,2.88,2.84,2.88,5844553.0,0.0,0.04,0.0,1233.33,0.04,3400257.5,71.89,0.0,True,55.31,0.01,0.02,-0.0,2025-12-04,2.87,0.35,0,,2.78,2.93,False,False
04-12-2025 11:00,IZMDC,6.68,7.1,6.58,7.08,8045317.0,0.02,0.4,0.05,669.23,0.4,3860166.0,108.42,0.05,True,78.82,0.18,0.13,0.05,2025-12-04,6.67,6.15,0,,6.07,ATH,False,False
04-12-2025 11:00,AYDEM,19.5,20.14,19.5,20.02,2140821.0,0.12,0.52,0.09,484.27,0.52,537758.1,298.1,0.23,True,83.87,0.22,0.17,0.05,2025-12-04,19.44,2.98,0,,18.31,ATH,False,False
04-12-2025 11:00,DESA,11.37,11.53,11.37,11.52,186024.0,0.01,0.15,0.01,2400.0,0.15,110223.5,68.77,0.07,True,62.77,0.01,0.0,0.01,2025-12-04,11.22,2.67,0,,11.21,11.56,False,False
04-12-2025 11:00,DMLKT,5.97,5.98,5.95,5.98,1774327.0,0.0,0.01,0.0,900.0,0.01,844371.2,110.14,0.0,True,55.83,0.0,0.01,-0.0,2025-12-04,5.97,0.17,3,,5.87,6.01,False,False
04-12-2025 10:00,MARMR,2.04,2.16,2.0,2.13,139941358.0,0.03,0.09,0.0,1700.0,0.09,30626437.5,356.93,0.33,True,72.67,0.02,0.01,0.01,2025-12-04,2.02,5.45,0,,1.92,ATH,False,False
04-12-2025 10:00,METRO,5.67,5.94,5.62,5.94,7650392.0,0.0,0.27,0.05,440.0,0.27,2806323.9,172.61,0.0,True,88.33,0.2,0.13,0.07,2025-12-04,5.4,10.0,1,5.94,4.8,ATH,False,False
04-12-2025 10:00,CUSAN,22.44,23.48,22.02,23.48,654009.0,0.0,1.04,0.06,1693.1,1.04,139479.6,368.89,0.0,True,59.0,-0.04,-0.02,-0.02,2025-12-04,22.24,5.58,2,22.02,22.02,26.32,False,False
04-12-2025 10:00,CEMZY,45.5,49.86,45.48,49.86,3474424.0,0.0,4.36,0.38,1053.44,4.36,529810.8,555.79,0.0,True,69.73,-0.2,-0.46,0.27,2025-12-04,45.34,9.97,1,49.86,44.7,52.85,True,True
04-12-2025 10:00,ATATP,152.9,167.3,152.1,165.1,1426976.0,2.2,12.2,1.08,1029.63,12.2,291216.2,390.01,0.18,True,79.49,1.9,0.84,1.06,2025-12-04,152.1,8.55,1,167.3,146.5,167.3,False,False
04-12-2025 10:00,KTLEV,17.38,18.43,17.38,18.35,25506798.0,0.08,0.97,0.12,708.33,0.97,7398383.5,244.76,0.08,True,72.95,0.2,0.17,0.03,2025-12-04,17.37,5.64,0,,16.81,ATH,False,False
04-12-2025 10:00,OSMEN,8.66,8.75,8.62,8.73,435047.0,0.02,0.07,0.01,1300.0,0.07,175108.5,148.44,0.29,True,61.98,0.0,0.0,0.0,2025-12-04,8.64,1.04,0,,8.61,8.82,False,False
04-12-2025 10:00,DSTKF,642.0,712.0,642.0,706.0,1345462.0,6.0,64.0,6.4,900.0,64.0,136081.4,888.72,0.09,True,36.94,-40.1,-38.53,-1.57,2025-12-04,713.0,-0.98,2,642.0,642.0,968.0,True,True
03-12-2025 17:00,SMRTG,25.6,27.9,25.54,27.9,4567679.0,0.0,2.3,0.24,858.33,2.3,647262.0,605.69,0.0,True,89.9,0.23,0.06,0.17,2025-12-03,25.38,9.93,0,,24.82,ATH,False,False
03-12-2025 17:00,ALVES,24.26,25.5,24.26,25.36,5805703.0,0.14,1.1,0.07,1386.49,1.1,799576.0,626.1,0.13,True,71.75,0.15,0.12,0.03,2025-12-03,24.46,3.68,1,25.5,24.24,25.5,False,False
03-12-2025 17:00,SKTAS,4.2,4.63,4.17,4.63,2354191.0,0.0,0.43,0.04,1002.56,0.43,838127.1,180.89,0.0,True,78.31,0.02,-0.0,0.02,2025-12-03,4.25,8.94,3,,4.15,ATH,False,False
03-12-2025 17:00,ESCAR,20.28,20.56,20.2,20.48,554894.0,0.08,0.2,0.01,2400.0,0.2,248224.2,123.55,0.4,True,59.94,0.0,0.0,-0.0,2025-12-03,20.28,0.99,0,,20.1,21.0,False,False
03-12-2025 16:00,GRTHO,309.25,337.5,309.25,332.5,515465.0,5.0,23.25,1.75,1228.57,23.25,123373.3,317.81,0.22,True,75.7,6.2,6.04,0.16,2025-12-03,308.25,7.87,0,,264.0,ATH,False,False
03-12-2025 16:00,ARZUM,2.63,2.7,2.63,2.69,3448716.0,0.01,0.06,0.01,900.0,0.06,1040425.0,231.47,0.17,True,67.66,0.01,0.0,0.0,2025-12-03,2.63,2.28,0,,2.61,ATH,False,False
03-12-2025 15:00,MARBL,12.84,13.12,12.83,13.06,1217837.0,0.06,0.22,0.05,368.09,0.22,303739.8,300.95,0.27,True,80.04,0.07,0.03,0.04,2025-12-03,12.49,4.56,1,13.12,12.39,13.12,False,False
03-12-2025 14:00,SUWEN,9.68,9.87,9.66,9.85,437932.0,0.02,0.17,0.01,1114.29,0.17,239861.4,82.58,0.12,True,66.04,0.07,0.06,0.01,2025-12-03,9.66,1.97,0,,9.58,ATH,False,False
03-12-2025 13:00,RTALB,3.84,4.0,3.82,3.99,23148538.0,0.01,0.15,0.04,305.41,0.15,7375960.6,213.84,0.07,True,88.05,0.06,0.03,0.03,2025-12-03,3.68,8.42,0,,3.61,ATH,False,False
03-12-2025 12:00,ORCAY,3.87,3.93,3.86,3.92,892214.0,0.01,0.05,0.0,1150.0,0.05,314891.6,183.34,0.2,True,56.92,-0.0,-0.0,0.0,2025-12-03,3.85,1.82,0,,3.81,4.1,False,False
03-12-2025 12:00,EFOR,25.36,26.9,25.3,26.88,23725652.0,0.02,1.52,0.25,512.9,1.52,3757660.3,531.39,0.01,True,85.62,0.77,0.56,0.21,2025-12-03,25.16,6.84,0,,22.16,ATH,False,False
03-12-2025 11:00,BIENY,28.62,30.0,28.6,29.66,2898181.0,0.34,1.04,0.1,940.0,1.04,481101.6,502.41,0.33,True,69.04,0.18,0.19,-0.0,2025-12-03,28.6,3.71,1,30.0,28.46,30.0,False,False
03-12-2025 10:00,VKFYO,22.1,23.92,21.12,23.9,313457.0,0.02,1.8,0.22,710.81,1.8,56787.1,451.99,0.01,True,67.44,0.1,-0.04,0.14,2025-12-03,22.1,8.14,2,21.12,21.12,ATH,False,False
03-12-2025 10:00,A1CAP,11.95,12.53,11.86,12.5,6993425.0,0.03,0.55,0.08,570.73,0.55,1512987.5,362.23,0.05,True,78.04,0.13,0.09,0.04,2025-12-03,11.92,4.87,0,,11.57,ATH,False,False
03-12-2025 10:00,DCTTR,26.14,27.22,26.14,26.92,1080425.0,0.3,0.78,0.07,1081.82,0.78,187374.9,476.61,0.38,True,69.26,-0.01,-0.07,0.06,2025-12-03,26.06,3.3,1,27.22,25.98,27.22,False,False
03-12-2025 10:00,INDES,7.31,7.38,7.31,7.36,579145.0,0.02,0.05,0.0,1566.67,0.05,276959.0,109.11,0.4,True,67.22,0.01,0.01,0.0,2025-12-03,7.29,0.96,0,,7.27,ATH,False,False
02-12-2025 17:00,KRPLS,7.57,8.25,7.52,8.24,1406750.0,0.01,0.67,0.07,857.14,0.67,202612.7,594.3,0.01,True,84.7,0.06,0.01,0.05,2025-12-02,7.52,9.57,2,7.52,7.52,ATH,False,False
02-12-2025 17:00,TNZTP,21.18,21.46,21.16,21.44,214125.0,0.02,0.26,0.01,2500.0,0.26,131864.2,62.38,0.08,True,56.17,0.03,0.03,0.0,2025-12-02,21.36,0.37,0,,20.88,21.6,False,False
02-12-2025 15:00,TKNSA,23.92,24.42,23.88,24.36,762962.0,0.06,0.44,0.03,1194.12,0.44,207877.2,267.03,0.14,True,71.9,0.12,0.07,0.05,2025-12-02,23.76,2.53,0,,23.22,ATH,False,False
02-12-2025 14:00,AKSEN,57.85,59.5,57.1,59.45,4467066.0,0.05,1.6,0.5,220.0,1.6,1319134.3,238.64,0.03,True,85.85,1.28,0.86,0.42,2025-12-02,55.75,6.64,0,,51.3,ATH,False,False
02-12-2025 13:00,PEKGY,10.36,10.56,10.34,10.54,76110185.0,0.02,0.18,0.01,1700.0,0.18,46996872.8,61.95,0.11,True,51.98,-0.01,-0.05,0.04,2025-12-02,10.2,3.33,0,,9.9,10.71,True,False
02-12-2025 13:00,ODINE,225.0,233.4,222.2,231.8,229787.0,1.6,6.8,1.46,365.75,6.8,75632.1,203.82,0.24,True,72.04,1.02,0.1,0.91,2025-12-02,219.9,5.41,0,,215.0,ATH,False,False
02-12-2025 13:00,ALFAS,44.98,45.86,44.98,45.78,399921.0,0.08,0.8,0.16,393.83,0.8,209199.2,91.17,0.1,True,83.92,0.49,0.39,0.11,2025-12-02,44.22,3.53,0,,42.66,ATH,False,False
02-12-2025 13:00,DOFER,56.9,58.0,56.7,57.75,81345.0,0.25,0.85,0.12,608.33,0.85,54043.5,50.52,0.29,True,77.54,0.51,0.33,0.18,2025-12-02,56.05,3.03,0,,54.65,ATH,False,False
02-12-2025 12:00,NTGAZ,9.96,10.12,9.96,10.09,966954.0,0.03,0.13,0.02,420.0,0.13,397051.3,143.53,0.23,True,61.62,0.01,-0.0,0.01,2025-12-02,10.06,0.3,0,,9.86,ATH,False,False
02-12-2025 11:00,ENTRA,10.42,10.64,10.42,10.59,2055506.0,0.05,0.17,0.02,672.73,0.17,960284.9,114.05,0.29,True,75.39,0.03,0.01,0.02,2025-12-02,10.3,2.82,1,10.64,10.2,10.64,False,False
02-12-2025 11:00,GEREL,21.34,22.66,21.3,22.3,2734196.0,0.36,0.96,0.15,548.65,0.96,954567.9,186.43,0.37,True,78.42,0.25,0.18,0.07,2025-12-02,21.26,4.89,0,,19.75,ATH,False,False
02-12-2025 11:00,CGCAM,37.54,39.14,37.36,38.72,1847709.0,0.42,1.18,0.13,807.69,1.18,972749.0,89.95,0.36,True,78.83,1.04,0.89,0.15,2025-12-02,38.0,1.89,0,,32.28,ATH,False,False
02-12-2025 10:00,INVEO,9.48,9.56,9.36,9.55,3201442.0,0.01,0.07,0.01,1300.0,0.07,743503.2,330.59,0.14,True,67.54,0.02,0.0,0.02,2025-12-02,9.35,2.14,0,,9.17,ATH,False,False
02-12-2025 10:00,INFO,3.86,3.93,3.85,3.92,5197963.0,0.01,0.06,0.01,650.0,0.06,2306567.1,125.35,0.17,True,70.16,0.01,0.01,0.01,2025-12-02,3.87,1.29,1,3.93,3.76,3.93,False,False
02-12-2025 10:00,BIMAS,544.5,552.0,540.0,550.0,1689387.0,2.0,5.5,0.8,587.5,5.5,577737.3,192.41,0.36,True,68.53,0.84,-0.13,0.97,2025-12-02,545.0,0.92,0,,533.5,ATH,False,False
02-12-2025 10:00,BIGEN,9.18,9.36,9.17,9.34,2726894.0,0.02,0.16,0.02,900.0,0.16,827856.6,229.39,0.12,True,56.59,-0.04,-0.06,0.02,2025-12-02,9.16,1.97,1,9.36,9.04,9.36,False,False
02-12-2025 10:00,HALKB,39.88,41.12,39.54,40.78,71665921.0,0.34,0.9,0.36,147.25,0.9,18370927.0,290.11,0.38,True,93.13,1.15,0.84,0.31,2025-12-02,39.18,4.08,0,,ATL,ATH,False,False
02-12-2025 10:00,HUNER,3.43,3.45,3.41,3.45,1705614.0,0.0,0.02,0.0,400.0,0.02,940896.1,81.28,0.0,True,64.22,0.0,-0.0,0.0,2025-12-02,3.42,0.88,0,,3.36,ATH,False,False
02-12-2025 10:00,ADESE,1.6,1.7,1.59,1.7,159061715.0,0.0,0.1,0.01,733.33,0.1,22252509.1,614.8,0.0,True,78.06,0.02,0.01,0.02,2025-12-02,1.55,9.68,1,1.7,1.38,ATH,False,False
02-12-2025 10:00,CVKMD,17.78,18.77,17.7,18.76,12335087.0,0.01,0.98,0.13,671.65,0.98,2702141.4,356.49,0.01,True,82.61,0.19,0.1,0.09,2025-12-02,17.69,6.05,0,,16.96,ATH,False,False
02-12-2025 10:00,KATMR,3.26,3.37,3.25,3.35,57705846.0,0.02,0.09,0.01,542.86,0.09,22211115.3,159.81,0.22,True,74.68,0.03,0.02,0.01,2025-12-02,3.25,3.08,0,,3.1,ATH,False,False
02-12-2025 10:00,MAKTK,13.85,14.32,13.5,14.25,2853879.0,0.07,0.4,0.11,280.95,0.4,1283682.2,122.32,0.18,True,72.1,0.31,0.25,0.06,2025-12-02,13.9,2.52,0,,12.27,ATH,False,False
02-12-2025 10:00,SKBNK,8.17,8.26,8.15,8.24,6835974.0,0.02,0.07,0.01,438.46,0.07,3589266.2,90.46,0.29,True,73.21,0.04,0.03,0.01,2025-12-02,8.14,1.23,0,,7.87,ATH,False,False
02-12-2025 10:00,MHRGY,3.61,3.63,3.59,3.63,564014.0,0.0,0.02,0.0,400.0,0.02,278907.0,102.22,0.0,True,64.6,0.0,-0.0,0.01,2025-12-02,3.6,0.83,0,,3.54,ATH,False,False
01-12-2025 17:00,DMRGD,24.3,24.68,24.26,24.64,366792.0,0.04,0.34,0.05,580.0,0.34,175812.2,108.63,0.12,True,71.99,0.17,0.12,0.05,2025-12-01,24.2,1.82,0,,23.66,ATH,False,False
01-12-2025 17:00,CEOEM,25.08,26.12,25.0,25.96,485555.0,0.16,0.88,0.12,609.68,0.88,134007.1,262.34,0.18,True,70.86,0.14,0.06,0.07,2025-12-01,24.48,6.05,0,,24.34,ATH,False,False
01-12-2025 17:00,ARCLK,107.4,109.0,107.4,108.9,688321.0,0.1,1.5,0.34,341.18,1.5,312570.8,120.21,0.07,True,71.39,0.36,0.17,0.19,2025-12-01,105.7,3.03,0,,105.2,ATH,False,False
01-12-2025 17:00,MAVI,38.28,38.64,38.28,38.58,1257533.0,0.06,0.3,0.1,194.12,0.3,469897.8,167.62,0.2,True,70.78,0.05,-0.02,0.07,2025-12-01,37.72,2.28,0,,37.46,ATH,False,False
01-12-2025 17:00,AEFES,16.06,16.2,16.05,16.16,15071911.0,0.04,0.1,0.04,170.27,0.1,6798574.1,121.69,0.4,True,58.85,-0.03,-0.05,0.02,2025-12-01,15.79,2.34,1,16.2,15.67,16.2,False,False
01-12-2025 17:00,PETKM,17.29,17.43,17.29,17.39,9570205.0,0.04,0.1,0.04,150.0,0.1,5793462.3,65.19,0.4,True,81.91,0.08,0.05,0.03,2025-12-01,17.0,2.29,0,,16.78,ATH,False,False
01-12-2025 14:00,TSKB,13.08,13.26,13.08,13.22,7879378.0,0.04,0.14,0.03,351.61,0.14,3631100.8,117.0,0.29,True,72.65,0.04,0.01,0.03,2025-12-01,12.86,2.8,0,,12.77,ATH,False,False
01-12-2025 14:00,VAKFN,2.01,2.1,2.01,2.1,90290093.0,0.0,0.09,0.01,1400.0,0.09,17148711.8,426.51,0.0,True,66.2,0.0,-0.0,0.01,2025-12-01,2.0,5.0,0,,1.99,ATH,False,False
01-12-2025 12:00,ECOGR,21.94,22.58,21.76,22.58,5675937.0,0.0,0.64,0.04,1500.0,0.64,3675940.7,54.41,0.0,True,62.75,0.0,-0.04,0.05,2025-12-01,21.72,3.96,0,,21.3,23.12,False,False
01-12-2025 12:00,VESBE,8.44,8.54,8.43,8.52,1225540.0,0.02,0.08,0.0,1500.0,0.08,691240.4,77.3,0.25,True,63.22,0.01,0.01,0.01,2025-12-01,8.4,1.43,0,,8.37,ATH,False,False
01-12-2025 12:00,EUPWR,28.76,30.08,28.76,29.86,3484186.0,0.22,1.1,0.15,643.24,1.1,888455.3,292.16,0.2,True,75.65,0.03,-0.08,0.11,2025-12-01,28.02,6.57,0,,27.98,ATH,False,False
01-12-2025 12:00,AVOD,3.47,3.6,3.47,3.57,552031.0,0.03,0.1,0.0,3233.33,0.1,204876.7,169.45,0.3,True,55.49,-0.01,-0.01,0.0,2025-12-01,3.48,2.59,0,,3.42,ATH,False,False
01-12-2025 12:00,SANFM,6.5,6.82,6.49,6.75,3043079.0,0.07,0.25,0.04,594.44,0.25,969185.4,213.98,0.28,True,69.04,0.01,-0.02,0.03,2025-12-01,6.25,8.0,0,,6.21,ATH,False,False
01-12-2025 11:00,GARAN,139.4,140.8,139.3,140.5,6069669.0,0.3,1.1,0.15,633.33,1.1,3014798.6,101.33,0.27,True,66.73,0.14,0.01,0.12,2025-12-01,138.9,1.15,0,,137.3,ATH,False,False
01-12-2025 11:00,GLRYH,4.26,4.37,4.26,4.34,1764681.0,0.03,0.08,0.01,433.33,0.08,554834.9,218.06,0.38,True,76.89,0.01,0.0,0.01,2025-12-01,4.18,3.83,1,4.37,4.09,4.37,False,False
01-12-2025 11:00,DOHOL,17.15,17.24,17.13,17.23,1535852.0,0.01,0.08,0.01,1233.33,0.08,859576.7,78.68,0.12,True,57.09,-0.02,-0.03,0.01,2025-12-01,17.09,0.82,0,,16.92,ATH,False,False
01-12-2025 11:00,TTKOM,55.95,56.5,55.9,56.4,4733160.0,0.1,0.45,0.01,4400.0,0.45,2012810.1,135.15,0.22,True,62.6,0.03,0.01,0.02,2025-12-01,55.75,1.17,0,,55.55,56.55,False,False
01-12-2025 11:00,PENGD,8.25,8.36,8.25,8.34,559134.0,0.02,0.09,0.01,1400.0,0.09,287339.3,94.59,0.22,True,57.27,-0.03,-0.03,0.01,2025-12-01,8.15,2.33,1,8.36,8.14,8.36,False,False
01-12-2025 10:00,BLUME,52.65,55.15,51.9,54.55,1310527.0,0.6,1.9,0.13,1307.41,1.9,223698.4,485.85,0.32,True,74.06,0.33,0.19,0.15,2025-12-01,53.0,2.92,0,,51.7,ATH,False,False
01-12-2025 10:00,BINHO,9.81,10.24,9.78,10.18,9326685.0,0.06,0.37,0.02,1750.0,0.37,2165918.3,330.61,0.16,True,64.24,-0.02,-0.03,0.01,2025-12-01,9.84,3.46,3,,ATL,10.28,False,False
01-12-2025 10:00,BAYRK,23.0,24.72,22.86,24.54,2578899.0,0.18,1.54,0.12,1183.33,1.54,438430.2,488.21,0.12,True,66.25,-0.07,-0.14,0.07,2025-12-01,23.0,6.7,0,,22.78,ATH,False,False
01-12-2025 10:00,XU030,11902.11,12000.21,11864.24,11987.41,581355677.0,12.8,85.3,10.15,740.06,85.3,230986182.5,151.68,0.15,True,62.06,-4.12,-7.02,2.9,2025-12-01,11911.7,0.64,2,11864.24,11864.24,12043.14,False,False
01-12-2025 10:00,CELHA,11.7,12.26,11.7,12.26,5402017.0,0.0,0.56,0.01,4207.69,0.56,3270339.3,65.18,0.0,True,66.86,0.05,0.04,0.01,2025-12-01,11.15,9.96,0,,10.48,12.54,False,False
01-12-2025 10:00,YYLGD,10.0,10.13,10.0,10.1,492674.0,0.03,0.1,0.0,9900.0,0.1,259349.3,89.97,0.3,True,51.2,-0.02,-0.02,-0.0,2025-12-01,10.01,0.9,2,10.0,10.0,ATH,False,False
01-12-2025 10:00,XU100,10895.36,10979.42,10870.07,10970.12,1208366500.0,9.3,74.76,7.11,951.62,74.76,437974222.9,175.9,0.12,True,61.21,-7.26,-9.29,2.03,2025-12-01,10898.7,0.66,2,10870.07,10870.07,11032.53,False,False
01-12-2025 10:00,REEDR,7.34,7.45,7.3,7.44,5816898.0,0.01,0.1,0.0,9900.0,0.1,2250849.8,158.43,0.1,True,53.48,-0.02,-0.01,-0.0,2025-12-01,7.34,1.36,2,7.3,7.3,7.73,False,False
01-12-2025 10:00,TUREX,7.58,7.73,7.56,7.72,4206886.0,0.01,0.14,0.01,833.33,0.14,1642343.0,156.15,0.07,True,65.54,-0.01,-0.01,0.01,2025-12-01,7.57,1.98,0,,7.5,ATH,False,False
01-12-2025 10:00,GOODY,14.68,14.91,14.68,14.9,168071.0,0.01,0.22,0.02,1366.67,0.22,64581.6,160.25,0.05,True,64.76,-0.01,-0.02,0.01,2025-12-01,14.68,1.5,0,,14.61,ATH,False,False
01-12-2025 10:00,PRDGS,5.85,6.03,5.82,6.03,780505.0,0.0,0.18,0.01,2900.0,0.18,228019.6,242.3,0.0,True,68.69,-0.01,-0.02,0.01,2025-12-01,5.85,3.08,0,,5.81,ATH,False,False
01-12-2025 10:00,SASA,2.93,2.96,2.93,2.96,129582276.0,0.0,0.03,0.0,1400.0,0.03,57061276.0,127.09,0.0,True,69.64,0.0,-0.0,0.0,2025-12-01,2.92,1.37,0,,2.9,ATH,False,False
01-12-2025 10:00,ONCSM,231.9,247.2,230.0,247.0,540915.0,0.2,15.1,1.42,963.38,15.1,149859.6,260.95,0.01,True,69.11,0.27,-1.04,1.31,2025-12-01,227.0,8.81,0,,220.0,ATH,False,False
01-12-2025 10:00,MARTI,2.78,2.86,2.77,2.86,2242830.0,0.0,0.08,0.0,3900.0,0.08,923540.1,142.85,0.0,True,68.98,0.0,0.0,0.0,2025-12-01,2.77,3.25,0,,2.75,ATH,False,False
01-12-2025 10:00,TUKAS,2.56,2.61,2.55,2.6,27687808.0,0.01,0.04,0.0,1900.0,0.04,9624573.3,187.68,0.25,True,58.85,-0.01,-0.01,0.0,2025-12-01,2.54,2.36,0,,2.54,ATH,False,False
01-12-2025 10:00,HEKTS,3.17,3.23,3.17,3.22,17929704.0,0.01,0.05,0.01,733.33,0.05,6722004.7,166.73,0.2,True,73.76,0.0,0.0,0.0,2025-12-01,3.18,1.26,0,,3.15,3.23,False,False
01-12-2025 10:00,HKTM,11.76,12.04,11.74,11.97,356388.0,0.07,0.21,0.02,775.0,0.21,141014.4,152.73,0.33,True,64.47,0.01,-0.0,0.01,2025-12-01,11.72,2.13,0,,ATL,ATH,False,False
01-12-2025 10:00,GOKNR,20.54,20.78,20.52,20.76,390935.0,0.02,0.22,0.01,2650.0,0.22,200578.0,94.9,0.09,True,56.36,-0.03,-0.03,0.01,2025-12-01,20.54,1.07,0,,20.4,20.84,False,False
01-12-2025 10:00,PRKME,16.39,16.59,16.39,16.57,198271.0,0.02,0.18,0.02,757.14,0.18,80542.6,146.17,0.11,True,79.76,0.02,0.01,0.01,2025-12-01,16.39,1.1,0,,ATL,ATH,False,False
01-12-2025 10:00,EREGL,23.86,24.28,23.86,24.28,49533152.0,0.0,0.42,0.02,1650.0,0.42,16287580.3,204.12,0.0,True,71.61,0.0,-0.02,0.02,2025-12-01,23.86,1.76,0,,23.74,ATH,False,False
01-12-2025 10:00,EGEGY,24.16,24.9,23.9,24.76,294691.0,0.14,0.6,0.07,733.33,0.6,143654.6,105.14,0.23,True,67.12,0.12,0.12,0.01,2025-12-01,24.18,2.4,2,23.9,23.9,ATH,False,False
01-12-2025 10:00,ZOREN,3.25,3.3,3.24,3.29,9118186.0,0.01,0.04,0.0,1900.0,0.04,3489968.5,161.27,0.25,True,58.96,-0.01,-0.01,0.0,2025-12-01,3.24,1.54,0,,3.23,3.32,False,False
28-11-2025 17:00,HATEK,19.19,21.22,19.17,21.22,4240118.0,0.0,2.03,0.17,1115.57,2.03,1348326.5,214.47,0.0,True,71.53,0.08,-0.05,0.12,2025-11-28,19.3,9.95,0,,18.01,ATH,False,False
28-11-2025 17:00,SURGY,49.58,52.45,49.06,52.45,1167009.0,0.0,2.87,0.31,811.11,2.87,325591.7,258.43,0.0,True,81.77,0.26,0.1,0.17,2025-11-28,49.44,6.09,1,52.45,ATL,ATH,False,False
28-11-2025 17:00,LMKDC,27.6,27.94,27.6,27.86,587457.0,0.08,0.26,0.02,1200.0,0.26,203255.3,189.02,0.31,True,58.17,-0.01,-0.02,0.01,2025-11-28,27.7,0.58,0,,27.52,ATH,False,False
28-11-2025 17:00,BOBET,18.76,18.83,18.76,18.83,180219.0,0.0,0.07,0.0,1650.0,0.07,98755.7,82.49,0.0,True,57.42,-0.01,-0.01,0.0,2025-11-28,18.8,0.16,0,,18.71,18.88,False,False
28-11-2025 15:00,YAYLA,32.4,33.58,32.4,33.56,834518.0,0.02,1.16,0.15,694.52,1.16,200380.6,316.47,0.02,True,67.42,0.0,-0.06,0.06,2025-11-28,32.36,3.71,0,,31.5,ATH,False,False
28-11-2025 11:00,THYAO,272.75,276.5,272.5,275.75,8338805.0,0.75,3.0,0.22,1233.33,3.0,3111305.1,168.02,0.25,True,62.7,-0.11,-0.14,0.03,2025-11-28,272.5,1.19,0,,271.5,ATH,False,False
28-11-2025 10:00,KZBGY,11.5,11.93,11.47,11.83,8456190.0,0.1,0.33,0.05,500.0,0.33,2312015.8,265.75,0.3,True,93.61,0.06,0.04,0.02,2025-11-28,11.45,3.32,0,,ATL,ATH,False,False
27-11-2025 17:00,AHGAZ,26.36,26.74,26.34,26.72,699867.0,0.02,0.36,0.02,1400.0,0.36,259010.0,170.21,0.06,True,66.01,0.01,0.0,0.01,2025-11-27,26.4,1.21,0,,ATL,ATH,False,False
