Tarih,Hisse,open,high,low,close,volume,YuksekKapanis_Fark,AcilisKapanis_Fark,AcilisKapanisFark_Ort,AcilisKapanisFark_OrtalamayaGoreDegisim,AcilisKapanisFarkOrt_MaxSon10,HacimOrtalama,%Hacim_HacimOrtalama,Fark_Orani,Kosul,rsi,MACD_12_26_9,MACDs_12_26_9,MACDh_12_26_9,Tarih1,prev_close,%Deg,isPivot,pointpos,destek,direnc,Tsinyal_Banker_Dip,Tsinyal_Banker_DipKarar
10-02-2026 12:00,SKTAS,3.87,3.92,3.87,3.91,1129550.0,0.01,0.04,0.01,300.0,0.04,751049.9,50.4,0.25,True,68.95,0.02,0.01,0.01,2026-02-10,3.82,2.36,0,,3.71,4.09,False,False
10-02-2026 11:00,ARFYE,31.02,32.84,31.0,32.78,12408302.0,0.06,1.76,0.34,417.65,1.76,4409519.9,181.4,0.03,True,80.31,0.72,0.41,0.31,2026-02-10,31.3,4.73,0,,28.28,ATH,False,False
10-02-2026 11:00,CANTE,1.82,1.85,1.81,1.85,140343149.0,0.0,0.03,0.0,1400.0,0.03,57214500.0,145.29,0.0,True,57.87,-0.0,-0.01,0.01,2026-02-10,1.82,1.65,0,,1.78,1.86,True,False
10-02-2026 11:00,QUAGR,2.86,2.99,2.85,2.99,43588866.0,0.0,0.13,0.01,1525.0,0.13,16131329.5,170.21,0.0,True,74.22,0.07,0.06,0.01,2026-02-10,2.9,3.1,0,,2.61,ATH,False,False
10-02-2026 11:00,PAPIL,18.35,18.5,18.29,18.48,2118354.0,0.02,0.13,0.01,1081.82,0.13,1231578.5,72.0,0.15,True,53.65,-0.02,-0.09,0.06,2026-02-10,18.42,0.33,0,,17.8,19.25,False,False
10-02-2026 11:00,SAMAT,5.96,6.06,5.94,6.05,512325.0,0.01,0.09,0.02,328.57,0.09,209855.3,144.13,0.11,True,73.99,0.06,0.04,0.02,2026-02-10,5.92,2.2,0,,5.69,6.1,False,False
10-02-2026 11:00,GMTAS,27.14,27.62,26.96,27.52,982450.0,0.1,0.38,0.04,955.56,0.38,392171.7,150.52,0.26,True,72.81,0.49,0.42,0.07,2026-02-10,27.0,1.93,0,,24.42,ATH,False,False
10-02-2026 11:00,GIPTA,58.2,62.1,58.15,61.3,2126659.0,0.8,3.1,0.3,933.33,3.1,405015.3,425.08,0.26,True,76.31,0.27,0.04,0.23,2026-02-10,58.25,5.24,0,,57.0,63.8,False,False
10-02-2026 11:00,SELVA,2.58,2.65,2.56,2.64,10938285.0,0.01,0.06,0.0,2900.0,0.06,4699717.2,132.74,0.17,True,54.27,-0.01,-0.02,0.01,2026-02-10,2.59,1.93,0,,2.57,2.65,True,True
10-02-2026 11:00,GEREL,19.84,21.22,19.7,21.2,4681455.0,0.02,1.36,0.19,627.27,1.36,2912470.2,60.74,0.01,True,92.0,0.78,0.63,0.16,2026-02-10,19.65,7.89,0,,16.32,ATH,False,False
10-02-2026 11:00,AVHOL,39.14,39.74,39.14,39.74,209530.0,0.0,0.6,0.1,500.0,0.6,111351.0,88.17,0.0,True,70.89,0.3,0.21,0.1,2026-02-10,39.26,1.22,0,,37.72,39.9,False,False
10-02-2026 11:00,CUSAN,30.3,31.68,30.2,31.48,315068.0,0.2,1.18,0.02,5800.0,1.18,207506.8,51.84,0.17,True,60.61,0.45,0.46,-0.01,2026-02-10,31.14,1.09,0,,27.8,32.3,False,False
10-02-2026 11:00,ODAS,5.86,6.19,5.85,6.14,20106303.0,0.05,0.28,0.03,833.33,0.28,5140145.2,291.16,0.18,True,75.95,0.06,0.04,0.02,2026-02-10,5.9,4.07,0,,5.64,6.36,False,False
10-02-2026 11:00,FZLGY,12.38,12.8,12.38,12.69,2924315.0,0.11,0.31,0.03,839.39,0.31,724120.3,303.84,0.35,True,67.37,0.09,0.04,0.05,2026-02-10,12.52,1.36,0,,12.0,12.97,False,False
10-02-2026 11:00,NATEN,8.41,8.5,8.41,8.48,1792365.0,0.02,0.07,0.01,775.0,0.07,803537.6,123.06,0.29,True,58.71,0.0,-0.01,0.02,2026-02-10,8.4,0.95,0,,8.26,8.83,False,False
10-02-2026 11:00,GZNMI,48.74,52.55,48.66,52.35,2348146.0,0.2,3.61,0.51,609.23,3.61,909414.1,158.2,0.06,True,85.52,1.34,0.93,0.41,2026-02-10,48.98,6.88,0,,44.64,ATH,False,False
10-02-2026 11:00,ADESE,1.19,1.23,1.18,1.23,135261094.0,0.0,0.04,0.0,900.0,0.04,55294849.4,144.62,0.0,True,62.65,0.0,-0.0,0.0,2026-02-10,1.19,3.36,0,,1.17,1.45,False,False
10-02-2026 11:00,AKGRT,8.47,8.61,8.44,8.61,4186352.0,0.0,0.14,0.01,900.0,0.14,1472125.1,184.37,0.0,True,67.44,0.04,0.02,0.02,2026-02-10,8.38,2.74,0,,7.86,8.71,False,False
10-02-2026 11:00,LRSHO,4.16,4.23,4.15,4.22,3678488.0,0.01,0.06,0.01,900.0,0.06,2034414.0,80.81,0.17,True,65.06,0.01,-0.01,0.01,2026-02-10,4.14,1.93,0,,4.03,4.37,False,False
10-02-2026 11:00,BORSK,6.35,6.46,6.35,6.45,2573604.0,0.01,0.1,0.02,354.55,0.1,1228023.0,109.57,0.1,True,76.37,0.04,0.02,0.02,2026-02-10,6.34,1.74,0,,6.08,6.47,False,False
10-02-2026 11:00,KFEIN,9.61,9.73,9.61,9.7,1028377.0,0.03,0.09,0.02,291.3,0.09,504328.4,103.91,0.33,True,73.57,0.09,0.06,0.03,2026-02-10,9.6,1.04,0,,9.07,ATH,False,False
10-02-2026 11:00,KNFRT,12.41,12.62,12.41,12.59,585357.0,0.03,0.18,0.0,8900.0,0.18,372494.6,57.15,0.17,True,54.26,0.01,0.03,-0.03,2026-02-10,12.44,1.21,0,,12.42,13.24,False,False
10-02-2026 11:00,KRONT,15.85,16.27,15.85,16.19,411099.0,0.08,0.34,0.07,359.46,0.34,181604.4,126.37,0.24,True,76.53,0.17,0.09,0.07,2026-02-10,15.69,3.19,0,,14.95,ATH,False,False
10-02-2026 11:00,BNTAS,6.74,6.82,6.74,6.81,1020043.0,0.01,0.07,0.01,900.0,0.07,526907.2,93.59,0.14,True,73.49,0.04,0.02,0.02,2026-02-10,6.69,1.79,0,,6.47,6.93,False,False
10-02-2026 10:00,MERCN,18.57,20.28,18.57,20.0,19635137.0,0.28,1.43,0.17,717.14,1.43,2882386.7,581.21,0.2,True,87.24,0.56,0.41,0.15,2026-02-10,18.44,8.46,0,,16.35,ATH,False,False
10-02-2026 10:00,BURCE,61.85,63.95,60.35,63.5,476630.0,0.45,1.65,0.09,1636.84,1.65,172772.6,175.87,0.27,True,40.99,-1.55,-1.46,-0.1,2026-02-10,62.75,1.2,0,,61.25,77.5,False,False
10-02-2026 10:00,ASELS,292.25,296.5,291.0,296.0,10769094.0,0.5,3.75,0.4,837.5,3.75,3122530.1,244.88,0.13,True,61.36,-0.17,-0.95,0.78,2026-02-10,292.0,1.37,0,,283.0,304.0,False,False
10-02-2026 10:00,KOCMT,2.75,2.79,2.73,2.79,17797436.0,0.0,0.04,0.0,1233.33,0.04,3882884.8,358.36,0.0,True,72.18,0.01,-0.0,0.01,2026-02-10,2.72,2.57,0,,2.63,2.82,False,False
10-02-2026 10:00,KRVGD,3.05,3.12,3.04,3.11,2035657.0,0.01,0.06,0.01,900.0,0.06,764234.7,166.37,0.17,True,71.5,0.02,0.01,0.01,2026-02-10,3.06,1.63,0,,2.93,3.31,False,False
10-02-2026 10:00,KLKIM,42.0,43.1,41.88,42.9,1041612.0,0.2,0.9,0.14,552.17,0.9,276885.4,276.19,0.22,True,72.96,0.34,0.26,0.09,2026-02-10,42.0,2.14,0,,40.06,ATH,False,False
10-02-2026 10:00,MANAS,11.6,12.51,11.52,12.3,32913399.0,0.21,0.7,0.1,579.61,0.7,7377597.6,346.13,0.3,True,81.1,0.37,0.29,0.08,2026-02-10,11.38,8.08,0,,10.09,ATH,False,False
10-02-2026 10:00,BIGEN,10.12,10.48,10.05,10.42,7644747.0,0.06,0.3,0.07,310.96,0.3,2040271.3,274.69,0.2,True,79.88,0.14,0.07,0.07,2026-02-10,10.11,3.07,0,,9.43,ATH,False,False
10-02-2026 10:00,DURKN,19.01,20.32,19.01,20.1,4543724.0,0.22,1.09,0.21,411.74,1.09,1009948.1,349.9,0.2,True,80.99,0.52,0.3,0.22,2026-02-10,18.92,6.24,0,,17.79,ATH,False,False
10-02-2026 10:00,ISKPL,11.22,11.99,11.22,11.84,16808597.0,0.15,0.62,0.07,773.24,0.62,2553434.9,558.27,0.24,True,73.49,0.05,-0.0,0.05,2026-02-10,11.22,5.53,0,,11.01,11.92,False,False
10-02-2026 10:00,ISSEN,7.6,7.75,7.58,7.72,614808.0,0.03,0.12,0.01,1100.0,0.12,187895.7,227.21,0.25,True,70.32,0.02,-0.01,0.02,2026-02-10,7.56,2.12,0,,7.36,7.77,False,False
10-02-2026 10:00,KMPUR,15.9,16.17,15.88,16.1,795970.0,0.07,0.2,0.02,852.38,0.2,185957.9,328.04,0.35,True,72.77,0.12,0.07,0.05,2026-02-10,15.83,1.71,0,,15.02,16.73,False,False
10-02-2026 10:00,RYSAS,19.7,20.38,19.69,20.34,7855734.0,0.04,0.64,0.08,680.49,0.64,1782421.8,340.73,0.06,True,65.43,0.18,0.19,-0.01,2026-02-10,19.89,2.26,0,,19.0,ATH,False,False
10-02-2026 10:00,DAPGM,11.77,12.4,11.65,12.23,11377197.0,0.17,0.46,0.07,538.89,0.46,3221545.4,253.16,0.37,True,73.01,0.24,0.22,0.02,2026-02-10,11.76,4.0,0,,10.2,ATH,False,False
10-02-2026 10:00,TSPOR,1.07,1.09,1.07,1.09,66741585.0,0.0,0.02,0.0,400.0,0.02,36704646.7,81.83,0.0,True,59.42,0.0,-0.0,0.0,2026-02-10,1.08,0.93,0,,1.05,1.11,False,False
10-02-2026 10:00,TRENJ,101.8,103.2,100.5,103.1,639372.0,0.1,1.3,0.14,828.57,1.3,202481.9,215.77,0.08,True,60.27,0.22,-0.13,0.35,2026-02-10,101.9,1.18,0,,97.6,105.0,False,False
10-02-2026 10:00,TRALT,48.26,50.0,47.66,49.9,44678604.0,0.1,1.64,0.3,454.05,1.64,12934305.5,245.43,0.06,True,68.69,0.3,-0.07,0.37,2026-02-10,48.34,3.23,0,,44.68,52.05,False,False
10-02-2026 10:00,ESCOM,3.86,3.91,3.79,3.9,5589495.0,0.01,0.04,0.0,900.0,0.04,2385896.6,134.27,0.25,True,68.21,0.04,0.03,0.01,2026-02-10,3.85,1.3,0,,3.61,ATH,False,False
10-02-2026 10:00,AKSEN,68.3,69.75,67.95,69.7,1544403.0,0.05,1.4,0.05,2700.0,1.4,566452.8,172.64,0.04,True,51.74,-0.63,-0.89,0.26,2026-02-10,68.3,2.05,0,,66.6,70.05,True,False
10-02-2026 10:00,ENERY,9.54,9.75,9.51,9.73,4586308.0,0.02,0.19,0.02,850.0,0.19,1351469.2,239.36,0.11,True,61.25,-0.03,-0.06,0.03,2026-02-10,9.53,2.1,0,,9.33,10.24,True,False
10-02-2026 10:00,ULUFA,4.14,4.32,4.13,4.27,9880141.0,0.05,0.13,0.01,766.67,0.13,1693737.7,483.33,0.38,True,71.2,0.02,0.01,0.02,2026-02-10,4.14,3.14,0,,3.97,4.31,False,False
10-02-2026 10:00,DNISI,23.6,24.26,23.6,24.08,1055445.0,0.18,0.48,0.12,293.44,0.48,356786.9,195.82,0.38,True,74.66,0.37,0.32,0.05,2026-02-10,23.56,2.21,0,,21.7,ATH,False,False
10-02-2026 10:00,DAGI,6.4,6.66,6.3,6.6,4274272.0,0.06,0.2,0.01,1900.0,0.2,990294.9,331.62,0.3,True,73.32,0.08,0.07,0.01,2026-02-10,6.36,3.77,0,,5.97,ATH,False,False
10-02-2026 10:00,ZERGY,21.06,22.16,21.06,22.0,25887427.0,0.16,0.94,0.21,354.11,0.94,7329796.1,253.18,0.17,True,76.42,0.7,0.42,0.28,2026-02-10,20.5,7.32,0,,16.22,ATH,False,False
10-02-2026 10:00,ZGYO,29.0,30.5,28.7,30.5,6876748.0,0.0,1.5,0.15,900.0,1.5,773787.7,788.71,0.0,True,93.65,1.43,1.25,0.18,2026-02-10,27.74,9.95,0,,19.19,ATH,False,False
10-02-2026 10:00,ALKLC,248.2,259.5,248.2,259.0,340389.0,0.5,10.8,0.94,1055.08,10.8,112378.1,202.9,0.05,True,60.42,-2.54,-3.18,0.64,2026-02-10,248.0,4.44,0,,245.5,282.5,True,True
10-02-2026 10:00,GENTS,10.6,10.76,10.51,10.74,1652414.0,0.02,0.14,0.01,1900.0,0.14,704983.2,134.39,0.14,True,52.87,-0.11,-0.18,0.06,2026-02-10,10.48,2.48,0,,10.19,10.85,True,False
10-02-2026 10:00,SAYAS,42.0,42.64,41.7,42.5,352706.0,0.14,0.5,0.1,410.2,0.5,100648.8,250.43,0.28,True,74.07,0.4,0.23,0.17,2026-02-10,41.8,1.67,0,,39.74,43.0,False,False
10-02-2026 10:00,KLYPV,64.85,69.9,64.5,69.0,3770103.0,0.9,4.15,0.29,1331.03,4.15,680602.9,453.94,0.22,True,65.52,-0.36,-0.56,0.2,2026-02-10,64.6,6.81,0,,64.5,74.9,True,True
10-02-2026 10:00,TURSG,11.91,12.46,11.91,12.37,43151283.0,0.09,0.46,0.04,995.24,0.46,6566888.8,557.1,0.2,True,76.67,0.04,0.0,0.04,2026-02-10,11.87,4.21,0,,11.7,ATH,False,False
09-02-2026 18:00,PASEU,154.7,158.9,154.7,158.9,1003796.0,0.0,4.2,0.51,723.53,4.2,541292.8,85.44,0.0,True,69.62,1.7,1.6,0.1,2026-02-09,154.9,2.58,0,,146.7,164.9,False,False
09-02-2026 17:00,ESCAR,27.26,28.0,27.24,28.0,1781065.0,0.0,0.74,0.05,1380.0,0.74,587131.3,203.35,0.0,True,66.63,0.11,0.07,0.04,2026-02-09,27.6,1.45,0,,26.2,28.56,False,False
09-02-2026 17:00,DESA,11.89,12.12,11.87,12.06,345622.0,0.06,0.17,0.02,794.74,0.17,120044.8,187.91,0.35,True,64.2,0.01,-0.03,0.04,2026-02-09,11.85,1.77,0,,11.53,12.25,False,False
09-02-2026 17:00,BRKVY,112.5,114.3,112.5,114.2,165511.0,0.1,1.7,0.07,2328.57,1.7,81104.3,104.07,0.06,True,47.25,-1.12,-1.3,0.19,2026-02-09,113.5,0.62,0,,111.7,129.0,True,True
09-02-2026 17:00,ESEN,3.93,3.95,3.92,3.95,10943138.0,0.0,0.02,0.01,185.71,0.02,6394475.1,71.13,0.0,True,64.43,0.01,0.0,0.01,2026-02-09,3.9,1.28,0,,3.83,3.98,False,False
09-02-2026 17:00,ISMEN,47.22,47.8,47.18,47.76,2119899.0,0.04,0.54,0.07,718.18,0.54,824541.9,157.1,0.07,True,62.78,-0.01,-0.14,0.13,2026-02-09,46.54,2.62,0,,46.06,48.3,False,False
09-02-2026 17:00,BUCIM,6.83,6.87,6.82,6.86,2297727.0,0.01,0.03,0.0,500.0,0.03,919333.7,149.93,0.33,True,56.64,-0.01,-0.02,0.01,2026-02-09,6.78,1.18,0,,6.72,6.94,False,False
09-02-2026 17:00,HDFGS,3.28,3.45,3.28,3.45,59867957.0,0.0,0.17,0.03,431.25,0.17,13893804.9,330.9,0.0,True,73.57,0.03,0.01,0.02,2026-02-09,3.14,9.87,0,,3.11,ATH,False,False
09-02-2026 17:00,MAGEN,43.8,44.96,43.78,44.8,3967488.0,0.16,1.0,0.29,247.22,1.0,1880982.0,110.93,0.16,True,78.87,0.51,0.21,0.3,2026-02-09,41.7,7.43,0,,41.24,ATH,False,False
09-02-2026 17:00,DYOBY,14.12,14.22,14.09,14.2,315054.0,0.02,0.08,0.02,247.83,0.08,181823.2,73.27,0.25,True,57.63,-0.01,-0.03,0.02,2026-02-09,13.88,2.31,0,,13.72,14.99,False,False
09-02-2026 17:00,PRZMA,11.66,11.97,11.66,11.89,243584.0,0.08,0.23,0.03,576.47,0.23,88029.7,176.71,0.35,True,55.49,-0.05,-0.13,0.08,2026-02-09,11.64,2.15,0,,10.8,13.95,False,False
09-02-2026 17:00,BIGCH,55.05,56.9,54.6,56.5,422917.0,0.4,1.45,0.21,590.48,1.45,149239.6,183.38,0.28,True,62.82,0.36,0.29,0.07,2026-02-09,54.9,2.91,0,,52.1,ATH,False,False
09-02-2026 17:00,USAK,1.83,1.84,1.82,1.84,17971594.0,0.0,0.01,0.0,400.0,0.01,10885687.3,65.09,0.0,True,47.12,-0.01,-0.01,0.0,2026-02-09,1.82,1.1,0,,1.78,2.13,False,False
09-02-2026 17:00,AHGAZ,25.22,25.62,25.18,25.52,827067.0,0.1,0.3,0.04,733.33,0.3,407843.1,102.79,0.33,True,59.69,-0.02,-0.12,0.1,2026-02-09,25.16,1.43,0,,24.28,27.02,False,False
09-02-2026 17:00,AKFYE,19.14,19.36,19.14,19.33,1379400.0,0.03,0.19,0.02,955.56,0.19,734357.8,87.84,0.16,True,42.06,-0.32,-0.37,0.05,2026-02-09,19.03,1.58,0,,18.8,21.84,True,True
09-02-2026 17:00,BARMA,44.62,45.3,44.46,45.2,600234.0,0.1,0.58,0.02,3525.0,0.58,286136.7,109.77,0.17,True,66.08,0.68,0.67,0.0,2026-02-09,45.0,0.44,0,,42.42,46.02,False,False
09-02-2026 17:00,TCKRC,88.7,90.15,88.7,90.15,289329.0,0.0,1.45,0.17,752.94,1.45,187020.0,54.7,0.0,True,51.35,-1.12,-1.38,0.27,2026-02-09,87.15,3.44,0,,87.1,96.5,True,True
09-02-2026 17:00,NETAS,63.9,64.65,63.8,64.55,89907.0,0.1,0.65,0.2,225.0,0.65,33681.6,166.93,0.15,True,62.23,-0.09,-0.37,0.28,2026-02-09,62.2,3.78,0,,61.6,68.0,False,False
09-02-2026 17:00,AYDEM,26.04,26.5,25.96,26.5,545096.0,0.0,0.46,0.05,751.85,0.46,361378.2,50.84,0.0,True,53.23,-0.08,-0.1,0.02,2026-02-09,25.98,2.0,0,,25.62,27.62,False,False
09-02-2026 17:00,ALKIM,19.3,19.68,19.24,19.65,1027758.0,0.03,0.35,0.05,548.15,0.35,252276.4,307.39,0.09,True,72.95,0.04,-0.04,0.07,2026-02-09,18.9,3.97,0,,18.72,19.92,False,False
09-02-2026 17:00,SKBNK,9.39,9.79,9.38,9.75,23063577.0,0.04,0.36,0.05,682.61,0.36,6804525.5,238.94,0.11,True,76.68,0.1,0.07,0.03,2026-02-09,9.1,7.14,0,,9.04,ATH,False,False
09-02-2026 16:00,GESAN,56.35,57.3,56.25,57.25,921327.0,0.05,0.9,0.18,386.49,0.9,503133.2,83.12,0.06,True,64.73,0.08,-0.14,0.21,2026-02-09,55.05,4.0,0,,54.3,60.75,False,False
09-02-2026 16:00,SRVGY,3.38,3.44,3.38,3.43,8094007.0,0.01,0.05,0.01,284.62,0.05,4477534.7,80.77,0.2,True,65.31,-0.01,-0.02,0.01,2026-02-09,3.3,3.94,0,,3.26,3.58,False,False
09-02-2026 16:00,FROTO,118.5,120.3,118.3,120.2,4089373.0,0.1,1.7,0.3,466.67,1.7,2469245.6,65.61,0.06,True,75.45,0.82,0.46,0.36,2026-02-09,115.7,3.89,0,,114.4,ATH,False,False
09-02-2026 16:00,GOZDE,26.22,26.64,26.22,26.6,613758.0,0.04,0.38,0.09,322.22,0.38,272508.1,125.23,0.11,True,60.41,-0.03,-0.1,0.07,2026-02-09,25.9,2.7,0,,25.4,27.08,False,False
09-02-2026 16:00,A1CAP,16.06,16.44,16.03,16.38,2739758.0,0.06,0.32,0.02,1584.21,0.32,1500326.1,82.61,0.19,True,62.34,0.06,0.03,0.03,2026-02-09,16.1,1.74,0,,15.38,16.62,False,False
09-02-2026 16:00,KBORU,18.11,18.89,18.05,18.72,3305522.0,0.17,0.61,0.11,470.09,0.61,1690020.9,95.59,0.28,True,68.7,0.2,0.16,0.04,2026-02-09,17.76,5.41,0,,17.4,19.32,False,False
09-02-2026 15:00,METRO,5.52,5.65,5.51,5.62,2116092.0,0.03,0.1,0.01,809.09,0.1,1378424.8,53.52,0.3,True,64.41,0.02,-0.0,0.02,2026-02-09,5.37,4.66,0,,5.33,5.64,False,False
09-02-2026 15:00,ANELE,16.33,16.59,16.33,16.53,583126.0,0.06,0.2,0.03,506.06,0.2,199624.8,192.11,0.3,True,68.35,0.05,0.01,0.04,2026-02-09,16.16,2.29,0,,15.82,16.86,False,False
09-02-2026 15:00,DMRGD,3.91,4.13,3.9,4.07,16630055.0,0.06,0.16,0.02,788.89,0.16,6436166.4,158.38,0.37,True,68.76,0.07,0.06,0.0,2026-02-09,3.88,4.9,0,,3.82,4.08,False,False
09-02-2026 15:00,HOROZ,64.8,66.05,64.65,65.8,340403.0,0.25,1.0,0.27,270.37,1.0,162511.3,109.46,0.25,True,69.84,0.76,0.45,0.32,2026-02-09,62.9,4.61,0,,61.55,66.55,False,False
09-02-2026 14:00,HATEK,15.17,16.0,15.16,15.81,2691650.0,0.19,0.64,0.06,966.67,0.64,391469.0,587.58,0.3,True,75.35,0.04,-0.02,0.06,2026-02-09,15.15,4.36,0,,14.95,15.86,False,False
09-02-2026 14:00,SELEC,82.65,84.15,82.65,84.0,696435.0,0.15,1.35,0.19,592.31,1.35,153735.1,353.01,0.11,True,70.9,0.34,0.15,0.19,2026-02-09,80.6,4.22,0,,80.15,ATH,False,False
09-02-2026 14:00,EGSER,3.22,3.27,3.22,3.26,1092923.0,0.01,0.04,0.01,344.44,0.04,501514.5,117.92,0.25,True,65.9,0.02,0.01,0.01,2026-02-09,3.19,2.19,0,,3.14,ATH,False,False
09-02-2026 14:00,ALTNY,15.75,15.97,15.74,15.92,4501521.0,0.05,0.17,0.02,709.52,0.17,1748015.5,157.52,0.29,True,62.81,-0.01,-0.04,0.03,2026-02-09,15.64,1.79,0,,15.51,15.98,False,False
09-02-2026 14:00,ENDAE,14.9,15.35,14.88,15.28,1112694.0,0.07,0.38,0.07,442.86,0.38,366219.7,203.83,0.18,True,74.12,0.06,-0.02,0.08,2026-02-09,14.68,4.09,0,,14.37,15.31,False,False
09-02-2026 14:00,LMKDC,31.44,31.82,31.34,31.78,797837.0,0.04,0.34,0.05,529.63,0.34,343135.5,132.51,0.12,True,60.98,-0.05,-0.2,0.15,2026-02-09,30.9,2.85,0,,30.46,33.12,False,False
09-02-2026 13:00,BINHO,10.06,10.73,10.01,10.73,48901603.0,0.0,0.67,0.07,830.56,0.67,12819518.2,281.46,0.0,True,89.93,0.35,0.26,0.08,2026-02-09,9.76,9.94,0,,8.76,ATH,False,False
09-02-2026 13:00,SNICA,4.44,4.51,4.43,4.51,3734552.0,0.0,0.07,0.02,366.67,0.07,2070977.6,80.33,0.0,True,74.76,0.04,0.04,0.01,2026-02-09,4.41,2.27,0,,4.05,ATH,False,False
09-02-2026 13:00,BINBN,186.9,203.0,186.2,202.6,577184.0,0.4,15.7,0.95,1552.63,15.7,124981.6,361.82,0.03,True,72.54,1.42,1.4,0.02,2026-02-09,188.8,7.31,0,,186.0,203.6,False,False
09-02-2026 12:00,SASA,2.48,2.53,2.48,2.52,738796936.0,0.01,0.04,0.01,566.67,0.04,323379814.9,128.46,0.25,True,58.55,-0.02,-0.03,0.01,2026-02-09,2.42,4.13,0,,2.36,2.61,False,False
09-02-2026 12:00,TKFEN,81.4,86.4,81.1,85.45,2408786.0,0.95,4.05,0.64,532.81,4.05,869958.2,176.89,0.23,True,65.02,-0.38,-0.77,0.39,2026-02-09,78.55,8.78,1,86.4,77.5,86.4,True,True
09-02-2026 12:00,MAKTK,16.5,17.09,16.47,17.05,2183346.0,0.04,0.55,0.11,386.73,0.55,642249.8,239.95,0.07,True,60.34,-0.09,-0.16,0.06,2026-02-09,16.26,4.86,0,,15.96,17.35,False,False
09-02-2026 12:00,MTRYO,10.38,10.59,10.38,10.54,95052.0,0.05,0.16,0.02,661.9,0.16,60391.4,57.39,0.31,True,56.03,-0.05,-0.08,0.03,2026-02-09,10.31,2.23,0,,9.99,11.35,False,False
09-02-2026 12:00,OYAKC,26.22,26.5,26.18,26.5,3356220.0,0.0,0.28,0.09,197.87,0.28,1689444.6,98.66,0.0,True,62.8,-0.12,-0.26,0.13,2026-02-09,25.72,3.03,0,,25.3,27.4,True,False
09-02-2026 12:00,POLHO,17.18,17.4,17.13,17.35,476820.0,0.05,0.17,0.01,1445.45,0.17,260583.8,82.98,0.29,True,50.9,-0.14,-0.17,0.04,2026-02-09,17.01,2.0,0,,16.94,18.15,True,False
09-02-2026 12:00,VSNMD,97.25,102.0,96.9,101.8,2117423.0,0.2,4.55,0.47,878.49,4.55,413998.6,411.46,0.04,True,81.37,1.63,1.46,0.17,2026-02-09,95.9,6.15,0,,95.55,ATH,False,False
09-02-2026 12:00,ECILC,113.4,116.7,113.1,116.6,1110443.0,0.1,3.2,0.4,700.0,3.2,517115.7,114.74,0.03,True,60.85,-0.7,-1.21,0.51,2026-02-09,108.0,7.96,0,,108.0,118.4,False,False
09-02-2026 12:00,FONET,3.18,3.25,3.18,3.25,8115160.0,0.0,0.07,0.0,6900.0,0.07,5106648.1,58.91,0.0,True,48.34,-0.05,-0.06,0.01,2026-02-09,3.15,3.17,0,,3.13,3.91,True,True
09-02-2026 12:00,ZOREN,3.49,3.55,3.48,3.54,17248744.0,0.01,0.05,0.01,316.67,0.05,8339740.1,106.83,0.2,True,68.26,0.01,-0.0,0.01,2026-02-09,3.42,3.51,0,,3.37,3.65,False,False
09-02-2026 12:00,AGROT,3.22,3.27,3.22,3.26,5343232.0,0.01,0.04,0.01,471.43,0.04,2454392.6,117.7,0.25,True,64.48,0.01,-0.0,0.01,2026-02-09,3.16,3.16,0,,3.13,3.3,False,False
09-02-2026 12:00,AKYHO,2.87,2.95,2.87,2.93,781685.0,0.02,0.06,0.01,1100.0,0.06,228893.7,241.51,0.33,True,58.31,-0.0,-0.0,-0.0,2026-02-09,2.87,2.09,0,,2.81,2.98,False,False
09-02-2026 12:00,ARZUM,2.65,2.83,2.64,2.83,45280382.0,0.0,0.18,0.02,800.0,0.18,6517167.2,594.79,0.0,True,75.24,0.04,0.03,0.01,2026-02-09,2.58,9.69,0,,2.56,ATH,False,False
09-02-2026 11:00,ATLAS,8.86,9.95,8.85,9.89,1139680.0,0.06,1.03,0.1,909.8,1.03,363477.5,213.55,0.06,True,60.34,-0.13,-0.16,0.03,2026-02-09,9.07,9.04,0,,8.5,10.93,True,True
09-02-2026 11:00,IHEVA,2.35,2.41,2.34,2.4,1398630.0,0.01,0.05,0.01,455.56,0.05,225617.5,519.91,0.2,True,68.7,-0.0,-0.01,0.01,2026-02-09,2.32,3.45,1,2.41,2.29,2.41,False,False
09-02-2026 11:00,SEKUR,4.6,4.98,4.55,4.9,1519000.0,0.08,0.3,0.05,488.24,0.3,606165.8,150.59,0.27,True,66.05,0.14,0.15,-0.01,2026-02-09,4.71,4.03,0,,4.42,ATH,False,False
09-02-2026 11:00,VAKFA,13.66,14.2,13.66,14.15,26089821.0,0.05,0.49,0.15,233.33,0.49,9187109.2,183.98,0.1,True,81.85,0.17,0.01,0.16,2026-02-09,13.44,5.28,0,,12.44,ATH,False,False
09-02-2026 11:00,TMSN,109.9,112.4,109.8,112.2,323253.0,0.2,2.3,0.4,475.0,2.3,96616.3,234.57,0.09,True,69.06,-0.25,-0.75,0.5,2026-02-09,108.0,3.89,0,,106.2,113.3,False,False
09-02-2026 11:00,DZGYO,8.89,8.95,8.87,8.94,472545.0,0.01,0.05,0.0,1566.67,0.05,304935.0,54.97,0.2,True,54.93,-0.04,-0.06,0.02,2026-02-09,8.76,2.05,0,,8.63,9.28,False,False
09-02-2026 11:00,YUNSA,9.5,9.95,9.47,9.9,4784176.0,0.05,0.4,0.08,419.48,0.4,1332156.8,259.13,0.12,True,75.26,0.11,0.06,0.04,2026-02-09,9.18,7.84,0,,9.08,ATH,False,False
09-02-2026 10:00,GOODY,15.74,16.04,15.74,15.99,193749.0,0.05,0.25,0.02,1215.79,0.25,94522.7,104.98,0.2,True,58.53,-0.05,-0.07,0.01,2026-02-09,15.71,1.78,0,,15.59,16.22,False,False
09-02-2026 10:00,CCOLA,73.75,75.0,73.75,74.85,1113592.0,0.15,1.1,0.07,1592.31,1.1,509651.7,118.5,0.14,True,62.07,-0.25,-0.35,0.1,2026-02-09,72.95,2.6,0,,71.85,76.4,False,False
09-02-2026 10:00,GLYHO,15.41,15.62,15.3,15.6,889645.0,0.02,0.19,0.03,533.33,0.19,359107.4,147.74,0.11,True,60.67,-0.0,-0.02,0.02,2026-02-09,15.31,1.89,0,,15.09,16.05,False,False
09-02-2026 10:00,HEKTS,3.21,3.28,3.2,3.27,56111305.0,0.01,0.06,0.01,650.0,0.06,14116754.3,297.48,0.17,True,59.01,-0.02,-0.03,0.01,2026-02-09,3.18,2.83,0,,3.12,3.28,True,False
09-02-2026 10:00,HEDEF,62.6,66.7,62.2,66.7,1345564.0,0.0,4.1,0.07,5757.14,4.1,588506.7,128.64,0.0,True,63.57,1.6,2.09,-0.49,2026-02-09,63.1,5.71,2,62.2,62.2,68.6,False,False
09-02-2026 10:00,OSMEN,8.23,8.4,8.23,8.37,324568.0,0.03,0.14,0.02,677.78,0.14,167799.9,93.43,0.21,True,61.51,-0.02,-0.04,0.01,2026-02-09,8.18,2.32,0,,8.11,8.65,True,False
09-02-2026 10:00,HATSN,41.5,42.44,41.02,42.22,2340707.0,0.22,0.72,0.09,682.61,0.72,386489.1,505.63,0.31,True,35.52,-0.34,0.1,-0.44,2026-02-09,44.52,-5.17,2,41.02,41.02,48.36,False,False
09-02-2026 10:00,CATES,41.04,42.16,41.04,41.86,343287.0,0.3,0.82,0.25,225.4,0.82,212159.9,61.81,0.37,True,59.98,-0.14,-0.33,0.19,2026-02-09,41.0,2.1,1,42.16,39.08,42.16,False,False
09-02-2026 10:00,PENGD,8.8,8.91,8.8,8.9,713734.0,0.01,0.1,0.01,614.29,0.1,292760.5,143.79,0.1,True,60.53,-0.0,-0.01,0.01,2026-02-09,8.75,1.71,0,,8.69,9.12,True,True
09-02-2026 10:00,GWIND,26.38,26.84,26.38,26.8,1610149.0,0.04,0.42,0.08,452.63,0.42,663957.5,142.51,0.1,True,54.23,-0.2,-0.22,0.02,2026-02-09,26.24,2.13,0,,25.38,28.26,False,False
09-02-2026 10:00,GOKNR,21.8,22.08,21.8,22.02,1049805.0,0.06,0.22,0.02,1122.22,0.22,463842.1,126.33,0.27,True,55.32,-0.15,-0.22,0.07,2026-02-09,21.64,1.76,0,,21.34,23.48,True,False
09-02-2026 10:00,OTKAR,445.0,458.25,440.75,455.75,934248.0,2.5,10.75,1.9,465.79,10.75,226611.8,312.27,0.23,True,81.77,2.91,0.92,1.99,2026-02-09,438.5,3.93,0,,430.0,ATH,False,False
09-02-2026 10:00,GSRAY,1.17,1.2,1.17,1.2,90896122.0,0.0,0.03,0.01,500.0,0.03,16917043.9,437.3,0.0,True,63.75,-0.0,-0.0,0.0,2026-02-09,1.16,3.45,0,,1.16,1.22,False,False
09-02-2026 10:00,NTHOL,46.64,47.88,46.62,47.8,377375.0,0.08,1.16,0.12,850.82,1.16,104105.1,262.49,0.07,True,70.88,-0.07,-0.19,0.12,2026-02-09,46.3,3.24,0,,46.04,48.68,True,False
09-02-2026 10:00,GSDHO,4.96,5.12,4.95,5.11,2243835.0,0.01,0.15,0.02,782.35,0.15,788218.1,184.67,0.07,True,61.97,-0.03,-0.05,0.02,2026-02-09,4.92,3.86,0,,4.83,5.25,True,False
09-02-2026 10:00,GSDDE,9.92,10.1,9.92,10.08,549025.0,0.02,0.16,0.01,1130.77,0.16,137689.0,298.74,0.12,True,66.09,-0.01,-0.02,0.01,2026-02-09,9.89,1.92,0,,9.78,10.1,False,False
09-02-2026 10:00,INDES,8.37,8.52,8.36,8.48,993753.0,0.04,0.11,0.01,1471.43,0.11,513543.5,93.51,0.36,True,52.83,-0.05,-0.06,0.01,2026-02-09,8.31,2.05,1,8.52,8.24,8.52,True,True
09-02-2026 10:00,NTGAZ,11.24,11.36,11.23,11.34,694165.0,0.02,0.1,0.0,1900.0,0.1,279254.9,148.58,0.2,True,54.24,-0.06,-0.07,0.01,2026-02-09,11.17,1.52,0,,11.07,11.81,True,False
09-02-2026 10:00,BTCIM,4.87,5.02,4.87,4.98,52855118.0,0.04,0.11,0.01,685.71,0.11,11930952.2,343.01,0.36,True,64.47,0.0,-0.01,0.01,2026-02-09,4.83,3.11,1,5.02,4.75,5.02,False,False
09-02-2026 10:00,PETKM,17.92,18.42,17.91,18.41,33372090.0,0.01,0.49,0.05,824.53,0.49,7612817.1,338.37,0.02,True,67.75,-0.07,-0.13,0.06,2026-02-09,17.71,3.95,0,,17.41,18.56,False,False
09-02-2026 10:00,BJKAS,1.56,1.59,1.56,1.59,7526437.0,0.0,0.03,0.01,500.0,0.03,2278158.4,230.37,0.0,True,58.42,-0.01,-0.01,0.0,2026-02-09,1.56,1.92,0,,1.55,1.6,True,False
09-02-2026 10:00,KRDMA,28.66,29.0,28.62,29.0,1171110.0,0.0,0.34,0.04,672.73,0.34,305942.6,282.79,0.0,True,62.72,-0.06,-0.12,0.06,2026-02-09,28.24,2.69,0,,27.9,29.26,False,False
09-02-2026 10:00,BIMAS,690.0,701.0,688.5,700.5,1851957.0,0.5,10.5,1.0,950.0,10.5,554989.8,233.69,0.05,True,68.08,1.78,0.45,1.32,2026-02-09,683.0,2.56,0,,674.0,ATH,False,False
09-02-2026 10:00,BRSAN,691.0,728.5,684.5,718.0,948628.0,10.5,27.0,3.45,682.61,27.0,248862.0,281.19,0.39,True,82.23,11.06,6.88,4.18,2026-02-09,680.0,5.59,0,,647.5,ATH,False,False
09-02-2026 10:00,BSOKE,28.42,29.62,28.3,29.44,2523406.0,0.18,1.02,0.11,862.26,1.02,808274.1,212.2,0.18,True,69.82,0.12,0.02,0.1,2026-02-09,28.2,4.4,0,,27.46,30.14,False,False
09-02-2026 10:00,ISCTR,16.86,17.2,16.63,17.18,253055794.0,0.02,0.32,0.0,6300.0,0.32,63959474.4,295.65,0.06,True,63.43,-0.05,-0.1,0.04,2026-02-09,16.49,4.18,0,,16.27,17.53,False,False
09-02-2026 10:00,MAKIM,16.42,17.04,16.42,16.88,421269.0,0.16,0.46,0.05,820.0,0.46,101079.7,316.77,0.35,True,61.25,-0.02,-0.05,0.03,2026-02-09,16.4,2.93,1,17.04,16.19,17.04,False,False
09-02-2026 10:00,ADEL,35.48,37.48,35.24,36.94,1663414.0,0.54,1.46,0.27,448.87,1.46,585793.4,183.96,0.37,True,80.54,0.39,0.16,0.23,2026-02-09,35.08,5.3,0,,33.9,ATH,False,False
09-02-2026 10:00,BERA,19.75,21.38,19.75,21.34,15483217.0,0.04,1.59,0.28,476.09,1.59,6266396.5,147.08,0.03,True,84.67,0.47,0.26,0.21,2026-02-09,19.7,8.32,0,,18.08,ATH,False,False
09-02-2026 10:00,IHLAS,2.3,2.31,2.29,2.31,19574960.0,0.0,0.01,0.0,400.0,0.01,7162162.6,173.31,0.0,True,54.45,-0.01,-0.01,0.0,2026-02-09,2.28,1.32,0,,2.27,2.4,True,True
09-02-2026 10:00,IHGZT,1.55,1.57,1.55,1.57,3394077.0,0.0,0.02,0.0,400.0,0.02,1119146.6,203.27,0.0,True,54.45,-0.01,-0.01,0.0,2026-02-09,1.54,1.95,0,,1.53,1.63,True,True
09-02-2026 10:00,MARTI,2.76,2.82,2.76,2.81,7305808.0,0.01,0.05,0.01,525.0,0.05,2252780.3,224.3,0.2,True,58.57,-0.02,-0.03,0.01,2026-02-09,2.74,2.55,0,,2.7,2.93,True,False
09-02-2026 10:00,MAVI,46.62,48.0,46.62,47.96,1829839.0,0.04,1.34,0.08,1575.0,1.34,573117.5,219.28,0.03,True,61.09,-0.27,-0.32,0.05,2026-02-09,46.6,2.92,0,,46.0,48.64,False,False
09-02-2026 10:00,MERIT,16.85,17.46,16.83,17.42,2757655.0,0.04,0.57,0.07,714.29,0.57,422463.0,552.76,0.07,True,75.45,0.06,0.0,0.06,2026-02-09,16.72,4.19,0,,16.52,ATH,False,False
09-02-2026 10:00,MNDRS,14.67,14.91,14.53,14.9,524749.0,0.01,0.23,0.03,693.1,0.23,272606.2,92.49,0.04,True,61.59,-0.09,-0.13,0.05,2026-02-09,14.46,3.04,0,,14.02,15.36,False,False
09-02-2026 10:00,MNDTR,6.64,6.76,6.62,6.74,532459.0,0.02,0.1,0.01,900.0,0.1,240347.4,121.54,0.2,True,51.46,-0.07,-0.08,0.01,2026-02-09,6.61,1.97,1,6.76,6.53,6.76,True,True
09-02-2026 10:00,HUNER,3.29,3.35,3.29,3.34,5631670.0,0.01,0.05,0.01,614.29,0.05,1587650.5,254.72,0.2,True,61.88,-0.01,-0.01,0.01,2026-02-09,3.26,2.45,0,,3.22,3.43,True,False
09-02-2026 10:00,PENTA,14.08,14.25,14.06,14.22,341991.0,0.03,0.14,0.02,508.7,0.14,138663.1,146.63,0.21,True,59.21,-0.06,-0.1,0.03,2026-02-09,13.99,1.64,0,,13.85,14.61,True,False
09-02-2026 10:00,CEMTS,12.15,12.46,12.15,12.45,1499918.0,0.01,0.3,0.02,1100.0,0.3,444469.2,237.46,0.03,True,59.95,-0.06,-0.07,0.01,2026-02-09,12.12,2.72,0,,12.0,12.6,False,False
09-02-2026 10:00,KARSN,10.07,10.2,10.07,10.19,3741201.0,0.01,0.12,0.02,605.88,0.12,1337705.8,179.67,0.08,True,61.82,-0.01,-0.02,0.01,2026-02-09,10.02,1.7,0,,9.88,10.29,False,False
09-02-2026 10:00,VESBE,8.23,8.35,8.23,8.35,1559608.0,0.0,0.12,0.01,1900.0,0.12,963563.9,61.86,0.0,True,58.66,-0.03,-0.04,0.01,2026-02-09,8.18,2.08,0,,8.04,8.6,False,False
09-02-2026 10:00,EDIP,36.9,37.5,36.9,37.34,270671.0,0.16,0.44,0.1,331.37,0.44,106202.1,154.86,0.36,True,60.77,-0.05,-0.13,0.09,2026-02-09,36.66,1.85,0,,36.04,38.66,False,False
09-02-2026 10:00,EKSUN,5.7,5.81,5.7,5.78,807225.0,0.03,0.08,0.01,700.0,0.08,533775.3,51.23,0.37,True,52.22,-0.04,-0.05,0.01,2026-02-09,5.68,1.76,1,5.81,5.59,5.81,True,False
09-02-2026 10:00,AHSGY,24.3,25.02,24.3,24.92,163545.0,0.1,0.62,0.07,761.11,0.62,86889.5,88.22,0.16,True,59.94,0.1,0.13,-0.02,2026-02-09,24.2,2.98,0,,24.02,25.32,False,False
09-02-2026 10:00,ULKER,132.5,135.6,132.5,135.2,1499482.0,0.4,2.7,0.19,1321.05,2.7,705438.1,112.56,0.15,True,59.45,-0.77,-0.99,0.22,2026-02-09,131.2,3.05,0,,129.8,137.0,True,False
09-02-2026 10:00,AKBNK,84.8,86.2,84.75,85.95,31427775.0,0.25,1.15,0.03,3185.71,1.15,10663628.8,194.72,0.22,True,58.01,-0.57,-0.85,0.28,2026-02-09,83.85,2.5,0,,82.9,93.35,True,False
09-02-2026 10:00,TUREX,7.44,7.56,7.43,7.56,6382484.0,0.0,0.12,0.02,650.0,0.12,1581258.7,303.63,0.0,True,64.59,-0.03,-0.04,0.02,2026-02-09,7.37,2.58,0,,7.29,7.72,True,False
09-02-2026 10:00,ENKAI,95.0,97.25,94.85,97.15,2681680.0,0.1,2.15,0.24,814.89,2.15,999256.9,168.37,0.05,True,61.81,-0.3,-0.42,0.12,2026-02-09,94.5,2.8,0,,93.3,97.9,False,False
09-02-2026 10:00,TUPRS,221.4,223.0,218.9,222.9,7929104.0,0.1,1.5,0.05,2900.0,1.5,2445090.3,224.29,0.07,True,36.03,-2.24,-2.08,-0.16,2026-02-09,223.0,-0.04,2,218.9,218.9,237.7,False,False
09-02-2026 10:00,TUKAS,2.84,2.88,2.84,2.87,22545948.0,0.01,0.03,0.0,1400.0,0.03,12355208.2,82.48,0.33,True,49.36,-0.03,-0.03,0.0,2026-02-09,2.82,1.77,0,,2.8,3.02,True,True
09-02-2026 10:00,BOSSA,6.87,7.0,6.87,6.98,578186.0,0.02,0.11,0.03,307.41,0.11,222384.5,159.99,0.18,True,60.0,-0.03,-0.04,0.02,2026-02-09,6.84,2.05,0,,6.71,7.21,False,False
09-02-2026 10:00,YIGIT,24.88,25.26,24.82,25.16,406965.0,0.1,0.28,0.03,976.92,0.28,257216.2,58.22,0.36,True,52.88,-0.14,-0.17,0.02,2026-02-09,24.7,1.86,0,,24.48,25.96,True,False
09-02-2026 10:00,YKBNK,38.8,39.28,38.6,39.26,56371887.0,0.02,0.46,0.06,618.75,0.46,20831008.4,170.62,0.04,True,60.34,-0.25,-0.41,0.16,2026-02-09,38.26,2.61,0,,37.88,41.26,True,False
09-02-2026 10:00,TNZTP,24.68,26.5,24.62,26.28,3505969.0,0.22,1.6,0.09,1639.13,1.6,741285.1,372.96,0.14,True,61.9,-0.36,-0.51,0.16,2026-02-09,24.58,6.92,1,26.5,24.18,26.5,True,True
09-02-2026 10:00,YYLGD,13.63,14.14,13.63,14.01,8044246.0,0.13,0.38,0.09,308.6,0.38,3439557.5,133.87,0.34,True,75.71,0.14,0.03,0.11,2026-02-09,13.54,3.47,0,,12.66,ATH,False,False
09-02-2026 10:00,TATGD,14.11,14.32,14.11,14.3,315463.0,0.02,0.19,0.01,1257.14,0.19,102275.4,208.44,0.11,True,57.88,-0.06,-0.07,0.01,2026-02-09,14.01,2.07,0,,13.85,14.84,True,True
09-02-2026 10:00,EUREN,5.11,5.18,5.11,5.18,11033769.0,0.0,0.07,0.01,677.78,0.07,3938176.4,180.17,0.0,True,63.13,-0.01,-0.02,0.01,2026-02-09,5.06,2.37,0,,5.01,5.31,True,True
09-02-2026 10:00,SARKY,42.3,43.92,41.62,43.88,14853355.0,0.04,1.58,0.21,652.38,1.58,4625307.2,221.13,0.03,True,58.36,-0.57,-0.95,0.38,2026-02-09,40.86,7.39,0,,39.34,50.55,True,False
09-02-2026 10:00,CEOEM,21.76,22.08,21.74,22.08,219206.0,0.0,0.32,0.03,1042.86,0.32,65033.6,237.07,0.0,True,58.93,-0.1,-0.15,0.05,2026-02-09,21.6,2.22,0,,21.52,23.48,True,False
09-02-2026 10:00,PLTUR,21.9,22.18,21.76,22.12,774681.0,0.06,0.22,0.01,3566.67,0.22,315002.7,145.93,0.27,True,61.59,0.05,0.04,0.01,2026-02-09,21.62,2.31,0,,21.46,22.7,False,False
09-02-2026 10:00,CONSE,3.36,3.54,3.31,3.53,11514166.0,0.01,0.17,0.03,448.39,0.17,1960310.2,487.36,0.06,True,80.76,0.03,-0.0,0.03,2026-02-09,3.3,6.97,0,,3.14,ATH,False,False
09-02-2026 10:00,GEDIK,5.92,6.01,5.92,5.99,825476.0,0.02,0.07,0.01,536.36,0.07,349988.4,135.86,0.29,True,55.67,-0.03,-0.03,0.01,2026-02-09,5.9,1.53,0,,5.82,6.19,False,False
09-02-2026 10:00,PRKME,20.5,21.04,20.5,20.98,1412581.0,0.06,0.48,0.07,566.67,0.48,576545.5,145.01,0.12,True,52.91,-0.23,-0.31,0.08,2026-02-09,20.42,2.74,0,,20.18,23.04,True,False
09-02-2026 10:00,SANFM,7.3,7.6,7.3,7.53,2270884.0,0.07,0.23,0.03,641.94,0.23,576696.1,293.77,0.3,True,62.25,-0.02,-0.04,0.02,2026-02-09,7.24,4.01,0,,7.11,7.54,False,False
09-02-2026 10:00,ANHYT,116.6,117.9,115.6,117.8,187447.0,0.1,1.2,0.08,1400.0,1.2,93647.5,100.16,0.08,True,53.41,-0.84,-1.01,0.17,2026-02-09,115.4,2.08,0,,114.2,122.0,True,True
09-02-2026 10:00,FORTE,88.0,89.45,87.8,89.2,353964.0,0.25,1.2,0.09,1233.33,1.2,117626.6,200.92,0.21,True,50.5,-0.86,-1.04,0.19,2026-02-09,87.05,2.47,0,,87.05,93.6,True,True
09-02-2026 10:00,ALBRK,8.94,9.09,8.9,9.06,6940210.0,0.03,0.12,0.01,900.0,0.12,2088117.8,232.37,0.25,True,64.41,-0.03,-0.06,0.03,2026-02-09,8.82,2.72,0,,8.71,9.3,True,False
09-02-2026 10:00,AEFES,20.42,20.7,20.38,20.64,15562823.0,0.06,0.22,0.03,609.68,0.22,6404312.8,143.01,0.27,True,68.16,0.08,0.05,0.03,2026-02-09,20.18,2.28,1,20.7,19.71,20.7,False,False
09-02-2026 10:00,FADE,15.78,16.23,15.76,16.17,553273.0,0.06,0.39,0.07,441.67,0.39,131526.0,320.66,0.15,True,70.47,0.04,-0.0,0.04,2026-02-09,15.71,2.93,0,,15.37,ATH,False,False
06-02-2026 17:00,KOPOL,5.78,5.98,5.77,5.98,1956920.0,0.0,0.2,0.01,2400.0,0.2,572077.5,242.07,0.0,True,61.16,-0.02,-0.01,-0.0,2026-02-06,5.9,1.36,2,5.77,5.77,6.11,False,False
06-02-2026 17:00,KCAER,10.86,11.03,10.84,11.0,2894993.0,0.03,0.14,0.0,4566.67,0.14,1200540.0,141.14,0.21,True,42.94,-0.12,-0.12,0.0,2026-02-06,10.97,0.27,0,,10.8,11.52,True,True
06-02-2026 17:00,KCHOL,202.1,206.2,202.0,205.1,6377980.0,1.1,3.0,0.08,3650.0,3.0,2338568.3,172.73,0.37,True,49.81,-1.1,-0.98,-0.12,2026-02-06,204.5,0.29,0,,201.6,211.7,False,False
06-02-2026 17:00,YAYLA,27.84,28.9,27.76,28.9,149101.0,0.0,1.06,0.06,1666.67,1.06,77898.6,91.4,0.0,True,59.96,-0.2,-0.23,0.03,2026-02-06,28.06,2.99,1,28.9,28.46,29.76,True,True
06-02-2026 17:00,LILAK,32.64,33.34,32.48,33.2,1599568.0,0.14,0.56,0.07,677.78,0.56,713174.2,124.29,0.25,True,60.15,0.05,0.03,0.02,2026-02-06,32.56,1.97,0,,32.04,33.52,False,False
06-02-2026 17:00,PGSUS,201.7,207.7,201.6,206.8,11466628.0,0.9,5.1,0.17,2900.0,5.1,3335707.7,243.75,0.18,True,58.01,-0.77,-0.61,-0.16,2026-02-06,205.2,0.78,0,,200.9,211.4,True,True
06-02-2026 17:00,VAKFN,2.03,2.05,2.01,2.05,13941472.0,0.0,0.02,0.0,900.0,0.02,6780356.1,105.62,0.0,True,48.16,-0.01,-0.01,-0.0,2026-02-06,2.04,0.49,2,2.01,2.01,2.11,True,True
06-02-2026 17:00,UNLU,16.64,16.99,16.61,16.91,469245.0,0.08,0.27,0.02,1127.27,0.27,170084.0,175.89,0.3,True,58.51,-0.02,-0.04,0.02,2026-02-06,16.66,1.5,0,,16.31,16.93,False,False
06-02-2026 17:00,ULUUN,7.18,7.34,7.18,7.33,889331.0,0.01,0.15,0.01,1400.0,0.15,417940.5,112.79,0.07,True,54.2,-0.04,-0.04,0.0,2026-02-06,7.26,0.96,0,,7.1,7.5,False,False
06-02-2026 17:00,MPARK,443.75,452.25,443.5,451.0,140733.0,1.25,7.25,0.48,1426.32,7.25,50790.4,177.09,0.17,True,53.61,-1.16,-1.37,0.21,2026-02-06,451.25,-0.06,0,,442.25,456.5,False,False
06-02-2026 17:00,AKCNS,192.8,195.7,192.7,195.6,187805.0,0.1,2.8,0.11,2445.45,2.8,79044.0,137.6,0.04,True,57.24,0.22,0.21,0.01,2026-02-06,194.7,0.46,0,,191.0,197.3,False,False
06-02-2026 17:00,THYAO,314.25,324.5,314.0,322.0,25331401.0,2.5,7.75,0.52,1376.19,7.75,6764876.0,274.45,0.32,True,64.16,0.23,0.47,-0.24,2026-02-06,317.0,1.58,0,,311.75,322.75,False,False
06-02-2026 17:00,TAVHL,352.5,363.25,352.5,361.75,599169.0,1.5,9.25,0.9,927.78,9.25,255536.5,134.47,0.16,True,64.46,0.68,0.53,0.14,2026-02-06,353.25,2.41,0,,350.5,ATH,False,False
06-02-2026 17:00,ALARK,109.4,111.7,109.2,111.4,1559504.0,0.3,2.0,0.04,4900.0,2.0,844953.3,84.57,0.15,True,56.25,0.03,0.28,-0.25,2026-02-06,110.9,0.45,0,,109.0,114.3,False,False
06-02-2026 17:00,SOKE,12.82,13.04,12.72,13.04,1218450.0,0.0,0.22,0.01,1592.31,0.22,296587.5,310.82,0.0,True,59.62,-0.02,-0.02,0.0,2026-02-06,12.95,0.69,0,,12.66,13.44,False,False
06-02-2026 17:00,SAHOL,101.8,104.1,101.7,103.6,10451009.0,0.5,1.8,0.07,2471.43,1.8,3102666.3,236.84,0.28,True,42.36,-1.35,-1.38,0.03,2026-02-06,103.7,-0.1,2,101.7,101.7,110.8,True,True
06-02-2026 17:00,MOBTL,10.18,10.48,10.14,10.42,2416699.0,0.06,0.24,0.03,700.0,0.24,842017.4,187.01,0.25,True,63.85,0.01,-0.01,0.02,2026-02-06,10.13,2.86,0,,10.03,10.59,False,False
06-02-2026 17:00,DOHOL,20.3,20.7,20.24,20.7,2721964.0,0.0,0.4,0.02,1718.18,0.4,937305.3,190.4,0.0,True,44.99,-0.28,-0.27,-0.0,2026-02-06,20.54,0.78,0,,20.16,21.84,True,True
06-02-2026 17:00,INFO,4.12,4.18,4.1,4.17,5189719.0,0.01,0.05,0.0,4900.0,0.05,2464408.3,110.59,0.2,True,41.87,-0.06,-0.06,0.0,2026-02-06,4.15,0.48,2,4.1,4.1,4.48,True,True
06-02-2026 17:00,GUBRF,510.0,518.5,507.5,517.0,535037.0,1.5,7.0,0.85,723.53,7.0,205520.8,160.33,0.21,True,60.1,0.61,0.99,-0.39,2026-02-06,504.0,2.58,0,,502.0,527.0,False,False
06-02-2026 17:00,EGPRO,24.88,25.28,24.88,25.22,126638.0,0.06,0.34,0.01,3300.0,0.34,68710.6,84.31,0.18,True,45.85,-0.18,-0.18,0.0,2026-02-06,25.2,0.08,0,,24.8,26.14,True,True
06-02-2026 17:00,EMKEL,20.82,22.04,20.76,22.04,9242499.0,0.0,1.22,0.2,513.07,1.22,3030555.5,204.98,0.0,True,79.72,0.07,-0.11,0.18,2026-02-06,20.04,9.98,0,,19.49,ATH,False,False
06-02-2026 17:00,DOAS,225.9,230.5,225.8,230.4,734629.0,0.1,4.5,0.45,900.0,4.5,269550.9,172.54,0.02,True,63.89,0.26,0.07,0.19,2026-02-06,226.3,1.81,0,,224.0,230.7,False,False
06-02-2026 17:00,KATMR,2.81,2.85,2.8,2.84,16386090.0,0.01,0.03,0.0,1400.0,0.03,6004034.2,172.92,0.33,True,42.88,-0.02,-0.02,0.0,2026-02-06,2.82,0.71,2,2.8,2.8,2.93,True,True
06-02-2026 17:00,DURDO,3.66,3.69,3.65,3.69,1060628.0,0.0,0.03,0.0,2900.0,0.03,434113.5,144.32,0.0,True,38.97,-0.03,-0.04,0.0,2026-02-06,3.7,-0.27,2,3.65,3.65,3.88,True,True
06-02-2026 17:00,GARFA,28.26,28.6,28.2,28.52,116815.0,0.08,0.26,0.01,4233.33,0.26,70881.3,64.8,0.31,True,39.39,-0.42,-0.43,0.01,2026-02-06,28.66,-0.49,0,,28.02,32.04,True,True
06-02-2026 16:00,AVOD,4.74,5.11,4.71,5.11,38414882.0,0.0,0.37,0.05,687.23,0.37,5419768.8,608.79,0.0,True,74.75,-0.02,-0.07,0.04,2026-02-06,4.65,9.89,0,,4.6,5.63,True,False
06-02-2026 16:00,GLCVY,71.75,74.95,71.65,74.7,573668.0,0.25,2.95,0.4,628.4,2.95,159488.0,259.69,0.08,True,70.93,0.18,-0.2,0.37,2026-02-06,70.25,6.33,0,,70.0,77.35,False,False
06-02-2026 16:00,IZMDC,7.53,7.64,7.5,7.64,1802818.0,0.0,0.11,0.0,5400.0,0.11,831347.0,116.86,0.0,True,48.88,-0.03,-0.02,-0.01,2026-02-06,7.67,-0.39,0,,7.45,7.95,False,False
06-02-2026 15:00,ZEDUR,8.13,8.41,8.12,8.35,723279.0,0.06,0.22,0.01,2100.0,0.22,221059.3,227.19,0.27,True,54.16,-0.05,-0.05,-0.0,2026-02-06,8.23,1.46,2,8.12,8.12,8.62,True,True
06-02-2026 15:00,TEKTU,8.41,9.15,8.39,9.08,23874795.0,0.07,0.67,0.07,885.29,0.67,3099353.7,670.32,0.1,True,74.22,-0.03,-0.09,0.06,2026-02-06,8.32,9.13,0,,8.32,10.66,True,False
06-02-2026 14:00,TATEN,10.25,10.54,10.2,10.5,3652561.0,0.04,0.25,0.02,1462.5,0.25,1334869.9,173.63,0.16,True,50.53,-0.17,-0.2,0.04,2026-02-06,10.16,3.35,0,,10.08,11.99,True,True
06-02-2026 14:00,ARSAN,4.3,4.47,4.29,4.46,15193275.0,0.01,0.16,0.02,566.67,0.16,8881838.0,71.06,0.06,True,60.87,-0.04,-0.08,0.03,2026-02-06,4.07,9.58,0,,3.92,4.7,False,False
06-02-2026 13:00,TRCAS,50.05,51.0,50.0,50.85,281850.0,0.15,0.8,0.01,7900.0,0.8,171241.5,64.59,0.19,True,53.02,0.24,0.46,-0.22,2026-02-06,50.95,-0.2,0,,49.94,52.9,False,False
06-02-2026 13:00,EGEGY,32.94,33.54,32.68,33.4,339199.0,0.14,0.46,0.08,447.62,0.46,193458.9,75.33,0.3,True,62.29,0.24,0.22,0.02,2026-02-06,32.96,1.33,1,33.54,30.72,33.54,False,False
06-02-2026 13:00,GLRYH,4.69,4.76,4.69,4.75,3412067.0,0.01,0.06,0.01,650.0,0.06,1698491.6,100.89,0.17,True,65.29,0.04,0.05,-0.0,2026-02-06,4.67,1.71,1,4.76,4.5,4.76,False,False
06-02-2026 13:00,ALVES,3.98,4.15,3.93,4.15,54028370.0,0.0,0.17,0.01,1114.29,0.17,29077237.6,85.81,0.0,True,55.82,-0.06,-0.07,0.01,2026-02-06,3.92,5.87,0,,3.79,4.59,True,True
06-02-2026 13:00,BORLS,2.6,2.73,2.59,2.7,14512134.0,0.03,0.1,0.01,1150.0,0.1,5270218.6,175.36,0.3,True,57.63,-0.02,-0.02,0.0,2026-02-06,2.62,3.05,2,2.59,2.59,2.74,True,True
06-02-2026 13:00,SEGYO,4.57,4.77,4.55,4.75,2781000.0,0.02,0.18,0.02,1025.0,0.18,754698.8,268.49,0.11,True,67.55,0.01,0.01,-0.0,2026-02-06,4.52,5.09,0,,4.51,5.03,False,False
06-02-2026 13:00,IZFAS,55.5,56.15,55.4,56.05,755011.0,0.1,0.55,0.09,547.06,0.55,457059.6,65.19,0.18,True,61.79,0.12,0.11,0.01,2026-02-06,55.4,1.17,0,,54.75,58.0,False,False
06-02-2026 13:00,SILVR,2.82,2.9,2.82,2.88,354326.0,0.02,0.06,0.0,1900.0,0.06,204277.1,73.45,0.33,True,50.88,-0.01,-0.01,-0.0,2026-02-06,2.88,0.0,0,,2.8,2.92,False,False
06-02-2026 12:00,ARMGD,87.55,90.9,87.55,90.05,758815.0,0.85,2.5,0.38,566.67,2.5,185816.4,308.37,0.34,True,76.98,1.09,0.78,0.3,2026-02-06,85.65,5.14,0,,84.65,ATH,False,False
06-02-2026 12:00,ENSRI,26.02,27.2,26.0,27.16,1660479.0,0.04,1.14,0.13,750.75,1.14,328372.3,405.67,0.04,True,69.92,0.37,0.29,0.08,2026-02-06,25.4,6.93,0,,25.4,ATH,False,False
06-02-2026 12:00,SAFKR,28.44,29.32,28.38,29.08,2313945.0,0.24,0.64,0.1,540.0,0.64,943621.2,145.22,0.38,True,64.44,0.06,-0.05,0.11,2026-02-06,27.72,4.91,0,,27.5,30.04,False,False
06-02-2026 11:00,HUBVC,3.38,3.64,3.37,3.58,1766549.0,0.06,0.2,0.02,852.38,0.2,533879.4,230.89,0.3,True,65.82,0.0,0.01,-0.0,2026-02-06,3.32,7.83,0,,3.29,ATH,False,False
06-02-2026 11:00,SMRVA,66.8,68.45,66.6,68.3,1183971.0,0.15,1.5,0.05,2900.0,1.5,424086.8,179.18,0.1,True,51.04,-0.58,-0.55,-0.03,2026-02-06,66.65,2.48,0,,67.05,70.95,True,True
06-02-2026 11:00,KONKA,15.35,15.5,15.32,15.49,386765.0,0.01,0.14,0.0,4566.67,0.14,229733.1,68.35,0.07,True,52.4,-0.02,-0.01,-0.01,2026-02-06,15.42,0.45,0,,15.19,15.8,False,False
06-02-2026 11:00,PRDGS,6.75,6.89,6.75,6.87,1371073.0,0.02,0.12,0.02,700.0,0.12,611016.0,124.39,0.17,True,61.66,0.03,0.03,0.0,2026-02-06,6.7,2.54,0,,6.6,7.0,False,False
06-02-2026 11:00,VBTYZ,19.33,20.1,19.33,20.02,1094295.0,0.08,0.69,0.09,626.32,0.69,599074.1,82.66,0.12,True,64.61,0.29,0.28,0.01,2026-02-06,19.27,3.89,0,,18.99,ATH,False,False
06-02-2026 11:00,OZYSR,48.62,50.55,48.5,50.4,429466.0,0.15,1.78,0.04,4710.81,1.78,162388.8,164.47,0.08,True,68.17,0.79,0.85,-0.06,2026-02-06,49.26,2.31,0,,46.98,50.45,False,False
06-02-2026 10:00,TDGYO,23.14,27.3,23.14,27.22,2753963.0,0.08,4.08,0.41,900.0,4.08,340509.6,708.78,0.02,True,47.63,-1.4,-1.48,0.08,2026-02-06,25.7,5.91,2,23.14,23.14,32.82,True,True
06-02-2026 10:00,MEKAG,4.89,5.14,4.82,5.1,9435676.0,0.04,0.21,0.02,1135.29,0.21,2665708.9,253.96,0.19,True,66.94,0.05,0.04,0.01,2026-02-06,4.93,3.45,1,5.14,4.67,5.14,False,False
06-02-2026 10:00,PNSUT,12.58,13.5,12.5,13.28,3936183.0,0.22,0.7,0.04,1566.67,0.7,764201.4,415.07,0.31,True,56.27,-0.16,-0.16,-0.0,2026-02-06,12.64,5.06,3,,13.01,14.25,True,True
06-02-2026 10:00,GENIL,118.7,121.5,118.2,120.7,469480.0,0.8,2.0,0.33,506.06,2.0,232063.4,102.31,0.4,True,53.66,-0.53,-0.83,0.3,2026-02-06,118.7,1.68,0,,116.6,126.0,False,False
06-02-2026 10:00,RUBNS,28.9,30.8,28.88,30.58,1341645.0,0.22,1.68,0.16,924.39,1.68,596982.4,124.74,0.13,True,57.54,-0.3,-0.58,0.29,2026-02-06,29.4,4.01,0,,26.56,30.6,False,False
06-02-2026 10:00,LIDFA,2.97,3.12,2.92,3.09,6542067.0,0.03,0.12,0.01,900.0,0.12,2752770.9,137.65,0.25,True,58.94,-0.02,-0.03,0.01,2026-02-06,2.93,5.46,0,,2.87,3.41,False,False
05-02-2026 17:00,IEYHO,77.35,79.7,77.1,79.55,9926372.0,0.15,2.2,0.29,658.62,2.2,2712050.2,266.01,0.07,True,82.59,0.33,0.19,0.14,2026-02-05,76.6,3.85,1,79.7,75.0,79.7,False,False
05-02-2026 17:00,EDATA,9.05,9.28,9.04,9.28,2702796.0,0.0,0.23,0.02,1252.94,0.23,1042824.4,159.18,0.0,True,55.61,0.0,0.0,0.0,2026-02-05,9.2,0.87,0,,9.01,9.39,False,False
05-02-2026 17:00,ARTMS,36.18,39.54,35.98,39.54,1343280.0,0.0,3.36,0.36,828.18,3.36,215654.8,522.88,0.0,True,81.2,0.08,-0.21,0.29,2026-02-05,35.96,9.96,0,,35.7,ATH,True,False
05-02-2026 17:00,BMSTL,102.0,112.0,101.9,109.6,2760505.0,2.4,7.6,0.72,955.56,7.6,381319.3,623.94,0.32,True,81.27,0.66,0.3,0.36,2026-02-05,102.5,6.93,0,,101.3,ATH,False,False
05-02-2026 16:00,HKTM,12.2,13.6,12.16,13.6,4939043.0,0.0,1.4,0.14,892.91,1.4,841942.7,486.62,0.0,True,83.11,0.18,0.11,0.07,2026-02-05,12.37,9.94,0,,11.51,ATH,False,False
05-02-2026 16:00,KLSER,28.12,29.28,28.1,29.16,1914817.0,0.12,1.04,0.12,796.55,1.04,298656.6,541.14,0.12,True,76.26,0.1,0.02,0.08,2026-02-05,27.94,4.37,0,,27.82,ATH,False,False
05-02-2026 15:00,DEVA,73.75,74.9,73.65,74.8,372955.0,0.1,1.05,0.22,377.27,1.05,148985.0,150.33,0.1,True,86.31,1.18,1.1,0.08,2026-02-05,72.5,3.17,0,,65.65,ATH,False,False
05-02-2026 14:00,AKENR,11.14,11.4,11.12,11.35,3735203.0,0.05,0.21,0.02,950.0,0.21,1054360.9,254.26,0.24,True,65.14,0.04,0.03,0.01,2026-02-05,11.11,2.16,1,11.4,10.75,11.4,False,False
05-02-2026 13:00,ARDYZ,47.08,48.54,46.82,48.44,1097522.0,0.1,1.36,0.22,523.85,1.36,527878.0,107.91,0.07,True,66.71,0.26,0.1,0.15,2026-02-05,46.1,5.08,0,,46.0,48.5,False,False
05-02-2026 13:00,VRGYO,2.44,2.5,2.43,2.49,9531506.0,0.01,0.05,0.0,2400.0,0.05,3062634.0,211.22,0.2,True,62.99,-0.0,-0.01,0.0,2026-02-05,2.43,2.47,1,2.5,2.41,2.5,False,False
05-02-2026 12:00,PETUN,13.0,13.24,13.0,13.2,408387.0,0.04,0.2,0.03,566.67,0.2,227920.4,79.18,0.2,True,61.08,0.02,0.02,0.01,2026-02-05,13.06,1.07,0,,12.74,13.61,False,False
05-02-2026 12:00,MHRGY,3.68,3.93,3.67,3.9,6598056.0,0.03,0.22,0.03,714.81,0.22,1535195.1,329.79,0.14,True,80.05,0.06,0.04,0.02,2026-02-05,3.6,8.33,1,3.93,3.48,3.93,False,False
05-02-2026 12:00,BAHKM,119.9,125.9,119.9,125.0,996715.0,0.9,5.1,0.82,521.95,5.1,363197.5,174.43,0.18,True,79.28,4.74,4.36,0.38,2026-02-05,118.7,5.31,0,,113.0,ATH,False,False
05-02-2026 12:00,FRIGO,8.17,8.52,8.17,8.44,6939081.0,0.08,0.27,0.04,542.86,0.27,2552170.1,171.89,0.3,True,72.02,0.05,0.01,0.04,2026-02-05,8.08,4.46,0,,7.71,ATH,False,False
05-02-2026 12:00,DOFER,33.06,34.26,33.0,34.02,1143291.0,0.24,0.96,0.08,1042.86,0.96,341904.8,234.39,0.25,True,56.03,-0.24,-0.31,0.07,2026-02-05,32.9,3.4,1,34.26,32.52,34.26,True,True
05-02-2026 11:00,SUNTK,40.54,41.46,40.48,41.34,277530.0,0.12,0.8,0.07,1112.12,0.8,119860.4,131.54,0.15,True,58.77,-0.06,-0.09,0.03,2026-02-05,40.46,2.17,0,,40.08,41.86,True,True
05-02-2026 11:00,EFOR,21.02,22.22,21.02,21.98,6407067.0,0.24,0.96,0.11,772.73,0.96,2174027.7,194.71,0.25,True,62.97,-0.28,-0.43,0.15,2026-02-05,20.4,7.75,0,,20.16,22.66,True,False
05-02-2026 11:00,MARBL,13.68,13.94,13.68,13.87,676103.0,0.07,0.19,0.0,3700.0,0.19,357345.0,89.2,0.37,True,48.03,-0.09,-0.1,0.01,2026-02-05,13.72,1.09,0,,13.5,14.19,False,False
05-02-2026 10:00,CEMAS,5.58,6.1,5.49,6.1,57198600.0,0.0,0.52,0.05,961.22,0.52,12065839.3,374.05,0.0,True,60.05,-0.06,-0.06,-0.0,2026-02-05,5.55,9.91,1,6.1,5.47,6.72,False,False
05-02-2026 10:00,AVGYO,11.89,13.06,11.85,13.06,3058135.0,0.0,1.17,0.13,793.13,1.17,425544.9,618.64,0.0,True,83.21,0.21,0.14,0.07,2026-02-05,11.88,9.93,1,13.06,11.61,ATH,False,False
05-02-2026 10:00,BAYRK,4.55,4.96,4.51,4.9,21547586.0,0.06,0.35,0.02,1421.74,0.35,2932094.0,634.89,0.17,True,71.87,-0.01,-0.03,0.02,2026-02-05,4.51,8.65,3,,4.51,5.0,True,True
05-02-2026 10:00,ARCLK,120.5,121.4,119.3,121.3,1074890.0,0.1,0.8,0.05,1500.0,0.8,639598.1,68.06,0.13,True,66.25,1.43,1.5,-0.07,2026-02-05,120.5,0.66,2,119.3,119.3,ATH,False,False
05-02-2026 10:00,SISE,46.18,48.04,45.88,47.52,46816233.0,0.52,1.34,0.07,1710.81,1.34,11771899.2,297.69,0.39,True,67.1,0.32,0.33,-0.0,2026-02-05,46.34,2.55,2,45.88,45.88,48.16,False,False
05-02-2026 10:00,KLRHO,660.0,688.0,660.0,686.0,816182.0,2.0,26.0,5.55,368.47,26.0,297486.9,174.36,0.08,True,79.71,21.12,16.78,4.33,2026-02-05,658.5,4.18,0,,538.0,ATH,False,False
05-02-2026 10:00,XU100,13854.83,13955.77,13804.27,13955.74,1832916584.0,0.03,100.91,4.54,2122.2,100.91,824891132.9,122.2,0.0,True,61.01,47.1,51.27,-4.18,2026-02-05,13891.21,0.46,0,,13393.8,13998.18,False,False
05-02-2026 10:00,AGHOL,35.12,35.38,34.98,35.32,1409125.0,0.06,0.2,0.04,376.19,0.2,594968.9,136.84,0.3,True,57.99,0.16,0.17,-0.02,2026-02-05,35.02,0.86,0,,34.74,35.52,False,False
05-02-2026 10:00,KRDMB,32.96,34.44,32.96,34.06,738616.0,0.38,1.1,0.07,1427.78,1.1,263835.2,179.95,0.35,True,58.8,0.15,0.26,-0.11,2026-02-05,33.6,1.37,1,34.44,32.94,34.44,False,False
05-02-2026 10:00,INVEO,9.22,9.49,9.11,9.46,2695624.0,0.03,0.24,0.02,1100.0,0.24,1079405.2,149.73,0.12,True,62.6,0.06,0.06,-0.0,2026-02-05,9.25,2.27,0,,9.08,9.65,False,False
05-02-2026 10:00,TTKOM,68.1,69.45,67.55,69.3,7103481.0,0.15,1.2,0.21,485.37,1.2,2598581.8,173.36,0.13,True,63.25,0.71,0.7,0.01,2026-02-05,68.6,1.02,0,,63.35,ATH,False,False
05-02-2026 10:00,MEGMT,67.45,69.4,66.65,68.85,4786820.0,0.55,1.4,0.02,6900.0,1.4,1914533.7,150.03,0.39,True,63.31,0.42,0.24,0.18,2026-02-05,67.5,2.0,0,,65.5,69.05,False,False
05-02-2026 10:00,TOASO,323.25,329.5,322.75,329.0,1246507.0,0.5,5.75,0.85,576.47,5.75,398114.0,213.1,0.09,True,61.24,0.89,0.81,0.08,2026-02-05,325.0,1.23,0,,321.75,ATH,False,False
05-02-2026 10:00,FORMT,3.49,3.74,3.47,3.71,128045487.0,0.03,0.22,0.04,411.63,0.22,39658250.5,222.87,0.14,True,75.81,0.11,0.08,0.03,2026-02-05,3.48,6.61,0,,3.02,ATH,False,False
05-02-2026 10:00,HTTBT,45.9,47.24,45.9,47.22,598249.0,0.02,1.32,0.13,885.07,1.32,168951.0,254.1,0.02,True,81.17,0.14,0.08,0.06,2026-02-05,46.0,2.65,0,,45.88,ATH,False,False
05-02-2026 10:00,DSTKF,849.5,876.5,849.0,871.0,219663.0,5.5,21.5,2.8,667.86,21.5,69065.9,218.05,0.26,True,75.06,10.14,8.53,1.61,2026-02-05,850.0,2.47,0,,825.0,ATH,False,False
04-02-2026 17:00,BEGYO,4.84,4.86,4.82,4.86,1438424.0,0.0,0.02,0.0,1900.0,0.02,913348.4,57.49,0.0,True,54.2,0.02,0.02,0.0,2026-02-04,4.86,0.0,0,,4.69,4.98,False,False
04-02-2026 17:00,DITAS,52.5,55.4,52.5,54.9,1059232.0,0.5,2.4,0.17,1271.43,2.4,371170.9,185.38,0.21,True,68.89,0.84,0.79,0.05,2026-02-04,52.7,4.17,0,,50.8,ATH,False,False
04-02-2026 17:00,KOTON,17.67,17.98,17.58,17.95,952684.0,0.03,0.28,0.02,1300.0,0.28,360557.5,164.23,0.11,True,57.39,0.05,-0.0,0.05,2026-02-04,17.76,1.07,2,17.58,17.58,18.23,False,False
04-02-2026 16:00,IZENR,9.89,10.05,9.87,10.04,6031207.0,0.01,0.15,0.03,476.92,0.15,2550201.3,136.5,0.07,True,68.9,0.09,0.08,0.02,2026-02-04,9.78,2.66,0,,9.16,ATH,False,False
04-02-2026 15:00,BIOEN,19.25,19.85,19.21,19.85,1769933.0,0.0,0.6,0.01,8471.43,0.6,645416.4,174.23,0.0,True,67.62,0.11,0.07,0.03,2026-02-04,19.06,4.14,0,,19.02,ATH,False,False
04-02-2026 13:00,KAYSE,4.91,5.04,4.9,5.01,3753535.0,0.03,0.1,0.01,809.09,0.1,1659905.7,126.13,0.3,True,65.91,0.0,-0.01,0.01,2026-02-04,4.85,3.3,0,,4.85,5.12,False,False
04-02-2026 13:00,BALSU,16.5,17.42,16.47,17.25,8019916.0,0.17,0.75,0.1,642.57,0.75,3320464.8,141.53,0.23,True,76.37,0.23,0.17,0.07,2026-02-04,16.6,3.92,0,,15.67,ATH,False,False
04-02-2026 13:00,OBAMS,8.28,8.47,8.28,8.42,24457281.0,0.05,0.14,0.0,7.88129934789839e+16,0.14,8847418.9,176.43,0.36,True,42.4,-0.15,-0.15,0.01,2026-02-04,8.28,1.69,0,,8.08,9.29,True,False
04-02-2026 13:00,MOPAS,53.5,54.85,53.4,54.5,1047378.0,0.35,1.0,0.18,471.43,1.0,656221.6,59.61,0.35,True,71.9,0.48,0.29,0.19,2026-02-04,52.45,3.91,1,54.85,51.6,54.85,False,False
04-02-2026 12:00,EPLAS,7.1,7.2,7.1,7.19,969599.0,0.01,0.09,0.0,8900.0,0.09,506725.2,91.35,0.11,True,56.53,0.0,-0.01,0.01,2026-02-04,7.06,1.84,1,7.2,7.0,7.2,False,False
04-02-2026 12:00,DMLKT,5.84,5.88,5.83,5.88,4339171.0,0.0,0.04,0.0,700.0,0.04,1910600.1,127.11,0.0,True,64.63,0.0,-0.0,0.0,2026-02-04,5.84,0.68,1,5.88,5.78,5.92,False,False
04-02-2026 12:00,OZSUB,20.24,20.84,20.16,20.74,897357.0,0.1,0.5,0.04,1150.0,0.5,497549.8,80.36,0.2,True,69.16,0.11,0.03,0.08,2026-02-04,20.0,3.7,0,,19.5,20.8,False,False
04-02-2026 11:00,VESTL,32.74,33.54,32.64,33.4,2671640.0,0.14,0.66,0.13,400.0,0.66,712404.9,275.02,0.21,True,80.68,0.38,0.22,0.15,2026-02-04,32.14,3.92,1,33.54,30.12,33.54,False,False
04-02-2026 11:00,SEKFK,9.12,9.5,9.12,9.46,1239539.0,0.04,0.34,0.05,608.33,0.34,158661.3,681.25,0.12,True,68.14,0.06,0.03,0.03,2026-02-04,9.2,2.83,0,,8.65,ATH,False,False
04-02-2026 11:00,AFYON,14.62,14.91,14.62,14.84,1202542.0,0.07,0.22,0.02,1000.0,0.22,302137.8,298.01,0.32,True,61.42,0.02,0.01,0.01,2026-02-04,14.71,0.88,3,,14.62,15.07,False,False
04-02-2026 11:00,UCAYM,34.68,38.12,34.58,37.7,37755366.0,0.42,3.02,0.14,2088.41,3.02,12542049.2,201.03,0.14,True,59.55,0.05,0.36,-0.31,2026-02-04,34.66,8.77,0,,33.76,41.2,False,False
04-02-2026 11:00,IHAAS,57.95,59.8,57.45,59.6,772109.0,0.2,1.65,0.02,6500.0,1.65,266410.8,189.82,0.12,True,31.84,-1.6,-0.62,-0.98,2026-02-04,63.7,-6.44,0,,57.35,72.15,False,False
04-02-2026 10:00,DGNMO,5.2,5.29,5.2,5.27,392849.0,0.02,0.07,0.01,775.0,0.07,248998.1,57.77,0.29,True,62.32,0.02,0.01,0.01,2026-02-04,5.18,1.74,1,5.29,4.95,5.29,False,False
04-02-2026 10:00,ERCB,70.25,70.95,70.2,70.8,360438.0,0.15,0.55,0.01,5400.0,0.55,150273.8,139.85,0.27,True,56.89,0.04,-0.01,0.05,2026-02-04,70.1,1.0,0,,69.95,71.15,False,False
04-02-2026 10:00,CVKMD,43.5,45.1,43.12,44.82,16232421.0,0.28,1.32,0.29,348.98,1.32,4746922.4,241.96,0.21,True,76.21,1.07,0.7,0.37,2026-02-04,42.96,4.33,0,,37.5,ATH,False,False
04-02-2026 10:00,PNLSN,41.1,42.9,41.1,42.54,435404.0,0.36,1.44,0.15,860.0,1.44,79573.3,447.17,0.25,True,70.82,0.14,0.02,0.12,2026-02-04,40.88,4.06,0,,40.46,ATH,False,False
04-02-2026 10:00,MGROS,660.0,667.0,657.0,666.0,1164150.0,1.0,6.0,0.05,11900.0,6.0,547692.3,112.56,0.17,True,68.86,7.58,6.23,1.35,2026-02-04,654.0,1.83,0,,610.5,667.0,False,False
04-02-2026 10:00,TUCLK,5.98,6.28,5.72,6.28,33738256.0,0.0,0.3,0.05,445.45,0.3,7287758.2,362.94,0.0,True,78.68,0.16,0.09,0.07,2026-02-04,5.8,8.28,1,6.28,5.15,ATH,False,False
04-02-2026 10:00,ENJSA,108.9,112.6,108.8,112.5,1248090.0,0.1,3.6,0.37,872.97,3.6,261505.5,377.27,0.03,True,83.74,1.39,0.98,0.41,2026-02-04,107.1,5.04,1,112.6,101.9,112.6,False,False
04-02-2026 10:00,BIENY,23.94,24.4,23.94,24.32,295216.0,0.08,0.38,0.06,512.9,0.38,193934.2,52.22,0.21,True,61.96,0.01,-0.06,0.06,2026-02-04,24.0,1.33,1,24.4,23.46,24.4,False,False
04-02-2026 10:00,PRKAB,55.4,58.0,55.05,58.0,4968684.0,0.0,2.6,0.26,900.0,2.6,542026.7,816.69,0.0,True,78.63,1.41,0.73,0.68,2026-02-04,52.75,9.95,1,58.0,44.88,ATH,False,False
04-02-2026 10:00,ALKA,13.1,13.6,13.08,13.55,5520844.0,0.05,0.45,0.05,900.0,0.45,1111258.4,396.81,0.11,True,67.66,-0.01,-0.05,0.04,2026-02-04,13.05,3.83,0,,12.96,14.43,False,False
04-02-2026 10:00,KLMSN,29.72,30.6,29.72,30.52,479329.0,0.08,0.8,0.07,1076.47,0.8,107022.1,347.88,0.1,True,70.8,0.01,-0.06,0.07,2026-02-04,29.66,2.9,0,,29.58,ATH,False,False
03-02-2026 17:00,MARMR,2.98,3.14,2.94,3.14,114133816.0,0.0,0.16,0.02,841.18,0.16,50162482.8,127.53,0.0,True,70.31,0.06,0.04,0.02,2026-02-03,2.86,9.79,0,,2.86,3.15,False,False
03-02-2026 17:00,ICUGS,2.7,2.73,2.68,2.73,3671491.0,0.0,0.03,0.0,650.0,0.03,1274898.8,187.98,0.0,True,55.65,-0.0,-0.01,0.0,2026-02-03,2.69,1.49,2,2.68,2.68,2.75,False,False
03-02-2026 17:00,EGEPO,10.49,10.95,10.45,10.87,1321523.0,0.08,0.38,0.03,985.71,0.38,315747.0,318.54,0.21,True,65.3,0.07,0.04,0.03,2026-02-03,10.52,3.33,0,,10.04,11.36,False,False
03-02-2026 17:00,BLCYT,42.76,44.54,42.68,44.54,1305393.0,0.0,1.78,0.4,347.24,1.78,259317.6,403.4,0.0,True,86.03,1.31,1.02,0.29,2026-02-03,39.8,11.91,0,,34.6,ATH,False,False
03-02-2026 16:00,SKYMD,12.26,12.47,12.22,12.45,741260.0,0.02,0.19,0.02,726.09,0.19,294357.4,151.82,0.11,True,62.49,0.01,-0.01,0.02,2026-02-03,12.23,1.8,0,,11.99,12.64,False,False
03-02-2026 16:00,MEYSU,13.96,15.0,13.88,14.93,33621101.0,0.07,0.97,0.08,1127.85,0.97,12389088.1,171.38,0.07,True,65.93,0.01,-0.11,0.12,2026-02-03,14.18,5.29,2,13.88,13.88,ATH,False,False
03-02-2026 16:00,PAHOL,1.8,1.83,1.79,1.83,257911910.0,0.0,0.03,0.0,650.0,0.03,98775473.0,161.11,0.0,True,63.45,0.01,0.01,0.0,2026-02-03,1.77,3.39,0,,1.76,1.86,False,False
03-02-2026 16:00,KAREL,9.3,9.48,9.29,9.45,2609748.0,0.03,0.15,0.01,1053.85,0.15,991862.4,163.12,0.2,True,66.31,0.01,-0.01,0.02,2026-02-03,9.22,2.49,0,,9.07,9.59,False,False
03-02-2026 15:00,SURGY,49.18,52.55,49.06,52.55,5645654.0,0.0,3.37,0.41,719.95,3.37,1397529.4,303.97,0.0,True,72.85,0.05,-0.19,0.25,2026-02-03,47.8,9.94,0,,47.0,ATH,False,False
03-02-2026 15:00,TRMET,138.7,141.5,138.7,140.9,1412916.0,0.6,2.2,0.14,1471.43,2.2,876128.5,61.27,0.27,True,55.22,-0.97,-1.83,0.86,2026-02-03,132.1,6.66,0,,130.0,154.1,False,False
03-02-2026 15:00,SOKM,65.15,67.15,65.15,66.6,3208144.0,0.55,1.45,0.13,1015.38,1.45,1108410.7,189.44,0.38,True,65.85,0.38,0.29,0.09,2026-02-03,64.95,2.54,0,,64.55,ATH,False,False
03-02-2026 14:00,ASUZU,60.65,61.9,60.65,61.6,254154.0,0.3,0.95,0.08,1017.65,0.95,97316.0,161.16,0.32,True,65.24,0.19,0.05,0.14,2026-02-03,60.0,2.67,0,,58.15,ATH,False,False
03-02-2026 13:00,BEYAZ,29.96,30.7,29.96,30.56,304912.0,0.14,0.6,0.02,2900.0,0.6,142958.4,113.29,0.23,True,57.11,-0.02,-0.02,0.0,2026-02-03,29.9,2.21,1,30.7,29.5,30.7,False,False
03-02-2026 13:00,RTALB,3.98,4.09,3.96,4.06,10539785.0,0.03,0.08,0.01,788.89,0.08,4461481.1,136.24,0.38,True,66.28,0.03,0.02,0.01,2026-02-03,3.92,3.57,0,,3.73,ATH,False,False
03-02-2026 13:00,MERKO,16.19,16.76,16.16,16.64,1661689.0,0.12,0.45,0.06,689.47,0.45,612103.3,171.47,0.27,True,71.64,0.09,0.04,0.05,2026-02-03,16.1,3.35,0,,15.87,ATH,False,False
03-02-2026 12:00,NIBAS,3.74,4.0,3.71,4.0,7640879.0,0.0,0.26,0.03,712.5,0.26,1989673.0,284.03,0.0,True,72.37,0.06,0.03,0.02,2026-02-03,3.82,4.71,0,,3.54,ATH,False,False
03-02-2026 12:00,ORCAY,3.78,3.9,3.77,3.88,851843.0,0.02,0.1,0.01,900.0,0.1,471301.3,80.74,0.2,True,64.22,0.01,0.0,0.0,2026-02-03,3.78,2.65,0,,3.73,4.0,False,False
03-02-2026 11:00,EREGL,28.16,28.74,28.16,28.64,57392649.0,0.1,0.48,0.11,344.44,0.48,22981390.1,149.74,0.21,True,61.95,0.05,0.06,-0.0,2026-02-03,28.18,1.63,0,,27.64,28.72,False,False
03-02-2026 11:00,KRDMD,29.74,30.42,29.72,30.4,18493411.0,0.02,0.66,0.24,179.66,0.66,7487885.2,146.98,0.03,True,69.72,0.07,-0.13,0.2,2026-02-03,29.24,3.97,0,,27.7,30.5,False,False
03-02-2026 10:00,JANTS,19.46,19.65,19.46,19.6,649264.0,0.05,0.14,0.02,723.53,0.14,246012.3,163.92,0.36,True,44.82,-0.12,-0.12,0.01,2026-02-03,19.44,0.82,0,,19.32,20.26,True,True
03-02-2026 10:00,FRMPL,40.6,42.72,40.44,42.72,7341550.0,0.0,2.12,0.22,872.48,2.12,2335526.6,214.34,0.0,True,65.79,-0.42,-0.83,0.41,2026-02-03,38.84,9.99,1,42.72,38.0,ATH,True,False
03-02-2026 10:00,SMRTG,7.87,7.99,7.87,7.96,1855847.0,0.03,0.09,0.01,800.0,0.09,1229659.0,50.92,0.33,True,41.86,-0.12,-0.12,0.01,2026-02-03,7.86,1.27,0,,7.8,ATH,False,False
03-02-2026 10:00,TCELL,114.5,116.8,113.3,116.6,11386139.0,0.2,2.1,0.35,500.0,2.1,5054204.8,125.28,0.1,True,57.95,-0.39,-0.54,0.15,2026-02-03,113.5,2.73,0,,110.9,118.8,False,False
03-02-2026 10:00,BMSCH,18.83,20.06,18.83,19.88,3284308.0,0.18,1.05,0.1,939.6,1.05,563809.5,482.52,0.17,True,77.37,0.22,0.13,0.08,2026-02-03,18.74,6.08,0,,17.75,ATH,False,False
03-02-2026 10:00,FENER,3.31,3.36,3.3,3.36,38477610.0,0.0,0.05,0.01,455.56,0.05,12929188.8,197.6,0.0,True,62.17,-0.0,-0.01,0.01,2026-02-03,3.27,2.75,1,3.36,3.23,3.37,False,False
02-02-2026 17:00,RALYH,189.1,192.7,189.1,192.6,187551.0,0.1,3.5,0.45,677.78,3.5,64682.6,189.96,0.03,True,60.72,0.38,0.16,0.22,2026-02-02,187.7,2.61,1,192.7,184.8,192.7,False,False
02-02-2026 16:00,ECOGR,25.92,27.1,25.92,26.94,8493893.0,0.16,1.02,0.23,335.9,1.02,3706215.3,129.18,0.16,True,78.4,0.33,0.15,0.18,2026-02-02,24.86,8.37,0,,24.18,ATH,False,False
02-02-2026 15:00,AZTEK,4.63,4.86,4.62,4.85,6381707.0,0.01,0.22,0.04,464.1,0.22,1362795.8,368.28,0.05,True,73.24,0.03,-0.0,0.03,2026-02-02,4.54,6.83,0,,4.43,ATH,False,False
02-02-2026 15:00,DERHL,14.12,15.19,14.12,15.17,3965886.0,0.02,1.05,0.09,1029.03,1.05,1484324.1,167.18,0.02,True,72.2,0.07,0.03,0.04,2026-02-02,14.27,6.31,0,,14.0,ATH,False,False
02-02-2026 15:00,AKFIS,22.2,22.66,22.2,22.66,1066826.0,0.0,0.46,0.03,1337.5,0.46,317618.5,235.88,0.0,True,60.96,-0.06,-0.07,0.01,2026-02-02,22.4,1.16,0,,21.9,22.76,False,False
02-02-2026 15:00,DOFRB,105.7,110.1,105.5,109.9,5409033.0,0.2,4.2,1.08,290.7,4.2,2480886.1,118.03,0.05,True,76.92,1.85,1.05,0.8,2026-02-02,100.1,9.79,0,,95.65,ATH,False,False
02-02-2026 14:00,GARAN,155.5,159.1,155.4,159.1,10608040.0,0.0,3.6,0.7,414.29,3.6,5566907.1,90.56,0.0,True,59.02,0.49,0.92,-0.43,2026-02-02,161.3,-1.36,0,,153.0,161.9,False,False
02-02-2026 14:00,XBANK,19379.86,19915.38,19367.94,19866.41,293381160.0,48.97,486.55,32.06,1417.72,486.55,176422665.1,66.29,0.1,True,63.87,125.73,170.9,-45.17,2026-02-02,20019.85,-0.77,0,,19148.51,20011.78,False,False
02-02-2026 14:00,XU030,14824.39,15065.29,14823.76,15038.71,1060731108.0,26.58,214.32,7.5,2755.7,214.32,512614379.1,106.93,0.12,True,56.84,-5.91,24.12,-30.03,2026-02-02,15127.98,-0.59,0,,14532.93,15310.42,False,False
02-02-2026 14:00,KLSYN,7.23,7.62,7.22,7.56,1589982.0,0.06,0.33,0.01,2100.0,0.33,495527.7,220.87,0.18,True,52.06,-0.09,-0.1,0.01,2026-02-02,7.36,2.72,0,,7.17,7.85,False,False
02-02-2026 14:00,OSTIM,2.98,3.14,2.98,3.13,13870679.0,0.01,0.15,0.02,733.33,0.15,2545664.3,444.87,0.07,True,82.69,0.01,-0.0,0.01,2026-02-02,2.96,5.74,0,,2.94,ATH,False,False
02-02-2026 13:00,YEOTK,43.76,45.4,43.74,45.38,2160893.0,0.02,1.62,0.12,1272.88,1.62,1102790.5,95.95,0.01,True,65.9,0.04,-0.04,0.09,2026-02-02,43.5,4.32,0,,42.9,ATH,False,False
02-02-2026 13:00,HRKET,80.9,82.3,80.8,82.0,142295.0,0.3,1.1,0.07,1471.43,1.1,80084.2,77.68,0.27,True,56.77,-0.18,-0.18,0.0,2026-02-02,81.4,0.74,0,,79.7,83.2,False,False
02-02-2026 12:00,YKSLN,3.41,3.58,3.41,3.57,18123379.0,0.01,0.16,0.03,384.85,0.16,3198378.1,466.64,0.06,True,68.56,0.03,0.01,0.01,2026-02-02,3.42,4.39,0,,3.26,ATH,False,False
02-02-2026 12:00,BRLSM,15.01,15.25,14.99,15.22,522249.0,0.03,0.21,0.02,813.04,0.21,345140.6,51.31,0.14,True,55.28,-0.06,-0.08,0.02,2026-02-02,15.01,1.4,0,,14.61,15.27,False,False
02-02-2026 12:00,ANGEN,11.47,11.68,11.47,11.67,421902.0,0.01,0.2,0.02,1150.0,0.2,239422.3,76.22,0.05,True,52.35,-0.02,-0.01,-0.01,2026-02-02,11.65,0.17,0,,11.32,12.0,True,True
02-02-2026 12:00,DARDL,2.46,2.49,2.46,2.49,7069613.0,0.0,0.03,0.01,275.0,0.03,4690414.5,50.72,0.0,True,61.12,0.01,0.0,0.0,2026-02-02,2.44,2.05,0,,2.38,2.5,False,False
02-02-2026 12:00,GLRMK,195.1,200.8,195.1,200.4,481337.0,0.4,5.3,0.54,881.48,5.3,165642.4,190.59,0.08,True,70.17,0.78,0.37,0.41,2026-02-02,194.8,2.87,0,,190.4,ATH,False,False
02-02-2026 12:00,DMSAS,9.24,9.74,9.24,9.6,5652093.0,0.14,0.36,0.05,665.96,0.36,1564380.8,261.3,0.39,True,42.07,-0.26,-0.16,-0.1,2026-02-02,9.98,-3.81,0,,8.99,11.67,False,False
02-02-2026 11:00,BOBET,20.64,21.08,20.6,21.02,857170.0,0.06,0.38,0.02,2011.11,0.38,434899.6,97.1,0.16,True,46.09,-0.14,-0.12,-0.01,2026-02-02,20.92,0.48,0,,20.52,ATH,True,True
02-02-2026 11:00,BESLR,14.12,14.44,14.1,14.39,561534.0,0.05,0.27,0.02,1073.91,0.27,346295.5,62.15,0.19,True,49.93,-0.05,-0.04,-0.01,2026-02-02,14.34,0.35,0,,14.01,14.61,False,False
02-02-2026 11:00,MACKO,26.0,28.34,25.8,27.9,2315112.0,0.44,1.9,0.19,879.38,1.9,322874.3,617.03,0.23,True,79.2,0.08,-0.07,0.15,2026-02-02,25.78,8.22,0,,25.64,ATH,True,True
30-01-2026 17:00,KTLEV,37.02,38.22,36.64,38.08,12001587.0,0.14,1.06,0.09,1077.78,1.06,6891189.3,74.16,0.13,True,60.38,0.29,0.25,0.03,2026-01-30,37.12,2.59,2,36.64,36.64,38.26,False,False
30-01-2026 16:00,BAGFS,28.3,30.44,28.08,30.42,2518077.0,0.02,2.12,0.26,703.03,2.12,364467.2,590.89,0.01,True,85.14,0.25,0.09,0.16,2026-01-30,27.72,9.74,0,,27.32,ATH,False,False
30-01-2026 16:00,HURGZ,5.55,5.76,5.55,5.74,5494779.0,0.02,0.19,0.03,578.57,0.19,1078996.7,409.25,0.11,True,76.51,0.05,0.03,0.02,2026-01-30,5.39,6.49,0,,5.33,ATH,False,False
30-01-2026 13:00,TERA,203.9,207.3,203.1,207.1,2298044.0,0.2,3.2,0.43,644.19,3.2,1181975.0,94.42,0.06,True,82.34,1.55,1.14,0.42,2026-01-30,202.0,2.52,0,,ATL,ATH,False,False
30-01-2026 13:00,ELITE,31.2,32.9,31.14,32.84,1914266.0,0.06,1.64,0.21,666.36,1.64,460358.9,315.82,0.04,True,85.28,0.27,0.1,0.17,2026-01-30,30.5,7.67,0,,30.38,ATH,False,False
30-01-2026 12:00,SEYKM,5.3,5.53,5.3,5.52,910771.0,0.01,0.22,0.03,547.06,0.22,280352.8,224.87,0.05,True,63.58,0.0,-0.01,0.02,2026-01-30,5.26,4.94,0,,5.1,ATH,False,False
30-01-2026 10:00,PINSU,11.24,11.99,11.24,11.92,8520661.0,0.07,0.68,0.08,783.12,0.68,1223349.9,596.5,0.1,True,86.72,0.03,-0.01,0.04,2026-01-30,11.24,6.05,0,,11.13,ATH,False,False
30-01-2026 10:00,ETILR,3.98,4.06,3.92,4.04,3904419.0,0.02,0.06,0.0,1900.0,0.06,1046770.7,273.0,0.33,True,68.41,0.01,0.01,0.0,2026-01-30,3.95,2.28,2,3.92,3.92,ATH,False,False
30-01-2026 10:00,YATAS,46.76,48.84,46.44,48.66,656818.0,0.18,1.9,0.19,889.58,1.9,169664.2,287.13,0.09,True,74.25,0.33,0.18,0.15,2026-01-30,46.76,4.06,1,48.84,ATL,48.84,False,False
29-01-2026 17:00,BULGS,45.0,47.62,44.86,47.4,7337972.0,0.22,2.4,0.15,1478.95,2.4,1457448.9,403.48,0.09,True,70.39,0.09,-0.0,0.09,2026-01-29,45.4,4.41,0,,44.7,ATH,False,False
29-01-2026 17:00,CWENE,31.12,35.08,30.78,35.08,10472947.0,0.0,3.96,0.34,1078.57,3.96,2741872.5,281.96,0.0,True,81.05,0.12,-0.07,0.19,2026-01-29,31.9,9.97,2,30.78,30.78,ATH,False,False
29-01-2026 16:00,MOGAN,8.93,8.99,8.9,8.99,1267425.0,0.0,0.06,0.02,300.0,0.06,740713.9,71.11,0.0,True,79.07,0.02,0.01,0.01,2026-01-29,8.87,1.35,0,,ATL,ATH,False,False
29-01-2026 16:00,IHYAY,1.98,2.0,1.98,2.0,1927092.0,0.0,0.02,0.0,900.0,0.02,1012497.2,90.33,0.0,True,60.48,0.0,-0.0,0.0,2026-01-29,1.97,1.52,1,2.0,1.95,ATH,False,False
29-01-2026 15:00,AKSA,10.7,10.89,10.67,10.84,11204219.0,0.05,0.14,0.03,337.5,0.14,3530732.1,217.33,0.36,True,77.8,0.04,0.02,0.02,2026-01-29,10.56,2.65,1,10.89,10.49,10.89,False,False
29-01-2026 14:00,TSKB,13.8,14.01,13.78,13.99,11751971.0,0.02,0.19,0.06,222.03,0.19,6294070.7,86.71,0.11,True,88.46,0.13,0.08,0.04,2026-01-29,13.45,4.01,0,,ATL,ATH,False,False
29-01-2026 13:00,ANSGR,27.94,28.5,27.9,28.4,4581810.0,0.1,0.46,0.05,858.33,0.46,2305604.4,98.72,0.22,True,73.69,0.05,0.01,0.03,2026-01-29,27.7,2.53,0,,27.54,ATH,False,False
29-01-2026 11:00,SEGMN,34.34,36.32,34.22,36.32,2135660.0,0.0,1.98,0.12,1522.95,1.98,837781.4,154.92,0.0,True,73.26,0.22,0.09,0.13,2026-01-29,33.02,9.99,0,,ATL,ATH,False,False
29-01-2026 10:00,VAKBN,35.78,36.24,35.4,36.18,10048096.0,0.06,0.4,0.13,198.51,0.4,4209392.1,138.71,0.15,True,85.8,0.19,0.1,0.09,2026-01-29,35.5,1.92,0,,ATL,ATH,False,False
29-01-2026 10:00,ENTRA,10.88,11.26,10.88,11.16,7828615.0,0.1,0.28,0.02,1373.68,0.28,2141573.5,265.55,0.36,True,63.13,-0.02,-0.04,0.02,2026-01-29,10.8,3.33,0,,10.79,ATH,False,False
28-01-2026 17:00,ICBCT,14.0,14.07,13.99,14.06,247229.0,0.01,0.06,0.01,400.0,0.06,137253.7,80.13,0.17,True,65.51,0.01,0.0,0.01,2026-01-28,13.88,1.3,0,,ATL,ATH,False,False
28-01-2026 17:00,TEZOL,12.6,13.05,12.57,12.96,3827702.0,0.09,0.36,0.06,462.5,0.36,1021592.2,274.68,0.25,True,84.58,0.06,0.03,0.03,2026-01-28,12.28,5.54,1,13.05,ATL,13.05,False,False
28-01-2026 17:00,RGYAS,163.8,164.8,163.4,164.8,234096.0,0.0,1.0,0.36,177.78,1.0,109377.1,114.03,0.0,True,86.75,0.95,0.73,0.22,2026-01-28,161.3,2.17,0,,ATL,ATH,False,False
28-01-2026 15:00,CIMSA,51.4,53.2,51.35,53.05,6631880.0,0.15,1.65,0.18,806.59,1.65,3524559.0,88.16,0.09,True,92.6,0.4,0.25,0.15,2026-01-28,49.08,8.09,0,,ATL,ATH,False,False
28-01-2026 13:00,MTRKS,23.76,24.54,23.7,24.42,306073.0,0.12,0.66,0.06,1000.0,0.66,149811.9,104.3,0.18,True,70.44,0.02,-0.0,0.02,2026-01-28,23.66,3.21,0,,ATL,ATH,False,False
27-01-2026 14:00,SERNT,8.24,8.59,8.23,8.5,10193853.0,0.09,0.26,0.03,796.55,0.26,1668371.6,511.01,0.35,True,84.13,0.02,0.0,0.01,2026-01-27,8.22,3.41,0,,ATL,ATH,False,False
27-01-2026 12:00,CELHA,12.1,12.48,12.04,12.39,2052525.0,0.09,0.29,0.03,866.67,0.29,709702.7,189.21,0.31,True,75.72,0.02,0.0,0.02,2026-01-27,11.96,3.6,1,12.48,ATL,12.48,False,False
