Tarih,Hisse,open,high,low,close,volume,YuksekKapanis_Fark,AcilisKapanis_Fark,AcilisKapanisFark_Ort,AcilisKapanisFark_OrtalamayaGoreDegisim,AcilisKapanisFarkOrt_MaxSon10,HacimOrtalama,%Hacim_HacimOrtalama,Fark_Orani,Kosul,rsi,MACD_12_26_9,MACDs_12_26_9,MACDh_12_26_9,Tarih1,prev_close,%Deg,isPivot,pointpos,destek,direnc,Tsinyal_Banker_Dip,Tsinyal_Banker_DipKarar
19-02-2026 13:00,OZATD,177.3,185.6,176.8,184.6,322385.0,1.0,7.3,0.41,1680.49,7.3,141714.2,127.49,0.14,True,69.47,1.71,1.72,-0.01,2026-02-19,177.2,4.18,0,,162.5,ATH,False,False
19-02-2026 13:00,PAPIL,19.32,21.1,19.32,20.84,24148618.0,0.26,1.52,0.06,2614.29,1.52,6149085.4,292.72,0.17,True,65.19,0.17,0.19,-0.03,2026-02-19,20.14,3.48,0,,19.14,ATH,False,False
19-02-2026 12:00,PCILT,25.14,25.98,24.9,25.92,482744.0,0.06,0.78,0.04,1850.0,0.78,241001.2,100.31,0.08,True,59.52,0.1,0.17,-0.07,2026-02-19,25.04,3.51,0,,23.16,27.0,False,False
19-02-2026 11:00,TATGD,18.14,19.09,18.05,19.01,4003925.0,0.08,0.87,0.12,625.0,0.87,2115442.1,89.27,0.09,True,94.55,0.73,0.62,0.11,2026-02-19,17.46,8.88,0,,14.07,ATH,False,False
19-02-2026 10:00,TUPRS,223.7,228.3,223.6,227.1,17151572.0,1.2,3.4,0.48,608.33,3.4,5272681.2,225.29,0.35,True,67.78,0.49,0.03,0.46,2026-02-19,222.1,2.25,0,,218.2,ATH,False,False
19-02-2026 10:00,GEREL,24.06,25.5,23.76,25.32,4583752.0,0.18,1.26,0.11,1088.68,1.26,1229529.0,272.81,0.14,True,59.18,-0.2,-0.28,0.08,2026-02-19,23.96,5.68,0,,23.96,26.32,True,True
19-02-2026 10:00,EKOS,6.29,6.82,6.29,6.69,31308776.0,0.13,0.4,0.02,1718.18,0.4,5004284.4,525.64,0.32,True,77.74,0.11,0.1,0.01,2026-02-19,6.28,6.53,0,,6.2,ATH,False,False
19-02-2026 10:00,PRKAB,51.05,53.4,50.4,53.0,2555397.0,0.4,1.95,0.1,1952.63,1.95,844967.9,202.43,0.21,True,50.26,-0.82,-0.99,0.17,2026-02-19,51.15,3.62,0,,50.0,54.4,True,True
19-02-2026 10:00,ISKPL,12.12,12.19,11.91,12.17,2675478.0,0.02,0.05,0.0,4900.0,0.05,1430293.1,87.06,0.4,True,54.87,-0.01,-0.01,-0.0,2026-02-19,12.04,1.08,0,,11.98,12.42,True,True
19-02-2026 10:00,DURKN,23.36,24.86,23.36,24.62,5693979.0,0.24,1.26,0.04,2763.64,1.26,2345664.9,142.74,0.19,True,61.06,0.35,0.43,-0.08,2026-02-19,23.06,6.76,0,,22.06,24.8,False,False
19-02-2026 10:00,MEGMT,72.1,75.1,72.1,74.55,3288806.0,0.55,2.45,0.61,301.64,2.45,1793211.7,83.4,0.22,True,81.46,1.29,0.87,0.42,2026-02-19,72.2,3.25,0,,66.3,ATH,False,False
19-02-2026 10:00,SARKY,37.94,40.4,37.26,40.1,12111506.0,0.3,2.16,0.21,928.57,2.16,2940643.8,311.87,0.14,True,77.28,0.32,0.01,0.31,2026-02-19,37.7,6.37,0,,35.3,42.48,False,False
19-02-2026 10:00,TEKTU,8.91,9.12,8.89,9.06,4308214.0,0.06,0.15,0.0,4900.0,0.15,1551490.1,177.68,0.4,True,37.84,-0.22,-0.26,0.03,2026-02-19,8.89,1.91,0,,ATL,10.95,True,True
19-02-2026 10:00,OZRDN,22.4,25.08,22.34,25.0,397942.0,0.08,2.6,0.04,6090.48,2.6,139927.9,184.39,0.03,True,60.81,0.31,0.58,-0.27,2026-02-19,22.9,9.17,0,,22.12,25.88,False,False
18-02-2026 16:00,TRMET,149.2,151.7,148.7,151.2,1842390.0,0.5,2.0,0.72,177.78,2.0,874891.2,110.59,0.25,True,81.91,2.52,1.91,0.61,2026-02-18,144.5,4.64,0,,137.8,ATH,False,False
18-02-2026 15:00,ALTIN,82.67,84.01,82.65,83.9,6383137.0,0.11,1.23,0.0,122900.0,1.23,2699098.2,136.49,0.09,True,62.14,-0.09,-0.27,0.18,2026-02-18,82.08,2.22,0,,81.65,87.77,False,False
18-02-2026 15:00,NIBAS,4.94,5.46,4.92,5.38,8985814.0,0.08,0.44,0.02,1660.0,0.44,2787137.0,222.4,0.18,True,67.24,0.05,0.03,0.01,2026-02-18,4.97,8.25,2,4.92,4.92,ATH,False,False
18-02-2026 14:00,MARMR,2.82,3.02,2.82,3.0,112735751.0,0.02,0.18,0.01,1400.0,0.18,27872167.7,304.47,0.11,True,62.37,-0.01,-0.02,0.01,2026-02-18,2.88,4.17,0,,2.86,3.02,True,True
18-02-2026 14:00,TERA,228.3,235.8,228.1,234.8,3057971.0,1.0,6.5,0.77,744.16,6.5,758261.1,303.29,0.15,True,82.86,1.62,1.06,0.56,2026-02-18,225.5,4.12,0,,221.8,ATH,False,False
18-02-2026 14:00,MANAS,10.85,11.65,10.84,11.52,19236128.0,0.13,0.67,0.04,1761.11,0.67,3858412.2,398.55,0.19,True,55.77,-0.2,-0.23,0.03,2026-02-18,11.11,3.69,1,11.65,11.05,11.65,True,True
18-02-2026 14:00,ASTOR,185.9,190.9,185.8,190.6,9630916.0,0.3,4.7,0.99,374.75,4.7,5189852.3,85.57,0.06,True,76.52,1.7,0.33,1.36,2026-02-18,175.8,8.42,0,,173.7,ATH,False,False
18-02-2026 14:00,VSNMD,96.9,99.0,96.8,98.75,1487817.0,0.25,1.85,0.55,236.36,1.85,704901.4,111.07,0.14,True,79.83,1.08,0.46,0.62,2026-02-18,93.0,6.18,0,,91.45,103.5,False,False
18-02-2026 14:00,DOFRB,89.4,94.7,89.4,94.7,12386451.0,0.0,5.3,0.77,588.31,5.3,2202769.1,462.31,0.0,True,83.72,0.4,-0.3,0.71,2026-02-18,86.1,9.99,0,,85.6,98.7,False,False
18-02-2026 14:00,ANSGR,27.88,28.18,27.84,28.16,3147451.0,0.02,0.28,0.03,900.0,0.28,1375604.9,128.8,0.07,True,60.11,0.04,0.05,-0.01,2026-02-18,27.92,0.86,0,,27.86,28.2,False,False
18-02-2026 14:00,KOCMT,2.82,2.98,2.82,2.96,26320353.0,0.02,0.14,0.02,723.53,0.14,6887264.8,282.16,0.14,True,79.75,0.02,0.01,0.01,2026-02-18,2.84,4.23,0,,2.78,ATH,False,False
18-02-2026 13:00,BNTAS,7.18,7.25,7.18,7.25,2124825.0,0.0,0.07,0.02,366.67,0.07,1195986.6,77.66,0.0,True,76.53,0.06,0.06,0.0,2026-02-18,7.07,2.55,0,,7.02,ATH,False,False
18-02-2026 13:00,OSMEN,9.24,9.45,9.21,9.39,917145.0,0.06,0.15,0.0,14900.0,0.15,336824.8,172.29,0.4,True,67.5,0.12,0.13,-0.01,2026-02-18,9.18,2.29,1,9.45,8.11,9.45,False,False
18-02-2026 13:00,BRSAN,692.5,722.5,692.5,717.5,598373.0,5.0,25.0,1.0,2400.0,25.0,224719.5,166.28,0.2,True,53.94,-9.34,-10.96,1.62,2026-02-18,689.5,4.06,0,,686.5,784.0,True,True
18-02-2026 13:00,DOHOL,21.8,22.12,21.76,22.08,2289170.0,0.04,0.28,0.03,976.92,0.28,1257140.7,82.09,0.14,True,58.96,0.02,0.04,-0.02,2026-02-18,21.76,1.47,0,,21.6,22.42,False,False
18-02-2026 13:00,DURDO,4.08,4.41,4.08,4.38,14438580.0,0.03,0.3,0.04,733.33,0.3,2304022.8,526.67,0.1,True,80.02,0.05,0.04,0.01,2026-02-18,4.02,8.96,0,,3.86,ATH,False,False
18-02-2026 13:00,ENJSA,111.6,114.1,111.5,113.8,709520.0,0.3,2.2,0.18,1122.22,2.2,286928.1,147.28,0.14,True,63.32,0.1,0.04,0.06,2026-02-18,110.4,3.08,0,,109.5,114.0,False,False
18-02-2026 12:00,PAHOL,1.7,1.73,1.7,1.73,175946982.0,0.0,0.03,0.0,2900.0,0.03,58884779.6,198.8,0.0,True,60.86,0.0,0.0,0.0,2026-02-18,1.7,1.76,1,1.73,1.69,ATH,False,False
18-02-2026 12:00,ARFYE,30.24,30.72,30.22,30.68,1740362.0,0.04,0.44,0.08,450.0,0.44,1005277.7,73.12,0.09,True,63.27,0.01,-0.08,0.09,2026-02-18,29.92,2.54,0,,29.6,31.86,False,False
18-02-2026 12:00,PRZMA,11.66,11.97,11.5,11.92,393157.0,0.05,0.26,0.05,465.22,0.26,112364.3,249.89,0.19,True,73.93,0.14,0.07,0.06,2026-02-18,11.46,4.01,0,,11.1,11.97,False,False
18-02-2026 12:00,KAYSE,5.6,5.85,5.59,5.8,22215342.0,0.05,0.2,0.01,1328.57,0.2,10671100.5,108.18,0.25,True,69.81,0.1,0.1,0.0,2026-02-18,5.5,5.45,0,,5.48,5.97,False,False
18-02-2026 12:00,METRO,5.81,5.94,5.79,5.94,2460218.0,0.0,0.13,0.02,766.67,0.13,1129920.2,117.73,0.0,True,58.51,-0.01,-0.02,0.01,2026-02-18,5.81,2.24,0,,5.67,6.13,False,False
18-02-2026 12:00,ODAS,6.3,6.48,6.29,6.46,18079178.0,0.02,0.16,0.01,1042.86,0.16,7243627.7,149.59,0.13,True,68.5,0.02,0.02,0.0,2026-02-18,6.2,4.19,0,,6.18,6.48,False,False
18-02-2026 12:00,AVOD,5.15,5.23,5.11,5.21,2193685.0,0.02,0.06,0.0,2900.0,0.06,1115124.9,96.72,0.33,True,58.14,0.0,0.0,0.0,2026-02-18,5.1,2.16,1,5.23,5.04,5.23,False,False
18-02-2026 12:00,MERIT,18.54,18.89,18.51,18.8,1022526.0,0.09,0.26,0.0,6400.0,0.26,673354.0,51.86,0.35,True,63.83,0.08,0.1,-0.02,2026-02-18,18.52,1.51,0,,17.62,18.85,False,False
18-02-2026 12:00,KZGYO,26.32,26.68,26.22,26.66,267872.0,0.02,0.34,0.04,672.73,0.34,142611.6,87.83,0.06,True,60.69,0.05,0.05,-0.0,2026-02-18,26.42,0.91,0,,26.14,26.98,False,False
18-02-2026 12:00,EGEPO,11.54,11.73,11.53,11.7,1867205.0,0.03,0.16,0.01,2185.71,0.16,376554.9,395.87,0.19,True,55.61,0.0,0.01,-0.01,2026-02-18,11.55,1.3,1,11.73,11.3,11.73,False,False
18-02-2026 12:00,PETUN,13.35,13.61,13.31,13.54,1143686.0,0.07,0.19,0.03,533.33,0.19,424254.3,169.58,0.37,True,64.32,0.04,0.04,-0.0,2026-02-18,13.32,1.65,0,,13.03,ATH,False,False
18-02-2026 11:00,BIMAS,706.0,714.0,704.5,713.0,1551551.0,1.0,7.0,0.3,2233.33,7.0,727215.8,113.35,0.14,True,58.34,-0.52,0.06,-0.59,2026-02-18,699.0,2.0,0,,691.0,724.5,False,False
18-02-2026 11:00,BURCE,59.55,62.0,59.3,61.5,214265.0,0.5,1.95,0.31,529.03,1.95,125699.4,70.46,0.26,True,58.56,-0.26,-0.32,0.06,2026-02-18,59.0,4.24,1,62.0,57.7,62.0,False,False
18-02-2026 11:00,DESA,13.14,13.49,13.06,13.4,708035.0,0.09,0.26,0.05,409.8,0.26,198245.9,257.15,0.35,True,84.97,0.2,0.17,0.02,2026-02-18,12.79,4.77,0,,12.67,ATH,False,False
18-02-2026 11:00,KCHOL,222.1,225.3,221.9,225.2,8800273.0,0.1,3.1,0.48,545.83,3.1,3207031.4,174.41,0.03,True,61.86,0.59,0.76,-0.17,2026-02-18,220.8,1.99,0,,219.7,229.1,False,False
18-02-2026 11:00,A1YEN,33.4,34.02,33.3,33.92,737701.0,0.1,0.52,0.1,409.8,0.52,344915.3,113.88,0.19,True,75.47,0.4,0.38,0.03,2026-02-18,33.2,2.17,0,,31.14,ATH,False,False
18-02-2026 11:00,GARFA,31.32,32.78,31.18,32.5,1665487.0,0.28,1.18,0.31,278.21,1.18,379223.2,339.18,0.24,True,89.38,0.52,0.28,0.24,2026-02-18,30.04,8.19,0,,29.16,ATH,False,False
18-02-2026 11:00,ALKIM,19.87,20.02,19.86,19.98,460830.0,0.04,0.11,0.0,5400.0,0.11,235358.5,95.8,0.36,True,56.45,0.02,0.02,-0.0,2026-02-18,19.83,0.76,1,20.02,19.53,20.02,False,False
18-02-2026 11:00,RUBNS,35.68,37.3,35.6,37.24,774454.0,0.06,1.56,0.14,998.59,1.56,468708.4,65.23,0.04,True,73.69,0.63,0.52,0.11,2026-02-18,35.58,4.67,0,,31.5,ATH,False,False
18-02-2026 11:00,AKBNK,90.1,91.55,90.05,91.35,29596136.0,0.2,1.25,0.11,1036.36,1.25,10566142.6,180.1,0.16,True,63.45,0.4,0.4,-0.0,2026-02-18,88.9,2.76,0,,88.9,91.7,False,False
18-02-2026 11:00,XU030,15789.84,15938.61,15786.81,15907.64,1411147644.0,30.97,117.8,18.56,534.73,117.8,706881159.4,99.63,0.26,True,61.74,34.63,41.95,-7.32,2026-02-18,15616.21,1.87,0,,15622.71,16011.0,False,False
18-02-2026 11:00,XU100,14372.4,14487.45,14372.4,14459.4,1853040885.0,28.05,87.0,14.21,512.42,87.0,1130850179.2,63.86,0.32,True,64.36,47.85,51.24,-3.4,2026-02-18,14227.29,1.63,0,,14109.21,ATH,False,False
18-02-2026 11:00,AEFES,21.52,21.74,21.5,21.72,9719028.0,0.02,0.2,0.01,1900.0,0.2,5297879.9,83.45,0.1,True,51.61,0.01,0.08,-0.06,2026-02-18,21.5,1.02,0,,21.48,22.3,False,False
18-02-2026 11:00,ALKA,13.43,13.8,13.41,13.74,2265674.0,0.06,0.31,0.02,1723.53,0.31,903206.9,150.85,0.19,True,65.5,0.06,0.06,-0.0,2026-02-18,13.51,1.7,1,13.8,13.35,13.8,False,False
18-02-2026 11:00,YKBNK,42.4,43.58,42.4,43.5,53012980.0,0.08,1.1,0.15,643.24,1.1,19355753.4,173.89,0.07,True,65.25,0.23,0.21,0.02,2026-02-18,41.68,4.37,0,,41.68,ATH,False,False
18-02-2026 11:00,SAHOL,110.4,111.9,110.2,111.9,9443546.0,0.0,1.5,0.08,1775.0,1.5,3988987.9,136.74,0.0,True,56.19,0.14,0.36,-0.22,2026-02-18,110.0,1.73,0,,110.0,115.0,False,False
18-02-2026 11:00,XBANK,20468.53,20813.02,20468.53,20744.41,322932541.0,68.61,275.88,35.05,686.99,275.88,132693428.0,143.37,0.25,True,63.42,74.09,70.83,3.27,2026-02-18,20188.05,2.76,0,,20188.05,20749.2,False,False
18-02-2026 10:00,ICUGS,3.31,3.54,3.31,3.51,18371074.0,0.03,0.2,0.02,852.38,0.2,5884427.9,212.2,0.15,True,74.22,0.1,0.11,-0.01,2026-02-18,3.28,7.01,0,,2.89,ATH,False,False
18-02-2026 10:00,TRENJ,109.5,111.3,109.4,111.2,746201.0,0.1,1.7,0.21,709.52,1.7,245899.3,203.46,0.06,True,64.43,0.47,0.37,0.1,2026-02-18,108.4,2.58,0,,106.9,111.8,False,False
18-02-2026 10:00,AFYON,15.11,15.32,15.03,15.28,935069.0,0.04,0.17,0.01,1788.89,0.17,256571.1,264.45,0.24,True,61.59,0.04,0.05,-0.02,2026-02-18,15.11,1.13,0,,14.78,15.52,False,False
18-02-2026 10:00,KARSN,11.46,11.87,11.4,11.77,13310925.0,0.1,0.31,0.07,324.66,0.31,5239233.9,154.06,0.32,True,84.96,0.25,0.21,0.04,2026-02-18,11.45,2.79,0,,10.12,ATH,False,False
18-02-2026 10:00,MARBL,13.76,14.02,13.75,13.97,712449.0,0.05,0.21,0.02,740.0,0.21,277045.5,157.16,0.24,True,53.16,0.04,0.06,-0.03,2026-02-18,13.93,0.29,0,,13.33,14.12,False,False
18-02-2026 10:00,AKHAN,28.28,30.1,28.16,29.84,25095107.0,0.26,1.56,0.17,806.98,1.56,5115232.5,390.6,0.17,True,64.33,-0.14,-0.28,0.14,2026-02-18,28.16,5.97,1,30.1,27.8,30.1,True,False
18-02-2026 10:00,CGCAM,39.02,40.28,38.96,40.1,2488255.0,0.18,1.08,0.05,2247.83,1.08,710874.0,250.03,0.17,True,63.12,0.07,0.04,0.03,2026-02-18,38.46,4.26,1,40.28,37.42,40.28,False,False
18-02-2026 10:00,AYEN,30.26,32.46,30.22,32.3,2175061.0,0.16,2.04,0.18,1033.33,2.04,335590.1,548.13,0.08,True,81.3,0.29,0.23,0.07,2026-02-18,30.14,7.17,0,,29.88,ATH,False,False
18-02-2026 10:00,MACKO,37.5,40.12,36.94,40.08,5634460.0,0.04,2.58,0.26,900.0,2.58,672948.1,737.28,0.02,True,99.11,1.88,1.77,0.11,2026-02-18,36.86,8.74,0,,33.52,ATH,False,False
18-02-2026 10:00,KRVGD,3.25,3.32,3.2,3.31,3042950.0,0.01,0.06,0.01,445.45,0.06,1004235.3,203.01,0.17,True,75.76,0.04,0.03,0.01,2026-02-18,3.24,2.16,0,,3.15,ATH,False,False
18-02-2026 10:00,KRDMD,31.72,32.6,31.7,32.44,26481706.0,0.16,0.72,0.05,1340.0,0.72,5489514.2,382.41,0.22,True,63.22,0.1,0.1,-0.0,2026-02-18,31.78,2.08,0,,31.4,32.66,False,False
18-02-2026 10:00,PLTUR,24.84,25.9,24.5,25.6,1504560.0,0.3,0.76,0.08,874.36,0.76,336018.7,347.76,0.39,True,78.46,0.15,0.07,0.07,2026-02-18,24.74,3.48,0,,24.36,26.12,False,False
18-02-2026 10:00,DSTKF,1070.0,1126.0,1069.0,1123.0,359760.0,3.0,53.0,14.05,277.22,53.0,148695.4,141.94,0.06,True,86.77,41.61,32.81,8.8,2026-02-18,1080.0,3.98,0,,925.0,ATH,False,False
18-02-2026 10:00,AKFIS,31.04,32.78,30.3,32.62,11595332.0,0.16,1.58,0.25,522.05,1.58,2016298.0,475.08,0.1,True,96.92,1.64,1.55,0.09,2026-02-18,30.72,6.18,0,,22.38,ATH,False,False
18-02-2026 10:00,KMPUR,16.53,16.84,16.47,16.81,874465.0,0.03,0.28,0.05,471.43,0.28,286201.8,205.54,0.11,True,75.59,0.13,0.11,0.02,2026-02-18,16.5,1.88,0,,15.55,ATH,False,False
18-02-2026 10:00,VAKFN,2.24,2.29,2.24,2.29,46262712.0,0.0,0.05,0.01,614.29,0.05,9782400.2,372.92,0.0,True,78.28,0.03,0.03,0.0,2026-02-18,2.23,2.69,0,,2.05,ATH,False,False
18-02-2026 10:00,KBORU,18.6,20.96,18.47,20.82,14587330.0,0.14,2.22,0.29,662.89,2.22,3287230.0,343.76,0.06,True,66.71,0.14,0.03,0.11,2026-02-18,19.54,6.55,2,18.47,18.47,ATH,False,False
18-02-2026 10:00,AHGAZ,25.38,25.8,25.22,25.7,1414975.0,0.1,0.32,0.04,742.11,0.32,858780.0,64.77,0.31,True,60.09,0.04,-0.02,0.06,2026-02-18,25.0,2.8,0,,24.78,26.06,False,False
18-02-2026 10:00,MARTI,3.0,3.04,2.98,3.03,4404517.0,0.01,0.03,0.0,650.0,0.03,1451187.5,203.51,0.33,True,58.91,0.01,0.01,-0.0,2026-02-18,3.0,1.0,1,3.04,2.97,3.04,False,False
18-02-2026 10:00,MNDRS,16.49,16.61,16.25,16.58,2507193.0,0.03,0.09,0.01,592.31,0.09,465319.4,438.81,0.33,True,81.92,0.18,0.15,0.04,2026-02-18,16.0,3.62,0,,15.42,ATH,False,False
18-02-2026 10:00,MTRKS,24.08,24.38,23.82,24.34,368586.0,0.04,0.26,0.05,441.67,0.26,191123.9,92.85,0.15,True,74.79,0.26,0.25,0.01,2026-02-18,24.04,1.25,0,,22.48,24.5,False,False
18-02-2026 10:00,OZSUB,20.92,21.38,20.82,21.28,454306.0,0.1,0.36,0.01,5900.0,0.36,205213.1,121.38,0.28,True,54.17,0.03,0.08,-0.04,2026-02-18,20.92,1.72,2,20.82,20.82,21.58,False,False
18-02-2026 10:00,IEYHO,80.3,81.25,80.3,81.2,1234177.0,0.05,0.9,0.08,1025.0,0.9,584629.4,111.1,0.06,True,79.68,0.46,0.4,0.06,2026-02-18,80.0,1.5,0,,78.45,ATH,False,False
18-02-2026 10:00,ARDYZ,46.04,47.66,45.98,47.26,3542418.0,0.4,1.22,0.02,5445.45,1.22,592869.2,497.5,0.33,True,63.18,-0.07,-0.09,0.02,2026-02-18,44.8,5.49,1,47.66,43.36,47.66,False,False
18-02-2026 10:00,EKSUN,6.11,6.17,6.05,6.16,1478649.0,0.01,0.05,0.01,733.33,0.05,554455.5,166.68,0.2,True,64.46,0.04,0.04,-0.01,2026-02-18,6.11,0.82,0,,6.06,6.18,False,False
18-02-2026 10:00,NTGAZ,12.29,12.44,12.26,12.44,962831.0,0.0,0.15,0.01,2400.0,0.15,391030.6,146.23,0.0,True,61.88,0.11,0.14,-0.03,2026-02-18,12.37,0.57,0,,11.07,12.61,False,False
18-02-2026 10:00,BAYRK,4.92,4.97,4.91,4.96,1266221.0,0.01,0.04,0.0,1233.33,0.04,729043.1,73.68,0.25,True,44.05,-0.01,0.01,-0.02,2026-02-18,4.99,-0.6,0,,4.59,5.35,False,False
18-02-2026 10:00,NETCD,99.95,108.5,99.75,108.5,15006660.0,0.0,8.55,1.08,691.67,8.55,8271900.2,81.42,0.0,True,68.99,3.55,3.9,-0.35,2026-02-18,98.65,9.98,1,108.5,93.0,ATH,False,False
18-02-2026 10:00,CIMSA,54.5,55.8,54.1,55.55,5259495.0,0.25,1.05,0.05,1809.09,1.05,1197808.0,339.09,0.24,True,67.35,0.28,0.31,-0.03,2026-02-18,53.95,2.97,0,,53.85,55.85,False,False
18-02-2026 10:00,BRKSN,8.9,9.05,8.9,9.05,401254.0,0.0,0.15,0.02,733.33,0.15,234627.4,71.02,0.0,True,48.25,-0.03,-0.02,-0.01,2026-02-18,8.97,0.89,0,,8.7,9.29,False,False
17-02-2026 17:00,CEMAS,6.22,6.47,6.2,6.44,17068554.0,0.03,0.22,0.01,1471.43,0.22,5133582.3,232.49,0.14,True,62.49,0.04,0.06,-0.02,2026-02-17,6.28,2.55,1,6.47,6.15,6.47,False,False
17-02-2026 17:00,MEKAG,5.2,5.32,5.17,5.32,3064565.0,0.0,0.12,0.0,11900.0,0.12,1681775.8,82.22,0.0,True,65.01,0.04,0.04,-0.0,2026-02-17,5.29,0.57,0,,5.13,5.42,False,False
17-02-2026 17:00,AZTEK,4.87,4.93,4.86,4.92,2162707.0,0.01,0.05,0.0,2400.0,0.05,777475.9,178.17,0.2,True,60.35,0.02,0.02,-0.0,2026-02-17,4.9,0.41,0,,4.72,4.94,False,False
17-02-2026 17:00,DMRGD,4.45,4.54,4.44,4.53,8998158.0,0.01,0.08,0.02,400.0,0.08,3441012.7,161.5,0.12,True,72.84,0.05,0.05,0.0,2026-02-17,4.41,2.72,1,4.54,3.98,4.54,False,False
17-02-2026 17:00,ETILR,4.25,4.28,4.21,4.28,1410831.0,0.0,0.03,0.0,2900.0,0.03,541244.0,160.66,0.0,True,61.32,0.02,0.02,-0.0,2026-02-17,4.27,0.23,0,,4.16,4.33,False,False
17-02-2026 17:00,PENGD,9.35,10.29,9.34,10.29,14889020.0,0.0,0.94,0.09,956.18,0.94,1959892.9,659.69,0.0,True,83.47,0.09,0.03,0.05,2026-02-17,9.36,9.94,0,,9.2,ATH,False,False
17-02-2026 17:00,TATEN,10.25,10.32,10.2,10.32,4529520.0,0.0,0.07,0.01,600.0,0.07,2262040.1,100.24,0.0,True,57.74,0.01,0.0,0.0,2026-02-17,10.16,1.57,0,,10.1,10.39,False,False
17-02-2026 17:00,YUNSA,10.67,11.2,10.65,11.1,4638490.0,0.1,0.43,0.08,418.07,0.43,1655653.6,180.16,0.23,True,79.26,0.14,0.06,0.08,2026-02-17,10.27,8.08,1,11.2,10.07,11.2,False,False
17-02-2026 17:00,GSDHO,5.22,5.38,5.2,5.34,5867173.0,0.04,0.12,0.01,1233.33,0.12,1787648.3,228.21,0.33,True,61.64,-0.0,0.0,-0.01,2026-02-17,5.35,-0.19,0,,5.14,5.44,False,False
17-02-2026 17:00,LIDER,75.9,77.55,75.8,77.4,275913.0,0.15,1.5,0.28,435.71,1.5,96643.8,185.49,0.1,True,60.02,-0.04,-0.22,0.18,2026-02-17,74.8,3.48,1,77.55,74.2,77.55,False,False
17-02-2026 17:00,MHRGY,3.88,4.0,3.87,3.98,3142696.0,0.02,0.1,0.01,566.67,0.1,712478.7,341.09,0.2,True,76.11,0.02,0.01,0.01,2026-02-17,3.85,3.38,1,4.0,3.82,4.0,False,False
17-02-2026 17:00,CONSE,3.86,3.93,3.85,3.91,5002830.0,0.02,0.05,0.01,733.33,0.05,1301356.8,284.43,0.4,True,68.51,0.03,0.03,0.0,2026-02-17,3.83,2.09,0,,3.81,ATH,False,False
17-02-2026 17:00,TNZTP,27.98,28.34,27.98,28.3,886722.0,0.04,0.32,0.0,7900.0,0.32,521541.7,70.02,0.12,True,59.42,0.15,0.23,-0.08,2026-02-17,28.2,0.35,0,,ATL,28.84,False,False
17-02-2026 17:00,RYSAS,19.0,19.39,19.0,19.35,5909714.0,0.04,0.35,0.03,1246.15,0.35,846307.0,598.29,0.11,True,64.52,0.01,0.0,0.01,2026-02-17,19.1,1.31,0,,18.9,20.38,False,False
17-02-2026 16:00,MOPAS,56.45,58.35,56.2,57.9,2038451.0,0.45,1.45,0.03,4733.33,1.45,538549.6,278.51,0.31,True,59.21,-0.26,-0.34,0.08,2026-02-17,55.3,4.7,1,58.35,54.35,58.35,False,False
17-02-2026 16:00,ULKER,138.1,140.0,137.6,139.5,949820.0,0.5,1.4,0.13,976.92,1.4,542537.5,75.07,0.36,True,60.07,0.29,0.37,-0.08,2026-02-17,138.7,0.58,1,140.0,136.1,140.0,False,False
17-02-2026 16:00,LIDFA,3.19,3.25,3.18,3.25,3354157.0,0.0,0.06,0.01,361.54,0.06,1394125.7,140.59,0.0,True,70.44,0.02,0.01,0.01,2026-02-17,3.14,3.5,0,,3.11,ATH,False,False
17-02-2026 16:00,INDES,8.87,9.1,8.85,9.05,1817224.0,0.05,0.18,0.03,500.0,0.18,1096387.8,65.75,0.28,True,76.44,0.11,0.09,0.01,2026-02-17,8.76,3.31,0,,8.66,ATH,False,False
17-02-2026 16:00,MOBTL,11.02,11.24,10.85,11.19,5366582.0,0.05,0.17,0.02,580.0,0.17,1223899.2,338.48,0.29,True,66.02,0.04,0.03,0.01,2026-02-17,10.99,1.82,1,11.24,10.83,11.24,False,False
17-02-2026 16:00,DOAS,242.2,245.1,241.0,244.5,399466.0,0.6,2.3,0.35,557.14,2.3,234447.7,70.39,0.26,True,67.8,1.15,1.07,0.08,2026-02-17,241.9,1.07,0,,239.2,245.0,False,False
17-02-2026 16:00,KRSTL,12.04,12.3,11.98,12.27,1349984.0,0.03,0.23,0.01,3185.71,0.23,708972.6,90.41,0.13,True,55.09,-0.03,-0.01,-0.02,2026-02-17,12.31,-0.32,0,,11.83,12.45,False,False
17-02-2026 15:00,HRKET,87.6,89.95,87.5,89.5,270219.0,0.45,1.9,0.12,1483.33,1.9,100480.8,168.93,0.24,True,67.06,0.55,0.42,0.14,2026-02-17,87.8,1.94,1,89.95,84.85,89.95,False,False
17-02-2026 15:00,ONRYT,72.5,73.5,72.5,73.4,303836.0,0.1,0.9,0.14,542.86,0.9,136561.4,122.49,0.11,True,65.53,0.08,0.01,0.07,2026-02-17,72.15,1.73,0,,71.65,73.75,False,False
17-02-2026 15:00,DEVA,78.4,80.1,78.1,80.0,148124.0,0.1,1.6,0.2,680.49,1.6,55178.4,168.45,0.06,True,67.38,0.21,0.13,0.07,2026-02-17,78.0,2.56,0,,77.5,81.75,False,False
17-02-2026 15:00,TUREX,8.18,8.29,8.16,8.27,4382199.0,0.02,0.09,0.0,2900.0,0.09,2511066.0,74.52,0.22,True,62.36,0.07,0.09,-0.02,2026-02-17,8.25,0.24,0,,8.07,8.4,False,False
17-02-2026 15:00,BESLR,15.4,16.57,15.35,16.4,2519837.0,0.17,1.0,0.08,1119.51,1.0,746459.1,237.57,0.17,True,74.68,0.14,0.13,0.01,2026-02-17,15.56,5.4,0,,15.06,ATH,False,False
17-02-2026 15:00,SDTTR,202.4,214.8,202.4,213.3,977973.0,1.5,10.9,1.25,772.0,10.9,154591.1,532.62,0.14,True,78.1,2.34,1.89,0.46,2026-02-17,200.8,6.23,0,,199.2,ATH,False,False
17-02-2026 15:00,TRALT,53.75,54.75,53.7,54.75,13328004.0,0.0,1.0,0.18,455.56,1.0,8808119.0,51.31,0.0,True,63.87,0.28,0.24,0.03,2026-02-17,53.75,1.86,0,,51.95,ATH,False,False
17-02-2026 15:00,ANELE,17.14,18.06,17.12,17.9,2296107.0,0.16,0.76,0.11,597.25,0.76,376171.4,510.39,0.21,True,86.86,0.21,0.14,0.07,2026-02-17,16.85,6.23,1,18.06,15.66,18.06,False,False
17-02-2026 14:00,LILAK,33.98,34.64,33.92,34.54,2947065.0,0.1,0.56,0.04,1172.73,0.56,992812.8,196.84,0.18,True,68.37,0.33,0.35,-0.02,2026-02-17,34.02,1.53,0,,33.34,ATH,False,False
17-02-2026 14:00,PRDGS,7.65,7.94,7.64,7.86,4023734.0,0.08,0.21,0.04,388.37,0.21,1580963.1,154.51,0.38,True,71.63,0.09,0.06,0.03,2026-02-17,7.56,3.97,1,7.94,7.23,7.94,False,False
17-02-2026 14:00,HKTM,13.33,13.83,13.31,13.8,1264489.0,0.03,0.47,0.05,859.18,0.47,506339.5,149.73,0.06,True,68.57,0.01,-0.02,0.04,2026-02-17,13.25,4.15,0,,13.19,ATH,False,False
17-02-2026 13:00,TURGG,33.1,34.3,32.8,34.22,932466.0,0.08,1.12,0.15,656.76,1.12,321593.3,189.95,0.07,True,74.43,0.7,0.63,0.07,2026-02-17,31.96,7.07,0,,31.5,ATH,False,False
17-02-2026 13:00,DUNYH,128.6,136.4,128.2,136.4,839066.0,0.0,7.8,1.37,469.34,7.8,155129.3,440.88,0.0,True,82.39,2.61,1.81,0.8,2026-02-17,124.0,10.0,1,136.4,120.6,ATH,False,False
17-02-2026 13:00,ULUFA,4.35,4.42,4.35,4.42,1996799.0,0.0,0.07,0.01,677.78,0.07,1197736.2,66.71,0.0,True,70.37,0.05,0.05,0.0,2026-02-17,4.37,1.14,0,,4.16,4.43,False,False
17-02-2026 13:00,PINSU,11.52,11.68,11.5,11.67,864161.0,0.01,0.15,0.01,1263.64,0.15,404217.7,113.79,0.07,True,74.55,0.04,0.02,0.01,2026-02-17,11.47,1.74,0,,11.42,ATH,False,False
17-02-2026 12:00,ISFIN,21.18,21.56,21.16,21.48,432585.0,0.08,0.3,0.04,689.47,0.3,272707.1,58.63,0.27,True,69.3,0.14,0.16,-0.02,2026-02-17,21.22,1.23,0,,20.98,ATH,False,False
17-02-2026 12:00,TUKAS,2.94,3.0,2.94,2.99,35005811.0,0.01,0.05,0.0,2400.0,0.05,16686759.7,109.78,0.2,True,67.51,0.02,0.02,-0.0,2026-02-17,2.96,1.01,2,2.94,2.94,ATH,False,False
17-02-2026 12:00,INFO,4.51,4.74,4.51,4.69,18264629.0,0.05,0.18,0.01,1284.62,0.18,4243474.7,330.42,0.28,True,72.28,0.05,0.04,0.01,2026-02-17,4.5,4.22,1,4.74,4.22,4.74,False,False
17-02-2026 12:00,ORGE,73.55,76.3,73.5,75.6,566457.0,0.7,2.05,0.25,736.73,2.05,139432.4,306.26,0.34,True,78.0,0.72,0.59,0.12,2026-02-17,73.5,2.86,1,76.3,72.8,76.3,False,False
17-02-2026 12:00,SANFM,7.46,7.67,7.45,7.65,5835876.0,0.02,0.19,0.02,955.56,0.19,2018314.2,189.15,0.11,True,69.72,0.05,0.03,0.02,2026-02-17,7.44,2.82,0,,7.35,ATH,False,False
17-02-2026 12:00,HUNER,3.56,3.64,3.55,3.64,5009956.0,0.0,0.08,0.01,700.0,0.08,2286789.4,119.08,0.0,True,80.42,0.04,0.03,0.0,2026-02-17,3.54,2.82,0,,3.33,ATH,False,False
17-02-2026 12:00,RTALB,4.28,4.44,4.26,4.4,13810710.0,0.04,0.12,0.03,328.57,0.12,4976890.2,177.5,0.33,True,86.63,0.06,0.04,0.02,2026-02-17,4.19,5.01,0,,3.99,ATH,False,False
17-02-2026 12:00,PNLSN,43.7,44.24,43.5,44.24,134531.0,0.0,0.54,0.01,5300.0,0.54,80764.0,66.57,0.0,True,69.83,0.18,0.14,0.04,2026-02-17,43.46,1.79,0,,43.2,44.3,False,False
17-02-2026 12:00,A1CAP,17.51,18.49,17.49,18.23,6889250.0,0.26,0.72,0.14,425.55,0.72,1894096.6,263.72,0.36,True,79.91,0.25,0.13,0.12,2026-02-17,17.25,5.68,1,18.49,16.31,18.49,False,False
17-02-2026 12:00,DOFER,33.76,35.3,33.7,35.16,1266498.0,0.14,1.4,0.23,498.29,1.4,592872.2,113.62,0.1,True,87.84,0.57,0.37,0.2,2026-02-17,33.3,5.59,0,,31.56,ATH,False,False
17-02-2026 12:00,EGPRO,28.22,29.14,28.1,29.12,972348.0,0.02,0.9,0.02,4900.0,0.9,218785.5,344.43,0.02,True,70.47,0.35,0.35,0.01,2026-02-17,28.08,3.7,0,,27.72,ATH,False,False
17-02-2026 12:00,DAGI,6.42,6.48,6.42,6.48,828660.0,0.0,0.06,0.0,1900.0,0.06,430384.0,92.54,0.0,True,54.75,-0.01,-0.01,-0.0,2026-02-17,6.43,0.78,1,6.48,6.38,6.55,False,False
17-02-2026 12:00,BULGS,49.8,52.8,49.64,52.8,12396267.0,0.0,3.0,0.34,792.86,3.0,2824993.7,338.81,0.0,True,76.18,0.75,0.44,0.32,2026-02-17,48.0,10.0,0,,47.0,ATH,False,False
17-02-2026 12:00,DARDL,2.49,2.53,2.49,2.52,8120175.0,0.01,0.03,0.01,400.0,0.03,4717307.7,72.14,0.33,True,73.01,0.03,0.02,0.0,2026-02-17,2.48,1.61,0,,2.37,ATH,False,False
17-02-2026 11:00,GUNDG,283.5,323.75,272.0,323.75,714456.0,0.0,40.25,6.9,483.33,40.25,190715.9,274.62,0.0,True,76.22,10.29,7.6,2.69,2026-02-17,294.5,9.93,1,323.75,259.0,ATH,False,False
17-02-2026 11:00,TEZOL,14.42,14.8,14.42,14.7,1785923.0,0.1,0.28,0.03,833.33,0.28,709494.4,151.72,0.36,True,76.47,0.11,0.06,0.05,2026-02-17,14.32,2.65,1,14.8,14.0,14.8,False,False
17-02-2026 11:00,SEKUR,5.05,5.19,4.97,5.17,1112387.0,0.02,0.12,0.0,11900.0,0.12,363999.8,205.6,0.17,True,54.74,0.02,0.02,-0.0,2026-02-17,5.09,1.57,0,,4.8,5.25,False,False
17-02-2026 11:00,BEGYO,4.96,5.03,4.96,5.02,6570981.0,0.01,0.06,0.0,1900.0,0.06,2117011.6,210.39,0.17,True,71.98,0.04,0.03,0.0,2026-02-17,4.96,1.21,0,,4.92,ATH,False,False
17-02-2026 10:00,KLRHO,475.25,512.0,475.0,512.0,1040663.0,0.0,36.75,5.75,539.13,36.75,365234.4,184.93,0.0,True,67.51,1.31,-7.16,8.48,2026-02-17,475.0,7.79,0,,415.25,613.5,False,False
17-02-2026 10:00,ASUZU,69.35,72.25,69.05,71.75,983519.0,0.5,2.4,0.19,1197.3,2.4,182298.8,439.51,0.21,True,84.44,1.09,0.9,0.19,2026-02-17,68.8,4.29,0,,65.9,ATH,False,False
17-02-2026 10:00,SNICA,4.58,4.64,4.57,4.63,3252352.0,0.01,0.05,0.0,4900.0,0.05,1616190.5,101.24,0.2,True,55.03,-0.01,-0.01,-0.0,2026-02-17,4.57,1.31,2,4.57,4.57,4.65,False,False
17-02-2026 10:00,HEKTS,3.53,3.63,3.5,3.61,123128370.0,0.02,0.08,0.01,700.0,0.08,30015627.0,310.21,0.25,True,70.68,0.04,0.03,0.01,2026-02-17,3.51,2.85,1,3.63,3.37,3.63,False,False
17-02-2026 10:00,SURGY,66.95,69.8,63.7,69.5,14335435.0,0.3,2.55,0.25,900.0,2.55,1563670.8,816.78,0.12,True,93.11,2.67,2.24,0.43,2026-02-17,64.45,7.84,2,63.7,63.7,ATH,False,False
17-02-2026 10:00,ISMEN,51.8,52.65,51.7,52.65,1575282.0,0.0,0.85,0.11,709.52,0.85,844201.9,86.6,0.0,True,64.61,0.66,0.79,-0.13,2026-02-17,52.25,0.77,0,,47.14,53.2,False,False
17-02-2026 10:00,SEYKM,5.46,5.61,5.43,5.61,470588.0,0.0,0.15,0.03,383.87,0.15,247008.0,90.52,0.0,True,57.57,0.02,0.01,0.01,2026-02-17,5.5,2.0,0,,5.3,5.63,False,False
17-02-2026 10:00,DITAS,45.22,46.9,45.22,46.62,755301.0,0.28,1.4,0.2,593.07,1.4,433133.4,74.38,0.2,True,66.19,0.42,0.17,0.25,2026-02-17,45.18,3.19,0,,42.4,ATH,False,False
17-02-2026 10:00,KNFRT,12.89,13.06,12.83,13.02,842535.0,0.04,0.13,0.01,1525.0,0.13,458981.3,83.57,0.31,True,58.6,0.02,0.01,0.0,2026-02-17,12.89,1.01,1,13.06,12.75,13.06,False,False
17-02-2026 10:00,ENSRI,30.3,30.68,30.12,30.68,680948.0,0.0,0.38,0.05,691.67,0.38,341804.1,99.22,0.0,True,67.33,0.28,0.28,-0.0,2026-02-17,30.36,1.05,0,,29.42,ATH,False,False
17-02-2026 10:00,TTKOM,72.4,74.65,72.15,74.6,7713059.0,0.05,2.2,0.05,4300.0,2.2,2357802.9,227.13,0.02,True,73.73,1.16,1.07,0.08,2026-02-17,72.6,2.75,2,72.15,72.15,ATH,False,False
17-02-2026 10:00,DCTTR,8.67,8.91,8.6,8.89,3623494.0,0.02,0.22,0.03,547.06,0.22,1135912.1,218.99,0.09,True,74.38,0.12,0.11,0.01,2026-02-17,8.66,2.66,0,,8.11,ATH,False,False
17-02-2026 10:00,YKSLN,3.47,3.56,3.47,3.54,8056735.0,0.02,0.07,0.01,438.46,0.07,2502920.8,221.89,0.29,True,78.32,0.06,0.04,0.01,2026-02-17,3.46,2.31,0,,3.25,ATH,False,False
17-02-2026 10:00,HATSN,41.18,41.48,41.0,41.4,552361.0,0.08,0.22,0.03,547.06,0.22,206112.6,167.99,0.36,True,57.29,0.01,-0.05,0.06,2026-02-17,41.18,0.53,2,41.0,41.0,41.76,False,False
17-02-2026 10:00,HATEK,17.09,18.21,16.29,18.06,5462680.0,0.15,0.97,0.13,623.88,0.97,1268375.4,330.68,0.15,True,82.83,0.46,0.33,0.13,2026-02-17,17.1,5.61,2,16.29,16.29,ATH,False,False
16-02-2026 18:00,PASEU,135.4,139.0,135.4,139.0,1251493.0,0.0,3.6,0.38,847.37,3.6,645357.3,93.92,0.0,True,60.51,-0.88,-1.82,0.94,2026-02-16,135.0,2.96,1,139.0,126.5,148.0,False,False
16-02-2026 17:00,OZYSR,53.6,55.7,53.6,55.7,537205.0,0.0,2.1,0.18,1100.0,2.1,185996.6,188.83,0.0,True,67.22,0.4,0.41,-0.01,2026-02-16,53.8,3.53,0,,53.1,ATH,False,False
16-02-2026 17:00,MGROS,691.5,695.0,691.0,694.5,557843.0,0.5,3.0,0.4,650.0,3.0,329399.9,69.35,0.17,True,64.18,4.93,4.9,0.04,2026-02-16,686.5,1.17,0,,663.5,698.5,False,False
16-02-2026 17:00,GUBRF,540.0,543.5,540.0,542.5,377330.0,1.0,2.5,0.1,2400.0,2.5,243018.7,55.27,0.4,True,48.84,-0.21,1.0,-1.2,2026-02-16,540.5,0.37,0,,536.0,566.5,False,False
16-02-2026 17:00,SISE,50.3,50.9,50.25,50.8,17540596.0,0.1,0.5,0.09,488.24,0.5,10166465.5,72.53,0.2,True,75.47,0.5,0.46,0.04,2026-02-16,49.54,2.54,1,50.9,46.68,50.9,False,False
16-02-2026 17:00,IMASM,4.68,4.77,4.65,4.76,9279713.0,0.01,0.08,0.01,700.0,0.08,5069793.5,83.04,0.12,True,62.35,0.02,0.01,0.01,2026-02-16,4.62,3.03,0,,4.6,4.8,False,False
16-02-2026 17:00,SASA,2.74,2.79,2.73,2.78,807889094.0,0.01,0.04,0.0,900.0,0.04,304754535.4,165.1,0.25,True,74.76,0.03,0.03,-0.0,2026-02-16,2.7,2.96,1,2.79,2.5,2.79,False,False
16-02-2026 17:00,EUREN,5.83,6.1,5.81,6.1,46859432.0,0.0,0.27,0.05,409.43,0.27,11438842.4,309.65,0.0,True,90.29,0.11,0.07,0.04,2026-02-16,5.55,9.91,0,,5.44,ATH,False,False
16-02-2026 16:00,PENTA,14.89,15.28,14.87,15.19,1633215.0,0.09,0.3,0.04,689.47,0.3,498477.6,227.64,0.3,True,74.83,0.12,0.09,0.03,2026-02-16,14.66,3.62,0,,14.59,ATH,False,False
16-02-2026 16:00,ARMGD,85.8,87.45,85.75,87.45,111263.0,0.0,1.65,0.22,667.44,1.65,50374.4,120.87,0.0,True,63.33,0.15,0.06,0.1,2026-02-16,85.5,2.28,0,,85.5,87.9,False,False
16-02-2026 16:00,TDGYO,28.32,30.0,28.3,30.0,1240327.0,0.0,1.68,0.22,677.78,1.68,249349.3,397.43,0.0,True,73.26,0.59,0.47,0.12,2026-02-16,27.28,9.97,0,,26.8,ATH,False,False
16-02-2026 15:00,CWENE,32.7,33.06,32.7,33.0,11433368.0,0.06,0.3,0.06,435.71,0.3,5702396.7,100.5,0.2,True,66.46,0.08,0.01,0.07,2026-02-16,32.3,2.17,0,,32.06,33.4,False,False
16-02-2026 15:00,ZERGY,19.24,20.28,19.17,20.26,15095752.0,0.02,1.02,0.1,890.29,1.02,6058415.1,149.17,0.02,True,62.1,-0.18,-0.34,0.17,2026-02-16,18.6,8.92,0,,17.47,21.86,True,False
16-02-2026 15:00,KRONT,16.3,16.7,16.26,16.64,832665.0,0.06,0.34,0.03,1114.29,0.34,287813.3,189.31,0.18,True,66.16,0.08,0.07,0.01,2026-02-16,16.26,2.34,0,,16.04,ATH,False,False
16-02-2026 14:00,GZNMI,64.3,67.9,62.35,67.6,6833156.0,0.3,3.3,0.0,65900.0,3.3,934336.6,631.34,0.09,True,68.79,3.23,3.02,0.21,2026-02-16,61.75,9.47,0,,50.85,67.9,False,False
16-02-2026 14:00,BSOKE,30.08,30.96,29.96,30.74,2021526.0,0.22,0.66,0.07,900.0,0.66,849942.4,137.84,0.33,True,67.21,0.11,0.06,0.05,2026-02-16,29.8,3.15,0,,29.66,ATH,False,False
16-02-2026 14:00,IZENR,9.79,9.91,9.78,9.88,6754002.0,0.03,0.09,0.03,221.43,0.09,3618282.7,86.66,0.33,True,76.85,0.04,0.01,0.03,2026-02-16,9.6,2.92,0,,9.52,ATH,False,False
16-02-2026 13:00,TCKRC,89.1,90.6,88.95,90.4,293008.0,0.2,1.3,0.17,664.71,1.3,192421.9,52.27,0.15,True,67.42,0.02,-0.22,0.24,2026-02-16,87.85,2.9,0,,87.15,90.6,False,False
16-02-2026 13:00,SMART,32.0,33.9,31.82,33.78,2512488.0,0.12,1.78,0.19,817.53,1.78,1279924.0,96.3,0.07,True,89.96,1.37,1.41,-0.04,2026-02-16,31.76,6.36,0,,ATL,ATH,False,False
16-02-2026 13:00,CEOEM,23.3,23.76,23.28,23.66,301033.0,0.1,0.36,0.07,414.29,0.36,169783.5,77.3,0.28,True,68.76,0.17,0.14,0.04,2026-02-16,23.06,2.6,0,,22.8,ATH,False,False
16-02-2026 12:00,AKYHO,2.95,2.97,2.91,2.97,663111.0,0.0,0.02,0.0,900.0,0.02,257485.2,157.53,0.0,True,62.29,0.01,0.0,0.0,2026-02-16,2.93,1.37,2,2.91,2.91,ATH,False,False
16-02-2026 12:00,TAVHL,363.0,367.25,362.25,366.5,589792.0,0.75,3.5,0.35,900.0,3.5,287999.0,104.79,0.21,True,61.23,1.7,1.22,0.47,2026-02-16,361.5,1.38,0,,350.25,367.75,False,False
16-02-2026 12:00,ADESE,1.28,1.32,1.26,1.32,459275946.0,0.0,0.04,0.01,400.0,0.04,85864371.2,434.89,0.0,True,82.56,0.02,0.01,0.01,2026-02-16,1.2,10.0,0,,1.2,ATH,False,False
16-02-2026 11:00,KLMSN,31.92,32.16,31.92,32.12,199968.0,0.04,0.2,0.01,2400.0,0.2,117997.8,69.47,0.2,True,64.99,0.26,0.29,-0.03,2026-02-16,31.64,1.52,0,,31.4,33.48,False,False
16-02-2026 11:00,BORSK,6.71,6.85,6.69,6.84,3162038.0,0.01,0.13,0.03,364.29,0.13,1660342.3,90.44,0.08,True,77.59,0.08,0.05,0.02,2026-02-16,6.61,3.48,0,,6.33,ATH,False,False
16-02-2026 11:00,HTTBT,46.2,46.88,46.18,46.88,284488.0,0.0,0.68,0.1,566.67,0.68,116776.1,143.62,0.0,True,70.79,0.39,0.34,0.05,2026-02-16,45.88,2.18,0,,44.1,ATH,False,False
16-02-2026 11:00,TSPOR,1.1,1.13,1.1,1.13,73318975.0,0.0,0.03,0.0,1400.0,0.03,29453382.8,148.93,0.0,True,63.84,0.01,0.01,-0.0,2026-02-16,1.11,1.8,2,1.1,1.1,ATH,False,False
16-02-2026 11:00,IHEVA,2.39,2.43,2.39,2.42,1046130.0,0.01,0.03,0.01,400.0,0.03,329213.1,217.77,0.33,True,69.88,0.01,0.0,0.01,2026-02-16,2.34,3.42,0,,2.34,ATH,False,False
16-02-2026 11:00,GLRYH,4.61,4.69,4.61,4.68,3809507.0,0.01,0.07,0.01,366.67,0.07,1253420.9,203.93,0.14,True,63.23,0.01,-0.0,0.01,2026-02-16,4.55,2.86,0,,4.53,4.72,False,False
16-02-2026 11:00,OTKAR,426.5,433.5,424.5,432.5,1188367.0,1.0,6.0,0.55,990.91,6.0,425199.3,179.48,0.17,True,31.58,-2.1,2.32,-4.42,2026-02-16,469.0,-7.78,2,424.5,424.5,470.75,False,False
16-02-2026 11:00,BLUME,46.22,46.78,46.16,46.7,436532.0,0.08,0.48,0.05,823.08,0.48,229685.8,90.06,0.17,True,57.51,-0.07,-0.11,0.04,2026-02-16,45.92,1.7,0,,45.86,46.82,True,False
16-02-2026 11:00,EGEGY,33.8,34.62,33.8,34.46,635547.0,0.16,0.66,0.09,602.13,0.66,238951.9,165.97,0.24,True,72.3,0.25,0.16,0.09,2026-02-16,33.2,3.8,1,34.62,32.78,34.62,False,False
16-02-2026 11:00,PRKME,21.16,21.4,21.16,21.38,503846.0,0.02,0.22,0.04,511.11,0.22,236107.8,113.4,0.09,True,63.94,0.01,-0.03,0.03,2026-02-16,20.96,2.0,0,,20.8,21.48,False,False
16-02-2026 11:00,ARENA,28.7,29.04,28.64,29.04,429464.0,0.0,0.34,0.08,304.76,0.34,155509.3,176.17,0.0,True,75.5,0.14,0.08,0.06,2026-02-16,28.36,2.4,0,,27.7,ATH,False,False
16-02-2026 10:00,ATATP,157.3,161.8,156.0,161.1,369205.0,0.7,3.8,0.41,826.83,3.8,104816.0,252.24,0.18,True,73.7,1.09,0.97,0.12,2026-02-16,157.4,2.35,2,156.0,156.0,ATH,False,False
16-02-2026 10:00,ARTMS,40.18,41.2,40.0,41.12,541374.0,0.08,0.94,0.08,1105.13,0.94,160686.5,236.91,0.09,True,63.9,0.01,-0.07,0.08,2026-02-16,39.9,3.06,0,,39.48,43.34,True,True
16-02-2026 10:00,MERKO,16.73,17.42,16.55,17.26,4694535.0,0.16,0.53,0.05,960.0,0.53,1112757.9,321.88,0.3,True,66.34,-0.02,-0.04,0.02,2026-02-16,16.71,3.29,2,16.55,16.55,17.74,True,True
16-02-2026 10:00,CATES,42.28,43.18,41.78,43.16,427833.0,0.02,0.88,0.14,511.11,0.88,125668.7,240.45,0.02,True,77.91,0.24,0.03,0.22,2026-02-16,41.48,4.05,0,,40.6,ATH,False,False
16-02-2026 10:00,OBAMS,8.75,9.04,8.73,9.02,30873884.0,0.02,0.27,0.08,246.15,0.27,16944399.0,82.21,0.07,True,80.47,0.24,0.18,0.06,2026-02-16,8.68,3.92,0,,7.64,ATH,False,False
16-02-2026 10:00,AVHOL,40.66,41.3,40.54,41.24,521252.0,0.06,0.58,0.05,974.07,0.58,122839.7,324.34,0.1,True,73.97,0.22,0.16,0.06,2026-02-16,40.36,2.18,0,,39.74,ATH,False,False
16-02-2026 10:00,LKMNH,17.78,18.12,17.76,18.08,710581.0,0.04,0.3,0.06,368.75,0.3,258119.5,175.29,0.13,True,78.09,0.14,0.08,0.06,2026-02-16,17.71,2.09,0,,16.98,ATH,False,False
16-02-2026 10:00,MNDTR,6.92,7.06,6.91,7.03,766879.0,0.03,0.11,0.01,1275.0,0.11,281626.1,172.3,0.27,True,74.96,0.04,0.03,0.01,2026-02-16,6.85,2.63,0,,6.8,ATH,False,False
16-02-2026 10:00,BORLS,2.77,2.99,2.76,2.96,30799975.0,0.03,0.19,0.02,955.56,0.19,6468288.0,376.17,0.16,True,78.87,0.03,0.01,0.01,2026-02-16,2.75,7.64,0,,2.67,ATH,False,False
16-02-2026 10:00,PGSUS,220.3,226.1,219.9,224.8,19608865.0,1.3,4.5,0.35,1185.71,4.5,4835163.1,305.55,0.29,True,78.19,2.61,2.34,0.27,2026-02-16,218.1,3.07,1,226.1,216.7,226.1,False,False
16-02-2026 10:00,BOSSA,7.13,7.3,7.13,7.3,601246.0,0.0,0.17,0.01,1445.45,0.17,260550.7,130.76,0.0,True,62.94,0.0,0.01,-0.01,2026-02-16,7.11,2.67,0,,7.1,7.33,False,False
16-02-2026 10:00,BLCYT,35.88,37.3,35.4,37.16,1778802.0,0.14,1.28,0.13,900.0,1.28,214939.8,727.58,0.11,True,23.73,-2.56,-2.19,-0.38,2026-02-16,39.3,-5.45,2,35.4,35.4,39.3,False,False
16-02-2026 10:00,AYDEM,26.24,26.66,26.24,26.66,517502.0,0.0,0.42,0.06,556.25,0.42,283002.6,82.86,0.0,True,76.47,0.24,0.15,0.09,2026-02-16,26.2,1.76,0,,24.44,ATH,False,False
16-02-2026 10:00,LRSHO,4.16,4.22,4.15,4.21,6159815.0,0.01,0.05,0.01,614.29,0.05,1830809.3,236.45,0.2,True,64.34,0.01,0.01,0.0,2026-02-16,4.15,1.45,0,,4.1,4.27,False,False
16-02-2026 10:00,BAGFS,30.06,30.46,30.06,30.4,458083.0,0.06,0.34,0.02,1316.67,0.34,117690.7,289.23,0.18,True,60.35,-0.02,-0.06,0.04,2026-02-16,29.96,1.47,0,,29.6,30.68,False,False
16-02-2026 10:00,BRLSM,15.81,16.81,15.8,16.78,4192512.0,0.03,0.97,0.12,736.21,0.97,685427.9,511.66,0.03,True,82.33,0.13,0.04,0.09,2026-02-16,15.7,6.88,0,,15.34,ATH,False,False
16-02-2026 10:00,SMRVA,64.3,66.0,64.3,65.95,1038816.0,0.05,1.65,0.03,5400.0,1.65,288173.4,260.48,0.03,True,61.84,-0.1,-0.25,0.15,2026-02-16,64.2,2.73,0,,63.7,66.35,False,False
16-02-2026 10:00,TKNSA,25.0,25.56,25.0,25.44,1231971.0,0.12,0.44,0.01,5400.0,0.44,353506.1,248.5,0.27,True,66.65,0.08,0.07,0.0,2026-02-16,24.92,2.09,1,25.56,24.68,25.56,False,False
16-02-2026 10:00,VESTL,32.88,33.44,32.88,33.3,1347436.0,0.14,0.42,0.0,20900.0,0.42,455403.0,195.88,0.33,True,74.22,0.21,0.18,0.03,2026-02-16,32.5,2.46,0,,32.3,ATH,False,False
16-02-2026 10:00,VESBE,8.67,8.79,8.65,8.78,3072805.0,0.01,0.11,0.01,1000.0,0.11,1119089.5,174.58,0.09,True,71.42,0.05,0.04,0.01,2026-02-16,8.59,2.21,0,,8.5,ATH,False,False
16-02-2026 10:00,USAK,1.88,1.92,1.87,1.91,45060209.0,0.01,0.03,0.0,650.0,0.03,26804874.2,68.1,0.33,True,74.39,0.02,0.01,0.0,2026-02-16,1.86,2.69,0,,1.78,ATH,False,False
16-02-2026 10:00,GSDDE,10.21,10.36,10.21,10.35,385246.0,0.01,0.14,0.01,1172.73,0.14,149159.1,158.28,0.07,True,62.1,0.02,0.02,-0.0,2026-02-16,10.21,1.37,0,,10.18,10.42,False,False
16-02-2026 10:00,HOROZ,66.75,69.65,66.75,69.35,1509589.0,0.3,2.6,0.4,550.0,2.6,349782.7,331.58,0.12,True,77.24,0.68,0.28,0.4,2026-02-16,65.75,5.48,1,69.65,63.0,69.65,False,False
16-02-2026 10:00,ALARK,114.8,116.3,114.8,116.0,2660729.0,0.3,1.2,0.05,2300.0,1.2,771267.0,244.98,0.25,True,69.91,0.61,0.46,0.16,2026-02-16,113.8,1.93,0,,112.8,ATH,False,False
16-02-2026 10:00,HURGZ,5.57,5.68,5.56,5.65,2347746.0,0.03,0.08,0.01,1233.33,0.08,467651.9,402.03,0.37,True,63.29,-0.0,-0.01,0.0,2026-02-16,5.56,1.62,0,,5.53,5.66,False,False
16-02-2026 10:00,TOASO,344.25,349.5,340.0,348.5,1390650.0,1.0,4.25,0.88,385.71,4.25,463044.9,200.33,0.24,True,82.31,6.13,4.79,1.34,2026-02-16,338.5,2.95,1,349.5,307.25,349.5,False,False
16-02-2026 10:00,YIGIT,26.2,26.82,26.14,26.68,1997953.0,0.14,0.48,0.05,900.0,0.48,433177.6,361.23,0.29,True,78.78,0.15,0.11,0.04,2026-02-16,26.06,2.38,0,,25.74,ATH,False,False
16-02-2026 10:00,TKFEN,83.0,85.0,82.95,84.85,2418826.0,0.15,1.85,0.02,7300.0,1.85,786462.3,207.56,0.08,True,56.97,-0.22,-0.17,-0.06,2026-02-16,82.55,2.79,0,,81.9,87.0,False,False
16-02-2026 10:00,INVEO,9.8,10.22,9.8,10.11,4897517.0,0.11,0.31,0.02,1622.22,0.31,1251447.8,291.35,0.35,True,66.83,0.05,0.05,-0.0,2026-02-16,9.72,4.01,0,,9.71,10.25,False,False
16-02-2026 10:00,GOODY,16.1,16.29,16.07,16.29,385216.0,0.0,0.19,0.01,1800.0,0.19,142108.2,171.07,0.0,True,69.48,0.03,0.02,0.01,2026-02-16,16.05,1.5,0,,15.36,ATH,False,False
16-02-2026 10:00,GOKNR,22.36,22.64,22.36,22.62,1203819.0,0.02,0.26,0.0,6400.0,0.26,471338.8,155.4,0.08,True,69.89,0.08,0.07,0.01,2026-02-16,22.24,1.71,0,,22.1,22.72,False,False
16-02-2026 10:00,ISSEN,7.93,8.04,7.9,8.02,517688.0,0.02,0.09,0.01,800.0,0.09,170022.5,204.48,0.22,True,82.06,0.05,0.03,0.02,2026-02-16,7.8,2.82,0,,7.68,ATH,False,False
16-02-2026 10:00,IZMDC,8.19,8.38,8.18,8.33,1503199.0,0.05,0.14,0.0,4566.67,0.14,768505.2,95.6,0.36,True,70.46,0.1,0.1,-0.0,2026-02-16,8.17,1.96,0,,8.09,8.48,False,False
16-02-2026 10:00,TCELL,126.0,129.6,125.3,129.0,15653202.0,0.6,3.0,0.35,757.14,3.0,3511744.0,345.74,0.2,True,82.65,1.61,1.49,0.12,2026-02-16,125.3,2.95,1,129.6,116.3,129.6,False,False
16-02-2026 10:00,SRVGY,3.51,3.64,3.51,3.62,43604625.0,0.02,0.11,0.01,900.0,0.11,7897007.6,452.17,0.18,True,79.24,0.02,0.01,0.01,2026-02-16,3.48,4.02,0,,3.45,ATH,False,False
16-02-2026 10:00,SOKE,13.16,13.32,13.16,13.3,397215.0,0.02,0.14,0.01,1455.56,0.14,126495.4,214.02,0.14,True,60.14,0.01,0.0,0.01,2026-02-16,13.16,1.06,1,13.32,13.1,13.32,False,False
16-02-2026 10:00,SKYMD,12.44,12.66,12.44,12.63,882999.0,0.03,0.19,0.02,900.0,0.19,545211.4,61.96,0.16,True,73.67,0.05,0.04,0.01,2026-02-16,12.4,1.85,0,,12.27,ATH,False,False
16-02-2026 10:00,YYLGD,14.09,14.4,14.08,14.38,3018446.0,0.02,0.29,0.02,1605.88,0.29,1276425.8,136.48,0.07,True,66.42,0.06,0.05,0.01,2026-02-16,14.08,2.13,0,,14.0,ATH,False,False
16-02-2026 10:00,DGNMO,5.32,5.38,5.27,5.37,985365.0,0.01,0.05,0.0,1566.67,0.05,208708.8,372.12,0.2,True,79.04,0.03,0.02,0.01,2026-02-16,5.24,2.48,0,,5.04,ATH,False,False
16-02-2026 10:00,SERNT,8.7,8.95,8.7,8.94,2157819.0,0.01,0.24,0.0,4700.0,0.24,832316.6,159.25,0.04,True,65.7,0.05,0.05,-0.01,2026-02-16,8.68,3.0,1,8.95,8.63,8.95,False,False
16-02-2026 10:00,KOTON,17.01,17.35,17.01,17.34,908361.0,0.01,0.33,0.04,685.71,0.33,331462.1,174.05,0.03,True,71.62,0.04,-0.01,0.05,2026-02-16,17.0,2.0,0,,16.75,18.24,False,False
16-02-2026 10:00,SELVA,2.46,2.52,2.45,2.51,17393095.0,0.01,0.05,0.01,455.56,0.05,7143906.9,143.47,0.2,True,52.18,-0.02,-0.03,0.0,2026-02-16,2.45,2.45,0,,2.42,2.64,True,True
16-02-2026 10:00,DENGE,3.07,3.18,3.03,3.15,15438603.0,0.03,0.08,0.0,1900.0,0.08,5568831.0,177.23,0.38,True,74.2,0.07,0.06,0.01,2026-02-16,3.06,2.94,3,,2.76,3.16,False,False
16-02-2026 10:00,YATAS,46.4,47.7,46.38,47.44,267089.0,0.26,1.04,0.06,1633.33,1.04,92372.4,189.14,0.25,True,66.11,0.15,0.14,0.01,2026-02-16,46.58,1.85,1,47.7,46.36,47.7,False,False
13-02-2026 17:00,BOBET,21.3,21.74,21.24,21.7,911359.0,0.04,0.4,0.04,852.38,0.4,418694.0,117.67,0.1,True,68.37,0.16,0.14,0.02,2026-02-13,21.34,1.69,0,,21.16,ATH,False,False
13-02-2026 17:00,KRPLS,9.17,9.37,9.13,9.32,1008034.0,0.05,0.15,0.03,476.92,0.15,417059.4,141.7,0.33,True,71.09,0.07,0.06,0.01,2026-02-13,9.02,3.33,0,,9.01,ATH,False,False
13-02-2026 17:00,GWIND,27.58,27.92,27.48,27.9,1800866.0,0.02,0.32,0.03,900.0,0.32,643691.4,179.77,0.06,True,72.85,0.18,0.16,0.03,2026-02-13,27.52,1.38,0,,26.56,ATH,False,False
13-02-2026 17:00,HEDEF,79.35,85.05,79.25,83.5,4671122.0,1.55,4.15,0.35,1069.01,4.15,880536.7,430.49,0.37,True,72.3,1.41,1.49,-0.08,2026-02-13,80.0,4.38,0,,76.6,ATH,False,False
13-02-2026 17:00,DAPGM,12.0,13.13,11.89,13.13,36298177.0,0.0,1.13,0.12,857.63,1.13,5240881.4,592.6,0.0,True,83.39,0.14,0.06,0.08,2026-02-13,11.94,9.97,0,,11.42,ATH,False,False
13-02-2026 17:00,CCOLA,77.5,78.8,77.45,78.65,2723639.0,0.15,1.15,0.08,1433.33,1.15,1150468.8,136.74,0.13,True,70.55,0.65,0.58,0.07,2026-02-13,77.5,1.48,0,,76.25,ATH,False,False
13-02-2026 17:00,LOGO,157.0,160.0,156.4,160.0,483716.0,0.0,3.0,0.14,2042.86,3.0,156916.1,208.26,0.0,True,65.89,0.46,0.37,0.09,2026-02-13,158.4,1.01,0,,155.0,ATH,False,False
13-02-2026 17:00,ZOREN,3.59,3.64,3.58,3.63,32493904.0,0.01,0.04,0.0,1900.0,0.04,7718246.3,321.0,0.25,True,67.84,0.02,0.01,0.01,2026-02-13,3.58,1.4,0,,3.53,ATH,False,False
13-02-2026 16:00,BJKAS,1.63,1.65,1.63,1.65,9628379.0,0.0,0.02,0.0,400.0,0.02,3551835.8,171.08,0.0,True,65.63,0.01,0.01,0.0,2026-02-13,1.61,2.48,0,,1.59,ATH,False,False
13-02-2026 16:00,ANGEN,11.57,11.66,11.56,11.66,715675.0,0.0,0.09,0.01,1700.0,0.09,304271.7,135.21,0.0,True,64.91,0.04,0.04,0.0,2026-02-13,11.57,0.78,0,,11.47,ATH,False,False
13-02-2026 16:00,NTHOL,49.54,50.6,49.54,50.4,593212.0,0.2,0.86,0.16,444.3,0.86,202076.6,193.56,0.23,True,72.36,0.29,0.19,0.1,2026-02-13,48.94,2.98,0,,48.32,ATH,False,False
13-02-2026 16:00,GENTS,9.92,10.48,9.9,10.39,5111794.0,0.09,0.47,0.01,4600.0,0.47,2016462.8,153.5,0.19,True,54.88,-0.12,-0.12,0.0,2026-02-13,10.32,0.68,0,,9.89,11.14,True,True
13-02-2026 16:00,ESCOM,3.9,3.96,3.9,3.95,4832429.0,0.01,0.05,0.01,525.0,0.05,2161355.0,123.58,0.2,True,71.38,0.03,0.02,0.01,2026-02-13,3.86,2.33,0,,3.74,3.96,False,False
13-02-2026 16:00,GIPTA,62.7,64.3,62.4,64.2,1206813.0,0.1,1.5,0.15,900.0,1.5,382078.9,215.85,0.07,True,64.84,0.26,0.23,0.03,2026-02-13,62.5,2.72,0,,61.6,65.75,False,False
13-02-2026 16:00,KATMR,2.91,3.06,2.9,3.03,105065045.0,0.03,0.12,0.01,823.08,0.12,19545952.0,437.53,0.25,True,76.73,0.02,0.01,0.01,2026-02-13,2.9,4.48,0,,2.89,ATH,False,False
13-02-2026 15:00,YESIL,1.99,2.03,1.98,2.03,18126337.0,0.0,0.04,0.0,700.0,0.04,4084165.2,343.82,0.0,True,64.41,0.0,0.0,0.0,2026-02-13,2.0,1.5,2,1.98,1.98,2.08,False,False
13-02-2026 14:00,CVKMD,44.72,46.74,44.7,46.36,6729265.0,0.38,1.64,0.19,745.36,1.64,3008935.6,123.64,0.23,True,72.28,0.6,0.46,0.14,2026-02-13,45.08,2.84,0,,40.82,ATH,False,False
13-02-2026 14:00,SEKFK,9.67,9.93,9.66,9.89,404230.0,0.04,0.22,0.03,547.06,0.22,137343.2,194.32,0.18,True,65.32,0.04,0.0,0.03,2026-02-13,9.6,3.02,1,9.93,9.24,9.93,False,False
13-02-2026 14:00,GOZDE,27.4,27.7,27.4,27.68,444374.0,0.02,0.28,0.06,400.0,0.28,244219.2,81.96,0.07,True,71.33,0.2,0.19,0.01,2026-02-13,27.26,1.54,0,,27.18,ATH,False,False
13-02-2026 14:00,YYAPI,1.84,1.88,1.83,1.88,35629950.0,0.0,0.04,0.0,3900.0,0.04,11509372.9,209.57,0.0,True,60.44,0.01,0.01,0.0,2026-02-13,1.85,1.62,2,1.83,1.83,ATH,False,False
13-02-2026 14:00,OSTIM,3.16,3.3,3.15,3.27,17339598.0,0.03,0.11,0.01,746.15,0.11,3828854.4,352.87,0.27,True,79.06,0.02,0.01,0.01,2026-02-13,3.13,4.47,0,,3.06,ATH,False,False
13-02-2026 14:00,ZEDUR,8.77,8.94,8.77,8.94,576288.0,0.0,0.17,0.0,5566.67,0.17,245067.4,135.15,0.0,True,61.71,0.03,0.03,-0.0,2026-02-13,8.8,1.59,0,,8.7,9.1,False,False
13-02-2026 14:00,SEGMN,48.66,50.0,48.62,49.78,1245674.0,0.22,1.12,0.22,413.76,1.12,646060.0,92.81,0.2,True,61.48,0.32,0.21,0.11,2026-02-13,48.98,1.63,0,,47.08,51.25,False,False
13-02-2026 13:00,KFEIN,10.42,10.81,10.37,10.73,3999920.0,0.08,0.31,0.02,1309.09,0.31,1432675.2,179.19,0.26,True,65.92,0.13,0.14,-0.01,2026-02-13,10.41,3.07,0,,10.12,10.83,False,False
13-02-2026 12:00,YEOTK,42.46,43.32,42.4,43.26,1319694.0,0.06,0.8,0.08,852.38,0.8,768598.8,71.7,0.08,True,75.98,0.44,0.33,0.11,2026-02-13,42.6,1.55,0,,40.3,ATH,False,False
13-02-2026 12:00,VBTYZ,22.2,23.58,22.06,23.52,2493717.0,0.06,1.32,0.06,2100.0,1.32,648366.5,284.62,0.05,True,65.4,0.15,0.03,0.12,2026-02-13,21.5,9.4,0,,21.1,23.58,False,False
13-02-2026 12:00,VRGYO,2.58,2.65,2.57,2.64,6319569.0,0.01,0.06,0.0,1900.0,0.06,3976705.4,58.91,0.17,True,62.22,0.02,0.02,-0.0,2026-02-13,2.61,1.15,0,,2.56,ATH,False,False
13-02-2026 11:00,SEGYO,5.6,5.96,5.58,5.95,7939540.0,0.01,0.35,0.01,2400.0,0.35,4463393.7,77.88,0.03,True,70.81,0.15,0.15,-0.0,2026-02-13,5.57,6.82,0,,4.88,ATH,False,False
13-02-2026 11:00,ARSAN,4.52,4.84,4.47,4.76,23491909.0,0.08,0.24,0.01,1746.15,0.24,5683868.9,313.31,0.33,True,58.14,-0.01,0.0,-0.01,2026-02-13,4.61,3.25,3,,4.58,4.96,False,False
13-02-2026 10:00,HALKB,48.18,49.44,47.86,49.36,40260569.0,0.08,1.18,0.22,441.28,1.18,13372400.5,201.07,0.07,True,83.65,0.8,0.63,0.17,2026-02-13,48.0,2.83,0,,43.0,ATH,False,False
13-02-2026 10:00,REEDR,6.92,7.03,6.89,7.0,8687146.0,0.03,0.08,0.01,515.38,0.08,2443328.9,255.55,0.38,True,75.71,0.03,0.02,0.01,2026-02-13,6.93,1.01,0,,6.78,ATH,False,False
13-02-2026 10:00,QUAGR,3.09,3.36,3.08,3.35,197900756.0,0.01,0.26,0.05,441.67,0.26,39885202.7,396.18,0.04,True,86.25,0.07,0.03,0.04,2026-02-13,3.09,8.41,0,,2.83,ATH,False,False
13-02-2026 10:00,UNLU,17.35,18.01,17.25,17.88,1941065.0,0.13,0.53,0.07,657.14,0.53,708066.3,174.14,0.25,True,67.92,0.17,0.15,0.02,2026-02-13,17.25,3.65,3,,16.44,18.0,False,False
13-02-2026 10:00,VAKBN,41.36,42.84,40.82,42.56,28405739.0,0.28,1.2,0.25,383.87,1.2,9687443.4,193.22,0.23,True,89.27,1.21,0.92,0.3,2026-02-13,41.1,3.55,1,42.84,36.24,42.84,False,False
13-02-2026 10:00,IHAAS,46.2,49.46,46.2,48.9,1725731.0,0.56,2.7,0.41,558.54,2.7,552371.8,212.42,0.21,True,74.36,0.81,0.45,0.37,2026-02-13,46.1,6.07,0,,42.92,49.72,False,False
13-02-2026 10:00,KCAER,11.7,12.04,11.7,11.96,8787416.0,0.08,0.26,0.02,1138.1,0.26,2164915.6,305.9,0.31,True,77.23,0.09,0.08,0.01,2026-02-13,11.69,2.31,0,,ATL,ATH,False,False
13-02-2026 10:00,BAHKM,134.7,139.4,131.5,139.3,431395.0,0.1,4.6,0.7,557.14,4.6,119694.5,260.41,0.02,True,63.82,0.4,0.04,0.36,2026-02-13,133.5,4.34,0,,128.6,141.4,False,False
13-02-2026 10:00,BERA,19.82,20.08,19.77,20.06,7243246.0,0.02,0.24,0.01,1900.0,0.24,3051211.9,137.39,0.08,True,49.79,-0.18,-0.21,0.02,2026-02-13,19.7,1.83,0,,19.61,23.1,False,False
13-02-2026 10:00,KIMMR,16.6,17.28,16.51,17.16,242861.0,0.12,0.56,0.09,551.16,0.56,122998.5,97.45,0.21,True,85.6,0.26,0.2,0.06,2026-02-13,16.66,3.0,0,,15.24,ATH,False,False
13-02-2026 10:00,BALSU,17.19,17.59,17.06,17.49,5333654.0,0.1,0.3,0.08,284.62,0.3,2374924.6,124.58,0.33,True,71.19,0.14,0.09,0.05,2026-02-13,17.1,2.28,1,17.59,16.53,17.59,False,False
13-02-2026 10:00,BIENY,25.5,27.56,25.2,27.46,5285448.0,0.1,1.96,0.31,536.36,1.96,872873.1,505.52,0.05,True,90.41,0.43,0.17,0.26,2026-02-13,25.44,7.94,0,,24.0,ATH,False,False
13-02-2026 10:00,AGROT,3.25,3.3,3.25,3.29,8489238.0,0.01,0.04,0.01,700.0,0.04,3053053.7,178.06,0.25,True,67.28,0.01,0.0,0.0,2026-02-13,3.25,1.23,0,,3.2,3.32,False,False
13-02-2026 10:00,THYAO,337.5,351.25,337.25,347.75,38503684.0,3.5,10.25,1.5,583.33,10.25,10077821.3,282.06,0.34,True,77.53,2.74,1.98,0.76,2026-02-13,337.0,3.19,1,351.25,331.0,351.25,False,False
12-02-2026 17:00,AKENR,11.25,11.33,11.24,11.33,1638902.0,0.0,0.08,0.01,471.43,0.08,793155.5,106.63,0.0,True,60.54,0.01,0.0,0.01,2026-02-12,11.17,1.43,0,,11.13,11.41,False,False
12-02-2026 17:00,KLKIM,42.54,42.84,42.5,42.78,415125.0,0.06,0.24,0.04,500.0,0.24,237901.5,74.49,0.25,True,53.92,-0.07,-0.04,-0.03,2026-02-12,42.22,1.33,0,,41.98,44.2,False,False
12-02-2026 17:00,RUZYE,12.78,13.07,12.72,13.01,3214943.0,0.06,0.23,0.03,596.97,0.23,901061.6,256.8,0.26,True,68.25,0.04,0.03,0.01,2026-02-12,12.61,3.17,0,,12.51,13.08,False,False
12-02-2026 17:00,MOGAN,9.12,9.17,9.11,9.17,1322195.0,0.0,0.05,0.01,455.56,0.05,544070.3,143.02,0.0,True,62.68,0.01,0.0,0.01,2026-02-12,9.0,1.89,0,,8.96,9.21,False,False
12-02-2026 17:00,SAFKR,28.04,28.66,27.94,28.52,2141099.0,0.14,0.48,0.03,1614.29,0.48,566836.8,277.73,0.29,True,56.47,-0.01,-0.03,0.02,2026-02-12,28.22,1.06,1,28.66,27.8,28.66,False,False
12-02-2026 17:00,ZGYO,32.36,36.3,32.16,35.8,1618307.0,0.5,3.44,0.23,1382.76,3.44,983488.6,64.55,0.15,True,75.4,1.0,0.92,0.07,2026-02-12,33.54,6.74,0,,28.22,ATH,False,False
12-02-2026 17:00,IHLGM,2.06,2.08,2.06,2.08,4061152.0,0.0,0.02,0.0,400.0,0.02,1860862.1,118.24,0.0,True,64.2,0.0,0.0,0.0,2026-02-12,2.04,1.96,0,,2.03,2.09,False,False
12-02-2026 17:00,ANHYT,120.8,122.0,120.7,122.0,691087.0,0.0,1.2,0.03,3900.0,1.2,200838.9,244.1,0.0,True,63.43,0.62,0.7,-0.08,2026-02-12,122.0,0.0,0,,120.4,122.1,False,False
12-02-2026 16:00,DNISI,23.9,24.04,23.86,24.02,165019.0,0.02,0.12,0.01,1100.0,0.12,88327.7,86.83,0.17,True,55.88,0.01,0.04,-0.03,2026-02-12,23.8,0.92,0,,23.78,24.76,False,False
12-02-2026 15:00,ENKAI,98.45,100.0,98.2,99.95,2546149.0,0.05,1.5,0.35,322.54,1.5,1147280.7,121.93,0.03,True,77.88,0.65,0.28,0.38,2026-02-12,96.0,4.11,0,,94.15,ATH,False,False
12-02-2026 15:00,BMSTL,112.1,116.4,111.8,116.1,1183526.0,0.3,4.0,0.29,1279.31,4.0,246116.4,380.88,0.08,True,75.4,0.39,0.11,0.28,2026-02-12,111.4,4.22,0,,110.6,ATH,False,False
12-02-2026 15:00,LMKDC,31.76,32.02,31.68,32.0,554392.0,0.02,0.24,0.04,445.45,0.24,347707.6,59.44,0.08,True,63.89,0.1,0.05,0.05,2026-02-12,31.3,2.24,0,,30.98,32.06,False,False
12-02-2026 15:00,TSKB,13.91,14.15,13.9,14.14,14016923.0,0.01,0.23,0.06,289.83,0.23,5640293.4,148.51,0.04,True,86.64,0.15,0.1,0.05,2026-02-12,13.59,4.05,0,,13.22,ATH,False,False
12-02-2026 15:00,ASELS,297.0,302.0,296.5,301.5,7322743.0,0.5,4.5,0.55,718.18,4.5,3549610.7,106.3,0.11,True,70.07,0.76,0.58,0.18,2026-02-12,294.0,2.55,0,,291.5,ATH,False,False
12-02-2026 15:00,AGHOL,35.28,35.8,35.28,35.76,1496787.0,0.04,0.48,0.08,531.58,0.48,715315.7,109.25,0.08,True,66.8,0.04,-0.06,0.09,2026-02-12,34.8,2.76,0,,34.18,36.3,False,False
12-02-2026 13:00,MIATK,38.24,38.94,38.24,38.9,4965143.0,0.04,0.66,0.07,900.0,0.66,2204949.9,125.18,0.06,True,74.54,0.32,0.27,0.05,2026-02-12,37.98,2.42,0,,37.46,ATH,False,False
12-02-2026 13:00,KRDMA,29.3,29.62,29.28,29.6,621611.0,0.02,0.3,0.04,689.47,0.3,404422.4,53.7,0.07,True,66.4,0.12,0.1,0.02,2026-02-12,29.28,1.09,0,,28.7,29.72,False,False
12-02-2026 12:00,GESAN,57.15,58.0,57.1,57.95,1122246.0,0.05,0.8,0.11,595.65,0.8,452293.2,148.12,0.06,True,68.17,0.3,0.14,0.16,2026-02-12,56.55,2.48,0,,55.4,ATH,False,False
12-02-2026 11:00,BTCIM,4.92,5.0,4.91,4.98,28361077.0,0.02,0.06,0.01,757.14,0.06,10331942.3,174.5,0.33,True,61.38,0.01,0.01,0.0,2026-02-12,4.93,1.01,0,,4.9,5.03,False,False
12-02-2026 11:00,DMLKT,5.79,5.81,5.79,5.81,1551572.0,0.0,0.02,0.0,1900.0,0.02,940874.6,64.91,0.0,True,59.97,0.0,-0.0,0.0,2026-02-12,5.79,0.35,1,5.81,5.77,5.82,False,False
12-02-2026 11:00,OYAKC,26.52,26.82,26.44,26.82,4061918.0,0.0,0.3,0.08,284.62,0.3,1772476.5,129.17,0.0,True,67.84,0.08,0.03,0.05,2026-02-12,26.24,2.21,0,,25.68,26.86,False,False
12-02-2026 11:00,KOPOL,5.86,6.22,5.84,6.21,5904795.0,0.01,0.35,0.03,960.61,0.35,1043431.0,465.9,0.03,True,74.04,0.01,-0.01,0.02,2026-02-12,5.82,6.7,0,,5.82,ATH,False,False
12-02-2026 11:00,POLHO,17.48,17.77,17.47,17.74,894226.0,0.03,0.26,0.01,2788.89,0.26,279455.9,219.99,0.12,True,65.06,0.03,0.03,0.0,2026-02-12,17.33,2.37,0,,17.29,ATH,False,False
12-02-2026 10:00,ISDMR,46.46,46.82,45.74,46.74,1000510.0,0.08,0.28,0.01,3400.0,0.28,349848.5,185.98,0.29,True,68.58,0.38,0.43,-0.05,2026-02-12,46.38,0.78,2,45.74,45.74,47.0,False,False
12-02-2026 10:00,ARCLK,123.2,127.0,123.2,127.0,1603003.0,0.0,3.8,0.39,874.36,3.8,508505.9,215.24,0.0,True,69.41,0.2,-0.03,0.23,2026-02-12,122.7,3.5,0,,121.7,ATH,False,False
12-02-2026 10:00,GLRMK,188.1,190.5,188.1,190.3,249083.0,0.2,2.2,0.2,1000.0,2.2,107724.6,131.22,0.09,True,58.31,-0.1,-0.0,-0.09,2026-02-12,187.4,1.55,1,190.5,186.9,190.5,False,False
12-02-2026 10:00,ALBRK,9.28,9.46,9.26,9.44,6457176.0,0.02,0.16,0.03,515.38,0.16,2335137.7,176.52,0.13,True,77.7,0.07,0.06,0.01,2026-02-12,9.26,1.94,0,,8.71,ATH,False,False
12-02-2026 10:00,FORMT,3.57,3.64,3.5,3.62,50388472.0,0.02,0.05,0.01,257.14,0.05,11852304.9,325.14,0.4,True,53.62,-0.0,-0.01,0.01,2026-02-12,3.6,0.56,2,3.5,3.5,3.87,True,False
12-02-2026 10:00,AKSA,10.81,10.89,10.79,10.88,3335834.0,0.01,0.07,0.01,438.46,0.07,1582325.4,110.82,0.14,True,57.91,0.01,0.01,-0.0,2026-02-12,10.8,0.74,2,10.79,10.79,10.99,False,False
12-02-2026 10:00,UCAYM,32.1,33.44,31.98,33.26,7548596.0,0.18,1.16,0.1,1083.67,1.16,4126828.2,82.92,0.16,True,45.57,-0.7,-0.72,0.02,2026-02-12,32.2,3.29,2,31.98,31.98,36.88,True,True
12-02-2026 10:00,SOKM,65.5,66.7,65.4,66.65,1094377.0,0.05,1.15,0.07,1669.23,1.15,475217.7,130.29,0.04,True,66.76,0.39,0.41,-0.02,2026-02-12,65.35,1.99,0,,65.0,66.7,False,False
12-02-2026 10:00,ORCAY,3.8,3.83,3.76,3.83,791447.0,0.0,0.03,0.0,650.0,0.03,343830.3,130.19,0.0,True,60.52,0.0,-0.0,0.0,2026-02-12,3.8,0.79,0,,3.75,3.85,False,False
12-02-2026 10:00,BARMA,46.8,47.38,46.42,47.24,370612.0,0.14,0.44,0.07,511.11,0.44,245462.1,50.99,0.32,True,75.35,0.51,0.43,0.08,2026-02-12,46.7,1.16,0,,42.82,ATH,False,False
12-02-2026 10:00,MERCN,19.0,19.96,18.97,19.85,5329336.0,0.11,0.85,0.07,1187.88,0.85,1673616.4,218.43,0.13,True,67.71,0.15,0.22,-0.07,2026-02-12,19.0,4.47,0,,18.74,20.28,False,False
12-02-2026 10:00,CANTE,1.77,1.83,1.77,1.82,277058581.0,0.01,0.05,0.0,4900.0,0.05,63620296.2,335.49,0.2,True,58.72,-0.01,-0.01,-0.0,2026-02-12,1.76,3.41,0,,1.75,1.87,True,True
12-02-2026 10:00,SKBNK,10.27,10.45,10.23,10.4,14304544.0,0.05,0.13,0.02,441.67,0.13,5896215.1,142.61,0.38,True,78.27,0.19,0.17,0.02,2026-02-12,10.14,2.56,0,,9.04,ATH,False,False
12-02-2026 10:00,ARZUM,3.4,3.61,3.38,3.57,34873390.0,0.04,0.17,0.02,709.52,0.17,9111362.3,282.75,0.24,True,89.13,0.15,0.14,0.01,2026-02-12,3.38,5.62,0,,2.56,ATH,False,False
12-02-2026 10:00,MAKTK,16.55,17.37,16.55,17.22,3979028.0,0.15,0.67,0.07,900.0,0.67,952520.3,317.74,0.22,True,62.93,-0.0,-0.01,0.01,2026-02-12,16.55,4.05,1,17.37,16.48,17.37,False,False
11-02-2026 17:00,EUPWR,39.7,41.1,39.62,40.86,3339325.0,0.24,1.16,0.13,820.63,1.16,926890.6,260.27,0.21,True,67.44,-0.03,-0.11,0.08,2026-02-11,39.66,3.03,0,,38.92,41.02,False,False
11-02-2026 16:00,ESEN,4.02,4.16,4.02,4.16,29994748.0,0.0,0.14,0.02,566.67,0.14,12022051.6,149.5,0.0,True,83.73,0.03,0.01,0.02,2026-02-11,3.94,5.58,0,,3.91,ATH,False,False
11-02-2026 16:00,AVGYO,13.13,13.72,13.07,13.72,1206132.0,0.0,0.59,0.09,541.3,0.59,537875.2,124.24,0.0,True,71.91,0.15,0.08,0.07,2026-02-11,12.79,7.27,0,,11.89,ATH,False,False
11-02-2026 16:00,MAGEN,44.94,45.92,44.86,45.86,1268999.0,0.06,0.92,0.17,434.88,0.92,549696.7,130.85,0.07,True,69.4,0.49,0.48,0.01,2026-02-11,44.46,3.15,0,,44.26,ATH,False,False
11-02-2026 16:00,CEMTS,12.55,13.01,12.54,13.0,2305725.0,0.01,0.45,0.05,749.06,0.45,601595.5,283.27,0.02,True,80.25,0.07,0.05,0.02,2026-02-11,12.53,3.75,0,,12.42,ATH,False,False
11-02-2026 16:00,KAREL,9.66,9.88,9.66,9.85,4129937.0,0.03,0.19,0.03,578.57,0.19,1464191.5,182.06,0.16,True,79.34,0.13,0.11,0.02,2026-02-11,9.55,3.14,0,,ATL,ATH,False,False
11-02-2026 15:00,SELEC,86.45,87.95,86.45,87.95,415103.0,0.0,1.5,0.14,971.43,1.5,227939.8,82.11,0.0,True,72.12,0.96,0.83,0.13,2026-02-11,85.2,3.23,0,,80.15,ATH,False,False
11-02-2026 15:00,TRCAS,50.9,53.05,50.8,52.95,614134.0,0.1,2.05,0.34,506.51,2.05,176815.5,247.33,0.05,True,71.35,0.13,-0.06,0.19,2026-02-11,50.05,5.79,0,,49.44,ATH,False,False
11-02-2026 15:00,SUWEN,8.75,9.03,8.75,9.0,2377613.0,0.03,0.25,0.04,575.68,0.25,449665.9,428.75,0.12,True,72.34,0.05,0.03,0.02,2026-02-11,8.71,3.33,0,,8.62,ATH,False,False
11-02-2026 14:00,IHLAS,2.33,2.38,2.32,2.38,57446102.0,0.0,0.05,0.01,614.29,0.05,15493402.8,270.78,0.0,True,76.03,0.01,0.0,0.0,2026-02-11,2.3,3.48,0,,2.29,ATH,False,False
11-02-2026 13:00,MAVI,48.32,49.04,48.3,48.98,1491599.0,0.06,0.66,0.07,816.67,0.66,844483.4,76.63,0.09,True,68.46,0.21,0.2,0.01,2026-02-11,48.46,1.07,0,,47.8,ATH,False,False
11-02-2026 12:00,ISCTR,16.82,17.0,16.81,16.95,107591695.0,0.05,0.13,0.02,584.21,0.13,68582465.7,56.88,0.38,True,56.0,0.02,0.03,-0.01,2026-02-11,16.93,0.12,0,,16.65,17.14,False,False
11-02-2026 12:00,OFSYM,74.55,76.25,74.4,76.25,289083.0,0.0,1.7,0.2,729.27,1.7,166351.7,73.78,0.0,True,71.77,0.73,0.7,0.02,2026-02-11,74.65,2.14,0,,70.0,ATH,False,False
11-02-2026 11:00,ALVES,4.12,4.29,4.1,4.27,96982938.0,0.02,0.15,0.03,383.87,0.15,26420894.0,267.07,0.13,True,73.75,0.02,0.0,0.02,2026-02-11,4.0,6.75,0,,3.91,ATH,False,False
11-02-2026 11:00,BIOEN,19.54,19.82,19.47,19.75,377791.0,0.07,0.21,0.0,10400.0,0.21,227393.3,66.14,0.33,True,50.26,-0.01,0.01,-0.02,2026-02-11,19.69,0.3,0,,19.45,20.2,False,False
11-02-2026 11:00,SILVR,2.83,2.87,2.82,2.86,468422.0,0.01,0.03,0.0,1400.0,0.03,292086.3,60.37,0.33,True,54.49,-0.0,-0.0,0.0,2026-02-11,2.84,0.7,0,,2.8,2.91,False,False
11-02-2026 10:00,TURSG,12.43,12.66,12.36,12.6,23970655.0,0.06,0.17,0.03,529.63,0.17,12013363.9,99.53,0.35,True,68.76,0.16,0.15,0.01,2026-02-11,12.45,1.2,2,12.36,12.36,12.78,False,False
11-02-2026 10:00,GLYHO,15.25,15.67,15.25,15.58,1184911.0,0.09,0.33,0.05,547.06,0.33,582083.5,103.56,0.27,True,60.28,0.01,-0.0,0.01,2026-02-11,15.39,1.23,1,15.67,15.15,15.67,False,False
11-02-2026 10:00,TMSN,111.4,118.3,110.7,117.1,1342718.0,1.2,5.7,0.43,1225.58,5.7,186795.6,618.82,0.21,True,79.46,0.74,0.6,0.14,2026-02-11,111.4,5.12,3,,106.2,ATH,False,False
11-02-2026 10:00,KRDMB,34.54,35.12,34.04,35.1,213139.0,0.02,0.56,0.1,471.43,0.56,138215.8,54.21,0.04,True,74.83,0.29,0.19,0.1,2026-02-11,34.56,1.56,0,,32.98,ATH,False,False
11-02-2026 10:00,DZGYO,8.99,9.87,8.97,9.7,5420473.0,0.17,0.71,0.06,1026.98,0.71,769885.5,604.06,0.24,True,83.37,0.07,0.04,0.02,2026-02-11,8.99,7.9,2,8.97,8.97,ATH,False,False
11-02-2026 10:00,JANTS,19.49,20.24,19.39,20.06,4544716.0,0.18,0.57,0.05,1017.65,0.57,616110.2,637.65,0.32,True,78.9,0.06,0.03,0.02,2026-02-11,19.49,2.92,3,,19.23,ATH,False,False
11-02-2026 10:00,VAKFA,14.13,14.59,14.06,14.52,20510682.0,0.07,0.39,0.03,1200.0,0.39,4706146.6,335.83,0.18,True,79.72,0.15,0.16,-0.01,2026-02-11,14.03,3.49,1,14.59,13.97,14.59,False,False
10-02-2026 17:00,SAYAS,43.46,45.98,43.42,45.98,1526381.0,0.0,2.52,0.4,533.17,2.52,343749.7,344.04,0.0,True,88.23,0.73,0.45,0.29,2026-02-10,41.8,10.0,0,,39.74,ATH,False,False
10-02-2026 14:00,BUCIM,6.98,7.07,6.98,7.07,4954171.0,0.0,0.09,0.02,309.09,0.09,1886303.0,162.64,0.0,True,81.58,0.04,0.02,0.02,2026-02-10,6.85,3.21,0,,6.72,ATH,False,False
10-02-2026 14:00,KTLEV,39.08,40.08,39.02,40.04,11749321.0,0.04,0.96,0.24,306.78,0.96,4907245.5,139.43,0.04,True,85.63,0.59,0.39,0.19,2026-02-10,37.66,6.32,0,,ATL,ATH,False,False
10-02-2026 12:00,KLSER,28.76,29.1,28.72,29.04,481325.0,0.06,0.28,0.04,636.84,0.28,172229.1,179.47,0.21,True,69.06,0.08,0.04,0.04,2026-02-10,28.68,1.26,0,,28.06,ATH,False,False
10-02-2026 11:00,GMTAS,27.14,27.62,26.96,27.52,982450.0,0.1,0.38,0.04,955.56,0.38,392171.7,150.52,0.26,True,77.34,0.35,0.29,0.06,2026-02-10,27.0,1.93,1,27.62,ATL,27.62,False,False
10-02-2026 11:00,NATEN,8.41,8.5,8.41,8.48,1792365.0,0.02,0.07,0.01,775.0,0.07,803537.6,123.06,0.29,True,59.71,0.01,-0.01,0.01,2026-02-10,8.4,0.95,1,8.5,8.26,8.5,False,False
10-02-2026 11:00,AKGRT,8.47,8.61,8.44,8.61,4186352.0,0.0,0.14,0.01,900.0,0.14,1472125.1,184.37,0.0,True,71.42,0.04,0.03,0.01,2026-02-10,8.38,2.74,0,,ATL,ATH,False,False
10-02-2026 11:00,CUSAN,30.3,31.68,30.2,31.48,315068.0,0.2,1.18,0.02,5800.0,1.18,207506.8,51.84,0.17,True,64.3,0.33,0.37,-0.04,2026-02-10,31.14,1.09,0,,ATL,32.3,False,False
10-02-2026 11:00,SAMAT,5.96,6.06,5.94,6.05,512325.0,0.01,0.09,0.02,328.57,0.09,209855.3,144.13,0.11,True,77.16,0.05,0.03,0.02,2026-02-10,5.92,2.2,0,,5.69,ATH,False,False
10-02-2026 10:00,KLYPV,64.85,69.9,64.5,69.0,3770103.0,0.9,4.15,0.29,1331.03,4.15,680602.9,453.94,0.22,True,65.61,-0.13,-0.36,0.23,2026-02-10,64.6,6.81,3,,64.5,ATH,False,False
10-02-2026 10:00,BIGEN,10.12,10.48,10.05,10.42,7644747.0,0.06,0.3,0.07,310.96,0.3,2040271.3,274.69,0.2,True,85.66,0.13,0.08,0.05,2026-02-10,10.11,3.07,0,,ATL,ATH,False,False
10-02-2026 10:00,AKSEN,68.3,69.75,67.95,69.7,1544403.0,0.05,1.4,0.05,2700.0,1.4,566452.8,172.64,0.04,True,55.51,0.03,-0.05,0.08,2026-02-10,68.3,2.05,2,67.95,67.95,70.05,False,False
10-02-2026 10:00,ALKLC,248.2,259.5,248.2,259.0,340389.0,0.5,10.8,0.94,1055.08,10.8,112378.1,202.9,0.05,True,63.49,-0.91,-1.27,0.37,2026-02-10,248.0,4.44,0,,245.5,ATH,False,False
09-02-2026 17:00,HDFGS,3.28,3.45,3.28,3.45,59867957.0,0.0,0.17,0.03,431.25,0.17,13893804.9,330.9,0.0,True,79.08,0.02,0.0,0.02,2026-02-09,3.14,9.87,0,,3.11,ATH,False,False
09-02-2026 17:00,BIGCH,11.01,11.38,10.92,11.3,2114585.0,0.08,0.29,0.04,590.48,0.29,746198.0,183.38,0.28,True,65.74,0.03,0.02,0.02,2026-02-09,10.98,2.91,0,,ATL,ATH,False,False
09-02-2026 17:00,DYOBY,14.12,14.22,14.09,14.2,315054.0,0.02,0.08,0.02,247.83,0.08,181823.2,73.27,0.25,True,60.13,0.01,-0.01,0.02,2026-02-09,13.88,2.31,0,,13.72,ATH,False,False
09-02-2026 17:00,AKFYE,19.14,19.36,19.14,19.33,1379400.0,0.03,0.19,0.02,955.56,0.19,734357.8,87.84,0.16,True,42.09,-0.08,-0.11,0.03,2026-02-09,19.03,1.58,0,,ATL,ATH,False,False
09-02-2026 14:00,ALTNY,15.75,15.97,15.74,15.92,4501521.0,0.05,0.17,0.02,709.52,0.17,1748015.5,157.52,0.29,True,73.89,0.03,0.01,0.02,2026-02-09,15.64,1.79,0,,ATL,ATH,False,False
09-02-2026 13:00,BINHO,10.06,10.73,10.01,10.73,48901603.0,0.0,0.67,0.07,830.56,0.67,12819518.2,281.46,0.0,True,93.0,0.17,0.12,0.06,2026-02-09,9.76,9.94,0,,ATL,ATH,False,False
09-02-2026 13:00,BINBN,186.9,203.0,186.2,202.6,577184.0,0.4,15.7,0.95,1552.63,15.7,124981.6,361.82,0.03,True,73.12,0.18,-0.11,0.29,2026-02-09,188.8,7.31,0,,186.0,ATH,False,False
09-02-2026 12:00,MEDTR,30.1,30.26,30.0,30.22,118021.0,0.04,0.12,0.01,1400.0,0.12,75007.7,57.35,0.33,True,67.16,0.05,0.02,0.04,2026-02-09,29.68,1.82,0,,ATL,ATH,False,False
09-02-2026 11:00,ATLAS,8.86,9.95,8.85,9.89,1139680.0,0.06,1.03,0.1,909.8,1.03,363477.5,213.55,0.06,True,59.94,-0.14,-0.18,0.04,2026-02-09,9.07,9.04,0,,8.5,10.93,True,True
09-02-2026 10:00,MAKIM,16.42,17.04,16.42,16.88,421269.0,0.16,0.46,0.05,820.0,0.46,101079.7,316.77,0.35,True,65.68,0.02,-0.01,0.03,2026-02-09,16.4,2.93,1,17.04,16.19,17.04,False,False
09-02-2026 10:00,IHGZT,1.55,1.57,1.55,1.57,3394077.0,0.0,0.02,0.0,400.0,0.02,1119146.6,203.27,0.0,True,63.03,0.0,-0.0,0.0,2026-02-09,1.54,1.95,0,,1.53,ATH,False,False
09-02-2026 10:00,ADEL,35.48,37.48,35.24,36.94,1663414.0,0.54,1.46,0.27,448.87,1.46,585793.4,183.96,0.37,True,87.37,0.27,0.12,0.15,2026-02-09,35.08,5.3,0,,ATL,ATH,False,False
09-02-2026 10:00,PETKM,17.92,18.42,17.91,18.41,33372090.0,0.01,0.49,0.05,824.53,0.49,7612817.1,338.37,0.02,True,75.86,0.04,-0.01,0.05,2026-02-09,17.71,3.95,0,,17.41,ATH,False,False
09-02-2026 10:00,AHSGY,24.3,25.02,24.3,24.92,163545.0,0.1,0.62,0.07,761.11,0.62,86889.5,88.22,0.16,True,62.61,0.0,0.0,0.0,2026-02-09,24.2,2.98,0,,ATL,ATH,False,False
09-02-2026 10:00,GSRAY,1.17,1.2,1.17,1.2,90896122.0,0.0,0.03,0.01,500.0,0.03,16917043.9,437.3,0.0,True,75.91,0.0,0.0,0.0,2026-02-09,1.16,3.45,0,,1.16,ATH,False,False
06-02-2026 17:00,AKCNS,192.8,195.7,192.7,195.6,187805.0,0.1,2.8,0.11,2445.45,2.8,79044.0,137.6,0.04,True,58.36,-0.03,-0.12,0.08,2026-02-06,194.7,0.46,0,,ATL,ATH,False,False
06-02-2026 17:00,ULUUN,7.18,7.34,7.18,7.33,889331.0,0.01,0.15,0.01,1400.0,0.15,417940.5,112.79,0.07,True,65.35,0.0,-0.0,0.0,2026-02-06,7.26,0.96,0,,7.1,ATH,False,False
06-02-2026 17:00,YAYLA,27.84,28.9,27.76,28.9,149101.0,0.0,1.06,0.06,1666.67,1.06,77898.6,91.4,0.0,True,68.32,0.02,-0.02,0.04,2026-02-06,28.06,2.99,1,28.9,ATL,ATH,False,False
