Tarih,Hisse,open,high,low,close,volume,YuksekKapanis_Fark,AcilisKapanis_Fark,AcilisKapanisFark_Ort,AcilisKapanisFark_OrtalamayaGoreDegisim,AcilisKapanisFarkOrt_MaxSon10,HacimOrtalama,%Hacim_HacimOrtalama,Fark_Orani,Kosul,rsi,MACD_12_26_9,MACDs_12_26_9,MACDh_12_26_9,Tarih1,prev_close,%Deg,isPivot,pointpos,destek,direnc,Tsinyal_Banker_Dip,Tsinyal_Banker_DipKarar
11-02-2026 17:00,IZMDC,7.69,7.81,7.69,7.8,1056980.0,0.01,0.11,0.01,1471.43,0.11,399219.7,164.76,0.09,True,58.98,-0.0,-0.01,0.0,2026-02-11,7.7,1.3,0,,7.45,7.93,False,False
11-02-2026 17:00,YYLGD,13.92,14.15,13.89,14.11,1401249.0,0.04,0.19,0.01,1166.67,0.19,839845.7,66.85,0.21,True,63.18,0.1,0.12,-0.02,2026-02-11,14.0,0.79,0,,13.64,14.27,False,False
11-02-2026 17:00,MERKO,16.87,17.2,16.85,17.16,1311351.0,0.04,0.29,0.03,974.07,0.29,622073.9,110.8,0.14,True,67.08,0.05,0.05,0.0,2026-02-11,16.86,1.78,0,,16.78,17.34,False,False
11-02-2026 16:00,AVGYO,13.13,13.72,13.07,13.72,1206132.0,0.0,0.59,0.09,541.3,0.59,537875.2,124.24,0.0,True,72.28,0.18,0.12,0.06,2026-02-11,12.79,7.27,0,,11.89,ATH,False,False
11-02-2026 16:00,TSPOR,1.08,1.1,1.08,1.1,47197454.0,0.0,0.02,0.0,566.67,0.02,29886949.6,57.92,0.0,True,61.7,0.0,0.0,0.0,2026-02-11,1.08,1.85,0,,1.05,1.11,False,False
11-02-2026 16:00,KAREL,9.66,9.88,9.66,9.85,4129937.0,0.03,0.19,0.03,578.57,0.19,1464191.5,182.06,0.16,True,78.06,0.13,0.11,0.02,2026-02-11,9.55,3.14,0,,8.85,ATH,False,False
11-02-2026 16:00,MAGEN,44.94,45.92,44.86,45.86,1268999.0,0.06,0.92,0.17,434.88,0.92,549696.7,130.85,0.07,True,68.76,0.58,0.58,-0.0,2026-02-11,44.46,3.15,0,,41.24,ATH,False,False
11-02-2026 16:00,CEMTS,12.55,13.01,12.54,13.0,2305725.0,0.01,0.45,0.05,749.06,0.45,601595.5,283.27,0.02,True,79.02,0.07,0.05,0.03,2026-02-11,12.53,3.75,0,,12.42,ATH,False,False
11-02-2026 16:00,ESEN,4.02,4.16,4.02,4.16,29994748.0,0.0,0.14,0.02,566.67,0.14,12022051.6,149.5,0.0,True,82.62,0.03,0.02,0.02,2026-02-11,3.94,5.58,0,,3.91,ATH,False,False
11-02-2026 15:00,TRCAS,50.9,53.05,50.8,52.95,614134.0,0.1,2.05,0.34,506.51,2.05,176815.5,247.33,0.05,True,70.75,0.14,-0.04,0.19,2026-02-11,50.05,5.79,0,,49.44,ATH,False,False
11-02-2026 15:00,SUWEN,8.75,9.03,8.75,9.0,2377613.0,0.03,0.25,0.04,575.68,0.25,449665.9,428.75,0.12,True,72.01,0.04,0.02,0.02,2026-02-11,8.71,3.33,0,,8.58,ATH,False,False
11-02-2026 15:00,SELEC,86.45,87.95,86.45,87.95,415103.0,0.0,1.5,0.14,971.43,1.5,227939.8,82.11,0.0,True,71.52,1.13,1.01,0.12,2026-02-11,85.2,3.23,0,,80.15,ATH,False,False
11-02-2026 15:00,CONSE,3.63,3.73,3.63,3.73,7293933.0,0.0,0.1,0.02,400.0,0.1,2081763.1,250.37,0.0,True,81.51,0.06,0.06,0.0,2026-02-11,3.56,4.78,0,,3.52,ATH,False,False
11-02-2026 15:00,DOHOL,20.96,21.26,20.96,21.18,1935912.0,0.08,0.22,0.03,587.5,0.22,762884.2,153.76,0.36,True,63.16,0.01,-0.02,0.02,2026-02-11,20.86,1.53,0,,20.68,21.26,False,False
11-02-2026 15:00,ALBRK,9.18,9.34,9.18,9.31,4735531.0,0.03,0.13,0.02,465.22,0.13,2177176.3,117.51,0.23,True,72.63,0.06,0.06,0.01,2026-02-11,9.2,1.2,0,,8.71,ATH,False,False
11-02-2026 15:00,EGPRO,25.84,26.38,25.84,26.32,292390.0,0.06,0.48,0.04,1100.0,0.48,90366.4,223.56,0.12,True,61.55,0.07,0.1,-0.04,2026-02-11,26.0,1.23,0,,24.8,26.56,False,False
11-02-2026 15:00,MAKTK,16.59,17.12,16.58,16.97,1263056.0,0.15,0.38,0.02,1709.52,0.38,535666.6,135.79,0.39,True,56.81,-0.02,-0.01,-0.02,2026-02-11,16.79,1.07,0,,15.96,17.35,False,False
11-02-2026 15:00,ICUGS,2.64,2.7,2.64,2.69,3911542.0,0.01,0.05,0.01,733.33,0.05,1582094.6,147.24,0.2,True,67.01,0.0,-0.0,0.0,2026-02-11,2.63,2.28,0,,2.61,2.75,True,False
11-02-2026 14:00,METRO,5.66,5.99,5.65,5.99,8307521.0,0.0,0.33,0.03,964.52,0.33,1687961.7,392.16,0.0,True,75.47,0.07,0.05,0.01,2026-02-11,5.69,5.27,0,,5.33,ATH,False,False
11-02-2026 14:00,IHLAS,2.33,2.38,2.32,2.38,57446102.0,0.0,0.05,0.01,614.29,0.05,15493402.8,270.78,0.0,True,73.52,0.01,0.0,0.0,2026-02-11,2.3,3.48,0,,2.3,2.4,False,False
11-02-2026 14:00,SEGYO,5.3,5.57,5.21,5.5,35415242.0,0.07,0.2,0.06,238.98,0.2,5579408.6,534.75,0.35,True,76.71,0.12,0.09,0.03,2026-02-11,5.07,8.48,0,,4.88,ATH,False,False
11-02-2026 14:00,IHLGM,2.07,2.08,2.06,2.08,3770818.0,0.0,0.01,0.0,400.0,0.01,1735859.0,117.23,0.0,True,62.87,0.01,0.01,0.0,2026-02-11,2.06,0.97,0,,1.97,2.09,False,False
11-02-2026 14:00,MERIT,17.82,18.1,17.82,18.06,1410636.0,0.04,0.24,0.02,900.0,0.24,474318.6,197.4,0.17,True,66.3,0.16,0.2,-0.04,2026-02-11,17.87,1.06,0,,16.52,18.2,False,False
11-02-2026 13:00,MAVI,48.32,49.04,48.3,48.98,1491599.0,0.06,0.66,0.07,816.67,0.66,844483.4,76.63,0.09,True,66.9,0.22,0.2,0.02,2026-02-11,48.46,1.07,0,,46.0,ATH,False,False
11-02-2026 13:00,UNLU,16.58,16.84,16.58,16.78,385638.0,0.06,0.2,0.01,2400.0,0.2,166499.3,131.62,0.3,True,54.3,-0.05,-0.05,-0.01,2026-02-11,16.61,1.02,0,,16.31,17.32,False,False
11-02-2026 13:00,HEKTS,3.25,3.33,3.24,3.32,38367474.0,0.01,0.07,0.0,6900.0,0.07,15862196.2,141.88,0.14,True,61.87,-0.0,-0.0,-0.0,2026-02-11,3.24,2.47,0,,3.12,3.44,False,False
11-02-2026 13:00,NTHOL,48.62,49.28,48.52,49.18,138290.0,0.1,0.56,0.03,1547.06,0.56,80916.9,70.9,0.18,True,61.38,0.43,0.48,-0.06,2026-02-11,49.02,0.33,0,,46.04,49.52,False,False
11-02-2026 13:00,BOSSA,7.04,7.12,7.03,7.12,445559.0,0.0,0.08,0.02,400.0,0.08,221441.9,101.21,0.0,True,61.72,0.03,0.03,-0.0,2026-02-11,7.1,0.28,0,,6.71,7.13,False,False
11-02-2026 13:00,VBTYZ,22.48,23.34,22.48,23.32,1304549.0,0.02,0.84,0.06,1400.0,0.84,712948.5,82.98,0.02,True,69.58,0.46,0.4,0.06,2026-02-11,21.46,8.67,0,,20.94,ATH,False,False
11-02-2026 12:00,SASA,2.53,2.59,2.52,2.58,883507450.0,0.01,0.05,0.0,4900.0,0.05,218743890.3,303.9,0.2,True,65.18,0.01,0.01,0.0,2026-02-11,2.51,2.79,0,,2.5,2.61,False,False
11-02-2026 12:00,OFSYM,74.55,76.25,74.4,76.25,289083.0,0.0,1.7,0.2,729.27,1.7,166351.7,73.78,0.0,True,70.25,0.88,0.87,0.02,2026-02-11,74.65,2.14,0,,70.0,ATH,False,False
11-02-2026 12:00,EFOR,22.24,23.2,22.2,23.12,2685037.0,0.08,0.88,0.22,303.67,0.88,1466868.0,83.05,0.09,True,62.34,-0.0,-0.06,0.06,2026-02-11,22.34,3.49,0,,21.42,24.06,False,False
11-02-2026 12:00,TAVHL,354.25,357.75,354.25,357.5,297278.0,0.25,3.25,0.2,1525.0,3.25,189686.0,56.72,0.08,True,49.08,-1.2,-0.36,-0.85,2026-02-11,354.0,0.99,0,,350.5,369.0,False,False
11-02-2026 12:00,ISCTR,16.82,17.0,16.81,16.95,107591695.0,0.05,0.13,0.02,584.21,0.13,68582465.7,56.88,0.38,True,54.56,0.01,0.01,-0.01,2026-02-11,16.93,0.12,0,,16.27,17.14,False,False
11-02-2026 11:00,BIOEN,19.54,19.82,19.47,19.75,377791.0,0.07,0.21,0.0,10400.0,0.21,227393.3,66.14,0.33,True,51.29,-0.01,0.01,-0.02,2026-02-11,19.69,0.3,0,,19.16,20.2,False,False
11-02-2026 11:00,ASUZU,63.85,64.4,63.8,64.4,115623.0,0.0,0.55,0.04,1275.0,0.55,69256.2,66.95,0.0,True,57.12,0.18,0.25,-0.07,2026-02-11,64.1,0.47,0,,63.65,64.9,False,False
11-02-2026 11:00,SILVR,2.83,2.87,2.82,2.86,468422.0,0.01,0.03,0.0,1400.0,0.03,292086.3,60.37,0.33,True,53.45,-0.0,-0.01,0.0,2026-02-11,2.84,0.7,0,,2.82,2.91,False,False
11-02-2026 11:00,GUBRF,519.0,523.5,518.5,522.5,342233.0,1.0,3.5,0.5,600.0,3.5,218293.2,56.78,0.29,True,56.77,1.48,1.76,-0.28,2026-02-11,519.5,0.58,0,,502.0,533.0,False,False
11-02-2026 11:00,LMKDC,31.24,31.6,31.1,31.56,517228.0,0.04,0.32,0.02,1500.0,0.32,301707.4,71.43,0.13,True,52.16,-0.03,0.01,-0.03,2026-02-11,31.4,0.51,0,,30.46,32.06,False,False
11-02-2026 11:00,BOBET,20.7,20.78,20.64,20.76,394734.0,0.02,0.06,0.0,2900.0,0.06,237422.3,66.26,0.33,True,47.14,-0.04,-0.04,-0.0,2026-02-11,20.74,0.1,0,,20.26,21.0,False,False
11-02-2026 11:00,AEFES,20.12,20.3,19.99,20.3,8589071.0,0.0,0.18,0.0,8900.0,0.18,4345715.1,97.64,0.0,True,49.3,-0.0,0.03,-0.03,2026-02-11,20.32,-0.1,0,,20.18,20.7,False,False
11-02-2026 11:00,SARKY,41.0,42.06,40.84,42.0,6068731.0,0.06,1.0,0.1,941.67,1.0,2449165.1,147.79,0.06,True,53.46,-0.34,-0.4,0.07,2026-02-11,41.02,2.39,0,,40.4,44.28,False,False
11-02-2026 11:00,ALVES,4.12,4.29,4.1,4.27,96982938.0,0.02,0.15,0.03,383.87,0.15,26420894.0,267.07,0.13,True,69.95,0.01,-0.01,0.02,2026-02-11,4.0,6.75,0,,3.91,4.59,False,False
11-02-2026 11:00,TKNSA,24.38,25.08,24.28,25.04,1223565.0,0.04,0.66,0.06,1000.0,0.66,330085.3,270.68,0.06,True,67.92,0.02,-0.02,0.04,2026-02-11,24.2,3.47,0,,23.7,25.12,False,False
11-02-2026 11:00,SERNT,8.37,8.68,8.33,8.65,3476994.0,0.03,0.28,0.03,865.52,0.28,890334.2,290.53,0.11,True,77.25,0.06,0.05,0.01,2026-02-11,8.4,2.98,0,,8.29,8.83,False,False
11-02-2026 11:00,ANGEN,11.37,11.47,11.34,11.45,356499.0,0.02,0.08,0.01,1233.33,0.08,154563.3,130.65,0.25,True,58.4,0.01,0.01,0.0,2026-02-11,11.37,0.7,0,,11.1,11.47,False,False
11-02-2026 10:00,SEGMN,45.8,47.38,45.08,47.16,2367375.0,0.22,1.36,0.16,760.76,1.36,1167429.7,102.79,0.16,True,48.96,-0.45,-0.36,-0.1,2026-02-11,46.2,2.08,0,,44.78,49.0,False,False
11-02-2026 10:00,MOBTL,10.35,10.72,10.35,10.72,4937703.0,0.0,0.37,0.04,760.47,0.37,1173443.5,320.79,0.0,True,64.09,0.04,0.04,-0.01,2026-02-11,10.38,3.28,0,,10.31,10.76,False,False
11-02-2026 10:00,EDIP,37.86,38.5,37.52,38.34,426319.0,0.16,0.48,0.04,1163.16,0.48,94716.1,350.1,0.33,True,68.11,0.25,0.23,0.02,2026-02-11,37.74,1.59,0,,36.04,38.66,False,False
11-02-2026 10:00,DZGYO,8.99,9.87,8.97,9.7,5420473.0,0.17,0.71,0.06,1026.98,0.71,769885.5,604.06,0.24,True,81.24,0.07,0.04,0.03,2026-02-11,8.99,7.9,0,,8.63,ATH,False,False
11-02-2026 10:00,SKBNK,9.85,10.07,9.83,10.02,13108138.0,0.05,0.17,0.04,359.46,0.17,5586730.7,134.63,0.29,True,76.05,0.17,0.15,0.02,2026-02-11,9.86,1.62,0,,9.04,ATH,False,False
11-02-2026 10:00,KLRHO,576.5,613.5,569.5,607.0,610903.0,6.5,30.5,1.95,1464.1,30.5,253683.7,140.81,0.21,True,57.63,-2.72,-4.32,1.6,2026-02-11,576.5,5.29,0,,560.5,610.0,False,False
11-02-2026 10:00,CEMAS,5.68,5.93,5.65,5.9,17716031.0,0.03,0.22,0.01,1471.43,0.22,5205603.5,240.33,0.14,True,51.99,-0.06,-0.05,-0.01,2026-02-11,5.72,3.15,0,,5.65,6.44,False,False
11-02-2026 10:00,INVEO,9.32,10.07,9.22,9.95,11776823.0,0.12,0.63,0.07,854.55,0.63,1691906.4,596.07,0.19,True,83.01,0.08,0.04,0.04,2026-02-11,9.32,6.76,0,,8.95,ATH,False,False
11-02-2026 10:00,TTKOM,66.2,67.65,65.95,67.55,6171555.0,0.1,1.35,0.07,1828.57,1.35,2515123.1,145.38,0.07,True,53.42,-0.13,-0.09,-0.04,2026-02-11,66.75,1.2,0,,66.05,68.55,False,False
11-02-2026 10:00,JANTS,19.49,20.24,19.39,20.06,4544716.0,0.18,0.57,0.05,1017.65,0.57,616110.2,637.65,0.32,True,77.25,0.06,0.03,0.03,2026-02-11,19.49,2.92,0,,19.23,ATH,False,False
11-02-2026 10:00,TURSG,12.43,12.66,12.36,12.6,23970655.0,0.06,0.17,0.03,529.63,0.17,12013363.9,99.53,0.35,True,67.4,0.18,0.16,0.02,2026-02-11,12.45,1.2,0,,11.7,12.78,False,False
11-02-2026 10:00,ZEDUR,8.8,9.1,8.73,9.03,2893786.0,0.07,0.23,0.05,389.36,0.23,830873.4,248.28,0.3,True,75.33,0.12,0.08,0.04,2026-02-11,8.74,3.32,0,,8.45,ATH,False,False
11-02-2026 10:00,KARSN,10.15,10.3,10.12,10.26,2241480.0,0.04,0.11,0.01,1275.0,0.11,1015869.6,120.65,0.36,True,52.34,0.02,0.04,-0.02,2026-02-11,10.22,0.39,0,,9.88,10.48,False,False
11-02-2026 10:00,PLTUR,22.8,24.52,22.58,24.04,3881235.0,0.48,1.24,0.16,656.1,1.24,600771.4,546.04,0.39,True,82.8,0.34,0.24,0.11,2026-02-11,22.78,5.53,0,,21.46,ATH,False,False
11-02-2026 10:00,CEOEM,22.1,23.0,22.1,22.84,635896.0,0.16,0.74,0.09,740.91,0.74,120740.1,426.67,0.22,True,69.99,0.12,0.09,0.02,2026-02-11,22.32,2.33,0,,22.1,23.48,False,False
11-02-2026 10:00,PRDGS,7.02,7.51,6.97,7.41,6236314.0,0.1,0.39,0.03,1344.44,0.39,1289897.8,383.47,0.26,True,67.88,0.05,0.07,-0.02,2026-02-11,7.04,5.26,0,,6.6,7.54,False,False
11-02-2026 10:00,ISDMR,45.6,46.86,45.4,46.6,1453336.0,0.26,1.0,0.04,2531.58,1.0,475500.7,205.64,0.26,True,72.59,0.61,0.69,-0.08,2026-02-11,45.66,2.06,0,,41.94,48.0,False,False
11-02-2026 10:00,EPLAS,6.81,7.1,6.78,7.02,3578791.0,0.08,0.21,0.02,740.0,0.21,631047.9,467.12,0.38,True,60.99,-0.02,-0.04,0.02,2026-02-11,6.77,3.69,0,,6.74,7.05,True,True
11-02-2026 10:00,KRDMD,30.04,30.56,29.82,30.48,16632720.0,0.08,0.44,0.07,494.59,0.44,5214829.3,218.95,0.18,True,61.25,0.14,0.13,0.01,2026-02-11,30.36,0.4,0,,28.74,30.7,False,False
11-02-2026 10:00,THYAO,330.25,336.75,329.0,335.75,18679335.0,1.0,5.5,0.75,633.33,5.5,5666509.5,229.64,0.18,True,68.69,3.18,3.08,0.09,2026-02-11,333.0,0.83,0,,311.75,ATH,False,False
11-02-2026 10:00,KRDMB,34.54,35.12,34.04,35.1,213139.0,0.02,0.56,0.1,471.43,0.56,138215.8,54.21,0.04,True,73.03,0.31,0.2,0.12,2026-02-11,34.56,1.56,0,,32.98,35.3,False,False
11-02-2026 10:00,ARSAN,4.54,4.79,4.51,4.77,13844178.0,0.02,0.23,0.01,1433.33,0.23,3862077.8,258.46,0.09,True,65.34,0.04,0.04,-0.0,2026-02-11,4.54,5.07,0,,4.49,4.89,False,False
11-02-2026 10:00,TMSN,111.4,118.3,110.7,117.1,1342718.0,1.2,5.7,0.43,1225.58,5.7,186795.6,618.82,0.21,True,77.47,0.78,0.58,0.2,2026-02-11,111.4,5.12,0,,106.2,118.3,False,False
11-02-2026 10:00,AKHAN,29.98,31.46,29.58,31.46,13202929.0,0.0,1.48,0.15,900.0,1.48,3601827.9,266.56,0.0,True,100.0,1.04,0.83,0.21,2026-02-11,28.6,10.0,0,,28.6,ATH,False,False
11-02-2026 10:00,VAKFA,14.13,14.59,14.06,14.52,20510682.0,0.07,0.39,0.03,1200.0,0.39,4706146.6,335.83,0.18,True,77.44,0.21,0.22,-0.01,2026-02-11,14.03,3.49,0,,13.97,14.61,False,False
11-02-2026 10:00,IHAAS,41.4,43.5,41.0,43.2,2370526.0,0.3,1.8,0.1,1736.73,1.8,712113.5,232.89,0.17,True,41.15,-1.91,-2.29,0.39,2026-02-11,41.42,4.3,0,,41.0,49.72,True,True
11-02-2026 10:00,FROTO,115.0,118.0,114.1,117.6,5212972.0,0.4,2.6,0.16,1525.0,2.6,2774883.8,87.86,0.15,True,55.51,-0.21,-0.07,-0.15,2026-02-11,115.9,1.47,0,,114.4,120.3,False,False
11-02-2026 10:00,GLYHO,15.25,15.67,15.25,15.58,1184911.0,0.09,0.33,0.05,547.06,0.33,582083.5,103.56,0.27,True,58.7,0.0,-0.01,0.01,2026-02-11,15.39,1.23,0,,15.15,15.71,False,False
11-02-2026 10:00,SRVGY,3.41,3.46,3.4,3.45,6610801.0,0.01,0.04,0.0,1900.0,0.04,2618749.3,152.44,0.25,True,60.66,0.01,0.01,0.0,2026-02-11,3.42,0.88,0,,3.4,3.46,False,False
11-02-2026 10:00,MNDRS,15.06,15.2,14.96,15.16,590308.0,0.04,0.1,0.0,2400.0,0.1,255425.4,131.11,0.4,True,59.47,0.1,0.11,-0.01,2026-02-11,15.08,0.53,0,,14.02,15.46,False,False
11-02-2026 10:00,GEREL,22.0,23.76,21.98,23.76,14703226.0,0.0,1.76,0.35,397.18,1.76,3218823.4,356.79,0.0,True,96.79,1.15,0.98,0.17,2026-02-11,21.6,10.0,0,,16.32,ATH,False,False
10-02-2026 17:00,SAYAS,43.46,45.98,43.42,45.98,1526381.0,0.0,2.52,0.4,533.17,2.52,343749.7,344.04,0.0,True,86.09,0.83,0.5,0.33,2026-02-10,41.8,10.0,0,,39.74,ATH,False,False
10-02-2026 17:00,IMASM,4.49,4.92,4.49,4.92,49496282.0,0.0,0.43,0.05,814.89,0.43,8163192.6,506.33,0.0,True,81.59,0.05,0.01,0.03,2026-02-10,4.48,9.82,0,,4.42,ATH,False,False
10-02-2026 17:00,DSTKF,847.5,859.5,847.0,856.5,499126.0,3.0,9.0,0.2,4400.0,9.0,155569.2,220.84,0.33,True,58.74,5.56,2.08,3.48,2026-02-10,855.5,0.12,0,,767.5,869.5,False,False
10-02-2026 17:00,BLCYT,47.2,49.0,45.28,49.0,911568.0,0.0,1.8,0.2,782.35,1.8,348625.0,161.48,0.0,True,60.47,0.87,0.83,0.04,2026-02-10,47.34,3.51,2,45.28,45.28,50.2,False,False
10-02-2026 17:00,TCELL,116.6,118.2,116.6,118.0,7032111.0,0.2,1.4,0.07,1900.0,1.4,3683677.3,90.9,0.14,True,62.88,0.38,0.31,0.07,2026-02-10,117.0,0.85,0,,113.0,119.5,False,False
10-02-2026 17:00,CATES,41.5,42.08,41.46,42.08,183164.0,0.0,0.58,0.03,1712.5,0.58,101638.5,80.21,0.0,True,59.42,0.15,0.11,0.04,2026-02-10,41.54,1.3,1,42.08,39.08,42.16,False,False
10-02-2026 17:00,DURDO,3.81,3.84,3.8,3.84,1034099.0,0.0,0.03,0.0,900.0,0.03,399946.3,158.56,0.0,True,70.21,0.02,0.02,0.01,2026-02-10,3.78,1.59,0,,3.65,3.88,False,False
10-02-2026 17:00,ASTOR,161.9,165.5,161.9,164.7,8468681.0,0.8,2.8,0.29,865.52,2.8,3624743.9,133.64,0.29,True,68.67,2.03,1.76,0.27,2026-02-10,160.9,2.36,0,,149.0,166.1,False,False
10-02-2026 17:00,HALKB,45.26,46.1,44.98,46.06,11807662.0,0.04,0.8,0.09,769.57,0.8,5271774.9,123.98,0.05,True,69.47,0.33,0.25,0.09,2026-02-10,45.1,2.13,0,,43.0,46.58,False,False
10-02-2026 17:00,NTGAZ,11.42,11.63,11.42,11.61,800646.0,0.02,0.19,0.03,458.82,0.19,455926.9,75.61,0.11,True,70.26,0.05,0.02,0.03,2026-02-10,11.32,2.56,0,,11.07,11.81,False,False
10-02-2026 17:00,MNDTR,6.74,6.82,6.74,6.8,449567.0,0.02,0.06,0.01,757.14,0.06,227010.1,98.04,0.33,True,59.15,0.01,-0.0,0.01,2026-02-10,6.72,1.19,0,,6.53,7.39,False,False
10-02-2026 17:00,RUBNS,32.76,35.0,32.7,34.78,4173742.0,0.22,2.02,0.24,734.71,2.02,1113028.9,274.99,0.11,True,73.33,1.02,0.79,0.23,2026-02-10,32.12,8.28,0,,28.18,35.02,False,False
10-02-2026 16:00,TEKTU,10.0,10.31,9.95,10.31,12753541.0,0.0,0.31,0.07,336.62,0.31,3798355.9,235.76,0.0,True,80.22,0.32,0.27,0.05,2026-02-10,9.38,9.91,0,,8.32,10.66,False,False
10-02-2026 16:00,BLUME,47.1,48.34,47.04,48.12,791005.0,0.22,1.02,0.15,571.05,1.02,327406.0,141.6,0.22,True,77.22,0.6,0.42,0.18,2026-02-10,46.2,4.16,0,,43.88,48.42,False,False
10-02-2026 16:00,ECOGR,25.4,26.38,25.38,26.1,6279016.0,0.28,0.7,0.13,446.88,0.7,1419004.7,342.49,0.4,True,81.13,0.26,0.12,0.14,2026-02-10,24.88,4.9,1,26.38,24.62,26.38,False,False
10-02-2026 16:00,SEYKM,5.25,5.51,5.24,5.46,466201.0,0.05,0.21,0.02,1135.29,0.21,170918.7,172.76,0.24,True,68.15,0.02,0.0,0.02,2026-02-10,5.27,3.61,0,,5.17,5.67,False,False
10-02-2026 16:00,ENSRI,28.04,29.28,28.04,29.18,1584768.0,0.1,1.14,0.16,621.52,1.14,503791.1,214.57,0.09,True,76.59,0.45,0.39,0.06,2026-02-10,27.5,6.11,0,,26.3,ATH,False,False
10-02-2026 15:00,FORMT,3.58,3.64,3.56,3.63,21756107.0,0.01,0.05,0.0,900.0,0.05,13180102.2,65.07,0.2,True,53.43,0.0,0.01,-0.01,2026-02-10,3.57,1.68,0,,3.54,3.87,False,False
10-02-2026 15:00,DEVA,76.1,76.75,75.65,76.75,236643.0,0.0,0.65,0.11,490.91,0.65,90221.7,162.29,0.0,True,67.76,0.66,0.67,-0.01,2026-02-10,75.55,1.59,0,,73.75,ATH,False,False
10-02-2026 15:00,SURGY,52.85,53.95,52.6,53.85,806512.0,0.1,1.0,0.15,566.67,1.0,298952.9,169.78,0.1,True,68.76,0.24,0.07,0.17,2026-02-10,51.95,3.66,0,,50.55,55.2,False,False
10-02-2026 14:00,RGYAS,156.6,159.2,156.5,159.0,153158.0,0.2,2.4,0.45,433.33,2.4,84461.4,81.33,0.08,True,67.6,0.87,0.54,0.33,2026-02-10,156.5,1.6,0,,150.9,166.0,False,False
10-02-2026 14:00,ANHYT,118.6,122.2,118.5,121.7,513122.0,0.5,3.1,0.43,620.93,3.1,124165.3,313.26,0.16,True,75.58,0.45,-0.02,0.47,2026-02-10,117.1,3.93,1,122.2,116.4,122.2,False,False
10-02-2026 14:00,KTLEV,39.08,40.08,39.02,40.04,11749321.0,0.04,0.96,0.24,306.78,0.96,4907245.5,139.43,0.04,True,80.28,0.67,0.42,0.25,2026-02-10,37.66,6.32,0,,34.68,ATH,False,False
10-02-2026 14:00,ATAKP,57.2,57.95,57.2,57.9,151351.0,0.05,0.7,0.13,418.52,0.7,59987.4,152.3,0.07,True,60.69,0.11,-0.05,0.15,2026-02-10,57.6,0.52,0,,55.25,60.4,False,False
10-02-2026 14:00,ARZUM,2.97,3.11,2.96,3.11,25411015.0,0.0,0.14,0.04,241.46,0.14,10798695.0,135.32,0.0,True,78.73,0.1,0.07,0.02,2026-02-10,2.83,9.89,0,,2.56,ATH,False,False
10-02-2026 14:00,TRENJ,102.3,104.5,102.1,103.9,444814.0,0.6,1.6,0.26,515.38,1.6,230329.9,93.12,0.37,True,62.04,0.45,0.17,0.28,2026-02-10,101.9,1.96,0,,100.5,105.0,False,False
10-02-2026 14:00,MARTI,2.88,2.91,2.87,2.91,4372476.0,0.0,0.03,0.01,328.57,0.03,2404102.0,81.88,0.0,True,72.69,0.03,0.02,0.01,2026-02-10,2.86,1.75,0,,2.7,2.93,False,False
10-02-2026 14:00,BERA,21.22,23.1,21.22,22.88,19982807.0,0.22,1.66,0.17,900.0,1.66,7082815.1,182.13,0.13,True,76.72,0.73,0.67,0.06,2026-02-10,21.1,8.44,1,23.1,18.08,23.1,False,False
10-02-2026 14:00,TABGD,260.5,264.0,260.0,263.25,359127.0,0.75,2.75,0.88,214.29,2.75,82123.3,337.3,0.27,True,74.75,1.34,0.36,0.98,2026-02-10,256.0,2.83,0,,255.0,283.0,False,False
10-02-2026 14:00,SNICA,4.46,4.64,4.46,4.59,7413624.0,0.05,0.13,0.01,1200.0,0.13,2061096.1,259.69,0.38,True,74.32,0.04,0.04,0.0,2026-02-10,4.49,2.23,0,,4.45,ATH,False,False
10-02-2026 14:00,MPARK,458.5,472.75,457.5,472.5,172662.0,0.25,14.0,1.58,788.89,14.0,66999.8,157.71,0.02,True,73.56,3.64,2.54,1.1,2026-02-10,458.75,3.0,0,,442.25,473.0,False,False
10-02-2026 14:00,TRMET,131.7,133.1,131.5,133.1,710667.0,0.0,1.4,0.25,460.0,1.4,414162.9,71.59,0.0,True,58.17,0.18,-0.23,0.41,2026-02-10,131.5,1.22,0,,129.9,142.4,False,False
10-02-2026 14:00,ANSGR,27.34,27.6,27.34,27.58,1910925.0,0.02,0.24,0.05,400.0,0.24,1149620.5,66.22,0.08,True,64.55,0.03,-0.05,0.08,2026-02-10,27.08,1.85,1,27.6,26.92,27.6,False,False
10-02-2026 14:00,SOKM,64.7,65.4,64.4,65.25,837718.0,0.15,0.55,0.11,400.0,0.55,388853.6,115.43,0.27,True,61.19,0.21,0.04,0.17,2026-02-10,64.9,0.54,0,,61.6,67.4,False,False
10-02-2026 14:00,BUCIM,6.98,7.07,6.98,7.07,4954171.0,0.0,0.09,0.02,309.09,0.09,1886303.0,162.64,0.0,True,79.19,0.04,0.01,0.03,2026-02-10,6.85,3.21,0,,6.72,7.16,False,False
10-02-2026 14:00,KFEIN,9.74,9.91,9.74,9.89,1146641.0,0.02,0.15,0.04,316.67,0.15,679764.1,68.68,0.13,True,79.6,0.12,0.08,0.04,2026-02-10,9.6,3.02,0,,9.44,ATH,False,False
10-02-2026 13:00,GARFA,28.7,29.08,28.68,29.04,261127.0,0.04,0.34,0.05,553.85,0.34,119771.6,118.02,0.12,True,61.43,-0.05,-0.13,0.08,2026-02-10,28.62,1.47,1,29.08,28.3,29.08,False,False
10-02-2026 13:00,FLAP,9.27,9.51,9.17,9.45,382221.0,0.06,0.18,0.03,592.31,0.18,95284.2,301.14,0.33,True,74.56,0.06,0.04,0.03,2026-02-10,9.18,2.94,0,,9.08,ATH,False,False
10-02-2026 12:00,ONRYT,69.65,71.55,69.6,71.1,373339.0,0.45,1.45,0.28,408.77,1.45,91461.7,308.19,0.31,True,76.7,0.43,0.18,0.25,2026-02-10,68.75,3.42,0,,66.75,ATH,False,False
10-02-2026 12:00,GLRMK,189.7,194.0,189.2,193.2,415850.0,0.8,3.5,0.34,929.41,3.5,204956.8,102.9,0.23,True,66.15,0.48,-0.15,0.63,2026-02-10,189.3,2.06,1,194.0,182.5,194.0,False,False
10-02-2026 12:00,KATMR,2.87,2.91,2.86,2.91,22458480.0,0.0,0.04,0.0,1233.33,0.04,9591110.3,134.16,0.0,True,64.67,0.01,0.0,0.0,2026-02-10,2.88,1.04,0,,2.86,2.93,False,False
10-02-2026 12:00,KZGYO,26.3,26.58,26.3,26.58,214544.0,0.0,0.28,0.07,288.89,0.28,111651.4,92.16,0.0,True,69.13,0.06,-0.04,0.1,2026-02-10,25.9,2.63,0,,25.4,26.88,False,False
10-02-2026 12:00,PENTA,14.41,14.48,14.4,14.48,242948.0,0.0,0.07,0.01,536.36,0.07,136168.0,78.42,0.0,True,73.49,0.08,0.05,0.03,2026-02-10,14.37,0.77,0,,13.85,14.61,False,False
10-02-2026 12:00,FORTE,89.5,91.9,89.5,91.6,426058.0,0.3,2.1,0.24,757.14,2.1,133026.0,220.28,0.14,True,66.15,0.14,-0.2,0.35,2026-02-10,89.45,2.4,0,,88.35,93.6,False,False
10-02-2026 12:00,VRGYO,2.54,2.6,2.53,2.59,10921981.0,0.01,0.05,0.01,354.55,0.05,3960883.0,175.75,0.2,True,80.3,0.03,0.02,0.01,2026-02-10,2.51,3.19,1,2.6,2.38,2.6,False,False
10-02-2026 12:00,IHEVA,2.37,2.39,2.37,2.39,318246.0,0.0,0.02,0.01,300.0,0.02,132638.0,139.94,0.0,True,58.39,0.01,0.01,0.0,2026-02-10,2.39,0.0,0,,2.29,2.4,False,False
10-02-2026 12:00,KNFRT,12.58,12.82,12.53,12.8,1121515.0,0.02,0.22,0.02,856.52,0.22,460940.3,143.31,0.09,True,62.88,0.03,0.03,-0.0,2026-02-10,12.44,2.89,0,,12.34,13.24,False,False
10-02-2026 12:00,KLSER,28.76,29.1,28.72,29.04,481325.0,0.06,0.28,0.04,636.84,0.28,172229.1,179.47,0.21,True,70.79,0.15,0.11,0.03,2026-02-10,28.68,1.26,0,,28.06,29.36,False,False
10-02-2026 12:00,MOPAS,55.7,58.55,55.7,57.95,2582461.0,0.6,2.25,0.28,703.57,2.25,532618.9,384.86,0.27,True,80.69,0.63,0.45,0.18,2026-02-10,55.0,5.36,1,58.55,52.2,58.55,False,False
10-02-2026 11:00,CANTE,1.82,1.85,1.81,1.85,140343149.0,0.0,0.03,0.0,1400.0,0.03,57214500.0,145.29,0.0,True,57.86,-0.0,-0.01,0.01,2026-02-10,1.82,1.65,0,,1.78,1.86,True,False
10-02-2026 11:00,QUAGR,2.86,2.99,2.85,2.99,43588866.0,0.0,0.13,0.01,1525.0,0.13,16131329.5,170.21,0.0,True,74.23,0.07,0.06,0.01,2026-02-10,2.9,3.1,0,,2.82,ATH,False,False
10-02-2026 11:00,SELVA,2.58,2.65,2.56,2.64,10938285.0,0.01,0.06,0.0,2900.0,0.06,4699717.2,132.74,0.17,True,54.43,-0.01,-0.02,0.01,2026-02-10,2.59,1.93,2,2.56,2.56,2.65,True,True
10-02-2026 11:00,KRONT,15.85,16.27,15.85,16.19,411099.0,0.08,0.34,0.07,359.46,0.34,181604.4,126.37,0.24,True,76.55,0.17,0.1,0.07,2026-02-10,15.69,3.19,1,16.27,14.95,16.27,False,False
10-02-2026 11:00,SAMAT,5.96,6.06,5.94,6.05,512325.0,0.01,0.09,0.02,328.57,0.09,209855.3,144.13,0.11,True,74.03,0.06,0.04,0.02,2026-02-10,5.92,2.2,0,,5.69,ATH,False,False
10-02-2026 11:00,ODAS,5.86,6.19,5.85,6.14,20106303.0,0.05,0.28,0.03,833.33,0.28,5140145.2,291.16,0.18,True,75.92,0.06,0.03,0.02,2026-02-10,5.9,4.07,1,6.19,5.64,6.19,False,False
10-02-2026 11:00,GZNMI,48.74,52.55,48.66,52.35,2348146.0,0.2,3.61,0.51,609.23,3.61,909414.1,158.2,0.06,True,85.56,1.34,0.93,0.41,2026-02-10,48.98,6.88,0,,44.64,ATH,False,False
10-02-2026 11:00,FZLGY,12.38,12.8,12.38,12.69,2924315.0,0.11,0.31,0.03,839.39,0.31,724120.3,303.84,0.35,True,67.39,0.09,0.04,0.05,2026-02-10,12.52,1.36,0,,12.0,12.97,False,False
10-02-2026 11:00,AVHOL,39.14,39.74,39.14,39.74,209530.0,0.0,0.6,0.1,500.0,0.6,111351.0,88.17,0.0,True,70.91,0.3,0.21,0.1,2026-02-10,39.26,1.22,0,,37.72,ATH,False,False
10-02-2026 11:00,LRSHO,4.16,4.23,4.15,4.22,3678488.0,0.01,0.06,0.01,900.0,0.06,2034414.0,80.81,0.17,True,65.08,0.01,-0.01,0.01,2026-02-10,4.14,1.93,0,,4.03,4.37,False,False
10-02-2026 11:00,GMTAS,27.14,27.62,26.96,27.52,982450.0,0.1,0.38,0.04,955.56,0.38,392171.7,150.52,0.26,True,72.85,0.49,0.42,0.07,2026-02-10,27.0,1.93,1,27.62,24.42,27.62,False,False
10-02-2026 11:00,ADESE,1.19,1.23,1.18,1.23,135261094.0,0.0,0.04,0.0,900.0,0.04,55294849.4,144.62,0.0,True,62.65,0.0,-0.0,0.0,2026-02-10,1.19,3.36,0,,1.17,1.45,False,False
10-02-2026 11:00,NATEN,8.41,8.5,8.41,8.48,1792365.0,0.02,0.07,0.01,775.0,0.07,803537.6,123.06,0.29,True,58.71,0.0,-0.01,0.02,2026-02-10,8.4,0.95,1,8.5,8.26,8.5,False,False
10-02-2026 11:00,BORSK,6.35,6.46,6.35,6.45,2573604.0,0.01,0.1,0.02,354.55,0.1,1228023.0,109.57,0.1,True,76.59,0.05,0.03,0.02,2026-02-10,6.34,1.74,0,,6.08,6.47,False,False
10-02-2026 11:00,PAPIL,18.35,18.5,18.29,18.48,2118354.0,0.02,0.13,0.01,1081.82,0.13,1231578.5,72.0,0.15,True,53.68,-0.02,-0.09,0.06,2026-02-10,18.42,0.33,0,,17.8,18.89,False,False
10-02-2026 11:00,BNTAS,6.74,6.82,6.74,6.81,1020043.0,0.01,0.07,0.01,900.0,0.07,526907.2,93.59,0.14,True,73.46,0.04,0.02,0.02,2026-02-10,6.69,1.79,0,,6.47,6.93,False,False
10-02-2026 11:00,AKGRT,8.47,8.61,8.44,8.61,4186352.0,0.0,0.14,0.01,900.0,0.14,1472125.1,184.37,0.0,True,67.45,0.04,0.02,0.02,2026-02-10,8.38,2.74,0,,7.86,8.71,False,False
10-02-2026 11:00,ARFYE,31.02,32.84,31.0,32.78,12408302.0,0.06,1.76,0.34,417.65,1.76,4409519.9,181.4,0.03,True,80.35,0.72,0.41,0.31,2026-02-10,31.3,4.73,0,,28.28,ATH,False,False
10-02-2026 11:00,CUSAN,30.3,31.68,30.2,31.48,315068.0,0.2,1.18,0.02,5800.0,1.18,207506.8,51.84,0.17,True,60.58,0.45,0.45,-0.01,2026-02-10,31.14,1.09,0,,27.8,32.3,False,False
10-02-2026 11:00,GIPTA,58.2,62.1,58.15,61.3,2126659.0,0.8,3.1,0.3,933.33,3.1,405015.3,425.08,0.26,True,76.33,0.27,0.04,0.23,2026-02-10,58.25,5.24,0,,58.05,ATH,False,False
10-02-2026 10:00,KLKIM,42.0,43.1,41.88,42.9,1041612.0,0.2,0.9,0.14,552.17,0.9,276885.4,276.19,0.22,True,72.97,0.34,0.26,0.09,2026-02-10,42.0,2.14,0,,40.06,ATH,False,False
10-02-2026 10:00,ISKPL,11.22,11.99,11.22,11.84,16808597.0,0.15,0.62,0.07,773.24,0.62,2553434.9,558.27,0.24,True,73.53,0.05,-0.0,0.05,2026-02-10,11.22,5.53,0,,11.01,11.92,False,False
10-02-2026 10:00,ZGYO,29.0,30.5,28.7,30.5,6876748.0,0.0,1.5,0.15,900.0,1.5,773787.7,788.71,0.0,True,93.65,1.43,1.24,0.18,2026-02-10,27.74,9.95,1,30.5,19.19,ATH,False,False
10-02-2026 10:00,KOCMT,2.75,2.79,2.73,2.79,17797436.0,0.0,0.04,0.0,1233.33,0.04,3882884.8,358.36,0.0,True,72.21,0.01,-0.0,0.01,2026-02-10,2.72,2.57,0,,2.63,2.82,False,False
10-02-2026 10:00,KMPUR,15.9,16.17,15.88,16.1,795970.0,0.07,0.2,0.02,852.38,0.2,185957.9,328.04,0.35,True,72.8,0.12,0.07,0.05,2026-02-10,15.83,1.71,1,16.17,15.02,16.17,False,False
10-02-2026 10:00,ZERGY,21.06,22.16,21.06,22.0,25887427.0,0.16,0.94,0.21,354.11,0.94,7329796.1,253.18,0.17,True,76.43,0.69,0.42,0.28,2026-02-10,20.5,7.32,0,,16.22,ATH,False,False
10-02-2026 10:00,KLYPV,64.85,69.9,64.5,69.0,3770103.0,0.9,4.15,0.29,1331.03,4.15,680602.9,453.94,0.22,True,65.53,-0.37,-0.57,0.2,2026-02-10,64.6,6.81,3,,64.5,74.9,True,True
10-02-2026 10:00,ISSEN,7.6,7.75,7.58,7.72,614808.0,0.03,0.12,0.01,1100.0,0.12,187895.7,227.21,0.25,True,70.34,0.02,-0.01,0.02,2026-02-10,7.56,2.12,0,,7.36,7.77,False,False
10-02-2026 10:00,ASELS,292.25,296.5,291.0,296.0,10769094.0,0.5,3.75,0.4,837.5,3.75,3122530.1,244.88,0.13,True,61.43,-0.15,-0.91,0.77,2026-02-10,292.0,1.37,0,,283.0,304.0,False,False
10-02-2026 10:00,KRVGD,3.05,3.12,3.04,3.11,2035657.0,0.01,0.06,0.01,900.0,0.06,764234.7,166.37,0.17,True,71.54,0.02,0.01,0.01,2026-02-10,3.06,1.63,2,3.04,3.04,3.31,False,False
10-02-2026 10:00,ULUFA,4.14,4.32,4.13,4.27,9880141.0,0.05,0.13,0.01,766.67,0.13,1693737.7,483.33,0.38,True,71.23,0.02,0.01,0.02,2026-02-10,4.14,3.14,1,4.32,3.97,4.32,False,False
10-02-2026 10:00,TRALT,48.26,50.0,47.66,49.9,44678604.0,0.1,1.64,0.3,454.05,1.64,12934305.5,245.43,0.06,True,68.69,0.31,-0.06,0.37,2026-02-10,48.34,3.23,0,,44.68,52.05,False,False
10-02-2026 10:00,BIGEN,10.12,10.48,10.05,10.42,7644747.0,0.06,0.3,0.07,310.96,0.3,2040271.3,274.69,0.2,True,79.89,0.14,0.07,0.07,2026-02-10,10.11,3.07,0,,9.43,ATH,False,False
10-02-2026 10:00,BURCE,61.85,63.95,60.35,63.5,476630.0,0.45,1.65,0.09,1636.84,1.65,172772.6,175.87,0.27,True,40.98,-1.57,-1.48,-0.09,2026-02-10,62.75,1.2,2,60.35,60.35,77.5,False,False
10-02-2026 10:00,DAGI,6.4,6.66,6.3,6.6,4274272.0,0.06,0.2,0.01,1900.0,0.2,990294.9,331.62,0.3,True,73.33,0.08,0.07,0.01,2026-02-10,6.36,3.77,3,,5.97,ATH,False,False
10-02-2026 10:00,DAPGM,11.77,12.4,11.65,12.23,11377197.0,0.17,0.46,0.07,538.89,0.46,3221545.4,253.16,0.37,True,73.03,0.24,0.22,0.02,2026-02-10,11.76,4.0,0,,10.2,ATH,False,False
10-02-2026 10:00,RYSAS,19.7,20.38,19.69,20.34,7855734.0,0.04,0.64,0.08,680.49,0.64,1782421.8,340.73,0.06,True,65.44,0.18,0.19,-0.01,2026-02-10,19.89,2.26,1,20.38,19.0,20.38,False,False
10-02-2026 10:00,DNISI,23.6,24.26,23.6,24.08,1055445.0,0.18,0.48,0.12,293.44,0.48,356786.9,195.82,0.38,True,74.71,0.37,0.32,0.05,2026-02-10,23.56,2.21,0,,21.7,ATH,False,False
10-02-2026 10:00,GENTS,10.6,10.76,10.51,10.74,1652414.0,0.02,0.14,0.01,1900.0,0.14,704983.2,134.39,0.14,True,52.88,-0.11,-0.18,0.06,2026-02-10,10.48,2.48,0,,10.19,10.85,True,False
10-02-2026 10:00,DURKN,19.01,20.32,19.01,20.1,4543724.0,0.22,1.09,0.21,411.74,1.09,1009948.1,349.9,0.2,True,81.02,0.52,0.3,0.22,2026-02-10,18.92,6.24,0,,17.79,ATH,False,False
10-02-2026 10:00,ALKLC,248.2,259.5,248.2,259.0,340389.0,0.5,10.8,0.94,1055.08,10.8,112378.1,202.9,0.05,True,60.44,-2.54,-3.19,0.65,2026-02-10,248.0,4.44,0,,245.5,282.5,True,True
10-02-2026 10:00,MERCN,18.57,20.28,18.57,20.0,19635137.0,0.28,1.43,0.17,717.14,1.43,2882386.7,581.21,0.2,True,87.25,0.56,0.41,0.15,2026-02-10,18.44,8.46,1,20.28,16.35,20.28,False,False
10-02-2026 10:00,ESCOM,3.86,3.91,3.79,3.9,5589495.0,0.01,0.04,0.0,900.0,0.04,2385896.6,134.27,0.25,True,68.22,0.04,0.03,0.01,2026-02-10,3.85,1.3,2,3.79,3.79,ATH,False,False
10-02-2026 10:00,GENIL,8.39,9.11,8.35,9.0,40302484.0,0.11,0.61,0.08,672.15,0.61,7982467.23,404.89,0.18,True,82.55,0.14,0.08,0.06,2026-02-10,8.33,8.0,0,,7.77,ATH,False,False
10-02-2026 10:00,ENERY,9.54,9.75,9.51,9.73,4586308.0,0.02,0.19,0.02,850.0,0.19,1351469.2,239.36,0.11,True,61.33,-0.03,-0.06,0.03,2026-02-10,9.53,2.1,0,,9.33,10.24,True,False
10-02-2026 10:00,MANAS,11.6,12.51,11.52,12.3,32913399.0,0.21,0.7,0.1,579.61,0.7,7377597.6,346.13,0.3,True,81.13,0.37,0.29,0.08,2026-02-10,11.38,8.08,1,12.51,10.09,12.51,False,False
10-02-2026 10:00,AKSEN,68.3,69.75,67.95,69.7,1544403.0,0.05,1.4,0.05,2700.0,1.4,566452.8,172.64,0.04,True,51.7,-0.63,-0.89,0.26,2026-02-10,68.3,2.05,2,67.95,67.95,70.05,True,False
09-02-2026 18:00,PASEU,154.7,158.9,154.7,158.9,1003796.0,0.0,4.2,0.51,723.53,4.2,541292.8,85.44,0.0,True,69.75,1.72,1.64,0.09,2026-02-09,154.9,2.58,0,,146.7,164.9,False,False
09-02-2026 17:00,DESA,11.89,12.12,11.87,12.06,345622.0,0.06,0.17,0.02,794.74,0.17,120044.8,187.91,0.35,True,64.19,0.01,-0.03,0.04,2026-02-09,11.85,1.77,0,,11.53,12.25,False,False
09-02-2026 17:00,ESCAR,27.26,28.0,27.24,28.0,1781065.0,0.0,0.74,0.05,1380.0,0.74,587131.3,203.35,0.0,True,66.63,0.11,0.07,0.04,2026-02-09,27.6,1.45,1,28.0,26.2,28.56,False,False
09-02-2026 17:00,AKFYE,19.14,19.36,19.14,19.33,1379400.0,0.03,0.19,0.02,955.56,0.19,734357.8,87.84,0.16,True,42.05,-0.32,-0.37,0.05,2026-02-09,19.03,1.58,0,,18.8,21.84,True,True
09-02-2026 17:00,ALKIM,19.3,19.68,19.24,19.65,1027758.0,0.03,0.35,0.05,548.15,0.35,252276.4,307.39,0.09,True,73.04,0.04,-0.03,0.07,2026-02-09,18.9,3.97,0,,18.72,19.92,False,False
09-02-2026 17:00,HDFGS,3.28,3.45,3.28,3.45,59867957.0,0.0,0.17,0.03,431.25,0.17,13893804.9,330.9,0.0,True,73.6,0.03,0.01,0.02,2026-02-09,3.14,9.87,0,,3.11,ATH,False,False
09-02-2026 17:00,BRKVY,112.5,114.3,112.5,114.2,165511.0,0.1,1.7,0.07,2328.57,1.7,81104.3,104.07,0.06,True,47.29,-1.11,-1.3,0.19,2026-02-09,113.5,0.62,0,,111.7,129.0,True,True
09-02-2026 17:00,AHGAZ,25.22,25.62,25.18,25.52,827067.0,0.1,0.3,0.04,733.33,0.3,407843.1,102.79,0.33,True,59.73,-0.02,-0.12,0.1,2026-02-09,25.16,1.43,0,,24.28,ATH,False,False
09-02-2026 17:00,ISMEN,47.22,47.8,47.18,47.76,2119899.0,0.04,0.54,0.07,718.18,0.54,824541.9,157.1,0.07,True,62.77,-0.02,-0.15,0.13,2026-02-09,46.54,2.62,0,,46.06,48.3,False,False
09-02-2026 17:00,BIGCH,55.05,56.9,54.6,56.5,422917.0,0.4,1.45,0.21,590.48,1.45,149239.6,183.38,0.28,True,62.79,0.35,0.28,0.07,2026-02-09,54.9,2.91,0,,52.1,ATH,False,False
09-02-2026 17:00,TCKRC,88.7,90.15,88.7,90.15,289329.0,0.0,1.45,0.17,752.94,1.45,187020.0,54.7,0.0,True,51.33,-1.11,-1.37,0.26,2026-02-09,87.15,3.44,0,,87.1,96.5,True,True
09-02-2026 17:00,BARMA,44.62,45.3,44.46,45.2,600234.0,0.1,0.58,0.02,3525.0,0.58,286136.7,109.77,0.17,True,66.13,0.67,0.66,0.01,2026-02-09,45.0,0.44,0,,42.82,46.02,False,False
09-02-2026 17:00,AYEN,28.02,28.26,28.0,28.26,146663.0,0.0,0.24,0.04,445.45,0.24,73340.5,99.98,0.0,True,64.86,0.03,-0.08,0.11,2026-02-09,27.2,3.9,0,,27.08,28.82,False,False
09-02-2026 17:00,AYDEM,26.04,26.5,25.96,26.5,545096.0,0.0,0.46,0.05,751.85,0.46,361378.2,50.84,0.0,True,53.24,-0.09,-0.11,0.02,2026-02-09,25.98,2.0,1,26.5,25.62,27.62,False,False
09-02-2026 17:00,DYOBY,14.12,14.22,14.09,14.2,315054.0,0.02,0.08,0.02,247.83,0.08,181823.2,73.27,0.25,True,57.64,-0.01,-0.03,0.02,2026-02-09,13.88,2.31,0,,13.72,14.99,False,False
09-02-2026 17:00,USAK,1.83,1.84,1.82,1.84,17971594.0,0.0,0.01,0.0,400.0,0.01,10885687.3,65.09,0.0,True,47.13,-0.01,-0.01,0.0,2026-02-09,1.82,1.1,0,,1.78,2.13,False,False
09-02-2026 16:00,KBORU,18.11,18.89,18.05,18.72,3305522.0,0.17,0.61,0.11,470.09,0.61,1690020.9,95.59,0.28,True,68.72,0.2,0.16,0.04,2026-02-09,17.76,5.41,0,,17.4,19.32,False,False
09-02-2026 16:00,A1CAP,16.06,16.44,16.03,16.38,2739758.0,0.06,0.32,0.02,1584.21,0.32,1500326.1,82.61,0.19,True,62.4,0.06,0.03,0.03,2026-02-09,16.1,1.74,0,,15.38,16.62,False,False
09-02-2026 16:00,GOZDE,26.22,26.64,26.22,26.6,613758.0,0.04,0.38,0.09,322.22,0.38,272508.1,125.23,0.11,True,60.41,-0.03,-0.1,0.07,2026-02-09,25.9,2.7,0,,25.4,27.08,False,False
09-02-2026 16:00,GESAN,56.35,57.3,56.25,57.25,921327.0,0.05,0.9,0.18,386.49,0.9,503133.2,83.12,0.06,True,64.74,0.07,-0.14,0.21,2026-02-09,55.05,4.0,0,,54.3,60.75,False,False
09-02-2026 15:00,ANELE,16.33,16.59,16.33,16.53,583126.0,0.06,0.2,0.03,506.06,0.2,199624.8,192.11,0.3,True,68.41,0.05,0.01,0.04,2026-02-09,16.16,2.29,0,,15.82,ATH,False,False
09-02-2026 15:00,HOROZ,64.8,66.05,64.65,65.8,340403.0,0.25,1.0,0.27,270.37,1.0,162511.3,109.46,0.25,True,69.87,0.76,0.45,0.31,2026-02-09,62.9,4.61,0,,61.55,ATH,False,False
09-02-2026 15:00,DMRGD,3.91,4.13,3.9,4.07,16630055.0,0.06,0.16,0.02,788.89,0.16,6436166.4,158.38,0.37,True,68.78,0.07,0.06,0.0,2026-02-09,3.88,4.9,0,,3.82,4.08,False,False
09-02-2026 14:00,ALTNY,15.75,15.97,15.74,15.92,4501521.0,0.05,0.17,0.02,709.52,0.17,1748015.5,157.52,0.29,True,62.86,-0.01,-0.04,0.03,2026-02-09,15.64,1.79,0,,15.51,15.98,False,False
09-02-2026 14:00,HATEK,15.17,16.0,15.16,15.81,2691650.0,0.19,0.64,0.06,966.67,0.64,391469.0,587.58,0.3,True,75.46,0.04,-0.02,0.06,2026-02-09,15.15,4.36,0,,14.95,ATH,False,False
09-02-2026 14:00,EGSER,3.22,3.27,3.22,3.26,1092923.0,0.01,0.04,0.01,344.44,0.04,501514.5,117.92,0.25,True,65.97,0.02,0.01,0.01,2026-02-09,3.19,2.19,0,,3.14,ATH,False,False
09-02-2026 14:00,ENDAE,14.9,15.35,14.88,15.28,1112694.0,0.07,0.38,0.07,442.86,0.38,366219.7,203.83,0.18,True,74.14,0.06,-0.02,0.08,2026-02-09,14.68,4.09,0,,14.37,15.31,False,False
09-02-2026 13:00,BINBN,186.9,203.0,186.2,202.6,577184.0,0.4,15.7,0.95,1552.63,15.7,124981.6,361.82,0.03,True,72.56,1.4,1.38,0.02,2026-02-09,188.8,7.31,0,,186.0,203.6,False,False
09-02-2026 13:00,BINHO,10.06,10.73,10.01,10.73,48901603.0,0.0,0.67,0.07,830.56,0.67,12819518.2,281.46,0.0,True,89.95,0.35,0.26,0.08,2026-02-09,9.76,9.94,0,,8.76,ATH,False,False
09-02-2026 12:00,AKYHO,2.87,2.95,2.87,2.93,781685.0,0.02,0.06,0.01,1100.0,0.06,228893.7,241.51,0.33,True,58.32,-0.0,-0.0,-0.0,2026-02-09,2.87,2.09,0,,2.81,2.98,False,False
09-02-2026 12:00,TKFEN,81.4,86.4,81.1,85.45,2408786.0,0.95,4.05,0.64,532.81,4.05,869958.2,176.89,0.23,True,65.0,-0.39,-0.79,0.39,2026-02-09,78.55,8.78,1,86.4,77.5,86.4,True,True
09-02-2026 12:00,POLHO,17.18,17.4,17.13,17.35,476820.0,0.05,0.17,0.01,1445.45,0.17,260583.8,82.98,0.29,True,50.99,-0.13,-0.17,0.03,2026-02-09,17.01,2.0,0,,16.94,18.15,True,False
09-02-2026 12:00,OYAKC,26.22,26.5,26.18,26.5,3356220.0,0.0,0.28,0.09,197.87,0.28,1689444.6,98.66,0.0,True,62.83,-0.12,-0.25,0.13,2026-02-09,25.72,3.03,0,,25.3,27.4,True,False
09-02-2026 12:00,VSNMD,97.25,102.0,96.9,101.8,2117423.0,0.2,4.55,0.47,878.49,4.55,413998.6,411.46,0.04,True,81.45,1.63,1.45,0.17,2026-02-09,95.9,6.15,0,,95.55,ATH,False,False
09-02-2026 12:00,ECILC,113.4,116.7,113.1,116.6,1110443.0,0.1,3.2,0.4,700.0,3.2,517115.7,114.74,0.03,True,60.88,-0.67,-1.17,0.5,2026-02-09,108.0,7.96,0,,108.0,118.4,False,False
09-02-2026 12:00,FONET,3.18,3.25,3.18,3.25,8115160.0,0.0,0.07,0.0,6900.0,0.07,5106648.1,58.91,0.0,True,48.32,-0.05,-0.06,0.01,2026-02-09,3.15,3.17,0,,3.13,3.91,True,True
09-02-2026 12:00,AGROT,3.22,3.27,3.22,3.26,5343232.0,0.01,0.04,0.01,471.43,0.04,2454392.6,117.7,0.25,True,64.5,0.01,-0.0,0.01,2026-02-09,3.16,3.16,0,,3.13,3.3,False,False
09-02-2026 12:00,ZOREN,3.49,3.55,3.48,3.54,17248744.0,0.01,0.05,0.01,316.67,0.05,8339740.1,106.83,0.2,True,68.29,0.01,-0.0,0.01,2026-02-09,3.42,3.51,0,,3.37,3.65,False,False
09-02-2026 11:00,ATLAS,8.86,9.95,8.85,9.89,1139680.0,0.06,1.03,0.1,909.8,1.03,363477.5,213.55,0.06,True,60.32,-0.14,-0.16,0.03,2026-02-09,9.07,9.04,0,,8.5,10.93,True,True
09-02-2026 11:00,YUNSA,9.5,9.95,9.47,9.9,4784176.0,0.05,0.4,0.08,419.48,0.4,1332156.8,259.13,0.12,True,75.3,0.1,0.06,0.04,2026-02-09,9.18,7.84,0,,9.08,ATH,False,False
09-02-2026 11:00,SEKUR,4.6,4.98,4.55,4.9,1519000.0,0.08,0.3,0.05,488.24,0.3,606165.8,150.59,0.27,True,66.07,0.14,0.15,-0.01,2026-02-09,4.71,4.03,0,,4.42,ATH,False,False
09-02-2026 10:00,TUPRS,221.4,223.0,218.9,222.9,7929104.0,0.1,1.5,0.05,2900.0,1.5,2445090.3,224.29,0.07,True,35.78,-2.22,-2.06,-0.17,2026-02-09,223.0,-0.04,2,218.9,218.9,237.7,False,False
09-02-2026 10:00,BRSAN,691.0,728.5,684.5,718.0,948628.0,10.5,27.0,3.45,682.61,27.0,248862.0,281.19,0.39,True,82.29,11.0,6.83,4.17,2026-02-09,680.0,5.59,0,,647.5,ATH,False,False
09-02-2026 10:00,EUREN,5.11,5.18,5.11,5.18,11033769.0,0.0,0.07,0.01,677.78,0.07,3938176.4,180.17,0.0,True,63.14,-0.01,-0.02,0.01,2026-02-09,5.06,2.37,0,,5.01,5.31,True,True
09-02-2026 10:00,TUKAS,2.84,2.88,2.84,2.87,22545948.0,0.01,0.03,0.0,1400.0,0.03,12355208.2,82.48,0.33,True,49.33,-0.03,-0.03,0.0,2026-02-09,2.82,1.77,0,,2.8,3.02,True,True
09-02-2026 10:00,TNZTP,24.68,26.5,24.62,26.28,3505969.0,0.22,1.6,0.09,1639.13,1.6,741285.1,372.96,0.14,True,61.88,-0.35,-0.51,0.15,2026-02-09,24.58,6.92,1,26.5,24.18,26.5,True,True
09-02-2026 10:00,TATGD,14.11,14.32,14.11,14.3,315463.0,0.02,0.19,0.01,1257.14,0.19,102275.4,208.44,0.11,True,57.89,-0.06,-0.07,0.01,2026-02-09,14.01,2.07,0,,13.85,14.84,True,True
09-02-2026 10:00,BIMAS,690.0,701.0,688.5,700.5,1851957.0,0.5,10.5,1.0,950.0,10.5,554989.8,233.69,0.05,True,68.1,1.65,0.28,1.38,2026-02-09,683.0,2.56,0,,674.0,ATH,False,False
09-02-2026 10:00,HUNER,3.29,3.35,3.29,3.34,5631670.0,0.01,0.05,0.01,614.29,0.05,1587650.5,254.72,0.2,True,61.93,-0.01,-0.01,0.01,2026-02-09,3.26,2.45,0,,3.22,3.43,True,False
09-02-2026 10:00,BJKAS,1.56,1.59,1.56,1.59,7526437.0,0.0,0.03,0.01,500.0,0.03,2278158.4,230.37,0.0,True,58.46,-0.01,-0.01,0.0,2026-02-09,1.56,1.92,0,,1.55,1.6,True,False
09-02-2026 10:00,SMART,22.92,23.42,22.92,23.34,309458.0,0.08,0.42,0.07,517.65,0.42,77129.0,301.22,0.19,True,69.92,-0.01,-0.07,0.06,2026-02-09,22.8,2.37,0,,22.5,23.94,False,False
09-02-2026 10:00,ENKAI,95.0,97.25,94.85,97.15,2681680.0,0.1,2.15,0.24,814.89,2.15,999256.9,168.37,0.05,True,61.73,-0.32,-0.44,0.13,2026-02-09,94.5,2.8,0,,93.3,97.9,False,False
09-02-2026 10:00,BSOKE,28.42,29.62,28.3,29.44,2523406.0,0.18,1.02,0.11,862.26,1.02,808274.1,212.2,0.18,True,69.88,0.12,0.02,0.1,2026-02-09,28.2,4.4,0,,27.46,30.14,False,False
09-02-2026 10:00,OTKAR,445.0,458.25,440.75,455.75,934248.0,2.5,10.75,1.9,465.79,10.75,226611.8,312.27,0.23,True,81.81,2.89,0.91,1.98,2026-02-09,438.5,3.93,0,,430.0,ATH,False,False
09-02-2026 10:00,BTCIM,4.87,5.02,4.87,4.98,52855118.0,0.04,0.11,0.01,685.71,0.11,11930952.2,343.01,0.36,True,64.55,0.0,-0.01,0.01,2026-02-09,4.83,3.11,1,5.02,4.75,5.02,False,False
09-02-2026 10:00,EKSUN,5.7,5.81,5.7,5.78,807225.0,0.03,0.08,0.01,700.0,0.08,533775.3,51.23,0.37,True,52.19,-0.04,-0.05,0.01,2026-02-09,5.68,1.76,1,5.81,5.59,5.81,True,False
09-02-2026 10:00,CCOLA,73.75,75.0,73.75,74.85,1113592.0,0.15,1.1,0.07,1592.31,1.1,509651.7,118.5,0.14,True,62.09,-0.25,-0.35,0.1,2026-02-09,72.95,2.6,0,,71.85,76.4,False,False
09-02-2026 10:00,SANFM,7.3,7.6,7.3,7.53,2270884.0,0.07,0.23,0.03,641.94,0.23,576696.1,293.77,0.3,True,62.26,-0.02,-0.04,0.02,2026-02-09,7.24,4.01,0,,7.11,7.54,False,False
09-02-2026 10:00,GWIND,26.38,26.84,26.38,26.8,1610149.0,0.04,0.42,0.08,452.63,0.42,663957.5,142.51,0.1,True,54.2,-0.2,-0.22,0.02,2026-02-09,26.24,2.13,0,,25.38,28.26,False,False
09-02-2026 10:00,PRKME,20.5,21.04,20.5,20.98,1412581.0,0.06,0.48,0.07,566.67,0.48,576545.5,145.01,0.12,True,52.79,-0.22,-0.3,0.08,2026-02-09,20.42,2.74,0,,20.18,23.04,True,False
09-02-2026 10:00,INDES,8.37,8.52,8.36,8.48,993753.0,0.04,0.11,0.01,1471.43,0.11,513543.5,93.51,0.36,True,52.86,-0.05,-0.06,0.01,2026-02-09,8.31,2.05,1,8.52,8.24,8.52,True,True
09-02-2026 10:00,PETKM,17.92,18.42,17.91,18.41,33372090.0,0.01,0.49,0.05,824.53,0.49,7612817.1,338.37,0.02,True,67.76,-0.07,-0.13,0.06,2026-02-09,17.71,3.95,0,,17.41,18.56,False,False
09-02-2026 10:00,OSMEN,8.23,8.4,8.23,8.37,324568.0,0.03,0.14,0.02,677.78,0.14,167799.9,93.43,0.21,True,61.54,-0.02,-0.04,0.01,2026-02-09,8.18,2.32,0,,8.11,8.65,True,False
09-02-2026 10:00,FADE,15.78,16.23,15.76,16.17,553273.0,0.06,0.39,0.07,441.67,0.39,131526.0,320.66,0.15,True,70.5,0.04,-0.0,0.04,2026-02-09,15.71,2.93,0,,15.37,ATH,False,False
09-02-2026 10:00,PENGD,8.8,8.91,8.8,8.9,713734.0,0.01,0.1,0.01,614.29,0.1,292760.5,143.79,0.1,True,60.51,-0.0,-0.01,0.01,2026-02-09,8.75,1.71,0,,8.69,9.12,True,True
09-02-2026 10:00,TUREX,7.44,7.56,7.43,7.56,6382484.0,0.0,0.12,0.02,650.0,0.12,1581258.7,303.63,0.0,True,64.74,-0.02,-0.04,0.02,2026-02-09,7.37,2.58,0,,7.29,7.72,True,False
09-02-2026 10:00,ULKER,132.5,135.6,132.5,135.2,1499482.0,0.4,2.7,0.19,1321.05,2.7,705438.1,112.56,0.15,True,59.45,-0.78,-1.0,0.22,2026-02-09,131.2,3.05,0,,129.8,137.0,True,False
09-02-2026 10:00,ADEL,35.48,37.48,35.24,36.94,1663414.0,0.54,1.46,0.27,448.87,1.46,585793.4,183.96,0.37,True,80.59,0.38,0.16,0.23,2026-02-09,35.08,5.3,0,,33.9,ATH,False,False
09-02-2026 10:00,GSRAY,1.17,1.2,1.17,1.2,90896122.0,0.0,0.03,0.01,500.0,0.03,16917043.9,437.3,0.0,True,63.79,-0.0,-0.0,0.0,2026-02-09,1.16,3.45,0,,1.16,1.22,False,False
09-02-2026 10:00,GSDHO,4.96,5.12,4.95,5.11,2243835.0,0.01,0.15,0.02,782.35,0.15,788218.1,184.67,0.07,True,61.97,-0.03,-0.05,0.02,2026-02-09,4.92,3.86,0,,4.83,5.25,True,False
09-02-2026 10:00,GSDDE,9.92,10.1,9.92,10.08,549025.0,0.02,0.16,0.01,1130.77,0.16,137689.0,298.74,0.12,True,66.22,-0.01,-0.02,0.01,2026-02-09,9.89,1.92,0,,9.78,10.1,False,False
09-02-2026 10:00,HATSN,41.5,42.44,41.02,42.22,2340707.0,0.22,0.72,0.09,682.61,0.72,386489.1,505.63,0.31,True,35.53,-0.34,0.09,-0.43,2026-02-09,44.52,-5.17,2,41.02,41.02,48.36,False,False
09-02-2026 10:00,AHSGY,24.3,25.02,24.3,24.92,163545.0,0.1,0.62,0.07,761.11,0.62,86889.5,88.22,0.16,True,59.98,0.1,0.12,-0.02,2026-02-09,24.2,2.98,0,,24.02,25.32,False,False
09-02-2026 10:00,YKBNK,38.8,39.28,38.6,39.26,56371887.0,0.02,0.46,0.06,618.75,0.46,20831008.4,170.62,0.04,True,60.33,-0.25,-0.41,0.16,2026-02-09,38.26,2.61,0,,37.88,41.26,True,False
09-02-2026 10:00,KRDMA,28.66,29.0,28.62,29.0,1171110.0,0.0,0.34,0.04,672.73,0.34,305942.6,282.79,0.0,True,62.74,-0.06,-0.12,0.06,2026-02-09,28.24,2.69,0,,27.9,29.26,False,False
09-02-2026 10:00,GOODY,15.74,16.04,15.74,15.99,193749.0,0.05,0.25,0.02,1215.79,0.25,94522.7,104.98,0.2,True,58.56,-0.05,-0.06,0.01,2026-02-09,15.71,1.78,0,,15.59,16.22,False,False
09-02-2026 10:00,GOKNR,21.8,22.08,21.8,22.02,1049805.0,0.06,0.22,0.02,1122.22,0.22,463842.1,126.33,0.27,True,55.35,-0.15,-0.22,0.07,2026-02-09,21.64,1.76,0,,21.34,23.48,True,False
09-02-2026 10:00,YIGIT,24.88,25.26,24.82,25.16,406965.0,0.1,0.28,0.03,976.92,0.28,257216.2,58.22,0.36,True,52.93,-0.14,-0.16,0.02,2026-02-09,24.7,1.86,0,,24.48,25.96,True,False
09-02-2026 10:00,HEDEF,62.6,66.7,62.2,66.7,1345564.0,0.0,4.1,0.07,5757.14,4.1,588506.7,128.64,0.0,True,63.61,1.58,2.06,-0.48,2026-02-09,63.1,5.71,2,62.2,62.2,68.6,False,False
09-02-2026 10:00,GEDIK,5.92,6.01,5.92,5.99,825476.0,0.02,0.07,0.01,536.36,0.07,349988.4,135.86,0.29,True,55.7,-0.03,-0.03,0.01,2026-02-09,5.9,1.53,0,,5.82,6.19,False,False
09-02-2026 10:00,IHGZT,1.55,1.57,1.55,1.57,3394077.0,0.0,0.02,0.0,400.0,0.02,1119146.6,203.27,0.0,True,54.45,-0.01,-0.01,0.0,2026-02-09,1.54,1.95,0,,1.53,1.63,True,True
09-02-2026 10:00,AKBNK,84.8,86.2,84.75,85.95,31427775.0,0.25,1.15,0.03,3185.71,1.15,10663628.8,194.72,0.22,True,57.89,-0.58,-0.86,0.28,2026-02-09,83.85,2.5,0,,82.9,93.35,True,False
09-02-2026 10:00,VESBE,8.23,8.35,8.23,8.35,1559608.0,0.0,0.12,0.01,1900.0,0.12,963563.9,61.86,0.0,True,58.66,-0.03,-0.04,0.01,2026-02-09,8.18,2.08,0,,8.04,8.6,False,False
09-02-2026 10:00,MAKIM,16.42,17.04,16.42,16.88,421269.0,0.16,0.46,0.05,820.0,0.46,101079.7,316.77,0.35,True,61.25,-0.02,-0.05,0.02,2026-02-09,16.4,2.93,1,17.04,16.19,17.04,False,False
06-02-2026 17:00,YAYLA,27.84,28.9,27.76,28.9,149101.0,0.0,1.06,0.06,1666.67,1.06,77898.6,91.4,0.0,True,60.06,-0.2,-0.23,0.03,2026-02-06,28.06,2.99,1,28.9,28.46,29.76,True,True
06-02-2026 17:00,SOKE,12.82,13.04,12.72,13.04,1218450.0,0.0,0.22,0.01,1592.31,0.22,296587.5,310.82,0.0,True,59.46,-0.02,-0.02,0.0,2026-02-06,12.95,0.69,0,,12.66,13.44,False,False
06-02-2026 17:00,AKCNS,192.8,195.7,192.7,195.6,187805.0,0.1,2.8,0.11,2445.45,2.8,79044.0,137.6,0.04,True,57.09,0.23,0.23,0.0,2026-02-06,194.7,0.46,0,,191.0,197.3,False,False
06-02-2026 17:00,VAKFN,2.03,2.05,2.01,2.05,13941472.0,0.0,0.02,0.0,900.0,0.02,6780356.1,105.62,0.0,True,48.34,-0.01,-0.01,-0.0,2026-02-06,2.04,0.49,2,2.01,2.01,2.11,True,True
06-02-2026 17:00,ALARK,109.4,111.7,109.2,111.4,1559504.0,0.3,2.0,0.04,4900.0,2.0,844953.3,84.57,0.15,True,56.25,0.02,0.27,-0.25,2026-02-06,110.9,0.45,0,,109.0,114.3,False,False
06-02-2026 17:00,PGSUS,201.7,207.7,201.6,206.8,11466628.0,0.9,5.1,0.17,2900.0,5.1,3335707.7,243.75,0.18,True,58.03,-0.79,-0.64,-0.15,2026-02-06,205.2,0.78,0,,200.9,211.4,True,True
06-02-2026 17:00,DOAS,225.9,230.5,225.8,230.4,734629.0,0.1,4.5,0.45,900.0,4.5,269550.9,172.54,0.02,True,63.96,0.26,0.07,0.19,2026-02-06,226.3,1.81,0,,224.0,230.7,False,False
06-02-2026 17:00,ULUUN,7.18,7.34,7.18,7.33,889331.0,0.01,0.15,0.01,1400.0,0.15,417940.5,112.79,0.07,True,54.16,-0.04,-0.04,0.0,2026-02-06,7.26,0.96,0,,7.1,7.5,False,False
06-02-2026 17:00,SAHOL,101.8,104.1,101.7,103.6,10451009.0,0.5,1.8,0.07,2471.43,1.8,3102666.3,236.84,0.28,True,42.16,-1.35,-1.39,0.04,2026-02-06,103.7,-0.1,2,101.7,101.7,110.8,True,True
06-02-2026 17:00,INFO,4.12,4.18,4.1,4.17,5189719.0,0.01,0.05,0.0,4900.0,0.05,2464408.3,110.59,0.2,True,41.81,-0.06,-0.06,0.0,2026-02-06,4.15,0.48,2,4.1,4.1,4.48,True,True
06-02-2026 17:00,KCAER,10.86,11.03,10.84,11.0,2894993.0,0.03,0.14,0.0,4566.67,0.14,1200540.0,141.14,0.21,True,42.76,-0.12,-0.12,0.0,2026-02-06,10.97,0.27,0,,10.8,11.52,True,True
06-02-2026 17:00,KCHOL,202.1,206.2,202.0,205.1,6377980.0,1.1,3.0,0.08,3650.0,3.0,2338568.3,172.73,0.37,True,49.75,-1.11,-1.01,-0.11,2026-02-06,204.5,0.29,0,,201.6,211.7,False,False
06-02-2026 17:00,LILAK,32.64,33.34,32.48,33.2,1599568.0,0.14,0.56,0.07,677.78,0.56,713174.2,124.29,0.25,True,60.24,0.05,0.03,0.02,2026-02-06,32.56,1.97,0,,32.04,33.52,False,False
06-02-2026 17:00,EMKEL,20.82,22.04,20.76,22.04,9242499.0,0.0,1.22,0.2,513.07,1.22,3030555.5,204.98,0.0,True,79.78,0.08,-0.1,0.18,2026-02-06,20.04,9.98,0,,19.49,ATH,False,False
06-02-2026 17:00,KOPOL,5.78,5.98,5.77,5.98,1956920.0,0.0,0.2,0.01,2400.0,0.2,572077.5,242.07,0.0,True,61.21,-0.02,-0.01,-0.0,2026-02-06,5.9,1.36,2,5.77,5.77,6.11,False,False
06-02-2026 16:00,GLCVY,71.75,74.95,71.65,74.7,573668.0,0.25,2.95,0.4,628.4,2.95,159488.0,259.69,0.08,True,70.99,0.19,-0.18,0.37,2026-02-06,70.25,6.33,0,,70.0,77.35,False,False
06-02-2026 16:00,AVOD,4.74,5.11,4.71,5.11,38414882.0,0.0,0.37,0.05,687.23,0.37,5419768.8,608.79,0.0,True,75.08,-0.02,-0.06,0.04,2026-02-06,4.65,9.89,0,,4.6,5.63,True,False
06-02-2026 14:00,TATEN,10.25,10.54,10.2,10.5,3652561.0,0.04,0.25,0.02,1462.5,0.25,1334869.9,173.63,0.16,True,50.31,-0.17,-0.2,0.03,2026-02-06,10.16,3.35,0,,10.08,11.99,True,False
06-02-2026 13:00,GLRYH,4.69,4.76,4.69,4.75,3412067.0,0.01,0.06,0.01,650.0,0.06,1698491.6,100.89,0.17,True,65.39,0.04,0.04,-0.0,2026-02-06,4.67,1.71,1,4.76,4.5,4.76,False,False
06-02-2026 13:00,EGEGY,32.94,33.54,32.68,33.4,339199.0,0.14,0.46,0.08,447.62,0.46,193458.9,75.33,0.3,True,61.99,0.24,0.22,0.02,2026-02-06,32.96,1.33,1,33.54,30.72,33.54,False,False
06-02-2026 13:00,BORLS,2.6,2.73,2.59,2.7,14512134.0,0.03,0.1,0.01,1150.0,0.1,5270218.6,175.36,0.3,True,57.7,-0.02,-0.02,0.0,2026-02-06,2.62,3.05,2,2.59,2.59,2.74,True,True
06-02-2026 13:00,IZFAS,55.5,56.15,55.4,56.05,755011.0,0.1,0.55,0.09,547.06,0.55,457059.6,65.19,0.18,True,62.19,0.13,0.13,0.01,2026-02-06,55.4,1.17,0,,54.75,58.0,False,False
06-02-2026 12:00,SAFKR,28.44,29.32,28.38,29.08,2313945.0,0.24,0.64,0.1,540.0,0.64,943621.2,145.22,0.38,True,64.48,0.07,-0.04,0.1,2026-02-06,27.72,4.91,0,,27.5,30.04,False,False
06-02-2026 11:00,SMRVA,66.8,68.45,66.6,68.3,1183971.0,0.15,1.5,0.05,2900.0,1.5,424086.8,179.18,0.1,True,51.47,-0.54,-0.49,-0.04,2026-02-06,66.65,2.48,0,,67.05,70.95,True,True
06-02-2026 11:00,HUBVC,3.38,3.64,3.37,3.58,1766549.0,0.06,0.2,0.02,852.38,0.2,533879.4,230.89,0.3,True,65.93,0.0,0.0,-0.0,2026-02-06,3.32,7.83,0,,3.29,ATH,False,False
06-02-2026 11:00,OZYSR,48.62,50.55,48.5,50.4,429466.0,0.15,1.78,0.04,4710.81,1.78,162388.8,164.47,0.08,True,68.2,0.77,0.82,-0.05,2026-02-06,49.26,2.31,0,,46.98,50.45,False,False
06-02-2026 11:00,KONKA,15.35,15.5,15.32,15.49,386765.0,0.01,0.14,0.0,4566.67,0.14,229733.1,68.35,0.07,True,52.43,-0.01,-0.01,-0.01,2026-02-06,15.42,0.45,0,,15.19,15.8,False,False
06-02-2026 10:00,TDGYO,23.14,27.3,23.14,27.22,2753963.0,0.08,4.08,0.41,900.0,4.08,340509.6,708.78,0.02,True,47.73,-1.35,-1.42,0.06,2026-02-06,25.7,5.91,2,23.14,23.14,32.82,True,True
06-02-2026 10:00,MEKAG,4.89,5.14,4.82,5.1,9435676.0,0.04,0.21,0.02,1135.29,0.21,2665708.9,253.96,0.19,True,66.82,0.05,0.04,0.01,2026-02-06,4.93,3.45,1,5.14,4.67,5.14,False,False
06-02-2026 10:00,LIDFA,2.97,3.12,2.92,3.09,6542067.0,0.03,0.12,0.01,900.0,0.12,2752770.9,137.65,0.25,True,58.99,-0.02,-0.03,0.01,2026-02-06,2.93,5.46,0,,2.87,3.41,False,False
06-02-2026 10:00,PNSUT,12.58,13.5,12.5,13.28,3936183.0,0.22,0.7,0.04,1566.67,0.7,764201.4,415.07,0.31,True,56.31,-0.17,-0.17,0.0,2026-02-06,12.64,5.06,3,,13.01,14.25,True,True
05-02-2026 17:00,BMSTL,102.0,112.0,101.9,109.6,2760505.0,2.4,7.6,0.72,955.56,7.6,381319.3,623.94,0.32,True,81.5,0.62,0.25,0.37,2026-02-05,102.5,6.93,0,,101.3,ATH,False,False
05-02-2026 17:00,IEYHO,77.35,79.7,77.1,79.55,9926372.0,0.15,2.2,0.29,658.62,2.2,2712050.2,266.01,0.07,True,82.62,0.31,0.16,0.15,2026-02-05,76.6,3.85,1,79.7,75.0,79.7,False,False
05-02-2026 17:00,ARTMS,36.18,39.54,35.98,39.54,1343280.0,0.0,3.36,0.36,828.18,3.36,215654.8,522.88,0.0,True,81.47,0.1,-0.18,0.28,2026-02-05,35.96,9.96,0,,35.7,ATH,True,False
05-02-2026 17:00,EDATA,9.05,9.28,9.04,9.28,2702796.0,0.0,0.23,0.02,1252.94,0.23,1042824.4,159.18,0.0,True,55.68,0.01,0.0,0.0,2026-02-05,9.2,0.87,0,,9.01,9.39,False,False
05-02-2026 16:00,HKTM,12.2,13.6,12.16,13.6,4939043.0,0.0,1.4,0.14,892.91,1.4,841942.7,486.62,0.0,True,83.28,0.18,0.11,0.07,2026-02-05,12.37,9.94,0,,11.51,ATH,False,False
05-02-2026 14:00,AKENR,11.14,11.4,11.12,11.35,3735203.0,0.05,0.21,0.02,950.0,0.21,1054360.9,254.26,0.24,True,65.11,0.04,0.04,0.01,2026-02-05,11.11,2.16,1,11.4,10.75,11.4,False,False
05-02-2026 13:00,ARDYZ,47.08,48.54,46.82,48.44,1097522.0,0.1,1.36,0.22,523.85,1.36,527878.0,107.91,0.07,True,66.76,0.23,0.07,0.16,2026-02-05,46.1,5.08,0,,46.0,48.5,False,False
05-02-2026 12:00,PETUN,13.0,13.24,13.0,13.2,408387.0,0.04,0.2,0.03,566.67,0.2,227920.4,79.18,0.2,True,61.18,0.02,0.01,0.01,2026-02-05,13.06,1.07,0,,12.74,13.61,False,False
05-02-2026 12:00,BAHKM,119.9,125.9,119.9,125.0,996715.0,0.9,5.1,0.82,521.95,5.1,363197.5,174.43,0.18,True,79.81,4.63,4.26,0.37,2026-02-05,118.7,5.31,0,,113.0,ATH,False,False
05-02-2026 12:00,MHRGY,3.68,3.93,3.67,3.9,6598056.0,0.03,0.22,0.03,714.81,0.22,1535195.1,329.79,0.14,True,80.05,0.06,0.04,0.02,2026-02-05,3.6,8.33,1,3.93,3.48,3.93,False,False
05-02-2026 12:00,DOFER,33.06,34.26,33.0,34.02,1143291.0,0.24,0.96,0.08,1042.86,0.96,341904.8,234.39,0.25,True,55.99,-0.27,-0.35,0.08,2026-02-05,32.9,3.4,1,34.26,32.52,34.26,True,True
05-02-2026 12:00,FRIGO,8.17,8.52,8.17,8.44,6939081.0,0.08,0.27,0.04,542.86,0.27,2552170.1,171.89,0.3,True,72.37,0.05,0.01,0.04,2026-02-05,8.08,4.46,0,,7.71,ATH,False,False
05-02-2026 11:00,MARBL,13.68,13.94,13.68,13.87,676103.0,0.07,0.19,0.0,3700.0,0.19,357345.0,89.2,0.37,True,47.79,-0.08,-0.08,0.0,2026-02-05,13.72,1.09,0,,13.5,14.19,False,False
05-02-2026 11:00,SUNTK,40.54,41.46,40.48,41.34,277530.0,0.12,0.8,0.07,1112.12,0.8,119860.4,131.54,0.15,True,59.06,-0.06,-0.09,0.03,2026-02-05,40.46,2.17,0,,40.08,41.86,True,True
05-02-2026 10:00,SISE,46.18,48.04,45.88,47.52,46816233.0,0.52,1.34,0.07,1710.81,1.34,11771899.2,297.69,0.39,True,67.05,0.26,0.25,0.02,2026-02-05,46.34,2.55,2,45.88,45.88,48.16,False,False
05-02-2026 10:00,BAYRK,4.55,4.96,4.51,4.9,21547586.0,0.06,0.35,0.02,1421.74,0.35,2932094.0,634.89,0.17,True,71.98,-0.01,-0.02,0.02,2026-02-05,4.51,8.65,3,,4.51,ATH,True,True
05-02-2026 10:00,AGHOL,35.12,35.38,34.98,35.32,1409125.0,0.06,0.2,0.04,376.19,0.2,594968.9,136.84,0.3,True,57.85,0.14,0.15,-0.01,2026-02-05,35.02,0.86,0,,34.74,35.52,False,False
05-02-2026 10:00,MEGMT,67.45,69.4,66.65,68.85,4786820.0,0.55,1.4,0.02,6900.0,1.4,1914533.7,150.03,0.39,True,63.35,0.41,0.23,0.18,2026-02-05,67.5,2.0,0,,65.5,69.05,False,False
05-02-2026 10:00,XU100,13854.83,13955.77,13804.27,13955.74,1832916584.0,0.03,100.91,4.54,2122.2,100.91,824891132.9,122.2,0.0,True,60.83,40.67,42.55,-1.89,2026-02-05,13891.21,0.46,0,,13393.8,13998.18,False,False
05-02-2026 10:00,HTTBT,45.9,47.24,45.9,47.22,598249.0,0.02,1.32,0.13,885.07,1.32,168951.0,254.1,0.02,True,81.82,0.14,0.09,0.06,2026-02-05,46.0,2.65,0,,45.88,ATH,False,False
05-02-2026 10:00,ARCLK,120.5,121.4,119.3,121.3,1074890.0,0.1,0.8,0.05,1500.0,0.8,639598.1,68.06,0.13,True,66.33,1.36,1.43,-0.06,2026-02-05,120.5,0.66,2,119.3,119.3,ATH,False,False
05-02-2026 10:00,TOASO,323.25,329.5,322.75,329.0,1246507.0,0.5,5.75,0.85,576.47,5.75,398114.0,213.1,0.09,True,61.27,0.75,0.62,0.13,2026-02-05,325.0,1.23,0,,321.75,ATH,False,False
04-02-2026 17:00,BEGYO,4.84,4.86,4.82,4.86,1438424.0,0.0,0.02,0.0,1900.0,0.02,913348.4,57.49,0.0,True,54.3,0.02,0.02,-0.0,2026-02-04,4.86,0.0,0,,4.69,4.98,False,False
04-02-2026 17:00,KOTON,17.67,17.98,17.58,17.95,952684.0,0.03,0.28,0.02,1300.0,0.28,360557.5,164.23,0.11,True,57.08,0.06,0.01,0.05,2026-02-04,17.76,1.07,2,17.58,17.58,18.23,False,False
04-02-2026 17:00,DITAS,52.5,55.4,52.5,54.9,1059232.0,0.5,2.4,0.17,1271.43,2.4,371170.9,185.38,0.21,True,68.81,0.75,0.68,0.08,2026-02-04,52.7,4.17,0,,50.8,ATH,False,False
04-02-2026 16:00,IZENR,9.89,10.05,9.87,10.04,6031207.0,0.01,0.15,0.03,476.92,0.15,2550201.3,136.5,0.07,True,69.83,0.09,0.08,0.02,2026-02-04,9.78,2.66,0,,9.16,ATH,False,False
04-02-2026 13:00,KAYSE,4.91,5.04,4.9,5.01,3753535.0,0.03,0.1,0.01,809.09,0.1,1659905.7,126.13,0.3,True,66.55,0.0,-0.0,0.01,2026-02-04,4.85,3.3,0,,4.85,ATH,False,False
04-02-2026 13:00,BALSU,16.5,17.42,16.47,17.25,8019916.0,0.17,0.75,0.1,642.57,0.75,3320464.8,141.53,0.23,True,76.71,0.23,0.16,0.06,2026-02-04,16.6,3.92,0,,15.67,ATH,False,False
04-02-2026 13:00,OBAMS,8.28,8.47,8.28,8.42,24457281.0,0.05,0.14,0.0,7.88129934789839e+16,0.14,8847418.9,176.43,0.36,True,42.06,-0.13,-0.14,0.0,2026-02-04,8.28,1.69,0,,8.08,ATH,True,True
04-02-2026 12:00,DMLKT,5.84,5.88,5.83,5.88,4339171.0,0.0,0.04,0.0,700.0,0.04,1910600.1,127.11,0.0,True,65.07,0.0,-0.0,0.0,2026-02-04,5.84,0.68,1,5.88,5.78,ATH,False,False
04-02-2026 12:00,OZSUB,20.24,20.84,20.16,20.74,897357.0,0.1,0.5,0.04,1150.0,0.5,497549.8,80.36,0.2,True,69.54,0.12,0.05,0.07,2026-02-04,20.0,3.7,0,,19.5,ATH,False,False
04-02-2026 11:00,VESTL,32.74,33.54,32.64,33.4,2671640.0,0.14,0.66,0.13,400.0,0.66,712404.9,275.02,0.21,True,80.74,0.36,0.21,0.15,2026-02-04,32.14,3.92,1,33.54,30.12,33.54,False,False
04-02-2026 11:00,UCAYM,34.68,38.12,34.58,37.7,37755366.0,0.42,3.02,0.14,2088.41,3.02,12542049.2,201.03,0.14,True,59.32,-0.13,0.1,-0.23,2026-02-04,34.66,8.77,0,,33.76,41.2,False,False
04-02-2026 11:00,AFYON,14.62,14.91,14.62,14.84,1202542.0,0.07,0.22,0.02,1000.0,0.22,302137.8,298.01,0.32,True,60.85,0.01,0.0,0.01,2026-02-04,14.71,0.88,3,,14.62,15.07,False,False
04-02-2026 11:00,SEKFK,9.12,9.5,9.12,9.46,1239539.0,0.04,0.34,0.05,608.33,0.34,158661.3,681.25,0.12,True,68.48,0.05,0.02,0.03,2026-02-04,9.2,2.83,0,,8.65,ATH,False,False
04-02-2026 10:00,TUCLK,5.98,6.28,5.72,6.28,33738256.0,0.0,0.3,0.05,445.45,0.3,7287758.2,362.94,0.0,True,78.57,0.14,0.07,0.07,2026-02-04,5.8,8.28,1,6.28,5.15,ATH,False,False
04-02-2026 10:00,KLMSN,29.72,30.6,29.72,30.52,479329.0,0.08,0.8,0.07,1076.47,0.8,107022.1,347.88,0.1,True,71.2,0.02,-0.04,0.06,2026-02-04,29.66,2.9,0,,29.58,ATH,False,False
04-02-2026 10:00,BIENY,23.94,24.4,23.94,24.32,295216.0,0.08,0.38,0.06,512.9,0.38,193934.2,52.22,0.21,True,61.98,0.02,-0.04,0.06,2026-02-04,24.0,1.33,1,24.4,23.46,24.4,False,False
04-02-2026 10:00,ERCB,70.25,70.95,70.2,70.8,360438.0,0.15,0.55,0.01,5400.0,0.55,150273.8,139.85,0.27,True,57.13,0.06,0.02,0.04,2026-02-04,70.1,1.0,0,,69.95,71.15,False,False
04-02-2026 10:00,DGNMO,5.2,5.29,5.2,5.27,392849.0,0.02,0.07,0.01,775.0,0.07,248998.1,57.77,0.29,True,63.08,0.02,0.01,0.01,2026-02-04,5.18,1.74,1,5.29,4.95,5.29,False,False
04-02-2026 10:00,MGROS,660.0,667.0,657.0,666.0,1164150.0,1.0,6.0,0.05,11900.0,6.0,547692.3,112.56,0.17,True,69.01,6.87,5.44,1.43,2026-02-04,654.0,1.83,0,,610.5,667.0,False,False
04-02-2026 10:00,ALKA,13.1,13.6,13.08,13.55,5520844.0,0.05,0.45,0.05,900.0,0.45,1111258.4,396.81,0.11,True,68.94,0.01,-0.03,0.03,2026-02-04,13.05,3.83,0,,12.96,ATH,False,False
04-02-2026 10:00,PNLSN,41.1,42.9,41.1,42.54,435404.0,0.36,1.44,0.15,860.0,1.44,79573.3,447.17,0.25,True,71.47,0.16,0.06,0.1,2026-02-04,40.88,4.06,0,,40.46,ATH,False,False
04-02-2026 10:00,ENJSA,108.9,112.6,108.8,112.5,1248090.0,0.1,3.6,0.37,872.97,3.6,261505.5,377.27,0.03,True,84.07,1.26,0.83,0.43,2026-02-04,107.1,5.04,1,112.6,101.9,112.6,False,False
04-02-2026 10:00,PRKAB,55.4,58.0,55.05,58.0,4968684.0,0.0,2.6,0.26,900.0,2.6,542026.7,816.69,0.0,True,78.42,1.34,0.67,0.67,2026-02-04,52.75,9.95,1,58.0,44.88,ATH,False,False
04-02-2026 10:00,CVKMD,43.5,45.1,43.12,44.82,16232421.0,0.28,1.32,0.29,348.98,1.32,4746922.4,241.96,0.21,True,76.52,1.0,0.63,0.37,2026-02-04,42.96,4.33,0,,37.5,ATH,False,False
03-02-2026 17:00,MARMR,2.98,3.14,2.94,3.14,114133816.0,0.0,0.16,0.02,841.18,0.16,50162482.8,127.53,0.0,True,70.5,0.06,0.03,0.02,2026-02-03,2.86,9.79,0,,2.86,ATH,False,False
03-02-2026 17:00,EGEPO,10.49,10.95,10.45,10.87,1321523.0,0.08,0.38,0.03,985.71,0.38,315747.0,318.54,0.21,True,65.38,0.06,0.03,0.03,2026-02-03,10.52,3.33,0,,10.04,11.36,False,False
03-02-2026 16:00,SKYMD,12.26,12.47,12.22,12.45,741260.0,0.02,0.19,0.02,726.09,0.19,294357.4,151.82,0.11,True,62.73,0.01,-0.01,0.02,2026-02-03,12.23,1.8,0,,11.99,12.64,False,False
03-02-2026 16:00,PAHOL,1.8,1.83,1.79,1.83,257911910.0,0.0,0.03,0.0,650.0,0.03,98775473.0,161.11,0.0,True,63.63,0.0,0.0,0.0,2026-02-03,1.77,3.39,0,,1.76,1.86,False,False
03-02-2026 16:00,MEYSU,13.96,15.0,13.88,14.93,33621101.0,0.07,0.97,0.08,1127.85,0.97,12389088.1,171.38,0.07,True,67.64,0.09,0.0,0.08,2026-02-03,14.18,5.29,2,13.88,13.88,ATH,False,False
03-02-2026 13:00,BEYAZ,29.96,30.7,29.96,30.56,304912.0,0.14,0.6,0.02,2900.0,0.6,142958.4,113.29,0.23,True,57.94,-0.02,-0.02,0.0,2026-02-03,29.9,2.21,1,30.7,29.5,30.7,False,False
03-02-2026 13:00,RTALB,3.98,4.09,3.96,4.06,10539785.0,0.03,0.08,0.01,788.89,0.08,4461481.1,136.24,0.38,True,66.9,0.02,0.02,0.01,2026-02-03,3.92,3.57,0,,3.73,ATH,False,False
03-02-2026 12:00,NIBAS,3.74,4.0,3.71,4.0,7640879.0,0.0,0.26,0.03,712.5,0.26,1989673.0,284.03,0.0,True,72.97,0.05,0.03,0.02,2026-02-03,3.82,4.71,0,,3.54,ATH,False,False
03-02-2026 12:00,ORCAY,3.78,3.9,3.77,3.88,851843.0,0.02,0.1,0.01,900.0,0.1,471301.3,80.74,0.2,True,64.64,0.0,0.0,0.0,2026-02-03,3.78,2.65,0,,3.73,4.0,True,True
03-02-2026 11:00,EREGL,28.16,28.74,28.16,28.64,57392649.0,0.1,0.48,0.11,344.44,0.48,22981390.1,149.74,0.21,True,62.18,0.02,0.01,0.01,2026-02-03,28.18,1.63,0,,27.64,28.72,False,False
03-02-2026 10:00,FENER,3.31,3.36,3.3,3.36,38477610.0,0.0,0.05,0.01,455.56,0.05,12929188.8,197.6,0.0,True,63.22,-0.0,-0.01,0.01,2026-02-03,3.27,2.75,1,3.36,3.23,3.37,False,False
03-02-2026 10:00,FRMPL,40.6,42.72,40.44,42.72,7341550.0,0.0,2.12,0.22,872.48,2.12,2335526.6,214.34,0.0,True,67.52,-0.17,-0.5,0.33,2026-02-03,38.84,9.99,1,42.72,38.0,ATH,False,False
03-02-2026 10:00,BMSCH,18.83,20.06,18.83,19.88,3284308.0,0.18,1.05,0.1,939.6,1.05,563809.5,482.52,0.17,True,76.78,0.17,0.08,0.09,2026-02-03,18.74,6.08,0,,17.75,ATH,False,False
03-02-2026 10:00,SMRTG,7.87,7.99,7.87,7.96,1855847.0,0.03,0.09,0.01,800.0,0.09,1229659.0,50.92,0.33,True,40.91,-0.1,-0.11,0.01,2026-02-03,7.86,1.27,0,,7.8,ATH,False,False
02-02-2026 17:00,RALYH,189.1,192.7,189.1,192.6,187551.0,0.1,3.5,0.45,677.78,3.5,64682.6,189.96,0.03,True,62.01,0.35,0.15,0.2,2026-02-02,187.7,2.61,1,192.7,184.8,192.7,False,False
02-02-2026 15:00,DERHL,14.12,15.19,14.12,15.17,3965886.0,0.02,1.05,0.09,1029.03,1.05,1484324.1,167.18,0.02,True,72.96,0.06,0.02,0.04,2026-02-02,14.27,6.31,0,,14.0,ATH,False,False
02-02-2026 15:00,DOFRB,105.7,110.1,105.5,109.9,5409033.0,0.2,4.2,1.08,290.7,4.2,2480886.1,118.03,0.05,True,77.37,1.42,0.59,0.82,2026-02-02,100.1,9.79,0,,95.65,ATH,False,False
02-02-2026 15:00,AZTEK,4.63,4.86,4.62,4.85,6381707.0,0.01,0.22,0.04,464.1,0.22,1362795.8,368.28,0.05,True,74.64,0.03,0.01,0.03,2026-02-02,4.54,6.83,0,,4.43,ATH,False,False
02-02-2026 14:00,XBANK,19379.86,19915.38,19367.94,19866.41,293381160.0,48.97,486.55,32.06,1417.72,486.55,176422665.1,66.29,0.1,True,63.05,23.28,39.22,-15.93,2026-02-02,20019.85,-0.77,0,,19148.51,ATH,False,False
02-02-2026 14:00,KLSYN,7.23,7.62,7.22,7.56,1589982.0,0.06,0.33,0.01,2100.0,0.33,495527.7,220.87,0.18,True,53.56,-0.04,-0.04,-0.0,2026-02-02,7.36,2.72,0,,7.17,7.85,False,False
02-02-2026 14:00,OSTIM,2.98,3.14,2.98,3.13,13870679.0,0.01,0.15,0.02,733.33,0.15,2545664.3,444.87,0.07,True,85.77,0.01,0.0,0.01,2026-02-02,2.96,5.74,0,,2.94,ATH,False,False
02-02-2026 14:00,XU030,14824.39,15065.29,14823.76,15038.71,1060731108.0,26.58,214.32,7.5,2755.7,214.32,512614379.1,106.93,0.12,True,55.96,-40.8,-26.66,-14.14,2026-02-02,15127.98,-0.59,0,,14532.93,ATH,False,False
02-02-2026 14:00,GARAN,155.5,159.1,155.4,159.1,10608040.0,0.0,3.6,0.7,414.29,3.6,5566907.1,90.56,0.0,True,58.75,-0.17,0.04,-0.21,2026-02-02,161.3,-1.36,0,,153.0,ATH,False,False
02-02-2026 13:00,YEOTK,43.76,45.4,43.74,45.38,2160893.0,0.02,1.62,0.12,1272.88,1.62,1102790.5,95.95,0.01,True,68.03,0.05,-0.03,0.08,2026-02-02,43.5,4.32,0,,42.9,ATH,False,False
02-02-2026 13:00,HRKET,80.9,82.3,80.8,82.0,142295.0,0.3,1.1,0.07,1471.43,1.1,80084.2,77.68,0.27,True,56.28,-0.14,-0.16,0.01,2026-02-02,81.4,0.74,0,,79.7,ATH,False,False
02-02-2026 12:00,DARDL,2.46,2.49,2.46,2.49,7069613.0,0.0,0.03,0.01,275.0,0.03,4690414.5,50.72,0.0,True,61.81,0.0,-0.0,0.0,2026-02-02,2.44,2.05,0,,2.38,ATH,False,False
02-02-2026 12:00,BRLSM,15.01,15.25,14.99,15.22,522249.0,0.03,0.21,0.02,813.04,0.21,345140.6,51.31,0.14,True,57.37,-0.02,-0.03,0.01,2026-02-02,15.01,1.4,0,,14.61,15.27,False,False
02-02-2026 12:00,DMSAS,9.24,9.74,9.24,9.6,5652093.0,0.14,0.36,0.05,665.96,0.36,1564380.8,261.3,0.39,True,39.35,-0.25,-0.19,-0.06,2026-02-02,9.98,-3.81,0,,8.99,ATH,False,False
02-02-2026 12:00,YKSLN,3.41,3.58,3.41,3.57,18123379.0,0.01,0.16,0.03,384.85,0.16,3198378.1,466.64,0.06,True,69.09,0.02,0.0,0.02,2026-02-02,3.42,4.39,0,,3.26,ATH,False,False
02-02-2026 11:00,MACKO,26.0,28.34,25.8,27.9,2315112.0,0.44,1.9,0.19,879.38,1.9,322874.3,617.03,0.23,True,82.4,0.13,0.01,0.12,2026-02-02,25.78,8.22,0,,25.64,ATH,False,False
02-02-2026 11:00,BESLR,14.12,14.44,14.1,14.39,561534.0,0.05,0.27,0.02,1073.91,0.27,346295.5,62.15,0.19,True,50.11,-0.04,-0.03,-0.01,2026-02-02,14.34,0.35,0,,14.01,14.61,False,False
30-01-2026 16:00,HURGZ,5.55,5.76,5.55,5.74,5494779.0,0.02,0.19,0.03,578.57,0.19,1078996.7,409.25,0.11,True,77.65,0.03,0.01,0.02,2026-01-30,5.39,6.49,0,,5.33,ATH,False,False
30-01-2026 16:00,BAGFS,28.3,30.44,28.08,30.42,2518077.0,0.02,2.12,0.26,703.03,2.12,364467.2,590.89,0.01,True,86.37,0.17,0.02,0.15,2026-01-30,27.72,9.74,0,,27.32,ATH,False,False
30-01-2026 13:00,ELITE,31.2,32.9,31.14,32.84,1914266.0,0.06,1.64,0.21,666.36,1.64,460358.9,315.82,0.04,True,89.64,0.21,0.08,0.13,2026-01-30,30.5,7.67,0,,ATL,ATH,False,False
30-01-2026 13:00,TERA,203.9,207.3,203.1,207.1,2298044.0,0.2,3.2,0.43,644.19,3.2,1181975.0,94.42,0.06,True,88.72,0.75,0.36,0.39,2026-01-30,202.0,2.52,0,,ATL,ATH,False,False
30-01-2026 10:00,YATAS,46.76,48.84,46.44,48.66,656818.0,0.18,1.9,0.19,889.58,1.9,169664.2,287.13,0.09,True,79.72,0.15,0.04,0.11,2026-01-30,46.76,4.06,1,48.84,ATL,48.84,False,False
30-01-2026 10:00,PINSU,11.24,11.99,11.24,11.92,8520661.0,0.07,0.68,0.08,783.12,0.68,1223349.9,596.5,0.1,True,89.89,0.04,0.01,0.03,2026-01-30,11.24,6.05,0,,ATL,ATH,False,False
30-01-2026 10:00,ETILR,3.98,4.06,3.92,4.04,3904419.0,0.02,0.06,0.0,1900.0,0.06,1046770.7,273.0,0.33,True,76.11,0.0,0.0,0.0,2026-01-30,3.95,2.28,2,3.92,3.92,ATH,False,False
29-01-2026 17:00,CWENE,31.12,35.08,30.78,35.08,10472947.0,0.0,3.96,0.34,1078.57,3.96,2741872.5,281.96,0.0,True,85.77,0.15,0.01,0.15,2026-01-29,31.9,9.97,2,30.78,30.78,ATH,False,False
29-01-2026 17:00,BULGS,45.0,47.62,44.86,47.4,7337972.0,0.22,2.4,0.15,1478.95,2.4,1457448.9,403.48,0.09,True,78.72,0.08,-0.0,0.08,2026-01-29,45.4,4.41,0,,44.7,ATH,False,False
29-01-2026 10:00,ENTRA,10.88,11.26,10.88,11.16,7828615.0,0.1,0.28,0.02,1373.68,0.28,2141573.5,265.55,0.36,True,72.22,0.01,-0.0,0.01,2026-01-29,10.8,3.33,0,,ATL,ATH,False,False
