Tarih,Hisse,open,high,low,close,volume,YuksekKapanis_Fark,AcilisKapanis_Fark,AcilisKapanisFark_Ort,AcilisKapanisFark_OrtalamayaGoreDegisim,AcilisKapanisFarkOrt_MaxSon10,HacimOrtalama,%Hacim_HacimOrtalama,Fark_Orani,Kosul,rsi,MACD_12_26_9,MACDs_12_26_9,MACDh_12_26_9,Tarih1,prev_close,%Deg,isPivot,pointpos,destek,direnc,Tsinyal_Banker_Dip,Tsinyal_Banker_DipKarar
03-12-2025 15:00,MARBL,12.84,13.12,12.83,13.06,1217837.0,0.06,0.22,0.05,368.09,0.22,303739.8,300.95,0.27,True,78.72,0.07,0.02,0.05,2025-12-03,12.49,4.56,0,,12.21,13.24,False,False
03-12-2025 15:00,ALBRK,8.17,8.29,8.17,8.27,4180930.0,0.02,0.1,0.01,1150.0,0.1,2748600.0,52.11,0.2,True,61.35,0.02,0.03,-0.01,2025-12-03,8.19,0.98,0,,8.15,8.35,False,False
03-12-2025 15:00,ASTOR,98.05,99.3,97.7,99.0,5788111.0,0.3,0.95,0.03,3066.67,0.95,3398134.8,70.33,0.32,True,70.88,1.14,1.22,-0.08,2025-12-03,97.95,1.07,0,,90.6,ATH,False,False
03-12-2025 15:00,OYAKC,24.32,24.6,24.2,24.6,8060854.0,0.0,0.28,0.03,976.92,0.28,3433902.5,134.74,0.0,True,75.04,0.24,0.23,0.01,2025-12-03,24.04,2.33,0,,22.94,ATH,False,False
03-12-2025 14:00,SUWEN,9.68,9.87,9.66,9.85,437932.0,0.02,0.17,0.01,1114.29,0.17,239861.4,82.58,0.12,True,64.53,0.06,0.04,0.02,2025-12-03,9.66,1.97,0,,9.15,10.55,False,False
03-12-2025 14:00,KRVGD,2.51,2.56,2.51,2.55,1191923.0,0.01,0.04,0.01,344.44,0.04,560787.9,112.54,0.25,True,68.28,0.01,0.0,0.01,2025-12-03,2.48,2.82,0,,2.42,2.59,False,False
03-12-2025 14:00,SEGYO,5.57,5.87,5.55,5.86,11784890.0,0.01,0.29,0.03,835.48,0.29,2647179.2,345.19,0.03,True,62.18,-0.04,-0.08,0.05,2025-12-03,5.45,7.52,0,,5.2,6.56,False,False
03-12-2025 14:00,SMRTG,25.48,25.66,25.48,25.64,307431.0,0.02,0.16,0.0,3900.0,0.16,186926.3,64.47,0.12,True,60.32,0.02,0.0,0.02,2025-12-03,25.38,1.02,0,,24.82,26.5,False,False
03-12-2025 13:00,ARSAN,2.97,3.02,2.96,3.01,3719921.0,0.01,0.04,0.01,400.0,0.04,1494783.9,148.86,0.25,True,71.21,0.02,0.02,0.0,2025-12-03,2.92,3.08,0,,2.9,ATH,False,False
03-12-2025 13:00,RTALB,3.84,4.0,3.82,3.99,23148538.0,0.01,0.15,0.04,305.41,0.15,7375960.6,213.84,0.07,True,87.02,0.06,0.02,0.03,2025-12-03,3.68,8.42,0,,3.61,ATH,False,False
03-12-2025 13:00,KMPUR,16.08,16.52,16.08,16.4,415579.0,0.12,0.32,0.03,1130.77,0.32,194620.0,113.53,0.38,True,63.69,0.13,0.14,-0.02,2025-12-03,16.03,2.31,0,,15.92,16.49,False,False
03-12-2025 13:00,EMKEL,61.35,62.8,61.3,62.7,810769.0,0.1,1.35,0.33,302.99,1.35,535154.5,51.5,0.07,True,75.92,1.05,0.9,0.15,2025-12-03,59.75,4.94,0,,58.15,ATH,False,False
03-12-2025 13:00,TEZOL,12.4,12.57,12.4,12.55,606897.0,0.02,0.15,0.02,782.35,0.15,311676.7,94.72,0.13,True,70.67,0.04,0.03,0.02,2025-12-03,12.25,2.45,0,,12.22,ATH,False,False
03-12-2025 13:00,TRILC,16.22,17.04,16.2,16.85,3049176.0,0.19,0.63,0.08,668.29,0.63,715964.6,325.88,0.3,True,69.07,-0.12,-0.25,0.12,2025-12-03,16.03,5.12,0,,15.97,18.53,True,False
03-12-2025 13:00,FRIGO,9.93,10.24,9.91,10.18,1805375.0,0.06,0.25,0.01,3471.43,0.25,1022256.9,76.61,0.24,True,53.41,-0.07,-0.1,0.03,2025-12-03,9.9,2.83,0,,9.6,10.3,False,False
03-12-2025 13:00,ANGEN,11.69,12.32,11.67,12.26,3418355.0,0.06,0.57,0.08,612.5,0.57,744622.1,359.07,0.11,True,88.24,0.12,0.04,0.07,2025-12-03,11.41,7.45,0,,11.34,ATH,False,False
03-12-2025 12:00,CWENE,25.08,27.52,24.84,26.84,15301931.0,0.68,1.76,0.14,1175.36,1.76,2200384.4,595.42,0.39,True,73.75,0.05,-0.04,0.08,2025-12-03,25.04,7.19,0,,24.98,27.14,False,False
03-12-2025 12:00,ORCAY,3.87,3.93,3.86,3.92,892214.0,0.01,0.05,0.0,1150.0,0.05,314891.6,183.34,0.2,True,56.51,-0.0,-0.01,0.0,2025-12-03,3.85,1.82,0,,3.84,4.1,False,False
03-12-2025 12:00,SISE,37.62,38.12,37.52,38.02,7026689.0,0.1,0.4,0.02,1566.67,0.4,4002503.1,75.56,0.25,True,65.76,0.14,0.14,0.0,2025-12-03,37.4,1.66,0,,37.32,38.18,False,False
03-12-2025 12:00,EFOR,25.36,26.9,25.3,26.88,23725652.0,0.02,1.52,0.25,512.9,1.52,3757660.3,531.39,0.01,True,85.29,0.82,0.61,0.21,2025-12-03,25.16,6.84,0,,22.16,ATH,False,False
03-12-2025 12:00,ZEDUR,8.21,8.35,8.21,8.32,336476.0,0.03,0.11,0.01,1733.33,0.11,117736.2,185.79,0.27,True,57.95,0.0,-0.0,0.0,2025-12-03,8.22,1.22,0,,8.06,8.4,False,False
03-12-2025 12:00,CRDFA,60.0,62.0,59.0,61.95,257826.0,0.05,1.95,0.05,3800.0,1.95,144573.2,78.34,0.03,True,61.02,0.69,0.81,-0.12,2025-12-03,60.8,1.89,0,,53.1,62.0,False,False
03-12-2025 12:00,BAHKM,58.1,62.15,57.75,62.1,1183287.0,0.05,4.0,0.44,819.54,4.0,250001.6,373.31,0.01,True,67.04,-0.37,-0.64,0.28,2025-12-03,56.6,9.72,0,,56.0,66.0,True,True
03-12-2025 11:00,KRDMA,25.32,26.04,25.32,26.02,1831286.0,0.02,0.7,0.05,1196.3,0.7,350768.2,422.08,0.03,True,74.94,0.06,0.03,0.03,2025-12-03,25.18,3.34,0,,25.14,26.2,False,False
03-12-2025 11:00,BIENY,28.62,30.0,28.6,29.66,2898181.0,0.34,1.04,0.1,940.0,1.04,481101.6,502.41,0.33,True,67.74,0.17,0.16,0.01,2025-12-03,28.6,3.71,0,,28.46,29.88,False,False
03-12-2025 11:00,IZMDC,6.12,6.44,6.11,6.41,3763626.0,0.03,0.29,0.02,1712.5,0.29,814946.6,361.82,0.1,True,69.79,0.02,0.0,0.01,2025-12-03,6.07,5.6,0,,6.07,ATH,False,False
03-12-2025 11:00,DMSAS,10.7,10.95,10.5,10.89,1935532.0,0.06,0.19,0.03,660.0,0.19,325309.3,494.98,0.32,True,80.97,0.08,0.07,0.01,2025-12-03,10.63,2.45,0,,10.23,ATH,False,False
03-12-2025 11:00,GZNMI,75.5,82.55,75.2,81.85,2873298.0,0.7,6.35,0.79,698.74,6.35,702211.2,309.18,0.11,True,67.49,1.46,1.29,0.17,2025-12-03,75.05,9.06,0,,72.6,81.95,False,False
03-12-2025 11:00,VAKBN,31.74,32.68,31.58,32.64,25677312.0,0.04,0.9,0.21,328.57,0.9,13756421.3,86.66,0.04,True,81.47,0.69,0.57,0.12,2025-12-03,30.8,5.97,0,,29.52,ATH,False,False
03-12-2025 11:00,ISDMR,36.08,36.66,36.06,36.52,696302.0,0.14,0.44,0.03,1592.31,0.44,183532.4,279.39,0.32,True,74.09,0.18,0.14,0.03,2025-12-03,36.1,1.16,0,,35.7,ATH,False,False
03-12-2025 10:00,LINK,222.1,242.8,220.9,241.5,1156885.0,1.3,19.4,2.36,722.03,19.4,221490.8,422.32,0.07,True,83.35,3.91,1.37,2.55,2025-12-03,220.8,9.37,0,,ATL,245.5,False,False
03-12-2025 10:00,METRO,4.8,5.18,4.8,5.15,7312419.0,0.03,0.35,0.03,993.75,0.35,1085613.8,573.57,0.09,True,66.59,0.03,0.03,0.0,2025-12-03,4.91,4.89,0,,4.54,5.27,False,False
03-12-2025 10:00,MNDRS,13.96,14.03,13.96,14.01,350152.0,0.02,0.05,0.0,1566.67,0.05,181508.1,92.91,0.4,True,62.77,0.09,0.11,-0.02,2025-12-03,13.96,0.36,0,,13.26,14.11,False,False
03-12-2025 10:00,MOBTL,8.11,8.27,8.0,8.24,1928200.0,0.03,0.13,0.02,622.22,0.13,788426.7,144.56,0.23,True,64.4,0.08,0.09,-0.0,2025-12-03,8.14,1.23,0,,7.52,8.3,False,False
03-12-2025 10:00,A1CAP,11.95,12.53,11.86,12.5,6993425.0,0.03,0.55,0.08,570.73,0.55,1512987.5,362.23,0.05,True,76.68,0.14,0.1,0.04,2025-12-03,11.92,4.87,0,,11.57,ATH,False,False
03-12-2025 10:00,LIDER,45.4,48.16,45.32,47.84,1456925.0,0.32,2.44,0.2,1107.92,2.44,528176.0,175.84,0.13,True,65.98,0.53,0.42,0.11,2025-12-03,46.0,4.0,0,,44.9,48.88,False,False
03-12-2025 10:00,BURCE,45.28,49.66,45.16,49.66,1094441.0,0.0,4.38,0.91,382.38,4.38,242510.5,351.3,0.0,True,84.87,1.67,1.05,0.62,2025-12-03,45.16,9.96,0,,39.6,ATH,False,False
03-12-2025 10:00,NIBAS,24.6,25.66,24.54,25.4,2636277.0,0.26,0.8,0.07,1042.86,0.8,609134.4,332.79,0.33,True,84.96,0.84,0.6,0.24,2025-12-03,23.8,6.72,0,,20.9,ATH,False,False
03-12-2025 10:00,DCTTR,26.14,27.22,26.14,26.92,1080425.0,0.3,0.78,0.07,1081.82,0.78,187374.9,476.61,0.38,True,67.5,-0.05,-0.13,0.08,2025-12-03,26.06,3.3,0,,25.98,27.5,False,False
03-12-2025 10:00,INDES,7.31,7.38,7.31,7.36,579145.0,0.02,0.05,0.0,1566.67,0.05,276959.0,109.11,0.4,True,65.04,0.01,0.0,0.0,2025-12-03,7.29,0.96,0,,7.27,7.54,False,False
03-12-2025 10:00,DOFRB,71.9,75.9,71.05,74.85,5676827.0,1.05,2.95,0.54,446.3,2.95,1529287.8,271.21,0.36,True,71.46,0.61,0.13,0.47,2025-12-03,71.9,4.1,0,,68.65,77.4,False,False
03-12-2025 10:00,GWIND,23.32,23.8,23.32,23.68,1401302.0,0.12,0.36,0.03,1025.0,0.36,400972.1,249.48,0.33,True,73.05,0.14,0.11,0.03,2025-12-03,23.24,1.89,0,,22.66,ATH,False,False
03-12-2025 10:00,GOZDE,21.14,21.5,21.14,21.48,508417.0,0.02,0.34,0.0,8400.0,0.34,143093.2,255.3,0.06,True,60.79,0.03,0.03,-0.0,2025-12-03,21.04,2.09,0,,21.02,21.56,False,False
03-12-2025 10:00,DAGI,8.26,8.42,8.24,8.38,3064186.0,0.04,0.12,0.02,700.0,0.12,931656.7,228.9,0.33,True,60.38,0.1,0.13,-0.03,2025-12-03,8.24,1.7,0,,8.23,8.56,False,False
03-12-2025 10:00,MANAS,9.1,9.77,9.09,9.67,23948752.0,0.1,0.57,0.07,750.75,0.57,3879171.2,517.37,0.18,True,69.15,0.01,-0.07,0.08,2025-12-03,8.96,7.92,0,,8.73,10.53,True,False
03-12-2025 10:00,ASELS,187.7,191.3,187.7,190.6,7439087.0,0.7,2.9,0.22,1218.18,2.9,2069359.2,259.49,0.24,True,72.7,1.0,0.88,0.12,2025-12-03,187.7,1.55,0,,185.5,ATH,False,False
03-12-2025 10:00,ATATP,147.2,154.8,147.0,153.5,732404.0,1.3,6.3,0.47,1240.43,6.3,151592.9,383.14,0.21,True,65.06,-0.5,-1.02,0.52,2025-12-03,148.0,3.72,0,,146.5,154.2,True,True
03-12-2025 10:00,SANEL,40.68,41.54,39.64,41.54,480106.0,0.0,0.86,0.09,900.0,0.86,87850.7,446.5,0.0,True,79.4,0.94,0.43,0.51,2025-12-03,37.78,9.95,0,,34.1,48.88,False,False
03-12-2025 10:00,RYSAS,13.91,14.05,13.89,14.04,865466.0,0.01,0.13,0.01,900.0,0.13,510820.3,69.43,0.08,True,69.51,0.05,0.03,0.02,2025-12-03,13.87,1.23,0,,13.48,14.55,False,False
03-12-2025 10:00,PENTA,13.69,13.83,13.69,13.82,189570.0,0.01,0.13,0.01,1081.82,0.13,124358.7,52.44,0.08,True,63.17,0.03,0.02,0.01,2025-12-03,13.7,0.88,0,,13.33,13.91,False,False
02-12-2025 17:00,ISFIN,19.06,19.33,19.03,19.3,318044.0,0.03,0.24,0.0,23900.0,0.24,158829.5,100.24,0.12,True,56.71,0.01,0.01,0.0,2025-12-02,19.25,0.26,0,,19.0,19.39,False,False
02-12-2025 17:00,TDGYO,31.06,31.68,31.06,31.68,185037.0,0.0,0.62,0.05,1140.0,0.62,70948.8,160.8,0.0,True,55.25,-0.14,-0.17,0.03,2025-12-02,31.22,1.47,0,,31.0,32.94,False,False
02-12-2025 17:00,KLSYN,5.35,5.45,5.35,5.43,1608270.0,0.02,0.08,0.01,700.0,0.08,411470.3,290.86,0.25,True,64.39,0.02,0.02,0.0,2025-12-02,5.36,1.31,1,5.45,5.33,5.45,False,False
02-12-2025 17:00,TNZTP,21.18,21.46,21.16,21.44,214125.0,0.02,0.26,0.01,2500.0,0.26,131864.2,62.38,0.08,True,55.05,-0.01,-0.03,0.02,2025-12-02,21.36,0.37,0,,20.88,21.6,False,False
02-12-2025 17:00,KONKA,13.92,14.3,13.9,14.2,904181.0,0.1,0.28,0.05,438.46,0.28,222365.0,306.62,0.36,True,75.63,0.12,0.07,0.06,2025-12-02,13.66,3.95,1,14.3,13.04,14.3,False,False
02-12-2025 17:00,PLTUR,20.56,20.9,20.46,20.88,763642.0,0.02,0.32,0.07,332.43,0.32,274933.1,177.76,0.06,True,66.58,0.08,0.02,0.07,2025-12-02,20.22,3.26,0,,20.04,21.48,False,False
02-12-2025 17:00,BULGS,44.82,46.04,44.7,45.84,1219044.0,0.2,1.02,0.13,684.62,1.02,668678.8,82.31,0.2,True,56.12,-0.15,-0.29,0.15,2025-12-02,44.7,2.55,0,,43.42,46.3,False,False
02-12-2025 17:00,KRPLS,7.57,8.25,7.52,8.24,1406750.0,0.01,0.67,0.07,857.14,0.67,202612.7,594.3,0.01,True,83.65,0.05,-0.01,0.05,2025-12-02,7.52,9.57,2,7.52,7.52,ATH,False,False
02-12-2025 17:00,BTCIM,3.55,3.63,3.54,3.61,19667907.0,0.02,0.06,0.01,500.0,0.06,6097274.4,222.57,0.33,True,61.19,-0.0,-0.02,0.02,2025-12-02,3.53,2.27,0,,3.36,3.7,False,False
02-12-2025 17:00,ENERY,9.94,10.57,9.93,10.52,18388052.0,0.05,0.58,0.05,1108.33,0.58,3393619.2,441.84,0.09,True,70.06,-0.02,-0.06,0.04,2025-12-02,10.02,4.99,3,,9.93,11.74,False,False
02-12-2025 17:00,SARKY,15.0,15.21,14.93,15.21,299782.0,0.0,0.21,0.01,1400.0,0.21,88389.3,239.16,0.0,True,69.01,0.01,-0.01,0.02,2025-12-02,15.05,1.06,2,14.93,14.93,15.27,False,False
02-12-2025 17:00,PAHOL,1.48,1.65,1.47,1.62,964312577.0,0.03,0.14,0.0,3400.0,0.14,204757051.2,370.95,0.21,True,59.54,-0.03,-0.04,0.01,2025-12-02,1.54,5.19,2,1.47,1.47,1.74,True,True
02-12-2025 17:00,BLCYT,33.98,36.36,33.84,36.36,2339281.0,0.0,2.38,0.32,653.16,2.38,305137.9,666.63,0.0,True,85.55,0.46,0.22,0.24,2025-12-02,33.06,9.98,0,,32.1,ATH,False,False
02-12-2025 16:00,KLYPV,54.15,55.2,54.05,55.1,375406.0,0.1,0.95,0.01,9400.0,0.95,186156.8,101.66,0.11,True,63.88,0.18,0.02,0.16,2025-12-02,53.55,2.89,0,,52.6,57.25,False,False
02-12-2025 15:00,TKNSA,23.92,24.42,23.88,24.36,762962.0,0.06,0.44,0.03,1194.12,0.44,207877.2,267.03,0.14,True,69.54,0.09,0.02,0.07,2025-12-02,23.76,2.53,0,,23.22,24.9,False,False
02-12-2025 15:00,KOTON,14.89,15.01,14.88,15.0,218176.0,0.01,0.11,0.02,511.11,0.11,137614.5,58.54,0.09,True,63.36,0.03,0.0,0.02,2025-12-02,14.79,1.42,0,,14.35,15.02,False,False
02-12-2025 15:00,ULUUN,6.91,6.96,6.88,6.96,475187.0,0.0,0.05,0.01,733.33,0.05,256663.4,85.14,0.0,True,59.27,0.02,0.02,0.0,2025-12-02,6.92,0.58,0,,6.74,7.01,False,False
02-12-2025 14:00,AKSEN,57.85,59.5,57.1,59.45,4467066.0,0.05,1.6,0.5,220.0,1.6,1319134.3,238.64,0.03,True,84.15,1.45,1.01,0.44,2025-12-02,55.75,6.64,0,,51.3,ATH,False,False
02-12-2025 14:00,SEGMN,18.1,18.19,18.07,18.18,128188.0,0.01,0.08,0.0,1900.0,0.08,74825.1,71.32,0.13,True,45.9,-0.07,-0.07,0.01,2025-12-02,18.14,0.22,0,,18.03,18.26,False,False
02-12-2025 13:00,PEKGY,10.36,10.56,10.34,10.54,76110185.0,0.02,0.18,0.01,1700.0,0.18,46996872.8,61.95,0.11,True,50.24,-0.17,-0.27,0.1,2025-12-02,10.2,3.33,0,,9.9,10.71,True,False
02-12-2025 13:00,ENKAI,78.65,79.65,78.55,79.55,2247191.0,0.1,0.9,0.01,5900.0,0.9,1268057.8,77.22,0.11,True,57.17,0.05,0.12,-0.07,2025-12-02,79.25,0.38,0,,78.35,79.8,False,False
02-12-2025 13:00,ODINE,225.0,233.4,222.2,231.8,229787.0,1.6,6.8,1.46,365.75,6.8,75632.1,203.82,0.24,True,70.35,0.33,-0.93,1.26,2025-12-02,219.9,5.41,0,,215.0,241.5,False,False
02-12-2025 13:00,ALFAS,44.98,45.86,44.98,45.78,399921.0,0.08,0.8,0.16,393.83,0.8,209199.2,91.17,0.1,True,79.77,0.55,0.42,0.13,2025-12-02,44.22,3.53,0,,42.66,ATH,False,False
02-12-2025 12:00,NTGAZ,9.96,10.12,9.96,10.09,966954.0,0.03,0.13,0.02,420.0,0.13,397051.3,143.53,0.23,True,58.48,-0.01,-0.03,0.02,2025-12-02,10.06,0.3,0,,9.86,10.46,False,False
02-12-2025 12:00,BRKVY,87.95,89.45,87.85,89.3,167853.0,0.15,1.35,0.29,365.52,1.35,107152.4,56.65,0.11,True,63.16,0.09,-0.28,0.37,2025-12-02,86.0,3.84,0,,84.5,97.9,False,False
02-12-2025 12:00,LYDHO,171.7,178.0,171.7,177.3,251399.0,0.7,5.6,0.48,1066.67,5.6,87412.9,187.6,0.12,True,55.36,-2.51,-3.15,0.63,2025-12-02,169.6,4.54,1,178.0,167.1,178.0,True,False
02-12-2025 12:00,ESCOM,3.25,3.29,3.24,3.28,2174113.0,0.01,0.03,0.0,650.0,0.03,1240043.1,75.33,0.33,True,62.22,0.01,0.0,0.01,2025-12-02,3.24,1.23,1,3.29,3.15,3.29,False,False
02-12-2025 11:00,DITAS,39.32,41.3,39.32,41.18,620652.0,0.12,1.86,0.2,848.98,1.86,144361.1,329.93,0.06,True,69.88,0.35,0.22,0.13,2025-12-02,39.5,4.25,0,,37.22,42.36,False,False
02-12-2025 11:00,ENTRA,10.42,10.64,10.42,10.59,2055506.0,0.05,0.17,0.02,672.73,0.17,960284.9,114.05,0.29,True,71.17,0.02,-0.01,0.03,2025-12-02,10.3,2.82,1,10.64,10.2,10.64,False,False
02-12-2025 11:00,GEREL,21.34,22.66,21.3,22.3,2734196.0,0.36,0.96,0.15,548.65,0.96,954567.9,186.43,0.37,True,76.25,0.31,0.24,0.07,2025-12-02,21.26,4.89,0,,19.75,ATH,False,False
02-12-2025 11:00,DZGYO,7.18,7.29,7.18,7.27,626344.0,0.02,0.09,0.01,1400.0,0.09,263071.5,138.09,0.22,True,67.21,0.05,0.04,0.0,2025-12-02,7.18,1.25,1,7.29,7.16,7.29,False,False
02-12-2025 11:00,BESLR,12.37,12.55,12.36,12.5,1025269.0,0.05,0.13,0.03,348.28,0.13,370689.7,176.58,0.38,True,77.41,0.05,0.01,0.03,2025-12-02,12.25,2.04,1,12.55,12.06,12.55,False,False
02-12-2025 11:00,KRDMD,25.44,25.82,25.42,25.78,6878829.0,0.04,0.34,0.04,750.0,0.34,3640224.6,88.97,0.12,True,63.91,0.15,0.12,0.03,2025-12-02,25.62,0.62,0,,25.4,25.86,False,False
02-12-2025 11:00,CIMSA,47.48,48.6,47.48,48.48,3182846.0,0.12,1.0,0.26,290.62,1.0,1547396.1,105.69,0.12,True,76.84,0.59,0.38,0.21,2025-12-02,47.76,1.51,0,,45.12,ATH,False,False
02-12-2025 11:00,CEMAS,4.89,4.92,4.88,4.92,2108456.0,0.0,0.03,0.0,2900.0,0.03,1350783.6,56.09,0.0,True,51.64,-0.02,-0.03,0.01,2025-12-02,4.89,0.61,0,,ATL,5.16,True,False
02-12-2025 11:00,CGCAM,37.54,39.14,37.36,38.72,1847709.0,0.42,1.18,0.13,807.69,1.18,972749.0,89.95,0.36,True,77.77,1.18,0.99,0.19,2025-12-02,38.0,1.89,0,,32.28,ATH,False,False
02-12-2025 10:00,KARSN,9.4,9.48,9.4,9.46,2221253.0,0.02,0.06,0.01,328.57,0.06,1143833.0,94.19,0.33,True,68.1,0.01,-0.01,0.02,2025-12-02,9.4,0.64,0,,9.21,9.71,False,False
02-12-2025 10:00,POLHO,17.38,17.84,17.38,17.77,1684003.0,0.07,0.39,0.12,219.67,0.39,745413.1,125.92,0.18,True,77.56,0.39,0.29,0.1,2025-12-02,17.3,2.72,0,,15.44,ATH,False,False
02-12-2025 10:00,MHRGY,3.61,3.63,3.59,3.63,564014.0,0.0,0.02,0.0,400.0,0.02,278907.0,102.22,0.0,True,60.02,-0.0,-0.01,0.01,2025-12-02,3.6,0.83,0,,3.54,3.75,True,False
02-12-2025 10:00,MERKO,12.97,13.1,12.97,13.07,558793.0,0.03,0.1,0.0,5.62949953421309e+16,0.1,225680.3,147.6,0.3,True,56.86,-0.01,-0.02,0.01,2025-12-02,12.95,0.93,0,,12.7,13.15,False,False
02-12-2025 10:00,OSTIM,2.97,2.99,2.95,2.99,941672.0,0.0,0.02,0.0,900.0,0.02,461935.6,103.85,0.0,True,46.93,-0.02,-0.02,0.01,2025-12-02,2.97,0.67,0,,2.94,3.0,True,False
02-12-2025 10:00,MAKTK,13.85,14.32,13.5,14.25,2853879.0,0.07,0.4,0.11,280.95,0.4,1283682.2,122.32,0.18,True,70.64,0.35,0.27,0.08,2025-12-02,13.9,2.52,0,,12.27,ATH,False,False
02-12-2025 10:00,FONET,2.75,2.82,2.75,2.82,7750055.0,0.0,0.07,0.01,1066.67,0.07,3432963.1,125.75,0.0,True,69.65,0.01,-0.0,0.01,2025-12-02,2.74,2.92,0,,2.67,2.9,False,False
02-12-2025 10:00,ULKER,112.3,114.0,111.8,113.9,1184831.0,0.1,1.6,0.29,451.72,1.6,463831.4,155.44,0.06,True,70.77,0.31,-0.01,0.31,2025-12-02,112.3,1.42,0,,109.3,ATH,False,False
02-12-2025 10:00,GLCVY,80.5,82.4,79.15,82.1,375134.0,0.3,1.6,0.32,392.31,1.6,141854.2,164.45,0.19,True,76.8,1.68,1.28,0.4,2025-12-02,80.25,2.31,0,,72.6,ATH,False,False
02-12-2025 10:00,TMSN,105.0,106.8,104.8,106.3,255367.0,0.5,1.3,0.15,766.67,1.3,92459.1,176.19,0.38,True,63.33,-0.04,-0.22,0.17,2025-12-02,104.8,1.43,0,,103.6,108.7,True,False
02-12-2025 10:00,KATMR,3.26,3.37,3.25,3.35,57705846.0,0.02,0.09,0.01,542.86,0.09,22211115.3,159.81,0.22,True,70.64,0.03,0.02,0.01,2025-12-02,3.25,3.08,0,,3.1,3.54,False,False
02-12-2025 10:00,HALKB,39.88,41.12,39.54,40.78,71665921.0,0.34,0.9,0.36,147.25,0.9,18370927.0,290.11,0.38,True,91.89,1.5,1.21,0.29,2025-12-02,39.18,4.08,0,,28.94,ATH,False,False
02-12-2025 10:00,HUNER,3.43,3.45,3.41,3.45,1705614.0,0.0,0.02,0.0,400.0,0.02,940896.1,81.28,0.0,True,61.5,0.0,-0.01,0.01,2025-12-02,3.42,0.88,0,,3.36,3.48,False,False
02-12-2025 10:00,RUZYE,12.69,13.38,12.63,13.21,6293967.0,0.17,0.52,0.09,511.76,0.52,1643414.0,282.98,0.33,True,68.97,0.03,-0.07,0.11,2025-12-02,12.68,4.18,1,13.38,12.0,13.38,False,False
02-12-2025 10:00,HURGZ,5.77,5.9,5.74,5.88,539291.0,0.02,0.11,0.02,587.5,0.11,207187.0,160.29,0.18,True,63.53,0.02,0.0,0.02,2025-12-02,5.79,1.55,1,5.9,5.58,5.9,False,False
02-12-2025 10:00,SKBNK,8.17,8.26,8.15,8.24,6835974.0,0.02,0.07,0.01,438.46,0.07,3589266.2,90.46,0.29,True,68.14,0.04,0.03,0.01,2025-12-02,8.14,1.23,0,,7.87,8.39,False,False
02-12-2025 10:00,MNDTR,7.04,7.41,7.02,7.31,1606163.0,0.1,0.27,0.02,1250.0,0.27,519655.1,209.08,0.37,True,64.03,-0.04,-0.05,0.02,2025-12-02,7.01,4.28,1,7.41,6.97,7.41,False,False
02-12-2025 10:00,A1YEN,29.32,29.96,29.24,29.86,297767.0,0.1,0.54,0.07,694.12,0.54,90285.1,229.81,0.19,True,64.48,-0.04,-0.12,0.08,2025-12-02,29.22,2.19,0,,28.46,30.0,False,False
02-12-2025 10:00,INVEO,9.48,9.56,9.36,9.55,3201442.0,0.01,0.07,0.01,1300.0,0.07,743503.2,330.59,0.14,True,62.95,-0.01,-0.05,0.04,2025-12-02,9.35,2.14,0,,9.17,10.24,False,False
02-12-2025 10:00,KLKIM,30.76,31.12,30.76,31.12,287819.0,0.0,0.36,0.06,520.69,0.36,152847.0,88.31,0.0,True,65.75,0.01,-0.04,0.06,2025-12-02,30.62,1.63,0,,30.28,31.96,False,False
02-12-2025 10:00,INFO,3.86,3.93,3.85,3.92,5197963.0,0.01,0.06,0.01,650.0,0.06,2306567.1,125.35,0.17,True,64.69,0.01,0.0,0.01,2025-12-02,3.87,1.29,1,3.93,3.76,3.93,False,False
02-12-2025 10:00,CATES,35.16,36.2,34.9,36.2,429889.0,0.0,1.04,0.15,612.33,1.04,174929.0,145.75,0.0,True,70.26,0.37,0.33,0.04,2025-12-02,35.16,2.96,0,,33.52,ATH,False,False
02-12-2025 10:00,ARDYZ,32.24,35.24,32.18,35.24,11096537.0,0.0,3.0,0.38,697.87,3.0,2208649.4,402.41,0.0,True,73.92,0.43,0.22,0.21,2025-12-02,32.04,9.99,1,35.24,30.98,ATH,False,False
02-12-2025 10:00,BIGEN,9.18,9.36,9.17,9.34,2726894.0,0.02,0.16,0.02,900.0,0.16,827856.6,229.39,0.12,True,54.48,-0.08,-0.12,0.03,2025-12-02,9.16,1.97,1,9.36,9.04,9.36,True,False
02-12-2025 10:00,BEGYO,5.12,5.28,5.11,5.25,4231558.0,0.03,0.13,0.02,664.71,0.13,1179116.6,258.88,0.23,True,67.65,0.02,0.01,0.01,2025-12-02,5.11,2.74,0,,4.99,5.26,False,False
02-12-2025 10:00,DOAS,186.2,190.9,185.4,190.4,916500.0,0.5,4.2,0.78,438.46,4.2,218616.7,319.23,0.12,True,80.44,1.22,0.48,0.74,2025-12-02,186.2,2.26,0,,180.2,ATH,False,False
02-12-2025 10:00,DGNMO,5.65,5.69,5.61,5.68,171893.0,0.01,0.03,0.01,400.0,0.03,87786.4,95.81,0.33,True,68.58,0.01,-0.01,0.02,2025-12-02,5.65,0.53,0,,5.5,5.86,False,False
02-12-2025 10:00,ADESE,1.6,1.7,1.59,1.7,159061715.0,0.0,0.1,0.01,733.33,0.1,22252509.1,614.8,0.0,True,75.2,0.02,-0.01,0.02,2025-12-02,1.55,9.68,1,1.7,1.38,1.77,False,False
02-12-2025 10:00,BIMAS,544.5,552.0,540.0,550.0,1689387.0,2.0,5.5,0.8,587.5,5.5,577737.3,192.41,0.36,True,67.18,0.9,-0.09,0.99,2025-12-02,545.0,0.92,0,,533.5,ATH,False,False
02-12-2025 10:00,AYDEM,18.92,19.13,18.85,19.09,796615.0,0.04,0.17,0.05,254.17,0.17,272148.7,192.71,0.24,True,75.81,0.13,0.08,0.06,2025-12-02,18.93,0.85,0,,18.31,19.26,False,False
02-12-2025 10:00,BRSAN,462.25,492.0,461.75,490.5,1310775.0,1.5,28.25,3.52,701.42,28.25,227960.4,475.0,0.05,True,82.39,4.74,1.23,3.51,2025-12-02,460.0,6.63,0,,441.0,ATH,False,False
02-12-2025 10:00,BSOKE,14.96,15.19,14.81,15.14,2450790.0,0.05,0.18,0.04,373.68,0.18,848395.1,188.87,0.28,True,60.46,-0.04,-0.11,0.07,2025-12-02,14.89,1.68,0,,14.31,16.12,False,False
02-12-2025 10:00,CVKMD,17.78,18.77,17.7,18.76,12335087.0,0.01,0.98,0.13,671.65,0.98,2702141.4,356.49,0.01,True,80.97,0.21,0.12,0.09,2025-12-02,17.69,6.05,0,,16.96,ATH,False,False
01-12-2025 17:00,TSPOR,1.22,1.24,1.22,1.24,81916878.0,0.0,0.02,0.01,300.0,0.02,40791620.4,100.82,0.0,True,63.2,0.0,-0.0,0.0,2025-12-01,1.19,4.2,0,,1.19,1.28,False,False
01-12-2025 17:00,SOKM,46.36,47.2,46.36,47.02,1285639.0,0.18,0.66,0.09,617.39,0.66,485789.6,164.65,0.27,True,62.7,0.04,0.0,0.03,2025-12-01,46.0,2.22,0,,45.42,47.74,False,False
01-12-2025 17:00,AKGRT,6.73,6.8,6.73,6.79,1935540.0,0.01,0.06,0.01,361.54,0.06,1079277.8,79.34,0.17,True,66.1,0.01,0.0,0.01,2025-12-01,6.66,1.95,1,6.8,6.6,6.8,False,False
01-12-2025 17:00,PETKM,17.29,17.43,17.29,17.39,9570205.0,0.04,0.1,0.04,150.0,0.1,5793462.3,65.19,0.4,True,77.3,0.09,0.05,0.04,2025-12-01,17.0,2.29,0,,16.78,ATH,False,False
01-12-2025 17:00,TCELL,95.0,96.0,95.0,95.9,4081203.0,0.1,0.9,0.25,252.94,0.9,2004804.2,103.57,0.11,True,68.63,0.24,0.05,0.19,2025-12-01,93.55,2.51,0,,93.35,97.0,False,False
01-12-2025 17:00,MIATK,35.12,35.9,35.12,35.7,3838640.0,0.2,0.58,0.07,778.79,0.58,1227854.2,212.63,0.34,True,50.56,-0.32,-0.42,0.09,2025-12-01,34.82,2.53,0,,34.8,37.32,True,False
01-12-2025 17:00,CEOEM,25.08,26.12,25.0,25.96,485555.0,0.16,0.88,0.12,609.68,0.88,134007.1,262.34,0.18,True,68.57,0.15,0.06,0.09,2025-12-01,24.48,6.05,0,,24.34,26.62,False,False
01-12-2025 17:00,SELEC,69.4,71.1,69.4,70.85,219124.0,0.25,1.45,0.24,491.84,1.45,84141.3,160.42,0.17,True,66.13,0.17,0.0,0.17,2025-12-01,68.55,3.36,0,,67.95,72.6,False,False
01-12-2025 17:00,ODAS,5.31,5.37,5.3,5.37,7300465.0,0.0,0.06,0.01,328.57,0.06,2504495.1,191.49,0.0,True,57.45,-0.01,-0.03,0.01,2025-12-01,5.25,2.29,0,,5.23,5.47,False,False
01-12-2025 17:00,MAVI,38.28,38.64,38.28,38.58,1257533.0,0.06,0.3,0.1,194.12,0.3,469897.8,167.62,0.2,True,67.32,0.03,-0.06,0.09,2025-12-01,37.72,2.28,0,,37.46,38.68,False,False
01-12-2025 17:00,AGHOL,28.22,28.62,28.22,28.52,771464.0,0.1,0.3,0.06,417.24,0.3,420933.2,83.27,0.33,True,54.69,-0.11,-0.12,0.01,2025-12-01,27.92,2.15,0,,27.5,29.32,False,False
01-12-2025 17:00,ESCAR,20.54,20.8,20.48,20.76,1078070.0,0.04,0.22,0.06,243.75,0.22,449702.5,139.73,0.18,True,71.09,0.14,0.06,0.07,2025-12-01,20.0,3.8,0,,19.7,21.0,False,False
01-12-2025 17:00,TAVHL,277.5,281.5,277.5,281.5,415754.0,0.0,4.0,0.35,1042.86,4.0,194851.4,113.37,0.0,True,66.19,0.99,0.83,0.15,2025-12-01,278.0,1.26,0,,273.75,ATH,False,False
01-12-2025 17:00,DMRGD,24.3,24.68,24.26,24.64,366792.0,0.04,0.34,0.05,580.0,0.34,175812.2,108.63,0.12,True,69.14,0.19,0.13,0.07,2025-12-01,24.2,1.82,0,,23.66,ATH,False,False
01-12-2025 17:00,IEYHO,57.65,58.25,57.45,58.15,2574855.0,0.1,0.5,0.0,9900.0,0.5,1308050.1,96.85,0.2,True,57.35,0.17,0.16,0.01,2025-12-01,58.0,0.26,0,,56.45,58.5,False,False
01-12-2025 17:00,ARCLK,107.4,109.0,107.4,108.9,688321.0,0.1,1.5,0.34,341.18,1.5,312570.8,120.21,0.07,True,68.98,0.42,0.21,0.21,2025-12-01,105.7,3.03,0,,105.2,ATH,False,False
01-12-2025 17:00,AEFES,16.06,16.2,16.05,16.16,15071911.0,0.04,0.1,0.04,170.27,0.1,6798574.1,121.69,0.4,True,58.15,-0.01,-0.01,0.01,2025-12-01,15.79,2.34,1,16.2,15.67,16.2,False,False
01-12-2025 17:00,BUCIM,6.21,6.28,6.2,6.28,2044613.0,0.0,0.07,0.01,438.46,0.07,495918.5,312.29,0.0,True,77.78,0.02,0.01,0.01,2025-12-01,6.15,2.11,0,,6.13,ATH,False,False
01-12-2025 17:00,BAGFS,27.32,27.8,27.32,27.76,211105.0,0.04,0.44,0.08,464.1,0.44,65747.6,221.08,0.09,True,61.94,0.03,-0.06,0.09,2025-12-01,27.0,2.81,0,,26.5,28.38,False,False
01-12-2025 16:00,GMTAS,44.76,45.36,44.54,45.22,421407.0,0.14,0.46,0.03,1433.33,0.46,233540.5,80.44,0.3,True,51.5,-0.05,-0.02,-0.03,2025-12-01,45.5,-0.62,2,44.54,44.54,45.9,False,False
01-12-2025 16:00,IHEVA,2.3,2.34,2.3,2.34,436933.0,0.0,0.04,0.0,900.0,0.04,147345.0,196.54,0.0,True,49.55,-0.01,-0.01,0.0,2025-12-01,2.31,1.3,0,,2.3,2.37,False,False
01-12-2025 15:00,DMLKT,5.93,5.99,5.92,5.98,4432300.0,0.01,0.05,0.01,455.56,0.05,1826085.4,142.72,0.2,True,77.68,0.01,0.0,0.01,2025-12-01,5.89,1.53,0,,5.87,ATH,False,False
01-12-2025 15:00,SKYMD,12.19,12.5,12.17,12.46,1771272.0,0.04,0.27,0.05,400.0,0.27,639096.6,177.15,0.15,True,67.79,0.04,-0.01,0.05,2025-12-01,11.97,4.09,0,,11.8,12.5,False,False
01-12-2025 15:00,ARMGD,40.68,41.56,40.66,41.46,586349.0,0.1,0.78,0.09,766.67,0.78,196669.1,198.14,0.13,True,59.73,-0.21,-0.32,0.11,2025-12-01,40.1,3.39,0,,39.62,43.3,False,False
01-12-2025 14:00,GLYHO,11.74,11.95,11.74,11.9,1705414.0,0.05,0.16,0.02,595.65,0.16,714995.5,138.52,0.31,True,66.28,0.06,0.04,0.02,2025-12-01,11.72,1.54,0,,11.52,12.01,False,False
01-12-2025 14:00,VAKFN,2.01,2.1,2.01,2.1,90290093.0,0.0,0.09,0.01,1400.0,0.09,17148711.8,426.51,0.0,True,62.29,-0.01,-0.02,0.01,2025-12-01,2.0,5.0,0,,1.99,2.54,False,False
01-12-2025 14:00,TSKB,13.08,13.26,13.08,13.22,7879378.0,0.04,0.14,0.03,351.61,0.14,3631100.8,117.0,0.29,True,71.03,0.07,0.04,0.03,2025-12-01,12.86,2.8,0,,12.77,ATH,False,False
01-12-2025 13:00,SILVR,2.84,2.94,2.84,2.93,572230.0,0.01,0.09,0.01,800.0,0.09,360724.2,58.63,0.11,True,64.04,0.02,0.01,0.01,2025-12-01,2.85,2.81,0,,2.7,ATH,False,False
01-12-2025 12:00,SANFM,6.5,6.82,6.49,6.75,3043079.0,0.07,0.25,0.04,594.44,0.25,969185.4,213.98,0.28,True,66.08,-0.02,-0.07,0.05,2025-12-01,6.25,8.0,0,,6.21,6.77,False,False
01-12-2025 12:00,ISCTR,13.65,13.95,13.64,13.92,166868574.0,0.03,0.27,0.05,486.96,0.27,78720344.1,111.98,0.11,True,83.02,0.15,0.12,0.03,2025-12-01,13.57,2.58,0,,12.47,ATH,False,False
01-12-2025 12:00,AVOD,3.47,3.6,3.47,3.57,552031.0,0.03,0.1,0.0,3233.33,0.1,204876.7,169.45,0.3,True,53.45,-0.03,-0.03,0.01,2025-12-01,3.48,2.59,0,,3.42,3.82,True,False
01-12-2025 12:00,VESBE,8.44,8.54,8.43,8.52,1225540.0,0.02,0.08,0.0,1500.0,0.08,691240.4,77.3,0.25,True,58.4,-0.0,-0.02,0.02,2025-12-01,8.4,1.43,0,,8.37,8.96,False,False
01-12-2025 12:00,MERIT,17.52,18.15,17.5,18.03,970777.0,0.12,0.51,0.04,1207.69,0.51,493218.7,96.82,0.24,True,60.06,-0.06,-0.11,0.05,2025-12-01,17.62,2.33,1,18.15,ATL,18.15,True,False
01-12-2025 12:00,EUPWR,28.76,30.08,28.76,29.86,3484186.0,0.22,1.1,0.15,643.24,1.1,888455.3,292.16,0.2,True,71.58,-0.05,-0.19,0.14,2025-12-01,28.02,6.57,0,,27.98,29.98,True,False
01-12-2025 12:00,ECOGR,21.94,22.58,21.76,22.58,5675937.0,0.0,0.64,0.04,1500.0,0.64,3675940.7,54.41,0.0,True,58.82,-0.1,-0.18,0.07,2025-12-01,21.72,3.96,0,,21.3,23.12,False,False
01-12-2025 12:00,SRVGY,3.45,3.53,3.44,3.53,9918163.0,0.0,0.08,0.02,321.05,0.08,5627374.3,76.25,0.0,True,66.11,0.0,-0.01,0.02,2025-12-01,3.34,5.69,0,,3.3,3.57,False,False
01-12-2025 12:00,XBANK,16050.13,16281.82,16047.61,16237.37,259193014.0,44.45,187.24,49.8,276.01,187.24,142809638.4,81.5,0.24,True,79.59,133.47,97.39,36.08,2025-12-01,15853.65,2.42,0,,15609.01,ATH,False,False
01-12-2025 12:00,TUPRS,195.1,197.0,194.6,196.7,2575276.0,0.3,1.6,0.06,2566.67,1.6,1399251.8,84.05,0.19,True,67.11,0.48,0.24,0.23,2025-12-01,194.8,0.98,0,,193.7,ATH,False,False
01-12-2025 11:00,ESEN,6.7,6.84,6.65,6.84,11245761.0,0.0,0.14,0.02,566.67,0.14,3626321.6,210.11,0.0,True,63.54,-0.01,-0.04,0.03,2025-12-01,6.59,3.79,0,,6.49,8.43,False,False
01-12-2025 11:00,ANSGR,22.66,22.94,22.64,22.9,1449914.0,0.04,0.24,0.02,990.91,0.24,498249.3,191.0,0.17,True,69.7,0.09,0.09,0.01,2025-12-01,22.5,1.78,1,22.94,22.3,22.94,False,False
01-12-2025 11:00,FENER,10.86,11.06,10.85,11.01,11815680.0,0.05,0.15,0.02,581.82,0.15,4095472.1,188.51,0.33,True,59.39,-0.04,-0.11,0.06,2025-12-01,10.73,2.61,0,,9.76,12.41,False,False
01-12-2025 11:00,SAHOL,82.2,83.2,82.2,83.1,6335986.0,0.1,0.9,0.16,445.45,0.9,4164904.2,52.13,0.11,True,67.12,0.2,0.14,0.05,2025-12-01,81.9,1.47,0,,80.85,83.15,False,False
01-12-2025 11:00,DOHOL,17.15,17.24,17.13,17.23,1535852.0,0.01,0.08,0.01,1233.33,0.08,859576.7,78.68,0.12,True,55.34,-0.03,-0.03,0.01,2025-12-01,17.09,0.82,0,,16.92,17.48,False,False
01-12-2025 11:00,TTKOM,55.95,56.5,55.9,56.4,4733160.0,0.1,0.45,0.01,4400.0,0.45,2012810.1,135.15,0.22,True,59.14,0.01,-0.02,0.03,2025-12-01,55.75,1.17,0,,55.55,56.55,False,False
01-12-2025 11:00,PENGD,8.25,8.36,8.25,8.34,559134.0,0.02,0.09,0.01,1400.0,0.09,287339.3,94.59,0.22,True,53.04,-0.07,-0.08,0.01,2025-12-01,8.15,2.33,1,8.36,8.14,8.36,True,False
01-12-2025 11:00,KTLEV,16.44,17.24,16.36,17.22,13981208.0,0.02,0.78,0.12,539.34,0.78,4802358.5,191.13,0.03,True,75.38,0.21,0.15,0.06,2025-12-01,16.16,6.56,0,,15.65,ATH,False,False
01-12-2025 11:00,TOASO,230.3,232.4,230.0,232.2,657139.0,0.2,1.9,0.22,763.64,1.9,429096.8,53.14,0.11,True,61.59,0.15,0.15,0.0,2025-12-01,229.8,1.04,0,,226.6,233.2,False,False
01-12-2025 11:00,GLRYH,4.26,4.37,4.26,4.34,1764681.0,0.03,0.08,0.01,433.33,0.08,554834.9,218.06,0.38,True,70.54,-0.0,-0.02,0.02,2025-12-01,4.18,3.83,1,4.37,4.09,4.37,False,False
01-12-2025 11:00,MGROS,523.0,528.0,522.0,528.0,353570.0,0.0,5.0,0.45,1011.11,5.0,205971.7,71.66,0.0,True,57.51,-0.38,-0.4,0.02,2025-12-01,521.0,1.34,0,,517.0,530.0,False,False
01-12-2025 11:00,GARAN,139.4,140.8,139.3,140.5,6069669.0,0.3,1.1,0.15,633.33,1.1,3014798.6,101.33,0.27,True,66.2,0.5,0.48,0.03,2025-12-01,138.9,1.15,0,,137.3,ATH,False,False
01-12-2025 10:00,OZRDN,11.98,12.96,11.74,12.76,377377.0,0.2,0.78,0.06,1200.0,0.78,130155.2,189.94,0.26,True,51.58,-0.21,-0.15,-0.07,2025-12-01,11.99,6.42,3,,11.71,14.03,False,False
01-12-2025 10:00,MARTI,2.78,2.86,2.77,2.86,2242830.0,0.0,0.08,0.0,3900.0,0.08,923540.1,142.85,0.0,True,60.96,-0.01,-0.03,0.01,2025-12-01,2.77,3.25,0,,2.75,3.12,True,False
01-12-2025 10:00,MERCN,16.5,17.88,16.4,17.77,4848444.0,0.11,1.27,0.16,688.82,1.27,928892.6,421.96,0.09,True,75.66,-0.05,-0.24,0.19,2025-12-01,16.47,7.89,1,17.88,15.71,17.88,False,False
01-12-2025 10:00,ONCSM,231.9,247.2,230.0,247.0,540915.0,0.2,15.1,1.42,963.38,15.1,149859.6,260.95,0.01,True,66.83,-0.29,-1.65,1.36,2025-12-01,227.0,8.81,0,,220.0,249.0,False,False
01-12-2025 10:00,BJKAS,1.73,1.76,1.72,1.76,6612568.0,0.0,0.03,0.0,1400.0,0.03,1863625.0,254.82,0.0,True,60.02,-0.01,-0.01,0.0,2025-12-01,1.72,2.33,2,1.72,1.72,1.8,True,True
01-12-2025 10:00,BAYRK,23.0,24.72,22.86,24.54,2578899.0,0.18,1.54,0.12,1183.33,1.54,438430.2,488.21,0.12,True,61.85,-0.26,-0.37,0.11,2025-12-01,23.0,6.7,0,,22.78,25.16,True,True
01-12-2025 10:00,BINHO,9.81,10.24,9.78,10.18,9326685.0,0.06,0.37,0.02,1750.0,0.37,2165918.3,330.61,0.16,True,58.56,-0.08,-0.1,0.02,2025-12-01,9.84,3.46,3,,10.04,10.28,True,True
01-12-2025 10:00,ELITE,30.56,31.36,30.46,31.3,330410.0,0.06,0.74,0.04,1581.82,0.74,100373.2,229.18,0.08,True,63.95,-0.16,-0.25,0.09,2025-12-01,30.3,3.3,0,,30.2,31.78,True,False
01-12-2025 10:00,ALTIN,75.25,76.5,75.24,76.48,8810965.0,0.02,1.23,0.16,663.98,1.23,2044215.4,331.02,0.02,True,88.04,0.37,0.2,0.17,2025-12-01,74.62,2.49,0,,73.72,ATH,False,False
01-12-2025 10:00,ARZUM,2.6,2.65,2.59,2.65,2534108.0,0.0,0.05,0.0,1150.0,0.05,914997.1,176.95,0.0,True,56.64,-0.02,-0.02,0.01,2025-12-01,2.59,2.32,1,2.65,2.57,2.76,True,True
01-12-2025 10:00,TCKRC,48.26,51.3,48.02,50.65,954964.0,0.65,2.39,0.14,1644.53,2.39,243069.8,292.88,0.27,True,56.04,-0.6,-0.62,0.03,2025-12-01,48.38,4.69,2,48.02,48.02,53.9,True,True
01-12-2025 10:00,YYLGD,10.0,10.13,10.0,10.1,492674.0,0.03,0.1,0.0,9900.0,0.1,259349.3,89.97,0.3,True,46.37,-0.06,-0.06,0.0,2025-12-01,10.01,0.9,2,10.0,10.0,10.43,True,True
01-12-2025 10:00,YKBNK,35.24,35.96,35.04,35.84,48495015.0,0.12,0.6,0.09,538.3,0.6,18078066.3,168.25,0.2,True,72.22,0.2,0.16,0.04,2025-12-01,35.3,1.53,0,,34.86,ATH,False,False
01-12-2025 10:00,YEOTK,36.06,36.8,36.06,36.72,827053.0,0.08,0.66,0.01,6500.0,0.66,397506.1,108.06,0.12,True,49.73,-0.28,-0.29,0.0,2025-12-01,36.18,1.49,0,,35.98,37.6,True,True
01-12-2025 10:00,XU100,10895.36,10979.42,10870.07,10970.12,1208366500.0,9.3,74.76,7.11,951.62,74.76,437974222.9,175.9,0.12,True,59.29,-3.14,-2.12,-1.02,2025-12-01,10898.7,0.66,2,10870.07,10870.07,11032.53,False,False
01-12-2025 10:00,XU030,11902.11,12000.21,11864.24,11987.41,581355677.0,12.8,85.3,10.15,740.06,85.3,230986182.5,151.68,0.15,True,60.98,7.55,9.33,-1.78,2025-12-01,11911.7,0.64,2,11864.24,11864.24,12043.14,False,False
01-12-2025 10:00,ULUFA,4.01,4.09,4.0,4.08,2786858.0,0.01,0.07,0.0,1650.0,0.07,1234185.5,125.81,0.14,True,57.19,-0.02,-0.03,0.01,2025-12-01,4.01,1.75,0,,3.97,4.12,True,False
01-12-2025 10:00,TUREX,7.58,7.73,7.56,7.72,4206886.0,0.01,0.14,0.01,833.33,0.14,1642343.0,156.15,0.07,True,59.51,-0.04,-0.05,0.02,2025-12-01,7.57,1.98,0,,7.5,7.88,True,False
01-12-2025 10:00,TUKAS,2.56,2.61,2.55,2.6,27687808.0,0.01,0.04,0.0,1900.0,0.04,9624573.3,187.68,0.25,True,54.41,-0.02,-0.02,0.0,2025-12-01,2.54,2.36,0,,2.54,2.64,True,True
01-12-2025 10:00,TUCLK,8.89,9.0,8.87,8.98,437305.0,0.02,0.09,0.01,1400.0,0.09,245694.0,77.99,0.22,True,51.08,-0.04,-0.04,0.0,2025-12-01,8.9,0.9,0,,8.78,9.28,True,True
01-12-2025 10:00,TRCAS,40.48,40.7,39.74,40.7,183486.0,0.0,0.22,0.0,10900.0,0.22,65814.7,178.79,0.0,True,65.27,0.22,0.21,0.01,2025-12-01,40.44,0.64,2,39.74,39.74,40.94,False,False
01-12-2025 10:00,TEKTU,11.48,12.29,11.48,12.18,3303088.0,0.11,0.7,0.12,493.22,0.7,765834.1,331.31,0.16,True,63.55,-0.02,-0.12,0.1,2025-12-01,11.6,5.0,0,,10.85,13.12,False,False
01-12-2025 10:00,TATEN,15.77,16.34,15.77,16.19,1433788.0,0.15,0.42,0.04,1005.26,0.42,341994.0,319.24,0.36,True,63.65,-0.02,-0.05,0.03,2025-12-01,15.72,2.99,1,16.34,15.52,16.34,False,False
01-12-2025 10:00,PRDGS,5.85,6.03,5.82,6.03,780505.0,0.0,0.18,0.01,2900.0,0.18,228019.6,242.3,0.0,True,60.4,-0.04,-0.05,0.01,2025-12-01,5.85,3.08,0,,5.81,6.67,True,True
01-12-2025 10:00,AKSA,10.22,10.33,10.2,10.31,2783116.0,0.02,0.09,0.01,1400.0,0.09,1035540.0,168.76,0.22,True,63.06,-0.02,-0.04,0.03,2025-12-01,10.16,1.48,0,,10.01,10.5,False,False
01-12-2025 10:00,AKYHO,2.9,2.98,2.88,2.97,290969.0,0.01,0.07,0.0,2233.33,0.07,138965.3,109.38,0.14,True,54.74,-0.02,-0.02,0.0,2025-12-01,2.91,2.06,2,2.88,2.88,3.02,True,True
01-12-2025 10:00,ALKA,8.97,9.16,8.91,9.13,1217484.0,0.03,0.16,0.01,1900.0,0.16,395553.7,207.79,0.19,True,53.27,-0.09,-0.11,0.03,2025-12-01,8.9,2.58,0,,8.9,9.56,True,False
01-12-2025 10:00,SELVA,1.73,1.77,1.71,1.77,3024950.0,0.0,0.04,0.0,900.0,0.04,1155108.2,161.88,0.0,True,48.9,-0.02,-0.03,0.0,2025-12-01,1.74,1.72,2,1.71,1.71,2.05,True,True
01-12-2025 10:00,ALKLC,98.15,105.0,98.15,103.3,1006561.0,1.7,5.15,0.27,1807.41,5.15,229389.6,338.8,0.33,True,60.91,-0.81,-1.19,0.37,2025-12-01,97.45,6.0,0,,94.95,105.5,True,True
01-12-2025 10:00,BMSCH,22.52,24.42,22.24,24.26,2704099.0,0.16,1.74,0.14,1108.33,1.74,667460.8,305.13,0.09,True,73.15,0.51,0.36,0.15,2025-12-01,22.22,9.18,0,,20.02,ATH,False,False
01-12-2025 10:00,SASA,2.93,2.96,2.93,2.96,129582276.0,0.0,0.03,0.0,1400.0,0.03,57061276.0,127.09,0.0,True,56.81,-0.01,-0.02,0.01,2025-12-01,2.92,1.37,0,,2.9,2.99,True,False
01-12-2025 10:00,ALTNY,61.25,62.1,61.2,62.05,681294.0,0.05,0.8,0.07,1042.86,0.8,209024.3,225.94,0.06,True,65.47,-0.07,-0.18,0.12,2025-12-01,61.0,1.72,0,,60.65,63.7,True,False
01-12-2025 10:00,REEDR,7.34,7.45,7.3,7.44,5816898.0,0.01,0.1,0.0,9900.0,0.1,2250849.8,158.43,0.1,True,49.17,-0.05,-0.05,0.0,2025-12-01,7.34,1.36,2,7.3,7.3,7.73,False,False
01-12-2025 10:00,QUAGR,3.36,3.68,3.35,3.68,109331780.0,0.0,0.32,0.02,1291.3,0.32,15799207.3,592.01,0.0,True,66.47,-0.04,-0.06,0.02,2025-12-01,3.35,9.85,1,3.68,3.34,4.19,True,True
01-12-2025 10:00,PRKME,16.39,16.59,16.39,16.57,198271.0,0.02,0.18,0.02,757.14,0.18,80542.6,146.17,0.11,True,68.01,0.01,-0.01,0.02,2025-12-01,16.39,1.1,0,,16.2,17.96,False,False
01-12-2025 10:00,MARMR,1.96,2.07,1.96,2.04,72161419.0,0.03,0.08,0.0,2566.67,0.08,17013915.7,324.13,0.37,True,49.8,-0.04,-0.04,0.01,2025-12-01,1.96,4.08,1,2.07,1.95,2.07,True,True
01-12-2025 10:00,BLUME,52.65,55.15,51.9,54.55,1310527.0,0.6,1.9,0.13,1307.41,1.9,223698.4,485.85,0.32,True,71.73,0.69,0.61,0.08,2025-12-01,53.0,2.92,0,,51.7,ATH,False,False
01-12-2025 10:00,HEKTS,3.17,3.23,3.17,3.22,17929704.0,0.01,0.05,0.01,733.33,0.05,6722004.7,166.73,0.2,True,63.62,-0.0,-0.01,0.01,2025-12-01,3.18,1.26,0,,3.15,3.23,False,False
01-12-2025 10:00,HATSN,39.7,40.24,39.66,40.14,87904.0,0.1,0.44,0.02,2650.0,0.44,44899.7,95.78,0.23,True,59.46,-0.08,-0.13,0.04,2025-12-01,39.7,1.11,0,,39.44,40.42,True,False
01-12-2025 10:00,KCAER,10.48,10.62,10.46,10.62,1582101.0,0.0,0.14,0.0,2700.0,0.14,631964.9,150.35,0.0,True,51.26,-0.05,-0.06,0.01,2025-12-01,10.48,1.34,2,10.46,10.46,10.84,True,True
01-12-2025 10:00,KAYSE,17.18,17.35,17.18,17.33,330243.0,0.02,0.15,0.01,1263.64,0.15,113142.0,191.88,0.13,True,54.67,-0.04,-0.05,0.01,2025-12-01,17.18,0.87,0,,17.17,17.48,True,True
01-12-2025 10:00,KAREL,8.79,9.02,8.79,8.96,1090788.0,0.06,0.17,0.01,1207.69,0.17,396128.3,175.36,0.35,True,50.52,-0.08,-0.09,0.01,2025-12-01,8.76,2.28,1,9.02,8.75,9.02,False,False
01-12-2025 10:00,ISMEN,40.0,40.76,40.0,40.74,1623669.0,0.02,0.74,0.07,927.78,0.74,377420.0,330.2,0.03,True,76.82,0.02,-0.03,0.05,2025-12-01,39.94,2.0,0,,39.86,ATH,False,False
01-12-2025 10:00,DENGE,3.09,3.36,3.05,3.34,7045599.0,0.02,0.25,0.01,3471.43,0.25,1371846.8,413.58,0.08,True,49.82,-0.06,-0.06,-0.01,2025-12-01,3.18,5.03,3,,ATL,3.5,True,True
01-12-2025 10:00,DESA,11.07,11.27,11.07,11.22,168226.0,0.05,0.15,0.0,14900.0,0.15,74915.6,124.55,0.33,True,46.72,-0.07,-0.07,0.0,2025-12-01,11.19,0.27,2,11.07,11.07,11.59,False,False
01-12-2025 10:00,IMASM,4.48,4.59,4.46,4.59,5907173.0,0.0,0.11,0.0,3566.67,0.11,2687519.6,119.8,0.0,True,52.36,-0.06,-0.07,0.02,2025-12-01,4.48,2.46,0,,4.4,4.73,True,False
01-12-2025 10:00,IHLAS,3.25,3.32,3.24,3.32,30375142.0,0.0,0.07,0.0,3400.0,0.07,9601577.0,216.36,0.0,True,50.28,-0.04,-0.04,0.01,2025-12-01,3.23,2.79,0,,3.23,3.34,True,True
01-12-2025 10:00,ICBCT,13.45,13.64,13.39,13.59,129149.0,0.05,0.14,0.02,723.53,0.14,62007.2,108.28,0.36,True,58.77,-0.03,-0.04,0.01,2025-12-01,13.37,1.65,0,,13.35,13.7,True,True
01-12-2025 10:00,HKTM,11.76,12.04,11.74,11.97,356388.0,0.07,0.21,0.02,775.0,0.21,141014.4,152.73,0.33,True,59.65,-0.02,-0.04,0.02,2025-12-01,11.72,2.13,0,,11.65,12.5,True,False
01-12-2025 10:00,GSRAY,1.28,1.3,1.27,1.3,42986595.0,0.0,0.02,0.0,1900.0,0.02,16335354.9,163.15,0.0,True,49.95,-0.01,-0.01,0.0,2025-12-01,1.27,2.36,1,1.3,1.26,1.39,True,False
01-12-2025 10:00,CUSAN,22.46,23.94,22.06,23.94,370401.0,0.0,1.48,0.15,913.7,1.48,63823.9,480.35,0.0,True,89.83,0.32,0.09,0.24,2025-12-01,21.78,9.92,0,,20.88,ATH,False,False
01-12-2025 10:00,GSDHO,4.27,4.34,4.27,4.32,639378.0,0.02,0.05,0.0,1150.0,0.05,284605.6,124.65,0.4,True,54.43,-0.01,-0.01,0.0,2025-12-01,4.29,0.7,2,4.27,4.27,4.35,False,False
01-12-2025 10:00,GSDDE,9.26,9.39,9.26,9.37,146435.0,0.02,0.11,0.01,746.15,0.11,66262.5,120.99,0.18,True,50.66,-0.06,-0.08,0.01,2025-12-01,9.23,1.52,0,,9.16,9.88,True,False
01-12-2025 10:00,DURDO,3.55,3.61,3.55,3.61,332691.0,0.0,0.06,0.0,5900.0,0.06,150184.1,121.52,0.0,True,54.31,-0.02,-0.02,0.0,2025-12-01,3.55,1.69,2,3.55,3.55,3.63,True,True
01-12-2025 10:00,GOKNR,20.54,20.78,20.52,20.76,390935.0,0.02,0.22,0.01,2650.0,0.22,200578.0,94.9,0.09,True,52.68,-0.09,-0.1,0.02,2025-12-01,20.54,1.07,0,,20.4,20.84,True,False
01-12-2025 10:00,GESAN,43.18,43.76,43.14,43.72,624960.0,0.04,0.54,0.03,1828.57,0.54,227995.8,174.11,0.07,True,55.92,-0.17,-0.21,0.04,2025-12-01,43.06,1.53,0,,42.98,45.0,True,True
01-12-2025 10:00,FZLGY,11.75,12.17,11.75,12.17,1674533.0,0.0,0.42,0.12,258.97,0.42,829403.1,101.9,0.0,True,65.87,-0.02,-0.11,0.09,2025-12-01,11.77,3.4,0,,10.87,12.51,False,False
01-12-2025 10:00,EDATA,5.26,5.34,5.26,5.33,262771.0,0.01,0.07,0.01,1300.0,0.07,142332.2,84.62,0.14,True,48.22,-0.03,-0.03,0.0,2025-12-01,5.25,1.52,0,,5.25,5.57,False,False
01-12-2025 10:00,EREGL,23.86,24.28,23.86,24.28,49533152.0,0.0,0.42,0.02,1650.0,0.42,16287580.3,204.12,0.0,True,68.72,-0.01,-0.03,0.02,2025-12-01,23.86,1.76,0,,23.74,ATH,False,False
01-12-2025 10:00,EPLAS,5.24,5.35,5.24,5.33,667381.0,0.02,0.09,0.01,1025.0,0.09,203071.1,228.64,0.22,True,57.79,-0.03,-0.04,0.01,2025-12-01,5.22,2.11,0,,5.17,5.67,True,False
01-12-2025 10:00,EGEGY,24.16,24.9,23.9,24.76,294691.0,0.14,0.6,0.07,733.33,0.6,143654.6,105.14,0.23,True,62.3,0.12,0.06,0.05,2025-12-01,24.18,2.4,2,23.9,23.9,25.88,False,False
01-12-2025 10:00,KCHOL,168.5,170.8,167.5,170.6,7029628.0,0.2,2.1,0.15,1300.0,2.1,2898588.3,142.52,0.1,True,60.95,0.02,0.04,-0.02,2025-12-01,168.4,1.31,2,167.5,167.5,171.6,False,False
01-12-2025 10:00,ZOREN,3.25,3.3,3.24,3.29,9118186.0,0.01,0.04,0.0,1900.0,0.04,3489968.5,161.27,0.25,True,52.98,-0.02,-0.02,0.0,2025-12-01,3.24,1.54,0,,3.23,3.32,True,True
01-12-2025 10:00,LIDFA,4.55,4.67,4.55,4.65,2481928.0,0.02,0.1,0.01,1150.0,0.1,679584.6,265.21,0.2,True,63.39,0.02,0.01,0.01,2025-12-01,4.57,1.75,0,,4.5,4.66,False,False
01-12-2025 10:00,CELHA,11.7,12.26,11.7,12.26,5402017.0,0.0,0.56,0.01,4207.69,0.56,3270339.3,65.18,0.0,True,68.42,0.34,0.4,-0.06,2025-12-01,11.15,9.96,0,,10.48,12.54,False,False
01-12-2025 10:00,KNFRT,11.65,12.1,11.57,12.0,483024.0,0.1,0.35,0.04,775.0,0.35,126431.4,282.04,0.29,True,74.95,0.09,0.06,0.03,2025-12-01,11.56,3.81,0,,11.09,12.14,False,False
01-12-2025 10:00,KOPOL,5.57,5.69,5.56,5.69,1418639.0,0.0,0.12,0.0,2300.0,0.12,858917.0,65.17,0.0,True,52.89,-0.03,-0.04,0.0,2025-12-01,5.58,1.97,2,5.56,5.56,5.93,True,True
28-11-2025 17:00,BOBET,18.76,18.83,18.76,18.83,180219.0,0.0,0.07,0.0,1650.0,0.07,98755.7,82.49,0.0,True,58.14,0.0,0.01,-0.0,2025-11-28,18.8,0.16,0,,18.71,18.88,False,False
28-11-2025 17:00,BIGCH,60.65,61.5,60.25,61.4,202791.0,0.1,0.75,0.01,4900.0,0.75,115501.4,75.57,0.13,True,62.66,0.59,0.47,0.12,2025-11-28,61.0,0.66,0,,57.3,61.65,False,False
28-11-2025 17:00,HATEK,19.19,21.22,19.17,21.22,4240118.0,0.0,2.03,0.17,1115.57,2.03,1348326.5,214.47,0.0,True,65.41,-0.23,-0.46,0.23,2025-11-28,19.3,9.95,0,,18.01,25.2,True,False
28-11-2025 17:00,LMKDC,27.6,27.94,27.6,27.86,587457.0,0.08,0.26,0.02,1200.0,0.26,203255.3,189.02,0.31,True,52.2,-0.1,-0.13,0.03,2025-11-28,27.7,0.58,0,,27.52,29.18,True,False
28-11-2025 17:00,CEMTS,10.48,10.8,10.47,10.74,3543865.0,0.06,0.26,0.03,828.57,0.26,789091.6,349.11,0.23,True,65.61,0.07,0.07,0.0,2025-11-28,10.54,1.9,0,,10.08,ATH,False,False
28-11-2025 17:00,MEGMT,41.94,43.8,41.92,43.62,2010347.0,0.18,1.68,0.15,1020.0,1.68,562035.4,257.69,0.11,True,61.42,-0.18,-0.27,0.1,2025-11-28,42.36,2.97,0,,41.44,43.7,True,True
28-11-2025 17:00,SURGY,49.58,52.45,49.06,52.45,1167009.0,0.0,2.87,0.31,811.11,2.87,325591.7,258.43,0.0,True,74.34,0.21,-0.05,0.26,2025-11-28,49.44,6.09,1,52.45,47.52,ATH,False,False
28-11-2025 17:00,AKBNK,64.0,64.9,63.95,64.75,26081468.0,0.15,0.75,0.13,500.0,0.75,9723508.2,168.23,0.2,True,65.49,0.23,0.22,0.01,2025-11-28,63.75,1.57,0,,63.45,ATH,False,False
28-11-2025 17:00,TERA,235.5,259.5,234.5,259.5,8731896.0,0.0,24.0,2.7,788.89,24.0,1547749.8,464.17,0.0,True,66.45,-4.0,-7.57,3.57,2025-11-28,236.0,9.96,0,,220.6,320.5,True,False
28-11-2025 16:00,GENTS,11.02,11.41,11.01,11.4,3097380.0,0.01,0.38,0.05,744.44,0.38,1069853.3,189.51,0.03,True,63.99,0.05,0.05,-0.0,2025-11-28,10.87,4.88,0,,10.84,11.46,False,False
28-11-2025 16:00,PASEU,137.0,140.2,136.9,139.4,659209.0,0.8,2.4,0.37,548.65,2.4,226899.0,190.53,0.33,True,55.55,-0.84,-1.21,0.37,2025-11-28,135.0,3.26,0,,133.6,141.6,True,False
28-11-2025 15:00,YAYLA,32.4,33.58,32.4,33.56,834518.0,0.02,1.16,0.15,694.52,1.16,200380.6,316.47,0.02,True,66.48,0.21,0.25,-0.03,2025-11-28,32.36,3.71,0,,31.5,34.0,False,False
28-11-2025 14:00,YKSLN,5.85,5.9,5.85,5.89,413178.0,0.01,0.04,0.0,1900.0,0.04,220066.5,87.75,0.25,True,54.31,-0.0,-0.01,0.0,2025-11-28,5.84,0.86,0,,5.83,6.0,False,False
28-11-2025 14:00,BORLS,5.39,6.06,5.32,6.05,75154335.0,0.01,0.66,0.06,1078.57,0.66,20118701.6,273.55,0.02,True,48.97,-0.34,-0.41,0.06,2025-11-28,5.76,5.03,0,,5.23,9.8,True,False
28-11-2025 14:00,SAFKR,23.5,24.32,23.46,24.18,1034049.0,0.14,0.68,0.07,930.3,0.68,480453.4,115.22,0.21,True,47.2,-0.51,-0.57,0.06,2025-11-28,23.7,2.03,0,,23.1,26.84,True,True
28-11-2025 11:00,DAPGM,10.24,10.94,10.16,10.94,14417104.0,0.0,0.7,0.01,8650.0,0.7,3109975.0,363.58,0.0,True,47.49,-0.23,-0.24,0.0,2025-11-28,10.65,2.72,0,,10.06,12.14,True,True
28-11-2025 11:00,ALVES,23.62,24.12,23.58,24.04,1346756.0,0.08,0.42,0.03,1515.38,0.42,456029.5,195.32,0.19,True,48.55,-0.24,-0.29,0.06,2025-11-28,23.62,1.78,1,24.12,23.54,24.12,True,True
28-11-2025 11:00,GUBRF,294.75,313.75,288.5,311.0,5607689.0,2.75,16.25,0.7,2221.43,16.25,1075112.2,421.59,0.17,True,40.24,-5.35,-2.72,-2.62,2025-11-28,320.5,-2.96,2,288.5,288.5,337.5,False,False
28-11-2025 11:00,THYAO,272.75,276.5,272.5,275.75,8338805.0,0.75,3.0,0.22,1233.33,3.0,3111305.1,168.02,0.25,True,59.36,0.09,0.18,-0.09,2025-11-28,272.5,1.19,0,,271.5,276.5,False,False
28-11-2025 10:00,GIPTA,60.5,62.75,60.25,62.4,672926.0,0.35,1.9,0.27,603.7,1.9,249469.6,169.74,0.18,True,57.72,-0.63,-1.07,0.45,2025-11-28,60.1,3.83,0,,58.65,77.0,True,False
28-11-2025 10:00,BARMA,27.3,29.28,27.14,29.02,2915549.0,0.26,1.72,0.22,696.3,1.72,1110755.9,162.48,0.15,True,65.36,0.26,0.25,0.01,2025-11-28,27.52,5.45,0,,25.96,30.12,False,False
28-11-2025 10:00,KZBGY,11.5,11.93,11.47,11.83,8456190.0,0.1,0.33,0.05,500.0,0.33,2312015.8,265.75,0.3,True,64.83,0.01,-0.07,0.08,2025-11-28,11.45,3.32,0,,10.66,12.16,False,False
28-11-2025 10:00,AZTEK,4.72,4.99,4.69,4.98,13812690.0,0.01,0.26,0.02,1447.62,0.26,2844412.0,385.61,0.05,True,61.32,0.03,0.05,-0.02,2025-11-28,4.72,5.47,2,4.69,4.69,5.06,False,False
28-11-2025 10:00,OBAMS,6.83,7.12,6.83,7.07,14131328.53,0.05,0.23,0.04,478.51,0.23,5081595.53,178.09,0.23,True,70.51,0.11,0.08,0.03,2025-11-28,6.95,1.73,0,,6.39,ATH,False,False
28-11-2025 10:00,HRKET,68.95,70.5,68.6,70.45,439355.0,0.05,1.5,0.15,867.74,1.5,126855.5,246.34,0.03,True,66.84,0.38,0.28,0.1,2025-11-28,68.6,2.7,0,,67.05,70.95,False,False
27-11-2025 17:00,SMRVA,472.25,495.0,470.0,490.75,1076704.0,4.25,18.5,1.68,1004.48,18.5,208919.3,415.37,0.23,True,86.8,12.69,10.82,1.87,2025-11-27,476.5,2.99,3,,423.5,ATH,False,False
27-11-2025 17:00,TRENJ,78.25,80.4,78.25,80.35,1000904.0,0.05,2.1,0.28,663.64,2.1,390424.9,156.36,0.02,True,68.2,0.59,0.15,0.44,2025-11-27,76.95,4.42,0,,73.9,83.9,False,False
27-11-2025 17:00,PINSU,14.2,14.77,14.08,14.7,6371953.0,0.07,0.5,0.1,420.83,0.5,2111692.9,201.75,0.14,True,78.54,0.48,0.39,0.09,2025-11-27,13.43,9.46,0,,12.12,ATH,False,False
27-11-2025 17:00,AKFIS,21.58,21.76,21.54,21.72,363398.0,0.04,0.14,0.02,677.78,0.14,182254.5,99.39,0.29,True,51.15,-0.06,-0.09,0.02,2025-11-27,21.4,1.5,0,,21.4,22.14,True,False
27-11-2025 17:00,AHGAZ,26.36,26.74,26.34,26.72,699867.0,0.02,0.36,0.02,1400.0,0.36,259010.0,170.21,0.06,True,47.43,-0.21,-0.17,-0.04,2025-11-27,26.4,1.21,0,,26.2,27.94,False,False
27-11-2025 17:00,TRMET,100.6,102.1,100.4,101.9,1375370.0,0.2,1.3,0.06,1900.0,1.3,535680.0,156.75,0.15,True,64.42,0.8,0.46,0.34,2025-11-27,100.4,1.49,0,,95.75,107.4,False,False
27-11-2025 15:00,BMSTL,81.2,94.0,81.2,91.35,6217270.0,2.65,10.15,1.07,848.6,10.15,1972393.6,215.21,0.26,True,48.5,-5.28,-5.91,0.63,2025-11-27,89.7,1.84,0,,80.75,99.65,True,True
27-11-2025 15:00,IHGZT,1.98,2.05,1.97,2.04,21606870.0,0.01,0.06,0.01,445.45,0.06,7444344.5,190.25,0.17,True,64.66,-0.01,-0.02,0.01,2025-11-27,1.9,7.37,1,2.05,1.9,2.05,False,False
27-11-2025 14:00,DARDL,2.24,2.34,2.21,2.34,16835761.0,0.0,0.1,0.01,733.33,0.1,3311010.9,408.48,0.0,True,67.65,-0.01,-0.03,0.01,2025-11-27,2.19,6.85,0,,2.19,2.41,True,False
27-11-2025 12:00,KONTR,31.94,34.32,31.9,34.14,31638512.0,0.18,2.2,0.1,2015.38,2.2,7307766.5,332.94,0.08,True,60.8,-0.04,0.08,-0.12,2025-11-27,32.12,6.29,0,,31.66,36.78,False,False
27-11-2025 12:00,ENJSA,79.15,80.45,79.15,80.25,665922.0,0.2,1.1,0.16,566.67,1.1,193031.3,244.98,0.18,True,69.32,0.34,0.14,0.2,2025-11-27,77.9,3.02,0,,76.9,ATH,False,False
27-11-2025 10:00,HEDEF,49.62,52.25,49.4,51.85,1117148.0,0.4,2.23,0.12,1727.87,2.23,572174.7,95.25,0.18,True,53.39,-0.49,-0.44,-0.05,2025-11-27,49.64,4.45,2,49.4,49.4,59.5,False,False
27-11-2025 10:00,ENDAE,14.61,15.73,14.61,15.43,1637268.0,0.3,0.82,0.02,3804.76,0.82,325808.7,402.52,0.37,True,55.77,-0.13,-0.09,-0.05,2025-11-27,14.56,5.98,0,,14.56,16.1,False,False
27-11-2025 10:00,FROTO,95.45,96.45,95.45,96.45,4305904.0,0.0,1.0,0.09,1076.47,1.0,1347671.8,219.51,0.0,True,69.84,0.35,0.24,0.11,2025-11-27,95.0,1.53,0,,93.05,ATH,False,False
27-11-2025 10:00,KOCMT,2.85,2.89,2.84,2.88,6446235.0,0.01,0.03,0.0,2900.0,0.03,2224934.8,189.73,0.33,True,51.35,-0.0,-0.0,-0.0,2025-11-27,2.84,1.41,1,2.89,2.84,2.89,False,False
26-11-2025 17:00,DSTKF,862.0,920.5,860.5,916.5,1326989.0,4.0,54.5,2.5,2080.0,54.5,257644.4,415.05,0.07,True,77.28,10.11,7.49,2.62,2025-11-26,854.0,7.32,0,,825.0,ATH,False,False
26-11-2025 17:00,GRTHO,234.3,260.0,234.3,259.0,760398.0,1.0,24.7,0.4,6075.0,24.7,174511.8,335.73,0.04,True,45.34,-14.7,-16.15,1.46,2025-11-26,260.25,-0.48,2,234.3,234.3,ATH,True,True
26-11-2025 16:00,FORMT,3.56,3.94,3.56,3.88,26338870.0,0.06,0.32,0.02,1291.3,0.32,5735242.1,359.25,0.19,True,66.55,-0.01,-0.02,0.0,2025-11-26,3.63,6.89,3,,3.56,4.06,False,False
26-11-2025 15:00,VSNMD,91.5,96.0,91.0,95.95,1185925.0,0.05,4.45,0.2,2125.0,4.45,435472.4,172.33,0.01,True,49.24,-2.32,-2.85,0.53,2025-11-26,91.7,4.63,0,,ATL,126.0,True,True
26-11-2025 15:00,EUREN,6.0,6.18,5.99,6.16,5824493.0,0.02,0.16,0.0,3900.0,0.16,2856150.3,103.93,0.12,True,53.86,-0.02,-0.01,-0.01,2025-11-26,6.15,0.16,2,5.99,5.99,6.33,False,False
26-11-2025 13:00,IZFAS,141.0,144.7,140.8,144.7,466323.0,0.0,3.7,0.29,1175.86,3.7,183621.7,153.96,0.0,True,73.29,0.82,0.72,0.1,2025-11-26,140.9,2.7,0,,139.2,ATH,False,False
26-11-2025 13:00,MAGEN,32.44,33.16,32.04,32.98,1393047.0,0.18,0.54,0.01,4400.0,0.54,591276.6,135.6,0.33,True,56.89,0.06,0.13,-0.06,2025-11-26,32.6,1.17,0,,31.0,33.8,False,False
26-11-2025 12:00,FORTE,73.55,77.5,73.45,76.65,938242.0,0.85,3.1,0.15,1900.0,3.1,184342.7,408.97,0.27,True,58.38,-0.45,-0.47,0.02,2025-11-26,73.8,3.86,0,,73.2,77.3,False,False
26-11-2025 12:00,YUNSA,8.53,8.75,8.52,8.69,1914246.0,0.06,0.16,0.02,966.67,0.16,995314.6,92.33,0.38,True,50.09,-0.07,-0.09,0.02,2025-11-26,8.61,0.93,1,8.75,8.48,8.75,True,False
26-11-2025 12:00,AFYON,12.98,13.08,12.98,13.06,585893.0,0.02,0.08,0.01,1042.86,0.08,233589.6,150.82,0.25,True,57.26,-0.01,-0.01,0.01,2025-11-26,12.93,1.01,1,13.08,12.91,13.08,False,False
26-11-2025 10:00,AHSGY,14.46,15.76,14.46,15.58,7038080.44,0.18,1.12,0.12,822.22,1.12,856350.32,721.87,0.16,True,73.62,0.07,-0.01,0.07,2025-11-26,14.32,8.77,1,15.76,14.05,15.76,False,False
26-11-2025 10:00,GEDIK,6.59,6.85,6.56,6.8,2232465.0,0.05,0.21,0.01,1515.38,0.21,771705.6,189.29,0.24,True,64.13,0.04,0.04,-0.0,2025-11-26,6.59,3.19,3,,6.25,6.89,False,False
25-11-2025 15:00,PGSUS,204.3,208.9,203.8,208.4,6231142.0,0.5,4.1,0.13,3053.85,4.1,2401653.6,159.45,0.12,True,62.55,-0.21,-0.21,0.0,2025-11-25,205.0,1.66,0,,202.8,209.1,False,False
25-11-2025 15:00,VESTL,35.16,36.32,35.12,36.02,6976387.0,0.3,0.86,0.11,667.86,0.86,4081254.3,70.94,0.35,True,82.38,0.97,0.87,0.1,2025-11-25,33.92,6.19,1,36.32,33.74,36.32,False,False
25-11-2025 14:00,IZENR,9.7,9.91,9.69,9.86,9639170.0,0.05,0.16,0.03,451.72,0.16,6185872.1,55.83,0.31,True,62.4,0.01,-0.0,0.01,2025-11-25,9.65,2.18,0,,9.28,10.03,False,False
25-11-2025 12:00,TKFEN,69.2,70.0,69.15,69.8,494046.0,0.2,0.6,0.0,11900.0,0.6,303211.8,62.94,0.33,True,38.65,-0.75,-0.7,-0.05,2025-11-25,69.55,0.36,0,,68.65,ATH,False,False
25-11-2025 12:00,VAKFA,17.97,19.1,17.87,19.08,55418332.0,0.02,1.11,0.02,5450.0,1.11,30196532.5,83.53,0.02,True,71.15,0.4,0.46,-0.06,2025-11-25,18.89,1.01,0,,17.01,ATH,False,False
25-11-2025 12:00,EKOS,26.68,27.9,26.66,27.56,911540.0,0.34,0.88,0.04,2344.44,0.88,458354.7,98.87,0.39,True,63.82,0.12,0.1,0.02,2025-11-25,27.0,2.07,0,,26.6,ATH,False,False
25-11-2025 10:00,CEMZY,42.78,45.02,42.2,44.44,2542616.0,0.58,1.66,0.49,240.16,1.66,659116.6,285.76,0.35,True,82.34,1.14,0.74,0.4,2025-11-25,41.9,6.06,0,,ATL,ATH,False,False
25-11-2025 10:00,OFSYM,60.35,63.5,60.35,63.2,435840.0,0.3,2.85,0.27,936.36,2.85,88729.7,391.2,0.11,True,79.18,0.61,0.43,0.17,2025-11-25,60.2,4.98,0,,ATL,ATH,False,False
24-11-2025 17:00,LRSHO,5.36,5.48,5.36,5.47,5402239.0,0.01,0.11,0.03,243.75,0.11,2846611.3,89.78,0.09,True,66.89,0.05,0.03,0.02,2025-11-24,5.17,5.8,0,,5.05,5.49,False,False
24-11-2025 17:00,EGEPO,8.01,8.18,8.0,8.14,1273566.0,0.04,0.13,0.02,584.21,0.13,497929.7,155.77,0.31,True,70.04,0.04,0.02,0.01,2025-11-24,7.97,2.13,1,8.18,7.75,8.18,False,False
24-11-2025 17:00,RALYH,215.8,219.1,215.6,218.7,128665.0,0.4,2.9,0.43,574.42,2.9,62156.7,107.0,0.14,True,73.51,1.76,1.71,0.05,2025-11-24,215.0,1.72,1,219.1,200.5,219.1,False,False
24-11-2025 17:00,NTHOL,49.4,49.9,49.4,49.86,356703.0,0.04,0.46,0.07,521.62,0.46,149235.0,139.02,0.09,True,60.99,0.06,0.02,0.04,2025-11-24,49.48,0.77,1,49.9,ATL,49.9,False,False
24-11-2025 17:00,TURSG,12.35,12.52,12.31,12.52,7297535.0,0.0,0.17,0.02,608.33,0.17,3063934.2,138.18,0.0,True,54.73,-0.03,-0.04,0.02,2025-11-24,12.38,1.13,0,,12.22,12.58,False,False
24-11-2025 15:00,AKENR,11.96,13.43,11.96,13.27,20625450.0,0.16,1.31,0.17,679.76,1.31,9416353.3,119.04,0.12,True,68.44,0.27,0.16,0.12,2025-11-24,11.92,11.33,0,,11.2,ATH,False,False
24-11-2025 15:00,VRGYO,2.97,2.99,2.96,2.99,3306448.0,0.0,0.02,0.0,900.0,0.02,2040021.8,62.08,0.0,True,47.23,-0.0,-0.0,0.0,2025-11-24,2.99,0.0,0,,2.96,3.02,False,False
24-11-2025 15:00,DERHL,14.35,15.37,14.35,15.37,20143102.0,0.0,1.02,0.14,633.81,1.02,2903859.9,593.67,0.0,True,80.75,0.08,-0.02,0.1,2025-11-24,13.98,9.94,0,,13.88,ATH,False,False
24-11-2025 15:00,ISSEN,7.63,8.07,7.63,8.04,680278.0,0.03,0.41,0.04,853.49,0.41,152390.8,346.4,0.07,True,80.58,0.03,-0.0,0.03,2025-11-24,7.59,5.93,0,,7.51,ATH,False,False
24-11-2025 14:00,BNTAS,6.51,6.6,6.46,6.59,735506.0,0.01,0.08,0.01,433.33,0.08,263885.8,178.72,0.12,True,68.1,0.01,-0.0,0.01,2025-11-24,6.45,2.17,0,,6.4,ATH,False,False
24-11-2025 13:00,KLRHO,155.5,166.1,154.5,165.0,465740.0,1.1,9.5,1.1,763.64,9.5,159357.5,192.26,0.12,True,87.5,1.4,0.69,0.71,2025-11-24,154.0,7.14,0,,147.9,ATH,False,False
24-11-2025 13:00,SNICA,4.32,4.4,4.32,4.38,3763058.0,0.02,0.06,0.0,1100.0,0.06,1223128.1,207.66,0.33,True,57.24,-0.01,-0.01,0.0,2025-11-24,4.28,2.34,0,,4.27,4.43,False,False
24-11-2025 12:00,EKSUN,5.7,5.75,5.69,5.74,151342.0,0.01,0.04,0.01,344.44,0.04,100496.3,50.59,0.25,True,58.64,-0.0,-0.0,0.0,2025-11-24,5.71,0.53,0,,5.6,ATH,False,False
24-11-2025 11:00,HUBVC,2.81,2.91,2.8,2.9,1360267.0,0.01,0.09,0.0,2150.0,0.09,455025.7,198.94,0.11,True,51.46,-0.01,-0.01,-0.0,2025-11-24,2.87,1.05,0,,2.78,ATH,False,False
24-11-2025 11:00,KFEIN,9.19,9.29,9.15,9.28,926107.0,0.01,0.09,0.01,1025.0,0.09,342667.2,170.26,0.11,True,60.71,-0.01,-0.01,0.0,2025-11-24,9.15,1.42,0,,9.06,ATH,False,False
24-11-2025 11:00,NATEN,8.45,8.49,8.43,8.49,710085.0,0.0,0.04,0.01,471.43,0.04,387945.1,83.04,0.0,True,62.38,-0.0,-0.01,0.0,2025-11-24,8.43,0.71,0,,8.39,ATH,False,False
24-11-2025 11:00,SERNT,8.65,8.76,8.62,8.74,912337.0,0.02,0.09,0.0,5.0665495807917896e+16,0.09,562803.3,62.11,0.22,True,52.92,-0.02,-0.02,0.0,2025-11-24,8.63,1.27,0,,8.55,ATH,False,False
24-11-2025 10:00,BIOEN,21.0,21.48,20.64,21.4,774928.0,0.08,0.4,0.05,733.33,0.4,160683.0,382.27,0.2,True,75.06,0.08,0.07,0.0,2025-11-24,21.0,1.9,0,,ATL,21.46,False,False
24-11-2025 10:00,YYAPI,2.36,2.47,2.36,2.46,55821878.0,0.01,0.1,0.01,566.67,0.1,19070729.5,192.71,0.1,True,75.6,0.01,-0.0,0.02,2025-11-24,2.34,5.13,0,,2.23,ATH,False,False
24-11-2025 10:00,BALSU,18.51,19.87,18.5,19.59,4589853.0,0.28,1.08,0.14,676.98,1.08,1665755.3,175.54,0.26,True,77.17,0.26,0.15,0.11,2025-11-24,18.5,5.89,1,19.87,17.3,19.87,False,False
24-11-2025 10:00,KBORU,14.81,15.14,14.68,15.13,2802839.0,0.01,0.32,0.04,764.86,0.32,874250.2,220.6,0.03,True,72.96,0.05,0.02,0.03,2025-11-24,14.81,2.16,0,,14.5,ATH,False,False
24-11-2025 10:00,YIGIT,24.78,26.12,24.76,25.82,2999606.0,0.3,1.04,0.14,632.39,1.04,636810.9,371.04,0.29,True,83.64,0.13,0.05,0.08,2025-11-24,24.76,4.28,0,,24.14,ATH,False,False
24-11-2025 10:00,ISKPL,9.47,10.28,9.0,10.15,7707640.0,0.13,0.68,0.09,690.7,0.68,1178300.6,554.13,0.19,True,81.66,0.11,0.04,0.06,2025-11-24,9.31,9.02,2,9.0,9.0,ATH,False,False
24-11-2025 10:00,BVSAN,102.8,109.7,101.8,108.2,657695.0,1.5,5.4,0.26,1976.92,5.4,139132.4,372.71,0.28,True,73.92,0.01,-0.31,0.32,2025-11-24,101.5,6.6,0,,101.0,ATH,False,False
24-11-2025 10:00,DYOBY,13.42,13.67,13.05,13.62,340069.0,0.05,0.2,0.01,2757.14,0.2,136369.0,149.37,0.25,True,49.65,-0.03,-0.01,-0.01,2025-11-24,13.6,0.15,2,13.05,13.05,ATH,False,False
24-11-2025 10:00,HDFGS,3.24,3.56,3.23,3.5,51280747.0,0.06,0.26,0.02,1268.42,0.26,7154813.8,616.73,0.23,True,61.77,-0.01,-0.01,0.0,2025-11-24,3.28,6.71,2,3.23,3.23,ATH,False,False
24-11-2025 10:00,DOGUB,51.8,56.65,51.8,56.4,607732.0,0.25,4.6,0.57,707.02,4.6,198190.5,206.64,0.05,True,57.32,0.65,0.86,-0.21,2025-11-24,57.55,-2.0,2,51.8,51.8,58.0,False,False
24-11-2025 10:00,ETILR,4.05,4.09,4.0,4.08,1105127.0,0.01,0.03,0.01,328.57,0.03,464085.5,138.13,0.33,True,60.54,-0.0,-0.0,0.0,2025-11-24,4.05,0.74,3,,4.0,4.09,False,False
21-11-2025 16:00,SAMAT,6.13,6.25,6.13,6.25,168235.0,0.0,0.12,0.0,3900.0,0.12,91954.3,82.96,0.0,True,57.83,-0.0,-0.0,0.0,2025-11-21,6.23,0.32,1,6.25,6.06,ATH,False,False
21-11-2025 16:00,DURKN,14.26,14.4,14.23,14.4,138272.0,0.0,0.14,0.01,2700.0,0.14,82210.2,68.19,0.0,True,56.05,-0.01,-0.01,-0.0,2025-11-21,14.38,0.14,0,,14.22,ATH,False,False
21-11-2025 14:00,ECILC,103.7,105.9,103.2,105.9,963787.0,0.0,2.2,0.4,450.0,2.2,580136.1,66.13,0.0,True,70.24,0.46,0.29,0.17,2025-11-21,104.0,1.83,0,,ATL,ATH,False,False
21-11-2025 12:00,MEKAG,3.97,4.21,3.96,4.16,6127071.0,0.05,0.19,0.03,533.33,0.19,1230279.9,398.02,0.26,True,78.8,0.02,0.01,0.02,2025-11-21,3.86,7.77,0,,ATL,ATH,False,False
21-11-2025 11:00,CANTE,2.27,2.31,2.26,2.3,125262610.0,0.01,0.03,0.0,2900.0,0.03,64867562.1,93.11,0.33,True,67.73,0.0,-0.0,0.0,2025-11-21,2.24,2.68,1,2.31,2.23,2.31,False,False
21-11-2025 10:00,PAPIL,15.57,16.4,15.51,16.3,12536312.0,0.1,0.73,0.06,1116.67,0.73,1705359.5,635.11,0.14,True,86.17,0.04,0.0,0.03,2025-11-21,15.55,4.82,0,,15.44,ATH,False,False
20-11-2025 17:00,USAK,3.35,3.37,3.34,3.37,6800622.0,0.0,0.02,0.0,900.0,0.02,4351180.2,56.29,0.0,True,51.21,-0.01,-0.01,-0.0,2025-11-20,3.35,0.6,0,,3.33,ATH,False,False
20-11-2025 10:00,ADEL,31.04,33.0,30.52,32.88,1608610.0,0.12,1.84,0.29,534.48,1.84,344478.1,366.97,0.07,True,94.56,0.24,0.09,0.15,2025-11-20,31.04,5.93,0,,ATL,ATH,False,False
