Tarih,Hisse,open,high,low,close,volume,YuksekKapanis_Fark,AcilisKapanis_Fark,AcilisKapanisFark_Ort,AcilisKapanisFark_OrtalamayaGoreDegisim,AcilisKapanisFarkOrt_MaxSon10,HacimOrtalama,%Hacim_HacimOrtalama,Fark_Orani,Kosul,rsi,MACD_12_26_9,MACDs_12_26_9,MACDh_12_26_9,Tarih1,prev_close,%Deg,isPivot,pointpos,destek,direnc,Tsinyal_Banker_Dip,Tsinyal_Banker_DipKarar
24-02-2026 13:00,GEDZA,29.58,30.34,29.44,30.28,394113.0,0.06,0.7,0.19,272.34,0.7,234674.6,67.94,0.09,True,62.65,-0.06,-0.26,0.2,2026-02-24,29.0,4.41,0,,28.3,32.96,False,False
24-02-2026 13:00,ENTRA,11.07,11.38,11.04,11.37,2326751.0,0.01,0.3,0.0,14900.0,0.3,1461242.4,59.23,0.03,True,52.75,-0.08,-0.09,0.01,2026-02-24,11.22,1.34,0,,10.94,11.68,False,False
24-02-2026 13:00,IHEVA,2.39,2.42,2.37,2.42,451056.0,0.0,0.03,0.0,900.0,0.03,197104.2,128.84,0.0,True,59.65,0.0,0.0,0.0,2026-02-24,2.38,1.68,0,,2.25,2.48,False,False
24-02-2026 13:00,EUREN,5.14,5.31,5.13,5.3,19010755.0,0.01,0.16,0.01,1900.0,0.16,6769887.9,180.81,0.06,True,48.69,-0.08,-0.1,0.02,2026-02-24,5.15,2.91,0,,5.18,5.4,True,True
24-02-2026 12:00,PRKME,20.76,21.06,20.76,20.98,318927.0,0.08,0.22,0.03,633.33,0.22,172276.8,85.12,0.36,True,61.41,-0.01,-0.07,0.06,2026-02-24,20.5,2.34,0,,20.16,22.36,False,False
24-02-2026 12:00,KTLEV,37.24,39.22,37.16,38.78,27817270.0,0.44,1.54,0.06,2555.17,1.54,7927448.8,250.9,0.29,True,62.86,0.15,-0.1,0.24,2026-02-24,36.76,5.5,0,,34.62,38.98,False,False
24-02-2026 11:00,AKCNS,216.4,218.0,215.7,217.9,146997.0,0.1,1.5,0.0,5.2776558133247896e+16,1.5,80089.9,83.54,0.07,True,58.0,0.28,0.4,-0.12,2026-02-24,216.0,0.88,0,,214.5,220.9,False,False
24-02-2026 11:00,DSTKF,1434.0,1467.0,1417.0,1460.0,330371.0,7.0,26.0,7.1,266.2,26.0,209987.7,57.33,0.27,True,89.61,68.81,64.18,4.63,2026-02-24,1402.0,4.14,0,,925.0,ATH,False,False
24-02-2026 11:00,XBANK,20415.77,20623.28,20290.38,20599.82,218913064.0,23.46,184.05,17.22,968.82,184.05,133239665.8,64.3,0.13,True,66.13,133.98,95.45,38.53,2026-02-24,20411.53,0.92,0,,19447.51,20889.83,False,False
24-02-2026 11:00,SKYMD,12.59,13.23,12.52,13.13,6355936.0,0.1,0.54,0.07,639.73,0.54,1356260.1,368.64,0.19,True,76.81,0.08,-0.01,0.09,2026-02-24,12.17,7.89,0,,11.91,ATH,False,False
24-02-2026 11:00,AKBNK,90.4,91.75,89.9,91.65,27023370.0,0.1,1.25,0.13,861.54,1.25,13131088.7,105.8,0.08,True,67.22,0.63,0.45,0.18,2026-02-24,90.35,1.44,0,,85.55,92.3,False,False
24-02-2026 11:00,ISCTR,17.29,17.46,17.17,17.43,122387239.0,0.03,0.14,0.04,300.0,0.14,74649630.5,63.95,0.21,True,62.77,0.1,0.05,0.05,2026-02-24,17.3,0.75,0,,16.25,18.03,False,False
24-02-2026 11:00,OZATD,184.0,189.3,183.9,188.8,1121365.0,0.5,4.8,0.49,879.59,4.8,299724.7,274.13,0.1,True,64.81,1.3,1.2,0.11,2026-02-24,183.5,2.89,0,,172.0,ATH,False,False
24-02-2026 11:00,YKBNK,42.98,43.52,42.78,43.46,34075208.0,0.06,0.48,0.04,1042.86,0.48,16525633.2,106.2,0.13,True,63.94,0.36,0.31,0.05,2026-02-24,43.18,0.65,0,,40.66,43.94,False,False
24-02-2026 10:00,SUWEN,8.85,9.4,8.79,9.39,2183288.0,0.01,0.54,0.04,1127.27,0.54,365548.1,497.26,0.02,True,68.43,0.0,-0.03,0.03,2026-02-24,8.8,6.7,0,,8.67,9.54,False,False
24-02-2026 10:00,MANAS,13.45,14.08,13.33,14.08,24078122.0,0.0,0.63,0.06,900.0,0.63,3461681.4,595.56,0.0,True,92.09,0.61,0.49,0.13,2026-02-24,12.8,10.0,0,,10.45,ATH,False,False
24-02-2026 10:00,PNLSN,46.36,48.56,46.06,48.28,2232354.0,0.28,1.92,0.19,921.28,1.92,310257.4,619.52,0.15,True,74.81,0.74,0.39,0.35,2026-02-24,45.0,7.29,0,,41.46,ATH,False,False
24-02-2026 10:00,OBAMS,8.41,8.66,8.29,8.66,12829867.0,0.0,0.25,0.02,1288.89,0.25,4347288.0,195.12,0.0,True,60.69,-0.01,-0.04,0.03,2026-02-24,8.39,3.22,0,,7.64,9.53,False,False
24-02-2026 10:00,PRDGS,7.3,7.63,7.21,7.55,2427188.0,0.08,0.25,0.02,1215.79,0.25,687285.2,253.16,0.32,True,62.09,0.02,-0.0,0.03,2026-02-24,7.3,3.42,0,,6.94,7.56,False,False
24-02-2026 10:00,YEOTK,40.02,41.46,40.0,41.18,2611676.0,0.28,1.16,0.15,694.52,1.16,704006.6,270.97,0.24,True,59.26,0.06,-0.06,0.13,2026-02-24,40.62,1.38,0,,38.1,41.48,False,False
24-02-2026 10:00,ICUGS,3.23,3.47,3.16,3.46,29128696.0,0.01,0.23,0.02,1252.94,0.23,5904161.3,393.36,0.04,True,64.57,0.01,0.0,0.01,2026-02-24,3.22,7.45,0,,3.15,3.59,False,False
24-02-2026 10:00,HUBVC,4.68,4.91,4.67,4.88,2702967.0,0.03,0.2,0.03,525.0,0.2,742264.1,264.15,0.15,True,84.56,0.15,0.12,0.03,2026-02-24,4.67,4.5,0,,4.08,ATH,False,False
24-02-2026 10:00,FZLGY,12.03,12.25,11.95,12.24,1369939.0,0.01,0.21,0.01,2233.33,0.21,830939.1,64.87,0.05,True,50.7,-0.06,-0.07,0.01,2026-02-24,12.04,1.66,0,,11.64,12.62,False,False
24-02-2026 10:00,ESCOM,4.77,4.87,4.65,4.87,63363514.0,0.0,0.1,0.01,900.0,0.1,7985522.1,693.48,0.0,True,91.56,0.19,0.14,0.05,2026-02-24,4.43,9.93,0,,4.03,ATH,False,False
24-02-2026 10:00,ELITE,31.7,32.68,31.54,32.44,723427.0,0.24,0.74,0.02,4011.11,0.74,149210.6,384.84,0.32,True,59.6,-0.04,-0.16,0.11,2026-02-24,31.78,2.08,0,,30.82,32.48,True,False
23-02-2026 17:00,KLMSN,30.3,30.76,30.24,30.68,245005.0,0.08,0.38,0.0,9400.0,0.38,101499.1,141.39,0.21,True,48.43,-0.16,-0.19,0.03,2026-02-23,30.62,0.2,0,,30.18,31.64,True,False
23-02-2026 17:00,ECILC,118.9,124.2,118.4,123.2,1037053.0,1.0,4.3,0.36,1094.44,4.3,331988.9,212.38,0.23,True,60.25,-0.94,-1.56,0.61,2026-02-23,118.6,3.88,0,,117.6,132.2,True,True
23-02-2026 17:00,BOSSA,7.1,7.23,7.09,7.2,1042817.0,0.03,0.1,0.03,257.14,0.1,265074.3,293.41,0.3,True,63.46,0.0,-0.03,0.03,2026-02-23,6.93,3.9,0,,6.85,7.68,False,False
23-02-2026 17:00,DOHOL,20.84,21.16,20.84,21.12,2791311.0,0.04,0.28,0.05,483.33,0.28,1122984.3,148.56,0.14,True,63.35,-0.01,-0.12,0.11,2026-02-23,20.4,3.53,0,,20.06,22.42,False,False
23-02-2026 17:00,AKHAN,26.3,27.06,26.16,26.88,3021348.0,0.18,0.58,0.0,14400.0,0.58,1306355.9,131.28,0.31,True,47.9,-0.27,-0.31,0.04,2026-02-23,26.7,0.67,0,,26.2,27.94,True,True
23-02-2026 16:00,HALKB,49.34,50.25,49.22,50.15,9907849.0,0.1,0.81,0.06,1227.87,0.81,5724502.9,73.08,0.12,True,68.11,0.42,0.25,0.18,2026-02-23,49.1,2.14,0,,46.44,50.45,False,False
23-02-2026 16:00,SILVR,2.73,2.75,2.71,2.75,638531.0,0.0,0.02,0.0,1900.0,0.02,293016.8,117.92,0.0,True,46.7,-0.02,-0.02,0.01,2026-02-23,2.74,0.36,0,,2.69,2.78,True,False
23-02-2026 16:00,MEKAG,5.06,5.21,5.05,5.19,2910461.0,0.02,0.13,0.02,622.22,0.13,1938972.0,50.1,0.15,True,60.08,0.0,-0.02,0.02,2026-02-23,4.93,5.27,0,,4.84,5.49,False,False
23-02-2026 16:00,AFYON,14.49,14.67,14.47,14.62,506599.0,0.05,0.13,0.02,441.67,0.13,231954.7,118.4,0.38,True,55.92,-0.06,-0.11,0.05,2026-02-23,14.33,2.02,0,,14.2,15.33,True,False
23-02-2026 16:00,VAKBN,41.64,42.16,41.56,42.1,5983204.0,0.06,0.46,0.09,389.36,0.46,3383958.2,76.81,0.13,True,67.78,0.24,0.1,0.13,2026-02-23,41.1,2.43,0,,40.06,42.4,False,False
23-02-2026 16:00,HATEK,15.83,16.77,15.71,16.69,2708397.0,0.08,0.86,0.12,599.19,0.86,532709.4,408.42,0.09,True,66.88,0.01,-0.11,0.12,2026-02-23,15.75,5.97,2,15.71,15.71,18.5,False,False
23-02-2026 15:00,TRMET,159.7,163.0,159.6,162.5,1527818.0,0.5,2.8,0.61,359.02,2.8,877294.9,74.15,0.18,True,83.24,2.93,2.53,0.4,2026-02-23,156.0,4.17,0,,150.3,ATH,False,False
23-02-2026 15:00,KCAER,11.36,11.7,11.35,11.66,7318771.0,0.04,0.3,0.02,1100.0,0.3,1923369.7,280.52,0.13,True,62.02,-0.01,-0.08,0.06,2026-02-23,11.34,2.82,1,11.7,10.98,11.7,False,False
23-02-2026 15:00,ULUFA,4.14,4.18,4.12,4.17,1700991.0,0.01,0.03,0.0,650.0,0.03,943223.9,80.34,0.33,True,55.41,-0.01,-0.03,0.02,2026-02-23,4.08,2.21,0,,3.92,4.48,False,False
23-02-2026 14:00,BRSAN,684.0,707.5,683.0,702.5,398586.0,5.0,18.5,2.15,760.47,18.5,191746.4,107.87,0.27,True,60.86,-1.93,-6.12,4.19,2026-02-23,670.0,4.85,0,,661.5,711.0,False,False
23-02-2026 14:00,KLKIM,40.9,41.64,40.86,41.48,358343.0,0.16,0.58,0.06,806.25,0.58,197585.0,81.36,0.28,True,54.77,-0.16,-0.26,0.1,2026-02-23,40.96,1.27,0,,40.24,41.66,False,False
23-02-2026 14:00,LIDFA,3.26,3.32,3.25,3.32,1626028.0,0.0,0.06,0.01,900.0,0.06,916663.0,77.39,0.0,True,68.26,0.02,0.01,0.01,2026-02-23,3.19,4.08,0,,3.09,ATH,False,False
23-02-2026 13:00,TCKRC,89.3,91.4,89.25,91.05,259162.0,0.35,1.75,0.25,586.27,1.75,140376.2,84.62,0.2,True,59.66,-0.09,-0.38,0.29,2026-02-23,89.5,1.73,0,,86.85,91.45,False,False
23-02-2026 12:00,ASTOR,188.5,192.1,187.8,192.0,6945837.0,0.1,3.5,0.66,430.3,3.5,3449868.0,101.34,0.03,True,72.67,1.6,0.86,0.75,2026-02-23,184.5,4.07,0,,180.0,192.2,False,False
23-02-2026 12:00,KRDMA,30.42,30.86,30.38,30.78,1548639.0,0.08,0.36,0.04,800.0,0.36,913865.0,69.46,0.22,True,69.33,0.25,0.12,0.14,2026-02-23,30.1,2.26,0,,28.34,31.1,False,False
23-02-2026 12:00,DCTTR,8.58,8.93,8.57,8.91,3750663.0,0.02,0.33,0.01,2257.14,0.33,1134197.9,230.69,0.06,True,58.37,-0.01,-0.04,0.03,2026-02-23,8.64,3.12,1,8.93,8.42,8.93,True,False
23-02-2026 11:00,AKFYE,18.92,19.32,18.92,19.25,2376554.0,0.07,0.33,0.1,236.73,0.33,721535.7,229.37,0.21,True,60.22,-0.18,-0.32,0.14,2026-02-23,18.55,3.77,1,19.32,18.16,19.32,True,False
23-02-2026 11:00,RYSAS,18.35,18.72,18.35,18.7,1034704.0,0.02,0.35,0.04,775.0,0.35,326294.3,217.11,0.06,True,58.84,-0.16,-0.23,0.07,2026-02-23,17.97,4.06,0,,17.9,19.7,True,False
23-02-2026 11:00,BESLR,15.75,15.94,15.68,15.91,941672.0,0.03,0.16,0.05,233.33,0.16,494907.2,90.27,0.19,True,64.2,-0.01,-0.1,0.09,2026-02-23,15.29,4.05,0,,14.91,16.68,False,False
23-02-2026 11:00,AGHOL,35.1,35.66,35.02,35.66,695370.0,0.0,0.56,0.1,449.02,0.56,347020.3,100.38,0.0,True,62.98,-0.09,-0.24,0.15,2026-02-23,35.0,1.89,0,,34.18,36.64,False,False
23-02-2026 11:00,EREGL,30.32,30.68,30.32,30.6,28094834.0,0.08,0.28,0.02,1650.0,0.28,18438132.0,52.37,0.29,True,65.9,0.18,0.07,0.11,2026-02-23,30.06,1.8,0,,29.12,30.86,False,False
23-02-2026 11:00,NETCD,104.9,111.5,104.8,109.7,7330398.0,1.8,4.8,0.54,788.89,4.8,3751417.5,95.4,0.37,True,61.42,1.43,0.68,0.75,2026-02-23,106.0,3.49,1,111.5,97.65,111.5,False,False
23-02-2026 11:00,ARTMS,38.58,39.38,38.46,39.18,199459.0,0.2,0.6,0.03,2207.69,0.6,124100.8,60.72,0.33,True,46.16,-0.49,-0.6,0.11,2026-02-23,38.64,1.4,0,,38.04,40.0,True,False
23-02-2026 11:00,SISE,46.5,47.2,46.44,47.1,16324898.0,0.1,0.6,0.08,650.0,0.6,9171431.5,78.0,0.17,True,64.24,-0.14,-0.42,0.29,2026-02-23,46.0,2.39,0,,44.5,50.9,False,False
23-02-2026 11:00,KRTEK,28.36,29.12,28.3,29.02,235192.0,0.1,0.66,0.08,746.15,0.66,87958.0,167.39,0.15,True,61.2,-0.24,-0.36,0.11,2026-02-23,27.74,4.61,0,,27.58,31.0,True,False
23-02-2026 10:00,HEKTS,3.34,3.38,3.34,3.37,30188604.0,0.01,0.03,0.01,500.0,0.03,14744911.0,104.74,0.33,True,53.96,-0.03,-0.04,0.01,2026-02-23,3.3,2.12,1,3.38,3.23,3.38,True,False
23-02-2026 10:00,GOZDE,26.3,27.1,26.3,27.04,614855.0,0.06,0.74,0.11,560.71,0.74,346815.1,77.29,0.08,True,62.24,-0.26,-0.43,0.17,2026-02-23,26.04,3.84,0,,25.34,28.72,True,False
23-02-2026 10:00,DZGYO,9.38,9.8,9.38,9.75,2307336.0,0.05,0.37,0.04,825.0,0.37,426755.5,440.67,0.14,True,63.06,-0.08,-0.13,0.05,2026-02-23,9.3,4.84,1,9.8,9.0,9.8,False,False
23-02-2026 10:00,ECOGR,24.52,25.26,24.52,25.06,2984997.0,0.2,0.54,0.08,610.53,0.54,712686.1,318.84,0.37,True,64.57,-0.09,-0.2,0.11,2026-02-23,24.4,2.7,1,25.26,24.0,25.26,True,False
23-02-2026 10:00,GZNMI,60.35,65.0,60.3,64.05,2233651.0,0.95,3.7,0.15,2366.67,3.7,438263.3,409.66,0.26,True,55.34,-1.01,-1.18,0.17,2026-02-23,60.45,5.96,0,,60.2,68.45,True,True
23-02-2026 10:00,GSRAY,1.3,1.35,1.29,1.34,283767050.0,0.01,0.04,0.01,471.43,0.04,90177763.0,214.68,0.25,True,63.93,0.02,0.02,0.0,2026-02-23,1.34,0.0,1,1.35,1.24,1.35,False,False
23-02-2026 10:00,ENJSA,107.8,109.9,107.7,109.6,1033237.0,0.3,1.8,0.21,757.14,1.8,237657.3,334.76,0.17,True,56.55,-0.65,-0.9,0.25,2026-02-23,107.5,1.95,0,,106.1,114.6,True,False
23-02-2026 10:00,GOODY,15.74,16.0,15.74,15.95,312706.0,0.05,0.21,0.02,1005.26,0.21,89929.6,247.72,0.24,True,58.12,-0.12,-0.18,0.06,2026-02-23,15.61,2.18,0,,15.4,16.78,True,False
23-02-2026 10:00,GEREL,23.32,24.58,23.14,24.58,2839208.0,0.0,1.26,0.11,1025.0,1.26,732518.0,287.6,0.0,True,64.74,-0.25,-0.47,0.22,2026-02-23,22.36,9.93,0,,22.12,25.7,True,False
23-02-2026 10:00,SMRTG,7.81,7.95,7.81,7.91,2403033.0,0.04,0.1,0.01,809.09,0.1,766448.8,213.53,0.4,True,51.9,-0.09,-0.13,0.04,2026-02-23,7.74,2.2,1,7.95,7.66,7.95,True,False
23-02-2026 10:00,SANFM,7.25,7.35,7.21,7.33,2613403.0,0.02,0.08,0.02,370.59,0.08,728992.4,258.5,0.25,True,64.66,-0.02,-0.08,0.05,2026-02-23,7.12,2.95,1,7.35,6.87,7.35,True,False
23-02-2026 10:00,EPLAS,6.51,6.66,6.51,6.63,1518944.0,0.03,0.12,0.02,605.88,0.12,511745.2,196.82,0.25,True,55.1,-0.08,-0.12,0.04,2026-02-23,6.42,3.27,0,,6.29,7.29,True,False
23-02-2026 10:00,ERCB,59.55,61.0,59.55,60.7,573985.0,0.3,1.15,0.07,1542.86,1.15,147297.3,289.68,0.26,True,55.2,-0.69,-0.96,0.28,2026-02-23,58.95,2.97,0,,58.3,65.2,True,False
23-02-2026 10:00,TUPRS,223.4,227.2,223.3,226.2,8447265.0,1.0,2.8,0.44,536.36,2.8,3047816.4,177.16,0.36,True,66.27,0.1,-0.36,0.46,2026-02-23,221.6,2.08,0,,217.5,229.8,False,False
23-02-2026 10:00,FENER,3.33,3.44,3.29,3.41,202171688.0,0.03,0.08,0.01,566.67,0.08,30918994.3,553.88,0.37,True,75.46,-0.0,-0.03,0.03,2026-02-23,3.15,8.25,0,,3.09,ATH,False,False
23-02-2026 10:00,HDFGS,3.48,3.63,3.45,3.63,25326196.0,0.0,0.15,0.02,837.5,0.15,7087890.3,257.32,0.0,True,75.67,0.02,-0.02,0.04,2026-02-23,3.3,10.0,1,3.63,3.21,3.69,False,False
23-02-2026 10:00,MOGAN,10.68,11.13,10.67,11.06,11942043.0,0.07,0.38,0.03,1307.41,0.38,4812288.7,148.16,0.18,True,63.97,0.02,-0.01,0.03,2026-02-23,10.52,5.13,0,,10.2,11.34,False,False
23-02-2026 10:00,RTALB,4.25,4.32,4.2,4.32,62752385.0,0.0,0.07,0.01,677.78,0.07,8034324.0,681.05,0.0,True,74.97,-0.01,-0.06,0.05,2026-02-23,3.93,9.92,1,4.32,3.85,4.5,True,False
23-02-2026 10:00,HURGZ,5.43,5.56,5.42,5.54,673914.0,0.02,0.11,0.01,900.0,0.11,342802.8,96.59,0.18,True,63.35,-0.01,-0.04,0.03,2026-02-23,5.42,2.21,1,5.56,5.24,5.56,False,False
23-02-2026 10:00,MERKO,16.53,16.92,16.48,16.9,1819966.0,0.02,0.37,0.04,873.68,0.37,953516.9,90.87,0.05,True,51.44,-0.28,-0.36,0.08,2026-02-23,16.48,2.55,0,,15.75,18.43,True,False
23-02-2026 10:00,MERIT,16.77,17.72,16.76,17.69,2248285.0,0.03,0.92,0.1,848.45,0.92,661874.5,239.68,0.03,True,65.04,-0.23,-0.38,0.14,2026-02-23,16.63,6.37,0,,16.3,18.99,True,False
23-02-2026 10:00,MARBL,12.95,13.25,12.95,13.21,712167.0,0.04,0.26,0.02,1200.0,0.26,215231.1,230.88,0.15,True,55.58,-0.15,-0.22,0.07,2026-02-23,12.85,2.8,1,13.25,12.65,13.25,True,False
23-02-2026 10:00,ODAS,5.83,5.95,5.83,5.92,12710394.0,0.03,0.09,0.0,2150.0,0.09,5916037.7,114.85,0.33,True,52.62,-0.08,-0.11,0.03,2026-02-23,5.75,2.96,0,,5.64,6.57,True,False
23-02-2026 10:00,PENGD,9.47,9.8,9.44,9.71,1810325.0,0.09,0.24,0.0,7900.0,0.24,589150.7,207.28,0.37,True,51.13,-0.08,-0.07,-0.01,2026-02-23,9.48,2.43,0,,9.4,10.74,False,False
23-02-2026 10:00,TDGYO,19.33,20.72,19.03,20.42,2180933.0,0.3,1.09,0.02,4441.67,1.09,838991.5,159.95,0.28,True,35.26,-1.43,-1.57,0.14,2026-02-23,19.7,3.65,2,19.03,19.03,30.04,True,True
23-02-2026 10:00,MAGEN,45.26,46.06,45.14,45.98,1125994.0,0.08,0.72,0.11,566.67,0.72,748947.6,50.34,0.11,True,61.97,-0.06,-0.16,0.1,2026-02-23,45.22,1.68,0,,44.26,46.98,False,False
23-02-2026 10:00,LOGO,153.3,155.7,153.3,155.2,239283.0,0.5,1.9,0.02,9400.0,1.9,105247.2,127.35,0.26,True,54.87,-1.15,-1.56,0.41,2026-02-23,151.9,2.17,1,155.7,149.9,155.7,True,False
23-02-2026 10:00,LILAK,33.18,33.9,32.92,33.9,4145622.0,0.0,0.72,0.04,1614.29,0.72,965317.7,329.46,0.0,True,65.94,-0.12,-0.35,0.23,2026-02-23,32.2,5.28,0,,31.46,35.72,True,False
23-02-2026 10:00,PENTA,14.68,15.46,14.68,15.37,2774123.0,0.09,0.69,0.06,1110.53,0.69,523081.9,430.34,0.13,True,65.06,-0.1,-0.17,0.07,2026-02-23,14.6,5.27,0,,14.4,16.75,True,True
23-02-2026 10:00,KRONT,15.77,16.24,15.66,16.2,485972.0,0.04,0.43,0.04,923.81,0.43,142294.8,241.52,0.09,True,59.44,-0.07,-0.13,0.05,2026-02-23,15.72,3.05,0,,15.47,16.83,True,False
23-02-2026 10:00,PETKM,17.57,18.11,17.57,18.01,30092236.0,0.1,0.44,0.03,1319.35,0.44,7251100.4,315.0,0.23,True,56.7,-0.26,-0.37,0.1,2026-02-23,17.39,3.57,1,18.11,17.12,18.11,True,False
23-02-2026 10:00,TERA,235.0,255.0,234.4,250.75,3925233.0,4.25,15.75,1.67,840.3,15.75,1184605.5,231.35,0.27,True,83.21,2.25,0.93,1.32,2026-02-23,232.2,7.99,0,,226.4,ATH,False,False
23-02-2026 10:00,KLRHO,440.5,470.0,440.25,468.0,938052.0,2.0,27.5,0.2,13650.0,27.5,397021.0,136.27,0.07,True,50.29,-13.82,-14.73,0.92,2026-02-23,439.5,6.48,0,,430.0,482.75,True,True
23-02-2026 10:00,PLTUR,23.8,24.16,23.78,24.1,557780.0,0.06,0.3,0.07,341.18,0.3,270415.8,106.27,0.2,True,58.8,-0.12,-0.26,0.14,2026-02-23,23.46,2.73,0,,22.88,25.94,True,False
23-02-2026 10:00,TKNSA,22.62,23.08,22.6,23.0,1086505.0,0.08,0.38,0.01,4650.0,0.38,457445.8,137.52,0.21,True,42.97,-0.56,-0.65,0.09,2026-02-23,22.42,2.59,0,,22.2,26.46,True,True
23-02-2026 10:00,ISSEN,7.67,7.8,7.65,7.78,153162.0,0.02,0.11,0.01,685.71,0.11,92467.1,65.64,0.18,True,56.86,-0.05,-0.08,0.03,2026-02-23,7.67,1.43,1,7.8,7.31,7.8,False,False
23-02-2026 10:00,PNSUT,11.9,12.15,11.87,12.08,576490.0,0.07,0.18,0.01,1900.0,0.18,187082.8,208.15,0.39,True,47.35,-0.12,-0.14,0.02,2026-02-23,11.97,0.92,0,,11.81,12.99,True,True
23-02-2026 10:00,INDES,8.3,8.62,8.29,8.58,1736536.0,0.04,0.28,0.03,775.0,0.28,461184.8,276.54,0.14,True,61.83,-0.06,-0.1,0.04,2026-02-23,8.27,3.75,0,,8.17,9.12,True,False
23-02-2026 10:00,IMASM,4.45,4.58,4.44,4.55,7640682.0,0.03,0.1,0.01,900.0,0.1,2241385.8,240.89,0.3,True,58.19,-0.04,-0.06,0.02,2026-02-23,4.4,3.41,0,,4.35,4.83,True,False
23-02-2026 10:00,IHYAY,1.9,1.94,1.9,1.94,3337674.0,0.0,0.04,0.0,900.0,0.04,995910.5,235.14,0.0,True,59.57,-0.01,-0.02,0.01,2026-02-23,1.88,3.19,1,1.94,1.86,2.01,True,False
23-02-2026 10:00,IHGZT,1.6,1.65,1.6,1.65,17416675.0,0.0,0.05,0.0,1150.0,0.05,3594309.0,384.56,0.0,True,69.31,-0.0,-0.01,0.01,2026-02-23,1.54,7.14,1,1.65,1.52,1.67,False,False
23-02-2026 10:00,MHRGY,3.61,3.68,3.56,3.67,2034879.0,0.01,0.06,0.01,500.0,0.06,634878.6,220.51,0.17,True,58.38,-0.04,-0.07,0.03,2026-02-23,3.55,3.38,1,3.68,3.46,3.68,True,False
23-02-2026 10:00,REEDR,6.69,6.8,6.69,6.78,5136055.0,0.02,0.09,0.01,800.0,0.09,1434205.0,258.11,0.22,True,53.21,-0.06,-0.08,0.02,2026-02-23,6.66,1.8,0,,6.59,7.18,True,False
23-02-2026 10:00,ICBCT,14.21,14.48,14.21,14.42,201924.0,0.06,0.21,0.01,1809.09,0.21,105224.8,91.9,0.29,True,52.81,-0.14,-0.19,0.05,2026-02-23,14.14,1.98,1,14.48,13.88,14.48,True,False
23-02-2026 10:00,KOTON,16.31,16.65,16.31,16.65,850842.0,0.0,0.34,0.03,962.5,0.34,332056.8,156.23,0.0,True,54.66,-0.18,-0.24,0.06,2026-02-23,16.19,2.84,0,,15.93,17.77,True,True
23-02-2026 10:00,GSDHO,4.95,5.02,4.95,5.02,966863.0,0.0,0.07,0.0,3400.0,0.07,422546.6,128.82,0.0,True,51.63,-0.06,-0.08,0.02,2026-02-23,4.9,2.45,1,5.02,4.83,5.48,True,False
23-02-2026 10:00,BUCIM,6.84,6.9,6.84,6.89,2922365.0,0.01,0.05,0.01,400.0,0.05,778036.5,275.61,0.2,True,55.08,-0.05,-0.07,0.02,2026-02-23,6.79,1.47,0,,6.69,7.17,True,False
23-02-2026 10:00,VAKKO,74.2,79.5,74.15,79.5,459211.0,0.0,5.3,0.67,691.04,5.3,129426.4,254.8,0.0,True,74.22,0.61,0.03,0.58,2026-02-23,72.3,9.96,0,,69.0,ATH,False,False
23-02-2026 10:00,ULUUN,7.36,7.6,7.36,7.55,1817875.0,0.05,0.19,0.02,763.64,0.19,479192.4,279.36,0.26,True,62.84,-0.03,-0.07,0.04,2026-02-23,7.34,2.86,1,7.6,7.13,7.6,True,False
23-02-2026 10:00,ALKA,11.94,12.27,11.94,12.26,1861340.0,0.01,0.32,0.03,1130.77,0.32,676236.0,175.25,0.03,True,48.56,-0.26,-0.32,0.06,2026-02-23,11.87,3.29,0,,11.66,13.8,True,False
23-02-2026 10:00,DITAS,47.16,48.38,47.16,48.2,283846.0,0.18,1.04,0.1,900.0,1.04,137855.2,105.9,0.17,True,64.62,0.39,0.3,0.1,2026-02-23,46.9,2.77,0,,44.6,ATH,False,False
23-02-2026 10:00,DMLKT,5.82,5.89,5.81,5.87,5380802.0,0.02,0.05,0.0,1566.67,0.05,1180049.0,355.98,0.4,True,73.6,0.0,-0.0,0.0,2026-02-23,5.8,1.21,1,5.89,5.79,5.89,False,False
23-02-2026 10:00,BULGS,48.2,49.8,48.2,49.62,4864557.0,0.18,1.42,0.07,1988.24,1.42,1113227.0,336.98,0.13,True,59.05,-0.42,-0.67,0.25,2026-02-23,47.54,4.38,0,,46.2,56.7,True,False
23-02-2026 10:00,BTCIM,4.94,5.06,4.94,5.06,33574326.0,0.0,0.12,0.02,471.43,0.12,11163482.3,200.75,0.0,True,61.22,-0.0,-0.02,0.02,2026-02-23,5.0,1.2,0,,4.81,5.13,False,False
23-02-2026 10:00,DARDL,2.26,2.3,2.26,2.29,5380495.0,0.01,0.03,0.0,1400.0,0.03,1933927.4,178.22,0.33,True,46.65,-0.04,-0.05,0.01,2026-02-23,2.24,2.23,1,2.3,2.22,2.3,True,True
23-02-2026 10:00,BRLSM,15.6,16.47,15.58,16.46,2936329.0,0.01,0.86,0.09,911.76,0.86,521580.8,462.97,0.01,True,66.42,-0.15,-0.29,0.14,2026-02-23,15.21,8.22,0,,15.04,18.22,True,False
23-02-2026 10:00,BSOKE,28.8,29.74,28.5,29.58,2487586.0,0.16,0.78,0.04,1850.0,0.78,833597.9,198.42,0.21,True,51.62,-0.3,-0.35,0.05,2026-02-23,28.74,2.92,0,,28.5,29.98,True,True
23-02-2026 10:00,DAPGM,12.16,12.57,12.16,12.5,4630244.0,0.07,0.34,0.03,1072.41,0.34,1361812.2,240.01,0.21,True,53.07,-0.17,-0.22,0.06,2026-02-23,12.17,2.71,0,,11.91,13.84,True,True
23-02-2026 10:00,BIENY,24.14,24.4,24.14,24.34,504328.0,0.06,0.2,0.03,566.67,0.2,189750.8,165.78,0.3,True,46.6,-0.34,-0.45,0.11,2026-02-23,24.0,1.42,1,24.4,23.78,24.4,True,False
23-02-2026 10:00,VRGYO,2.46,2.53,2.46,2.52,3930839.0,0.01,0.06,0.0,2900.0,0.06,1588916.9,147.39,0.17,True,52.69,-0.03,-0.04,0.01,2026-02-23,2.45,2.86,1,2.53,2.44,2.53,True,True
23-02-2026 10:00,ADEL,34.98,36.98,34.98,36.74,1151905.0,0.24,1.76,0.02,7233.33,1.76,307913.8,274.1,0.14,True,54.98,-0.67,-0.83,0.16,2026-02-23,34.76,5.7,1,36.98,34.46,36.98,True,True
23-02-2026 10:00,AYEN,28.38,29.16,28.38,29.1,473075.0,0.06,0.72,0.04,1536.36,0.72,126254.2,274.7,0.08,True,50.0,-0.44,-0.52,0.07,2026-02-23,28.28,2.9,0,,28.02,33.12,True,True
23-02-2026 10:00,AYDEM,26.04,26.56,26.0,26.48,1001141.0,0.08,0.44,0.07,566.67,0.44,422678.6,136.86,0.18,True,59.63,-0.09,-0.2,0.11,2026-02-23,26.0,1.85,0,,25.2,27.32,False,False
20-02-2026 17:00,CONSE,3.55,3.64,3.52,3.62,2613904.0,0.02,0.07,0.01,600.0,0.07,1672373.5,56.3,0.29,True,46.73,-0.06,-0.07,0.01,2026-02-20,3.52,2.84,0,,3.44,3.95,True,False
20-02-2026 17:00,FORTE,90.7,92.75,90.0,92.55,398784.0,0.2,1.85,0.41,351.22,1.85,158782.2,151.15,0.11,True,55.39,-0.94,-1.2,0.26,2026-02-20,88.65,4.4,0,,87.85,97.8,True,False
20-02-2026 17:00,GARAN,155.6,157.4,155.5,157.4,4171873.0,0.0,1.8,0.23,682.61,1.8,2296803.1,81.64,0.0,True,51.29,-1.07,-1.3,0.23,2026-02-20,155.2,1.42,0,,153.8,164.5,True,True
20-02-2026 17:00,POLHO,16.73,17.03,16.73,17.02,740300.0,0.01,0.29,0.03,728.57,0.29,403653.5,83.4,0.03,True,52.96,-0.2,-0.26,0.06,2026-02-20,16.53,2.96,0,,16.36,18.15,True,False
20-02-2026 17:00,MNDTR,6.79,6.95,6.78,6.94,827907.0,0.01,0.15,0.01,1566.67,0.15,233271.6,254.91,0.07,True,58.81,-0.03,-0.04,0.01,2026-02-20,6.82,1.76,0,,6.68,7.1,False,False
20-02-2026 17:00,ISMEN,49.5,50.25,49.32,50.25,1790068.0,0.0,0.75,0.0,74900.0,0.75,1172436.1,52.68,0.0,True,44.58,-0.73,-0.73,-0.0,2026-02-20,50.3,-0.1,0,,48.74,54.0,True,True
20-02-2026 17:00,MOBTL,11.08,11.25,11.06,11.25,1385522.0,0.0,0.17,0.01,1788.89,0.17,805951.2,71.91,0.0,True,60.93,0.0,0.01,-0.01,2026-02-20,11.2,0.45,0,,11.01,11.37,False,False
20-02-2026 17:00,IZENR,9.26,9.84,9.24,9.7,17568822.0,0.14,0.44,0.05,700.0,0.44,4707415.1,273.22,0.32,True,66.15,-0.05,-0.11,0.06,2026-02-20,9.1,6.59,0,,9.05,9.98,True,False
20-02-2026 17:00,PASEU,133.0,137.0,132.8,136.7,2223042.0,0.3,3.7,0.06,6066.67,3.7,624795.4,255.8,0.08,True,58.24,-0.32,-0.75,0.43,2026-02-20,136.9,-0.15,0,,127.5,136.9,False,False
20-02-2026 17:00,HEDEF,88.65,96.75,87.8,95.0,2649655.0,1.75,6.35,0.68,827.01,6.35,570680.8,364.3,0.28,True,76.16,1.79,1.33,0.46,2026-02-20,88.0,7.95,0,,82.9,ATH,False,False
20-02-2026 17:00,KAREL,9.54,9.84,9.54,9.81,4845579.0,0.03,0.27,0.03,694.12,0.27,1147760.9,322.18,0.11,True,53.69,-0.14,-0.17,0.03,2026-02-20,9.36,4.81,0,,9.36,10.68,True,True
20-02-2026 17:00,TRALT,56.0,57.2,55.95,56.95,18626921.0,0.25,0.95,0.17,475.76,0.95,7906094.2,135.6,0.26,True,69.31,0.38,0.24,0.14,2026-02-20,54.8,3.92,0,,54.2,ATH,False,False
20-02-2026 17:00,DUNYH,120.5,124.0,120.1,123.4,370836.0,0.6,2.9,0.79,267.09,2.9,104614.8,254.48,0.21,True,63.55,-0.57,-1.39,0.82,2026-02-20,116.1,6.29,0,,114.6,136.4,True,False
20-02-2026 17:00,ENSRI,31.2,34.3,31.18,34.3,1025951.0,0.0,3.1,0.27,1065.41,3.1,446843.8,129.6,0.0,True,78.63,0.31,0.14,0.17,2026-02-20,31.3,9.58,1,34.3,30.2,ATH,False,False
20-02-2026 17:00,EKOS,6.36,6.65,6.32,6.65,9637143.0,0.0,0.29,0.06,400.0,0.29,4125326.7,133.61,0.0,True,65.8,0.05,0.02,0.03,2026-02-20,6.05,9.92,0,,6.0,6.82,False,False
20-02-2026 17:00,TURSG,12.06,12.2,12.04,12.18,4298933.0,0.02,0.12,0.01,1233.33,0.12,2340112.0,83.71,0.17,True,47.11,-0.13,-0.16,0.03,2026-02-20,12.11,0.58,0,,11.79,12.86,True,False
20-02-2026 16:00,GMTAS,26.02,26.3,25.96,26.28,304576.0,0.02,0.26,0.06,319.35,0.26,175043.9,74.0,0.08,True,59.07,0.01,-0.03,0.04,2026-02-20,25.82,1.78,0,,25.6,26.32,False,False
20-02-2026 16:00,DERHL,13.45,13.93,13.44,13.91,3102326.0,0.02,0.46,0.06,693.1,0.46,651236.8,376.37,0.04,True,65.02,-0.12,-0.18,0.06,2026-02-20,13.29,4.67,0,,13.23,14.42,True,False
20-02-2026 15:00,BOBET,22.1,22.68,22.06,22.52,1000637.0,0.16,0.42,0.02,1650.0,0.42,439987.3,127.42,0.38,True,48.14,-0.31,-0.35,0.04,2026-02-20,21.92,2.74,1,22.68,21.82,22.68,True,True
20-02-2026 15:00,GSDDE,10.01,10.19,10.01,10.16,208546.0,0.03,0.15,0.01,2042.86,0.15,110207.4,89.23,0.2,True,46.57,-0.11,-0.11,0.0,2026-02-20,9.94,2.21,0,,9.91,11.29,False,False
20-02-2026 15:00,FRMPL,33.88,35.06,33.84,35.02,1204521.0,0.04,1.14,0.02,5600.0,1.14,720500.7,67.18,0.04,True,40.73,-0.93,-0.95,0.02,2026-02-20,34.8,0.63,0,,33.76,38.98,True,True
20-02-2026 15:00,MEYSU,12.42,13.59,12.37,13.58,11857625.0,0.01,1.16,0.03,3214.29,1.16,4222534.8,180.82,0.01,True,59.51,-0.18,-0.22,0.03,2026-02-20,12.66,7.27,2,12.37,12.37,14.18,True,True
20-02-2026 15:00,ISFIN,20.26,20.74,20.26,20.72,499455.0,0.02,0.46,0.05,784.62,0.46,328003.5,52.27,0.04,True,52.46,-0.22,-0.25,0.03,2026-02-20,20.22,2.47,0,,19.92,21.68,True,True
20-02-2026 15:00,BLUME,44.16,45.8,44.06,45.66,575165.0,0.14,1.5,0.01,12400.0,1.5,255607.7,125.02,0.09,True,47.43,-0.72,-0.67,-0.06,2026-02-20,45.52,0.31,0,,43.94,49.66,True,True
20-02-2026 14:00,SEKFK,9.63,9.81,9.63,9.76,359336.0,0.05,0.13,0.04,195.45,0.13,179016.1,100.73,0.38,True,60.85,-0.04,-0.07,0.03,2026-02-20,9.32,4.72,0,,9.2,9.99,False,False
20-02-2026 14:00,EGEPO,11.32,12.03,11.3,11.83,2233480.0,0.2,0.51,0.02,2025.0,0.51,418670.5,433.47,0.39,True,61.5,-0.01,-0.04,0.02,2026-02-20,11.3,4.69,1,12.03,11.24,12.03,False,False
20-02-2026 13:00,TEKTU,8.69,9.52,8.66,9.51,21493621.0,0.01,0.82,0.07,1023.29,0.82,2916131.1,637.06,0.01,True,69.86,-0.1,-0.18,0.08,2026-02-20,8.66,9.82,0,,8.62,10.95,True,False
20-02-2026 13:00,ALKLC,261.25,276.75,255.75,274.5,1834531.0,2.25,13.25,1.65,703.03,13.25,316646.7,479.36,0.17,True,77.14,2.4,0.69,1.71,2026-02-20,256.25,7.12,0,,251.25,ATH,False,False
20-02-2026 13:00,LIDER,75.7,76.95,75.2,76.8,196041.0,0.15,1.1,0.2,436.59,1.1,65281.9,200.3,0.14,True,60.17,-0.12,-0.24,0.13,2026-02-20,74.55,3.02,0,,74.5,77.55,False,False
20-02-2026 13:00,VSNMD,90.4,94.05,89.9,94.0,2022763.0,0.05,3.6,0.38,860.0,3.6,575402.5,251.54,0.01,True,57.79,-0.6,-0.71,0.11,2026-02-20,90.2,4.21,0,,89.75,100.2,True,True
20-02-2026 12:00,SDTTR,238.5,251.5,238.4,248.9,1326313.0,2.6,10.4,1.94,436.08,10.4,688009.6,92.78,0.25,True,84.29,9.21,7.63,1.57,2026-02-20,233.3,6.69,1,251.5,199.2,251.5,False,False
20-02-2026 11:00,SKBNK,11.19,11.55,11.16,11.51,10511662.0,0.04,0.32,0.02,1291.3,0.32,4363342.6,140.91,0.13,True,67.83,0.06,0.07,-0.01,2026-02-20,11.12,3.51,0,,10.72,11.53,False,False
20-02-2026 11:00,OZRDN,24.94,27.0,24.44,26.92,437067.0,0.08,1.98,0.17,1064.71,1.98,193308.9,126.1,0.04,True,70.73,0.57,0.48,0.08,2026-02-20,25.18,6.91,0,,22.34,ATH,False,False
20-02-2026 11:00,OBASE,40.92,45.1,40.58,45.1,1310954.0,0.0,4.18,0.37,1023.66,4.18,206371.6,535.24,0.0,True,77.61,0.18,-0.09,0.27,2026-02-20,41.0,10.0,1,45.1,39.9,ATH,False,False
20-02-2026 10:00,ENKAI,99.55,101.0,99.05,100.7,2612322.0,0.3,1.15,0.07,1542.86,1.15,1146656.4,127.82,0.26,True,54.71,-0.32,-0.42,0.09,2026-02-20,99.5,1.21,0,,98.4,103.9,False,False
20-02-2026 10:00,LMKDC,30.1,31.14,30.0,30.9,1626237.0,0.24,0.8,0.02,4900.0,0.8,729045.1,123.06,0.3,True,50.78,-0.43,-0.45,0.02,2026-02-20,30.0,3.0,0,,29.72,32.78,True,True
20-02-2026 10:00,YESIL,1.88,1.99,1.87,1.97,10959016.0,0.02,0.09,0.0,4.0532396646334483e+17,0.09,2420970.1,352.67,0.22,True,52.7,-0.03,-0.03,-0.0,2026-02-20,1.86,5.91,1,1.99,1.86,1.99,True,True
20-02-2026 10:00,IHAAS,68.95,73.75,64.5,73.75,997747.0,0.0,4.8,0.93,418.92,4.8,511909.1,94.91,0.0,True,85.5,3.48,3.24,0.23,2026-02-20,70.4,4.76,2,64.5,64.5,ATH,False,False
20-02-2026 10:00,BLCYT,35.88,36.9,35.88,36.76,147325.0,0.14,0.88,0.05,1660.0,0.88,91615.0,60.81,0.16,True,45.78,-0.61,-0.67,0.06,2026-02-20,36.0,2.11,0,,35.46,38.92,False,False
20-02-2026 10:00,SMART,26.18,28.62,26.04,28.62,3790892.0,0.0,2.44,0.09,2552.17,2.44,823281.7,360.46,0.0,True,52.98,-1.05,-1.13,0.08,2026-02-20,26.02,9.99,1,28.62,26.02,33.32,True,True
20-02-2026 10:00,VBTYZ,21.52,22.42,21.52,22.3,1025234.0,0.12,0.78,0.02,4775.0,0.78,382075.0,168.33,0.15,True,54.6,-0.16,-0.15,-0.01,2026-02-20,21.4,4.21,0,,21.1,22.9,False,False
20-02-2026 10:00,KLSYN,9.15,9.47,9.01,9.38,2623622.0,0.09,0.23,0.03,576.47,0.23,758516.0,245.89,0.39,True,62.53,0.01,-0.02,0.03,2026-02-20,9.12,2.85,1,9.47,8.9,9.47,True,False
20-02-2026 10:00,TATGD,18.09,19.58,18.0,19.39,7843208.0,0.19,1.3,0.12,974.38,1.3,3003293.4,161.15,0.15,True,73.5,0.63,0.65,-0.02,2026-02-20,18.2,6.54,1,19.58,17.56,19.58,False,False
19-02-2026 17:00,EMKEL,20.6,21.58,20.46,21.3,2207631.0,0.28,0.7,0.01,4900.0,0.7,596486.8,270.11,0.4,True,49.92,-0.29,-0.28,-0.01,2026-02-19,21.1,0.95,2,20.46,20.46,22.78,True,True
19-02-2026 17:00,AKSUE,22.4,23.36,22.1,23.3,324108.0,0.06,0.9,0.07,1150.0,0.9,151600.0,113.79,0.07,True,62.99,-0.05,-0.11,0.06,2026-02-19,22.56,3.28,0,,21.82,24.9,False,False
19-02-2026 16:00,GUNDG,309.75,344.5,308.25,344.5,828345.0,0.0,34.75,2.17,1497.7,34.75,171557.3,382.84,0.0,True,70.35,10.21,11.42,-1.21,2026-02-19,313.25,9.98,0,,300.5,351.75,False,False
19-02-2026 13:00,PAPIL,19.32,21.1,19.32,20.84,22185632.0,0.26,1.52,0.06,2614.29,1.52,5952786.8,272.69,0.17,True,65.21,0.16,0.19,-0.02,2026-02-19,20.14,3.48,1,21.1,19.24,21.1,False,False
19-02-2026 12:00,PCILT,25.14,25.98,24.9,25.92,482744.0,0.06,0.78,0.04,1850.0,0.78,241001.2,100.31,0.08,True,59.51,0.09,0.16,-0.07,2026-02-19,25.04,3.51,1,25.98,24.44,25.98,False,False
19-02-2026 10:00,SARKY,37.94,40.4,37.26,40.1,12111506.0,0.3,2.16,0.21,928.57,2.16,2940643.8,311.87,0.14,True,77.58,0.34,0.04,0.3,2026-02-19,37.7,6.37,0,,35.3,42.48,False,False
19-02-2026 10:00,PRKAB,51.05,53.4,50.4,53.0,2555397.0,0.4,1.95,0.1,1952.63,1.95,844967.9,202.43,0.21,True,50.17,-0.76,-0.91,0.15,2026-02-19,51.15,3.62,0,,50.0,54.4,True,True
19-02-2026 10:00,MEGMT,72.1,75.1,72.1,74.55,3288806.0,0.55,2.45,0.61,301.64,2.45,1793211.7,83.4,0.22,True,81.73,1.29,0.87,0.42,2026-02-19,72.2,3.25,0,,66.3,ATH,False,False
19-02-2026 10:00,DURKN,23.36,24.86,23.36,24.62,5693979.0,0.24,1.26,0.04,2763.64,1.26,2345664.9,142.74,0.19,True,60.99,0.32,0.39,-0.07,2026-02-19,23.06,6.76,1,24.86,22.06,24.86,False,False
19-02-2026 10:00,ISKPL,12.12,12.19,11.91,12.17,2675478.0,0.02,0.05,0.0,4900.0,0.05,1430293.1,87.06,0.4,True,54.83,-0.02,-0.01,-0.0,2026-02-19,12.04,1.08,0,,11.98,12.42,True,True
18-02-2026 15:00,ALTIN,82.67,84.01,82.65,83.9,6383137.0,0.11,1.23,0.0,122900.0,1.23,2699098.2,136.49,0.09,True,62.22,-0.06,-0.23,0.17,2026-02-18,82.08,2.22,0,,81.65,ATH,False,False
18-02-2026 15:00,NIBAS,4.94,5.46,4.92,5.38,8985814.0,0.08,0.44,0.02,1660.0,0.44,2787137.0,222.4,0.18,True,67.29,0.04,0.02,0.02,2026-02-18,4.97,8.25,2,4.92,4.92,ATH,False,False
18-02-2026 14:00,EFOR,22.76,23.32,22.5,23.22,2890493.0,0.1,0.46,0.05,784.62,0.46,784049.4,268.66,0.22,True,54.58,0.03,0.03,-0.0,2026-02-18,23.0,0.96,2,22.5,22.5,23.5,False,False
18-02-2026 14:00,KOCMT,2.82,2.98,2.82,2.96,26320353.0,0.02,0.14,0.02,723.53,0.14,6887264.8,282.16,0.14,True,79.94,0.02,0.01,0.01,2026-02-18,2.84,4.23,0,,2.78,ATH,False,False
18-02-2026 14:00,MARMR,2.82,3.02,2.82,3.0,112735751.0,0.02,0.18,0.01,1400.0,0.18,27872167.7,304.47,0.11,True,62.66,-0.01,-0.02,0.01,2026-02-18,2.88,4.17,0,,2.86,3.02,True,True
18-02-2026 14:00,ANSGR,27.88,28.18,27.84,28.16,3147451.0,0.02,0.28,0.03,900.0,0.28,1375604.9,128.8,0.07,True,60.16,0.04,0.04,-0.0,2026-02-18,27.92,0.86,0,,27.86,28.2,False,False
18-02-2026 14:00,DOFRB,89.4,94.7,89.4,94.7,12386451.0,0.0,5.3,0.77,588.31,5.3,2202769.1,462.31,0.0,True,84.22,0.46,-0.21,0.68,2026-02-18,86.1,9.99,0,,85.6,ATH,False,False
18-02-2026 13:00,BNTAS,7.18,7.25,7.18,7.25,2124825.0,0.0,0.07,0.02,366.67,0.07,1195986.6,77.66,0.0,True,76.84,0.06,0.06,0.0,2026-02-18,7.07,2.55,0,,7.02,ATH,False,False
18-02-2026 13:00,DURDO,4.08,4.41,4.08,4.38,14438580.0,0.03,0.3,0.04,733.33,0.3,2304022.8,526.67,0.1,True,80.06,0.05,0.04,0.02,2026-02-18,4.02,8.96,0,,3.86,ATH,False,False
18-02-2026 13:00,OSMEN,9.24,9.45,9.21,9.39,917145.0,0.06,0.15,0.0,14900.0,0.15,336824.8,172.29,0.4,True,67.53,0.11,0.12,-0.01,2026-02-18,9.18,2.29,1,9.45,ATL,9.45,False,False
18-02-2026 12:00,ARFYE,30.24,30.72,30.22,30.68,1740362.0,0.04,0.44,0.08,450.0,0.44,1005277.7,73.12,0.09,True,63.0,0.02,-0.07,0.09,2026-02-18,29.92,2.54,0,,29.6,31.86,False,False
18-02-2026 12:00,KAYSE,5.6,5.85,5.59,5.8,22215342.0,0.05,0.2,0.01,1328.57,0.2,10671100.5,108.18,0.25,True,69.84,0.1,0.1,0.0,2026-02-18,5.5,5.45,0,,5.48,5.97,False,False
18-02-2026 12:00,PETUN,13.35,13.61,13.31,13.54,1143686.0,0.07,0.19,0.03,533.33,0.19,424254.3,169.58,0.37,True,64.51,0.04,0.04,-0.0,2026-02-18,13.32,1.65,0,,13.03,ATH,False,False
18-02-2026 12:00,KZGYO,26.32,26.68,26.22,26.66,267872.0,0.02,0.34,0.04,672.73,0.34,142611.6,87.83,0.06,True,60.78,0.04,0.04,-0.0,2026-02-18,26.42,0.91,0,,26.14,26.98,False,False
18-02-2026 12:00,AVOD,5.15,5.23,5.11,5.21,2193685.0,0.02,0.06,0.0,2900.0,0.06,1115124.9,96.72,0.33,True,58.15,0.0,-0.0,0.0,2026-02-18,5.1,2.16,1,5.23,5.04,5.23,False,False
18-02-2026 12:00,PAHOL,1.7,1.73,1.7,1.73,175946982.0,0.0,0.03,0.0,2900.0,0.03,58884779.6,198.8,0.0,True,60.97,0.0,0.0,0.0,2026-02-18,1.7,1.76,1,1.73,1.69,ATH,False,False
18-02-2026 12:00,METRO,5.81,5.94,5.79,5.94,2460218.0,0.0,0.13,0.02,766.67,0.13,1129920.2,117.73,0.0,True,58.43,-0.01,-0.02,0.01,2026-02-18,5.81,2.24,0,,5.67,6.13,False,False
18-02-2026 11:00,A1YEN,33.4,34.02,33.3,33.92,737701.0,0.1,0.52,0.1,409.8,0.52,344915.3,113.88,0.19,True,75.64,0.38,0.35,0.03,2026-02-18,33.2,2.17,0,,31.14,ATH,False,False
18-02-2026 11:00,GARFA,31.32,32.78,31.18,32.5,1665487.0,0.28,1.18,0.31,278.21,1.18,379223.2,339.18,0.24,True,89.63,0.5,0.27,0.24,2026-02-18,30.04,8.19,0,,29.16,ATH,False,False
18-02-2026 11:00,RUBNS,35.68,37.3,35.6,37.24,774454.0,0.06,1.56,0.14,998.59,1.56,468708.4,65.23,0.04,True,73.75,0.59,0.47,0.12,2026-02-18,35.58,4.67,0,,31.5,ATH,False,False
18-02-2026 11:00,AEFES,21.52,21.74,21.5,21.72,9719028.0,0.02,0.2,0.01,1900.0,0.2,5297879.9,83.45,0.1,True,51.72,-0.0,0.05,-0.06,2026-02-18,21.5,1.02,0,,21.48,22.3,False,False
18-02-2026 11:00,BIMAS,706.0,714.0,704.5,713.0,1551551.0,1.0,7.0,0.3,2233.33,7.0,727215.8,113.35,0.14,True,58.4,-0.64,-0.11,-0.53,2026-02-18,699.0,2.0,0,,691.0,724.5,False,False
18-02-2026 11:00,KCHOL,222.1,225.3,221.9,225.2,8800273.0,0.1,3.1,0.48,545.83,3.1,3207031.4,174.41,0.03,True,62.05,0.44,0.56,-0.11,2026-02-18,220.8,1.99,0,,219.7,229.1,False,False
18-02-2026 11:00,XU030,15789.84,15938.61,15786.81,15907.64,1411147644.0,30.97,117.8,18.56,534.73,117.8,706881159.4,99.63,0.26,True,61.86,26.42,30.41,-3.99,2026-02-18,15616.21,1.87,0,,15622.71,16011.0,False,False
18-02-2026 11:00,SAHOL,110.4,111.9,110.2,111.9,9443546.0,0.0,1.5,0.08,1775.0,1.5,3988987.9,136.74,0.0,True,56.34,0.06,0.25,-0.19,2026-02-18,110.0,1.73,0,,110.0,115.0,False,False
18-02-2026 11:00,BURCE,59.55,62.0,59.3,61.5,214265.0,0.5,1.95,0.31,529.03,1.95,125699.4,70.46,0.26,True,59.02,-0.21,-0.25,0.04,2026-02-18,59.0,4.24,1,62.0,57.7,62.0,False,False
18-02-2026 11:00,DESA,13.14,13.49,13.06,13.4,708035.0,0.09,0.26,0.05,409.8,0.26,198245.9,257.15,0.35,True,85.14,0.19,0.16,0.03,2026-02-18,12.79,4.77,0,,12.67,ATH,False,False
18-02-2026 11:00,ALKIM,19.87,20.02,19.86,19.98,460830.0,0.04,0.11,0.0,5400.0,0.11,235358.5,95.8,0.36,True,56.4,0.01,0.01,-0.0,2026-02-18,19.83,0.76,1,20.02,19.53,20.02,False,False
18-02-2026 11:00,XU100,14372.4,14487.45,14372.4,14459.4,1853040885.0,28.05,87.0,14.21,512.42,87.0,1130850179.2,63.86,0.32,True,64.47,42.03,43.41,-1.38,2026-02-18,14227.29,1.63,0,,14109.21,ATH,False,False
18-02-2026 10:00,MARTI,3.0,3.04,2.98,3.03,4404517.0,0.01,0.03,0.0,650.0,0.03,1451187.5,203.51,0.33,True,58.71,0.01,0.01,-0.0,2026-02-18,3.0,1.0,1,3.04,2.97,3.04,False,False
18-02-2026 10:00,BAYRK,4.92,4.97,4.91,4.96,1266221.0,0.01,0.04,0.0,1233.33,0.04,729043.1,73.68,0.25,True,43.99,-0.02,-0.0,-0.02,2026-02-18,4.99,-0.6,0,,ATL,5.35,False,False
18-02-2026 10:00,MNDRS,16.49,16.61,16.25,16.58,2507193.0,0.03,0.09,0.01,592.31,0.09,465319.4,438.81,0.33,True,82.19,0.17,0.13,0.04,2026-02-18,16.0,3.62,0,,15.42,ATH,False,False
18-02-2026 10:00,MACKO,37.5,40.12,36.94,40.08,5634460.0,0.04,2.58,0.26,900.0,2.58,672948.1,737.28,0.02,True,99.32,1.79,1.66,0.13,2026-02-18,36.86,8.74,0,,33.52,ATH,False,False
18-02-2026 10:00,NTGAZ,12.29,12.44,12.26,12.44,962831.0,0.0,0.15,0.01,2400.0,0.15,391030.6,146.23,0.0,True,61.81,0.1,0.12,-0.02,2026-02-18,12.37,0.57,0,,ATL,12.61,False,False
18-02-2026 10:00,MTRKS,24.08,24.38,23.82,24.34,368586.0,0.04,0.26,0.05,441.67,0.26,191123.9,92.85,0.15,True,75.31,0.25,0.24,0.01,2026-02-18,24.04,1.25,0,,22.48,24.5,False,False
18-02-2026 10:00,KRVGD,3.25,3.32,3.2,3.31,3042950.0,0.01,0.06,0.01,445.45,0.06,1004235.3,203.01,0.17,True,75.87,0.04,0.03,0.01,2026-02-18,3.24,2.16,0,,3.15,ATH,False,False
18-02-2026 10:00,KRDMD,31.72,32.6,31.7,32.44,26481706.0,0.16,0.72,0.05,1340.0,0.72,5489514.2,382.41,0.22,True,63.25,0.08,0.07,0.0,2026-02-18,31.78,2.08,0,,31.4,32.66,False,False
18-02-2026 10:00,ARDYZ,46.04,47.66,45.98,47.26,3542418.0,0.4,1.22,0.02,5445.45,1.22,592869.2,497.5,0.33,True,63.43,-0.09,-0.12,0.04,2026-02-18,44.8,5.49,1,47.66,ATL,47.66,False,False
18-02-2026 10:00,AHGAZ,25.38,25.8,25.22,25.7,1414975.0,0.1,0.32,0.05,566.67,0.32,536703.6,163.64,0.31,True,69.71,0.08,0.03,0.06,2026-02-18,25.28,1.66,0,,24.92,26.06,False,False
18-02-2026 10:00,KMPUR,16.53,16.84,16.47,16.81,874465.0,0.03,0.28,0.05,471.43,0.28,286201.8,205.54,0.11,True,76.14,0.12,0.1,0.02,2026-02-18,16.5,1.88,0,,ATL,ATH,False,False
18-02-2026 10:00,BRKSN,8.9,9.05,8.9,9.05,401254.0,0.0,0.15,0.02,733.33,0.15,234627.4,71.02,0.0,True,48.1,-0.03,-0.02,-0.01,2026-02-18,8.97,0.89,0,,8.7,9.29,False,False
18-02-2026 10:00,CGCAM,39.02,40.28,38.96,40.1,2488255.0,0.18,1.08,0.05,2247.83,1.08,710874.0,250.03,0.17,True,63.16,0.06,0.03,0.04,2026-02-18,38.46,4.26,1,40.28,37.42,40.28,False,False
18-02-2026 10:00,ENERY,9.71,9.92,9.62,9.9,7173496.0,0.02,0.19,0.04,322.22,0.19,2477035.3,189.6,0.11,True,84.02,0.08,0.04,0.04,2026-02-18,9.69,2.17,0,,9.34,ATH,False,False
18-02-2026 10:00,CIMSA,54.5,55.8,54.1,55.55,5259495.0,0.25,1.05,0.05,1809.09,1.05,1197808.0,339.09,0.24,True,67.62,0.25,0.26,-0.02,2026-02-18,53.95,2.97,0,,53.85,55.85,False,False
18-02-2026 10:00,TRENJ,109.5,111.3,109.4,111.2,746201.0,0.1,1.7,0.21,709.52,1.7,245899.3,203.46,0.06,True,64.34,0.38,0.26,0.13,2026-02-18,108.4,2.58,0,,106.9,111.8,False,False
18-02-2026 10:00,OZSUB,20.92,21.38,20.82,21.28,454306.0,0.1,0.36,0.01,5900.0,0.36,205213.1,121.38,0.28,True,54.01,0.03,0.07,-0.04,2026-02-18,20.92,1.72,2,20.82,20.82,21.58,False,False
18-02-2026 10:00,IEYHO,80.3,81.25,80.3,81.2,1234177.0,0.05,0.9,0.08,1025.0,0.9,584629.4,111.1,0.06,True,79.97,0.44,0.37,0.06,2026-02-18,80.0,1.5,0,,78.45,ATH,False,False
18-02-2026 10:00,EKSUN,6.11,6.17,6.05,6.16,1478649.0,0.01,0.05,0.01,733.33,0.05,554455.5,166.68,0.2,True,64.74,0.03,0.04,-0.01,2026-02-18,6.11,0.82,0,,6.06,6.18,False,False
18-02-2026 10:00,AKFIS,31.04,32.78,30.3,32.62,11595332.0,0.16,1.58,0.25,522.05,1.58,2016298.0,475.08,0.1,True,97.0,1.56,1.46,0.1,2026-02-18,30.72,6.18,0,,ATL,ATH,False,False
18-02-2026 10:00,KARSN,11.46,11.87,11.4,11.77,13310925.0,0.1,0.31,0.07,324.66,0.31,5239233.9,154.06,0.32,True,85.3,0.24,0.2,0.04,2026-02-18,11.45,2.79,0,,ATL,ATH,False,False
18-02-2026 10:00,KBORU,18.6,20.96,18.47,20.82,14587330.0,0.14,2.22,0.29,662.89,2.22,3287230.0,343.76,0.06,True,66.72,0.13,0.02,0.11,2026-02-18,19.54,6.55,2,18.47,18.47,ATH,False,False
18-02-2026 10:00,VAKFN,2.24,2.29,2.24,2.29,46262712.0,0.0,0.05,0.01,614.29,0.05,9782400.2,372.92,0.0,True,78.56,0.03,0.02,0.0,2026-02-18,2.23,2.69,0,,2.05,ATH,False,False
17-02-2026 17:00,CEMAS,6.22,6.47,6.2,6.44,17068554.0,0.03,0.22,0.01,1471.43,0.22,5133582.3,232.49,0.14,True,62.92,0.03,0.05,-0.02,2026-02-17,6.28,2.55,1,6.47,6.15,6.47,False,False
17-02-2026 17:00,DMRGD,4.45,4.54,4.44,4.53,8998158.0,0.01,0.08,0.02,400.0,0.08,3441012.7,161.5,0.12,True,73.13,0.05,0.04,0.0,2026-02-17,4.41,2.72,1,4.54,3.98,4.54,False,False
17-02-2026 17:00,ETILR,4.25,4.28,4.21,4.28,1410831.0,0.0,0.03,0.0,2900.0,0.03,541244.0,160.66,0.0,True,61.09,0.01,0.02,-0.0,2026-02-17,4.27,0.23,0,,4.16,4.33,False,False
17-02-2026 17:00,AZTEK,4.87,4.93,4.86,4.92,2162707.0,0.01,0.05,0.0,2400.0,0.05,777475.9,178.17,0.2,True,60.58,0.01,0.02,-0.0,2026-02-17,4.9,0.41,0,,4.72,4.94,False,False
17-02-2026 17:00,YUNSA,10.67,11.2,10.65,11.1,4638490.0,0.1,0.43,0.08,418.07,0.43,1655653.6,180.16,0.23,True,79.78,0.13,0.05,0.08,2026-02-17,10.27,8.08,1,11.2,10.07,11.2,False,False
17-02-2026 17:00,TNZTP,27.98,28.34,27.98,28.3,886722.0,0.04,0.32,0.0,7900.0,0.32,521541.7,70.02,0.12,True,59.31,0.12,0.19,-0.07,2026-02-17,28.2,0.35,0,,ATL,28.84,False,False
17-02-2026 17:00,TATEN,10.25,10.32,10.2,10.32,4529520.0,0.0,0.07,0.01,600.0,0.07,2262040.1,100.24,0.0,True,58.27,0.01,0.0,0.0,2026-02-17,10.16,1.57,0,,10.1,10.39,False,False
17-02-2026 16:00,ULKER,138.1,140.0,137.6,139.5,949820.0,0.5,1.4,0.13,976.92,1.4,542537.5,75.07,0.36,True,60.61,0.23,0.28,-0.05,2026-02-17,138.7,0.58,1,140.0,136.1,140.0,False,False
17-02-2026 16:00,MOPAS,56.45,58.35,56.2,57.9,2038451.0,0.45,1.45,0.03,4733.33,1.45,538549.6,278.51,0.31,True,59.11,-0.29,-0.38,0.09,2026-02-17,55.3,4.7,1,58.35,54.35,58.35,False,False
17-02-2026 16:00,DOAS,242.2,245.1,241.0,244.5,399466.0,0.6,2.3,0.35,557.14,2.3,234447.7,70.39,0.26,True,68.23,1.09,0.99,0.09,2026-02-17,241.9,1.07,0,,239.2,245.0,False,False
17-02-2026 16:00,KRSTL,12.04,12.3,11.98,12.27,1349984.0,0.03,0.23,0.01,3185.71,0.23,708972.6,90.41,0.13,True,55.0,-0.04,-0.02,-0.02,2026-02-17,12.31,-0.32,0,,11.83,12.45,False,False
17-02-2026 15:00,ONRYT,72.5,73.5,72.5,73.4,303836.0,0.1,0.9,0.14,542.86,0.9,136561.4,122.49,0.11,True,64.59,0.02,-0.07,0.09,2026-02-17,72.15,1.73,0,,71.65,73.75,False,False
17-02-2026 15:00,DEVA,78.4,80.1,78.1,80.0,148124.0,0.1,1.6,0.2,680.49,1.6,55178.4,168.45,0.06,True,67.41,0.15,0.06,0.09,2026-02-17,78.0,2.56,0,,77.5,81.75,False,False
17-02-2026 15:00,ANELE,17.14,18.06,17.12,17.9,2296107.0,0.16,0.76,0.11,597.25,0.76,376171.4,510.39,0.21,True,87.21,0.2,0.13,0.07,2026-02-17,16.85,6.23,1,18.06,ATL,18.06,False,False
17-02-2026 15:00,TUREX,8.18,8.29,8.16,8.27,4382199.0,0.02,0.09,0.0,2900.0,0.09,2511066.0,74.52,0.22,True,62.3,0.06,0.07,-0.01,2026-02-17,8.25,0.24,0,,8.07,8.4,False,False
17-02-2026 14:00,HKTM,13.33,13.83,13.31,13.8,1264489.0,0.03,0.47,0.05,859.18,0.47,506339.5,149.73,0.06,True,69.46,0.02,-0.01,0.03,2026-02-17,13.25,4.15,0,,13.19,ATH,False,False
17-02-2026 13:00,PINSU,11.52,11.68,11.5,11.67,864161.0,0.01,0.15,0.01,1263.64,0.15,404217.7,113.79,0.07,True,75.17,0.03,0.02,0.01,2026-02-17,11.47,1.74,0,,11.42,ATH,False,False
17-02-2026 13:00,TURGG,33.1,34.3,32.8,34.22,932466.0,0.08,1.12,0.15,656.76,1.12,321593.3,189.95,0.07,True,74.6,0.63,0.55,0.08,2026-02-17,31.96,7.07,0,,31.5,ATH,False,False
17-02-2026 12:00,ORGE,73.55,76.3,73.5,75.6,566457.0,0.7,2.05,0.25,736.73,2.05,139432.4,306.26,0.34,True,78.68,0.68,0.56,0.12,2026-02-17,73.5,2.86,1,76.3,72.8,76.3,False,False
17-02-2026 12:00,A1CAP,17.51,18.49,17.49,18.23,6889250.0,0.26,0.72,0.14,425.55,0.72,1894096.6,263.72,0.36,True,80.1,0.23,0.12,0.12,2026-02-17,17.25,5.68,1,18.49,16.31,18.49,False,False
17-02-2026 12:00,DOFER,33.76,35.3,33.7,35.16,1266498.0,0.14,1.4,0.23,498.29,1.4,592872.2,113.62,0.1,True,88.5,0.57,0.38,0.19,2026-02-17,33.3,5.59,0,,31.56,ATH,False,False
17-02-2026 12:00,DAGI,6.42,6.48,6.42,6.48,828660.0,0.0,0.06,0.0,1900.0,0.06,430384.0,92.54,0.0,True,54.42,-0.01,-0.01,0.0,2026-02-17,6.43,0.78,1,6.48,6.38,6.55,False,False
17-02-2026 12:00,INFO,4.51,4.74,4.51,4.69,18264629.0,0.05,0.18,0.01,1284.62,0.18,4243474.7,330.42,0.28,True,72.36,0.05,0.04,0.01,2026-02-17,4.5,4.22,1,4.74,4.22,4.74,False,False
17-02-2026 12:00,EGPRO,28.22,29.14,28.1,29.12,972348.0,0.02,0.9,0.02,4900.0,0.9,218785.5,344.43,0.02,True,70.63,0.31,0.3,0.02,2026-02-17,28.08,3.7,0,,27.72,ATH,False,False
17-02-2026 12:00,TUKAS,2.94,3.0,2.94,2.99,35005811.0,0.01,0.05,0.0,2400.0,0.05,16686759.7,109.78,0.2,True,68.03,0.02,0.02,-0.0,2026-02-17,2.96,1.01,2,2.94,2.94,ATH,False,False
17-02-2026 12:00,HUNER,3.56,3.64,3.55,3.64,5009956.0,0.0,0.08,0.01,700.0,0.08,2286789.4,119.08,0.0,True,81.29,0.03,0.03,0.0,2026-02-17,3.54,2.82,0,,ATL,ATH,False,False
17-02-2026 11:00,TEZOL,14.42,14.8,14.42,14.7,1785923.0,0.1,0.28,0.03,833.33,0.28,709494.4,151.72,0.36,True,77.25,0.1,0.05,0.05,2026-02-17,14.32,2.65,1,14.8,14.0,14.8,False,False
17-02-2026 11:00,BEGYO,4.96,5.03,4.96,5.02,6570981.0,0.01,0.06,0.0,1900.0,0.06,2117011.6,210.39,0.17,True,72.7,0.03,0.03,0.0,2026-02-17,4.96,1.21,0,,4.92,ATH,False,False
17-02-2026 11:00,SEKUR,5.05,5.19,4.97,5.17,1112387.0,0.02,0.12,0.0,11900.0,0.12,363999.8,205.6,0.17,True,54.7,0.02,0.02,-0.0,2026-02-17,5.09,1.57,0,,4.8,5.25,False,False
17-02-2026 10:00,KNFRT,12.89,13.06,12.83,13.02,842535.0,0.04,0.13,0.01,1525.0,0.13,458981.3,83.57,0.31,True,58.03,0.01,0.0,0.01,2026-02-17,12.89,1.01,1,13.06,12.75,13.06,False,False
17-02-2026 10:00,YKSLN,3.47,3.56,3.47,3.54,8056735.0,0.02,0.07,0.01,438.46,0.07,2502920.8,221.89,0.29,True,78.96,0.05,0.04,0.01,2026-02-17,3.46,2.31,0,,3.25,ATH,False,False
17-02-2026 10:00,SNICA,4.58,4.64,4.57,4.63,3252352.0,0.01,0.05,0.0,4900.0,0.05,1616190.5,101.24,0.2,True,54.58,-0.01,-0.01,0.0,2026-02-17,4.57,1.31,2,4.57,4.57,4.65,False,False
17-02-2026 10:00,TTKOM,72.4,74.65,72.15,74.6,7713059.0,0.05,2.2,0.05,4300.0,2.2,2357802.9,227.13,0.02,True,74.31,1.05,0.96,0.09,2026-02-17,72.6,2.75,2,72.15,72.15,ATH,False,False
17-02-2026 10:00,SEYKM,5.46,5.61,5.43,5.61,470588.0,0.0,0.15,0.03,383.87,0.15,247008.0,90.52,0.0,True,57.66,0.01,-0.0,0.01,2026-02-17,5.5,2.0,0,,5.3,5.63,False,False
17-02-2026 10:00,ASUZU,69.35,72.25,69.05,71.75,983519.0,0.5,2.4,0.19,1197.3,2.4,182298.8,439.51,0.21,True,85.06,0.99,0.79,0.2,2026-02-17,68.8,4.29,0,,65.9,ATH,False,False
17-02-2026 10:00,HATSN,41.18,41.48,41.0,41.4,552361.0,0.08,0.22,0.03,547.06,0.22,206112.6,167.99,0.36,True,59.59,0.05,0.01,0.04,2026-02-17,41.18,0.53,2,41.0,41.0,41.76,False,False
17-02-2026 10:00,SURGY,66.95,69.8,63.7,69.5,14335435.0,0.3,2.55,0.25,900.0,2.55,1563670.8,816.78,0.12,True,93.38,2.42,1.96,0.46,2026-02-17,64.45,7.84,2,63.7,63.7,ATH,False,False
16-02-2026 17:00,OZYSR,53.6,55.7,53.6,55.7,537205.0,0.0,2.1,0.18,1100.0,2.1,185996.6,188.83,0.0,True,68.0,0.3,0.27,0.02,2026-02-16,53.8,3.53,0,,53.1,ATH,False,False
16-02-2026 17:00,MGROS,691.5,695.0,691.0,694.5,557843.0,0.5,3.0,0.4,650.0,3.0,329399.9,69.35,0.17,True,64.76,4.23,4.08,0.15,2026-02-16,686.5,1.17,0,,663.5,698.5,False,False
16-02-2026 17:00,FRIGO,10.03,10.23,10.0,10.22,8688268.0,0.01,0.19,0.05,265.38,0.19,2869867.2,202.74,0.05,True,84.58,0.14,0.11,0.04,2026-02-16,9.7,5.36,0,,9.37,ATH,False,False
16-02-2026 17:00,GUBRF,540.0,543.5,540.0,542.5,377330.0,1.0,2.5,0.1,2400.0,2.5,243018.7,55.27,0.4,True,48.5,-1.06,-0.25,-0.8,2026-02-16,540.5,0.37,0,,536.0,566.5,False,False
16-02-2026 17:00,SASA,2.74,2.79,2.73,2.78,807889094.0,0.01,0.04,0.0,900.0,0.04,304754535.4,165.1,0.25,True,75.65,0.03,0.03,0.0,2026-02-16,2.7,2.96,1,2.79,ATL,2.79,False,False
16-02-2026 15:00,CWENE,32.7,33.06,32.7,33.0,11433368.0,0.06,0.3,0.06,435.71,0.3,5702396.7,100.5,0.2,True,66.77,0.07,-0.01,0.08,2026-02-16,32.3,2.17,0,,32.06,ATH,False,False
16-02-2026 15:00,ZERGY,19.24,20.28,19.17,20.26,15095752.0,0.02,1.02,0.1,890.29,1.02,6058415.1,149.17,0.02,True,61.34,-0.13,-0.29,0.16,2026-02-16,18.6,8.92,0,,17.47,21.86,True,False
16-02-2026 13:00,CEOEM,23.3,23.76,23.28,23.66,301033.0,0.1,0.36,0.07,414.29,0.36,169783.5,77.3,0.28,True,68.81,0.13,0.08,0.05,2026-02-16,23.06,2.6,0,,22.8,ATH,False,False
16-02-2026 12:00,AKYHO,2.95,2.97,2.91,2.97,663111.0,0.0,0.02,0.0,900.0,0.02,257485.2,157.53,0.0,True,62.95,0.01,0.0,0.0,2026-02-16,2.93,1.37,2,2.91,2.91,ATH,False,False
16-02-2026 12:00,TAVHL,363.0,367.25,362.25,366.5,589792.0,0.75,3.5,0.35,900.0,3.5,287999.0,104.79,0.21,True,62.4,1.73,1.37,0.35,2026-02-16,361.5,1.38,0,,350.25,367.75,False,False
16-02-2026 12:00,ADESE,1.28,1.32,1.26,1.32,459275946.0,0.0,0.04,0.01,400.0,0.04,85864371.2,434.89,0.0,True,83.52,0.01,0.01,0.01,2026-02-16,1.2,10.0,0,,1.2,ATH,False,False
16-02-2026 11:00,TSPOR,1.1,1.13,1.1,1.13,73318975.0,0.0,0.03,0.0,1400.0,0.03,29453382.8,148.93,0.0,True,64.06,0.01,0.01,0.0,2026-02-16,1.11,1.8,2,1.1,1.1,ATH,False,False
16-02-2026 11:00,EGEGY,33.8,34.62,33.8,34.46,635547.0,0.16,0.66,0.09,602.13,0.66,238951.9,165.97,0.24,True,73.69,0.23,0.14,0.09,2026-02-16,33.2,3.8,1,34.62,32.78,34.62,False,False
16-02-2026 11:00,ARENA,28.7,29.04,28.64,29.04,429464.0,0.0,0.34,0.08,304.76,0.34,155509.3,176.17,0.0,True,78.19,0.14,0.09,0.05,2026-02-16,28.36,2.4,0,,27.7,ATH,False,False
16-02-2026 11:00,GLRYH,4.61,4.69,4.61,4.68,3809507.0,0.01,0.07,0.01,366.67,0.07,1253420.9,203.93,0.14,True,64.06,0.01,0.0,0.01,2026-02-16,4.55,2.86,0,,4.53,4.72,False,False
16-02-2026 11:00,HTTBT,46.2,46.88,46.18,46.88,284488.0,0.0,0.68,0.1,566.67,0.68,116776.1,143.62,0.0,True,72.04,0.36,0.32,0.04,2026-02-16,45.88,2.18,0,,44.1,ATH,False,False
16-02-2026 11:00,BORSK,6.71,6.85,6.69,6.84,3162038.0,0.01,0.13,0.03,364.29,0.13,1660342.3,90.44,0.08,True,77.98,0.07,0.04,0.03,2026-02-16,6.61,3.48,0,,ATL,ATH,False,False
16-02-2026 11:00,OTKAR,426.5,433.5,424.5,432.5,1188367.0,1.0,6.0,0.55,990.91,6.0,425199.3,179.48,0.17,True,30.49,-2.27,1.98,-4.25,2026-02-16,469.0,-7.78,2,424.5,424.5,470.75,False,False
16-02-2026 10:00,USAK,1.88,1.92,1.87,1.91,45060209.0,0.01,0.03,0.0,650.0,0.03,26804874.2,68.1,0.33,True,76.29,0.01,0.01,0.0,2026-02-16,1.86,2.69,0,,1.78,ATH,False,False
16-02-2026 10:00,LRSHO,4.16,4.22,4.15,4.21,6159815.0,0.01,0.05,0.01,614.29,0.05,1830809.3,236.45,0.2,True,65.29,0.01,0.01,0.0,2026-02-16,4.15,1.45,0,,4.1,ATH,False,False
16-02-2026 10:00,DGNMO,5.32,5.38,5.27,5.37,985365.0,0.01,0.05,0.0,1566.67,0.05,208708.8,372.12,0.2,True,80.41,0.03,0.02,0.01,2026-02-16,5.24,2.48,0,,ATL,ATH,False,False
16-02-2026 10:00,BAGFS,30.06,30.46,30.06,30.4,458083.0,0.06,0.34,0.02,1316.67,0.34,117690.7,289.23,0.18,True,60.97,-0.01,-0.05,0.04,2026-02-16,29.96,1.47,0,,29.6,30.68,False,False
16-02-2026 10:00,EGSER,3.31,3.35,3.3,3.34,923291.0,0.01,0.03,0.0,900.0,0.03,505322.9,82.71,0.33,True,68.48,0.01,0.01,0.0,2026-02-16,3.3,1.21,0,,3.26,ATH,False,False
16-02-2026 10:00,NATEN,8.52,8.62,8.52,8.61,2839723.0,0.01,0.09,0.01,1400.0,0.09,798540.2,255.61,0.11,True,69.59,0.02,0.01,0.0,2026-02-16,8.48,1.53,0,,8.45,ATH,False,False
16-02-2026 10:00,SMRVA,64.3,66.0,64.3,65.95,1038816.0,0.05,1.65,0.03,5400.0,1.65,288173.4,260.48,0.03,True,62.29,-0.0,-0.12,0.12,2026-02-16,64.2,2.73,0,,63.7,66.35,False,False
16-02-2026 10:00,LKMNH,17.78,18.12,17.76,18.08,710581.0,0.04,0.3,0.06,368.75,0.3,258119.5,175.29,0.13,True,77.57,0.12,0.06,0.06,2026-02-16,17.71,2.09,0,,16.98,ATH,False,False
16-02-2026 10:00,SELVA,2.46,2.52,2.45,2.51,17393095.0,0.01,0.05,0.01,455.56,0.05,7143906.9,143.47,0.2,True,52.42,-0.02,-0.02,0.0,2026-02-16,2.45,2.45,0,,2.42,2.64,True,True
16-02-2026 10:00,AVHOL,40.66,41.3,40.54,41.24,521252.0,0.06,0.58,0.05,974.07,0.58,122839.7,324.34,0.1,True,75.13,0.15,0.08,0.07,2026-02-16,40.36,2.18,0,,39.74,ATH,False,False
16-02-2026 10:00,DENGE,3.07,3.18,3.03,3.15,15438603.0,0.03,0.08,0.0,1900.0,0.08,5568831.0,177.23,0.38,True,75.23,0.06,0.05,0.01,2026-02-16,3.06,2.94,3,,2.76,3.16,False,False
16-02-2026 10:00,SERNT,8.7,8.95,8.7,8.94,2157819.0,0.01,0.24,0.0,4700.0,0.24,832316.6,159.25,0.04,True,65.62,0.02,0.02,0.0,2026-02-16,8.68,3.0,1,8.95,8.63,8.95,False,False
16-02-2026 10:00,ATATP,157.3,161.8,156.0,161.1,369205.0,0.7,3.8,0.41,826.83,3.8,104816.0,252.24,0.18,True,76.19,0.88,0.74,0.14,2026-02-16,157.4,2.35,2,156.0,156.0,ATH,False,False
16-02-2026 10:00,YATAS,46.4,47.7,46.38,47.44,267089.0,0.26,1.04,0.06,1633.33,1.04,92372.4,189.14,0.25,True,67.87,0.11,0.09,0.02,2026-02-16,46.58,1.85,1,47.7,46.36,47.7,False,False
16-02-2026 10:00,EDIP,38.78,42.0,38.74,41.78,1544894.0,0.22,3.0,0.28,963.83,3.0,223395.9,591.55,0.07,True,83.97,0.27,0.07,0.2,2026-02-16,38.32,9.03,0,,38.26,ATH,False,False
16-02-2026 10:00,TCELL,126.0,129.6,125.3,129.0,15653202.0,0.6,3.0,0.35,757.14,3.0,3511744.0,345.74,0.2,True,83.82,1.18,0.99,0.2,2026-02-16,125.3,2.95,1,129.6,ATL,129.6,False,False
16-02-2026 10:00,VESTL,32.88,33.44,32.88,33.3,1347436.0,0.14,0.42,0.0,20900.0,0.42,455403.0,195.88,0.33,True,75.45,0.18,0.14,0.04,2026-02-16,32.5,2.46,0,,32.3,ATH,False,False
16-02-2026 10:00,FADE,16.77,18.0,16.75,17.65,2497133.0,0.35,0.88,0.14,524.11,0.88,463808.6,438.4,0.4,True,85.33,0.24,0.15,0.09,2026-02-16,16.65,6.01,1,18.0,15.82,18.0,False,False
16-02-2026 10:00,SOKE,13.16,13.32,13.16,13.3,397215.0,0.02,0.14,0.01,1455.56,0.14,126495.4,214.02,0.14,True,60.87,0.0,-0.0,0.01,2026-02-16,13.16,1.06,1,13.32,13.1,13.32,False,False
16-02-2026 10:00,GOKNR,22.36,22.64,22.36,22.62,1203819.0,0.02,0.26,0.0,6400.0,0.26,471338.8,155.4,0.08,True,71.43,0.07,0.06,0.01,2026-02-16,22.24,1.71,0,,22.1,22.72,False,False
16-02-2026 10:00,SRVGY,3.51,3.64,3.51,3.62,43604625.0,0.02,0.11,0.01,900.0,0.11,7897007.6,452.17,0.18,True,81.03,0.02,0.01,0.01,2026-02-16,3.48,4.02,0,,3.45,ATH,False,False
16-02-2026 10:00,FLAP,11.1,12.0,11.07,11.9,2458587.0,0.1,0.8,0.17,373.37,0.8,656797.8,274.33,0.12,True,82.26,0.38,0.27,0.11,2026-02-16,11.07,7.5,0,,ATL,ATH,False,False
16-02-2026 10:00,YYLGD,14.09,14.4,14.08,14.38,3018446.0,0.02,0.29,0.02,1605.88,0.29,1276425.8,136.48,0.07,True,66.82,0.04,0.02,0.01,2026-02-16,14.08,2.13,0,,14.0,ATH,False,False
16-02-2026 10:00,YIGIT,26.2,26.82,26.14,26.68,1997953.0,0.14,0.48,0.05,900.0,0.48,433177.6,361.23,0.29,True,80.81,0.13,0.09,0.04,2026-02-16,26.06,2.38,0,,25.74,ATH,False,False
16-02-2026 10:00,TKFEN,83.0,85.0,82.95,84.85,2418826.0,0.15,1.85,0.02,7300.0,1.85,786462.3,207.56,0.08,True,57.63,-0.26,-0.25,-0.02,2026-02-16,82.55,2.79,0,,81.9,87.0,False,False
16-02-2026 10:00,IZMDC,8.19,8.38,8.18,8.33,1503199.0,0.05,0.14,0.0,4566.67,0.14,768505.2,95.6,0.36,True,71.59,0.09,0.09,-0.0,2026-02-16,8.17,1.96,0,,8.09,8.48,False,False
16-02-2026 10:00,INVEO,9.8,10.22,9.8,10.11,4897517.0,0.11,0.31,0.02,1622.22,0.31,1251447.8,291.35,0.35,True,67.1,0.02,0.01,0.01,2026-02-16,9.72,4.01,0,,9.71,10.25,False,False
16-02-2026 10:00,GEDIK,6.35,6.49,6.3,6.48,6710849.0,0.01,0.13,0.0,3150.0,0.13,1259294.5,432.91,0.08,True,66.3,0.01,0.0,0.01,2026-02-16,6.24,3.85,0,,6.22,ATH,False,False
16-02-2026 10:00,BORLS,2.77,2.99,2.76,2.96,30799975.0,0.03,0.19,0.02,955.56,0.19,6468288.0,376.17,0.16,True,80.77,0.03,0.01,0.01,2026-02-16,2.75,7.64,0,,2.67,ATH,False,False
16-02-2026 10:00,ALARK,114.8,116.3,114.8,116.0,2660729.0,0.3,1.2,0.05,2300.0,1.2,771267.0,244.98,0.25,True,71.05,0.57,0.44,0.13,2026-02-16,113.8,1.93,0,,112.8,ATH,False,False
16-02-2026 10:00,TOASO,344.25,349.5,340.0,348.5,1390650.0,1.0,4.25,0.88,385.71,4.25,463044.9,200.33,0.24,True,84.57,5.4,4.18,1.22,2026-02-16,338.5,2.95,1,349.5,ATL,349.5,False,False
16-02-2026 10:00,PGSUS,220.3,226.1,219.9,224.8,19608865.0,1.3,4.5,0.35,1185.71,4.5,4835163.1,305.55,0.29,True,79.59,2.17,1.89,0.28,2026-02-16,218.1,3.07,1,226.1,216.7,226.1,False,False
16-02-2026 10:00,HOROZ,66.75,69.65,66.75,69.35,1509589.0,0.3,2.6,0.4,550.0,2.6,349782.7,331.58,0.12,True,78.09,0.67,0.3,0.37,2026-02-16,65.75,5.48,1,69.65,63.0,69.65,False,False
16-02-2026 10:00,VESBE,8.67,8.79,8.65,8.78,3072805.0,0.01,0.11,0.01,1000.0,0.11,1119089.5,174.58,0.09,True,71.85,0.04,0.03,0.01,2026-02-16,8.59,2.21,0,,8.5,ATH,False,False
13-02-2026 17:00,ZOREN,3.59,3.64,3.58,3.63,32493904.0,0.01,0.04,0.0,1900.0,0.04,7718246.3,321.0,0.25,True,67.94,0.02,0.01,0.01,2026-02-13,3.58,1.4,0,,3.53,ATH,False,False
13-02-2026 17:00,CCOLA,77.5,78.8,77.45,78.65,2723639.0,0.15,1.15,0.08,1433.33,1.15,1150468.8,136.74,0.13,True,70.75,0.52,0.44,0.07,2026-02-13,77.5,1.48,0,,76.25,ATH,False,False
13-02-2026 17:00,GWIND,27.58,27.92,27.48,27.9,1800866.0,0.02,0.32,0.03,900.0,0.32,643691.4,179.77,0.06,True,74.48,0.15,0.12,0.03,2026-02-13,27.52,1.38,0,,ATL,ATH,False,False
13-02-2026 17:00,KRPLS,9.17,9.37,9.13,9.32,1008034.0,0.05,0.15,0.03,476.92,0.15,417059.4,141.7,0.33,True,71.88,0.04,0.02,0.02,2026-02-13,9.02,3.33,0,,9.01,ATH,False,False
13-02-2026 16:00,GENTS,9.92,10.48,9.9,10.39,5111794.0,0.09,0.47,0.01,4600.0,0.47,2016462.8,153.5,0.19,True,53.88,-0.09,-0.09,0.0,2026-02-13,10.32,0.68,0,,9.89,ATH,False,False
13-02-2026 16:00,NTHOL,49.54,50.6,49.54,50.4,593212.0,0.2,0.86,0.16,444.3,0.86,202076.6,193.56,0.23,True,72.72,0.2,0.08,0.12,2026-02-13,48.94,2.98,0,,48.32,ATH,False,False
13-02-2026 16:00,BJKAS,1.63,1.65,1.63,1.65,9628379.0,0.0,0.02,0.0,400.0,0.02,3551835.8,171.08,0.0,True,66.4,0.01,0.01,0.0,2026-02-13,1.61,2.48,0,,1.59,ATH,False,False
13-02-2026 16:00,GIPTA,62.7,64.3,62.4,64.2,1206813.0,0.1,1.5,0.15,900.0,1.5,382078.9,215.85,0.07,True,64.02,0.01,-0.12,0.13,2026-02-13,62.5,2.72,0,,61.6,ATH,False,False
13-02-2026 16:00,KATMR,2.91,3.06,2.9,3.03,105065045.0,0.03,0.12,0.01,823.08,0.12,19545952.0,437.53,0.25,True,77.86,0.01,0.01,0.01,2026-02-13,2.9,4.48,0,,2.89,ATH,False,False
13-02-2026 16:00,ANGEN,11.57,11.66,11.56,11.66,715675.0,0.0,0.09,0.01,1700.0,0.09,304271.7,135.21,0.0,True,66.02,0.03,0.03,0.0,2026-02-13,11.57,0.78,0,,11.47,ATH,False,False
13-02-2026 14:00,SEGMN,48.66,50.0,48.62,49.78,1245674.0,0.22,1.12,0.22,413.76,1.12,646060.0,92.81,0.2,True,67.0,0.31,0.25,0.07,2026-02-13,48.98,1.63,0,,47.08,51.25,False,False
13-02-2026 14:00,CVKMD,44.72,46.74,44.7,46.36,6729265.0,0.38,1.64,0.19,745.36,1.64,3008935.6,123.64,0.23,True,74.51,0.56,0.46,0.09,2026-02-13,45.08,2.84,0,,ATL,ATH,False,False
13-02-2026 14:00,ENDAE,15.73,16.26,15.71,16.23,2464837.0,0.03,0.5,0.1,385.44,0.5,659294.7,273.86,0.06,True,69.01,0.06,-0.01,0.07,2026-02-13,15.32,5.94,0,,15.05,ATH,False,False
13-02-2026 14:00,YYAPI,1.84,1.88,1.83,1.88,35629950.0,0.0,0.04,0.0,3900.0,0.04,11509372.9,209.57,0.0,True,60.62,0.01,0.0,0.0,2026-02-13,1.85,1.62,2,1.83,1.83,ATH,False,False
13-02-2026 14:00,ZEDUR,8.77,8.94,8.77,8.94,576288.0,0.0,0.17,0.0,5566.67,0.17,245067.4,135.15,0.0,True,62.09,0.01,-0.0,0.01,2026-02-13,8.8,1.59,0,,8.7,ATH,False,False
13-02-2026 14:00,OSTIM,3.16,3.3,3.15,3.27,17339598.0,0.03,0.11,0.01,746.15,0.11,3828854.4,352.87,0.27,True,82.53,0.02,0.01,0.01,2026-02-13,3.13,4.47,0,,3.06,ATH,False,False
13-02-2026 13:00,KFEIN,10.42,10.81,10.37,10.73,3999920.0,0.08,0.31,0.02,1309.09,0.31,1432675.2,179.19,0.26,True,65.39,0.05,0.03,0.02,2026-02-13,10.41,3.07,0,,10.12,10.83,False,False
13-02-2026 11:00,SEGYO,5.6,5.96,5.58,5.95,7939540.0,0.01,0.35,0.01,2400.0,0.35,4463393.7,77.88,0.03,True,71.33,0.08,0.07,0.01,2026-02-13,5.57,6.82,0,,ATL,ATH,False,False
13-02-2026 11:00,ARSAN,4.52,4.84,4.47,4.76,23491909.0,0.08,0.24,0.01,1746.15,0.24,5683868.9,313.31,0.33,True,59.06,-0.02,-0.01,-0.0,2026-02-13,4.61,3.25,3,,4.58,ATH,False,False
13-02-2026 10:00,AGROT,3.25,3.3,3.25,3.29,8489238.0,0.01,0.04,0.01,700.0,0.04,3053053.7,178.06,0.25,True,70.71,0.01,0.0,0.0,2026-02-13,3.25,1.23,0,,3.2,ATH,False,False
13-02-2026 10:00,BAHKM,134.7,139.4,131.5,139.3,431395.0,0.1,4.6,0.7,557.14,4.6,119694.5,260.41,0.02,True,65.32,0.16,-0.28,0.44,2026-02-13,133.5,4.34,0,,128.6,ATH,False,False
13-02-2026 10:00,UNLU,17.35,18.01,17.25,17.88,1941065.0,0.13,0.53,0.07,657.14,0.53,708066.3,174.14,0.25,True,70.6,0.11,0.1,0.01,2026-02-13,17.25,3.65,3,,ATL,18.0,False,False
13-02-2026 10:00,FONET,3.31,3.53,3.31,3.47,51164692.0,0.06,0.16,0.02,788.89,0.16,6867157.2,645.06,0.37,True,78.79,0.02,0.01,0.02,2026-02-13,3.24,7.1,1,3.53,ATL,3.53,False,False
13-02-2026 10:00,BALSU,17.19,17.59,17.06,17.49,5333654.0,0.1,0.3,0.08,284.62,0.3,2374924.6,124.58,0.33,True,74.38,0.11,0.07,0.04,2026-02-13,17.1,2.28,1,17.59,ATL,17.59,False,False
13-02-2026 10:00,BERA,19.82,20.08,19.77,20.06,7243246.0,0.02,0.24,0.01,1900.0,0.24,3051211.9,137.39,0.08,True,41.68,-0.09,-0.11,0.03,2026-02-13,19.7,1.83,0,,19.61,ATH,False,False
13-02-2026 10:00,KIMMR,16.6,17.28,16.51,17.16,242861.0,0.12,0.56,0.09,551.16,0.56,122998.5,97.45,0.21,True,90.34,0.18,0.13,0.05,2026-02-13,16.66,3.0,0,,ATL,ATH,False,False
13-02-2026 10:00,THYAO,337.5,351.25,337.25,347.75,38503684.0,3.5,10.25,1.5,583.33,10.25,10077821.3,282.06,0.34,True,79.52,1.65,0.76,0.9,2026-02-13,337.0,3.19,1,351.25,331.0,351.25,False,False
13-02-2026 10:00,QUAGR,3.09,3.36,3.08,3.35,197900756.0,0.01,0.26,0.05,441.67,0.26,39885202.7,396.18,0.04,True,89.04,0.06,0.02,0.04,2026-02-13,3.09,8.41,0,,2.83,ATH,False,False
12-02-2026 17:00,IHLGM,2.06,2.08,2.06,2.08,4061152.0,0.0,0.02,0.0,400.0,0.02,1860862.1,118.24,0.0,True,65.65,0.0,-0.0,0.0,2026-02-12,2.04,1.96,0,,2.03,ATH,False,False
12-02-2026 17:00,ANHYT,120.8,122.0,120.7,122.0,691087.0,0.0,1.2,0.03,3900.0,1.2,200838.9,244.1,0.0,True,60.02,0.16,0.14,0.02,2026-02-12,122.0,0.0,0,,120.4,122.1,False,False
12-02-2026 17:00,SAFKR,28.04,28.66,27.94,28.52,2141099.0,0.14,0.48,0.03,1614.29,0.48,566836.8,277.73,0.29,True,62.12,0.02,0.02,0.0,2026-02-12,28.22,1.06,1,28.66,ATL,28.66,False,False
12-02-2026 17:00,AKENR,11.25,11.33,11.24,11.33,1638902.0,0.0,0.08,0.01,471.43,0.08,793155.5,106.63,0.0,True,62.34,0.01,0.0,0.01,2026-02-12,11.17,1.43,0,,11.13,ATH,False,False
12-02-2026 17:00,RUZYE,12.78,13.07,12.72,13.01,3214943.0,0.06,0.23,0.03,596.97,0.23,901061.6,256.8,0.26,True,70.65,0.02,-0.0,0.02,2026-02-12,12.61,3.17,0,,12.51,13.08,False,False
12-02-2026 17:00,ZGYO,32.36,36.3,32.16,35.8,1618307.0,0.5,3.44,0.23,1382.76,3.44,983488.6,64.55,0.15,True,73.92,0.42,0.25,0.17,2026-02-12,33.54,6.74,0,,ATL,ATH,False,False
12-02-2026 16:00,DNISI,23.9,24.04,23.86,24.02,165019.0,0.02,0.12,0.01,1100.0,0.12,88327.7,86.83,0.17,True,45.24,-0.05,-0.06,0.01,2026-02-12,23.8,0.92,0,,23.78,ATH,False,False
12-02-2026 15:00,FROTO,123.7,125.9,123.3,125.8,3368276.0,0.1,2.1,0.52,303.85,2.1,2095090.9,60.77,0.05,True,85.28,1.07,0.71,0.36,2026-02-12,120.2,4.66,0,,ATL,ATH,False,False
12-02-2026 15:00,ASELS,297.0,302.0,296.5,301.5,7322743.0,0.5,4.5,0.55,718.18,4.5,3549610.7,106.3,0.11,True,71.03,0.17,-0.18,0.35,2026-02-12,294.0,2.55,0,,291.5,ATH,False,False
12-02-2026 15:00,TSKB,13.91,14.15,13.9,14.14,14016923.0,0.01,0.23,0.06,289.83,0.23,5640293.4,148.51,0.04,True,91.58,0.09,0.05,0.04,2026-02-12,13.59,4.05,0,,ATL,ATH,False,False
12-02-2026 15:00,BMSTL,112.1,116.4,111.8,116.1,1183526.0,0.3,4.0,0.29,1279.31,4.0,246116.4,380.88,0.08,True,79.71,0.33,0.11,0.23,2026-02-12,111.4,4.22,0,,110.6,ATH,False,False
12-02-2026 13:00,MIATK,38.24,38.94,38.24,38.9,4965143.0,0.04,0.66,0.07,900.0,0.66,2204949.9,125.18,0.06,True,73.98,0.12,0.05,0.06,2026-02-12,37.98,2.42,0,,ATL,ATH,False,False
12-02-2026 12:00,GESAN,57.15,58.0,57.1,57.95,1122246.0,0.05,0.8,0.11,595.65,0.8,452293.2,148.12,0.06,True,77.04,0.26,0.14,0.12,2026-02-12,56.55,2.48,0,,ATL,ATH,False,False
12-02-2026 11:00,KOPOL,5.86,6.22,5.84,6.21,5904795.0,0.01,0.35,0.03,960.61,0.35,1043431.0,465.9,0.03,True,79.86,0.01,-0.0,0.01,2026-02-12,5.82,6.7,0,,5.82,ATH,False,False
12-02-2026 11:00,OYAKC,26.52,26.82,26.44,26.82,4061918.0,0.0,0.3,0.08,284.62,0.3,1772476.5,129.17,0.0,True,75.39,0.08,0.04,0.04,2026-02-12,26.24,2.21,0,,ATL,ATH,False,False
12-02-2026 10:00,AKSA,10.81,10.89,10.79,10.88,3335834.0,0.01,0.07,0.01,438.46,0.07,1582325.4,110.82,0.14,True,60.28,0.0,0.0,0.0,2026-02-12,10.8,0.74,2,10.79,10.79,ATH,False,False
12-02-2026 10:00,ARZUM,3.4,3.61,3.38,3.57,34873390.0,0.04,0.17,0.02,709.52,0.17,9111362.3,282.75,0.24,True,93.95,0.04,0.03,0.01,2026-02-12,3.38,5.62,0,,ATL,ATH,False,False
12-02-2026 10:00,ARCLK,123.2,127.0,123.2,127.0,1603003.0,0.0,3.8,0.39,874.36,3.8,508505.9,215.24,0.0,True,75.78,0.25,0.06,0.2,2026-02-12,122.7,3.5,0,,121.7,ATH,False,False
12-02-2026 10:00,ORCAY,3.8,3.83,3.76,3.83,791447.0,0.0,0.03,0.0,650.0,0.03,343830.3,130.19,0.0,True,68.05,0.0,-0.0,0.0,2026-02-12,3.8,0.79,0,,3.75,ATH,False,False
12-02-2026 10:00,BARMA,46.8,47.38,46.42,47.24,370612.0,0.14,0.44,0.07,511.11,0.44,245462.1,50.99,0.32,True,89.28,0.2,0.15,0.05,2026-02-12,46.7,1.16,0,,ATL,ATH,False,False
12-02-2026 10:00,CANTE,1.77,1.83,1.77,1.82,277058581.0,0.01,0.05,0.0,4900.0,0.05,63620296.2,335.49,0.2,True,64.42,-0.0,-0.0,0.0,2026-02-12,1.76,3.41,0,,1.75,ATH,False,False
12-02-2026 10:00,UCAYM,32.1,33.44,31.98,33.26,7548596.0,0.18,1.16,0.1,1083.67,1.16,4126828.2,82.92,0.16,True,47.44,-0.14,-0.16,0.02,2026-02-12,32.2,3.29,2,31.98,31.98,ATH,False,False
12-02-2026 10:00,FORMT,3.57,3.64,3.5,3.62,50388472.0,0.02,0.05,0.01,257.14,0.05,11852304.9,325.14,0.4,True,55.05,0.0,0.0,0.0,2026-02-12,3.6,0.56,2,3.5,3.5,ATH,False,False
12-02-2026 10:00,ALBRK,9.28,9.46,9.26,9.44,6457176.0,0.02,0.16,0.03,515.38,0.16,2335137.7,176.52,0.13,True,78.65,0.03,0.01,0.01,2026-02-12,9.26,1.94,0,,ATL,ATH,False,False
12-02-2026 10:00,SOKM,65.5,66.7,65.4,66.65,1094377.0,0.05,1.15,0.07,1669.23,1.15,475217.7,130.29,0.04,True,65.09,0.01,-0.04,0.05,2026-02-12,65.35,1.99,0,,65.0,ATH,False,False
12-02-2026 10:00,GLRMK,188.1,190.5,188.1,190.3,249083.0,0.2,2.2,0.2,1000.0,2.2,107724.6,131.22,0.09,True,58.17,-0.1,-0.17,0.06,2026-02-12,187.4,1.55,1,190.5,ATL,190.5,False,False
12-02-2026 10:00,MAKTK,16.55,17.37,16.55,17.22,3979028.0,0.15,0.67,0.07,900.0,0.67,952520.3,317.74,0.22,True,66.1,0.02,-0.01,0.02,2026-02-12,16.55,4.05,1,17.37,16.48,17.37,False,False
12-02-2026 10:00,MERCN,19.0,19.96,18.97,19.85,5329336.0,0.11,0.85,0.07,1187.88,0.85,1673616.4,218.43,0.13,True,61.62,-0.05,-0.07,0.02,2026-02-12,19.0,4.47,0,,ATL,ATH,False,False
12-02-2026 10:00,ISDMR,46.46,46.82,45.74,46.74,1000510.0,0.08,0.28,0.01,3400.0,0.28,349848.5,185.98,0.29,True,68.95,0.08,0.08,-0.0,2026-02-12,46.38,0.78,2,45.74,45.74,47.0,False,False
11-02-2026 17:00,EUPWR,39.7,41.1,39.62,40.86,3339325.0,0.24,1.16,0.13,820.63,1.16,926890.6,260.27,0.21,True,83.06,0.08,0.02,0.06,2026-02-11,39.66,3.03,0,,ATL,ATH,False,False
11-02-2026 16:00,AVGYO,13.13,13.72,13.07,13.72,1206132.0,0.0,0.59,0.09,541.3,0.59,537875.2,124.24,0.0,True,78.14,0.07,0.03,0.05,2026-02-11,12.79,7.27,0,,ATL,ATH,False,False
11-02-2026 16:00,CEMTS,12.55,13.01,12.54,13.0,2305725.0,0.01,0.45,0.05,749.06,0.45,601595.5,283.27,0.02,True,91.05,0.03,0.01,0.02,2026-02-11,12.53,3.75,0,,ATL,ATH,False,False
11-02-2026 16:00,ESEN,4.02,4.16,4.02,4.16,29994748.0,0.0,0.14,0.02,566.67,0.14,12022051.6,149.5,0.0,True,91.36,0.02,0.01,0.01,2026-02-11,3.94,5.58,0,,ATL,ATH,False,False
11-02-2026 15:00,TRCAS,50.9,53.05,50.8,52.95,614134.0,0.1,2.05,0.34,506.51,2.05,176815.5,247.33,0.05,True,86.98,0.19,0.08,0.11,2026-02-11,50.05,5.79,0,,ATL,ATH,False,False
11-02-2026 15:00,SELEC,86.45,87.95,86.45,87.95,415103.0,0.0,1.5,0.14,971.43,1.5,227939.8,82.11,0.0,True,77.78,0.2,0.13,0.08,2026-02-11,85.2,3.23,0,,ATL,ATH,False,False
11-02-2026 14:00,IHLAS,2.33,2.38,2.32,2.38,57446102.0,0.0,0.05,0.01,614.29,0.05,15493402.8,270.78,0.0,True,84.65,0.0,0.0,0.0,2026-02-11,2.3,3.48,0,,ATL,ATH,False,False
09-02-2026 11:00,ATLAS,8.86,9.95,8.85,9.89,1139680.0,0.06,1.03,0.1,909.8,1.03,363477.5,213.55,0.06,True,60.8,-0.1,-0.14,0.04,2026-02-09,9.07,9.04,0,,8.5,ATH,False,False
