Tarih,Hisse,open,high,low,close,volume,YuksekKapanis_Fark,AcilisKapanis_Fark,AcilisKapanisFark_Ort,AcilisKapanisFark_OrtalamayaGoreDegisim,AcilisKapanisFarkOrt_MaxSon10,HacimOrtalama,%Hacim_HacimOrtalama,Fark_Orani,Kosul,rsi,MACD_12_26_9,MACDs_12_26_9,MACDh_12_26_9,Tarih1,prev_close,%Deg,isPivot,pointpos,destek,direnc,Tsinyal_Banker_Dip,Tsinyal_Banker_DipKarar
16-02-2026 10:00,QUAGR,3.47,3.62,3.45,3.58,92008358.0,0.04,0.11,0.01,746.15,0.11,30408744.5,202.57,0.36,True,84.53,0.15,0.12,0.03,2026-02-16,3.39,5.6,0,,2.83,ATH,False,False
16-02-2026 10:00,RGYAS,162.2,165.2,162.2,165.1,147716.0,0.1,2.9,0.4,625.0,2.9,47854.8,208.68,0.03,True,80.77,1.44,1.11,0.33,2026-02-16,161.8,2.04,0,,156.0,ATH,False,False
16-02-2026 10:00,ALBRK,10.25,10.54,10.25,10.46,4780393.0,0.08,0.21,0.01,2233.33,0.21,2159465.2,121.37,0.38,True,84.19,0.22,0.18,0.04,2026-02-16,9.83,6.41,0,,8.71,ATH,False,False
16-02-2026 10:00,PETUN,13.17,13.4,13.17,13.36,407638.0,0.04,0.19,0.02,850.0,0.19,194729.9,109.34,0.21,True,69.92,0.04,0.03,0.01,2026-02-16,13.16,1.52,0,,12.79,13.61,False,False
16-02-2026 10:00,ULUFA,4.24,4.32,4.23,4.32,2640336.0,0.0,0.08,0.01,788.89,0.08,1031240.9,156.03,0.0,True,71.53,0.03,0.02,0.01,2026-02-16,4.24,1.89,0,,4.07,ATH,False,False
16-02-2026 10:00,PGSUS,220.3,224.1,219.9,223.8,8309753.0,0.3,3.5,0.25,1300.0,3.5,3705251.9,124.27,0.09,True,76.69,2.59,2.38,0.2,2026-02-16,218.1,2.61,0,,205.2,ATH,False,False
16-02-2026 10:00,TUREX,8.14,8.4,8.13,8.34,6903748.0,0.06,0.2,0.02,1076.47,0.2,4376378.3,57.75,0.3,True,74.35,0.13,0.1,0.03,2026-02-16,8.07,3.35,0,,7.63,ATH,False,False
16-02-2026 10:00,POLHO,17.75,18.08,17.75,18.01,613924.0,0.07,0.26,0.06,356.14,0.26,305642.9,100.86,0.27,True,62.5,0.09,0.09,0.0,2026-02-16,17.75,1.46,0,,17.29,18.08,False,False
16-02-2026 10:00,SEGMN,46.6,50.5,46.6,50.15,1121125.0,0.35,3.55,0.24,1397.89,3.55,488526.2,129.49,0.1,True,58.8,0.15,0.2,-0.06,2026-02-16,47.84,4.83,0,,47.08,51.25,False,False
16-02-2026 10:00,OTKAR,431.0,445.25,428.0,444.75,652635.0,0.5,13.75,1.58,773.02,13.75,149865.5,335.48,0.04,True,41.43,1.17,3.9,-2.72,2026-02-16,469.0,-5.17,0,,438.75,463.75,False,False
16-02-2026 10:00,BLCYT,35.88,36.46,35.4,36.36,536207.0,0.1,0.48,0.05,900.0,0.48,90680.3,491.32,0.21,True,17.76,-2.64,-2.2,-0.44,2026-02-16,39.3,-7.48,0,,ATL,50.5,False,False
16-02-2026 10:00,TTKOM,70.85,73.35,70.7,73.3,6359484.0,0.05,2.45,0.33,631.34,2.45,2439836.2,160.65,0.02,True,81.5,0.86,0.6,0.26,2026-02-16,70.3,4.27,0,,65.95,ATH,False,False
16-02-2026 10:00,SMRTG,8.46,8.67,8.46,8.62,1968204.0,0.05,0.16,0.0,7900.0,0.16,1193144.5,64.96,0.31,True,69.93,0.09,0.09,-0.0,2026-02-16,8.43,2.25,0,,7.95,8.69,False,False
16-02-2026 10:00,SOKE,13.16,13.26,13.16,13.26,179510.0,0.0,0.1,0.0,1900.0,0.1,104724.9,71.41,0.0,True,57.57,0.01,0.0,0.0,2026-02-16,13.16,0.76,0,,12.9,13.33,False,False
16-02-2026 10:00,SUNTK,40.12,40.44,39.8,40.44,209575.0,0.0,0.32,0.03,1042.86,0.32,85112.8,146.23,0.0,True,58.47,-0.07,-0.14,0.07,2026-02-16,39.86,1.46,0,,38.44,40.98,False,False
16-02-2026 10:00,TCELL,126.0,127.0,125.3,127.0,4172246.0,0.0,1.0,0.15,566.67,1.0,2363648.4,76.52,0.0,True,77.16,1.49,1.51,-0.02,2026-02-16,125.3,1.36,0,,116.3,ATH,False,False
16-02-2026 10:00,ASUZU,67.0,68.95,67.0,68.95,123354.0,0.0,1.95,0.13,1344.44,1.95,67988.2,81.43,0.0,True,80.79,0.59,0.49,0.1,2026-02-16,66.0,4.47,0,,64.85,ATH,False,False
16-02-2026 10:00,DARDL,2.42,2.47,2.42,2.46,4149910.0,0.01,0.04,0.0,900.0,0.04,2248000.5,84.6,0.25,True,72.55,0.01,0.01,0.0,2026-02-16,2.4,2.5,0,,2.37,2.55,False,False
16-02-2026 10:00,VESTL,32.88,33.4,32.88,33.36,756619.0,0.04,0.48,0.01,5900.0,0.48,396321.3,90.91,0.08,True,74.59,0.22,0.18,0.04,2026-02-16,32.5,2.65,0,,31.46,33.54,False,False
16-02-2026 10:00,DOFER,31.94,32.5,31.94,32.34,240883.0,0.16,0.4,0.02,1718.18,0.4,105304.9,128.75,0.4,True,65.53,-0.03,-0.1,0.08,2026-02-16,31.76,1.83,0,,31.56,33.4,True,False
16-02-2026 10:00,ADGYO,63.0,64.65,63.0,64.65,543053.0,0.0,1.65,0.16,931.25,1.65,258234.1,110.29,0.0,True,59.44,-0.02,-0.1,0.08,2026-02-16,62.75,3.03,0,,61.85,65.3,False,False
16-02-2026 10:00,GZNMI,65.05,67.9,65.05,67.9,1448081.0,0.0,2.85,0.29,900.0,2.85,190987.4,658.21,0.0,True,92.38,3.26,2.73,0.53,2026-02-16,61.75,9.96,0,,50.85,ATH,False,False
16-02-2026 10:00,AFYON,15.11,15.45,15.11,15.42,445349.0,0.03,0.31,0.02,1247.83,0.31,232149.6,91.84,0.1,True,81.39,0.08,0.05,0.03,2026-02-16,14.89,3.56,0,,14.66,ATH,False,False
16-02-2026 10:00,HATEK,15.64,16.18,15.64,16.14,605019.0,0.04,0.5,0.04,1036.36,0.5,154647.6,291.22,0.08,True,69.84,0.06,0.05,0.01,2026-02-16,15.55,3.79,0,,15.17,ATH,False,False
16-02-2026 10:00,HOROZ,66.75,69.3,66.75,69.3,592271.0,0.0,2.55,0.4,545.57,2.55,258050.9,129.52,0.0,True,76.93,0.69,0.3,0.39,2026-02-16,65.75,5.4,0,,63.0,ATH,False,False
16-02-2026 10:00,YKSLN,3.3,3.4,3.3,3.39,2694859.0,0.01,0.09,0.01,800.0,0.09,1361800.9,97.89,0.11,True,72.55,0.02,0.01,0.01,2026-02-16,3.3,2.73,0,,3.23,3.76,False,False
16-02-2026 10:00,IHEVA,2.37,2.4,2.36,2.4,542422.0,0.0,0.03,0.0,650.0,0.03,193085.5,180.92,0.0,True,65.19,0.0,0.0,0.0,2026-02-16,2.34,2.56,0,,2.34,2.41,False,False
16-02-2026 10:00,YIGIT,26.2,26.74,26.14,26.72,1154007.0,0.02,0.52,0.05,900.0,0.52,348783.0,230.87,0.04,True,79.1,0.16,0.11,0.05,2026-02-16,26.06,2.53,0,,25.42,ATH,False,False
16-02-2026 10:00,KLSYN,9.0,9.53,8.93,9.5,2263443.0,0.03,0.5,0.05,986.96,0.5,1132266.3,99.9,0.06,True,77.52,0.25,0.23,0.02,2026-02-16,8.84,7.47,0,,7.85,ATH,False,False
16-02-2026 10:00,KRDMD,32.02,32.46,31.98,32.42,11055663.0,0.04,0.4,0.01,3900.0,0.4,6074443.6,82.0,0.1,True,71.69,0.29,0.24,0.05,2026-02-16,31.5,2.92,0,,29.82,ATH,False,False
16-02-2026 10:00,LINK,240.5,246.3,240.4,245.6,172484.0,0.7,5.1,0.62,722.58,5.1,68456.2,151.96,0.14,True,68.68,0.24,-0.15,0.39,2026-02-16,240.5,2.12,0,,231.8,248.0,False,False
16-02-2026 10:00,TRILC,19.94,20.6,19.94,20.44,1443329.0,0.16,0.5,0.12,309.84,0.5,877994.0,64.39,0.32,True,89.45,0.41,0.28,0.13,2026-02-16,19.89,2.77,0,,18.22,ATH,False,False
13-02-2026 17:00,CCOLA,77.5,78.8,77.45,78.65,2723639.0,0.15,1.15,0.08,1433.33,1.15,1150468.8,136.74,0.13,True,70.34,0.66,0.59,0.07,2026-02-13,77.5,1.48,0,,73.5,ATH,False,False
13-02-2026 17:00,BOBET,21.3,21.74,21.24,21.7,911359.0,0.04,0.4,0.04,852.38,0.4,418694.0,117.67,0.1,True,68.25,0.16,0.14,0.02,2026-02-13,21.34,1.69,0,,20.58,ATH,False,False
13-02-2026 17:00,HEDEF,79.35,85.05,79.25,83.5,4671122.0,1.55,4.15,0.35,1069.01,4.15,880536.7,430.49,0.37,True,72.26,1.56,1.69,-0.13,2026-02-13,80.0,4.38,0,,76.6,ATH,False,False
13-02-2026 17:00,KRPLS,9.17,9.37,9.13,9.32,1008034.0,0.05,0.15,0.03,476.92,0.15,417059.4,141.7,0.33,True,70.9,0.07,0.06,0.01,2026-02-13,9.02,3.33,0,,9.01,ATH,False,False
13-02-2026 17:00,DAPGM,12.0,13.13,11.89,13.13,36298177.0,0.0,1.13,0.12,857.63,1.13,5240881.4,592.6,0.0,True,83.37,0.15,0.07,0.08,2026-02-13,11.94,9.97,0,,11.42,ATH,False,False
13-02-2026 17:00,LOGO,157.0,160.0,156.4,160.0,483716.0,0.0,3.0,0.14,2042.86,3.0,156916.1,208.26,0.0,True,65.67,0.44,0.35,0.1,2026-02-13,158.4,1.01,0,,153.5,ATH,False,False
13-02-2026 17:00,ZOREN,3.59,3.64,3.58,3.63,32493904.0,0.01,0.04,0.0,1900.0,0.04,7718246.3,321.0,0.25,True,67.59,0.02,0.01,0.01,2026-02-13,3.58,1.4,0,,3.46,3.65,False,False
13-02-2026 17:00,GWIND,27.58,27.92,27.48,27.9,1800866.0,0.02,0.32,0.03,900.0,0.32,643691.4,179.77,0.06,True,72.48,0.18,0.15,0.03,2026-02-13,27.52,1.38,0,,26.56,28.26,False,False
13-02-2026 16:00,ETILR,4.19,4.22,4.18,4.22,986120.0,0.0,0.03,0.0,900.0,0.03,598530.1,64.76,0.0,True,64.39,0.02,0.01,0.0,2026-02-13,4.2,0.48,0,,4.13,4.33,False,False
13-02-2026 16:00,OBAMS,8.38,8.71,8.36,8.65,27391240.0,0.06,0.27,0.06,390.91,0.27,11570671.6,136.73,0.22,True,74.95,0.17,0.11,0.06,2026-02-13,8.12,6.53,0,,7.64,8.73,False,False
13-02-2026 16:00,NTHOL,49.54,50.6,49.54,50.4,593212.0,0.2,0.86,0.16,444.3,0.86,202076.6,193.56,0.23,True,72.17,0.3,0.21,0.09,2026-02-13,48.94,2.98,0,,48.32,ATH,False,False
13-02-2026 16:00,ANELE,16.51,16.72,16.48,16.67,305834.0,0.05,0.16,0.02,566.67,0.16,169101.3,80.86,0.31,True,61.72,0.05,0.04,0.01,2026-02-13,16.41,1.58,0,,15.66,16.78,False,False
13-02-2026 16:00,ANGEN,11.57,11.66,11.56,11.66,715675.0,0.0,0.09,0.01,1700.0,0.09,304271.7,135.21,0.0,True,64.46,0.04,0.04,0.0,2026-02-13,11.57,0.78,0,,11.29,11.78,False,False
13-02-2026 16:00,PRDGS,7.27,7.54,7.25,7.48,1372081.0,0.06,0.21,0.01,3400.0,0.21,661899.7,107.29,0.29,True,61.77,0.02,0.02,-0.01,2026-02-13,7.34,1.91,0,,7.2,7.57,False,False
13-02-2026 16:00,BURCE,58.5,62.9,58.35,62.45,530113.0,0.45,3.95,0.29,1262.07,3.95,153207.7,246.01,0.11,True,62.21,-0.53,-0.83,0.3,2026-02-13,59.6,4.78,0,,57.0,77.5,True,False
13-02-2026 16:00,MNDTR,6.84,6.89,6.84,6.88,498877.0,0.01,0.04,0.0,1900.0,0.04,259684.9,92.11,0.25,True,61.77,0.02,0.02,0.0,2026-02-13,6.84,0.58,0,,6.53,6.95,False,False
13-02-2026 16:00,RTALB,4.02,4.09,4.02,4.09,4573555.0,0.0,0.07,0.01,1066.67,0.07,2326047.4,96.62,0.0,True,61.18,0.0,-0.0,0.0,2026-02-13,4.07,0.49,0,,3.97,4.1,False,False
13-02-2026 16:00,BSOKE,29.74,30.2,29.74,30.14,919961.0,0.06,0.4,0.02,1566.67,0.4,502691.5,83.01,0.15,True,57.48,0.09,0.1,-0.01,2026-02-13,29.8,1.14,0,,29.36,30.18,False,False
13-02-2026 16:00,BJKAS,1.63,1.65,1.63,1.65,9628379.0,0.0,0.02,0.0,400.0,0.02,3551835.8,171.08,0.0,True,65.49,0.01,0.01,0.0,2026-02-13,1.61,2.48,0,,1.59,ATH,False,False
13-02-2026 16:00,ESCOM,3.9,3.96,3.9,3.95,4832429.0,0.01,0.05,0.01,525.0,0.05,2161355.0,123.58,0.2,True,70.92,0.03,0.02,0.01,2026-02-13,3.86,2.33,0,,3.74,3.96,False,False
13-02-2026 16:00,KRVGD,3.09,3.13,3.09,3.12,1434806.0,0.01,0.03,0.0,900.0,0.03,838262.6,71.16,0.33,True,61.66,0.01,0.0,0.0,2026-02-13,3.08,1.3,0,,3.04,3.16,False,False
13-02-2026 16:00,GENTS,9.92,10.48,9.9,10.39,5111794.0,0.09,0.47,0.01,4600.0,0.47,2016462.8,153.5,0.19,True,54.52,-0.13,-0.13,0.0,2026-02-13,10.32,0.68,0,,10.13,11.14,True,True
13-02-2026 16:00,TATGD,14.66,15.08,14.64,15.06,1414562.0,0.02,0.4,0.06,525.0,0.4,405122.8,249.17,0.05,True,82.39,0.14,0.08,0.06,2026-02-13,14.42,4.44,0,,14.07,ATH,False,False
13-02-2026 16:00,GIPTA,62.7,64.3,62.4,64.2,1206813.0,0.1,1.5,0.15,900.0,1.5,382078.9,215.85,0.07,True,64.67,0.29,0.27,0.01,2026-02-13,62.5,2.72,0,,61.6,65.75,False,False
13-02-2026 16:00,KATMR,2.91,3.06,2.9,3.03,105065045.0,0.03,0.12,0.01,823.08,0.12,19545952.0,437.53,0.25,True,76.48,0.02,0.01,0.01,2026-02-13,2.9,4.48,0,,2.85,ATH,False,False
13-02-2026 15:00,AKFIS,24.04,25.56,24.04,25.56,11065430.0,0.0,1.52,0.23,560.87,1.52,1476301.1,649.54,0.0,True,91.26,0.45,0.27,0.18,2026-02-13,23.24,9.98,0,,22.38,ATH,False,False
13-02-2026 15:00,YESIL,1.99,2.03,1.98,2.03,18126337.0,0.0,0.04,0.0,700.0,0.04,4084165.2,343.82,0.0,True,64.13,0.0,0.0,0.0,2026-02-13,2.0,1.5,0,,1.98,2.08,False,False
13-02-2026 15:00,EPLAS,6.9,7.17,6.87,7.16,2423305.0,0.01,0.26,0.03,712.5,0.26,608880.2,297.99,0.04,True,69.52,0.03,0.0,0.03,2026-02-13,6.89,3.92,0,,6.75,7.2,False,False
13-02-2026 15:00,MOBTL,10.85,11.05,10.83,11.04,2795454.0,0.01,0.19,0.0,18900.0,0.19,1196118.1,133.71,0.05,True,61.76,0.06,0.07,-0.01,2026-02-13,10.87,1.56,0,,10.68,11.3,False,False
13-02-2026 14:00,ENDAE,15.73,16.26,15.71,16.23,2464837.0,0.03,0.5,0.1,385.44,0.5,659294.7,273.86,0.06,True,68.73,0.09,0.03,0.07,2026-02-13,15.32,5.94,0,,15.05,ATH,False,False
13-02-2026 14:00,ODAS,6.12,6.2,6.08,6.19,13461566.0,0.01,0.07,0.0,6900.0,0.07,8352608.2,61.17,0.14,True,64.16,0.05,0.05,-0.0,2026-02-13,6.14,0.81,0,,5.96,ATH,False,False
13-02-2026 14:00,ZEDUR,8.77,8.94,8.77,8.94,576288.0,0.0,0.17,0.0,5566.67,0.17,245067.4,135.15,0.0,True,61.53,0.04,0.04,-0.0,2026-02-13,8.8,1.59,0,,8.7,9.1,False,False
13-02-2026 14:00,DAGI,6.42,6.5,6.41,6.48,864781.0,0.02,0.06,0.0,1400.0,0.06,518335.5,66.84,0.33,True,53.11,-0.01,-0.01,-0.0,2026-02-13,6.45,0.47,0,,6.37,6.76,False,False
13-02-2026 14:00,CVKMD,44.72,46.74,44.7,46.36,6729265.0,0.38,1.64,0.19,745.36,1.64,3008935.6,123.64,0.23,True,72.14,0.59,0.45,0.15,2026-02-13,45.08,2.84,0,,40.82,46.48,False,False
13-02-2026 14:00,TURGG,29.96,31.78,29.74,31.32,1233898.0,0.46,1.36,0.07,1900.0,1.36,751775.8,64.13,0.34,True,62.46,0.46,0.45,0.01,2026-02-13,31.24,0.26,0,,28.2,ATH,False,False
13-02-2026 14:00,GOZDE,27.4,27.7,27.4,27.68,444374.0,0.02,0.28,0.06,400.0,0.28,244219.2,81.96,0.07,True,71.01,0.2,0.2,0.01,2026-02-13,27.26,1.54,0,,26.66,ATH,False,False
13-02-2026 14:00,YYAPI,1.84,1.88,1.83,1.88,35629950.0,0.0,0.04,0.0,3900.0,0.04,11509372.9,209.57,0.0,True,60.37,0.01,0.01,0.0,2026-02-13,1.85,1.62,0,,1.83,ATH,False,False
13-02-2026 14:00,OSTIM,3.16,3.3,3.15,3.27,17339598.0,0.03,0.11,0.01,746.15,0.11,3828854.4,352.87,0.27,True,78.59,0.02,0.01,0.01,2026-02-13,3.13,4.47,0,,3.06,3.32,False,False
13-02-2026 14:00,SEKFK,9.67,9.93,9.66,9.89,404230.0,0.04,0.22,0.03,547.06,0.22,137343.2,194.32,0.18,True,65.43,0.04,-0.0,0.04,2026-02-13,9.6,3.02,0,,9.24,10.68,False,False
13-02-2026 13:00,KFEIN,10.42,10.81,10.37,10.73,3999920.0,0.08,0.31,0.02,1309.09,0.31,1432675.2,179.19,0.26,True,65.72,0.14,0.15,-0.01,2026-02-13,10.41,3.07,0,,10.12,10.83,False,False
13-02-2026 13:00,CEMAS,5.92,6.18,5.92,6.13,13304401.0,0.05,0.21,0.01,1650.0,0.21,5581857.7,138.35,0.24,True,61.47,0.04,0.01,0.03,2026-02-13,5.87,4.43,0,,5.74,6.44,False,False
13-02-2026 12:00,ARDYZ,46.7,47.78,46.6,47.72,974935.0,0.06,1.02,0.15,598.63,1.02,555692.6,75.45,0.06,True,74.56,0.59,0.37,0.22,2026-02-13,45.7,4.42,0,,43.36,48.78,False,False
13-02-2026 12:00,VRGYO,2.58,2.65,2.57,2.64,6319569.0,0.01,0.06,0.0,1900.0,0.06,3976705.4,58.91,0.17,True,62.09,0.02,0.02,-0.0,2026-02-13,2.61,1.15,0,,2.56,ATH,False,False
13-02-2026 12:00,DCTTR,8.26,8.49,8.23,8.44,3439382.0,0.05,0.18,0.03,500.0,0.18,975216.0,252.68,0.28,True,76.5,0.03,0.01,0.02,2026-02-13,8.21,2.8,0,,8.11,8.47,False,False
13-02-2026 12:00,VBTYZ,22.2,23.58,22.06,23.52,2493717.0,0.06,1.32,0.06,2100.0,1.32,648366.5,284.62,0.05,True,65.38,0.19,0.08,0.11,2026-02-13,21.5,9.4,0,,21.1,23.58,False,False
13-02-2026 12:00,AVOD,5.2,5.45,5.15,5.44,9447254.0,0.01,0.24,0.05,433.33,0.24,4020275.9,134.99,0.04,True,75.85,0.07,0.03,0.04,2026-02-13,5.07,7.3,1,5.45,4.98,5.45,False,False
13-02-2026 12:00,YEOTK,42.46,43.32,42.4,43.26,1319694.0,0.06,0.8,0.08,852.38,0.8,768598.8,71.7,0.08,True,74.94,0.42,0.29,0.13,2026-02-13,42.6,1.55,0,,40.3,47.0,False,False
13-02-2026 12:00,ANSGR,27.94,28.4,27.9,28.34,2741847.0,0.06,0.4,0.08,387.8,0.4,1167240.8,134.9,0.15,True,81.37,0.18,0.1,0.07,2026-02-13,27.6,2.68,1,28.4,27.0,28.4,False,False
13-02-2026 12:00,FLAP,10.29,10.6,10.23,10.54,488740.0,0.06,0.25,0.1,160.42,0.25,248230.0,96.89,0.24,True,72.7,0.23,0.17,0.06,2026-02-13,10.09,4.46,0,,9.01,ATH,False,False
13-02-2026 11:00,PENGD,9.23,9.32,9.21,9.32,908840.0,0.0,0.09,0.01,1185.71,0.09,557620.6,62.99,0.0,True,59.12,0.01,0.01,-0.0,2026-02-13,9.15,1.86,0,,9.08,9.67,False,False
13-02-2026 11:00,CONSE,3.68,3.79,3.68,3.76,3523553.0,0.03,0.08,0.01,1042.86,0.08,1188489.1,196.47,0.38,True,68.84,0.05,0.05,-0.0,2026-02-13,3.71,1.35,0,,3.52,ATH,False,False
13-02-2026 11:00,ARSAN,4.52,4.84,4.47,4.76,23491909.0,0.08,0.24,0.01,1746.15,0.24,5683868.9,313.31,0.33,True,57.57,-0.0,0.01,-0.01,2026-02-13,4.61,3.25,3,,4.58,4.96,False,False
13-02-2026 11:00,SEGYO,5.6,5.96,5.58,5.95,7939540.0,0.01,0.35,0.01,2400.0,0.35,4463393.7,77.88,0.03,True,70.65,0.16,0.16,-0.0,2026-02-13,5.57,6.82,0,,4.88,ATH,False,False
13-02-2026 10:00,KCAER,11.7,12.04,11.7,11.96,8787416.0,0.08,0.26,0.02,1138.1,0.26,2164915.6,305.9,0.31,True,76.52,0.1,0.09,0.01,2026-02-13,11.69,2.31,0,,10.8,ATH,False,False
13-02-2026 10:00,HALKB,48.18,49.44,47.86,49.36,40260569.0,0.08,1.18,0.22,441.28,1.18,13372400.5,201.07,0.07,True,83.04,0.83,0.66,0.17,2026-02-13,48.0,2.83,0,,43.0,ATH,False,False
13-02-2026 10:00,MANAS,12.22,12.68,12.1,12.59,11846070.0,0.09,0.37,0.04,900.0,0.37,5381496.9,120.13,0.24,True,65.07,0.16,0.17,-0.01,2026-02-13,12.2,3.2,0,,11.71,12.73,False,False
13-02-2026 10:00,TRALT,52.35,54.15,52.15,54.0,37096921.0,0.15,1.65,0.09,1636.84,1.65,11348107.1,226.9,0.09,True,65.77,0.76,0.89,-0.13,2026-02-13,53.3,1.31,2,52.15,52.15,54.4,False,False
13-02-2026 10:00,DURKN,19.9,21.32,19.8,21.24,4588375.0,0.08,1.34,0.11,1085.84,1.34,882247.2,420.08,0.06,True,74.36,0.31,0.26,0.05,2026-02-13,19.93,6.57,0,,19.05,ATH,False,False
13-02-2026 10:00,KIMMR,16.6,17.28,16.51,17.16,242861.0,0.12,0.56,0.09,551.16,0.56,122998.5,97.45,0.21,True,84.82,0.27,0.21,0.06,2026-02-13,16.66,3.0,0,,15.24,ATH,False,False
13-02-2026 10:00,IHAAS,46.2,49.46,46.2,48.9,1725731.0,0.56,2.7,0.41,558.54,2.7,552371.8,212.42,0.21,True,73.2,0.65,0.19,0.46,2026-02-13,46.1,6.07,0,,42.92,49.72,False,False
13-02-2026 10:00,FORTE,91.2,92.55,90.85,92.5,267337.0,0.05,1.3,0.22,490.91,1.3,113987.7,134.53,0.04,True,68.76,0.45,0.31,0.14,2026-02-13,91.25,1.37,0,,89.7,93.6,False,False
13-02-2026 10:00,ECOGR,24.9,25.58,24.74,25.46,5195223.0,0.12,0.56,0.07,748.48,0.56,1332021.1,290.03,0.21,True,67.36,0.02,-0.05,0.07,2026-02-13,24.88,2.33,1,25.58,24.28,25.58,False,False
13-02-2026 10:00,EKSUN,5.83,6.01,5.82,5.98,2133899.0,0.03,0.15,0.01,1053.85,0.15,557613.0,282.68,0.2,True,72.71,0.04,0.02,0.01,2026-02-13,5.83,2.57,0,,5.66,5.99,False,False
13-02-2026 10:00,AGROT,3.25,3.3,3.25,3.29,8489238.0,0.01,0.04,0.01,700.0,0.04,3053053.7,178.06,0.25,True,67.04,0.01,0.01,0.0,2026-02-13,3.25,1.23,0,,3.2,3.32,False,False
13-02-2026 10:00,FONET,3.31,3.53,3.31,3.47,51164692.0,0.06,0.16,0.02,788.89,0.16,6867157.2,645.06,0.37,True,75.67,0.02,0.0,0.02,2026-02-13,3.24,7.1,1,3.53,3.2,3.53,False,False
13-02-2026 10:00,TRENJ,106.6,110.3,106.2,109.9,775962.0,0.4,3.3,0.04,8150.0,3.3,268565.6,188.93,0.12,True,64.62,1.18,1.21,-0.03,2026-02-13,108.1,1.67,2,106.2,106.2,111.8,False,False
13-02-2026 10:00,BAYRK,4.88,5.2,4.87,5.16,13505633.0,0.04,0.28,0.05,522.22,0.28,3353900.2,302.68,0.14,True,83.85,0.09,0.05,0.04,2026-02-13,4.88,5.74,0,,4.59,ATH,False,False
13-02-2026 10:00,UNLU,17.35,18.01,17.25,17.88,1941065.0,0.13,0.53,0.07,657.14,0.53,708066.3,174.14,0.25,True,67.67,0.17,0.16,0.01,2026-02-13,17.25,3.65,3,,16.44,18.0,False,False
13-02-2026 10:00,BAHKM,134.7,139.4,131.5,139.3,431395.0,0.1,4.6,0.7,557.14,4.6,119694.5,260.41,0.02,True,63.97,0.64,0.38,0.26,2026-02-13,133.5,4.34,0,,128.6,141.4,False,False
13-02-2026 10:00,BERA,19.82,20.08,19.77,20.06,7243246.0,0.02,0.24,0.01,1900.0,0.24,3051211.9,137.39,0.08,True,49.72,-0.16,-0.17,0.01,2026-02-13,19.7,1.83,0,,19.61,23.1,False,False
13-02-2026 10:00,AYEN,29.22,29.62,29.1,29.6,574339.0,0.02,0.38,0.07,458.82,0.38,159495.4,260.1,0.05,True,75.46,0.22,0.2,0.02,2026-02-13,29.12,1.65,0,,28.54,ATH,False,False
13-02-2026 10:00,TUKAS,2.87,2.92,2.86,2.91,58370579.0,0.01,0.04,0.01,400.0,0.04,21774978.1,168.06,0.25,True,65.76,0.0,-0.0,0.01,2026-02-13,2.86,1.75,1,2.92,2.83,2.92,False,False
13-02-2026 10:00,THYAO,337.5,351.25,337.25,347.75,38503684.0,3.5,10.25,1.5,583.33,10.25,10077821.3,282.06,0.34,True,77.34,2.97,2.27,0.7,2026-02-13,337.0,3.19,1,351.25,331.0,351.25,False,False
13-02-2026 10:00,SEYKM,5.33,5.48,5.33,5.46,630376.0,0.02,0.13,0.01,1757.14,0.13,350204.1,80.0,0.15,True,48.87,0.03,0.06,-0.03,2026-02-13,5.48,-0.36,0,,5.32,5.82,False,False
13-02-2026 10:00,BALSU,17.19,17.59,17.06,17.49,5333654.0,0.1,0.3,0.08,284.62,0.3,2374924.6,124.58,0.33,True,70.97,0.14,0.09,0.05,2026-02-13,17.1,2.28,1,17.59,16.53,17.59,False,False
13-02-2026 10:00,REEDR,6.92,7.03,6.89,7.0,8687146.0,0.03,0.08,0.01,515.38,0.08,2443328.9,255.55,0.38,True,74.63,0.03,0.02,0.01,2026-02-13,6.93,1.01,0,,6.78,ATH,False,False
13-02-2026 10:00,BORLS,2.7,2.78,2.7,2.76,13908952.0,0.02,0.06,0.0,1400.0,0.06,2437937.2,470.52,0.33,True,59.91,-0.0,-0.01,0.0,2026-02-13,2.7,2.22,0,,2.67,2.86,False,False
13-02-2026 10:00,VAKBN,41.36,42.84,40.82,42.56,28405739.0,0.28,1.2,0.25,383.87,1.2,9687443.4,193.22,0.23,True,88.82,1.24,0.94,0.3,2026-02-13,41.1,3.55,1,42.84,36.24,42.84,False,False
13-02-2026 10:00,DENGE,2.94,3.16,2.93,3.13,53494174.0,0.03,0.19,0.02,1017.65,0.19,7202105.3,642.76,0.16,True,83.43,0.05,0.02,0.02,2026-02-13,2.88,8.68,1,3.16,2.76,3.16,False,False
13-02-2026 10:00,TRMET,136.5,140.1,135.1,139.8,1672140.0,0.3,3.3,0.08,4025.0,3.3,595131.9,180.97,0.09,True,59.05,1.2,1.4,-0.19,2026-02-13,139.6,0.14,2,135.1,135.1,142.2,False,False
13-02-2026 10:00,BIENY,25.5,27.56,25.2,27.46,5285448.0,0.1,1.96,0.31,536.36,1.96,872873.1,505.52,0.05,True,90.17,0.44,0.18,0.26,2026-02-13,25.44,7.94,0,,24.0,ATH,False,False
13-02-2026 10:00,BESLR,15.23,15.62,15.1,15.55,2190119.0,0.07,0.32,0.04,700.0,0.32,765432.2,186.13,0.22,True,79.91,0.25,0.22,0.04,2026-02-13,15.15,2.64,0,,14.1,ATH,False,False
13-02-2026 10:00,PAPIL,18.58,19.03,18.49,18.97,7982673.0,0.06,0.39,0.08,387.5,0.39,1827694.4,336.76,0.15,True,70.71,0.11,0.04,0.07,2026-02-13,18.56,2.21,0,,18.06,19.25,False,False
12-02-2026 17:00,AKENR,11.25,11.33,11.24,11.33,1638902.0,0.0,0.08,0.01,471.43,0.08,793155.5,106.63,0.0,True,60.19,0.01,0.01,0.01,2026-02-12,11.17,1.43,0,,11.13,11.41,False,False
12-02-2026 17:00,KRSTL,12.2,12.5,12.2,12.43,2041231.0,0.07,0.23,0.05,400.0,0.23,754738.2,170.46,0.3,True,73.26,0.12,0.1,0.03,2026-02-12,12.03,3.33,1,12.5,11.75,12.5,False,False
12-02-2026 17:00,KLKIM,42.54,42.84,42.5,42.78,415125.0,0.06,0.24,0.04,500.0,0.24,237901.5,74.49,0.25,True,53.95,-0.04,-0.0,-0.04,2026-02-12,42.22,1.33,0,,41.98,44.2,False,False
12-02-2026 17:00,OZYSR,52.65,54.1,52.5,54.0,354537.0,0.1,1.35,0.09,1488.24,1.35,171680.9,106.51,0.07,True,66.93,0.79,0.72,0.07,2026-02-12,53.0,1.89,0,,47.78,55.25,False,False
12-02-2026 17:00,TABGD,264.75,269.25,264.25,268.75,263850.0,0.5,4.0,0.7,471.43,4.0,86318.9,205.67,0.12,True,71.2,1.23,0.94,0.29,2026-02-12,261.0,2.97,0,,258.75,281.5,False,False
12-02-2026 17:00,GARFA,29.04,29.26,29.02,29.22,181620.0,0.04,0.18,0.02,800.0,0.18,99187.8,83.11,0.22,True,64.05,0.09,0.05,0.03,2026-02-12,28.96,0.9,0,,28.44,ATH,False,False
12-02-2026 17:00,HUNER,3.42,3.46,3.42,3.45,4128609.0,0.01,0.03,0.01,275.0,0.03,2099545.5,96.64,0.33,True,67.63,0.02,0.02,0.0,2026-02-12,3.37,2.37,0,,3.33,ATH,False,False
12-02-2026 17:00,IHLGM,2.06,2.08,2.06,2.08,4061152.0,0.0,0.02,0.0,400.0,0.02,1860862.1,118.24,0.0,True,63.43,0.0,0.0,0.0,2026-02-12,2.04,1.96,0,,2.03,2.09,False,False
12-02-2026 17:00,LKMNH,17.27,17.35,17.25,17.35,350760.0,0.0,0.08,0.02,344.44,0.08,198457.6,76.74,0.0,True,53.44,0.01,0.02,-0.01,2026-02-12,16.98,2.18,0,,16.98,17.79,False,False
12-02-2026 17:00,HTTBT,44.7,46.06,44.58,46.0,696921.0,0.06,1.3,0.16,702.47,1.3,261533.4,166.47,0.05,True,73.76,-0.01,-0.15,0.14,2026-02-12,44.34,3.74,0,,44.1,47.44,False,False
12-02-2026 17:00,SAFKR,28.04,28.66,27.94,28.52,2141099.0,0.14,0.48,0.03,1614.29,0.48,566836.8,277.73,0.29,True,56.05,-0.01,-0.03,0.02,2026-02-12,28.22,1.06,1,28.66,27.8,28.66,False,False
12-02-2026 17:00,RUZYE,12.78,13.07,12.72,13.01,3214943.0,0.06,0.23,0.03,596.97,0.23,901061.6,256.8,0.26,True,67.33,0.04,0.03,0.01,2026-02-12,12.61,3.17,0,,12.51,13.08,False,False
12-02-2026 17:00,ANHYT,120.8,122.0,120.7,122.0,691087.0,0.0,1.2,0.03,3900.0,1.2,200838.9,244.1,0.0,True,62.84,0.63,0.71,-0.07,2026-02-12,122.0,0.0,0,,120.4,122.1,False,False
12-02-2026 17:00,MOGAN,9.12,9.17,9.11,9.17,1322195.0,0.0,0.05,0.01,455.56,0.05,544070.3,143.02,0.0,True,62.66,0.01,0.0,0.01,2026-02-12,9.0,1.89,0,,8.96,9.21,False,False
12-02-2026 17:00,MOPAS,58.05,59.15,57.1,59.0,894182.0,0.15,0.95,0.02,4650.0,0.95,379825.4,135.42,0.16,True,65.75,0.72,0.75,-0.03,2026-02-12,58.45,0.94,0,,56.0,59.45,False,False
12-02-2026 17:00,NTGAZ,11.66,11.91,11.65,11.9,2038811.0,0.01,0.24,0.04,485.37,0.24,530556.9,284.28,0.04,True,75.76,0.08,0.06,0.02,2026-02-12,11.56,2.94,0,,11.07,ATH,False,False
12-02-2026 17:00,TKNSA,25.08,25.26,24.98,25.26,585852.0,0.0,0.18,0.04,309.09,0.18,215295.9,172.11,0.0,True,67.12,0.16,0.14,0.01,2026-02-12,24.76,2.02,0,,23.98,25.4,False,False
12-02-2026 17:00,DEVA,77.55,80.45,77.45,80.45,680184.0,0.0,2.9,0.29,900.0,2.9,113895.0,497.2,0.0,True,85.48,0.68,0.56,0.12,2026-02-12,77.35,4.01,0,,73.75,ATH,False,False
12-02-2026 17:00,ZGYO,32.36,36.3,32.16,35.8,1618307.0,0.5,3.44,0.23,1382.76,3.44,983488.6,64.55,0.15,True,75.23,1.16,1.13,0.02,2026-02-12,33.54,6.74,0,,28.22,ATH,False,False
12-02-2026 17:00,DOHOL,21.84,22.2,21.8,22.14,8539367.0,0.06,0.3,0.06,417.24,0.3,3040234.4,180.88,0.2,True,81.72,0.25,0.17,0.08,2026-02-12,21.3,3.94,0,,20.66,ATH,False,False
12-02-2026 16:00,AYDEM,25.44,25.8,25.4,25.76,1728507.0,0.04,0.32,0.11,185.71,0.32,725151.2,138.37,0.12,True,60.83,-0.15,-0.29,0.14,2026-02-12,24.54,4.97,0,,24.44,26.5,False,False
12-02-2026 16:00,TEKTU,10.21,10.95,10.18,10.77,8834381.0,0.18,0.56,0.03,1650.0,0.56,2764186.8,219.6,0.32,True,64.56,0.16,0.2,-0.04,2026-02-12,10.1,6.63,1,10.95,10.1,10.95,False,False
12-02-2026 16:00,DNISI,23.9,24.04,23.86,24.02,165019.0,0.02,0.12,0.01,1100.0,0.12,88327.7,86.83,0.17,True,55.96,0.04,0.08,-0.04,2026-02-12,23.8,0.92,0,,23.78,24.76,False,False
12-02-2026 16:00,KOCMT,2.78,2.79,2.77,2.79,4754471.0,0.0,0.01,0.0,233.33,0.01,2397484.1,98.31,0.0,True,63.6,0.01,0.01,0.0,2026-02-12,2.74,1.82,0,,2.74,2.8,False,False
12-02-2026 16:00,EGPRO,26.62,27.08,26.44,27.0,524937.0,0.08,0.38,0.05,660.0,0.38,147908.4,254.91,0.21,True,68.08,0.2,0.17,0.03,2026-02-12,26.4,2.27,0,,25.72,ATH,False,False
12-02-2026 16:00,SANFM,7.27,7.49,7.26,7.46,2754908.0,0.03,0.19,0.02,1017.65,0.19,724596.8,280.2,0.16,True,63.76,-0.01,-0.02,0.01,2026-02-12,7.26,2.75,1,7.49,7.21,7.49,True,True
12-02-2026 16:00,BNTAS,6.77,6.87,6.77,6.85,2102289.0,0.02,0.08,0.01,566.67,0.08,785471.4,167.65,0.25,True,68.67,0.03,0.02,0.01,2026-02-12,6.67,2.7,1,6.87,6.61,6.87,False,False
12-02-2026 15:00,KCHOL,217.1,223.2,216.9,222.9,9934601.0,0.3,5.8,1.17,395.73,5.8,6124893.7,62.2,0.05,True,83.13,2.66,1.25,1.41,2026-02-12,207.4,7.47,0,,203.5,ATH,False,False
12-02-2026 15:00,RYSAS,18.9,19.14,18.87,19.13,2684423.0,0.01,0.23,0.04,489.74,0.23,1340517.5,100.25,0.04,True,52.66,-0.14,-0.19,0.05,2026-02-12,18.85,1.49,0,,18.49,20.38,False,False
12-02-2026 15:00,OSMEN,8.46,8.6,8.46,8.56,636020.0,0.04,0.1,0.01,1011.11,0.1,158103.4,302.28,0.4,True,64.73,0.03,0.03,0.0,2026-02-12,8.39,2.03,0,,8.11,8.65,False,False
12-02-2026 15:00,PENTA,14.51,14.7,14.49,14.65,663847.0,0.05,0.14,0.02,833.33,0.14,248002.5,167.68,0.36,True,64.25,0.05,0.05,0.0,2026-02-12,14.45,1.38,0,,14.39,14.69,False,False
12-02-2026 15:00,XBANK,20153.53,20474.74,20141.03,20453.01,297644399.0,21.73,299.48,107.37,178.94,299.48,193290657.4,53.99,0.07,True,84.12,230.06,113.94,116.12,2026-02-12,19267.66,6.15,0,,18970.78,ATH,False,False
12-02-2026 15:00,LMKDC,31.76,32.02,31.68,32.0,554392.0,0.02,0.24,0.04,445.45,0.24,347707.6,59.44,0.08,True,62.79,0.09,0.04,0.06,2026-02-12,31.3,2.24,0,,30.98,32.06,False,False
12-02-2026 15:00,LIDFA,3.11,3.15,3.09,3.15,3002320.0,0.0,0.04,0.0,1233.33,0.04,969596.1,209.65,0.0,True,62.01,0.01,0.0,0.0,2026-02-12,3.09,1.94,0,,3.05,3.22,False,False
12-02-2026 15:00,SAHOL,108.5,111.2,108.4,111.0,12761745.0,0.2,2.5,0.58,331.03,2.5,6145381.5,107.66,0.08,True,82.13,1.14,0.41,0.73,2026-02-12,103.9,6.83,0,,101.9,ATH,False,False
12-02-2026 15:00,TSKB,13.91,14.15,13.9,14.14,14016923.0,0.01,0.23,0.06,289.83,0.23,5640293.4,148.51,0.04,True,85.13,0.15,0.1,0.05,2026-02-12,13.59,4.05,0,,13.22,14.15,False,False
12-02-2026 15:00,ICUGS,2.73,2.79,2.71,2.78,6354541.0,0.01,0.05,0.01,455.56,0.05,3059699.6,107.69,0.2,True,73.38,0.03,0.02,0.01,2026-02-12,2.73,1.83,0,,2.61,ATH,False,False
12-02-2026 15:00,KMPUR,15.77,15.92,15.76,15.9,294978.0,0.02,0.13,0.01,983.33,0.13,186404.8,58.25,0.15,True,59.13,0.03,0.02,0.01,2026-02-12,15.62,1.79,0,,15.55,16.17,False,False
12-02-2026 15:00,YKBNK,41.46,42.16,41.38,42.12,42525731.0,0.04,0.66,0.2,236.73,0.66,28206939.0,50.76,0.06,True,83.46,0.49,0.29,0.2,2026-02-12,39.78,5.88,0,,39.08,ATH,False,False
12-02-2026 15:00,TSPOR,1.09,1.11,1.09,1.11,88843435.0,0.0,0.02,0.0,400.0,0.02,56558299.8,57.08,0.0,True,64.81,0.0,0.0,0.0,2026-02-12,1.09,1.83,0,,1.07,ATH,False,False
12-02-2026 15:00,VESBE,8.53,8.6,8.51,8.58,1258176.0,0.02,0.05,0.01,455.56,0.05,806942.3,55.92,0.4,True,66.12,0.03,0.02,0.01,2026-02-12,8.4,2.14,0,,8.39,8.6,False,False
12-02-2026 15:00,ISMEN,48.9,49.62,48.9,49.6,1328521.0,0.02,0.7,0.14,414.71,0.7,732973.5,81.25,0.03,True,81.3,0.35,0.24,0.11,2026-02-12,48.04,3.25,0,,47.14,ATH,False,False
12-02-2026 15:00,ASELS,297.0,302.0,296.5,301.5,7322743.0,0.5,4.5,0.55,718.18,4.5,3549610.7,106.3,0.11,True,68.93,0.7,0.47,0.23,2026-02-12,294.0,2.55,0,,291.5,304.0,False,False
12-02-2026 15:00,BMSTL,112.1,116.4,111.8,116.1,1183526.0,0.3,4.0,0.29,1279.31,4.0,246116.4,380.88,0.08,True,75.05,0.58,0.38,0.21,2026-02-12,111.4,4.22,0,,110.6,ATH,False,False
12-02-2026 15:00,ENKAI,98.45,100.0,98.2,99.95,2546149.0,0.05,1.5,0.35,322.54,1.5,1147280.7,121.93,0.03,True,77.11,0.65,0.26,0.39,2026-02-12,96.0,4.11,0,,94.15,ATH,False,False
12-02-2026 15:00,AEFES,20.76,21.12,20.7,21.1,14588836.0,0.02,0.34,0.04,672.73,0.34,6373360.0,128.9,0.06,True,71.25,0.12,0.07,0.05,2026-02-12,20.44,3.23,0,,19.99,ATH,False,False
12-02-2026 15:00,AGHOL,35.28,35.8,35.28,35.76,1496787.0,0.04,0.48,0.08,531.58,0.48,715315.7,109.25,0.08,True,66.31,0.04,-0.06,0.1,2026-02-12,34.8,2.76,0,,34.18,36.3,False,False
12-02-2026 15:00,AKBNK,88.8,90.5,88.75,90.4,29633291.0,0.1,1.6,0.57,180.7,1.6,19414703.9,52.63,0.06,True,83.79,1.01,0.33,0.68,2026-02-12,83.95,7.68,0,,82.65,ATH,False,False
12-02-2026 15:00,FROTO,123.7,125.9,123.3,125.8,3368276.0,0.1,2.1,0.52,303.85,2.1,2095090.9,60.77,0.05,True,78.05,1.65,1.14,0.51,2026-02-12,120.2,4.66,0,,114.1,ATH,False,False
12-02-2026 15:00,ALARK,112.6,113.9,112.6,113.8,1701071.0,0.1,1.2,0.15,700.0,1.2,1037896.1,63.9,0.08,True,63.56,0.04,-0.17,0.22,2026-02-12,110.1,3.36,0,,109.8,114.6,False,False
12-02-2026 15:00,GARAN,160.0,163.2,159.7,163.0,12824872.0,0.2,3.0,0.65,361.54,3.0,5221114.0,145.63,0.07,True,77.03,0.98,0.17,0.81,2026-02-12,154.5,5.5,0,,152.6,169.7,False,False
12-02-2026 14:00,SASA,2.59,2.66,2.58,2.65,1439200040.0,0.01,0.06,0.0,2900.0,0.06,628291973.8,129.07,0.17,True,66.79,0.02,0.02,0.0,2026-02-12,2.54,4.33,0,,2.5,ATH,False,False
12-02-2026 14:00,KRONT,15.95,16.32,15.95,16.31,517329.0,0.01,0.36,0.01,2900.0,0.36,234741.4,120.38,0.03,True,60.75,0.11,0.12,-0.02,2026-02-12,16.1,1.3,0,,15.55,ATH,False,False
12-02-2026 14:00,EREGL,29.68,29.94,29.66,29.88,30729198.0,0.06,0.2,0.04,376.19,0.2,15389325.8,99.68,0.3,True,66.84,0.09,0.04,0.05,2026-02-12,29.24,2.19,0,,28.86,30.22,False,False
12-02-2026 13:00,MIATK,38.24,38.94,38.24,38.9,4965143.0,0.04,0.66,0.07,900.0,0.66,2204949.9,125.18,0.06,True,73.57,0.33,0.28,0.05,2026-02-12,37.98,2.42,0,,37.46,ATH,False,False
12-02-2026 13:00,TOASO,317.75,325.5,317.75,325.5,1797261.0,0.0,7.75,0.92,737.84,7.75,642836.0,179.58,0.0,True,66.88,0.72,-0.51,1.23,2026-02-12,315.25,3.25,0,,307.25,332.25,False,False
12-02-2026 13:00,FRIGO,9.45,9.63,9.42,9.63,5971873.0,0.0,0.18,0.06,210.34,0.18,2716534.0,119.83,0.0,True,78.72,0.14,0.13,0.02,2026-02-12,9.1,5.82,0,,8.47,ATH,False,False
12-02-2026 13:00,SELVA,2.57,2.64,2.57,2.63,12487591.0,0.01,0.06,0.01,500.0,0.06,6655219.6,87.64,0.17,True,62.24,-0.01,-0.02,0.01,2026-02-12,2.5,5.2,1,2.64,2.48,2.64,False,False
12-02-2026 13:00,VAKFN,2.09,2.13,2.08,2.13,47381230.0,0.0,0.04,0.01,700.0,0.04,9837048.3,381.66,0.0,True,71.8,0.01,0.0,0.0,2026-02-12,2.05,3.9,0,,2.05,ATH,False,False
12-02-2026 13:00,KRDMA,29.3,29.62,29.28,29.6,621611.0,0.02,0.3,0.04,689.47,0.3,404422.4,53.7,0.07,True,65.71,0.13,0.11,0.02,2026-02-12,29.28,1.09,0,,28.7,29.72,False,False
12-02-2026 12:00,BORSK,6.38,6.45,6.38,6.44,1670361.0,0.01,0.06,0.0,2900.0,0.06,1005241.9,66.17,0.17,True,56.14,0.02,0.03,-0.01,2026-02-12,6.44,0.0,0,,6.33,6.55,False,False
12-02-2026 12:00,GESAN,57.15,58.0,57.1,57.95,1122246.0,0.05,0.8,0.11,595.65,0.8,452293.2,148.12,0.06,True,67.21,0.29,0.12,0.17,2026-02-12,56.55,2.48,0,,55.4,60.75,False,False
12-02-2026 12:00,GSDDE,10.22,10.39,10.22,10.35,434697.0,0.04,0.13,0.02,519.05,0.13,171914.0,152.86,0.31,True,65.93,0.05,0.03,0.02,2026-02-12,10.22,1.27,0,,9.97,ATH,False,False
12-02-2026 12:00,KOTON,16.78,16.9,16.73,16.89,440151.0,0.01,0.11,0.01,1122.22,0.11,271999.8,61.82,0.09,True,46.02,-0.15,-0.18,0.03,2026-02-12,16.65,1.44,0,,16.17,18.24,True,False
12-02-2026 12:00,GSDHO,5.15,5.21,5.15,5.2,1070824.0,0.01,0.05,0.01,400.0,0.05,572618.4,87.0,0.2,True,67.62,0.02,0.01,0.0,2026-02-12,5.09,2.16,0,,5.06,5.25,False,False
12-02-2026 12:00,LRSHO,4.11,4.16,4.09,4.15,5037151.0,0.01,0.04,0.0,1900.0,0.04,2919830.4,72.52,0.25,True,55.03,-0.01,-0.02,0.0,2026-02-12,4.07,1.97,0,,4.05,4.27,False,False
12-02-2026 12:00,DESA,11.88,11.95,11.88,11.95,109691.0,0.0,0.07,0.01,900.0,0.07,71584.9,53.23,0.0,True,54.23,-0.0,-0.0,0.0,2026-02-12,11.89,0.5,0,,11.82,12.17,False,False
12-02-2026 12:00,INDES,8.28,8.34,8.27,8.34,871523.0,0.0,0.06,0.0,1100.0,0.06,467158.7,86.56,0.0,True,49.21,-0.04,-0.04,0.0,2026-02-12,8.24,1.21,0,,8.22,8.57,True,True
12-02-2026 11:00,KOPOL,5.86,6.22,5.84,6.21,5904795.0,0.01,0.35,0.03,960.61,0.35,1043431.0,465.9,0.03,True,73.54,0.01,-0.01,0.02,2026-02-12,5.82,6.7,0,,5.82,ATH,False,False
12-02-2026 11:00,OYAKC,26.52,26.82,26.44,26.82,4061918.0,0.0,0.3,0.08,284.62,0.3,1772476.5,129.17,0.0,True,66.96,0.07,0.01,0.06,2026-02-12,26.24,2.21,0,,25.68,26.86,False,False
12-02-2026 11:00,ISFIN,20.16,20.42,20.12,20.42,330221.0,0.0,0.26,0.04,584.21,0.26,163651.1,101.78,0.0,True,60.07,-0.02,-0.03,0.01,2026-02-12,20.0,2.1,0,,19.99,20.6,False,False
12-02-2026 11:00,DSTKF,881.0,899.5,878.5,897.0,141729.0,2.5,16.0,3.85,315.58,16.0,76409.4,85.49,0.16,True,71.44,10.65,8.53,2.12,2026-02-12,866.0,3.58,0,,767.5,ATH,False,False
12-02-2026 11:00,EKOS,5.88,5.93,5.85,5.93,2430295.0,0.0,0.05,0.01,733.33,0.05,1024519.0,137.21,0.0,True,61.69,0.01,0.0,0.0,2026-02-12,5.85,1.37,0,,5.82,6.04,False,False
12-02-2026 11:00,BTCIM,4.92,5.0,4.91,4.98,28361077.0,0.02,0.06,0.01,757.14,0.06,10331942.3,174.5,0.33,True,60.72,0.01,0.01,0.0,2026-02-12,4.93,1.01,0,,4.9,5.03,False,False
12-02-2026 11:00,BULGS,46.74,47.82,46.66,47.62,2237754.0,0.2,0.88,0.05,1660.0,0.88,771636.6,190.0,0.23,True,62.07,-0.01,0.0,-0.01,2026-02-12,46.2,3.07,1,47.82,45.78,47.82,False,False
12-02-2026 11:00,ASTOR,176.8,180.2,176.0,179.6,9849996.0,0.6,2.8,1.1,154.55,2.8,4776093.0,106.24,0.21,True,86.85,4.3,3.31,0.98,2026-02-12,173.0,3.82,0,,149.0,ATH,False,False
12-02-2026 11:00,DMLKT,5.79,5.81,5.79,5.81,1551572.0,0.0,0.02,0.0,1900.0,0.02,940874.6,64.91,0.0,True,59.96,-0.0,-0.0,0.0,2026-02-12,5.79,0.35,1,5.81,5.77,5.82,False,False
12-02-2026 11:00,MARTI,2.96,3.0,2.94,3.0,9259602.0,0.0,0.04,0.01,566.67,0.04,4575662.2,102.37,0.0,True,78.73,0.03,0.03,0.01,2026-02-12,2.91,3.09,0,,2.7,ATH,False,False
12-02-2026 11:00,TUPRS,217.9,219.2,217.2,218.9,4451362.0,0.3,1.0,0.14,614.29,1.0,2595044.4,71.53,0.3,True,55.29,-0.84,-1.44,0.6,2026-02-12,215.9,1.39,0,,213.5,237.7,True,False
12-02-2026 10:00,GOODY,15.97,16.12,15.92,16.1,193901.0,0.02,0.13,0.02,465.22,0.13,59481.4,225.99,0.15,True,61.13,0.0,-0.01,0.01,2026-02-12,15.92,1.13,0,,15.78,16.25,False,False
12-02-2026 10:00,GOKNR,21.98,22.16,21.96,22.16,845355.0,0.0,0.18,0.02,718.18,0.18,339348.0,149.11,0.0,True,60.17,-0.0,-0.02,0.01,2026-02-12,21.88,1.28,0,,21.74,22.34,False,False
12-02-2026 10:00,ORCAY,3.8,3.83,3.76,3.83,791447.0,0.0,0.03,0.0,650.0,0.03,343830.3,130.19,0.0,True,59.67,-0.0,-0.0,0.0,2026-02-12,3.8,0.79,0,,3.75,3.85,False,False
12-02-2026 10:00,ECILC,123.9,125.8,122.8,125.5,1525731.0,0.3,1.6,0.03,5233.33,1.6,422969.6,260.72,0.19,True,71.78,1.57,1.57,0.0,2026-02-12,121.9,2.95,1,125.8,118.7,125.8,False,False
12-02-2026 10:00,NIBAS,4.76,4.87,4.74,4.87,7283273.0,0.0,0.11,0.01,900.0,0.11,1219240.8,497.36,0.0,True,93.92,0.24,0.19,0.05,2026-02-12,4.43,9.93,1,4.87,3.67,ATH,False,False
12-02-2026 10:00,MERCN,19.0,19.96,18.97,19.85,5329336.0,0.11,0.85,0.07,1187.88,0.85,1673616.4,218.43,0.13,True,67.24,0.22,0.32,-0.09,2026-02-12,19.0,4.47,0,,18.74,20.28,False,False
12-02-2026 10:00,MAKTK,16.55,17.37,16.55,17.22,3979028.0,0.15,0.67,0.07,900.0,0.67,952520.3,317.74,0.22,True,61.96,-0.01,-0.02,0.02,2026-02-12,16.55,4.05,1,17.37,16.48,17.37,False,False
12-02-2026 10:00,FORMT,3.57,3.64,3.5,3.62,50388472.0,0.02,0.05,0.01,257.14,0.05,11852304.9,325.14,0.4,True,54.37,-0.0,-0.01,0.0,2026-02-12,3.6,0.56,2,3.5,3.5,3.87,False,False
12-02-2026 10:00,ISKPL,12.08,12.49,11.99,12.45,6723993.0,0.04,0.37,0.1,285.42,0.37,2722579.9,146.97,0.11,True,74.79,0.19,0.12,0.06,2026-02-12,12.03,3.49,0,,11.36,ATH,False,False
12-02-2026 10:00,ARZUM,3.4,3.61,3.38,3.57,34873390.0,0.04,0.17,0.02,709.52,0.17,9111362.3,282.75,0.24,True,88.64,0.17,0.16,0.01,2026-02-12,3.38,5.62,0,,2.56,ATH,False,False
12-02-2026 10:00,GLRYH,4.54,4.6,4.54,4.59,1228562.0,0.01,0.05,0.0,900.0,0.05,734260.9,67.32,0.2,True,53.8,-0.01,-0.01,0.0,2026-02-12,4.54,1.1,0,,4.51,4.65,False,False
12-02-2026 10:00,XU100,13795.51,13846.27,13784.8,13846.27,1872683271.0,0.0,50.76,3.93,1192.92,50.76,1229411121.6,52.32,0.0,True,56.91,16.22,17.41,-1.19,2026-02-12,13787.82,0.42,0,,13680.91,13912.94,False,False
12-02-2026 10:00,AKSA,10.81,10.89,10.79,10.88,3335834.0,0.01,0.07,0.01,438.46,0.07,1582325.4,110.82,0.14,True,56.94,0.0,0.0,0.0,2026-02-12,10.8,0.74,2,10.79,10.79,10.99,False,False
12-02-2026 10:00,ULKER,135.7,138.0,135.4,137.6,2834151.0,0.4,1.9,0.45,322.22,1.9,834115.0,239.78,0.21,True,68.61,0.49,0.04,0.44,2026-02-12,134.8,2.08,0,,130.8,138.0,False,False
12-02-2026 10:00,GEREL,25.18,26.12,25.0,26.12,8572328.0,0.0,0.94,0.09,900.0,0.94,1103149.1,677.08,0.0,True,98.58,1.42,1.28,0.14,2026-02-12,23.76,9.93,1,26.12,16.32,ATH,False,False
12-02-2026 10:00,UCAYM,32.1,33.44,31.98,33.26,7548596.0,0.18,1.16,0.1,1083.67,1.16,4126828.2,82.92,0.16,True,45.38,-0.8,-0.83,0.03,2026-02-12,32.2,3.29,2,31.98,31.98,36.88,True,True
12-02-2026 10:00,ARCLK,123.2,127.0,123.2,127.0,1603003.0,0.0,3.8,0.39,874.36,3.8,508505.9,215.24,0.0,True,69.1,0.28,0.08,0.21,2026-02-12,122.7,3.5,0,,121.7,ATH,False,False
12-02-2026 10:00,CANTE,1.77,1.83,1.77,1.82,277058581.0,0.01,0.05,0.0,4900.0,0.05,63620296.2,335.49,0.2,True,57.56,-0.01,-0.01,0.0,2026-02-12,1.76,3.41,0,,1.75,1.87,True,True
12-02-2026 10:00,TDGYO,26.0,27.4,25.82,27.18,274735.0,0.22,1.18,0.13,807.69,1.18,80074.3,243.1,0.19,True,64.89,0.15,-0.02,0.17,2026-02-12,26.02,4.46,1,27.4,23.66,27.4,False,False
12-02-2026 10:00,BARMA,46.8,47.38,46.42,47.24,370612.0,0.14,0.44,0.07,511.11,0.44,245462.1,50.99,0.32,True,74.72,0.61,0.55,0.06,2026-02-12,46.7,1.16,0,,42.82,ATH,False,False
12-02-2026 10:00,SOKM,65.5,66.7,65.4,66.65,1094377.0,0.05,1.15,0.07,1669.23,1.15,475217.7,130.29,0.04,True,65.49,0.38,0.37,0.0,2026-02-12,65.35,1.99,0,,65.0,66.7,False,False
12-02-2026 10:00,GUBRF,550.0,563.5,541.5,561.5,944934.0,2.0,11.5,3.4,238.24,11.5,393095.7,140.38,0.17,True,84.9,8.56,5.02,3.54,2026-02-12,543.0,3.41,0,,514.5,ATH,False,False
12-02-2026 10:00,SNICA,4.61,4.75,4.56,4.74,13411465.0,0.01,0.13,0.01,983.33,0.13,4977594.2,169.44,0.08,True,69.35,0.05,0.05,0.0,2026-02-12,4.58,3.49,2,4.56,4.56,4.77,False,False
12-02-2026 10:00,ISDMR,46.46,46.82,45.74,46.74,1000510.0,0.08,0.28,0.01,3400.0,0.28,349848.5,185.98,0.29,True,68.19,0.48,0.56,-0.08,2026-02-12,46.38,0.78,2,45.74,45.74,47.0,False,False
12-02-2026 10:00,SKBNK,10.27,10.45,10.23,10.4,14304544.0,0.05,0.13,0.02,441.67,0.13,5896215.1,142.61,0.38,True,77.53,0.21,0.2,0.02,2026-02-12,10.14,2.56,0,,9.04,ATH,False,False
12-02-2026 10:00,SISE,47.82,48.18,47.78,48.14,14380640.0,0.04,0.32,0.07,357.14,0.32,8017867.9,79.36,0.12,True,59.18,0.08,0.03,0.05,2026-02-12,47.68,0.96,0,,46.68,48.68,False,False
12-02-2026 10:00,GLRMK,188.1,190.5,188.1,190.3,249083.0,0.2,2.2,0.2,1000.0,2.2,107724.6,131.22,0.09,True,56.61,-0.21,-0.17,-0.04,2026-02-12,187.4,1.55,1,190.5,186.9,190.5,False,False
11-02-2026 17:00,PASEU,139.0,148.0,137.1,148.0,7221141.0,0.0,9.0,1.25,620.0,9.0,1126686.4,540.92,0.0,True,52.72,-3.1,-2.78,-0.33,2026-02-11,143.1,3.42,1,148.0,132.7,160.7,False,False
11-02-2026 17:00,DURDO,3.83,3.89,3.83,3.89,1309089.0,0.0,0.06,0.01,900.0,0.06,697821.2,87.6,0.0,True,71.79,0.02,0.02,0.0,2026-02-11,3.83,1.57,0,,3.79,ATH,False,False
11-02-2026 17:00,LIDER,76.7,77.95,76.65,77.8,186829.0,0.15,1.1,0.08,1275.0,1.1,121533.9,53.73,0.14,True,65.05,0.52,0.55,-0.03,2026-02-11,77.0,1.04,0,,74.3,ATH,False,False
11-02-2026 17:00,DMRGD,4.11,4.28,4.09,4.24,19065525.0,0.04,0.13,0.02,712.5,0.13,4869999.2,291.49,0.31,True,65.32,0.05,0.05,-0.0,2026-02-11,4.1,3.41,0,,3.98,ATH,False,False
11-02-2026 17:00,KNFRT,12.78,13.0,12.78,12.97,876121.0,0.03,0.19,0.01,2275.0,0.19,321776.6,172.28,0.16,True,63.36,0.06,0.07,-0.01,2026-02-11,12.89,0.62,0,,12.34,13.14,False,False
11-02-2026 17:00,KAYSE,5.22,5.4,5.21,5.4,10564859.0,0.0,0.18,0.03,566.67,0.18,3312387.0,218.95,0.0,True,75.3,0.06,0.05,0.01,2026-02-11,5.17,4.45,0,,4.79,ATH,False,False
11-02-2026 17:00,EUPWR,39.7,41.1,39.62,40.86,3339325.0,0.24,1.16,0.13,820.63,1.16,926890.6,260.27,0.21,True,65.75,-0.09,-0.19,0.1,2026-02-11,39.66,3.03,0,,38.92,41.02,False,False
11-02-2026 16:00,ESEN,4.02,4.16,4.02,4.16,29994748.0,0.0,0.14,0.02,566.67,0.14,12022051.6,149.5,0.0,True,82.76,0.03,0.02,0.02,2026-02-11,3.94,5.58,0,,3.91,ATH,False,False
11-02-2026 16:00,CEMTS,12.55,13.01,12.54,13.0,2305725.0,0.01,0.45,0.05,749.06,0.45,601595.5,283.27,0.02,True,79.16,0.07,0.05,0.03,2026-02-11,12.53,3.75,0,,12.42,ATH,False,False
11-02-2026 16:00,KAREL,9.66,9.88,9.66,9.85,4129937.0,0.03,0.19,0.03,578.57,0.19,1464191.5,182.06,0.16,True,78.16,0.13,0.11,0.02,2026-02-11,9.55,3.14,0,,8.85,ATH,False,False
11-02-2026 16:00,MAGEN,44.94,45.92,44.86,45.86,1268999.0,0.06,0.92,0.17,434.88,0.92,549696.7,130.85,0.07,True,68.76,0.57,0.57,0.0,2026-02-11,44.46,3.15,0,,44.26,ATH,False,False
11-02-2026 16:00,AVGYO,13.13,13.72,13.07,13.72,1206132.0,0.0,0.59,0.09,541.3,0.59,537875.2,124.24,0.0,True,72.32,0.18,0.11,0.06,2026-02-11,12.79,7.27,0,,11.89,ATH,False,False
11-02-2026 15:00,SELEC,86.45,87.95,86.45,87.95,415103.0,0.0,1.5,0.14,971.43,1.5,227939.8,82.11,0.0,True,71.62,1.12,0.99,0.12,2026-02-11,85.2,3.23,0,,80.15,ATH,False,False
11-02-2026 15:00,TRCAS,50.9,53.05,50.8,52.95,614134.0,0.1,2.05,0.34,506.51,2.05,176815.5,247.33,0.05,True,70.8,0.14,-0.06,0.19,2026-02-11,50.05,5.79,0,,49.44,ATH,False,False
11-02-2026 15:00,SUWEN,8.75,9.03,8.75,9.0,2377613.0,0.03,0.25,0.04,575.68,0.25,449665.9,428.75,0.12,True,72.16,0.05,0.02,0.02,2026-02-11,8.71,3.33,0,,8.62,ATH,False,False
11-02-2026 14:00,METRO,5.66,5.99,5.65,5.99,8307521.0,0.0,0.33,0.03,964.52,0.33,1687961.7,392.16,0.0,True,75.51,0.07,0.05,0.01,2026-02-11,5.69,5.27,0,,5.64,ATH,False,False
11-02-2026 14:00,MERIT,17.82,18.1,17.82,18.06,1410636.0,0.04,0.24,0.02,900.0,0.24,474318.6,197.4,0.17,True,66.38,0.16,0.2,-0.04,2026-02-11,17.87,1.06,0,,16.52,18.2,False,False
11-02-2026 14:00,IHLAS,2.33,2.38,2.32,2.38,57446102.0,0.0,0.05,0.01,614.29,0.05,15493402.8,270.78,0.0,True,73.59,0.01,0.0,0.0,2026-02-11,2.3,3.48,0,,2.29,2.4,False,False
11-02-2026 13:00,HEKTS,3.25,3.33,3.24,3.32,38367474.0,0.01,0.07,0.0,6900.0,0.07,15862196.2,141.88,0.14,True,62.02,-0.0,-0.0,-0.0,2026-02-11,3.24,2.47,0,,3.21,3.44,False,False
11-02-2026 13:00,BOSSA,7.04,7.12,7.03,7.12,445559.0,0.0,0.08,0.02,400.0,0.08,221441.9,101.21,0.0,True,61.82,0.03,0.03,-0.0,2026-02-11,7.1,0.28,0,,7.0,7.13,False,False
11-02-2026 13:00,MAVI,48.32,49.04,48.3,48.98,1491599.0,0.06,0.66,0.07,816.67,0.66,844483.4,76.63,0.09,True,67.06,0.21,0.19,0.02,2026-02-11,48.46,1.07,0,,47.8,ATH,False,False
11-02-2026 12:00,TAVHL,354.25,357.75,354.25,357.5,297278.0,0.25,3.25,0.2,1525.0,3.25,189686.0,56.72,0.08,True,49.1,-1.25,-0.43,-0.82,2026-02-11,354.0,0.99,0,,350.0,369.0,False,False
11-02-2026 12:00,ISCTR,16.82,17.0,16.81,16.95,107591695.0,0.05,0.13,0.02,584.21,0.13,68582465.7,56.88,0.38,True,54.58,0.01,0.01,-0.0,2026-02-11,16.93,0.12,0,,16.65,17.14,False,False
11-02-2026 12:00,EFOR,22.24,23.2,22.2,23.12,2685037.0,0.08,0.88,0.22,303.67,0.88,1466868.0,83.05,0.09,True,62.48,-0.0,-0.06,0.06,2026-02-11,22.34,3.49,0,,21.42,24.06,False,False
11-02-2026 12:00,OFSYM,74.55,76.25,74.4,76.25,289083.0,0.0,1.7,0.2,729.27,1.7,166351.7,73.78,0.0,True,70.31,0.88,0.86,0.02,2026-02-11,74.65,2.14,0,,70.0,ATH,False,False
11-02-2026 11:00,ALVES,4.12,4.29,4.1,4.27,96982938.0,0.02,0.15,0.03,383.87,0.15,26420894.0,267.07,0.13,True,70.29,0.02,-0.01,0.02,2026-02-11,4.0,6.75,0,,3.91,4.59,False,False
11-02-2026 11:00,SERNT,8.37,8.68,8.33,8.65,3476994.0,0.03,0.28,0.03,865.52,0.28,890334.2,290.53,0.11,True,77.5,0.06,0.05,0.01,2026-02-11,8.4,2.98,0,,8.29,ATH,False,False
11-02-2026 11:00,SARKY,41.0,42.06,40.84,42.0,6068731.0,0.06,1.0,0.1,941.67,1.0,2449165.1,147.79,0.06,True,53.76,-0.32,-0.38,0.06,2026-02-11,41.02,2.39,0,,40.4,44.28,False,False
11-02-2026 11:00,SILVR,2.83,2.87,2.82,2.86,468422.0,0.01,0.03,0.0,1400.0,0.03,292086.3,60.37,0.33,True,53.43,-0.0,-0.01,0.0,2026-02-11,2.84,0.7,0,,2.8,2.91,False,False
11-02-2026 11:00,BIOEN,19.54,19.82,19.47,19.75,377791.0,0.07,0.21,0.0,10400.0,0.21,227393.3,66.14,0.33,True,51.36,-0.01,0.01,-0.02,2026-02-11,19.69,0.3,0,,19.45,20.2,False,False
11-02-2026 10:00,CEOEM,22.1,23.0,22.1,22.84,635896.0,0.16,0.74,0.09,740.91,0.74,120740.1,426.67,0.22,True,70.07,0.12,0.09,0.02,2026-02-11,22.32,2.33,2,22.1,22.1,23.48,False,False
11-02-2026 10:00,PLTUR,22.8,24.52,22.58,24.04,3881235.0,0.48,1.24,0.16,656.1,1.24,600771.4,546.04,0.39,True,82.93,0.34,0.23,0.11,2026-02-11,22.78,5.53,0,,21.46,ATH,False,False
11-02-2026 10:00,TMSN,111.4,118.3,110.7,117.1,1342718.0,1.2,5.7,0.43,1225.58,5.7,186795.6,618.82,0.21,True,77.72,0.78,0.59,0.19,2026-02-11,111.4,5.12,3,,106.2,ATH,False,False
11-02-2026 10:00,SRVGY,3.41,3.46,3.4,3.45,6610801.0,0.01,0.04,0.0,1900.0,0.04,2618749.3,152.44,0.25,True,60.78,0.01,0.01,0.0,2026-02-11,3.42,0.88,2,3.4,3.4,3.46,False,False
11-02-2026 10:00,INVEO,9.32,10.07,9.22,9.95,11776823.0,0.12,0.63,0.07,854.55,0.63,1691906.4,596.07,0.19,True,83.16,0.08,0.04,0.04,2026-02-11,9.32,6.76,2,9.22,9.22,ATH,False,False
11-02-2026 10:00,KARSN,10.15,10.3,10.12,10.26,2241480.0,0.04,0.11,0.01,1275.0,0.11,1015869.6,120.65,0.36,True,52.47,0.02,0.04,-0.02,2026-02-11,10.22,0.39,2,10.12,10.12,10.48,False,False
11-02-2026 10:00,JANTS,19.49,20.24,19.39,20.06,4544716.0,0.18,0.57,0.05,1017.65,0.57,616110.2,637.65,0.32,True,77.54,0.06,0.03,0.03,2026-02-11,19.49,2.92,3,,19.23,ATH,False,False
11-02-2026 10:00,DZGYO,8.99,9.87,8.97,9.7,5420473.0,0.17,0.71,0.06,1026.98,0.71,769885.5,604.06,0.24,True,81.45,0.07,0.04,0.03,2026-02-11,8.99,7.9,2,8.97,8.97,ATH,False,False
11-02-2026 10:00,KLRHO,576.5,613.5,569.5,607.0,610903.0,6.5,30.5,1.95,1464.1,30.5,253683.7,140.81,0.21,True,57.51,-2.81,-4.47,1.66,2026-02-11,576.5,5.29,1,613.5,560.5,613.5,False,False
11-02-2026 10:00,KRDMB,34.54,35.12,34.04,35.1,213139.0,0.02,0.56,0.1,471.43,0.56,138215.8,54.21,0.04,True,73.11,0.31,0.19,0.12,2026-02-11,34.56,1.56,0,,32.98,35.3,False,False
11-02-2026 10:00,MNDRS,15.06,15.2,14.96,15.16,590308.0,0.04,0.1,0.0,2400.0,0.1,255425.4,131.11,0.4,True,59.61,0.1,0.11,-0.01,2026-02-11,15.08,0.53,2,14.96,14.96,15.46,False,False
11-02-2026 10:00,GLYHO,15.25,15.67,15.25,15.58,1184911.0,0.09,0.33,0.05,547.06,0.33,582083.5,103.56,0.27,True,58.7,-0.0,-0.01,0.01,2026-02-11,15.39,1.23,1,15.67,15.15,15.67,False,False
11-02-2026 10:00,AKHAN,29.98,31.46,29.58,31.46,13202929.0,0.0,1.48,0.15,900.0,1.48,3601827.9,266.56,0.0,True,100.0,1.04,0.83,0.21,2026-02-11,28.6,10.0,1,31.46,28.6,ATH,False,False
11-02-2026 10:00,EDIP,37.86,38.5,37.52,38.34,426319.0,0.16,0.48,0.04,1163.16,0.48,94716.1,350.1,0.33,True,68.28,0.25,0.22,0.02,2026-02-11,37.74,1.59,2,37.52,37.52,38.66,False,False
11-02-2026 10:00,VAKFA,14.13,14.59,14.06,14.52,20510682.0,0.07,0.39,0.03,1200.0,0.39,4706146.6,335.83,0.18,True,77.62,0.21,0.22,-0.01,2026-02-11,14.03,3.49,1,14.59,13.97,14.59,False,False
11-02-2026 10:00,TURSG,12.43,12.66,12.36,12.6,23970655.0,0.06,0.17,0.03,529.63,0.17,12013363.9,99.53,0.35,True,67.51,0.18,0.16,0.02,2026-02-11,12.45,1.2,2,12.36,12.36,12.78,False,False
10-02-2026 17:00,RUBNS,32.76,35.0,32.7,34.78,4173742.0,0.22,2.02,0.24,734.71,2.02,1113028.9,274.99,0.11,True,73.47,1.03,0.81,0.22,2026-02-10,32.12,8.28,0,,28.18,ATH,False,False
10-02-2026 17:00,CATES,41.5,42.08,41.46,42.08,183164.0,0.0,0.58,0.03,1712.5,0.58,101638.5,80.21,0.0,True,59.6,0.16,0.12,0.04,2026-02-10,41.54,1.3,1,42.08,39.08,42.16,False,False
10-02-2026 17:00,IMASM,4.49,4.92,4.49,4.92,49496282.0,0.0,0.43,0.05,814.89,0.43,8163192.6,506.33,0.0,True,81.77,0.05,0.01,0.03,2026-02-10,4.48,9.82,0,,4.42,ATH,False,False
10-02-2026 17:00,SAYAS,43.46,45.98,43.42,45.98,1526381.0,0.0,2.52,0.4,533.17,2.52,343749.7,344.04,0.0,True,86.22,0.82,0.5,0.33,2026-02-10,41.8,10.0,0,,39.74,ATH,False,False
10-02-2026 16:00,ENSRI,28.04,29.28,28.04,29.18,1584768.0,0.1,1.14,0.16,621.52,1.14,503791.1,214.57,0.09,True,76.58,0.43,0.37,0.06,2026-02-10,27.5,6.11,0,,26.3,ATH,False,False
10-02-2026 16:00,BLUME,47.1,48.34,47.04,48.12,791005.0,0.22,1.02,0.15,571.05,1.02,327406.0,141.6,0.22,True,77.3,0.6,0.43,0.18,2026-02-10,46.2,4.16,0,,43.88,ATH,False,False
10-02-2026 15:00,SURGY,52.85,53.95,52.6,53.85,806512.0,0.1,1.0,0.15,566.67,1.0,298952.9,169.78,0.1,True,68.89,0.22,0.05,0.17,2026-02-10,51.95,3.66,0,,50.55,55.2,False,False
10-02-2026 14:00,ATAKP,57.2,57.95,57.2,57.9,151351.0,0.05,0.7,0.13,418.52,0.7,59987.4,152.3,0.07,True,60.98,0.11,-0.03,0.15,2026-02-10,57.6,0.52,0,,55.25,60.4,False,False
10-02-2026 14:00,KTLEV,39.08,40.08,39.02,40.04,11749321.0,0.04,0.96,0.24,306.78,0.96,4907245.5,139.43,0.04,True,80.55,0.67,0.43,0.24,2026-02-10,37.66,6.32,0,,34.68,ATH,False,False
10-02-2026 14:00,BUCIM,6.98,7.07,6.98,7.07,4954171.0,0.0,0.09,0.02,309.09,0.09,1886303.0,162.64,0.0,True,79.48,0.04,0.02,0.03,2026-02-10,6.85,3.21,0,,6.72,ATH,False,False
10-02-2026 12:00,KZGYO,26.3,26.58,26.3,26.58,214544.0,0.0,0.28,0.07,288.89,0.28,111651.4,92.16,0.0,True,69.48,0.07,-0.03,0.1,2026-02-10,25.9,2.63,0,,25.4,26.88,False,False
10-02-2026 12:00,ONRYT,69.65,71.55,69.6,71.1,373339.0,0.45,1.45,0.28,408.77,1.45,91461.7,308.19,0.31,True,77.25,0.45,0.21,0.24,2026-02-10,68.75,3.42,0,,66.75,ATH,False,False
10-02-2026 12:00,KLSER,28.76,29.1,28.72,29.04,481325.0,0.06,0.28,0.04,636.84,0.28,172229.1,179.47,0.21,True,71.25,0.14,0.11,0.03,2026-02-10,28.68,1.26,0,,28.06,29.36,False,False
10-02-2026 11:00,GMTAS,27.14,27.62,26.96,27.52,982450.0,0.1,0.38,0.04,955.56,0.38,392171.7,150.52,0.26,True,73.16,0.47,0.39,0.08,2026-02-10,27.0,1.93,1,27.62,24.42,27.62,False,False
10-02-2026 11:00,FZLGY,12.38,12.8,12.38,12.69,2924315.0,0.11,0.31,0.03,839.39,0.31,724120.3,303.84,0.35,True,67.65,0.09,0.04,0.04,2026-02-10,12.52,1.36,0,,12.0,ATH,False,False
10-02-2026 11:00,CUSAN,30.3,31.68,30.2,31.48,315068.0,0.2,1.18,0.02,5800.0,1.18,207506.8,51.84,0.17,True,61.06,0.44,0.46,-0.01,2026-02-10,31.14,1.09,0,,27.8,32.3,False,False
10-02-2026 11:00,NATEN,8.41,8.5,8.41,8.48,1792365.0,0.02,0.07,0.01,775.0,0.07,803537.6,123.06,0.29,True,59.41,0.01,-0.01,0.01,2026-02-10,8.4,0.95,1,8.5,8.26,8.5,False,False
10-02-2026 11:00,ARFYE,31.02,32.84,31.0,32.78,12408302.0,0.06,1.76,0.34,417.65,1.76,4409519.9,181.4,0.03,True,80.6,0.71,0.4,0.31,2026-02-10,31.3,4.73,0,,28.28,ATH,False,False
10-02-2026 11:00,AKGRT,8.47,8.61,8.44,8.61,4186352.0,0.0,0.14,0.01,900.0,0.14,1472125.1,184.37,0.0,True,67.77,0.04,0.02,0.02,2026-02-10,8.38,2.74,0,,7.86,8.71,False,False
10-02-2026 11:00,AVHOL,39.14,39.74,39.14,39.74,209530.0,0.0,0.6,0.1,500.0,0.6,111351.0,88.17,0.0,True,71.32,0.3,0.21,0.09,2026-02-10,39.26,1.22,0,,37.72,ATH,False,False
10-02-2026 11:00,SAMAT,5.96,6.06,5.94,6.05,512325.0,0.01,0.09,0.02,328.57,0.09,209855.3,144.13,0.11,True,74.4,0.06,0.04,0.02,2026-02-10,5.92,2.2,0,,5.69,ATH,False,False
10-02-2026 10:00,ZERGY,21.06,22.16,21.06,22.0,25887427.0,0.16,0.94,0.21,354.11,0.94,7329796.1,253.18,0.17,True,76.42,0.66,0.38,0.29,2026-02-10,20.5,7.32,0,,16.22,ATH,False,False
10-02-2026 10:00,ISSEN,7.6,7.75,7.58,7.72,614808.0,0.03,0.12,0.01,1100.0,0.12,187895.7,227.21,0.25,True,70.63,0.02,-0.0,0.02,2026-02-10,7.56,2.12,0,,7.36,7.77,False,False
10-02-2026 10:00,ENERY,9.54,9.75,9.51,9.73,4586308.0,0.02,0.19,0.02,850.0,0.19,1351469.2,239.36,0.11,True,61.91,-0.03,-0.06,0.03,2026-02-10,9.53,2.1,0,,9.33,10.24,True,False
10-02-2026 10:00,KLYPV,64.85,69.9,64.5,69.0,3770103.0,0.9,4.15,0.29,1331.03,4.15,680602.9,453.94,0.22,True,65.55,-0.42,-0.64,0.23,2026-02-10,64.6,6.81,3,,64.5,74.9,True,True
10-02-2026 10:00,BIGEN,10.12,10.48,10.05,10.42,7644747.0,0.06,0.3,0.07,310.96,0.3,2040271.3,274.69,0.2,True,80.19,0.13,0.06,0.07,2026-02-10,10.11,3.07,0,,9.43,ATH,False,False
10-02-2026 10:00,AKSEN,68.3,69.75,67.95,69.7,1544403.0,0.05,1.4,0.05,2700.0,1.4,566452.8,172.64,0.04,True,51.72,-0.59,-0.85,0.25,2026-02-10,68.3,2.05,2,67.95,67.95,70.05,True,False
10-02-2026 10:00,ALKLC,248.2,259.5,248.2,259.0,340389.0,0.5,10.8,0.94,1055.08,10.8,112378.1,202.9,0.05,True,60.39,-2.49,-3.15,0.65,2026-02-10,248.0,4.44,0,,245.5,282.5,True,True
10-02-2026 10:00,GENIL,8.39,9.11,8.35,9.0,40302484.0,0.11,0.61,0.08,672.15,0.61,7982467.23,404.89,0.18,True,82.96,0.14,0.08,0.05,2026-02-10,8.33,8.0,0,,7.77,ATH,False,False
09-02-2026 17:00,AKFYE,19.14,19.36,19.14,19.33,1379400.0,0.03,0.19,0.02,955.56,0.19,734357.8,87.84,0.16,True,41.56,-0.33,-0.39,0.06,2026-02-09,19.03,1.58,0,,18.8,21.84,True,True
09-02-2026 17:00,PRZMA,11.66,11.97,11.66,11.89,243584.0,0.08,0.23,0.03,576.47,0.23,88029.7,176.71,0.35,True,55.78,-0.04,-0.12,0.08,2026-02-09,11.64,2.15,1,11.97,10.8,11.97,False,False
09-02-2026 17:00,BRKVY,112.5,114.3,112.5,114.2,165511.0,0.1,1.7,0.07,2328.57,1.7,81104.3,104.07,0.06,True,46.56,-1.1,-1.31,0.2,2026-02-09,113.5,0.62,0,,111.7,129.0,True,True
09-02-2026 17:00,AHGAZ,25.22,25.62,25.18,25.52,827067.0,0.1,0.3,0.04,733.33,0.3,407843.1,102.79,0.33,True,60.06,-0.0,-0.1,0.09,2026-02-09,25.16,1.43,0,,24.28,ATH,False,False
09-02-2026 17:00,HDFGS,3.28,3.45,3.28,3.45,59867957.0,0.0,0.17,0.03,431.25,0.17,13893804.9,330.9,0.0,True,73.81,0.03,0.01,0.02,2026-02-09,3.14,9.87,0,,3.11,ATH,False,False
09-02-2026 17:00,ESCAR,27.26,28.0,27.24,28.0,1781065.0,0.0,0.74,0.05,1380.0,0.74,587131.3,203.35,0.0,True,66.6,0.11,0.06,0.04,2026-02-09,27.6,1.45,1,28.0,26.2,28.56,False,False
09-02-2026 17:00,USAK,1.83,1.84,1.82,1.84,17971594.0,0.0,0.01,0.0,400.0,0.01,10885687.3,65.09,0.0,True,47.31,-0.01,-0.01,0.0,2026-02-09,1.82,1.1,0,,1.78,2.13,False,False
09-02-2026 17:00,ALKIM,19.3,19.68,19.24,19.65,1027758.0,0.03,0.35,0.05,548.15,0.35,252276.4,307.39,0.09,True,73.5,0.04,-0.03,0.07,2026-02-09,18.9,3.97,0,,18.72,19.92,False,False
09-02-2026 17:00,TCKRC,88.7,90.15,88.7,90.15,289329.0,0.0,1.45,0.17,752.94,1.45,187020.0,54.7,0.0,True,51.42,-1.08,-1.35,0.27,2026-02-09,87.15,3.44,0,,87.1,96.5,True,True
09-02-2026 17:00,DYOBY,14.12,14.22,14.09,14.2,315054.0,0.02,0.08,0.02,247.83,0.08,181823.2,73.27,0.25,True,58.03,-0.01,-0.03,0.02,2026-02-09,13.88,2.31,0,,13.72,14.99,False,False
09-02-2026 17:00,BIGCH,11.01,11.38,10.92,11.3,2114585.0,0.08,0.29,0.04,590.48,0.29,746198.0,183.38,0.28,True,62.76,0.07,0.05,0.01,2026-02-09,10.98,2.91,0,,10.42,ATH,False,False
09-02-2026 16:00,A1CAP,16.06,16.44,16.03,16.38,2739758.0,0.06,0.32,0.02,1584.21,0.32,1500326.1,82.61,0.19,True,62.14,0.05,0.01,0.03,2026-02-09,16.1,1.74,0,,15.38,16.62,False,False
09-02-2026 16:00,KBORU,18.11,18.89,18.05,18.72,3305522.0,0.17,0.61,0.11,470.09,0.61,1690020.9,95.59,0.28,True,68.97,0.17,0.12,0.05,2026-02-09,17.76,5.41,0,,17.4,19.32,False,False
09-02-2026 14:00,EGSER,3.22,3.27,3.22,3.26,1092923.0,0.01,0.04,0.01,344.44,0.04,501514.5,117.92,0.25,True,66.24,0.02,0.01,0.01,2026-02-09,3.19,2.19,0,,3.14,ATH,False,False
09-02-2026 14:00,ALTNY,15.75,15.97,15.74,15.92,4501521.0,0.05,0.17,0.02,709.52,0.17,1748015.5,157.52,0.29,True,64.0,0.0,-0.03,0.03,2026-02-09,15.64,1.79,0,,15.51,15.98,False,False
09-02-2026 13:00,BINBN,186.9,203.0,186.2,202.6,577184.0,0.4,15.7,0.95,1552.63,15.7,124981.6,361.82,0.03,True,72.7,1.27,1.21,0.06,2026-02-09,188.8,7.31,0,,186.0,203.6,False,False
09-02-2026 12:00,TKFEN,81.4,86.4,81.1,85.45,2408786.0,0.95,4.05,0.64,532.81,4.05,869958.2,176.89,0.23,True,65.18,-0.47,-0.91,0.44,2026-02-09,78.55,8.78,1,86.4,77.5,86.4,True,True
09-02-2026 12:00,AKYHO,2.87,2.95,2.87,2.93,781685.0,0.02,0.06,0.01,1100.0,0.06,228893.7,241.51,0.33,True,58.82,-0.0,-0.0,-0.0,2026-02-09,2.87,2.09,0,,2.81,2.98,False,False
09-02-2026 12:00,VSNMD,97.25,102.0,96.9,101.8,2117423.0,0.2,4.55,0.47,878.49,4.55,413998.6,411.46,0.04,True,81.83,1.55,1.37,0.18,2026-02-09,95.9,6.15,0,,95.55,ATH,False,False
09-02-2026 11:00,SEKUR,4.6,4.98,4.55,4.9,1519000.0,0.08,0.3,0.05,488.24,0.3,606165.8,150.59,0.27,True,66.22,0.12,0.13,-0.01,2026-02-09,4.71,4.03,0,,4.42,ATH,False,False
09-02-2026 11:00,ATLAS,8.86,9.95,8.85,9.89,1139680.0,0.06,1.03,0.1,909.8,1.03,363477.5,213.55,0.06,True,60.21,-0.14,-0.18,0.03,2026-02-09,9.07,9.04,0,,8.5,10.93,True,True
09-02-2026 11:00,YUNSA,9.5,9.95,9.47,9.9,4784176.0,0.05,0.4,0.08,419.48,0.4,1332156.8,259.13,0.12,True,75.67,0.09,0.05,0.05,2026-02-09,9.18,7.84,0,,9.08,ATH,False,False
09-02-2026 10:00,HATSN,41.5,42.44,41.02,42.22,2340707.0,0.22,0.72,0.09,682.61,0.72,386489.1,505.63,0.31,True,35.35,-0.37,0.04,-0.41,2026-02-09,44.52,-5.17,2,41.02,41.02,48.36,False,False
09-02-2026 10:00,GEDIK,5.92,6.01,5.92,5.99,825476.0,0.02,0.07,0.01,536.36,0.07,349988.4,135.86,0.29,True,55.86,-0.03,-0.04,0.01,2026-02-09,5.9,1.53,0,,5.82,6.19,True,True
09-02-2026 10:00,IHGZT,1.55,1.57,1.55,1.57,3394077.0,0.0,0.02,0.0,400.0,0.02,1119146.6,203.27,0.0,True,54.85,-0.01,-0.01,0.0,2026-02-09,1.54,1.95,0,,1.53,1.63,True,True
09-02-2026 10:00,EUREN,5.11,5.18,5.11,5.18,11033769.0,0.0,0.07,0.01,677.78,0.07,3938176.4,180.17,0.0,True,63.28,-0.01,-0.02,0.01,2026-02-09,5.06,2.37,0,,5.01,5.31,True,False
09-02-2026 10:00,FADE,15.78,16.23,15.76,16.17,553273.0,0.06,0.39,0.07,441.67,0.39,131526.0,320.66,0.15,True,70.58,0.03,-0.01,0.05,2026-02-09,15.71,2.93,0,,15.37,ATH,False,False
09-02-2026 10:00,TNZTP,24.68,26.5,24.62,26.28,3505969.0,0.22,1.6,0.09,1639.13,1.6,741285.1,372.96,0.14,True,62.14,-0.32,-0.47,0.15,2026-02-09,24.58,6.92,1,26.5,24.18,26.5,True,True
09-02-2026 10:00,MAKIM,16.42,17.04,16.42,16.88,421269.0,0.16,0.46,0.05,820.0,0.46,101079.7,316.77,0.35,True,61.64,-0.02,-0.05,0.03,2026-02-09,16.4,2.93,1,17.04,16.19,17.04,False,False
09-02-2026 10:00,BIMAS,690.0,701.0,688.5,700.5,1851957.0,0.5,10.5,1.0,950.0,10.5,554989.8,233.69,0.05,True,68.96,1.26,-0.27,1.53,2026-02-09,683.0,2.56,0,,674.0,ATH,False,False
09-02-2026 10:00,AHSGY,24.3,25.02,24.3,24.92,163545.0,0.1,0.62,0.07,761.11,0.62,86889.5,88.22,0.16,True,59.67,0.08,0.09,-0.01,2026-02-09,24.2,2.98,0,,24.02,25.32,False,False
09-02-2026 10:00,SMART,22.92,23.42,22.92,23.34,309458.0,0.08,0.42,0.07,517.65,0.42,77129.0,301.22,0.19,True,71.21,0.0,-0.05,0.05,2026-02-09,22.8,2.37,0,,22.5,ATH,False,False
09-02-2026 10:00,YYLGD,13.63,14.14,13.63,14.01,8044246.0,0.13,0.38,0.09,308.6,0.38,3439557.5,133.87,0.34,True,76.11,0.13,0.02,0.11,2026-02-09,13.54,3.47,0,,12.66,ATH,False,False
09-02-2026 10:00,PRKME,20.5,21.04,20.5,20.98,1412581.0,0.06,0.48,0.07,566.67,0.48,576545.5,145.01,0.12,True,54.49,-0.19,-0.26,0.07,2026-02-09,20.42,2.74,0,,20.18,23.04,True,True
09-02-2026 10:00,GSRAY,1.17,1.2,1.17,1.2,90896122.0,0.0,0.03,0.01,500.0,0.03,16917043.9,437.3,0.0,True,63.81,-0.0,-0.0,0.0,2026-02-09,1.16,3.45,0,,1.16,1.22,False,False
09-02-2026 10:00,BRSAN,691.0,728.5,684.5,718.0,948628.0,10.5,27.0,3.45,682.61,27.0,248862.0,281.19,0.39,True,83.01,10.54,6.41,4.14,2026-02-09,680.0,5.59,0,,647.5,ATH,False,False
09-02-2026 10:00,ADEL,35.48,37.48,35.24,36.94,1663414.0,0.54,1.46,0.27,448.87,1.46,585793.4,183.96,0.37,True,80.9,0.37,0.14,0.22,2026-02-09,35.08,5.3,0,,33.9,ATH,False,False
09-02-2026 10:00,PETKM,17.92,18.42,17.91,18.41,33372090.0,0.01,0.49,0.05,824.53,0.49,7612817.1,338.37,0.02,True,68.83,-0.06,-0.12,0.06,2026-02-09,17.71,3.95,0,,17.41,18.56,False,False
06-02-2026 17:00,EMKEL,20.82,22.04,20.76,22.04,9242499.0,0.0,1.22,0.2,513.07,1.22,3030555.5,204.98,0.0,True,80.65,0.09,-0.09,0.17,2026-02-06,20.04,9.98,0,,19.49,ATH,False,False
06-02-2026 17:00,ULUUN,7.18,7.34,7.18,7.33,889331.0,0.01,0.15,0.01,1400.0,0.15,417940.5,112.79,0.07,True,54.52,-0.04,-0.04,0.0,2026-02-06,7.26,0.96,0,,7.1,7.5,True,True
06-02-2026 17:00,INFO,4.12,4.18,4.1,4.17,5189719.0,0.01,0.05,0.0,4900.0,0.05,2464408.3,110.59,0.2,True,39.98,-0.06,-0.06,0.0,2026-02-06,4.15,0.48,2,4.1,4.1,4.48,True,False
06-02-2026 17:00,AKCNS,192.8,195.7,192.7,195.6,187805.0,0.1,2.8,0.11,2445.45,2.8,79044.0,137.6,0.04,True,56.94,0.2,0.18,0.01,2026-02-06,194.7,0.46,0,,191.0,197.3,False,False
06-02-2026 17:00,LILAK,32.64,33.34,32.48,33.2,1599568.0,0.14,0.56,0.07,677.78,0.56,713174.2,124.29,0.25,True,61.3,0.04,0.01,0.02,2026-02-06,32.56,1.97,0,,32.04,33.52,False,False
06-02-2026 17:00,DOAS,225.9,230.5,225.8,230.4,734629.0,0.1,4.5,0.45,900.0,4.5,269550.9,172.54,0.02,True,65.23,0.23,0.05,0.19,2026-02-06,226.3,1.81,0,,224.0,230.7,False,False
06-02-2026 17:00,YAYLA,27.84,28.9,27.76,28.9,149101.0,0.0,1.06,0.06,1666.67,1.06,77898.6,91.4,0.0,True,60.6,-0.18,-0.2,0.02,2026-02-06,28.06,2.99,1,28.9,28.46,29.76,True,True
06-02-2026 16:00,GLCVY,71.75,74.95,71.65,74.7,573668.0,0.25,2.95,0.4,628.4,2.95,159488.0,259.69,0.08,True,71.76,0.27,-0.06,0.33,2026-02-06,70.25,6.33,0,,70.0,ATH,False,False
06-02-2026 16:00,IZMDC,7.53,7.64,7.5,7.64,1802818.0,0.0,0.11,0.0,5400.0,0.11,831347.0,116.86,0.0,True,49.15,-0.04,-0.03,-0.01,2026-02-06,7.67,-0.39,0,,7.45,7.95,False,False
06-02-2026 14:00,TATEN,10.25,10.54,10.2,10.5,3652561.0,0.04,0.25,0.02,1462.5,0.25,1334869.9,173.63,0.16,True,50.91,-0.14,-0.16,0.03,2026-02-06,10.16,3.35,0,,10.08,ATH,True,True
06-02-2026 13:00,IZFAS,55.5,56.15,55.4,56.05,755011.0,0.1,0.55,0.09,547.06,0.55,457059.6,65.19,0.18,True,62.55,0.06,0.03,0.03,2026-02-06,55.4,1.17,0,,54.75,58.0,False,False
06-02-2026 13:00,EGEGY,32.94,33.54,32.68,33.4,339199.0,0.14,0.46,0.08,447.62,0.46,193458.9,75.33,0.3,True,62.81,0.24,0.23,0.01,2026-02-06,32.96,1.33,1,33.54,30.72,33.54,False,False
06-02-2026 12:00,ARMGD,87.55,90.9,87.55,90.05,758815.0,0.85,2.5,0.38,566.67,2.5,185816.4,308.37,0.34,True,78.46,0.98,0.68,0.3,2026-02-06,85.65,5.14,0,,84.65,ATH,False,False
06-02-2026 11:00,KONKA,15.35,15.5,15.32,15.49,386765.0,0.01,0.14,0.0,4566.67,0.14,229733.1,68.35,0.07,True,53.57,-0.01,-0.01,-0.01,2026-02-06,15.42,0.45,0,,15.19,15.8,False,False
06-02-2026 11:00,HUBVC,3.38,3.64,3.37,3.58,1766549.0,0.06,0.2,0.02,852.38,0.2,533879.4,230.89,0.3,True,65.73,-0.01,-0.02,0.01,2026-02-06,3.32,7.83,0,,3.29,ATH,False,False
06-02-2026 11:00,SMRVA,66.8,68.45,66.6,68.3,1183971.0,0.15,1.5,0.05,2900.0,1.5,424086.8,179.18,0.1,True,52.33,-0.49,-0.44,-0.04,2026-02-06,66.65,2.48,0,,67.05,70.95,False,False
06-02-2026 10:00,PNSUT,12.58,13.5,12.5,13.28,3936183.0,0.22,0.7,0.04,1566.67,0.7,764201.4,415.07,0.31,True,54.89,-0.18,-0.2,0.02,2026-02-06,12.64,5.06,3,,13.01,ATH,True,True
06-02-2026 10:00,MEKAG,4.89,5.14,4.82,5.1,9435676.0,0.04,0.21,0.02,1135.29,0.21,2665708.9,253.96,0.19,True,67.76,0.04,0.02,0.02,2026-02-06,4.93,3.45,1,5.14,4.67,5.14,False,False
05-02-2026 17:00,EDATA,9.05,9.28,9.04,9.28,2702796.0,0.0,0.23,0.02,1252.94,0.23,1042824.4,159.18,0.0,True,55.97,0.0,0.0,0.0,2026-02-05,9.2,0.87,0,,9.01,9.39,False,False
05-02-2026 17:00,ARTMS,36.18,39.54,35.98,39.54,1343280.0,0.0,3.36,0.36,828.18,3.36,215654.8,522.88,0.0,True,84.3,0.18,-0.06,0.24,2026-02-05,35.96,9.96,0,,35.7,ATH,False,False
05-02-2026 17:00,IEYHO,77.35,79.7,77.1,79.55,9926372.0,0.15,2.2,0.29,658.62,2.2,2712050.2,266.01,0.07,True,82.84,0.23,0.06,0.17,2026-02-05,76.6,3.85,1,79.7,75.0,79.7,False,False
05-02-2026 16:00,HKTM,12.2,13.6,12.16,13.6,4939043.0,0.0,1.4,0.14,892.91,1.4,841942.7,486.62,0.0,True,84.61,0.17,0.1,0.06,2026-02-05,12.37,9.94,0,,ATL,ATH,False,False
05-02-2026 12:00,MHRGY,3.68,3.93,3.67,3.9,6598056.0,0.03,0.22,0.03,714.81,0.22,1535195.1,329.79,0.14,True,82.02,0.05,0.03,0.02,2026-02-05,3.6,8.33,1,3.93,3.48,3.93,False,False
05-02-2026 11:00,MARBL,13.68,13.94,13.68,13.87,676103.0,0.07,0.19,0.0,3700.0,0.19,357345.0,89.2,0.37,True,52.5,-0.03,-0.02,-0.02,2026-02-05,13.72,1.09,0,,13.5,14.19,False,False
05-02-2026 10:00,MEGMT,67.45,69.4,66.65,68.85,4786820.0,0.55,1.4,0.02,6900.0,1.4,1914533.7,150.03,0.39,True,68.42,0.4,0.27,0.13,2026-02-05,67.5,2.0,0,,65.5,69.05,False,False
04-02-2026 17:00,DITAS,52.5,55.4,52.5,54.9,1059232.0,0.5,2.4,0.17,1271.43,2.4,371170.9,185.38,0.21,True,69.48,0.44,0.33,0.11,2026-02-04,52.7,4.17,0,,50.8,ATH,False,False
04-02-2026 17:00,BEGYO,4.84,4.86,4.82,4.86,1438424.0,0.0,0.02,0.0,1900.0,0.02,913348.4,57.49,0.0,True,58.21,0.02,0.02,-0.0,2026-02-04,4.86,0.0,0,,ATL,4.98,False,False
04-02-2026 16:00,IZENR,9.89,10.05,9.87,10.04,6031207.0,0.01,0.15,0.03,476.92,0.15,2550201.3,136.5,0.07,True,73.49,0.06,0.04,0.02,2026-02-04,9.78,2.66,0,,ATL,ATH,False,False
04-02-2026 12:00,OZSUB,20.24,20.84,20.16,20.74,897357.0,0.1,0.5,0.04,1150.0,0.5,497549.8,80.36,0.2,True,73.28,0.11,0.06,0.05,2026-02-04,20.0,3.7,0,,19.5,ATH,False,False
04-02-2026 10:00,PNLSN,41.1,42.9,41.1,42.54,435404.0,0.36,1.44,0.15,860.0,1.44,79573.3,447.17,0.25,True,76.74,0.09,-0.0,0.09,2026-02-04,40.88,4.06,0,,40.46,ATH,False,False
04-02-2026 10:00,ENJSA,108.9,112.6,108.8,112.5,1248090.0,0.1,3.6,0.37,872.97,3.6,261505.5,377.27,0.03,True,91.42,0.78,0.43,0.35,2026-02-04,107.1,5.04,1,112.6,ATL,112.6,False,False
04-02-2026 10:00,MGROS,660.0,667.0,657.0,666.0,1164150.0,1.0,6.0,0.05,11900.0,6.0,547692.3,112.56,0.17,True,75.72,3.87,2.84,1.03,2026-02-04,654.0,1.83,0,,ATL,667.0,False,False
04-02-2026 10:00,TUCLK,5.98,6.28,5.72,6.28,33738256.0,0.0,0.3,0.05,445.45,0.3,7287758.2,362.94,0.0,True,90.13,0.12,0.07,0.05,2026-02-04,5.8,8.28,1,6.28,ATL,ATH,False,False
04-02-2026 10:00,KLMSN,29.72,30.6,29.72,30.52,479329.0,0.08,0.8,0.07,1076.47,0.8,107022.1,347.88,0.1,True,78.81,0.05,0.0,0.05,2026-02-04,29.66,2.9,0,,29.58,ATH,False,False
04-02-2026 10:00,PRKAB,55.4,58.0,55.05,58.0,4968684.0,0.0,2.6,0.26,900.0,2.6,542026.7,816.69,0.0,True,91.04,1.14,0.78,0.37,2026-02-04,52.75,9.95,1,58.0,ATL,ATH,False,False
04-02-2026 10:00,ALKA,13.1,13.6,13.08,13.55,5520844.0,0.05,0.45,0.05,900.0,0.45,1111258.4,396.81,0.11,True,76.15,0.03,0.0,0.02,2026-02-04,13.05,3.83,0,,12.96,ATH,False,False
04-02-2026 10:00,ERCB,70.25,70.95,70.2,70.8,360438.0,0.15,0.55,0.01,5400.0,0.55,150273.8,139.85,0.27,True,64.62,0.07,0.07,-0.0,2026-02-04,70.1,1.0,0,,69.95,ATH,False,False
04-02-2026 10:00,DGNMO,5.2,5.29,5.2,5.27,392849.0,0.02,0.07,0.01,775.0,0.07,248998.1,57.77,0.29,True,69.09,0.01,0.01,0.0,2026-02-04,5.18,1.74,1,5.29,ATL,5.29,False,False
03-02-2026 17:00,MARMR,2.98,3.14,2.94,3.14,114133816.0,0.0,0.16,0.02,841.18,0.16,50162482.8,127.53,0.0,True,77.07,0.03,0.02,0.01,2026-02-03,2.86,9.79,0,,2.86,ATH,False,False
03-02-2026 17:00,EGEPO,10.49,10.95,10.45,10.87,1321523.0,0.08,0.38,0.03,985.71,0.38,315747.0,318.54,0.21,True,76.16,0.05,0.03,0.02,2026-02-03,10.52,3.33,0,,ATL,ATH,False,False
03-02-2026 16:00,SKYMD,12.26,12.47,12.22,12.45,741260.0,0.02,0.19,0.02,726.09,0.19,294357.4,151.82,0.11,True,79.6,0.02,0.01,0.01,2026-02-03,12.23,1.8,0,,ATL,ATH,False,False
03-02-2026 16:00,PAHOL,1.8,1.83,1.79,1.83,257911910.0,0.0,0.03,0.0,650.0,0.03,98775473.0,161.11,0.0,True,70.8,0.0,-0.0,0.0,2026-02-03,1.77,3.39,0,,ATL,ATH,False,False
03-02-2026 16:00,MEYSU,13.96,15.0,13.88,14.93,33621101.0,0.07,0.97,0.08,1127.85,0.97,12389088.1,171.38,0.07,True,83.87,0.09,0.05,0.03,2026-02-03,14.18,5.29,2,13.88,13.88,ATH,False,False
03-02-2026 13:00,BEYAZ,29.96,30.7,29.96,30.56,304912.0,0.14,0.6,0.02,2900.0,0.6,142958.4,113.29,0.23,True,69.87,0.02,0.0,0.02,2026-02-03,29.9,2.21,1,30.7,ATL,30.7,False,False
03-02-2026 13:00,MERKO,16.19,16.76,16.16,16.64,1661689.0,0.12,0.45,0.06,689.47,0.45,612103.3,171.47,0.27,True,83.58,0.04,0.02,0.03,2026-02-03,16.1,3.35,0,,15.87,ATH,False,False
03-02-2026 10:00,FENER,3.31,3.36,3.3,3.36,38477610.0,0.0,0.05,0.01,455.56,0.05,12929188.8,197.6,0.0,True,88.44,0.01,0.0,0.0,2026-02-03,3.27,2.75,1,3.36,ATL,ATH,False,False
03-02-2026 10:00,FRMPL,40.6,42.72,40.44,42.72,7341550.0,0.0,2.12,0.22,872.48,2.12,2335526.6,214.34,0.0,True,88.31,0.25,0.07,0.17,2026-02-03,38.84,9.99,1,42.72,ATL,ATH,False,False
03-02-2026 10:00,BMSCH,18.83,20.06,18.83,19.88,3284308.0,0.18,1.05,0.1,939.6,1.05,563809.5,482.52,0.17,True,93.46,0.07,0.02,0.05,2026-02-03,18.74,6.08,0,,ATL,ATH,False,False
