Tarih,Hisse,open,high,low,close,volume,YuksekKapanis_Fark,AcilisKapanis_Fark,AcilisKapanisFark_Ort,AcilisKapanisFark_OrtalamayaGoreDegisim,AcilisKapanisFarkOrt_MaxSon10,HacimOrtalama,%Hacim_HacimOrtalama,Fark_Orani,Kosul,rsi,MACD_12_26_9,MACDs_12_26_9,MACDh_12_26_9,Tarih1,prev_close,%Deg,isPivot,pointpos,destek,direnc,Tsinyal_Banker_Dip,Tsinyal_Banker_DipKarar
12-12-2025 10:00,PINSU,12.88,13.65,12.88,13.6,4630916.0,0.05,0.72,0.07,974.63,0.72,688765.6,572.35,0.07,True,81.18,0.02,-0.03,0.05,2025-12-12,12.86,5.75,0,,12.79,ATH,False,False
12-12-2025 10:00,NIBAS,25.78,27.56,25.78,27.12,4757328.0,0.44,1.34,0.2,576.77,1.34,1035070.3,359.61,0.33,True,89.0,0.89,0.66,0.23,2025-12-12,25.26,7.36,0,,22.2,ATH,False,False
12-12-2025 10:00,ALVES,24.18,24.58,24.12,24.52,997939.0,0.06,0.34,0.03,1114.29,0.34,280165.0,256.2,0.18,True,62.75,-0.05,-0.08,0.03,2025-12-12,24.1,1.74,0,,24.0,24.62,False,False
12-12-2025 10:00,SAMAT,6.24,6.4,6.17,6.39,454178.0,0.01,0.15,0.01,2400.0,0.15,218540.9,107.82,0.07,True,61.17,0.04,0.04,0.0,2025-12-12,6.25,2.24,0,,6.09,6.43,False,False
12-12-2025 10:00,GIPTA,64.7,70.95,64.2,70.35,2292560.0,0.6,5.65,0.41,1278.05,5.65,371557.4,517.01,0.11,True,77.34,1.06,0.92,0.14,2025-12-12,64.55,8.99,0,,59.0,ATH,False,False
12-12-2025 10:00,PGSUS,203.3,205.2,203.3,205.1,4387055.0,0.1,1.8,0.11,1536.36,1.8,1616955.3,171.32,0.06,True,62.44,0.26,0.25,0.01,2025-12-12,202.7,1.18,0,,202.0,205.7,False,False
12-12-2025 10:00,PENTA,13.87,14.0,13.86,14.0,232503.0,0.0,0.13,0.0,12900.0,0.13,129365.7,79.73,0.0,True,58.53,0.01,0.02,-0.01,2025-12-12,13.83,1.23,0,,13.88,14.16,False,False
12-12-2025 10:00,CCOLA,56.75,58.5,56.7,58.25,3598447.0,0.25,1.5,0.16,809.09,1.5,836983.3,329.93,0.17,True,86.23,0.87,0.8,0.08,2025-12-12,56.5,3.1,0,,50.55,ATH,False,False
12-12-2025 10:00,OZYSR,44.6,48.18,44.1,47.18,1247987.0,1.0,2.58,0.66,289.73,2.58,295205.7,322.75,0.39,True,76.63,0.56,0.09,0.46,2025-12-12,44.6,5.78,0,,39.6,48.46,False,False
12-12-2025 10:00,AVGYO,10.94,11.5,10.94,11.39,1103920.0,0.11,0.45,0.05,782.35,0.45,215780.8,411.59,0.24,True,73.63,0.1,0.07,0.03,2025-12-12,10.94,4.11,0,,10.47,ATH,False,False
12-12-2025 10:00,MAVI,38.5,39.74,38.5,39.64,5466117.0,0.1,1.14,0.08,1361.54,1.14,1834686.2,197.93,0.09,True,74.36,0.44,0.35,0.1,2025-12-12,38.48,3.01,0,,36.88,39.8,False,False
12-12-2025 10:00,ALTIN,80.2,81.4,80.09,81.14,9535421.0,0.26,0.94,0.12,696.61,0.94,2133521.8,346.93,0.28,True,92.32,0.43,0.24,0.19,2025-12-12,79.02,2.68,0,,77.25,ATH,False,False
12-12-2025 10:00,MANAS,16.24,16.25,14.1,16.25,18374285.0,0.0,0.01,0.0,900.0,0.01,2572819.1,614.17,0.0,True,99.41,0.9,0.83,0.07,2025-12-12,14.78,9.95,0,,13.44,ATH,False,False
12-12-2025 10:00,LKMNH,16.2,16.44,16.14,16.39,644148.0,0.05,0.19,0.03,578.57,0.19,210726.5,205.68,0.26,True,72.06,0.18,0.17,0.01,2025-12-12,16.14,1.55,0,,15.64,ATH,False,False
12-12-2025 10:00,DESA,11.19,11.44,11.19,11.38,460512.0,0.06,0.19,0.02,955.56,0.19,106728.8,331.48,0.32,True,58.93,-0.03,-0.04,0.01,2025-12-12,11.17,1.88,0,,10.63,11.79,False,False
12-12-2025 10:00,KRSTL,10.48,10.67,10.45,10.67,850994.0,0.0,0.19,0.03,578.57,0.19,498589.4,70.68,0.0,True,62.88,0.03,0.01,0.02,2025-12-12,10.45,2.11,0,,10.34,10.7,False,False
12-12-2025 10:00,GUBRF,334.75,338.75,331.75,338.0,780086.0,0.75,3.25,0.8,306.25,3.25,210223.7,271.07,0.23,True,78.47,2.72,2.08,0.64,2025-12-12,331.75,1.88,0,,325.0,ATH,False,False
12-12-2025 10:00,KLYPV,60.45,63.0,60.3,62.85,1133105.0,0.15,2.4,0.36,566.67,2.4,351389.3,222.46,0.06,True,76.78,0.88,0.68,0.2,2025-12-12,60.25,4.32,0,,58.1,ATH,False,False
12-12-2025 10:00,KCHOL,173.2,175.6,173.1,175.1,11354080.0,0.5,1.9,0.06,3066.67,1.9,3827521.6,196.64,0.26,True,60.2,0.06,0.03,0.03,2025-12-12,172.2,1.68,0,,171.4,175.2,False,False
12-12-2025 10:00,KARSN,9.6,9.68,9.59,9.67,2432279.0,0.01,0.07,0.01,483.33,0.07,1004030.6,142.25,0.14,True,69.58,0.03,0.02,0.01,2025-12-12,9.58,0.94,0,,9.39,ATH,False,False
12-12-2025 10:00,SARKY,15.97,16.7,15.94,16.5,1857908.0,0.2,0.53,0.05,1027.66,0.53,354277.2,424.42,0.38,True,69.88,0.02,-0.02,0.03,2025-12-12,15.87,3.97,0,,15.48,ATH,False,False
12-12-2025 10:00,ISKPL,11.24,12.0,11.14,11.94,11370817.0,0.06,0.7,0.02,3584.21,0.7,2783601.4,308.49,0.09,True,55.56,0.11,0.22,-0.11,2025-12-12,11.35,5.2,0,,8.37,ATH,False,False
12-12-2025 10:00,ALKLC,160.0,169.9,157.2,169.1,777816.0,0.8,9.1,1.96,364.29,9.1,231867.7,235.46,0.09,True,81.96,6.21,4.41,1.79,2025-12-12,157.2,7.57,0,,135.6,ATH,False,False
12-12-2025 10:00,ENJSA,84.9,87.4,84.6,86.85,1022280.0,0.55,1.95,0.24,712.5,1.95,246170.0,315.27,0.28,True,74.27,0.21,0.02,0.19,2025-12-12,84.45,2.84,0,,83.45,ATH,False,False
12-12-2025 10:00,YUNSA,8.16,8.19,8.14,8.19,711098.0,0.0,0.03,0.0,2900.0,0.03,365367.7,94.63,0.0,True,50.34,-0.03,-0.03,0.01,2025-12-12,8.13,0.74,0,,7.87,8.38,False,False
12-12-2025 10:00,VESBE,8.44,8.49,8.44,8.48,1038752.0,0.01,0.04,0.0,900.0,0.04,434203.0,139.23,0.25,True,58.77,-0.0,-0.01,0.01,2025-12-12,8.42,0.71,0,,8.35,8.52,False,False
12-12-2025 10:00,AFYON,13.59,13.7,13.59,13.68,477060.0,0.02,0.09,0.01,1025.0,0.09,284178.5,67.87,0.22,True,70.82,0.06,0.06,0.0,2025-12-12,13.57,0.81,0,,13.38,13.7,False,False
12-12-2025 10:00,DOHOL,17.68,17.81,17.67,17.79,1870348.0,0.02,0.11,0.0,2650.0,0.11,1023107.2,82.81,0.18,True,52.4,-0.04,-0.04,0.0,2025-12-12,17.65,0.79,0,,17.63,18.16,False,False
12-12-2025 10:00,DSTKF,532.5,552.0,531.5,547.5,682304.0,4.5,15.0,0.7,2042.86,15.0,162246.4,320.54,0.3,True,46.25,-8.47,-10.09,1.62,2025-12-12,535.5,2.24,0,,ATL,647.5,True,True
12-12-2025 10:00,AKENR,11.21,12.0,11.2,11.85,18406476.0,0.15,0.64,0.13,407.94,0.64,5968115.6,208.41,0.23,True,89.19,0.16,0.05,0.12,2025-12-12,11.2,5.8,0,,10.48,ATH,False,False
12-12-2025 10:00,CVKMD,20.96,22.4,20.96,22.06,16517967.0,0.34,1.1,0.12,832.2,1.1,3402613.6,385.45,0.31,True,77.01,0.41,0.38,0.03,2025-12-12,20.86,5.75,0,,18.54,ATH,False,False
12-12-2025 10:00,AKFIS,21.58,21.72,21.48,21.68,355227.0,0.04,0.1,0.0,2400.0,0.1,179709.7,97.67,0.4,True,62.27,0.02,-0.0,0.02,2025-12-12,21.5,0.84,0,,21.24,21.76,False,False
12-12-2025 10:00,TKFEN,67.8,68.65,67.65,68.45,660282.0,0.2,0.65,0.08,664.71,0.65,216582.3,204.86,0.31,True,57.36,-0.21,-0.32,0.11,2025-12-12,67.65,1.18,0,,67.25,70.5,True,False
12-12-2025 10:00,AKYHO,2.86,2.89,2.84,2.89,336164.0,0.0,0.03,0.01,500.0,0.03,166896.0,101.42,0.0,True,50.97,-0.01,-0.01,0.0,2025-12-12,2.87,0.7,0,,2.84,2.91,False,False
12-12-2025 10:00,ALKA,9.57,10.23,9.56,10.1,6852316.0,0.13,0.53,0.04,1225.0,0.53,1096027.7,525.2,0.25,True,61.47,0.01,0.05,-0.04,2025-12-12,9.51,6.2,0,,8.91,10.82,False,False
11-12-2025 17:00,PAHOL,1.6,1.67,1.59,1.66,344710895.0,0.01,0.06,0.0,1100.0,0.06,95855092.2,259.62,0.17,True,57.84,0.0,0.0,-0.0,2025-12-11,1.61,3.11,0,,1.61,1.73,False,False
11-12-2025 17:00,IHLGM,2.24,2.27,2.24,2.27,5254955.0,0.0,0.03,0.0,2900.0,0.03,2836773.1,85.24,0.0,True,53.58,0.01,0.01,-0.0,2025-12-11,2.26,0.44,0,,2.18,2.36,False,False
11-12-2025 17:00,HURGZ,6.05,6.22,6.01,6.19,2362494.0,0.03,0.14,0.02,636.84,0.14,467878.2,404.94,0.21,True,71.66,0.04,0.03,0.01,2025-12-11,5.94,4.21,0,,5.94,ATH,False,False
11-12-2025 17:00,IZMDC,7.03,7.18,7.03,7.15,3164597.0,0.03,0.12,0.03,328.57,0.12,932899.6,239.22,0.25,True,62.93,0.0,-0.02,0.02,2025-12-11,6.85,4.38,0,,6.7,7.28,False,False
11-12-2025 17:00,FENER,9.88,9.97,9.87,9.95,4300994.0,0.02,0.07,0.01,775.0,0.07,1500276.5,186.68,0.29,True,55.25,-0.02,-0.03,0.01,2025-12-11,9.88,0.71,0,,9.87,10.02,False,False
11-12-2025 17:00,KRONT,13.19,13.5,13.19,13.45,399915.0,0.05,0.26,0.02,1344.44,0.26,138322.2,189.12,0.19,True,55.73,-0.07,-0.09,0.02,2025-12-11,13.22,1.74,0,,13.09,13.86,True,True
11-12-2025 16:00,EFOR,31.04,31.68,31.02,31.64,1251763.0,0.04,0.6,0.09,552.17,0.6,575658.4,117.45,0.07,True,62.52,0.13,0.11,0.02,2025-12-11,30.76,2.86,0,,30.32,31.72,False,False
11-12-2025 16:00,BIMAS,546.5,552.5,546.0,552.5,1426280.0,0.0,6.0,1.65,263.64,6.0,911071.6,56.55,0.0,True,74.89,4.77,3.24,1.53,2025-12-11,533.0,3.66,0,,531.0,559.0,False,False
11-12-2025 16:00,SKYMD,12.18,12.35,12.13,12.33,600018.0,0.02,0.15,0.02,650.0,0.15,227350.7,163.92,0.13,True,61.05,0.02,0.01,0.01,2025-12-11,12.09,1.99,0,,12.04,12.74,False,False
11-12-2025 16:00,PASEU,149.9,155.8,149.2,155.6,812274.0,0.2,5.7,0.91,526.37,5.7,320301.6,153.6,0.04,True,75.96,2.89,2.68,0.21,2025-12-11,149.5,4.08,0,,135.2,ATH,False,False
11-12-2025 15:00,PRKME,17.24,17.4,17.21,17.38,379061.0,0.02,0.14,0.02,636.84,0.14,130775.7,189.86,0.14,True,72.12,0.08,0.08,0.0,2025-12-11,17.15,1.34,0,,17.05,ATH,False,False
11-12-2025 15:00,IMASM,5.11,5.52,5.11,5.49,94790010.0,0.03,0.38,0.05,616.98,0.38,14572357.2,550.48,0.08,True,70.57,0.09,0.08,0.02,2025-12-11,5.02,9.36,0,,4.87,ATH,False,False
11-12-2025 15:00,LRSHO,5.55,5.74,5.53,5.69,15594240.0,0.05,0.14,0.01,900.0,0.14,4438165.9,251.37,0.36,True,70.57,0.06,0.05,0.01,2025-12-11,5.4,5.37,0,,5.36,ATH,False,False
11-12-2025 15:00,CONSE,3.12,3.2,3.11,3.19,15162203.0,0.01,0.07,0.0,1650.0,0.07,2194639.9,590.87,0.14,True,66.65,0.01,-0.0,0.01,2025-12-11,3.11,2.57,0,,3.08,3.27,False,False
11-12-2025 14:00,EREGL,24.28,24.48,24.24,24.46,35798072.0,0.02,0.18,0.02,800.0,0.18,18437428.0,94.16,0.11,True,65.04,0.07,0.06,0.0,2025-12-11,24.14,1.33,0,,23.98,ATH,False,False
11-12-2025 14:00,OFSYM,60.3,62.45,60.25,62.4,1012250.0,0.05,2.1,0.36,475.34,2.1,179476.5,464.0,0.02,True,71.98,0.44,0.21,0.23,2025-12-11,58.2,7.22,0,,57.75,ATH,False,False
11-12-2025 14:00,ULUFA,3.85,3.92,3.85,3.91,3563515.0,0.01,0.06,0.01,900.0,0.06,1740226.4,104.77,0.17,True,60.12,-0.0,-0.01,0.01,2025-12-11,3.81,2.62,0,,3.78,3.92,False,False
11-12-2025 13:00,UNLU,15.0,15.23,15.0,15.21,510219.0,0.02,0.21,0.03,624.14,0.21,218930.4,133.05,0.1,True,60.77,0.03,0.01,0.02,2025-12-11,15.0,1.4,0,,14.77,15.52,False,False
11-12-2025 13:00,KLSYN,5.58,5.69,5.56,5.68,811295.0,0.01,0.1,0.02,400.0,0.1,430073.6,88.64,0.1,True,68.64,0.05,0.04,0.01,2025-12-11,5.55,2.34,1,5.69,5.28,5.69,False,False
11-12-2025 13:00,BINHO,9.97,10.15,9.97,10.1,6095642.0,0.05,0.13,0.01,1200.0,0.13,3427097.5,77.87,0.38,True,61.44,0.01,0.01,0.0,2025-12-11,9.92,1.81,0,,9.88,10.23,False,False
11-12-2025 12:00,GSDDE,10.04,10.34,9.99,10.31,1318810.0,0.03,0.27,0.05,429.41,0.27,283019.5,365.98,0.11,True,79.0,0.05,0.01,0.04,2025-12-11,9.7,6.29,0,,9.62,ATH,False,False
11-12-2025 12:00,DOFER,55.45,59.2,55.35,58.25,2236642.0,0.95,2.8,0.39,617.95,2.8,353420.0,532.86,0.34,True,76.0,0.46,0.16,0.3,2025-12-11,53.85,8.17,1,59.2,53.0,59.2,False,False
11-12-2025 12:00,CELHA,9.57,10.57,9.55,10.57,8833762.0,0.0,1.0,0.07,1349.28,1.0,1211247.8,629.31,0.0,True,69.67,-0.06,-0.13,0.08,2025-12-11,9.61,9.99,0,,9.53,13.38,True,True
11-12-2025 12:00,DMRGD,3.2,3.43,3.2,3.4,22628671.0,0.03,0.2,0.03,555.74,0.2,6007205.9,276.69,0.15,True,77.18,0.04,0.02,0.02,2025-12-11,3.13,8.63,0,,3.04,ATH,False,False
11-12-2025 12:00,TRENJ,85.8,87.85,85.75,87.7,1451117.0,0.15,1.9,0.24,675.51,1.9,539688.7,168.88,0.08,True,68.74,1.3,1.15,0.15,2025-12-11,84.65,3.6,0,,79.55,ATH,False,False
11-12-2025 12:00,AGROT,6.98,7.06,6.98,7.05,2334067.0,0.01,0.07,0.0,2233.33,0.07,866240.3,169.45,0.14,True,55.12,-0.02,-0.03,0.0,2025-12-11,6.95,1.44,1,7.06,6.95,7.06,True,True
11-12-2025 12:00,ULUUN,6.87,6.96,6.86,6.96,747857.0,0.0,0.09,0.01,1400.0,0.09,253125.5,195.45,0.0,True,61.75,-0.0,-0.0,0.0,2025-12-11,6.8,2.35,0,,6.71,7.02,False,False
11-12-2025 11:00,BMSTL,101.2,108.3,100.7,107.4,370908.0,0.9,6.2,0.94,559.57,6.2,134389.2,176.0,0.15,True,58.7,-1.05,-2.07,1.02,2025-12-11,101.7,5.6,0,,94.2,107.8,False,False
11-12-2025 11:00,TNZTP,21.36,21.98,21.36,21.92,581710.0,0.06,0.56,0.05,976.92,0.56,152116.3,282.41,0.11,True,70.9,0.04,0.02,0.02,2025-12-11,21.22,3.3,0,,21.2,ATH,False,False
11-12-2025 11:00,ESCOM,3.04,3.15,3.03,3.13,14251128.0,0.02,0.09,0.01,900.0,0.09,2571290.5,454.24,0.22,True,62.76,-0.01,-0.01,0.0,2025-12-11,3.03,3.3,0,,3.02,3.15,False,False
11-12-2025 11:00,JANTS,19.42,19.63,19.41,19.61,878256.0,0.02,0.19,0.02,1017.65,0.19,260663.0,236.93,0.11,True,69.13,0.03,0.02,0.02,2025-12-11,19.4,1.08,0,,19.27,ATH,False,False
11-12-2025 11:00,RTALB,3.76,3.81,3.75,3.8,5173319.0,0.01,0.04,0.0,1900.0,0.04,2879839.2,79.64,0.25,True,61.51,0.0,-0.0,0.0,2025-12-11,3.74,1.6,1,3.81,3.73,3.81,False,False
11-12-2025 11:00,PENGD,8.37,8.45,8.35,8.44,486658.0,0.01,0.07,0.0,3400.0,0.07,274553.8,77.25,0.14,True,65.33,0.01,-0.0,0.01,2025-12-11,8.25,2.3,0,,8.24,8.47,False,False
11-12-2025 11:00,TRILC,16.97,17.11,16.94,17.09,535156.0,0.02,0.12,0.01,823.08,0.12,322398.9,65.99,0.17,True,64.07,0.08,0.08,0.0,2025-12-11,16.78,1.85,0,,16.7,ATH,False,False
11-12-2025 11:00,BALSU,16.48,16.87,16.45,16.8,1173559.0,0.07,0.32,0.0,31900.0,0.32,382149.8,207.09,0.22,True,55.07,-0.09,-0.1,0.01,2025-12-11,16.5,1.82,3,,16.45,16.9,True,True
11-12-2025 11:00,HUBVC,2.91,3.0,2.87,2.98,1412677.0,0.02,0.07,0.01,1066.67,0.07,928292.1,52.18,0.29,True,87.13,0.07,0.05,0.02,2025-12-11,2.87,3.83,0,,2.6,3.04,False,False
11-12-2025 11:00,KLRHO,211.2,221.4,207.4,220.3,408026.0,1.1,9.1,1.15,691.3,9.1,167596.2,143.46,0.12,True,72.9,7.19,6.97,0.22,2025-12-11,212.1,3.87,0,,193.1,ATH,False,False
11-12-2025 11:00,VKING,37.9,39.44,37.62,39.02,505775.0,0.42,1.12,0.11,882.46,1.12,179097.7,182.4,0.37,True,55.31,-0.49,-0.6,0.1,2025-12-11,37.0,5.46,0,,36.28,41.7,True,True
11-12-2025 11:00,BRKVY,106.6,111.5,106.0,111.1,620686.0,0.4,4.5,0.85,429.41,4.5,366668.7,69.28,0.09,True,89.16,4.14,3.36,0.78,2025-12-11,103.6,7.24,0,,86.0,ATH,False,False
11-12-2025 11:00,EPLAS,5.15,5.2,5.14,5.19,379640.0,0.01,0.04,0.0,3900.0,0.04,202444.6,87.53,0.25,True,56.34,-0.01,-0.01,0.0,2025-12-11,5.13,1.17,0,,5.1,5.21,False,False
11-12-2025 10:00,EDIP,35.3,37.34,35.28,37.08,1297884.0,0.26,1.78,0.22,694.64,1.78,204582.8,534.41,0.15,True,79.25,0.1,-0.06,0.16,2025-12-11,35.3,5.04,0,,34.8,37.5,False,False
11-12-2025 10:00,USAK,2.77,2.82,2.76,2.81,7648482.0,0.01,0.04,0.0,9.00719925474099e+16,0.04,3363105.2,127.42,0.25,True,47.78,-0.02,-0.02,-0.0,2025-12-11,2.76,1.81,3,,2.76,2.88,True,True
11-12-2025 10:00,DOGUB,56.85,59.0,56.0,59.0,599131.0,0.0,2.15,0.33,561.54,2.15,308627.9,94.13,0.0,True,69.25,2.84,2.64,0.2,2025-12-11,58.6,0.68,0,,45.44,63.25,False,False
11-12-2025 10:00,EKSUN,5.62,5.68,5.61,5.67,320768.0,0.01,0.05,0.0,4900.0,0.05,142654.5,124.86,0.2,True,63.92,0.01,0.01,0.0,2025-12-11,5.6,1.25,0,,5.59,5.69,False,False
11-12-2025 10:00,FONET,2.79,2.9,2.78,2.89,21420438.0,0.01,0.1,0.01,1011.11,0.1,5791728.8,269.85,0.1,True,70.0,0.01,0.01,0.0,2025-12-11,2.78,3.96,0,,2.77,ATH,False,False
11-12-2025 10:00,SEYKM,6.3,6.7,6.17,6.61,1359070.0,0.09,0.31,0.06,434.48,0.31,488924.6,177.97,0.29,True,81.68,0.29,0.27,0.02,2025-12-11,6.36,3.93,1,6.7,4.51,6.7,False,False
11-12-2025 10:00,SANFM,6.34,6.95,6.32,6.95,12456426.0,0.0,0.61,0.05,1050.94,0.61,1482907.5,740.0,0.0,True,79.76,0.01,-0.04,0.04,2025-12-11,6.32,9.97,1,6.95,6.3,7.12,True,False
11-12-2025 10:00,PAPIL,16.16,16.73,16.03,16.7,8027111.0,0.03,0.54,0.1,445.45,0.54,3284789.8,144.37,0.06,True,86.91,0.19,0.1,0.09,2025-12-11,16.15,3.41,0,,15.48,ATH,False,False
11-12-2025 10:00,GLRMK,168.8,173.3,168.7,172.3,448398.0,1.0,3.5,0.28,1150.0,3.5,125040.3,258.6,0.29,True,65.74,0.57,0.67,-0.1,2025-12-11,169.0,1.95,0,,168.5,173.7,False,False
11-12-2025 10:00,KOTON,15.5,15.83,15.35,15.75,880767.0,0.08,0.25,0.01,1685.71,0.25,439851.7,100.24,0.32,True,65.86,0.2,0.19,0.01,2025-12-11,15.49,1.68,2,15.35,15.35,15.85,False,False
11-12-2025 10:00,HDFGS,2.84,2.91,2.79,2.9,32431649.0,0.01,0.06,0.0,1900.0,0.06,8667315.6,274.18,0.17,True,52.51,-0.02,-0.02,0.0,2025-12-11,2.82,2.84,3,,2.79,2.94,True,True
11-12-2025 10:00,HEDEF,56.0,58.45,54.85,58.35,2006327.0,0.1,2.35,0.24,900.0,2.35,374637.4,435.54,0.04,True,74.42,0.65,0.42,0.23,2025-12-11,55.8,4.57,0,,54.0,ATH,False,False
11-12-2025 10:00,HUNER,3.42,3.45,3.41,3.45,4769326.0,0.0,0.03,0.01,400.0,0.03,2255352.8,111.47,0.0,True,68.98,0.0,-0.0,0.01,2025-12-11,3.4,1.47,0,,3.37,3.46,False,False
11-12-2025 10:00,IEYHO,59.25,61.1,59.2,60.6,3720351.0,0.5,1.35,0.16,770.97,1.35,1537773.6,141.93,0.37,True,55.5,0.19,0.23,-0.03,2025-12-11,60.5,0.17,2,59.2,59.2,60.7,False,False
11-12-2025 10:00,KTLEV,17.83,18.03,17.8,18.03,4723598.0,0.0,0.2,0.01,3900.0,0.2,3000405.8,57.43,0.0,True,48.3,-0.11,-0.1,-0.02,2025-12-11,17.8,1.29,0,,17.71,19.2,False,False
11-12-2025 10:00,ZEDUR,8.58,8.78,8.56,8.75,617449.0,0.03,0.17,0.03,553.85,0.17,319354.4,93.34,0.18,True,73.72,0.06,0.05,0.01,2025-12-11,8.55,2.34,0,,8.4,ATH,False,False
11-12-2025 10:00,CANTE,2.14,2.19,2.14,2.18,137566480.0,0.01,0.04,0.0,900.0,0.04,48454795.8,183.91,0.25,True,56.91,0.01,0.01,-0.0,2025-12-11,2.13,2.35,0,,2.13,2.23,False,False
11-12-2025 10:00,CATES,35.26,35.82,35.02,35.8,124014.0,0.02,0.54,0.07,694.12,0.54,72898.3,70.12,0.04,True,60.72,-0.07,-0.18,0.11,2025-12-11,35.18,1.76,0,,34.52,36.9,False,False
11-12-2025 10:00,ANGEN,11.62,11.73,11.62,11.72,239814.0,0.01,0.1,0.0,4900.0,0.1,157282.3,52.47,0.1,True,57.54,0.01,0.01,-0.0,2025-12-11,11.6,1.03,0,,11.49,11.78,False,False
11-12-2025 10:00,ARMGD,52.35,57.45,51.9,57.45,5354939.0,0.0,5.1,0.94,443.71,5.1,1013528.0,428.35,0.0,True,95.65,2.52,2.07,0.45,2025-12-11,52.25,9.95,1,57.45,41.42,ATH,False,False
11-12-2025 10:00,CGCAM,33.14,33.8,33.14,33.7,750733.0,0.1,0.56,0.03,1650.0,0.56,302725.3,147.99,0.18,True,49.45,-0.29,-0.34,0.06,2025-12-11,33.12,1.75,0,,33.12,33.8,True,True
11-12-2025 10:00,AEFES,15.97,16.21,15.92,16.17,20066015.0,0.04,0.2,0.01,3233.33,0.2,6384963.5,214.27,0.2,True,65.28,0.06,0.04,0.02,2025-12-11,15.89,1.76,0,,15.53,16.18,False,False
10-12-2025 17:00,MERKO,12.68,12.82,12.67,12.82,593384.0,0.0,0.14,0.01,900.0,0.14,204896.8,189.6,0.0,True,57.74,-0.02,-0.03,0.01,2025-12-10,12.69,1.02,0,,12.66,13.1,True,True
10-12-2025 17:00,ETILR,3.84,4.11,3.83,4.11,9567615.0,0.0,0.27,0.03,718.18,0.27,1745554.5,448.11,0.0,True,88.2,0.05,0.02,0.03,2025-12-10,3.74,9.89,0,,3.68,ATH,False,False
10-12-2025 17:00,MOBTL,8.19,8.45,8.19,8.45,2858151.0,0.0,0.26,0.03,862.96,0.26,706519.9,304.54,0.0,True,63.46,-0.01,-0.03,0.03,2025-12-10,8.1,4.32,0,,8.04,8.67,False,False
10-12-2025 17:00,BLCYT,33.34,33.76,32.9,33.64,438430.0,0.12,0.3,0.02,1775.0,0.3,196150.0,123.52,0.4,True,48.65,-0.37,-0.47,0.11,2025-12-10,33.3,1.02,0,,32.5,37.84,True,False
10-12-2025 17:00,MARMR,1.94,2.0,1.94,1.99,20762069.0,0.01,0.05,0.0,1566.67,0.05,8052972.9,157.82,0.2,True,52.87,-0.01,-0.01,0.0,2025-12-10,1.97,1.02,3,,1.94,2.07,True,True
10-12-2025 17:00,KCAER,10.53,10.93,10.53,10.92,4602097.0,0.01,0.39,0.04,954.05,0.39,1850478.2,148.7,0.03,True,71.02,0.1,0.08,0.02,2025-12-10,10.56,3.41,1,10.93,10.32,10.93,False,False
10-12-2025 17:00,ESCAR,20.98,21.16,20.98,21.12,1108126.0,0.04,0.14,0.02,536.36,0.14,712296.2,55.57,0.29,True,67.4,0.16,0.13,0.03,2025-12-10,20.84,1.34,0,,20.28,21.3,False,False
10-12-2025 17:00,DYOBY,13.61,14.38,13.6,14.21,3442003.0,0.17,0.6,0.09,552.17,0.6,530533.2,548.78,0.28,True,88.41,0.11,0.04,0.07,2025-12-10,13.28,7.0,1,14.38,13.23,14.38,False,False
10-12-2025 17:00,DCTTR,25.56,26.2,25.44,26.02,1257129.0,0.18,0.46,0.03,1337.5,0.46,246884.7,409.2,0.39,True,59.47,-0.02,-0.06,0.03,2025-12-10,25.6,1.64,2,25.44,25.44,26.54,False,False
10-12-2025 16:00,SAFKR,25.34,26.06,25.16,25.94,1285663.0,0.12,0.6,0.08,650.0,0.6,668711.4,92.26,0.2,True,74.4,0.24,0.16,0.07,2025-12-10,25.12,3.26,0,,24.28,ATH,False,False
10-12-2025 15:00,GOZDE,21.94,22.36,21.94,22.26,396047.0,0.1,0.32,0.03,841.18,0.32,139027.4,184.87,0.31,True,73.92,0.12,0.1,0.03,2025-12-10,21.68,2.68,0,,21.62,ATH,False,False
10-12-2025 15:00,EGEPO,7.12,7.5,7.11,7.43,2983276.0,0.07,0.31,0.02,1531.58,0.31,562030.2,430.8,0.23,True,65.66,-0.02,-0.03,0.01,2025-12-10,7.18,3.48,1,7.5,7.08,7.5,False,False
10-12-2025 15:00,PKENT,207.9,216.1,207.9,214.4,346906.0,1.7,6.5,1.08,501.85,6.5,148215.6,134.05,0.26,True,71.05,3.88,2.62,1.26,2025-12-10,203.0,5.62,0,,191.7,226.0,False,False
10-12-2025 15:00,SERNT,8.32,8.87,8.31,8.8,5803092.0,0.07,0.48,0.05,860.0,0.48,1152604.0,403.48,0.15,True,81.64,0.09,0.05,0.04,2025-12-10,8.23,6.93,0,,8.14,ATH,False,False
10-12-2025 15:00,TRMET,100.2,102.8,100.1,102.5,1497552.0,0.3,2.3,0.05,4081.82,2.3,898913.2,66.6,0.13,True,62.2,0.4,0.45,-0.05,2025-12-10,100.4,2.09,0,,98.4,102.6,False,False
10-12-2025 14:00,IHGZT,1.74,1.77,1.74,1.77,6684352.0,0.0,0.03,0.01,400.0,0.03,3557758.0,87.88,0.0,True,55.74,-0.01,-0.01,0.0,2025-12-10,1.73,2.31,1,1.77,1.72,1.8,False,False
10-12-2025 14:00,IHLAS,2.63,2.68,2.62,2.68,22949442.0,0.0,0.05,0.0,1566.67,0.05,8839221.6,159.63,0.0,True,57.79,-0.01,-0.02,0.01,2025-12-10,2.63,1.9,0,,2.61,2.73,True,False
10-12-2025 14:00,SEGMN,18.43,18.94,18.43,18.84,934918.0,0.1,0.41,0.04,831.82,0.41,193485.5,383.2,0.24,True,78.66,0.1,0.07,0.03,2025-12-10,18.35,2.67,1,18.94,18.12,18.94,False,False
10-12-2025 13:00,LILAK,26.36,26.88,26.28,26.74,1057349.0,0.14,0.38,0.09,313.04,0.38,351720.1,200.62,0.37,True,79.11,0.16,0.09,0.07,2025-12-10,25.88,3.32,0,,25.6,ATH,False,False
10-12-2025 12:00,TUPRS,197.2,199.4,196.8,199.2,2794569.0,0.2,2.0,0.03,6566.67,2.0,1774450.8,57.49,0.1,True,55.25,-0.2,-0.14,-0.06,2025-12-10,197.5,0.86,0,,196.6,201.7,False,False
10-12-2025 12:00,RUZYE,13.14,13.39,13.08,13.33,1941704.0,0.06,0.19,0.02,726.09,0.19,790208.4,145.72,0.32,True,59.13,-0.0,-0.01,0.0,2025-12-10,12.98,2.7,1,13.39,12.32,13.39,False,False
10-12-2025 12:00,KOCMT,2.98,3.03,2.98,3.03,10082186.0,0.0,0.05,0.0,1566.67,0.05,6543091.5,54.09,0.0,True,65.64,0.02,0.03,-0.0,2025-12-10,2.99,1.34,0,,2.97,3.05,False,False
10-12-2025 12:00,CEMTS,11.66,12.12,11.63,11.99,2879052.0,0.13,0.33,0.04,667.44,0.33,851375.0,238.16,0.39,True,69.6,0.1,0.1,-0.01,2025-12-10,11.74,2.13,0,,11.43,12.13,False,False
10-12-2025 11:00,TAVHL,293.25,298.75,293.0,298.5,491489.0,0.25,5.25,1.18,346.81,5.25,203328.7,141.72,0.05,True,80.17,2.2,1.11,1.09,2025-12-10,290.0,2.93,0,,283.25,ATH,False,False
10-12-2025 11:00,BARMA,31.92,32.8,31.92,32.76,554141.0,0.04,0.84,0.07,1066.67,0.84,307328.2,80.31,0.05,True,65.47,0.34,0.33,0.01,2025-12-10,32.3,1.42,0,,30.7,ATH,False,False
10-12-2025 11:00,DERHL,13.9,14.15,13.9,14.1,1514053.0,0.05,0.2,0.03,506.06,0.2,627534.9,141.27,0.25,True,64.57,0.08,0.07,0.01,2025-12-10,13.85,1.81,0,,13.3,ATH,False,False
10-12-2025 11:00,GLCVY,80.6,82.0,80.6,81.9,138420.0,0.1,1.3,0.14,862.96,1.3,62126.9,122.8,0.08,True,58.95,-0.07,-0.06,-0.02,2025-12-10,79.65,2.82,0,,79.1,84.0,False,False
10-12-2025 11:00,MERCN,18.37,19.19,18.23,18.96,2721084.0,0.23,0.59,0.11,431.53,0.59,808184.2,236.69,0.39,True,70.63,0.13,0.06,0.07,2025-12-10,18.34,3.38,0,,17.64,ATH,False,False
10-12-2025 11:00,MNDTR,7.31,7.41,7.27,7.39,654939.0,0.02,0.08,0.01,1042.86,0.08,383641.3,70.72,0.25,True,62.37,0.02,0.02,0.0,2025-12-10,7.27,1.65,0,,7.24,7.48,False,False
10-12-2025 11:00,BEGYO,5.1,5.13,5.09,5.13,1468453.0,0.0,0.03,0.0,2900.0,0.03,884523.8,66.02,0.0,True,59.45,-0.0,-0.01,0.0,2025-12-10,5.08,0.98,0,,5.05,5.2,False,False
10-12-2025 11:00,TSPOR,1.21,1.22,1.2,1.22,90918728.0,0.0,0.01,0.0,900.0,0.01,51518700.2,76.48,0.0,True,63.34,0.0,0.0,0.0,2025-12-10,1.19,2.52,0,,1.17,1.26,False,False
10-12-2025 11:00,GSDHO,4.75,4.81,4.73,4.8,1754632.0,0.01,0.05,0.0,1150.0,0.05,649916.4,169.98,0.2,True,54.65,0.01,0.02,-0.01,2025-12-10,4.79,0.21,2,4.73,4.73,4.87,False,False
10-12-2025 11:00,ARSAN,3.18,3.46,3.17,3.45,22770176.0,0.01,0.27,0.03,800.0,0.27,4732496.1,381.15,0.04,True,74.13,0.03,0.02,0.01,2025-12-10,3.19,8.15,0,,3.15,ATH,False,False
10-12-2025 10:00,BORLS,6.55,6.69,6.43,6.69,34165229.0,0.0,0.14,0.01,900.0,0.14,5683403.3,501.14,0.0,True,81.26,0.23,0.17,0.06,2025-12-10,6.09,9.85,1,6.69,5.33,ATH,False,False
10-12-2025 10:00,GSRAY,1.28,1.29,1.27,1.29,71608217.0,0.0,0.01,0.0,900.0,0.01,24878984.1,187.83,0.0,True,45.88,-0.0,0.0,-0.0,2025-12-10,1.3,-0.77,0,,1.26,1.31,False,False
10-12-2025 10:00,GZNMI,116.9,122.6,116.9,122.6,1677907.0,0.0,5.7,0.57,900.0,5.7,217361.6,671.94,0.0,True,95.75,6.48,5.94,0.54,2025-12-10,111.5,9.96,1,122.6,79.3,ATH,False,False
10-12-2025 10:00,ISFIN,19.05,19.3,19.05,19.23,508836.0,0.07,0.18,0.02,847.37,0.18,142660.7,256.68,0.39,True,60.33,-0.01,-0.02,0.01,2025-12-10,19.04,1.0,1,19.3,18.94,19.3,False,False
10-12-2025 10:00,GMTAS,45.08,45.3,44.48,45.24,293332.0,0.06,0.16,0.02,700.0,0.16,96356.6,204.42,0.37,True,51.9,-0.06,-0.11,0.05,2025-12-10,45.08,0.35,2,44.48,44.48,45.4,False,False
10-12-2025 10:00,KLKIM,30.9,32.38,30.9,32.04,1314678.0,0.34,1.14,0.13,763.64,1.14,247381.4,431.44,0.3,True,75.02,0.19,0.11,0.09,2025-12-10,30.88,3.76,1,32.38,30.4,32.38,False,False
10-12-2025 10:00,LIDER,55.9,57.75,54.75,57.65,1501719.0,0.1,1.75,0.12,1300.0,1.75,406669.5,269.27,0.06,True,56.83,0.72,1.16,-0.45,2025-12-10,56.65,1.77,0,,45.32,61.25,False,False
10-12-2025 10:00,HATSN,40.6,41.08,40.54,40.98,157352.0,0.1,0.38,0.04,955.56,0.38,82363.8,91.05,0.26,True,47.52,-0.2,-0.23,0.03,2025-12-10,40.84,0.34,1,41.08,40.52,41.08,False,False
10-12-2025 10:00,KOPOL,5.63,5.84,5.63,5.8,5143952.0,0.04,0.17,0.02,962.5,0.17,1094683.7,369.9,0.24,True,74.32,0.02,0.02,0.01,2025-12-10,5.61,3.39,0,,5.57,ATH,False,False
10-12-2025 10:00,MOPAS,32.12,34.04,32.0,34.02,2214373.0,0.02,1.9,0.23,711.97,1.9,453462.1,388.33,0.01,True,83.39,0.34,0.2,0.14,2025-12-10,32.02,6.25,0,,31.02,ATH,False,False
10-12-2025 10:00,YIGIT,23.86,24.1,23.84,24.04,399983.0,0.06,0.18,0.03,462.5,0.18,140490.6,184.7,0.33,True,66.96,0.04,0.02,0.02,2025-12-10,23.86,0.75,0,,23.66,24.48,False,False
10-12-2025 10:00,ADEL,31.1,31.52,31.1,31.5,208809.0,0.02,0.4,0.03,1233.33,0.4,65143.9,220.54,0.05,True,59.19,-0.08,-0.12,0.04,2025-12-10,31.08,1.35,0,,30.9,31.74,True,False
10-12-2025 10:00,ASELS,201.9,208.8,200.9,208.0,18367117.0,0.8,6.1,1.55,293.55,6.1,5301100.4,246.48,0.13,True,87.08,4.01,3.03,0.97,2025-12-10,202.0,2.97,0,,183.0,ATH,False,False
10-12-2025 10:00,SRVGY,3.55,3.63,3.53,3.63,17922885.0,0.0,0.08,0.02,433.33,0.08,6657054.8,169.23,0.0,True,66.53,0.02,0.01,0.01,2025-12-10,3.55,2.25,0,,3.47,3.64,False,False
10-12-2025 10:00,SNICA,4.05,4.07,4.05,4.07,1984536.0,0.0,0.02,0.0,1900.0,0.02,694984.6,185.55,0.0,True,53.81,-0.01,-0.01,0.0,2025-12-10,4.05,0.49,0,,4.02,4.11,False,False
10-12-2025 10:00,FZLGY,12.56,12.73,12.49,12.7,1092321.0,0.03,0.14,0.01,1172.73,0.14,328384.2,232.64,0.21,True,61.24,0.06,0.07,-0.01,2025-12-10,12.56,1.11,0,,12.43,12.83,False,False
10-12-2025 10:00,EKOS,27.28,28.3,27.16,28.08,2091778.0,0.22,0.8,0.14,455.56,0.8,575978.9,263.17,0.28,True,77.85,0.22,0.1,0.12,2025-12-10,27.1,3.62,1,28.3,26.2,28.3,False,False
10-12-2025 10:00,RYSAS,14.01,14.25,14.01,14.25,1206266.0,0.0,0.24,0.02,1233.33,0.24,408627.5,195.2,0.0,True,73.8,0.06,0.03,0.02,2025-12-10,14.03,1.57,1,14.25,13.82,ATH,False,False
09-12-2025 17:00,TUCLK,4.99,5.36,4.98,5.31,8133975.35,0.05,0.32,0.03,1015.38,0.32,1330635.74,511.28,0.16,True,76.98,0.0,-0.01,0.02,2025-12-09,5.02,5.86,1,5.36,4.91,5.36,True,True
09-12-2025 17:00,ALBRK,8.31,8.39,8.31,8.39,3876561.0,0.0,0.08,0.01,1500.0,0.08,1362924.9,184.43,0.0,True,65.54,0.03,0.03,0.0,2025-12-09,8.31,0.96,0,,8.2,ATH,False,False
09-12-2025 17:00,TERA,306.75,318.0,305.75,315.0,3367540.0,3.0,8.25,0.78,964.52,8.25,880984.2,282.25,0.36,True,83.68,5.74,5.24,0.5,2025-12-09,304.25,3.53,1,318.0,303.25,318.0,False,False
09-12-2025 17:00,TATGD,12.78,13.32,12.74,13.2,1785952.0,0.12,0.42,0.03,1400.0,0.42,324978.5,449.56,0.29,True,76.13,0.13,0.1,0.02,2025-12-09,12.88,2.48,3,,12.28,ATH,False,False
09-12-2025 17:00,LIDFA,4.35,4.44,4.35,4.43,1855383.0,0.01,0.08,0.0,1900.0,0.08,451863.3,310.61,0.13,True,55.12,-0.02,-0.02,0.0,2025-12-09,4.38,1.14,0,,4.34,4.44,False,False
09-12-2025 17:00,RALYH,213.2,223.0,212.8,222.6,454713.0,0.4,9.4,1.41,566.67,9.4,113930.8,299.11,0.04,True,76.77,2.17,1.14,1.03,2025-12-09,210.0,6.0,1,223.0,204.4,223.0,False,False
09-12-2025 17:00,PATEK,24.62,26.5,24.52,26.44,10538542.0,0.06,1.82,0.22,734.86,1.82,2392770.9,340.43,0.03,True,83.68,0.23,0.08,0.15,2025-12-09,24.16,9.44,0,,24.02,ATH,False,False
09-12-2025 17:00,BIGCH,70.35,75.0,69.55,75.0,552636.0,0.0,4.65,0.3,1476.27,4.65,337858.3,63.57,0.0,True,72.74,1.7,1.9,-0.2,2025-12-09,72.4,3.59,1,75.0,58.55,ATH,False,False
09-12-2025 17:00,ODAS,5.41,5.46,5.4,5.45,5797102.0,0.01,0.04,0.0,3900.0,0.04,2786520.6,108.04,0.25,True,59.62,0.02,0.01,0.0,2025-12-09,5.39,1.11,0,,5.26,5.46,False,False
09-12-2025 17:00,BESLR,12.76,12.91,12.76,12.91,754416.0,0.0,0.15,0.02,733.33,0.15,218456.1,245.34,0.0,True,70.12,0.06,0.06,0.0,2025-12-09,12.72,1.49,0,,12.68,ATH,False,False
09-12-2025 17:00,AZTEK,4.37,4.52,4.34,4.49,3340478.0,0.03,0.12,0.01,1400.0,0.12,896328.1,272.68,0.25,True,59.39,-0.03,-0.04,0.01,2025-12-09,4.38,2.51,3,,4.4,4.69,True,True
09-12-2025 17:00,TURSG,12.25,12.33,12.22,12.31,11776104.0,0.02,0.06,0.0,2900.0,0.06,4616485.6,155.09,0.33,True,70.35,0.09,0.09,-0.0,2025-12-09,12.2,0.9,1,12.33,11.57,12.33,False,False
09-12-2025 17:00,DGNMO,5.4,5.45,5.4,5.44,229511.0,0.01,0.04,0.01,300.0,0.04,125640.1,82.67,0.25,True,55.33,-0.01,-0.03,0.01,2025-12-09,5.35,1.68,0,,5.29,5.69,False,False
09-12-2025 17:00,DZGYO,7.62,7.9,7.6,7.87,5482954.0,0.03,0.25,0.02,1462.5,0.25,1426864.1,284.27,0.12,True,72.19,0.11,0.11,-0.0,2025-12-09,7.74,1.68,0,,7.57,ATH,False,False
09-12-2025 17:00,DENGE,3.29,3.66,3.28,3.66,7033135.0,0.0,0.37,0.03,1056.25,0.37,1467528.2,379.25,0.0,True,74.5,0.03,0.02,0.01,2025-12-09,3.33,9.91,0,,3.18,ATH,False,False
09-12-2025 17:00,DMSAS,11.17,11.41,11.15,11.36,619635.0,0.05,0.19,0.03,475.76,0.19,168264.4,268.25,0.26,True,73.81,0.09,0.07,0.02,2025-12-09,11.05,2.81,0,,10.7,ATH,False,False
09-12-2025 17:00,EGSER,3.02,3.14,3.01,3.12,2123171.0,0.02,0.1,0.01,1150.0,0.1,855679.8,148.13,0.2,True,67.44,0.01,0.0,0.0,2025-12-09,3.04,2.63,3,,3.01,3.25,False,False
09-12-2025 16:00,VAKBN,30.68,31.16,30.62,31.14,9430475.0,0.02,0.46,0.03,1542.86,0.46,4652026.4,102.72,0.04,True,55.63,-0.15,-0.19,0.05,2025-12-09,30.82,1.04,0,,30.3,31.5,True,True
09-12-2025 16:00,MEGMT,49.52,51.85,48.78,51.85,9334162.0,0.0,2.33,0.45,418.93,2.33,2907044.1,221.09,0.0,True,78.28,1.31,1.01,0.3,2025-12-09,47.18,9.9,0,,42.94,ATH,False,False
09-12-2025 16:00,ICUGS,2.79,2.85,2.77,2.85,4770608.0,0.0,0.06,0.01,566.67,0.06,1145557.6,316.44,0.0,True,61.01,-0.01,-0.01,0.0,2025-12-09,2.79,2.15,2,2.77,2.77,3.08,False,False
09-12-2025 15:00,GLYHO,12.34,12.81,12.34,12.81,3135484.0,0.0,0.47,0.04,993.02,0.47,1104908.1,183.78,0.0,True,71.78,0.04,0.02,0.02,2025-12-09,12.24,4.66,0,,12.16,ATH,False,False
09-12-2025 15:00,ULKER,112.9,115.4,112.9,115.1,2540085.0,0.3,2.2,0.12,1733.33,2.2,633518.0,300.95,0.14,True,62.71,0.3,0.31,-0.01,2025-12-09,113.5,1.41,0,,112.0,ATH,False,False
09-12-2025 14:00,ANSGR,23.54,23.8,23.52,23.78,1579201.0,0.02,0.24,0.03,757.14,0.24,660395.4,139.13,0.08,True,74.99,0.26,0.22,0.04,2025-12-09,23.28,2.15,0,,22.3,ATH,False,False
09-12-2025 14:00,KRDMD,25.78,26.22,25.78,26.12,11332569.0,0.1,0.34,0.01,5566.67,0.34,4302904.9,163.37,0.29,True,61.29,0.06,0.05,0.0,2025-12-09,25.84,1.08,0,,25.48,26.22,False,False
09-12-2025 14:00,EMKEL,69.35,71.65,69.2,71.55,2329436.0,0.1,2.2,0.36,511.11,2.2,748469.0,211.23,0.05,True,77.02,1.38,1.32,0.06,2025-12-09,67.3,6.32,0,,66.0,ATH,False,False
09-12-2025 14:00,SISE,41.7,43.0,41.48,42.92,45740806.0,0.08,1.22,0.06,1933.33,1.22,15369100.2,197.62,0.07,True,80.64,1.16,1.11,0.05,2025-12-09,41.52,3.37,0,,41.42,ATH,False,False
09-12-2025 14:00,ALKIM,16.62,17.59,16.6,17.34,3984878.0,0.25,0.72,0.06,1120.34,0.72,747336.4,433.21,0.35,True,78.0,0.18,0.14,0.04,2025-12-09,16.46,5.35,0,,16.32,ATH,False,False
09-12-2025 14:00,IZENR,10.28,10.68,10.26,10.65,10578866.0,0.03,0.37,0.05,704.35,0.37,3054318.5,246.36,0.08,True,72.88,0.08,0.05,0.03,2025-12-09,10.19,4.51,1,10.68,10.04,10.68,False,False
09-12-2025 14:00,KRVGD,2.55,2.59,2.54,2.58,2897175.0,0.01,0.03,0.01,400.0,0.03,1423843.8,103.48,0.33,True,60.18,0.01,0.01,0.0,2025-12-09,2.55,1.18,0,,2.52,2.66,False,False
09-12-2025 14:00,GWIND,23.58,23.8,23.54,23.76,462409.0,0.04,0.18,0.01,1400.0,0.18,279290.5,65.57,0.22,True,60.89,0.09,0.08,0.01,2025-12-09,23.48,1.19,0,,23.06,23.8,False,False
09-12-2025 13:00,CWENE,28.46,29.54,28.2,29.52,9269682.0,0.02,1.06,0.2,424.75,1.06,5683037.6,63.11,0.02,True,66.86,0.25,0.15,0.1,2025-12-09,27.2,8.53,0,,26.66,ATH,False,False
09-12-2025 13:00,SEKUR,4.1,4.18,4.06,4.17,465942.0,0.01,0.07,0.0,3400.0,0.07,179472.4,159.62,0.14,True,51.38,-0.03,-0.03,-0.0,2025-12-09,4.1,1.71,0,,4.06,4.59,False,False
09-12-2025 12:00,KFEIN,9.05,9.27,9.05,9.24,1045532.0,0.03,0.19,0.01,1800.0,0.19,329051.3,217.74,0.16,True,67.52,0.02,0.0,0.01,2025-12-09,9.1,1.54,1,9.27,9.04,9.27,False,False
09-12-2025 12:00,ENERY,10.46,10.64,10.46,10.59,6355415.0,0.05,0.13,0.01,983.33,0.13,2254496.3,181.9,0.38,True,66.14,0.05,0.05,0.0,2025-12-09,10.46,1.24,1,10.64,10.07,10.64,False,False
09-12-2025 12:00,KAREL,9.18,9.31,9.18,9.28,761334.0,0.03,0.1,0.01,614.29,0.1,378248.7,101.28,0.3,True,67.67,0.06,0.04,0.01,2025-12-09,9.21,0.76,1,9.31,8.9,9.31,False,False
09-12-2025 12:00,SMART,22.92,24.98,22.84,24.52,1575054.0,0.46,1.6,0.14,1042.86,1.6,221382.6,611.46,0.29,True,75.2,0.09,0.01,0.08,2025-12-09,23.14,5.96,3,,22.76,25.4,True,True
09-12-2025 11:00,ARTMS,42.0,42.78,41.9,42.74,274107.0,0.04,0.74,0.07,957.14,0.74,155499.2,76.28,0.05,True,71.14,0.41,0.35,0.06,2025-12-09,41.62,2.69,0,,39.88,43.06,False,False
09-12-2025 11:00,ARENA,28.56,29.64,28.54,29.34,1136528.0,0.3,0.78,0.11,622.22,0.78,220858.6,414.6,0.38,True,75.81,0.35,0.28,0.07,2025-12-09,27.86,5.31,1,29.64,27.76,29.64,False,False
09-12-2025 10:00,CEMAS,4.73,5.19,4.68,5.19,41547871.0,0.0,0.46,0.05,878.72,0.46,5137213.2,708.76,0.0,True,86.56,0.03,-0.01,0.04,2025-12-09,4.72,9.96,3,,4.66,ATH,False,False
09-12-2025 10:00,ENSRI,15.1,16.26,14.74,16.01,6409192.26,0.25,0.91,0.07,1114.29,0.91,1050136.27,510.32,0.27,True,69.77,0.14,0.07,0.07,2025-12-09,14.95,7.08,0,,14.65,16.5,False,False
09-12-2025 10:00,GENTS,10.41,10.87,10.41,10.78,4147291.0,0.09,0.37,0.01,4525.0,0.37,975025.9,325.35,0.24,True,56.69,-0.11,-0.12,0.01,2025-12-09,10.25,5.17,1,10.87,10.25,10.87,True,True
09-12-2025 10:00,TCKRC,57.1,58.5,56.6,58.15,694213.0,0.35,1.05,0.1,900.0,1.05,452976.2,53.26,0.33,True,78.03,1.39,1.39,0.0,2025-12-09,57.05,1.93,0,,50.0,59.8,False,False
09-12-2025 10:00,BAHKM,58.55,63.6,58.5,63.35,1191641.0,0.25,4.8,0.49,879.59,4.8,208135.8,472.53,0.05,True,72.48,0.09,-0.17,0.26,2025-12-09,58.5,8.29,0,,57.9,63.6,False,False
09-12-2025 10:00,MNDRS,13.87,14.11,13.85,14.1,837000.0,0.01,0.23,0.02,900.0,0.23,271995.1,207.73,0.04,True,67.1,0.04,0.02,0.02,2025-12-09,13.86,1.73,0,,13.61,14.11,False,False
09-12-2025 10:00,ARDYZ,36.16,37.26,35.8,37.04,3432100.0,0.22,0.88,0.06,1275.0,0.88,1112017.8,208.64,0.25,True,63.65,0.19,0.26,-0.06,2025-12-09,35.96,3.0,0,,35.38,37.6,False,False
09-12-2025 10:00,TCELL,100.6,102.1,100.5,101.9,5684176.0,0.2,1.3,0.32,306.25,1.3,2740995.5,107.38,0.15,True,76.01,0.91,0.77,0.15,2025-12-09,100.8,1.09,1,102.1,96.8,102.1,False,False
09-12-2025 10:00,YYAPI,2.06,2.11,2.03,2.1,57243047.0,0.01,0.04,0.0,1900.0,0.04,17395332.6,229.07,0.25,True,67.8,0.02,0.02,0.0,2025-12-09,2.06,1.94,2,2.03,2.03,2.12,False,False
09-12-2025 10:00,MGROS,512.0,520.0,509.5,518.5,820900.0,1.5,6.5,0.85,664.71,6.5,269912.4,204.14,0.23,True,60.87,0.26,-0.49,0.75,2025-12-09,511.0,1.47,3,,505.0,519.0,False,False
09-12-2025 10:00,ISCTR,14.24,14.4,14.2,14.39,145088474.0,0.01,0.15,0.01,1400.0,0.15,62542141.4,131.99,0.07,True,67.08,0.1,0.1,0.01,2025-12-09,14.22,1.2,0,,14.1,14.45,False,False
09-12-2025 10:00,DNISI,20.8,21.16,20.72,21.08,339864.0,0.08,0.28,0.03,833.33,0.28,114392.8,197.1,0.29,True,60.7,0.05,-0.0,0.05,2025-12-09,20.82,1.25,0,,20.32,21.18,False,False
09-12-2025 10:00,ALTNY,62.1,64.95,62.0,64.7,3610778.0,0.25,2.6,0.26,900.0,2.6,581950.6,520.46,0.1,True,82.65,0.33,0.15,0.18,2025-12-09,61.9,4.52,0,,61.05,ATH,False,False
09-12-2025 10:00,KIMMR,13.27,13.49,13.21,13.44,259541.0,0.05,0.17,0.02,1033.33,0.17,158323.5,63.93,0.29,True,51.39,-0.08,-0.11,0.02,2025-12-09,13.27,1.28,0,,13.16,13.6,True,False
09-12-2025 10:00,SAHOL,85.75,86.3,85.15,86.25,4830101.0,0.05,0.5,0.02,1900.0,0.5,2580183.0,87.2,0.1,True,60.12,0.39,0.32,0.06,2025-12-09,85.65,0.7,0,,82.5,86.65,False,False
09-12-2025 10:00,SELVA,2.11,2.34,2.1,2.34,18063592.0,0.0,0.23,0.02,1177.78,0.23,3222938.5,460.47,0.0,True,72.66,0.07,0.06,0.01,2025-12-09,2.13,9.86,1,2.34,1.86,ATH,False,False
09-12-2025 10:00,DURDO,3.68,3.89,3.67,3.88,5156323.0,0.01,0.2,0.02,1011.11,0.2,780039.9,561.03,0.05,True,73.6,0.02,0.02,0.0,2025-12-09,3.68,5.43,2,3.67,3.67,ATH,False,False
08-12-2025 17:00,VBTYZ,15.7,15.82,15.69,15.81,152766.0,0.01,0.11,0.02,511.11,0.11,61215.3,149.56,0.09,True,60.18,0.05,0.02,0.02,2025-12-08,15.66,0.96,0,,15.36,15.84,False,False
08-12-2025 17:00,ASTOR,101.8,104.5,101.6,104.0,14436430.0,0.5,2.2,0.41,443.21,2.2,3875386.6,272.52,0.23,True,79.73,1.05,0.76,0.28,2025-12-08,99.35,4.68,1,104.5,97.45,104.5,False,False
08-12-2025 17:00,BNTAS,6.43,6.83,6.42,6.8,10782388.0,0.03,0.37,0.04,802.44,0.37,1296885.9,731.41,0.08,True,83.4,0.04,0.01,0.03,2025-12-08,6.35,7.09,0,,6.32,ATH,False,False
08-12-2025 16:00,MAGEN,33.36,34.3,33.22,34.22,1431059.0,0.08,0.86,0.13,541.79,0.86,741891.9,92.89,0.09,True,73.18,0.31,0.2,0.11,2025-12-08,32.86,4.14,0,,32.02,ATH,False,False
08-12-2025 16:00,SEGYO,5.53,5.68,5.53,5.66,3475846.0,0.02,0.13,0.0,12900.0,0.13,1391825.5,149.73,0.15,True,51.78,-0.05,-0.04,-0.0,2025-12-08,5.57,1.62,0,,5.43,6.07,False,False
08-12-2025 15:00,PNSUT,11.32,11.75,11.3,11.69,1329781.0,0.06,0.37,0.06,549.12,0.37,311042.1,327.52,0.16,True,72.23,0.08,0.04,0.04,2025-12-08,11.0,6.27,0,,10.97,ATH,False,False
08-12-2025 15:00,VAKFA,13.35,13.85,13.3,13.84,19042774.0,0.01,0.49,0.0,48900.0,0.49,8065320.8,136.11,0.02,True,50.33,-0.18,-0.18,0.0,2025-12-08,13.72,0.87,0,,13.27,14.68,True,True
08-12-2025 15:00,PETUN,11.08,11.44,11.0,11.39,1162123.0,0.05,0.31,0.06,463.64,0.31,283594.4,309.78,0.16,True,76.67,0.06,0.0,0.05,2025-12-08,10.82,5.27,0,,10.67,ATH,False,False
08-12-2025 14:00,A1YEN,29.78,30.4,29.74,30.32,197216.0,0.08,0.54,0.05,938.46,0.54,75378.3,161.63,0.15,True,65.72,0.06,-0.02,0.08,2025-12-08,29.44,2.99,0,,29.28,30.74,False,False
08-12-2025 14:00,DURKN,14.3,14.55,14.3,14.51,1121854.0,0.04,0.21,0.01,2900.0,0.21,273849.1,309.66,0.19,True,63.21,0.06,0.05,0.01,2025-12-08,14.3,1.47,0,,14.08,14.7,False,False
08-12-2025 14:00,KRDMA,25.42,25.84,25.38,25.76,530718.0,0.08,0.34,0.07,385.71,0.34,266047.8,99.48,0.24,True,69.4,0.08,-0.03,0.11,2025-12-08,24.82,3.79,0,,24.48,26.14,False,False
08-12-2025 14:00,SUNTK,41.42,42.28,41.28,42.16,521688.0,0.12,0.74,0.07,957.14,0.74,158280.4,229.6,0.16,True,66.83,0.44,0.48,-0.04,2025-12-08,40.5,4.1,0,,40.48,43.0,False,False
08-12-2025 13:00,SILVR,2.78,2.85,2.78,2.83,513687.0,0.02,0.05,0.01,733.33,0.05,316040.4,62.54,0.4,True,57.99,-0.0,-0.01,0.01,2025-12-08,2.81,0.71,0,,2.72,3.01,False,False
08-12-2025 13:00,YKBNK,36.6,37.32,36.58,37.14,45409688.0,0.18,0.54,0.1,451.02,0.54,26201687.0,73.31,0.33,True,68.65,0.11,-0.08,0.19,2025-12-08,35.86,3.57,1,37.32,34.88,37.32,False,False
08-12-2025 13:00,SOKM,48.32,48.9,48.3,48.86,1025956.0,0.04,0.54,0.02,3275.0,0.54,577751.2,77.58,0.07,True,64.16,0.28,0.27,0.01,2025-12-08,48.34,1.08,0,,47.06,ATH,False,False
08-12-2025 13:00,AKBNK,68.1,69.8,68.05,69.4,26945740.0,0.4,1.3,0.21,519.05,1.3,12930055.7,108.4,0.31,True,77.81,0.64,0.33,0.3,2025-12-08,67.0,3.58,1,69.8,63.95,69.8,False,False
08-12-2025 13:00,VSNMD,97.8,101.4,96.8,100.4,1239815.0,1.0,2.6,0.22,1081.82,2.6,488749.8,153.67,0.38,True,68.93,0.95,0.74,0.21,2025-12-08,94.8,5.91,1,101.4,94.05,101.4,False,False
08-12-2025 13:00,XBANK,16543.26,16806.89,16531.67,16735.48,215215212.0,71.41,192.22,42.62,351.0,192.22,126657995.9,69.92,0.37,True,70.7,80.06,23.93,56.13,2025-12-08,16329.08,2.49,1,16806.89,15874.15,16806.89,False,False
08-12-2025 12:00,ISMEN,42.22,42.48,42.16,42.46,754242.0,0.02,0.24,0.05,344.44,0.24,491414.8,53.48,0.08,True,69.77,0.14,0.04,0.09,2025-12-08,41.52,2.26,0,,41.22,ATH,False,False
08-12-2025 12:00,EDATA,5.38,5.56,5.38,5.55,4482812.0,0.01,0.17,0.02,672.73,0.17,812045.7,452.04,0.06,True,76.94,0.03,0.01,0.02,2025-12-08,5.32,4.32,0,,5.27,ATH,False,False
08-12-2025 12:00,KBORU,14.59,15.81,14.54,15.5,6967545.0,0.31,0.91,0.12,684.48,0.91,1579218.3,341.2,0.34,True,80.25,0.23,0.14,0.09,2025-12-08,14.56,6.46,0,,13.83,ATH,False,False
08-12-2025 11:00,TOASO,237.6,244.2,237.6,243.4,1815130.0,0.8,5.8,0.79,634.18,5.8,507763.2,257.48,0.14,True,82.54,1.54,0.51,1.03,2025-12-08,233.5,4.24,0,,228.3,ATH,False,False
08-12-2025 11:00,NATEN,8.57,8.66,8.56,8.65,1049104.0,0.01,0.08,0.01,1233.33,0.08,468888.1,123.74,0.12,True,60.58,-0.01,-0.02,0.01,2025-12-08,8.5,1.76,1,8.66,8.47,8.66,True,False
08-12-2025 11:00,DITAS,40.02,41.54,39.9,41.54,251648.0,0.0,1.52,0.09,1588.89,1.52,101300.8,148.42,0.0,True,55.05,-0.22,-0.21,-0.01,2025-12-08,40.12,3.54,0,,38.4,43.28,False,False
08-12-2025 11:00,BRSAN,498.0,508.0,497.5,506.0,495494.0,2.0,8.0,0.98,720.51,8.0,188973.0,162.2,0.25,True,61.74,1.64,2.09,-0.45,2025-12-08,492.75,2.69,0,,488.5,519.5,False,False
08-12-2025 11:00,MOGAN,8.43,8.48,8.42,8.47,392696.0,0.01,0.04,0.01,263.64,0.04,221196.0,77.53,0.25,True,69.53,0.02,-0.0,0.02,2025-12-08,8.34,1.56,1,8.48,8.21,8.48,False,False
08-12-2025 11:00,VESTL,32.94,34.56,32.92,34.34,3687141.0,0.22,1.4,0.17,704.6,1.4,706302.9,422.03,0.16,True,84.33,0.2,0.01,0.18,2025-12-08,32.46,5.79,1,34.56,31.94,34.56,False,False
08-12-2025 11:00,ENDAE,14.35,14.51,14.34,14.48,306221.0,0.03,0.13,0.02,622.22,0.13,142615.6,114.72,0.23,True,48.15,-0.11,-0.13,0.03,2025-12-08,14.29,1.33,1,14.51,14.26,14.51,True,True
08-12-2025 11:00,YESIL,2.17,2.2,2.16,2.2,6460826.0,0.0,0.03,0.01,500.0,0.03,4101068.1,57.54,0.0,True,68.46,0.01,-0.01,0.01,2025-12-08,2.12,3.77,0,,2.06,2.21,False,False
08-12-2025 11:00,CRDFA,54.6,57.95,54.3,57.5,340421.0,0.45,2.9,0.26,1015.38,2.9,141917.5,139.87,0.16,True,55.77,-0.76,-1.0,0.24,2025-12-08,55.2,4.17,1,57.95,53.0,57.95,True,True
08-12-2025 11:00,OYAKC,24.86,25.5,24.8,25.38,7911376.0,0.12,0.52,0.06,712.5,0.52,3076743.8,157.13,0.23,True,73.59,0.17,0.12,0.05,2025-12-08,24.8,2.34,0,,24.2,ATH,False,False
08-12-2025 11:00,KONKA,14.53,14.78,14.52,14.75,506507.0,0.03,0.22,0.03,609.68,0.22,201029.5,151.96,0.14,True,77.58,0.1,0.07,0.03,2025-12-08,14.23,3.65,0,,14.16,ATH,False,False
08-12-2025 11:00,MERIT,17.66,18.0,17.66,17.92,754282.0,0.08,0.26,0.08,213.25,0.26,427728.4,76.35,0.31,True,73.74,0.17,0.07,0.1,2025-12-08,17.55,2.11,0,,16.67,18.15,False,False
08-12-2025 11:00,DAPGM,12.14,12.66,11.94,12.55,20515272.0,0.11,0.41,0.12,244.54,0.41,7446086.5,175.52,0.27,True,88.04,0.24,0.14,0.11,2025-12-08,11.94,5.11,0,,11.11,ATH,False,False
08-12-2025 10:00,BULGS,44.06,45.86,44.06,45.68,3403381.0,0.18,1.62,0.27,500.0,1.62,1076322.5,216.2,0.11,True,68.61,-0.07,-0.31,0.23,2025-12-08,43.8,4.29,1,45.86,42.68,45.86,True,False
08-12-2025 10:00,BUCIM,6.47,6.6,6.41,6.58,3039549.0,0.02,0.11,0.03,340.0,0.11,1037104.7,193.08,0.18,True,90.13,0.06,0.03,0.03,2025-12-08,6.44,2.17,0,,6.24,ATH,False,False
08-12-2025 10:00,LINK,271.25,289.75,270.75,288.0,1384709.0,1.75,16.75,2.82,492.92,16.75,300654.8,360.56,0.1,True,81.96,9.51,7.77,1.74,2025-12-08,264.25,8.99,0,,235.0,ATH,False,False
08-12-2025 10:00,KAYSE,17.39,17.67,17.39,17.62,463456.0,0.05,0.23,0.04,538.89,0.23,183612.1,152.41,0.22,True,67.3,0.04,0.01,0.02,2025-12-08,17.4,1.26,0,,17.21,17.68,False,False
08-12-2025 10:00,BJKAS,1.78,1.8,1.78,1.8,6315583.0,0.0,0.02,0.0,1900.0,0.02,2361050.6,167.49,0.0,True,60.4,0.0,0.0,0.0,2025-12-08,1.77,1.69,1,1.8,1.76,1.82,False,False
08-12-2025 10:00,FRIGO,10.2,10.46,10.1,10.46,1857531.0,0.0,0.26,0.02,1268.42,0.26,648951.8,186.24,0.0,True,61.3,0.06,0.05,0.01,2025-12-08,10.13,3.26,0,,10.08,10.47,False,False
08-12-2025 10:00,RGYAS,140.5,142.2,140.3,141.9,233580.0,0.3,1.4,0.28,400.0,1.4,132202.4,76.68,0.21,True,68.88,0.31,0.04,0.27,2025-12-08,140.1,1.28,0,,137.9,143.0,False,False
08-12-2025 10:00,ENKAI,80.05,80.9,80.05,80.85,2053997.0,0.05,0.8,0.11,595.65,0.8,957546.2,114.51,0.06,True,63.99,0.06,0.01,0.05,2025-12-08,79.75,1.38,0,,78.9,81.3,False,False
08-12-2025 10:00,OSTIM,2.91,2.96,2.91,2.95,3732523.0,0.01,0.04,0.0,900.0,0.04,761825.0,389.94,0.25,True,58.65,-0.01,-0.02,0.0,2025-12-08,2.89,2.08,0,,2.89,2.99,True,False
08-12-2025 10:00,BRLSM,13.79,14.02,13.78,13.97,370997.0,0.05,0.18,0.02,800.0,0.18,164802.6,125.12,0.28,True,65.39,0.0,-0.01,0.01,2025-12-08,13.78,1.38,0,,13.61,13.98,False,False
08-12-2025 10:00,AKFYE,17.12,17.33,17.12,17.31,1013173.0,0.02,0.19,0.01,1361.54,0.19,226871.0,346.59,0.11,True,72.53,0.02,0.01,0.02,2025-12-08,17.06,1.47,0,,16.95,ATH,False,False
08-12-2025 10:00,FROTO,91.15,92.85,91.15,92.65,4404918.0,0.2,1.5,0.11,1263.64,1.5,1988900.8,121.47,0.13,True,59.76,-0.21,-0.45,0.24,2025-12-08,90.8,2.04,0,,89.85,93.05,True,False
08-12-2025 10:00,DOFRB,75.15,79.25,75.0,78.2,3852190.0,1.05,3.05,0.24,1170.83,3.05,1367159.1,181.77,0.34,True,65.25,0.47,0.42,0.05,2025-12-08,75.0,4.27,0,,73.0,81.75,False,False
08-12-2025 10:00,IHEVA,2.19,2.26,2.19,2.24,308540.0,0.02,0.05,0.01,455.56,0.05,145660.7,111.82,0.4,True,59.17,-0.0,-0.01,0.01,2025-12-08,2.21,1.36,1,2.26,2.15,2.26,False,False
08-12-2025 10:00,BSOKE,15.74,16.15,15.67,16.13,3433234.0,0.02,0.39,0.05,635.85,0.39,2118998.8,62.02,0.05,True,71.83,0.25,0.18,0.07,2025-12-08,15.67,2.94,0,,14.7,ATH,False,False
05-12-2025 17:00,DARDL,2.21,2.24,2.21,2.24,4205163.0,0.0,0.03,0.0,650.0,0.03,1595333.2,163.59,0.0,True,49.12,-0.01,-0.01,-0.0,2025-12-05,2.23,0.45,2,2.21,2.21,2.3,True,True
05-12-2025 17:00,GENIL,196.4,199.1,196.3,199.0,210994.0,0.1,2.6,0.44,490.91,2.6,101901.3,107.06,0.04,True,68.15,0.84,0.73,0.11,2025-12-05,195.0,2.05,1,199.1,193.1,199.1,False,False
05-12-2025 17:00,TATEN,14.51,15.86,14.49,15.86,4784868.0,0.0,1.35,0.14,837.5,1.35,831529.2,475.43,0.0,True,69.58,-0.2,-0.32,0.12,2025-12-05,14.42,9.99,0,,14.21,15.88,True,False
05-12-2025 17:00,AKGRT,6.72,6.78,6.7,6.77,2384701.0,0.01,0.05,0.01,233.33,0.05,1457811.2,63.58,0.2,True,67.84,0.01,-0.0,0.01,2025-12-05,6.61,2.42,0,,6.58,6.8,False,False
05-12-2025 17:00,ISDMR,35.48,35.7,35.48,35.66,307887.0,0.04,0.18,0.02,800.0,0.18,165091.1,86.5,0.22,True,44.76,-0.12,-0.09,-0.02,2025-12-05,35.6,0.17,0,,35.46,36.78,False,False
05-12-2025 16:00,KMPUR,16.53,16.88,16.42,16.79,489568.0,0.09,0.26,0.05,420.0,0.26,315670.4,55.09,0.35,True,67.16,0.13,0.1,0.02,2025-12-05,16.49,1.82,2,16.42,16.42,16.93,False,False
05-12-2025 16:00,FORTE,79.25,82.0,79.25,81.95,250531.0,0.05,2.7,0.06,4809.09,2.7,135386.5,85.05,0.02,True,59.07,-0.28,-0.18,-0.1,2025-12-05,81.4,0.68,0,,78.9,84.05,False,False
05-12-2025 15:00,DOAS,186.0,187.3,185.5,187.1,270988.0,0.2,1.1,0.2,450.0,1.1,143032.7,89.46,0.18,True,59.8,0.03,-0.27,0.3,2025-12-05,184.4,1.46,0,,183.7,194.0,True,False
05-12-2025 15:00,KNFRT,11.59,11.67,11.56,11.67,331519.0,0.0,0.08,0.01,700.0,0.08,133293.5,148.71,0.0,True,47.33,-0.05,-0.06,0.01,2025-12-05,11.6,0.6,0,,11.52,11.9,False,False
05-12-2025 13:00,ESEN,7.37,7.51,7.27,7.51,10966456.0,0.0,0.14,0.02,536.36,0.14,3977056.4,175.74,0.0,True,71.47,0.08,0.07,0.01,2025-12-05,7.31,2.74,0,,7.13,ATH,False,False
05-12-2025 12:00,GESAN,44.88,45.44,44.86,45.36,444302.0,0.08,0.48,0.07,585.71,0.48,262110.2,69.51,0.17,True,64.07,0.07,0.06,0.01,2025-12-05,44.62,1.66,0,,44.34,45.68,False,False
05-12-2025 12:00,MIATK,36.24,37.46,36.14,37.14,6210282.0,0.32,0.9,0.16,462.5,0.9,1981091.7,213.48,0.36,True,76.93,0.18,0.02,0.16,2025-12-05,35.9,3.45,0,,35.08,ATH,False,False
05-12-2025 11:00,TEKTU,12.46,13.39,12.37,13.18,5390413.0,0.21,0.72,0.06,1141.38,0.72,1445024.2,273.03,0.29,True,62.49,0.01,0.01,0.0,2025-12-05,12.33,6.89,0,,12.12,13.23,False,False
05-12-2025 11:00,TEZOL,12.36,12.69,12.35,12.64,1158138.0,0.05,0.28,0.03,723.53,0.28,247220.8,368.46,0.18,True,69.27,0.0,-0.01,0.01,2025-12-05,12.2,3.61,0,,12.17,ATH,False,False
05-12-2025 11:00,QUAGR,3.53,3.72,3.47,3.67,55882287.0,0.05,0.14,0.01,2233.33,0.14,12711497.2,339.62,0.36,True,60.64,-0.01,-0.01,0.0,2025-12-05,3.51,4.56,2,3.47,3.47,3.81,True,True
05-12-2025 11:00,CIMSA,47.3,48.1,47.24,47.96,1645847.0,0.14,0.66,0.0,32900.0,0.66,829569.5,98.4,0.21,True,52.37,-0.1,0.01,-0.11,2025-12-05,47.5,0.97,0,,46.9,49.44,False,False
05-12-2025 11:00,KONTR,15.62,16.43,15.6,16.33,31486092.38,0.09,0.71,0.04,1871.43,0.71,11073724.05,184.33,0.13,True,54.38,-0.21,-0.26,0.05,2025-12-05,15.68,4.15,0,,15.46,ATH,True,True
05-12-2025 10:00,SMRVA,464.25,505.5,464.0,495.75,324437.0,9.75,31.5,3.12,908.0,31.5,77458.8,318.85,0.31,True,52.61,-4.25,-2.9,-1.36,2025-12-05,476.5,4.04,2,464.0,464.0,516.0,False,False
05-12-2025 10:00,PLTUR,20.9,21.28,20.7,21.24,482507.0,0.04,0.34,0.04,709.52,0.34,193979.2,148.74,0.12,True,61.69,0.07,0.07,0.0,2025-12-05,20.74,2.41,2,20.7,20.7,21.82,False,False
05-12-2025 10:00,ALARK,95.9,99.25,95.65,99.0,7338589.0,0.25,3.1,0.38,726.67,3.1,1264985.5,480.13,0.08,True,78.49,0.61,0.35,0.26,2025-12-05,95.25,3.94,0,,92.05,ATH,False,False
05-12-2025 10:00,AGHOL,28.06,28.36,27.96,28.3,885880.0,0.06,0.24,0.02,1100.0,0.24,395518.6,123.98,0.25,True,54.01,-0.06,-0.07,0.01,2025-12-05,28.02,1.0,0,,27.8,28.86,False,False
05-12-2025 10:00,BURCE,47.7,52.9,47.66,51.6,559291.0,1.3,3.9,0.37,954.05,3.9,139002.4,302.36,0.33,True,57.24,1.71,2.2,-0.49,2025-12-05,52.95,-2.55,2,47.66,47.66,54.6,False,False
05-12-2025 10:00,POLHO,17.63,18.07,17.57,18.07,808956.0,0.0,0.44,0.03,1194.12,0.44,470041.1,72.1,0.0,True,60.34,0.05,0.05,-0.0,2025-12-05,17.65,2.38,0,,16.59,18.65,False,False
05-12-2025 10:00,BTCIM,3.51,3.85,3.51,3.81,111588316.0,0.04,0.3,0.03,934.48,0.3,14075475.9,692.79,0.13,True,77.49,0.01,-0.0,0.01,2025-12-05,3.51,8.55,0,,3.49,ATH,False,False
04-12-2025 17:00,TRALT,36.44,38.96,36.22,38.96,52363270.0,0.0,2.52,0.35,624.14,2.52,14609992.3,258.41,0.0,True,86.6,0.42,0.19,0.24,2025-12-04,35.42,9.99,0,,35.32,ATH,False,False
04-12-2025 16:00,MEKAG,3.92,3.99,3.91,3.98,1054880.0,0.01,0.06,0.01,757.14,0.06,634759.3,66.19,0.17,True,54.33,-0.01,-0.02,0.0,2025-12-04,3.9,2.05,0,,3.89,4.1,True,False
04-12-2025 15:00,OBAMS,7.56,7.92,7.55,7.87,13606395.0,0.05,0.31,0.03,1007.14,0.31,3503092.4,288.41,0.16,True,67.02,0.0,-0.02,0.02,2025-12-04,7.5,4.93,0,,7.22,8.2,False,False
04-12-2025 15:00,AKSA,10.35,10.55,10.33,10.51,3376221.0,0.04,0.16,0.01,1042.86,0.16,1194152.2,182.73,0.25,True,63.25,0.01,0.01,0.0,2025-12-04,10.4,1.06,0,,ATL,10.55,False,False
04-12-2025 14:00,BIOEN,19.75,21.92,19.73,21.76,3880843.0,0.16,2.01,0.18,992.39,2.01,562215.7,590.28,0.08,True,83.49,0.13,0.03,0.09,2025-12-04,20.02,8.69,2,19.73,19.73,ATH,False,False
04-12-2025 14:00,BMSCH,24.64,27.36,24.54,26.68,2072859.0,0.68,2.04,0.22,844.44,2.04,497836.7,316.37,0.33,True,72.31,0.32,0.24,0.08,2025-12-04,24.92,7.06,0,,23.7,ATH,False,False
04-12-2025 14:00,BORSK,5.66,5.82,5.64,5.78,2929208.0,0.04,0.12,0.01,1100.0,0.12,608774.4,381.16,0.37,True,63.84,0.0,-0.0,0.0,2025-12-04,5.68,1.85,0,,5.63,5.87,False,False
04-12-2025 13:00,BERA,17.0,17.85,16.99,17.79,4997101.0,0.06,0.79,0.08,939.47,0.79,1312860.5,280.63,0.08,True,76.49,0.06,0.01,0.05,2025-12-04,16.68,6.65,1,17.85,16.58,17.85,False,False
04-12-2025 13:00,BEYAZ,27.12,28.4,27.12,28.4,1050784.0,0.0,1.28,0.26,392.31,1.28,399814.4,162.82,0.0,True,78.6,0.37,0.15,0.22,2025-12-04,25.82,9.99,0,,25.66,ATH,False,False
04-12-2025 12:00,DAGI,8.7,8.87,8.62,8.86,2262221.0,0.01,0.16,0.03,433.33,0.16,1327394.6,70.43,0.06,True,70.63,0.12,0.1,0.02,2025-12-04,8.73,1.49,0,,8.23,ATH,False,False
04-12-2025 11:00,DMLKT,5.97,5.98,5.95,5.98,1774327.0,0.0,0.01,0.0,900.0,0.01,844371.2,110.14,0.0,True,55.93,0.0,0.0,-0.0,2025-12-04,5.97,0.17,3,,ATL,6.01,False,False
04-12-2025 11:00,VRGYO,2.84,2.88,2.84,2.88,5844553.0,0.0,0.04,0.0,1233.33,0.04,3400257.5,71.89,0.0,True,55.73,0.01,0.02,-0.0,2025-12-04,2.87,0.35,0,,2.78,2.93,False,False
04-12-2025 11:00,AYDEM,19.5,20.14,19.5,20.02,2140821.0,0.12,0.52,0.09,484.27,0.52,537758.1,298.1,0.23,True,84.72,0.19,0.14,0.05,2025-12-04,19.44,2.98,0,,ATL,ATH,False,False
04-12-2025 10:00,METRO,5.67,5.94,5.62,5.94,7650392.0,0.0,0.27,0.05,440.0,0.27,2806323.9,172.61,0.0,True,89.52,0.18,0.12,0.06,2025-12-04,5.4,10.0,1,5.94,4.8,ATH,False,False
04-12-2025 10:00,CEMZY,45.5,49.86,45.48,49.86,3474424.0,0.0,4.36,0.38,1053.44,4.36,529810.8,555.79,0.0,True,69.85,-0.09,-0.33,0.23,2025-12-04,45.34,9.97,1,49.86,44.7,ATH,True,True
04-12-2025 10:00,CUSAN,22.44,23.48,22.02,23.48,654009.0,0.0,1.04,0.06,1693.1,1.04,139479.6,368.89,0.0,True,58.89,-0.09,-0.1,0.01,2025-12-04,22.24,5.58,2,22.02,22.02,26.32,False,False
04-12-2025 10:00,OSMEN,8.66,8.75,8.62,8.73,435047.0,0.02,0.07,0.01,1300.0,0.07,175108.5,148.44,0.29,True,62.02,0.0,-0.0,0.0,2025-12-04,8.64,1.04,0,,8.61,8.82,False,False
04-12-2025 10:00,ATATP,152.9,167.3,152.1,165.1,1426976.0,2.2,12.2,1.08,1029.63,12.2,291216.2,390.01,0.18,True,80.35,1.92,0.95,0.97,2025-12-04,152.1,8.55,1,167.3,146.5,167.3,False,False
03-12-2025 17:00,SMRTG,25.6,27.9,25.54,27.9,4567679.0,0.0,2.3,0.24,858.33,2.3,647262.0,605.69,0.0,True,91.17,0.23,0.07,0.15,2025-12-03,25.38,9.93,0,,24.82,ATH,False,False
03-12-2025 17:00,SKTAS,4.2,4.63,4.17,4.63,2354191.0,0.0,0.43,0.04,1002.56,0.43,838127.1,180.89,0.0,True,79.74,0.02,-0.01,0.02,2025-12-03,4.25,8.94,3,,4.15,ATH,False,False
03-12-2025 16:00,ARZUM,2.63,2.7,2.63,2.69,3448716.0,0.01,0.06,0.01,900.0,0.06,1040425.0,231.47,0.17,True,69.0,0.01,0.0,0.0,2025-12-03,2.63,2.28,0,,2.61,ATH,False,False
03-12-2025 16:00,GRTHO,309.25,337.5,309.25,332.5,515465.0,5.0,23.25,1.75,1228.57,23.25,123373.3,317.81,0.22,True,76.85,4.81,4.42,0.39,2025-12-03,308.25,7.87,0,,ATL,ATH,False,False
03-12-2025 15:00,MARBL,12.84,13.12,12.83,13.06,1217837.0,0.06,0.22,0.05,368.09,0.22,303739.8,300.95,0.27,True,82.06,0.07,0.04,0.04,2025-12-03,12.49,4.56,1,13.12,12.39,13.12,False,False
03-12-2025 14:00,SUWEN,9.68,9.87,9.66,9.85,437932.0,0.02,0.17,0.01,1114.29,0.17,239861.4,82.58,0.12,True,68.98,0.07,0.06,0.01,2025-12-03,9.66,1.97,0,,9.58,ATH,False,False
03-12-2025 12:00,ORCAY,3.87,3.93,3.86,3.92,892214.0,0.01,0.05,0.0,1150.0,0.05,314891.6,183.34,0.2,True,59.12,-0.0,-0.0,0.0,2025-12-03,3.85,1.82,0,,3.81,4.1,False,False
03-12-2025 11:00,BIENY,28.62,30.0,28.6,29.66,2898181.0,0.34,1.04,0.1,940.0,1.04,481101.6,502.41,0.33,True,70.84,0.12,0.12,0.0,2025-12-03,28.6,3.71,1,30.0,28.46,30.0,False,False
03-12-2025 10:00,VKFYO,22.1,23.92,21.12,23.9,313457.0,0.02,1.8,0.22,710.81,1.8,56787.1,451.99,0.01,True,67.24,0.11,-0.02,0.13,2025-12-03,22.1,8.14,2,21.12,21.12,ATH,False,False
03-12-2025 10:00,A1CAP,11.95,12.53,11.86,12.5,6993425.0,0.03,0.55,0.08,570.73,0.55,1512987.5,362.23,0.05,True,78.42,0.1,0.06,0.04,2025-12-03,11.92,4.87,0,,11.57,ATH,False,False
03-12-2025 10:00,INDES,7.31,7.38,7.31,7.36,579145.0,0.02,0.05,0.0,1566.67,0.05,276959.0,109.11,0.4,True,68.91,0.01,0.01,0.0,2025-12-03,7.29,0.96,0,,7.27,ATH,False,False
03-12-2025 10:00,MTRKS,25.26,25.68,25.12,25.66,163581.0,0.02,0.4,0.04,900.0,0.4,64611.7,153.18,0.05,True,72.63,0.11,0.09,0.02,2025-12-03,25.2,1.83,0,,25.0,ATH,False,False
02-12-2025 17:00,KRPLS,7.57,8.25,7.52,8.24,1406750.0,0.01,0.67,0.07,857.14,0.67,202612.7,594.3,0.01,True,86.89,0.06,0.02,0.04,2025-12-02,7.52,9.57,2,7.52,7.52,ATH,False,False
02-12-2025 15:00,TKNSA,23.92,24.42,23.88,24.36,762962.0,0.06,0.44,0.03,1194.12,0.44,207877.2,267.03,0.14,True,76.53,0.11,0.08,0.03,2025-12-02,23.76,2.53,0,,ATL,ATH,False,False
02-12-2025 14:00,AKSEN,57.85,59.5,57.1,59.45,4467066.0,0.05,1.6,0.5,220.0,1.6,1319134.3,238.64,0.03,True,85.8,0.97,0.6,0.36,2025-12-02,55.75,6.64,0,,51.3,ATH,False,False
02-12-2025 13:00,ALFAS,44.98,45.86,44.98,45.78,399921.0,0.08,0.8,0.16,393.83,0.8,209199.2,91.17,0.1,True,84.2,0.29,0.18,0.11,2025-12-02,44.22,3.53,0,,42.66,ATH,False,False
02-12-2025 13:00,PEKGY,10.36,10.56,10.34,10.54,76110185.0,0.02,0.18,0.01,1700.0,0.18,46996872.8,61.95,0.11,True,64.17,0.05,0.04,0.01,2025-12-02,10.2,3.33,0,,9.9,10.71,False,False
02-12-2025 13:00,ODINE,225.0,233.4,222.2,231.8,229787.0,1.6,6.8,1.46,365.75,6.8,75632.1,203.82,0.24,True,76.07,0.91,0.09,0.82,2025-12-02,219.9,5.41,0,,ATL,ATH,False,False
02-12-2025 12:00,NTGAZ,9.96,10.12,9.96,10.09,966954.0,0.03,0.13,0.02,420.0,0.13,397051.3,143.53,0.23,True,64.8,0.01,0.01,0.0,2025-12-02,10.06,0.3,0,,9.86,ATH,False,False
02-12-2025 11:00,ENTRA,10.42,10.64,10.42,10.59,2055506.0,0.05,0.17,0.02,672.73,0.17,960284.9,114.05,0.29,True,76.32,0.03,0.01,0.02,2025-12-02,10.3,2.82,1,10.64,ATL,10.64,False,False
02-12-2025 11:00,GEREL,21.34,22.66,21.3,22.3,2734196.0,0.36,0.96,0.15,548.65,0.96,954567.9,186.43,0.37,True,81.67,0.11,0.04,0.07,2025-12-02,21.26,4.89,0,,ATL,ATH,False,False
02-12-2025 10:00,KATMR,3.26,3.37,3.25,3.35,57705846.0,0.02,0.09,0.01,542.86,0.09,22211115.3,159.81,0.22,True,78.15,0.02,0.02,0.01,2025-12-02,3.25,3.08,0,,3.1,ATH,False,False
02-12-2025 10:00,HALKB,39.88,41.12,39.54,40.78,71665921.0,0.34,0.9,0.36,147.25,0.9,18370927.0,290.11,0.38,True,96.84,0.75,0.52,0.23,2025-12-02,39.18,4.08,0,,ATL,ATH,False,False
02-12-2025 10:00,ADESE,1.6,1.7,1.59,1.7,159061715.0,0.0,0.1,0.01,733.33,0.1,22252509.1,614.8,0.0,True,86.21,0.03,0.02,0.01,2025-12-02,1.55,9.68,1,1.7,1.38,ATH,False,False
02-12-2025 10:00,INFO,3.86,3.93,3.85,3.92,5197963.0,0.01,0.06,0.01,650.0,0.06,2306567.1,125.35,0.17,True,75.89,0.01,0.01,0.0,2025-12-02,3.87,1.29,1,3.93,ATL,3.93,False,False
02-12-2025 10:00,INVEO,9.48,9.56,9.36,9.55,3201442.0,0.01,0.07,0.01,1300.0,0.07,743503.2,330.59,0.14,True,70.92,0.03,0.01,0.02,2025-12-02,9.35,2.14,0,,9.17,ATH,False,False
02-12-2025 10:00,BIGEN,9.18,9.36,9.17,9.34,2726894.0,0.02,0.16,0.02,900.0,0.16,827856.6,229.39,0.12,True,63.07,0.01,-0.01,0.01,2025-12-02,9.16,1.97,1,9.36,9.04,9.36,False,False
02-12-2025 10:00,MHRGY,3.61,3.63,3.59,3.63,564014.0,0.0,0.02,0.0,400.0,0.02,278907.0,102.22,0.0,True,69.0,0.01,0.0,0.0,2025-12-02,3.6,0.83,0,,3.54,ATH,False,False
02-12-2025 10:00,SKBNK,8.17,8.26,8.15,8.24,6835974.0,0.02,0.07,0.01,438.46,0.07,3589266.2,90.46,0.29,True,83.8,0.02,0.02,0.0,2025-12-02,8.14,1.23,0,,ATL,ATH,False,False
02-12-2025 10:00,MAKTK,13.85,14.32,13.5,14.25,2853879.0,0.07,0.4,0.11,280.95,0.4,1283682.2,122.32,0.18,True,72.1,0.18,0.13,0.05,2025-12-02,13.9,2.52,0,,ATL,ATH,False,False
01-12-2025 17:00,PETKM,17.29,17.43,17.29,17.39,9570205.0,0.04,0.1,0.04,150.0,0.1,5793462.3,65.19,0.4,True,90.48,0.05,0.03,0.02,2025-12-01,17.0,2.29,0,,ATL,ATH,False,False
01-12-2025 17:00,ARCLK,107.4,109.0,107.4,108.9,688321.0,0.1,1.5,0.34,341.18,1.5,312570.8,120.21,0.07,True,73.39,0.26,0.1,0.15,2025-12-01,105.7,3.03,0,,105.2,ATH,False,False
01-12-2025 17:00,CEOEM,25.08,26.12,25.0,25.96,485555.0,0.16,0.88,0.12,609.68,0.88,134007.1,262.34,0.18,True,72.81,0.1,0.04,0.06,2025-12-01,24.48,6.05,0,,ATL,ATH,False,False
01-12-2025 14:00,VAKFN,2.01,2.1,2.01,2.1,90290093.0,0.0,0.09,0.01,1400.0,0.09,17148711.8,426.51,0.0,True,67.27,0.0,0.0,0.0,2025-12-01,2.0,5.0,0,,1.99,ATH,False,False
01-12-2025 14:00,TSKB,13.08,13.26,13.08,13.22,7879378.0,0.04,0.14,0.03,351.61,0.14,3631100.8,117.0,0.29,True,79.87,0.03,0.01,0.02,2025-12-01,12.86,2.8,0,,ATL,ATH,False,False
01-12-2025 12:00,AVOD,3.47,3.6,3.47,3.57,552031.0,0.03,0.1,0.0,3233.33,0.1,204876.7,169.45,0.3,True,63.18,0.0,-0.0,0.0,2025-12-01,3.48,2.59,0,,3.42,ATH,False,False
01-12-2025 12:00,EUPWR,28.76,30.08,28.76,29.86,3484186.0,0.22,1.1,0.15,643.24,1.1,888455.3,292.16,0.2,True,89.69,0.11,0.03,0.09,2025-12-01,28.02,6.57,0,,27.98,ATH,False,False
01-12-2025 12:00,ECOGR,21.94,22.58,21.76,22.58,5675937.0,0.0,0.64,0.04,1500.0,0.64,3675940.7,54.41,0.0,True,73.63,0.04,-0.0,0.04,2025-12-01,21.72,3.96,0,,ATL,ATH,False,False
01-12-2025 11:00,TTKOM,55.95,56.5,55.9,56.4,4733160.0,0.1,0.45,0.01,4400.0,0.45,2012810.1,135.15,0.22,True,63.24,0.01,-0.02,0.02,2025-12-01,55.75,1.17,0,,55.55,ATH,False,False
01-12-2025 11:00,GLRYH,4.26,4.37,4.26,4.34,1764681.0,0.03,0.08,0.01,433.33,0.08,554834.9,218.06,0.38,True,88.5,0.01,0.0,0.01,2025-12-01,4.18,3.83,1,4.37,ATL,4.37,False,False
01-12-2025 11:00,GARAN,139.4,140.8,139.3,140.5,6069669.0,0.3,1.1,0.15,633.33,1.1,3014798.6,101.33,0.27,True,72.01,0.12,0.03,0.08,2025-12-01,138.9,1.15,0,,137.3,ATH,False,False
