Tarih,Hisse,open,high,low,close,volume,YuksekKapanis_Fark,AcilisKapanis_Fark,AcilisKapanisFark_Ort,AcilisKapanisFark_OrtalamayaGoreDegisim,AcilisKapanisFarkOrt_MaxSon10,HacimOrtalama,%Hacim_HacimOrtalama,Fark_Orani,Kosul,rsi,MACD_12_26_9,MACDs_12_26_9,MACDh_12_26_9,Tarih1,prev_close,%Deg,isPivot,pointpos,destek,direnc,Tsinyal_Banker_Dip,Tsinyal_Banker_DipKarar
16-02-2026 16:00,TDGYO,28.32,30.0,28.3,30.0,1240327.0,0.0,1.68,0.22,677.78,1.68,249349.3,397.43,0.0,True,73.05,0.59,0.47,0.12,2026-02-16,27.28,9.97,0,,26.7,ATH,False,False
16-02-2026 16:00,PENTA,14.89,15.28,14.87,15.19,1633215.0,0.09,0.3,0.04,689.47,0.3,498477.6,227.64,0.3,True,74.64,0.12,0.09,0.03,2026-02-16,14.66,3.62,0,,14.59,ATH,False,False
16-02-2026 16:00,FRIGO,9.91,10.06,9.9,10.03,4819183.0,0.03,0.12,0.03,242.86,0.12,2474745.1,94.73,0.25,True,79.94,0.15,0.14,0.01,2026-02-16,9.7,3.4,0,,9.37,ATH,False,False
16-02-2026 16:00,PRDGS,7.39,7.64,7.37,7.59,3197846.0,0.05,0.2,0.01,1328.57,0.2,1052001.4,203.98,0.25,True,63.91,0.05,0.03,0.02,2026-02-16,7.35,3.27,0,,7.23,ATH,False,False
16-02-2026 16:00,ARMGD,85.8,87.45,85.75,87.45,111263.0,0.0,1.65,0.22,667.44,1.65,50374.4,120.87,0.0,True,63.31,0.16,0.06,0.1,2026-02-16,85.5,2.28,0,,83.9,87.9,False,False
16-02-2026 15:00,CWENE,32.7,33.06,32.7,33.0,11433368.0,0.06,0.3,0.06,435.71,0.3,5702396.7,100.5,0.2,True,66.21,0.08,0.01,0.07,2026-02-16,32.3,2.17,0,,31.88,33.4,False,False
16-02-2026 15:00,ZERGY,19.24,20.28,19.17,20.26,15095752.0,0.02,1.02,0.1,890.29,1.02,6058415.1,149.17,0.02,True,61.96,-0.18,-0.34,0.17,2026-02-16,18.6,8.92,0,,18.35,21.86,True,False
16-02-2026 15:00,KRONT,16.3,16.7,16.26,16.64,832665.0,0.06,0.34,0.03,1114.29,0.34,287813.3,189.31,0.18,True,66.04,0.09,0.08,0.01,2026-02-16,16.26,2.34,0,,16.04,ATH,False,False
16-02-2026 15:00,KARSN,10.81,10.9,10.8,10.9,3442256.0,0.0,0.09,0.03,246.15,0.09,1694685.0,103.12,0.0,True,74.12,0.12,0.1,0.02,2026-02-16,10.66,2.25,0,,10.12,ATH,False,False
16-02-2026 14:00,DESA,12.45,12.71,12.42,12.69,336932.0,0.02,0.24,0.05,433.33,0.24,160085.8,110.47,0.08,True,80.49,0.15,0.11,0.04,2026-02-16,12.26,3.51,0,,11.8,ATH,False,False
16-02-2026 14:00,IZENR,9.79,9.91,9.78,9.88,6754002.0,0.03,0.09,0.03,221.43,0.09,3618282.7,86.66,0.33,True,76.48,0.04,0.01,0.03,2026-02-16,9.6,2.92,0,,9.52,10.41,False,False
16-02-2026 14:00,KAYSE,5.15,5.5,5.13,5.4,38013789.0,0.1,0.25,0.03,681.25,0.25,5654415.1,572.29,0.4,True,70.71,0.0,-0.02,0.03,2026-02-16,5.04,7.14,0,,5.02,5.55,True,False
16-02-2026 14:00,OZYSR,53.45,54.2,53.25,54.1,380529.0,0.1,0.65,0.06,983.33,0.65,138110.6,175.52,0.15,True,59.16,0.4,0.52,-0.12,2026-02-16,53.8,0.56,0,,47.78,54.5,False,False
16-02-2026 14:00,VAKFN,2.18,2.25,2.18,2.24,111181867.0,0.01,0.06,0.01,500.0,0.06,18258584.8,508.93,0.17,True,86.88,0.03,0.02,0.01,2026-02-16,2.13,5.16,0,,2.05,ATH,False,False
16-02-2026 14:00,ISFIN,21.24,21.48,21.2,21.42,487890.0,0.06,0.18,0.03,542.86,0.18,267646.3,82.29,0.33,True,76.41,0.21,0.2,0.01,2026-02-16,21.06,1.71,0,,19.99,ATH,False,False
16-02-2026 14:00,BSOKE,30.08,30.96,29.96,30.74,2021526.0,0.22,0.66,0.07,900.0,0.66,849942.4,137.84,0.33,True,67.08,0.12,0.07,0.04,2026-02-16,29.8,3.15,0,,29.66,ATH,False,False
16-02-2026 14:00,GZNMI,64.3,67.9,62.35,67.6,6833156.0,0.3,3.3,0.0,65900.0,3.3,934336.6,631.34,0.09,True,68.76,3.3,3.11,0.19,2026-02-16,61.75,9.47,0,,50.85,ATH,False,False
16-02-2026 13:00,SMART,32.0,33.9,31.82,33.78,2512488.0,0.12,1.78,0.19,817.53,1.78,1279924.0,96.3,0.07,True,89.9,1.4,1.45,-0.05,2026-02-16,31.76,6.36,0,,22.5,ATH,False,False
16-02-2026 13:00,CEOEM,23.3,23.76,23.28,23.66,301033.0,0.1,0.36,0.07,414.29,0.36,169783.5,77.3,0.28,True,68.59,0.18,0.14,0.04,2026-02-16,23.06,2.6,0,,22.8,ATH,False,False
16-02-2026 13:00,MARMR,2.92,3.02,2.9,3.02,96569052.0,0.0,0.1,0.0,9900.0,0.1,29922424.0,222.73,0.0,True,59.87,-0.0,0.0,-0.0,2026-02-16,2.91,3.78,0,,2.75,3.14,False,False
16-02-2026 13:00,TCKRC,89.1,90.6,88.95,90.4,293008.0,0.2,1.3,0.17,664.71,1.3,192421.9,52.27,0.15,True,67.16,-0.01,-0.26,0.26,2026-02-16,87.85,2.9,0,,87.15,90.6,False,False
16-02-2026 13:00,GUNDG,261.25,294.5,259.0,294.5,565269.0,0.0,33.25,3.52,843.26,33.25,114058.8,395.59,0.0,True,71.09,4.22,3.14,1.09,2026-02-16,267.75,9.99,0,,257.75,ATH,False,False
16-02-2026 13:00,VSNMD,93.25,95.0,93.0,94.8,693465.0,0.2,1.55,0.23,559.57,1.55,246324.8,181.52,0.13,True,65.89,-0.08,-0.37,0.29,2026-02-16,91.9,3.16,0,,91.35,97.9,True,False
16-02-2026 12:00,TRMET,141.1,142.7,141.0,142.4,1208535.0,0.3,1.3,0.27,381.48,1.3,512674.4,135.73,0.23,True,64.91,1.2,1.08,0.11,2026-02-16,140.1,1.64,0,,135.1,ATH,False,False
16-02-2026 12:00,EGPRO,28.14,28.62,28.0,28.52,262944.0,0.1,0.38,0.05,630.77,0.38,115199.5,128.25,0.26,True,77.56,0.43,0.38,0.04,2026-02-16,27.74,2.81,0,,25.72,ATH,False,False
16-02-2026 12:00,ECOGR,25.2,25.74,25.16,25.74,2040762.0,0.0,0.54,0.06,800.0,0.54,1133374.9,80.06,0.0,True,67.71,0.15,0.1,0.05,2026-02-16,25.24,1.98,0,,24.28,26.38,False,False
16-02-2026 12:00,SANFM,7.4,7.51,7.37,7.49,2665006.0,0.02,0.09,0.0,2900.0,0.09,1210385.6,120.18,0.22,True,62.75,0.02,-0.0,0.02,2026-02-16,7.22,3.74,0,,7.19,7.64,False,False
16-02-2026 12:00,TAVHL,363.0,367.25,362.25,366.5,589792.0,0.75,3.5,0.35,900.0,3.5,287999.0,104.79,0.21,True,61.16,1.72,1.25,0.47,2026-02-16,361.5,1.38,0,,350.25,368.25,False,False
16-02-2026 12:00,ADESE,1.28,1.32,1.26,1.32,459275946.0,0.0,0.04,0.01,400.0,0.04,85864371.2,434.89,0.0,True,82.07,0.02,0.01,0.01,2026-02-16,1.2,10.0,0,,1.2,ATH,False,False
16-02-2026 12:00,AKYHO,2.95,2.97,2.91,2.97,663111.0,0.0,0.02,0.0,900.0,0.02,257485.2,157.53,0.0,True,62.23,0.01,0.0,0.0,2026-02-16,2.93,1.37,0,,2.89,2.98,False,False
16-02-2026 11:00,OSMEN,8.84,9.03,8.8,9.02,992390.0,0.01,0.18,0.04,400.0,0.18,299189.8,231.69,0.06,True,79.21,0.09,0.07,0.02,2026-02-16,8.67,4.04,0,,8.11,ATH,False,False
16-02-2026 11:00,GLRYH,4.61,4.69,4.61,4.68,3809507.0,0.01,0.07,0.01,366.67,0.07,1253420.9,203.93,0.14,True,63.12,0.01,-0.0,0.01,2026-02-16,4.55,2.86,0,,4.53,4.72,False,False
16-02-2026 11:00,BLUME,46.22,46.78,46.16,46.7,436532.0,0.08,0.48,0.05,823.08,0.48,229685.8,90.06,0.17,True,57.32,-0.06,-0.1,0.04,2026-02-16,45.92,1.7,0,,45.86,46.82,True,True
16-02-2026 11:00,ERCB,64.15,65.25,64.15,65.05,590259.0,0.2,0.9,0.21,318.6,0.9,262093.6,125.21,0.22,True,75.53,0.41,0.18,0.23,2026-02-16,63.35,2.68,0,,61.9,77.8,False,False
16-02-2026 11:00,EUREN,5.62,5.7,5.61,5.7,11358500.0,0.0,0.08,0.02,280.95,0.08,5770426.7,96.84,0.0,True,81.55,0.05,0.04,0.01,2026-02-16,5.55,2.7,0,,5.44,ATH,False,False
16-02-2026 11:00,OTKAR,426.5,433.5,424.5,432.5,1188367.0,1.0,6.0,0.55,990.91,6.0,425199.3,179.48,0.17,True,31.6,-2.0,2.48,-4.48,2026-02-16,469.0,-7.78,0,,430.0,470.75,False,False
16-02-2026 11:00,BORSK,6.71,6.85,6.69,6.84,3162038.0,0.01,0.13,0.03,364.29,0.13,1660342.3,90.44,0.08,True,77.49,0.08,0.05,0.02,2026-02-16,6.61,3.48,0,,6.33,ATH,False,False
16-02-2026 11:00,MOGAN,9.24,9.76,9.23,9.74,12508520.0,0.02,0.5,0.06,762.07,0.5,1875482.3,566.95,0.04,True,88.0,0.07,0.03,0.04,2026-02-16,9.16,6.33,0,,9.11,9.76,False,False
16-02-2026 11:00,INDES,8.69,8.89,8.68,8.84,2187966.0,0.05,0.15,0.02,689.47,0.15,1108773.1,97.33,0.33,True,83.53,0.09,0.05,0.04,2026-02-16,8.6,2.79,0,,8.22,ATH,False,False
16-02-2026 11:00,ENTRA,12.08,12.55,12.07,12.49,10330120.0,0.06,0.41,0.04,925.0,0.41,3140716.6,228.91,0.15,True,75.39,0.12,0.09,0.03,2026-02-16,11.99,4.17,0,,11.67,ATH,False,False
16-02-2026 11:00,DOFER,32.38,33.0,32.38,32.98,521158.0,0.02,0.6,0.1,476.92,0.6,191924.3,171.54,0.03,True,75.99,0.07,-0.07,0.14,2026-02-16,31.76,3.84,0,,31.56,33.4,False,False
16-02-2026 11:00,CGCAM,38.88,39.64,38.82,39.46,1164389.0,0.18,0.58,0.08,663.16,0.58,294398.2,295.51,0.31,True,69.48,0.05,-0.02,0.07,2026-02-16,38.28,3.08,0,,38.2,40.16,False,False
16-02-2026 11:00,KLMSN,31.92,32.16,31.92,32.12,199968.0,0.04,0.2,0.01,2400.0,0.2,117997.8,69.47,0.2,True,64.87,0.27,0.3,-0.03,2026-02-16,31.64,1.52,0,,31.4,33.48,False,False
16-02-2026 11:00,EGEGY,33.8,34.62,33.8,34.46,635547.0,0.16,0.66,0.09,602.13,0.66,238951.9,165.97,0.24,True,72.22,0.26,0.16,0.09,2026-02-16,33.2,3.8,0,,32.78,ATH,False,False
16-02-2026 11:00,HTTBT,46.2,46.88,46.18,46.88,284488.0,0.0,0.68,0.1,566.67,0.68,116776.1,143.62,0.0,True,70.72,0.39,0.33,0.05,2026-02-16,45.88,2.18,0,,44.1,47.44,False,False
16-02-2026 11:00,DURDO,3.9,3.94,3.89,3.94,1269384.0,0.0,0.04,0.0,900.0,0.04,841566.5,50.84,0.0,True,57.21,0.0,0.01,-0.01,2026-02-16,3.87,1.81,0,,3.86,4.18,False,False
16-02-2026 11:00,IHEVA,2.39,2.43,2.39,2.42,1046130.0,0.01,0.03,0.01,400.0,0.03,329213.1,217.77,0.33,True,69.7,0.01,0.0,0.01,2026-02-16,2.34,3.42,0,,2.34,ATH,False,False
16-02-2026 11:00,PAHOL,1.69,1.73,1.69,1.73,133766827.0,0.0,0.04,0.0,900.0,0.04,70638603.7,89.37,0.0,True,62.34,0.0,0.0,0.0,2026-02-16,1.68,2.98,0,,1.68,1.84,False,False
16-02-2026 11:00,A1CAP,16.64,17.02,16.63,16.96,2261430.0,0.06,0.32,0.04,788.89,0.32,1283405.8,76.21,0.19,True,58.44,0.02,0.02,-0.0,2026-02-16,16.5,2.79,0,,16.4,17.39,False,False
16-02-2026 11:00,MEKAG,5.08,5.22,5.07,5.19,5901442.0,0.03,0.11,0.01,1275.0,0.11,1780097.9,231.52,0.27,True,65.16,0.02,0.02,0.0,2026-02-16,5.06,2.57,0,,4.83,5.21,False,False
16-02-2026 11:00,AYEN,29.8,30.72,29.8,30.68,675562.0,0.04,0.88,0.08,1028.21,0.88,238621.8,183.11,0.05,True,80.37,0.3,0.24,0.06,2026-02-16,29.44,4.21,0,,28.54,ATH,False,False
16-02-2026 11:00,PRKME,21.16,21.4,21.16,21.38,503846.0,0.02,0.22,0.04,511.11,0.22,236107.8,113.4,0.09,True,63.49,0.01,-0.03,0.03,2026-02-16,20.96,2.0,0,,20.8,21.48,False,False
16-02-2026 11:00,PNLSN,43.56,44.0,43.5,43.96,129228.0,0.04,0.4,0.06,566.67,0.4,85070.7,51.91,0.1,True,68.58,0.1,0.0,0.1,2026-02-16,43.04,2.14,0,,42.7,47.54,False,False
16-02-2026 11:00,ARENA,28.7,29.04,28.64,29.04,429464.0,0.0,0.34,0.08,304.76,0.34,155509.3,176.17,0.0,True,75.22,0.13,0.06,0.07,2026-02-16,28.36,2.4,0,,27.7,30.56,False,False
16-02-2026 11:00,TSPOR,1.1,1.13,1.1,1.13,73318975.0,0.0,0.03,0.0,1400.0,0.03,29453382.8,148.93,0.0,True,63.7,0.01,0.01,-0.0,2026-02-16,1.11,1.8,0,,1.07,ATH,False,False
16-02-2026 10:00,BAGFS,30.06,30.46,30.06,30.4,458083.0,0.06,0.34,0.02,1316.67,0.34,117690.7,289.23,0.18,True,60.25,-0.02,-0.06,0.04,2026-02-16,29.96,1.47,0,,29.6,30.68,False,False
16-02-2026 10:00,TOASO,344.25,349.5,340.0,348.5,1390650.0,1.0,4.25,0.88,385.71,4.25,463044.9,200.33,0.24,True,82.16,6.16,4.78,1.37,2026-02-16,338.5,2.95,0,,307.25,ATH,False,False
16-02-2026 10:00,TUKAS,2.95,2.99,2.95,2.98,40748898.0,0.01,0.03,0.0,900.0,0.03,19042433.8,113.99,0.33,True,72.46,0.02,0.01,0.01,2026-02-16,2.92,2.05,0,,2.83,3.02,False,False
16-02-2026 10:00,TTKOM,70.85,74.5,70.7,74.45,13403658.0,0.05,3.6,0.45,700.0,3.6,3144253.6,326.29,0.01,True,84.26,0.95,0.61,0.33,2026-02-16,70.3,5.9,0,,65.95,ATH,False,False
16-02-2026 10:00,HURGZ,5.57,5.68,5.56,5.65,2347746.0,0.03,0.08,0.01,1233.33,0.08,467651.9,402.03,0.37,True,63.0,-0.0,-0.01,0.0,2026-02-16,5.56,1.62,0,,5.53,5.66,False,False
16-02-2026 10:00,IEYHO,78.5,79.45,78.5,79.2,3001581.0,0.25,0.7,0.06,1066.67,0.7,638035.7,370.44,0.36,True,66.25,0.13,0.13,0.0,2026-02-16,78.5,0.89,0,,78.45,79.7,False,False
16-02-2026 10:00,DURKN,22.48,23.9,22.36,23.76,7172293.0,0.14,1.28,0.19,566.67,1.28,1804830.8,297.39,0.11,True,86.94,0.83,0.61,0.21,2026-02-16,21.92,8.39,0,,19.05,ATH,False,False
16-02-2026 10:00,DSTKF,941.5,970.5,941.5,964.0,185703.0,6.5,22.5,1.7,1223.53,22.5,67422.2,175.43,0.29,True,81.72,18.6,18.09,0.51,2026-02-16,940.0,2.55,0,,925.0,ATH,False,False
16-02-2026 10:00,ALARK,114.8,116.3,114.8,116.0,2660729.0,0.3,1.2,0.05,2300.0,1.2,771267.0,244.98,0.25,True,69.79,0.63,0.47,0.15,2026-02-16,113.8,1.93,0,,112.8,ATH,False,False
16-02-2026 10:00,EDIP,38.78,42.0,38.74,41.78,1544894.0,0.22,3.0,0.28,963.83,3.0,223395.9,591.55,0.07,True,83.31,0.35,0.16,0.19,2026-02-16,38.32,9.03,0,,38.26,ATH,False,False
16-02-2026 10:00,DOAS,237.1,242.6,237.1,242.3,1025782.0,0.3,5.2,0.26,1900.0,5.2,272451.7,276.5,0.06,True,66.87,0.6,0.54,0.07,2026-02-16,236.8,2.32,0,,234.9,242.4,False,False
16-02-2026 10:00,TKNSA,25.0,25.56,25.0,25.44,1231971.0,0.12,0.44,0.01,5400.0,0.44,353506.1,248.5,0.27,True,66.48,0.08,0.07,0.0,2026-02-16,24.92,2.09,0,,24.68,ATH,False,False
16-02-2026 10:00,INVEO,9.8,10.22,9.8,10.11,4897517.0,0.11,0.31,0.02,1622.22,0.31,1251447.8,291.35,0.35,True,66.71,0.05,0.05,-0.0,2026-02-16,9.72,4.01,0,,9.71,10.25,False,False
16-02-2026 10:00,A1YEN,31.72,32.16,31.72,32.1,516681.0,0.06,0.38,0.02,2011.11,0.38,191208.2,170.22,0.16,True,66.28,0.1,0.08,0.02,2026-02-16,31.64,1.45,0,,31.14,32.28,False,False
16-02-2026 10:00,TKFEN,83.0,85.0,82.95,84.85,2418826.0,0.15,1.85,0.02,7300.0,1.85,786462.3,207.56,0.08,True,56.85,-0.23,-0.18,-0.06,2026-02-16,82.55,2.79,0,,81.9,87.0,False,False
16-02-2026 10:00,DGNMO,5.32,5.38,5.27,5.37,985365.0,0.01,0.05,0.0,1566.67,0.05,208708.8,372.12,0.2,True,78.61,0.03,0.02,0.01,2026-02-16,5.24,2.48,0,,5.04,ATH,False,False
16-02-2026 10:00,ISSEN,7.93,8.04,7.9,8.02,517688.0,0.02,0.09,0.01,800.0,0.09,170022.5,204.48,0.22,True,81.73,0.05,0.03,0.02,2026-02-16,7.8,2.82,0,,7.68,ATH,False,False
16-02-2026 10:00,TCELL,126.0,129.6,125.3,129.0,15653202.0,0.6,3.0,0.35,757.14,3.0,3511744.0,345.74,0.2,True,82.43,1.65,1.54,0.11,2026-02-16,125.3,2.95,0,,116.3,ATH,False,False
16-02-2026 10:00,HOROZ,66.75,69.65,66.75,69.35,1509589.0,0.3,2.6,0.4,550.0,2.6,349782.7,331.58,0.12,True,77.1,0.7,0.3,0.4,2026-02-16,65.75,5.48,0,,63.0,ATH,False,False
16-02-2026 10:00,ULUFA,4.24,4.37,4.23,4.36,6630257.0,0.01,0.12,0.01,823.08,0.12,1430233.0,363.58,0.08,True,74.83,0.03,0.02,0.01,2026-02-16,4.24,2.83,0,,4.16,ATH,False,False
16-02-2026 10:00,HEKTS,3.43,3.5,3.43,3.49,48706134.0,0.01,0.06,0.0,1400.0,0.06,19067986.9,155.43,0.17,True,62.06,0.02,0.02,-0.0,2026-02-16,3.4,2.65,0,,3.37,3.56,False,False
16-02-2026 10:00,TABGD,271.5,276.0,271.0,275.0,152853.0,1.0,3.5,0.6,483.33,3.5,82246.2,85.85,0.29,True,79.79,2.71,2.28,0.43,2026-02-16,271.25,1.38,0,,258.75,281.5,False,False
16-02-2026 10:00,FLAP,11.1,12.0,11.07,11.9,2458587.0,0.1,0.8,0.17,373.37,0.8,656797.8,274.33,0.12,True,82.3,0.46,0.34,0.11,2026-02-16,11.07,7.5,0,,9.01,ATH,False,False
16-02-2026 10:00,FORTE,95.9,97.15,95.6,97.1,607865.0,0.05,1.2,0.31,280.95,1.2,368477.5,64.97,0.04,True,77.51,1.41,1.07,0.34,2026-02-16,94.4,2.86,0,,89.7,ATH,False,False
16-02-2026 10:00,YYLGD,14.09,14.4,14.08,14.38,3018446.0,0.02,0.29,0.02,1605.88,0.29,1276425.8,136.48,0.07,True,66.22,0.06,0.06,0.0,2026-02-16,14.08,2.13,0,,14.0,ATH,False,False
16-02-2026 10:00,GEDIK,6.35,6.49,6.3,6.48,6710849.0,0.01,0.13,0.0,3150.0,0.13,1259294.5,432.91,0.08,True,65.99,0.03,0.02,0.01,2026-02-16,6.24,3.85,0,,6.22,ATH,False,False
16-02-2026 10:00,GLCVY,75.5,77.3,75.5,77.2,272851.0,0.1,1.7,0.1,1600.0,1.7,121783.2,124.05,0.06,True,66.81,0.21,0.11,0.1,2026-02-16,75.25,2.59,0,,74.7,77.95,False,False
16-02-2026 10:00,YUNSA,10.12,10.26,10.02,10.24,2805289.0,0.02,0.12,0.0,3900.0,0.12,779116.1,260.06,0.17,True,52.79,-0.01,0.02,-0.03,2026-02-16,10.08,1.59,0,,9.08,10.51,False,False
16-02-2026 10:00,YIGIT,26.2,26.82,26.14,26.68,1997953.0,0.14,0.48,0.05,900.0,0.48,433177.6,361.23,0.29,True,78.52,0.15,0.11,0.04,2026-02-16,26.06,2.38,0,,25.74,ATH,False,False
16-02-2026 10:00,YATAS,46.4,47.7,46.38,47.44,267089.0,0.26,1.04,0.06,1633.33,1.04,92372.4,189.14,0.25,True,65.96,0.15,0.14,0.01,2026-02-16,46.58,1.85,0,,46.36,ATH,False,False
16-02-2026 10:00,GOKNR,22.36,22.64,22.36,22.62,1203819.0,0.02,0.26,0.0,6400.0,0.26,471338.8,155.4,0.08,True,69.54,0.08,0.07,0.01,2026-02-16,22.24,1.71,0,,22.1,22.72,False,False
16-02-2026 10:00,GOODY,16.1,16.29,16.07,16.29,385216.0,0.0,0.19,0.01,1800.0,0.19,142108.2,171.07,0.0,True,69.2,0.03,0.02,0.01,2026-02-16,16.05,1.5,0,,15.36,ATH,False,False
16-02-2026 10:00,GSDDE,10.21,10.36,10.21,10.35,385246.0,0.01,0.14,0.01,1172.73,0.14,149159.1,158.28,0.07,True,62.0,0.02,0.02,-0.0,2026-02-16,10.21,1.37,0,,10.18,10.42,False,False
16-02-2026 10:00,GSDHO,5.27,5.36,5.27,5.35,2920807.0,0.01,0.08,0.01,627.27,0.08,1117543.4,161.36,0.13,True,72.83,0.04,0.04,0.0,2026-02-16,5.25,1.9,0,,5.18,ATH,False,False
16-02-2026 10:00,VESTL,32.88,33.44,32.88,33.3,1347436.0,0.14,0.42,0.0,20900.0,0.42,455403.0,195.88,0.33,True,73.82,0.21,0.18,0.04,2026-02-16,32.5,2.46,0,,32.3,33.54,False,False
16-02-2026 10:00,VESBE,8.67,8.79,8.65,8.78,3072805.0,0.01,0.11,0.01,1000.0,0.11,1119089.5,174.58,0.09,True,71.26,0.05,0.04,0.01,2026-02-16,8.59,2.21,0,,8.5,ATH,False,False
16-02-2026 10:00,HATEK,15.64,16.79,15.64,16.68,3508847.0,0.11,1.04,0.1,961.22,1.04,445030.4,688.45,0.11,True,78.59,0.1,0.06,0.04,2026-02-16,15.55,7.27,0,,15.55,ATH,False,False
16-02-2026 10:00,EGSER,3.31,3.35,3.3,3.34,923291.0,0.01,0.03,0.0,900.0,0.03,505322.9,82.71,0.33,True,67.28,0.01,0.01,0.0,2026-02-16,3.3,1.21,0,,3.26,ATH,False,False
16-02-2026 10:00,USAK,1.88,1.92,1.87,1.91,45060209.0,0.01,0.03,0.0,650.0,0.03,26804874.2,68.1,0.33,True,73.97,0.02,0.01,0.0,2026-02-16,1.86,2.69,0,,1.78,ATH,False,False
16-02-2026 10:00,DENGE,3.07,3.18,3.03,3.15,15438603.0,0.03,0.08,0.0,1900.0,0.08,5568831.0,177.23,0.38,True,74.13,0.07,0.06,0.01,2026-02-16,3.06,2.94,0,,2.76,3.16,False,False
16-02-2026 10:00,IZMDC,8.19,8.38,8.18,8.33,1503199.0,0.05,0.14,0.0,4566.67,0.14,768505.2,95.6,0.36,True,70.26,0.1,0.11,-0.0,2026-02-16,8.17,1.96,0,,8.09,8.48,False,False
16-02-2026 10:00,PAPIL,19.15,19.46,19.03,19.43,5233690.0,0.03,0.28,0.04,551.16,0.28,1866249.5,180.44,0.11,True,77.08,0.24,0.19,0.05,2026-02-16,19.13,1.57,0,,18.06,ATH,False,False
16-02-2026 10:00,BOSSA,7.13,7.3,7.13,7.3,601246.0,0.0,0.17,0.01,1445.45,0.17,260550.7,130.76,0.0,True,62.8,0.0,0.01,-0.01,2026-02-16,7.11,2.67,0,,7.1,7.33,False,False
16-02-2026 10:00,BORLS,2.77,2.99,2.76,2.96,30799975.0,0.03,0.19,0.02,955.56,0.19,6468288.0,376.17,0.16,True,78.7,0.03,0.01,0.01,2026-02-16,2.75,7.64,0,,2.67,ATH,False,False
16-02-2026 10:00,MARTI,2.95,2.99,2.94,2.99,3899387.0,0.0,0.04,0.0,900.0,0.04,1715369.0,127.32,0.0,True,60.35,0.01,0.01,-0.0,2026-02-16,2.93,2.05,0,,2.93,3.05,False,False
16-02-2026 10:00,MERIT,18.5,18.81,18.41,18.77,1847035.0,0.04,0.27,0.05,400.0,0.27,606884.9,204.35,0.15,True,74.5,0.2,0.14,0.06,2026-02-16,18.45,1.73,0,,17.62,ATH,False,False
16-02-2026 10:00,BLCYT,35.88,37.3,35.4,37.16,1778802.0,0.14,1.28,0.13,900.0,1.28,214939.8,727.58,0.11,True,24.0,-2.58,-2.19,-0.39,2026-02-16,39.3,-5.45,0,,ATL,39.3,False,False
16-02-2026 10:00,MERKO,16.73,17.42,16.55,17.26,4694535.0,0.16,0.53,0.05,960.0,0.53,1112757.9,321.88,0.3,True,66.28,-0.02,-0.03,0.02,2026-02-16,16.71,3.29,0,,16.7,17.74,True,True
16-02-2026 10:00,METRO,5.85,6.02,5.85,6.0,3045556.0,0.02,0.15,0.02,689.47,0.15,1012121.2,200.91,0.13,True,65.1,0.03,0.03,-0.0,2026-02-16,5.81,3.27,0,,5.78,6.08,False,False
16-02-2026 10:00,MNDRS,15.56,15.79,15.56,15.75,478383.0,0.04,0.19,0.02,900.0,0.19,267225.6,79.02,0.21,True,67.96,0.09,0.09,-0.0,2026-02-16,15.54,1.35,0,,15.42,ATH,False,False
16-02-2026 10:00,MNDTR,6.92,7.06,6.91,7.03,766879.0,0.03,0.11,0.01,1275.0,0.11,281626.1,172.3,0.27,True,74.18,0.04,0.02,0.01,2026-02-16,6.85,2.63,0,,6.8,7.39,False,False
16-02-2026 10:00,PGSUS,220.3,226.1,219.9,224.8,19608865.0,1.3,4.5,0.35,1185.71,4.5,4835163.1,305.55,0.29,True,78.07,2.66,2.4,0.27,2026-02-16,218.1,3.07,0,,216.7,ATH,False,False
16-02-2026 10:00,MTRKS,23.14,23.66,23.12,23.54,361099.0,0.12,0.4,0.04,809.09,0.4,111886.6,222.74,0.3,True,71.24,0.09,0.04,0.05,2026-02-16,22.94,2.62,0,,22.48,24.32,False,False
16-02-2026 10:00,NATEN,8.52,8.62,8.52,8.61,2839723.0,0.01,0.09,0.01,1400.0,0.09,798540.2,255.61,0.11,True,67.64,0.02,0.02,0.0,2026-02-16,8.48,1.53,0,,8.45,8.83,False,False
16-02-2026 10:00,NTGAZ,11.94,12.41,11.94,12.34,2460665.0,0.07,0.4,0.06,601.75,0.4,797927.3,208.38,0.18,True,74.49,0.14,0.11,0.03,2026-02-16,11.94,3.35,0,,11.07,ATH,False,False
16-02-2026 10:00,OBAMS,8.75,9.04,8.73,9.02,30873884.0,0.02,0.27,0.08,246.15,0.27,16944399.0,82.21,0.07,True,80.4,0.24,0.17,0.06,2026-02-16,8.68,3.92,0,,7.64,ATH,False,False
16-02-2026 10:00,AVHOL,40.66,41.3,40.54,41.24,521252.0,0.06,0.58,0.05,974.07,0.58,122839.7,324.34,0.1,True,73.71,0.23,0.18,0.05,2026-02-16,40.36,2.18,0,,39.74,ATH,False,False
16-02-2026 10:00,AYDEM,26.24,26.66,26.24,26.66,517502.0,0.0,0.42,0.06,556.25,0.42,283002.6,82.86,0.0,True,76.4,0.23,0.14,0.09,2026-02-16,26.2,1.76,0,,24.44,27.62,False,False
16-02-2026 10:00,OZRDN,21.26,22.94,20.84,22.82,797447.0,0.12,1.56,0.37,323.91,1.56,286633.3,178.21,0.08,True,75.66,0.56,0.21,0.34,2026-02-16,20.86,9.4,0,,18.21,ATH,False,False
16-02-2026 10:00,AZTEK,4.82,4.89,4.81,4.87,2488982.0,0.02,0.05,0.0,1566.67,0.05,764050.7,225.76,0.4,True,62.32,0.01,0.01,0.0,2026-02-16,4.8,1.46,0,,4.72,4.88,False,False
16-02-2026 10:00,SRVGY,3.51,3.64,3.51,3.62,43604625.0,0.02,0.11,0.01,900.0,0.11,7897007.6,452.17,0.18,True,79.05,0.02,0.01,0.01,2026-02-16,3.48,4.02,0,,3.45,ATH,False,False
16-02-2026 10:00,RYSAS,19.01,19.28,19.01,19.28,1152262.0,0.0,0.27,0.01,1976.92,0.27,373404.5,208.58,0.0,True,61.08,-0.01,-0.04,0.04,2026-02-16,18.92,1.9,0,,18.78,20.38,False,False
16-02-2026 10:00,BRLSM,15.81,16.81,15.8,16.78,4192512.0,0.03,0.97,0.12,736.21,0.97,685427.9,511.66,0.03,True,82.19,0.13,0.05,0.08,2026-02-16,15.7,6.88,0,,15.34,ATH,False,False
16-02-2026 10:00,SELVA,2.46,2.52,2.45,2.51,17393095.0,0.01,0.05,0.01,455.56,0.05,7143906.9,143.47,0.2,True,52.18,-0.02,-0.03,0.0,2026-02-16,2.45,2.45,0,,2.42,2.64,True,True
16-02-2026 10:00,SOKE,13.16,13.32,13.16,13.3,397215.0,0.02,0.14,0.01,1455.56,0.14,126495.4,214.02,0.14,True,59.95,0.01,0.0,0.01,2026-02-16,13.16,1.06,0,,13.1,13.33,False,False
16-02-2026 10:00,SMRVA,64.3,66.0,64.3,65.95,1038816.0,0.05,1.65,0.03,5400.0,1.65,288173.4,260.48,0.03,True,61.62,-0.12,-0.28,0.16,2026-02-16,64.2,2.73,0,,63.7,66.35,False,False
16-02-2026 10:00,SKYMD,12.44,12.66,12.44,12.63,882999.0,0.03,0.19,0.02,900.0,0.19,545211.4,61.96,0.16,True,73.37,0.05,0.04,0.01,2026-02-16,12.4,1.85,0,,12.27,13.08,False,False
16-02-2026 10:00,KLRHO,431.75,455.75,415.25,454.75,905797.0,1.0,23.0,1.65,1293.94,23.0,596233.9,51.92,0.04,True,44.43,-22.45,-26.96,4.51,2026-02-16,432.0,5.27,0,,ATL,613.5,True,True
16-02-2026 10:00,KNFRT,12.82,13.01,12.82,13.0,1197906.0,0.01,0.18,0.0,8900.0,0.18,389545.6,207.51,0.06,True,57.46,0.01,0.01,-0.01,2026-02-16,12.81,1.48,0,,12.75,13.25,False,False
16-02-2026 10:00,SERNT,8.7,8.95,8.7,8.94,2157819.0,0.01,0.24,0.0,4700.0,0.24,832316.6,159.25,0.04,True,65.62,0.05,0.06,-0.01,2026-02-16,8.68,3.0,0,,8.63,8.99,False,False
16-02-2026 10:00,KOTON,17.01,17.35,17.01,17.34,908361.0,0.01,0.33,0.04,685.71,0.33,331462.1,174.05,0.03,True,71.51,0.04,-0.01,0.05,2026-02-16,17.0,2.0,0,,16.75,18.24,False,False
16-02-2026 10:00,CATES,42.28,43.18,41.78,43.16,427833.0,0.02,0.88,0.14,511.11,0.88,125668.7,240.45,0.02,True,77.62,0.24,0.02,0.22,2026-02-16,41.48,4.05,0,,40.6,ATH,False,False
16-02-2026 10:00,LILAK,33.4,33.82,33.2,33.8,2094862.0,0.02,0.4,0.07,471.43,0.4,1090790.8,92.05,0.05,True,72.03,0.25,0.09,0.16,2026-02-16,33.12,2.05,0,,31.04,34.4,False,False
16-02-2026 10:00,LKMNH,17.78,18.12,17.76,18.08,710581.0,0.04,0.3,0.06,368.75,0.3,258119.5,175.29,0.13,True,77.75,0.14,0.08,0.06,2026-02-16,17.71,2.09,0,,16.98,ATH,False,False
16-02-2026 10:00,BULGS,47.22,48.7,47.22,48.38,3486271.0,0.32,1.16,0.1,1060.0,1.16,921136.8,278.47,0.28,True,68.36,0.18,0.11,0.07,2026-02-16,47.06,2.8,0,,47.0,ATH,False,False
16-02-2026 10:00,LRSHO,4.16,4.22,4.15,4.21,6159815.0,0.01,0.05,0.01,614.29,0.05,1830809.3,236.45,0.2,True,64.01,0.01,0.0,0.01,2026-02-16,4.15,1.45,0,,4.1,4.27,False,False
16-02-2026 10:00,MARBL,13.83,13.97,13.71,13.97,791009.0,0.0,0.14,0.01,1455.56,0.14,309529.3,155.55,0.0,True,73.71,0.05,0.02,0.03,2026-02-16,13.65,2.34,0,,13.33,14.02,False,False
16-02-2026 10:00,ARTMS,40.18,41.2,40.0,41.12,541374.0,0.08,0.94,0.08,1105.13,0.94,160686.5,236.91,0.09,True,63.84,0.03,-0.04,0.07,2026-02-16,39.9,3.06,0,,39.48,43.34,True,True
16-02-2026 10:00,SEKUR,5.05,5.23,4.88,5.21,578276.0,0.02,0.16,0.01,1042.86,0.16,208910.0,176.81,0.13,True,58.11,0.04,0.04,-0.0,2026-02-16,5.0,4.2,0,,4.8,5.33,False,False
16-02-2026 10:00,FADE,16.77,18.0,16.75,17.65,2497133.0,0.35,0.88,0.14,524.11,0.88,463808.6,438.4,0.4,True,84.22,0.26,0.16,0.1,2026-02-16,16.65,6.01,0,,15.82,ATH,False,False
13-02-2026 17:00,HEDEF,79.35,85.05,79.25,83.5,4671122.0,1.55,4.15,0.35,1069.01,4.15,880536.7,430.49,0.37,True,72.27,1.55,1.68,-0.13,2026-02-13,80.0,4.38,0,,76.6,ATH,False,False
13-02-2026 17:00,KRPLS,9.17,9.37,9.13,9.32,1008034.0,0.05,0.15,0.03,476.92,0.15,417059.4,141.7,0.33,True,70.91,0.07,0.06,0.01,2026-02-13,9.02,3.33,0,,9.01,ATH,False,False
13-02-2026 17:00,GWIND,27.58,27.92,27.48,27.9,1800866.0,0.02,0.32,0.03,900.0,0.32,643691.4,179.77,0.06,True,72.47,0.18,0.15,0.03,2026-02-13,27.52,1.38,0,,26.56,28.26,False,False
13-02-2026 17:00,ZOREN,3.59,3.64,3.58,3.63,32493904.0,0.01,0.04,0.0,1900.0,0.04,7718246.3,321.0,0.25,True,67.59,0.02,0.01,0.01,2026-02-13,3.58,1.4,0,,3.53,3.65,False,False
13-02-2026 17:00,DAPGM,12.0,13.13,11.89,13.13,36298177.0,0.0,1.13,0.12,857.63,1.13,5240881.4,592.6,0.0,True,83.38,0.15,0.07,0.08,2026-02-13,11.94,9.97,0,,11.42,ATH,False,False
13-02-2026 17:00,CCOLA,77.5,78.8,77.45,78.65,2723639.0,0.15,1.15,0.08,1433.33,1.15,1150468.8,136.74,0.13,True,70.33,0.66,0.59,0.07,2026-02-13,77.5,1.48,0,,76.25,ATH,False,False
13-02-2026 17:00,BOBET,21.3,21.74,21.24,21.7,911359.0,0.04,0.4,0.04,852.38,0.4,418694.0,117.67,0.1,True,68.25,0.16,0.14,0.02,2026-02-13,21.34,1.69,0,,21.16,ATH,False,False
13-02-2026 16:00,ETILR,4.19,4.22,4.18,4.22,986120.0,0.0,0.03,0.0,900.0,0.03,598530.1,64.76,0.0,True,64.44,0.02,0.01,0.0,2026-02-13,4.2,0.48,0,,4.13,4.33,False,False
13-02-2026 16:00,GENTS,9.92,10.48,9.9,10.39,5111794.0,0.09,0.47,0.01,4600.0,0.47,2016462.8,153.5,0.19,True,54.53,-0.12,-0.13,0.0,2026-02-13,10.32,0.68,0,,9.89,11.14,True,True
13-02-2026 16:00,NTHOL,49.54,50.6,49.54,50.4,593212.0,0.2,0.86,0.16,444.3,0.86,202076.6,193.56,0.23,True,72.18,0.3,0.21,0.09,2026-02-13,48.94,2.98,0,,48.32,ATH,False,False
13-02-2026 16:00,GIPTA,62.7,64.3,62.4,64.2,1206813.0,0.1,1.5,0.15,900.0,1.5,382078.9,215.85,0.07,True,64.69,0.29,0.27,0.01,2026-02-13,62.5,2.72,0,,61.6,65.75,False,False
13-02-2026 16:00,RTALB,4.02,4.09,4.02,4.09,4573555.0,0.0,0.07,0.01,1066.67,0.07,2326047.4,96.62,0.0,True,61.18,0.0,-0.0,0.0,2026-02-13,4.07,0.49,0,,3.99,4.1,False,False
13-02-2026 16:00,TATGD,14.66,15.08,14.64,15.06,1414562.0,0.02,0.4,0.06,525.0,0.4,405122.8,249.17,0.05,True,82.4,0.14,0.08,0.06,2026-02-13,14.42,4.44,0,,14.07,ATH,False,False
13-02-2026 16:00,BJKAS,1.63,1.65,1.63,1.65,9628379.0,0.0,0.02,0.0,400.0,0.02,3551835.8,171.08,0.0,True,65.49,0.01,0.01,0.0,2026-02-13,1.61,2.48,0,,1.59,ATH,False,False
13-02-2026 16:00,YKSLN,3.27,3.32,3.27,3.32,3854757.0,0.0,0.05,0.01,733.33,0.05,1106781.4,248.29,0.0,True,65.3,0.01,0.0,0.0,2026-02-13,3.27,1.53,0,,3.25,ATH,False,False
13-02-2026 16:00,ANGEN,11.57,11.66,11.56,11.66,715675.0,0.0,0.09,0.01,1700.0,0.09,304271.7,135.21,0.0,True,64.47,0.04,0.04,0.0,2026-02-13,11.57,0.78,0,,11.47,11.78,False,False
13-02-2026 16:00,BURCE,58.5,62.9,58.35,62.45,530113.0,0.45,3.95,0.29,1262.07,3.95,153207.7,246.01,0.11,True,62.21,-0.53,-0.83,0.3,2026-02-13,59.6,4.78,0,,57.0,77.5,True,True
13-02-2026 16:00,ESCOM,3.9,3.96,3.9,3.95,4832429.0,0.01,0.05,0.01,525.0,0.05,2161355.0,123.58,0.2,True,70.94,0.03,0.02,0.01,2026-02-13,3.86,2.33,0,,3.74,3.96,False,False
13-02-2026 16:00,KATMR,2.91,3.06,2.9,3.03,105065045.0,0.03,0.12,0.01,823.08,0.12,19545952.0,437.53,0.25,True,76.49,0.02,0.01,0.01,2026-02-13,2.9,4.48,0,,2.89,ATH,False,False
13-02-2026 16:00,KRVGD,3.09,3.13,3.09,3.12,1434806.0,0.01,0.03,0.0,900.0,0.03,838262.6,71.16,0.33,True,61.72,0.01,0.0,0.0,2026-02-13,3.08,1.3,0,,3.04,3.16,False,False
13-02-2026 16:00,ANELE,16.51,16.72,16.48,16.67,305834.0,0.05,0.16,0.02,566.67,0.16,169101.3,80.86,0.31,True,61.73,0.05,0.04,0.01,2026-02-13,16.41,1.58,0,,15.66,16.78,False,False
13-02-2026 15:00,MOBTL,10.85,11.05,10.83,11.04,2795454.0,0.01,0.19,0.0,18900.0,0.19,1196118.1,133.71,0.05,True,61.76,0.06,0.07,-0.01,2026-02-13,10.87,1.56,0,,10.68,11.3,False,False
13-02-2026 15:00,YESIL,1.99,2.03,1.98,2.03,18126337.0,0.0,0.04,0.0,700.0,0.04,4084165.2,343.82,0.0,True,64.16,0.0,0.0,0.0,2026-02-13,2.0,1.5,2,1.98,1.98,2.08,False,False
13-02-2026 15:00,AKFIS,24.04,25.56,24.04,25.56,11065430.0,0.0,1.52,0.23,560.87,1.52,1476301.1,649.54,0.0,True,91.26,0.45,0.27,0.18,2026-02-13,23.24,9.98,0,,22.38,ATH,False,False
13-02-2026 15:00,EPLAS,6.9,7.17,6.87,7.16,2423305.0,0.01,0.26,0.03,712.5,0.26,608880.2,297.99,0.04,True,69.53,0.03,0.0,0.02,2026-02-13,6.89,3.92,0,,6.75,7.2,False,False
13-02-2026 14:00,SEGMN,48.66,50.0,48.62,49.78,1245674.0,0.22,1.12,0.22,413.76,1.12,646060.0,92.81,0.2,True,61.84,0.35,0.24,0.1,2026-02-13,48.98,1.63,0,,47.08,51.25,False,False
13-02-2026 14:00,DAGI,6.42,6.5,6.41,6.48,864781.0,0.02,0.06,0.0,1400.0,0.06,518335.5,66.84,0.33,True,53.12,-0.01,-0.01,-0.0,2026-02-13,6.45,0.47,0,,6.37,6.76,False,False
13-02-2026 14:00,ZEDUR,8.77,8.94,8.77,8.94,576288.0,0.0,0.17,0.0,5566.67,0.17,245067.4,135.15,0.0,True,61.53,0.04,0.04,-0.0,2026-02-13,8.8,1.59,0,,8.7,9.1,False,False
13-02-2026 14:00,TURGG,29.96,31.78,29.74,31.32,1233898.0,0.46,1.36,0.07,1900.0,1.36,751775.8,64.13,0.34,True,62.47,0.46,0.45,0.01,2026-02-13,31.24,0.26,0,,28.2,ATH,False,False
13-02-2026 14:00,OSTIM,3.16,3.3,3.15,3.27,17339598.0,0.03,0.11,0.01,746.15,0.11,3828854.4,352.87,0.27,True,78.58,0.02,0.01,0.01,2026-02-13,3.13,4.47,0,,3.06,3.32,False,False
13-02-2026 14:00,ENDAE,15.73,16.26,15.71,16.23,2464837.0,0.03,0.5,0.1,385.44,0.5,659294.7,273.86,0.06,True,68.74,0.09,0.03,0.07,2026-02-13,15.32,5.94,0,,15.05,ATH,False,False
13-02-2026 14:00,SEKFK,9.67,9.93,9.66,9.89,404230.0,0.04,0.22,0.03,547.06,0.22,137343.2,194.32,0.18,True,65.42,0.03,-0.0,0.04,2026-02-13,9.6,3.02,1,9.93,9.24,9.93,False,False
13-02-2026 14:00,CVKMD,44.72,46.74,44.7,46.36,6729265.0,0.38,1.64,0.19,745.36,1.64,3008935.6,123.64,0.23,True,72.15,0.59,0.44,0.15,2026-02-13,45.08,2.84,0,,40.82,46.48,False,False
13-02-2026 14:00,YYAPI,1.84,1.88,1.83,1.88,35629950.0,0.0,0.04,0.0,3900.0,0.04,11509372.9,209.57,0.0,True,60.38,0.01,0.01,0.0,2026-02-13,1.85,1.62,2,1.83,1.83,ATH,False,False
13-02-2026 14:00,GOZDE,27.4,27.7,27.4,27.68,444374.0,0.02,0.28,0.06,400.0,0.28,244219.2,81.96,0.07,True,70.97,0.2,0.2,0.01,2026-02-13,27.26,1.54,0,,27.18,ATH,False,False
13-02-2026 14:00,ODAS,6.12,6.2,6.08,6.19,13461566.0,0.01,0.07,0.0,6900.0,0.07,8352608.2,61.17,0.14,True,64.17,0.05,0.05,-0.0,2026-02-13,6.14,0.81,2,6.08,6.08,ATH,False,False
13-02-2026 13:00,CEMAS,5.92,6.18,5.92,6.13,13304401.0,0.05,0.21,0.01,1650.0,0.21,5581857.7,138.35,0.24,True,61.46,0.04,0.01,0.03,2026-02-13,5.87,4.43,0,,5.74,6.44,False,False
13-02-2026 13:00,KFEIN,10.42,10.81,10.37,10.73,3999920.0,0.08,0.31,0.02,1309.09,0.31,1432675.2,179.19,0.26,True,65.74,0.14,0.15,-0.01,2026-02-13,10.41,3.07,0,,10.12,10.83,False,False
13-02-2026 12:00,YEOTK,42.46,43.32,42.4,43.26,1319694.0,0.06,0.8,0.08,852.38,0.8,768598.8,71.7,0.08,True,74.98,0.42,0.29,0.13,2026-02-13,42.6,1.55,0,,40.3,47.0,False,False
13-02-2026 12:00,DCTTR,8.26,8.49,8.23,8.44,3439382.0,0.05,0.18,0.03,500.0,0.18,975216.0,252.68,0.28,True,76.61,0.03,0.01,0.02,2026-02-13,8.21,2.8,0,,8.11,8.47,False,False
13-02-2026 12:00,VRGYO,2.58,2.65,2.57,2.64,6319569.0,0.01,0.06,0.0,1900.0,0.06,3976705.4,58.91,0.17,True,62.08,0.02,0.02,-0.0,2026-02-13,2.61,1.15,0,,2.56,ATH,False,False
13-02-2026 12:00,VBTYZ,22.2,23.58,22.06,23.52,2493717.0,0.06,1.32,0.06,2100.0,1.32,648366.5,284.62,0.05,True,65.37,0.19,0.08,0.11,2026-02-13,21.5,9.4,0,,21.1,23.58,False,False
13-02-2026 12:00,ARDYZ,46.7,47.78,46.6,47.72,974935.0,0.06,1.02,0.15,598.63,1.02,555692.6,75.45,0.06,True,74.59,0.59,0.37,0.22,2026-02-13,45.7,4.42,0,,43.36,48.78,False,False
13-02-2026 12:00,ANSGR,27.94,28.4,27.9,28.34,2741847.0,0.06,0.4,0.08,387.8,0.4,1167240.8,134.9,0.15,True,81.36,0.18,0.1,0.07,2026-02-13,27.6,2.68,1,28.4,27.0,28.4,False,False
13-02-2026 12:00,AVOD,5.2,5.45,5.15,5.44,9447254.0,0.01,0.24,0.05,433.33,0.24,4020275.9,134.99,0.04,True,75.87,0.07,0.03,0.04,2026-02-13,5.07,7.3,1,5.45,4.98,5.45,False,False
13-02-2026 11:00,PENGD,9.23,9.32,9.21,9.32,908840.0,0.0,0.09,0.01,1185.71,0.09,557620.6,62.99,0.0,True,59.12,0.01,0.01,-0.0,2026-02-13,9.15,1.86,0,,9.08,9.67,False,False
13-02-2026 11:00,CONSE,3.68,3.79,3.68,3.76,3523553.0,0.03,0.08,0.01,1042.86,0.08,1188489.1,196.47,0.38,True,68.84,0.05,0.05,-0.0,2026-02-13,3.71,1.35,0,,3.52,ATH,False,False
13-02-2026 11:00,SEGYO,5.6,5.96,5.58,5.95,7939540.0,0.01,0.35,0.01,2400.0,0.35,4463393.7,77.88,0.03,True,70.65,0.16,0.16,-0.0,2026-02-13,5.57,6.82,0,,4.88,ATH,False,False
13-02-2026 11:00,ARSAN,4.52,4.84,4.47,4.76,23491909.0,0.08,0.24,0.01,1746.15,0.24,5683868.9,313.31,0.33,True,57.54,-0.0,0.01,-0.01,2026-02-13,4.61,3.25,3,,4.58,4.96,False,False
13-02-2026 10:00,SEYKM,5.33,5.48,5.33,5.46,630376.0,0.02,0.13,0.01,1757.14,0.13,350204.1,80.0,0.15,True,48.85,0.03,0.06,-0.03,2026-02-13,5.48,-0.36,0,,5.32,5.82,False,False
13-02-2026 10:00,MANAS,12.22,12.68,12.1,12.59,11846070.0,0.09,0.37,0.04,900.0,0.37,5381496.9,120.13,0.24,True,65.08,0.16,0.17,-0.01,2026-02-13,12.2,3.2,0,,11.71,12.73,False,False
13-02-2026 10:00,BIENY,25.5,27.56,25.2,27.46,5285448.0,0.1,1.96,0.31,536.36,1.96,872873.1,505.52,0.05,True,90.18,0.44,0.18,0.26,2026-02-13,25.44,7.94,0,,24.0,ATH,False,False
13-02-2026 10:00,BESLR,15.23,15.62,15.1,15.55,2190119.0,0.07,0.32,0.04,700.0,0.32,765432.2,186.13,0.22,True,79.9,0.25,0.22,0.04,2026-02-13,15.15,2.64,0,,14.1,ATH,False,False
13-02-2026 10:00,REEDR,6.92,7.03,6.89,7.0,8687146.0,0.03,0.08,0.01,515.38,0.08,2443328.9,255.55,0.38,True,74.65,0.03,0.02,0.01,2026-02-13,6.93,1.01,0,,6.78,ATH,False,False
13-02-2026 10:00,BERA,19.82,20.08,19.77,20.06,7243246.0,0.02,0.24,0.01,1900.0,0.24,3051211.9,137.39,0.08,True,49.71,-0.16,-0.17,0.01,2026-02-13,19.7,1.83,0,,19.61,23.1,False,False
13-02-2026 10:00,KIMMR,16.6,17.28,16.51,17.16,242861.0,0.12,0.56,0.09,551.16,0.56,122998.5,97.45,0.21,True,84.82,0.27,0.2,0.06,2026-02-13,16.66,3.0,0,,15.24,ATH,False,False
13-02-2026 10:00,QUAGR,3.09,3.36,3.08,3.35,197900756.0,0.01,0.26,0.05,441.67,0.26,39885202.7,396.18,0.04,True,86.13,0.07,0.03,0.04,2026-02-13,3.09,8.41,0,,2.83,ATH,False,False
13-02-2026 10:00,KCAER,11.7,12.04,11.7,11.96,8787416.0,0.08,0.26,0.02,1138.1,0.26,2164915.6,305.9,0.31,True,76.54,0.1,0.09,0.01,2026-02-13,11.69,2.31,0,,10.8,ATH,False,False
13-02-2026 10:00,THYAO,337.5,351.25,337.25,347.75,38503684.0,3.5,10.25,1.5,583.33,10.25,10077821.3,282.06,0.34,True,77.35,2.95,2.24,0.71,2026-02-13,337.0,3.19,1,351.25,331.0,351.25,False,False
13-02-2026 10:00,BAYRK,4.88,5.2,4.87,5.16,13505633.0,0.04,0.28,0.05,522.22,0.28,3353900.2,302.68,0.14,True,83.88,0.09,0.05,0.04,2026-02-13,4.88,5.74,0,,4.59,ATH,False,False
13-02-2026 10:00,BALSU,17.19,17.59,17.06,17.49,5333654.0,0.1,0.3,0.08,284.62,0.3,2374924.6,124.58,0.33,True,70.98,0.14,0.09,0.05,2026-02-13,17.1,2.28,1,17.59,16.53,17.59,False,False
13-02-2026 10:00,BAHKM,134.7,139.4,131.5,139.3,431395.0,0.1,4.6,0.7,557.14,4.6,119694.5,260.41,0.02,True,63.98,0.62,0.35,0.27,2026-02-13,133.5,4.34,0,,128.6,141.4,False,False
13-02-2026 10:00,TRALT,52.35,54.15,52.15,54.0,37096921.0,0.15,1.65,0.09,1636.84,1.65,11348107.1,226.9,0.09,True,65.81,0.76,0.89,-0.13,2026-02-13,53.3,1.31,2,52.15,52.15,54.4,False,False
13-02-2026 10:00,TRENJ,106.6,110.3,106.2,109.9,775962.0,0.4,3.3,0.04,8150.0,3.3,268565.6,188.93,0.12,True,64.63,1.18,1.2,-0.03,2026-02-13,108.1,1.67,2,106.2,106.2,111.8,False,False
13-02-2026 10:00,PCILT,23.54,24.24,23.54,24.16,396863.0,0.08,0.62,0.06,868.75,0.62,122216.4,224.72,0.13,True,66.57,0.1,0.08,0.02,2026-02-13,23.54,2.63,0,,23.16,ATH,False,False
13-02-2026 10:00,HALKB,48.18,49.44,47.86,49.36,40260569.0,0.08,1.18,0.22,441.28,1.18,13372400.5,201.07,0.07,True,83.04,0.83,0.66,0.17,2026-02-13,48.0,2.83,0,,43.0,ATH,False,False
13-02-2026 10:00,EKSUN,5.83,6.01,5.82,5.98,2133899.0,0.03,0.15,0.01,1053.85,0.15,557613.0,282.68,0.2,True,72.73,0.04,0.03,0.01,2026-02-13,5.83,2.57,0,,5.66,5.99,False,False
13-02-2026 10:00,TUREX,7.81,8.18,7.8,8.1,23016369.0,0.08,0.29,0.04,643.59,0.29,3646334.9,531.22,0.28,True,86.14,0.07,0.04,0.02,2026-02-13,7.79,3.98,0,,7.63,ATH,False,False
13-02-2026 10:00,UNLU,17.35,18.01,17.25,17.88,1941065.0,0.13,0.53,0.07,657.14,0.53,708066.3,174.14,0.25,True,67.68,0.17,0.16,0.01,2026-02-13,17.25,3.65,3,,16.44,18.0,False,False
13-02-2026 10:00,VAKBN,41.36,42.84,40.82,42.56,28405739.0,0.28,1.2,0.25,383.87,1.2,9687443.4,193.22,0.23,True,88.83,1.24,0.94,0.3,2026-02-13,41.1,3.55,1,42.84,36.24,42.84,False,False
13-02-2026 10:00,IHAAS,46.2,49.46,46.2,48.9,1725731.0,0.56,2.7,0.41,558.54,2.7,552371.8,212.42,0.21,True,73.18,0.67,0.22,0.45,2026-02-13,46.1,6.07,0,,42.92,49.72,False,False
13-02-2026 10:00,AGROT,3.25,3.3,3.25,3.29,8489238.0,0.01,0.04,0.01,700.0,0.04,3053053.7,178.06,0.25,True,67.05,0.01,0.0,0.0,2026-02-13,3.25,1.23,0,,3.2,3.32,False,False
13-02-2026 10:00,FONET,3.31,3.53,3.31,3.47,51164692.0,0.06,0.16,0.02,788.89,0.16,6867157.2,645.06,0.37,True,75.69,0.02,0.0,0.02,2026-02-13,3.24,7.1,1,3.53,3.2,3.53,False,False
12-02-2026 17:00,SAFKR,28.04,28.66,27.94,28.52,2141099.0,0.14,0.48,0.03,1614.29,0.48,566836.8,277.73,0.29,True,56.13,-0.01,-0.03,0.02,2026-02-12,28.22,1.06,1,28.66,27.8,28.66,False,False
12-02-2026 17:00,DOHOL,21.84,22.2,21.8,22.14,8539367.0,0.06,0.3,0.06,417.24,0.3,3040234.4,180.88,0.2,True,81.7,0.25,0.17,0.08,2026-02-12,21.3,3.94,0,,20.66,ATH,False,False
12-02-2026 17:00,MOPAS,58.05,59.15,57.1,59.0,894182.0,0.15,0.95,0.02,4650.0,0.95,379825.4,135.42,0.16,True,65.77,0.72,0.75,-0.03,2026-02-12,58.45,0.94,0,,56.0,59.45,False,False
12-02-2026 17:00,AKENR,11.25,11.33,11.24,11.33,1638902.0,0.0,0.08,0.01,471.43,0.08,793155.5,106.63,0.0,True,60.2,0.01,0.01,0.01,2026-02-12,11.17,1.43,0,,11.13,11.41,False,False
12-02-2026 17:00,HUNER,3.42,3.46,3.42,3.45,4128609.0,0.01,0.03,0.01,275.0,0.03,2099545.5,96.64,0.33,True,67.63,0.02,0.02,0.0,2026-02-12,3.37,2.37,0,,3.33,ATH,False,False
12-02-2026 17:00,RUZYE,12.78,13.07,12.72,13.01,3214943.0,0.06,0.23,0.03,596.97,0.23,901061.6,256.8,0.26,True,67.38,0.04,0.03,0.01,2026-02-12,12.61,3.17,0,,12.51,13.08,False,False
12-02-2026 17:00,KRSTL,12.2,12.5,12.2,12.43,2041231.0,0.07,0.23,0.05,400.0,0.23,754738.2,170.46,0.3,True,73.25,0.12,0.1,0.03,2026-02-12,12.03,3.33,1,12.5,11.75,12.5,False,False
12-02-2026 17:00,ANHYT,120.8,122.0,120.7,122.0,691087.0,0.0,1.2,0.03,3900.0,1.2,200838.9,244.1,0.0,True,62.84,0.63,0.71,-0.08,2026-02-12,122.0,0.0,0,,120.4,122.1,False,False
12-02-2026 17:00,DEVA,77.55,80.45,77.45,80.45,680184.0,0.0,2.9,0.29,900.0,2.9,113895.0,497.2,0.0,True,85.47,0.67,0.55,0.13,2026-02-12,77.35,4.01,0,,73.75,ATH,False,False
12-02-2026 17:00,GARFA,29.04,29.26,29.02,29.22,181620.0,0.04,0.18,0.02,800.0,0.18,99187.8,83.11,0.22,True,64.09,0.09,0.06,0.03,2026-02-12,28.96,0.9,0,,28.44,ATH,False,False
12-02-2026 17:00,ZGYO,32.36,36.3,32.16,35.8,1618307.0,0.5,3.44,0.23,1382.76,3.44,983488.6,64.55,0.15,True,75.23,1.15,1.12,0.03,2026-02-12,33.54,6.74,0,,28.22,ATH,False,False
12-02-2026 17:00,IHLGM,2.06,2.08,2.06,2.08,4061152.0,0.0,0.02,0.0,400.0,0.02,1860862.1,118.24,0.0,True,63.43,0.0,0.0,0.0,2026-02-12,2.04,1.96,0,,2.03,2.09,False,False
12-02-2026 17:00,KLKIM,42.54,42.84,42.5,42.78,415125.0,0.06,0.24,0.04,500.0,0.24,237901.5,74.49,0.25,True,53.93,-0.04,-0.01,-0.04,2026-02-12,42.22,1.33,0,,41.98,44.2,False,False
12-02-2026 16:00,BNTAS,6.77,6.87,6.77,6.85,2102289.0,0.02,0.08,0.01,566.67,0.08,785471.4,167.65,0.25,True,68.74,0.03,0.02,0.01,2026-02-12,6.67,2.7,1,6.87,6.61,6.87,False,False
12-02-2026 16:00,TEKTU,10.21,10.95,10.18,10.77,8834381.0,0.18,0.56,0.03,1650.0,0.56,2764186.8,219.6,0.32,True,64.58,0.16,0.2,-0.04,2026-02-12,10.1,6.63,1,10.95,10.1,10.95,False,False
12-02-2026 16:00,KOCMT,2.78,2.79,2.77,2.79,4754471.0,0.0,0.01,0.0,233.33,0.01,2397484.1,98.31,0.0,True,63.59,0.01,0.01,0.0,2026-02-12,2.74,1.82,0,,2.74,2.8,False,False
12-02-2026 16:00,DNISI,23.9,24.04,23.86,24.02,165019.0,0.02,0.12,0.01,1100.0,0.12,88327.7,86.83,0.17,True,55.98,0.04,0.08,-0.04,2026-02-12,23.8,0.92,0,,23.78,24.76,False,False
12-02-2026 15:00,KCHOL,217.1,223.2,216.9,222.9,9934601.0,0.3,5.8,1.17,395.73,5.8,6124893.7,62.2,0.05,True,83.16,2.65,1.25,1.41,2026-02-12,207.4,7.47,0,,203.5,ATH,False,False
12-02-2026 15:00,XBANK,20153.53,20474.74,20141.03,20453.01,297644399.0,21.73,299.48,107.37,178.94,299.48,193290657.4,53.99,0.07,True,84.15,230.25,114.5,115.74,2026-02-12,19267.66,6.15,0,,18970.78,ATH,False,False
12-02-2026 15:00,TSKB,13.91,14.15,13.9,14.14,14016923.0,0.01,0.23,0.06,289.83,0.23,5640293.4,148.51,0.04,True,85.16,0.15,0.1,0.05,2026-02-12,13.59,4.05,0,,13.22,14.15,False,False
12-02-2026 15:00,KMPUR,15.77,15.92,15.76,15.9,294978.0,0.02,0.13,0.01,983.33,0.13,186404.8,58.25,0.15,True,59.13,0.03,0.02,0.01,2026-02-12,15.62,1.79,0,,15.55,16.17,False,False
12-02-2026 15:00,LMKDC,31.76,32.02,31.68,32.0,554392.0,0.02,0.24,0.04,445.45,0.24,347707.6,59.44,0.08,True,62.89,0.09,0.04,0.06,2026-02-12,31.3,2.24,0,,30.98,32.06,False,False
12-02-2026 15:00,BMSTL,112.1,116.4,111.8,116.1,1183526.0,0.3,4.0,0.29,1279.31,4.0,246116.4,380.88,0.08,True,75.08,0.57,0.36,0.21,2026-02-12,111.4,4.22,0,,110.6,ATH,False,False
12-02-2026 15:00,YKBNK,41.46,42.16,41.38,42.12,42525731.0,0.04,0.66,0.2,236.73,0.66,28206939.0,50.76,0.06,True,83.49,0.49,0.29,0.2,2026-02-12,39.78,5.88,0,,39.08,ATH,False,False
12-02-2026 15:00,ASELS,297.0,302.0,296.5,301.5,7322743.0,0.5,4.5,0.55,718.18,4.5,3549610.7,106.3,0.11,True,68.97,0.7,0.48,0.23,2026-02-12,294.0,2.55,0,,291.5,304.0,False,False
12-02-2026 15:00,SAHOL,108.5,111.2,108.4,111.0,12761745.0,0.2,2.5,0.58,331.03,2.5,6145381.5,107.66,0.08,True,82.16,1.14,0.42,0.73,2026-02-12,103.9,6.83,0,,101.9,ATH,False,False
12-02-2026 15:00,ISMEN,48.9,49.62,48.9,49.6,1328521.0,0.02,0.7,0.14,414.71,0.7,732973.5,81.25,0.03,True,81.36,0.35,0.24,0.11,2026-02-12,48.04,3.25,0,,47.14,ATH,False,False
12-02-2026 15:00,RGYAS,157.5,158.8,156.8,158.7,341318.0,0.1,1.2,0.14,757.14,1.2,108384.1,214.92,0.08,True,63.96,0.39,0.37,0.03,2026-02-12,156.7,1.28,0,,156.0,159.9,False,False
12-02-2026 15:00,AKBNK,88.8,90.5,88.75,90.4,29633291.0,0.1,1.6,0.57,180.7,1.6,19414703.9,52.63,0.06,True,83.85,1.02,0.34,0.68,2026-02-12,83.95,7.68,0,,82.65,ATH,False,False
12-02-2026 15:00,GARAN,160.0,163.2,159.7,163.0,12824872.0,0.2,3.0,0.65,361.54,3.0,5221114.0,145.63,0.07,True,77.02,0.98,0.17,0.81,2026-02-12,154.5,5.5,0,,152.6,169.7,False,False
12-02-2026 15:00,AEFES,20.76,21.12,20.7,21.1,14588836.0,0.02,0.34,0.04,672.73,0.34,6373360.0,128.9,0.06,True,71.24,0.12,0.07,0.05,2026-02-12,20.44,3.23,0,,19.99,ATH,False,False
12-02-2026 15:00,FROTO,123.7,125.9,123.3,125.8,3368276.0,0.1,2.1,0.52,303.85,2.1,2095090.9,60.77,0.05,True,78.07,1.65,1.14,0.51,2026-02-12,120.2,4.66,0,,114.1,ATH,False,False
12-02-2026 15:00,ICUGS,2.73,2.79,2.71,2.78,6354541.0,0.01,0.05,0.01,455.56,0.05,3059699.6,107.69,0.2,True,73.39,0.03,0.02,0.01,2026-02-12,2.73,1.83,0,,2.61,ATH,False,False
12-02-2026 15:00,AGHOL,35.28,35.8,35.28,35.76,1496787.0,0.04,0.48,0.08,531.58,0.48,715315.7,109.25,0.08,True,66.33,0.04,-0.06,0.1,2026-02-12,34.8,2.76,0,,34.18,36.3,False,False
12-02-2026 15:00,ENKAI,98.45,100.0,98.2,99.95,2546149.0,0.05,1.5,0.35,322.54,1.5,1147280.7,121.93,0.03,True,77.14,0.65,0.25,0.39,2026-02-12,96.0,4.11,0,,94.15,ATH,False,False
12-02-2026 15:00,LIDFA,3.11,3.15,3.09,3.15,3002320.0,0.0,0.04,0.0,1233.33,0.04,969596.1,209.65,0.0,True,62.04,0.01,0.0,0.0,2026-02-12,3.09,1.94,0,,3.05,3.22,False,False
12-02-2026 14:00,SASA,2.59,2.66,2.58,2.65,1439200040.0,0.01,0.06,0.0,2900.0,0.06,628291973.8,129.07,0.17,True,66.78,0.02,0.02,0.0,2026-02-12,2.54,4.33,0,,2.5,ATH,False,False
12-02-2026 14:00,EREGL,29.68,29.94,29.66,29.88,30729198.0,0.06,0.2,0.04,376.19,0.2,15389325.8,99.68,0.3,True,66.86,0.09,0.04,0.06,2026-02-12,29.24,2.19,0,,28.86,30.22,False,False
12-02-2026 13:00,MIATK,38.24,38.94,38.24,38.9,4965143.0,0.04,0.66,0.07,900.0,0.66,2204949.9,125.18,0.06,True,73.65,0.33,0.28,0.05,2026-02-12,37.98,2.42,0,,37.46,ATH,False,False
12-02-2026 13:00,KRDMA,29.3,29.62,29.28,29.6,621611.0,0.02,0.3,0.04,689.47,0.3,404422.4,53.7,0.07,True,65.67,0.12,0.1,0.02,2026-02-12,29.28,1.09,0,,28.7,29.72,False,False
12-02-2026 12:00,GESAN,57.15,58.0,57.1,57.95,1122246.0,0.05,0.8,0.11,595.65,0.8,452293.2,148.12,0.06,True,67.24,0.29,0.12,0.17,2026-02-12,56.55,2.48,0,,55.4,60.75,False,False
12-02-2026 11:00,POLHO,17.48,17.77,17.47,17.74,894226.0,0.03,0.26,0.01,2788.89,0.26,279455.9,219.99,0.12,True,64.31,0.03,0.02,0.01,2026-02-12,17.33,2.37,0,,17.29,18.15,False,False
12-02-2026 11:00,ASTOR,176.8,180.2,176.0,179.6,9849996.0,0.6,2.8,1.1,154.55,2.8,4776093.0,106.24,0.21,True,86.93,4.28,3.3,0.98,2026-02-12,173.0,3.82,0,,149.0,ATH,False,False
12-02-2026 11:00,KOPOL,5.86,6.22,5.84,6.21,5904795.0,0.01,0.35,0.03,960.61,0.35,1043431.0,465.9,0.03,True,73.57,0.01,-0.01,0.02,2026-02-12,5.82,6.7,0,,5.82,ATH,False,False
12-02-2026 11:00,BTCIM,4.92,5.0,4.91,4.98,28361077.0,0.02,0.06,0.01,757.14,0.06,10331942.3,174.5,0.33,True,60.77,0.01,0.01,0.0,2026-02-12,4.93,1.01,0,,4.9,5.03,False,False
12-02-2026 11:00,OYAKC,26.52,26.82,26.44,26.82,4061918.0,0.0,0.3,0.08,284.62,0.3,1772476.5,129.17,0.0,True,66.98,0.07,0.01,0.06,2026-02-12,26.24,2.21,0,,25.68,26.86,False,False
12-02-2026 11:00,DMLKT,5.79,5.81,5.79,5.81,1551572.0,0.0,0.02,0.0,1900.0,0.02,940874.6,64.91,0.0,True,59.93,-0.0,-0.0,0.0,2026-02-12,5.79,0.35,1,5.81,5.77,5.82,False,False
12-02-2026 11:00,DARDL,2.37,2.41,2.36,2.4,15237637.0,0.01,0.03,0.0,1400.0,0.03,3086480.5,393.69,0.33,True,63.29,0.0,0.0,0.0,2026-02-12,2.35,2.13,0,,2.33,ATH,False,False
12-02-2026 11:00,EKOS,5.88,5.93,5.85,5.93,2430295.0,0.0,0.05,0.01,733.33,0.05,1024519.0,137.21,0.0,True,61.69,0.01,0.0,0.0,2026-02-12,5.85,1.37,0,,5.82,6.04,False,False
12-02-2026 11:00,TUPRS,217.9,219.2,217.2,218.9,4451362.0,0.3,1.0,0.14,614.29,1.0,2595044.4,71.53,0.3,True,55.31,-0.82,-1.41,0.59,2026-02-12,215.9,1.39,0,,213.5,237.7,True,False
12-02-2026 10:00,GLRMK,188.1,190.5,188.1,190.3,249083.0,0.2,2.2,0.2,1000.0,2.2,107724.6,131.22,0.09,True,56.66,-0.2,-0.15,-0.05,2026-02-12,187.4,1.55,1,190.5,186.9,190.5,False,False
12-02-2026 10:00,GEREL,25.18,26.12,25.0,26.12,8572328.0,0.0,0.94,0.09,900.0,0.94,1103149.1,677.08,0.0,True,98.64,1.41,1.27,0.14,2026-02-12,23.76,9.93,1,26.12,16.32,ATH,False,False
12-02-2026 10:00,ORCAY,3.8,3.83,3.76,3.83,791447.0,0.0,0.03,0.0,650.0,0.03,343830.3,130.19,0.0,True,59.75,-0.0,-0.0,0.0,2026-02-12,3.8,0.79,0,,3.75,3.85,False,False
12-02-2026 10:00,BARMA,46.8,47.38,46.42,47.24,370612.0,0.14,0.44,0.07,511.11,0.44,245462.1,50.99,0.32,True,74.72,0.6,0.54,0.06,2026-02-12,46.7,1.16,0,,42.82,ATH,False,False
12-02-2026 10:00,FORMT,3.57,3.64,3.5,3.62,50388472.0,0.02,0.05,0.01,257.14,0.05,11852304.9,325.14,0.4,True,54.37,-0.0,-0.01,0.0,2026-02-12,3.6,0.56,2,3.5,3.5,3.87,False,False
12-02-2026 10:00,MAKTK,16.55,17.37,16.55,17.22,3979028.0,0.15,0.67,0.07,900.0,0.67,952520.3,317.74,0.22,True,62.05,-0.01,-0.02,0.01,2026-02-12,16.55,4.05,1,17.37,16.48,17.37,False,False
12-02-2026 10:00,GUBRF,550.0,563.5,541.5,561.5,944934.0,2.0,11.5,3.4,238.24,11.5,393095.7,140.38,0.17,True,84.88,8.48,4.92,3.56,2026-02-12,543.0,3.41,0,,514.5,ATH,False,False
12-02-2026 10:00,XU100,13795.51,13846.27,13784.8,13846.27,1872683271.0,0.0,50.76,3.93,1192.92,50.76,1229410716.9,52.32,0.0,True,56.92,16.05,17.19,-1.14,2026-02-12,13787.82,0.42,0,,13680.91,13912.94,False,False
12-02-2026 10:00,ALBRK,9.28,9.46,9.26,9.44,6457176.0,0.02,0.16,0.03,515.38,0.16,2335137.7,176.52,0.13,True,76.32,0.08,0.07,0.01,2026-02-12,9.26,1.94,0,,8.71,ATH,False,False
12-02-2026 10:00,ISKPL,12.08,12.49,11.99,12.45,6723993.0,0.04,0.37,0.1,285.42,0.37,2722579.9,146.97,0.11,True,74.85,0.19,0.12,0.06,2026-02-12,12.03,3.49,0,,11.36,ATH,False,False
12-02-2026 10:00,AKSA,10.81,10.89,10.79,10.88,3335834.0,0.01,0.07,0.01,438.46,0.07,1582325.4,110.82,0.14,True,57.07,0.0,0.0,0.0,2026-02-12,10.8,0.74,2,10.79,10.79,10.99,False,False
12-02-2026 10:00,ISDMR,46.46,46.82,45.74,46.74,1000510.0,0.08,0.28,0.01,3400.0,0.28,349848.5,185.98,0.29,True,68.11,0.47,0.55,-0.08,2026-02-12,46.38,0.78,2,45.74,45.74,47.0,False,False
12-02-2026 10:00,UCAYM,32.1,33.44,31.98,33.26,7548596.0,0.18,1.16,0.1,1083.67,1.16,4126828.2,82.92,0.16,True,45.38,-0.79,-0.82,0.03,2026-02-12,32.2,3.29,2,31.98,31.98,36.88,True,True
12-02-2026 10:00,SOKM,65.5,66.7,65.4,66.65,1094377.0,0.05,1.15,0.07,1669.23,1.15,475217.7,130.29,0.04,True,65.48,0.37,0.37,0.0,2026-02-12,65.35,1.99,0,,65.0,66.7,False,False
12-02-2026 10:00,SNICA,4.61,4.75,4.56,4.74,13411465.0,0.01,0.13,0.01,983.33,0.13,4977594.2,169.44,0.08,True,69.36,0.05,0.05,0.0,2026-02-12,4.58,3.49,2,4.56,4.56,4.77,False,False
12-02-2026 10:00,ULKER,135.7,138.0,135.4,137.6,2834151.0,0.4,1.9,0.45,322.22,1.9,834115.0,239.78,0.21,True,68.59,0.49,0.04,0.44,2026-02-12,134.8,2.08,0,,130.8,138.0,False,False
12-02-2026 10:00,ARCLK,123.2,127.0,123.2,127.0,1603003.0,0.0,3.8,0.39,874.36,3.8,508505.9,215.24,0.0,True,69.07,0.27,0.06,0.21,2026-02-12,122.7,3.5,0,,121.7,ATH,False,False
12-02-2026 10:00,ECILC,123.9,125.8,122.8,125.5,1525731.0,0.3,1.6,0.03,5233.33,1.6,422969.6,260.72,0.19,True,71.86,1.56,1.56,0.0,2026-02-12,121.9,2.95,1,125.8,118.7,125.8,False,False
12-02-2026 10:00,CANTE,1.77,1.83,1.77,1.82,277058581.0,0.01,0.05,0.0,4900.0,0.05,63620296.2,335.49,0.2,True,57.54,-0.01,-0.01,0.0,2026-02-12,1.76,3.41,0,,1.75,1.87,True,True
12-02-2026 10:00,SKBNK,10.27,10.45,10.23,10.4,14304544.0,0.05,0.13,0.02,441.67,0.13,5896215.1,142.61,0.38,True,77.59,0.21,0.2,0.02,2026-02-12,10.14,2.56,0,,9.04,ATH,False,False
12-02-2026 10:00,SISE,47.82,48.18,47.78,48.14,14380640.0,0.04,0.32,0.07,357.14,0.32,8017867.9,79.36,0.12,True,59.16,0.08,0.02,0.06,2026-02-12,47.68,0.96,0,,46.68,48.68,False,False
12-02-2026 10:00,ARZUM,3.4,3.61,3.38,3.57,34873390.0,0.04,0.17,0.02,709.52,0.17,9111362.3,282.75,0.24,True,88.67,0.17,0.16,0.01,2026-02-12,3.38,5.62,0,,2.56,ATH,False,False
12-02-2026 10:00,MERCN,19.0,19.96,18.97,19.85,5329336.0,0.11,0.85,0.07,1187.88,0.85,1673616.4,218.43,0.13,True,67.26,0.22,0.31,-0.09,2026-02-12,19.0,4.47,0,,18.74,20.28,False,False
12-02-2026 10:00,NIBAS,4.76,4.87,4.74,4.87,7283273.0,0.0,0.11,0.01,900.0,0.11,1219240.8,497.36,0.0,True,93.91,0.24,0.19,0.05,2026-02-12,4.43,9.93,1,4.87,3.67,ATH,False,False
11-02-2026 17:00,EUPWR,39.7,41.1,39.62,40.86,3339325.0,0.24,1.16,0.13,820.63,1.16,926890.6,260.27,0.21,True,65.82,-0.09,-0.19,0.1,2026-02-11,39.66,3.03,0,,38.92,41.02,False,False
11-02-2026 17:00,PASEU,139.0,148.0,137.1,148.0,7221141.0,0.0,9.0,1.25,620.0,9.0,1126686.4,540.92,0.0,True,52.65,-3.12,-2.8,-0.31,2026-02-11,143.1,3.42,1,148.0,132.7,160.7,False,False
11-02-2026 17:00,DMRGD,4.11,4.28,4.09,4.24,19065525.0,0.04,0.13,0.02,712.5,0.13,4869999.2,291.49,0.31,True,65.34,0.05,0.05,-0.0,2026-02-11,4.1,3.41,0,,3.98,ATH,False,False
11-02-2026 17:00,LIDER,76.7,77.95,76.65,77.8,186829.0,0.15,1.1,0.08,1275.0,1.1,121533.9,53.73,0.14,True,65.19,0.51,0.54,-0.03,2026-02-11,77.0,1.04,0,,74.3,ATH,False,False
11-02-2026 16:00,ESEN,4.02,4.16,4.02,4.16,29994748.0,0.0,0.14,0.02,566.67,0.14,12022051.6,149.5,0.0,True,82.78,0.03,0.02,0.02,2026-02-11,3.94,5.58,0,,3.91,ATH,False,False
11-02-2026 16:00,AVGYO,13.13,13.72,13.07,13.72,1206132.0,0.0,0.59,0.09,541.3,0.59,537875.2,124.24,0.0,True,72.31,0.17,0.11,0.07,2026-02-11,12.79,7.27,0,,11.89,ATH,False,False
11-02-2026 16:00,KAREL,9.66,9.88,9.66,9.85,4129937.0,0.03,0.19,0.03,578.57,0.19,1464191.5,182.06,0.16,True,78.21,0.13,0.11,0.02,2026-02-11,9.55,3.14,0,,8.85,ATH,False,False
11-02-2026 16:00,CEMTS,12.55,13.01,12.54,13.0,2305725.0,0.01,0.45,0.05,749.06,0.45,601595.5,283.27,0.02,True,79.16,0.07,0.05,0.03,2026-02-11,12.53,3.75,0,,12.42,ATH,False,False
11-02-2026 16:00,MAGEN,44.94,45.92,44.86,45.86,1268999.0,0.06,0.92,0.17,434.88,0.92,549696.7,130.85,0.07,True,68.79,0.57,0.56,0.0,2026-02-11,44.46,3.15,0,,44.26,ATH,False,False
11-02-2026 15:00,TRCAS,50.9,53.05,50.8,52.95,614134.0,0.1,2.05,0.34,506.51,2.05,176815.5,247.33,0.05,True,70.78,0.13,-0.07,0.19,2026-02-11,50.05,5.79,0,,49.44,ATH,False,False
11-02-2026 15:00,SUWEN,8.75,9.03,8.75,9.0,2377613.0,0.03,0.25,0.04,575.68,0.25,449665.9,428.75,0.12,True,72.21,0.05,0.02,0.02,2026-02-11,8.71,3.33,0,,8.62,ATH,False,False
11-02-2026 15:00,SELEC,86.45,87.95,86.45,87.95,415103.0,0.0,1.5,0.14,971.43,1.5,227939.8,82.11,0.0,True,71.63,1.1,0.98,0.13,2026-02-11,85.2,3.23,0,,80.15,ATH,False,False
11-02-2026 14:00,IHLAS,2.33,2.38,2.32,2.38,57446102.0,0.0,0.05,0.01,614.29,0.05,15493402.8,270.78,0.0,True,73.66,0.01,0.0,0.0,2026-02-11,2.3,3.48,0,,2.29,2.4,False,False
11-02-2026 13:00,MAVI,48.32,49.04,48.3,48.98,1491599.0,0.06,0.66,0.07,816.67,0.66,844483.4,76.63,0.09,True,67.16,0.21,0.19,0.02,2026-02-11,48.46,1.07,0,,47.8,ATH,False,False
11-02-2026 12:00,EFOR,22.24,23.2,22.2,23.12,2685037.0,0.08,0.88,0.22,303.67,0.88,1466868.0,83.05,0.09,True,62.48,-0.0,-0.06,0.06,2026-02-11,22.34,3.49,0,,21.42,24.06,False,False
11-02-2026 12:00,ISCTR,16.82,17.0,16.81,16.95,107591695.0,0.05,0.13,0.02,584.21,0.13,68582465.7,56.88,0.38,True,54.4,0.01,0.01,-0.0,2026-02-11,16.93,0.12,0,,16.65,17.14,False,False
11-02-2026 12:00,OFSYM,74.55,76.25,74.4,76.25,289083.0,0.0,1.7,0.2,729.27,1.7,166351.7,73.78,0.0,True,70.41,0.88,0.86,0.01,2026-02-11,74.65,2.14,0,,70.0,ATH,False,False
11-02-2026 11:00,SARKY,41.0,42.06,40.84,42.0,6068731.0,0.06,1.0,0.1,941.67,1.0,2449165.1,147.79,0.06,True,53.76,-0.32,-0.38,0.06,2026-02-11,41.02,2.39,0,,40.4,44.28,False,False
11-02-2026 11:00,ASUZU,63.85,64.4,63.8,64.4,115623.0,0.0,0.55,0.04,1275.0,0.55,69256.2,66.95,0.0,True,57.2,0.15,0.22,-0.06,2026-02-11,64.1,0.47,0,,63.65,64.9,False,False
11-02-2026 11:00,ALVES,4.12,4.29,4.1,4.27,96982938.0,0.02,0.15,0.03,383.87,0.15,26420894.0,267.07,0.13,True,70.44,0.02,-0.01,0.02,2026-02-11,4.0,6.75,0,,3.91,4.59,False,False
11-02-2026 11:00,BIOEN,19.54,19.82,19.47,19.75,377791.0,0.07,0.21,0.0,10400.0,0.21,227393.3,66.14,0.33,True,51.34,-0.01,0.01,-0.02,2026-02-11,19.69,0.3,0,,19.45,20.2,False,False
11-02-2026 11:00,SILVR,2.83,2.87,2.82,2.86,468422.0,0.01,0.03,0.0,1400.0,0.03,292086.3,60.37,0.33,True,53.44,-0.0,-0.0,0.0,2026-02-11,2.84,0.7,0,,2.8,2.91,False,False
11-02-2026 10:00,DZGYO,8.99,9.87,8.97,9.7,5420473.0,0.17,0.71,0.06,1026.98,0.71,769885.5,604.06,0.24,True,81.49,0.07,0.04,0.03,2026-02-11,8.99,7.9,2,8.97,8.97,ATH,False,False
11-02-2026 10:00,KRDMB,34.54,35.12,34.04,35.1,213139.0,0.02,0.56,0.1,471.43,0.56,138215.8,54.21,0.04,True,73.03,0.3,0.18,0.12,2026-02-11,34.56,1.56,0,,32.98,ATH,False,False
11-02-2026 10:00,VAKFA,14.13,14.59,14.06,14.52,20510682.0,0.07,0.39,0.03,1200.0,0.39,4706146.6,335.83,0.18,True,77.63,0.2,0.21,-0.01,2026-02-11,14.03,3.49,1,14.59,13.97,14.59,False,False
11-02-2026 10:00,PLTUR,22.8,24.52,22.58,24.04,3881235.0,0.48,1.24,0.16,656.1,1.24,600771.4,546.04,0.39,True,82.96,0.34,0.23,0.11,2026-02-11,22.78,5.53,0,,21.46,ATH,False,False
11-02-2026 10:00,TURSG,12.43,12.66,12.36,12.6,23970655.0,0.06,0.17,0.03,529.63,0.17,12013363.9,99.53,0.35,True,67.56,0.18,0.16,0.02,2026-02-11,12.45,1.2,2,12.36,12.36,12.78,False,False
11-02-2026 10:00,GLYHO,15.25,15.67,15.25,15.58,1184911.0,0.09,0.33,0.05,547.06,0.33,582083.5,103.56,0.27,True,58.69,-0.0,-0.02,0.01,2026-02-11,15.39,1.23,1,15.67,15.15,15.67,False,False
11-02-2026 10:00,AKHAN,29.98,31.46,29.58,31.46,13202929.0,0.0,1.48,0.15,900.0,1.48,3601827.9,266.56,0.0,True,100.0,1.04,0.83,0.21,2026-02-11,28.6,10.0,1,31.46,28.6,ATH,False,False
11-02-2026 10:00,JANTS,19.49,20.24,19.39,20.06,4544716.0,0.18,0.57,0.05,1017.65,0.57,616110.2,637.65,0.32,True,77.6,0.06,0.03,0.03,2026-02-11,19.49,2.92,3,,19.23,ATH,False,False
11-02-2026 10:00,TMSN,111.4,118.3,110.7,117.1,1342718.0,1.2,5.7,0.43,1225.58,5.7,186795.6,618.82,0.21,True,77.75,0.77,0.58,0.19,2026-02-11,111.4,5.12,3,,106.2,ATH,False,False
11-02-2026 10:00,KRDMD,30.04,30.56,29.82,30.48,16632720.0,0.08,0.44,0.07,494.59,0.44,5214829.3,218.95,0.18,True,61.36,0.13,0.12,0.01,2026-02-11,30.36,0.4,2,29.82,29.82,30.7,False,False
10-02-2026 17:00,IMASM,4.49,4.92,4.49,4.92,49496282.0,0.0,0.43,0.05,814.89,0.43,8163192.6,506.33,0.0,True,81.92,0.05,0.02,0.03,2026-02-10,4.48,9.82,0,,4.42,ATH,False,False
10-02-2026 17:00,RUBNS,32.76,35.0,32.7,34.78,4173742.0,0.22,2.02,0.24,734.71,2.02,1113028.9,274.99,0.11,True,73.67,1.04,0.82,0.21,2026-02-10,32.12,8.28,0,,28.18,ATH,False,False
10-02-2026 17:00,SAYAS,43.46,45.98,43.42,45.98,1526381.0,0.0,2.52,0.4,533.17,2.52,343749.7,344.04,0.0,True,86.24,0.81,0.49,0.33,2026-02-10,41.8,10.0,0,,39.74,ATH,False,False
10-02-2026 16:00,ENSRI,28.04,29.28,28.04,29.18,1584768.0,0.1,1.14,0.16,621.52,1.14,503791.1,214.57,0.09,True,76.58,0.42,0.36,0.06,2026-02-10,27.5,6.11,0,,26.3,ATH,False,False
10-02-2026 15:00,SURGY,52.85,53.95,52.6,53.85,806512.0,0.1,1.0,0.15,566.67,1.0,298952.9,169.78,0.1,True,69.41,0.2,0.02,0.18,2026-02-10,51.95,3.66,0,,50.55,55.2,False,False
10-02-2026 14:00,BUCIM,6.98,7.07,6.98,7.07,4954171.0,0.0,0.09,0.02,309.09,0.09,1886303.0,162.64,0.0,True,79.49,0.04,0.02,0.03,2026-02-10,6.85,3.21,0,,6.72,ATH,False,False
10-02-2026 14:00,ATAKP,57.2,57.95,57.2,57.9,151351.0,0.05,0.7,0.13,418.52,0.7,59987.4,152.3,0.07,True,61.28,0.12,-0.03,0.15,2026-02-10,57.6,0.52,0,,55.25,60.4,False,False
10-02-2026 14:00,KTLEV,39.08,40.08,39.02,40.04,11749321.0,0.04,0.96,0.24,306.78,0.96,4907245.5,139.43,0.04,True,80.72,0.68,0.44,0.24,2026-02-10,37.66,6.32,0,,34.68,ATH,False,False
10-02-2026 12:00,KZGYO,26.3,26.58,26.3,26.58,214544.0,0.0,0.28,0.07,288.89,0.28,111651.4,92.16,0.0,True,69.64,0.07,-0.03,0.1,2026-02-10,25.9,2.63,0,,25.4,26.88,False,False
10-02-2026 12:00,ONRYT,69.65,71.55,69.6,71.1,373339.0,0.45,1.45,0.28,408.77,1.45,91461.7,308.19,0.31,True,77.37,0.45,0.22,0.23,2026-02-10,68.75,3.42,0,,66.75,ATH,False,False
10-02-2026 12:00,KLSER,28.76,29.1,28.72,29.04,481325.0,0.06,0.28,0.04,636.84,0.28,172229.1,179.47,0.21,True,71.4,0.14,0.1,0.03,2026-02-10,28.68,1.26,0,,28.06,29.36,False,False
10-02-2026 11:00,ARFYE,31.02,32.84,31.0,32.78,12408302.0,0.06,1.76,0.34,417.65,1.76,4409519.9,181.4,0.03,True,80.68,0.7,0.4,0.3,2026-02-10,31.3,4.73,0,,28.28,ATH,False,False
10-02-2026 11:00,AKGRT,8.47,8.61,8.44,8.61,4186352.0,0.0,0.14,0.01,900.0,0.14,1472125.1,184.37,0.0,True,67.83,0.04,0.02,0.02,2026-02-10,8.38,2.74,0,,7.86,ATH,False,False
10-02-2026 11:00,SAMAT,5.96,6.06,5.94,6.05,512325.0,0.01,0.09,0.02,328.57,0.09,209855.3,144.13,0.11,True,74.42,0.06,0.04,0.02,2026-02-10,5.92,2.2,0,,5.69,ATH,False,False
10-02-2026 11:00,GMTAS,27.14,27.62,26.96,27.52,982450.0,0.1,0.38,0.04,955.56,0.38,392171.7,150.52,0.26,True,73.4,0.46,0.38,0.08,2026-02-10,27.0,1.93,1,27.62,24.42,27.62,False,False
10-02-2026 11:00,CUSAN,30.3,31.68,30.2,31.48,315068.0,0.2,1.18,0.02,5800.0,1.18,207506.8,51.84,0.17,True,61.21,0.42,0.43,-0.01,2026-02-10,31.14,1.09,0,,27.8,32.3,False,False
10-02-2026 11:00,FZLGY,12.38,12.8,12.38,12.69,2924315.0,0.11,0.31,0.03,839.39,0.31,724120.3,303.84,0.35,True,68.09,0.09,0.04,0.04,2026-02-10,12.52,1.36,0,,12.0,ATH,False,False
10-02-2026 11:00,LINK,240.5,243.4,239.1,243.0,237843.0,0.4,2.5,0.4,525.0,2.5,117653.2,102.16,0.16,True,64.84,2.11,2.03,0.08,2026-02-10,240.0,1.25,0,,231.8,244.5,False,False
10-02-2026 10:00,KLYPV,64.85,69.9,64.5,69.0,3770103.0,0.9,4.15,0.29,1331.03,4.15,680602.9,453.94,0.22,True,65.51,-0.45,-0.69,0.24,2026-02-10,64.6,6.81,3,,64.5,74.9,True,True
10-02-2026 10:00,ENERY,9.54,9.75,9.51,9.73,4586308.0,0.02,0.19,0.02,850.0,0.19,1351469.2,239.36,0.11,True,61.92,-0.02,-0.06,0.03,2026-02-10,9.53,2.1,0,,9.33,10.24,True,False
10-02-2026 10:00,BIGEN,10.12,10.48,10.05,10.42,7644747.0,0.06,0.3,0.07,310.96,0.3,2040271.3,274.69,0.2,True,80.34,0.13,0.06,0.07,2026-02-10,10.11,3.07,0,,9.43,ATH,False,False
10-02-2026 10:00,GENIL,8.39,9.11,8.35,9.0,40302484.0,0.11,0.61,0.08,672.15,0.61,7982467.23,404.89,0.18,True,83.11,0.14,0.08,0.05,2026-02-10,8.33,8.0,0,,7.77,ATH,False,False
10-02-2026 10:00,AKSEN,68.3,69.75,67.95,69.7,1544403.0,0.05,1.4,0.05,2700.0,1.4,566452.8,172.64,0.04,True,51.83,-0.56,-0.81,0.25,2026-02-10,68.3,2.05,2,67.95,67.95,70.05,True,False
10-02-2026 10:00,ALKLC,248.2,259.5,248.2,259.0,340389.0,0.5,10.8,0.94,1055.08,10.8,112378.1,202.9,0.05,True,60.53,-2.39,-3.01,0.63,2026-02-10,248.0,4.44,0,,245.5,282.5,True,True
09-02-2026 17:00,HDFGS,3.28,3.45,3.28,3.45,59867957.0,0.0,0.17,0.03,431.25,0.17,13893804.9,330.9,0.0,True,73.91,0.02,0.0,0.02,2026-02-09,3.14,9.87,0,,3.11,ATH,False,False
09-02-2026 17:00,ESCAR,27.26,28.0,27.24,28.0,1781065.0,0.0,0.74,0.05,1380.0,0.74,587131.3,203.35,0.0,True,66.55,0.11,0.07,0.04,2026-02-09,27.6,1.45,1,28.0,26.2,ATH,False,False
09-02-2026 17:00,AKFYE,19.14,19.36,19.14,19.33,1379400.0,0.03,0.19,0.02,955.56,0.19,734357.8,87.84,0.16,True,40.72,-0.32,-0.38,0.06,2026-02-09,19.03,1.58,0,,18.8,21.84,True,False
09-02-2026 17:00,AHGAZ,25.22,25.62,25.18,25.52,827067.0,0.1,0.3,0.04,733.33,0.3,407843.1,102.79,0.33,True,60.04,0.0,-0.09,0.09,2026-02-09,25.16,1.43,0,,24.28,ATH,False,False
09-02-2026 17:00,DYOBY,14.12,14.22,14.09,14.2,315054.0,0.02,0.08,0.02,247.83,0.08,181823.2,73.27,0.25,True,57.63,-0.01,-0.04,0.02,2026-02-09,13.88,2.31,0,,13.72,14.99,True,False
09-02-2026 17:00,BIGCH,11.01,11.38,10.92,11.3,2114585.0,0.08,0.29,0.04,590.48,0.29,746198.0,183.38,0.28,True,63.02,0.07,0.05,0.01,2026-02-09,10.98,2.91,0,,ATL,ATH,False,False
09-02-2026 17:00,ALKIM,19.3,19.68,19.24,19.65,1027758.0,0.03,0.35,0.05,548.15,0.35,252276.4,307.39,0.09,True,73.6,0.04,-0.03,0.07,2026-02-09,18.9,3.97,0,,18.72,19.92,False,False
09-02-2026 17:00,PRZMA,11.66,11.97,11.66,11.89,243584.0,0.08,0.23,0.03,576.47,0.23,88029.7,176.71,0.35,True,55.34,-0.03,-0.11,0.07,2026-02-09,11.64,2.15,1,11.97,10.8,11.97,False,False
09-02-2026 16:00,KBORU,18.11,18.89,18.05,18.72,3305522.0,0.17,0.61,0.11,470.09,0.61,1690020.9,95.59,0.28,True,68.68,0.15,0.09,0.06,2026-02-09,17.76,5.41,0,,17.4,19.32,False,False
09-02-2026 14:00,ALTNY,15.75,15.97,15.74,15.92,4501521.0,0.05,0.17,0.02,709.52,0.17,1748015.5,157.52,0.29,True,64.44,0.01,-0.02,0.03,2026-02-09,15.64,1.79,0,,15.51,15.98,False,False
09-02-2026 13:00,BINBN,186.9,203.0,186.2,202.6,577184.0,0.4,15.7,0.95,1552.63,15.7,124981.6,361.82,0.03,True,72.78,1.16,1.07,0.09,2026-02-09,188.8,7.31,0,,186.0,203.6,False,False
09-02-2026 13:00,BINHO,10.06,10.73,10.01,10.73,48901603.0,0.0,0.67,0.07,830.56,0.67,12819518.2,281.46,0.0,True,90.48,0.33,0.25,0.08,2026-02-09,9.76,9.94,0,,8.76,ATH,False,False
09-02-2026 11:00,ATLAS,8.86,9.95,8.85,9.89,1139680.0,0.06,1.03,0.1,909.8,1.03,363477.5,213.55,0.06,True,60.15,-0.14,-0.18,0.03,2026-02-09,9.07,9.04,0,,8.5,10.93,True,True
09-02-2026 10:00,TNZTP,24.68,26.5,24.62,26.28,3505969.0,0.22,1.6,0.09,1639.13,1.6,741285.1,372.96,0.14,True,62.37,-0.29,-0.43,0.14,2026-02-09,24.58,6.92,1,26.5,24.18,26.5,True,True
09-02-2026 10:00,IHGZT,1.55,1.57,1.55,1.57,3394077.0,0.0,0.02,0.0,400.0,0.02,1119146.6,203.27,0.0,True,54.74,-0.01,-0.01,0.0,2026-02-09,1.54,1.95,0,,1.53,1.63,True,False
09-02-2026 10:00,MAKIM,16.42,17.04,16.42,16.88,421269.0,0.16,0.46,0.05,820.0,0.46,101079.7,316.77,0.35,True,61.74,-0.02,-0.05,0.03,2026-02-09,16.4,2.93,1,17.04,16.19,17.04,False,False
09-02-2026 10:00,HATSN,41.5,42.44,41.02,42.22,2340707.0,0.22,0.72,0.09,682.61,0.72,386489.1,505.63,0.31,True,35.42,-0.41,-0.02,-0.39,2026-02-09,44.52,-5.17,2,41.02,41.02,48.36,False,False
09-02-2026 10:00,GSRAY,1.17,1.2,1.17,1.2,90896122.0,0.0,0.03,0.01,500.0,0.03,16917043.9,437.3,0.0,True,64.28,-0.0,-0.0,0.0,2026-02-09,1.16,3.45,0,,1.16,ATH,False,False
09-02-2026 10:00,BRSAN,691.0,728.5,684.5,718.0,948628.0,10.5,27.0,3.45,682.61,27.0,248862.0,281.19,0.39,True,83.16,10.09,5.95,4.14,2026-02-09,680.0,5.59,0,,647.5,ATH,False,False
09-02-2026 10:00,PETKM,17.92,18.42,17.91,18.41,33372090.0,0.01,0.49,0.05,824.53,0.49,7612817.1,338.37,0.02,True,68.9,-0.06,-0.13,0.06,2026-02-09,17.71,3.95,0,,17.41,18.56,True,False
09-02-2026 10:00,BIMAS,690.0,701.0,688.5,700.5,1851957.0,0.5,10.5,1.0,950.0,10.5,554989.8,233.69,0.05,True,68.89,0.96,-0.69,1.65,2026-02-09,683.0,2.56,0,,674.0,ATH,False,False
09-02-2026 10:00,ADEL,35.48,37.48,35.24,36.94,1663414.0,0.54,1.46,0.27,448.87,1.46,585793.4,183.96,0.37,True,81.09,0.36,0.14,0.22,2026-02-09,35.08,5.3,0,,33.9,ATH,False,False
09-02-2026 10:00,AHSGY,24.3,25.02,24.3,24.92,163545.0,0.1,0.62,0.07,761.11,0.62,86889.5,88.22,0.16,True,60.73,0.07,0.09,-0.01,2026-02-09,24.2,2.98,0,,24.02,25.32,False,False
06-02-2026 17:00,YAYLA,27.84,28.9,27.76,28.9,149101.0,0.0,1.06,0.06,1666.67,1.06,77898.6,91.4,0.0,True,60.96,-0.17,-0.19,0.02,2026-02-06,28.06,2.99,1,28.9,28.46,29.76,False,False
06-02-2026 17:00,EMKEL,20.82,22.04,20.76,22.04,9242499.0,0.0,1.22,0.2,513.07,1.22,3030555.5,204.98,0.0,True,80.78,0.09,-0.08,0.17,2026-02-06,20.04,9.98,0,,19.49,ATH,False,False
06-02-2026 17:00,AKCNS,192.8,195.7,192.7,195.6,187805.0,0.1,2.8,0.11,2445.45,2.8,79044.0,137.6,0.04,True,57.6,0.26,0.28,-0.02,2026-02-06,194.7,0.46,0,,191.0,197.3,False,False
06-02-2026 17:00,INFO,4.12,4.18,4.1,4.17,5189719.0,0.01,0.05,0.0,4900.0,0.05,2464408.3,110.59,0.2,True,40.47,-0.05,-0.05,0.0,2026-02-06,4.15,0.48,2,4.1,4.1,4.48,True,True
06-02-2026 17:00,ULUUN,7.18,7.34,7.18,7.33,889331.0,0.01,0.15,0.01,1400.0,0.15,417940.5,112.79,0.07,True,54.46,-0.04,-0.04,0.0,2026-02-06,7.26,0.96,0,,7.1,7.5,True,True
06-02-2026 14:00,TATEN,10.25,10.54,10.2,10.5,3652561.0,0.04,0.25,0.02,1462.5,0.25,1334869.9,173.63,0.16,True,50.99,-0.11,-0.14,0.02,2026-02-06,10.16,3.35,0,,10.08,ATH,True,True
06-02-2026 13:00,IZFAS,55.5,56.15,55.4,56.05,755011.0,0.1,0.55,0.09,547.06,0.55,457059.6,65.19,0.18,True,63.67,0.05,0.02,0.04,2026-02-06,55.4,1.17,0,,54.75,ATH,False,False
06-02-2026 11:00,HUBVC,3.38,3.64,3.37,3.58,1766549.0,0.06,0.2,0.02,852.38,0.2,533879.4,230.89,0.3,True,65.72,-0.02,-0.03,0.01,2026-02-06,3.32,7.83,0,,3.29,ATH,False,False
06-02-2026 11:00,KONKA,15.35,15.5,15.32,15.49,386765.0,0.01,0.14,0.0,4566.67,0.14,229733.1,68.35,0.07,True,53.55,-0.02,-0.02,-0.0,2026-02-06,15.42,0.45,0,,15.19,15.8,False,False
06-02-2026 10:00,PNSUT,12.58,13.5,12.5,13.28,3936183.0,0.22,0.7,0.04,1566.67,0.7,764201.4,415.07,0.31,True,53.66,-0.15,-0.17,0.02,2026-02-06,12.64,5.06,3,,13.01,ATH,False,False
05-02-2026 17:00,EDATA,9.05,9.28,9.04,9.28,2702796.0,0.0,0.23,0.02,1252.94,0.23,1042824.4,159.18,0.0,True,56.0,0.01,0.01,0.0,2026-02-05,9.2,0.87,0,,9.01,9.39,False,False
05-02-2026 16:00,HKTM,12.2,13.6,12.16,13.6,4939043.0,0.0,1.4,0.14,892.91,1.4,841942.7,486.62,0.0,True,85.25,0.14,0.08,0.06,2026-02-05,12.37,9.94,0,,ATL,ATH,False,False
05-02-2026 12:00,PETUN,13.0,13.24,13.0,13.2,408387.0,0.04,0.2,0.03,566.67,0.2,227920.4,79.18,0.2,True,60.2,0.01,-0.01,0.02,2026-02-05,13.06,1.07,0,,ATL,ATH,False,False
05-02-2026 12:00,MHRGY,3.68,3.93,3.67,3.9,6598056.0,0.03,0.22,0.03,714.81,0.22,1535195.1,329.79,0.14,True,82.68,0.04,0.02,0.02,2026-02-05,3.6,8.33,1,3.93,ATL,3.93,False,False
05-02-2026 11:00,SUNTK,40.54,41.46,40.48,41.34,277530.0,0.12,0.8,0.07,1112.12,0.8,119860.4,131.54,0.15,True,63.57,-0.03,-0.06,0.03,2026-02-05,40.46,2.17,0,,40.08,ATH,False,False
05-02-2026 10:00,MEGMT,67.45,69.4,66.65,68.85,4786820.0,0.55,1.4,0.02,6900.0,1.4,1914533.7,150.03,0.39,True,68.78,0.23,0.08,0.15,2026-02-05,67.5,2.0,0,,65.5,69.05,False,False
04-02-2026 17:00,BEGYO,4.84,4.86,4.82,4.86,1438424.0,0.0,0.02,0.0,1900.0,0.02,913348.4,57.49,0.0,True,58.42,0.01,0.01,-0.0,2026-02-04,4.86,0.0,0,,ATL,ATH,False,False
04-02-2026 17:00,DITAS,52.5,55.4,52.5,54.9,1059232.0,0.5,2.4,0.17,1271.43,2.4,371170.9,185.38,0.21,True,69.02,0.28,0.16,0.12,2026-02-04,52.7,4.17,0,,50.8,ATH,False,False
04-02-2026 12:00,OZSUB,20.24,20.84,20.16,20.74,897357.0,0.1,0.5,0.04,1150.0,0.5,497549.8,80.36,0.2,True,75.99,0.08,0.04,0.04,2026-02-04,20.0,3.7,0,,ATL,ATH,False,False
04-02-2026 11:00,AFYON,14.62,14.91,14.62,14.84,1202542.0,0.07,0.22,0.02,1000.0,0.22,302137.8,298.01,0.32,True,68.38,0.01,0.01,0.01,2026-02-04,14.71,0.88,3,,14.62,ATH,False,False
04-02-2026 10:00,MGROS,660.0,667.0,657.0,666.0,1164150.0,1.0,6.0,0.05,11900.0,6.0,547692.3,112.56,0.17,True,75.78,1.76,0.93,0.83,2026-02-04,654.0,1.83,0,,ATL,ATH,False,False
04-02-2026 10:00,TUCLK,5.98,6.28,5.72,6.28,33738256.0,0.0,0.3,0.05,445.45,0.3,7287758.2,362.94,0.0,True,93.52,0.07,0.04,0.03,2026-02-04,5.8,8.28,1,6.28,ATL,ATH,False,False
04-02-2026 10:00,ENJSA,108.9,112.6,108.8,112.5,1248090.0,0.1,3.6,0.37,872.97,3.6,261505.5,377.27,0.03,True,92.97,0.46,0.18,0.27,2026-02-04,107.1,5.04,1,112.6,ATL,112.6,False,False
04-02-2026 10:00,PRKAB,55.4,58.0,55.05,58.0,4968684.0,0.0,2.6,0.26,900.0,2.6,542026.7,816.69,0.0,True,100.0,0.57,0.29,0.28,2026-02-04,52.75,9.95,1,58.0,ATL,ATH,False,False
04-02-2026 10:00,ALKA,13.1,13.6,13.08,13.55,5520844.0,0.05,0.45,0.05,900.0,0.45,1111258.4,396.81,0.11,True,82.64,0.02,0.0,0.02,2026-02-04,13.05,3.83,0,,ATL,ATH,False,False
03-02-2026 17:00,EGEPO,10.49,10.95,10.45,10.87,1321523.0,0.08,0.38,0.03,985.71,0.38,315747.0,318.54,0.21,True,78.03,0.02,0.01,0.01,2026-02-03,10.52,3.33,0,,ATL,ATH,False,False
