Tarih,Hisse,open,high,low,close,volume,YuksekKapanis_Fark,AcilisKapanis_Fark,AcilisKapanisFark_Ort,AcilisKapanisFark_OrtalamayaGoreDegisim,AcilisKapanisFarkOrt_MaxSon10,HacimOrtalama,%Hacim_HacimOrtalama,Fark_Orani,Kosul,rsi,MACD_12_26_9,MACDs_12_26_9,MACDh_12_26_9,Tarih1,prev_close,%Deg,isPivot,pointpos,destek,direnc,Tsinyal_Banker_Dip,Tsinyal_Banker_DipKarar
06-01-2026 15:00,ZOREN,3.1,3.14,3.09,3.13,14925446.0,0.01,0.03,0.01,328.57,0.03,4325017.6,245.1,0.33,True,61.78,0.01,0.01,0.0,2026-01-06,3.09,1.29,0,,3.07,3.14,False,False
06-01-2026 14:00,IEYHO,68.45,69.65,68.35,69.6,4219264.0,0.05,1.15,0.16,596.97,1.15,2591483.4,62.81,0.04,True,71.57,0.51,0.44,0.07,2026-01-06,67.75,2.73,0,,63.25,ATH,False,False
06-01-2026 14:00,MTRYO,8.54,8.75,8.54,8.75,66054.0,0.0,0.21,0.01,2000.0,0.21,37448.8,76.38,0.0,True,57.46,-0.01,-0.01,0.0,2026-01-06,8.65,1.16,0,,8.58,8.8,False,False
06-01-2026 14:00,OBAMS,8.14,8.29,8.12,8.27,5300190.0,0.02,0.13,0.01,1344.44,0.13,2427006.0,118.38,0.15,True,63.32,0.07,0.08,-0.01,2026-01-06,8.15,1.47,0,,7.27,8.38,False,False
06-01-2026 14:00,PRDGS,6.21,6.37,6.19,6.36,1117081.0,0.01,0.15,0.0,3650.0,0.15,525587.3,112.54,0.07,True,62.07,0.01,0.01,-0.0,2026-01-06,6.14,3.58,0,,6.13,6.53,False,False
06-01-2026 14:00,SAFKR,22.08,23.56,22.06,23.16,2424485.0,0.4,1.08,0.01,17900.0,1.08,649585.7,273.24,0.37,True,54.81,-0.32,-0.38,0.05,2026-01-06,22.3,3.86,0,,22.54,23.28,True,True
06-01-2026 14:00,BULGS,44.18,45.32,44.16,45.16,2111904.0,0.16,0.98,0.03,3166.67,0.98,644328.4,227.77,0.16,True,65.48,0.17,0.18,-0.01,2026-01-06,44.42,1.67,0,,43.78,45.34,False,False
06-01-2026 14:00,TCKRC,63.0,67.0,62.95,66.8,1664908.0,0.2,3.8,0.56,578.57,3.8,429984.4,287.2,0.05,True,80.89,1.34,1.14,0.2,2026-01-06,62.2,7.4,0,,52.55,ATH,False,False
06-01-2026 13:00,ASELS,240.7,245.9,240.1,244.8,6801235.0,1.1,4.1,0.47,772.34,4.1,3508440.3,93.85,0.27,True,73.84,3.05,2.81,0.24,2026-01-06,240.0,2.0,0,,228.5,ATH,False,False
06-01-2026 13:00,KTSKR,70.5,71.3,70.4,71.2,156269.0,0.1,0.7,0.06,1066.67,0.7,82399.6,89.65,0.14,True,36.46,-1.13,-1.38,0.25,2026-01-06,70.55,0.92,0,,70.05,77.35,True,True
06-01-2026 13:00,MERIT,17.86,18.25,17.86,18.22,1018278.0,0.03,0.36,0.07,445.45,0.36,526946.2,93.24,0.08,True,69.57,0.07,0.02,0.05,2026-01-06,17.68,3.05,0,,17.4,ATH,False,False
06-01-2026 13:00,HEDEF,44.3,46.4,44.3,46.4,1692500.0,0.0,2.1,0.32,556.25,2.1,569377.0,197.25,0.0,True,71.33,0.56,0.17,0.38,2026-01-06,42.88,8.21,0,,38.16,51.8,False,False
06-01-2026 13:00,HDFGS,3.32,3.47,3.31,3.45,28396045.0,0.02,0.13,0.0,12900.0,0.13,18886103.6,50.35,0.15,True,61.26,0.05,0.07,-0.03,2026-01-06,3.38,2.07,0,,2.8,3.67,False,False
06-01-2026 13:00,TRILC,16.28,16.5,16.26,16.49,689935.0,0.01,0.21,0.01,4100.0,0.21,271741.2,153.89,0.05,True,69.03,0.07,0.06,0.01,2026-01-06,16.29,1.23,0,,15.97,16.58,False,False
06-01-2026 13:00,TRMET,108.8,111.7,108.6,111.0,1386003.0,0.7,2.2,0.12,1733.33,2.2,636619.9,117.71,0.32,True,63.45,0.77,0.73,0.03,2026-01-06,109.8,1.09,0,,103.3,113.7,False,False
06-01-2026 13:00,EDATA,7.18,7.52,7.18,7.52,15212984.0,0.0,0.34,0.06,457.38,0.34,4927735.6,208.72,0.0,True,74.26,0.26,0.22,0.04,2026-01-06,6.84,9.94,0,,5.81,ATH,False,False
06-01-2026 13:00,AFYON,13.24,13.39,13.23,13.36,432020.0,0.03,0.12,0.02,380.0,0.12,225724.0,91.39,0.25,True,75.23,0.06,0.05,0.01,2026-01-06,13.23,0.98,0,,13.07,ATH,False,False
06-01-2026 13:00,AKSA,10.11,10.18,10.11,10.18,2028539.0,0.0,0.07,0.01,775.0,0.07,1192126.0,70.16,0.0,True,64.56,0.04,0.04,-0.0,2026-01-06,10.13,0.49,0,,9.82,ATH,False,False
06-01-2026 12:00,MAVI,42.24,43.02,42.22,42.98,3154129.0,0.04,0.74,0.12,506.56,0.74,1380331.3,128.51,0.05,True,61.96,-0.09,-0.17,0.08,2026-01-06,41.88,2.63,0,,41.2,44.08,False,False
06-01-2026 12:00,PINSU,11.17,11.29,11.16,11.27,730815.0,0.02,0.1,0.01,1150.0,0.1,365286.4,100.07,0.2,True,46.05,-0.08,-0.11,0.03,2026-01-06,11.19,0.71,0,,11.0,11.32,True,False
06-01-2026 12:00,AVOD,3.59,3.66,3.59,3.64,1558044.0,0.02,0.05,0.01,900.0,0.05,780389.0,99.65,0.4,True,57.35,-0.01,-0.01,0.0,2026-01-06,3.56,2.25,0,,3.53,3.78,True,True
06-01-2026 12:00,BORLS,4.17,4.29,4.16,4.26,10251548.0,0.03,0.09,0.02,350.0,0.09,3168572.3,223.54,0.33,True,73.94,0.04,0.02,0.02,2026-01-06,4.08,4.41,0,,4.0,4.54,False,False
06-01-2026 12:00,DARDL,2.26,2.3,2.25,2.29,16008720.0,0.01,0.03,0.01,500.0,0.03,6482330.3,146.96,0.33,True,66.58,0.02,0.02,0.0,2026-01-06,2.25,1.78,0,,2.17,ATH,False,False
06-01-2026 12:00,DURDO,3.67,3.82,3.66,3.79,3255412.0,0.03,0.12,0.02,605.88,0.12,934738.7,248.27,0.25,True,74.81,0.01,-0.0,0.01,2026-01-06,3.64,4.12,0,,3.6,3.93,False,False
06-01-2026 11:00,NATEN,8.69,8.89,8.68,8.85,2035641.0,0.04,0.16,0.01,1500.0,0.16,702519.6,189.76,0.25,True,56.91,0.02,0.04,-0.02,2026-01-06,8.74,1.26,0,,8.62,9.11,False,False
06-01-2026 11:00,ISMEN,41.52,42.06,41.5,41.92,1540245.0,0.14,0.4,0.1,308.16,0.4,967984.6,59.12,0.35,True,78.75,0.39,0.3,0.09,2026-01-06,41.38,1.3,0,,39.62,ATH,False,False
06-01-2026 11:00,ANHYT,96.85,98.2,96.8,98.1,361243.0,0.1,1.25,0.14,825.93,1.25,199116.2,81.42,0.08,True,54.21,-0.66,-0.88,0.22,2026-01-06,95.9,2.29,0,,95.0,100.7,False,False
06-01-2026 11:00,KATMR,2.93,3.01,2.92,3.01,18029856.0,0.0,0.08,0.01,1042.86,0.08,11858627.3,52.04,0.0,True,71.11,0.04,0.03,0.01,2026-01-06,2.94,2.38,0,,2.79,ATH,False,False
06-01-2026 11:00,BRKVY,98.9,103.5,98.8,103.5,397128.0,0.0,4.6,0.21,2039.53,4.6,123867.2,220.61,0.0,True,57.66,-0.73,-1.09,0.36,2026-01-06,100.3,3.19,0,,98.2,104.9,True,True
06-01-2026 11:00,ADEL,34.92,36.6,34.88,36.56,1581450.0,0.04,1.64,0.13,1201.59,1.64,404529.9,290.94,0.02,True,75.66,0.61,0.53,0.08,2026-01-06,35.06,4.28,0,,32.54,ATH,False,False
06-01-2026 11:00,ENJSA,92.95,93.35,92.75,93.25,351954.0,0.1,0.3,0.13,130.77,0.3,214224.6,64.29,0.33,True,70.18,0.76,0.72,0.04,2026-01-06,92.75,0.54,0,,88.55,ATH,False,False
06-01-2026 11:00,KLSYN,7.12,7.18,7.12,7.18,765426.0,0.0,0.06,0.01,400.0,0.06,445335.6,71.88,0.0,True,60.25,0.03,0.03,-0.0,2026-01-06,7.14,0.56,0,,7.01,7.38,False,False
06-01-2026 10:00,TCELL,96.95,98.2,96.85,98.0,5818702.0,0.2,1.05,0.2,412.2,1.05,3025796.5,92.3,0.19,True,75.07,0.74,0.58,0.16,2026-01-06,96.8,1.24,0,,92.85,99.4,False,False
06-01-2026 10:00,MOBTL,9.11,9.35,9.1,9.32,2271418.0,0.03,0.21,0.02,1212.5,0.21,805759.5,181.9,0.14,True,65.11,0.08,0.09,-0.01,2026-01-06,9.11,2.31,0,,8.68,9.33,False,False
06-01-2026 10:00,ISDMR,36.02,36.28,35.94,36.24,376945.0,0.04,0.22,0.04,450.0,0.22,169462.6,122.44,0.18,True,81.36,0.19,0.15,0.04,2026-01-06,35.88,1.0,0,,35.08,ATH,False,False
06-01-2026 10:00,BSOKE,16.17,16.9,16.15,16.81,5717084.0,0.09,0.64,0.07,827.54,0.64,1197007.8,377.61,0.14,True,69.85,-0.01,-0.06,0.05,2026-01-06,16.15,4.09,0,,15.9,18.57,False,False
06-01-2026 10:00,EREGL,24.56,24.88,24.56,24.86,45740684.0,0.02,0.3,0.03,900.0,0.3,13990586.0,226.94,0.07,True,76.59,0.16,0.14,0.02,2026-01-06,24.52,1.39,0,,23.76,ATH,False,False
06-01-2026 10:00,AKENR,11.3,11.47,11.29,11.43,1860070.0,0.04,0.13,0.02,550.0,0.13,842989.1,120.65,0.31,True,59.22,-0.01,-0.03,0.02,2026-01-06,11.31,1.06,0,,11.19,11.51,False,False
06-01-2026 10:00,BOSSA,6.36,6.4,6.34,6.39,293048.0,0.01,0.03,0.0,650.0,0.03,184504.5,58.83,0.33,True,56.75,0.01,0.01,-0.0,2026-01-06,6.37,0.31,0,,6.33,6.45,False,False
06-01-2026 10:00,ISKPL,11.35,11.77,11.3,11.67,5146797.0,0.1,0.32,0.0,31900.0,0.32,1965507.5,161.86,0.31,True,58.3,-0.08,-0.14,0.06,2026-01-06,11.33,3.0,0,,10.95,11.7,False,False
06-01-2026 10:00,KZBGY,10.87,11.75,10.87,11.52,7170676.0,0.23,0.65,0.07,815.49,0.65,1312690.5,446.26,0.35,True,73.6,0.06,0.04,0.02,2026-01-06,10.81,6.57,0,,10.66,ATH,False,False
06-01-2026 10:00,CONSE,3.02,3.07,3.02,3.06,796404.0,0.01,0.04,0.01,566.67,0.04,489704.6,62.63,0.25,True,71.05,0.02,0.02,-0.0,2026-01-06,3.03,0.99,0,,2.92,ATH,False,False
06-01-2026 10:00,NIBAS,3.65,3.74,3.65,3.73,1626880.0,0.01,0.08,0.01,700.0,0.08,512553.8,217.41,0.13,True,66.65,0.01,0.0,0.0,2026-01-06,3.63,2.75,0,,3.53,3.75,False,False
06-01-2026 10:00,DMLKT,5.8,5.81,5.8,5.81,2762428.0,0.0,0.01,0.0,900.0,0.01,1327771.4,108.05,0.0,True,48.92,-0.0,-0.01,0.0,2026-01-06,5.8,0.17,0,,5.79,5.84,False,False
06-01-2026 10:00,SISE,39.62,40.02,39.48,40.0,8722768.0,0.02,0.38,0.08,400.0,0.38,3330865.1,161.88,0.05,True,74.97,0.24,0.19,0.05,2026-01-06,39.48,1.32,0,,38.26,40.28,False,False
06-01-2026 10:00,YKBNK,38.26,38.62,37.92,38.56,61641208.0,0.06,0.3,0.07,316.67,0.3,19569403.7,214.99,0.2,True,73.98,0.48,0.5,-0.02,2026-01-06,38.24,0.84,0,,35.2,38.6,False,False
06-01-2026 10:00,HALKB,40.2,43.36,39.7,43.1,66628722.0,0.26,2.9,0.38,659.16,2.9,12865497.5,417.89,0.09,True,91.34,0.93,0.64,0.29,2026-01-06,40.0,7.75,0,,36.76,ATH,False,False
06-01-2026 10:00,SEGMN,18.7,18.84,18.65,18.84,392788.0,0.0,0.14,0.02,775.0,0.14,136875.5,186.97,0.0,True,66.24,0.03,0.02,0.02,2026-01-06,18.66,0.96,0,,18.49,18.91,False,False
06-01-2026 10:00,FROTO,96.3,97.35,96.0,97.05,3683786.0,0.3,0.75,0.2,265.85,0.75,1745666.4,111.02,0.4,True,74.62,0.81,0.74,0.07,2026-01-06,96.2,0.88,0,,90.75,ATH,False,False
06-01-2026 10:00,SARKY,20.14,21.5,19.87,21.34,8145441.0,0.16,1.2,0.18,562.98,1.2,2134567.2,281.6,0.13,True,84.64,0.58,0.4,0.18,2026-01-06,19.72,8.22,0,,18.28,ATH,False,False
06-01-2026 10:00,PETKM,16.73,16.82,16.7,16.81,11660909.0,0.01,0.08,0.02,280.95,0.08,4245317.4,174.68,0.13,True,76.1,0.09,0.08,0.01,2026-01-06,16.71,0.6,0,,16.21,ATH,False,False
06-01-2026 10:00,AKBNK,73.35,74.65,72.75,74.55,28690671.0,0.1,1.2,0.16,650.0,1.2,9359063.4,206.55,0.08,True,73.59,0.77,0.78,-0.01,2026-01-06,73.2,1.84,0,,69.7,ATH,False,False
06-01-2026 10:00,XU100,11743.81,11831.76,11732.4,11830.5,1345409844.0,1.26,86.69,25.64,238.13,86.69,604128615.9,122.7,0.01,True,89.52,115.41,100.63,14.79,2026-01-06,11702.0,1.1,0,,11102.18,ATH,False,False
06-01-2026 10:00,PGSUS,199.1,203.7,199.0,203.5,8338698.0,0.2,4.4,0.76,478.95,4.4,2214797.2,276.5,0.05,True,84.15,1.37,0.64,0.72,2026-01-06,198.6,2.47,0,,191.7,208.3,False,False
06-01-2026 10:00,AKFIS,20.54,20.68,20.54,20.64,231902.0,0.04,0.1,0.01,614.29,0.1,109421.2,111.94,0.4,True,62.36,0.02,-0.01,0.02,2026-01-06,20.5,0.68,0,,20.04,21.54,False,False
06-01-2026 10:00,ISCTR,14.42,14.6,14.34,14.58,200279194.0,0.02,0.16,0.02,966.67,0.16,59770852.9,235.08,0.12,True,77.04,0.13,0.14,-0.01,2026-01-06,14.39,1.32,0,,13.38,ATH,False,False
06-01-2026 10:00,ESCOM,3.4,3.46,3.4,3.45,4165864.0,0.01,0.05,0.01,733.33,0.05,1556371.2,167.67,0.2,True,45.56,-0.06,-0.07,0.01,2026-01-06,3.39,1.77,0,,3.35,3.95,True,True
06-01-2026 10:00,XBANK,17296.78,17557.42,17171.18,17539.56,422341375.0,17.86,242.78,38.06,537.95,242.78,118541978.7,256.28,0.07,True,79.05,188.73,189.75,-1.01,2026-01-06,17264.68,1.59,0,,16178.48,ATH,False,False
06-01-2026 10:00,KTLEV,21.38,22.32,21.36,22.1,14528216.0,0.22,0.72,0.09,682.61,0.72,4290743.7,238.59,0.31,True,72.09,0.33,0.34,-0.02,2026-01-06,21.36,3.46,0,,19.21,ATH,False,False
06-01-2026 10:00,VAKFN,1.92,1.93,1.9,1.93,16890310.0,0.0,0.01,0.0,900.0,0.01,5466679.3,208.97,0.0,True,65.63,0.01,0.01,0.0,2026-01-06,1.91,1.05,0,,1.84,1.98,False,False
06-01-2026 10:00,VAKBN,32.66,33.6,32.36,33.44,33228727.0,0.16,0.78,0.11,596.43,0.78,5585826.1,494.88,0.21,True,87.19,0.56,0.5,0.05,2026-01-06,32.68,2.33,0,,29.98,ATH,False,False
06-01-2026 10:00,TSKB,13.07,13.28,12.99,13.27,8618796.0,0.01,0.2,0.03,545.16,0.2,3104478.2,177.62,0.05,True,84.4,0.17,0.15,0.02,2026-01-06,13.07,1.53,0,,12.09,ATH,False,False
06-01-2026 10:00,THYAO,279.25,286.75,279.0,286.5,22752677.0,0.25,7.25,1.15,530.43,7.25,5307035.4,328.73,0.03,True,88.64,2.9,2.12,0.79,2026-01-06,277.75,3.15,0,,262.75,ATH,False,False
06-01-2026 10:00,KOCMT,2.54,2.6,2.53,2.6,4016990.0,0.0,0.06,0.0,1900.0,0.06,1681383.0,138.91,0.0,True,64.36,0.01,0.01,-0.0,2026-01-06,2.54,2.36,0,,2.49,2.61,False,False
06-01-2026 10:00,AKSUE,23.52,25.74,23.2,25.44,3082385.0,0.3,1.92,0.11,1677.78,1.92,519811.9,492.98,0.16,True,62.35,-0.03,-0.03,0.0,2026-01-06,23.5,8.26,0,,23.1,26.3,False,False
06-01-2026 10:00,KLRHO,371.5,388.5,371.5,385.75,803359.0,2.75,14.25,2.95,383.05,14.25,221360.5,262.92,0.19,True,83.7,14.05,10.44,3.61,2026-01-06,360.75,6.93,0,,300.25,ATH,False,False
06-01-2026 10:00,KRDMD,27.0,27.46,26.9,27.38,12856440.0,0.08,0.38,0.09,341.86,0.38,5318958.8,141.71,0.21,True,84.79,0.35,0.26,0.09,2026-01-06,26.84,2.01,0,,25.12,ATH,False,False
06-01-2026 10:00,TNZTP,23.54,25.42,23.28,25.1,3437407.0,0.32,1.56,0.13,1118.75,1.56,711177.3,383.34,0.21,True,83.58,0.72,0.64,0.07,2026-01-06,23.28,7.82,0,,20.08,ATH,False,False
06-01-2026 10:00,ULUFA,3.75,3.78,3.74,3.78,1314306.0,0.0,0.03,0.0,500.0,0.03,705984.0,86.17,0.0,True,65.45,0.02,0.02,-0.0,2026-01-06,3.75,0.8,0,,3.57,3.92,False,False
06-01-2026 10:00,YYLGD,10.01,10.12,10.01,10.09,1084968.0,0.03,0.08,0.0,1900.0,0.08,387809.1,179.77,0.37,True,74.11,0.07,0.07,0.0,2026-01-06,10.01,0.8,0,,9.47,10.1,False,False
06-01-2026 10:00,ALBRK,8.16,8.24,8.14,8.24,3156986.0,0.0,0.08,0.02,400.0,0.08,1325810.0,138.12,0.0,True,75.13,0.07,0.06,0.0,2026-01-06,8.16,0.98,0,,7.84,ATH,False,False
06-01-2026 10:00,ARCLK,106.8,108.1,106.1,108.0,722935.0,0.1,1.2,0.35,242.86,1.2,302599.6,138.91,0.08,True,78.37,1.13,0.87,0.26,2026-01-06,107.0,0.93,0,,101.0,108.4,False,False
05-01-2026 17:00,GIPTA,69.7,74.05,69.7,74.05,5051869.0,0.0,4.35,0.7,517.02,4.35,2299561.3,119.69,0.0,True,66.32,-0.35,-1.17,0.82,2026-01-05,67.35,9.95,0,,64.35,76.2,False,False
05-01-2026 17:00,YYAPI,1.86,1.89,1.86,1.89,16864578.0,0.0,0.03,0.0,650.0,0.03,9257416.9,82.17,0.0,True,52.82,-0.0,-0.01,0.0,2026-01-05,1.89,0.0,0,,1.85,1.92,False,False
05-01-2026 17:00,KRONT,14.22,15.02,14.22,14.81,2251951.0,0.21,0.59,0.1,490.0,0.59,603483.1,273.16,0.36,True,78.05,0.35,0.29,0.05,2026-01-05,13.8,7.32,0,,13.17,ATH,False,False
05-01-2026 17:00,DAPGM,13.08,14.34,12.87,14.34,40142805.0,0.0,1.26,0.12,967.8,1.26,6609214.8,507.38,0.0,True,76.7,0.23,0.11,0.13,2026-01-05,13.04,9.97,0,,12.77,ATH,False,False
05-01-2026 17:00,OFSYM,68.45,70.8,68.05,70.8,415364.0,0.0,2.35,0.3,683.33,2.35,206173.5,101.46,0.0,True,67.75,-0.23,-0.49,0.26,2026-01-05,67.65,4.66,0,,66.1,71.95,False,False
05-01-2026 17:00,ALTIN,105.64,106.24,105.64,106.24,6876076.0,0.0,0.6,0.09,581.82,0.6,4579236.7,50.16,0.0,True,78.39,2.03,1.84,0.19,2026-01-05,101.23,4.95,0,,95.22,ATH,False,False
05-01-2026 17:00,PAHOL,1.53,1.67,1.52,1.64,698443354.0,0.03,0.11,0.01,1275.0,0.11,113318712.0,516.35,0.27,True,71.83,0.0,0.0,0.0,2026-01-05,1.55,5.81,3,,1.54,ATH,False,False
05-01-2026 17:00,CIMSA,45.66,45.96,45.6,45.88,1683203.0,0.08,0.22,0.02,1122.22,0.22,1112019.0,51.36,0.36,True,62.73,0.11,0.1,0.01,2026-01-05,45.54,0.75,0,,45.4,46.5,False,False
05-01-2026 17:00,DOHOL,17.73,17.98,17.73,17.94,4044633.0,0.04,0.21,0.05,337.5,0.21,1825058.4,121.62,0.19,True,73.39,0.11,0.04,0.07,2026-01-05,17.47,2.69,0,,16.87,19.0,False,False
05-01-2026 17:00,SNICA,4.36,4.58,4.35,4.56,7404018.0,0.02,0.2,0.02,852.38,0.2,1629583.2,354.35,0.1,True,71.95,0.06,0.06,-0.0,2026-01-05,4.34,5.07,0,,4.27,ATH,False,False
05-01-2026 17:00,CCOLA,60.15,61.85,59.95,61.5,2937414.0,0.35,1.35,0.21,527.91,1.35,884801.7,231.99,0.26,True,76.0,0.45,0.25,0.2,2026-01-05,59.3,3.71,0,,57.85,ATH,False,False
05-01-2026 17:00,SUNTK,49.38,60.3,49.38,60.3,491695.0,0.0,10.92,0.92,1086.96,10.92,142533.1,244.97,0.0,True,69.2,-1.46,-1.83,0.36,2026-01-05,54.85,9.94,3,,49.38,61.45,True,True
05-01-2026 17:00,KBORU,14.21,14.74,14.16,14.72,3138092.0,0.02,0.51,0.02,1940.0,0.51,695092.0,351.46,0.04,True,64.02,-0.01,-0.01,0.0,2026-01-05,14.43,2.01,2,14.16,14.16,14.85,False,False
05-01-2026 17:00,MEKAG,3.95,4.31,3.94,4.31,21555388.0,0.0,0.36,0.04,847.37,0.36,2589032.1,732.57,0.0,True,82.97,0.04,0.01,0.03,2026-01-05,3.92,9.95,0,,3.83,ATH,False,False
05-01-2026 17:00,YIGIT,23.38,23.48,23.32,23.48,300024.0,0.0,0.1,0.01,614.29,0.1,168589.2,77.96,0.0,True,68.59,0.12,0.12,0.0,2026-01-05,23.34,0.6,0,,22.42,ATH,False,False
05-01-2026 16:00,TSPOR,1.08,1.1,1.08,1.1,60635600.0,0.0,0.02,0.0,1900.0,0.02,23923521.9,153.46,0.0,True,55.04,0.0,0.0,-0.0,2026-01-05,1.11,-0.9,2,1.08,1.08,1.11,False,False
05-01-2026 16:00,FZLGY,13.14,13.6,13.12,13.57,4249573.0,0.03,0.43,0.05,696.3,0.43,777580.2,446.51,0.07,True,80.08,0.09,0.04,0.05,2026-01-05,12.92,5.03,0,,12.85,ATH,False,False
05-01-2026 16:00,CANTE,2.09,2.2,2.08,2.19,303985553.0,0.01,0.1,0.01,733.33,0.1,60193423.4,405.01,0.1,True,82.36,0.02,0.01,0.01,2026-01-05,2.04,7.35,1,2.2,2.0,2.2,False,False
05-01-2026 16:00,ENERY,9.34,9.53,9.34,9.5,5074006.0,0.03,0.16,0.01,2566.67,0.16,1404348.8,261.31,0.19,True,58.54,-0.0,0.0,-0.01,2026-01-05,9.45,0.53,0,,9.27,9.6,False,False
05-01-2026 16:00,SERNT,7.88,8.19,7.88,8.18,3112666.0,0.01,0.3,0.02,1263.64,0.3,607531.4,412.35,0.03,True,75.16,0.03,0.01,0.02,2026-01-05,7.91,3.41,0,,7.86,8.21,False,False
05-01-2026 16:00,ENSRI,17.76,18.52,17.74,18.37,1351689.0,0.15,0.61,0.12,412.61,0.61,416266.2,224.72,0.25,True,75.88,0.25,0.2,0.05,2026-01-05,17.22,6.68,0,,16.78,ATH,False,False
05-01-2026 16:00,RUBNS,25.9,27.9,25.56,27.36,1793665.0,0.54,1.46,0.23,534.78,1.46,1038257.7,72.76,0.37,True,78.01,1.19,1.17,0.02,2026-01-05,25.46,7.46,0,,24.3,ATH,False,False
05-01-2026 15:00,ALKA,10.62,11.46,10.6,11.39,6541590.0,0.07,0.77,0.08,839.02,0.77,1113687.9,487.38,0.09,True,73.5,0.05,-0.0,0.05,2026-01-05,10.78,5.66,0,,10.45,ATH,False,False
05-01-2026 15:00,DGNMO,4.85,4.99,4.85,4.97,660290.0,0.02,0.12,0.0,2300.0,0.12,271689.1,143.03,0.17,True,63.28,0.02,0.02,0.0,2026-01-05,4.99,-0.4,1,4.99,4.84,4.99,False,False
05-01-2026 15:00,DOFRB,85.5,89.65,85.1,89.65,7837073.0,0.0,4.15,1.2,247.28,4.15,3871284.3,102.44,0.0,True,78.03,1.81,0.85,0.96,2026-01-05,81.5,10.0,0,,74.1,ATH,False,False
05-01-2026 15:00,MARMR,1.69,1.89,1.69,1.86,215973756.0,0.03,0.17,0.02,750.0,0.17,57032674.0,278.68,0.18,True,72.31,0.03,0.02,0.01,2026-01-05,1.72,8.14,1,1.89,1.54,1.89,False,False
05-01-2026 14:00,TUPRS,188.5,191.0,188.5,190.8,4890541.0,0.2,2.3,0.5,360.0,2.3,2559463.8,91.08,0.09,True,78.68,0.79,0.4,0.39,2026-01-05,187.0,2.03,0,,183.7,ATH,False,False
05-01-2026 14:00,BOBET,19.71,20.34,19.68,20.22,1435883.0,0.12,0.51,0.1,395.15,0.51,426175.0,236.92,0.24,True,83.08,0.26,0.18,0.08,2026-01-05,19.27,4.93,0,,18.73,ATH,False,False
05-01-2026 14:00,BEGYO,4.77,5.08,4.77,5.04,13612734.0,0.04,0.27,0.02,1073.91,0.27,1850815.9,635.5,0.15,True,75.03,0.03,0.01,0.02,2026-01-05,4.8,5.0,0,,4.67,5.1,False,False
05-01-2026 14:00,SMRVA,101.7,110.5,101.0,109.5,2626547.0,1.0,7.8,0.95,716.75,7.8,955835.2,174.79,0.13,True,48.04,-5.4,-6.77,1.37,2026-01-05,103.6,5.69,1,110.5,97.0,110.5,True,False
05-01-2026 14:00,LKMNH,18.67,19.08,18.67,18.98,509119.0,0.1,0.31,0.0,10233.33,0.31,188684.7,169.83,0.32,True,57.32,0.03,0.08,-0.05,2026-01-05,18.75,1.23,0,,18.5,19.44,False,False
05-01-2026 14:00,ECOGR,22.56,23.06,22.48,22.98,7509294.0,0.08,0.42,0.04,900.0,0.42,2837284.4,164.66,0.19,True,66.03,0.16,0.16,0.01,2026-01-05,22.68,1.32,0,,22.12,23.1,False,False
05-01-2026 14:00,ULUUN,6.67,6.75,6.65,6.75,362650.0,0.0,0.08,0.0,3900.0,0.08,236602.8,53.27,0.0,True,62.61,0.05,0.06,-0.01,2026-01-05,6.79,-0.59,0,,6.52,6.8,False,False
05-01-2026 13:00,USAK,3.0,3.09,2.98,3.08,21093291.0,0.01,0.08,0.01,1233.33,0.08,8189477.8,157.57,0.12,True,54.24,-0.02,-0.02,0.0,2026-01-05,3.06,0.65,2,2.98,2.98,3.15,True,True
05-01-2026 13:00,GOKNR,19.95,20.44,19.95,20.32,1184947.0,0.12,0.37,0.04,802.44,0.37,292838.5,304.64,0.32,True,74.59,0.1,0.07,0.03,2026-01-05,19.95,1.85,0,,19.8,ATH,False,False
05-01-2026 13:00,DURKN,14.98,16.36,14.95,16.36,2570581.0,0.0,1.38,0.16,757.14,1.38,407768.9,530.4,0.0,True,91.34,0.18,0.09,0.09,2026-01-05,14.88,9.95,0,,14.67,ATH,False,False
05-01-2026 13:00,BIOEN,17.56,18.17,17.55,18.02,1511805.0,0.15,0.46,0.11,303.51,0.46,375828.3,302.26,0.33,True,80.61,0.16,0.04,0.12,2026-01-05,16.82,7.13,1,18.17,16.82,18.17,False,False
05-01-2026 12:00,ASTOR,117.1,119.3,117.1,119.1,5414446.0,0.2,2.0,0.2,900.0,2.0,3029724.0,78.71,0.1,True,67.25,0.26,0.21,0.05,2026-01-05,117.2,1.62,1,119.3,115.8,119.3,False,False
05-01-2026 12:00,SMART,22.24,22.5,22.18,22.44,144656.0,0.06,0.2,0.05,300.0,0.2,86631.4,66.98,0.3,True,71.51,0.05,-0.01,0.06,2026-01-05,22.12,1.45,1,22.5,21.76,22.5,False,False
05-01-2026 12:00,UNLU,15.19,15.49,15.16,15.48,451338.0,0.01,0.29,0.01,2800.0,0.29,276739.8,63.09,0.03,True,43.43,-0.24,-0.19,-0.04,2026-01-05,15.35,0.85,0,,15.05,17.06,False,False
05-01-2026 12:00,IHLGM,2.1,2.18,2.1,2.17,22401650.0,0.01,0.07,0.01,775.0,0.07,4362183.5,413.54,0.14,True,73.33,0.01,0.01,0.01,2026-01-05,2.08,4.33,0,,2.05,2.26,False,False
05-01-2026 11:00,PEKGY,13.23,13.83,13.22,13.81,91893545.0,0.02,0.58,0.09,551.69,0.58,46273212.0,98.59,0.03,True,65.37,-0.1,-0.23,0.13,2026-01-05,12.89,7.14,0,,12.27,15.22,True,False
05-01-2026 11:00,IHEVA,2.26,2.31,2.25,2.3,646881.0,0.01,0.04,0.01,344.44,0.04,220148.8,193.84,0.25,True,69.34,0.02,0.01,0.01,2026-01-05,2.27,1.32,0,,2.18,2.37,False,False
05-01-2026 11:00,IHGZT,1.58,1.6,1.57,1.6,7285176.0,0.0,0.02,0.0,1900.0,0.02,2198373.0,231.39,0.0,True,63.39,0.0,0.0,0.0,2026-01-05,1.58,1.27,2,1.57,1.57,1.63,False,False
05-01-2026 11:00,IHLAS,2.34,2.4,2.34,2.4,44967884.0,0.0,0.06,0.01,445.45,0.06,14365412.8,213.03,0.0,True,78.05,0.01,0.0,0.01,2026-01-05,2.29,4.8,0,,2.25,2.56,False,False
05-01-2026 11:00,IZFAS,56.75,57.9,56.75,57.85,1128560.0,0.05,1.1,0.03,3566.67,1.1,698915.9,61.47,0.05,True,65.88,0.91,0.87,0.04,2026-01-05,56.45,2.48,1,57.9,54.6,57.9,False,False
05-01-2026 11:00,IZENR,9.61,9.94,9.6,9.91,24134792.0,0.03,0.3,0.04,597.67,0.3,9705562.8,148.67,0.1,True,56.08,-0.07,-0.14,0.07,2026-01-05,9.71,2.06,0,,9.39,10.0,True,False
05-01-2026 11:00,RUZYE,11.25,11.49,11.23,11.44,1684737.0,0.05,0.19,0.01,1483.33,0.19,671582.2,150.86,0.26,True,61.21,0.03,-0.0,0.03,2026-01-05,11.3,1.24,0,,10.82,11.52,False,False
05-01-2026 11:00,BERA,18.24,18.57,18.14,18.55,2049769.0,0.02,0.31,0.04,656.1,0.31,1062558.7,92.91,0.06,True,61.28,0.16,0.17,-0.01,2026-01-05,18.24,1.7,0,,17.47,19.49,False,False
05-01-2026 11:00,DSTKF,572.5,594.5,571.0,593.0,573978.0,1.5,20.5,1.95,951.28,20.5,183241.5,213.24,0.07,True,63.46,-1.93,-6.25,4.32,2026-01-05,560.0,5.89,0,,552.0,619.0,False,False
05-01-2026 10:00,MARTI,2.77,2.84,2.73,2.83,9462372.0,0.01,0.06,0.01,566.67,0.06,2669781.3,254.42,0.17,True,75.4,0.04,0.03,0.01,2026-01-05,2.77,2.17,1,2.84,2.54,2.84,False,False
05-01-2026 10:00,BAHKM,67.95,74.45,67.75,74.45,1131641.0,0.0,6.5,0.46,1313.04,6.5,254637.7,344.41,0.0,True,70.22,0.31,0.08,0.23,2026-01-05,67.7,9.97,1,74.45,66.8,ATH,False,False
05-01-2026 10:00,TERA,172.9,182.7,170.0,182.0,7979646.0,0.7,9.1,1.15,691.3,9.1,2560000.2,211.7,0.08,True,58.52,-1.69,-2.76,1.07,2026-01-05,173.0,5.2,0,,165.7,190.0,False,False
05-01-2026 10:00,CVKMD,28.12,29.2,28.12,29.06,10066252.0,0.14,0.94,0.17,466.27,0.94,3044384.2,230.65,0.15,True,79.67,0.61,0.44,0.17,2026-01-05,27.9,4.16,0,,24.58,ATH,False,False
05-01-2026 10:00,ONRYT,65.05,67.75,64.75,67.55,707211.0,0.2,2.5,0.35,624.64,2.5,152092.6,364.99,0.08,True,75.73,0.41,0.11,0.3,2026-01-05,64.75,4.32,0,,62.5,69.1,False,False
05-01-2026 10:00,SEKUR,3.66,3.91,3.65,3.84,1980018.0,0.07,0.18,0.03,592.31,0.18,292153.5,577.73,0.39,True,76.98,0.06,0.03,0.02,2026-01-05,3.65,5.21,0,,3.41,ATH,False,False
05-01-2026 10:00,TOASO,260.0,266.75,259.25,265.0,1579316.0,1.75,5.0,1.55,221.54,5.0,541849.6,191.47,0.35,True,86.04,3.13,1.67,1.46,2026-01-05,258.75,2.42,0,,246.3,ATH,False,False
05-01-2026 10:00,GWIND,23.08,23.24,23.02,23.2,716264.0,0.04,0.12,0.05,122.22,0.12,421907.9,69.77,0.33,True,64.43,0.03,-0.08,0.11,2026-01-05,23.06,0.61,0,,22.22,24.38,False,False
05-01-2026 10:00,BIMAS,544.0,558.0,543.0,557.0,2707508.0,1.0,13.0,1.6,712.5,13.0,525871.3,414.86,0.08,True,79.9,2.41,1.12,1.28,2026-01-05,543.0,2.58,0,,535.0,565.5,False,False
05-01-2026 10:00,MANAS,17.73,19.29,17.56,18.98,7087765.0,0.31,1.25,0.36,250.14,1.25,1572403.2,350.76,0.25,True,80.4,0.64,0.37,0.27,2026-01-05,17.54,8.21,1,19.29,15.08,19.29,False,False
05-01-2026 10:00,HATEK,14.82,15.03,14.6,15.02,449572.0,0.01,0.2,0.03,545.16,0.2,173749.6,158.75,0.05,True,65.88,0.05,0.0,0.05,2026-01-05,14.8,1.49,0,,14.31,15.85,False,False
05-01-2026 10:00,TAVHL,310.75,313.75,309.75,313.75,572073.0,0.0,3.0,1.12,166.67,3.0,304321.5,87.98,0.0,True,74.43,2.68,1.8,0.88,2026-01-05,310.75,0.97,0,,298.25,ATH,False,False
05-01-2026 10:00,EUREN,6.62,6.92,6.6,6.91,42480338.0,0.01,0.29,0.05,530.43,0.29,10371226.3,309.6,0.03,True,76.2,0.04,-0.01,0.04,2026-01-05,6.6,4.7,0,,6.34,7.39,False,False
05-01-2026 10:00,MGROS,531.5,546.5,530.5,545.5,1115848.0,1.0,14.0,2.1,566.67,14.0,255525.5,336.69,0.07,True,80.73,3.64,2.04,1.6,2026-01-05,530.5,2.83,0,,517.5,ATH,False,False
05-01-2026 10:00,DENGE,3.28,3.49,3.24,3.47,12110951.0,0.02,0.19,0.04,413.51,0.19,5333669.8,127.07,0.11,True,83.5,0.06,0.02,0.03,2026-01-05,3.27,6.12,1,3.49,3.04,3.49,False,False
02-01-2026 17:00,BORSK,5.81,5.95,5.81,5.93,1859609.0,0.02,0.12,0.02,421.74,0.12,716456.7,159.56,0.17,True,65.85,0.0,-0.02,0.02,2026-01-02,5.7,4.04,0,,5.7,6.26,False,False
02-01-2026 17:00,AGHOL,29.06,29.38,29.0,29.34,1274835.0,0.04,0.28,0.05,418.52,0.28,400461.8,218.34,0.14,True,71.43,0.19,0.15,0.04,2026-01-02,28.7,2.23,0,,27.76,ATH,False,False
02-01-2026 17:00,SEYKM,5.02,5.1,5.01,5.1,208518.0,0.0,0.08,0.01,1042.86,0.08,93528.8,122.95,0.0,True,59.66,0.02,0.01,0.01,2026-01-02,5.03,1.39,1,5.1,4.93,5.3,False,False
02-01-2026 17:00,GSRAY,1.16,1.18,1.16,1.18,24992258.0,0.0,0.02,0.0,900.0,0.02,15985773.9,56.34,0.0,True,55.83,0.0,0.0,0.0,2026-01-02,1.16,1.72,2,1.16,1.16,1.2,False,False
02-01-2026 17:00,TATEN,12.73,13.5,12.65,13.3,3097169.0,0.2,0.57,0.06,850.0,0.57,1791020.9,72.93,0.35,True,66.12,0.21,0.15,0.06,2026-01-02,12.8,3.91,0,,11.04,14.53,False,False
02-01-2026 17:00,SKYMD,11.88,12.0,11.85,11.99,796398.0,0.01,0.11,0.02,633.33,0.11,266643.4,198.68,0.09,True,71.19,0.13,0.11,0.02,2026-01-02,11.77,1.87,0,,10.8,ATH,False,False
02-01-2026 17:00,DAGI,7.7,7.96,7.67,7.96,1857725.0,0.0,0.26,0.03,664.71,0.26,654805.5,183.71,0.0,True,61.28,-0.04,-0.08,0.04,2026-01-02,7.51,5.99,0,,7.51,8.36,True,False
02-01-2026 17:00,BEYAZ,27.56,28.18,27.52,28.16,644273.0,0.02,0.6,0.09,581.82,0.6,183351.0,251.39,0.03,True,75.27,0.3,0.21,0.09,2026-01-02,27.08,3.99,0,,25.86,ATH,False,False
02-01-2026 17:00,JANTS,18.84,20.46,18.82,20.46,2294233.0,0.0,1.62,0.18,800.0,1.62,331737.1,591.58,0.0,True,90.28,0.17,0.04,0.13,2026-01-02,18.61,9.94,0,,18.46,ATH,False,False
02-01-2026 17:00,TUCLK,4.84,4.87,4.84,4.87,1508161.0,0.0,0.03,0.0,500.0,0.03,795299.1,89.63,0.0,True,49.08,-0.03,-0.03,0.0,2026-01-02,4.8,1.46,0,,4.79,4.99,True,True
02-01-2026 17:00,ENTRA,10.5,10.7,10.49,10.7,3462294.0,0.0,0.2,0.05,344.44,0.2,844464.4,310.0,0.0,True,72.23,0.09,0.06,0.03,2026-01-02,10.2,4.9,1,10.7,10.01,ATH,False,False
02-01-2026 17:00,FENER,3.42,3.45,3.4,3.45,15784559.85,0.0,0.03,0.0,1185.71,0.03,5163133.41,205.72,0.11,True,51.25,-0.01,-0.01,0.0,2026-01-02,3.42,0.87,0,,3.39,3.52,False,False
02-01-2026 17:00,LILAK,29.3,29.4,29.2,29.4,530673.0,0.0,0.1,0.03,257.14,0.1,339681.1,56.23,0.0,True,67.56,0.13,0.08,0.04,2026-01-02,29.0,1.38,0,,27.92,29.6,False,False
02-01-2026 17:00,KARSN,9.34,9.42,9.34,9.4,1182820.0,0.02,0.06,0.02,215.79,0.06,658060.5,79.74,0.33,True,76.97,0.06,0.04,0.02,2026-01-02,9.2,2.17,0,,9.0,ATH,False,False
02-01-2026 17:00,CEMZY,41.94,47.3,41.88,47.3,4788590.0,0.0,5.36,0.41,1200.97,5.36,731146.3,554.94,0.0,True,70.27,-0.59,-0.96,0.37,2026-01-02,43.0,10.0,0,,41.38,52.65,True,True
02-01-2026 17:00,GARAN,147.7,149.2,147.6,149.2,4774839.0,0.0,1.5,0.48,212.5,1.5,3118697.5,53.1,0.0,True,81.69,1.63,1.25,0.38,2026-01-02,143.5,3.97,0,,140.2,ATH,False,False
02-01-2026 17:00,GEDZA,28.16,28.44,27.94,28.44,123892.0,0.0,0.28,0.03,833.33,0.28,64884.3,90.94,0.0,True,52.75,-0.13,-0.13,0.0,2026-01-02,28.06,1.35,0,,27.76,29.98,True,True
02-01-2026 17:00,GESAN,47.14,47.7,46.98,47.68,1028111.0,0.02,0.54,0.13,321.87,0.54,449103.5,128.93,0.04,True,68.74,0.26,0.21,0.06,2026-01-02,46.4,2.76,0,,46.24,ATH,False,False
02-01-2026 16:00,DOAS,190.7,193.2,190.5,192.8,401707.0,0.4,2.1,0.38,452.63,2.1,189530.1,111.95,0.19,True,73.4,1.31,1.04,0.27,2026-01-02,188.1,2.5,0,,183.0,ATH,False,False
02-01-2026 16:00,GEREL,18.84,19.16,18.82,19.1,618284.0,0.06,0.26,0.01,2263.64,0.26,305269.4,102.54,0.23,True,57.05,-0.02,-0.02,0.0,2026-01-02,18.93,0.9,0,,18.8,20.52,False,False
02-01-2026 16:00,KRSTL,9.66,9.8,9.65,9.77,875561.0,0.03,0.11,0.03,243.75,0.11,559700.1,56.43,0.27,True,73.49,0.06,0.03,0.03,2026-01-02,9.37,4.27,0,,9.37,ATH,False,False
02-01-2026 16:00,ETILR,3.77,3.9,3.76,3.88,7890028.0,0.02,0.11,0.01,1000.0,0.11,1665028.9,373.87,0.18,True,72.28,0.0,-0.01,0.01,2026-01-02,3.74,3.74,1,3.9,3.73,3.9,True,False
02-01-2026 16:00,KRVGD,2.74,2.83,2.74,2.81,2777961.0,0.02,0.07,0.01,1300.0,0.07,1536617.0,80.78,0.29,True,75.79,0.03,0.03,0.0,2026-01-02,2.76,1.81,0,,2.56,ATH,False,False
02-01-2026 15:00,KAYSE,18.76,19.42,18.76,19.34,1730472.0,0.08,0.58,0.08,598.8,0.58,393167.5,340.14,0.14,True,79.45,0.13,0.06,0.07,2026-01-02,18.43,4.94,0,,17.99,ATH,False,False
02-01-2026 15:00,CEMTS,11.34,11.45,11.32,11.45,374271.0,0.0,0.11,0.02,478.95,0.11,244684.9,52.96,0.0,True,72.24,0.03,0.01,0.02,2026-01-02,11.25,1.78,0,,11.1,11.59,False,False
02-01-2026 15:00,ISFIN,16.9,17.37,16.89,17.35,1251091.0,0.02,0.45,0.09,423.26,0.45,692106.9,80.77,0.04,True,57.2,-0.24,-0.39,0.15,2026-01-02,16.35,6.12,0,,16.35,19.0,True,False
02-01-2026 15:00,YATAS,39.74,40.7,39.62,40.66,537337.0,0.04,0.92,0.05,1740.0,0.92,178749.9,200.61,0.04,True,70.04,0.51,0.4,0.11,2026-01-02,39.84,2.06,0,,36.0,ATH,False,False
02-01-2026 15:00,PRKME,18.36,18.42,18.35,18.42,304800.0,0.0,0.06,0.0,1400.0,0.06,184686.8,65.04,0.0,True,57.61,0.04,0.05,-0.01,2026-01-02,18.48,-0.32,0,,18.03,18.51,False,False
02-01-2026 15:00,DITAS,31.8,33.66,31.7,33.32,805228.0,0.34,1.52,0.04,3464.2,1.52,492349.79,63.55,0.22,True,57.2,0.1,0.03,0.07,2026-01-02,31.25,6.62,0,,29.8,34.4,False,False
02-01-2026 15:00,SILVR,2.87,3.0,2.85,3.0,1033946.0,0.0,0.13,0.01,766.67,0.13,399602.6,158.74,0.0,True,64.11,0.02,0.02,0.0,2026-01-02,2.94,2.04,0,,2.63,3.01,False,False
02-01-2026 14:00,ECILC,82.5,83.85,82.4,83.55,601341.0,0.3,1.05,0.18,483.33,1.05,229115.2,162.46,0.29,True,65.32,0.37,0.18,0.19,2026-01-02,81.8,2.14,0,,79.4,85.6,False,False
02-01-2026 14:00,AGROT,6.24,6.43,6.2,6.42,5499284.0,0.01,0.18,0.05,275.0,0.18,3249204.6,69.25,0.06,True,80.89,0.06,0.0,0.06,2026-01-02,5.95,7.9,0,,5.78,7.5,False,False
02-01-2026 13:00,VSNMD,90.15,92.5,90.05,91.85,423729.0,0.65,1.7,0.18,818.92,1.7,114414.0,270.35,0.38,True,60.2,-0.18,-0.42,0.24,2026-01-02,89.5,2.63,0,,89.25,97.45,True,True
02-01-2026 13:00,MOGAN,8.29,8.47,8.27,8.42,1867105.0,0.05,0.13,0.03,400.0,0.13,563017.3,231.62,0.38,True,73.49,0.05,0.03,0.02,2026-01-02,8.19,2.81,0,,8.06,ATH,False,False
02-01-2026 12:00,RALYH,228.6,232.4,228.0,231.8,204273.0,0.6,3.2,0.87,267.82,3.2,80312.6,154.35,0.19,True,61.33,1.45,1.38,0.06,2026-01-02,228.7,1.36,0,,224.8,ATH,False,False
02-01-2026 11:00,KCHOL,170.9,172.6,170.8,172.4,6391851.0,0.2,1.5,0.23,552.17,1.5,2998946.3,113.14,0.13,True,72.71,0.53,0.29,0.24,2026-01-02,168.8,2.13,0,,168.5,174.1,False,False
02-01-2026 11:00,SASA,2.83,2.94,2.83,2.91,511928383.0,0.03,0.08,0.01,788.89,0.08,121654409.0,320.81,0.37,True,68.32,0.01,-0.0,0.01,2026-01-02,2.78,4.68,1,2.94,2.78,2.94,False,False
02-01-2026 11:00,FORTE,82.15,83.7,81.9,83.6,402082.0,0.1,1.45,0.16,806.25,1.45,150704.9,166.8,0.07,True,64.02,-0.08,-0.24,0.17,2026-01-02,80.8,3.47,0,,80.65,85.5,True,False
02-01-2026 11:00,OYAKC,23.1,23.5,23.1,23.42,4411652.0,0.08,0.32,0.02,1900.0,0.32,1480695.7,197.94,0.25,True,62.6,0.02,-0.03,0.05,2026-01-02,23.04,1.65,0,,22.58,23.6,False,False
02-01-2026 10:00,MAGEN,38.2,39.74,37.6,39.66,4345350.0,0.08,1.46,0.06,2333.33,1.46,1136655.4,282.29,0.05,True,59.17,-0.03,0.03,-0.05,2026-01-02,38.12,4.04,2,37.6,37.6,40.78,False,False
02-01-2026 10:00,SAHOL,84.9,86.4,84.75,86.35,9894890.0,0.05,1.45,0.12,1160.87,1.45,2835322.9,248.99,0.03,True,72.25,0.37,0.2,0.17,2026-01-02,84.25,2.49,0,,82.9,ATH,False,False
02-01-2026 10:00,LRSHO,3.94,4.15,3.94,4.12,13396775.0,0.03,0.18,0.02,958.82,0.18,2458602.2,444.89,0.17,True,68.74,-0.0,-0.02,0.02,2026-01-02,3.93,4.83,0,,3.85,4.35,False,False
02-01-2026 10:00,RTALB,3.45,3.51,3.44,3.5,5634713.0,0.01,0.05,0.01,900.0,0.05,1355391.3,315.73,0.2,True,50.1,-0.03,-0.04,0.0,2026-01-02,3.43,2.04,0,,3.41,3.69,True,True
02-01-2026 10:00,TUKAS,2.49,2.54,2.48,2.54,40661317.0,0.0,0.05,0.01,733.33,0.05,9040572.3,349.76,0.0,True,64.35,0.01,0.01,0.0,2026-01-02,2.47,2.83,0,,2.47,2.57,False,False
02-01-2026 10:00,TRALT,41.26,41.9,41.22,41.86,31677264.0,0.04,0.6,0.03,1775.0,0.6,18001114.5,75.97,0.07,True,55.69,-0.15,-0.31,0.16,2026-01-02,40.98,2.15,0,,39.18,45.3,False,False
02-01-2026 10:00,LIDER,68.4,69.5,65.6,69.35,1708470.0,0.15,0.95,0.25,280.0,0.95,476117.9,258.83,0.16,True,61.28,0.75,0.73,0.02,2026-01-02,70.0,-0.93,2,65.6,65.6,70.75,False,False
02-01-2026 10:00,TUREX,7.09,7.17,7.05,7.17,2365612.0,0.0,0.08,0.01,515.38,0.08,1131922.3,108.99,0.0,True,65.57,0.01,-0.01,0.02,2026-01-02,7.07,1.41,0,,6.89,7.32,False,False
02-01-2026 10:00,VAKFA,11.29,11.43,11.28,11.43,3651121.0,0.0,0.14,0.01,976.92,0.14,1778180.8,105.33,0.0,True,55.34,-0.04,-0.07,0.03,2026-01-02,11.24,1.69,0,,11.11,11.44,True,False
02-01-2026 10:00,REEDR,6.63,6.74,6.63,6.73,2836697.0,0.01,0.1,0.01,1900.0,0.1,1691170.4,67.74,0.1,True,61.04,-0.0,-0.01,0.01,2026-01-02,6.61,1.82,0,,6.5,6.83,False,False
02-01-2026 10:00,VESBE,7.82,7.92,7.82,7.91,646786.0,0.01,0.09,0.01,1700.0,0.09,324119.6,99.55,0.11,True,61.82,0.01,-0.0,0.01,2026-01-02,7.8,1.41,0,,7.8,8.04,False,False
02-01-2026 10:00,YEOTK,36.6,36.96,36.5,36.92,857491.0,0.04,0.32,0.02,1500.0,0.32,260712.4,228.9,0.12,True,57.87,-0.01,-0.03,0.02,2026-01-02,36.54,1.04,0,,36.48,36.98,False,False
02-01-2026 10:00,PENGD,7.6,7.69,7.6,7.69,436236.0,0.0,0.09,0.01,1185.71,0.09,197916.0,120.41,0.0,True,61.5,0.0,-0.01,0.01,2026-01-02,7.59,1.32,0,,7.56,7.79,False,False
02-01-2026 10:00,SEGYO,4.94,5.14,4.94,5.09,3536434.0,0.05,0.15,0.02,614.29,0.15,1332198.4,165.46,0.33,True,46.42,0.01,0.04,-0.03,2026-01-02,5.2,-2.12,0,,4.76,5.37,False,False
02-01-2026 10:00,PENTA,13.04,13.36,13.04,13.31,287555.0,0.05,0.27,0.03,900.0,0.27,116132.8,147.61,0.19,True,63.43,-0.02,-0.05,0.03,2026-01-02,13.09,1.68,2,13.04,13.04,13.83,True,False
02-01-2026 10:00,KZGYO,23.42,23.7,23.34,23.68,155265.0,0.02,0.26,0.01,1757.14,0.26,73181.2,112.17,0.08,True,56.69,-0.07,-0.13,0.06,2026-01-02,23.2,2.07,0,,23.2,25.4,False,False
02-01-2026 10:00,PATEK,22.16,23.3,22.16,23.16,14914993.0,0.14,1.0,0.05,2073.91,1.0,8098474.4,84.17,0.14,True,41.81,-1.14,-1.25,0.1,2026-01-02,22.02,5.18,1,23.3,21.88,23.3,True,True
02-01-2026 10:00,PAPIL,16.04,16.29,16.04,16.25,1521405.0,0.04,0.21,0.03,650.0,0.21,437054.8,248.1,0.19,True,45.65,-0.19,-0.22,0.03,2026-01-02,16.03,1.37,0,,15.9,17.3,True,True
02-01-2026 10:00,TKNSA,21.94,22.32,21.94,22.3,252464.0,0.02,0.36,0.03,1100.0,0.36,85104.6,196.65,0.06,True,60.36,-0.04,-0.07,0.03,2026-01-02,21.94,1.64,2,21.94,21.94,22.8,False,False
02-01-2026 10:00,TKFEN,70.6,73.75,70.25,73.4,1102563.0,0.35,2.8,0.17,1547.06,2.8,408120.0,170.16,0.12,True,64.29,0.06,-0.22,0.27,2026-01-02,70.4,4.26,0,,69.7,79.95,False,False
02-01-2026 10:00,TEZOL,11.89,12.0,11.87,11.98,242192.0,0.02,0.09,0.0,2900.0,0.09,106532.3,127.34,0.22,True,57.81,-0.01,-0.02,0.01,2026-01-02,11.85,1.1,0,,11.85,11.99,False,False
02-01-2026 10:00,OSMEN,7.85,8.08,7.85,8.06,577553.0,0.02,0.21,0.02,1212.5,0.21,145760.5,296.23,0.1,True,61.45,0.02,0.03,-0.0,2026-01-02,7.84,2.81,0,,7.84,8.13,False,False
02-01-2026 10:00,ODAS,5.11,5.18,5.09,5.18,7759912.0,0.0,0.07,0.0,2233.33,0.07,2711072.7,186.23,0.0,True,63.6,-0.01,-0.02,0.01,2026-01-02,5.07,2.17,0,,5.05,5.19,False,False
02-01-2026 10:00,SKTAS,3.81,3.87,3.78,3.87,715147.0,0.0,0.06,0.0,1400.0,0.06,414638.1,72.47,0.0,True,60.39,0.01,-0.0,0.01,2026-01-02,3.79,2.11,2,3.78,3.78,3.94,False,False
02-01-2026 10:00,MHRGY,3.44,3.5,3.43,3.49,574694.0,0.01,0.05,0.01,455.56,0.05,333401.1,72.37,0.2,True,67.12,0.04,0.04,0.0,2026-01-02,3.45,1.16,1,3.5,3.21,3.5,False,False
02-01-2026 10:00,MNDRS,13.42,13.64,13.39,13.59,490230.0,0.05,0.17,0.05,269.57,0.17,318048.5,54.14,0.29,True,82.95,0.13,0.08,0.05,2026-01-02,13.39,1.49,1,13.64,12.68,13.64,False,False
02-01-2026 10:00,MNDTR,6.57,6.74,6.57,6.72,509053.0,0.02,0.15,0.02,552.17,0.15,250620.9,103.12,0.13,True,62.51,0.02,-0.01,0.02,2026-01-02,6.57,2.28,0,,6.38,6.93,False,False
02-01-2026 10:00,SRVGY,3.2,3.28,3.18,3.28,5481449.0,0.0,0.08,0.01,515.38,0.08,1744714.0,214.17,0.0,True,61.3,-0.02,-0.03,0.01,2026-01-02,3.17,3.47,0,,3.11,3.41,False,False
02-01-2026 10:00,QUAGR,2.85,3.1,2.83,3.08,68579257.0,0.02,0.23,0.03,666.67,0.23,14849334.8,361.83,0.09,True,79.56,0.06,0.04,0.02,2026-01-02,2.85,8.07,2,2.83,2.83,ATH,False,False
02-01-2026 10:00,A1CAP,11.81,12.59,11.81,12.57,10577057.0,0.02,0.76,0.07,1051.52,0.76,2025789.7,422.12,0.03,True,83.84,0.3,0.23,0.06,2026-01-02,11.8,6.53,0,,10.64,ATH,False,False
02-01-2026 10:00,AYDEM,22.54,22.96,22.22,22.94,1188083.0,0.02,0.4,0.06,566.67,0.4,485444.0,144.74,0.05,True,81.99,0.44,0.39,0.05,2026-01-02,22.54,1.77,0,,20.96,ATH,False,False
02-01-2026 10:00,ARDYZ,33.6,36.06,33.48,35.78,4000075.0,0.28,2.18,0.22,890.91,2.18,605490.3,560.63,0.13,True,82.54,0.22,-0.08,0.3,2026-01-02,33.24,7.64,1,36.06,32.38,36.06,False,False
02-01-2026 10:00,ALVES,25.7,26.18,25.6,26.08,627306.0,0.1,0.38,0.05,660.0,0.38,237678.7,163.93,0.26,True,64.83,0.02,-0.06,0.08,2026-01-02,25.68,1.56,0,,25.16,26.56,False,False
02-01-2026 10:00,EPLAS,5.06,5.15,5.06,5.13,696474.0,0.02,0.07,0.0,1650.0,0.07,134954.1,416.08,0.29,True,68.72,0.01,-0.0,0.01,2026-01-02,5.05,1.58,0,,5.01,5.19,False,False
02-01-2026 10:00,HUNER,3.1,3.14,3.1,3.13,2297162.0,0.01,0.03,0.0,650.0,0.03,1139069.3,101.67,0.33,True,56.83,-0.0,-0.01,0.0,2026-01-02,3.09,1.29,0,,3.08,3.18,False,False
02-01-2026 10:00,HUBVC,2.46,2.64,2.45,2.62,1790584.0,0.02,0.16,0.02,900.0,0.16,339879.3,426.83,0.12,True,64.41,0.01,0.0,0.0,2026-01-02,2.49,5.22,2,2.45,2.45,ATH,False,False
02-01-2026 10:00,HKTM,10.96,11.11,10.96,11.1,547728.0,0.01,0.14,0.01,1172.73,0.14,294412.5,86.04,0.07,True,64.94,0.01,-0.01,0.02,2026-01-02,10.9,1.83,0,,10.9,11.12,False,False
02-01-2026 10:00,ANGEN,10.81,10.96,10.79,10.93,404790.0,0.03,0.12,0.01,990.91,0.12,90806.8,345.77,0.25,True,61.56,-0.01,-0.03,0.02,2026-01-02,10.81,1.11,0,,10.67,10.96,False,False
02-01-2026 10:00,HEKTS,3.06,3.12,3.06,3.11,14377311.0,0.01,0.05,0.0,1150.0,0.05,8054051.2,78.51,0.2,True,60.97,0.0,-0.0,0.0,2026-01-02,3.06,1.63,0,,3.0,3.24,False,False
02-01-2026 10:00,GZNMI,57.9,62.7,57.1,62.7,2927588.0,0.0,4.8,0.65,644.19,4.8,1062727.0,175.48,0.0,True,65.95,0.91,0.29,0.61,2026-01-02,57.0,10.0,1,62.7,48.12,63.35,False,False
02-01-2026 10:00,ESEN,4.44,4.64,4.4,4.62,30546056.0,0.02,0.18,0.04,386.49,0.18,7388804.9,313.41,0.11,True,72.05,0.03,0.0,0.03,2026-01-02,4.44,4.05,0,,4.22,4.67,False,False
02-01-2026 10:00,BESLR,12.28,12.45,12.28,12.42,756595.0,0.03,0.14,0.01,1900.0,0.14,211062.3,258.47,0.21,True,67.44,0.03,0.02,0.02,2026-01-02,12.24,1.47,0,,12.04,12.46,False,False
02-01-2026 10:00,BINHO,8.86,9.29,8.85,9.28,11216903.0,0.01,0.42,0.04,876.74,0.42,2254333.9,397.57,0.02,True,80.03,0.01,-0.03,0.04,2026-01-02,8.83,5.1,0,,8.72,9.5,False,False
02-01-2026 10:00,BIGEN,8.91,9.08,8.91,9.07,814787.0,0.01,0.16,0.02,788.89,0.16,313868.6,159.59,0.06,True,62.69,-0.0,-0.02,0.02,2026-01-02,8.9,1.91,0,,8.88,9.18,False,False
02-01-2026 10:00,DERHL,13.18,13.43,13.14,13.4,860076.0,0.03,0.22,0.03,566.67,0.22,308618.3,178.69,0.14,True,67.89,0.05,0.01,0.04,2026-01-02,13.14,1.98,0,,12.72,13.7,False,False
02-01-2026 10:00,AZTEK,4.17,4.22,4.15,4.22,1546069.0,0.0,0.05,0.0,1150.0,0.05,396560.2,289.87,0.0,True,63.35,0.01,-0.01,0.01,2026-01-02,4.12,2.43,0,,4.04,4.31,False,False
02-01-2026 10:00,FONET,2.81,2.93,2.81,2.93,23716216.0,0.0,0.12,0.02,650.0,0.12,4782923.1,395.85,0.0,True,74.32,0.03,0.01,0.02,2026-01-02,2.79,5.02,0,,2.65,ATH,False,False
02-01-2026 10:00,BIENY,25.06,26.06,25.06,26.0,1638400.0,0.06,0.94,0.07,1170.27,0.94,277216.1,491.02,0.06,True,71.05,0.1,0.05,0.05,2026-01-02,25.06,3.75,0,,25.02,ATH,False,False
02-01-2026 10:00,GLYHO,11.99,12.1,11.97,12.1,848270.0,0.0,0.11,0.02,478.95,0.11,555592.4,52.68,0.0,True,62.98,0.01,-0.01,0.03,2026-01-02,11.95,1.26,1,12.1,11.7,12.25,False,False
02-01-2026 10:00,GLRYH,3.74,3.89,3.74,3.89,2225421.0,0.0,0.15,0.02,837.5,0.15,512426.6,334.29,0.0,True,70.01,-0.0,-0.02,0.02,2026-01-02,3.74,4.01,0,,3.64,4.0,False,False
02-01-2026 10:00,ALTNY,14.66,14.85,14.66,14.83,2463522.0,0.02,0.17,0.01,1207.69,0.17,1370487.8,79.76,0.12,True,48.57,-0.1,-0.13,0.03,2026-01-02,14.65,1.23,0,,14.65,16.6,True,False
02-01-2026 10:00,IMASM,4.72,4.91,4.72,4.87,13937237.0,0.04,0.15,0.01,971.43,0.15,3605887.1,286.51,0.27,True,68.9,0.03,0.01,0.02,2026-01-02,4.69,3.84,0,,4.44,5.28,False,False
02-01-2026 10:00,A1YEN,28.98,29.38,28.98,29.34,117324.0,0.04,0.36,0.07,414.29,0.36,70129.1,67.3,0.11,True,64.41,0.03,-0.02,0.06,2026-01-02,28.9,1.52,0,,28.5,30.24,True,False
02-01-2026 10:00,BMSCH,30.4,33.0,30.4,32.64,4396770.0,0.36,2.24,0.45,393.39,2.24,2133809.8,106.05,0.16,True,91.18,1.12,0.86,0.26,2026-01-02,30.4,7.37,0,,25.76,ATH,False,False
02-01-2026 10:00,KOTON,15.6,16.22,15.52,16.11,1327671.0,0.11,0.51,0.04,1242.11,0.51,344034.5,285.91,0.22,True,73.73,0.14,0.11,0.03,2026-01-02,15.6,3.27,3,,15.01,ATH,False,False
02-01-2026 10:00,CEMAS,4.07,4.15,4.05,4.14,4403726.0,0.01,0.07,0.01,536.36,0.07,1388725.1,217.11,0.14,True,59.85,-0.01,-0.02,0.01,2026-01-02,4.04,2.48,0,,3.95,4.48,True,False
02-01-2026 10:00,DZGYO,7.6,7.91,7.6,7.84,2200566.0,0.07,0.24,0.03,823.08,0.24,564553.6,289.79,0.29,True,74.74,0.06,0.03,0.03,2026-01-02,7.49,4.67,0,,7.06,7.92,False,False
02-01-2026 10:00,EFOR,24.22,25.8,24.2,25.64,9178495.0,0.16,1.42,0.27,418.25,1.42,1886199.5,386.61,0.11,True,62.02,-0.18,-0.42,0.24,2026-01-02,24.2,5.95,0,,22.46,27.54,False,False
02-01-2026 10:00,EGEPO,8.16,8.42,8.12,8.36,1554025.0,0.06,0.2,0.04,376.19,0.2,673869.4,130.61,0.3,True,61.52,0.07,0.07,0.0,2026-01-02,8.19,2.08,0,,7.77,8.94,False,False
02-01-2026 10:00,EGSER,3.01,3.02,2.98,3.02,611379.0,0.0,0.01,0.0,900.0,0.01,221406.8,176.13,0.0,True,50.67,-0.02,-0.03,0.01,2026-01-02,2.99,1.0,0,,2.97,3.34,True,False
02-01-2026 10:00,BRLSM,13.25,13.58,13.23,13.56,479300.0,0.02,0.31,0.03,811.76,0.31,147387.7,225.2,0.06,True,70.58,0.01,-0.03,0.04,2026-01-02,13.17,2.96,0,,13.15,13.65,False,False
02-01-2026 10:00,KLMSN,31.52,32.64,31.44,32.44,474586.0,0.2,0.92,0.02,5650.0,0.92,245804.1,93.07,0.22,True,42.62,-0.82,-0.71,-0.11,2026-01-02,31.48,3.05,0,,31.2,38.86,False,False
02-01-2026 10:00,BNTAS,6.36,6.4,6.34,6.39,268460.0,0.01,0.03,0.01,328.57,0.03,121683.5,120.62,0.33,True,66.74,0.0,-0.01,0.01,2026-01-02,6.33,0.95,0,,6.23,6.41,False,False
02-01-2026 10:00,EKSUN,5.3,5.37,5.29,5.36,256443.0,0.01,0.06,0.01,757.14,0.06,128800.1,99.1,0.17,True,71.12,0.01,0.0,0.01,2026-01-02,5.28,1.52,0,,5.17,5.4,False,False
02-01-2026 10:00,KAREL,8.45,8.56,8.45,8.55,869184.0,0.01,0.1,0.0,3233.33,0.1,324413.2,167.92,0.1,True,64.01,0.01,-0.0,0.01,2026-01-02,8.4,1.79,0,,8.39,8.6,False,False
02-01-2026 10:00,ALARK,102.3,104.3,102.3,103.9,2327983.0,0.4,1.6,0.14,1042.86,1.6,750102.4,210.36,0.25,True,60.39,-0.34,-0.57,0.23,2026-01-02,102.0,1.86,0,,101.5,106.3,True,False
02-01-2026 10:00,ALFAS,40.96,41.22,40.96,41.2,185063.0,0.02,0.24,0.02,900.0,0.24,77575.5,138.56,0.08,True,58.9,0.0,-0.06,0.06,2026-01-02,40.82,0.93,0,,40.14,41.32,False,False
02-01-2026 10:00,ELITE,28.26,28.94,28.26,28.8,190934.0,0.14,0.54,0.04,1321.05,0.54,48615.2,292.75,0.26,True,61.96,-0.09,-0.17,0.08,2026-01-02,28.26,1.91,1,28.94,27.92,28.94,True,False
02-01-2026 10:00,ENDAE,14.13,14.36,14.13,14.35,352286.0,0.01,0.22,0.03,714.81,0.22,146475.0,140.51,0.05,True,54.04,-0.06,-0.09,0.03,2026-01-02,14.11,1.7,0,,14.01,14.54,False,False
02-01-2026 10:00,INVEO,8.34,8.63,8.34,8.62,2409881.0,0.01,0.28,0.03,937.04,0.28,475121.7,407.21,0.04,True,66.73,-0.0,-0.03,0.02,2026-01-02,8.34,3.36,0,,8.01,9.17,False,False
02-01-2026 10:00,INFO,3.53,3.75,3.52,3.7,17459493.0,0.05,0.17,0.02,794.74,0.17,3147282.7,454.75,0.29,True,75.0,0.03,0.02,0.01,2026-01-02,3.5,5.71,0,,3.39,ATH,False,False
02-01-2026 10:00,FORMT,3.23,3.36,3.21,3.34,8736871.0,0.02,0.11,0.02,547.06,0.11,3178853.3,174.84,0.18,True,65.65,-0.0,-0.03,0.02,2026-01-02,3.19,4.7,1,3.36,3.06,3.36,False,False
31-12-2025 17:00,ESCAR,24.6,25.66,24.58,25.66,2465800.0,0.0,1.06,0.1,1004.17,1.06,704711.4,249.9,0.0,True,79.08,0.24,0.2,0.04,2025-12-31,24.64,4.14,0,,22.22,ATH,False,False
31-12-2025 17:00,SELEC,84.7,87.3,84.25,87.2,1147388.0,0.1,2.5,0.28,777.19,2.5,324062.2,254.06,0.04,True,78.35,1.96,1.83,0.13,2025-12-31,82.7,5.44,1,87.3,69.3,87.3,False,False
31-12-2025 17:00,DMRGD,3.11,3.31,3.09,3.31,28806090.0,0.0,0.2,0.03,640.74,0.2,4367988.8,559.48,0.0,True,70.97,-0.01,-0.04,0.03,2025-12-31,3.01,9.97,0,,2.98,ATH,False,False
31-12-2025 17:00,AHSGY,15.1,16.72,15.1,16.72,2745464.0,0.0,1.62,0.14,1065.47,1.62,407704.4,573.4,0.0,True,73.04,0.03,-0.08,0.1,2025-12-31,15.2,10.0,0,,15.06,ATH,False,False
31-12-2025 17:00,KCAER,10.3,10.5,10.27,10.45,1207685.0,0.05,0.15,0.02,500.0,0.15,540616.1,123.39,0.33,True,68.32,0.02,-0.02,0.03,2025-12-31,10.18,2.65,0,,9.99,10.69,False,False
31-12-2025 17:00,AVGYO,9.36,9.5,9.32,9.49,223363.0,0.01,0.13,0.0,4233.33,0.13,101409.6,120.26,0.08,True,52.31,-0.03,-0.05,0.02,2025-12-31,9.43,0.64,2,9.32,9.32,9.64,False,False
31-12-2025 17:00,BASGZ,44.16,45.4,44.06,45.22,479261.0,0.18,1.06,0.09,1077.78,1.06,158177.6,202.99,0.17,True,66.87,0.03,-0.05,0.08,2025-12-31,44.28,2.12,2,44.06,44.06,45.36,False,False
31-12-2025 17:00,KONKA,15.56,15.7,15.47,15.7,743413.0,0.0,0.14,0.01,1455.56,0.14,334196.6,122.45,0.0,True,60.73,0.07,0.06,0.01,2025-12-31,15.55,0.96,2,15.47,15.47,16.35,False,False
31-12-2025 17:00,VBTYZ,16.66,16.95,16.57,16.94,394418.0,0.01,0.28,0.02,1455.56,0.28,163594.8,141.09,0.04,True,57.92,-0.03,-0.05,0.02,2025-12-31,16.8,0.83,0,,15.96,18.02,False,False
31-12-2025 17:00,NTGAZ,10.23,10.47,10.19,10.46,1669375.0,0.01,0.23,0.02,1050.0,0.23,760366.5,119.55,0.04,True,70.9,0.19,0.17,0.02,2025-12-31,10.2,2.55,0,,9.44,ATH,False,False
31-12-2025 16:00,AHGAZ,22.2,22.42,22.18,22.42,695943.0,0.0,0.22,0.02,1275.0,0.22,413077.8,68.48,0.0,True,53.06,-0.08,-0.11,0.03,2025-12-31,22.2,0.99,0,,21.94,22.64,True,True
31-12-2025 16:00,INDES,7.82,7.88,7.8,7.88,5687653.0,0.0,0.06,0.01,328.57,0.06,1480368.6,284.21,0.0,True,79.75,0.11,0.1,0.01,2025-12-31,7.66,2.87,0,,6.96,ATH,False,False
31-12-2025 16:00,BUCIM,7.61,7.68,7.6,7.66,1974072.0,0.02,0.05,0.02,212.5,0.05,971066.2,103.29,0.4,True,77.16,0.09,0.08,0.01,2025-12-31,7.55,1.46,0,,7.14,ATH,False,False
31-12-2025 16:00,GOODY,14.65,14.75,14.65,14.75,89978.0,0.0,0.1,0.01,614.29,0.1,43612.7,106.31,0.0,True,59.22,0.03,0.02,0.01,2025-12-31,14.65,0.68,0,,14.45,14.79,False,False
31-12-2025 16:00,ANELE,15.86,16.56,15.86,16.38,892830.0,0.18,0.52,0.08,566.67,0.52,172647.1,417.14,0.35,True,73.32,0.09,0.05,0.04,2025-12-31,15.95,2.7,0,,15.45,ATH,False,False
31-12-2025 15:00,BLUME,50.1,52.5,50.05,52.3,1218668.0,0.2,2.2,0.27,727.07,2.2,378861.9,221.67,0.09,True,62.23,-0.28,-0.54,0.26,2025-12-31,50.4,3.77,0,,47.98,53.95,False,False
31-12-2025 15:00,YUNSA,7.56,7.68,7.55,7.68,879654.0,0.0,0.12,0.02,605.88,0.12,330001.5,166.56,0.0,True,67.51,0.01,-0.01,0.02,2025-12-31,7.53,1.99,0,,7.44,7.84,False,False
31-12-2025 13:00,BTCIM,3.75,3.84,3.73,3.83,26460569.0,0.01,0.08,0.01,700.0,0.08,10097804.9,162.04,0.12,True,56.25,-0.04,-0.05,0.01,2025-12-31,3.72,2.96,0,,3.68,3.93,True,False
31-12-2025 13:00,ALKIM,18.08,18.57,18.07,18.46,778840.0,0.11,0.38,0.14,163.89,0.38,341007.1,128.39,0.29,True,85.59,0.24,0.1,0.14,2025-12-31,17.63,4.71,0,,16.88,ATH,False,False
31-12-2025 13:00,AKYHO,2.72,2.75,2.71,2.75,391081.0,0.0,0.03,0.0,2900.0,0.03,123473.9,216.73,0.0,True,50.48,-0.01,-0.01,-0.0,2025-12-31,2.74,0.36,0,,2.69,2.89,False,False
31-12-2025 12:00,ADESE,1.52,1.61,1.52,1.59,95738001.0,0.02,0.07,0.01,1066.67,0.07,23949516.8,299.75,0.29,True,59.15,-0.01,-0.02,0.01,2025-12-31,1.53,3.92,1,1.61,1.49,1.61,True,False
31-12-2025 12:00,BAYRK,5.17,5.47,5.15,5.4,2746143.0,0.07,0.23,0.0,5650.0,0.23,808391.2,239.7,0.3,True,59.71,0.02,0.02,-0.01,2025-12-31,5.23,3.25,0,,5.11,5.54,False,False
31-12-2025 12:00,ARTMS,36.84,37.74,36.48,37.54,227313.0,0.2,0.7,0.07,960.61,0.7,125833.2,80.65,0.29,True,50.88,-0.5,-0.6,0.1,2025-12-31,36.3,3.42,0,,35.7,39.0,True,False
31-12-2025 12:00,PLTUR,22.08,22.64,21.9,22.58,614146.0,0.06,0.5,0.04,1036.36,0.5,267864.0,129.28,0.12,True,61.15,0.01,-0.05,0.05,2025-12-31,22.08,2.26,0,,21.46,22.9,False,False
31-12-2025 11:00,EMKEL,34.0,34.62,34.0,34.58,10972611.0,0.04,0.58,0.06,900.0,0.58,4426923.1,147.86,0.07,True,8.89,-2.99,-2.96,-0.04,2025-12-31,37.76,-8.42,2,34.0,34.0,41.94,False,False
31-12-2025 10:00,YKSLN,3.09,3.15,3.08,3.14,2737505.0,0.01,0.05,0.0,1566.67,0.05,952740.3,187.33,0.2,True,58.08,-0.02,-0.04,0.01,2025-12-31,3.07,2.28,0,,3.03,3.42,True,False
31-12-2025 10:00,BRSAN,529.5,542.5,528.0,540.5,426489.0,2.0,11.0,1.45,658.62,11.0,144165.0,195.83,0.18,True,72.66,2.85,1.03,1.81,2025-12-31,529.5,2.08,0,,511.5,541.0,False,False
31-12-2025 10:00,TATGD,11.8,11.95,11.8,11.92,355529.0,0.03,0.12,0.01,990.91,0.12,179958.2,97.56,0.25,True,51.18,-0.08,-0.1,0.02,2025-12-31,11.83,0.76,1,11.95,11.65,11.95,True,False
31-12-2025 10:00,ALKLC,174.4,189.8,174.4,189.7,1966542.0,0.1,15.3,0.54,2733.33,15.3,294609.1,567.51,0.01,True,35.82,-9.19,-7.41,-1.78,2025-12-31,193.7,-2.07,2,174.4,174.4,237.0,False,False
31-12-2025 10:00,ULKER,109.1,110.6,108.8,110.4,958026.0,0.2,1.3,0.28,364.29,1.3,375354.3,155.23,0.15,True,69.24,0.03,-0.3,0.33,2025-12-31,108.7,1.56,1,110.6,106.3,110.6,False,False
31-12-2025 10:00,AEFES,15.68,16.02,15.67,16.0,10370757.0,0.02,0.32,0.05,515.38,0.32,5208527.6,99.11,0.06,True,60.03,-0.03,-0.06,0.03,2025-12-31,15.7,1.91,0,,15.33,16.71,False,False
31-12-2025 10:00,BMSTL,90.3,92.0,89.6,91.95,298026.0,0.05,1.65,0.32,415.62,1.65,130411.1,128.53,0.03,True,69.15,1.25,1.26,-0.01,2025-12-31,90.3,1.83,0,,87.05,93.75,False,False
31-12-2025 10:00,KRDMA,23.62,23.88,23.62,23.82,251039.0,0.06,0.2,0.02,733.33,0.2,125713.2,99.69,0.3,True,50.42,-0.15,-0.2,0.05,2025-12-31,23.48,1.45,0,,23.24,25.0,True,False
31-12-2025 10:00,ENKAI,78.95,80.0,78.95,79.9,1980738.0,0.1,0.95,0.17,475.76,0.95,783519.2,152.8,0.11,True,67.53,0.12,-0.02,0.14,2025-12-31,78.5,1.78,0,,77.35,81.5,False,False
31-12-2025 10:00,KONTR,10.93,11.15,10.86,11.11,27252212.0,0.04,0.18,0.01,1185.71,0.18,12328988.2,121.04,0.22,True,48.22,-0.14,-0.15,0.02,2025-12-31,10.8,2.87,0,,10.8,ATH,True,True
31-12-2025 10:00,GSDHO,4.52,4.61,4.52,4.59,761761.0,0.02,0.07,0.02,366.67,0.07,300288.3,153.68,0.29,True,68.04,-0.0,-0.02,0.01,2025-12-31,4.51,1.77,0,,4.4,4.64,False,False
31-12-2025 10:00,GUBRF,348.0,352.75,342.0,352.0,856784.0,0.75,4.0,0.22,1677.78,4.0,271434.0,215.65,0.19,True,55.77,-1.57,-1.67,0.1,2025-12-31,345.25,1.96,0,,341.5,364.0,False,False
31-12-2025 10:00,IHYAY,1.97,1.99,1.96,1.99,1991228.0,0.0,0.02,0.0,566.67,0.02,658075.6,202.58,0.0,True,54.19,-0.01,-0.01,0.0,2025-12-31,1.97,1.02,1,1.99,1.91,2.14,True,False
30-12-2025 17:00,LMKDC,27.42,28.0,27.42,27.92,658717.0,0.08,0.5,0.1,420.83,0.5,317327.9,107.58,0.16,True,78.33,0.14,0.07,0.07,2025-12-30,27.1,3.03,0,,26.84,ATH,False,False
30-12-2025 17:00,ARSAN,3.38,3.5,3.37,3.5,16259497.0,0.0,0.12,0.03,344.44,0.12,5857391.5,177.59,0.0,True,78.75,0.04,0.01,0.03,2025-12-30,3.19,9.72,0,,3.18,ATH,False,False
30-12-2025 17:00,EDIP,34.22,36.0,34.1,35.92,354205.0,0.08,1.7,0.19,804.26,1.7,99248.7,256.89,0.05,True,69.52,-0.25,-0.41,0.16,2025-12-30,34.0,5.65,0,,33.16,36.16,True,False
30-12-2025 17:00,LIDFA,4.23,4.29,4.22,4.29,1298571.0,0.0,0.06,0.01,757.14,0.06,641335.0,102.48,0.0,True,61.64,0.01,0.0,0.01,2025-12-30,4.18,2.63,0,,4.18,ATH,False,False
30-12-2025 15:00,GSDDE,9.9,10.12,9.84,10.11,628709.0,0.01,0.21,0.03,577.42,0.21,169157.1,271.67,0.05,True,64.99,0.01,0.01,0.0,2025-12-30,9.7,4.23,0,,9.65,10.24,False,False
30-12-2025 15:00,SKBNK,7.73,7.91,7.72,7.88,6513595.0,0.03,0.15,0.01,1400.0,0.15,1724513.5,277.71,0.2,True,67.84,-0.01,-0.01,0.01,2025-12-30,7.77,1.42,1,7.91,7.71,7.91,True,True
30-12-2025 14:00,MERCN,16.17,16.6,16.16,16.57,1655308.0,0.03,0.4,0.05,669.23,0.4,517533.5,219.85,0.08,True,71.48,0.09,0.06,0.03,2025-12-30,15.9,4.21,0,,15.71,ATH,False,False
30-12-2025 13:00,AKSEN,66.85,68.75,66.4,68.65,2426510.0,0.1,1.8,0.11,1536.36,1.8,882252.0,175.04,0.06,True,65.94,0.57,0.62,-0.06,2025-12-30,66.55,3.16,0,,65.9,70.05,False,False
30-12-2025 11:00,DESA,11.08,12.01,11.06,11.81,1971536.0,0.2,0.73,0.07,973.53,0.73,227874.3,765.19,0.27,True,79.55,0.02,-0.03,0.04,2025-12-30,11.09,6.49,0,,11.01,ATH,True,True
30-12-2025 10:00,GMTAS,44.86,45.24,44.86,45.14,142922.0,0.1,0.28,0.03,775.0,0.28,79909.3,78.86,0.36,True,48.89,-0.1,-0.08,-0.02,2025-12-30,44.84,0.67,0,,44.66,46.26,False,False
30-12-2025 10:00,ARMGD,67.05,72.45,66.1,72.45,2672176.0,0.0,5.4,0.8,575.0,5.4,399987.8,568.06,0.0,True,86.31,1.27,0.6,0.67,2025-12-30,65.9,9.94,1,72.45,61.4,ATH,False,False
30-12-2025 10:00,EKOS,5.77,6.18,5.77,6.09,9666296.0,0.09,0.32,0.02,1900.0,0.32,2791424.6,246.29,0.28,True,41.11,-0.24,-0.23,-0.0,2025-12-30,5.78,5.36,1,6.18,5.75,6.18,True,True
30-12-2025 10:00,MAKTK,15.48,16.54,15.15,16.48,9957208.0,0.06,1.0,0.16,545.16,1.0,2179915.9,356.77,0.06,True,84.88,0.53,0.35,0.17,2025-12-30,15.1,9.14,0,,13.2,ATH,False,False
30-12-2025 10:00,CELHA,10.35,11.49,10.26,11.49,2618971.0,0.0,1.14,0.14,697.2,1.14,482946.2,442.29,0.0,True,79.25,0.2,0.11,0.08,2025-12-30,10.45,9.95,1,11.49,9.65,ATH,False,False
30-12-2025 10:00,CGCAM,34.0,35.04,34.0,34.84,1745207.0,0.2,0.84,0.0,20900.0,0.84,437801.7,298.63,0.24,True,65.44,0.33,0.34,-0.02,2025-12-30,33.86,2.89,0,,33.8,35.4,False,False
30-12-2025 10:00,AVHOL,36.1,38.38,36.04,37.86,842709.0,0.52,1.76,0.12,1391.53,1.76,167469.7,403.2,0.3,True,58.24,-0.3,-0.25,-0.05,2025-12-30,36.1,4.88,2,36.04,36.04,40.8,False,False
29-12-2025 17:00,PETUN,11.04,11.12,10.9,11.12,397297.0,0.0,0.08,0.0,3900.0,0.08,113430.7,250.26,0.0,True,50.05,0.0,0.01,-0.0,2025-12-29,11.12,0.0,0,,10.98,11.27,False,False
29-12-2025 17:00,KNFRT,12.1,13.47,12.1,13.47,4246515.0,0.0,1.37,0.08,1679.22,1.37,937050.0,353.18,0.0,True,68.09,0.26,0.25,0.01,2025-12-29,12.25,9.96,0,,11.97,ATH,False,False
29-12-2025 15:00,IZMDC,6.44,6.92,6.42,6.81,6928397.0,0.11,0.37,0.03,1175.86,0.37,1137310.3,509.19,0.3,True,67.67,-0.03,-0.05,0.02,2025-12-29,6.55,3.97,0,,6.25,ATH,False,False
29-12-2025 14:00,POLHO,15.98,16.46,15.97,16.43,719678.0,0.03,0.45,0.02,2400.0,0.45,370394.0,94.3,0.07,True,52.96,-0.16,-0.2,0.04,2025-12-29,16.04,2.43,0,,15.84,17.79,True,False
29-12-2025 13:00,MERKO,13.96,14.51,13.94,14.48,3442978.0,0.03,0.52,0.1,436.08,0.52,1883748.8,82.77,0.06,True,86.97,0.36,0.28,0.09,2025-12-29,13.6,6.47,0,,12.43,ATH,False,False
29-12-2025 10:00,ZERGY,11.29,11.82,11.25,11.68,21597198.0,0.14,0.39,0.01,6400.0,0.39,8332039.9,159.21,0.36,True,39.24,-0.31,-0.3,-0.01,2025-12-29,11.3,3.36,0,,ATL,13.45,True,True
26-12-2025 17:00,OSTIM,3.01,3.08,3.0,3.06,7073562.0,0.02,0.05,0.0,1566.67,0.05,1762474.6,301.34,0.4,True,44.31,-0.03,-0.03,0.0,2025-12-26,3.03,0.99,1,3.08,3.0,3.08,True,False
26-12-2025 17:00,SOKM,49.96,50.6,49.68,50.55,1003433.0,0.05,0.59,0.03,1866.67,0.59,529728.7,89.42,0.08,True,54.44,-0.09,-0.04,-0.05,2025-12-26,50.55,0.0,0,,49.3,51.75,False,False
26-12-2025 17:00,SANFM,8.01,8.4,8.0,8.31,4544455.0,0.09,0.3,0.02,1664.71,0.3,1180802.5,284.86,0.3,True,71.37,0.09,0.09,0.01,2025-12-26,8.2,1.34,1,8.4,7.81,8.4,False,False
26-12-2025 16:00,BARMA,36.6,36.98,36.46,36.94,306979.0,0.04,0.34,0.06,507.14,0.34,174184.6,76.24,0.12,True,79.04,0.38,0.36,0.02,2025-12-26,36.22,1.99,0,,33.1,ATH,False,False
26-12-2025 16:00,EUPWR,31.96,33.04,31.9,33.0,1745252.0,0.04,1.04,0.13,676.12,1.04,1022481.7,70.69,0.04,True,76.57,0.4,0.33,0.07,2025-12-26,31.48,4.83,0,,31.32,ATH,False,False
26-12-2025 16:00,SELVA,2.36,2.48,2.35,2.47,6953944.0,0.01,0.11,0.02,547.06,0.11,2627958.5,164.61,0.09,True,59.19,-0.03,-0.05,0.02,2025-12-26,2.3,7.39,0,,2.24,2.82,True,False
26-12-2025 15:00,RYSAS,14.17,15.01,14.17,15.01,3463581.0,0.0,0.84,0.03,2609.68,0.84,499287.2,593.71,0.0,True,57.84,-0.14,-0.17,0.04,2025-12-26,14.41,4.16,0,,14.04,ATH,True,True
26-12-2025 15:00,MIATK,36.8,38.3,36.72,38.14,4640746.0,0.16,1.34,0.1,1295.83,1.34,1410091.8,229.11,0.12,True,65.86,-0.08,-0.18,0.09,2025-12-26,36.72,3.87,0,,36.68,ATH,True,False
26-12-2025 14:00,EGEGY,22.3,25.62,22.22,25.56,7110159.0,0.06,3.26,0.24,1281.36,3.26,1646767.0,331.76,0.02,True,72.81,0.09,-0.04,0.13,2025-12-26,23.3,9.7,0,,22.2,ATH,False,False
26-12-2025 10:00,GENIL,182.0,188.9,180.4,187.8,727804.0,1.1,5.8,0.54,974.07,5.8,87497.6,731.8,0.19,True,79.45,1.78,1.47,0.31,2025-12-26,182.0,3.19,1,188.9,179.4,188.9,False,False
26-12-2025 10:00,KLKIM,34.44,34.68,34.14,34.68,400437.0,0.0,0.24,0.04,500.0,0.24,210916.2,89.86,0.0,True,69.99,0.22,0.2,0.03,2025-12-26,34.28,1.17,0,,33.58,34.78,False,False
26-12-2025 10:00,BALSU,18.13,18.91,18.12,18.73,6913485.0,0.18,0.6,0.01,4515.38,0.6,1392254.7,396.57,0.3,True,67.69,0.13,0.18,-0.05,2025-12-26,18.01,4.0,0,,17.86,19.0,False,False
25-12-2025 17:00,DMSAS,13.22,13.5,13.22,13.5,655459.0,0.0,0.28,0.05,471.43,0.28,242056.4,170.79,0.0,True,91.79,0.16,0.13,0.04,2025-12-25,12.95,4.25,0,,ATL,ATH,False,False
25-12-2025 17:00,ERCB,79.2,86.8,78.65,86.8,2577482.0,0.0,7.6,0.77,887.01,7.6,580840.2,343.75,0.0,True,76.83,0.51,0.05,0.47,2025-12-25,78.95,9.94,0,,76.8,ATH,False,False
25-12-2025 16:00,GEDIK,5.85,6.01,5.81,5.97,1863590.0,0.04,0.12,0.02,605.88,0.12,515559.3,261.47,0.33,True,73.26,0.02,-0.0,0.02,2025-12-25,5.75,3.83,1,6.01,5.72,6.01,False,False
25-12-2025 13:00,KLYPV,58.0,59.0,57.9,58.9,218453.0,0.1,0.9,0.08,1100.0,0.9,107402.6,103.4,0.11,True,58.53,-0.12,-0.16,0.04,2025-12-25,57.6,2.26,0,,57.6,ATH,False,False
25-12-2025 13:00,VESTL,30.2,30.4,30.18,30.38,994102.0,0.02,0.18,0.03,592.31,0.18,456686.5,117.68,0.11,True,66.12,0.03,-0.0,0.03,2025-12-25,29.94,1.47,0,,29.9,ATH,False,False
25-12-2025 13:00,ICUGS,2.66,2.68,2.65,2.68,2075387.0,0.0,0.02,0.0,400.0,0.02,1034443.0,100.63,0.0,True,56.89,0.0,-0.0,0.0,2025-12-25,2.66,0.75,0,,2.61,ATH,False,False
25-12-2025 12:00,TEKTU,10.76,11.28,10.71,11.21,2431721.0,0.07,0.45,0.01,6328.57,0.45,1190739.3,104.22,0.16,True,45.99,-0.11,-0.09,-0.02,2025-12-25,11.0,1.91,0,,10.69,ATH,False,False
25-12-2025 11:00,METRO,4.16,4.43,4.16,4.38,5408114.0,0.05,0.22,0.02,1000.0,0.22,1431772.1,277.72,0.23,True,50.47,-0.07,-0.08,0.01,2025-12-25,4.12,6.31,1,4.43,4.11,4.43,False,False
25-12-2025 11:00,DCTTR,8.8,9.63,8.77,9.51,6037930.0,0.12,0.71,0.1,631.96,0.71,1474126.3,309.59,0.17,True,72.8,0.06,-0.01,0.07,2025-12-25,8.9,6.85,1,9.63,8.34,9.63,False,False
24-12-2025 15:00,GOZDE,22.3,22.9,22.3,22.82,791945.0,0.08,0.52,0.1,420.0,0.52,183971.4,330.47,0.15,True,78.91,0.11,0.04,0.06,2025-12-24,21.9,4.2,0,,21.74,ATH,False,False
24-12-2025 13:00,MOPAS,40.5,42.02,40.5,41.92,2518687.0,0.1,1.42,0.37,283.78,1.42,1200682.1,109.77,0.07,True,80.42,0.48,0.27,0.21,2025-12-24,39.4,6.4,1,42.02,ATL,42.02,False,False
24-12-2025 12:00,MACKO,32.84,33.68,32.74,33.56,223774.0,0.12,0.72,0.07,900.0,0.72,117521.6,90.41,0.17,True,61.98,0.02,-0.0,0.02,2025-12-24,33.16,1.21,0,,ATL,ATH,False,False
24-12-2025 11:00,DOFER,55.5,56.45,55.5,56.45,367356.0,0.0,0.95,0.21,341.86,0.95,116922.6,214.19,0.0,True,86.55,0.28,0.11,0.17,2025-12-24,54.8,3.01,0,,ATL,ATH,False,False
24-12-2025 11:00,TRENJ,90.6,96.95,89.3,96.2,3004764.0,0.75,5.6,0.51,987.38,5.6,676810.8,343.96,0.13,True,88.41,0.76,0.37,0.39,2025-12-24,89.15,7.91,0,,ATL,ATH,False,False
24-12-2025 11:00,ORCAY,3.54,3.75,3.5,3.7,2507562.0,0.05,0.16,0.02,627.27,0.16,441396.0,468.1,0.31,True,74.73,0.01,-0.0,0.01,2025-12-24,3.48,6.32,1,3.75,3.42,3.75,False,False
24-12-2025 10:00,NTHOL,49.14,49.78,49.12,49.68,318056.0,0.1,0.54,0.05,900.0,0.54,141867.1,124.19,0.19,True,77.63,0.31,0.31,-0.01,2025-12-24,49.1,1.18,0,,ATL,ATH,False,False
23-12-2025 16:00,SURGY,41.04,41.74,41.0,41.6,3057681.0,0.14,0.56,0.14,305.8,0.56,570951.3,435.54,0.25,True,66.89,0.05,0.02,0.03,2025-12-23,41.1,1.22,0,,ATL,ATH,False,False
