Tarih,Hisse,open,high,low,close,volume,YuksekKapanis_Fark,AcilisKapanis_Fark,AcilisKapanisFark_Ort,AcilisKapanisFark_OrtalamayaGoreDegisim,AcilisKapanisFarkOrt_MaxSon10,HacimOrtalama,%Hacim_HacimOrtalama,Fark_Orani,Kosul,rsi,MACD_12_26_9,MACDs_12_26_9,MACDh_12_26_9,Tarih1,prev_close,%Deg,isPivot,pointpos,destek,direnc,Tsinyal_Banker_Dip,Tsinyal_Banker_DipKarar
05-12-2025 13:00,TCKRC,50.75,55.7,50.0,55.35,8034410.0,0.35,4.6,0.42,995.24,4.6,868810.1,824.76,0.08,True,81.47,0.28,0.06,0.22,2025-12-05,50.7,9.17,0,,48.02,ATH,False,False
05-12-2025 13:00,ESEN,7.37,7.51,7.27,7.51,10966456.0,0.0,0.14,0.02,536.36,0.14,3977056.4,175.74,0.0,True,70.88,0.09,0.09,0.01,2025-12-05,7.31,2.74,0,,7.0,ATH,False,False
05-12-2025 13:00,IZENR,10.1,10.26,10.08,10.24,3937534.0,0.02,0.14,0.01,1300.0,0.14,2441432.7,61.28,0.14,True,65.75,0.07,0.06,0.01,2025-12-05,9.91,3.33,0,,9.65,ATH,False,False
05-12-2025 12:00,EMKEL,62.05,63.75,62.0,63.75,1324092.0,0.0,1.7,0.23,639.13,1.7,599209.5,120.97,0.0,True,66.89,0.7,0.66,0.04,2025-12-05,61.8,3.16,0,,60.3,ATH,False,False
05-12-2025 12:00,MERCN,17.69,18.18,17.69,18.08,1824720.0,0.1,0.39,0.01,2900.0,0.39,681285.8,167.83,0.26,True,62.04,0.09,0.08,0.01,2025-12-05,17.86,1.23,0,,17.2,18.45,False,False
05-12-2025 12:00,ALKIM,15.95,16.09,15.95,16.08,161437.0,0.01,0.13,0.02,622.22,0.13,67930.0,137.65,0.08,True,61.64,-0.02,-0.03,0.01,2025-12-05,15.81,1.71,0,,15.8,16.16,False,False
05-12-2025 12:00,TRMET,97.35,102.2,97.0,101.3,4145121.0,0.9,3.95,0.62,537.1,3.95,1948070.0,112.78,0.23,True,71.52,0.8,0.17,0.63,2025-12-05,97.1,4.33,0,,93.3,103.5,False,False
05-12-2025 12:00,DAPGM,11.3,11.49,11.28,11.44,1220324.0,0.05,0.14,0.02,723.53,0.14,722264.5,68.96,0.36,True,64.19,0.01,-0.0,0.02,2025-12-05,11.27,1.51,0,,11.11,11.72,False,False
05-12-2025 12:00,PINSU,12.91,13.5,12.88,13.37,3212420.0,0.13,0.46,0.05,858.33,0.46,579593.9,454.25,0.28,True,70.0,-0.03,-0.08,0.04,2025-12-05,12.8,4.45,0,,12.95,13.4,False,False
05-12-2025 12:00,DURDO,3.66,3.71,3.62,3.7,1112534.0,0.01,0.04,0.01,700.0,0.04,363613.7,205.97,0.25,True,58.19,0.01,0.01,-0.0,2025-12-05,3.66,1.09,0,,3.59,3.75,False,False
05-12-2025 12:00,IEYHO,58.5,59.35,57.0,59.25,3573420.0,0.1,0.75,0.09,733.33,0.75,1349831.3,164.73,0.13,True,53.34,0.08,0.15,-0.08,2025-12-05,59.25,0.0,0,,57.35,60.1,False,False
05-12-2025 12:00,GESAN,44.88,45.44,44.86,45.36,444302.0,0.08,0.48,0.07,585.71,0.48,262110.2,69.51,0.17,True,63.54,0.09,0.09,0.0,2025-12-05,44.62,1.66,0,,44.3,45.68,False,False
05-12-2025 12:00,GUBRF,308.25,313.0,307.0,312.5,580745.0,0.5,4.25,0.28,1445.45,4.25,264332.5,119.7,0.12,True,62.32,0.39,-0.15,0.54,2025-12-05,306.0,2.12,0,,302.25,318.25,False,False
05-12-2025 12:00,MIATK,36.24,37.46,36.14,37.14,6210282.0,0.32,0.9,0.16,462.5,0.9,1981091.7,213.48,0.36,True,75.81,0.16,-0.0,0.17,2025-12-05,35.9,3.45,0,,35.08,37.32,False,False
05-12-2025 11:00,RUZYE,12.88,13.7,12.87,13.6,6980034.0,0.1,0.72,0.09,682.61,0.72,2143958.8,225.57,0.14,True,66.48,0.11,0.02,0.09,2025-12-05,13.06,4.13,0,,12.48,14.87,False,False
05-12-2025 11:00,CIMSA,47.3,48.1,47.24,47.96,1645847.0,0.14,0.66,0.0,32900.0,0.66,829569.5,98.4,0.21,True,52.43,-0.05,0.07,-0.13,2025-12-05,47.5,0.97,0,,47.68,49.44,False,False
05-12-2025 11:00,LILAK,25.36,25.64,25.34,25.62,455827.0,0.02,0.26,0.01,1757.14,0.26,242109.0,88.27,0.08,True,54.69,-0.04,-0.02,-0.02,2025-12-05,25.26,1.43,0,,25.2,26.02,False,False
05-12-2025 11:00,LIDER,51.1,53.7,50.9,53.65,817515.0,0.05,2.55,0.43,497.19,2.55,378859.9,115.78,0.02,True,76.57,1.26,1.14,0.11,2025-12-05,50.75,5.71,0,,45.32,ATH,False,False
05-12-2025 11:00,LYDHO,175.9,178.6,175.1,178.6,135384.0,0.0,2.7,0.46,486.96,2.7,77732.6,74.17,0.0,True,67.12,0.43,-0.44,0.87,2025-12-05,173.0,3.24,0,,169.0,192.0,False,False
05-12-2025 11:00,BARMA,30.2,30.98,30.12,30.96,719747.0,0.02,0.76,0.05,1307.41,0.76,451322.3,59.48,0.03,True,66.04,0.37,0.37,0.0,2025-12-05,30.68,0.91,0,,28.9,ATH,False,False
05-12-2025 11:00,MOBTL,8.21,8.7,8.18,8.58,5984657.0,0.12,0.37,0.04,927.78,0.37,1604447.5,273.0,0.32,True,70.73,0.07,0.04,0.03,2025-12-05,8.2,4.63,0,,7.89,8.7,False,False
05-12-2025 11:00,KONTR,30.24,31.8,30.2,31.62,16265022.0,0.18,1.38,0.07,1871.43,1.38,5720442.0,184.33,0.13,True,54.23,-0.46,-0.56,0.1,2025-12-05,30.36,4.15,0,,ATL,35.32,True,True
05-12-2025 11:00,TEZOL,12.36,12.69,12.35,12.64,1158138.0,0.05,0.28,0.03,723.53,0.28,247220.8,368.46,0.18,True,68.96,0.01,-0.01,0.01,2025-12-05,12.2,3.61,0,,12.22,ATH,False,False
05-12-2025 11:00,FONET,2.74,2.78,2.74,2.77,3817196.0,0.01,0.03,0.0,1400.0,0.03,2232734.5,70.97,0.33,True,53.6,-0.0,-0.0,-0.0,2025-12-05,2.73,1.47,0,,2.74,2.83,False,False
05-12-2025 11:00,YYAPI,1.99,2.03,1.98,2.02,15506825.0,0.01,0.03,0.0,1400.0,0.03,7737736.6,100.41,0.33,True,54.94,-0.02,-0.02,0.0,2025-12-05,1.97,2.54,0,,2.01,2.06,True,False
05-12-2025 11:00,AFYON,12.97,13.12,12.96,13.11,393127.0,0.01,0.14,0.0,6900.0,0.14,214101.8,83.62,0.07,True,52.03,-0.04,-0.04,-0.01,2025-12-05,12.98,1.0,0,,12.93,13.35,False,False
05-12-2025 11:00,MERIT,16.72,17.08,16.72,17.05,773324.0,0.03,0.33,0.01,5400.0,0.33,397717.7,94.44,0.09,True,52.37,-0.11,-0.13,0.02,2025-12-05,16.8,1.49,0,,ATL,17.34,True,True
05-12-2025 11:00,YESIL,2.09,2.14,2.09,2.13,3057720.0,0.01,0.04,0.0,900.0,0.04,1797683.4,70.09,0.25,True,51.15,-0.02,-0.03,0.01,2025-12-05,2.08,2.4,0,,2.08,2.21,True,True
05-12-2025 11:00,IHEVA,2.17,2.2,2.17,2.2,286874.0,0.0,0.03,0.0,650.0,0.03,180974.5,58.52,0.0,True,44.59,-0.02,-0.02,0.0,2025-12-05,2.18,0.92,0,,2.16,2.37,True,False
05-12-2025 11:00,QUAGR,3.53,3.72,3.47,3.67,55882287.0,0.05,0.14,0.01,2233.33,0.14,12711497.2,339.62,0.36,True,60.02,-0.01,-0.01,-0.0,2025-12-05,3.51,4.56,0,,3.54,3.81,True,True
05-12-2025 11:00,TEKTU,12.46,13.39,12.37,13.18,5390413.0,0.21,0.72,0.06,1141.38,0.72,1445024.2,273.03,0.29,True,61.99,0.03,0.03,-0.0,2025-12-05,12.33,6.89,0,,12.07,13.23,False,False
05-12-2025 10:00,DENGE,3.2,3.37,3.17,3.34,3616162.0,0.03,0.14,0.03,400.0,0.14,1160530.4,211.6,0.21,True,63.33,0.02,-0.01,0.03,2025-12-05,3.24,3.09,0,,2.99,3.5,False,False
05-12-2025 10:00,PLTUR,20.9,21.28,20.7,21.24,482507.0,0.04,0.34,0.04,709.52,0.34,193979.2,148.74,0.12,True,61.35,0.08,0.08,0.0,2025-12-05,20.74,2.41,0,,20.04,21.82,False,False
05-12-2025 10:00,POLHO,17.63,18.07,17.57,18.07,808956.0,0.0,0.44,0.03,1194.12,0.44,470041.1,72.1,0.0,True,60.17,0.09,0.11,-0.02,2025-12-05,17.65,2.38,0,,16.59,18.65,False,False
05-12-2025 10:00,ISCTR,13.65,13.98,13.6,13.97,215213720.0,0.01,0.32,0.01,2809.09,0.32,75553165.2,184.85,0.03,True,59.1,-0.03,-0.02,-0.01,2025-12-05,13.66,2.27,0,,13.72,14.24,False,False
05-12-2025 10:00,OZRDN,13.45,14.45,13.3,14.41,377382.0,0.04,0.96,0.11,749.56,0.96,97660.1,286.42,0.04,True,72.17,0.27,0.2,0.07,2025-12-05,13.4,7.54,0,,11.71,ATH,False,False
05-12-2025 10:00,BURCE,47.7,52.9,47.66,51.6,559291.0,1.3,3.9,0.37,954.05,3.9,139002.4,302.36,0.33,True,57.21,1.76,2.27,-0.51,2025-12-05,52.95,-2.55,0,,39.6,54.6,False,False
05-12-2025 10:00,ISKPL,9.67,10.5,9.54,10.36,8008844.0,0.14,0.69,0.11,538.89,0.69,1842798.2,334.6,0.2,True,88.67,0.29,0.2,0.09,2025-12-05,9.65,7.36,0,,8.37,ATH,False,False
05-12-2025 10:00,SMRVA,464.25,505.5,464.0,495.75,324437.0,9.75,31.5,3.12,908.0,31.5,77458.8,318.85,0.31,True,52.84,-3.66,-1.92,-1.75,2025-12-05,476.5,4.04,0,,494.25,516.0,False,False
05-12-2025 10:00,BTCIM,3.51,3.85,3.51,3.81,111588316.0,0.04,0.3,0.03,934.48,0.3,14075475.9,692.79,0.13,True,76.88,0.01,-0.01,0.01,2025-12-05,3.51,8.55,0,,3.36,ATH,False,False
05-12-2025 10:00,ENJSA,81.6,83.65,81.2,83.65,635091.0,0.0,2.05,0.16,1181.25,2.05,178795.1,255.21,0.0,True,66.7,0.1,0.09,0.0,2025-12-05,81.7,2.39,0,,81.65,83.9,False,False
05-12-2025 10:00,SARKY,15.6,16.03,15.54,15.91,653164.0,0.12,0.31,0.02,1723.53,0.31,197236.7,231.16,0.39,True,69.87,0.13,0.14,-0.01,2025-12-05,15.51,2.58,0,,14.93,ATH,False,False
05-12-2025 10:00,LINK,237.1,253.0,235.0,253.0,597855.0,0.0,15.9,0.61,2506.56,15.9,185351.0,222.55,0.0,True,63.8,5.3,6.91,-1.61,2025-12-05,240.4,5.24,0,,ATL,259.5,False,False
05-12-2025 10:00,ALTIN,76.89,77.67,76.88,77.48,6299202.0,0.19,0.59,0.11,446.3,0.59,2112837.0,198.14,0.32,True,75.09,0.27,0.22,0.05,2025-12-05,76.8,0.89,0,,76.0,ATH,False,False
05-12-2025 10:00,ALKLC,124.9,134.4,124.3,134.3,1913312.0,0.1,9.4,1.32,612.12,9.4,486073.8,293.63,0.01,True,83.07,4.25,3.76,0.49,2025-12-05,124.1,8.22,0,,115.2,ATH,False,False
05-12-2025 10:00,TURSG,11.73,11.82,11.57,11.8,12847098.0,0.02,0.07,0.01,775.0,0.07,4064535.6,216.08,0.29,True,52.22,-0.03,-0.05,0.02,2025-12-05,11.71,0.77,0,,11.53,11.88,False,False
05-12-2025 10:00,ALARK,95.9,99.25,95.65,99.0,7338589.0,0.25,3.1,0.38,726.67,3.1,1264985.5,480.13,0.08,True,78.06,0.61,0.33,0.28,2025-12-05,95.25,3.94,0,,92.05,ATH,False,False
05-12-2025 10:00,AGHOL,28.06,28.36,27.96,28.3,885880.0,0.06,0.24,0.02,1100.0,0.24,395518.6,123.98,0.25,True,54.01,-0.07,-0.08,0.01,2025-12-05,28.02,1.0,0,,27.8,28.86,False,False
05-12-2025 10:00,ALBRK,8.16,8.28,8.12,8.26,5763840.0,0.02,0.1,0.01,614.29,0.1,2587067.4,122.79,0.2,True,60.99,0.0,-0.01,0.01,2025-12-05,8.16,1.23,0,,8.03,8.36,False,False
05-12-2025 10:00,AKBNK,64.3,66.55,64.2,66.5,78052185.0,0.05,2.2,0.06,3900.0,2.2,19954197.9,291.16,0.02,True,58.57,-0.29,-0.16,-0.12,2025-12-05,64.4,3.26,0,,65.4,68.15,False,False
04-12-2025 17:00,PASEU,132.2,137.7,130.9,137.0,718653.0,0.7,4.8,0.43,1016.28,4.8,272106.9,164.11,0.15,True,59.44,-1.1,-1.34,0.24,2025-12-04,133.0,3.01,0,,128.3,137.7,False,False
04-12-2025 17:00,TRALT,36.44,38.96,36.22,38.96,52363270.0,0.0,2.52,0.35,624.14,2.52,14609992.3,258.41,0.0,True,84.59,0.37,0.1,0.27,2025-12-04,35.42,9.99,0,,35.32,ATH,False,False
04-12-2025 17:00,CWENE,26.84,28.3,26.82,28.2,14384750.0,0.1,1.36,0.08,1643.59,1.36,4043384.4,255.76,0.07,True,72.2,0.46,0.43,0.03,2025-12-04,27.14,3.91,0,,26.66,ATH,False,False
04-12-2025 17:00,YKSLN,6.01,6.22,6.0,6.16,4885505.0,0.06,0.15,0.02,525.0,0.15,1456320.8,235.47,0.4,True,74.19,0.02,0.0,0.02,2025-12-04,5.92,4.05,0,,5.83,ATH,False,False
04-12-2025 17:00,RALYH,207.2,209.0,206.0,208.9,144155.0,0.1,1.7,0.17,900.0,1.7,60383.6,138.73,0.06,True,59.21,1.0,0.57,0.42,2025-12-04,207.0,0.92,0,,191.5,219.1,False,False
04-12-2025 16:00,MEKAG,3.92,3.99,3.91,3.98,1054880.0,0.01,0.06,0.01,757.14,0.06,634759.3,66.19,0.17,True,53.87,-0.01,-0.02,0.0,2025-12-04,3.9,2.05,0,,3.89,4.1,True,True
04-12-2025 16:00,KAREL,9.05,9.15,8.97,9.13,1498432.0,0.02,0.08,0.01,471.43,0.08,435546.6,244.03,0.25,True,62.77,0.01,0.01,-0.0,2025-12-04,9.0,1.44,1,9.15,8.75,9.15,False,False
04-12-2025 16:00,PENTA,13.64,13.82,13.6,13.81,465346.0,0.01,0.17,0.01,1316.67,0.17,224043.9,107.7,0.06,True,58.51,0.01,0.01,0.0,2025-12-04,13.62,1.4,0,,13.57,13.95,False,False
04-12-2025 16:00,BLCYT,38.36,39.4,38.3,39.3,692017.0,0.1,0.94,0.26,264.34,0.94,277647.7,149.24,0.11,True,82.27,1.09,0.96,0.13,2025-12-04,36.42,7.91,0,,32.1,ATH,False,False
04-12-2025 15:00,OBAMS,7.56,7.92,7.55,7.87,13606395.0,0.05,0.31,0.03,1007.14,0.31,3503092.4,288.41,0.16,True,67.54,0.03,0.02,0.01,2025-12-04,7.5,4.93,0,,7.22,8.2,False,False
04-12-2025 15:00,PNSUT,11.02,11.22,11.02,11.17,716522.0,0.05,0.15,0.01,2400.0,0.15,140242.9,410.91,0.33,True,64.19,0.03,0.03,0.0,2025-12-04,10.97,1.82,0,,10.85,11.2,False,False
04-12-2025 15:00,BIGCH,61.4,64.15,61.3,63.65,314238.0,0.5,2.25,0.17,1223.53,2.25,140588.3,123.52,0.22,True,74.4,0.62,0.34,0.27,2025-12-04,61.3,3.83,0,,58.55,ATH,False,False
04-12-2025 15:00,AKSA,10.35,10.55,10.33,10.51,3376221.0,0.04,0.16,0.01,1042.86,0.16,1194152.2,182.73,0.25,True,62.4,0.01,0.02,-0.0,2025-12-04,10.4,1.06,0,,10.01,10.55,False,False
04-12-2025 14:00,BORSK,22.64,23.3,22.54,23.12,732302.0,0.18,0.48,0.04,1100.0,0.48,152193.6,381.16,0.37,True,63.21,0.01,-0.0,0.01,2025-12-04,22.7,1.85,0,,22.52,23.48,False,False
04-12-2025 14:00,BMSCH,24.64,27.36,24.54,26.68,2072859.0,0.68,2.04,0.22,844.44,2.04,497836.7,316.37,0.33,True,72.11,0.44,0.39,0.05,2025-12-04,24.92,7.06,0,,23.7,ATH,False,False
04-12-2025 14:00,SELEC,68.45,69.95,68.4,69.8,109409.0,0.15,1.35,0.04,2900.0,1.35,69620.8,57.15,0.11,True,55.74,-0.21,-0.23,0.02,2025-12-04,68.2,2.35,0,,68.2,71.45,False,False
04-12-2025 14:00,BIOEN,19.75,21.92,19.73,21.76,3880843.0,0.16,2.01,0.18,992.39,2.01,562215.7,590.28,0.08,True,82.86,0.12,0.03,0.1,2025-12-04,20.02,8.69,2,19.73,19.73,ATH,False,False
04-12-2025 13:00,ENSRI,64.7,67.8,64.5,67.0,655379.0,0.8,2.3,0.04,5011.11,2.3,245193.5,167.29,0.35,True,44.79,-2.42,-2.58,0.16,2025-12-04,66.1,1.36,0,,62.6,77.15,False,False
04-12-2025 13:00,EKOS,26.82,27.24,26.74,27.14,701023.0,0.1,0.32,0.05,515.38,0.32,289336.0,142.29,0.31,True,64.1,0.08,0.04,0.04,2025-12-04,26.7,1.65,1,27.24,26.44,27.24,False,False
04-12-2025 13:00,DZGYO,7.12,7.24,7.07,7.23,1072998.0,0.01,0.11,0.01,1471.43,0.11,384823.3,178.83,0.09,True,56.59,-0.0,0.01,-0.01,2025-12-04,7.17,0.84,2,7.07,7.07,7.35,False,False
04-12-2025 13:00,BEYAZ,27.12,28.4,27.12,28.4,1050784.0,0.0,1.28,0.26,392.31,1.28,399814.4,162.82,0.0,True,77.82,0.39,0.17,0.22,2025-12-04,25.82,9.99,0,,25.66,ATH,False,False
04-12-2025 13:00,GOZDE,21.3,21.84,21.24,21.74,365874.0,0.1,0.44,0.06,658.62,0.44,105834.1,245.71,0.23,True,67.13,0.06,0.02,0.04,2025-12-04,21.14,2.84,1,21.84,21.02,21.84,False,False
04-12-2025 13:00,BERA,17.0,17.85,16.99,17.79,4997101.0,0.06,0.79,0.08,939.47,0.79,1312860.5,280.63,0.08,True,75.27,0.08,0.03,0.05,2025-12-04,16.68,6.65,1,17.85,16.58,17.85,False,False
04-12-2025 13:00,CATES,36.26,37.06,36.12,36.9,274754.0,0.16,0.64,0.1,527.45,0.64,163746.1,67.79,0.25,True,69.14,0.33,0.32,0.01,2025-12-04,36.5,1.1,0,,35.64,ATH,False,False
04-12-2025 13:00,YEOTK,37.7,38.6,37.68,38.42,1073491.0,0.18,0.72,0.04,1794.74,0.72,515966.4,108.05,0.25,True,62.34,0.2,0.24,-0.04,2025-12-04,38.16,0.68,2,37.68,37.68,38.54,False,False
04-12-2025 12:00,SOKM,47.62,48.56,47.6,48.4,1278720.0,0.16,0.78,0.26,204.69,0.78,711698.8,79.67,0.21,True,69.65,0.3,0.18,0.12,2025-12-04,47.64,1.6,0,,45.82,ATH,False,False
04-12-2025 12:00,KBORU,13.94,14.08,13.92,14.06,589587.0,0.02,0.12,0.01,990.91,0.12,275638.8,113.9,0.17,True,58.28,-0.01,-0.02,0.01,2025-12-04,13.9,1.15,0,,13.83,14.4,False,False
04-12-2025 12:00,KOCMT,2.84,2.88,2.84,2.88,7651449.0,0.0,0.04,0.0,900.0,0.04,3887647.5,96.81,0.0,True,58.77,0.0,0.0,0.0,2025-12-04,2.82,2.13,0,,2.82,2.91,False,False
04-12-2025 12:00,DAGI,8.7,8.87,8.62,8.86,2262221.0,0.01,0.16,0.03,433.33,0.16,1327394.6,70.43,0.06,True,69.42,0.16,0.14,0.01,2025-12-04,8.73,1.49,0,,8.23,ATH,False,False
04-12-2025 11:00,VRGYO,2.84,2.88,2.84,2.88,5844553.0,0.0,0.04,0.0,1233.33,0.04,3400257.5,71.89,0.0,True,54.91,0.01,0.02,-0.0,2025-12-04,2.87,0.35,0,,2.78,2.93,False,False
04-12-2025 11:00,DMLKT,5.97,5.98,5.95,5.98,1774327.0,0.0,0.01,0.0,900.0,0.01,844371.2,110.14,0.0,True,55.48,0.01,0.01,-0.0,2025-12-04,5.97,0.17,3,,5.87,6.01,False,False
04-12-2025 11:00,AYDEM,19.5,20.14,19.5,20.02,2140821.0,0.12,0.52,0.09,484.27,0.52,537758.1,298.1,0.23,True,83.34,0.23,0.18,0.05,2025-12-04,19.44,2.98,0,,18.31,ATH,False,False
04-12-2025 11:00,DARDL,2.26,2.3,2.25,2.29,9464896.0,0.01,0.03,0.0,1400.0,0.03,2458183.0,285.04,0.33,True,58.95,-0.0,-0.0,0.0,2025-12-04,2.25,1.78,1,2.3,2.23,2.3,False,False
04-12-2025 11:00,IZMDC,6.68,7.1,6.58,7.08,8045317.0,0.02,0.4,0.05,669.23,0.4,3860166.0,108.42,0.05,True,78.64,0.18,0.13,0.05,2025-12-04,6.67,6.15,0,,6.07,ATH,False,False
04-12-2025 11:00,ICUGS,2.86,3.08,2.85,3.03,20300683.0,0.05,0.17,0.02,794.74,0.17,3569775.6,468.68,0.29,True,79.14,0.01,0.0,0.01,2025-12-04,2.82,7.45,1,3.08,2.81,3.08,False,False
04-12-2025 11:00,DESA,11.37,11.53,11.37,11.52,186024.0,0.01,0.15,0.01,2400.0,0.15,110223.5,68.77,0.07,True,62.26,0.01,-0.0,0.01,2025-12-04,11.22,2.67,0,,11.21,11.56,False,False
04-12-2025 11:00,KLRHO,162.8,167.2,162.4,167.0,209749.0,0.2,4.2,0.22,1809.09,4.2,113436.5,84.9,0.05,True,67.02,1.87,1.96,-0.09,2025-12-04,165.1,1.15,0,,161.7,167.1,False,False
04-12-2025 10:00,METRO,5.67,5.94,5.62,5.94,7650392.0,0.0,0.27,0.05,440.0,0.27,2806323.9,172.61,0.0,True,88.01,0.2,0.14,0.07,2025-12-04,5.4,10.0,1,5.94,4.8,ATH,False,False
04-12-2025 10:00,FORTE,80.8,82.7,80.15,82.3,503621.0,0.4,1.5,0.08,1664.71,1.5,139550.2,260.89,0.27,True,62.3,0.38,0.61,-0.22,2025-12-04,80.45,2.3,0,,80.0,84.2,False,False
04-12-2025 10:00,OSMEN,8.66,8.75,8.62,8.73,435047.0,0.02,0.07,0.01,1300.0,0.07,175108.5,148.44,0.29,True,61.2,0.0,0.0,0.0,2025-12-04,8.64,1.04,0,,8.61,8.82,False,False
04-12-2025 10:00,GLCVY,79.6,82.1,78.5,81.55,300890.0,0.55,1.95,0.04,4775.0,1.95,119960.4,150.82,0.28,True,59.06,0.28,0.59,-0.31,2025-12-04,79.6,2.45,3,,78.95,84.0,False,False
04-12-2025 10:00,DOFRB,74.9,81.75,74.55,80.3,13459061.0,1.45,5.4,0.48,1013.4,5.4,2559775.8,425.79,0.27,True,79.23,1.53,0.91,0.62,2025-12-04,74.35,8.0,1,81.75,68.65,81.75,False,False
04-12-2025 10:00,MARMR,2.04,2.16,2.0,2.13,139941358.0,0.03,0.09,0.0,1700.0,0.09,30626437.5,356.93,0.33,True,71.29,0.02,0.0,0.01,2025-12-04,2.02,5.45,0,,1.92,2.27,False,False
04-12-2025 10:00,DSTKF,642.0,712.0,642.0,706.0,1345462.0,6.0,64.0,6.4,900.0,64.0,136081.4,888.72,0.09,True,37.32,-41.74,-40.06,-1.67,2025-12-04,713.0,-0.98,2,642.0,642.0,968.0,True,True
04-12-2025 10:00,ARTMS,39.32,41.32,38.94,40.94,977088.0,0.38,1.62,0.14,1073.91,1.62,166237.9,487.76,0.23,True,70.23,0.09,-0.09,0.18,2025-12-04,39.1,4.71,0,,38.66,45.18,False,False
04-12-2025 10:00,TCELL,97.95,99.3,97.95,99.0,4764266.0,0.3,1.05,0.18,500.0,1.05,2714120.1,75.54,0.29,True,78.41,0.77,0.73,0.04,2025-12-04,97.75,1.28,1,99.3,93.35,99.3,False,False
04-12-2025 10:00,AZTEK,4.42,4.66,4.4,4.6,11652080.0,0.06,0.18,0.02,958.82,0.18,2071934.1,462.38,0.33,True,52.58,-0.09,-0.1,0.02,2025-12-04,4.4,4.55,3,,4.4,5.26,True,True
04-12-2025 10:00,KTLEV,17.38,18.43,17.38,18.35,25506798.0,0.08,0.97,0.12,708.33,0.97,7398383.5,244.76,0.08,True,72.87,0.22,0.21,0.02,2025-12-04,17.37,5.64,0,,16.81,ATH,False,False
04-12-2025 10:00,ATATP,152.9,167.3,152.1,165.1,1426976.0,2.2,12.2,1.08,1029.63,12.2,291216.2,390.01,0.18,True,79.04,1.8,0.66,1.14,2025-12-04,152.1,8.55,1,167.3,146.5,167.3,False,False
04-12-2025 10:00,CUSAN,22.44,23.48,22.02,23.48,654009.0,0.0,1.04,0.06,1693.1,1.04,139479.6,368.89,0.0,True,58.87,-0.01,0.01,-0.03,2025-12-04,22.24,5.58,2,22.02,22.02,26.32,False,False
04-12-2025 10:00,CEMZY,45.5,49.86,45.48,49.86,3474424.0,0.0,4.36,0.38,1053.44,4.36,529810.8,555.79,0.0,True,69.58,-0.18,-0.44,0.26,2025-12-04,45.34,9.97,1,49.86,44.7,52.85,True,True
04-12-2025 10:00,TAVHL,278.5,290.25,278.5,289.5,967763.0,0.75,11.0,1.05,947.62,11.0,264762.8,265.52,0.07,True,69.12,0.64,0.13,0.5,2025-12-04,279.5,3.58,1,290.25,275.5,290.25,False,False
04-12-2025 10:00,SELVA,1.9,2.03,1.87,2.03,15328030.0,0.0,0.13,0.02,465.22,0.13,4949750.4,209.67,0.0,True,75.22,0.04,0.03,0.01,2025-12-04,1.91,6.28,0,,1.77,ATH,False,False
04-12-2025 10:00,ARDYZ,33.94,36.44,33.94,36.1,7482726.0,0.34,2.16,0.18,1086.81,2.16,1354632.5,452.38,0.16,True,70.04,0.5,0.46,0.04,2025-12-04,33.72,7.06,0,,33.42,ATH,False,False
04-12-2025 10:00,DGNMO,5.6,5.65,5.59,5.64,185739.0,0.01,0.04,0.0,3900.0,0.04,116317.4,59.68,0.25,True,55.19,-0.0,0.0,-0.0,2025-12-04,5.6,0.71,0,,5.5,5.69,False,False
04-12-2025 10:00,KLYPV,55.5,57.7,55.35,57.25,812223.0,0.45,1.75,0.25,600.0,1.75,196996.0,312.3,0.26,True,72.25,0.47,0.32,0.14,2025-12-04,55.35,3.43,0,,54.5,ATH,False,False
03-12-2025 17:00,GLYHO,11.87,12.06,11.87,12.01,2105296.0,0.05,0.14,0.01,2700.0,0.14,585139.0,259.79,0.36,True,59.75,0.04,0.05,-0.01,2025-12-03,11.95,0.5,0,,11.85,12.13,False,False
03-12-2025 17:00,AKYHO,2.95,2.99,2.95,2.98,261003.0,0.01,0.03,0.01,400.0,0.03,115424.4,126.12,0.33,True,54.57,-0.0,-0.0,0.0,2025-12-03,2.95,1.02,1,2.99,2.91,2.99,False,False
03-12-2025 17:00,ESCAR,20.28,20.56,20.2,20.48,554894.0,0.08,0.2,0.01,2400.0,0.2,248224.2,123.55,0.4,True,59.01,0.0,0.01,-0.0,2025-12-03,20.28,0.99,0,,20.1,21.0,False,False
03-12-2025 17:00,SKTAS,4.2,4.63,4.17,4.63,2354191.0,0.0,0.43,0.04,1002.56,0.43,838127.1,180.89,0.0,True,77.62,0.02,-0.0,0.03,2025-12-03,4.25,8.94,3,,4.15,4.74,False,False
03-12-2025 17:00,SMRTG,25.6,27.9,25.54,27.9,4567679.0,0.0,2.3,0.24,858.33,2.3,647262.0,605.69,0.0,True,89.25,0.23,0.06,0.17,2025-12-03,25.38,9.93,0,,24.82,ATH,False,False
03-12-2025 17:00,KONKA,14.08,14.22,14.02,14.22,478478.0,0.0,0.14,0.01,1300.0,0.14,163026.2,193.5,0.0,True,70.24,0.15,0.15,0.0,2025-12-03,14.18,0.28,0,,13.04,14.3,False,False
03-12-2025 17:00,KRVGD,2.54,2.61,2.52,2.61,5028585.0,0.0,0.07,0.01,400.0,0.07,1139592.9,341.26,0.0,True,77.51,0.02,0.01,0.01,2025-12-03,2.48,5.24,0,,2.42,2.64,False,False
03-12-2025 17:00,BMSTL,120.6,126.6,120.5,126.2,512784.0,0.4,5.6,0.69,711.59,5.6,154464.1,231.98,0.07,True,77.07,3.66,3.58,0.08,2025-12-03,119.8,5.34,0,,110.0,131.2,False,False
03-12-2025 17:00,TATGD,12.59,12.7,12.57,12.7,262459.0,0.0,0.11,0.02,340.0,0.11,119573.9,119.5,0.0,True,70.8,0.05,0.03,0.01,2025-12-03,12.46,1.93,0,,12.23,ATH,False,False
03-12-2025 17:00,ALVES,24.26,25.5,24.26,25.36,5805703.0,0.14,1.1,0.07,1386.49,1.1,799576.0,626.1,0.13,True,71.09,0.15,0.11,0.04,2025-12-03,24.46,3.68,1,25.5,24.24,25.5,False,False
03-12-2025 16:00,ARZUM,2.63,2.7,2.63,2.69,3448716.0,0.01,0.06,0.01,900.0,0.06,1040425.0,231.47,0.17,True,66.51,0.01,0.0,0.0,2025-12-03,2.63,2.28,0,,2.61,2.76,False,False
03-12-2025 16:00,DURKN,14.08,14.59,14.03,14.57,813146.0,0.02,0.49,0.05,988.89,0.49,137644.9,490.76,0.04,True,77.57,0.07,0.04,0.03,2025-12-03,14.05,3.7,0,,13.91,ATH,False,False
03-12-2025 16:00,GRTHO,309.25,337.5,309.25,332.5,515465.0,5.0,23.25,1.75,1228.57,23.25,123373.3,317.81,0.22,True,74.95,7.24,7.36,-0.12,2025-12-03,308.25,7.87,0,,264.0,ATH,False,False
03-12-2025 16:00,GIPTA,63.9,65.3,63.7,65.1,308409.0,0.2,1.2,0.16,627.27,1.2,181658.6,69.77,0.17,True,61.06,0.09,0.07,0.02,2025-12-03,63.0,3.33,0,,62.7,67.75,False,False
03-12-2025 15:00,ASTOR,98.05,99.3,97.7,99.0,5788111.0,0.3,0.95,0.03,3066.67,0.95,3398134.8,70.33,0.32,True,70.92,1.13,1.21,-0.08,2025-12-03,97.95,1.07,0,,96.8,ATH,False,False
03-12-2025 15:00,MARBL,12.84,13.12,12.83,13.06,1217837.0,0.06,0.22,0.05,368.09,0.22,303739.8,300.95,0.27,True,78.8,0.07,0.02,0.05,2025-12-03,12.49,4.56,1,13.12,12.39,13.12,False,False
03-12-2025 15:00,SUNTK,38.44,40.4,38.38,40.06,659087.0,0.34,1.62,0.11,1346.43,1.62,146150.6,350.96,0.21,True,72.91,0.68,0.6,0.08,2025-12-03,38.44,4.21,0,,35.1,40.32,False,False
03-12-2025 15:00,OYAKC,24.32,24.6,24.2,24.6,8060854.0,0.0,0.28,0.03,976.92,0.28,3433902.5,134.74,0.0,True,75.1,0.24,0.23,0.01,2025-12-03,24.04,2.33,0,,23.9,ATH,False,False
03-12-2025 14:00,SEGYO,5.57,5.87,5.55,5.86,11784890.0,0.01,0.29,0.03,835.48,0.29,2647179.2,345.19,0.03,True,62.18,-0.04,-0.08,0.04,2025-12-03,5.45,7.52,0,,5.2,6.56,False,False
03-12-2025 14:00,SUWEN,9.68,9.87,9.66,9.85,437932.0,0.02,0.17,0.01,1114.29,0.17,239861.4,82.58,0.12,True,64.56,0.06,0.04,0.02,2025-12-03,9.66,1.97,0,,9.58,ATH,False,False
03-12-2025 13:00,TRILC,16.22,17.04,16.2,16.85,3049176.0,0.19,0.63,0.08,668.29,0.63,715964.6,325.88,0.3,True,69.12,-0.12,-0.24,0.12,2025-12-03,16.03,5.12,1,17.04,15.97,17.04,True,False
03-12-2025 13:00,KMPUR,16.08,16.52,16.08,16.4,415579.0,0.12,0.32,0.03,1130.77,0.32,194620.0,113.53,0.38,True,63.72,0.13,0.14,-0.02,2025-12-03,16.03,2.31,1,16.52,15.92,16.52,False,False
03-12-2025 13:00,FRIGO,9.93,10.24,9.91,10.18,1805375.0,0.06,0.25,0.01,3471.43,0.25,1022256.9,76.61,0.24,True,53.4,-0.06,-0.1,0.03,2025-12-03,9.9,2.83,0,,9.72,10.3,False,False
03-12-2025 13:00,RTALB,3.84,4.0,3.82,3.99,23148538.0,0.01,0.15,0.04,305.41,0.15,7375960.6,213.84,0.07,True,87.06,0.06,0.02,0.03,2025-12-03,3.68,8.42,0,,3.61,ATH,False,False
03-12-2025 13:00,ANGEN,11.69,12.32,11.67,12.26,3418355.0,0.06,0.57,0.08,612.5,0.57,744622.1,359.07,0.11,True,88.3,0.12,0.05,0.07,2025-12-03,11.41,7.45,1,12.32,11.34,12.32,False,False
03-12-2025 13:00,ARSAN,2.97,3.02,2.96,3.01,3719921.0,0.01,0.04,0.01,400.0,0.04,1494783.9,148.86,0.25,True,71.27,0.02,0.02,0.0,2025-12-03,2.92,3.08,0,,2.9,ATH,False,False
03-12-2025 12:00,CRDFA,60.0,62.0,59.0,61.95,257826.0,0.05,1.95,0.05,3800.0,1.95,144573.2,78.34,0.03,True,60.99,0.67,0.78,-0.11,2025-12-03,60.8,1.89,1,62.0,53.1,62.0,False,False
03-12-2025 12:00,BAHKM,58.1,62.15,57.75,62.1,1183287.0,0.05,4.0,0.44,819.54,4.0,250001.6,373.31,0.01,True,67.07,-0.37,-0.65,0.28,2025-12-03,56.6,9.72,0,,56.05,66.0,True,True
03-12-2025 12:00,SISE,37.62,38.12,37.52,38.02,7026689.0,0.1,0.4,0.02,1566.67,0.4,4002503.1,75.56,0.25,True,65.8,0.14,0.13,0.0,2025-12-03,37.4,1.66,1,38.12,37.32,38.12,False,False
03-12-2025 12:00,EFOR,25.36,26.9,25.3,26.88,23725652.0,0.02,1.52,0.25,512.9,1.52,3757660.3,531.39,0.01,True,85.31,0.82,0.6,0.21,2025-12-03,25.16,6.84,0,,22.16,ATH,False,False
03-12-2025 12:00,ZEDUR,8.21,8.35,8.21,8.32,336476.0,0.03,0.11,0.01,1733.33,0.11,117736.2,185.79,0.27,True,57.84,0.0,-0.0,0.0,2025-12-03,8.22,1.22,0,,8.15,8.4,False,False
03-12-2025 12:00,ORCAY,3.87,3.93,3.86,3.92,892214.0,0.01,0.05,0.0,1150.0,0.05,314891.6,183.34,0.2,True,56.48,-0.0,-0.0,0.0,2025-12-03,3.85,1.82,0,,3.81,4.1,False,False
03-12-2025 11:00,BIENY,28.62,30.0,28.6,29.66,2898181.0,0.34,1.04,0.1,940.0,1.04,481101.6,502.41,0.33,True,67.77,0.17,0.17,0.01,2025-12-03,28.6,3.71,1,30.0,28.46,30.0,False,False
03-12-2025 11:00,GZNMI,75.5,82.55,75.2,81.85,2873298.0,0.7,6.35,0.79,698.74,6.35,702211.2,309.18,0.11,True,67.61,1.53,1.39,0.13,2025-12-03,75.05,9.06,0,,72.6,81.95,False,False
03-12-2025 11:00,ISDMR,36.08,36.66,36.06,36.52,696302.0,0.14,0.44,0.03,1592.31,0.44,183532.4,279.39,0.32,True,74.16,0.18,0.14,0.03,2025-12-03,36.1,1.16,0,,35.7,ATH,False,False
03-12-2025 11:00,VAKBN,31.74,32.68,31.58,32.64,25677312.0,0.04,0.9,0.21,328.57,0.9,13756421.3,86.66,0.04,True,81.49,0.68,0.56,0.12,2025-12-03,30.8,5.97,0,,29.52,ATH,False,False
03-12-2025 11:00,KRDMA,25.32,26.04,25.32,26.02,1831286.0,0.02,0.7,0.05,1196.3,0.7,350768.2,422.08,0.03,True,75.06,0.06,0.03,0.03,2025-12-03,25.18,3.34,0,,25.14,26.2,False,False
03-12-2025 11:00,DMSAS,10.7,10.95,10.5,10.89,1935532.0,0.06,0.19,0.03,660.0,0.19,325309.3,494.98,0.32,True,81.01,0.08,0.07,0.01,2025-12-03,10.63,2.45,2,10.5,10.5,ATH,False,False
03-12-2025 10:00,INDES,7.31,7.38,7.31,7.36,579145.0,0.02,0.05,0.0,1566.67,0.05,276959.0,109.11,0.4,True,65.14,0.01,0.01,0.0,2025-12-03,7.29,0.96,0,,7.27,7.54,False,False
03-12-2025 10:00,MANAS,9.1,9.77,9.09,9.67,23948752.0,0.1,0.57,0.07,750.75,0.57,3879171.2,517.37,0.18,True,69.2,0.01,-0.06,0.07,2025-12-03,8.96,7.92,0,,8.73,10.53,True,False
03-12-2025 10:00,MNDRS,13.96,14.03,13.96,14.01,350152.0,0.02,0.05,0.0,1566.67,0.05,181508.1,92.91,0.4,True,62.84,0.1,0.11,-0.02,2025-12-03,13.96,0.36,0,,13.26,14.11,False,False
03-12-2025 10:00,A1CAP,11.95,12.53,11.86,12.5,6993425.0,0.03,0.55,0.08,570.73,0.55,1512987.5,362.23,0.05,True,76.77,0.14,0.1,0.04,2025-12-03,11.92,4.87,0,,11.57,ATH,False,False
03-12-2025 10:00,RYSAS,13.91,14.05,13.89,14.04,865466.0,0.01,0.13,0.01,900.0,0.13,510820.3,69.43,0.08,True,69.75,0.05,0.03,0.02,2025-12-03,13.87,1.23,0,,13.48,14.55,False,False
03-12-2025 10:00,GWIND,23.32,23.8,23.32,23.68,1401302.0,0.12,0.36,0.03,1025.0,0.36,400972.1,249.48,0.33,True,73.17,0.14,0.11,0.03,2025-12-03,23.24,1.89,1,23.8,22.66,23.8,False,False
03-12-2025 10:00,DCTTR,26.14,27.22,26.14,26.92,1080425.0,0.3,0.78,0.07,1081.82,0.78,187374.9,476.61,0.38,True,67.58,-0.05,-0.13,0.08,2025-12-03,26.06,3.3,1,27.22,25.98,27.22,False,False
03-12-2025 10:00,NIBAS,24.6,25.66,24.54,25.4,2636277.0,0.26,0.8,0.07,1042.86,0.8,609134.4,332.79,0.33,True,85.01,0.84,0.6,0.23,2025-12-03,23.8,6.72,1,25.66,20.9,25.66,False,False
03-12-2025 10:00,ASELS,187.7,191.3,187.7,190.6,7439087.0,0.7,2.9,0.22,1218.18,2.9,2069359.2,259.49,0.24,True,72.82,0.99,0.88,0.12,2025-12-03,187.7,1.55,0,,185.5,ATH,False,False
03-12-2025 10:00,SANEL,40.68,41.54,39.64,41.54,480106.0,0.0,0.86,0.09,900.0,0.86,87850.7,446.5,0.0,True,79.52,0.96,0.46,0.5,2025-12-03,37.78,9.95,1,41.54,34.1,ATH,False,False
02-12-2025 17:00,KLSYN,5.35,5.45,5.35,5.43,1608270.0,0.02,0.08,0.01,700.0,0.08,411470.3,290.86,0.25,True,64.47,0.02,0.02,0.0,2025-12-02,5.36,1.31,1,5.45,5.33,5.45,False,False
02-12-2025 17:00,TNZTP,21.18,21.46,21.16,21.44,214125.0,0.02,0.26,0.01,2500.0,0.26,131864.2,62.38,0.08,True,55.07,-0.01,-0.03,0.02,2025-12-02,21.36,0.37,0,,20.88,21.6,False,False
02-12-2025 17:00,KRPLS,7.57,8.25,7.52,8.24,1406750.0,0.01,0.67,0.07,857.14,0.67,202612.7,594.3,0.01,True,83.72,0.05,-0.01,0.05,2025-12-02,7.52,9.57,2,7.52,7.52,ATH,False,False
02-12-2025 17:00,TDGYO,31.06,31.68,31.06,31.68,185037.0,0.0,0.62,0.05,1140.0,0.62,70948.8,160.8,0.0,True,55.18,-0.15,-0.18,0.03,2025-12-02,31.22,1.47,0,,31.0,32.94,False,False
02-12-2025 17:00,BULGS,44.82,46.04,44.7,45.84,1219044.0,0.2,1.02,0.13,684.62,1.02,668678.8,82.31,0.2,True,56.09,-0.14,-0.29,0.15,2025-12-02,44.7,2.55,0,,43.42,46.3,False,False
02-12-2025 17:00,PAHOL,1.48,1.65,1.47,1.62,964312577.0,0.03,0.14,0.0,3400.0,0.14,204757051.2,370.95,0.21,True,59.54,-0.03,-0.04,0.01,2025-12-02,1.54,5.19,2,1.47,1.47,1.74,True,True
02-12-2025 17:00,ISFIN,19.06,19.33,19.03,19.3,318044.0,0.03,0.24,0.0,23900.0,0.24,158829.5,100.24,0.12,True,56.7,0.01,0.01,0.0,2025-12-02,19.25,0.26,0,,19.0,19.39,False,False
02-12-2025 17:00,ENERY,9.94,10.57,9.93,10.52,18388052.0,0.05,0.58,0.05,1108.33,0.58,3393619.2,441.84,0.09,True,70.08,-0.02,-0.06,0.04,2025-12-02,10.02,4.99,3,,9.93,11.74,False,False
02-12-2025 15:00,TKNSA,23.92,24.42,23.88,24.36,762962.0,0.06,0.44,0.03,1194.12,0.44,207877.2,267.03,0.14,True,69.7,0.09,0.02,0.07,2025-12-02,23.76,2.53,0,,23.22,24.9,False,False
02-12-2025 15:00,KOTON,14.89,15.01,14.88,15.0,218176.0,0.01,0.11,0.02,511.11,0.11,137614.5,58.54,0.09,True,63.47,0.03,0.01,0.02,2025-12-02,14.79,1.42,0,,14.35,15.02,False,False
02-12-2025 15:00,ULUUN,6.91,6.96,6.88,6.96,475187.0,0.0,0.05,0.01,733.33,0.05,256663.4,85.14,0.0,True,59.31,0.02,0.02,0.0,2025-12-02,6.92,0.58,0,,6.74,7.01,False,False
02-12-2025 14:00,SEGMN,18.1,18.19,18.07,18.18,128188.0,0.01,0.08,0.0,1900.0,0.08,74825.1,71.32,0.13,True,46.02,-0.06,-0.07,0.01,2025-12-02,18.14,0.22,0,,18.03,18.26,False,False
02-12-2025 14:00,AKSEN,57.85,59.5,57.1,59.45,4467066.0,0.05,1.6,0.5,220.0,1.6,1319134.3,238.64,0.03,True,84.21,1.45,1.01,0.44,2025-12-02,55.75,6.64,0,,51.3,ATH,False,False
02-12-2025 13:00,ALFAS,44.98,45.86,44.98,45.78,399921.0,0.08,0.8,0.16,393.83,0.8,209199.2,91.17,0.1,True,79.93,0.55,0.43,0.12,2025-12-02,44.22,3.53,0,,42.66,ATH,False,False
02-12-2025 13:00,ODINE,225.0,233.4,222.2,231.8,229787.0,1.6,6.8,1.46,365.75,6.8,75632.1,203.82,0.24,True,70.43,0.37,-0.87,1.24,2025-12-02,219.9,5.41,0,,215.0,241.5,False,False
02-12-2025 13:00,ENKAI,78.65,79.65,78.55,79.55,2247191.0,0.1,0.9,0.01,5900.0,0.9,1268057.8,77.22,0.11,True,57.27,0.04,0.1,-0.07,2025-12-02,79.25,0.38,0,,78.35,79.8,False,False
02-12-2025 13:00,PEKGY,10.36,10.56,10.34,10.54,76110185.0,0.02,0.18,0.01,1700.0,0.18,46996872.8,61.95,0.11,True,50.23,-0.16,-0.26,0.1,2025-12-02,10.2,3.33,0,,9.9,10.71,True,False
02-12-2025 13:00,DOFER,56.9,58.0,56.7,57.75,81345.0,0.25,0.85,0.12,608.33,0.85,54043.5,50.52,0.29,True,74.67,0.47,0.24,0.23,2025-12-02,56.05,3.03,0,,54.65,59.3,False,False
02-12-2025 12:00,BRKVY,87.95,89.45,87.85,89.3,167853.0,0.15,1.35,0.29,365.52,1.35,107152.4,56.65,0.11,True,63.27,0.08,-0.29,0.37,2025-12-02,86.0,3.84,0,,84.5,97.9,False,False
02-12-2025 12:00,ESCOM,3.25,3.29,3.24,3.28,2174113.0,0.01,0.03,0.0,650.0,0.03,1240043.1,75.33,0.33,True,62.33,0.01,0.0,0.01,2025-12-02,3.24,1.23,1,3.29,3.15,3.29,False,False
02-12-2025 12:00,NTGAZ,9.96,10.12,9.96,10.09,966954.0,0.03,0.13,0.02,420.0,0.13,397051.3,143.53,0.23,True,58.78,-0.01,-0.02,0.02,2025-12-02,10.06,0.3,0,,9.86,10.46,False,False
02-12-2025 11:00,GEREL,21.34,22.66,21.3,22.3,2734196.0,0.36,0.96,0.15,548.65,0.96,954567.9,186.43,0.37,True,76.43,0.3,0.23,0.07,2025-12-02,21.26,4.89,0,,19.75,ATH,False,False
02-12-2025 11:00,CGCAM,37.54,39.14,37.36,38.72,1847709.0,0.42,1.18,0.13,807.69,1.18,972749.0,89.95,0.36,True,77.87,1.18,0.98,0.19,2025-12-02,38.0,1.89,0,,32.28,ATH,False,False
02-12-2025 11:00,ENTRA,10.42,10.64,10.42,10.59,2055506.0,0.05,0.17,0.02,672.73,0.17,960284.9,114.05,0.29,True,71.36,0.02,-0.01,0.03,2025-12-02,10.3,2.82,1,10.64,10.2,10.64,False,False
02-12-2025 11:00,DITAS,39.32,41.3,39.32,41.18,620652.0,0.12,1.86,0.2,848.98,1.86,144361.1,329.93,0.06,True,69.92,0.34,0.21,0.13,2025-12-02,39.5,4.25,0,,37.22,ATH,False,False
02-12-2025 11:00,BESLR,12.37,12.55,12.36,12.5,1025269.0,0.05,0.13,0.03,348.28,0.13,370689.7,176.58,0.38,True,77.65,0.05,0.02,0.03,2025-12-02,12.25,2.04,1,12.55,12.06,12.55,False,False
02-12-2025 11:00,KRDMD,25.44,25.82,25.42,25.78,6878829.0,0.04,0.34,0.04,750.0,0.34,3640224.6,88.97,0.12,True,64.05,0.15,0.12,0.03,2025-12-02,25.62,0.62,0,,25.4,25.86,False,False
02-12-2025 11:00,CEMAS,4.89,4.92,4.88,4.92,2108456.0,0.0,0.03,0.0,2900.0,0.03,1350783.6,56.09,0.0,True,51.67,-0.01,-0.02,0.01,2025-12-02,4.89,0.61,0,,ATL,5.16,True,False
02-12-2025 10:00,ULKER,112.3,114.0,111.8,113.9,1184831.0,0.1,1.6,0.29,451.72,1.6,463831.4,155.44,0.06,True,71.04,0.31,0.01,0.31,2025-12-02,112.3,1.42,0,,109.3,ATH,False,False
02-12-2025 10:00,MNDTR,7.04,7.41,7.02,7.31,1606163.0,0.1,0.27,0.02,1250.0,0.27,519655.1,209.08,0.37,True,64.22,-0.03,-0.05,0.02,2025-12-02,7.01,4.28,1,7.41,6.97,7.41,False,False
02-12-2025 10:00,SKBNK,8.17,8.26,8.15,8.24,6835974.0,0.02,0.07,0.01,438.46,0.07,3589266.2,90.46,0.29,True,68.05,0.04,0.03,0.01,2025-12-02,8.14,1.23,0,,7.87,8.39,False,False
02-12-2025 10:00,OSTIM,2.97,2.99,2.95,2.99,941672.0,0.0,0.02,0.0,900.0,0.02,461935.6,103.85,0.0,True,47.0,-0.01,-0.02,0.01,2025-12-02,2.97,0.67,0,,2.94,3.0,True,False
02-12-2025 10:00,MERKO,12.97,13.1,12.97,13.07,558793.0,0.03,0.1,0.0,5.62949953421309e+16,0.1,225680.3,147.6,0.3,True,56.94,-0.0,-0.02,0.01,2025-12-02,12.95,0.93,0,,12.7,13.15,False,False
02-12-2025 10:00,MHRGY,3.61,3.63,3.59,3.63,564014.0,0.0,0.02,0.0,400.0,0.02,278907.0,102.22,0.0,True,60.17,-0.0,-0.01,0.01,2025-12-02,3.6,0.83,0,,3.54,3.75,True,False
02-12-2025 10:00,MAKTK,13.85,14.32,13.5,14.25,2853879.0,0.07,0.4,0.11,280.95,0.4,1283682.2,122.32,0.18,True,70.72,0.35,0.27,0.08,2025-12-02,13.9,2.52,0,,12.27,ATH,False,False
02-12-2025 10:00,INFO,3.86,3.93,3.85,3.92,5197963.0,0.01,0.06,0.01,650.0,0.06,2306567.1,125.35,0.17,True,64.84,0.01,0.0,0.01,2025-12-02,3.87,1.29,1,3.93,3.76,3.93,False,False
02-12-2025 10:00,HURGZ,5.77,5.9,5.74,5.88,539291.0,0.02,0.11,0.02,587.5,0.11,207187.0,160.29,0.18,True,63.6,0.02,0.0,0.02,2025-12-02,5.79,1.55,1,5.9,5.58,5.9,False,False
02-12-2025 10:00,INVEO,9.48,9.56,9.36,9.55,3201442.0,0.01,0.07,0.01,1300.0,0.07,743503.2,330.59,0.14,True,63.02,-0.01,-0.04,0.03,2025-12-02,9.35,2.14,0,,9.17,10.24,False,False
02-12-2025 10:00,BSOKE,14.96,15.19,14.81,15.14,2450790.0,0.05,0.18,0.04,373.68,0.18,848395.1,188.87,0.28,True,60.28,-0.03,-0.1,0.07,2025-12-02,14.89,1.68,0,,14.31,16.12,False,False
02-12-2025 10:00,BIMAS,544.5,552.0,540.0,550.0,1689387.0,2.0,5.5,0.8,587.5,5.5,577737.3,192.41,0.36,True,67.44,0.93,-0.05,0.98,2025-12-02,545.0,0.92,0,,533.5,ATH,False,False
02-12-2025 10:00,BIGEN,9.18,9.36,9.17,9.34,2726894.0,0.02,0.16,0.02,900.0,0.16,827856.6,229.39,0.12,True,54.53,-0.08,-0.11,0.03,2025-12-02,9.16,1.97,1,9.36,9.04,9.36,True,False
02-12-2025 10:00,BEGYO,5.12,5.28,5.11,5.25,4231558.0,0.03,0.13,0.02,664.71,0.13,1179116.6,258.88,0.23,True,67.77,0.03,0.01,0.01,2025-12-02,5.11,2.74,0,,4.99,5.26,False,False
02-12-2025 10:00,HALKB,39.88,41.12,39.54,40.78,71665921.0,0.34,0.9,0.36,147.25,0.9,18370927.0,290.11,0.38,True,91.99,1.47,1.17,0.3,2025-12-02,39.18,4.08,0,,ATL,ATH,False,False
02-12-2025 10:00,HUNER,3.43,3.45,3.41,3.45,1705614.0,0.0,0.02,0.0,400.0,0.02,940896.1,81.28,0.0,True,61.64,0.0,-0.01,0.01,2025-12-02,3.42,0.88,0,,3.36,3.48,False,False
02-12-2025 10:00,CVKMD,17.78,18.77,17.7,18.76,12335087.0,0.01,0.98,0.13,671.65,0.98,2702141.4,356.49,0.01,True,81.09,0.21,0.12,0.09,2025-12-02,17.69,6.05,0,,16.96,ATH,False,False
02-12-2025 10:00,A1YEN,29.32,29.96,29.24,29.86,297767.0,0.1,0.54,0.07,694.12,0.54,90285.1,229.81,0.19,True,64.56,-0.04,-0.12,0.08,2025-12-02,29.22,2.19,0,,28.46,30.0,False,False
02-12-2025 10:00,BRSAN,462.25,492.0,461.75,490.5,1310775.0,1.5,28.25,3.52,701.42,28.25,227960.4,475.0,0.05,True,82.52,4.86,1.43,3.43,2025-12-02,460.0,6.63,0,,441.0,ATH,False,False
02-12-2025 10:00,KLKIM,30.76,31.12,30.76,31.12,287819.0,0.0,0.36,0.06,520.69,0.36,152847.0,88.31,0.0,True,65.84,0.01,-0.04,0.05,2025-12-02,30.62,1.63,0,,30.28,31.96,False,False
02-12-2025 10:00,ADESE,1.6,1.7,1.59,1.7,159061715.0,0.0,0.1,0.01,733.33,0.1,22252509.1,614.8,0.0,True,75.53,0.02,-0.0,0.02,2025-12-02,1.55,9.68,1,1.7,1.38,1.77,False,False
02-12-2025 10:00,KARSN,9.4,9.48,9.4,9.46,2221253.0,0.02,0.06,0.01,328.57,0.06,1143833.0,94.19,0.33,True,68.16,0.01,-0.01,0.02,2025-12-02,9.4,0.64,0,,9.21,9.71,False,False
02-12-2025 10:00,DOAS,186.2,190.9,185.4,190.4,916500.0,0.5,4.2,0.78,438.46,4.2,218616.7,319.23,0.12,True,80.66,1.23,0.5,0.73,2025-12-02,186.2,2.26,0,,180.2,ATH,False,False
02-12-2025 10:00,KATMR,3.26,3.37,3.25,3.35,57705846.0,0.02,0.09,0.01,542.86,0.09,22211115.3,159.81,0.22,True,70.72,0.03,0.02,0.01,2025-12-02,3.25,3.08,0,,3.1,ATH,False,False
01-12-2025 17:00,ARCLK,107.4,109.0,107.4,108.9,688321.0,0.1,1.5,0.34,341.18,1.5,312570.8,120.21,0.07,True,69.04,0.42,0.21,0.21,2025-12-01,105.7,3.03,0,,105.2,ATH,False,False
01-12-2025 17:00,AEFES,16.06,16.2,16.05,16.16,15071911.0,0.04,0.1,0.04,170.27,0.1,6798574.1,121.69,0.4,True,58.3,-0.01,-0.02,0.01,2025-12-01,15.79,2.34,1,16.2,15.67,16.2,False,False
01-12-2025 17:00,TSPOR,1.22,1.24,1.22,1.24,81916878.0,0.0,0.02,0.01,300.0,0.02,40791620.4,100.82,0.0,True,63.37,0.0,-0.0,0.0,2025-12-01,1.19,4.2,0,,1.19,1.28,False,False
01-12-2025 17:00,BUCIM,6.21,6.28,6.2,6.28,2044613.0,0.0,0.07,0.01,438.46,0.07,495918.5,312.29,0.0,True,78.01,0.02,0.01,0.01,2025-12-01,6.15,2.11,0,,6.13,ATH,False,False
01-12-2025 17:00,PETKM,17.29,17.43,17.29,17.39,9570205.0,0.04,0.1,0.04,150.0,0.1,5793462.3,65.19,0.4,True,77.78,0.09,0.05,0.04,2025-12-01,17.0,2.29,0,,16.78,ATH,False,False
01-12-2025 17:00,ODAS,5.31,5.37,5.3,5.37,7300465.0,0.0,0.06,0.01,328.57,0.06,2504495.1,191.49,0.0,True,57.52,-0.01,-0.02,0.01,2025-12-01,5.25,2.29,0,,5.23,5.47,False,False
01-12-2025 17:00,MAVI,38.28,38.64,38.28,38.58,1257533.0,0.06,0.3,0.1,194.12,0.3,469897.8,167.62,0.2,True,67.66,0.03,-0.05,0.08,2025-12-01,37.72,2.28,0,,37.46,38.68,False,False
01-12-2025 17:00,CEOEM,25.08,26.12,25.0,25.96,485555.0,0.16,0.88,0.12,609.68,0.88,134007.1,262.34,0.18,True,68.62,0.15,0.06,0.09,2025-12-01,24.48,6.05,0,,24.34,ATH,False,False
01-12-2025 17:00,DMRGD,24.3,24.68,24.26,24.64,366792.0,0.04,0.34,0.05,580.0,0.34,175812.2,108.63,0.12,True,69.28,0.19,0.13,0.07,2025-12-01,24.2,1.82,0,,23.66,ATH,False,False
01-12-2025 17:00,AKGRT,6.73,6.8,6.73,6.79,1935540.0,0.01,0.06,0.01,361.54,0.06,1079277.8,79.34,0.17,True,66.39,0.01,0.0,0.01,2025-12-01,6.66,1.95,1,6.8,6.6,6.8,False,False
01-12-2025 16:00,GMTAS,44.76,45.36,44.54,45.22,421407.0,0.14,0.46,0.03,1433.33,0.46,233540.5,80.44,0.3,True,51.87,-0.04,-0.0,-0.03,2025-12-01,45.5,-0.62,2,44.54,44.54,45.9,False,False
01-12-2025 15:00,ARMGD,40.68,41.56,40.66,41.46,586349.0,0.1,0.78,0.09,766.67,0.78,196669.1,198.14,0.13,True,59.45,-0.22,-0.34,0.12,2025-12-01,40.1,3.39,0,,39.62,43.3,False,False
01-12-2025 15:00,SKYMD,12.19,12.5,12.17,12.46,1771272.0,0.04,0.27,0.05,400.0,0.27,639096.6,177.15,0.15,True,67.98,0.04,-0.0,0.05,2025-12-01,11.97,4.09,0,,11.8,12.5,False,False
01-12-2025 14:00,TSKB,13.08,13.26,13.08,13.22,7879378.0,0.04,0.14,0.03,351.61,0.14,3631100.8,117.0,0.29,True,71.18,0.07,0.04,0.03,2025-12-01,12.86,2.8,0,,12.77,ATH,False,False
01-12-2025 14:00,VAKFN,2.01,2.1,2.01,2.1,90290093.0,0.0,0.09,0.01,1400.0,0.09,17148711.8,426.51,0.0,True,62.83,-0.0,-0.01,0.01,2025-12-01,2.0,5.0,0,,1.99,ATH,False,False
01-12-2025 13:00,SILVR,2.84,2.94,2.84,2.93,572230.0,0.01,0.09,0.01,800.0,0.09,360724.2,58.63,0.11,True,64.14,0.02,0.01,0.01,2025-12-01,2.85,2.81,0,,2.7,ATH,False,False
01-12-2025 12:00,SRVGY,3.45,3.53,3.44,3.53,9918163.0,0.0,0.08,0.02,321.05,0.08,5627374.3,76.25,0.0,True,66.2,0.0,-0.02,0.02,2025-12-01,3.34,5.69,0,,3.3,3.57,False,False
01-12-2025 12:00,AVOD,3.47,3.6,3.47,3.57,552031.0,0.03,0.1,0.0,3233.33,0.1,204876.7,169.45,0.3,True,53.59,-0.03,-0.03,0.01,2025-12-01,3.48,2.59,0,,3.42,3.82,True,False
01-12-2025 12:00,EUPWR,28.76,30.08,28.76,29.86,3484186.0,0.22,1.1,0.15,643.24,1.1,888455.3,292.16,0.2,True,71.91,-0.04,-0.17,0.13,2025-12-01,28.02,6.57,0,,27.98,29.98,True,False
01-12-2025 12:00,XBANK,16050.13,16281.82,16047.61,16237.37,259193014.0,44.45,187.24,49.8,276.01,187.24,142809638.4,81.5,0.24,True,79.91,126.72,88.95,37.77,2025-12-01,15853.65,2.42,0,,15609.01,ATH,False,False
01-12-2025 12:00,ECOGR,21.94,22.58,21.76,22.58,5675937.0,0.0,0.64,0.04,1500.0,0.64,3675940.7,54.41,0.0,True,58.84,-0.09,-0.16,0.07,2025-12-01,21.72,3.96,0,,21.3,23.12,False,False
01-12-2025 12:00,VESBE,8.44,8.54,8.43,8.52,1225540.0,0.02,0.08,0.0,1500.0,0.08,691240.4,77.3,0.25,True,58.48,-0.0,-0.02,0.02,2025-12-01,8.4,1.43,0,,8.37,8.96,True,False
01-12-2025 12:00,TUPRS,195.1,197.0,194.6,196.7,2575276.0,0.3,1.6,0.06,2566.67,1.6,1399251.8,84.05,0.19,True,67.75,0.55,0.36,0.19,2025-12-01,194.8,0.98,0,,193.7,ATH,False,False
01-12-2025 11:00,TOASO,230.3,232.4,230.0,232.2,657139.0,0.2,1.9,0.22,763.64,1.9,429096.8,53.14,0.11,True,61.87,0.15,0.15,0.0,2025-12-01,229.8,1.04,0,,226.6,233.2,False,False
01-12-2025 11:00,DOHOL,17.15,17.24,17.13,17.23,1535852.0,0.01,0.08,0.01,1233.33,0.08,859576.7,78.68,0.12,True,55.62,-0.02,-0.03,0.01,2025-12-01,17.09,0.82,0,,16.92,17.48,False,False
01-12-2025 11:00,TTKOM,55.95,56.5,55.9,56.4,4733160.0,0.1,0.45,0.01,4400.0,0.45,2012810.1,135.15,0.22,True,59.23,0.02,-0.01,0.03,2025-12-01,55.75,1.17,0,,55.55,56.55,False,False
01-12-2025 11:00,MGROS,523.0,528.0,522.0,528.0,353570.0,0.0,5.0,0.45,1011.11,5.0,205971.7,71.66,0.0,True,57.66,-0.35,-0.36,0.01,2025-12-01,521.0,1.34,0,,517.0,530.0,False,False
01-12-2025 11:00,GLRYH,4.26,4.37,4.26,4.34,1764681.0,0.03,0.08,0.01,433.33,0.08,554834.9,218.06,0.38,True,70.84,0.0,-0.02,0.02,2025-12-01,4.18,3.83,1,4.37,4.09,4.37,False,False
01-12-2025 11:00,FENER,10.86,11.06,10.85,11.01,11815680.0,0.05,0.15,0.02,581.82,0.15,4095472.1,188.51,0.33,True,59.51,-0.03,-0.09,0.06,2025-12-01,10.73,2.61,0,,9.76,ATH,False,False
01-12-2025 11:00,GARAN,139.4,140.8,139.3,140.5,6069669.0,0.3,1.1,0.15,633.33,1.1,3014798.6,101.33,0.27,True,66.43,0.46,0.41,0.04,2025-12-01,138.9,1.15,0,,137.3,ATH,False,False
01-12-2025 11:00,ANSGR,22.66,22.94,22.64,22.9,1449914.0,0.04,0.24,0.02,990.91,0.24,498249.3,191.0,0.17,True,70.17,0.09,0.08,0.01,2025-12-01,22.5,1.78,1,22.94,22.3,22.94,False,False
01-12-2025 11:00,PENGD,8.25,8.36,8.25,8.34,559134.0,0.02,0.09,0.01,1400.0,0.09,287339.3,94.59,0.22,True,53.12,-0.06,-0.07,0.01,2025-12-01,8.15,2.33,1,8.36,8.14,8.36,True,False
01-12-2025 11:00,SAHOL,82.2,83.2,82.2,83.1,6335986.0,0.1,0.9,0.16,445.45,0.9,4164904.2,52.13,0.11,True,67.09,0.16,0.09,0.07,2025-12-01,81.9,1.47,0,,80.85,83.15,False,False
01-12-2025 10:00,SASA,2.93,2.96,2.93,2.96,129582276.0,0.0,0.03,0.0,1400.0,0.03,57061276.0,127.09,0.0,True,56.5,-0.01,-0.02,0.01,2025-12-01,2.92,1.37,0,,2.9,2.99,True,False
01-12-2025 10:00,CELHA,11.7,12.26,11.7,12.26,5402017.0,0.0,0.56,0.01,4207.69,0.56,3270339.3,65.18,0.0,True,68.47,0.31,0.36,-0.05,2025-12-01,11.15,9.96,0,,10.48,12.54,False,False
01-12-2025 10:00,KOPOL,5.57,5.69,5.56,5.69,1418639.0,0.0,0.12,0.0,2300.0,0.12,858917.0,65.17,0.0,True,53.2,-0.03,-0.03,0.0,2025-12-01,5.58,1.97,2,5.56,5.56,ATH,True,True
01-12-2025 10:00,TATEN,15.77,16.34,15.77,16.19,1433788.0,0.15,0.42,0.04,1005.26,0.42,341994.0,319.24,0.36,True,64.11,-0.01,-0.04,0.02,2025-12-01,15.72,2.99,1,16.34,15.52,16.34,False,False
01-12-2025 10:00,BLUME,52.65,55.15,51.9,54.55,1310527.0,0.6,1.9,0.13,1307.41,1.9,223698.4,485.85,0.32,True,72.05,0.63,0.53,0.1,2025-12-01,53.0,2.92,0,,51.7,ATH,False,False
01-12-2025 10:00,BJKAS,1.73,1.76,1.72,1.76,6612568.0,0.0,0.03,0.0,1400.0,0.03,1863625.0,254.82,0.0,True,60.13,-0.01,-0.01,0.0,2025-12-01,1.72,2.33,2,1.72,1.72,1.8,True,True
01-12-2025 10:00,BINHO,9.81,10.24,9.78,10.18,9326685.0,0.06,0.37,0.02,1750.0,0.37,2165918.3,330.61,0.16,True,58.75,-0.07,-0.09,0.02,2025-12-01,9.84,3.46,3,,10.04,10.28,True,True
01-12-2025 10:00,BAYRK,23.0,24.72,22.86,24.54,2578899.0,0.18,1.54,0.12,1183.33,1.54,438430.2,488.21,0.12,True,61.49,-0.27,-0.39,0.12,2025-12-01,23.0,6.7,0,,22.78,25.16,True,True
01-12-2025 10:00,TUCLK,8.89,9.0,8.87,8.98,437305.0,0.02,0.09,0.01,1400.0,0.09,245694.0,77.99,0.22,True,51.25,-0.04,-0.04,0.0,2025-12-01,8.9,0.9,0,,8.78,9.28,True,True
01-12-2025 10:00,TUKAS,2.56,2.61,2.55,2.6,27687808.0,0.01,0.04,0.0,1900.0,0.04,9624573.3,187.68,0.25,True,54.58,-0.02,-0.02,0.0,2025-12-01,2.54,2.36,0,,2.54,2.64,True,True
01-12-2025 10:00,ALTNY,61.25,62.1,61.2,62.05,681294.0,0.05,0.8,0.07,1042.86,0.8,209024.3,225.94,0.06,True,65.85,-0.05,-0.16,0.11,2025-12-01,61.0,1.72,0,,60.65,ATH,True,False
01-12-2025 10:00,ULUFA,4.01,4.09,4.0,4.08,2786858.0,0.01,0.07,0.0,1650.0,0.07,1234185.5,125.81,0.14,True,57.64,-0.02,-0.02,0.01,2025-12-01,4.01,1.75,0,,3.97,4.12,True,False
01-12-2025 10:00,ALKA,8.97,9.16,8.91,9.13,1217484.0,0.03,0.16,0.01,1900.0,0.16,395553.7,207.79,0.19,True,53.39,-0.08,-0.1,0.03,2025-12-01,8.9,2.58,0,,8.9,9.56,True,False
01-12-2025 10:00,XU030,11902.11,12000.21,11864.24,11987.41,581355677.0,12.8,85.3,10.15,740.06,85.3,230986182.5,151.68,0.15,True,61.34,6.85,8.42,-1.57,2025-12-01,11911.7,0.64,2,11864.24,11864.24,12043.14,False,False
01-12-2025 10:00,XU100,10895.36,10979.42,10870.07,10970.12,1208366500.0,9.3,74.76,7.11,951.62,74.76,437974222.9,175.9,0.12,True,59.62,-3.29,-2.37,-0.92,2025-12-01,10898.7,0.66,2,10870.07,10870.07,11032.53,False,False
01-12-2025 10:00,YKBNK,35.24,35.96,35.04,35.84,48495015.0,0.12,0.6,0.09,538.3,0.6,18078066.3,168.25,0.2,True,72.33,0.18,0.14,0.04,2025-12-01,35.3,1.53,0,,34.86,ATH,False,False
01-12-2025 10:00,YYLGD,10.0,10.13,10.0,10.1,492674.0,0.03,0.1,0.0,9900.0,0.1,259349.3,89.97,0.3,True,46.52,-0.05,-0.05,0.0,2025-12-01,10.01,0.9,2,10.0,10.0,10.43,True,True
01-12-2025 10:00,TRCAS,40.48,40.7,39.74,40.7,183486.0,0.0,0.22,0.0,10900.0,0.22,65814.7,178.79,0.0,True,66.04,0.22,0.2,0.01,2025-12-01,40.44,0.64,2,39.74,39.74,40.94,False,False
01-12-2025 10:00,EDATA,5.26,5.34,5.26,5.33,262771.0,0.01,0.07,0.01,1300.0,0.07,142332.2,84.62,0.14,True,48.06,-0.03,-0.03,0.0,2025-12-01,5.25,1.52,0,,5.25,5.57,False,False
01-12-2025 10:00,KNFRT,11.65,12.1,11.57,12.0,483024.0,0.1,0.35,0.04,775.0,0.35,126431.4,282.04,0.29,True,75.1,0.09,0.06,0.03,2025-12-01,11.56,3.81,0,,11.09,12.14,False,False
01-12-2025 10:00,GOKNR,20.54,20.78,20.52,20.76,390935.0,0.02,0.22,0.01,2650.0,0.22,200578.0,94.9,0.09,True,52.55,-0.08,-0.09,0.01,2025-12-01,20.54,1.07,0,,20.4,20.84,True,False
01-12-2025 10:00,ONCSM,231.9,247.2,230.0,247.0,540915.0,0.2,15.1,1.42,963.38,15.1,149859.6,260.95,0.01,True,66.87,-0.28,-1.63,1.36,2025-12-01,227.0,8.81,0,,220.0,249.0,False,False
01-12-2025 10:00,GSDHO,4.27,4.34,4.27,4.32,639378.0,0.02,0.05,0.0,1150.0,0.05,284605.6,124.65,0.4,True,54.66,-0.01,-0.01,-0.0,2025-12-01,4.29,0.7,2,4.27,4.27,4.35,False,False
01-12-2025 10:00,GSRAY,1.28,1.3,1.27,1.3,42986595.0,0.0,0.02,0.0,1900.0,0.02,16335354.9,163.15,0.0,True,49.91,-0.01,-0.01,0.0,2025-12-01,1.27,2.36,1,1.3,1.26,1.39,True,False
01-12-2025 10:00,HATSN,39.7,40.24,39.66,40.14,87904.0,0.1,0.44,0.02,2650.0,0.44,44899.7,95.78,0.23,True,59.97,-0.07,-0.1,0.04,2025-12-01,39.7,1.11,0,,39.44,40.42,True,False
01-12-2025 10:00,HEKTS,3.17,3.23,3.17,3.22,17929704.0,0.01,0.05,0.01,733.33,0.05,6722004.7,166.73,0.2,True,64.08,-0.0,-0.01,0.0,2025-12-01,3.18,1.26,0,,3.15,3.23,False,False
01-12-2025 10:00,HKTM,11.76,12.04,11.74,11.97,356388.0,0.07,0.21,0.02,775.0,0.21,141014.4,152.73,0.33,True,59.76,-0.02,-0.04,0.02,2025-12-01,11.72,2.13,0,,11.65,12.5,True,False
01-12-2025 10:00,ICBCT,13.45,13.64,13.39,13.59,129149.0,0.05,0.14,0.02,723.53,0.14,62007.2,108.28,0.36,True,59.03,-0.03,-0.04,0.01,2025-12-01,13.37,1.65,0,,13.35,13.7,True,True
01-12-2025 10:00,IHLAS,3.25,3.32,3.24,3.32,30375142.0,0.0,0.07,0.0,3400.0,0.07,9601577.0,216.36,0.0,True,50.11,-0.03,-0.04,0.01,2025-12-01,3.23,2.79,0,,3.23,3.34,True,True
01-12-2025 10:00,MARTI,2.78,2.86,2.77,2.86,2242830.0,0.0,0.08,0.0,3900.0,0.08,923540.1,142.85,0.0,True,61.16,-0.01,-0.02,0.01,2025-12-01,2.77,3.25,0,,2.75,ATH,True,False
01-12-2025 10:00,IMASM,4.48,4.59,4.46,4.59,5907173.0,0.0,0.11,0.0,3566.67,0.11,2687519.6,119.8,0.0,True,52.63,-0.05,-0.06,0.01,2025-12-01,4.48,2.46,0,,4.4,4.73,True,False
01-12-2025 10:00,ISMEN,40.0,40.76,40.0,40.74,1623669.0,0.02,0.74,0.07,927.78,0.74,377420.0,330.2,0.03,True,77.22,0.03,-0.02,0.05,2025-12-01,39.94,2.0,0,,39.86,ATH,False,False
01-12-2025 10:00,LIDFA,4.55,4.67,4.55,4.65,2481928.0,0.02,0.1,0.01,1150.0,0.1,679584.6,265.21,0.2,True,63.74,0.02,0.01,0.01,2025-12-01,4.57,1.75,0,,4.5,4.66,False,False
01-12-2025 10:00,KAYSE,17.18,17.35,17.18,17.33,330243.0,0.02,0.15,0.01,1263.64,0.15,113142.0,191.88,0.13,True,54.43,-0.04,-0.04,0.01,2025-12-01,17.18,0.87,0,,17.17,17.48,True,True
01-12-2025 10:00,KCAER,10.48,10.62,10.46,10.62,1582101.0,0.0,0.14,0.0,2700.0,0.14,631964.9,150.35,0.0,True,51.54,-0.04,-0.05,0.01,2025-12-01,10.48,1.34,2,10.46,10.46,10.84,True,True
01-12-2025 10:00,KCHOL,168.5,170.8,167.5,170.6,7029628.0,0.2,2.1,0.15,1300.0,2.1,2898588.3,142.52,0.1,True,61.24,0.03,0.06,-0.03,2025-12-01,168.4,1.31,2,167.5,167.5,171.6,False,False
01-12-2025 10:00,GSDDE,9.26,9.39,9.26,9.37,146435.0,0.02,0.11,0.01,746.15,0.11,66262.5,120.99,0.18,True,50.73,-0.06,-0.07,0.01,2025-12-01,9.23,1.52,0,,9.16,9.88,True,False
01-12-2025 10:00,ZOREN,3.25,3.3,3.24,3.29,9118186.0,0.01,0.04,0.0,1900.0,0.04,3489968.5,161.27,0.25,True,52.95,-0.02,-0.02,0.0,2025-12-01,3.24,1.54,0,,3.23,3.32,True,True
01-12-2025 10:00,PRDGS,5.85,6.03,5.82,6.03,780505.0,0.0,0.18,0.01,2900.0,0.18,228019.6,242.3,0.0,True,60.6,-0.04,-0.05,0.01,2025-12-01,5.85,3.08,0,,5.81,6.67,True,True
01-12-2025 10:00,EGEGY,24.16,24.9,23.9,24.76,294691.0,0.14,0.6,0.07,733.33,0.6,143654.6,105.14,0.23,True,62.39,0.13,0.08,0.05,2025-12-01,24.18,2.4,2,23.9,23.9,ATH,False,False
01-12-2025 10:00,FZLGY,11.75,12.17,11.75,12.17,1674533.0,0.0,0.42,0.12,258.97,0.42,829403.1,101.9,0.0,True,66.18,-0.01,-0.1,0.09,2025-12-01,11.77,3.4,0,,10.87,12.51,False,False
01-12-2025 10:00,REEDR,7.34,7.45,7.3,7.44,5816898.0,0.01,0.1,0.0,9900.0,0.1,2250849.8,158.43,0.1,True,50.12,-0.04,-0.04,-0.0,2025-12-01,7.34,1.36,2,7.3,7.3,7.73,False,False
01-12-2025 10:00,EPLAS,5.24,5.35,5.24,5.33,667381.0,0.02,0.09,0.01,1025.0,0.09,203071.1,228.64,0.22,True,57.96,-0.02,-0.03,0.01,2025-12-01,5.22,2.11,0,,5.17,ATH,True,False
01-12-2025 10:00,EREGL,23.86,24.28,23.86,24.28,49533152.0,0.0,0.42,0.02,1650.0,0.42,16287580.3,204.12,0.0,True,69.06,-0.0,-0.02,0.02,2025-12-01,23.86,1.76,0,,23.74,ATH,False,False
01-12-2025 10:00,PRKME,16.39,16.59,16.39,16.57,198271.0,0.02,0.18,0.02,757.14,0.18,80542.6,146.17,0.11,True,68.3,0.01,-0.01,0.02,2025-12-01,16.39,1.1,0,,16.2,ATH,False,False
28-11-2025 17:00,BOBET,18.76,18.83,18.76,18.83,180219.0,0.0,0.07,0.0,1650.0,0.07,98755.7,82.49,0.0,True,59.01,0.0,0.01,-0.0,2025-11-28,18.8,0.16,0,,18.71,18.88,False,False
28-11-2025 17:00,LMKDC,27.6,27.94,27.6,27.86,587457.0,0.08,0.26,0.02,1200.0,0.26,203255.3,189.02,0.31,True,52.46,-0.09,-0.12,0.03,2025-11-28,27.7,0.58,0,,27.52,ATH,True,True
28-11-2025 17:00,CEMTS,10.48,10.8,10.47,10.74,3543865.0,0.06,0.26,0.03,828.57,0.26,789091.6,349.11,0.23,True,65.72,0.07,0.07,0.0,2025-11-28,10.54,1.9,0,,10.08,ATH,False,False
28-11-2025 17:00,MEGMT,41.94,43.8,41.92,43.62,2010347.0,0.18,1.68,0.15,1020.0,1.68,562035.4,257.69,0.11,True,61.52,-0.19,-0.29,0.11,2025-11-28,42.36,2.97,0,,41.44,43.7,True,True
28-11-2025 17:00,HATEK,19.19,21.22,19.17,21.22,4240118.0,0.0,2.03,0.17,1115.57,2.03,1348326.5,214.47,0.0,True,65.33,-0.21,-0.43,0.22,2025-11-28,19.3,9.95,0,,18.01,ATH,True,False
28-11-2025 17:00,TERA,235.5,259.5,234.5,259.5,8731896.0,0.0,24.0,2.7,788.89,24.0,1547749.8,464.17,0.0,True,66.69,-3.49,-6.9,3.41,2025-11-28,236.0,9.96,0,,220.6,320.5,True,False
28-11-2025 17:00,SURGY,49.58,52.45,49.06,52.45,1167009.0,0.0,2.87,0.31,811.11,2.87,325591.7,258.43,0.0,True,74.59,0.23,-0.02,0.25,2025-11-28,49.44,6.09,1,52.45,47.52,ATH,False,False
28-11-2025 16:00,GENTS,11.02,11.41,11.01,11.4,3097380.0,0.01,0.38,0.05,744.44,0.38,1069853.3,189.51,0.03,True,64.33,0.04,0.03,0.0,2025-11-28,10.87,4.88,0,,10.84,11.46,False,False
28-11-2025 15:00,YAYLA,32.4,33.58,32.4,33.56,834518.0,0.02,1.16,0.15,694.52,1.16,200380.6,316.47,0.02,True,66.58,0.17,0.19,-0.02,2025-11-28,32.36,3.71,0,,31.5,34.0,False,False
28-11-2025 14:00,SAFKR,23.5,24.32,23.46,24.18,1034049.0,0.14,0.68,0.07,930.3,0.68,480453.4,115.22,0.21,True,46.73,-0.48,-0.54,0.06,2025-11-28,23.7,2.03,0,,23.1,26.84,True,True
28-11-2025 14:00,BORLS,5.39,6.06,5.32,6.05,75154335.0,0.01,0.66,0.06,1078.57,0.66,20118701.6,273.55,0.02,True,48.97,-0.3,-0.34,0.05,2025-11-28,5.76,5.03,0,,5.23,ATH,True,False
28-11-2025 11:00,THYAO,272.75,276.5,272.5,275.75,8338805.0,0.75,3.0,0.22,1233.33,3.0,3111305.1,168.02,0.25,True,60.11,0.12,0.22,-0.11,2025-11-28,272.5,1.19,0,,271.5,276.5,False,False
28-11-2025 10:00,KZBGY,11.5,11.93,11.47,11.83,8456190.0,0.1,0.33,0.05,500.0,0.33,2312015.8,265.75,0.3,True,65.32,0.02,-0.05,0.07,2025-11-28,11.45,3.32,0,,10.66,12.16,False,False
28-11-2025 10:00,HRKET,68.95,70.5,68.6,70.45,439355.0,0.05,1.5,0.15,867.74,1.5,126855.5,246.34,0.03,True,67.18,0.37,0.28,0.09,2025-11-28,68.6,2.7,0,,67.05,70.95,False,False
27-11-2025 17:00,TRENJ,78.25,80.4,78.25,80.35,1000904.0,0.05,2.1,0.28,663.64,2.1,390424.9,156.36,0.02,True,69.74,0.76,0.43,0.33,2025-11-27,76.95,4.42,0,,73.9,ATH,False,False
27-11-2025 17:00,AHGAZ,26.36,26.74,26.34,26.72,699867.0,0.02,0.36,0.02,1400.0,0.36,259010.0,170.21,0.06,True,47.16,-0.21,-0.18,-0.03,2025-11-27,26.4,1.21,0,,26.2,27.94,False,False
27-11-2025 17:00,AKFIS,21.58,21.76,21.54,21.72,363398.0,0.04,0.14,0.02,677.78,0.14,182254.5,99.39,0.29,True,51.86,-0.05,-0.07,0.02,2025-11-27,21.4,1.5,0,,21.4,22.14,True,True
27-11-2025 15:00,IHGZT,1.98,2.05,1.97,2.04,21606870.0,0.01,0.06,0.01,445.45,0.06,7444344.5,190.25,0.17,True,65.13,-0.01,-0.02,0.01,2025-11-27,1.9,7.37,1,2.05,1.9,2.05,True,False
27-11-2025 10:00,ENDAE,14.61,15.73,14.61,15.43,1637268.0,0.3,0.82,0.02,3804.76,0.82,325808.7,402.52,0.37,True,55.52,-0.16,-0.13,-0.03,2025-11-27,14.56,5.98,0,,14.56,16.1,False,False
27-11-2025 10:00,FROTO,95.45,96.45,95.45,96.45,4305904.0,0.0,1.0,0.09,1076.47,1.0,1347671.8,219.51,0.0,True,71.58,0.34,0.25,0.09,2025-11-27,95.0,1.53,0,,ATL,ATH,False,False
27-11-2025 10:00,HEDEF,49.62,52.25,49.4,51.85,1117148.0,0.4,2.23,0.12,1727.87,2.23,572174.7,95.25,0.18,True,53.64,-0.53,-0.54,0.0,2025-11-27,49.64,4.45,2,49.4,49.4,59.5,True,True
26-11-2025 16:00,FORMT,3.56,3.94,3.56,3.88,26338870.0,0.06,0.32,0.02,1291.3,0.32,5735242.1,359.25,0.19,True,65.78,-0.03,-0.04,0.01,2025-11-26,3.63,6.89,3,,3.56,ATH,False,False
26-11-2025 15:00,EUREN,6.0,6.18,5.99,6.16,5824493.0,0.02,0.16,0.0,3900.0,0.16,2856150.3,103.93,0.12,True,56.31,-0.02,-0.01,-0.0,2025-11-26,6.15,0.16,2,5.99,5.99,6.33,False,False
26-11-2025 15:00,VSNMD,91.5,96.0,91.0,95.95,1185925.0,0.05,4.45,0.2,2125.0,4.45,435472.4,172.33,0.01,True,50.96,-1.23,-1.5,0.27,2025-11-26,91.7,4.63,0,,ATL,ATH,False,False
26-11-2025 13:00,IZFAS,141.0,144.7,140.8,144.7,466323.0,0.0,3.7,0.29,1175.86,3.7,183621.7,153.96,0.0,True,77.33,0.44,0.26,0.17,2025-11-26,140.9,2.7,0,,139.2,ATH,False,False
26-11-2025 13:00,MAGEN,32.44,33.16,32.04,32.98,1393047.0,0.18,0.54,0.01,4400.0,0.54,591276.6,135.6,0.33,True,57.76,-0.01,0.04,-0.04,2025-11-26,32.6,1.17,0,,ATL,33.8,False,False
26-11-2025 12:00,YUNSA,8.53,8.75,8.52,8.69,1914246.0,0.06,0.16,0.02,966.67,0.16,995314.6,92.33,0.38,True,50.92,-0.03,-0.04,0.01,2025-11-26,8.61,0.93,1,8.75,8.48,8.75,False,False
26-11-2025 10:00,GEDIK,6.59,6.85,6.56,6.8,2232465.0,0.05,0.21,0.01,1515.38,0.21,771705.6,189.29,0.24,True,67.08,0.03,0.03,-0.0,2025-11-26,6.59,3.19,3,,ATL,6.89,False,False
26-11-2025 10:00,AHSGY,14.46,15.76,14.46,15.58,7038080.44,0.18,1.12,0.12,822.22,1.12,856350.32,721.87,0.16,True,74.67,0.06,-0.01,0.07,2025-11-26,14.32,8.77,1,15.76,14.05,15.76,False,False
25-11-2025 15:00,PGSUS,204.3,208.9,203.8,208.4,6231142.0,0.5,4.1,0.13,3053.85,4.1,2401653.6,159.45,0.12,True,62.84,-0.2,-0.26,0.06,2025-11-25,205.0,1.66,0,,202.8,ATH,False,False
25-11-2025 15:00,VESTL,35.16,36.32,35.12,36.02,6976387.0,0.3,0.86,0.11,667.86,0.86,4081254.3,70.94,0.35,True,84.14,0.5,0.42,0.09,2025-11-25,33.92,6.19,1,36.32,33.74,36.32,False,False
25-11-2025 12:00,VAKFA,17.97,19.1,17.87,19.08,55418332.0,0.02,1.11,0.02,5450.0,1.11,30196532.5,83.53,0.02,True,68.01,0.08,0.11,-0.03,2025-11-25,18.89,1.01,0,,17.01,ATH,False,False
25-11-2025 12:00,TKFEN,69.2,70.0,69.15,69.8,494046.0,0.2,0.6,0.0,11900.0,0.6,303211.8,62.94,0.33,True,39.79,-0.28,-0.23,-0.05,2025-11-25,69.55,0.36,0,,68.65,ATH,False,False
25-11-2025 10:00,OFSYM,60.35,63.5,60.35,63.2,435840.0,0.3,2.85,0.27,936.36,2.85,88729.7,391.2,0.11,True,86.77,0.31,0.16,0.15,2025-11-25,60.2,4.98,0,,ATL,ATH,False,False
24-11-2025 17:00,EGEPO,8.01,8.18,8.0,8.14,1273566.0,0.04,0.13,0.02,584.21,0.13,497929.7,155.77,0.31,True,79.22,0.02,0.01,0.01,2025-11-24,7.97,2.13,1,8.18,ATL,8.18,False,False
24-11-2025 17:00,NTHOL,49.4,49.9,49.4,49.86,356703.0,0.04,0.46,0.07,521.62,0.46,149235.0,139.02,0.09,True,69.8,0.03,0.01,0.02,2025-11-24,49.48,0.77,1,49.9,ATL,49.9,False,False
24-11-2025 17:00,LRSHO,5.36,5.48,5.36,5.47,5402239.0,0.01,0.11,0.03,243.75,0.11,2846611.3,89.78,0.09,True,69.73,0.02,0.01,0.01,2025-11-24,5.17,5.8,0,,ATL,ATH,False,False
24-11-2025 15:00,DERHL,14.35,15.37,14.35,15.37,20143102.0,0.0,1.02,0.14,633.81,1.02,2903859.9,593.67,0.0,True,89.08,0.09,0.03,0.06,2025-11-24,13.98,9.94,0,,ATL,ATH,False,False
24-11-2025 15:00,AKENR,11.96,13.43,11.96,13.27,20625450.0,0.16,1.31,0.17,679.76,1.31,9416353.3,119.04,0.12,True,70.17,0.11,0.05,0.06,2025-11-24,11.92,11.33,0,,ATL,ATH,False,False
24-11-2025 15:00,ISSEN,7.63,8.07,7.63,8.04,680278.0,0.03,0.41,0.04,853.49,0.41,152390.8,346.4,0.07,True,91.19,0.03,0.01,0.02,2025-11-24,7.59,5.93,0,,ATL,ATH,False,False
24-11-2025 14:00,BNTAS,6.51,6.6,6.46,6.59,735506.0,0.01,0.08,0.01,433.33,0.08,263885.8,178.72,0.12,True,95.7,0.01,0.01,0.01,2025-11-24,6.45,2.17,0,,ATL,ATH,False,False
