Tarih,Hisse,open,high,low,close,volume,YuksekKapanis_Fark,AcilisKapanis_Fark,AcilisKapanisFark_Ort,AcilisKapanisFark_OrtalamayaGoreDegisim,AcilisKapanisFarkOrt_MaxSon10,HacimOrtalama,%Hacim_HacimOrtalama,Fark_Orani,Kosul,rsi,MACD_12_26_9,MACDs_12_26_9,MACDh_12_26_9,Tarih1,prev_close,%Deg,isPivot,pointpos,destek,direnc,Tsinyal_Banker_Dip,Tsinyal_Banker_DipKarar
23-02-2026 10:00,GEREL,23.32,24.58,23.14,24.58,2332777.0,0.0,1.26,0.11,1025.0,1.26,681874.9,242.11,0.0,True,64.76,-0.24,-0.47,0.22,2026-02-23,22.36,9.93,0,,23.96,25.7,True,False
23-02-2026 10:00,VAKFN,2.1,2.15,2.1,2.14,10724557.0,0.01,0.04,0.0,1233.33,0.04,6542545.1,63.92,0.25,True,53.72,-0.03,-0.03,0.01,2026-02-23,2.07,3.38,0,,2.05,2.34,True,True
23-02-2026 10:00,ULUUN,7.36,7.6,7.36,7.55,1509475.0,0.05,0.19,0.02,763.64,0.19,448352.4,236.67,0.26,True,62.83,-0.03,-0.07,0.04,2026-02-23,7.34,2.86,0,,7.13,8.06,True,False
23-02-2026 10:00,HDFGS,3.48,3.63,3.45,3.63,18552634.0,0.0,0.15,0.02,837.5,0.15,6410534.1,189.41,0.0,True,75.67,0.02,-0.02,0.04,2026-02-23,3.3,10.0,0,,3.17,3.69,False,False
23-02-2026 10:00,MARBL,12.95,13.24,12.95,13.23,300056.0,0.01,0.28,0.02,1172.73,0.28,174020.0,72.43,0.04,True,56.3,-0.15,-0.22,0.07,2026-02-23,12.85,2.96,0,,ATL,14.14,True,False
23-02-2026 10:00,TUCLK,4.98,5.08,4.97,5.07,2021048.0,0.01,0.09,0.01,650.0,0.09,732718.5,175.83,0.11,True,59.15,-0.04,-0.06,0.02,2026-02-23,4.92,3.05,0,,4.83,5.39,True,False
23-02-2026 10:00,GLRMK,176.8,178.6,176.0,178.5,262208.0,0.1,1.7,0.13,1207.69,1.7,159160.7,64.74,0.06,True,54.09,-2.33,-3.49,1.16,2026-02-23,173.3,3.0,0,,ATL,196.5,True,False
23-02-2026 10:00,GEDIK,6.03,6.1,5.99,6.08,1100947.0,0.02,0.05,0.0,2400.0,0.05,688106.2,60.0,0.4,True,49.91,-0.09,-0.12,0.03,2026-02-23,5.91,2.88,0,,ATL,7.1,True,False
23-02-2026 10:00,TRALT,58.4,60.45,58.15,60.2,19239345.0,0.25,1.8,0.39,361.54,1.8,8898940.5,116.2,0.14,True,82.27,0.95,0.49,0.46,2026-02-23,57.1,5.43,0,,54.2,ATH,False,False
23-02-2026 10:00,NTHOL,48.16,48.94,48.16,48.9,153779.0,0.04,0.74,0.11,585.19,0.74,60319.8,154.94,0.05,True,45.69,-0.66,-0.76,0.1,2026-02-23,48.02,1.83,0,,48.32,54.2,True,True
23-02-2026 10:00,SOKE,13.66,13.97,13.66,13.89,1089480.0,0.08,0.23,0.03,820.0,0.23,257317.6,323.4,0.35,True,71.29,0.08,-0.01,0.09,2026-02-23,13.49,2.97,0,,13.13,ATH,False,False
23-02-2026 10:00,FENER,3.33,3.37,3.29,3.36,80659482.0,0.01,0.03,0.01,328.57,0.03,18767773.7,329.78,0.33,True,71.9,-0.01,-0.03,0.02,2026-02-23,3.15,6.67,0,,3.09,3.37,False,False
23-02-2026 10:00,EUPWR,38.3,39.26,38.28,39.14,1322466.0,0.12,0.84,0.03,2900.0,0.84,801101.6,65.08,0.14,True,50.88,-0.74,-0.98,0.23,2026-02-23,37.92,3.22,0,,37.38,44.82,True,False
23-02-2026 10:00,ORCAY,3.59,3.64,3.55,3.64,370491.0,0.0,0.05,0.0,2400.0,0.05,165661.3,123.64,0.0,True,48.23,-0.04,-0.05,0.01,2026-02-23,3.55,2.54,0,,3.49,3.94,True,False
23-02-2026 10:00,ESCAR,25.98,26.96,25.98,26.72,1555349.0,0.24,0.74,0.21,245.79,0.74,824053.7,88.74,0.32,True,72.3,0.18,-0.07,0.25,2026-02-23,25.92,3.09,0,,23.98,27.8,False,False
23-02-2026 10:00,SELVA,2.36,2.41,2.35,2.4,4650427.0,0.01,0.04,0.0,1233.33,0.04,2915701.0,59.5,0.25,True,55.94,-0.02,-0.04,0.01,2026-02-23,2.34,2.56,0,,2.29,2.61,True,False
23-02-2026 10:00,BRLSM,15.6,15.89,15.58,15.84,581451.0,0.05,0.24,0.02,943.48,0.24,286093.0,103.24,0.21,True,55.73,-0.2,-0.3,0.1,2026-02-23,15.21,4.14,0,,15.34,18.22,True,False
23-02-2026 10:00,ORGE,71.0,72.4,71.0,72.05,86029.0,0.35,1.05,0.04,2525.0,1.05,56812.6,51.43,0.33,True,53.94,-0.55,-0.74,0.2,2026-02-23,70.65,1.98,0,,71.3,76.45,True,False
23-02-2026 10:00,SARKY,38.66,40.4,38.52,40.3,6503224.0,0.1,1.64,0.14,1088.41,1.64,1724295.4,277.15,0.06,True,70.49,0.23,0.03,0.2,2026-02-23,37.48,7.52,0,,36.8,40.54,False,False
23-02-2026 10:00,RUZYE,12.23,12.48,12.23,12.43,748948.0,0.05,0.2,0.0,19900.0,0.2,487493.4,53.63,0.25,True,52.78,-0.12,-0.17,0.04,2026-02-23,12.2,1.89,0,,ATL,13.34,True,False
23-02-2026 10:00,EDIP,39.86,41.66,39.84,41.6,224467.0,0.06,1.74,0.16,1015.38,1.74,122916.4,82.62,0.03,True,60.86,-0.37,-0.61,0.24,2026-02-23,39.04,6.56,0,,41.4,44.6,True,False
23-02-2026 10:00,PAHOL,1.63,1.64,1.62,1.64,75468531.0,0.0,0.01,0.0,400.0,0.01,34034417.5,121.74,0.0,True,51.7,-0.01,-0.02,0.01,2026-02-23,1.61,1.86,0,,1.59,1.73,True,False
23-02-2026 10:00,REEDR,6.69,6.8,6.69,6.77,3295855.0,0.03,0.08,0.01,788.89,0.08,1250185.0,163.63,0.38,True,52.12,-0.06,-0.08,0.02,2026-02-23,6.66,1.65,0,,ATL,7.18,True,False
23-02-2026 10:00,PRKAB,47.9,51.35,47.8,50.8,1215748.0,0.55,2.9,0.2,1335.64,2.9,558893.0,117.53,0.19,True,59.74,-0.8,-1.31,0.51,2026-02-23,47.3,7.4,0,,45.66,53.75,True,False
23-02-2026 10:00,PENTA,14.68,15.01,14.68,14.97,447417.0,0.04,0.29,0.02,1605.88,0.29,290411.3,54.06,0.14,True,55.1,-0.13,-0.18,0.04,2026-02-23,14.6,2.53,0,,14.4,16.75,True,True
23-02-2026 10:00,HOROZ,68.35,70.55,68.0,70.25,459762.0,0.3,1.9,0.14,1307.41,1.9,227119.2,102.43,0.16,True,67.37,0.36,0.02,0.33,2026-02-23,66.85,5.09,0,,64.55,72.0,False,False
23-02-2026 10:00,PETKM,17.57,17.91,17.57,17.83,14317527.0,0.08,0.26,0.01,1900.0,0.26,5673629.5,152.35,0.31,True,51.29,-0.28,-0.37,0.09,2026-02-23,17.39,2.53,0,,ATL,19.25,True,False
23-02-2026 10:00,ANGEN,11.67,12.2,11.67,12.09,797711.0,0.11,0.42,0.03,1212.5,0.42,214080.7,272.62,0.26,True,74.65,-0.04,-0.13,0.1,2026-02-23,11.18,8.14,0,,11.47,12.37,True,False
23-02-2026 10:00,IHGZT,1.6,1.63,1.6,1.63,6784944.0,0.0,0.03,0.0,1400.0,0.03,2531135.9,168.06,0.0,True,66.07,-0.01,-0.02,0.01,2026-02-23,1.54,5.84,0,,1.61,1.67,False,False
23-02-2026 10:00,KARSN,10.93,11.14,10.92,11.09,2148829.0,0.05,0.16,0.01,1130.77,0.16,1223592.9,75.62,0.31,True,56.94,-0.08,-0.11,0.03,2026-02-23,10.82,2.5,0,,10.62,11.89,True,True
23-02-2026 10:00,JANTS,19.16,19.39,19.16,19.33,327256.0,0.06,0.17,0.0,5566.67,0.17,192121.2,70.34,0.35,True,47.9,-0.21,-0.27,0.06,2026-02-23,18.99,1.79,0,,18.91,20.7,True,True
23-02-2026 10:00,YIGIT,24.34,25.2,24.34,25.08,945959.0,0.12,0.74,0.09,722.22,0.74,297501.5,217.97,0.16,True,57.33,-0.32,-0.48,0.16,2026-02-23,24.14,3.89,0,,23.6,27.18,True,False
23-02-2026 10:00,KTLEV,36.1,37.5,36.08,37.34,8453228.0,0.16,1.24,0.13,868.75,1.24,4932169.9,71.39,0.13,True,55.97,-0.57,-0.84,0.27,2026-02-23,35.7,4.59,0,,34.32,41.82,False,False
23-02-2026 10:00,IHYAY,1.9,1.94,1.9,1.93,1599351.0,0.01,0.03,0.0,900.0,0.03,822078.2,94.55,0.33,True,56.87,-0.01,-0.02,0.0,2026-02-23,1.88,2.66,0,,1.87,2.01,True,False
23-02-2026 10:00,IMASM,4.45,4.58,4.44,4.58,3245493.0,0.0,0.13,0.01,900.0,0.13,1801866.9,80.12,0.0,True,60.93,-0.04,-0.06,0.02,2026-02-23,4.4,4.09,0,,4.35,4.83,True,False
23-02-2026 10:00,HUBVC,4.32,4.51,4.32,4.5,712685.0,0.01,0.18,0.02,650.0,0.18,403872.9,76.46,0.06,True,74.44,0.06,0.03,0.03,2026-02-23,4.3,4.65,0,,4.08,ATH,False,False
23-02-2026 10:00,LILAK,33.18,33.6,32.92,33.52,1529329.0,0.08,0.34,0.0,8400.0,0.34,703688.4,117.33,0.24,True,62.33,-0.15,-0.36,0.21,2026-02-23,32.2,4.1,0,,31.46,35.72,True,False
23-02-2026 10:00,VAKKO,74.2,79.5,74.15,79.5,368695.0,0.0,5.3,0.67,691.04,5.3,120374.8,206.29,0.0,True,74.21,0.61,0.03,0.58,2026-02-23,72.3,9.96,0,,69.0,ATH,False,False
20-02-2026 17:00,ISMEN,49.5,50.25,49.32,50.25,1790068.0,0.0,0.75,0.0,74900.0,0.75,1172436.1,52.68,0.0,True,44.6,-0.72,-0.72,-0.0,2026-02-20,50.3,-0.1,0,,48.74,54.0,True,True
20-02-2026 17:00,IZENR,9.26,9.84,9.24,9.7,17568822.0,0.14,0.44,0.05,700.0,0.44,4707415.1,273.22,0.32,True,66.13,-0.05,-0.11,0.06,2026-02-20,9.1,6.59,0,,9.05,9.98,True,False
20-02-2026 17:00,AKBNK,87.05,88.1,87.0,88.05,13887097.0,0.05,1.0,0.11,769.57,1.0,9227205.9,50.5,0.05,True,49.75,-0.53,-0.61,0.07,2026-02-20,87.0,1.21,0,,85.55,92.3,False,False
20-02-2026 17:00,SANFM,7.02,7.12,6.99,7.1,1035897.0,0.02,0.08,0.01,471.43,0.08,578201.9,79.16,0.25,True,49.77,-0.08,-0.11,0.02,2026-02-20,6.91,2.75,0,,6.87,7.73,True,False
20-02-2026 17:00,BUCIM,6.75,6.79,6.75,6.79,1075426.0,0.0,0.04,0.01,700.0,0.04,570808.3,88.4,0.0,True,34.96,-0.08,-0.08,0.01,2026-02-20,6.76,0.44,0,,6.69,7.17,True,True
20-02-2026 17:00,ENSRI,31.2,34.3,31.18,34.3,1025951.0,0.0,3.1,0.27,1065.41,3.1,446843.8,129.6,0.0,True,78.61,0.32,0.15,0.17,2026-02-20,31.3,9.58,0,,30.2,ATH,False,False
20-02-2026 17:00,EKOS,6.36,6.65,6.32,6.65,9637143.0,0.0,0.29,0.06,400.0,0.29,4125326.7,133.61,0.0,True,65.79,0.05,0.02,0.03,2026-02-20,6.05,9.92,0,,6.0,6.82,False,False
20-02-2026 17:00,TURSG,12.06,12.2,12.04,12.18,4298933.0,0.02,0.12,0.01,1233.33,0.12,2340112.0,83.71,0.17,True,47.17,-0.13,-0.16,0.03,2026-02-20,12.11,0.58,0,,11.79,12.86,True,False
20-02-2026 17:00,YKBNK,41.42,42.0,41.4,41.92,25139844.0,0.08,0.5,0.08,557.89,0.5,16606645.8,51.38,0.16,True,53.07,-0.18,-0.23,0.05,2026-02-20,41.16,1.85,0,,40.66,43.94,False,False
20-02-2026 17:00,AGHOL,34.72,35.1,34.58,35.06,628680.0,0.04,0.34,0.04,672.73,0.34,295109.6,113.03,0.12,True,50.81,-0.29,-0.35,0.06,2026-02-20,34.72,0.98,0,,34.18,36.64,True,False
20-02-2026 17:00,PASEU,133.0,137.0,132.8,136.7,2223042.0,0.3,3.7,0.06,6066.67,3.7,624795.4,255.8,0.08,True,58.23,-0.34,-0.78,0.44,2026-02-20,136.9,-0.15,0,,127.5,136.9,False,False
20-02-2026 17:00,CONSE,3.55,3.64,3.52,3.62,2613904.0,0.02,0.07,0.01,600.0,0.07,1672373.5,56.3,0.29,True,46.73,-0.06,-0.07,0.01,2026-02-20,3.52,2.84,0,,3.44,3.95,True,False
20-02-2026 17:00,DUNYH,120.5,124.0,120.1,123.4,370836.0,0.6,2.9,0.79,267.09,2.9,104614.8,254.48,0.21,True,63.54,-0.57,-1.38,0.82,2026-02-20,116.1,6.29,0,,114.6,136.4,True,False
20-02-2026 17:00,KAREL,9.54,9.84,9.54,9.81,4845579.0,0.03,0.27,0.03,694.12,0.27,1147760.9,322.18,0.11,True,53.72,-0.14,-0.17,0.03,2026-02-20,9.36,4.81,0,,9.36,10.68,True,True
20-02-2026 17:00,VAKBN,40.64,41.0,40.64,41.0,4686089.0,0.0,0.36,0.03,1025.0,0.36,2481459.1,88.84,0.0,True,55.17,-0.1,-0.14,0.04,2026-02-20,40.7,0.74,0,,40.06,41.1,False,False
20-02-2026 17:00,POLHO,16.73,17.03,16.73,17.02,740300.0,0.01,0.29,0.03,728.57,0.29,403653.5,83.4,0.03,True,52.98,-0.2,-0.26,0.06,2026-02-20,16.53,2.96,0,,ATL,18.15,True,False
20-02-2026 17:00,HEDEF,88.65,96.75,87.8,95.0,2649655.0,1.75,6.35,0.68,827.01,6.35,570680.8,364.3,0.28,True,76.13,1.81,1.36,0.45,2026-02-20,88.0,7.95,0,,82.9,ATH,False,False
20-02-2026 17:00,ISCTR,16.49,16.79,16.49,16.78,129317311.0,0.01,0.29,0.03,900.0,0.29,66315575.0,95.0,0.03,True,46.63,-0.24,-0.28,0.04,2026-02-20,16.47,1.88,0,,16.65,18.03,True,True
20-02-2026 17:00,GARAN,155.6,157.4,155.5,157.4,4171873.0,0.0,1.8,0.23,682.61,1.8,2296803.1,81.64,0.0,True,51.26,-1.07,-1.3,0.23,2026-02-20,155.2,1.42,0,,152.6,164.5,True,True
20-02-2026 17:00,FZLGY,12.0,12.59,11.99,12.44,3813333.0,0.15,0.44,0.03,1529.63,0.44,1082496.1,252.27,0.34,True,55.6,-0.16,-0.19,0.03,2026-02-20,12.05,3.24,0,,11.64,13.1,False,False
20-02-2026 17:00,XBANK,19680.59,19924.2,19680.59,19918.28,200315082.0,5.92,237.69,33.3,613.68,237.69,113041580.0,77.2,0.02,True,51.01,-140.09,-170.74,30.64,2026-02-20,19605.04,1.6,0,,19447.51,20889.83,True,True
20-02-2026 17:00,IHEVA,2.34,2.48,2.33,2.48,625084.0,0.0,0.14,0.02,723.53,0.14,276662.1,125.94,0.0,True,69.88,-0.01,-0.02,0.01,2026-02-20,2.31,7.36,0,,2.25,ATH,False,False
20-02-2026 17:00,FORTE,90.7,92.75,90.0,92.55,398784.0,0.2,1.85,0.41,351.22,1.85,158782.2,151.15,0.11,True,55.4,-0.94,-1.19,0.26,2026-02-20,88.65,4.4,0,,87.85,97.8,True,False
20-02-2026 17:00,MNDTR,6.79,6.95,6.78,6.94,827907.0,0.01,0.15,0.01,1566.67,0.15,233271.6,254.91,0.07,True,58.81,-0.03,-0.03,0.01,2026-02-20,6.82,1.76,0,,6.68,7.1,False,False
20-02-2026 17:00,MOBTL,11.08,11.25,11.06,11.25,1385522.0,0.0,0.17,0.01,1788.89,0.17,805951.2,71.91,0.0,True,60.9,0.0,0.01,-0.01,2026-02-20,11.2,0.45,0,,11.01,11.37,False,False
20-02-2026 16:00,HALKB,47.82,49.28,47.76,49.04,20931006.0,0.24,1.22,0.21,470.09,1.22,6248142.6,235.0,0.2,True,62.6,-0.13,-0.32,0.19,2026-02-20,47.3,3.68,0,,46.44,49.9,False,False
20-02-2026 16:00,DOHOL,20.3,20.6,20.26,20.52,2323838.0,0.08,0.22,0.03,746.15,0.22,1257360.6,84.82,0.36,True,40.17,-0.33,-0.36,0.03,2026-02-20,20.3,1.08,0,,20.06,22.42,True,True
20-02-2026 16:00,GMTAS,26.02,26.3,25.96,26.28,304576.0,0.02,0.26,0.06,319.35,0.26,175043.9,74.0,0.08,True,59.03,0.01,-0.03,0.04,2026-02-20,25.82,1.78,0,,25.5,26.32,False,False
20-02-2026 16:00,DERHL,13.45,13.93,13.44,13.91,3102326.0,0.02,0.46,0.06,693.1,0.46,651236.8,376.37,0.04,True,64.98,-0.12,-0.18,0.06,2026-02-20,13.29,4.67,0,,13.25,14.42,True,False
20-02-2026 15:00,GSDDE,10.01,10.19,10.01,10.16,208546.0,0.03,0.15,0.01,2042.86,0.15,110207.4,89.23,0.2,True,46.57,-0.11,-0.11,0.0,2026-02-20,9.94,2.21,0,,9.91,11.29,False,False
20-02-2026 15:00,MEYSU,12.42,13.59,12.37,13.58,11857625.0,0.01,1.16,0.03,3214.29,1.16,4222534.8,180.82,0.01,True,59.49,-0.19,-0.22,0.03,2026-02-20,12.66,7.27,0,,13.51,14.18,True,True
20-02-2026 15:00,MANAS,11.07,11.64,11.02,11.64,13852239.0,0.0,0.57,0.09,512.9,0.57,5055918.8,173.98,0.0,True,70.02,0.0,-0.12,0.13,2026-02-20,10.59,9.92,0,,10.45,11.65,False,False
20-02-2026 15:00,ISFIN,20.26,20.74,20.26,20.72,499455.0,0.02,0.46,0.05,784.62,0.46,328003.5,52.27,0.04,True,52.45,-0.22,-0.24,0.03,2026-02-20,20.22,2.47,0,,19.92,21.68,True,True
20-02-2026 15:00,BLUME,44.16,45.8,44.06,45.66,575165.0,0.14,1.5,0.01,12400.0,1.5,255607.7,125.02,0.09,True,47.46,-0.72,-0.67,-0.06,2026-02-20,45.52,0.31,0,,45.6,49.66,True,True
20-02-2026 15:00,FRMPL,33.88,35.06,33.84,35.02,1204521.0,0.04,1.14,0.02,5600.0,1.14,720500.7,67.18,0.04,True,40.71,-0.94,-0.96,0.02,2026-02-20,34.8,0.63,0,,ATL,38.98,True,True
20-02-2026 15:00,BOBET,22.1,22.68,22.06,22.52,1000637.0,0.16,0.42,0.02,1650.0,0.42,439987.3,127.42,0.38,True,48.13,-0.31,-0.35,0.04,2026-02-20,21.92,2.74,0,,21.82,25.52,True,True
20-02-2026 14:00,SEKFK,9.63,9.81,9.63,9.76,359336.0,0.05,0.13,0.04,195.45,0.13,179016.1,100.73,0.38,True,60.78,-0.04,-0.07,0.03,2026-02-20,9.32,4.72,0,,9.2,9.99,False,False
20-02-2026 14:00,EGEPO,11.32,12.03,11.3,11.83,2233480.0,0.2,0.51,0.02,2025.0,0.51,418670.5,433.47,0.39,True,61.5,-0.01,-0.04,0.02,2026-02-20,11.3,4.69,0,,11.24,12.1,False,False
20-02-2026 13:00,OFSYM,67.55,69.6,67.5,69.2,185946.0,0.4,1.65,0.04,3566.67,1.65,113867.2,63.3,0.24,True,41.36,-1.1,-1.12,0.02,2026-02-20,68.95,0.36,0,,67.1,75.6,True,True
20-02-2026 13:00,ALKLC,261.25,276.75,255.75,274.5,1834531.0,2.25,13.25,1.65,703.03,13.25,316646.7,479.36,0.17,True,77.09,2.41,0.7,1.71,2026-02-20,256.25,7.12,0,,251.25,ATH,False,False
20-02-2026 13:00,TEKTU,8.69,9.52,8.66,9.51,21493621.0,0.01,0.82,0.07,1023.29,0.82,2916131.1,637.06,0.01,True,69.86,-0.1,-0.18,0.08,2026-02-20,8.66,9.82,0,,8.62,10.95,True,False
20-02-2026 13:00,VSNMD,90.4,94.05,89.9,94.0,2022763.0,0.05,3.6,0.38,860.0,3.6,575402.5,251.54,0.01,True,57.74,-0.61,-0.72,0.11,2026-02-20,90.2,4.21,0,,89.75,100.2,True,True
20-02-2026 13:00,LIDER,75.7,76.95,75.2,76.8,196041.0,0.15,1.1,0.2,436.59,1.1,65281.9,200.3,0.14,True,60.19,-0.12,-0.24,0.13,2026-02-20,74.55,3.02,0,,74.5,77.55,False,False
20-02-2026 12:00,SDTTR,238.5,251.5,238.4,248.9,1326313.0,2.6,10.4,1.94,436.08,10.4,688009.6,92.78,0.25,True,84.27,9.26,7.69,1.57,2026-02-20,233.3,6.69,1,251.5,199.2,251.5,False,False
20-02-2026 11:00,OZRDN,24.94,27.0,24.44,26.92,437067.0,0.08,1.98,0.17,1064.71,1.98,192437.9,127.12,0.04,True,70.7,0.57,0.49,0.08,2026-02-20,25.18,6.91,0,,22.34,ATH,False,False
20-02-2026 11:00,SKBNK,11.19,11.55,11.16,11.51,10511662.0,0.04,0.32,0.02,1291.3,0.32,4376450.8,140.19,0.13,True,67.82,0.06,0.07,-0.01,2026-02-20,11.12,3.51,0,,10.72,11.53,False,False
20-02-2026 11:00,OBASE,40.92,45.1,40.58,45.1,1310954.0,0.0,4.18,0.37,1023.66,4.18,205358.9,538.37,0.0,True,77.57,0.18,-0.09,0.27,2026-02-20,41.0,10.0,1,45.1,39.9,ATH,False,False
20-02-2026 10:00,NETCD,98.2,107.4,98.2,106.2,20371008.0,1.2,8.0,0.2,3900.0,8.0,5694759.1,257.72,0.15,True,59.2,-0.13,0.52,-0.65,2026-02-20,97.65,8.76,1,107.4,97.65,107.4,False,False
20-02-2026 10:00,EREGL,29.42,29.82,29.4,29.72,31055634.0,0.1,0.3,0.01,2400.0,0.3,19874828.2,56.26,0.33,True,52.76,-0.07,-0.07,-0.01,2026-02-20,29.42,1.02,0,,29.12,30.86,False,False
20-02-2026 10:00,IHAAS,68.95,73.75,64.5,73.75,997747.0,0.0,4.8,0.93,418.92,4.8,515950.7,93.38,0.0,True,85.43,3.52,3.3,0.22,2026-02-20,70.4,4.76,2,64.5,64.5,ATH,False,False
20-02-2026 10:00,ENKAI,99.55,101.0,99.05,100.7,2612322.0,0.3,1.15,0.07,1542.86,1.15,1145079.2,128.13,0.26,True,54.65,-0.32,-0.41,0.09,2026-02-20,99.5,1.21,0,,98.4,103.9,False,False
20-02-2026 10:00,LMKDC,30.1,31.14,30.0,30.9,1626237.0,0.24,0.8,0.02,4900.0,0.8,729045.1,123.06,0.3,True,50.77,-0.43,-0.45,0.02,2026-02-20,30.0,3.0,0,,29.72,32.78,True,True
20-02-2026 10:00,KLSYN,9.15,9.47,9.01,9.38,2623622.0,0.09,0.23,0.03,576.47,0.23,758516.0,245.89,0.39,True,62.53,0.01,-0.02,0.03,2026-02-20,9.12,2.85,1,9.47,8.9,9.47,True,False
20-02-2026 10:00,DSTKF,1168.0,1193.0,1165.0,1188.0,206899.0,5.0,20.0,1.1,1718.18,20.0,128975.0,60.42,0.25,True,71.97,31.81,37.34,-5.53,2026-02-20,1168.0,1.71,0,,925.0,1214.0,False,False
20-02-2026 10:00,SMART,26.18,28.62,26.04,28.62,3790892.0,0.0,2.44,0.09,2552.17,2.44,823281.7,360.46,0.0,True,52.98,-1.04,-1.11,0.07,2026-02-20,26.02,9.99,1,28.62,26.02,33.32,True,True
20-02-2026 10:00,VBTYZ,21.52,22.42,21.52,22.3,1025234.0,0.12,0.78,0.02,4775.0,0.78,380437.7,169.49,0.15,True,54.54,-0.16,-0.14,-0.02,2026-02-20,21.4,4.21,0,,21.1,22.9,False,False
20-02-2026 10:00,TATGD,18.09,19.58,18.0,19.39,7843208.0,0.19,1.3,0.12,974.38,1.3,3003293.4,161.15,0.15,True,73.5,0.63,0.65,-0.02,2026-02-20,18.2,6.54,1,19.58,17.56,19.58,False,False
20-02-2026 10:00,BLCYT,35.88,36.9,35.88,36.76,147325.0,0.14,0.88,0.05,1660.0,0.88,91615.0,60.81,0.16,True,45.91,-0.63,-0.7,0.07,2026-02-20,36.0,2.11,0,,35.46,38.92,False,False
20-02-2026 10:00,PNLSN,42.12,44.78,42.12,44.18,705633.0,0.6,2.06,0.02,9263.64,2.06,240417.3,193.5,0.29,True,54.35,-0.47,-0.36,-0.12,2026-02-20,42.0,5.19,1,44.78,41.46,44.78,False,False
20-02-2026 10:00,TCKRC,88.4,91.45,87.75,90.65,649176.0,0.8,2.25,0.04,5525.0,2.25,230776.4,181.3,0.36,True,53.22,-0.63,-0.56,-0.07,2026-02-20,88.7,2.2,1,91.45,86.85,91.45,False,False
20-02-2026 10:00,YESIL,1.88,1.99,1.87,1.97,10959016.0,0.02,0.09,0.0,4.0532396646334483e+17,0.09,2420970.1,352.67,0.22,True,52.68,-0.03,-0.03,-0.0,2026-02-20,1.86,5.91,1,1.99,1.86,1.99,True,True
19-02-2026 17:00,EMKEL,20.6,21.58,20.46,21.3,2207631.0,0.28,0.7,0.01,4900.0,0.7,593933.1,271.7,0.4,True,49.91,-0.29,-0.28,-0.01,2026-02-19,21.1,0.95,2,20.46,20.46,22.78,True,True
19-02-2026 17:00,AKSUE,22.4,23.36,22.1,23.3,324108.0,0.06,0.9,0.07,1150.0,0.9,151600.0,113.79,0.07,True,62.95,-0.05,-0.11,0.06,2026-02-19,22.56,3.28,0,,21.82,24.9,False,False
19-02-2026 17:00,AKCNS,215.7,218.3,215.5,217.9,604257.0,0.4,2.2,0.25,780.0,2.2,206251.7,192.97,0.18,True,67.16,1.13,1.13,0.01,2026-02-19,215.3,1.21,0,,212.0,218.5,False,False
19-02-2026 16:00,GSRAY,1.24,1.28,1.24,1.28,223005591.0,0.0,0.04,0.0,900.0,0.04,51092231.5,336.48,0.0,True,58.99,0.0,0.0,-0.0,2026-02-19,1.25,2.4,2,1.24,1.24,1.3,False,False
19-02-2026 16:00,GUNDG,309.75,344.5,308.25,344.5,828345.0,0.0,34.75,2.17,1497.7,34.75,170909.0,384.67,0.0,True,70.26,10.34,11.57,-1.24,2026-02-19,313.25,9.98,0,,300.5,351.75,False,False
19-02-2026 13:00,OZATD,177.3,185.6,176.8,184.6,319784.0,1.0,7.3,0.41,1680.49,7.3,141454.1,126.07,0.14,True,69.48,1.69,1.69,0.0,2026-02-19,177.2,4.18,0,,172.0,ATH,False,False
19-02-2026 13:00,PAPIL,19.32,21.1,19.32,20.84,22185632.0,0.26,1.52,0.06,2614.29,1.52,5952786.8,272.69,0.17,True,65.19,0.17,0.19,-0.03,2026-02-19,20.14,3.48,1,21.1,19.24,21.1,False,False
19-02-2026 12:00,PCILT,25.14,25.98,24.9,25.92,482744.0,0.06,0.78,0.04,1850.0,0.78,241001.2,100.31,0.08,True,59.51,0.1,0.17,-0.07,2026-02-19,25.04,3.51,1,25.98,24.44,25.98,False,False
19-02-2026 10:00,TUPRS,223.7,228.3,223.6,227.1,17151572.0,1.2,3.4,0.48,608.33,3.4,5272681.2,225.29,0.35,True,67.84,0.49,0.03,0.46,2026-02-19,222.1,2.25,0,,218.2,ATH,False,False
19-02-2026 10:00,MEGMT,72.1,75.1,72.1,74.55,3288806.0,0.55,2.45,0.61,301.64,2.45,1793211.7,83.4,0.22,True,81.46,1.29,0.87,0.42,2026-02-19,72.2,3.25,0,,66.3,ATH,False,False
19-02-2026 10:00,ISKPL,12.12,12.19,11.91,12.17,2675478.0,0.02,0.05,0.0,4900.0,0.05,1430293.1,87.06,0.4,True,54.87,-0.01,-0.01,-0.0,2026-02-19,12.04,1.08,0,,11.98,12.42,True,True
19-02-2026 10:00,DURKN,23.36,24.86,23.36,24.62,5693979.0,0.24,1.26,0.04,2763.64,1.26,2345664.9,142.74,0.19,True,61.05,0.34,0.41,-0.07,2026-02-19,23.06,6.76,1,24.86,22.06,24.86,False,False
18-02-2026 16:00,TRMET,149.2,151.7,148.7,151.2,1842390.0,0.5,2.0,0.72,177.78,2.0,874891.2,110.59,0.25,True,81.95,2.49,1.87,0.62,2026-02-18,144.5,4.64,0,,137.8,ATH,False,False
18-02-2026 15:00,NIBAS,4.94,5.46,4.92,5.38,8985814.0,0.08,0.44,0.02,1660.0,0.44,2787137.0,222.4,0.18,True,67.26,0.04,0.03,0.01,2026-02-18,4.97,8.25,2,4.92,4.92,ATH,False,False
18-02-2026 15:00,ALTIN,82.67,84.01,82.65,83.9,6383137.0,0.11,1.23,0.0,122900.0,1.23,2699098.2,136.49,0.09,True,62.09,-0.09,-0.26,0.18,2026-02-18,82.08,2.22,0,,81.65,ATH,False,False
18-02-2026 14:00,KOCMT,2.82,2.98,2.82,2.96,26320353.0,0.02,0.14,0.02,723.53,0.14,6887264.8,282.16,0.14,True,79.83,0.02,0.01,0.01,2026-02-18,2.84,4.23,0,,2.78,ATH,False,False
18-02-2026 14:00,EFOR,22.76,23.32,22.5,23.22,2890493.0,0.1,0.46,0.05,784.62,0.46,784049.4,268.66,0.22,True,54.43,0.03,0.04,-0.01,2026-02-18,23.0,0.96,2,22.5,22.5,23.5,False,False
18-02-2026 14:00,ASTOR,185.9,190.9,185.8,190.6,9630916.0,0.3,4.7,0.99,374.75,4.7,5189852.3,85.57,0.06,True,76.56,1.63,0.25,1.39,2026-02-18,175.8,8.42,0,,173.7,ATH,False,False
18-02-2026 14:00,DOFRB,89.4,94.7,89.4,94.7,12386451.0,0.0,5.3,0.77,588.31,5.3,2202769.1,462.31,0.0,True,83.76,0.42,-0.28,0.7,2026-02-18,86.1,9.99,0,,85.6,ATH,False,False
18-02-2026 14:00,TERA,228.3,235.8,228.1,234.8,3057971.0,1.0,6.5,0.77,744.16,6.5,758261.1,303.29,0.15,True,82.99,1.59,1.02,0.57,2026-02-18,225.5,4.12,0,,221.8,ATH,False,False
18-02-2026 14:00,ANSGR,27.88,28.18,27.84,28.16,3147451.0,0.02,0.28,0.03,900.0,0.28,1375604.9,128.8,0.07,True,60.13,0.04,0.05,-0.01,2026-02-18,27.92,0.86,0,,27.86,28.2,False,False
18-02-2026 13:00,ENJSA,111.6,114.1,111.5,113.8,709520.0,0.3,2.2,0.18,1122.22,2.2,286928.1,147.28,0.14,True,63.36,0.09,0.02,0.07,2026-02-18,110.4,3.08,0,,109.5,114.0,False,False
18-02-2026 13:00,DURDO,4.08,4.41,4.08,4.38,14438580.0,0.03,0.3,0.04,733.33,0.3,2304022.8,526.67,0.1,True,80.04,0.05,0.04,0.01,2026-02-18,4.02,8.96,0,,3.86,ATH,False,False
18-02-2026 13:00,OSMEN,9.24,9.45,9.21,9.39,917145.0,0.06,0.15,0.0,14900.0,0.15,336824.8,172.29,0.4,True,67.52,0.12,0.13,-0.01,2026-02-18,9.18,2.29,1,9.45,ATL,9.45,False,False
18-02-2026 13:00,BRSAN,692.5,722.5,692.5,717.5,598373.0,5.0,25.0,1.0,2400.0,25.0,224719.5,166.28,0.2,True,53.74,-9.43,-11.12,1.69,2026-02-18,689.5,4.06,0,,686.5,784.0,True,True
18-02-2026 13:00,BNTAS,7.18,7.25,7.18,7.25,2124825.0,0.0,0.07,0.02,366.67,0.07,1195986.6,77.66,0.0,True,76.52,0.06,0.06,0.0,2026-02-18,7.07,2.55,0,,7.02,ATH,False,False
18-02-2026 12:00,KZGYO,26.32,26.68,26.22,26.66,267872.0,0.02,0.34,0.04,672.73,0.34,142611.6,87.83,0.06,True,60.74,0.04,0.04,-0.0,2026-02-18,26.42,0.91,0,,26.14,26.98,False,False
18-02-2026 12:00,METRO,5.81,5.94,5.79,5.94,2460218.0,0.0,0.13,0.02,766.67,0.13,1129920.2,117.73,0.0,True,58.5,-0.01,-0.02,0.01,2026-02-18,5.81,2.24,0,,5.67,6.13,False,False
18-02-2026 12:00,ODAS,6.3,6.48,6.29,6.46,18079178.0,0.02,0.16,0.01,1042.86,0.16,7243627.7,149.59,0.13,True,68.48,0.01,0.01,0.0,2026-02-18,6.2,4.19,0,,6.18,6.48,False,False
18-02-2026 12:00,AVOD,5.15,5.23,5.11,5.21,2193685.0,0.02,0.06,0.0,2900.0,0.06,1115124.9,96.72,0.33,True,58.03,0.0,-0.0,0.0,2026-02-18,5.1,2.16,1,5.23,5.04,5.23,False,False
18-02-2026 12:00,MERIT,18.54,18.89,18.51,18.8,1022526.0,0.09,0.26,0.0,6400.0,0.26,673354.0,51.86,0.35,True,63.7,0.08,0.1,-0.02,2026-02-18,18.52,1.51,0,,17.62,18.85,False,False
18-02-2026 12:00,PETUN,13.35,13.61,13.31,13.54,1143686.0,0.07,0.19,0.03,533.33,0.19,424254.3,169.58,0.37,True,64.34,0.04,0.04,-0.0,2026-02-18,13.32,1.65,0,,13.03,ATH,False,False
18-02-2026 12:00,KAYSE,5.6,5.85,5.59,5.8,22215342.0,0.05,0.2,0.01,1328.57,0.2,10671100.5,108.18,0.25,True,69.82,0.1,0.1,0.0,2026-02-18,5.5,5.45,0,,5.48,5.97,False,False
18-02-2026 12:00,ARFYE,30.24,30.72,30.22,30.68,1740362.0,0.04,0.44,0.08,450.0,0.44,1005277.7,73.12,0.09,True,63.26,0.01,-0.08,0.09,2026-02-18,29.92,2.54,0,,29.6,31.86,False,False
18-02-2026 11:00,GARFA,31.32,32.78,31.18,32.5,1665487.0,0.28,1.18,0.31,278.21,1.18,379223.2,339.18,0.24,True,89.44,0.51,0.27,0.24,2026-02-18,30.04,8.19,0,,29.16,ATH,False,False
18-02-2026 11:00,DESA,13.14,13.49,13.06,13.4,708035.0,0.09,0.26,0.05,409.8,0.26,198245.9,257.15,0.35,True,85.03,0.2,0.17,0.03,2026-02-18,12.79,4.77,0,,12.67,ATH,False,False
18-02-2026 11:00,BIMAS,706.0,714.0,704.5,713.0,1551551.0,1.0,7.0,0.3,2233.33,7.0,727215.8,113.35,0.14,True,58.2,-0.59,-0.04,-0.55,2026-02-18,699.0,2.0,0,,691.0,724.5,False,False
18-02-2026 11:00,SAHOL,110.4,111.9,110.2,111.9,9443546.0,0.0,1.5,0.08,1775.0,1.5,3988987.9,136.74,0.0,True,56.16,0.11,0.33,-0.21,2026-02-18,110.0,1.73,0,,110.0,115.0,False,False
18-02-2026 11:00,RUBNS,35.68,37.3,35.6,37.24,774454.0,0.06,1.56,0.14,998.59,1.56,468708.4,65.23,0.04,True,73.78,0.61,0.5,0.11,2026-02-18,35.58,4.67,0,,31.5,ATH,False,False
18-02-2026 11:00,ALKIM,19.87,20.02,19.86,19.98,460830.0,0.04,0.11,0.0,5400.0,0.11,235358.5,95.8,0.36,True,56.46,0.02,0.02,-0.0,2026-02-18,19.83,0.76,1,20.02,19.53,20.02,False,False
18-02-2026 11:00,ALKA,13.43,13.8,13.41,13.74,2265674.0,0.06,0.31,0.02,1723.53,0.31,903206.9,150.85,0.19,True,65.54,0.06,0.06,-0.0,2026-02-18,13.51,1.7,1,13.8,13.35,13.8,False,False
18-02-2026 11:00,BURCE,59.55,62.0,59.3,61.5,214265.0,0.5,1.95,0.31,529.03,1.95,125699.4,70.46,0.26,True,58.75,-0.24,-0.29,0.05,2026-02-18,59.0,4.24,1,62.0,57.7,62.0,False,False
18-02-2026 11:00,XU030,15789.84,15938.61,15786.81,15907.64,1411147644.0,30.97,117.8,18.56,534.73,117.8,706881159.4,99.63,0.26,True,61.71,31.92,38.11,-6.19,2026-02-18,15616.21,1.87,0,,15622.71,16011.0,False,False
18-02-2026 11:00,XU100,14372.4,14487.45,14372.4,14459.4,1853040885.0,28.05,87.0,14.21,512.42,87.0,1130850179.2,63.86,0.32,True,64.33,45.75,48.36,-2.6,2026-02-18,14227.29,1.63,0,,14109.21,ATH,False,False
18-02-2026 11:00,AEFES,21.52,21.74,21.5,21.72,9719028.0,0.02,0.2,0.01,1900.0,0.2,5297879.9,83.45,0.1,True,51.54,0.01,0.07,-0.06,2026-02-18,21.5,1.02,0,,21.48,22.3,False,False
18-02-2026 11:00,KCHOL,222.1,225.3,221.9,225.2,8800273.0,0.1,3.1,0.48,545.83,3.1,3207031.4,174.41,0.03,True,61.82,0.54,0.69,-0.15,2026-02-18,220.8,1.99,0,,219.7,229.1,False,False
18-02-2026 11:00,A1YEN,33.4,34.02,33.3,33.92,737701.0,0.1,0.52,0.1,409.8,0.52,344915.3,113.88,0.19,True,75.54,0.4,0.37,0.03,2026-02-18,33.2,2.17,0,,31.14,ATH,False,False
18-02-2026 10:00,MARTI,3.0,3.04,2.98,3.03,4404517.0,0.01,0.03,0.0,650.0,0.03,1451187.5,203.51,0.33,True,58.87,0.01,0.01,-0.0,2026-02-18,3.0,1.0,1,3.04,2.97,3.04,False,False
18-02-2026 10:00,AFYON,15.11,15.32,15.03,15.28,935069.0,0.04,0.17,0.01,1788.89,0.17,256571.1,264.45,0.24,True,61.59,0.03,0.05,-0.02,2026-02-18,15.11,1.13,0,,14.78,15.52,False,False
18-02-2026 10:00,AHGAZ,25.38,25.8,25.22,25.7,1414975.0,0.1,0.32,0.04,742.11,0.32,858780.0,64.77,0.31,True,60.13,0.04,-0.02,0.06,2026-02-18,25.0,2.8,0,,24.78,26.06,False,False
18-02-2026 10:00,KMPUR,16.53,16.84,16.47,16.81,874465.0,0.03,0.28,0.05,471.43,0.28,286201.8,205.54,0.11,True,75.59,0.13,0.11,0.02,2026-02-18,16.5,1.88,0,,15.55,ATH,False,False
18-02-2026 10:00,AKFIS,31.04,32.78,30.3,32.62,11595332.0,0.16,1.58,0.25,522.05,1.58,2016298.0,475.08,0.1,True,96.95,1.62,1.53,0.09,2026-02-18,30.72,6.18,0,,22.38,ATH,False,False
18-02-2026 10:00,IEYHO,80.3,81.25,80.3,81.2,1234177.0,0.05,0.9,0.08,1025.0,0.9,584629.4,111.1,0.06,True,79.82,0.45,0.39,0.06,2026-02-18,80.0,1.5,0,,78.45,ATH,False,False
18-02-2026 10:00,KRDMD,31.72,32.6,31.7,32.44,26481706.0,0.16,0.72,0.05,1340.0,0.72,5489514.2,382.41,0.22,True,63.22,0.09,0.09,-0.0,2026-02-18,31.78,2.08,0,,31.4,32.66,False,False
18-02-2026 10:00,ICUGS,3.31,3.54,3.31,3.51,18371074.0,0.03,0.2,0.02,852.38,0.2,5884427.9,212.2,0.15,True,74.23,0.1,0.11,-0.01,2026-02-18,3.28,7.01,0,,2.89,ATH,False,False
18-02-2026 10:00,KRVGD,3.25,3.32,3.2,3.31,3042950.0,0.01,0.06,0.01,445.45,0.06,1004235.3,203.01,0.17,True,75.77,0.04,0.03,0.01,2026-02-18,3.24,2.16,0,,3.15,ATH,False,False
18-02-2026 10:00,MACKO,37.5,40.12,36.94,40.08,5634460.0,0.04,2.58,0.26,900.0,2.58,672948.1,737.28,0.02,True,99.2,1.86,1.74,0.12,2026-02-18,36.86,8.74,0,,33.52,ATH,False,False
18-02-2026 10:00,AKHAN,28.28,30.1,28.16,29.84,25095107.0,0.26,1.56,0.17,806.98,1.56,5115232.5,390.6,0.17,True,64.23,-0.15,-0.3,0.15,2026-02-18,28.16,5.97,1,30.1,27.8,30.1,True,False
18-02-2026 10:00,ARDYZ,46.04,47.66,45.98,47.26,3542418.0,0.4,1.22,0.02,5445.45,1.22,592869.2,497.5,0.33,True,63.29,-0.07,-0.1,0.03,2026-02-18,44.8,5.49,1,47.66,43.36,47.66,False,False
18-02-2026 10:00,MTRKS,24.08,24.38,23.82,24.34,368586.0,0.04,0.26,0.05,441.67,0.26,191123.9,92.85,0.15,True,75.03,0.26,0.24,0.01,2026-02-18,24.04,1.25,0,,22.48,24.5,False,False
18-02-2026 10:00,KBORU,18.6,20.96,18.47,20.82,14587330.0,0.14,2.22,0.29,662.89,2.22,3287230.0,343.76,0.06,True,66.73,0.14,0.03,0.11,2026-02-18,19.54,6.55,2,18.47,18.47,ATH,False,False
18-02-2026 10:00,BAYRK,4.92,4.97,4.91,4.96,1266221.0,0.01,0.04,0.0,1233.33,0.04,729043.1,73.68,0.25,True,44.11,-0.02,0.0,-0.02,2026-02-18,4.99,-0.6,0,,4.59,5.35,False,False
18-02-2026 10:00,AYEN,30.26,32.46,30.22,32.3,2175061.0,0.16,2.04,0.18,1033.33,2.04,335590.1,548.13,0.08,True,81.37,0.28,0.21,0.07,2026-02-18,30.14,7.17,0,,29.88,ATH,False,False
18-02-2026 10:00,EKSUN,6.11,6.17,6.05,6.16,1478649.0,0.01,0.05,0.01,733.33,0.05,554455.5,166.68,0.2,True,64.5,0.03,0.04,-0.01,2026-02-18,6.11,0.82,0,,6.06,6.18,False,False
18-02-2026 10:00,CGCAM,39.02,40.28,38.96,40.1,2488255.0,0.18,1.08,0.05,2247.83,1.08,710874.0,250.03,0.17,True,63.21,0.07,0.03,0.04,2026-02-18,38.46,4.26,1,40.28,37.42,40.28,False,False
18-02-2026 10:00,PLTUR,24.84,25.9,24.5,25.6,1504560.0,0.3,0.76,0.08,874.36,0.76,336018.7,347.76,0.39,True,78.57,0.14,0.06,0.08,2026-02-18,24.74,3.48,0,,24.36,26.12,False,False
18-02-2026 10:00,BRKSN,8.9,9.05,8.9,9.05,401254.0,0.0,0.15,0.02,733.33,0.15,234627.4,71.02,0.0,True,48.15,-0.03,-0.02,-0.01,2026-02-18,8.97,0.89,0,,8.7,9.29,False,False
18-02-2026 10:00,OZSUB,20.92,21.38,20.82,21.28,454306.0,0.1,0.36,0.01,5900.0,0.36,205213.1,121.38,0.28,True,54.19,0.03,0.07,-0.04,2026-02-18,20.92,1.72,2,20.82,20.82,21.58,False,False
18-02-2026 10:00,CIMSA,54.5,55.8,54.1,55.55,5259495.0,0.25,1.05,0.05,1809.09,1.05,1197808.0,339.09,0.24,True,67.36,0.27,0.29,-0.02,2026-02-18,53.95,2.97,0,,53.85,55.85,False,False
18-02-2026 10:00,TRENJ,109.5,111.3,109.4,111.2,746201.0,0.1,1.7,0.21,709.52,1.7,245899.3,203.46,0.06,True,64.4,0.44,0.33,0.11,2026-02-18,108.4,2.58,0,,106.9,111.8,False,False
18-02-2026 10:00,MNDRS,16.49,16.61,16.25,16.58,2507193.0,0.03,0.09,0.01,592.31,0.09,465319.4,438.81,0.33,True,82.01,0.18,0.14,0.04,2026-02-18,16.0,3.62,0,,15.42,ATH,False,False
18-02-2026 10:00,ENERY,9.71,9.92,9.62,9.9,7173496.0,0.02,0.19,0.04,322.22,0.19,2477035.3,189.6,0.11,True,83.79,0.08,0.04,0.04,2026-02-18,9.69,2.17,0,,9.34,ATH,False,False
18-02-2026 10:00,ELITE,34.04,35.7,33.42,35.6,1536075.0,0.1,1.56,0.2,664.71,1.56,354422.4,333.4,0.06,True,82.76,0.37,0.26,0.11,2026-02-18,34.04,4.58,1,35.7,32.42,35.7,False,False
18-02-2026 10:00,NTGAZ,12.29,12.44,12.26,12.44,962831.0,0.0,0.15,0.01,2400.0,0.15,391030.6,146.23,0.0,True,61.87,0.11,0.13,-0.03,2026-02-18,12.37,0.57,0,,ATL,12.61,False,False
17-02-2026 17:00,RYSAS,19.0,19.39,19.0,19.35,5909714.0,0.04,0.35,0.03,1246.15,0.35,846307.0,598.29,0.11,True,64.72,0.02,0.01,0.01,2026-02-17,19.1,1.31,0,,18.9,20.38,False,False
17-02-2026 17:00,EPLAS,6.99,7.21,6.94,7.16,3019273.0,0.05,0.17,0.01,2025.0,0.17,849983.5,255.22,0.29,True,57.35,0.02,0.03,-0.02,2026-02-17,7.1,0.85,0,,6.93,7.35,False,False
17-02-2026 17:00,CEMAS,6.22,6.47,6.2,6.44,17068554.0,0.03,0.22,0.01,1471.43,0.22,5133582.3,232.49,0.14,True,62.59,0.04,0.05,-0.02,2026-02-17,6.28,2.55,1,6.47,6.15,6.47,False,False
17-02-2026 17:00,MHRGY,3.88,4.0,3.87,3.98,3142696.0,0.02,0.1,0.01,566.67,0.1,712478.7,341.09,0.2,True,76.45,0.02,0.01,0.01,2026-02-17,3.85,3.38,1,4.0,3.82,4.0,False,False
17-02-2026 17:00,DMRGD,4.45,4.54,4.44,4.53,8998158.0,0.01,0.08,0.02,400.0,0.08,3441012.7,161.5,0.12,True,72.87,0.05,0.05,0.0,2026-02-17,4.41,2.72,1,4.54,3.98,4.54,False,False
17-02-2026 17:00,TATEN,10.25,10.32,10.2,10.32,4529520.0,0.0,0.07,0.01,600.0,0.07,2262040.1,100.24,0.0,True,57.66,0.01,0.0,0.0,2026-02-17,10.16,1.57,0,,10.1,10.39,False,False
17-02-2026 17:00,ETILR,4.25,4.28,4.21,4.28,1410831.0,0.0,0.03,0.0,2900.0,0.03,541244.0,160.66,0.0,True,61.27,0.01,0.02,-0.0,2026-02-17,4.27,0.23,0,,4.16,4.33,False,False
17-02-2026 17:00,PENGD,9.35,10.29,9.34,10.29,14889020.0,0.0,0.94,0.09,956.18,0.94,1959892.9,659.69,0.0,True,83.49,0.08,0.03,0.06,2026-02-17,9.36,9.94,0,,9.2,ATH,False,False
17-02-2026 17:00,TNZTP,27.98,28.34,27.98,28.3,886722.0,0.04,0.32,0.0,7900.0,0.32,521541.7,70.02,0.12,True,59.31,0.14,0.21,-0.08,2026-02-17,28.2,0.35,0,,ATL,28.84,False,False
17-02-2026 17:00,AZTEK,4.87,4.93,4.86,4.92,2162707.0,0.01,0.05,0.0,2400.0,0.05,777475.9,178.17,0.2,True,60.34,0.02,0.02,-0.0,2026-02-17,4.9,0.41,0,,4.72,4.94,False,False
17-02-2026 17:00,YUNSA,10.67,11.2,10.65,11.1,4638490.0,0.1,0.43,0.08,418.07,0.43,1655653.6,180.16,0.23,True,79.26,0.13,0.06,0.08,2026-02-17,10.27,8.08,1,11.2,10.07,11.2,False,False
17-02-2026 17:00,MEKAG,5.2,5.32,5.17,5.32,3064565.0,0.0,0.12,0.0,11900.0,0.12,1681775.8,82.22,0.0,True,65.1,0.04,0.04,-0.0,2026-02-17,5.29,0.57,0,,5.13,5.42,False,False
17-02-2026 17:00,GSDHO,5.22,5.38,5.2,5.34,5867173.0,0.04,0.12,0.01,1233.33,0.12,1787648.3,228.21,0.33,True,61.56,-0.0,0.0,-0.01,2026-02-17,5.35,-0.19,0,,5.14,5.44,False,False
17-02-2026 16:00,DOAS,242.2,245.1,241.0,244.5,399466.0,0.6,2.3,0.35,557.14,2.3,234447.7,70.39,0.26,True,67.62,1.1,1.0,0.1,2026-02-17,241.9,1.07,0,,239.2,245.0,False,False
17-02-2026 16:00,LIDFA,3.19,3.25,3.18,3.25,3354157.0,0.0,0.06,0.01,361.54,0.06,1394125.7,140.59,0.0,True,70.58,0.02,0.01,0.01,2026-02-17,3.14,3.5,0,,3.11,ATH,False,False
17-02-2026 16:00,ULKER,138.1,140.0,137.6,139.5,949820.0,0.5,1.4,0.13,976.92,1.4,542537.5,75.07,0.36,True,60.05,0.27,0.34,-0.07,2026-02-17,138.7,0.58,1,140.0,136.1,140.0,False,False
17-02-2026 16:00,MOPAS,56.45,58.35,56.2,57.9,2038451.0,0.45,1.45,0.03,4733.33,1.45,538549.6,278.51,0.31,True,59.2,-0.28,-0.36,0.08,2026-02-17,55.3,4.7,1,58.35,54.35,58.35,False,False
17-02-2026 16:00,RGYAS,165.5,167.8,165.1,167.4,214256.0,0.4,1.9,0.3,533.33,1.9,94039.1,127.84,0.21,True,77.17,1.42,1.37,0.05,2026-02-17,164.5,1.76,0,,156.0,ATH,False,False
17-02-2026 16:00,INDES,8.87,9.1,8.85,9.05,1817224.0,0.05,0.18,0.03,500.0,0.18,1096387.8,65.75,0.28,True,76.6,0.1,0.09,0.01,2026-02-17,8.76,3.31,0,,8.66,ATH,False,False
17-02-2026 15:00,BESLR,15.4,16.57,15.35,16.4,2519837.0,0.17,1.0,0.08,1119.51,1.0,746459.1,237.57,0.17,True,74.75,0.13,0.12,0.01,2026-02-17,15.56,5.4,0,,15.06,ATH,False,False
17-02-2026 15:00,ONRYT,72.5,73.5,72.5,73.4,303836.0,0.1,0.9,0.14,542.86,0.9,136561.4,122.49,0.11,True,65.58,0.06,-0.02,0.07,2026-02-17,72.15,1.73,0,,71.65,73.75,False,False
17-02-2026 15:00,ANELE,17.14,18.06,17.12,17.9,2296107.0,0.16,0.76,0.11,597.25,0.76,376171.4,510.39,0.21,True,86.93,0.2,0.13,0.07,2026-02-17,16.85,6.23,1,18.06,15.66,18.06,False,False
17-02-2026 15:00,HRKET,87.6,89.95,87.5,89.5,270219.0,0.45,1.9,0.12,1483.33,1.9,100480.8,168.93,0.24,True,67.02,0.53,0.39,0.14,2026-02-17,87.8,1.94,1,89.95,84.85,89.95,False,False
17-02-2026 15:00,DEVA,78.4,80.1,78.1,80.0,148124.0,0.1,1.6,0.2,680.49,1.6,55178.4,168.45,0.06,True,67.5,0.19,0.11,0.08,2026-02-17,78.0,2.56,0,,77.5,81.75,False,False
17-02-2026 15:00,TUREX,8.18,8.29,8.16,8.27,4382199.0,0.02,0.09,0.0,2900.0,0.09,2511066.0,74.52,0.22,True,62.3,0.07,0.08,-0.02,2026-02-17,8.25,0.24,0,,8.07,8.4,False,False
17-02-2026 14:00,ERCB,64.45,65.2,64.2,65.05,452536.0,0.15,0.6,0.03,1900.0,0.6,173636.7,160.62,0.25,True,68.64,0.41,0.42,-0.01,2026-02-17,64.35,1.09,1,65.2,63.85,65.2,False,False
17-02-2026 14:00,HKTM,13.33,13.83,13.31,13.8,1264489.0,0.03,0.47,0.05,859.18,0.47,506339.5,149.73,0.06,True,68.8,0.02,-0.02,0.03,2026-02-17,13.25,4.15,0,,13.19,ATH,False,False
17-02-2026 14:00,PRDGS,7.65,7.94,7.64,7.86,4023734.0,0.08,0.21,0.04,388.37,0.21,1580963.1,154.51,0.38,True,71.57,0.09,0.06,0.03,2026-02-17,7.56,3.97,1,7.94,7.23,7.94,False,False
17-02-2026 13:00,PINSU,11.52,11.68,11.5,11.67,864161.0,0.01,0.15,0.01,1263.64,0.15,404217.7,113.79,0.07,True,74.71,0.04,0.02,0.01,2026-02-17,11.47,1.74,0,,11.42,ATH,False,False
17-02-2026 13:00,ULUFA,4.35,4.42,4.35,4.42,1996799.0,0.0,0.07,0.01,677.78,0.07,1197736.2,66.71,0.0,True,70.45,0.05,0.05,0.0,2026-02-17,4.37,1.14,0,,4.16,4.43,False,False
17-02-2026 13:00,TURGG,33.1,34.3,32.8,34.22,932466.0,0.08,1.12,0.15,656.76,1.12,321593.3,189.95,0.07,True,74.5,0.68,0.61,0.07,2026-02-17,31.96,7.07,0,,31.5,ATH,False,False
17-02-2026 13:00,GEDZA,31.5,32.54,31.5,32.52,272703.0,0.02,1.02,0.12,764.41,1.02,85705.9,218.18,0.02,True,82.19,0.3,0.24,0.06,2026-02-17,31.42,3.5,0,,31.1,ATH,False,False
17-02-2026 12:00,RTALB,4.28,4.44,4.26,4.4,13810710.0,0.04,0.12,0.03,328.57,0.12,4976890.2,177.5,0.33,True,86.77,0.06,0.04,0.02,2026-02-17,4.19,5.01,0,,3.99,ATH,False,False
17-02-2026 12:00,SKTAS,4.07,4.22,4.06,4.2,3416964.0,0.02,0.13,0.01,1757.14,0.13,1701442.1,100.83,0.15,True,67.04,0.05,0.06,-0.0,2026-02-17,4.09,2.69,1,4.22,3.86,4.22,False,False
17-02-2026 12:00,TUKAS,2.94,3.0,2.94,2.99,35005811.0,0.01,0.05,0.0,2400.0,0.05,16686759.7,109.78,0.2,True,67.64,0.02,0.02,-0.0,2026-02-17,2.96,1.01,2,2.94,2.94,ATH,False,False
17-02-2026 12:00,A1CAP,17.51,18.49,17.49,18.23,6889250.0,0.26,0.72,0.14,425.55,0.72,1894096.6,263.72,0.36,True,80.01,0.24,0.13,0.12,2026-02-17,17.25,5.68,1,18.49,16.31,18.49,False,False
17-02-2026 12:00,DOFER,33.76,35.3,33.7,35.16,1266498.0,0.14,1.4,0.23,498.29,1.4,592872.2,113.62,0.1,True,88.07,0.57,0.37,0.2,2026-02-17,33.3,5.59,0,,31.56,ATH,False,False
17-02-2026 12:00,DARDL,2.49,2.53,2.49,2.52,8120175.0,0.01,0.03,0.01,400.0,0.03,4717307.7,72.14,0.33,True,73.24,0.03,0.02,0.0,2026-02-17,2.48,1.61,0,,2.37,ATH,False,False
17-02-2026 12:00,HUNER,3.56,3.64,3.55,3.64,5009956.0,0.0,0.08,0.01,700.0,0.08,2286789.4,119.08,0.0,True,80.53,0.04,0.03,0.0,2026-02-17,3.54,2.82,0,,3.33,ATH,False,False
17-02-2026 12:00,BULGS,49.8,52.8,49.64,52.8,12396267.0,0.0,3.0,0.34,792.86,3.0,2824993.7,338.81,0.0,True,76.21,0.74,0.42,0.32,2026-02-17,48.0,10.0,0,,47.0,ATH,False,False
17-02-2026 12:00,EGPRO,28.22,29.14,28.1,29.12,972348.0,0.02,0.9,0.02,4900.0,0.9,218785.5,344.43,0.02,True,70.43,0.34,0.33,0.01,2026-02-17,28.08,3.7,0,,27.72,ATH,False,False
17-02-2026 12:00,DAGI,6.42,6.48,6.42,6.48,828660.0,0.0,0.06,0.0,1900.0,0.06,430384.0,92.54,0.0,True,54.59,-0.01,-0.01,0.0,2026-02-17,6.43,0.78,1,6.48,6.38,6.55,False,False
17-02-2026 12:00,INFO,4.51,4.74,4.51,4.69,18264629.0,0.05,0.18,0.01,1284.62,0.18,4243474.7,330.42,0.28,True,72.35,0.05,0.04,0.01,2026-02-17,4.5,4.22,1,4.74,4.22,4.74,False,False
17-02-2026 11:00,BEGYO,4.96,5.03,4.96,5.02,6570981.0,0.01,0.06,0.0,1900.0,0.06,2117011.6,210.39,0.17,True,72.02,0.03,0.03,0.0,2026-02-17,4.96,1.21,0,,4.92,ATH,False,False
17-02-2026 11:00,SEKUR,5.05,5.19,4.97,5.17,1112387.0,0.02,0.12,0.0,11900.0,0.12,363999.8,205.6,0.17,True,54.65,0.02,0.02,-0.0,2026-02-17,5.09,1.57,0,,4.8,5.25,False,False
17-02-2026 11:00,TEZOL,14.42,14.8,14.42,14.7,1785923.0,0.1,0.28,0.03,833.33,0.28,709494.4,151.72,0.36,True,76.35,0.1,0.05,0.05,2026-02-17,14.32,2.65,1,14.8,14.0,14.8,False,False
17-02-2026 10:00,DCTTR,8.67,8.91,8.6,8.89,3623494.0,0.02,0.22,0.03,547.06,0.22,1135912.1,218.99,0.09,True,74.47,0.12,0.1,0.01,2026-02-17,8.66,2.66,0,,8.11,ATH,False,False
17-02-2026 10:00,HATEK,17.09,18.21,16.29,18.06,5462680.0,0.15,0.97,0.13,623.88,0.97,1268375.4,330.68,0.15,True,82.89,0.45,0.32,0.13,2026-02-17,17.1,5.61,2,16.29,16.29,ATH,False,False
17-02-2026 10:00,KRTEK,28.7,30.3,28.52,30.0,827877.0,0.3,1.3,0.17,673.81,1.3,222239.8,272.52,0.23,True,79.27,0.48,0.33,0.14,2026-02-17,28.5,5.26,0,,27.0,ATH,False,False
17-02-2026 10:00,HEKTS,3.53,3.63,3.5,3.61,123128370.0,0.02,0.08,0.01,700.0,0.08,30015627.0,310.21,0.25,True,70.73,0.04,0.03,0.01,2026-02-17,3.51,2.85,1,3.63,3.37,3.63,False,False
17-02-2026 10:00,SNICA,4.58,4.64,4.57,4.63,3252352.0,0.01,0.05,0.0,4900.0,0.05,1616190.5,101.24,0.2,True,54.94,-0.01,-0.01,0.0,2026-02-17,4.57,1.31,2,4.57,4.57,4.65,False,False
17-02-2026 10:00,DITAS,45.22,46.9,45.22,46.62,755301.0,0.28,1.4,0.2,593.07,1.4,433133.4,74.38,0.2,True,67.25,0.47,0.25,0.22,2026-02-17,45.18,3.19,0,,42.4,ATH,False,False
17-02-2026 10:00,TTKOM,72.4,74.65,72.15,74.6,7713059.0,0.05,2.2,0.05,4300.0,2.2,2357802.9,227.13,0.02,True,73.85,1.13,1.04,0.08,2026-02-17,72.6,2.75,2,72.15,72.15,ATH,False,False
17-02-2026 10:00,ASUZU,69.35,72.25,69.05,71.75,983519.0,0.5,2.4,0.19,1197.3,2.4,182298.8,439.51,0.21,True,84.72,1.06,0.87,0.2,2026-02-17,68.8,4.29,0,,65.9,ATH,False,False
17-02-2026 10:00,HATSN,41.18,41.48,41.0,41.4,552361.0,0.08,0.22,0.03,547.06,0.22,206112.6,167.99,0.36,True,58.73,0.03,-0.02,0.05,2026-02-17,41.18,0.53,2,41.0,41.0,41.76,False,False
17-02-2026 10:00,YKSLN,3.47,3.56,3.47,3.54,8056735.0,0.02,0.07,0.01,438.46,0.07,2502920.8,221.89,0.29,True,78.64,0.06,0.04,0.01,2026-02-17,3.46,2.31,0,,3.25,ATH,False,False
17-02-2026 10:00,SURGY,66.95,69.8,63.7,69.5,14335435.0,0.3,2.55,0.25,900.0,2.55,1563670.8,816.78,0.12,True,93.31,2.6,2.16,0.44,2026-02-17,64.45,7.84,2,63.7,63.7,ATH,False,False
17-02-2026 10:00,SEYKM,5.46,5.61,5.43,5.61,470588.0,0.0,0.15,0.03,383.87,0.15,247008.0,90.52,0.0,True,57.63,0.01,0.01,0.01,2026-02-17,5.5,2.0,0,,5.3,5.63,False,False
17-02-2026 10:00,KNFRT,12.89,13.06,12.83,13.02,842535.0,0.04,0.13,0.01,1525.0,0.13,458981.3,83.57,0.31,True,58.74,0.01,0.01,0.0,2026-02-17,12.89,1.01,1,13.06,12.75,13.06,False,False
17-02-2026 10:00,KLRHO,475.25,512.0,475.0,512.0,1040663.0,0.0,36.75,5.75,539.13,36.75,365234.4,184.93,0.0,True,67.63,2.09,-6.03,8.11,2026-02-17,475.0,7.79,0,,415.25,613.5,False,False
16-02-2026 17:00,EUREN,5.83,6.1,5.81,6.1,46859432.0,0.0,0.27,0.05,409.43,0.27,11438842.4,309.65,0.0,True,90.41,0.11,0.07,0.04,2026-02-16,5.55,9.91,0,,5.44,ATH,False,False
16-02-2026 17:00,SISE,50.3,50.9,50.25,50.8,17540596.0,0.1,0.5,0.09,488.24,0.5,10166465.5,72.53,0.2,True,75.66,0.48,0.44,0.04,2026-02-16,49.54,2.54,1,50.9,46.68,50.9,False,False
16-02-2026 17:00,GUBRF,540.0,543.5,540.0,542.5,377330.0,1.0,2.5,0.1,2400.0,2.5,243018.7,55.27,0.4,True,48.53,-0.47,0.61,-1.08,2026-02-16,540.5,0.37,0,,536.0,566.5,False,False
16-02-2026 17:00,MGROS,691.5,695.0,691.0,694.5,557843.0,0.5,3.0,0.4,650.0,3.0,329399.9,69.35,0.17,True,63.92,4.62,4.49,0.13,2026-02-16,686.5,1.17,0,,663.5,698.5,False,False
16-02-2026 17:00,OZYSR,53.6,55.7,53.6,55.7,537205.0,0.0,2.1,0.18,1100.0,2.1,185996.6,188.83,0.0,True,67.14,0.38,0.38,-0.0,2026-02-16,53.8,3.53,0,,53.1,ATH,False,False
16-02-2026 17:00,FRIGO,10.03,10.23,10.0,10.22,8688268.0,0.01,0.19,0.05,265.38,0.19,2869867.2,202.74,0.05,True,84.75,0.16,0.13,0.03,2026-02-16,9.7,5.36,0,,9.37,ATH,False,False
16-02-2026 17:00,SASA,2.74,2.79,2.73,2.78,807889094.0,0.01,0.04,0.0,900.0,0.04,304754535.4,165.1,0.25,True,75.01,0.03,0.03,-0.0,2026-02-16,2.7,2.96,1,2.79,2.5,2.79,False,False
16-02-2026 16:00,TDGYO,28.32,30.0,28.3,30.0,1240327.0,0.0,1.68,0.22,677.78,1.68,249349.3,397.43,0.0,True,73.92,0.58,0.46,0.12,2026-02-16,27.28,9.97,0,,26.8,ATH,False,False
16-02-2026 15:00,ZERGY,19.24,20.28,19.17,20.26,15095752.0,0.02,1.02,0.1,890.29,1.02,6058415.1,149.17,0.02,True,62.01,-0.19,-0.36,0.18,2026-02-16,18.6,8.92,0,,17.47,21.86,True,False
16-02-2026 15:00,KRONT,16.3,16.7,16.26,16.64,832665.0,0.06,0.34,0.03,1114.29,0.34,287813.3,189.31,0.18,True,66.17,0.07,0.06,0.02,2026-02-16,16.26,2.34,0,,16.04,ATH,False,False
16-02-2026 15:00,CWENE,32.7,33.06,32.7,33.0,11433368.0,0.06,0.3,0.06,435.71,0.3,5702396.7,100.5,0.2,True,66.59,0.07,-0.0,0.08,2026-02-16,32.3,2.17,0,,32.06,33.4,False,False
16-02-2026 14:00,BSOKE,30.08,30.96,29.96,30.74,2021526.0,0.22,0.66,0.07,900.0,0.66,849942.4,137.84,0.33,True,66.92,0.09,0.04,0.05,2026-02-16,29.8,3.15,0,,29.66,ATH,False,False
16-02-2026 14:00,GZNMI,64.3,67.9,62.35,67.6,6833156.0,0.3,3.3,0.0,65900.0,3.3,934336.6,631.34,0.09,True,68.74,3.06,2.83,0.24,2026-02-16,61.75,9.47,0,,50.85,67.9,False,False
16-02-2026 13:00,CEOEM,23.3,23.76,23.28,23.66,301033.0,0.1,0.36,0.07,414.29,0.36,169783.5,77.3,0.28,True,68.7,0.16,0.12,0.04,2026-02-16,23.06,2.6,0,,22.8,ATH,False,False
16-02-2026 12:00,TAVHL,363.0,367.25,362.25,366.5,589792.0,0.75,3.5,0.35,900.0,3.5,287999.0,104.79,0.21,True,61.11,1.64,1.17,0.47,2026-02-16,361.5,1.38,0,,350.25,367.75,False,False
16-02-2026 12:00,ADESE,1.28,1.32,1.26,1.32,459275946.0,0.0,0.04,0.01,400.0,0.04,85864371.2,434.89,0.0,True,82.85,0.02,0.01,0.01,2026-02-16,1.2,10.0,0,,1.2,ATH,False,False
16-02-2026 12:00,ECOGR,25.2,25.74,25.16,25.74,2040762.0,0.0,0.54,0.06,800.0,0.54,1133374.9,80.06,0.0,True,68.02,0.14,0.08,0.06,2026-02-16,25.24,1.98,0,,24.28,26.38,False,False
16-02-2026 12:00,AKYHO,2.95,2.97,2.91,2.97,663111.0,0.0,0.02,0.0,900.0,0.02,257485.2,157.53,0.0,True,62.78,0.01,0.0,0.0,2026-02-16,2.93,1.37,2,2.91,2.91,ATH,False,False
16-02-2026 11:00,PRKME,21.16,21.4,21.16,21.38,503846.0,0.02,0.22,0.04,511.11,0.22,236107.8,113.4,0.09,True,64.06,0.0,-0.04,0.04,2026-02-16,20.96,2.0,0,,20.8,21.48,False,False
16-02-2026 11:00,OTKAR,426.5,433.5,424.5,432.5,1188367.0,1.0,6.0,0.55,990.91,6.0,425199.3,179.48,0.17,True,31.02,-2.31,1.99,-4.3,2026-02-16,469.0,-7.78,2,424.5,424.5,470.75,False,False
16-02-2026 11:00,ENTRA,12.08,12.55,12.07,12.49,10330120.0,0.06,0.41,0.04,925.0,0.41,3140716.6,228.91,0.15,True,75.59,0.1,0.06,0.04,2026-02-16,11.99,4.17,0,,11.67,ATH,False,False
16-02-2026 11:00,KLMSN,31.92,32.16,31.92,32.12,199968.0,0.04,0.2,0.01,2400.0,0.2,117997.8,69.47,0.2,True,65.08,0.23,0.26,-0.02,2026-02-16,31.64,1.52,0,,31.4,33.48,False,False
16-02-2026 11:00,EGEGY,33.8,34.62,33.8,34.46,635547.0,0.16,0.66,0.09,602.13,0.66,238951.9,165.97,0.24,True,72.67,0.25,0.16,0.09,2026-02-16,33.2,3.8,1,34.62,32.78,34.62,False,False
16-02-2026 11:00,ARENA,28.7,29.04,28.64,29.04,429464.0,0.0,0.34,0.08,304.76,0.34,155509.3,176.17,0.0,True,77.21,0.15,0.09,0.06,2026-02-16,28.36,2.4,0,,27.7,ATH,False,False
16-02-2026 11:00,GLRYH,4.61,4.69,4.61,4.68,3809507.0,0.01,0.07,0.01,366.67,0.07,1253420.9,203.93,0.14,True,64.03,0.01,0.0,0.01,2026-02-16,4.55,2.86,0,,4.53,4.72,False,False
16-02-2026 11:00,TSPOR,1.1,1.13,1.1,1.13,73318975.0,0.0,0.03,0.0,1400.0,0.03,29453382.8,148.93,0.0,True,63.89,0.01,0.01,-0.0,2026-02-16,1.11,1.8,2,1.1,1.1,ATH,False,False
16-02-2026 11:00,BORSK,6.71,6.85,6.69,6.84,3162038.0,0.01,0.13,0.03,364.29,0.13,1660342.3,90.44,0.08,True,77.8,0.07,0.05,0.03,2026-02-16,6.61,3.48,0,,6.33,ATH,False,False
16-02-2026 11:00,HTTBT,46.2,46.88,46.18,46.88,284488.0,0.0,0.68,0.1,566.67,0.68,116776.1,143.62,0.0,True,71.6,0.39,0.34,0.05,2026-02-16,45.88,2.18,0,,44.1,ATH,False,False
16-02-2026 10:00,TOASO,344.25,349.5,340.0,348.5,1390650.0,1.0,4.25,0.88,385.71,4.25,463044.9,200.33,0.24,True,82.82,5.96,4.66,1.3,2026-02-16,338.5,2.95,1,349.5,307.25,349.5,False,False
16-02-2026 10:00,EGSER,3.31,3.35,3.3,3.34,923291.0,0.01,0.03,0.0,900.0,0.03,505322.9,82.71,0.33,True,67.56,0.01,0.01,0.0,2026-02-16,3.3,1.21,0,,3.26,ATH,False,False
16-02-2026 10:00,FLAP,11.1,12.0,11.07,11.9,2458587.0,0.1,0.8,0.17,373.37,0.8,656797.8,274.33,0.12,True,82.47,0.43,0.31,0.12,2026-02-16,11.07,7.5,0,,9.01,ATH,False,False
16-02-2026 10:00,TKNSA,25.0,25.56,25.0,25.44,1231971.0,0.12,0.44,0.01,5400.0,0.44,353506.1,248.5,0.27,True,66.77,0.06,0.06,0.01,2026-02-16,24.92,2.09,1,25.56,24.68,25.56,False,False
16-02-2026 10:00,TKFEN,83.0,85.0,82.95,84.85,2418826.0,0.15,1.85,0.02,7300.0,1.85,786462.3,207.56,0.08,True,57.01,-0.28,-0.26,-0.02,2026-02-16,82.55,2.79,0,,81.9,87.0,False,False
16-02-2026 10:00,DGNMO,5.32,5.38,5.27,5.37,985365.0,0.01,0.05,0.0,1566.67,0.05,208708.8,372.12,0.2,True,79.25,0.03,0.02,0.01,2026-02-16,5.24,2.48,0,,5.04,ATH,False,False
16-02-2026 10:00,PGSUS,220.3,226.1,219.9,224.8,19608865.0,1.3,4.5,0.35,1185.71,4.5,4835163.1,305.55,0.29,True,78.32,2.45,2.15,0.29,2026-02-16,218.1,3.07,1,226.1,216.7,226.1,False,False
16-02-2026 10:00,DENGE,3.07,3.18,3.03,3.15,15438603.0,0.03,0.08,0.0,1900.0,0.08,5568831.0,177.23,0.38,True,74.55,0.07,0.06,0.01,2026-02-16,3.06,2.94,3,,2.76,3.16,False,False
16-02-2026 10:00,TCELL,126.0,129.6,125.3,129.0,15653202.0,0.6,3.0,0.35,757.14,3.0,3511744.0,345.74,0.2,True,82.9,1.48,1.33,0.15,2026-02-16,125.3,2.95,1,129.6,116.3,129.6,False,False
16-02-2026 10:00,BOSSA,7.13,7.3,7.13,7.3,601246.0,0.0,0.17,0.01,1445.45,0.17,260550.7,130.76,0.0,True,62.85,-0.0,0.0,-0.0,2026-02-16,7.11,2.67,0,,7.1,7.33,False,False
16-02-2026 10:00,BORLS,2.77,2.99,2.76,2.96,30799975.0,0.03,0.19,0.02,955.56,0.19,6468288.0,376.17,0.16,True,79.02,0.02,0.01,0.02,2026-02-16,2.75,7.64,0,,2.67,ATH,False,False
16-02-2026 10:00,SERNT,8.7,8.95,8.7,8.94,2157819.0,0.01,0.24,0.0,4700.0,0.24,832316.6,159.25,0.04,True,65.69,0.04,0.04,-0.0,2026-02-16,8.68,3.0,1,8.95,8.63,8.95,False,False
16-02-2026 10:00,SKYMD,12.44,12.66,12.44,12.63,882999.0,0.03,0.19,0.02,900.0,0.19,545211.4,61.96,0.16,True,73.8,0.05,0.03,0.01,2026-02-16,12.4,1.85,0,,12.27,ATH,False,False
16-02-2026 10:00,SRVGY,3.51,3.64,3.51,3.62,43604625.0,0.02,0.11,0.01,900.0,0.11,7897007.6,452.17,0.18,True,79.76,0.02,0.01,0.01,2026-02-16,3.48,4.02,0,,3.45,ATH,False,False
16-02-2026 10:00,BAGFS,30.06,30.46,30.06,30.4,458083.0,0.06,0.34,0.02,1316.67,0.34,117690.7,289.23,0.18,True,60.42,-0.02,-0.07,0.04,2026-02-16,29.96,1.47,0,,29.6,30.68,False,False
16-02-2026 10:00,SMRVA,64.3,66.0,64.3,65.95,1038816.0,0.05,1.65,0.03,5400.0,1.65,288173.4,260.48,0.03,True,62.36,-0.08,-0.22,0.15,2026-02-16,64.2,2.73,0,,63.7,66.35,False,False
16-02-2026 10:00,VESTL,32.88,33.44,32.88,33.3,1347436.0,0.14,0.42,0.0,20900.0,0.42,455403.0,195.88,0.33,True,74.34,0.19,0.15,0.04,2026-02-16,32.5,2.46,0,,32.3,ATH,False,False
16-02-2026 10:00,KOTON,17.01,17.35,17.01,17.34,908361.0,0.01,0.33,0.04,685.71,0.33,331462.1,174.05,0.03,True,73.14,0.05,0.01,0.04,2026-02-16,17.0,2.0,0,,16.75,ATH,False,False
16-02-2026 10:00,USAK,1.88,1.92,1.87,1.91,45060209.0,0.01,0.03,0.0,650.0,0.03,26804874.2,68.1,0.33,True,75.12,0.02,0.01,0.0,2026-02-16,1.86,2.69,0,,1.78,ATH,False,False
16-02-2026 10:00,HURGZ,5.57,5.68,5.56,5.65,2347746.0,0.03,0.08,0.01,1233.33,0.08,467651.9,402.03,0.37,True,63.57,-0.0,-0.01,0.0,2026-02-16,5.56,1.62,0,,5.53,5.66,False,False
16-02-2026 10:00,ALARK,114.8,116.3,114.8,116.0,2660729.0,0.3,1.2,0.05,2300.0,1.2,771267.0,244.98,0.25,True,70.1,0.57,0.41,0.16,2026-02-16,113.8,1.93,0,,112.8,ATH,False,False
16-02-2026 10:00,MERKO,16.73,17.42,16.55,17.26,4694535.0,0.16,0.53,0.05,960.0,0.53,1112757.9,321.88,0.3,True,66.25,-0.02,-0.04,0.02,2026-02-16,16.71,3.29,2,16.55,16.55,17.74,True,True
16-02-2026 10:00,GOODY,16.1,16.29,16.07,16.29,385216.0,0.0,0.19,0.01,1800.0,0.19,142108.2,171.07,0.0,True,69.64,0.02,0.02,0.01,2026-02-16,16.05,1.5,0,,15.36,ATH,False,False
16-02-2026 10:00,GOKNR,22.36,22.64,22.36,22.62,1203819.0,0.02,0.26,0.0,6400.0,0.26,471338.8,155.4,0.08,True,69.91,0.07,0.06,0.02,2026-02-16,22.24,1.71,0,,22.1,22.72,False,False
16-02-2026 10:00,INVEO,9.8,10.22,9.8,10.11,4897517.0,0.11,0.31,0.02,1622.22,0.31,1251447.8,291.35,0.35,True,66.94,0.04,0.04,0.0,2026-02-16,9.72,4.01,0,,9.71,10.25,False,False
16-02-2026 10:00,VESBE,8.67,8.79,8.65,8.78,3072805.0,0.01,0.11,0.01,1000.0,0.11,1119089.5,174.58,0.09,True,71.54,0.04,0.03,0.01,2026-02-16,8.59,2.21,0,,8.5,ATH,False,False
16-02-2026 10:00,ARTMS,40.18,41.2,40.0,41.12,541374.0,0.08,0.94,0.08,1105.13,0.94,160686.5,236.91,0.09,True,63.88,0.0,-0.08,0.09,2026-02-16,39.9,3.06,0,,39.48,43.34,True,True
16-02-2026 10:00,LRSHO,4.16,4.22,4.15,4.21,6159815.0,0.01,0.05,0.01,614.29,0.05,1830809.3,236.45,0.2,True,64.47,0.01,0.0,0.01,2026-02-16,4.15,1.45,0,,4.1,4.27,False,False
16-02-2026 10:00,ISSEN,7.93,8.04,7.9,8.02,517688.0,0.02,0.09,0.01,800.0,0.09,170022.5,204.48,0.22,True,82.81,0.04,0.03,0.02,2026-02-16,7.8,2.82,0,,7.68,ATH,False,False
16-02-2026 10:00,ATATP,157.3,161.8,156.0,161.1,369205.0,0.7,3.8,0.41,826.83,3.8,104816.0,252.24,0.18,True,74.08,1.0,0.86,0.14,2026-02-16,157.4,2.35,2,156.0,156.0,ATH,False,False
16-02-2026 10:00,IZMDC,8.19,8.38,8.18,8.33,1503199.0,0.05,0.14,0.0,4566.67,0.14,768505.2,95.6,0.36,True,70.55,0.1,0.1,-0.0,2026-02-16,8.17,1.96,0,,8.09,8.48,False,False
16-02-2026 10:00,AVHOL,40.66,41.3,40.54,41.24,521252.0,0.06,0.58,0.05,974.07,0.58,122839.7,324.34,0.1,True,74.0,0.19,0.12,0.07,2026-02-16,40.36,2.18,0,,39.74,ATH,False,False
16-02-2026 10:00,OBAMS,8.75,9.04,8.73,9.02,30873884.0,0.02,0.27,0.08,246.15,0.27,16944399.0,82.21,0.07,True,81.63,0.24,0.18,0.06,2026-02-16,8.68,3.92,0,,7.64,ATH,False,False
16-02-2026 10:00,FADE,16.77,18.0,16.75,17.65,2497133.0,0.35,0.88,0.14,524.11,0.88,463808.6,438.4,0.4,True,84.58,0.24,0.15,0.1,2026-02-16,16.65,6.01,1,18.0,15.82,18.0,False,False
16-02-2026 10:00,AYDEM,26.24,26.66,26.24,26.66,517502.0,0.0,0.42,0.06,556.25,0.42,283002.6,82.86,0.0,True,77.65,0.25,0.17,0.08,2026-02-16,26.2,1.76,0,,24.44,ATH,False,False
16-02-2026 10:00,YYLGD,14.09,14.4,14.08,14.38,3018446.0,0.02,0.29,0.02,1605.88,0.29,1276425.8,136.48,0.07,True,66.04,0.04,0.03,0.01,2026-02-16,14.08,2.13,0,,14.0,ATH,False,False
16-02-2026 10:00,LKMNH,17.78,18.12,17.76,18.08,710581.0,0.04,0.3,0.06,368.75,0.3,258119.5,175.29,0.13,True,77.97,0.13,0.06,0.06,2026-02-16,17.71,2.09,0,,16.98,ATH,False,False
13-02-2026 17:00,KRPLS,9.17,9.37,9.13,9.32,1008034.0,0.05,0.15,0.03,476.92,0.15,417059.4,141.7,0.33,True,71.16,0.06,0.04,0.02,2026-02-13,9.02,3.33,0,,9.01,ATH,False,False
13-02-2026 17:00,LOGO,157.0,160.0,156.4,160.0,483716.0,0.0,3.0,0.14,2042.86,3.0,156916.1,208.26,0.0,True,66.31,0.4,0.3,0.1,2026-02-13,158.4,1.01,0,,155.0,ATH,False,False
13-02-2026 17:00,CCOLA,77.5,78.8,77.45,78.65,2723639.0,0.15,1.15,0.08,1433.33,1.15,1150468.8,136.74,0.13,True,70.54,0.58,0.5,0.09,2026-02-13,77.5,1.48,0,,76.25,ATH,False,False
13-02-2026 17:00,ZOREN,3.59,3.64,3.58,3.63,32493904.0,0.01,0.04,0.0,1900.0,0.04,7718246.3,321.0,0.25,True,67.77,0.02,0.01,0.01,2026-02-13,3.58,1.4,0,,3.53,ATH,False,False
13-02-2026 17:00,GWIND,27.58,27.92,27.48,27.9,1800866.0,0.02,0.32,0.03,900.0,0.32,643691.4,179.77,0.06,True,73.44,0.16,0.13,0.03,2026-02-13,27.52,1.38,0,,26.56,ATH,False,False
13-02-2026 17:00,DAPGM,12.0,13.13,11.89,13.13,36298177.0,0.0,1.13,0.12,857.63,1.13,5240881.4,592.6,0.0,True,83.78,0.13,0.04,0.08,2026-02-13,11.94,9.97,0,,11.42,ATH,False,False
13-02-2026 16:00,ESCOM,3.9,3.96,3.9,3.95,4832429.0,0.01,0.05,0.01,525.0,0.05,2161355.0,123.58,0.2,True,71.83,0.03,0.02,0.01,2026-02-13,3.86,2.33,0,,3.74,3.96,False,False
13-02-2026 16:00,BJKAS,1.63,1.65,1.63,1.65,9628379.0,0.0,0.02,0.0,400.0,0.02,3551835.8,171.08,0.0,True,65.68,0.01,0.01,0.0,2026-02-13,1.61,2.48,0,,1.59,ATH,False,False
13-02-2026 16:00,KATMR,2.91,3.06,2.9,3.03,105065045.0,0.03,0.12,0.01,823.08,0.12,19545952.0,437.53,0.25,True,76.91,0.02,0.01,0.01,2026-02-13,2.9,4.48,0,,2.89,ATH,False,False
13-02-2026 16:00,GENTS,9.92,10.48,9.9,10.39,5111794.0,0.09,0.47,0.01,4600.0,0.47,2016462.8,153.5,0.19,True,55.27,-0.11,-0.11,0.0,2026-02-13,10.32,0.68,0,,9.89,11.14,True,True
13-02-2026 16:00,GIPTA,62.7,64.3,62.4,64.2,1206813.0,0.1,1.5,0.15,900.0,1.5,382078.9,215.85,0.07,True,64.87,0.17,0.11,0.06,2026-02-13,62.5,2.72,0,,61.6,65.75,False,False
13-02-2026 14:00,ENDAE,15.73,16.26,15.71,16.23,2464837.0,0.03,0.5,0.1,385.44,0.5,659294.7,273.86,0.06,True,68.93,0.06,-0.01,0.08,2026-02-13,15.32,5.94,0,,15.05,ATH,False,False
13-02-2026 14:00,SEGMN,48.66,50.0,48.62,49.78,1245674.0,0.22,1.12,0.22,413.76,1.12,646060.0,92.81,0.2,True,63.85,0.38,0.31,0.07,2026-02-13,48.98,1.63,0,,47.08,51.25,False,False
13-02-2026 14:00,ZEDUR,8.77,8.94,8.77,8.94,576288.0,0.0,0.17,0.0,5566.67,0.17,245067.4,135.15,0.0,True,61.58,0.02,0.02,0.0,2026-02-13,8.8,1.59,0,,8.7,9.1,False,False
13-02-2026 14:00,YYAPI,1.84,1.88,1.83,1.88,35629950.0,0.0,0.04,0.0,3900.0,0.04,11509372.9,209.57,0.0,True,60.7,0.01,0.01,0.0,2026-02-13,1.85,1.62,2,1.83,1.83,ATH,False,False
13-02-2026 14:00,OSTIM,3.16,3.3,3.15,3.27,17339598.0,0.03,0.11,0.01,746.15,0.11,3828854.4,352.87,0.27,True,79.62,0.02,0.01,0.01,2026-02-13,3.13,4.47,0,,3.06,ATH,False,False
13-02-2026 14:00,GOZDE,27.4,27.7,27.4,27.68,444374.0,0.02,0.28,0.06,400.0,0.28,244219.2,81.96,0.07,True,72.2,0.17,0.16,0.01,2026-02-13,27.26,1.54,0,,27.18,ATH,False,False
13-02-2026 14:00,CVKMD,44.72,46.74,44.7,46.36,6729265.0,0.38,1.64,0.19,745.36,1.64,3008935.6,123.64,0.23,True,72.87,0.57,0.44,0.13,2026-02-13,45.08,2.84,0,,40.82,ATH,False,False
13-02-2026 13:00,KFEIN,10.42,10.81,10.37,10.73,3999920.0,0.08,0.31,0.02,1309.09,0.31,1432675.2,179.19,0.26,True,65.75,0.1,0.1,0.0,2026-02-13,10.41,3.07,0,,10.12,10.83,False,False
13-02-2026 12:00,VRGYO,2.58,2.65,2.57,2.64,6319569.0,0.01,0.06,0.0,1900.0,0.06,3976705.4,58.91,0.17,True,62.09,0.02,0.01,0.0,2026-02-13,2.61,1.15,0,,2.56,ATH,False,False
13-02-2026 12:00,YEOTK,42.46,43.32,42.4,43.26,1319694.0,0.06,0.8,0.08,852.38,0.8,768598.8,71.7,0.08,True,77.29,0.43,0.33,0.1,2026-02-13,42.6,1.55,0,,40.3,ATH,False,False
13-02-2026 11:00,SEGYO,5.6,5.96,5.58,5.95,7939540.0,0.01,0.35,0.01,2400.0,0.35,4463393.7,77.88,0.03,True,70.56,0.13,0.12,0.0,2026-02-13,5.57,6.82,0,,4.88,ATH,False,False
13-02-2026 11:00,ARSAN,4.52,4.84,4.47,4.76,23491909.0,0.08,0.24,0.01,1746.15,0.24,5683868.9,313.31,0.33,True,56.74,-0.01,-0.01,-0.01,2026-02-13,4.61,3.25,3,,4.58,4.96,False,False
13-02-2026 10:00,AGROT,3.25,3.3,3.25,3.29,8489238.0,0.01,0.04,0.01,700.0,0.04,3053053.7,178.06,0.25,True,67.87,0.01,0.0,0.0,2026-02-13,3.25,1.23,0,,3.2,3.32,False,False
13-02-2026 10:00,BERA,19.82,20.08,19.77,20.06,7243246.0,0.02,0.24,0.01,1900.0,0.24,3051211.9,137.39,0.08,True,47.15,-0.21,-0.25,0.04,2026-02-13,19.7,1.83,0,,19.61,23.1,True,True
13-02-2026 10:00,UNLU,17.35,18.01,17.25,17.88,1941065.0,0.13,0.53,0.07,657.14,0.53,708066.3,174.14,0.25,True,67.91,0.15,0.13,0.02,2026-02-13,17.25,3.65,3,,16.44,18.0,False,False
13-02-2026 10:00,BAHKM,134.7,139.4,131.5,139.3,431395.0,0.1,4.6,0.7,557.14,4.6,119694.5,260.41,0.02,True,63.16,0.21,-0.23,0.44,2026-02-13,133.5,4.34,0,,128.6,141.4,False,False
13-02-2026 10:00,BIENY,25.5,27.56,25.2,27.46,5285448.0,0.1,1.96,0.31,536.36,1.96,872873.1,505.52,0.05,True,90.85,0.4,0.14,0.26,2026-02-13,25.44,7.94,0,,24.0,ATH,False,False
13-02-2026 10:00,THYAO,337.5,351.25,337.25,347.75,38503684.0,3.5,10.25,1.5,583.33,10.25,10077821.3,282.06,0.34,True,77.62,2.23,1.35,0.89,2026-02-13,337.0,3.19,1,351.25,331.0,351.25,False,False
13-02-2026 10:00,BALSU,17.19,17.59,17.06,17.49,5333654.0,0.1,0.3,0.08,284.62,0.3,2374924.6,124.58,0.33,True,73.33,0.13,0.09,0.04,2026-02-13,17.1,2.28,1,17.59,16.53,17.59,False,False
13-02-2026 10:00,KCAER,11.7,12.04,11.7,11.96,8787416.0,0.08,0.26,0.02,1138.1,0.26,2164915.6,305.9,0.31,True,77.3,0.07,0.06,0.02,2026-02-13,11.69,2.31,0,,ATL,ATH,False,False
13-02-2026 10:00,QUAGR,3.09,3.36,3.08,3.35,197900756.0,0.01,0.26,0.05,441.67,0.26,39885202.7,396.18,0.04,True,86.55,0.06,0.02,0.04,2026-02-13,3.09,8.41,0,,2.83,ATH,False,False
13-02-2026 10:00,KIMMR,16.6,17.28,16.51,17.16,242861.0,0.12,0.56,0.09,551.16,0.56,122998.5,97.45,0.21,True,86.75,0.23,0.17,0.06,2026-02-13,16.66,3.0,0,,ATL,ATH,False,False
13-02-2026 10:00,FONET,3.31,3.53,3.31,3.47,51164692.0,0.06,0.16,0.02,788.89,0.16,6867157.2,645.06,0.37,True,77.4,0.02,0.0,0.02,2026-02-13,3.24,7.1,1,3.53,3.2,3.53,False,False
12-02-2026 17:00,AKENR,11.25,11.33,11.24,11.33,1638902.0,0.0,0.08,0.01,471.43,0.08,793155.5,106.63,0.0,True,60.01,0.0,-0.01,0.01,2026-02-12,11.17,1.43,0,,11.13,11.41,False,False
12-02-2026 17:00,IHLGM,2.06,2.08,2.06,2.08,4061152.0,0.0,0.02,0.0,400.0,0.02,1860862.1,118.24,0.0,True,63.73,0.0,-0.0,0.0,2026-02-12,2.04,1.96,0,,2.03,2.09,False,False
12-02-2026 17:00,ANHYT,120.8,122.0,120.7,122.0,691087.0,0.0,1.2,0.03,3900.0,1.2,200838.9,244.1,0.0,True,63.61,0.45,0.49,-0.04,2026-02-12,122.0,0.0,0,,120.4,122.1,False,False
12-02-2026 17:00,MOGAN,9.12,9.17,9.11,9.17,1322195.0,0.0,0.05,0.01,455.56,0.05,544070.3,143.02,0.0,True,62.92,0.01,0.0,0.01,2026-02-12,9.0,1.89,0,,8.96,9.21,False,False
12-02-2026 17:00,KLKIM,42.54,42.84,42.5,42.78,415125.0,0.06,0.24,0.04,500.0,0.24,237901.5,74.49,0.25,True,53.42,-0.12,-0.13,0.0,2026-02-12,42.22,1.33,0,,41.98,44.2,False,False
12-02-2026 17:00,ZGYO,32.36,36.3,32.16,35.8,1618307.0,0.5,3.44,0.23,1382.76,3.44,983488.6,64.55,0.15,True,74.8,0.74,0.6,0.14,2026-02-12,33.54,6.74,0,,28.22,ATH,False,False
12-02-2026 17:00,SAFKR,28.04,28.66,27.94,28.52,2141099.0,0.14,0.48,0.03,1614.29,0.48,566836.8,277.73,0.29,True,57.76,0.01,-0.0,0.01,2026-02-12,28.22,1.06,1,28.66,27.8,28.66,False,False
12-02-2026 16:00,DNISI,23.9,24.04,23.86,24.02,165019.0,0.02,0.12,0.01,1100.0,0.12,88327.7,86.83,0.17,True,55.39,-0.04,-0.04,-0.0,2026-02-12,23.8,0.92,0,,23.78,24.76,False,False
12-02-2026 15:00,FROTO,123.7,125.9,123.3,125.8,3368276.0,0.1,2.1,0.52,303.85,2.1,2095090.9,60.77,0.05,True,78.6,1.39,0.89,0.49,2026-02-12,120.2,4.66,0,,114.1,ATH,False,False
12-02-2026 15:00,TSKB,13.91,14.15,13.9,14.14,14016923.0,0.01,0.23,0.06,289.83,0.23,5640293.4,148.51,0.04,True,88.17,0.12,0.07,0.05,2026-02-12,13.59,4.05,0,,13.22,ATH,False,False
12-02-2026 15:00,ASELS,297.0,302.0,296.5,301.5,7322743.0,0.5,4.5,0.55,718.18,4.5,3549610.7,106.3,0.11,True,70.78,0.47,0.2,0.27,2026-02-12,294.0,2.55,0,,291.5,ATH,False,False
12-02-2026 15:00,BMSTL,112.1,116.4,111.8,116.1,1183526.0,0.3,4.0,0.29,1279.31,4.0,246116.4,380.88,0.08,True,76.01,0.4,0.14,0.26,2026-02-12,111.4,4.22,0,,110.6,ATH,False,False
12-02-2026 13:00,MIATK,38.24,38.94,38.24,38.9,4965143.0,0.04,0.66,0.07,900.0,0.66,2204949.9,125.18,0.06,True,75.57,0.24,0.18,0.06,2026-02-12,37.98,2.42,0,,37.46,ATH,False,False
12-02-2026 13:00,KRDMA,29.3,29.62,29.28,29.6,621611.0,0.02,0.3,0.04,689.47,0.3,404422.4,53.7,0.07,True,66.26,0.07,0.04,0.03,2026-02-12,29.28,1.09,0,,28.7,29.72,False,False
12-02-2026 12:00,GESAN,57.15,58.0,57.1,57.95,1122246.0,0.05,0.8,0.11,595.65,0.8,452293.2,148.12,0.06,True,68.59,0.23,0.06,0.17,2026-02-12,56.55,2.48,0,,55.4,ATH,False,False
12-02-2026 11:00,DMLKT,5.79,5.81,5.79,5.81,1551572.0,0.0,0.02,0.0,1900.0,0.02,940874.6,64.91,0.0,True,60.27,0.0,-0.0,0.0,2026-02-12,5.79,0.35,1,5.81,5.77,5.82,False,False
12-02-2026 11:00,OYAKC,26.52,26.82,26.44,26.82,4061918.0,0.0,0.3,0.08,284.62,0.3,1772476.5,129.17,0.0,True,68.11,0.04,-0.02,0.06,2026-02-12,26.24,2.21,0,,25.68,26.86,False,False
12-02-2026 11:00,KOPOL,5.86,6.22,5.84,6.21,5904795.0,0.01,0.35,0.03,960.61,0.35,1043431.0,465.9,0.03,True,74.43,0.0,-0.01,0.02,2026-02-12,5.82,6.7,0,,5.82,ATH,False,False
12-02-2026 11:00,BTCIM,4.92,5.0,4.91,4.98,28361077.0,0.02,0.06,0.01,757.14,0.06,10331942.3,174.5,0.33,True,60.57,0.01,0.0,0.0,2026-02-12,4.93,1.01,0,,4.9,5.03,False,False
12-02-2026 10:00,ALBRK,9.28,9.46,9.26,9.44,6457176.0,0.02,0.16,0.03,515.38,0.16,2335137.7,176.52,0.13,True,77.91,0.05,0.03,0.02,2026-02-12,9.26,1.94,0,,ATL,ATH,False,False
12-02-2026 10:00,UCAYM,32.1,33.44,31.98,33.26,7548596.0,0.18,1.16,0.1,1083.67,1.16,4126828.2,82.92,0.16,True,46.08,-0.54,-0.55,0.01,2026-02-12,32.2,3.29,2,31.98,31.98,ATH,False,False
12-02-2026 10:00,ARZUM,3.4,3.61,3.38,3.57,34873390.0,0.04,0.17,0.02,709.52,0.17,9111362.3,282.75,0.24,True,90.66,0.11,0.1,0.02,2026-02-12,3.38,5.62,0,,ATL,ATH,False,False
12-02-2026 10:00,SOKM,65.5,66.7,65.4,66.65,1094377.0,0.05,1.15,0.07,1669.23,1.15,475217.7,130.29,0.04,True,66.97,0.22,0.2,0.02,2026-02-12,65.35,1.99,0,,65.0,66.7,False,False
12-02-2026 10:00,ARCLK,123.2,127.0,123.2,127.0,1603003.0,0.0,3.8,0.39,874.36,3.8,508505.9,215.24,0.0,True,69.57,0.09,-0.18,0.28,2026-02-12,122.7,3.5,0,,121.7,ATH,False,False
12-02-2026 10:00,FORMT,3.57,3.64,3.5,3.62,50388472.0,0.02,0.05,0.01,257.14,0.05,11852304.9,325.14,0.4,True,54.83,0.0,-0.0,0.0,2026-02-12,3.6,0.56,2,3.5,3.5,ATH,False,False
12-02-2026 10:00,MAKTK,16.55,17.37,16.55,17.22,3979028.0,0.15,0.67,0.07,900.0,0.67,952520.3,317.74,0.22,True,63.75,-0.03,-0.06,0.03,2026-02-12,16.55,4.05,1,17.37,16.48,17.37,False,False
12-02-2026 10:00,MERCN,19.0,19.96,18.97,19.85,5329336.0,0.11,0.85,0.07,1187.88,0.85,1673616.4,218.43,0.13,True,66.09,0.02,0.04,-0.02,2026-02-12,19.0,4.47,0,,18.74,20.28,False,False
12-02-2026 10:00,BARMA,46.8,47.38,46.42,47.24,370612.0,0.14,0.44,0.07,511.11,0.44,245462.1,50.99,0.32,True,74.45,0.37,0.27,0.1,2026-02-12,46.7,1.16,0,,ATL,ATH,False,False
12-02-2026 10:00,AKSA,10.81,10.89,10.79,10.88,3335834.0,0.01,0.07,0.01,438.46,0.07,1582325.4,110.82,0.14,True,59.15,-0.0,-0.0,0.0,2026-02-12,10.8,0.74,2,10.79,10.79,10.99,False,False
12-02-2026 10:00,ECILC,123.9,125.8,122.8,125.5,1525731.0,0.3,1.6,0.03,5233.33,1.6,422969.6,260.72,0.19,True,75.09,0.76,0.59,0.16,2026-02-12,121.9,2.95,1,125.8,118.7,125.8,False,False
12-02-2026 10:00,ISDMR,46.46,46.82,45.74,46.74,1000510.0,0.08,0.28,0.01,3400.0,0.28,349848.5,185.98,0.29,True,65.8,0.17,0.16,0.01,2026-02-12,46.38,0.78,2,45.74,45.74,47.0,False,False
12-02-2026 10:00,CANTE,1.77,1.83,1.77,1.82,277058581.0,0.01,0.05,0.0,4900.0,0.05,63620296.2,335.49,0.2,True,59.11,-0.01,-0.01,0.0,2026-02-12,1.76,3.41,0,,1.75,1.87,False,False
11-02-2026 16:00,MAGEN,44.94,45.92,44.86,45.86,1268999.0,0.06,0.92,0.17,434.88,0.92,549696.7,130.85,0.07,True,70.55,0.24,0.19,0.05,2026-02-11,44.46,3.15,0,,44.26,ATH,False,False
11-02-2026 16:00,CEMTS,12.55,13.01,12.54,13.0,2305725.0,0.01,0.45,0.05,749.06,0.45,601595.5,283.27,0.02,True,82.2,0.04,0.01,0.03,2026-02-11,12.53,3.75,0,,12.42,ATH,False,False
11-02-2026 16:00,AVGYO,13.13,13.72,13.07,13.72,1206132.0,0.0,0.59,0.09,541.3,0.59,537875.2,124.24,0.0,True,74.18,0.11,0.05,0.07,2026-02-11,12.79,7.27,0,,11.89,ATH,False,False
11-02-2026 16:00,ESEN,4.02,4.16,4.02,4.16,29994748.0,0.0,0.14,0.02,566.67,0.14,12022051.6,149.5,0.0,True,85.26,0.02,0.01,0.02,2026-02-11,3.94,5.58,0,,3.91,ATH,False,False
11-02-2026 15:00,SELEC,86.45,87.95,86.45,87.95,415103.0,0.0,1.5,0.14,971.43,1.5,227939.8,82.11,0.0,True,73.1,0.58,0.42,0.16,2026-02-11,85.2,3.23,0,,ATL,ATH,False,False
11-02-2026 15:00,TRCAS,50.9,53.05,50.8,52.95,614134.0,0.1,2.05,0.34,506.51,2.05,176815.5,247.33,0.05,True,74.1,0.15,-0.03,0.18,2026-02-11,50.05,5.79,0,,49.44,ATH,False,False
11-02-2026 15:00,SUWEN,8.75,9.03,8.75,9.0,2377613.0,0.03,0.25,0.04,575.68,0.25,449665.9,428.75,0.12,True,72.88,0.05,0.03,0.02,2026-02-11,8.71,3.33,0,,8.62,ATH,False,False
11-02-2026 14:00,IHLAS,2.33,2.38,2.32,2.38,57446102.0,0.0,0.05,0.01,614.29,0.05,15493402.8,270.78,0.0,True,76.29,0.01,0.0,0.0,2026-02-11,2.3,3.48,0,,2.29,ATH,False,False
11-02-2026 13:00,MAVI,48.32,49.04,48.3,48.98,1491599.0,0.06,0.66,0.07,816.67,0.66,844483.4,76.63,0.09,True,67.93,0.05,0.01,0.04,2026-02-11,48.46,1.07,0,,47.8,ATH,False,False
11-02-2026 11:00,SILVR,2.83,2.87,2.82,2.86,468422.0,0.01,0.03,0.0,1400.0,0.03,292086.3,60.37,0.33,True,54.83,-0.0,-0.0,0.0,2026-02-11,2.84,0.7,0,,2.8,ATH,False,False
11-02-2026 11:00,ALVES,4.12,4.29,4.1,4.27,96982938.0,0.02,0.15,0.03,383.87,0.15,26420894.0,267.07,0.13,True,75.97,0.02,-0.01,0.02,2026-02-11,4.0,6.75,0,,3.91,ATH,False,False
11-02-2026 11:00,BIOEN,19.54,19.82,19.47,19.75,377791.0,0.07,0.21,0.0,10400.0,0.21,227393.3,66.14,0.33,True,49.73,-0.04,-0.03,-0.01,2026-02-11,19.69,0.3,0,,19.45,ATH,False,False
11-02-2026 10:00,GLYHO,15.25,15.67,15.25,15.58,1184911.0,0.09,0.33,0.05,547.06,0.33,582083.5,103.56,0.27,True,58.57,-0.0,-0.02,0.01,2026-02-11,15.39,1.23,1,15.67,15.15,15.67,False,False
11-02-2026 10:00,VAKFA,14.13,14.59,14.06,14.52,20510682.0,0.07,0.39,0.03,1200.0,0.39,4706146.6,335.83,0.18,True,75.16,0.01,-0.01,0.03,2026-02-11,14.03,3.49,1,14.59,13.97,14.59,False,False
11-02-2026 10:00,KRDMB,34.54,35.12,34.04,35.1,213139.0,0.02,0.56,0.1,471.43,0.56,138215.8,54.21,0.04,True,84.98,0.21,0.13,0.08,2026-02-11,34.56,1.56,0,,ATL,ATH,False,False
11-02-2026 10:00,DZGYO,8.99,9.87,8.97,9.7,5420473.0,0.17,0.71,0.06,1026.98,0.71,769885.5,604.06,0.24,True,85.28,0.03,0.0,0.03,2026-02-11,8.99,7.9,2,8.97,8.97,ATH,False,False
11-02-2026 10:00,TMSN,111.4,118.3,110.7,117.1,1342718.0,1.2,5.7,0.43,1225.58,5.7,186795.6,618.82,0.21,True,79.45,0.19,-0.03,0.23,2026-02-11,111.4,5.12,3,,ATL,ATH,False,False
10-02-2026 17:00,SAYAS,43.46,45.98,43.42,45.98,1526381.0,0.0,2.52,0.4,533.17,2.52,343749.7,344.04,0.0,True,91.09,0.41,0.18,0.23,2026-02-10,41.8,10.0,0,,ATL,ATH,False,False
10-02-2026 12:00,KLSER,28.76,29.1,28.72,29.04,481325.0,0.06,0.28,0.04,636.84,0.28,172229.1,179.47,0.21,True,95.45,0.04,0.02,0.02,2026-02-10,28.68,1.26,0,,ATL,ATH,False,False
10-02-2026 11:00,CUSAN,30.3,31.68,30.2,31.48,315068.0,0.2,1.18,0.02,5800.0,1.18,207506.8,51.84,0.17,True,53.82,-0.03,-0.02,-0.01,2026-02-10,31.14,1.09,0,,ATL,ATH,False,False
10-02-2026 11:00,AKGRT,8.47,8.61,8.44,8.61,4186352.0,0.0,0.14,0.01,900.0,0.14,1472125.1,184.37,0.0,True,79.53,0.01,0.0,0.01,2026-02-10,8.38,2.74,0,,ATL,ATH,False,False
10-02-2026 11:00,NATEN,8.41,8.5,8.41,8.48,1792365.0,0.02,0.07,0.01,775.0,0.07,803537.6,123.06,0.29,True,61.05,0.02,0.01,0.01,2026-02-10,8.4,0.95,1,8.5,8.26,8.5,False,False
10-02-2026 11:00,SAMAT,5.96,6.06,5.94,6.05,512325.0,0.01,0.09,0.02,328.57,0.09,209855.3,144.13,0.11,True,82.17,0.02,0.01,0.01,2026-02-10,5.92,2.2,0,,ATL,ATH,False,False
10-02-2026 10:00,AKSEN,68.3,69.75,67.95,69.7,1544403.0,0.05,1.4,0.05,2700.0,1.4,566452.8,172.64,0.04,True,64.99,0.0,-0.03,0.03,2026-02-10,68.3,2.05,2,67.95,67.95,ATH,False,False
10-02-2026 10:00,KLYPV,64.85,69.9,64.5,69.0,3770103.0,0.9,4.15,0.29,1331.03,4.15,680602.9,453.94,0.22,True,90.99,0.2,0.04,0.17,2026-02-10,64.6,6.81,3,,ATL,ATH,False,False
10-02-2026 10:00,GENIL,8.39,9.11,8.35,9.0,40302484.0,0.11,0.61,0.08,672.15,0.61,7982467.23,404.89,0.18,True,90.8,0.04,0.01,0.03,2026-02-10,8.33,8.0,0,,ATL,ATH,False,False
10-02-2026 10:00,BIGEN,10.12,10.48,10.05,10.42,7644747.0,0.06,0.3,0.07,310.96,0.3,2040271.3,274.69,0.2,True,96.99,0.05,0.02,0.02,2026-02-10,10.11,3.07,0,,ATL,ATH,False,False
09-02-2026 11:00,ATLAS,8.86,9.95,8.85,9.89,1139680.0,0.06,1.03,0.1,909.8,1.03,363477.5,213.55,0.06,True,59.56,-0.13,-0.17,0.04,2026-02-09,9.07,9.04,0,,8.5,10.93,True,True
