Tarih,Hisse,open,high,low,close,volume,YuksekKapanis_Fark,AcilisKapanis_Fark,AcilisKapanisFark_Ort,AcilisKapanisFark_OrtalamayaGoreDegisim,AcilisKapanisFarkOrt_MaxSon10,HacimOrtalama,%Hacim_HacimOrtalama,Fark_Orani,Kosul,rsi,MACD_12_26_9,MACDs_12_26_9,MACDh_12_26_9,Tarih1,prev_close,%Deg,isPivot,pointpos,destek,direnc,Tsinyal_Banker_Dip,Tsinyal_Banker_DipKarar
20-11-2025 10:00,KRDMA,25.44,26.32,25.42,26.08,1473033.0,0.24,0.64,0.03,2033.33,0.64,756981.1,94.59,0.38,True,66.01,0.16,0.11,0.05,2025-11-20,25.4,2.68,0,,24.7,ATH,False,False
20-11-2025 10:00,TDGYO,28.3,29.38,28.0,29.22,229245.0,0.16,0.92,0.01,11400.0,0.92,99227.2,131.03,0.17,True,39.11,-0.74,-0.64,-0.1,2025-11-20,28.3,3.25,0,,27.32,32.3,False,False
20-11-2025 10:00,SOKM,45.62,46.42,45.54,46.38,1705062.0,0.04,0.76,0.12,544.07,0.76,778824.5,118.93,0.05,True,61.01,-0.0,-0.11,0.11,2025-11-20,45.52,1.89,0,,44.62,47.68,False,False
20-11-2025 10:00,DARDL,2.35,2.4,2.31,2.4,18799022.0,0.0,0.05,0.01,733.33,0.05,6122643.8,207.04,0.0,True,68.11,0.02,0.01,0.01,2025-11-20,2.33,3.0,0,,2.25,2.42,False,False
20-11-2025 10:00,ARSAN,2.99,3.05,2.99,3.04,2120609.0,0.01,0.05,0.0,1150.0,0.05,1198739.7,76.9,0.2,True,60.1,-0.01,-0.01,0.0,2025-11-20,2.98,2.01,0,,2.96,3.09,False,False
20-11-2025 10:00,KNFRT,11.89,12.08,11.82,12.03,193716.0,0.05,0.14,0.0,3400.0,0.14,125235.9,54.68,0.36,True,53.39,-0.05,-0.04,-0.0,2025-11-20,11.78,2.12,0,,11.6,12.41,False,False
20-11-2025 10:00,KARSN,9.5,9.62,9.5,9.6,3687362.0,0.02,0.1,0.01,1150.0,0.1,1684171.6,118.94,0.2,True,62.33,0.0,-0.01,0.01,2025-11-20,9.47,1.37,0,,9.36,9.63,False,False
20-11-2025 10:00,TAVHL,261.75,267.0,261.0,266.25,435734.0,0.75,4.5,0.92,386.49,4.5,222140.1,96.15,0.17,True,68.39,1.36,0.46,0.9,2025-11-20,261.75,1.72,0,,253.0,268.0,False,False
20-11-2025 10:00,ADEL,31.04,33.0,30.52,32.88,1608610.0,0.12,1.84,0.29,534.48,1.84,344478.1,366.97,0.07,True,88.23,0.38,0.14,0.24,2025-11-20,31.04,5.93,0,,29.74,33.16,False,False
20-11-2025 10:00,BIGCH,53.25,58.0,53.25,57.65,933238.0,0.35,4.4,0.47,846.24,4.4,326919.6,185.46,0.08,True,73.74,1.02,0.62,0.4,2025-11-20,53.15,8.47,0,,49.5,ATH,False,False
20-11-2025 10:00,BIOEN,20.08,20.6,20.08,20.56,463656.0,0.04,0.48,0.02,2300.0,0.48,144241.3,221.44,0.08,True,58.91,-0.01,0.01,-0.02,2025-11-20,20.08,2.39,0,,19.37,21.06,False,False
20-11-2025 10:00,YUNSA,9.0,9.5,8.94,9.43,12562250.0,0.07,0.43,0.05,814.89,0.43,2562540.4,390.23,0.16,True,66.75,0.06,0.05,0.01,2025-11-20,8.87,6.31,0,,8.82,9.49,False,False
20-11-2025 10:00,SELVA,1.85,1.96,1.8,1.95,14394478.0,0.01,0.1,0.01,1150.0,0.1,3128883.7,360.05,0.1,True,61.55,-0.01,-0.02,0.01,2025-11-20,1.85,5.41,0,,1.82,2.01,False,False
20-11-2025 10:00,GEREL,20.22,21.1,20.12,20.92,3505010.0,0.18,0.7,0.12,503.45,0.7,1208065.0,190.13,0.26,True,77.95,0.63,0.67,-0.04,2025-11-20,20.18,3.67,0,,16.62,20.98,False,False
20-11-2025 10:00,FRIGO,13.44,13.62,13.43,13.62,3462115.0,0.0,0.18,0.04,318.6,0.18,1150647.2,200.88,0.0,True,95.66,0.26,0.25,0.02,2025-11-20,13.44,1.34,0,,10.8,ATH,False,False
20-11-2025 10:00,TERA,268.25,288.75,268.25,283.0,4346158.0,5.75,14.75,1.75,742.86,14.75,1657655.0,162.19,0.39,True,48.42,-4.12,-2.83,-1.29,2025-11-20,276.25,2.44,0,,268.75,303.75,False,False
20-11-2025 10:00,DOHOL,17.34,17.8,17.33,17.7,7118856.0,0.1,0.36,0.03,1061.29,0.36,2180414.1,226.49,0.28,True,66.75,0.06,0.03,0.03,2025-11-20,17.26,2.55,0,,16.97,17.83,False,False
20-11-2025 10:00,CRDFA,45.46,49.7,44.6,49.36,1076481.0,0.34,3.9,0.51,661.72,3.9,218470.4,392.74,0.09,True,79.41,1.8,1.31,0.5,2025-11-20,45.76,7.87,0,,36.08,ATH,False,False
20-11-2025 10:00,TSKB,12.35,12.53,12.35,12.52,5583031.0,0.01,0.17,0.04,325.0,0.17,2971887.5,87.86,0.06,True,66.92,0.11,0.1,0.01,2025-11-20,12.3,1.79,0,,11.98,ATH,False,False
20-11-2025 10:00,AGHOL,27.4,27.72,27.28,27.68,1521609.0,0.04,0.28,0.05,418.52,0.28,674655.0,125.54,0.14,True,71.33,0.2,0.15,0.04,2025-11-20,27.26,1.54,0,,26.3,27.94,False,False
20-11-2025 10:00,PETKM,17.05,17.33,17.04,17.26,20457562.0,0.07,0.21,0.02,1005.26,0.21,8635001.7,136.91,0.33,True,64.6,0.06,0.06,0.0,2025-11-20,16.95,1.83,0,,16.69,17.45,False,False
20-11-2025 10:00,OZSUB,19.64,20.36,19.53,20.16,729498.0,0.2,0.52,0.07,687.88,0.52,205208.4,255.49,0.38,True,56.86,-0.16,-0.25,0.08,2025-11-20,19.5,3.38,0,,19.34,22.98,True,False
20-11-2025 10:00,SILVR,2.81,2.92,2.77,2.91,1445885.0,0.01,0.1,0.01,809.09,0.1,317827.1,354.93,0.1,True,67.74,0.0,-0.01,0.01,2025-11-20,2.77,5.05,0,,2.76,2.92,False,False
20-11-2025 10:00,AKFIS,22.34,23.3,22.26,23.06,2061838.0,0.24,0.72,0.06,1100.0,0.72,377634.2,445.99,0.33,True,69.08,0.01,-0.03,0.04,2025-11-20,22.24,3.69,0,,22.18,23.1,False,False
20-11-2025 10:00,DYOBY,13.5,13.71,13.49,13.68,165525.0,0.03,0.18,0.01,2150.0,0.18,96235.1,72.0,0.17,True,49.86,-0.03,-0.01,-0.03,2025-11-20,13.54,1.03,0,,13.15,14.33,False,False
20-11-2025 10:00,EFOR,124.8,127.6,123.7,127.0,550553.0,0.6,2.2,0.13,1592.31,2.2,150802.9,265.08,0.27,True,46.29,-1.9,-2.25,0.36,2025-11-20,124.9,1.68,0,,123.3,133.0,False,False
20-11-2025 10:00,TNZTP,21.6,22.0,21.56,21.96,641608.0,0.04,0.36,0.02,1400.0,0.36,277286.8,131.39,0.11,True,59.08,-0.02,-0.04,0.02,2025-11-20,21.56,1.86,0,,21.46,22.04,False,False
19-11-2025 17:00,SMRVA,419.25,433.0,418.5,429.5,230127.0,3.5,10.25,0.8,1181.25,10.25,97121.8,136.95,0.34,True,68.34,2.97,3.22,-0.25,2025-11-19,418.25,2.69,0,,414.75,432.0,False,False
19-11-2025 17:00,IZENR,9.0,9.23,8.98,9.21,6633275.0,0.02,0.21,0.01,1515.38,0.21,2164515.7,206.46,0.1,True,69.05,0.05,0.03,0.02,2025-11-19,8.93,3.14,0,,8.71,9.3,False,False
19-11-2025 17:00,DSTKF,766.0,797.5,762.5,797.5,811155.0,0.0,31.5,1.8,1650.0,31.5,285680.9,183.94,0.0,True,71.99,6.39,5.18,1.21,2025-11-19,765.0,4.25,0,,759.0,ATH,False,False
19-11-2025 17:00,EDATA,5.25,5.63,5.22,5.59,1579353.0,0.04,0.34,0.03,996.77,0.34,545740.4,189.4,0.12,True,71.45,0.0,-0.02,0.02,2025-11-19,5.26,6.27,0,,5.13,5.87,False,False
19-11-2025 17:00,IPEKE,83.4,85.65,83.15,85.5,2106480.0,0.15,2.1,0.12,1580.0,2.1,1277266.3,64.92,0.07,True,67.94,1.68,1.63,0.05,2025-11-19,82.55,3.57,0,,77.05,87.75,False,False
19-11-2025 17:00,ULUFA,4.19,4.29,4.18,4.29,7362661.0,0.0,0.1,0.02,426.32,0.1,3629753.1,102.84,0.0,True,68.61,0.08,0.07,0.01,2025-11-19,4.08,5.15,0,,3.73,ATH,False,False
19-11-2025 17:00,ARTMS,40.26,40.68,40.22,40.6,157909.0,0.08,0.34,0.01,4150.0,0.34,101775.0,55.15,0.24,True,42.91,-0.3,-0.28,-0.02,2025-11-19,40.82,-0.54,0,,39.34,44.22,False,False
19-11-2025 17:00,PLTUR,22.1,22.18,22.02,22.18,245690.0,0.0,0.08,0.0,3900.0,0.08,104910.0,134.19,0.0,True,50.67,-0.01,-0.01,-0.0,2025-11-19,22.08,0.45,0,,21.92,22.8,False,False
19-11-2025 17:00,SEYKM,5.8,6.0,5.6,6.0,571471.0,0.0,0.2,0.02,733.33,0.2,143596.7,297.97,0.0,True,60.25,-0.03,-0.05,0.02,2025-11-19,5.73,4.71,0,,5.71,6.49,True,False
19-11-2025 17:00,AKFYE,17.23,17.72,17.22,17.59,3727013.0,0.13,0.36,0.05,620.0,0.36,591955.7,529.61,0.36,True,77.25,0.04,0.01,0.03,2025-11-19,17.04,3.23,0,,17.02,ATH,False,False
19-11-2025 17:00,MTRKS,25.86,26.9,25.76,26.82,296074.0,0.08,0.96,0.05,1820.0,0.96,187225.8,58.14,0.08,True,64.41,0.42,0.44,-0.02,2025-11-19,26.24,2.21,0,,23.64,27.48,False,False
19-11-2025 17:00,AKENR,11.3,11.55,11.25,11.55,3708790.0,0.0,0.25,0.02,941.67,0.25,1951295.8,90.07,0.0,True,67.43,0.21,0.22,-0.01,2025-11-19,11.18,3.31,0,,9.92,11.92,False,False
19-11-2025 17:00,OBAMS,39.34,39.52,39.28,39.48,563152.0,0.04,0.14,0.0,6900.0,0.14,221639.6,154.08,0.29,True,44.45,-0.15,-0.18,0.03,2025-11-19,39.36,0.3,0,,39.34,39.84,False,False
19-11-2025 16:00,AYDEM,18.76,18.99,18.68,18.98,892016.0,0.01,0.22,0.07,238.46,0.22,391831.6,127.65,0.05,True,70.73,0.07,0.01,0.05,2025-11-19,18.29,3.77,0,,18.2,19.33,False,False
19-11-2025 16:00,ARASE,61.1,64.35,60.9,63.8,446418.0,0.55,2.7,0.3,800.0,2.7,127982.2,248.81,0.2,True,78.68,0.84,0.71,0.13,2025-11-19,60.85,4.85,0,,56.0,64.8,False,False
19-11-2025 16:00,OYAKC,21.68,21.84,21.68,21.82,6602197.0,0.02,0.14,0.02,600.0,0.14,2961634.1,122.92,0.14,True,56.5,0.01,-0.02,0.03,2025-11-19,21.42,1.87,0,,21.4,21.96,False,False
19-11-2025 15:00,HEKTS,3.29,3.34,3.28,3.33,25144106.0,0.01,0.04,0.0,1900.0,0.04,13083343.9,92.18,0.25,True,62.71,0.01,0.01,0.0,2025-11-19,3.26,2.15,0,,3.24,3.34,False,False
19-11-2025 15:00,TCKRC,48.12,48.74,47.9,48.74,126451.0,0.0,0.62,0.06,868.75,0.62,82338.6,53.57,0.0,True,56.7,0.05,0.06,-0.01,2025-11-19,48.0,1.54,0,,47.76,50.0,False,False
19-11-2025 15:00,BRKVY,84.95,87.8,84.9,87.7,341065.0,0.1,2.75,0.24,1045.83,2.75,80355.8,324.44,0.04,True,62.71,0.23,0.21,0.02,2025-11-19,85.3,2.81,0,,83.95,88.3,False,False
19-11-2025 15:00,GLYHO,11.25,11.6,11.22,11.58,4466240.0,0.02,0.33,0.04,725.0,0.33,1112264.1,301.54,0.06,True,66.07,-0.01,-0.03,0.03,2025-11-19,11.14,3.95,0,,11.02,11.66,False,False
19-11-2025 15:00,MGROS,523.5,531.0,523.5,529.0,789619.0,2.0,5.5,2.4,129.17,5.5,415286.7,90.14,0.36,True,78.38,5.12,2.92,2.21,2025-11-19,505.0,4.75,0,,497.75,ATH,False,False
19-11-2025 15:00,AKGRT,6.82,6.89,6.8,6.88,1873002.0,0.01,0.06,0.0,2900.0,0.06,1024804.5,82.77,0.17,True,53.81,0.0,0.01,-0.01,2025-11-19,6.83,0.73,0,,6.8,6.93,False,False
19-11-2025 15:00,AEFES,14.9,15.2,14.9,15.15,17820189.0,0.05,0.25,0.05,371.7,0.25,7697983.8,131.49,0.2,True,72.58,0.13,0.1,0.03,2025-11-19,14.7,3.06,0,,14.35,ATH,False,False
19-11-2025 15:00,YKSLN,5.87,5.94,5.85,5.94,1065412.0,0.0,0.07,0.01,677.78,0.07,365469.5,191.52,0.0,True,56.15,0.0,0.0,-0.0,2025-11-19,5.88,1.02,0,,5.82,6.07,False,False
19-11-2025 15:00,MERIT,19.31,19.83,19.21,19.77,944663.0,0.06,0.46,0.07,547.89,0.46,417932.1,126.03,0.13,True,50.18,-0.32,-0.4,0.07,2025-11-19,19.16,3.18,0,,19.08,21.04,True,True
19-11-2025 15:00,DOFER,55.6,56.95,55.5,56.9,347773.0,0.05,1.3,0.29,340.68,1.3,130089.5,167.33,0.04,True,62.85,-0.18,-0.55,0.37,2025-11-19,53.6,6.16,0,,52.8,65.45,False,False
19-11-2025 15:00,TUCLK,9.26,9.41,9.22,9.37,595729.0,0.04,0.11,0.01,816.67,0.11,252770.9,135.68,0.36,True,57.09,0.02,0.02,0.0,2025-11-19,9.21,1.74,0,,9.17,9.5,False,False
19-11-2025 15:00,ECOGR,24.38,29.3,23.98,29.3,109104893.0,0.0,4.92,0.53,835.36,4.92,13466116.8,710.22,0.0,True,66.0,-0.43,-0.37,-0.05,2025-11-19,26.64,9.98,0,,23.98,29.6,True,True
19-11-2025 14:00,BNTAS,6.49,6.65,6.47,6.64,916824.0,0.01,0.15,0.02,782.35,0.15,352533.5,160.07,0.07,True,68.63,0.01,-0.0,0.01,2025-11-19,6.42,3.43,0,,6.42,6.96,False,False
19-11-2025 14:00,ZOREN,3.27,3.31,3.27,3.3,9964408.0,0.01,0.03,0.0,1400.0,0.03,5873569.8,69.65,0.33,True,57.42,-0.0,-0.01,0.0,2025-11-19,3.26,1.23,0,,3.22,3.33,False,False
19-11-2025 14:00,NIBAS,21.88,23.26,21.88,23.14,999784.0,0.12,1.26,0.12,986.21,1.26,208834.9,378.74,0.1,True,71.59,0.05,-0.06,0.12,2025-11-19,21.6,7.13,0,,20.82,24.16,False,False
19-11-2025 13:00,ODAS,5.46,5.58,5.45,5.55,9555958.0,0.03,0.09,0.02,400.0,0.09,3989205.2,139.55,0.33,True,70.72,0.02,0.01,0.01,2025-11-19,5.32,4.32,0,,5.31,ATH,False,False
19-11-2025 13:00,MANAS,10.24,11.15,10.22,11.15,10746660.0,0.0,0.91,0.08,1051.9,0.91,6161519.6,74.42,0.0,True,56.88,-0.22,-0.32,0.1,2025-11-19,10.14,9.96,1,11.15,9.7,11.26,True,False
19-11-2025 13:00,ICUGS,2.97,3.04,2.95,3.03,4564836.0,0.01,0.06,0.0,2900.0,0.06,1874535.9,143.52,0.17,True,58.41,-0.01,-0.01,0.0,2025-11-19,2.97,2.02,2,2.95,2.95,3.05,False,False
19-11-2025 13:00,EDIP,34.44,35.92,34.3,35.9,713902.0,0.02,1.46,0.27,444.78,1.46,187603.0,280.54,0.01,True,81.74,0.5,0.32,0.18,2025-11-19,33.54,7.04,0,,31.36,36.92,False,False
19-11-2025 12:00,ZRGYO,22.54,22.98,22.54,22.92,177079.0,0.06,0.38,0.03,1017.65,0.38,99754.7,77.51,0.16,True,55.92,0.01,0.03,-0.02,2025-11-19,22.58,1.51,0,,21.78,23.2,False,False
19-11-2025 12:00,BSOKE,15.34,15.97,15.34,15.83,5108002.0,0.14,0.49,0.06,690.32,0.49,1239901.6,311.97,0.29,True,74.08,0.02,-0.03,0.06,2025-11-19,15.04,5.25,0,,14.91,16.14,False,False
19-11-2025 12:00,KRDMB,22.22,22.68,22.2,22.58,509570.0,0.1,0.36,0.05,566.67,0.36,228131.3,123.37,0.28,True,74.29,0.07,0.0,0.07,2025-11-19,21.72,3.96,1,22.68,21.58,22.68,False,False
19-11-2025 12:00,IEYHO,50.2,54.25,50.0,54.15,9487715.0,0.1,3.95,0.35,1028.57,3.95,1935117.8,390.29,0.03,True,74.29,0.38,0.21,0.18,2025-11-19,50.8,6.59,0,,49.46,ATH,False,False
19-11-2025 12:00,MERCN,17.32,17.84,17.24,17.73,2227272.0,0.11,0.41,0.01,8100.0,0.41,779680.2,185.66,0.27,True,51.05,-0.19,-0.2,0.01,2025-11-19,17.31,2.43,0,,17.05,18.28,True,True
19-11-2025 12:00,ARCLK,105.4,106.2,105.3,106.1,458259.0,0.1,0.7,0.06,1066.67,0.7,253377.4,80.86,0.14,True,59.35,0.05,0.01,0.04,2025-11-19,104.6,1.43,0,,103.6,106.8,False,False
19-11-2025 12:00,ARMGD,38.26,38.86,38.16,38.7,717747.0,0.16,0.44,0.12,266.67,0.44,295572.7,142.83,0.36,True,72.61,0.45,0.4,0.05,2025-11-19,37.84,2.27,0,,35.06,ATH,False,False
19-11-2025 11:00,THYAO,271.5,275.25,271.5,274.5,9151081.0,0.75,3.0,0.48,531.58,3.0,3348469.1,173.29,0.25,True,68.39,0.11,-0.56,0.68,2025-11-19,267.5,2.62,0,,266.75,291.5,False,False
19-11-2025 11:00,GSDDE,9.6,9.73,9.6,9.7,336285.0,0.03,0.1,0.01,1150.0,0.1,136613.7,146.16,0.3,True,61.73,0.0,-0.0,0.0,2025-11-19,9.54,1.68,0,,9.44,9.81,False,False
19-11-2025 11:00,MNDTR,7.43,8.11,7.43,7.93,4656039.0,0.18,0.5,0.07,575.68,0.5,937560.2,396.61,0.36,True,81.36,0.12,0.06,0.06,2025-11-19,7.4,7.16,1,8.11,7.08,8.11,False,False
19-11-2025 11:00,GARAN,130.8,133.0,130.8,132.5,11059018.0,0.5,1.7,0.25,580.0,1.7,3314478.0,233.66,0.29,True,68.56,0.44,0.08,0.37,2025-11-19,129.2,2.55,0,,127.2,134.7,False,False
19-11-2025 11:00,YKBNK,32.78,33.64,32.78,33.54,63764077.0,0.1,0.76,0.08,804.76,0.76,19236299.0,231.48,0.13,True,71.98,0.2,0.1,0.09,2025-11-19,32.44,3.39,0,,31.76,33.92,False,False
19-11-2025 11:00,AKBNK,59.35,60.85,59.35,60.55,40849272.0,0.3,1.2,0.14,757.14,1.2,11998254.5,240.46,0.25,True,71.19,0.26,0.09,0.17,2025-11-19,58.85,2.89,0,,57.8,61.55,False,False
19-11-2025 11:00,XBANK,14620.86,14943.31,14614.79,14873.89,393475442.0,69.42,253.03,31.78,696.32,253.03,122419352.6,221.42,0.27,True,70.66,54.32,20.65,33.67,2025-11-19,14472.09,2.78,0,,14302.09,15066.03,False,False
19-11-2025 10:00,KZBGY,11.93,12.7,11.89,12.55,11691362.0,0.15,0.62,0.1,532.65,0.62,3966216.4,194.77,0.24,True,70.45,0.06,-0.09,0.15,2025-11-19,11.86,5.82,0,,10.55,14.12,False,False
19-11-2025 10:00,YYLGD,10.65,10.84,10.65,10.79,1104094.0,0.05,0.14,0.01,1650.0,0.14,495475.0,122.84,0.36,True,65.13,0.03,0.02,0.02,2025-11-19,10.56,2.18,0,,10.54,ATH,False,False
19-11-2025 10:00,XU100,10773.8,10844.58,10758.63,10828.28,1123601070.0,16.3,54.48,6.27,769.04,54.48,577025518.6,94.72,0.3,True,66.53,33.7,26.22,7.47,2025-11-19,10728.6,0.93,0,,10636.38,11044.47,False,False
19-11-2025 10:00,MEKAG,3.93,4.15,3.93,4.09,4226164.0,0.06,0.16,0.01,1900.0,0.16,878673.1,380.97,0.38,True,41.48,-0.04,-0.02,-0.02,2025-11-19,4.21,-2.85,0,,ATL,4.31,False,False
19-11-2025 10:00,ENJSA,77.5,78.8,77.2,78.45,537877.0,0.35,0.95,0.07,1257.14,0.95,172458.6,211.89,0.37,True,64.86,0.43,0.29,0.14,2025-11-19,76.65,2.35,1,78.8,74.9,78.8,False,False
19-11-2025 10:00,DAPGM,11.95,12.18,11.95,12.15,6125260.0,0.03,0.2,0.02,700.0,0.2,1855974.2,230.03,0.15,True,63.62,0.01,-0.01,0.02,2025-11-19,11.92,1.93,0,,11.77,12.38,False,False
19-11-2025 10:00,AKYHO,3.08,3.12,3.05,3.12,253875.0,0.0,0.04,0.0,1233.33,0.04,154308.0,64.52,0.0,True,60.03,0.01,0.0,0.0,2025-11-19,3.09,0.97,0,,3.01,3.27,False,False
19-11-2025 10:00,KRDMD,24.4,25.18,24.34,24.98,33655278.0,0.2,0.58,0.05,1060.0,0.58,6878239.4,389.3,0.34,True,68.79,0.1,0.05,0.05,2025-11-19,24.16,3.39,0,,23.84,ATH,False,False
19-11-2025 10:00,BAHKM,47.18,50.0,47.18,49.64,658856.0,0.36,2.46,0.15,1497.4,2.46,108575.7,506.82,0.15,True,66.03,-0.29,-0.49,0.2,2025-11-19,47.02,5.57,0,,46.74,54.3,True,False
19-11-2025 10:00,FONET,2.96,3.02,2.91,3.01,20385961.0,0.01,0.05,0.01,614.29,0.05,6334789.8,221.81,0.2,True,70.13,0.03,0.02,0.01,2025-11-19,2.91,3.44,1,3.02,2.84,3.02,False,False
19-11-2025 10:00,ISMEN,40.22,40.52,40.18,40.5,843977.0,0.02,0.28,0.02,1172.73,0.28,401618.5,110.14,0.07,True,61.86,0.01,-0.03,0.04,2025-11-19,40.02,1.2,0,,39.7,40.86,False,False
19-11-2025 10:00,XU030,11669.14,11750.26,11644.91,11736.79,619869646.0,13.47,67.65,7.34,821.29,67.65,288854775.2,114.6,0.2,True,65.11,36.87,27.65,9.22,2025-11-19,11622.35,0.98,0,,11493.41,11988.97,False,False
19-11-2025 10:00,YEOTK,37.36,38.22,37.12,38.0,1770412.0,0.22,0.64,0.04,1423.81,0.64,541750.2,226.79,0.34,True,62.14,0.1,0.13,-0.03,2025-11-19,37.24,2.04,2,37.12,37.12,38.38,False,False
19-11-2025 10:00,MOBTL,7.27,7.76,7.27,7.65,7080478.0,0.11,0.38,0.03,1166.67,0.38,954185.0,642.04,0.29,True,70.51,0.01,-0.01,0.02,2025-11-19,7.25,5.52,0,,7.19,8.11,False,False
19-11-2025 10:00,EGPRO,26.58,26.8,26.5,26.8,170750.0,0.0,0.22,0.03,685.71,0.22,46694.5,265.67,0.0,True,63.74,0.09,0.02,0.07,2025-11-19,26.5,1.13,0,,25.4,29.16,False,False
19-11-2025 10:00,GUBRF,327.5,337.25,324.75,335.5,1615186.0,1.75,8.0,0.8,900.0,8.0,419356.9,285.16,0.22,True,72.06,2.75,2.57,0.18,2025-11-19,325.5,3.07,0,,318.5,ATH,False,False
19-11-2025 10:00,TUPRS,203.9,206.2,203.9,205.7,4172751.0,0.5,1.8,0.43,318.6,1.8,1981913.2,110.54,0.28,True,68.28,1.51,1.34,0.18,2025-11-19,204.0,0.83,0,,195.9,ATH,False,False
19-11-2025 10:00,CONSE,3.17,3.22,3.17,3.21,1162781.0,0.01,0.04,0.0,3900.0,0.04,697390.9,66.73,0.25,True,52.04,-0.01,-0.01,-0.0,2025-11-19,3.17,1.26,0,,3.16,3.28,False,False
19-11-2025 10:00,PENTA,14.0,14.2,14.0,14.19,418517.0,0.01,0.19,0.01,2614.29,0.19,196579.9,112.9,0.05,True,59.63,-0.01,-0.02,0.01,2025-11-19,13.99,1.43,1,14.2,13.76,14.2,False,False
19-11-2025 10:00,CIMSA,44.2,44.66,44.08,44.6,1550902.0,0.06,0.4,0.08,412.82,0.4,965611.8,60.61,0.15,True,66.22,0.14,0.07,0.07,2025-11-19,44.1,1.13,0,,43.36,45.14,False,False
18-11-2025 17:00,ENERY,9.86,10.1,9.8,10.07,11166394.0,0.03,0.21,0.03,556.25,0.21,3223617.0,246.39,0.14,True,68.82,0.1,0.09,0.02,2025-11-18,9.75,3.28,0,,9.22,ATH,False,False
18-11-2025 17:00,IHEVA,2.51,2.6,2.49,2.59,2063382.0,0.01,0.08,0.01,700.0,0.08,327884.1,529.3,0.13,True,70.92,0.01,0.01,0.01,2025-11-18,2.5,3.6,1,2.6,2.45,2.6,False,False
18-11-2025 17:00,AGROT,7.7,8.38,7.65,8.26,30432793.0,0.12,0.56,0.05,1042.86,0.56,6086201.8,400.03,0.21,True,81.85,0.19,0.15,0.05,2025-11-18,7.62,8.4,0,,6.89,ATH,False,False
18-11-2025 17:00,ODINE,223.6,230.0,223.6,228.7,409303.0,1.3,5.1,0.51,900.0,5.1,73505.4,456.83,0.25,True,22.99,-13.07,-12.9,-0.17,2025-11-18,248.4,-7.93,0,,223.6,301.5,False,False
18-11-2025 17:00,AKSEN,50.55,52.65,50.55,52.35,1873020.0,0.3,1.8,0.14,1185.71,1.8,612934.5,205.58,0.17,True,59.9,-0.17,-0.29,0.12,2025-11-18,51.0,2.65,0,,50.35,52.4,False,False
18-11-2025 17:00,ESCOM,3.27,3.38,3.25,3.38,8966004.0,0.0,0.11,0.01,900.0,0.11,4403564.5,103.61,0.0,True,67.88,0.02,0.01,0.01,2025-11-18,3.27,3.36,0,,3.13,3.62,False,False
18-11-2025 17:00,TRCAS,40.1,41.2,40.06,40.9,584313.0,0.3,0.8,0.07,1076.47,0.8,132702.8,340.32,0.38,True,66.19,0.19,0.14,0.05,2025-11-18,40.3,1.49,0,,39.34,44.74,False,False
18-11-2025 17:00,CGCAM,33.82,37.74,33.64,37.74,1099744.0,0.0,3.92,0.31,1156.41,3.92,296508.6,270.9,0.0,True,78.03,-0.01,-0.22,0.21,2025-11-18,34.5,9.39,3,,34.16,ATH,True,True
18-11-2025 17:00,AHGAZ,26.62,27.24,26.6,27.1,1591005.0,0.14,0.48,0.02,2900.0,0.48,297354.4,435.05,0.29,True,64.96,0.1,0.05,0.04,2025-11-18,26.86,0.89,0,,26.54,29.46,False,False
18-11-2025 16:00,LIDER,82.3,88.0,82.3,86.4,534897.0,1.6,4.1,0.32,1161.54,4.1,126074.2,324.27,0.39,True,72.78,1.6,1.81,-0.21,2025-11-18,83.5,3.47,0,,65.75,ATH,False,False
18-11-2025 16:00,IHLAS,3.37,3.6,3.36,3.58,52829822.0,0.02,0.21,0.02,775.0,0.21,25969628.9,103.43,0.1,True,69.16,0.04,0.03,0.01,2025-11-18,3.32,7.83,0,,3.28,3.69,False,False
18-11-2025 16:00,IHLGM,2.73,2.84,2.72,2.84,13466548.0,0.0,0.11,0.01,746.15,0.11,4550481.8,195.94,0.0,True,66.26,0.01,0.01,0.01,2025-11-18,2.73,4.03,2,2.72,2.72,3.06,False,False
18-11-2025 16:00,BERA,16.96,17.38,16.94,17.31,3453963.0,0.07,0.35,0.02,1958.82,0.35,1358347.5,154.28,0.2,True,54.57,-0.06,-0.08,0.02,2025-11-18,17.25,0.35,0,,16.88,17.45,False,False
18-11-2025 15:00,RYSAS,14.77,14.94,14.74,14.94,1775639.0,0.0,0.17,0.01,2733.33,0.17,382824.0,363.83,0.0,True,56.02,0.02,0.01,0.01,2025-11-18,14.83,0.74,0,,14.74,14.97,False,False
18-11-2025 15:00,RTALB,4.0,4.19,3.97,4.16,18329380.0,0.03,0.16,0.01,1900.0,0.16,6383742.4,187.13,0.19,True,64.84,0.04,0.04,0.0,2025-11-18,4.11,1.22,1,4.19,3.72,4.19,False,False
18-11-2025 15:00,ALFAS,47.08,50.5,46.98,50.45,3124092.0,0.05,3.37,0.04,8541.03,3.37,1072814.1,191.21,0.01,True,69.48,1.32,1.42,-0.1,2025-11-18,48.5,4.02,0,,40.58,ATH,False,False
18-11-2025 13:00,MEGMT,39.52,40.38,39.22,40.38,1532303.0,0.0,0.86,0.08,975.0,0.86,709065.4,116.1,0.0,True,65.7,0.23,0.05,0.18,2025-11-18,39.04,3.43,0,,38.66,41.2,False,False
18-11-2025 13:00,DOAS,184.9,188.3,184.8,187.7,389589.0,0.6,2.8,0.42,566.67,2.8,240188.5,62.2,0.21,True,66.78,1.12,0.78,0.34,2025-11-18,183.6,2.23,1,188.3,183.4,188.3,False,False
18-11-2025 13:00,ALVES,26.6,26.94,26.6,26.92,924086.0,0.02,0.32,0.03,1130.77,0.32,497547.7,85.73,0.06,True,65.39,0.08,-0.0,0.08,2025-11-18,26.36,2.12,0,,26.26,28.22,False,False
18-11-2025 12:00,SAFKR,26.66,27.16,26.66,27.1,790826.0,0.06,0.44,0.03,1366.67,0.44,466488.7,69.53,0.14,True,66.81,0.15,0.07,0.08,2025-11-18,26.6,1.88,1,27.16,25.68,27.16,False,False
18-11-2025 12:00,PNSUT,11.38,11.54,11.27,11.54,423099.0,0.0,0.16,0.02,627.27,0.16,130846.9,223.35,0.0,True,61.28,0.0,-0.02,0.03,2025-11-18,11.26,2.49,0,,11.04,11.86,False,False
18-11-2025 12:00,BRSAN,481.0,495.25,480.25,492.25,849889.0,3.0,11.25,1.15,878.26,11.25,234987.4,261.67,0.27,True,58.84,-2.86,-5.05,2.19,2025-11-18,480.5,2.45,0,,470.0,544.0,True,False
18-11-2025 12:00,DITAS,38.98,41.26,38.36,41.1,418646.0,0.16,2.12,0.28,651.77,2.12,182040.7,129.97,0.08,True,78.2,0.95,0.74,0.21,2025-11-18,38.36,7.14,1,41.26,35.5,41.26,False,False
18-11-2025 11:00,AVOD,4.02,4.14,4.01,4.11,402969.0,0.03,0.09,0.0,2900.0,0.09,258563.8,55.85,0.33,True,60.79,0.0,-0.0,0.01,2025-11-18,4.04,1.73,0,,3.84,4.63,False,False
18-11-2025 11:00,ISFIN,19.31,19.61,19.31,19.58,338516.0,0.03,0.27,0.03,694.12,0.27,120040.1,182.0,0.11,True,62.35,0.01,-0.02,0.04,2025-11-18,19.16,2.19,0,,18.93,20.58,True,False
18-11-2025 11:00,GENIL,186.3,189.4,186.2,188.8,135820.0,0.6,2.5,0.6,316.67,2.5,61137.8,122.15,0.24,True,57.18,0.13,-0.72,0.85,2025-11-18,185.8,1.61,0,,168.2,198.8,False,False
18-11-2025 10:00,TMSN,108.8,113.8,108.6,113.8,817527.0,0.0,5.0,0.66,657.58,5.0,131456.5,521.9,0.0,True,87.73,1.72,0.68,1.04,2025-11-18,103.5,9.95,1,113.8,99.7,ATH,False,False
18-11-2025 10:00,CCOLA,54.05,55.15,54.05,54.95,1025987.0,0.2,0.9,0.11,757.14,0.9,633061.9,62.07,0.22,True,56.95,-0.02,-0.08,0.06,2025-11-18,54.35,1.1,2,54.05,54.05,55.8,False,False
18-11-2025 10:00,ISCTR,12.19,12.4,12.14,12.38,134855120.0,0.02,0.19,0.01,1257.14,0.19,57487079.1,134.58,0.11,True,53.33,-0.04,-0.04,0.0,2025-11-18,12.24,1.14,2,12.14,12.14,12.47,False,False
18-11-2025 10:00,MAKTK,13.29,14.32,13.29,14.27,3199550.0,0.05,0.98,0.14,620.59,0.98,675925.9,373.36,0.05,True,69.44,0.07,-0.04,0.1,2025-11-18,13.56,5.24,2,13.29,13.29,ATH,False,False
18-11-2025 10:00,BEYAZ,27.8,28.08,27.56,28.06,260135.0,0.02,0.26,0.05,381.48,0.26,106071.9,145.24,0.08,True,53.77,-0.1,-0.19,0.09,2025-11-18,27.66,1.45,0,,26.92,28.24,False,False
18-11-2025 10:00,ARDYZ,28.58,30.44,28.34,30.06,4580178.0,0.38,1.48,0.27,448.15,1.48,1007294.0,354.7,0.26,True,77.91,0.57,0.38,0.19,2025-11-18,28.54,5.33,1,30.44,26.48,30.44,False,False
18-11-2025 10:00,MARTI,3.17,3.19,3.15,3.19,2172824.0,0.0,0.02,0.0,566.67,0.02,1084010.8,100.44,0.0,True,60.21,0.01,0.01,0.01,2025-11-18,3.16,0.95,0,,3.02,3.21,False,False
18-11-2025 10:00,EUPWR,28.5,30.06,28.5,30.02,5590580.0,0.04,1.52,0.21,630.77,1.52,1523989.4,266.84,0.03,True,74.57,0.3,0.1,0.2,2025-11-18,28.7,4.6,1,30.06,27.06,30.06,False,False
18-11-2025 10:00,TCELL,92.8,94.55,92.7,94.45,5456453.0,0.1,1.65,0.16,931.25,1.65,2258968.0,141.55,0.06,True,54.34,-0.4,-0.53,0.13,2025-11-18,93.1,1.45,0,,92.3,96.8,True,True
18-11-2025 10:00,FROTO,94.45,95.15,93.5,95.1,2376919.0,0.05,0.65,0.04,1525.0,0.65,1207484.6,96.85,0.08,True,54.28,0.0,-0.06,0.07,2025-11-18,94.6,0.53,0,,92.7,95.8,False,False
18-11-2025 10:00,BARMA,23.88,25.1,23.74,24.8,4438247.0,0.3,0.92,0.09,945.45,0.92,965316.5,359.77,0.33,True,83.49,0.8,0.61,0.19,2025-11-18,23.34,6.26,0,,20.08,ATH,False,False
18-11-2025 10:00,PGSUS,203.5,205.4,203.0,205.3,3701529.0,0.1,1.8,0.24,650.0,1.8,1749238.4,111.61,0.06,True,53.58,-0.06,-0.1,0.04,2025-11-18,204.0,0.64,0,,203.0,208.3,False,False
18-11-2025 10:00,BIMAS,537.0,551.0,534.0,550.5,1547589.0,0.5,13.5,1.5,800.0,13.5,629408.0,145.88,0.04,True,56.09,-2.47,-3.6,1.13,2025-11-18,540.0,1.94,0,,532.5,574.0,True,True
18-11-2025 10:00,TTKOM,55.25,56.4,55.1,56.35,8241660.0,0.05,1.1,0.03,4300.0,1.1,3560921.0,131.45,0.05,True,52.74,-0.18,-0.13,-0.05,2025-11-18,55.4,1.71,0,,55.35,56.8,False,False
18-11-2025 10:00,ALKLC,76.3,81.55,75.8,81.55,3357557.0,0.0,5.25,0.54,881.31,5.25,645654.1,420.02,0.0,True,81.92,1.62,0.64,0.97,2025-11-18,74.15,9.98,0,,66.9,87.5,False,False
18-11-2025 10:00,KCHOL,166.9,169.4,166.6,169.3,6716859.0,0.1,2.4,0.65,269.23,2.4,3163253.8,112.34,0.04,True,64.04,0.84,0.45,0.39,2025-11-18,167.8,0.89,0,,161.9,174.0,False,False
18-11-2025 10:00,ULKER,113.9,115.7,113.1,115.6,1795340.0,0.1,1.7,0.26,553.85,1.7,555412.9,223.24,0.06,True,64.45,0.52,0.37,0.15,2025-11-18,114.0,1.4,0,,110.5,ATH,False,False
18-11-2025 10:00,ALARK,88.75,91.85,88.7,91.15,5562985.0,0.7,2.4,0.26,841.18,2.4,1077428.6,416.32,0.29,True,70.28,0.3,0.16,0.14,2025-11-18,88.25,3.29,0,,87.65,ATH,False,False
18-11-2025 10:00,BJKAS,1.84,1.85,1.83,1.85,16288373.0,0.0,0.01,0.0,900.0,0.01,5656791.7,187.94,0.0,True,62.68,0.01,0.0,0.0,2025-11-18,1.84,0.54,1,1.85,1.8,1.86,False,False
18-11-2025 10:00,HATEK,20.96,21.7,19.95,21.56,4188538.0,0.14,0.6,0.01,4185.71,0.6,1115505.8,275.48,0.23,True,71.01,0.72,0.72,-0.0,2025-11-18,20.78,3.75,0,,16.56,ATH,False,False
18-11-2025 10:00,TSPOR,1.27,1.28,1.26,1.28,87465788.0,0.0,0.01,0.0,150.0,0.01,47150281.6,85.5,0.0,True,58.45,0.0,0.0,0.0,2025-11-18,1.27,0.79,0,,1.23,1.29,False,False
18-11-2025 10:00,SASA,2.88,2.92,2.87,2.91,291564056.0,0.01,0.03,0.0,650.0,0.03,106270967.3,174.36,0.33,True,52.11,0.0,-0.0,0.0,2025-11-18,2.9,0.34,2,2.87,2.87,2.94,False,False
18-11-2025 10:00,BURCE,34.86,38.0,33.82,37.18,347310.0,0.82,2.32,0.35,570.52,2.32,93165.1,272.79,0.35,True,68.63,0.2,-0.19,0.4,2025-11-18,35.24,5.51,3,,31.26,40.0,False,False
18-11-2025 10:00,GMTAS,45.38,46.3,45.18,46.2,406908.0,0.1,0.82,0.1,703.92,0.82,165574.9,145.75,0.12,True,63.76,0.2,0.09,0.11,2025-11-18,45.38,1.81,0,,43.32,46.7,False,False
18-11-2025 10:00,KLRHO,135.3,138.1,133.8,137.3,553942.0,0.8,2.0,0.32,525.0,2.0,263315.6,110.37,0.4,True,68.12,1.31,0.91,0.4,2025-11-18,135.4,1.4,0,,122.6,140.2,False,False
18-11-2025 10:00,SAHOL,75.8,76.8,75.4,76.75,7443749.0,0.05,0.95,0.19,400.0,0.95,3607754.7,106.33,0.05,True,58.8,0.09,-0.04,0.13,2025-11-18,76.3,0.59,0,,74.75,80.75,False,False
18-11-2025 10:00,SRVGY,3.15,3.16,3.12,3.16,3015355.0,0.0,0.01,0.0,900.0,0.01,1948523.0,54.75,0.0,True,56.71,0.0,-0.0,0.01,2025-11-18,3.15,0.32,0,,3.05,3.18,False,False
18-11-2025 10:00,GIPTA,65.65,71.85,65.65,71.85,3971062.0,0.0,6.2,0.79,679.87,6.2,458054.7,766.94,0.0,True,79.17,1.01,0.11,0.9,2025-11-18,65.35,9.95,1,71.85,57.7,73.4,False,False
18-11-2025 10:00,ATATP,163.1,172.4,160.0,171.6,2074842.0,0.8,8.5,1.68,405.95,8.5,355216.6,484.11,0.09,True,84.33,3.44,1.67,1.77,2025-11-18,160.4,6.98,1,172.4,144.8,172.4,False,False
17-11-2025 17:00,OZYSR,40.84,43.0,40.76,43.0,2562553.0,0.0,2.16,0.44,388.69,2.16,433411.0,491.25,0.0,True,79.08,0.82,0.58,0.24,2025-11-17,39.1,9.97,0,,37.2,ATH,False,False
17-11-2025 17:00,SURGY,50.9,53.5,50.7,53.5,2328616.0,0.0,2.6,0.23,1055.56,2.6,466383.1,399.29,0.0,True,68.27,0.04,-0.12,0.16,2025-11-17,51.3,4.29,0,,50.35,55.0,False,False
17-11-2025 17:00,PEKGY,12.7,12.93,12.67,12.87,112354775.0,0.06,0.17,0.02,962.5,0.17,34605434.1,224.67,0.35,True,63.67,0.04,0.03,0.01,2025-11-17,12.62,1.98,2,12.67,12.67,13.1,False,False
17-11-2025 17:00,KLSER,28.56,28.98,28.54,28.96,217113.0,0.02,0.4,0.06,614.29,0.4,99318.0,118.6,0.05,True,60.73,0.01,-0.1,0.11,2025-11-17,28.12,2.99,1,28.98,27.88,28.98,False,False
17-11-2025 17:00,KRONT,15.42,15.7,15.36,15.69,139696.0,0.01,0.27,0.03,864.29,0.27,84920.8,64.5,0.04,True,50.73,-0.11,-0.15,0.04,2025-11-17,15.15,3.56,0,,15.02,16.7,False,False
17-11-2025 17:00,ANSGR,22.26,22.4,22.24,22.4,729566.0,0.0,0.14,0.03,366.67,0.14,429551.5,69.84,0.0,True,57.33,-0.0,-0.05,0.05,2025-11-17,21.92,2.19,0,,21.92,22.54,False,False
17-11-2025 17:00,TURSG,12.69,12.91,12.62,12.9,14416181.0,0.01,0.21,0.0,6900.0,0.21,5734548.1,151.39,0.05,True,48.98,-0.01,-0.01,0.0,2025-11-17,12.84,0.47,2,12.62,12.62,13.16,False,False
17-11-2025 17:00,HOROZ,59.85,60.45,59.6,60.45,137405.0,0.0,0.6,0.02,2300.0,0.6,91483.8,50.2,0.0,True,52.94,-0.0,-0.06,0.06,2025-11-17,60.05,0.67,0,,58.75,61.35,False,False
17-11-2025 16:00,GESAN,44.76,47.46,44.56,47.38,2776486.0,0.08,2.62,0.36,619.78,2.62,550896.5,403.99,0.03,True,77.19,0.21,-0.1,0.31,2025-11-17,43.84,8.07,0,,43.3,49.22,False,False
17-11-2025 16:00,EGEGY,25.62,26.62,25.62,26.54,660144.0,0.08,0.92,0.16,482.28,0.92,229367.6,187.81,0.09,True,74.46,0.13,-0.02,0.15,2025-11-17,25.14,5.57,1,26.62,24.68,26.62,False,False
17-11-2025 15:00,BLCYT,29.16,29.86,28.9,29.82,388824.0,0.04,0.66,0.21,214.29,0.66,205423.5,89.28,0.06,True,82.68,0.41,0.2,0.21,2025-11-17,28.1,6.12,0,,27.18,ATH,False,False
17-11-2025 15:00,MAGEN,32.86,34.18,32.74,34.1,1026554.0,0.08,1.24,0.21,479.44,1.24,517415.2,98.4,0.06,True,70.81,0.43,0.28,0.15,2025-11-17,32.22,5.83,0,,30.52,ATH,False,False
17-11-2025 14:00,SANFM,6.91,7.11,6.89,7.1,2055180.0,0.01,0.19,0.03,578.57,0.19,680497.1,202.01,0.05,True,68.15,0.01,-0.04,0.05,2025-11-17,6.79,4.57,1,7.11,6.58,7.11,False,False
17-11-2025 14:00,GSDHO,4.46,4.51,4.44,4.5,2199819.0,0.01,0.04,0.01,263.64,0.04,1056229.9,108.27,0.25,True,72.25,0.01,-0.01,0.02,2025-11-17,4.35,3.45,0,,4.32,4.78,False,False
17-11-2025 14:00,HALKB,27.92,28.34,27.9,28.24,8851906.0,0.1,0.32,0.03,841.18,0.32,5761789.2,53.63,0.31,True,71.83,0.22,0.12,0.11,2025-11-17,27.04,4.44,0,,26.7,ATH,False,False
17-11-2025 13:00,AVGYO,11.47,11.76,11.4,11.75,327876.0,0.01,0.28,0.04,566.67,0.28,168099.3,95.05,0.04,True,59.26,-0.06,-0.13,0.08,2025-11-17,11.28,4.17,0,,10.98,11.89,False,False
17-11-2025 13:00,EGEPO,7.78,7.97,7.78,7.96,1364310.0,0.01,0.18,0.02,650.0,0.18,650623.0,109.69,0.06,True,66.16,0.11,0.1,0.02,2025-11-17,7.58,5.01,0,,7.45,8.19,False,False
17-11-2025 13:00,VBTYZ,17.36,17.52,17.33,17.5,185458.0,0.02,0.14,0.04,268.42,0.14,108319.8,71.21,0.14,True,65.03,-0.03,-0.11,0.07,2025-11-17,17.08,2.46,0,,16.82,18.26,False,False
17-11-2025 13:00,PRKAB,37.94,40.2,37.5,40.2,732607.0,0.0,2.26,0.32,610.69,2.26,226280.0,223.76,0.0,True,71.75,0.22,-0.13,0.36,2025-11-17,36.56,9.96,0,,36.0,42.1,False,False
17-11-2025 13:00,ESCAR,19.57,19.88,19.55,19.88,703579.0,0.0,0.31,0.07,349.28,0.31,336337.4,109.19,0.0,True,68.41,0.1,0.01,0.09,2025-11-17,19.08,4.19,0,,18.81,ATH,False,False
17-11-2025 13:00,IHGZT,1.86,1.94,1.86,1.94,20163293.0,0.0,0.08,0.01,1233.33,0.08,6343493.9,217.86,0.0,True,63.94,-0.0,-0.01,0.01,2025-11-17,1.83,6.01,0,,1.82,2.14,False,False
17-11-2025 13:00,PATEK,28.48,29.02,28.4,28.92,3285645.0,0.1,0.44,0.12,279.31,0.44,1609523.2,104.14,0.23,True,68.13,0.03,-0.14,0.17,2025-11-17,27.76,4.18,0,,27.12,29.68,False,False
17-11-2025 12:00,LYDHO,180.7,189.6,180.0,189.6,269283.0,0.0,8.9,0.84,959.52,8.9,116142.5,131.86,0.0,True,63.58,-0.25,-1.49,1.24,2025-11-17,177.6,6.76,0,,170.0,197.0,False,False
17-11-2025 12:00,BOBET,18.85,19.0,18.83,18.99,470350.0,0.01,0.14,0.03,382.76,0.14,168926.7,178.43,0.07,True,61.02,-0.03,-0.06,0.04,2025-11-17,18.61,2.04,0,,18.52,19.1,False,False
17-11-2025 12:00,HKTM,12.63,12.76,12.62,12.73,467598.0,0.03,0.1,0.02,525.0,0.1,310650.2,50.52,0.3,True,59.25,-0.01,-0.04,0.04,2025-11-17,12.42,2.5,0,,12.25,13.34,True,False
17-11-2025 12:00,GEDZA,27.44,28.06,27.4,27.98,248214.0,0.08,0.54,0.08,558.54,0.54,80569.9,208.07,0.15,True,66.03,-0.07,-0.22,0.15,2025-11-17,26.58,5.27,0,,26.52,30.34,True,False
17-11-2025 12:00,IMASM,5.05,5.3,5.03,5.3,52463489.0,0.0,0.25,0.02,1288.89,0.25,12535450.6,318.52,0.0,True,65.65,0.07,0.06,0.02,2025-11-17,4.82,9.96,0,,4.76,5.77,False,False
17-11-2025 11:00,PAPIL,15.77,16.05,15.76,16.0,1435351.0,0.05,0.23,0.0,22900.0,0.23,917974.9,56.36,0.22,True,53.84,-0.1,-0.14,0.04,2025-11-17,15.65,2.24,0,,15.52,16.3,True,False
17-11-2025 11:00,YIGIT,24.32,24.82,24.32,24.8,337530.0,0.02,0.48,0.02,2300.0,0.48,171969.6,96.27,0.04,True,61.98,-0.13,-0.21,0.08,2025-11-17,23.94,3.59,0,,23.82,24.84,True,False
17-11-2025 11:00,NTGAZ,10.94,11.16,10.94,11.14,1059279.0,0.02,0.2,0.02,900.0,0.2,443844.9,138.66,0.1,True,69.34,0.04,-0.0,0.04,2025-11-17,10.84,2.77,0,,10.5,11.32,False,False
17-11-2025 11:00,OSMEN,8.92,9.15,8.89,9.14,696595.0,0.01,0.22,0.02,1000.0,0.22,226746.8,207.21,0.05,True,60.1,-0.08,-0.13,0.05,2025-11-17,8.77,4.22,1,9.15,8.7,9.15,True,False
17-11-2025 11:00,HUBVC,2.96,3.02,2.94,3.01,1074734.0,0.01,0.05,0.0,900.0,0.05,640966.3,67.67,0.2,True,44.19,-0.05,-0.06,0.0,2025-11-17,2.98,1.01,0,,2.93,3.3,False,False
17-11-2025 11:00,MIATK,37.32,39.2,37.3,38.92,6261165.0,0.28,1.6,0.17,852.38,1.6,1840981.9,240.1,0.18,True,72.06,-0.09,-0.26,0.17,2025-11-17,36.8,5.76,0,,36.64,40.88,True,False
17-11-2025 11:00,ANGEN,11.53,12.26,11.53,12.12,4869977.0,0.14,0.59,0.06,883.33,0.59,931116.6,423.03,0.24,True,79.55,0.05,-0.02,0.07,2025-11-17,11.29,7.35,0,,11.22,12.32,False,False
17-11-2025 11:00,DERHL,14.49,14.84,14.48,14.81,1581579.0,0.03,0.32,0.04,788.89,0.32,761640.4,107.65,0.09,True,55.53,-0.21,-0.27,0.07,2025-11-17,14.23,4.08,0,,14.12,16.53,True,False
17-11-2025 11:00,BAGFS,28.84,29.3,28.82,29.3,170967.0,0.0,0.46,0.09,411.11,0.46,87966.7,94.35,0.0,True,59.31,-0.17,-0.32,0.15,2025-11-17,28.58,2.52,0,,28.14,33.62,True,False
17-11-2025 11:00,ASELS,180.1,184.5,180.0,184.5,7045766.0,0.0,4.4,0.75,486.67,4.4,3711977.5,89.81,0.0,True,66.18,-0.89,-1.95,1.07,2025-11-17,176.0,4.83,0,,171.5,188.8,False,False
17-11-2025 11:00,ELITE,30.74,31.36,30.74,31.32,202016.0,0.04,0.58,0.02,2316.67,0.58,128549.7,57.15,0.07,True,56.4,-0.32,-0.47,0.15,2025-11-17,30.22,3.64,0,,29.92,36.66,True,False
17-11-2025 11:00,TEZOL,12.16,12.42,12.15,12.37,410172.0,0.05,0.21,0.04,377.27,0.21,249409.8,64.46,0.24,True,65.46,-0.05,-0.12,0.07,2025-11-17,11.9,3.95,0,,11.77,13.2,False,False
17-11-2025 11:00,SKYMD,12.43,12.72,12.43,12.69,890116.0,0.03,0.26,0.03,664.71,0.26,457906.0,94.39,0.12,True,67.37,-0.03,-0.08,0.05,2025-11-17,12.17,4.27,0,,12.05,12.78,False,False
17-11-2025 11:00,KAYSE,17.41,17.55,17.4,17.54,340151.0,0.01,0.13,0.01,2066.67,0.13,168030.8,102.43,0.08,True,55.53,-0.07,-0.1,0.03,2025-11-17,17.2,1.98,0,,17.2,17.85,True,False
17-11-2025 11:00,ENKAI,74.2,75.5,74.1,75.2,1610234.0,0.3,1.0,0.05,1718.18,1.0,928251.6,73.47,0.3,True,61.12,-0.0,-0.15,0.15,2025-11-17,74.0,1.62,1,75.5,73.1,75.5,False,False
17-11-2025 11:00,BOSSA,6.89,6.96,6.88,6.95,427101.0,0.01,0.06,0.01,1100.0,0.06,280449.4,52.29,0.17,True,55.21,-0.01,-0.01,0.0,2025-11-17,6.81,2.06,0,,6.77,7.38,False,False
17-11-2025 10:00,ISDMR,35.26,35.92,35.26,35.82,425365.0,0.1,0.56,0.02,3011.11,0.56,277369.3,53.36,0.18,True,56.91,-0.18,-0.24,0.06,2025-11-17,35.2,1.76,0,,34.98,35.9,True,False
17-11-2025 10:00,HUNER,3.5,3.58,3.49,3.57,3444884.0,0.01,0.07,0.0,2233.33,0.07,986106.1,249.34,0.14,True,64.34,-0.01,-0.02,0.01,2025-11-17,3.46,3.18,0,,3.48,3.92,False,False
17-11-2025 10:00,GLRMK,171.1,174.7,170.5,174.1,439863.0,0.6,3.0,0.32,837.5,3.0,139032.0,216.38,0.2,True,55.79,-1.22,-1.75,0.53,2025-11-17,169.1,2.96,0,,164.0,176.0,False,False
17-11-2025 10:00,GLRYH,4.31,4.43,4.31,4.41,2979854.0,0.02,0.1,0.0,9900.0,0.1,1200986.6,148.12,0.2,True,47.67,-0.08,-0.1,0.02,2025-11-17,4.29,2.8,0,,4.17,5.15,True,False
17-11-2025 10:00,GOODY,15.37,15.67,15.37,15.6,303789.0,0.07,0.23,0.02,995.24,0.23,115941.1,162.02,0.3,True,65.08,-0.01,-0.05,0.04,2025-11-17,15.29,2.03,0,,15.12,ATH,False,False
17-11-2025 10:00,BULGS,42.64,45.36,42.62,45.12,4938175.0,0.24,2.48,0.34,620.93,2.48,1617271.0,205.34,0.1,True,67.12,0.03,-0.3,0.34,2025-11-17,42.42,6.36,0,,40.84,48.7,False,False
17-11-2025 10:00,GENTS,10.4,11.08,10.25,11.04,7075786.0,0.04,0.64,0.03,1782.35,0.64,1515901.7,366.77,0.06,True,58.44,-0.15,-0.19,0.04,2025-11-17,10.17,8.55,0,,10.06,11.8,True,True
17-11-2025 10:00,PCILT,22.72,23.48,22.72,23.28,256848.0,0.2,0.56,0.03,1900.0,0.56,73152.3,251.11,0.36,True,55.53,-0.2,-0.24,0.04,2025-11-17,22.66,2.74,0,,22.48,23.58,True,True
17-11-2025 10:00,KRVGD,2.53,2.58,2.52,2.58,1678555.0,0.0,0.05,0.0,1150.0,0.05,768939.9,118.29,0.0,True,59.4,-0.0,-0.01,0.0,2025-11-17,2.52,2.38,0,,2.49,2.61,False,False
17-11-2025 10:00,ETILR,4.06,4.14,4.06,4.12,1136757.0,0.02,0.06,0.01,1100.0,0.06,437149.2,160.04,0.33,True,58.81,-0.02,-0.04,0.01,2025-11-17,4.04,1.98,0,,3.99,4.46,True,False
17-11-2025 10:00,FADE,13.58,13.75,13.45,13.73,199104.0,0.02,0.15,0.02,733.33,0.15,69534.1,186.34,0.13,True,55.85,-0.06,-0.1,0.03,2025-11-17,13.51,1.63,0,,13.41,14.39,True,False
17-11-2025 10:00,HURGZ,5.5,5.99,5.5,5.99,2639958.0,0.0,0.49,0.05,942.55,0.49,448651.9,488.42,0.0,True,72.95,-0.0,-0.03,0.03,2025-11-17,5.45,9.91,0,,5.45,6.0,True,True
17-11-2025 10:00,SEGYO,6.2,6.66,6.17,6.66,18187489.0,0.0,0.46,0.1,350.98,0.46,5796071.9,213.79,0.0,True,74.54,0.11,-0.03,0.14,2025-11-17,6.06,9.9,1,6.66,5.34,ATH,False,False
17-11-2025 10:00,KZGYO,24.72,26.44,24.56,26.22,949364.0,0.22,1.5,0.14,941.67,1.5,159277.7,496.04,0.15,True,75.93,-0.01,-0.18,0.17,2025-11-17,24.4,7.46,0,,24.16,ATH,True,False
17-11-2025 10:00,EKOS,26.14,28.2,26.14,28.12,2075551.0,0.08,1.98,0.18,976.09,1.98,447618.2,363.69,0.04,True,77.75,0.05,-0.13,0.19,2025-11-17,26.02,8.07,1,28.2,25.44,28.2,False,False
17-11-2025 10:00,CEMAS,5.43,5.66,5.43,5.65,16867704.0,0.01,0.22,0.03,780.0,0.22,6407626.7,163.24,0.05,True,64.87,-0.0,-0.02,0.01,2025-11-17,5.43,4.05,1,5.66,5.35,5.66,False,False
17-11-2025 10:00,TATGD,12.86,13.13,12.86,13.09,295320.0,0.04,0.23,0.02,1337.5,0.23,95909.7,207.91,0.17,True,49.97,-0.11,-0.13,0.02,2025-11-17,12.91,1.39,0,,12.81,14.45,True,False
17-11-2025 10:00,IHYAY,2.26,2.35,2.26,2.33,2880426.0,0.02,0.07,0.0,1.576259869579679e+17,0.07,994436.8,189.65,0.29,True,48.73,-0.02,-0.02,-0.0,2025-11-17,2.26,3.1,2,2.26,2.26,2.37,False,False
17-11-2025 10:00,INFO,3.9,4.12,3.89,4.08,14708229.0,0.04,0.18,0.01,1400.0,0.18,3409225.3,331.42,0.22,True,59.4,-0.06,-0.09,0.02,2025-11-17,3.86,5.7,0,,3.82,4.42,True,False
17-11-2025 10:00,SAMAT,6.15,6.3,6.07,6.26,282821.0,0.04,0.11,0.02,400.0,0.11,91081.1,210.52,0.36,True,57.04,-0.01,-0.03,0.02,2025-11-17,6.18,1.29,0,,6.0,6.49,False,False
14-11-2025 17:00,PASEU,135.1,142.0,134.1,142.0,1392607.0,0.0,6.9,1.19,479.83,6.9,513691.3,171.1,0.0,True,72.71,1.61,0.69,0.92,2025-11-14,130.0,9.23,1,142.0,128.3,ATH,False,False
14-11-2025 17:00,VAKFN,2.26,2.33,2.23,2.32,79478963.0,0.01,0.06,0.0,1900.0,0.06,22845821.1,247.89,0.17,True,73.91,0.03,0.03,0.0,2025-11-14,2.23,4.04,0,,2.17,ATH,False,False
14-11-2025 17:00,KRPLS,7.65,8.1,7.64,8.0,2502542.0,0.1,0.35,0.02,1300.0,0.35,345179.3,625.0,0.29,True,61.82,-0.03,-0.05,0.02,2025-11-14,7.77,2.96,1,8.1,7.63,8.1,True,True
14-11-2025 17:00,PRDGS,6.01,6.16,6.0,6.16,623571.0,0.0,0.15,0.01,1566.67,0.15,267895.0,132.77,0.0,True,49.37,-0.08,-0.1,0.01,2025-11-14,6.06,1.65,0,,5.94,6.69,True,True
14-11-2025 17:00,JANTS,18.98,19.15,18.96,19.15,369093.0,0.0,0.17,0.0,3300.0,0.17,167841.4,119.91,0.0,True,38.91,-0.17,-0.19,0.01,2025-11-14,19.24,-0.47,0,,18.94,ATH,True,True
14-11-2025 17:00,BMSTL,93.6,97.85,93.45,97.45,1092134.0,0.4,3.85,0.36,984.51,3.85,538924.4,102.65,0.1,True,78.12,2.86,2.67,0.19,2025-11-14,92.45,5.41,0,,80.35,ATH,False,False
14-11-2025 17:00,BORLS,11.91,13.2,11.91,12.84,19572508.0,0.36,0.93,0.09,933.33,0.93,8668966.6,125.78,0.39,True,44.61,-0.69,-0.74,0.05,2025-11-14,13.23,-2.95,0,,11.91,14.8,True,True
14-11-2025 17:00,SMRTG,25.04,25.36,25.0,25.3,329949.0,0.06,0.26,0.02,983.33,0.26,127998.3,157.78,0.23,True,51.82,-0.12,-0.17,0.05,2025-11-14,25.02,1.12,0,,24.96,25.84,True,True
14-11-2025 17:00,EUREN,7.11,7.27,7.09,7.26,10408048.0,0.01,0.15,0.01,1400.0,0.15,4460733.9,133.33,0.07,True,53.64,-0.02,-0.01,-0.0,2025-11-14,7.2,0.83,0,,7.07,7.58,False,False
14-11-2025 17:00,KOZAL,32.94,33.7,32.8,33.7,41448918.0,0.0,0.76,0.11,603.7,0.76,23521972.7,76.21,0.0,True,73.26,0.72,0.78,-0.06,2025-11-14,32.7,3.06,0,,27.36,ATH,False,False
14-11-2025 17:00,KONKA,14.01,14.29,13.92,14.29,240065.0,0.0,0.28,0.01,5500.0,0.28,130670.2,83.72,0.0,True,48.22,-0.1,-0.11,0.02,2025-11-14,14.3,-0.07,0,,13.91,14.48,True,True
14-11-2025 17:00,KOCMT,2.74,2.8,2.74,2.8,2502738.0,0.0,0.06,0.0,5900.0,0.06,1478261.5,69.3,0.0,True,56.05,-0.01,-0.01,0.0,2025-11-14,2.76,1.45,0,,2.73,2.92,False,False
14-11-2025 17:00,MOGAN,8.35,8.48,8.34,8.48,655989.0,0.0,0.13,0.0,6400.0,0.13,317965.4,106.31,0.0,True,43.42,-0.1,-0.12,0.02,2025-11-14,8.42,0.71,0,,8.31,8.78,True,True
14-11-2025 17:00,KIMMR,14.72,14.98,14.72,14.98,159190.0,0.0,0.26,0.02,1633.33,0.26,79278.6,100.8,0.0,True,48.98,-0.15,-0.17,0.02,2025-11-14,14.8,1.22,0,,ATL,15.84,True,True
14-11-2025 17:00,BALSU,17.36,18.45,17.29,18.45,1362096.0,0.0,1.09,0.05,2080.0,1.09,368020.1,270.11,0.0,True,61.06,-0.13,-0.16,0.03,2025-11-14,18.07,2.1,0,,17.17,18.49,False,False
14-11-2025 15:00,KLKIM,31.64,32.98,31.36,32.98,668391.0,0.0,1.34,0.16,737.5,1.34,185074.0,261.15,0.0,True,71.46,0.08,-0.05,0.12,2025-11-14,31.58,4.43,0,,31.2,ATH,False,False
14-11-2025 15:00,DESA,13.62,14.31,13.5,14.31,1207615.0,0.0,0.69,0.14,403.65,0.69,386528.9,212.43,0.0,True,73.88,0.11,-0.05,0.16,2025-11-14,13.01,9.99,1,14.31,12.66,ATH,False,False
14-11-2025 14:00,VKING,36.18,37.66,35.94,37.66,956287.0,0.0,1.48,0.33,351.22,1.48,325569.6,193.73,0.0,True,83.98,0.66,0.36,0.29,2025-11-14,34.24,9.99,0,,33.5,ATH,False,False
14-11-2025 13:00,ADESE,2.24,2.39,2.23,2.37,86760366.0,0.02,0.13,0.01,900.0,0.13,24144749.3,259.33,0.15,True,49.3,-0.07,-0.09,0.02,2025-11-14,2.27,4.41,0,,2.21,3.25,True,False
14-11-2025 13:00,MERKO,13.88,14.52,13.86,14.37,2114244.0,0.15,0.49,0.05,900.0,0.49,509746.1,314.76,0.31,True,66.6,-0.03,-0.07,0.04,2025-11-14,13.85,3.75,0,,13.81,15.18,False,False
14-11-2025 11:00,SERNT,8.9,9.01,8.83,8.98,1006675.0,0.03,0.08,0.0,1900.0,0.08,518743.2,94.06,0.37,True,46.9,-0.09,-0.12,0.03,2025-11-14,8.82,1.81,0,,8.72,9.03,True,False
14-11-2025 11:00,INVEO,9.82,9.95,9.8,9.94,1650147.0,0.01,0.12,0.02,605.88,0.12,934303.4,76.62,0.08,True,51.51,-0.07,-0.09,0.02,2025-11-14,9.76,1.84,0,,9.67,10.81,True,True
14-11-2025 11:00,ANELE,15.12,15.3,15.09,15.25,163478.0,0.05,0.13,0.02,490.91,0.13,82641.9,97.81,0.38,True,47.05,-0.08,-0.1,0.02,2025-11-14,15.15,0.66,0,,15.05,15.61,True,False
14-11-2025 11:00,METRO,5.12,5.26,5.09,5.24,2215428.0,0.02,0.12,0.02,445.45,0.12,1125761.0,96.79,0.17,True,48.01,-0.08,-0.09,0.01,2025-11-14,5.11,2.54,0,,ATL,5.93,True,False
14-11-2025 10:00,ECILC,85.75,88.4,85.35,87.75,2626589.0,0.65,2.0,0.19,952.63,2.0,779186.7,237.09,0.33,True,72.23,0.73,0.53,0.2,2025-11-14,85.0,3.24,0,,78.5,88.0,False,False
14-11-2025 10:00,ALKA,9.75,10.44,9.72,10.25,5470239.0,0.19,0.5,0.03,1512.9,0.5,917972.6,495.9,0.38,True,60.68,-0.13,-0.19,0.06,2025-11-14,9.71,5.56,0,,9.67,11.6,True,True
14-11-2025 10:00,CVKMD,18.46,19.41,18.44,19.34,13466809.0,0.07,0.88,0.1,807.22,0.88,3087868.3,336.12,0.08,True,68.59,-0.0,-0.14,0.14,2025-11-14,18.37,5.28,0,,17.64,ATH,False,False
14-11-2025 10:00,ORCAY,3.8,3.98,3.72,3.97,3256719.0,0.01,0.17,0.01,1114.29,0.17,741528.0,339.19,0.06,True,56.18,-0.0,-0.01,0.0,2025-11-14,3.85,3.12,2,3.72,3.72,4.07,False,False
14-11-2025 10:00,ALTNY,61.4,66.6,61.35,65.35,12597987.0,1.25,3.95,0.37,967.57,3.95,1424679.6,784.27,0.32,True,74.41,0.08,-0.25,0.32,2025-11-14,61.8,5.74,1,66.6,61.15,66.6,False,False
14-11-2025 10:00,TEKTU,11.09,11.95,10.7,11.88,6167829.0,0.07,0.79,0.16,387.65,0.79,1471977.8,319.02,0.09,True,64.96,0.0,-0.19,0.19,2025-11-14,11.19,6.17,1,11.95,9.79,11.95,False,False
14-11-2025 10:00,MNDRS,15.53,16.07,15.49,16.07,3616153.0,0.0,0.54,0.07,682.61,0.54,972221.5,271.95,0.0,True,77.72,0.2,0.18,0.02,2025-11-14,15.49,3.74,0,,13.7,16.08,False,False
14-11-2025 10:00,IZMDC,6.0,6.11,6.0,6.09,1584331.0,0.02,0.09,0.01,718.18,0.09,543523.9,191.49,0.22,True,53.53,-0.02,-0.04,0.02,2025-11-14,6.04,0.83,0,,5.91,6.12,False,False
13-11-2025 17:00,MARBL,13.74,14.19,13.59,14.19,485181.0,0.0,0.45,0.04,997.56,0.45,178854.0,171.27,0.0,True,55.59,-0.12,-0.14,0.02,2025-11-13,13.7,3.58,2,13.59,13.59,14.96,True,True
13-11-2025 17:00,VAKBN,26.28,26.78,26.26,26.68,19273495.0,0.1,0.4,0.05,700.0,0.4,5927241.2,225.17,0.25,True,73.33,0.37,0.35,0.03,2025-11-13,26.04,2.46,0,,23.88,ATH,False,False
13-11-2025 17:00,CANTE,2.32,2.44,2.32,2.44,494603999.0,0.0,0.12,0.02,400.0,0.12,101014402.8,389.64,0.0,True,63.46,-0.03,-0.06,0.03,2025-11-13,2.22,9.91,0,,2.21,2.87,True,False
13-11-2025 17:00,YYAPI,2.31,2.44,2.28,2.44,62385783.0,0.0,0.13,0.02,465.22,0.13,34838351.3,79.07,0.0,True,64.16,-0.01,-0.03,0.02,2025-11-13,2.22,9.91,0,,2.18,ATH,False,False
13-11-2025 17:00,YESIL,2.46,2.61,2.43,2.61,34473941.0,0.0,0.15,0.02,650.0,0.15,8551287.1,303.14,0.0,True,62.57,-0.01,-0.03,0.02,2025-11-13,2.38,9.66,0,,2.35,2.77,False,False
13-11-2025 16:00,NTHOL,48.56,49.5,48.5,49.38,486663.0,0.12,0.82,0.01,6733.33,0.82,258692.2,88.12,0.15,True,49.12,-0.4,-0.47,0.07,2025-11-13,48.54,1.73,0,,48.2,52.3,True,True
13-11-2025 16:00,ZEDUR,8.18,8.98,8.14,8.95,1668321.0,0.03,0.77,0.06,1162.3,0.77,336398.0,395.94,0.04,True,76.13,-0.01,-0.06,0.04,2025-11-13,8.34,7.31,2,8.14,8.14,ATH,True,True
13-11-2025 16:00,DENGE,3.57,3.79,3.56,3.76,18557947.0,0.03,0.19,0.03,442.86,0.19,5343494.6,247.3,0.16,True,69.77,0.04,0.02,0.02,2025-11-13,3.46,8.67,0,,3.3,ATH,False,False
13-11-2025 15:00,BTCIM,4.11,4.19,4.1,4.18,19752367.0,0.01,0.07,0.0,1300.0,0.07,10459975.4,88.84,0.14,True,48.88,-0.04,-0.05,0.01,2025-11-13,4.11,1.7,1,4.19,4.09,4.19,True,False
13-11-2025 15:00,CEMZY,35.94,41.0,35.94,40.5,3406651.0,0.5,4.56,0.01,37900.0,4.56,749995.7,354.22,0.11,True,49.05,-1.22,-1.19,-0.02,2025-11-13,39.92,1.45,3,,39.42,42.66,True,True
13-11-2025 15:00,USAK,3.51,3.67,3.5,3.67,35168514.0,0.0,0.16,0.04,357.14,0.16,21015018.0,67.35,0.0,True,71.94,0.05,0.02,0.03,2025-11-13,3.4,7.94,0,,3.27,ATH,False,False
13-11-2025 14:00,QUAGR,5.51,5.92,5.51,5.91,94140326.0,0.01,0.4,0.03,1190.32,0.4,43415969.8,116.83,0.02,True,31.12,-0.4,-0.41,0.02,2025-11-13,6.12,-3.43,0,,5.51,6.8,True,True
13-11-2025 13:00,ESEN,7.17,7.31,7.15,7.28,14254400.0,0.03,0.11,0.01,685.71,0.11,4011298.9,255.36,0.27,True,68.24,0.01,-0.01,0.02,2025-11-13,7.12,2.25,0,,7.06,7.46,False,False
13-11-2025 12:00,DGNMO,5.75,5.93,5.75,5.88,506791.0,0.05,0.13,0.01,1344.44,0.13,163317.6,210.31,0.38,True,55.39,-0.05,-0.07,0.02,2025-11-13,5.7,3.16,1,5.93,5.7,5.93,True,False
13-11-2025 12:00,EMKEL,55.25,57.2,55.25,57.2,4041229.0,0.0,1.95,0.1,1850.0,1.95,1879902.5,114.97,0.0,True,52.96,-1.1,-1.63,0.53,2025-11-13,52.0,10.0,0,,53.85,75.2,True,False
13-11-2025 11:00,TOASO,232.5,237.2,232.5,236.8,1446649.0,0.4,4.3,0.58,641.38,4.3,511431.7,182.86,0.09,True,68.58,0.44,-0.31,0.75,2025-11-13,231.2,2.42,0,,223.9,ATH,False,False
13-11-2025 10:00,DOGUB,56.5,66.8,56.5,65.1,1106587.0,1.7,8.6,0.86,900.0,8.6,124595.5,788.14,0.2,True,54.51,-0.49,0.19,-0.68,2025-11-13,62.75,3.75,3,,56.5,69.7,False,False
13-11-2025 10:00,DMSAS,9.89,9.99,9.87,9.98,545934.0,0.01,0.09,0.01,800.0,0.09,182538.8,199.08,0.11,True,68.13,0.04,0.04,0.0,2025-11-13,9.9,0.81,0,,ATL,ATH,False,False
13-11-2025 10:00,FENER,11.63,12.1,11.46,11.99,25549676.0,0.11,0.36,0.02,1900.0,0.36,11259894.6,126.91,0.31,True,73.64,0.35,0.34,0.0,2025-11-13,11.49,4.35,0,,9.95,ATH,False,False
13-11-2025 10:00,A1YEN,32.1,33.18,32.1,32.96,714002.0,0.22,0.86,0.1,726.92,0.86,465566.6,53.36,0.26,True,60.77,0.08,0.01,0.07,2025-11-13,31.98,3.06,0,,30.38,33.5,False,False
13-11-2025 10:00,OSTIM,3.36,3.4,3.36,3.39,3995239.0,0.01,0.03,0.0,900.0,0.03,1441881.4,177.09,0.33,True,45.93,-0.02,-0.02,-0.0,2025-11-13,3.36,0.89,1,3.4,3.33,3.4,False,False
12-11-2025 17:00,BUCIM,6.17,6.32,6.17,6.31,1449957.0,0.01,0.14,0.01,1066.67,0.14,503921.3,187.73,0.07,True,53.18,-0.04,-0.05,0.02,2025-11-12,6.15,2.6,0,,6.07,ATH,False,False
12-11-2025 17:00,DMRGD,26.56,27.02,26.5,26.96,431163.0,0.06,0.4,0.02,2400.0,0.4,271837.3,58.61,0.15,True,59.63,0.18,0.17,0.02,2025-11-12,27.0,-0.15,0,,24.82,27.5,False,False
12-11-2025 16:00,SKTAS,5.13,5.6,5.06,5.55,11335071.0,0.05,0.42,0.03,1172.73,0.42,2404945.5,371.32,0.12,True,66.82,-0.01,-0.04,0.03,2025-11-12,5.1,8.82,0,,4.97,5.81,False,False
12-11-2025 14:00,IZFAS,139.6,148.0,139.6,146.5,494459.0,1.5,6.9,0.73,845.21,6.9,117594.5,320.48,0.22,True,72.32,0.06,-0.72,0.78,2025-11-12,137.5,6.55,1,148.0,136.3,148.0,False,False
12-11-2025 13:00,ONCSM,247.7,259.5,247.5,257.75,775868.0,1.75,10.05,1.94,419.38,10.05,319826.5,142.59,0.17,True,78.16,5.2,3.03,2.16,2025-11-12,236.0,9.22,1,259.5,219.1,259.5,False,False
12-11-2025 11:00,PENGD,8.6,8.94,8.6,8.91,2063898.0,0.03,0.31,0.01,4328.57,0.31,705918.8,192.37,0.1,True,60.17,-0.04,-0.04,0.01,2025-11-12,8.55,4.21,0,,8.34,8.95,False,False
12-11-2025 11:00,ALTIN,72.59,73.4,72.15,73.25,7856716.0,0.15,0.66,0.11,494.59,0.66,4619779.9,70.07,0.23,True,67.72,0.72,0.77,-0.05,2025-11-12,73.64,-0.53,2,72.15,72.15,73.96,False,False
12-11-2025 11:00,BINHO,10.28,10.91,10.27,10.89,16737395.0,0.02,0.61,0.04,1286.36,0.61,4782648.2,249.96,0.03,True,61.03,-0.11,-0.15,0.04,2025-11-12,10.27,6.04,0,,10.0,ATH,True,True
12-11-2025 10:00,LINK,312.5,327.0,311.0,326.0,461119.0,1.0,13.5,0.75,1700.0,13.5,164991.7,179.48,0.07,True,58.29,-1.57,-0.96,-0.61,2025-11-12,312.0,4.49,0,,308.5,341.5,True,True
12-11-2025 10:00,VRGYO,3.05,3.14,3.05,3.12,6631727.0,0.02,0.07,0.0,6900.0,0.07,3568837.6,85.82,0.29,True,46.22,-0.04,-0.04,0.0,2025-11-12,3.03,2.97,1,3.14,2.96,3.14,False,False
12-11-2025 10:00,FORMT,4.01,4.15,4.01,4.11,19120539.0,0.04,0.1,0.0,3233.33,0.1,7188440.2,165.99,0.4,True,56.61,-0.0,0.01,-0.01,2025-11-12,3.97,3.53,1,4.15,3.95,4.15,False,False
11-11-2025 17:00,DCTTR,29.12,29.9,29.04,29.84,710432.0,0.06,0.72,0.06,1185.71,0.72,447056.3,58.91,0.08,True,50.97,-0.29,-0.32,0.03,2025-11-11,29.34,1.7,0,,27.86,ATH,False,False
11-11-2025 16:00,SKBNK,8.24,8.52,8.14,8.5,18709150.0,0.02,0.26,0.01,1900.0,0.26,7622787.1,145.44,0.08,True,63.33,0.02,0.02,-0.0,2025-11-11,8.41,1.07,0,,8.01,ATH,False,False
11-11-2025 15:00,MHRGY,3.86,4.14,3.74,4.14,4918476.0,0.0,0.28,0.01,3400.0,0.28,2630073.0,87.01,0.0,True,63.22,-0.0,0.01,-0.01,2025-11-11,4.0,3.5,2,3.74,3.74,4.21,False,False
11-11-2025 12:00,KLYPV,58.3,60.85,58.2,60.75,432308.0,0.1,2.45,0.15,1533.33,2.45,143530.6,201.2,0.04,True,63.9,-0.17,-0.22,0.05,2025-11-11,58.75,3.4,0,,ATL,ATH,False,False
11-11-2025 10:00,LIDFA,4.31,4.6,4.3,4.52,21009779.0,0.08,0.21,0.02,1300.0,0.21,3255589.8,545.34,0.38,True,79.66,0.04,0.02,0.02,2025-11-11,4.22,7.11,1,4.6,4.11,4.6,False,False
11-11-2025 10:00,LRSHO,5.88,6.08,5.81,6.07,11001708.0,0.01,0.19,0.02,955.56,0.19,3025670.3,263.61,0.05,True,58.58,-0.02,-0.03,0.01,2025-11-11,5.87,3.41,0,,ATL,6.19,False,False
11-11-2025 10:00,BMSCH,20.0,20.94,19.83,20.7,868711.0,0.24,0.7,0.07,900.0,0.7,256622.2,238.52,0.34,True,47.48,-0.27,-0.29,0.02,2025-11-11,20.0,3.5,1,20.94,19.4,20.94,False,False
11-11-2025 10:00,YAYLA,32.06,34.2,32.06,33.72,1214426.0,0.48,1.66,0.07,2415.15,1.66,302015.6,302.11,0.29,True,72.09,0.34,0.27,0.07,2025-11-11,32.34,4.27,1,34.2,30.66,34.2,False,False
10-11-2025 16:00,AVHOL,43.34,44.62,43.34,44.28,371163.0,0.34,0.94,0.13,646.03,0.94,157386.0,135.83,0.36,True,63.64,-0.02,-0.11,0.09,2025-11-10,42.88,3.26,0,,42.6,ATH,False,False
10-11-2025 15:00,GWIND,24.64,25.1,24.58,25.08,716022.0,0.02,0.44,0.03,1366.67,0.44,358511.7,99.72,0.05,True,60.33,-0.04,-0.06,0.02,2025-11-10,24.58,2.03,0,,24.36,25.18,False,False
10-11-2025 14:00,KCAER,12.04,12.35,12.0,12.34,2995748.0,0.01,0.3,0.01,3233.33,0.3,1525384.8,96.39,0.03,True,56.03,-0.06,-0.06,0.0,2025-11-10,12.08,2.15,0,,11.85,ATH,False,False
10-11-2025 13:00,BORSK,23.48,24.38,23.44,24.32,1240383.0,0.06,0.84,0.15,460.0,0.84,407706.7,204.23,0.07,True,59.94,-0.1,-0.14,0.04,2025-11-10,23.52,3.4,0,,22.62,ATH,False,False
10-11-2025 12:00,ONRYT,82.55,84.45,82.35,84.05,101352.0,0.4,1.5,0.14,1011.11,1.5,61790.8,64.02,0.27,True,53.61,-0.06,-0.08,0.02,2025-11-10,83.9,0.18,0,,81.95,85.0,False,False
10-11-2025 10:00,KFEIN,9.51,10.05,9.51,10.0,2797530.0,0.05,0.49,0.03,1431.25,0.49,863014.8,224.16,0.1,True,66.72,-0.01,-0.02,0.01,2025-11-10,9.51,5.15,2,9.51,9.51,ATH,False,False
10-11-2025 10:00,KTLEV,13.88,16.19,13.85,16.19,83903616.0,0.0,2.31,0.28,719.15,2.31,16461085.5,409.71,0.0,True,71.83,0.11,0.05,0.06,2025-11-10,14.72,9.99,1,16.19,13.82,ATH,False,False
10-11-2025 10:00,SAYAS,52.2,54.0,51.55,53.65,337440.0,0.35,1.45,0.24,491.84,1.45,166690.5,102.44,0.24,True,63.46,0.17,0.06,0.11,2025-11-10,52.55,2.09,0,,50.8,ATH,False,False
07-11-2025 17:00,EGSER,3.39,3.41,3.37,3.41,1011322.0,0.0,0.02,0.0,1900.0,0.02,483670.2,109.09,0.0,True,48.01,-0.0,-0.0,-0.0,2025-11-07,3.42,-0.29,2,3.37,3.37,3.45,False,False
07-11-2025 15:00,POLHO,18.39,18.85,18.38,18.76,1441272.0,0.09,0.37,0.0,5.20728706914714e+16,0.37,491128.1,193.46,0.24,True,51.65,-0.03,-0.03,-0.01,2025-11-07,18.71,0.27,0,,ATL,ATH,False,False
07-11-2025 12:00,BESLR,14.18,14.69,14.16,14.64,1412059.0,0.05,0.46,0.03,1252.94,0.46,572210.1,146.77,0.11,True,65.17,0.02,0.02,0.01,2025-11-07,14.39,1.74,2,14.16,14.16,ATH,False,False
07-11-2025 12:00,LILAK,29.98,30.64,29.98,30.46,672193.0,0.18,0.48,0.02,1900.0,0.48,369266.4,82.03,0.37,True,53.5,-0.03,-0.01,-0.01,2025-11-07,30.46,0.0,0,,29.96,ATH,False,False
07-11-2025 12:00,FORTE,76.85,80.0,76.5,79.2,327177.0,0.8,2.35,0.09,2664.71,2.35,122876.7,166.26,0.34,True,59.84,-0.02,-0.02,0.01,2025-11-07,78.1,1.41,2,76.5,76.5,ATH,False,False
07-11-2025 11:00,DMLKT,5.96,5.97,5.96,5.97,2317933.0,0.0,0.01,0.0,900.0,0.01,1127417.9,105.6,0.0,True,52.58,0.0,-0.0,0.0,2025-11-07,5.96,0.17,1,5.97,ATL,ATH,False,False
