Tarih,Hisse,open,high,low,close,volume,YuksekKapanis_Fark,AcilisKapanis_Fark,AcilisKapanisFark_Ort,AcilisKapanisFark_OrtalamayaGoreDegisim,AcilisKapanisFarkOrt_MaxSon10,HacimOrtalama,%Hacim_HacimOrtalama,Fark_Orani,Kosul,rsi,MACD_12_26_9,MACDs_12_26_9,MACDh_12_26_9,Tarih1,prev_close,%Deg,isPivot,pointpos,destek,direnc,Tsinyal_Banker_Dip,Tsinyal_Banker_DipKarar
12-01-2026 10:00,OBAMS,8.5,8.69,8.5,8.65,16884008.0,0.04,0.15,0.03,400.0,0.15,6626051.5,154.81,0.27,True,73.72,0.11,0.09,0.02,2026-01-12,8.47,2.13,0,,7.8,ATH,False,False
12-01-2026 10:00,MGROS,594.0,600.0,588.0,599.0,950680.0,1.0,5.0,0.4,1150.0,5.0,253533.4,274.97,0.2,True,77.84,6.02,6.32,-0.3,2026-01-12,592.0,1.18,0,,574.5,ATH,False,False
12-01-2026 10:00,CELHA,10.46,11.13,10.42,11.13,1787936.0,0.0,0.67,0.09,679.07,0.67,348023.1,413.74,0.0,True,72.37,0.06,0.0,0.06,2026-01-12,10.54,5.6,0,,10.2,11.49,False,False
12-01-2026 10:00,MOBTL,9.32,9.69,9.32,9.63,5440669.0,0.06,0.31,0.04,715.79,0.31,960770.6,466.28,0.19,True,71.53,0.05,0.02,0.03,2026-01-12,9.3,3.55,0,,9.0,ATH,False,False
12-01-2026 10:00,BURCE,79.05,82.85,78.3,82.45,1614007.0,0.4,3.4,0.57,501.77,3.4,511601.0,215.48,0.12,True,82.11,3.67,3.21,0.45,2026-01-12,77.55,6.32,0,,60.9,ATH,False,False
12-01-2026 10:00,BULGS,43.06,44.24,42.78,44.1,2712399.0,0.14,1.04,0.02,5100.0,1.04,629060.4,331.18,0.13,True,56.95,-0.21,-0.28,0.07,2026-01-12,43.0,2.56,0,,42.4,47.8,True,True
12-01-2026 10:00,MOPAS,37.06,39.04,37.04,38.7,2490635.0,0.34,1.64,0.11,1447.17,1.64,573921.3,333.97,0.21,True,61.8,-0.17,-0.24,0.07,2026-01-12,36.98,4.65,0,,36.96,39.8,True,True
12-01-2026 10:00,BSOKE,17.74,18.56,17.61,18.41,6809291.0,0.15,0.67,0.05,1213.73,0.67,1392670.7,388.94,0.22,True,70.61,0.22,0.22,-0.0,2026-01-12,17.69,4.07,0,,16.95,ATH,False,False
12-01-2026 10:00,ONRYT,71.95,74.6,71.95,73.85,685322.0,0.75,1.9,0.51,272.55,1.9,181447.0,277.7,0.39,True,75.14,1.26,0.98,0.28,2026-01-12,71.55,3.21,0,,66.9,ATH,False,False
12-01-2026 10:00,OYAKC,24.32,24.58,24.28,24.54,6865889.0,0.04,0.22,0.02,900.0,0.22,2465149.5,178.52,0.18,True,70.03,0.2,0.14,0.06,2026-01-12,24.22,1.32,0,,23.1,ATH,False,False
12-01-2026 10:00,ESCOM,3.54,3.62,3.52,3.61,9143353.0,0.01,0.07,0.01,400.0,0.07,2864683.7,219.17,0.14,True,73.12,0.03,0.01,0.02,2026-01-12,3.5,3.14,0,,3.28,3.95,False,False
12-01-2026 10:00,BIMAS,612.0,632.0,604.0,627.5,2885468.0,4.5,15.5,2.05,656.1,15.5,713642.8,304.33,0.29,True,85.03,9.24,7.2,2.04,2026-01-12,604.5,3.8,0,,575.0,ATH,False,False
12-01-2026 10:00,SAFKR,24.6,25.14,24.48,25.08,2565275.0,0.06,0.48,0.09,445.45,0.48,547458.3,368.58,0.13,True,67.85,0.17,0.05,0.12,2026-01-12,24.04,4.33,0,,23.3,25.48,False,False
12-01-2026 10:00,SAHOL,91.75,92.95,91.5,92.8,10088955.0,0.15,1.05,0.06,1650.0,1.05,3513638.6,187.14,0.14,True,66.04,0.31,0.15,0.16,2026-01-12,91.3,1.64,0,,89.1,ATH,False,False
12-01-2026 10:00,AZTEK,4.15,4.23,4.14,4.21,1437081.0,0.02,0.06,0.0,1400.0,0.06,424263.1,238.72,0.33,True,61.3,-0.0,-0.01,0.01,2026-01-12,4.15,1.45,0,,4.08,4.3,False,False
12-01-2026 10:00,SILVR,2.76,2.8,2.73,2.79,947604.0,0.01,0.03,0.0,900.0,0.03,315414.2,200.43,0.33,True,52.14,-0.01,-0.02,0.0,2026-01-12,2.76,1.09,0,,2.73,3.02,False,False
12-01-2026 10:00,EUPWR,34.24,36.74,34.24,36.58,9588005.0,0.16,2.34,0.2,1093.88,2.34,1780004.1,438.65,0.07,True,76.78,0.35,0.19,0.16,2026-01-12,34.08,7.34,0,,32.4,ATH,False,False
12-01-2026 10:00,MHRGY,3.39,3.53,3.39,3.52,2391108.0,0.01,0.13,0.01,828.57,0.13,537737.1,344.66,0.08,True,74.72,0.03,0.02,0.01,2026-01-12,3.41,3.23,0,,3.27,ATH,False,False
12-01-2026 10:00,GWIND,24.1,24.5,24.04,24.44,1753057.0,0.06,0.34,0.02,1600.0,0.34,383029.8,357.68,0.18,True,67.33,0.1,0.08,0.02,2026-01-12,23.9,2.26,0,,23.5,ATH,False,False
12-01-2026 10:00,ASELS,285.75,291.25,284.25,291.0,19262828.0,0.25,5.25,1.65,218.18,5.25,5761117.9,234.36,0.05,True,87.0,7.38,6.0,1.39,2026-01-12,280.0,3.93,0,,260.25,ATH,False,False
12-01-2026 10:00,CWENE,27.72,28.5,27.6,28.28,6476111.0,0.22,0.56,0.02,3400.0,0.56,1466121.3,341.72,0.39,True,54.22,-0.09,-0.08,-0.01,2026-01-12,27.74,1.95,0,,27.96,28.92,True,True
12-01-2026 10:00,ISDMR,36.84,37.38,36.78,37.32,581376.0,0.06,0.48,0.0,11900.0,0.48,213986.0,171.69,0.13,True,67.07,0.15,0.15,0.0,2026-01-12,36.72,1.63,0,,36.06,ATH,False,False
12-01-2026 10:00,EDIP,34.94,35.5,34.9,35.34,226826.0,0.16,0.4,0.02,2122.22,0.4,78671.3,188.32,0.4,True,56.48,0.03,0.02,0.0,2026-01-12,35.02,0.91,0,,34.66,35.78,False,False
12-01-2026 10:00,IHLAS,2.27,2.35,2.27,2.34,64524187.0,0.01,0.07,0.0,1300.0,0.07,8971990.4,619.17,0.14,True,69.63,-0.0,-0.01,0.01,2026-01-12,2.26,3.54,0,,2.24,2.49,False,False
12-01-2026 10:00,KCAER,10.43,10.6,10.42,10.59,2681377.0,0.01,0.16,0.01,1900.0,0.16,776717.4,245.22,0.06,True,60.94,-0.01,-0.03,0.01,2026-01-12,10.42,1.63,0,,10.17,10.92,False,False
12-01-2026 10:00,ECILC,91.95,95.7,91.9,95.4,2389966.0,0.3,3.45,0.28,1132.14,3.45,567626.6,321.05,0.09,True,78.38,1.52,1.45,0.07,2026-01-12,91.1,4.72,0,,83.2,ATH,False,False
12-01-2026 10:00,KCHOL,184.5,186.2,183.8,185.9,9961827.0,0.3,1.4,0.09,1455.56,1.4,3293018.4,202.51,0.21,True,67.36,0.63,0.46,0.16,2026-01-12,184.0,1.03,0,,180.7,186.1,False,False
12-01-2026 10:00,KLKIM,36.26,37.18,36.24,37.04,835404.0,0.14,0.78,0.12,550.0,0.78,248580.0,236.07,0.18,True,76.46,0.27,0.15,0.12,2026-01-12,36.24,2.21,0,,35.0,ATH,False,False
12-01-2026 10:00,KNFRT,11.05,11.26,10.94,11.21,789413.0,0.05,0.16,0.0,7900.0,0.16,182659.8,332.18,0.31,True,49.63,-0.1,-0.12,0.03,2026-01-12,11.0,1.91,0,,11.0,11.24,True,True
12-01-2026 10:00,IHGZT,1.55,1.57,1.54,1.57,7501543.0,0.0,0.02,0.0,900.0,0.02,1718249.1,336.58,0.0,True,58.82,-0.0,-0.0,0.0,2026-01-12,1.54,1.95,0,,1.52,1.59,False,False
12-01-2026 10:00,DOAS,213.0,216.3,212.8,216.1,950467.0,0.2,3.1,0.44,604.55,3.1,308374.8,208.22,0.06,True,83.33,3.02,2.81,0.22,2026-01-12,212.6,1.65,0,,201.5,ATH,False,False
12-01-2026 10:00,KRONT,15.12,15.67,15.12,15.55,1529585.0,0.12,0.43,0.05,795.83,0.43,432104.5,253.98,0.28,True,71.32,0.28,0.26,0.02,2026-01-12,15.12,2.84,0,,13.59,ATH,False,False
12-01-2026 10:00,KRSTL,9.93,10.09,9.92,10.09,910881.0,0.0,0.16,0.01,1042.86,0.16,299133.4,204.51,0.0,True,68.87,0.03,0.0,0.03,2026-01-12,9.86,2.33,0,,9.57,10.17,False,False
12-01-2026 10:00,KTLEV,28.44,30.3,28.44,29.82,42643130.0,0.48,1.38,0.36,287.64,1.38,14497842.1,194.13,0.35,True,88.9,1.26,1.1,0.16,2026-01-12,28.4,5.0,0,,19.21,ATH,False,False
12-01-2026 10:00,HKTM,11.15,11.32,11.15,11.29,339930.0,0.03,0.14,0.01,1172.73,0.14,153201.1,121.88,0.21,True,52.67,-0.01,-0.02,0.0,2026-01-12,11.25,0.36,0,,11.11,11.56,False,False
12-01-2026 10:00,LMKDC,28.98,29.6,28.98,29.46,1551444.0,0.14,0.48,0.09,433.33,0.48,468156.4,231.39,0.29,True,77.48,0.23,0.12,0.12,2026-01-12,28.9,1.94,0,,27.0,ATH,False,False
12-01-2026 10:00,ASTOR,131.4,134.0,130.7,133.9,13161680.0,0.1,2.5,0.4,525.0,2.5,4682884.2,181.06,0.04,True,85.28,3.17,2.43,0.74,2026-01-12,128.8,3.96,0,,115.1,ATH,False,False
12-01-2026 10:00,EREGL,24.76,25.04,24.72,25.0,49052380.0,0.04,0.24,0.01,2900.0,0.24,12398534.4,295.63,0.17,True,66.05,0.03,0.01,0.03,2026-01-12,24.66,1.38,0,,24.26,25.22,False,False
12-01-2026 10:00,EKSUN,5.35,5.43,5.35,5.41,526046.0,0.02,0.06,0.01,1100.0,0.06,176956.3,197.27,0.33,True,62.87,0.02,0.01,0.01,2026-01-12,5.36,0.93,0,,5.22,5.43,False,False
12-01-2026 10:00,XU100,12267.53,12349.94,12228.02,12340.83,1973892788.0,9.11,73.3,17.06,329.76,73.3,899505659.6,119.44,0.12,True,77.68,82.3,71.21,11.09,2026-01-12,12200.95,1.15,0,,11907.78,ATH,False,False
12-01-2026 10:00,ALTNY,16.52,17.49,16.52,17.35,22854887.0,0.14,0.83,0.17,382.56,0.83,7258463.2,214.87,0.17,True,85.66,0.35,0.23,0.12,2026-01-12,16.4,5.79,0,,15.22,ATH,False,False
12-01-2026 10:00,AKSUE,21.58,23.22,21.4,22.8,1482998.0,0.42,1.22,0.08,1352.38,1.22,264079.2,461.57,0.34,True,55.59,-0.32,-0.41,0.09,2026-01-12,21.7,5.07,0,,21.7,26.3,True,True
12-01-2026 10:00,ULKER,115.2,117.4,115.0,117.0,1584370.0,0.4,1.8,0.03,5900.0,1.8,657355.8,141.02,0.22,True,61.65,0.07,0.03,0.04,2026-01-12,114.6,2.09,0,,113.5,117.1,False,False
12-01-2026 10:00,VESBE,7.85,7.92,7.83,7.9,1435365.0,0.02,0.05,0.01,733.33,0.05,489927.9,192.97,0.4,True,55.92,-0.01,-0.02,0.01,2026-01-12,7.82,1.02,0,,7.75,7.91,False,False
12-01-2026 10:00,XBANK,17318.6,17469.17,17274.6,17435.39,232543146.0,33.78,116.79,2.97,3827.03,116.79,104198824.4,123.17,0.29,True,61.65,19.09,3.21,15.88,2026-01-12,17245.26,1.1,0,,17054.32,17448.57,False,False
12-01-2026 10:00,XU030,13332.66,13463.36,13295.47,13461.41,1361418247.0,1.95,128.75,22.17,480.69,128.75,591571710.1,130.14,0.02,True,77.81,90.07,72.88,17.19,2026-01-12,13248.85,1.6,0,,12929.65,ATH,False,False
12-01-2026 10:00,AKBNK,74.1,75.05,74.0,74.85,20820588.0,0.2,0.75,0.07,900.0,0.75,9616047.2,116.52,0.27,True,68.21,0.35,0.19,0.16,2026-01-12,73.8,1.42,0,,71.7,75.05,False,False
12-01-2026 10:00,YEOTK,36.16,36.72,36.12,36.66,1571855.0,0.06,0.5,0.02,2677.78,0.5,392972.4,299.99,0.12,True,59.22,-0.07,-0.13,0.06,2026-01-12,36.1,1.55,0,,34.8,36.74,False,False
12-01-2026 10:00,ARDYZ,41.24,42.34,40.68,42.18,3530680.0,0.16,0.94,0.07,1205.56,0.94,812490.3,334.55,0.17,True,80.14,0.87,0.66,0.21,2026-01-12,40.04,5.34,0,,37.2,ATH,False,False
12-01-2026 10:00,SOKM,54.25,55.45,53.95,55.15,2496751.0,0.3,0.9,0.1,800.0,0.9,641655.2,289.11,0.33,True,77.75,0.54,0.44,0.11,2026-01-12,53.85,2.41,0,,51.9,ATH,False,False
12-01-2026 10:00,YUNSA,7.56,7.7,7.55,7.69,1484046.0,0.01,0.13,0.01,1200.0,0.13,422454.8,251.29,0.08,True,64.22,0.0,-0.01,0.02,2026-01-12,7.54,1.99,0,,7.36,7.81,False,False
12-01-2026 10:00,GESAN,47.8,49.78,47.7,49.36,4211017.0,0.42,1.56,0.12,1158.06,1.56,654025.2,543.86,0.27,True,74.27,0.28,0.18,0.1,2026-01-12,47.78,3.31,0,,45.8,ATH,False,False
12-01-2026 10:00,GENIL,171.5,175.5,171.0,175.3,372924.0,0.2,3.8,0.09,4122.22,3.8,130009.7,186.84,0.05,True,45.17,-2.38,-2.41,0.03,2026-01-12,171.0,2.51,0,,174.9,180.5,True,True
09-01-2026 17:00,PASEU,152.9,159.0,150.9,159.0,1020370.0,0.0,6.1,0.9,577.78,6.1,478592.4,113.2,0.0,True,79.76,5.42,4.45,0.97,2026-01-09,149.8,6.14,0,,131.0,ATH,False,False
09-01-2026 17:00,DZGYO,7.83,7.92,7.82,7.91,975152.0,0.01,0.08,0.0,3900.0,0.08,588578.3,65.68,0.12,True,58.54,0.01,-0.01,0.02,2026-01-09,7.89,0.25,0,,7.46,8.03,False,False
09-01-2026 17:00,IHEVA,2.18,2.2,2.18,2.2,386183.0,0.0,0.02,0.0,4.50359962737049e+16,0.02,167161.2,131.02,0.0,True,43.56,-0.01,-0.01,0.0,2026-01-09,2.2,0.0,0,,2.18,2.28,True,True
09-01-2026 17:00,LILAK,29.24,30.3,29.16,30.06,4015657.0,0.24,0.82,0.12,572.13,0.82,838464.4,378.93,0.29,True,80.39,0.19,0.05,0.14,2026-01-09,28.68,4.81,0,,28.0,ATH,False,False
09-01-2026 17:00,CEMZY,52.6,56.0,52.4,55.45,7848850.0,0.55,2.85,0.42,586.75,2.85,1165929.5,573.18,0.19,True,73.65,0.43,0.2,0.22,2026-01-09,51.15,8.41,0,,50.0,ATH,False,False
09-01-2026 17:00,ALBRK,8.18,8.28,8.15,8.26,5272040.0,0.02,0.08,0.01,566.67,0.08,1790182.8,194.5,0.25,True,62.06,0.01,-0.0,0.01,2026-01-09,8.12,1.72,0,,8.04,8.33,False,False
09-01-2026 17:00,BTCIM,3.72,3.77,3.72,3.76,17121305.0,0.01,0.04,0.0,1900.0,0.04,10058805.0,70.21,0.25,True,57.75,0.0,-0.0,0.01,2026-01-09,3.73,0.8,0,,3.6,3.78,False,False
09-01-2026 17:00,TSKB,13.39,13.55,13.37,13.54,5260967.0,0.01,0.15,0.01,1775.0,0.15,2785655.2,88.86,0.07,True,58.36,0.02,0.03,-0.01,2026-01-09,13.47,0.52,0,,13.31,13.61,False,False
09-01-2026 17:00,SASA,2.32,2.36,2.31,2.36,865576492.0,0.0,0.04,0.0,9.00719925474099e+16,0.04,462311744.2,87.23,0.0,True,21.98,-0.12,-0.11,-0.0,2026-01-09,2.53,-6.72,0,,ATL,2.95,False,False
09-01-2026 17:00,RALYH,230.6,233.9,230.5,233.5,188736.0,0.4,2.9,0.21,1280.95,2.9,75346.0,150.49,0.14,True,58.05,-0.37,-0.49,0.12,2026-01-09,231.2,0.99,0,,224.9,236.2,False,False
09-01-2026 17:00,TAVHL,322.25,325.5,321.5,324.75,502563.0,0.75,2.5,0.18,1328.57,2.5,228536.5,119.9,0.3,True,64.56,2.08,2.16,-0.08,2026-01-09,322.5,0.7,0,,309.25,ATH,False,False
09-01-2026 17:00,PRDGS,6.3,6.68,6.2,6.68,4488182.0,0.0,0.38,0.04,874.36,0.38,957976.9,368.51,0.0,True,75.59,0.04,0.02,0.02,2026-01-09,6.24,7.05,0,,6.16,ATH,False,False
09-01-2026 16:00,BESLR,12.55,12.64,12.55,12.64,518396.0,0.0,0.09,0.01,1700.0,0.09,229685.4,125.7,0.0,True,61.44,0.02,0.0,0.01,2026-01-09,12.54,0.8,0,,12.3,12.7,False,False
09-01-2026 16:00,VESTL,29.0,29.3,28.82,29.26,568957.0,0.04,0.26,0.0,7.318349394477091e+16,0.26,322910.8,76.2,0.15,True,55.5,-0.09,-0.13,0.04,2026-01-09,28.98,0.97,0,,28.5,30.2,False,False
09-01-2026 16:00,A1YEN,28.8,29.02,28.76,28.96,138291.0,0.06,0.16,0.01,2566.67,0.16,87589.5,57.89,0.37,True,54.0,-0.04,-0.07,0.03,2026-01-09,28.86,0.35,0,,28.36,29.18,False,False
09-01-2026 16:00,BRKVY,103.4,108.7,103.4,107.2,666268.0,1.5,3.8,0.47,708.51,3.8,169796.7,292.39,0.39,True,68.51,0.43,-0.08,0.51,2026-01-09,101.3,5.82,0,,100.3,108.2,False,False
09-01-2026 15:00,INVEO,8.49,8.56,8.47,8.55,710195.0,0.01,0.06,0.0,2900.0,0.06,320192.2,121.8,0.17,True,49.61,-0.01,0.01,-0.02,2026-01-09,8.56,-0.12,0,,8.46,8.78,False,False
09-01-2026 15:00,GLYHO,11.99,12.37,11.96,12.34,2950964.0,0.03,0.35,0.05,660.87,0.35,837663.1,252.29,0.09,True,77.06,0.06,0.02,0.04,2026-01-09,11.91,3.61,0,,11.69,ATH,False,False
09-01-2026 15:00,ISFIN,17.84,18.06,17.8,18.04,466219.0,0.02,0.2,0.05,334.78,0.2,302305.2,54.22,0.1,True,70.5,0.19,0.14,0.04,2026-01-09,17.53,2.91,0,,16.96,19.0,False,False
09-01-2026 15:00,GLRYH,3.94,3.98,3.94,3.98,1087085.0,0.0,0.04,0.0,700.0,0.04,637837.5,70.43,0.0,True,55.29,-0.0,-0.0,0.0,2026-01-09,3.93,1.27,0,,3.91,4.09,False,False
09-01-2026 14:00,SMRVA,106.1,114.6,105.8,114.6,2868985.0,0.0,8.5,1.33,539.1,8.5,1056956.1,171.44,0.0,True,69.23,1.5,0.11,1.39,2026-01-09,104.2,9.98,0,,91.85,173.4,False,False
09-01-2026 14:00,MEKAG,3.82,3.86,3.82,3.86,1457223.0,0.0,0.04,0.01,400.0,0.04,871794.3,67.15,0.0,True,53.65,-0.02,-0.03,0.01,2026-01-09,3.8,1.58,0,,3.74,4.41,True,False
09-01-2026 14:00,KRVGD,2.83,2.89,2.82,2.88,3217225.0,0.01,0.05,0.01,316.67,0.05,1427156.7,125.43,0.2,True,70.87,0.02,0.01,0.01,2026-01-09,2.78,3.6,0,,2.72,ATH,False,False
09-01-2026 14:00,TRILC,16.38,17.48,16.31,17.37,2223175.0,0.11,0.99,0.09,942.11,0.99,418208.3,431.6,0.11,True,71.55,0.06,0.02,0.04,2026-01-09,16.58,4.76,0,,16.2,ATH,False,False
09-01-2026 14:00,ZERGY,9.51,10.08,9.5,10.03,16458490.0,0.05,0.52,0.08,575.32,0.52,4174766.9,294.24,0.1,True,74.58,0.01,-0.07,0.07,2026-01-09,9.31,7.73,0,,9.24,10.24,False,False
09-01-2026 13:00,MNDRS,13.69,14.05,13.69,14.04,2195449.0,0.01,0.35,0.07,430.3,0.35,426506.6,414.75,0.03,True,73.26,0.04,0.0,0.04,2026-01-09,13.52,3.85,0,,13.33,ATH,False,False
09-01-2026 13:00,ARSAN,3.53,3.71,3.52,3.69,16402202.0,0.02,0.16,0.02,788.89,0.16,4419406.1,271.14,0.12,True,65.3,-0.01,-0.03,0.02,2026-01-09,3.47,6.34,0,,3.46,3.71,True,False
09-01-2026 13:00,ANELE,16.68,17.7,16.66,17.61,2009133.0,0.09,0.93,0.12,644.0,0.93,356843.6,463.03,0.1,True,79.7,0.24,0.16,0.08,2026-01-09,16.49,6.79,0,,16.12,ATH,False,False
09-01-2026 13:00,BEGYO,4.83,4.96,4.81,4.95,2721648.0,0.01,0.12,0.02,500.0,0.12,955852.4,184.74,0.08,True,64.33,-0.0,-0.02,0.02,2026-01-09,4.78,3.56,0,,4.74,5.13,True,False
09-01-2026 12:00,TUKAS,2.66,2.75,2.66,2.74,112600484.0,0.01,0.08,0.02,344.44,0.08,26391851.0,326.65,0.12,True,80.59,0.02,0.0,0.01,2026-01-09,2.59,5.79,0,,2.53,ATH,False,False
09-01-2026 12:00,TKNSA,22.82,23.28,22.82,23.26,1013674.0,0.02,0.44,0.08,423.81,0.44,363687.3,178.72,0.05,True,79.49,0.16,0.07,0.09,2026-01-09,22.38,3.93,0,,22.02,ATH,False,False
09-01-2026 12:00,CVKMD,29.34,30.46,29.26,30.4,5053954.0,0.06,1.06,0.1,919.23,1.06,2088133.8,142.03,0.06,True,73.17,0.36,0.29,0.06,2026-01-09,29.4,3.4,0,,28.36,ATH,False,False
09-01-2026 12:00,ORCAY,3.79,3.87,3.77,3.87,1358160.0,0.0,0.08,0.0,2566.67,0.08,600213.1,126.28,0.0,True,68.82,0.04,0.01,0.03,2026-01-09,3.64,6.32,0,,3.58,3.99,False,False
09-01-2026 12:00,KRDMB,25.18,25.62,25.06,25.54,1179120.0,0.08,0.36,0.04,900.0,0.36,556829.4,111.76,0.22,True,71.61,0.48,0.42,0.06,2026-01-09,25.0,2.16,0,,23.2,25.56,False,False
09-01-2026 12:00,INFO,3.85,4.04,3.85,4.01,18912528.0,0.03,0.16,0.01,1130.77,0.16,5387998.1,251.01,0.19,True,67.84,0.02,0.01,0.01,2026-01-09,3.78,6.08,0,,3.72,4.1,False,False
09-01-2026 12:00,POLHO,16.07,16.3,16.06,16.29,632133.0,0.01,0.22,0.04,436.59,0.22,232162.1,172.28,0.05,True,57.89,-0.01,-0.04,0.02,2026-01-09,16.08,1.31,0,,15.71,16.65,False,False
09-01-2026 11:00,SELEC,80.45,81.55,80.45,81.45,133331.0,0.1,1.0,0.04,2400.0,1.0,74289.2,79.48,0.1,True,59.18,0.2,0.16,0.04,2026-01-09,80.2,1.56,1,81.55,79.5,81.55,False,False
09-01-2026 11:00,BAHKM,89.7,93.95,89.2,93.75,864904.0,0.2,4.05,0.36,1025.0,4.05,345590.1,150.27,0.05,True,86.08,3.68,3.15,0.53,2026-01-09,87.1,7.63,1,93.95,74.45,93.95,False,False
09-01-2026 11:00,GARFA,27.54,28.6,27.36,28.4,530342.0,0.2,0.86,0.19,343.3,0.86,147799.7,258.82,0.23,True,70.93,0.09,-0.03,0.12,2026-01-09,27.06,4.95,1,28.6,26.36,28.6,False,False
09-01-2026 11:00,GUBRF,366.5,374.5,366.25,372.75,542880.0,1.75,6.25,1.08,481.4,6.25,228964.8,137.1,0.28,True,70.25,1.76,1.13,0.64,2026-01-09,365.0,2.12,0,,359.0,ATH,False,False
09-01-2026 11:00,ALKIM,18.48,19.4,18.48,19.27,2720132.0,0.13,0.79,0.12,569.49,0.79,490659.3,454.38,0.16,True,77.5,0.1,-0.02,0.12,2026-01-09,17.92,7.53,0,,17.66,ATH,False,False
09-01-2026 11:00,ALKA,11.93,12.58,11.91,12.5,6949581.0,0.08,0.57,0.07,702.82,0.57,1543888.8,350.13,0.14,True,69.74,0.13,0.1,0.04,2026-01-09,11.7,6.84,0,,11.06,ATH,False,False
09-01-2026 10:00,SUWEN,9.26,9.45,9.26,9.43,968721.0,0.02,0.17,0.03,448.39,0.17,489777.6,97.79,0.12,True,64.2,-0.01,-0.04,0.03,2026-01-09,9.24,2.06,0,,9.11,9.65,False,False
09-01-2026 10:00,DITAS,36.4,38.08,36.3,37.96,1820067.0,0.12,1.56,0.33,369.88,1.56,540708.3,236.61,0.08,True,83.41,0.88,0.56,0.32,2026-01-09,36.3,4.57,0,,32.4,ATH,False,False
09-01-2026 10:00,BMSCH,19.77,21.8,19.77,21.8,17967456.0,0.0,2.03,0.2,900.0,2.03,1991312.0,802.29,0.0,True,34.68,-1.57,-1.6,0.03,2026-01-09,21.96,-0.73,2,19.77,19.77,27.22,True,True
09-01-2026 10:00,EGPRO,25.6,26.22,25.5,26.06,324818.0,0.16,0.46,0.07,538.89,0.46,125060.6,159.73,0.35,True,61.22,-0.0,-0.02,0.02,2026-01-09,25.48,2.28,0,,24.9,26.88,False,False
09-01-2026 10:00,FRIGO,13.38,14.2,13.3,14.13,3170923.0,0.07,0.75,0.09,697.87,0.75,971133.7,226.52,0.09,True,66.06,0.11,0.08,0.03,2026-01-09,13.39,5.53,1,14.2,11.78,14.2,False,False
09-01-2026 10:00,TRENJ,97.7,99.5,97.4,99.2,1138004.0,0.3,1.5,0.29,417.24,1.5,443148.2,156.8,0.2,True,62.72,0.25,0.1,0.15,2026-01-09,97.65,1.59,0,,94.5,100.9,False,False
09-01-2026 10:00,ADESE,1.57,1.6,1.56,1.6,45200001.0,0.0,0.03,0.01,500.0,0.03,19762463.2,128.72,0.0,True,66.85,0.01,0.0,0.0,2026-01-09,1.56,2.56,0,,1.52,1.61,False,False
09-01-2026 10:00,ADGYO,51.2,52.95,51.1,52.8,640925.0,0.15,1.6,0.28,471.43,1.6,155452.6,312.3,0.09,True,71.54,0.66,0.63,0.04,2026-01-09,50.7,4.14,0,,47.34,53.0,False,False
09-01-2026 10:00,YKSLN,3.11,3.16,3.1,3.15,1456346.0,0.01,0.04,0.01,344.44,0.04,518505.5,180.87,0.25,True,55.89,-0.01,-0.02,0.01,2026-01-09,3.12,0.96,0,,3.06,3.19,False,False
09-01-2026 10:00,DURKN,15.4,16.3,15.4,16.05,1517421.0,0.25,0.65,0.08,712.5,0.65,381376.1,297.88,0.38,True,66.97,-0.02,-0.07,0.06,2026-01-09,15.43,4.02,1,16.3,15.06,16.3,True,True
09-01-2026 10:00,HEDEF,49.6,53.1,49.46,52.95,2497475.0,0.15,3.35,0.13,2537.8,3.35,917200.8,172.29,0.04,True,69.28,1.22,1.37,-0.16,2026-01-09,49.34,7.32,0,,40.8,ATH,False,False
09-01-2026 10:00,KIMMR,12.71,13.27,12.71,13.27,276296.0,0.0,0.56,0.13,317.91,0.56,177627.6,55.55,0.0,True,57.59,-0.08,-0.16,0.08,2026-01-09,13.01,2.0,0,,11.85,13.78,False,False
09-01-2026 10:00,MARBL,12.31,13.47,12.23,13.47,4291023.0,0.0,1.16,0.13,792.31,1.16,510836.3,740.0,0.0,True,84.62,0.06,-0.03,0.09,2026-01-09,12.25,9.96,1,13.47,12.06,ATH,False,False
09-01-2026 10:00,DAGI,6.47,7.05,6.46,6.91,10161060.0,0.14,0.44,0.04,973.17,0.44,2018666.9,403.35,0.32,True,50.3,-0.25,-0.29,0.04,2026-01-09,6.41,7.8,1,7.05,6.32,7.05,True,True
09-01-2026 10:00,MANAS,16.65,18.62,16.65,18.38,4604159.0,0.24,1.73,0.17,900.0,1.73,1106500.9,316.1,0.14,True,56.11,-0.48,-0.49,0.01,2026-01-09,16.95,8.44,0,,16.63,21.2,False,False
09-01-2026 10:00,BOBET,20.34,20.6,20.26,20.6,494515.0,0.0,0.26,0.06,348.28,0.26,249530.3,98.18,0.0,True,61.08,0.06,0.07,-0.01,2026-01-09,20.26,1.68,0,,20.0,21.58,False,False
09-01-2026 10:00,SARKY,23.1,24.94,23.1,24.76,10528569.0,0.18,1.66,0.26,543.41,1.66,2926976.6,259.71,0.11,True,68.34,0.59,0.62,-0.04,2026-01-09,23.02,7.56,0,,18.28,ATH,False,False
09-01-2026 10:00,FZLGY,14.75,15.72,14.75,15.64,8227178.0,0.08,0.89,0.12,647.9,0.89,1638719.0,402.05,0.09,True,82.84,0.3,0.25,0.05,2026-01-09,14.71,6.32,0,,12.85,ATH,False,False
09-01-2026 10:00,ANHYT,101.3,103.5,100.9,103.0,458153.0,0.5,1.7,0.23,639.13,1.7,142305.7,221.95,0.29,True,64.91,0.78,0.71,0.06,2026-01-09,101.3,1.68,1,103.5,95.6,103.5,False,False
09-01-2026 10:00,USAK,2.93,2.98,2.9,2.98,8869042.0,0.0,0.05,0.01,525.0,0.05,2733170.4,224.5,0.0,True,56.22,-0.02,-0.03,0.01,2026-01-09,2.92,2.05,0,,2.87,3.07,True,False
09-01-2026 10:00,GSDHO,4.55,4.63,4.55,4.61,3040146.0,0.02,0.06,0.01,445.45,0.06,703139.1,332.37,0.33,True,60.5,-0.02,-0.03,0.01,2026-01-09,4.5,2.44,1,4.63,4.42,4.63,False,False
08-01-2026 17:00,ZOREN,3.07,3.11,3.06,3.1,18513270.0,0.01,0.03,0.0,900.0,0.03,5123603.7,261.33,0.33,True,57.38,-0.01,-0.01,0.0,2026-01-08,3.07,0.98,1,3.11,3.02,3.11,False,False
08-01-2026 17:00,SEKUR,3.63,3.68,3.57,3.68,448025.0,0.0,0.05,0.0,1150.0,0.05,175573.7,155.18,0.0,True,49.55,-0.04,-0.03,-0.0,2026-01-08,3.65,0.82,0,,3.51,ATH,False,False
08-01-2026 17:00,LIDER,69.65,74.5,69.25,74.5,555168.0,0.0,4.85,0.5,860.4,4.85,249486.1,122.52,0.0,True,77.31,0.76,0.46,0.3,2026-01-08,69.3,7.5,1,74.5,67.65,ATH,False,False
08-01-2026 17:00,LIDFA,4.51,4.62,4.51,4.6,1654301.0,0.02,0.09,0.02,429.41,0.09,424979.0,289.27,0.22,True,68.4,0.01,0.0,0.01,2026-01-08,4.46,3.14,0,,4.42,4.67,False,False
08-01-2026 17:00,KONKA,14.98,15.38,14.98,15.32,656511.0,0.06,0.34,0.06,431.25,0.34,246730.2,166.08,0.18,True,54.94,-0.13,-0.16,0.03,2026-01-08,14.81,3.44,0,,14.65,15.79,False,False
08-01-2026 17:00,AVHOL,36.68,40.36,36.68,40.36,2464974.0,0.0,3.68,0.35,939.55,3.68,383316.1,543.07,0.0,True,77.15,0.04,-0.16,0.19,2026-01-08,36.7,9.97,0,,35.72,ATH,False,False
08-01-2026 16:00,KAREL,8.69,8.8,8.68,8.79,762489.0,0.01,0.1,0.01,1328.57,0.1,458924.1,66.15,0.1,True,64.24,0.01,0.01,0.01,2026-01-08,8.69,1.15,0,,8.6,8.9,False,False
08-01-2026 16:00,VRGYO,2.38,2.42,2.38,2.42,3744594.0,0.0,0.04,0.01,700.0,0.04,1519049.8,146.51,0.0,True,57.56,-0.01,-0.02,0.0,2026-01-08,2.36,2.54,0,,2.35,2.45,True,False
08-01-2026 16:00,ULUUN,6.64,6.71,6.62,6.7,241743.0,0.01,0.06,0.0,1400.0,0.06,147012.4,64.44,0.17,True,53.49,-0.02,-0.01,-0.0,2026-01-08,6.68,0.3,0,,6.6,6.81,False,False
08-01-2026 16:00,THYAO,290.75,295.75,290.25,294.75,14633029.0,1.0,4.0,0.3,1233.33,4.0,5815515.7,151.62,0.25,True,67.88,2.16,2.65,-0.49,2026-01-08,290.75,1.38,0,,286.5,295.25,False,False
08-01-2026 16:00,SOKE,10.78,10.9,10.78,10.9,246849.0,0.0,0.12,0.02,605.88,0.12,118605.9,108.13,0.0,True,66.67,0.03,0.04,-0.01,2026-01-08,10.8,0.93,0,,10.7,10.93,False,False
08-01-2026 16:00,SKTAS,3.67,3.76,3.67,3.75,1610512.0,0.01,0.08,0.0,1500.0,0.08,772019.7,108.61,0.12,True,51.07,-0.04,-0.04,0.0,2026-01-08,3.68,1.9,0,,3.6,3.91,True,True
08-01-2026 16:00,GSDDE,10.14,10.27,10.14,10.26,187582.0,0.01,0.12,0.01,823.08,0.12,75662.5,147.92,0.08,True,53.42,-0.02,-0.01,-0.01,2026-01-08,10.22,0.39,0,,10.07,10.47,False,False
08-01-2026 16:00,PGSUS,203.6,207.2,203.3,206.4,3823641.0,0.8,2.8,0.1,2700.0,2.8,1787721.9,113.88,0.29,True,61.11,0.5,1.0,-0.5,2026-01-08,205.1,0.63,0,,201.2,209.3,False,False
08-01-2026 16:00,PENTA,13.22,13.43,13.21,13.43,266678.0,0.0,0.21,0.01,4100.0,0.21,115777.5,130.34,0.0,True,54.54,-0.04,-0.02,-0.02,2026-01-08,13.39,0.3,0,,13.18,13.77,False,False
08-01-2026 16:00,PATEK,21.66,22.04,21.58,22.0,4680338.0,0.04,0.34,0.03,1114.29,0.34,2573953.5,81.83,0.12,True,59.28,-0.04,-0.11,0.07,2026-01-08,21.48,2.42,0,,21.18,22.36,False,False
08-01-2026 16:00,OFSYM,70.9,71.55,70.75,71.4,129071.0,0.15,0.5,0.07,669.23,0.5,70881.3,82.09,0.3,True,62.07,0.37,0.43,-0.06,2026-01-08,71.0,0.56,0,,66.1,71.9,False,False
08-01-2026 16:00,MERCN,16.13,16.61,16.11,16.54,989403.0,0.07,0.41,0.04,951.28,0.41,362049.5,173.28,0.17,True,58.0,-0.11,-0.15,0.04,2026-01-08,16.16,2.35,0,,15.86,17.6,True,False
08-01-2026 16:00,MARTI,2.67,2.72,2.66,2.72,1644279.0,0.0,0.05,0.0,4900.0,0.05,1074440.8,53.04,0.0,True,49.98,-0.02,-0.01,-0.01,2026-01-08,2.72,0.0,1,2.72,2.65,2.81,False,False
08-01-2026 16:00,FROTO,96.95,98.5,96.8,98.35,3015410.0,0.15,1.4,0.12,1066.67,1.4,1573354.6,91.65,0.11,True,59.22,0.16,0.28,-0.12,2026-01-08,97.55,0.82,0,,96.1,99.25,False,False
08-01-2026 16:00,INDES,7.51,7.58,7.5,7.58,717533.0,0.0,0.07,0.01,1066.67,0.07,370864.8,93.48,0.0,True,52.88,-0.03,-0.03,0.0,2026-01-08,7.57,0.13,1,7.58,7.44,7.74,True,True
08-01-2026 16:00,AKFIS,20.6,20.74,20.58,20.7,168801.0,0.04,0.1,0.01,733.33,0.1,109251.6,54.51,0.4,True,55.65,-0.01,-0.0,-0.01,2026-01-08,20.64,0.29,0,,20.36,21.02,False,False
08-01-2026 16:00,BEYAZ,28.7,30.38,28.66,30.3,601297.0,0.08,1.6,0.2,708.08,1.6,261931.7,129.56,0.05,True,63.46,0.05,0.04,0.01,2026-01-08,28.92,4.77,0,,28.26,30.86,False,False
08-01-2026 16:00,ENTRA,10.27,10.38,10.26,10.38,1408372.0,0.0,0.11,0.0,3566.67,0.11,786830.1,78.99,0.0,True,54.57,-0.02,-0.02,-0.0,2026-01-08,10.23,1.47,0,,10.18,10.49,True,True
08-01-2026 16:00,BJKAS,1.63,1.65,1.62,1.65,7578160.0,0.0,0.02,0.0,1900.0,0.02,2580197.6,193.7,0.0,True,56.93,-0.0,-0.0,0.0,2026-01-08,1.62,1.85,3,,1.62,1.66,True,True
08-01-2026 16:00,ENKAI,81.95,83.1,81.9,82.9,2138537.0,0.2,0.95,0.12,691.67,0.95,941136.4,127.23,0.21,True,69.31,0.19,0.15,0.03,2026-01-08,81.3,1.97,1,83.1,80.0,83.1,False,False
08-01-2026 16:00,DERHL,13.3,13.5,13.3,13.49,512890.0,0.01,0.19,0.02,850.0,0.19,327752.3,56.49,0.05,True,58.35,-0.02,-0.03,0.01,2026-01-08,13.27,1.66,0,,13.13,13.75,False,False
08-01-2026 16:00,AGHOL,30.48,30.98,30.46,30.94,944376.0,0.04,0.46,0.03,1337.5,0.46,408710.2,131.06,0.09,True,67.52,0.16,0.19,-0.03,2026-01-08,30.7,0.78,0,,30.08,ATH,False,False
08-01-2026 16:00,CONSE,3.01,3.05,3.0,3.04,663158.0,0.01,0.03,0.0,2900.0,0.03,405428.8,63.57,0.33,True,57.31,-0.01,-0.0,-0.0,2026-01-08,3.01,1.0,1,3.05,2.96,3.05,False,False
08-01-2026 16:00,AKFYE,16.92,17.07,16.91,17.05,357626.0,0.02,0.13,0.01,983.33,0.13,224678.2,59.17,0.15,True,61.08,0.01,0.02,-0.01,2026-01-08,16.92,0.77,0,,16.73,17.14,False,False
08-01-2026 16:00,EGEPO,8.92,9.21,8.87,9.15,3315987.0,0.06,0.23,0.07,233.33,0.23,1016048.0,226.36,0.26,True,75.78,0.13,0.08,0.04,2026-01-08,8.45,8.28,0,,8.33,ATH,False,False
08-01-2026 16:00,BORSK,5.92,6.06,5.91,6.06,1133050.0,0.0,0.14,0.0,2700.0,0.14,651842.0,73.82,0.0,True,60.03,-0.01,-0.01,-0.0,2026-01-08,5.9,2.71,0,,5.85,6.26,False,False
08-01-2026 16:00,AKGRT,6.85,6.93,6.85,6.91,2173484.0,0.02,0.06,0.01,1100.0,0.06,934084.4,132.69,0.33,True,56.8,-0.02,-0.02,0.0,2026-01-08,6.84,1.02,0,,6.78,7.02,False,False
08-01-2026 15:00,EDATA,7.96,8.5,7.96,8.41,8806242.0,0.09,0.45,0.05,765.38,0.45,4156637.3,111.86,0.2,True,77.56,0.25,0.24,0.01,2026-01-08,7.75,8.52,0,,7.42,ATH,False,False
08-01-2026 15:00,SEGMN,18.73,19.37,18.7,19.31,1122369.0,0.06,0.58,0.07,694.52,0.58,282114.1,297.84,0.1,True,73.38,0.02,-0.03,0.05,2026-01-08,18.37,5.12,0,,18.26,ATH,False,False
08-01-2026 14:00,DOHOL,17.73,18.2,17.73,18.14,2603594.0,0.06,0.41,0.01,6733.33,0.41,1310679.1,98.64,0.15,True,58.7,0.01,0.05,-0.04,2026-01-08,18.02,0.67,0,,17.65,18.48,False,False
08-01-2026 14:00,KLYPV,56.75,57.45,56.65,57.3,236335.0,0.15,0.55,0.06,746.15,0.55,143165.0,65.08,0.27,True,57.09,0.06,0.08,-0.02,2026-01-08,56.55,1.33,0,,56.2,57.8,False,False
08-01-2026 14:00,OSTIM,3.01,3.05,3.0,3.04,5055426.0,0.01,0.03,0.0,6.75539944105579e+16,0.03,2130203.1,137.32,0.33,True,59.68,0.01,0.01,0.0,2026-01-08,3.02,0.66,0,,2.97,3.09,False,False
08-01-2026 14:00,ARCLK,108.9,111.9,108.9,111.7,968998.0,0.2,2.8,0.13,2053.85,2.8,431736.8,124.44,0.07,True,70.95,0.77,0.97,-0.2,2026-01-08,109.9,1.64,0,,108.5,112.2,False,False
08-01-2026 14:00,KATMR,2.98,3.14,2.97,3.1,68551740.0,0.04,0.12,0.0,2300.0,0.12,19471254.6,252.07,0.33,True,62.75,0.01,0.02,-0.01,2026-01-08,3.01,2.99,1,3.14,2.96,3.14,False,False
08-01-2026 14:00,GMTAS,46.24,50.25,46.24,50.25,2207060.0,0.0,4.01,0.51,684.74,4.01,505932.0,336.24,0.0,True,87.71,0.62,0.26,0.35,2026-01-08,45.7,9.96,0,,44.38,ATH,False,False
08-01-2026 14:00,SKYMD,12.04,12.45,12.01,12.35,464229.0,0.1,0.31,0.0,10233.33,0.31,244221.1,90.09,0.32,True,60.93,0.04,0.06,-0.02,2026-01-08,12.05,2.49,1,12.45,11.95,12.45,False,False
08-01-2026 13:00,SDTTR,193.3,204.4,193.2,203.4,628097.0,1.0,10.1,0.84,1102.38,10.1,197495.8,218.03,0.1,True,77.62,2.23,1.77,0.46,2026-01-08,190.9,6.55,0,,187.0,ATH,False,False
08-01-2026 13:00,REEDR,6.54,7.02,6.53,7.01,16618048.0,0.01,0.47,0.03,1324.24,0.47,3325549.8,399.71,0.02,True,72.61,-0.01,-0.02,0.01,2026-01-08,6.61,6.05,0,,6.52,ATH,False,False
08-01-2026 13:00,AGROT,3.3,3.41,3.3,3.41,20306278.0,0.0,0.11,0.02,378.26,0.11,7899647.1,157.05,0.0,True,72.18,0.04,0.02,0.02,2026-01-08,3.1,10.0,0,,3.1,ATH,False,False
08-01-2026 11:00,MARKA,37.46,38.78,37.3,38.44,248069.0,0.34,0.98,0.0,24400.0,0.98,95672.2,159.29,0.35,True,49.13,-0.42,-0.24,-0.18,2026-01-08,36.7,4.74,0,,36.7,40.54,False,False
08-01-2026 11:00,ARENA,27.06,28.44,27.02,28.24,513589.0,0.2,1.18,0.02,5800.0,1.18,130420.7,293.79,0.17,True,59.72,-0.12,-0.13,0.0,2026-01-08,27.14,4.05,0,,27.0,29.48,True,True
08-01-2026 11:00,ARMGD,76.35,83.95,76.3,83.5,1367923.0,0.45,7.15,0.17,3985.71,7.15,550878.4,148.32,0.06,True,59.33,1.87,1.98,-0.11,2026-01-08,84.0,-0.6,2,76.3,76.3,87.0,False,False
08-01-2026 11:00,LRSHO,4.21,4.44,4.19,4.41,14303818.0,0.03,0.2,0.03,525.0,0.2,5265624.6,171.65,0.15,True,77.6,0.05,0.03,0.02,2026-01-08,4.25,3.76,0,,4.07,ATH,False,False
08-01-2026 11:00,VAKBN,32.82,33.76,32.82,33.66,13628866.0,0.1,0.84,0.07,1100.0,0.84,5805125.0,134.77,0.12,True,67.5,0.21,0.25,-0.04,2026-01-08,32.96,2.12,0,,32.62,33.86,False,False
08-01-2026 11:00,TATGD,12.19,12.46,12.19,12.39,430930.0,0.07,0.2,0.01,2122.22,0.2,147499.2,192.16,0.35,True,67.57,0.06,0.06,-0.01,2026-01-08,12.25,1.14,0,,12.14,ATH,False,False
08-01-2026 10:00,KRDMA,24.18,25.48,24.16,25.26,2805536.0,0.22,1.08,0.05,1976.92,1.08,436075.3,543.36,0.2,True,72.99,0.05,0.04,0.01,2026-01-08,24.2,4.38,0,,24.12,ATH,False,False
08-01-2026 10:00,AVOD,3.73,4.09,3.7,4.03,22549265.0,0.06,0.3,0.04,614.29,0.3,6705927.4,236.26,0.2,True,71.32,0.06,0.03,0.03,2026-01-08,3.72,8.33,1,4.09,3.55,4.09,False,False
08-01-2026 10:00,TNZTP,24.58,26.66,24.38,26.18,3665767.0,0.48,1.6,0.03,4900.0,1.6,847945.8,332.31,0.3,True,65.81,0.45,0.55,-0.09,2026-01-08,24.48,6.94,1,26.66,24.32,26.66,False,False
08-01-2026 10:00,AHSGY,19.84,20.9,19.57,20.9,3329088.0,0.0,1.06,0.2,427.36,1.06,1400790.0,137.66,0.0,True,85.11,0.78,0.56,0.22,2026-01-08,19.0,10.0,1,20.9,16.7,ATH,False,False
07-01-2026 17:00,ENERY,9.58,9.87,9.55,9.86,9979074.0,0.01,0.28,0.03,748.48,0.28,2431892.6,310.34,0.04,True,78.46,0.05,0.03,0.03,2026-01-07,9.51,3.68,1,9.87,9.38,9.87,False,False
07-01-2026 17:00,UNLU,15.44,15.55,15.35,15.55,314162.0,0.0,0.11,0.01,900.0,0.11,159703.2,96.72,0.0,True,54.43,-0.01,-0.04,0.03,2026-01-07,15.44,0.71,0,,15.11,15.58,False,False
07-01-2026 17:00,KAYSE,4.58,4.96,4.57,4.92,8131363.0,0.04,0.34,0.02,1445.45,0.34,2470117.8,229.19,0.12,True,70.79,0.04,0.04,0.0,2026-01-07,4.69,4.9,1,4.96,4.54,4.96,False,False
07-01-2026 17:00,TCKRC,69.1,75.2,68.75,75.2,3484814.0,0.0,6.1,0.62,891.87,6.1,1068414.5,226.17,0.0,True,78.37,2.56,2.31,0.25,2026-01-07,68.4,9.94,0,,52.55,ATH,False,False
07-01-2026 17:00,TSPOR,1.1,1.11,1.1,1.11,30232882.0,0.0,0.01,0.0,900.0,0.01,13021337.7,132.18,0.0,True,56.83,0.0,0.0,0.0,2026-01-07,1.1,0.91,0,,1.08,1.12,False,False
07-01-2026 17:00,PAHOL,1.58,1.59,1.57,1.59,135851945.0,0.0,0.01,0.0,900.0,0.01,80763164.0,68.21,0.0,True,49.33,0.01,0.01,-0.0,2026-01-07,1.6,-0.63,0,,1.54,1.62,False,False
07-01-2026 17:00,AKSEN,68.25,69.9,68.0,69.75,1917400.0,0.15,1.5,0.08,1775.0,1.5,682825.1,180.8,0.1,True,60.18,0.03,-0.06,0.09,2026-01-07,68.55,1.75,1,69.9,67.35,69.9,False,False
07-01-2026 16:00,GENTS,9.72,10.05,9.72,10.05,2184966.0,0.0,0.33,0.04,685.71,0.33,731779.1,198.58,0.0,True,79.14,0.06,0.01,0.05,2026-01-07,9.5,5.79,0,,9.3,10.11,False,False
07-01-2026 16:00,RUBNS,27.72,29.22,27.48,29.12,3671216.0,0.1,1.4,0.18,686.52,1.4,897636.4,308.99,0.07,True,73.15,0.63,0.66,-0.03,2026-01-07,27.18,7.14,0,,26.32,ATH,False,False
07-01-2026 16:00,AHGAZ,21.9,23.14,21.9,22.82,3727755.0,0.32,0.92,0.1,838.78,0.92,748920.3,397.75,0.35,True,71.33,-0.02,-0.09,0.07,2026-01-07,21.86,4.39,1,23.14,21.58,23.14,True,False
07-01-2026 15:00,NATEN,9.09,9.55,9.04,9.52,6953185.0,0.03,0.43,0.06,582.54,0.43,1705850.1,307.61,0.07,True,82.33,0.12,0.07,0.05,2026-01-07,8.93,6.61,0,,8.68,ATH,False,False
07-01-2026 14:00,CEOEM,24.02,24.26,23.98,24.24,183934.0,0.02,0.22,0.05,340.0,0.22,102720.7,79.06,0.09,True,67.04,0.02,-0.03,0.05,2026-01-07,23.72,2.19,0,,23.66,24.58,False,False
07-01-2026 14:00,MACKO,24.92,26.24,24.64,25.96,2052791.0,0.28,1.04,0.08,1168.29,1.04,445526.6,360.76,0.27,True,49.36,-0.74,-0.96,0.22,2026-01-07,25.1,3.43,0,,24.42,31.06,True,False
07-01-2026 14:00,EFOR,21.86,22.36,21.5,22.3,3124462.0,0.06,0.44,0.06,658.62,0.44,1759906.8,77.54,0.14,True,51.72,-0.28,-0.41,0.14,2026-01-07,21.78,2.39,0,,21.0,26.06,False,False
07-01-2026 14:00,ETILR,3.87,4.01,3.84,4.01,2813429.0,0.0,0.14,0.02,636.84,0.14,1236164.5,127.59,0.0,True,74.03,0.03,0.02,0.01,2026-01-07,3.82,4.97,0,,3.8,4.07,False,False
07-01-2026 13:00,DOKTA,23.58,24.92,23.58,24.74,695185.0,0.18,1.16,0.08,1314.63,1.16,124141.1,460.0,0.16,True,70.64,0.05,-0.03,0.07,2026-01-07,23.2,6.64,0,,22.9,24.98,False,False
07-01-2026 13:00,DMSAS,9.08,9.17,9.08,9.17,1130434.0,0.0,0.09,0.01,1025.0,0.09,579255.5,95.15,0.0,True,42.59,-0.11,-0.16,0.05,2026-01-07,9.05,1.33,0,,9.04,10.07,True,False
07-01-2026 13:00,TRALT,44.36,45.6,44.3,45.52,46252019.0,0.08,1.16,0.21,463.11,1.16,21736720.0,112.78,0.07,True,80.45,0.62,0.55,0.07,2026-01-07,44.2,2.99,0,,39.18,ATH,False,False
07-01-2026 12:00,MAGEN,39.68,40.42,39.6,40.3,3239942.0,0.12,0.62,0.09,620.93,0.62,1277286.9,153.66,0.19,True,62.83,0.16,0.14,0.02,2026-01-07,39.58,1.82,0,,39.1,40.78,False,False
07-01-2026 11:00,TUREX,7.14,7.24,7.14,7.23,4045694.0,0.01,0.09,0.01,718.18,0.09,1637099.4,147.13,0.11,True,66.65,0.02,0.01,0.0,2026-01-07,7.14,1.26,0,,7.08,7.32,False,False
07-01-2026 11:00,KLSYN,7.16,7.65,7.16,7.52,9298487.0,0.13,0.36,0.04,872.97,0.36,1275988.1,628.73,0.36,True,80.49,0.05,0.03,0.02,2026-01-07,7.16,5.03,0,,7.01,ATH,False,False
07-01-2026 11:00,AEFES,16.46,16.67,16.46,16.65,14960958.0,0.02,0.19,0.03,475.76,0.19,6961300.9,114.92,0.11,True,83.71,0.14,0.11,0.03,2026-01-07,16.4,1.52,0,,15.65,16.71,False,False
07-01-2026 11:00,BALSU,16.77,17.74,16.75,17.5,6845670.0,0.24,0.73,0.05,1303.85,0.73,1348152.5,407.78,0.33,True,67.28,-0.05,-0.13,0.08,2026-01-07,16.67,4.98,1,17.74,16.55,17.74,False,False
07-01-2026 11:00,YATAS,39.92,40.68,39.9,40.56,280898.0,0.12,0.64,0.05,1180.0,0.64,111220.1,152.56,0.19,True,60.22,0.13,0.14,-0.01,2026-01-07,40.06,1.25,0,,39.5,40.6,False,False
07-01-2026 10:00,DSTKF,634.5,666.5,630.0,660.0,735216.0,6.5,25.5,2.8,810.71,25.5,169125.7,334.72,0.25,True,82.84,15.18,13.23,1.95,2026-01-07,629.0,4.93,0,,552.0,ATH,False,False
07-01-2026 10:00,BRSAN,567.5,579.0,564.5,577.0,438020.0,2.0,9.5,0.65,1361.54,9.5,120735.3,262.79,0.21,True,68.97,3.61,4.04,-0.44,2026-01-07,566.0,1.94,1,579.0,558.0,579.0,False,False
07-01-2026 10:00,KLRHO,398.0,417.25,397.75,412.25,594024.0,5.0,14.25,2.38,500.0,14.25,306935.5,93.53,0.35,True,78.34,17.79,15.65,2.14,2026-01-07,396.75,3.91,0,,300.25,ATH,False,False
07-01-2026 10:00,TUCLK,4.93,5.16,4.91,5.12,9296635.0,0.04,0.19,0.03,630.77,0.19,1523525.8,510.21,0.21,True,79.67,0.03,0.01,0.02,2026-01-07,4.91,4.28,0,,4.79,5.21,False,False
07-01-2026 10:00,BLUME,46.64,47.48,46.36,47.38,653670.0,0.1,0.74,0.01,5185.71,0.74,326579.1,100.16,0.14,True,36.69,-0.89,-0.85,-0.04,2026-01-07,47.0,0.81,0,,ATL,53.25,False,False
07-01-2026 10:00,METRO,4.47,4.69,4.42,4.65,18666370.0,0.04,0.18,0.05,233.33,0.18,4292449.4,334.87,0.22,True,90.05,0.13,0.06,0.06,2026-01-07,4.31,7.89,0,,3.91,ATH,False,False
07-01-2026 10:00,PINSU,11.5,12.25,11.5,12.2,5992695.0,0.05,0.7,0.1,614.29,0.7,1252634.5,378.41,0.07,True,81.46,0.09,0.0,0.09,2026-01-07,11.46,6.46,0,,11.11,12.3,False,False
07-01-2026 10:00,ANGEN,11.02,11.15,10.99,11.13,550603.0,0.02,0.11,0.01,900.0,0.11,150121.8,266.77,0.18,True,72.45,0.03,0.03,0.01,2026-01-07,10.97,1.46,0,,10.89,ATH,False,False
07-01-2026 10:00,RTALB,3.52,3.56,3.5,3.55,6378493.0,0.01,0.03,0.0,650.0,0.03,1888049.9,237.83,0.33,True,67.04,0.01,0.0,0.0,2026-01-07,3.51,1.14,0,,3.48,3.69,False,False
07-01-2026 10:00,ALTIN,110.57,114.92,108.5,114.51,28653046.0,0.41,3.94,0.57,587.61,3.94,6899128.1,315.31,0.1,True,82.83,2.72,2.62,0.1,2026-01-07,111.59,2.62,0,,95.22,ATH,False,False
07-01-2026 10:00,KRPLS,8.03,8.2,8.03,8.16,317936.0,0.04,0.13,0.0,3150.0,0.13,153924.9,106.55,0.31,True,59.96,0.04,0.06,-0.02,2026-01-07,8.03,1.62,1,8.2,7.6,8.2,False,False
06-01-2026 17:00,IHYAY,1.96,1.98,1.96,1.98,1175034.0,0.0,0.02,0.0,400.0,0.02,622052.9,88.9,0.0,True,51.47,-0.0,-0.0,-0.0,2026-01-06,1.97,0.51,2,1.96,1.96,2.03,False,False
06-01-2026 17:00,GOZDE,22.22,22.5,22.18,22.42,1760594.0,0.08,0.2,0.02,1011.11,0.2,308929.5,469.9,0.4,True,62.78,0.06,0.06,-0.0,2026-01-06,22.24,0.81,0,,22.16,22.46,False,False
06-01-2026 17:00,DOFER,52.25,54.0,51.55,54.0,240288.0,0.0,1.75,0.17,960.61,1.75,95097.6,152.68,0.0,True,63.33,-0.34,-0.55,0.21,2026-01-06,52.2,3.45,1,54.0,51.2,56.1,True,False
06-01-2026 17:00,HEKTS,3.17,3.19,3.17,3.19,18076782.0,0.0,0.02,0.0,1900.0,0.02,7643957.5,136.48,0.0,True,65.28,0.01,0.02,-0.0,2026-01-06,3.16,0.95,0,,3.15,3.2,False,False
06-01-2026 17:00,GARAN,149.3,150.5,149.2,150.2,8665976.0,0.3,0.9,0.14,542.86,0.9,4806007.0,80.32,0.33,True,67.41,0.94,1.07,-0.12,2026-01-06,148.3,1.28,0,,147.2,150.9,False,False
06-01-2026 16:00,SMRTG,22.56,23.06,22.54,22.96,2584630.0,0.1,0.4,0.01,3233.33,0.4,659902.2,291.67,0.25,True,56.56,-0.09,-0.1,0.01,2026-01-06,22.8,0.7,0,,22.48,23.1,True,True
06-01-2026 16:00,AKSA,10.16,10.24,10.14,10.23,2692771.0,0.01,0.07,0.01,536.36,0.07,1707867.3,57.67,0.14,True,67.37,0.04,0.04,0.0,2026-01-06,10.13,0.99,0,,9.82,ATH,False,False
06-01-2026 16:00,HDFGS,3.43,3.63,3.38,3.58,33517254.0,0.05,0.15,0.02,581.82,0.15,21153802.0,58.45,0.33,True,68.67,0.05,0.06,-0.0,2026-01-06,3.38,5.92,0,,3.22,3.67,False,False
06-01-2026 16:00,SEGYO,4.82,5.22,4.81,5.13,18318435.0,0.09,0.31,0.03,900.0,0.31,2701203.0,578.16,0.29,True,68.84,-0.04,-0.07,0.03,2026-01-06,4.8,6.88,0,,4.74,5.37,True,False
06-01-2026 16:00,SERNT,8.16,8.35,8.16,8.33,2393469.0,0.02,0.17,0.01,1445.45,0.17,1048441.2,128.29,0.12,True,74.08,0.08,0.06,0.03,2026-01-06,8.03,3.74,0,,7.86,ATH,False,False
06-01-2026 15:00,SKBNK,7.81,7.95,7.8,7.93,8043626.0,0.02,0.12,0.01,900.0,0.12,4143100.7,94.15,0.17,True,65.16,0.01,0.01,0.01,2026-01-06,7.79,1.8,1,7.95,7.77,7.95,False,False
06-01-2026 15:00,MTRYO,8.76,9.51,8.7,9.51,973517.0,0.0,0.75,0.08,792.86,0.75,132267.2,636.02,0.0,True,80.35,0.06,0.0,0.06,2026-01-06,8.65,9.94,0,,8.51,ATH,False,False
06-01-2026 15:00,TURSG,11.45,11.56,11.43,11.55,12938984.0,0.01,0.1,0.01,1566.67,0.1,6117184.7,111.52,0.1,True,53.29,-0.02,-0.03,0.01,2026-01-06,11.4,1.32,0,,11.29,11.86,False,False
06-01-2026 15:00,PETUN,11.24,11.3,11.24,11.3,377607.0,0.0,0.06,0.01,500.0,0.06,163915.0,130.37,0.0,True,57.87,0.01,0.01,-0.0,2026-01-06,11.23,0.62,0,,11.16,11.44,False,False
06-01-2026 15:00,MEGMT,54.7,55.95,54.65,55.65,1180700.0,0.3,0.95,0.23,313.04,0.95,583298.8,102.42,0.32,True,67.6,0.17,-0.02,0.19,2026-01-06,53.4,4.21,0,,52.85,58.0,False,False
06-01-2026 14:00,IEYHO,68.45,69.65,68.35,69.6,4219264.0,0.05,1.15,0.16,596.97,1.15,2591483.4,62.81,0.04,True,71.59,0.49,0.41,0.08,2026-01-06,67.75,2.73,0,,63.25,ATH,False,False
06-01-2026 13:00,MERIT,17.86,18.25,17.86,18.22,1018278.0,0.03,0.36,0.07,445.45,0.36,526946.2,93.24,0.08,True,69.83,0.07,0.02,0.05,2026-01-06,17.68,3.05,0,,17.4,ATH,False,False
06-01-2026 13:00,AFYON,13.24,13.39,13.23,13.36,432020.0,0.03,0.12,0.02,380.0,0.12,225724.0,91.39,0.25,True,75.65,0.06,0.05,0.01,2026-01-06,13.23,0.98,0,,13.07,ATH,False,False
06-01-2026 13:00,TRMET,108.8,111.7,108.6,111.0,1386003.0,0.7,2.2,0.12,1733.33,2.2,636619.9,117.71,0.32,True,63.23,0.76,0.73,0.03,2026-01-06,109.8,1.09,2,108.6,108.6,113.7,False,False
06-01-2026 12:00,DARDL,2.26,2.3,2.25,2.29,16008720.0,0.01,0.03,0.01,500.0,0.03,6482330.3,146.96,0.33,True,66.86,0.02,0.02,0.0,2026-01-06,2.25,1.78,1,2.3,2.17,2.3,False,False
06-01-2026 12:00,DURDO,3.67,3.82,3.66,3.79,3255412.0,0.03,0.12,0.02,605.88,0.12,934738.7,248.27,0.25,True,75.07,0.01,-0.0,0.01,2026-01-06,3.64,4.12,0,,3.6,ATH,False,False
06-01-2026 12:00,BORLS,4.17,4.29,4.16,4.26,10251548.0,0.03,0.09,0.02,350.0,0.09,3168572.3,223.54,0.33,True,74.32,0.04,0.02,0.02,2026-01-06,4.08,4.41,1,4.29,4.0,4.29,False,False
06-01-2026 12:00,MAVI,42.24,43.02,42.22,42.98,3154129.0,0.04,0.74,0.12,506.56,0.74,1380331.3,128.51,0.05,True,61.93,-0.09,-0.17,0.08,2026-01-06,41.88,2.63,0,,41.2,44.08,False,False
06-01-2026 11:00,ENJSA,92.95,93.35,92.75,93.25,351954.0,0.1,0.3,0.13,130.77,0.3,214224.6,64.29,0.33,True,70.33,0.74,0.7,0.04,2026-01-06,92.75,0.54,0,,88.55,ATH,False,False
06-01-2026 11:00,ADEL,34.92,36.6,34.88,36.56,1581450.0,0.04,1.64,0.13,1201.59,1.64,404529.9,290.94,0.02,True,75.71,0.58,0.49,0.09,2026-01-06,35.06,4.28,0,,34.68,ATH,False,False
06-01-2026 11:00,ISMEN,41.52,42.06,41.5,41.92,1540245.0,0.14,0.4,0.1,308.16,0.4,967984.6,59.12,0.35,True,79.05,0.38,0.3,0.08,2026-01-06,41.38,1.3,0,,39.62,ATH,False,False
06-01-2026 10:00,KRDMD,27.0,27.46,26.9,27.38,12856440.0,0.08,0.38,0.09,341.86,0.38,5318958.8,141.71,0.21,True,85.65,0.36,0.28,0.08,2026-01-06,26.84,2.01,0,,25.12,ATH,False,False
06-01-2026 10:00,ISKPL,11.35,11.77,11.3,11.67,5146797.0,0.1,0.32,0.0,31900.0,0.32,1965507.5,161.86,0.31,True,58.41,-0.06,-0.12,0.06,2026-01-06,11.33,3.0,0,,10.95,11.7,False,False
06-01-2026 10:00,AKENR,11.3,11.47,11.29,11.43,1860070.0,0.04,0.13,0.02,550.0,0.13,842989.1,120.65,0.31,True,59.33,-0.0,-0.02,0.02,2026-01-06,11.31,1.06,0,,11.19,11.51,False,False
06-01-2026 10:00,BOSSA,6.36,6.4,6.34,6.39,293048.0,0.01,0.03,0.0,650.0,0.03,184504.5,58.83,0.33,True,57.1,0.01,0.01,-0.0,2026-01-06,6.37,0.31,0,,6.33,6.45,False,False
06-01-2026 10:00,TCELL,96.95,98.2,96.85,98.0,5818702.0,0.2,1.05,0.2,412.2,1.05,3025796.5,92.3,0.19,True,75.68,0.77,0.63,0.14,2026-01-06,96.8,1.24,0,,92.85,ATH,False,False
06-01-2026 10:00,HALKB,40.2,43.36,39.7,43.1,66628722.0,0.26,2.9,0.38,659.16,2.9,12865497.5,417.89,0.09,True,91.51,0.91,0.62,0.29,2026-01-06,40.0,7.75,0,,36.76,ATH,False,False
06-01-2026 10:00,YKBNK,38.26,38.62,37.92,38.56,61641208.0,0.06,0.3,0.07,316.67,0.3,19569403.7,214.99,0.2,True,74.52,0.47,0.49,-0.02,2026-01-06,38.24,0.84,0,,35.2,38.6,False,False
06-01-2026 10:00,VAKFN,1.92,1.93,1.9,1.93,16890310.0,0.0,0.01,0.0,900.0,0.01,5466679.3,208.97,0.0,True,66.12,0.01,0.01,0.0,2026-01-06,1.91,1.05,0,,1.84,1.98,False,False
06-01-2026 10:00,SISE,39.62,40.02,39.48,40.0,8722768.0,0.02,0.38,0.08,400.0,0.38,3330865.1,161.88,0.05,True,75.54,0.24,0.19,0.05,2026-01-06,39.48,1.32,0,,38.26,ATH,False,False
06-01-2026 10:00,DMLKT,5.8,5.81,5.8,5.81,2762428.0,0.0,0.01,0.0,900.0,0.01,1327771.4,108.05,0.0,True,48.48,-0.0,-0.0,0.0,2026-01-06,5.8,0.17,1,5.81,5.79,5.84,False,False
06-01-2026 10:00,ISCTR,14.42,14.6,14.34,14.58,200279194.0,0.02,0.16,0.02,966.67,0.16,59770852.9,235.08,0.12,True,77.66,0.13,0.14,-0.01,2026-01-06,14.39,1.32,0,,13.38,ATH,False,False
06-01-2026 10:00,YYLGD,10.01,10.12,10.01,10.09,1084968.0,0.03,0.08,0.0,1900.0,0.08,387809.1,179.77,0.37,True,74.54,0.07,0.07,0.0,2026-01-06,10.01,0.8,1,10.12,9.47,10.12,False,False
06-01-2026 10:00,KOCMT,2.54,2.6,2.53,2.6,4016990.0,0.0,0.06,0.0,1900.0,0.06,1681383.0,138.91,0.0,True,64.56,0.01,0.01,-0.0,2026-01-06,2.54,2.36,2,2.53,2.53,2.61,False,False
06-01-2026 10:00,ULUFA,3.75,3.78,3.74,3.78,1314306.0,0.0,0.03,0.0,500.0,0.03,705984.0,86.17,0.0,True,65.76,0.02,0.03,-0.0,2026-01-06,3.75,0.8,0,,3.57,ATH,False,False
06-01-2026 10:00,PETKM,16.73,16.82,16.7,16.81,11660909.0,0.01,0.08,0.02,280.95,0.08,4245317.4,174.68,0.13,True,76.58,0.09,0.08,0.01,2026-01-06,16.71,0.6,0,,16.21,ATH,False,False
05-01-2026 17:00,SNICA,4.36,4.58,4.35,4.56,7404018.0,0.02,0.2,0.02,852.38,0.2,1629583.2,354.35,0.1,True,72.16,0.06,0.06,-0.0,2026-01-05,4.34,5.07,0,,4.27,ATH,False,False
05-01-2026 17:00,SUNTK,49.38,60.3,49.38,60.3,491695.0,0.0,10.92,0.92,1086.96,10.92,142533.1,244.97,0.0,True,69.19,-1.46,-1.84,0.39,2026-01-05,54.85,9.94,3,,49.38,61.45,True,True
05-01-2026 17:00,YYAPI,1.86,1.89,1.86,1.89,16864578.0,0.0,0.03,0.0,650.0,0.03,9257416.9,82.17,0.0,True,53.2,-0.0,-0.0,0.0,2026-01-05,1.89,0.0,0,,1.85,1.92,False,False
05-01-2026 17:00,YIGIT,23.38,23.48,23.32,23.48,300024.0,0.0,0.1,0.01,614.29,0.1,168589.2,77.96,0.0,True,69.03,0.12,0.12,0.0,2026-01-05,23.34,0.6,0,,22.42,ATH,False,False
05-01-2026 17:00,CCOLA,60.15,61.85,59.95,61.5,2937414.0,0.35,1.35,0.21,527.91,1.35,884801.7,231.99,0.26,True,76.09,0.46,0.26,0.19,2026-01-05,59.3,3.71,0,,57.85,ATH,False,False
05-01-2026 17:00,KBORU,14.21,14.74,14.16,14.72,3138092.0,0.02,0.51,0.02,1940.0,0.51,695092.0,351.46,0.04,True,64.3,-0.01,-0.01,0.0,2026-01-05,14.43,2.01,2,14.16,14.16,14.85,False,False
05-01-2026 17:00,CIMSA,45.66,45.96,45.6,45.88,1683203.0,0.08,0.22,0.02,1122.22,0.22,1112019.0,51.36,0.36,True,63.4,0.12,0.11,0.0,2026-01-05,45.54,0.75,0,,45.4,46.5,False,False
05-01-2026 17:00,GIPTA,69.7,74.05,69.7,74.05,5051869.0,0.0,4.35,0.7,517.02,4.35,2299561.3,119.69,0.0,True,67.04,-0.13,-0.86,0.73,2026-01-05,67.35,9.95,0,,64.35,76.2,False,False
05-01-2026 17:00,DAPGM,13.08,14.34,12.87,14.34,40142805.0,0.0,1.26,0.12,967.8,1.26,6609214.8,507.38,0.0,True,76.79,0.24,0.11,0.12,2026-01-05,13.04,9.97,0,,12.77,ATH,False,False
05-01-2026 16:00,ENSRI,17.76,18.52,17.74,18.37,1351689.0,0.15,0.61,0.12,412.61,0.61,416266.2,224.72,0.25,True,76.06,0.23,0.17,0.06,2026-01-05,17.22,6.68,0,,16.78,ATH,False,False
05-01-2026 16:00,CANTE,2.09,2.2,2.08,2.19,303985553.0,0.01,0.1,0.01,733.33,0.1,60193423.4,405.01,0.1,True,82.9,0.02,0.01,0.01,2026-01-05,2.04,7.35,1,2.2,2.0,2.2,False,False
05-01-2026 15:00,DOFRB,85.5,89.65,85.1,89.65,7837073.0,0.0,4.15,1.2,247.28,4.15,3871284.3,102.44,0.0,True,78.13,1.8,0.87,0.93,2026-01-05,81.5,10.0,0,,74.1,ATH,False,False
05-01-2026 15:00,DGNMO,4.85,4.99,4.85,4.97,660290.0,0.02,0.12,0.0,2300.0,0.12,271689.1,143.03,0.17,True,63.66,0.03,0.03,-0.0,2026-01-05,4.99,-0.4,1,4.99,4.84,4.99,False,False
05-01-2026 15:00,MARMR,1.69,1.89,1.69,1.86,215973756.0,0.03,0.17,0.02,750.0,0.17,57032674.0,278.68,0.18,True,72.29,0.03,0.02,0.01,2026-01-05,1.72,8.14,1,1.89,1.54,1.89,False,False
05-01-2026 14:00,LKMNH,18.67,19.08,18.67,18.98,509119.0,0.1,0.31,0.0,10233.33,0.31,188684.7,169.83,0.32,True,57.41,0.01,0.06,-0.05,2026-01-05,18.75,1.23,0,,18.5,19.44,False,False
05-01-2026 14:00,ECOGR,22.56,23.06,22.48,22.98,7509294.0,0.08,0.42,0.04,900.0,0.42,2837284.4,164.66,0.19,True,66.45,0.15,0.15,0.01,2026-01-05,22.68,1.32,0,,22.12,23.1,False,False
05-01-2026 14:00,TUPRS,188.5,191.0,188.5,190.8,4890541.0,0.2,2.3,0.5,360.0,2.3,2559463.8,91.08,0.09,True,79.41,0.8,0.43,0.37,2026-01-05,187.0,2.03,0,,183.7,ATH,False,False
05-01-2026 13:00,BIOEN,17.56,18.17,17.55,18.02,1511805.0,0.15,0.46,0.11,303.51,0.46,375828.3,302.26,0.33,True,81.32,0.18,0.07,0.11,2026-01-05,16.82,7.13,1,18.17,16.82,18.17,False,False
05-01-2026 13:00,GOKNR,19.95,20.44,19.95,20.32,1184947.0,0.12,0.37,0.04,802.44,0.37,292838.5,304.64,0.32,True,74.92,0.1,0.07,0.03,2026-01-05,19.95,1.85,0,,19.8,ATH,False,False
05-01-2026 12:00,IHLGM,2.1,2.18,2.1,2.17,22401650.0,0.01,0.07,0.01,775.0,0.07,4362183.5,413.54,0.14,True,73.73,0.01,0.01,0.01,2026-01-05,2.08,4.33,0,,2.05,2.26,False,False
05-01-2026 11:00,IZENR,9.61,9.94,9.6,9.91,24134792.0,0.03,0.3,0.04,597.67,0.3,9705562.8,148.67,0.1,True,56.09,-0.05,-0.11,0.06,2026-01-05,9.71,2.06,0,,9.39,10.0,True,False
05-01-2026 11:00,IZFAS,56.75,57.9,56.75,57.85,1128560.0,0.05,1.1,0.03,3566.67,1.1,698915.9,61.47,0.05,True,65.95,0.8,0.73,0.07,2026-01-05,56.45,2.48,1,57.9,54.6,57.9,False,False
05-01-2026 11:00,RUZYE,11.25,11.49,11.23,11.44,1684737.0,0.05,0.19,0.01,1483.33,0.19,671582.2,150.86,0.26,True,61.75,0.05,0.03,0.02,2026-01-05,11.3,1.24,0,,10.82,11.52,False,False
05-01-2026 11:00,BERA,18.24,18.57,18.14,18.55,2049769.0,0.02,0.31,0.04,656.1,0.31,1062558.7,92.91,0.06,True,61.36,0.13,0.13,0.0,2026-01-05,18.24,1.7,0,,17.47,19.49,False,False
05-01-2026 10:00,MAKIM,15.2,15.4,15.13,15.4,278240.0,0.0,0.2,0.02,1076.47,0.2,73620.1,277.94,0.0,True,56.15,-0.04,-0.07,0.03,2026-01-05,15.17,1.52,0,,14.95,15.67,False,False
05-01-2026 10:00,HATEK,14.82,15.03,14.6,15.02,449572.0,0.01,0.2,0.03,545.16,0.2,173749.6,158.75,0.05,True,66.46,0.06,0.01,0.04,2026-01-05,14.8,1.49,0,,14.31,15.85,False,False
05-01-2026 10:00,TERA,172.9,182.7,170.0,182.0,7979646.0,0.7,9.1,1.15,691.3,9.1,2560000.2,211.7,0.08,True,60.2,-0.68,-1.31,0.63,2026-01-05,173.0,5.2,0,,165.7,190.0,False,False
05-01-2026 10:00,TOASO,260.0,266.75,259.25,265.0,1579316.0,1.75,5.0,1.55,221.54,5.0,541849.6,191.47,0.35,True,86.17,3.0,1.56,1.44,2026-01-05,258.75,2.42,0,,246.3,ATH,False,False
05-01-2026 10:00,DENGE,3.28,3.49,3.24,3.47,12110951.0,0.02,0.19,0.04,413.51,0.19,5333669.8,127.07,0.11,True,84.33,0.06,0.03,0.03,2026-01-05,3.27,6.12,1,3.49,3.04,3.49,False,False
05-01-2026 10:00,EUREN,6.62,6.92,6.6,6.91,42480338.0,0.01,0.29,0.05,530.43,0.29,10371226.3,309.6,0.03,True,77.13,0.05,0.01,0.04,2026-01-05,6.6,4.7,0,,6.34,ATH,False,False
02-01-2026 17:00,KARSN,9.34,9.42,9.34,9.4,1182820.0,0.02,0.06,0.02,215.79,0.06,658060.5,79.74,0.33,True,78.35,0.06,0.05,0.02,2026-01-02,9.2,2.17,0,,9.0,ATH,False,False
02-01-2026 17:00,JANTS,18.84,20.46,18.82,20.46,2294233.0,0.0,1.62,0.18,800.0,1.62,331737.1,591.58,0.0,True,90.86,0.17,0.05,0.12,2026-01-02,18.61,9.94,0,,18.46,ATH,False,False
02-01-2026 17:00,FENER,3.42,3.45,3.4,3.45,15784559.85,0.0,0.03,0.0,1185.71,0.03,5163133.41,205.72,0.11,True,51.46,-0.01,-0.01,0.0,2026-01-02,3.42,0.87,0,,3.39,3.52,False,False
02-01-2026 17:00,TATEN,12.73,13.5,12.65,13.3,3097169.0,0.2,0.57,0.06,850.0,0.57,1791020.9,72.93,0.35,True,66.74,0.23,0.17,0.05,2026-01-02,12.8,3.91,0,,11.04,ATH,False,False
02-01-2026 17:00,GSRAY,1.16,1.18,1.16,1.18,24992258.0,0.0,0.02,0.0,900.0,0.02,15985773.9,56.34,0.0,True,56.03,0.0,0.0,0.0,2026-01-02,1.16,1.72,2,1.16,1.16,1.2,False,False
02-01-2026 15:00,CEMTS,11.34,11.45,11.32,11.45,374271.0,0.0,0.11,0.02,478.95,0.11,244684.9,52.96,0.0,True,74.14,0.04,0.02,0.02,2026-01-02,11.25,1.78,0,,11.1,ATH,False,False
02-01-2026 15:00,PRKME,18.36,18.42,18.35,18.42,304800.0,0.0,0.06,0.0,1400.0,0.06,184686.8,65.04,0.0,True,58.16,0.03,0.04,-0.01,2026-01-02,18.48,-0.32,0,,18.03,18.51,False,False
02-01-2026 13:00,VSNMD,90.15,92.5,90.05,91.85,423729.0,0.65,1.7,0.18,818.92,1.7,114414.0,270.35,0.38,True,60.71,-0.1,-0.31,0.21,2026-01-02,89.5,2.63,0,,89.25,97.45,True,True
02-01-2026 13:00,MOGAN,8.29,8.47,8.27,8.42,1867105.0,0.05,0.13,0.03,400.0,0.13,563017.3,231.62,0.38,True,74.16,0.05,0.03,0.02,2026-01-02,8.19,2.81,0,,8.06,ATH,False,False
02-01-2026 11:00,FORTE,82.15,83.7,81.9,83.6,402082.0,0.1,1.45,0.16,806.25,1.45,150704.9,166.8,0.07,True,64.84,-0.05,-0.21,0.16,2026-01-02,80.8,3.47,0,,80.65,85.5,True,False
02-01-2026 10:00,TEZOL,11.89,12.0,11.87,11.98,242192.0,0.02,0.09,0.0,2900.0,0.09,106532.3,127.34,0.22,True,58.57,0.0,-0.01,0.01,2026-01-02,11.85,1.1,0,,11.85,11.99,False,False
02-01-2026 10:00,VAKFA,11.29,11.43,11.28,11.43,3651121.0,0.0,0.14,0.01,976.92,0.14,1778180.8,105.33,0.0,True,56.86,-0.02,-0.03,0.02,2026-01-02,11.24,1.69,0,,11.11,11.44,False,False
02-01-2026 10:00,ALVES,25.7,26.18,25.6,26.08,627306.0,0.1,0.38,0.05,660.0,0.38,237678.7,163.93,0.26,True,65.94,0.05,-0.01,0.06,2026-01-02,25.68,1.56,0,,25.16,26.56,False,False
02-01-2026 10:00,TKFEN,70.6,73.75,70.25,73.4,1102563.0,0.35,2.8,0.17,1547.06,2.8,408120.0,170.16,0.12,True,65.53,0.21,0.01,0.2,2026-01-02,70.4,4.26,0,,69.7,ATH,False,False
02-01-2026 10:00,ALFAS,40.96,41.22,40.96,41.2,185063.0,0.02,0.24,0.02,900.0,0.24,77575.5,138.56,0.08,True,60.75,0.05,0.02,0.04,2026-01-02,40.82,0.93,0,,40.14,41.32,False,False
02-01-2026 10:00,ALARK,102.3,104.3,102.3,103.9,2327983.0,0.4,1.6,0.14,1042.86,1.6,750102.4,210.36,0.25,True,61.0,-0.21,-0.42,0.2,2026-01-02,102.0,1.86,0,,101.5,106.3,True,True
02-01-2026 10:00,NIBAS,3.62,3.71,3.62,3.69,1327283.0,0.02,0.07,0.01,600.0,0.07,393139.4,237.61,0.29,True,63.99,-0.01,-0.02,0.01,2026-01-02,3.62,1.93,1,3.71,3.53,3.71,False,False
02-01-2026 10:00,SRVGY,3.2,3.28,3.18,3.28,5481449.0,0.0,0.08,0.01,515.38,0.08,1744714.0,214.17,0.0,True,61.56,-0.01,-0.02,0.01,2026-01-02,3.17,3.47,0,,3.11,ATH,False,False
02-01-2026 10:00,IMASM,4.72,4.91,4.72,4.87,13937237.0,0.04,0.15,0.01,971.43,0.15,3605887.1,286.51,0.27,True,70.9,0.04,0.03,0.01,2026-01-02,4.69,3.84,0,,4.44,ATH,False,False
02-01-2026 10:00,FORMT,3.23,3.36,3.21,3.34,8736871.0,0.02,0.11,0.02,547.06,0.11,3178853.3,174.84,0.18,True,67.1,0.0,-0.02,0.02,2026-01-02,3.19,4.7,1,3.36,3.06,3.36,False,False
02-01-2026 10:00,MNDTR,6.57,6.74,6.57,6.72,509053.0,0.02,0.15,0.02,552.17,0.15,250620.9,103.12,0.13,True,63.29,0.03,0.01,0.02,2026-01-02,6.57,2.28,0,,6.38,ATH,False,False
02-01-2026 10:00,KOTON,15.6,16.22,15.52,16.11,1327671.0,0.11,0.51,0.04,1242.11,0.51,344034.5,285.91,0.22,True,74.14,0.12,0.09,0.03,2026-01-02,15.6,3.27,3,,15.01,ATH,False,False
02-01-2026 10:00,KLMSN,31.52,32.64,31.44,32.44,474586.0,0.2,0.92,0.02,5650.0,0.92,245804.1,93.07,0.22,True,41.81,-0.84,-0.8,-0.04,2026-01-02,31.48,3.05,0,,31.2,38.86,False,False
02-01-2026 10:00,EGSER,3.01,3.02,2.98,3.02,611379.0,0.0,0.01,0.0,900.0,0.01,221406.8,176.13,0.0,True,51.22,-0.01,-0.02,0.01,2026-01-02,2.99,1.0,0,,2.97,ATH,True,False
02-01-2026 10:00,ELITE,28.26,28.94,28.26,28.8,190934.0,0.14,0.54,0.04,1321.05,0.54,48615.2,292.75,0.26,True,63.15,-0.02,-0.07,0.05,2026-01-02,28.26,1.91,1,28.94,27.92,28.94,True,False
02-01-2026 10:00,ENDAE,14.13,14.36,14.13,14.35,352286.0,0.01,0.22,0.03,714.81,0.22,146475.0,140.51,0.05,True,55.02,-0.03,-0.04,0.02,2026-01-02,14.11,1.7,0,,14.01,14.54,False,False
02-01-2026 10:00,BRLSM,13.25,13.58,13.23,13.56,479300.0,0.02,0.31,0.03,811.76,0.31,147387.7,225.2,0.06,True,71.46,0.02,-0.02,0.03,2026-01-02,13.17,2.96,0,,13.15,13.65,False,False
02-01-2026 10:00,HUNER,3.1,3.14,3.1,3.13,2297162.0,0.01,0.03,0.0,650.0,0.03,1139069.3,101.67,0.33,True,57.31,-0.0,-0.01,0.0,2026-01-02,3.09,1.29,0,,3.08,3.18,True,False
02-01-2026 10:00,HUBVC,2.46,2.64,2.45,2.62,1790584.0,0.02,0.16,0.02,900.0,0.16,339879.3,426.83,0.12,True,65.27,0.01,0.0,0.0,2026-01-02,2.49,5.22,2,2.45,2.45,ATH,False,False
02-01-2026 10:00,GZNMI,57.9,62.7,57.1,62.7,2927588.0,0.0,4.8,0.65,644.19,4.8,1062727.0,175.48,0.0,True,66.86,1.26,0.86,0.39,2026-01-02,57.0,10.0,1,62.7,48.12,ATH,False,False
02-01-2026 10:00,EPLAS,5.06,5.15,5.06,5.13,696474.0,0.02,0.07,0.0,1650.0,0.07,134954.1,416.08,0.29,True,69.73,0.01,0.01,0.01,2026-01-02,5.05,1.58,0,,5.01,ATH,False,False
02-01-2026 10:00,ESEN,4.44,4.64,4.4,4.62,30546056.0,0.02,0.18,0.04,386.49,0.18,7388804.9,313.41,0.11,True,72.58,0.04,0.01,0.02,2026-01-02,4.44,4.05,0,,4.22,ATH,False,False
02-01-2026 10:00,FONET,2.81,2.93,2.81,2.93,23716216.0,0.0,0.12,0.02,650.0,0.12,4782923.1,395.85,0.0,True,75.39,0.03,0.02,0.01,2026-01-02,2.79,5.02,0,,2.65,ATH,False,False
02-01-2026 10:00,ODAS,5.11,5.18,5.09,5.18,7759912.0,0.0,0.07,0.0,2233.33,0.07,2711072.7,186.23,0.0,True,65.49,0.0,-0.0,0.01,2026-01-02,5.07,2.17,0,,5.05,5.19,False,False
02-01-2026 10:00,CEMAS,4.07,4.15,4.05,4.14,4403726.0,0.01,0.07,0.01,536.36,0.07,1388725.1,217.11,0.14,True,60.91,-0.01,-0.02,0.01,2026-01-02,4.04,2.48,0,,3.95,4.48,True,False
02-01-2026 10:00,OSMEN,7.85,8.08,7.85,8.06,577553.0,0.02,0.21,0.02,1212.5,0.21,145760.5,296.23,0.1,True,62.42,0.02,0.03,-0.01,2026-01-02,7.84,2.81,0,,7.84,ATH,False,False
02-01-2026 10:00,BINHO,8.86,9.29,8.85,9.28,11216903.0,0.01,0.42,0.04,876.74,0.42,2254333.9,397.57,0.02,True,81.85,0.03,-0.0,0.03,2026-01-02,8.83,5.1,0,,8.72,ATH,False,False
02-01-2026 10:00,AYDEM,22.54,22.96,22.22,22.94,1188083.0,0.02,0.4,0.06,566.67,0.4,485444.0,144.74,0.05,True,82.66,0.36,0.29,0.07,2026-01-02,22.54,1.77,0,,20.96,ATH,False,False
02-01-2026 10:00,BIENY,25.06,26.06,25.06,26.0,1638400.0,0.06,0.94,0.07,1170.27,0.94,277216.1,491.02,0.06,True,72.37,0.11,0.07,0.04,2026-01-02,25.06,3.75,0,,25.02,ATH,False,False
02-01-2026 10:00,BIGEN,8.91,9.08,8.91,9.07,814787.0,0.01,0.16,0.02,788.89,0.16,313868.6,159.59,0.06,True,63.21,0.01,-0.01,0.02,2026-01-02,8.9,1.91,0,,8.88,9.18,False,False
02-01-2026 10:00,QUAGR,2.85,3.1,2.83,3.08,68579257.0,0.02,0.23,0.03,666.67,0.23,14849334.8,361.83,0.09,True,80.49,0.06,0.04,0.01,2026-01-02,2.85,8.07,2,2.83,2.83,ATH,False,False
02-01-2026 10:00,A1CAP,11.81,12.59,11.81,12.57,10577057.0,0.02,0.76,0.07,1051.52,0.76,2025789.7,422.12,0.03,True,85.37,0.27,0.21,0.06,2026-01-02,11.8,6.53,0,,10.64,ATH,False,False
02-01-2026 10:00,PAPIL,16.04,16.29,16.04,16.25,1521405.0,0.04,0.21,0.03,650.0,0.21,437054.8,248.1,0.19,True,47.23,-0.14,-0.15,0.02,2026-01-02,16.03,1.37,0,,15.9,17.3,True,False
02-01-2026 10:00,BNTAS,6.36,6.4,6.34,6.39,268460.0,0.01,0.03,0.01,328.57,0.03,121683.5,120.62,0.33,True,68.22,0.01,0.0,0.01,2026-01-02,6.33,0.95,0,,6.23,6.41,False,False
31-12-2025 17:00,AVGYO,9.36,9.5,9.32,9.49,223363.0,0.01,0.13,0.0,4233.33,0.13,101409.6,120.26,0.08,True,54.8,-0.0,-0.01,0.0,2025-12-31,9.43,0.64,2,9.32,9.32,9.64,False,False
31-12-2025 17:00,ESCAR,24.6,25.66,24.58,25.66,2465800.0,0.0,1.06,0.1,1004.17,1.06,704711.4,249.9,0.0,True,79.36,0.17,0.11,0.06,2025-12-31,24.64,4.14,0,,ATL,ATH,False,False
31-12-2025 17:00,DMRGD,3.11,3.31,3.09,3.31,28806090.0,0.0,0.2,0.03,640.74,0.2,4367988.8,559.48,0.0,True,72.74,0.0,-0.02,0.02,2025-12-31,3.01,9.97,0,,2.98,ATH,False,False
31-12-2025 17:00,VBTYZ,16.66,16.95,16.57,16.94,394418.0,0.01,0.28,0.02,1455.56,0.28,163594.8,141.09,0.04,True,58.55,-0.02,-0.04,0.01,2025-12-31,16.8,0.83,0,,15.96,ATH,False,False
31-12-2025 17:00,NTGAZ,10.23,10.47,10.19,10.46,1669375.0,0.01,0.23,0.02,1050.0,0.23,760366.5,119.55,0.04,True,71.98,0.16,0.14,0.02,2025-12-31,10.2,2.55,0,,ATL,ATH,False,False
31-12-2025 16:00,BUCIM,7.61,7.68,7.6,7.66,1974072.0,0.02,0.05,0.02,212.5,0.05,971066.2,103.29,0.4,True,78.61,0.07,0.06,0.01,2025-12-31,7.55,1.46,0,,7.14,ATH,False,False
31-12-2025 13:00,AKYHO,2.72,2.75,2.71,2.75,391081.0,0.0,0.03,0.0,2900.0,0.03,123473.9,216.73,0.0,True,51.03,-0.01,-0.01,-0.0,2025-12-31,2.74,0.36,0,,2.69,2.89,False,False
31-12-2025 12:00,PLTUR,22.08,22.64,21.9,22.58,614146.0,0.06,0.5,0.04,1036.36,0.5,267864.0,129.28,0.12,True,62.64,0.03,-0.01,0.04,2025-12-31,22.08,2.26,0,,21.46,22.9,False,False
31-12-2025 12:00,BAYRK,5.17,5.47,5.15,5.4,2746143.0,0.07,0.23,0.0,5650.0,0.23,808391.2,239.7,0.3,True,59.3,0.0,0.01,-0.0,2025-12-31,5.23,3.25,0,,5.11,5.54,False,False
31-12-2025 12:00,ARTMS,36.84,37.74,36.48,37.54,227313.0,0.2,0.7,0.07,960.61,0.7,125833.2,80.65,0.29,True,54.09,-0.27,-0.32,0.05,2025-12-31,36.3,3.42,0,,35.7,39.0,False,False
31-12-2025 11:00,EMKEL,34.0,34.62,34.0,34.58,10972611.0,0.04,0.58,0.06,900.0,0.58,4426923.1,147.86,0.07,True,8.99,-1.68,-1.37,-0.31,2025-12-31,37.76,-8.42,2,34.0,34.0,41.94,False,False
31-12-2025 10:00,BMSTL,90.3,92.0,89.6,91.95,298026.0,0.05,1.65,0.32,415.62,1.65,130411.1,128.53,0.03,True,73.76,0.57,0.44,0.13,2025-12-31,90.3,1.83,0,,87.05,93.75,False,False
31-12-2025 10:00,ALKLC,174.4,189.8,174.4,189.7,1966542.0,0.1,15.3,0.54,2733.33,15.3,294609.1,567.51,0.01,True,32.05,-7.57,-6.3,-1.27,2025-12-31,193.7,-2.07,2,174.4,174.4,ATH,False,False
31-12-2025 10:00,KONTR,10.93,11.15,10.86,11.11,27252212.0,0.04,0.18,0.01,1185.71,0.18,12328988.2,121.04,0.22,True,49.26,-0.08,-0.09,0.01,2025-12-31,10.8,2.87,0,,10.8,ATH,False,False
30-12-2025 17:00,PNSUT,10.99,11.12,10.99,11.1,139598.0,0.02,0.11,0.03,243.75,0.11,77835.3,79.35,0.18,True,59.73,-0.01,-0.03,0.02,2025-12-30,10.88,2.02,0,,10.68,ATH,False,False
30-12-2025 11:00,DESA,11.08,12.01,11.06,11.81,1971536.0,0.2,0.73,0.07,973.53,0.73,227874.3,765.19,0.27,True,84.65,0.03,-0.01,0.04,2025-12-30,11.09,6.49,0,,11.01,ATH,False,False
30-12-2025 10:00,CGCAM,34.0,35.04,34.0,34.84,1745207.0,0.2,0.84,0.0,20900.0,0.84,437801.7,298.63,0.24,True,66.54,0.09,0.09,-0.0,2025-12-30,33.86,2.89,0,,33.8,35.4,False,False
30-12-2025 10:00,EKOS,5.77,6.18,5.77,6.09,9666296.0,0.09,0.32,0.02,1900.0,0.32,2791424.6,246.29,0.28,True,39.94,-0.09,-0.09,0.0,2025-12-30,5.78,5.36,1,6.18,5.75,6.18,False,False
30-12-2025 10:00,MAKTK,15.48,16.54,15.15,16.48,9957208.0,0.06,1.0,0.16,545.16,1.0,2179915.9,356.77,0.06,True,88.7,0.3,0.18,0.13,2025-12-30,15.1,9.14,0,,ATL,ATH,False,False
29-12-2025 15:00,IZMDC,6.44,6.92,6.42,6.81,6928397.0,0.11,0.37,0.03,1175.86,0.37,1137310.3,509.19,0.3,True,78.83,0.01,0.0,0.01,2025-12-29,6.55,3.97,0,,6.25,ATH,False,False
29-12-2025 13:00,MERKO,13.96,14.51,13.94,14.48,3442978.0,0.03,0.52,0.1,436.08,0.52,1883748.8,82.77,0.06,True,91.45,0.09,0.05,0.04,2025-12-29,13.6,6.47,0,,ATL,ATH,False,False
26-12-2025 16:00,SELVA,2.36,2.48,2.35,2.47,6953944.0,0.01,0.11,0.02,547.06,0.11,2627958.5,164.61,0.09,True,59.53,-0.02,-0.04,0.02,2025-12-26,2.3,7.39,0,,2.24,ATH,True,False
