Tarih,Hisse,open,high,low,close,volume,YuksekKapanis_Fark,AcilisKapanis_Fark,AcilisKapanisFark_Ort,AcilisKapanisFark_OrtalamayaGoreDegisim,AcilisKapanisFarkOrt_MaxSon10,HacimOrtalama,%Hacim_HacimOrtalama,Fark_Orani,Kosul,rsi,MACD_12_26_9,MACDs_12_26_9,MACDh_12_26_9,Tarih1,prev_close,%Deg,isPivot,pointpos,destek,direnc,Tsinyal_Banker_Dip,Tsinyal_Banker_DipKarar
21-01-2026 10:00,IHAAS,50.6,53.75,49.8,53.5,634750.0,0.25,2.9,0.79,267.09,2.9,288597.1,119.94,0.09,True,89.09,2.25,1.64,0.61,2026-01-21,49.1,8.96,0,,40.84,ATH,False,False
21-01-2026 10:00,VKFYO,56.5,58.0,53.7,57.85,191866.0,0.15,1.35,0.27,409.43,1.35,108241.9,77.26,0.11,True,61.94,2.31,2.54,-0.23,2026-01-21,58.9,-1.78,0,,43.0,60.5,False,False
21-01-2026 10:00,IHGZT,1.55,1.58,1.54,1.58,5508270.0,0.0,0.03,0.0,900.0,0.03,2285317.9,141.03,0.0,True,60.89,0.0,0.0,0.0,2026-01-21,1.55,1.94,0,,1.54,1.61,False,False
21-01-2026 10:00,TRENJ,113.2,120.0,113.2,118.8,1361692.0,1.2,5.6,1.27,340.94,5.6,618548.0,120.14,0.21,True,82.68,3.44,2.94,0.5,2026-01-21,114.2,4.03,0,,104.9,ATH,False,False
21-01-2026 10:00,KLSYN,6.93,7.39,6.85,7.27,2205976.0,0.12,0.34,0.04,750.0,0.34,646036.9,241.46,0.35,True,62.75,0.01,-0.02,0.02,2026-01-21,6.95,4.6,0,,6.88,7.7,False,False
21-01-2026 10:00,IZENR,8.66,8.9,8.54,8.88,5063817.0,0.02,0.22,0.01,2100.0,0.22,2121059.3,138.74,0.09,True,53.52,-0.09,-0.11,0.02,2026-01-21,8.61,3.14,0,,8.7,9.18,True,True
21-01-2026 10:00,SUNTK,38.5,40.4,38.18,39.92,651433.0,0.48,1.42,0.12,1083.33,1.42,140788.4,362.7,0.34,True,63.23,-0.23,-0.37,0.14,2026-01-21,38.0,5.05,0,,39.0,41.0,True,False
21-01-2026 10:00,VAKFA,13.43,13.99,13.1,13.89,32121834.0,0.1,0.46,0.07,557.14,0.46,6066331.9,429.51,0.22,True,93.28,0.43,0.36,0.08,2026-01-21,13.16,5.55,0,,11.97,ATH,False,False
20-01-2026 17:00,MARKA,35.6,36.76,35.28,36.6,323503.0,0.16,1.0,0.14,614.29,1.0,200363.6,61.46,0.16,True,59.6,0.26,0.14,0.12,2026-01-20,35.14,4.15,0,,34.8,37.38,False,False
20-01-2026 17:00,PINSU,11.62,11.67,11.59,11.67,439571.0,0.0,0.05,0.0,2400.0,0.05,264870.5,65.96,0.0,True,47.76,0.0,0.02,-0.02,2026-01-20,11.66,0.09,0,,11.29,12.31,False,False
20-01-2026 17:00,DOHOL,19.78,20.08,19.52,20.08,5315870.0,0.0,0.3,0.03,934.48,0.3,1447998.7,267.12,0.0,True,68.88,0.11,0.12,-0.01,2026-01-20,19.84,1.21,0,,18.51,20.1,False,False
20-01-2026 17:00,SAMAT,5.73,5.94,5.73,5.92,827316.0,0.02,0.19,0.01,1627.27,0.19,163546.3,405.86,0.11,True,66.66,0.01,0.01,0.0,2026-01-20,5.8,2.07,0,,5.66,ATH,False,False
20-01-2026 17:00,ICUGS,2.59,2.61,2.58,2.61,2896371.0,0.0,0.02,0.0,4.50359962737049e+16,0.02,1476733.0,96.13,0.0,True,45.87,-0.01,-0.0,-0.0,2026-01-20,2.62,-0.38,0,,2.59,2.67,False,False
20-01-2026 17:00,FRIGO,14.88,15.25,14.88,15.21,2870549.0,0.04,0.33,0.05,534.62,0.33,1126160.7,154.9,0.12,True,67.46,0.1,0.06,0.04,2026-01-20,14.7,3.47,0,,14.08,ATH,False,False
20-01-2026 17:00,IEYHO,72.1,72.85,72.05,72.65,2119267.0,0.2,0.55,0.07,746.15,0.55,698589.1,203.36,0.36,True,73.41,0.29,0.31,-0.02,2026-01-20,72.0,0.9,0,,71.8,72.75,False,False
20-01-2026 17:00,MEYSU,10.62,11.6,10.46,11.6,59759021.0,0.0,0.98,0.1,833.33,0.98,22200911.2,169.17,0.0,True,69.19,0.08,0.1,-0.02,2026-01-20,10.55,9.95,0,,9.97,11.96,False,False
20-01-2026 17:00,UNLU,15.26,15.43,15.24,15.4,313957.0,0.03,0.14,0.0,4566.67,0.14,127062.0,147.09,0.21,True,53.81,0.03,0.04,-0.01,2026-01-20,15.39,0.06,0,,15.28,15.66,False,False
20-01-2026 17:00,EKOS,5.92,6.04,5.9,6.01,2380161.0,0.03,0.09,0.0,2150.0,0.09,1105303.2,115.34,0.33,True,51.86,-0.02,-0.02,-0.0,2026-01-20,5.95,1.01,0,,5.85,6.1,False,False
20-01-2026 17:00,MERKO,14.38,14.59,14.33,14.59,1517379.0,0.0,0.21,0.01,1400.0,0.21,656612.4,131.09,0.0,True,64.87,0.05,0.04,0.0,2026-01-20,14.4,1.32,0,,14.32,14.62,False,False
20-01-2026 17:00,INDES,7.73,7.8,7.69,7.78,2944414.0,0.02,0.05,0.01,284.62,0.05,1158538.7,154.15,0.4,True,68.57,0.03,0.03,0.01,2026-01-20,7.66,1.57,0,,7.62,ATH,False,False
20-01-2026 17:00,GUBRF,393.75,405.0,392.75,404.25,2237647.0,0.75,10.5,1.98,431.65,10.5,526239.5,325.21,0.07,True,79.26,7.04,5.29,1.75,2026-01-20,384.0,5.27,0,,361.5,ATH,False,False
20-01-2026 17:00,VSNMD,95.15,101.3,94.2,101.3,2867965.0,0.0,6.15,0.91,572.13,6.15,514954.0,456.94,0.0,True,85.82,1.15,0.46,0.69,2026-01-20,92.15,9.93,0,,90.8,ATH,False,False
20-01-2026 17:00,BIENY,23.48,23.62,23.36,23.6,643355.0,0.02,0.12,0.01,1400.0,0.12,199632.9,222.27,0.17,True,54.76,0.05,0.07,-0.02,2026-01-20,23.5,0.43,0,,22.7,23.8,False,False
20-01-2026 17:00,DAPGM,10.69,10.91,10.66,10.91,1453594.0,0.0,0.22,0.01,2100.0,0.22,663598.0,119.05,0.0,True,50.48,-0.08,-0.1,0.02,2026-01-20,10.8,1.02,0,,10.6,11.1,True,True
20-01-2026 17:00,QUAGR,2.65,2.66,2.63,2.66,14884830.0,0.0,0.01,0.0,900.0,0.01,7547028.4,97.23,0.0,True,49.6,0.01,0.02,-0.01,2026-01-20,2.69,-1.12,0,,2.58,2.74,False,False
20-01-2026 17:00,KFEIN,9.02,9.21,8.94,9.18,1208412.0,0.03,0.16,0.02,841.18,0.16,621616.1,94.4,0.19,True,63.88,0.08,0.08,-0.0,2026-01-20,9.02,1.77,0,,8.92,ATH,False,False
20-01-2026 17:00,KLRHO,410.75,426.75,410.5,425.0,367817.0,1.75,14.25,3.22,341.86,14.25,206850.4,77.82,0.12,True,70.18,11.9,8.93,2.97,2026-01-20,391.75,8.49,0,,345.5,ATH,False,False
20-01-2026 17:00,RGYAS,149.9,151.0,148.5,150.7,188114.0,0.3,0.8,0.01,7900.0,0.8,67082.7,180.42,0.38,True,52.44,0.19,0.4,-0.2,2026-01-20,151.0,-0.2,0,,138.2,152.0,False,False
20-01-2026 17:00,YUNSA,8.18,8.23,8.13,8.22,1845693.0,0.01,0.04,0.01,233.33,0.04,621713.7,196.87,0.25,True,64.85,0.02,0.02,0.0,2026-01-20,8.11,1.36,0,,8.08,8.24,False,False
20-01-2026 17:00,AHSGY,19.59,22.18,19.57,22.18,1533678.0,0.0,2.59,0.22,1056.25,2.59,288048.6,432.44,0.0,True,71.55,-0.19,-0.39,0.2,2026-01-20,20.18,9.91,0,,19.5,26.6,True,True
20-01-2026 16:00,EGEPO,9.39,9.88,9.39,9.75,3624223.0,0.13,0.36,0.03,958.82,0.36,718510.8,404.41,0.36,True,71.84,0.07,0.05,0.02,2026-01-20,9.43,3.39,0,,9.18,ATH,False,False
20-01-2026 16:00,EDATA,8.44,8.92,8.44,8.87,9829283.0,0.05,0.43,0.07,514.29,0.43,2899630.6,238.98,0.12,True,68.42,0.07,0.01,0.06,2026-01-20,8.11,9.37,0,,8.01,9.55,False,False
20-01-2026 16:00,YYLGD,12.6,13.17,12.54,13.17,8973519.0,0.0,0.57,0.11,432.71,0.57,3211864.6,179.39,0.0,True,76.56,0.26,0.21,0.05,2026-01-20,11.98,9.93,0,,11.92,ATH,False,False
20-01-2026 15:00,ZERGY,10.82,11.25,10.73,11.24,7492509.0,0.01,0.42,0.07,517.65,0.42,3962099.0,89.1,0.02,True,75.72,0.18,0.12,0.06,2026-01-20,10.48,7.25,0,,10.07,ATH,False,False
20-01-2026 15:00,ELITE,30.62,31.14,30.6,31.0,474264.0,0.14,0.38,0.03,1087.5,0.38,157803.8,200.54,0.37,True,70.58,0.32,0.31,0.01,2026-01-20,30.24,2.51,0,,27.6,ATH,False,False
20-01-2026 15:00,VAKFN,2.07,2.16,2.05,2.16,201949669.0,0.0,0.09,0.02,429.41,0.09,38561540.6,423.71,0.0,True,83.45,0.03,0.01,0.02,2026-01-20,1.97,9.64,0,,1.96,ATH,False,False
20-01-2026 15:00,SKYMD,12.11,12.36,12.11,12.31,917384.0,0.05,0.2,0.02,809.09,0.2,264711.2,246.56,0.25,True,65.29,0.02,0.0,0.02,2026-01-20,12.1,1.74,0,,12.05,12.45,False,False
20-01-2026 15:00,MAVI,45.74,46.2,45.62,46.08,1766621.0,0.12,0.34,0.05,608.33,0.34,1122620.0,57.37,0.35,True,59.83,0.0,-0.02,0.03,2026-01-20,45.42,1.45,0,,44.78,46.9,False,False
20-01-2026 14:00,KARSN,9.92,10.11,9.88,10.09,3996941.0,0.02,0.17,0.03,466.67,0.17,2211176.1,80.76,0.12,True,70.68,0.07,0.05,0.02,2026-01-20,9.74,3.59,0,,9.7,ATH,False,False
20-01-2026 14:00,DSTKF,659.0,669.0,658.0,667.0,351618.0,2.0,8.0,1.45,451.72,8.0,224314.3,56.75,0.25,True,59.68,-1.69,-2.72,1.03,2026-01-20,649.0,2.77,0,,644.0,674.0,False,False
20-01-2026 14:00,VRGYO,2.55,2.59,2.54,2.59,3867772.0,0.0,0.04,0.0,900.0,0.04,2289508.5,68.93,0.0,True,65.69,0.02,0.02,-0.0,2026-01-20,2.57,0.78,0,,2.51,2.65,False,False
20-01-2026 14:00,SKTAS,4.02,4.15,3.99,4.14,4799006.0,0.01,0.12,0.0,2900.0,0.12,1067336.8,349.62,0.08,True,68.0,0.03,0.03,0.01,2026-01-20,3.99,3.76,0,,3.97,4.16,False,False
20-01-2026 14:00,VAKBN,33.18,33.76,33.1,33.74,7361666.0,0.02,0.56,0.03,2053.85,0.56,4201921.9,75.2,0.04,True,66.92,0.38,0.38,-0.01,2026-01-20,33.44,0.9,0,,32.72,33.98,False,False
20-01-2026 13:00,JANTS,20.0,20.56,19.97,20.52,1946102.0,0.04,0.52,0.04,1081.82,0.52,445640.0,336.7,0.08,True,74.57,0.07,0.05,0.01,2026-01-20,20.02,2.5,0,,19.9,ATH,False,False
20-01-2026 13:00,AKYHO,2.75,3.04,2.72,2.99,6066912.0,0.05,0.24,0.03,727.59,0.24,757549.7,700.86,0.21,True,82.64,0.04,0.02,0.01,2026-01-20,2.77,7.94,0,,2.71,ATH,False,False
20-01-2026 13:00,OYLUM,8.36,8.5,8.35,8.48,151663.0,0.02,0.12,0.01,1100.0,0.12,79592.3,90.55,0.17,True,58.68,-0.01,-0.04,0.02,2026-01-20,8.32,1.92,0,,8.2,8.78,False,False
20-01-2026 13:00,AHGAZ,22.82,23.5,22.82,23.44,1659084.0,0.06,0.62,0.06,1007.14,0.62,424409.2,290.92,0.1,True,77.13,0.17,0.14,0.02,2026-01-20,22.68,3.35,0,,22.6,ATH,False,False
20-01-2026 13:00,DMRGD,3.39,3.54,3.39,3.5,35474004.0,0.04,0.11,0.02,587.5,0.11,5350955.1,562.95,0.36,True,73.49,0.02,0.0,0.02,2026-01-20,3.28,6.71,0,,3.28,3.52,False,False
20-01-2026 13:00,KOCMT,2.69,2.78,2.69,2.77,10212760.0,0.01,0.08,0.01,900.0,0.08,2999365.0,240.5,0.12,True,67.08,0.01,0.01,0.0,2026-01-20,2.68,3.36,0,,2.67,ATH,False,False
20-01-2026 13:00,DOFRB,85.9,90.35,85.6,89.55,7517103.0,0.8,3.65,0.24,1420.83,3.65,2459499.6,205.64,0.22,True,62.89,0.34,0.25,0.09,2026-01-20,87.95,1.82,0,,85.55,89.95,False,False
20-01-2026 13:00,ATAKP,59.3,61.95,59.3,61.4,365982.0,0.55,2.1,0.14,1348.28,2.1,146361.6,150.05,0.26,True,64.32,0.41,0.42,-0.01,2026-01-20,59.1,3.89,0,,58.0,62.15,False,False
20-01-2026 12:00,NTGAZ,10.2,10.37,10.17,10.37,2304979.0,0.0,0.17,0.0,4150.0,0.17,1015864.4,126.9,0.0,True,63.52,0.04,0.01,0.02,2026-01-20,10.06,3.08,0,,9.99,ATH,False,False
20-01-2026 12:00,ADGYO,67.5,69.2,66.85,68.75,307938.0,0.45,1.25,0.31,303.23,1.25,171796.0,79.25,0.36,True,78.41,1.38,1.36,0.02,2026-01-20,66.7,3.07,1,69.2,63.7,69.2,False,False
20-01-2026 12:00,PLTUR,21.58,21.82,21.54,21.82,503787.0,0.0,0.24,0.04,471.43,0.24,275921.7,82.58,0.0,True,69.4,0.11,0.08,0.03,2026-01-20,21.38,2.06,0,,20.72,ATH,False,False
20-01-2026 12:00,DGNMO,4.98,5.02,4.97,5.01,374378.0,0.01,0.03,0.0,2900.0,0.03,212326.9,76.32,0.33,True,56.73,0.02,0.03,-0.01,2026-01-20,5.01,0.0,0,,4.8,5.07,False,False
20-01-2026 11:00,TEKTU,8.1,8.64,8.1,8.58,9519556.0,0.06,0.48,0.04,1233.33,0.48,1710752.6,456.45,0.13,True,64.89,-0.05,-0.07,0.02,2026-01-20,8.17,5.02,0,,8.04,8.63,True,True
20-01-2026 11:00,TERA,179.1,184.3,177.0,184.3,7065871.0,0.0,5.2,0.85,511.76,5.2,1668900.6,323.38,0.0,True,78.65,3.27,1.58,1.69,2026-01-20,173.8,6.04,0,,172.6,ATH,False,False
20-01-2026 11:00,NATEN,9.23,9.43,9.21,9.4,3317653.0,0.03,0.17,0.01,2025.0,0.17,1305566.4,154.12,0.18,True,57.01,-0.03,-0.04,0.01,2026-01-20,9.17,2.51,0,,9.11,9.75,True,True
20-01-2026 11:00,GARFA,29.26,30.22,29.22,30.04,778728.0,0.18,0.78,0.07,983.33,0.78,195944.1,297.42,0.23,True,66.6,-0.01,-0.06,0.05,2026-01-20,29.1,3.23,0,,28.92,30.26,False,False
20-01-2026 11:00,YAYLA,29.6,30.86,29.38,30.68,1429614.0,0.18,1.08,0.24,346.28,1.08,312265.2,357.82,0.17,True,75.57,0.36,0.18,0.18,2026-01-20,28.48,7.72,1,30.86,27.82,30.86,False,False
20-01-2026 11:00,NTHOL,46.68,47.36,46.64,47.2,327511.0,0.16,0.52,0.03,1525.0,0.52,168548.6,94.31,0.31,True,63.0,0.1,0.09,0.01,2026-01-20,46.54,1.42,0,,46.3,47.84,False,False
20-01-2026 11:00,OZYSR,41.96,42.9,41.86,42.64,198492.0,0.26,0.68,0.14,385.71,0.68,103433.3,91.9,0.38,True,64.94,0.13,0.08,0.05,2026-01-20,41.64,2.4,1,42.9,40.78,42.9,False,False
20-01-2026 11:00,BULGS,45.3,46.6,45.26,46.24,3510909.0,0.36,0.94,0.09,968.18,0.94,899859.8,290.16,0.38,True,70.88,0.28,0.25,0.03,2026-01-20,44.9,2.98,1,46.6,44.62,46.6,False,False
20-01-2026 11:00,MAGEN,41.84,43.0,41.82,42.94,783472.0,0.06,1.1,0.07,1517.65,1.1,457698.9,71.18,0.05,True,54.14,0.02,0.1,-0.08,2026-01-20,42.58,0.85,0,,41.8,43.58,False,False
20-01-2026 10:00,SEGMN,32.84,35.0,31.6,35.0,7135955.0,0.0,2.16,0.22,900.0,2.16,879743.4,711.14,0.0,True,93.99,1.91,1.78,0.12,2026-01-20,31.82,9.99,3,,19.2,ATH,False,False
20-01-2026 10:00,MARMR,2.49,2.76,2.41,2.76,259193322.0,0.0,0.27,0.01,2600.0,0.27,69447915.0,273.22,0.0,True,70.34,0.07,0.09,-0.02,2026-01-20,2.51,9.96,3,,2.07,2.82,False,False
20-01-2026 10:00,GSDHO,4.71,4.8,4.7,4.8,3976870.0,0.0,0.09,0.01,900.0,0.09,1029045.9,286.46,0.0,True,69.03,0.03,0.02,0.0,2026-01-20,4.71,1.91,0,,4.65,ATH,False,False
20-01-2026 10:00,BTCIM,4.44,4.75,4.44,4.74,152457394.0,0.01,0.3,0.03,1053.85,0.3,25596901.9,495.61,0.03,True,81.09,0.06,0.06,0.01,2026-01-20,4.4,7.73,0,,4.39,ATH,False,False
20-01-2026 10:00,SDTTR,207.1,215.2,206.8,214.2,590716.0,1.0,7.1,0.74,859.46,7.1,136684.0,332.18,0.14,True,61.2,-0.1,-0.06,-0.05,2026-01-20,207.1,3.43,0,,205.8,220.7,False,False
20-01-2026 10:00,DMLKT,5.78,6.03,5.77,5.98,20946094.0,0.05,0.2,0.02,852.38,0.2,4096022.4,411.38,0.25,True,88.29,0.02,0.01,0.02,2026-01-20,5.77,3.64,1,6.03,5.72,6.03,False,False
20-01-2026 10:00,GLYHO,12.44,12.79,12.43,12.75,3494111.0,0.04,0.31,0.03,933.33,0.31,857109.6,307.66,0.13,True,76.04,0.06,0.05,0.01,2026-01-20,12.43,2.57,0,,12.07,ATH,False,False
20-01-2026 10:00,INFO,4.0,4.05,3.97,4.04,6389783.0,0.01,0.04,0.0,1900.0,0.04,2772075.8,130.51,0.25,True,66.96,0.03,0.03,0.0,2026-01-20,4.0,1.0,2,3.97,3.97,4.09,False,False
20-01-2026 10:00,PRDGS,6.52,6.81,6.49,6.8,3186428.0,0.01,0.28,0.02,1766.67,0.28,523773.2,508.36,0.04,True,70.03,0.03,0.02,0.01,2026-01-20,6.51,4.45,2,6.49,6.49,6.98,False,False
20-01-2026 10:00,TCKRC,90.1,95.7,90.05,94.25,2317393.0,1.45,4.15,0.68,514.81,4.15,518669.9,346.8,0.35,True,73.52,1.83,1.81,0.02,2026-01-20,90.0,4.72,0,,86.0,ATH,False,False
20-01-2026 10:00,OYAKC,25.42,25.88,25.32,25.82,8111594.0,0.06,0.4,0.02,1900.0,0.4,2715200.4,198.75,0.15,True,70.3,0.28,0.24,0.03,2026-01-20,25.44,1.49,2,25.32,25.32,26.12,False,False
20-01-2026 10:00,KRSTL,10.71,10.88,10.62,10.84,1073418.0,0.04,0.13,0.01,900.0,0.13,433673.2,147.52,0.31,True,70.08,0.11,0.12,-0.01,2026-01-20,10.7,1.31,2,10.62,10.62,10.96,False,False
20-01-2026 10:00,ASELS,317.5,326.5,317.0,325.75,13545245.0,0.75,8.25,1.12,633.33,8.25,5329714.2,154.15,0.09,True,75.19,6.2,6.29,-0.09,2026-01-20,316.0,3.09,0,,283.0,ATH,False,False
20-01-2026 10:00,OBASE,36.64,40.6,36.36,39.58,951796.0,1.02,2.94,0.43,580.56,2.94,198774.9,378.83,0.35,True,76.02,0.85,0.64,0.21,2026-01-20,37.62,5.21,2,36.36,36.36,ATH,False,False
20-01-2026 10:00,YESIL,1.83,1.86,1.81,1.86,4715781.0,0.0,0.03,0.0,900.0,0.03,2122322.7,122.2,0.0,True,54.27,-0.0,0.0,-0.0,2026-01-20,1.83,1.64,3,,1.81,1.94,False,False
20-01-2026 10:00,OZSUB,17.5,18.48,17.35,18.32,2269971.0,0.16,0.82,0.09,853.49,0.82,331597.6,584.56,0.2,True,79.24,0.12,0.06,0.06,2026-01-20,17.46,4.93,0,,17.1,ATH,False,False
20-01-2026 10:00,BRSAN,650.0,677.5,650.0,671.5,1251054.0,6.0,21.5,0.9,2288.89,21.5,251352.7,397.73,0.28,True,65.31,3.4,4.03,-0.64,2026-01-20,647.5,3.71,1,677.5,646.5,677.5,False,False
20-01-2026 10:00,ONRYT,71.4,72.5,71.35,72.25,173368.0,0.25,0.85,0.0,16900.0,0.85,85156.8,103.59,0.29,True,49.48,-0.21,-0.07,-0.14,2026-01-20,71.6,0.91,2,71.35,71.35,73.85,False,False
20-01-2026 10:00,BSOKE,24.1,26.58,24.0,26.48,19243623.0,0.1,2.38,0.08,2875.0,2.38,4696150.5,309.77,0.04,True,58.82,0.12,0.32,-0.19,2026-01-20,24.72,7.12,2,24.0,24.0,27.62,False,False
20-01-2026 10:00,MOGAN,8.82,9.07,8.81,9.04,2319391.0,0.03,0.22,0.02,856.52,0.22,781345.1,196.85,0.14,True,77.76,0.1,0.1,0.01,2026-01-20,8.82,2.49,1,9.07,8.31,9.07,False,False
19-01-2026 17:00,KRONT,15.53,15.98,15.29,15.93,1044361.0,0.05,0.4,0.02,1900.0,0.4,362113.2,188.41,0.13,True,59.91,0.05,0.06,-0.01,2026-01-19,15.68,1.59,2,15.29,15.29,16.08,False,False
19-01-2026 17:00,PAHOL,1.55,1.62,1.54,1.6,638531380.0,0.02,0.05,0.01,733.33,0.05,100731550.5,533.89,0.4,True,70.55,0.01,0.0,0.0,2026-01-19,1.53,4.58,2,1.54,1.54,ATH,False,False
19-01-2026 17:00,CATES,37.42,38.26,37.34,38.22,548753.0,0.04,0.8,0.14,488.24,0.8,146540.6,274.47,0.05,True,70.79,0.27,0.24,0.03,2026-01-19,36.9,3.58,0,,35.66,ATH,False,False
19-01-2026 17:00,KLKIM,38.0,38.48,37.94,38.48,525732.0,0.0,0.48,0.1,370.59,0.48,268862.0,95.54,0.0,True,70.66,0.33,0.29,0.04,2026-01-19,37.3,3.16,0,,35.56,ATH,False,False
19-01-2026 16:00,KLSER,27.6,27.98,27.58,27.88,424402.0,0.1,0.28,0.06,400.0,0.28,179241.3,136.78,0.36,True,73.62,0.16,0.13,0.04,2026-01-19,27.28,2.2,1,27.98,26.66,27.98,False,False
19-01-2026 16:00,EGSER,3.0,3.02,2.99,3.02,873261.0,0.0,0.02,0.0,300.0,0.02,461014.9,89.42,0.0,True,60.96,0.01,0.01,0.0,2026-01-19,2.98,1.34,1,3.02,2.94,ATH,False,False
19-01-2026 16:00,ESCOM,3.7,3.77,3.7,3.76,4419226.0,0.01,0.06,0.01,400.0,0.06,2874425.4,53.74,0.17,True,67.28,0.02,0.01,0.02,2026-01-19,3.57,5.32,0,,3.56,3.81,False,False
19-01-2026 16:00,TUKAS,2.88,2.96,2.88,2.96,62490868.0,0.0,0.08,0.0,7900.0,0.08,21254029.3,194.02,0.0,True,71.95,0.04,0.04,0.0,2026-01-19,2.88,2.78,0,,2.68,ATH,False,False
19-01-2026 16:00,BORSK,6.49,6.67,6.49,6.66,6064716.0,0.01,0.17,0.06,198.25,0.17,2779405.1,118.2,0.06,True,80.69,0.12,0.07,0.05,2026-01-19,6.08,9.54,0,,5.96,ATH,False,False
19-01-2026 15:00,SANFM,7.1,7.47,7.09,7.45,1956705.0,0.02,0.35,0.04,872.22,0.35,604315.2,223.79,0.06,True,72.86,0.03,0.0,0.03,2026-01-19,7.05,5.67,1,7.47,7.01,7.47,False,False
19-01-2026 15:00,BVSAN,105.9,109.8,105.7,109.0,439970.0,0.8,3.1,0.31,900.0,3.1,108664.7,304.89,0.26,True,69.67,0.58,0.36,0.22,2026-01-19,104.4,4.41,0,,104.0,109.8,False,False
19-01-2026 15:00,YKBNK,36.84,37.38,36.82,37.32,43669229.0,0.06,0.48,0.1,380.0,0.48,27676891.6,57.78,0.13,True,70.61,0.08,-0.08,0.15,2026-01-19,36.2,3.09,0,,35.9,37.8,False,False
19-01-2026 14:00,KLMSN,28.94,29.76,28.9,29.6,610685.0,0.16,0.66,0.04,1733.33,0.66,170116.6,258.98,0.24,True,63.95,0.05,0.02,0.03,2026-01-19,28.84,2.64,0,,28.8,29.74,False,False
19-01-2026 13:00,KAYSE,5.04,5.39,5.03,5.32,15781248.0,0.07,0.28,0.01,2053.85,0.28,3493688.9,351.71,0.25,True,73.81,0.08,0.07,0.01,2026-01-19,5.04,5.56,0,,4.72,ATH,False,False
19-01-2026 13:00,ANGEN,11.16,11.25,11.15,11.25,619772.0,0.0,0.09,0.02,500.0,0.09,203720.2,204.23,0.0,True,67.5,0.06,0.04,0.02,2026-01-19,11.04,1.9,0,,10.81,ATH,False,False
19-01-2026 13:00,ULUFA,3.9,4.01,3.9,3.99,6053884.0,0.02,0.09,0.02,350.0,0.09,1860091.7,225.46,0.22,True,78.39,0.05,0.03,0.01,2026-01-19,3.82,4.45,0,,3.76,4.03,False,False
19-01-2026 13:00,ARSAN,4.18,4.34,4.17,4.34,10119475.0,0.0,0.16,0.0,3900.0,0.16,6009682.1,68.39,0.0,True,65.81,0.08,0.08,0.01,2026-01-19,4.01,8.23,0,,4.01,4.39,False,False
19-01-2026 13:00,MERCN,16.98,17.54,16.91,17.39,2279424.0,0.15,0.41,0.01,3316.67,0.41,900306.3,153.18,0.37,True,63.19,0.14,0.14,0.0,2026-01-19,17.32,0.4,0,,16.8,ATH,False,False
19-01-2026 13:00,EGEGY,30.52,31.48,30.5,31.3,799250.0,0.18,0.78,0.11,635.85,0.78,354308.5,125.58,0.23,True,73.81,0.58,0.58,-0.0,2026-01-19,30.08,4.06,0,,29.76,ATH,False,False
19-01-2026 13:00,MAKTK,14.48,15.07,14.45,14.91,2237026.0,0.16,0.43,0.05,777.55,0.43,646896.7,245.81,0.37,True,71.86,0.1,0.03,0.07,2026-01-19,14.08,5.89,0,,13.98,ATH,False,False
19-01-2026 12:00,PRKME,18.07,18.96,17.69,18.87,2710391.0,0.09,0.8,0.13,515.38,0.8,706507.6,283.63,0.11,True,78.58,0.07,-0.06,0.13,2026-01-19,17.44,8.2,0,,17.23,ATH,False,False
19-01-2026 12:00,KBORU,15.59,16.0,15.48,15.96,2011938.0,0.04,0.37,0.02,1581.82,0.37,1067451.7,88.48,0.11,True,71.48,0.2,0.18,0.02,2026-01-19,15.24,4.72,1,16.0,15.18,16.0,False,False
19-01-2026 12:00,DURDO,3.78,3.81,3.74,3.81,774236.0,0.0,0.03,0.01,275.0,0.03,484029.9,59.96,0.0,True,70.74,0.01,0.0,0.01,2026-01-19,3.73,2.14,0,,3.65,3.95,False,False
19-01-2026 12:00,CEMTS,11.52,11.7,11.48,11.69,1046784.0,0.01,0.17,0.03,486.21,0.17,571362.4,83.21,0.06,True,74.96,0.08,0.04,0.04,2026-01-19,11.32,3.27,1,11.7,11.1,11.7,False,False
19-01-2026 12:00,GLRMK,184.7,187.0,184.1,186.6,332212.0,0.4,1.9,0.21,804.76,1.9,166641.3,99.36,0.21,True,61.63,1.01,1.15,-0.14,2026-01-19,184.9,0.92,0,,170.7,ATH,False,False
19-01-2026 12:00,MEGMT,60.5,61.75,60.45,61.5,2724029.0,0.25,1.0,0.04,2400.0,1.0,1512773.0,80.07,0.25,True,66.97,0.71,0.81,-0.1,2026-01-19,60.2,2.16,0,,59.7,61.75,False,False
19-01-2026 12:00,ISFIN,18.47,18.82,18.41,18.74,786995.0,0.08,0.27,0.07,297.06,0.27,252985.2,211.08,0.3,True,69.44,0.15,0.12,0.03,2026-01-19,18.38,1.96,0,,17.75,18.93,False,False
19-01-2026 11:00,ERCB,71.6,72.9,71.55,72.8,501764.0,0.1,1.2,0.05,2081.82,1.2,195099.0,157.18,0.08,True,59.59,0.3,0.35,-0.05,2026-01-19,71.15,2.32,1,72.9,70.9,72.9,False,False
19-01-2026 11:00,TCELL,106.5,108.7,106.4,108.7,9607384.0,0.0,2.2,0.23,856.52,2.2,3681376.6,160.97,0.0,True,78.43,1.42,1.17,0.24,2026-01-19,105.9,2.64,0,,100.7,ATH,False,False
19-01-2026 11:00,OTKAR,433.25,439.25,433.0,439.25,665257.0,0.0,6.0,0.12,4700.0,6.0,331578.5,100.63,0.0,True,16.82,-18.73,-13.03,-5.7,2026-01-19,477.0,-7.91,0,,430.5,533.0,False,False
19-01-2026 11:00,USAK,2.93,2.95,2.92,2.95,7740680.0,0.0,0.02,0.01,233.33,0.02,3890752.3,98.95,0.0,True,60.22,0.01,0.01,0.0,2026-01-19,2.94,0.34,0,,2.89,2.97,False,False
19-01-2026 11:00,GSDDE,10.56,10.68,10.56,10.66,456169.0,0.02,0.1,0.01,733.33,0.1,165370.2,175.85,0.2,True,66.67,0.07,0.06,0.01,2026-01-19,10.48,1.72,0,,10.41,ATH,False,False
19-01-2026 11:00,VKING,31.14,32.18,31.12,31.92,228194.0,0.26,0.78,0.03,2500.0,0.78,148544.6,53.62,0.33,True,46.99,-0.37,-0.34,-0.03,2026-01-19,31.6,1.01,1,32.18,30.8,32.18,False,False
19-01-2026 11:00,BINHO,9.35,9.52,9.33,9.5,10288993.0,0.02,0.15,0.01,1775.0,0.15,3621620.3,184.1,0.13,True,60.81,0.03,0.03,-0.01,2026-01-19,9.25,2.7,0,,9.25,9.79,False,False
19-01-2026 11:00,CUSAN,23.18,23.64,23.18,23.64,298164.0,0.0,0.46,0.08,505.26,0.46,88103.0,238.43,0.0,True,68.45,0.08,0.01,0.06,2026-01-19,22.74,3.96,0,,22.5,24.44,False,False
19-01-2026 11:00,TTKOM,62.3,63.65,62.3,63.4,5913823.0,0.25,1.1,0.12,856.52,1.1,2951353.1,100.38,0.23,True,75.06,0.73,0.66,0.06,2026-01-19,62.05,2.18,1,63.65,58.7,63.65,False,False
19-01-2026 11:00,THYAO,293.25,297.25,293.0,296.5,11717058.0,0.75,3.25,0.18,1757.14,3.25,4924011.3,137.96,0.23,True,68.95,2.15,1.48,0.66,2026-01-19,292.0,1.54,0,,279.5,298.0,False,False
19-01-2026 11:00,BMSCH,17.98,18.59,17.9,18.49,1218253.0,0.1,0.51,0.02,2733.33,0.51,642569.9,89.59,0.2,True,50.55,-0.28,-0.37,0.09,2026-01-19,17.86,3.53,1,18.59,17.8,18.59,True,False
19-01-2026 10:00,LINK,235.3,249.5,235.0,247.1,644202.0,2.4,11.8,1.23,859.35,11.8,102813.0,526.58,0.2,True,72.01,0.77,0.34,0.43,2026-01-19,234.4,5.42,0,,232.7,ATH,False,False
19-01-2026 10:00,KNFRT,11.32,11.49,11.27,11.45,443047.0,0.04,0.13,0.02,712.5,0.13,228032.2,94.29,0.31,True,65.25,0.03,0.01,0.02,2026-01-19,11.22,2.05,0,,11.11,11.78,False,False
19-01-2026 10:00,HALKB,41.02,42.38,41.02,42.28,18612971.0,0.1,1.26,0.08,1475.0,1.26,5126631.0,263.06,0.08,True,70.7,0.08,-0.05,0.12,2026-01-19,40.82,3.58,0,,40.36,43.06,False,False
19-01-2026 10:00,GWIND,25.12,26.0,25.12,25.78,3920543.0,0.22,0.66,0.06,931.25,0.66,855035.4,358.52,0.33,True,74.77,0.18,0.12,0.06,2026-01-19,25.08,2.79,1,26.0,24.1,26.0,False,False
19-01-2026 10:00,ISCTR,14.24,14.45,14.23,14.45,229538048.0,0.0,0.21,0.01,1515.38,0.21,83873671.7,173.67,0.0,True,59.31,-0.05,-0.07,0.02,2026-01-19,14.18,1.9,0,,14.11,14.67,True,True
19-01-2026 10:00,KRDMA,27.44,28.36,27.1,28.26,3688384.0,0.1,0.82,0.11,632.14,0.82,915142.0,303.04,0.12,True,85.95,0.37,0.28,0.09,2026-01-19,27.0,4.67,1,28.36,26.0,28.36,False,False
19-01-2026 10:00,HKTM,11.35,11.57,11.35,11.54,659702.0,0.03,0.19,0.02,1087.5,0.19,232835.6,183.33,0.16,True,65.84,0.02,0.01,0.01,2026-01-19,11.32,1.94,0,,11.28,11.68,False,False
19-01-2026 10:00,KRDMB,28.22,28.82,28.08,28.72,805283.0,0.1,0.5,0.07,614.29,0.5,267785.3,200.72,0.2,True,81.27,0.47,0.43,0.05,2026-01-19,28.08,2.28,0,,26.2,ATH,False,False
19-01-2026 10:00,KRDMD,29.08,29.7,28.88,29.7,20730349.0,0.0,0.62,0.13,376.92,0.62,7565262.7,174.02,0.0,True,77.04,0.41,0.29,0.13,2026-01-19,28.64,3.7,1,29.7,27.1,ATH,False,False
19-01-2026 10:00,ASTOR,155.8,159.0,155.8,158.2,8694370.0,0.8,2.4,0.27,788.89,2.4,3796741.9,129.0,0.33,True,72.83,3.38,3.44,-0.06,2026-01-19,154.7,2.26,0,,115.1,ATH,False,False
19-01-2026 10:00,PRKAB,33.44,36.66,33.44,36.66,1190189.0,0.0,3.22,0.24,1241.67,3.22,271699.6,338.05,0.0,True,72.5,0.27,0.14,0.14,2026-01-19,33.34,9.96,1,36.66,32.8,ATH,False,False
19-01-2026 10:00,LMKDC,30.3,31.96,30.26,31.58,6805391.0,0.38,1.28,0.14,827.54,1.28,1081888.2,529.03,0.3,True,81.72,0.26,0.11,0.15,2026-01-19,29.78,6.04,1,31.96,28.88,31.96,False,False
19-01-2026 10:00,XBANK,17211.19,17414.9,17211.19,17398.23,402619394.0,16.67,187.04,22.96,714.6,187.04,152424060.6,164.14,0.09,True,64.7,8.21,-28.71,36.92,2026-01-19,17122.79,1.61,0,,16846.5,17453.8,False,False
19-01-2026 10:00,KMPUR,15.17,15.49,15.15,15.4,936645.0,0.09,0.23,0.04,538.89,0.23,221276.4,323.29,0.39,True,71.95,0.08,0.04,0.04,2026-01-19,15.1,1.99,0,,14.63,ATH,False,False
19-01-2026 10:00,KZGYO,25.98,26.98,25.98,26.84,427213.0,0.14,0.86,0.09,814.89,0.86,106836.5,299.88,0.16,True,72.93,0.3,0.29,0.01,2026-01-19,26.04,3.07,2,25.98,25.98,ATH,False,False
19-01-2026 10:00,PNSUT,11.36,11.55,11.36,11.52,719653.0,0.03,0.16,0.02,627.27,0.16,264924.2,171.64,0.19,True,71.12,0.06,0.04,0.02,2026-01-19,11.36,1.41,0,,11.07,ATH,False,False
19-01-2026 10:00,ANHYT,104.0,106.3,103.7,106.2,499032.0,0.1,2.2,0.08,2650.0,2.2,178113.8,180.18,0.05,True,77.32,1.46,1.41,0.05,2026-01-19,103.7,2.41,0,,96.5,106.9,False,False
19-01-2026 10:00,IHEVA,2.23,2.26,2.22,2.26,815532.0,0.0,0.03,0.0,900.0,0.03,310156.9,162.94,0.0,True,61.76,0.0,0.0,0.0,2026-01-19,2.23,1.35,1,2.26,2.19,2.29,False,False
19-01-2026 10:00,KCAER,11.25,11.49,11.24,11.43,7817780.0,0.06,0.18,0.03,429.41,0.18,2284895.6,242.15,0.33,True,69.42,0.1,0.08,0.02,2026-01-19,11.2,2.05,0,,10.91,ATH,False,False
19-01-2026 10:00,IHLAS,2.29,2.33,2.29,2.33,48767692.0,0.0,0.04,0.01,566.67,0.04,14142960.6,244.82,0.0,True,64.91,0.0,0.0,0.0,2026-01-19,2.28,2.19,0,,2.26,2.48,False,False
19-01-2026 10:00,ALVES,3.07,3.31,3.03,3.31,103061860.0,0.0,0.25,0.02,1181.25,0.25,20449332.0,403.99,0.0,True,84.97,0.1,0.09,0.01,2026-01-19,3.01,9.96,1,3.31,2.6,ATH,False,False
19-01-2026 10:00,SARKY,28.74,34.08,28.74,33.82,45385443.0,0.26,5.08,0.51,900.0,5.08,5011586.1,805.61,0.05,True,56.12,-0.09,0.3,-0.4,2026-01-19,31.9,6.02,0,,28.72,35.44,False,False
19-01-2026 10:00,OBAMS,8.6,8.96,8.59,8.92,26383105.0,0.04,0.32,0.05,595.65,0.32,6231258.0,323.4,0.13,True,76.49,0.04,0.0,0.03,2026-01-19,8.58,3.96,0,,8.41,ATH,False,False
19-01-2026 10:00,ALKIM,20.86,21.56,20.6,21.46,2312948.0,0.1,0.6,0.07,757.14,0.6,455199.2,408.12,0.17,True,67.24,0.15,0.13,0.02,2026-01-19,20.68,3.77,3,,19.7,ATH,False,False
19-01-2026 10:00,KAREL,9.0,9.13,9.0,9.1,1317615.0,0.03,0.1,0.01,733.33,0.1,703975.1,87.17,0.3,True,57.28,0.01,0.01,-0.0,2026-01-19,8.97,1.45,0,,8.97,9.11,False,False
19-01-2026 10:00,SAFKR,26.92,28.84,26.64,28.4,4916024.0,0.44,1.48,0.26,469.23,1.48,1098128.9,347.67,0.3,True,86.4,0.63,0.41,0.21,2026-01-19,26.84,5.81,0,,24.28,ATH,False,False
19-01-2026 10:00,YATAS,40.88,41.84,40.72,41.74,557635.0,0.1,0.86,0.09,900.0,0.86,165244.1,237.46,0.12,True,73.86,0.28,0.16,0.12,2026-01-19,40.92,2.0,0,,39.0,ATH,False,False
19-01-2026 10:00,TUCLK,4.57,4.67,4.56,4.67,4148160.0,0.0,0.1,0.01,900.0,0.1,1259589.5,229.33,0.0,True,70.35,0.02,0.01,0.01,2026-01-19,4.55,2.64,0,,4.51,5.07,False,False
19-01-2026 10:00,MACKO,26.2,27.24,26.2,26.96,652515.0,0.28,0.76,0.09,726.09,0.76,228053.9,186.12,0.37,True,67.23,0.26,0.28,-0.02,2026-01-19,26.18,2.98,0,,25.74,27.46,False,False
19-01-2026 10:00,CGCAM,34.8,35.56,34.66,35.42,1191565.0,0.14,0.62,0.1,507.84,0.62,400877.0,197.24,0.23,True,67.61,0.21,0.14,0.07,2026-01-19,34.48,2.73,0,,33.88,ATH,False,False
19-01-2026 10:00,EREGL,26.22,26.48,26.16,26.48,54881325.0,0.0,0.26,0.06,306.25,0.26,25205789.2,117.73,0.0,True,72.52,0.23,0.17,0.06,2026-01-19,26.06,1.61,0,,25.2,ATH,False,False
19-01-2026 10:00,MNDTR,6.71,6.8,6.71,6.78,689773.0,0.02,0.07,0.0,2233.33,0.07,419179.3,64.55,0.29,True,51.95,-0.01,-0.0,-0.0,2026-01-19,6.71,1.04,0,,6.7,6.85,False,False
19-01-2026 10:00,MIATK,35.88,36.46,35.88,36.3,6916640.0,0.16,0.42,0.04,950.0,0.42,1717853.4,302.63,0.38,True,59.71,0.01,-0.04,0.05,2026-01-19,35.8,1.4,1,36.46,34.84,36.46,False,False
19-01-2026 10:00,EUPWR,39.82,42.06,39.54,41.98,8744795.0,0.08,2.16,0.2,990.91,2.16,1931735.0,352.69,0.04,True,79.86,0.59,0.5,0.09,2026-01-19,39.24,6.98,0,,38.82,ATH,False,False
19-01-2026 10:00,EDIP,35.7,36.92,35.7,36.72,598158.0,0.2,1.02,0.14,639.13,1.02,156980.9,281.04,0.2,True,75.08,0.2,0.08,0.12,2026-01-19,35.52,3.38,1,36.92,34.8,36.92,False,False
19-01-2026 10:00,ECOGR,23.08,23.66,23.06,23.54,2959355.0,0.12,0.46,0.03,1252.94,0.46,831239.4,256.02,0.26,True,56.76,-0.1,-0.12,0.01,2026-01-19,23.08,1.99,0,,22.96,23.8,False,False
19-01-2026 10:00,ULUUN,6.91,7.09,6.88,7.05,1635629.0,0.04,0.14,0.02,536.36,0.14,469391.4,248.46,0.29,True,79.43,0.05,0.03,0.02,2026-01-19,6.88,2.47,0,,6.6,ATH,False,False
19-01-2026 10:00,CONSE,3.1,3.14,3.08,3.13,2116757.0,0.01,0.03,0.0,900.0,0.03,807247.7,162.22,0.33,True,70.15,0.02,0.02,0.0,2026-01-19,3.07,1.95,0,,2.97,ATH,False,False
19-01-2026 10:00,ENTRA,10.68,10.96,10.68,10.95,3249090.0,0.01,0.27,0.02,980.0,0.27,990402.8,228.06,0.04,True,71.45,0.02,0.01,0.01,2026-01-19,10.66,2.72,0,,10.55,ATH,False,False
19-01-2026 10:00,TRALT,48.96,51.0,48.52,50.8,54980936.0,0.2,1.84,0.35,422.73,1.84,21412113.8,156.77,0.11,True,80.69,0.63,0.2,0.44,2026-01-19,47.6,6.72,0,,44.9,ATH,False,False
19-01-2026 10:00,MAKIM,15.29,15.51,15.29,15.5,159935.0,0.01,0.21,0.02,775.0,0.21,50259.5,218.22,0.05,True,62.7,0.04,0.02,0.01,2026-01-19,15.25,1.64,0,,14.81,15.63,False,False
19-01-2026 10:00,BLCYT,35.44,36.22,35.12,36.08,239907.0,0.14,0.64,0.05,1233.33,0.64,122593.8,95.69,0.22,True,40.47,-0.84,-0.8,-0.03,2026-01-19,35.56,1.46,2,35.12,35.12,41.34,False,False
19-01-2026 10:00,PENGD,8.07,8.16,8.06,8.14,1434010.0,0.02,0.07,0.01,677.78,0.07,377647.5,279.72,0.29,True,66.72,0.02,0.01,0.01,2026-01-19,8.0,1.75,0,,7.85,8.34,False,False
19-01-2026 10:00,TKNSA,23.58,24.14,23.58,24.04,1188080.0,0.1,0.46,0.08,475.0,0.46,384419.4,209.06,0.22,True,78.95,0.2,0.12,0.08,2026-01-19,23.54,2.12,0,,22.68,ATH,False,False
19-01-2026 10:00,GARAN,145.5,148.2,145.4,147.8,12879723.0,0.4,2.3,0.17,1252.94,2.3,5525044.7,133.12,0.17,True,64.37,-0.01,-0.46,0.45,2026-01-19,144.8,2.07,0,,141.0,148.7,False,False
19-01-2026 10:00,CELHA,11.05,12.02,11.03,12.02,6278105.0,0.0,0.97,0.12,688.62,0.97,1542278.2,307.07,0.0,True,76.38,0.11,-0.0,0.11,2026-01-19,10.93,9.97,1,12.02,10.44,ATH,False,False
19-01-2026 10:00,BOBET,20.84,21.3,20.84,21.18,1035784.0,0.12,0.34,0.05,639.13,0.34,295422.8,250.61,0.35,True,71.45,0.08,0.05,0.03,2026-01-19,20.82,1.73,1,21.3,20.4,21.3,False,False
19-01-2026 10:00,MANAS,17.94,18.95,17.6,18.9,9946540.0,0.05,0.96,0.08,1070.73,0.96,2598081.2,282.84,0.05,True,64.9,0.02,-0.06,0.07,2026-01-19,17.64,7.14,1,18.95,17.33,18.95,False,False
16-01-2026 17:00,RUBNS,32.66,34.1,32.44,34.1,7203841.0,0.0,1.44,0.29,393.15,1.44,1564168.7,360.55,0.0,True,77.84,0.84,0.67,0.17,2026-01-16,31.0,10.0,0,,30.6,ATH,False,False
16-01-2026 17:00,DMSAS,9.17,9.29,9.17,9.29,951315.0,0.0,0.12,0.01,757.14,0.12,408942.4,132.63,0.0,True,66.89,0.01,0.0,0.01,2026-01-16,9.17,1.31,0,,9.1,9.33,False,False
16-01-2026 17:00,ISKPL,11.16,11.26,11.14,11.26,2934491.0,0.0,0.1,0.0,9900.0,0.1,1250916.6,134.59,0.0,True,48.36,-0.06,-0.06,-0.01,2026-01-16,11.14,1.08,0,,11.07,11.74,False,False
16-01-2026 17:00,BESLR,13.5,13.76,13.45,13.75,1933286.0,0.01,0.25,0.04,468.18,0.25,621086.0,211.28,0.04,True,76.0,0.22,0.18,0.04,2026-01-16,13.21,4.09,0,,12.5,ATH,False,False
16-01-2026 17:00,ENSRI,19.31,19.55,19.15,19.51,279535.0,0.04,0.2,0.02,1150.0,0.2,165060.8,69.35,0.2,True,55.53,0.09,0.12,-0.03,2026-01-16,19.36,0.77,2,19.15,19.15,19.79,False,False
16-01-2026 17:00,ENKAI,82.45,84.4,82.45,83.95,5333168.0,0.45,1.5,0.3,408.47,1.5,1631727.1,226.84,0.3,True,75.63,0.64,0.29,0.34,2026-01-16,80.95,3.71,0,,78.85,ATH,False,False
16-01-2026 17:00,ESEN,5.98,6.05,5.85,6.05,17263734.0,0.0,0.07,0.01,438.46,0.07,5938260.7,190.72,0.0,True,69.13,0.05,0.05,0.01,2026-01-16,5.91,2.37,0,,5.7,ATH,False,False
16-01-2026 17:00,BAHKM,90.45,92.7,89.9,92.5,325284.0,0.2,2.05,0.04,5025.0,2.05,180476.1,80.24,0.1,True,64.04,0.88,0.8,0.08,2026-01-16,90.5,2.21,0,,84.55,93.5,False,False
16-01-2026 17:00,FORTE,92.75,95.0,92.7,94.9,410223.0,0.1,2.15,0.06,3207.69,2.15,208026.7,97.2,0.05,True,52.34,-0.4,-0.42,0.03,2026-01-16,94.4,0.53,0,,92.6,97.8,True,True
16-01-2026 17:00,ARMGD,83.95,85.0,83.5,84.85,424446.0,0.15,0.9,0.1,757.14,0.9,235953.8,79.89,0.17,True,53.58,0.29,0.3,-0.01,2026-01-16,84.0,1.01,2,83.5,83.5,88.2,False,False
16-01-2026 16:00,MTRKS,22.3,22.92,22.28,22.86,1005606.0,0.06,0.56,0.13,344.44,0.56,242734.3,314.28,0.11,True,79.27,0.24,0.13,0.11,2026-01-16,21.66,5.54,0,,21.2,ATH,False,False
16-01-2026 16:00,DNISI,19.95,20.2,19.95,20.14,416877.0,0.06,0.19,0.02,1017.65,0.19,141076.1,195.5,0.32,True,66.53,0.07,0.05,0.01,2026-01-16,19.9,1.21,0,,19.68,20.5,False,False
16-01-2026 16:00,DESA,11.94,12.04,11.92,12.02,258398.0,0.02,0.08,0.02,220.0,0.08,111143.5,132.49,0.25,True,66.76,0.07,0.05,0.02,2026-01-16,11.82,1.69,0,,11.54,ATH,False,False
16-01-2026 16:00,ARTMS,35.82,37.88,35.82,37.6,959718.0,0.28,1.78,0.27,554.41,1.78,289807.7,231.16,0.16,True,81.49,0.33,0.05,0.28,2026-01-16,34.78,8.11,0,,34.32,ATH,False,False
16-01-2026 16:00,KONKA,14.58,14.74,14.53,14.7,514370.0,0.04,0.12,0.02,605.88,0.12,179446.3,186.64,0.33,True,54.46,-0.1,-0.16,0.05,2026-01-16,14.38,2.23,0,,14.35,15.79,True,False
16-01-2026 16:00,SASA,2.36,2.41,2.34,2.4,699386531.0,0.01,0.04,0.01,566.67,0.04,229057281.7,205.33,0.25,True,69.82,0.0,-0.01,0.01,2026-01-16,2.34,2.56,0,,2.32,ATH,False,False
16-01-2026 15:00,TRMET,122.7,125.8,122.0,125.4,2578384.0,0.4,2.7,0.46,486.96,2.7,1029008.5,150.57,0.15,True,71.06,1.28,0.72,0.56,2026-01-16,119.5,4.94,0,,116.0,ATH,False,False
16-01-2026 15:00,SEYKM,4.81,4.98,4.8,4.98,468522.0,0.0,0.17,0.02,672.73,0.17,103234.0,353.84,0.0,True,74.36,0.03,-0.0,0.03,2026-01-16,4.73,5.29,0,,4.53,5.0,False,False
16-01-2026 15:00,HDFGS,3.43,3.63,3.42,3.59,34715708.0,0.04,0.16,0.02,700.0,0.16,16277260.3,113.28,0.25,True,54.86,-0.07,-0.09,0.03,2026-01-16,3.42,4.97,1,3.63,3.24,3.63,True,False
16-01-2026 15:00,SOKM,56.9,58.25,56.8,58.0,1836213.0,0.25,1.1,0.2,464.1,1.1,708607.8,159.13,0.23,True,77.23,0.48,0.34,0.14,2026-01-16,55.8,3.94,0,,54.85,ATH,False,False
16-01-2026 15:00,KRVGD,2.98,3.0,2.97,3.0,2668063.0,0.0,0.02,0.0,1900.0,0.02,1427983.8,86.84,0.0,True,57.82,0.02,0.02,-0.0,2026-01-16,3.03,-0.99,0,,2.87,3.07,False,False
16-01-2026 15:00,SISE,39.26,39.66,39.02,39.62,13156803.0,0.04,0.36,0.14,150.0,0.36,6521682.6,101.74,0.11,True,66.48,0.08,-0.07,0.14,2026-01-16,38.72,2.32,0,,38.04,39.84,False,False
16-01-2026 15:00,TATEN,9.63,9.94,9.53,9.92,1921676.0,0.02,0.29,0.04,574.42,0.29,1201449.5,59.95,0.07,True,52.91,-0.15,-0.2,0.05,2026-01-16,9.6,3.33,0,,9.2,11.3,True,False
16-01-2026 15:00,YIGIT,24.34,25.06,24.28,25.02,1324188.0,0.04,0.68,0.06,996.77,0.68,827721.2,59.98,0.06,True,77.99,0.33,0.26,0.06,2026-01-16,24.22,3.3,0,,22.88,ATH,False,False
16-01-2026 14:00,ENJSA,96.45,98.2,96.35,97.95,831844.0,0.25,1.5,0.16,809.09,1.5,265231.2,213.63,0.17,True,65.11,0.38,0.3,0.07,2026-01-16,96.85,1.14,1,98.2,95.15,98.2,False,False
16-01-2026 14:00,PETUN,11.75,12.04,11.75,12.01,858483.0,0.03,0.26,0.04,490.91,0.26,223078.5,284.83,0.12,True,80.54,0.08,0.04,0.03,2026-01-16,11.61,3.45,0,,11.39,ATH,False,False
16-01-2026 14:00,MERIT,16.83,17.21,16.83,17.13,745941.0,0.08,0.3,0.02,1900.0,0.3,324217.2,130.07,0.27,True,50.49,-0.13,-0.16,0.03,2026-01-16,17.0,0.76,0,,16.72,18.78,True,False
16-01-2026 14:00,EGPRO,26.62,27.08,26.5,26.96,241349.0,0.12,0.34,0.08,335.9,0.34,105783.3,128.15,0.35,True,60.82,0.04,-0.02,0.07,2026-01-16,26.42,2.04,0,,24.92,27.52,False,False
16-01-2026 14:00,SEKUR,3.53,3.62,3.51,3.6,408419.0,0.02,0.07,0.01,1300.0,0.07,156732.2,160.58,0.29,True,61.5,-0.01,-0.02,0.01,2026-01-16,3.5,2.86,0,,3.47,3.74,True,False
16-01-2026 13:00,SURGY,44.4,44.8,44.34,44.78,546917.0,0.02,0.38,0.02,2275.0,0.38,281647.7,94.18,0.05,True,61.11,0.18,0.18,0.0,2026-01-16,44.72,0.13,0,,44.06,45.4,False,False
16-01-2026 13:00,KOTON,17.06,17.44,17.06,17.35,1265471.0,0.09,0.29,0.04,683.78,0.29,612686.8,106.54,0.31,True,66.55,0.21,0.22,-0.01,2026-01-16,17.28,0.41,0,,15.9,ATH,False,False
16-01-2026 13:00,EKSUN,5.56,5.64,5.56,5.64,432299.0,0.0,0.08,0.0,1900.0,0.08,261296.3,65.44,0.0,True,67.03,0.05,0.03,0.01,2026-01-16,5.54,1.81,0,,5.31,ATH,False,False
16-01-2026 13:00,YKSLN,3.15,3.17,3.14,3.17,1550428.0,0.0,0.02,0.0,1900.0,0.02,975124.3,59.0,0.0,True,58.79,0.0,-0.0,0.0,2026-01-16,3.13,1.28,0,,3.1,3.19,False,False
16-01-2026 13:00,GLRYH,3.93,4.11,3.93,4.07,4650187.0,0.04,0.14,0.02,566.67,0.14,1125175.6,313.29,0.29,True,72.3,0.01,-0.01,0.02,2026-01-16,3.91,4.09,0,,3.85,4.08,False,False
16-01-2026 12:00,ISDMR,37.8,38.2,37.72,38.14,390637.0,0.06,0.34,0.03,1033.33,0.34,175937.1,122.03,0.18,True,63.17,0.04,0.03,0.02,2026-01-16,37.74,1.06,0,,37.34,38.46,False,False
16-01-2026 12:00,YEOTK,39.32,40.34,39.16,40.3,1361095.0,0.04,0.98,0.16,512.5,0.98,832681.1,63.46,0.04,True,74.72,0.65,0.54,0.11,2026-01-16,39.4,2.28,0,,37.1,ATH,False,False
16-01-2026 12:00,TABGD,245.7,251.5,245.5,249.9,293441.0,1.6,4.2,0.26,1515.38,4.2,90100.0,225.68,0.38,True,71.7,3.37,3.06,0.31,2026-01-16,242.8,2.92,0,,215.2,250.25,False,False
16-01-2026 12:00,LKMNH,17.06,17.39,17.05,17.37,665412.0,0.02,0.31,0.04,761.11,0.31,188660.2,252.7,0.06,True,60.02,-0.09,-0.14,0.06,2026-01-16,17.0,2.18,0,,16.83,ATH,True,False
16-01-2026 12:00,AZTEK,4.19,4.25,4.19,4.24,682215.0,0.01,0.05,0.0,2400.0,0.05,399716.8,70.67,0.2,True,55.73,-0.0,-0.0,0.0,2026-01-16,4.24,0.0,0,,4.14,4.38,False,False
16-01-2026 11:00,ULKER,130.9,133.2,130.7,133.0,1811384.0,0.2,2.1,0.44,377.27,2.1,864457.2,109.54,0.1,True,74.75,2.59,2.5,0.09,2026-01-16,131.1,1.45,0,,113.5,ATH,False,False
16-01-2026 11:00,DOKTA,23.92,24.22,23.88,24.16,80933.0,0.06,0.24,0.02,900.0,0.24,44469.3,82.0,0.25,True,57.03,-0.03,-0.08,0.05,2026-01-16,24.0,0.67,0,,23.34,24.9,False,False
16-01-2026 11:00,TRCAS,43.52,44.4,43.48,44.34,322658.0,0.06,0.82,0.33,145.51,0.82,212112.2,52.12,0.07,True,82.08,0.7,0.49,0.21,2026-01-16,42.98,3.16,0,,40.06,ATH,False,False
16-01-2026 11:00,GZNMI,43.96,47.28,43.96,47.12,2558636.0,0.16,3.16,0.22,1336.36,3.16,867017.4,195.11,0.05,True,61.53,0.28,0.04,0.25,2026-01-16,45.16,4.34,0,,42.66,50.5,False,False
16-01-2026 11:00,MEKAG,3.81,4.03,3.81,4.01,4438164.0,0.02,0.2,0.02,952.63,0.2,1083581.4,309.58,0.1,True,74.87,0.02,0.0,0.01,2026-01-16,3.83,4.7,0,,3.77,ATH,False,False
16-01-2026 11:00,AVHOL,40.24,41.02,40.24,41.0,411215.0,0.02,0.76,0.05,1483.33,0.76,152679.6,169.33,0.03,True,59.53,0.13,0.13,0.01,2026-01-16,40.52,1.18,0,,39.7,41.12,False,False
16-01-2026 10:00,MGROS,617.5,643.0,617.0,642.0,1704270.0,1.0,24.5,2.65,824.53,24.5,433231.4,293.39,0.04,True,75.83,6.12,4.74,1.38,2026-01-16,616.5,4.14,0,,597.5,ATH,False,False
16-01-2026 10:00,OFSYM,73.75,75.6,73.75,75.35,748124.0,0.25,1.6,0.13,1085.19,1.6,128936.6,480.23,0.16,True,75.31,0.13,0.06,0.07,2026-01-16,73.75,2.17,2,73.75,73.75,ATH,False,False
16-01-2026 10:00,ORGE,68.95,71.3,68.65,71.3,540639.0,0.0,2.35,0.23,921.74,2.35,117341.6,360.74,0.0,True,71.89,0.37,0.25,0.12,2026-01-16,68.8,3.63,0,,67.4,ATH,False,False
16-01-2026 10:00,MOPAS,42.24,45.52,42.24,45.32,2967920.0,0.2,3.08,0.16,1874.36,3.08,806409.1,268.04,0.06,True,69.36,0.76,0.87,-0.1,2026-01-16,42.2,7.39,1,45.52,41.26,45.52,False,False
16-01-2026 10:00,ISMEN,42.66,43.08,42.52,42.98,2194947.0,0.1,0.32,0.04,661.9,0.32,900039.4,143.87,0.31,True,70.22,0.24,0.2,0.04,2026-01-16,42.54,1.03,0,,41.34,ATH,False,False
16-01-2026 10:00,BORLS,2.96,3.2,2.86,3.18,47358205.0,0.02,0.22,0.02,816.67,0.22,9865688.5,380.03,0.09,True,62.73,-0.03,-0.08,0.05,2026-01-16,2.92,8.9,0,,2.62,ATH,False,False
16-01-2026 10:00,ALTIN,74.07,81.4,74.07,80.94,95970867.0,0.46,6.87,0.69,900.0,6.87,9949175.0,864.61,0.07,True,48.64,-2.34,-2.69,0.35,2026-01-16,77.96,3.82,2,74.07,74.07,82.06,True,True
16-01-2026 10:00,BOSSA,6.7,6.83,6.59,6.82,1428762.0,0.01,0.12,0.02,700.0,0.12,383237.7,272.81,0.08,True,66.37,0.05,0.06,-0.0,2026-01-16,6.7,1.79,1,6.83,6.51,6.83,False,False
16-01-2026 10:00,BRKVY,101.6,103.5,100.5,103.3,327495.0,0.2,1.7,0.2,750.0,1.7,103441.6,216.6,0.12,True,64.47,0.06,-0.42,0.48,2026-01-16,101.0,2.28,0,,98.35,110.8,False,False
16-01-2026 10:00,CCOLA,69.0,70.7,67.8,70.45,3012413.0,0.25,1.45,0.2,625.0,1.45,1029724.7,192.55,0.17,True,81.94,1.33,1.24,0.09,2026-01-16,68.7,2.55,0,,61.55,ATH,False,False
16-01-2026 10:00,TOASO,285.25,290.0,284.0,289.5,1431634.0,0.5,4.25,1.23,246.94,4.25,540847.2,164.7,0.12,True,68.2,1.38,0.59,0.79,2026-01-16,284.75,1.67,0,,275.5,ATH,False,False
16-01-2026 10:00,ARENA,29.84,31.2,29.8,30.94,1004528.0,0.26,1.1,0.08,1209.52,1.1,191248.9,425.25,0.24,True,67.0,-0.09,-0.15,0.06,2026-01-16,29.6,4.53,0,,29.1,32.42,False,False
16-01-2026 10:00,ARDYZ,38.32,39.64,38.26,39.34,1879746.0,0.3,1.02,0.15,580.0,1.02,693403.4,171.09,0.29,True,57.89,-0.4,-0.57,0.17,2026-01-16,38.26,2.82,0,,37.04,42.4,True,False
16-01-2026 10:00,DOAS,223.7,226.4,222.0,226.1,548706.0,0.3,2.4,0.42,471.43,2.4,180967.1,203.21,0.13,True,71.04,1.9,1.65,0.25,2026-01-16,223.7,1.07,0,,217.2,ATH,False,False
16-01-2026 10:00,ANSGR,25.58,25.96,25.5,25.94,1230772.0,0.02,0.36,0.02,1700.0,0.36,757152.6,62.55,0.06,True,68.33,0.24,0.25,-0.01,2026-01-16,25.56,1.49,0,,24.2,ATH,False,False
16-01-2026 10:00,FORMT,2.86,2.96,2.85,2.96,13151897.0,0.0,0.1,0.01,1011.11,0.1,4159783.7,216.17,0.0,True,61.62,-0.02,-0.02,0.0,2026-01-16,2.85,3.86,0,,2.84,2.97,True,True
16-01-2026 10:00,BIMAS,625.5,637.5,622.0,636.5,2193416.0,1.0,11.0,1.55,609.68,11.0,910045.4,141.02,0.09,True,61.65,0.0,-0.65,0.65,2026-01-16,624.5,1.92,0,,615.0,655.5,False,False
16-01-2026 10:00,GENTS,10.97,11.89,10.97,11.79,9705196.0,0.1,0.82,0.15,435.95,0.82,2304212.7,321.19,0.12,True,92.5,0.35,0.22,0.12,2026-01-16,10.91,8.07,0,,9.43,ATH,False,False
16-01-2026 10:00,GIPTA,64.4,66.25,63.0,66.2,1893236.0,0.05,1.8,0.21,757.14,1.8,541051.9,249.92,0.03,True,59.3,-0.28,-0.58,0.3,2026-01-16,64.3,2.95,2,63.0,63.0,68.8,False,False
16-01-2026 10:00,GMTAS,26.78,28.72,25.88,28.72,4720701.0,0.0,1.94,0.19,926.31,1.94,818879.05,476.48,0.0,True,77.74,0.32,0.07,0.24,2026-01-16,26.11,10.0,3,,24.99,29.72,False,False
16-01-2026 10:00,HTTBT,44.56,45.68,44.4,45.4,416621.0,0.28,0.84,0.13,536.36,0.84,132904.3,213.47,0.33,True,73.23,0.46,0.36,0.1,2026-01-16,44.56,1.89,0,,43.0,ATH,False,False
16-01-2026 10:00,AGHOL,32.8,33.64,32.58,33.5,1622084.0,0.14,0.7,0.02,4275.0,0.7,560904.0,189.19,0.2,True,67.98,0.34,0.37,-0.02,2026-01-16,32.82,2.07,2,32.58,32.58,33.58,False,False
16-01-2026 10:00,AEFES,17.21,17.49,17.14,17.48,17449137.0,0.01,0.27,0.01,2354.55,0.27,7741804.7,125.39,0.04,True,73.07,0.17,0.14,0.02,2026-01-16,17.16,1.86,0,,16.26,17.54,False,False
15-01-2026 17:00,BMSTL,86.85,91.05,86.75,90.0,1046139.0,1.05,3.15,0.1,3215.79,3.15,581921.3,79.77,0.33,True,58.61,-0.46,-0.37,-0.09,2026-01-15,90.0,0.0,0,,86.1,91.3,False,False
15-01-2026 17:00,ARCLK,109.8,111.7,109.6,111.7,911835.0,0.0,1.9,0.05,3700.0,1.9,555041.0,64.28,0.0,True,52.23,-0.29,-0.04,-0.25,2026-01-15,111.5,0.18,0,,108.3,114.7,False,False
15-01-2026 17:00,XU100,12385.94,12472.88,12375.58,12470.73,1273765544.0,2.15,84.79,11.04,667.96,84.79,719463473.1,77.04,0.03,True,62.73,22.25,22.84,-0.59,2026-01-15,12369.89,0.82,0,,12300.4,ATH,False,False
15-01-2026 17:00,ALARK,102.9,104.8,102.8,104.6,2255043.0,0.2,1.7,0.34,400.0,1.7,992752.9,127.15,0.12,True,69.64,0.64,0.42,0.22,2026-01-15,102.0,2.55,0,,99.8,ATH,False,False
15-01-2026 17:00,AKENR,11.01,11.08,11.01,11.07,1106093.0,0.01,0.06,0.0,1400.0,0.06,636498.7,73.78,0.17,True,48.95,-0.04,-0.04,0.0,2026-01-15,11.02,0.45,0,,10.69,11.25,False,False
15-01-2026 17:00,AVOD,3.8,4.0,3.78,3.95,3537133.0,0.05,0.15,0.02,837.5,0.15,1176049.0,200.76,0.33,True,60.98,-0.02,-0.03,0.01,2026-01-15,3.78,4.5,0,,3.77,4.23,True,True
15-01-2026 17:00,MNDRS,14.18,14.4,14.16,14.38,376258.0,0.02,0.2,0.01,1438.46,0.2,228400.0,64.74,0.1,True,53.08,-0.06,-0.05,-0.02,2026-01-15,14.16,1.55,0,,14.03,14.94,False,False
15-01-2026 17:00,XU030,13561.53,13679.77,13548.72,13679.77,796222961.0,0.0,118.24,17.25,585.41,118.24,372792009.0,113.58,0.0,True,65.46,31.14,30.08,1.06,2026-01-15,13522.35,1.16,0,,13434.77,ATH,False,False
15-01-2026 17:00,KIMMR,13.98,14.11,13.95,14.11,174368.0,0.0,0.13,0.02,420.0,0.13,71561.2,143.66,0.0,True,62.27,0.11,0.11,0.0,2026-01-15,13.88,1.66,0,,13.52,ATH,False,False
15-01-2026 17:00,HURGZ,5.27,5.35,5.26,5.34,811792.0,0.01,0.07,0.02,268.42,0.07,265969.1,205.22,0.14,True,64.79,0.01,0.0,0.01,2026-01-15,5.17,3.29,0,,5.16,5.46,False,False
15-01-2026 17:00,TSPOR,1.08,1.1,1.08,1.1,62579298.0,0.0,0.02,0.0,400.0,0.02,28569604.3,119.04,0.0,True,63.57,0.0,0.0,0.0,2026-01-15,1.07,2.8,1,1.1,1.06,ATH,False,False
15-01-2026 17:00,DITAS,38.88,41.12,38.82,41.12,835274.0,0.0,2.24,0.14,1455.56,2.24,242716.0,244.14,0.0,True,63.99,0.24,0.25,-0.01,2026-01-15,39.74,3.47,0,,38.28,41.18,False,False
15-01-2026 17:00,ECILC,102.0,107.5,101.4,106.2,2009500.0,1.3,4.2,0.45,833.33,4.2,476916.0,321.35,0.31,True,72.5,0.66,0.63,0.04,2026-01-15,101.7,4.42,0,,100.0,107.0,False,False
15-01-2026 17:00,PGSUS,197.6,199.7,197.3,199.3,4687279.0,0.4,1.7,0.18,844.44,1.7,2208952.5,112.19,0.24,True,50.71,-1.16,-1.46,0.3,2026-01-15,197.1,1.12,0,,195.7,200.4,True,False
15-01-2026 17:00,GOKNR,20.92,21.5,20.92,21.44,1396156.0,0.06,0.52,0.06,828.57,0.52,526102.5,165.38,0.12,True,64.3,0.01,-0.01,0.02,2026-01-15,20.9,2.58,0,,20.76,21.7,False,False
15-01-2026 16:00,ANELE,16.78,17.4,16.76,17.26,702527.0,0.14,0.48,0.09,445.45,0.48,226826.4,209.72,0.29,True,60.96,-0.08,-0.15,0.07,2026-01-15,16.57,4.16,1,17.4,16.41,17.4,True,False
15-01-2026 16:00,ZEDUR,8.07,8.15,8.06,8.14,381603.0,0.01,0.07,0.01,438.46,0.07,167026.8,128.47,0.14,True,58.34,-0.01,-0.01,0.01,2026-01-15,8.05,1.12,0,,7.99,8.23,False,False
15-01-2026 16:00,PAPIL,16.68,17.55,16.64,17.32,12841210.0,0.23,0.64,0.09,603.3,0.64,2568195.0,400.01,0.36,True,72.42,-0.03,-0.12,0.09,2026-01-15,16.32,6.13,0,,16.32,17.95,True,False
15-01-2026 16:00,EPLAS,5.45,5.57,5.43,5.55,784485.0,0.02,0.1,0.0,1900.0,0.1,446823.3,75.57,0.2,True,64.05,0.04,0.05,-0.0,2026-01-15,5.55,0.0,0,,5.28,5.61,False,False
15-01-2026 15:00,RTALB,3.49,3.54,3.49,3.53,4458647.0,0.01,0.04,0.0,900.0,0.04,2225868.1,100.31,0.25,True,63.38,0.0,0.0,0.0,2026-01-15,3.47,1.73,0,,3.46,3.55,False,False
15-01-2026 15:00,GSRAY,1.19,1.21,1.19,1.21,74914370.0,0.0,0.02,0.01,300.0,0.02,33763806.7,121.88,0.0,True,65.93,0.01,0.0,0.0,2026-01-15,1.16,4.31,0,,1.15,ATH,False,False
15-01-2026 13:00,BARMA,35.86,36.5,35.76,36.44,1458211.0,0.06,0.58,0.1,491.84,0.58,285044.8,411.57,0.1,True,63.02,0.16,0.01,0.15,2026-01-15,35.52,2.59,0,,32.5,37.36,False,False
15-01-2026 12:00,ODAS,5.21,5.31,5.2,5.3,40469211.0,0.01,0.09,0.02,400.0,0.09,9169465.9,341.35,0.11,True,72.75,0.02,-0.0,0.02,2026-01-15,5.12,3.52,0,,5.04,ATH,False,False
15-01-2026 12:00,LIDFA,2.61,2.71,2.59,2.69,8454874.0,0.02,0.08,0.02,233.33,0.08,4499568.5,87.9,0.25,True,77.91,0.06,0.04,0.02,2026-01-15,2.47,8.91,0,,2.31,ATH,False,False
15-01-2026 12:00,ETILR,3.86,4.0,3.86,3.97,2756171.0,0.03,0.11,0.01,746.15,0.11,692588.1,297.95,0.27,True,73.18,0.01,-0.01,0.01,2026-01-15,3.82,3.93,1,4.0,3.8,4.0,False,False
15-01-2026 11:00,FROTO,102.3,104.2,102.2,103.8,6006465.0,0.4,1.5,0.21,614.29,1.5,2628190.8,128.54,0.27,True,70.34,0.82,0.82,-0.0,2026-01-15,101.6,2.17,0,,100.4,ATH,False,False
15-01-2026 10:00,SILVR,2.7,2.75,2.68,2.75,363014.0,0.0,0.05,0.0,1150.0,0.05,216721.9,67.5,0.0,True,52.34,-0.01,-0.01,0.0,2026-01-15,2.73,0.73,2,2.68,2.68,2.81,False,False
15-01-2026 10:00,TKFEN,69.5,70.75,69.5,70.45,420889.0,0.3,0.95,0.02,4650.0,0.95,268486.3,56.76,0.32,True,43.82,-0.43,-0.35,-0.08,2026-01-15,69.9,0.79,0,,ATL,72.95,False,False
15-01-2026 10:00,VBTYZ,15.58,16.25,15.48,16.06,1443530.0,0.19,0.48,0.04,1042.86,0.48,273548.7,427.7,0.4,True,75.83,0.07,0.02,0.05,2026-01-15,15.46,3.88,0,,15.19,ATH,False,False
15-01-2026 10:00,PATEK,20.3,21.2,20.2,21.1,7281016.0,0.1,0.8,0.01,13233.33,0.8,2589984.2,181.12,0.12,True,45.51,-0.38,-0.34,-0.04,2026-01-15,20.28,4.04,2,20.2,20.2,23.16,True,True
15-01-2026 10:00,TUREX,7.08,7.27,7.05,7.24,8583190.0,0.03,0.16,0.02,900.0,0.16,1996205.5,329.98,0.19,True,61.2,0.0,0.01,-0.0,2026-01-15,7.09,2.12,3,,7.08,7.29,False,False
15-01-2026 10:00,A1YEN,30.92,32.5,30.92,32.34,1826408.0,0.16,1.42,0.03,4971.43,1.42,769149.4,137.46,0.11,True,51.87,-0.11,0.16,-0.27,2026-01-15,31.46,2.8,0,,30.88,35.0,False,False
15-01-2026 10:00,INVEO,8.46,8.71,8.45,8.67,1433907.0,0.04,0.21,0.01,4100.0,0.21,561204.4,155.51,0.19,True,57.77,-0.02,-0.01,-0.01,2026-01-15,8.45,2.6,2,8.45,8.45,8.78,False,False
15-01-2026 10:00,OSMEN,7.87,8.02,7.83,8.01,406187.0,0.01,0.14,0.0,6900.0,0.14,269782.3,50.56,0.07,True,50.92,-0.03,-0.02,-0.01,2026-01-15,7.89,1.52,0,,7.82,8.1,False,False
15-01-2026 10:00,BEGYO,4.71,4.75,4.69,4.74,1213755.0,0.01,0.03,0.0,2900.0,0.03,654274.5,85.51,0.33,True,46.46,-0.02,-0.02,-0.0,2026-01-15,4.71,0.64,2,4.69,4.69,4.79,True,True
15-01-2026 10:00,BALSU,16.31,16.5,16.2,16.47,1779819.0,0.03,0.16,0.02,900.0,0.16,910714.1,95.43,0.19,True,54.77,-0.01,-0.02,0.01,2026-01-15,16.31,0.98,2,16.2,16.2,16.62,False,False
15-01-2026 10:00,HEKTS,2.89,2.95,2.88,2.95,29403817.0,0.0,0.06,0.0,1.351079888211149e+17,0.06,11164059.0,163.38,0.0,True,53.36,-0.01,-0.01,-0.0,2026-01-15,2.89,2.08,2,2.88,2.88,2.99,True,True
15-01-2026 10:00,HUNER,3.17,3.2,3.12,3.2,6881158.0,0.0,0.03,0.01,275.0,0.03,2238784.7,207.36,0.0,True,60.64,0.01,0.01,0.0,2026-01-15,3.18,0.63,2,3.12,3.12,3.23,False,False
15-01-2026 10:00,IHYAY,1.9,1.94,1.9,1.93,1248520.0,0.01,0.03,0.0,2900.0,0.03,524554.0,138.02,0.33,True,53.18,-0.01,-0.01,0.0,2026-01-15,1.91,1.05,2,1.9,1.9,1.94,False,False
15-01-2026 10:00,DERHL,13.4,13.68,13.36,13.68,634896.0,0.0,0.28,0.01,2053.85,0.28,327417.8,93.91,0.0,True,56.3,0.02,0.04,-0.02,2026-01-15,13.4,2.09,2,13.36,13.36,13.96,False,False
15-01-2026 10:00,ATATP,147.3,155.9,146.3,154.3,1686624.0,1.6,7.0,1.78,293.26,7.0,561210.5,200.53,0.23,True,88.74,4.34,2.73,1.61,2026-01-15,144.6,6.71,0,,130.0,ATH,False,False
15-01-2026 10:00,ARZUM,2.28,2.34,2.28,2.33,1972279.0,0.01,0.05,0.0,1150.0,0.05,966974.2,103.96,0.2,True,64.93,0.01,0.01,0.0,2026-01-15,2.29,1.75,0,,2.27,ATH,False,False
15-01-2026 10:00,KATMR,2.98,3.06,2.97,3.04,39778641.0,0.02,0.06,0.0,5900.0,0.06,20383406.5,95.15,0.33,True,51.85,-0.01,-0.01,-0.0,2026-01-15,2.98,2.01,2,2.97,2.97,3.11,False,False
15-01-2026 10:00,KONTR,10.01,10.25,9.98,10.2,25116557.0,0.05,0.19,0.01,1800.0,0.19,9958819.0,152.2,0.26,True,54.01,-0.05,-0.06,0.0,2026-01-15,9.96,2.41,0,,9.96,10.33,True,True
15-01-2026 10:00,KTLEV,30.02,32.8,29.84,32.74,38694623.0,0.06,2.72,0.04,7455.56,2.72,10360420.3,273.49,0.02,True,57.5,0.27,0.63,-0.36,2026-01-15,30.7,6.64,2,29.84,29.84,35.0,False,False
15-01-2026 10:00,BJKAS,1.59,1.63,1.59,1.62,11326444.0,0.01,0.03,0.0,1.351079888211149e+17,0.03,7543727.0,50.14,0.33,True,50.2,-0.01,-0.01,-0.0,2026-01-15,1.59,1.89,2,1.59,1.59,1.67,False,False
15-01-2026 10:00,LILAK,32.16,33.72,32.14,33.42,4343998.0,0.3,1.26,0.01,12500.0,1.26,1249443.1,247.67,0.24,True,65.87,0.41,0.54,-0.12,2026-01-15,32.2,3.79,0,,32.0,34.3,False,False
15-01-2026 10:00,BURCE,73.2,79.6,73.1,78.85,1212681.0,0.75,5.65,0.47,1115.05,5.65,290877.0,316.91,0.13,True,57.12,-0.8,-0.59,-0.2,2026-01-15,73.5,7.28,1,79.6,75.55,79.6,False,False
15-01-2026 10:00,AKSA,9.96,10.11,9.93,10.09,4769416.0,0.02,0.13,0.01,1525.0,0.13,2442916.9,95.23,0.15,True,57.62,-0.0,0.01,-0.01,2026-01-15,9.95,1.41,2,9.93,9.93,10.16,False,False
15-01-2026 10:00,AFYON,13.54,13.72,13.5,13.69,605509.0,0.03,0.15,0.01,1150.0,0.15,320728.4,88.79,0.2,True,64.36,0.04,0.04,0.0,2026-01-15,13.55,1.03,0,,13.48,13.71,False,False
15-01-2026 10:00,AKGRT,7.46,7.7,7.44,7.65,9700480.0,0.05,0.19,0.0,9400.0,0.19,2554876.7,279.68,0.26,True,69.76,0.08,0.1,-0.02,2026-01-15,7.46,2.55,2,7.44,7.44,7.74,False,False
15-01-2026 10:00,DARDL,2.18,2.25,2.17,2.25,7751155.0,0.0,0.07,0.0,2233.33,0.07,3717821.0,108.49,0.0,True,64.43,0.0,0.0,-0.0,2026-01-15,2.18,3.21,2,2.17,2.17,ATH,False,False
15-01-2026 10:00,EMKEL,21.4,23.56,21.28,23.56,11918152.0,0.0,2.16,0.06,3624.14,2.16,2506445.7,375.5,0.0,True,51.24,-0.56,-0.57,0.02,2026-01-15,21.42,9.99,2,21.28,21.28,24.08,True,True
15-01-2026 10:00,AKFIS,20.8,21.14,20.74,21.08,349847.0,0.06,0.28,0.02,1300.0,0.28,189421.5,84.69,0.21,True,58.22,0.02,0.04,-0.01,2026-01-15,20.8,1.35,0,,20.68,21.3,False,False
14-01-2026 17:00,SKBNK,7.86,7.97,7.86,7.94,7886633.0,0.03,0.08,0.02,370.59,0.08,5223862.5,50.97,0.37,True,71.5,0.07,0.06,0.0,2026-01-14,7.76,2.32,0,,7.37,8.0,False,False
14-01-2026 17:00,PASEU,161.0,169.1,160.1,169.1,2530521.0,0.0,8.1,0.98,726.53,8.1,597172.5,323.75,0.0,True,69.43,2.87,2.28,0.58,2026-01-14,165.0,2.48,1,169.1,147.5,ATH,False,False
14-01-2026 17:00,MEDTR,30.04,31.64,30.04,31.44,643970.0,0.2,1.4,0.05,2592.31,1.4,347469.6,85.33,0.14,True,68.58,0.47,0.44,0.03,2026-01-14,30.74,2.28,0,,28.52,31.82,False,False
14-01-2026 17:00,ADEL,32.38,35.2,32.3,35.2,1992507.0,0.0,2.82,0.32,775.78,2.82,391350.2,409.14,0.0,True,77.01,0.09,-0.16,0.25,2026-01-14,32.0,10.0,0,,31.82,ATH,True,False
14-01-2026 17:00,KRPLS,8.64,9.27,8.55,9.27,6188978.0,0.0,0.63,0.09,632.56,0.63,1491733.3,314.89,0.0,True,84.18,0.18,0.12,0.07,2026-01-14,8.43,9.96,0,,8.09,ATH,False,False
14-01-2026 16:00,ARFYE,34.12,41.0,34.12,39.54,23136753.0,1.46,5.42,0.29,1756.16,5.42,6546240.5,253.44,0.27,True,75.1,0.53,0.75,-0.22,2026-01-14,37.9,4.33,1,41.0,34.12,41.0,False,False
14-01-2026 15:00,ESCAR,27.66,28.24,27.64,28.12,1468024.0,0.12,0.46,0.14,223.94,0.46,881988.8,66.44,0.26,True,76.14,0.4,0.33,0.07,2026-01-14,27.56,2.03,0,,25.32,ATH,False,False
14-01-2026 13:00,FENER,3.26,3.42,3.26,3.39,103125982.0,0.03,0.13,0.01,1081.82,0.13,41660245.8,147.54,0.23,True,68.25,0.04,0.03,0.01,2026-01-14,3.29,3.04,0,,3.05,ATH,False,False
14-01-2026 12:00,VESTL,28.94,29.36,28.86,29.28,1453585.0,0.08,0.34,0.02,1316.67,0.34,545211.8,166.61,0.24,True,62.9,-0.02,-0.05,0.03,2026-01-14,28.74,1.88,0,,28.56,29.38,False,False
14-01-2026 12:00,SMRTG,22.32,22.76,22.28,22.66,1589385.0,0.1,0.34,0.01,5566.67,0.34,489670.1,224.58,0.29,True,58.04,-0.02,-0.02,0.0,2026-01-14,22.52,0.62,0,,22.2,22.74,False,False
14-01-2026 11:00,AVGYO,10.17,10.91,10.16,10.76,1867459.0,0.15,0.59,0.09,548.35,0.59,393777.6,374.24,0.25,True,84.55,0.13,0.08,0.06,2026-01-14,10.06,6.96,1,10.91,9.7,10.91,False,False
14-01-2026 11:00,ALFAS,40.52,41.18,40.5,41.12,532251.0,0.06,0.6,0.06,867.74,0.6,197126.1,170.01,0.1,True,66.82,0.08,0.04,0.04,2026-01-14,40.54,1.43,0,,40.06,ATH,False,False
14-01-2026 11:00,BNTAS,6.54,6.65,6.54,6.63,1373912.0,0.02,0.09,0.0,4400.0,0.09,379206.2,262.31,0.22,True,70.18,0.03,0.03,0.01,2026-01-14,6.55,1.22,0,,6.44,ATH,False,False
14-01-2026 11:00,MHRGY,3.5,3.64,3.5,3.6,1324053.0,0.04,0.1,0.01,1150.0,0.1,391145.6,238.51,0.4,True,69.73,0.03,0.03,-0.0,2026-01-14,3.53,1.98,1,3.64,3.49,3.64,False,False
14-01-2026 11:00,DYOBY,13.11,13.31,13.11,13.27,515081.0,0.04,0.16,0.02,627.27,0.16,143198.7,259.7,0.25,True,75.43,0.02,0.0,0.02,2026-01-14,13.07,1.53,0,,13.03,ATH,False,False
14-01-2026 11:00,BIGEN,8.92,9.04,8.9,9.01,1244241.0,0.03,0.09,0.0,2150.0,0.09,648813.2,91.77,0.33,True,54.04,0.0,-0.01,0.01,2026-01-14,9.01,0.0,0,,8.81,9.09,False,False
14-01-2026 11:00,GOZDE,23.04,23.48,23.04,23.48,517929.0,0.0,0.44,0.04,947.62,0.44,257668.4,101.01,0.0,True,67.28,0.18,0.16,0.02,2026-01-14,23.16,1.38,0,,22.72,ATH,False,False
14-01-2026 11:00,GENIL,168.8,170.1,168.4,169.8,96790.0,0.3,1.0,0.03,3233.33,1.0,63457.1,52.53,0.3,True,43.2,-0.9,-1.06,0.16,2026-01-14,170.0,-0.12,0,,168.3,172.8,True,False
14-01-2026 10:00,TUPRS,208.2,214.1,207.8,213.1,9642875.0,1.0,4.9,0.76,544.74,4.9,3233327.2,198.23,0.2,True,83.08,2.81,2.25,0.55,2026-01-14,208.4,2.26,0,,194.7,ATH,False,False
14-01-2026 10:00,BRLSM,13.88,14.84,13.81,14.72,4640912.0,0.12,0.84,0.09,843.82,0.84,655629.6,607.86,0.14,True,80.77,0.08,0.02,0.06,2026-01-14,13.9,5.9,0,,13.65,ATH,False,False
14-01-2026 10:00,OSTIM,3.11,3.26,3.06,3.25,12428326.0,0.01,0.14,0.02,723.53,0.14,2948511.8,321.51,0.07,True,75.95,0.03,0.02,0.01,2026-01-14,3.09,5.18,3,,2.97,ATH,False,False
14-01-2026 10:00,KCHOL,188.7,191.9,188.6,191.5,10073010.0,0.4,2.8,0.13,2053.85,2.8,4597311.9,119.11,0.14,True,65.06,1.2,1.28,-0.08,2026-01-14,187.9,1.92,0,,187.7,ATH,False,False
14-01-2026 10:00,AGROT,3.32,3.54,3.32,3.5,37002049.0,0.04,0.18,0.02,757.14,0.18,6950783.1,432.34,0.22,True,64.74,0.0,-0.01,0.01,2026-01-14,3.3,6.06,0,,3.25,3.64,False,False
13-01-2026 17:00,SOKE,11.12,11.15,11.05,11.15,305891.0,0.0,0.03,0.0,1400.0,0.03,114981.2,166.04,0.0,True,59.29,0.03,0.04,-0.01,2026-01-13,11.1,0.45,0,,11.03,11.36,False,False
13-01-2026 17:00,BAGFS,25.74,26.16,25.72,26.1,203280.0,0.06,0.36,0.04,757.14,0.36,84951.7,139.29,0.17,True,65.01,0.02,-0.02,0.04,2026-01-13,25.52,2.27,0,,25.46,ATH,False,False
13-01-2026 17:00,REEDR,6.92,7.1,6.92,7.05,12173650.0,0.05,0.13,0.03,381.48,0.13,4063102.0,199.61,0.38,True,68.35,0.03,0.02,0.01,2026-01-13,6.78,3.98,0,,6.72,7.1,False,False
13-01-2026 17:00,LIDER,74.25,77.65,74.15,77.65,361516.0,0.0,3.4,0.42,719.28,3.4,112130.2,222.41,0.0,True,77.81,1.01,0.78,0.23,2026-01-13,73.6,5.5,0,,70.75,ATH,False,False
13-01-2026 17:00,DCTTR,8.3,8.92,8.28,8.92,4474273.0,0.0,0.62,0.08,694.87,0.62,1011091.6,342.52,0.0,True,78.81,0.04,-0.02,0.06,2026-01-13,8.11,9.99,0,,8.03,ATH,False,False
13-01-2026 16:00,BIOEN,16.67,17.27,16.67,17.17,1259090.0,0.1,0.5,0.05,986.96,0.5,255797.1,392.22,0.2,True,65.73,0.01,-0.01,0.02,2026-01-13,16.75,2.51,0,,16.56,ATH,False,False
13-01-2026 15:00,AKBNK,73.6,75.1,73.45,74.8,16478598.0,0.3,1.2,0.02,5900.0,1.2,9187475.8,79.36,0.25,True,64.28,0.08,0.1,-0.02,2026-01-13,73.5,1.77,1,75.1,72.9,75.1,False,False
13-01-2026 15:00,MOBTL,9.68,9.96,9.63,9.88,4014618.0,0.08,0.2,0.03,640.74,0.2,1283832.0,212.71,0.4,True,69.1,0.09,0.08,0.02,2026-01-13,9.65,2.38,0,,9.32,ATH,False,False
13-01-2026 14:00,BLUME,44.36,45.54,44.2,45.54,667092.0,0.0,1.18,0.11,1013.21,1.18,321965.5,107.19,0.0,True,57.47,-0.26,-0.34,0.08,2026-01-13,44.58,2.15,0,,43.84,ATH,True,False
13-01-2026 13:00,SNICA,4.38,4.43,4.38,4.42,1354441.0,0.01,0.04,0.01,471.43,0.04,826742.7,63.83,0.25,True,57.89,-0.0,-0.01,0.01,2026-01-13,4.34,1.84,0,,4.29,4.45,False,False
13-01-2026 12:00,ALTNY,17.04,17.45,16.95,17.38,6912947.0,0.07,0.34,0.01,4150.0,0.34,4020341.4,71.95,0.21,True,69.52,0.31,0.32,-0.02,2026-01-13,17.16,1.28,0,,16.8,17.8,False,False
13-01-2026 12:00,KOPOL,5.25,5.32,5.25,5.32,1422353.0,0.0,0.07,0.01,1300.0,0.07,779165.6,82.55,0.0,True,51.99,-0.02,-0.03,0.01,2026-01-13,5.26,1.14,0,,5.2,ATH,True,False
13-01-2026 12:00,METRO,4.63,4.83,4.58,4.79,8116844.0,0.04,0.16,0.0,3900.0,0.16,2348999.3,245.54,0.25,True,57.58,-0.01,-0.02,0.0,2026-01-13,4.56,5.04,0,,4.55,4.95,False,False
13-01-2026 11:00,ZOREN,3.07,3.11,3.07,3.1,23919155.0,0.01,0.03,0.01,400.0,0.03,6660011.0,259.15,0.33,True,62.93,0.0,-0.0,0.0,2026-01-13,3.06,1.31,1,3.11,3.05,3.11,False,False
13-01-2026 11:00,ENERY,9.2,9.35,9.19,9.32,3228456.0,0.03,0.12,0.01,823.08,0.12,1100901.4,193.26,0.25,True,46.12,-0.07,-0.07,0.0,2026-01-13,9.19,1.41,1,9.35,9.16,9.35,True,True
13-01-2026 11:00,RALYH,220.8,223.3,220.8,223.1,245623.0,0.2,2.3,0.06,3733.33,2.3,114687.4,114.17,0.09,True,35.73,-1.8,-1.28,-0.51,2026-01-13,224.1,-0.45,0,,ATL,233.9,False,False
13-01-2026 11:00,HATEK,15.06,15.58,15.03,15.57,938961.0,0.01,0.51,0.08,514.46,0.51,551163.9,70.36,0.02,True,67.42,0.11,0.06,0.05,2026-01-13,15.25,2.1,0,,14.73,ATH,False,False
13-01-2026 11:00,GEDIK,5.88,5.95,5.85,5.94,1100142.0,0.01,0.06,0.0,5900.0,0.06,392773.2,180.1,0.17,True,46.98,-0.02,-0.02,-0.0,2026-01-13,5.9,0.68,2,5.85,5.85,6.03,False,False
13-01-2026 10:00,CANTE,2.06,2.12,2.05,2.11,185725398.0,0.01,0.05,0.0,900.0,0.05,45368880.5,309.37,0.2,True,69.02,0.01,0.0,0.01,2026-01-13,2.04,3.43,0,,2.01,ATH,False,False
13-01-2026 10:00,NIBAS,3.42,3.64,3.42,3.58,5656658.0,0.06,0.16,0.02,841.18,0.16,908228.7,522.82,0.38,True,64.57,-0.03,-0.04,0.01,2026-01-13,3.4,5.29,0,,3.31,ATH,False,False
13-01-2026 10:00,IMASM,4.86,5.04,4.79,5.0,30966345.0,0.04,0.14,0.02,600.0,0.14,6892645.8,349.27,0.29,True,72.46,0.03,0.02,0.01,2026-01-13,4.83,3.52,2,4.79,4.79,ATH,False,False
13-01-2026 10:00,POLHO,16.13,16.68,16.1,16.58,1565010.0,0.1,0.45,0.06,689.47,0.45,312060.3,401.51,0.22,True,67.24,0.04,0.01,0.03,2026-01-13,16.13,2.79,0,,15.9,ATH,False,False
12-01-2026 17:00,BUCIM,7.02,7.12,7.02,7.11,6108733.0,0.01,0.09,0.0,2900.0,0.09,1380967.7,342.35,0.11,True,45.79,-0.04,-0.04,0.0,2026-01-12,7.08,0.42,0,,7.01,ATH,True,True
12-01-2026 17:00,CVKMD,29.1,29.66,29.08,29.62,3345292.0,0.04,0.52,0.09,477.78,0.52,1712157.1,95.38,0.08,True,57.87,-0.02,-0.02,-0.01,2026-01-12,28.86,2.63,0,,28.1,30.56,False,False
12-01-2026 17:00,HEDEF,58.15,59.65,55.3,59.65,4243433.0,0.0,1.5,0.37,310.96,1.5,1354064.7,213.38,0.0,True,80.08,1.79,1.46,0.33,2026-01-12,54.25,9.95,2,55.3,55.3,ATH,False,False
12-01-2026 15:00,SAHOL,93.2,94.8,93.15,94.65,8507884.0,0.15,1.45,0.32,346.15,1.45,4094552.0,107.79,0.1,True,75.0,0.67,0.36,0.31,2026-01-12,91.3,3.67,1,94.8,89.1,94.8,False,False
12-01-2026 15:00,IZMDC,6.84,6.95,6.82,6.94,1336322.0,0.01,0.1,0.01,733.33,0.1,702805.1,90.14,0.1,True,63.39,0.01,-0.0,0.01,2026-01-12,6.81,1.91,0,,6.74,ATH,False,False
12-01-2026 13:00,RUZYE,10.95,11.5,10.95,11.44,4203574.0,0.06,0.49,0.02,1860.0,0.49,1009798.4,316.28,0.12,True,67.75,0.02,-0.01,0.02,2026-01-12,10.98,4.19,1,11.5,10.88,11.5,False,False
12-01-2026 13:00,LRSHO,4.62,4.8,4.62,4.76,9607291.0,0.04,0.14,0.02,483.33,0.14,3423257.1,180.65,0.29,True,79.98,0.08,0.06,0.02,2026-01-12,4.51,5.54,0,,4.33,ATH,False,False
12-01-2026 12:00,AYDEM,21.82,22.18,21.8,22.14,827918.0,0.04,0.32,0.07,344.44,0.32,470166.2,76.09,0.12,True,72.0,0.12,0.06,0.06,2026-01-12,21.48,3.07,0,,20.72,ATH,False,False
12-01-2026 11:00,BERA,18.27,18.8,18.26,18.65,3865447.0,0.15,0.38,0.02,1800.0,0.38,1160450.0,233.1,0.39,True,70.5,0.08,0.06,0.02,2026-01-12,17.98,3.73,1,18.8,17.9,18.8,False,False
12-01-2026 11:00,IHLGM,2.02,2.08,2.01,2.07,15445183.0,0.01,0.05,0.0,1566.67,0.05,2998746.9,415.05,0.2,True,71.34,0.0,-0.0,0.01,2026-01-12,1.99,4.02,0,,1.98,ATH,False,False
12-01-2026 10:00,VESBE,7.85,7.92,7.83,7.9,1435365.0,0.02,0.05,0.01,733.33,0.05,489927.9,192.97,0.4,True,55.49,-0.0,-0.01,0.01,2026-01-12,7.82,1.02,0,,7.75,7.91,False,False
12-01-2026 10:00,AKSUE,21.58,23.22,21.4,22.8,1482998.0,0.42,1.22,0.08,1352.38,1.22,264079.2,461.57,0.34,True,57.29,-0.14,-0.19,0.05,2026-01-12,21.7,5.07,3,,21.7,ATH,False,False
12-01-2026 10:00,GESAN,47.8,49.78,47.7,49.36,4211017.0,0.42,1.56,0.12,1158.06,1.56,654025.2,543.86,0.27,True,75.2,0.26,0.19,0.08,2026-01-12,47.78,3.31,0,,47.48,ATH,False,False
12-01-2026 10:00,CWENE,27.72,28.5,27.6,28.28,6476111.0,0.22,0.56,0.02,3400.0,0.56,1466121.3,341.72,0.39,True,55.06,-0.07,-0.07,-0.0,2026-01-12,27.74,1.95,3,,ATL,ATH,False,False
09-01-2026 17:00,ALBRK,8.18,8.28,8.15,8.26,5272040.0,0.02,0.08,0.01,566.67,0.08,1790182.8,194.5,0.25,True,62.28,0.01,0.0,0.01,2026-01-09,8.12,1.72,0,,8.04,ATH,False,False
09-01-2026 17:00,TSKB,13.39,13.55,13.37,13.54,5260967.0,0.01,0.15,0.01,1775.0,0.15,2785655.2,88.86,0.07,True,54.38,-0.01,-0.02,0.01,2026-01-09,13.47,0.52,0,,13.3,13.61,False,False
09-01-2026 17:00,CEMZY,52.6,56.0,52.4,55.45,7848850.0,0.55,2.85,0.42,586.75,2.85,1165929.5,573.18,0.19,True,74.87,0.21,-0.08,0.29,2026-01-09,51.15,8.41,0,,50.0,ATH,False,False
09-01-2026 17:00,DZGYO,7.83,7.92,7.82,7.91,975152.0,0.01,0.08,0.0,3900.0,0.08,588578.3,65.68,0.12,True,59.54,0.02,0.01,0.01,2026-01-09,7.89,0.25,0,,7.46,ATH,False,False
09-01-2026 17:00,TAVHL,322.25,325.5,321.5,324.75,502563.0,0.75,2.5,0.18,1328.57,2.5,228536.5,119.9,0.3,True,65.22,1.06,0.98,0.08,2026-01-09,322.5,0.7,0,,318.25,ATH,False,False
09-01-2026 14:00,GEREL,18.5,19.17,18.49,19.04,2168718.0,0.13,0.54,0.09,527.91,0.54,740866.8,192.73,0.24,True,66.47,0.05,0.02,0.03,2026-01-09,18.78,1.38,0,,18.06,ATH,False,False
09-01-2026 14:00,SMRVA,106.1,114.6,105.8,114.6,2868985.0,0.0,8.5,1.33,539.1,8.5,1056956.1,171.44,0.0,True,73.68,1.91,1.04,0.87,2026-01-09,104.2,9.98,0,,91.85,ATH,False,False
09-01-2026 14:00,TRILC,16.38,17.48,16.31,17.37,2223175.0,0.11,0.99,0.09,942.11,0.99,418208.3,431.6,0.11,True,72.8,0.03,-0.02,0.05,2026-01-09,16.58,4.76,2,16.31,16.31,ATH,False,False
09-01-2026 12:00,ORCAY,3.79,3.87,3.77,3.87,1358160.0,0.0,0.08,0.0,2566.67,0.08,600213.1,126.28,0.0,True,71.1,0.03,0.01,0.02,2026-01-09,3.64,6.32,0,,3.58,3.99,False,False
09-01-2026 11:00,ALKA,11.93,12.58,11.91,12.5,6949581.0,0.08,0.57,0.07,702.82,0.57,1544284.5,350.02,0.14,True,72.93,0.07,0.03,0.05,2026-01-09,11.7,6.84,0,,11.06,ATH,False,False
09-01-2026 10:00,MARBL,12.31,13.47,12.23,13.47,4291023.0,0.0,1.16,0.13,792.31,1.16,510836.3,740.0,0.0,True,87.59,0.07,-0.0,0.08,2026-01-09,12.25,9.96,1,13.47,12.06,ATH,False,False
09-01-2026 10:00,ADESE,1.57,1.6,1.56,1.6,45200001.0,0.0,0.03,0.01,500.0,0.03,19773413.3,128.59,0.0,True,69.89,0.0,-0.0,0.0,2026-01-09,1.56,2.56,0,,1.52,ATH,False,False
09-01-2026 10:00,DURKN,15.4,16.3,15.4,16.05,1517421.0,0.25,0.65,0.08,712.5,0.65,381376.1,297.88,0.38,True,77.39,0.05,0.01,0.04,2026-01-09,15.43,4.02,1,16.3,ATL,16.3,False,False
09-01-2026 10:00,FZLGY,14.75,15.72,14.75,15.64,8227178.0,0.08,0.89,0.12,647.9,0.89,1638719.0,402.05,0.09,True,82.35,0.11,0.04,0.07,2026-01-09,14.71,6.32,0,,ATL,ATH,False,False
09-01-2026 10:00,SUWEN,9.26,9.45,9.26,9.43,968721.0,0.02,0.17,0.03,448.39,0.17,489777.6,97.79,0.12,True,74.0,0.02,0.01,0.01,2026-01-09,9.24,2.06,0,,9.11,ATH,False,False
09-01-2026 10:00,DAGI,6.47,7.05,6.46,6.91,10161060.0,0.14,0.44,0.04,973.17,0.44,2018668.7,403.35,0.32,True,53.47,-0.05,-0.07,0.02,2026-01-09,6.41,7.8,1,7.05,6.32,7.05,False,False
08-01-2026 16:00,BEYAZ,28.7,30.38,28.66,30.3,601297.0,0.08,1.6,0.2,708.08,1.6,261941.0,129.55,0.05,True,68.47,0.05,-0.01,0.06,2026-01-08,28.92,4.77,0,,ATL,ATH,False,False
08-01-2026 16:00,AKFYE,16.92,17.07,16.91,17.05,357626.0,0.02,0.13,0.01,983.33,0.13,225819.1,58.37,0.15,True,60.09,-0.01,-0.01,0.01,2026-01-08,16.92,0.77,0,,16.73,ATH,False,False
08-01-2026 16:00,MARTI,2.67,2.72,2.66,2.72,1644279.0,0.0,0.05,0.0,4900.0,0.05,1081714.9,52.01,0.0,True,47.19,-0.01,-0.01,-0.0,2026-01-08,2.72,0.0,1,2.72,2.65,ATH,False,False
08-01-2026 16:00,PENTA,13.22,13.43,13.21,13.43,266678.0,0.0,0.21,0.01,4100.0,0.21,115788.1,130.32,0.0,True,48.66,-0.03,-0.03,0.0,2026-01-08,13.39,0.3,0,,13.18,ATH,False,False
08-01-2026 14:00,KLYPV,56.75,57.45,56.65,57.3,236335.0,0.15,0.55,0.06,746.15,0.55,143165.0,65.08,0.27,True,55.9,0.01,-0.02,0.03,2026-01-08,56.55,1.33,0,,ATL,57.8,False,False
08-01-2026 10:00,TNZTP,24.58,26.66,24.38,26.18,3697874.0,0.48,1.6,0.03,4900.0,1.6,851156.5,334.45,0.3,True,69.4,0.01,-0.03,0.04,2026-01-08,24.48,6.94,1,26.66,ATL,26.66,False,False
26-12-2025 16:00,SELVA,2.36,2.48,2.35,2.47,6953944.0,0.01,0.11,0.02,547.06,0.11,2627958.5,164.61,0.09,True,69.41,0.01,0.0,0.01,2025-12-26,2.3,7.39,0,,2.24,ATH,False,False
