Tarih,Hisse,open,high,low,close,volume,YuksekKapanis_Fark,AcilisKapanis_Fark,AcilisKapanisFark_Ort,AcilisKapanisFark_OrtalamayaGoreDegisim,AcilisKapanisFarkOrt_MaxSon10,HacimOrtalama,%Hacim_HacimOrtalama,Fark_Orani,Kosul,rsi,MACD_12_26_9,MACDs_12_26_9,MACDh_12_26_9,Tarih1,prev_close,%Deg,isPivot,pointpos,destek,direnc,Tsinyal_Banker_Dip,Tsinyal_Banker_DipKarar
15-01-2026 11:00,TUKAS,2.73,2.82,2.72,2.82,22911260.0,0.0,0.09,0.01,800.0,0.09,13719402.2,67.0,0.0,True,69.65,0.01,0.01,0.0,2026-01-15,2.69,4.83,0,,2.53,2.83,False,False
15-01-2026 11:00,RYSAS,15.94,16.73,15.93,16.72,1497432.0,0.01,0.78,0.08,887.34,0.78,953162.3,57.1,0.01,True,73.34,0.2,0.15,0.04,2026-01-15,15.96,4.76,0,,15.25,ATH,False,False
15-01-2026 10:00,MOGAN,8.32,8.45,8.31,8.43,793891.0,0.02,0.11,0.01,816.67,0.11,503124.5,57.79,0.18,True,56.68,-0.0,0.0,-0.01,2026-01-15,8.32,1.32,0,,8.31,8.46,False,False
15-01-2026 10:00,LILAK,32.16,33.72,32.14,33.42,4343998.0,0.3,1.26,0.01,12500.0,1.26,1249443.1,247.67,0.24,True,65.81,0.44,0.57,-0.13,2026-01-15,32.2,3.79,0,,28.0,34.3,False,False
15-01-2026 10:00,MACKO,25.2,27.1,24.98,26.78,1741774.0,0.32,1.58,0.2,690.0,1.58,295219.2,489.99,0.2,True,76.76,0.17,0.04,0.13,2026-01-15,24.98,7.21,0,,24.68,31.06,False,False
15-01-2026 10:00,DOFRB,86.75,88.45,86.3,88.25,3641170.0,0.2,1.5,0.03,4185.71,1.5,1234086.1,195.05,0.13,True,63.58,0.42,0.32,0.1,2026-01-15,86.45,2.08,0,,84.8,89.95,False,False
15-01-2026 10:00,MANAS,17.35,18.5,17.28,18.33,9816387.0,0.17,0.98,0.05,1714.81,0.98,2290425.7,328.58,0.17,True,55.29,-0.27,-0.27,-0.01,2026-01-15,17.27,6.14,0,,16.63,20.38,False,False
15-01-2026 10:00,MARKA,35.06,37.38,34.82,36.98,540268.0,0.4,1.92,0.24,700.0,1.92,143792.5,275.73,0.21,True,69.43,0.04,-0.19,0.23,2026-01-15,35.06,5.48,0,,33.7,40.54,False,False
15-01-2026 10:00,MARMR,2.16,2.33,2.07,2.31,207729589.0,0.02,0.15,0.02,525.0,0.15,62921016.6,230.14,0.13,True,79.01,0.09,0.08,0.01,2026-01-15,2.13,8.45,0,,1.67,ATH,False,False
15-01-2026 10:00,MEGMT,57.05,59.45,56.75,59.4,3208740.0,0.05,2.35,0.45,422.22,2.35,1887999.8,69.95,0.02,True,68.39,0.83,0.74,0.09,2026-01-15,57.1,4.03,0,,54.6,ATH,False,False
15-01-2026 10:00,DESA,11.62,11.86,11.54,11.81,545617.0,0.05,0.19,0.02,726.09,0.19,144151.4,278.5,0.26,True,59.78,0.01,0.01,0.0,2026-01-15,11.56,2.16,0,,11.55,11.82,False,False
15-01-2026 10:00,DERHL,13.4,13.68,13.36,13.68,634896.0,0.0,0.28,0.01,2053.85,0.28,327417.8,93.91,0.0,True,56.22,0.02,0.04,-0.02,2026-01-15,13.4,2.09,0,,13.2,13.96,False,False
15-01-2026 10:00,MGROS,608.5,617.5,608.0,616.0,1009118.0,1.5,7.5,1.0,650.0,7.5,321761.6,213.62,0.2,True,65.37,3.71,3.81,-0.09,2026-01-15,608.0,1.32,0,,574.5,ATH,False,False
15-01-2026 10:00,DARDL,2.18,2.25,2.17,2.25,7751155.0,0.0,0.07,0.0,2233.33,0.07,3717821.0,108.49,0.0,True,64.24,0.0,0.0,-0.0,2026-01-15,2.18,3.21,0,,2.18,2.3,False,False
15-01-2026 10:00,MNDTR,6.7,6.81,6.69,6.8,669564.0,0.01,0.1,0.01,1011.11,0.1,285955.5,134.15,0.1,True,52.4,0.01,0.02,-0.01,2026-01-15,6.74,0.89,0,,6.65,6.92,False,False
15-01-2026 10:00,A1YEN,30.92,32.5,30.92,32.34,1826408.0,0.16,1.42,0.03,4971.43,1.42,769149.4,137.46,0.11,True,51.85,-0.08,0.2,-0.29,2026-01-15,31.46,2.8,0,,31.82,35.0,False,False
15-01-2026 10:00,KTLEV,30.02,32.8,29.84,32.74,38694623.0,0.06,2.72,0.04,7455.56,2.72,10360420.3,273.49,0.02,True,57.63,0.36,0.75,-0.4,2026-01-15,30.7,6.64,0,,28.3,35.0,False,False
15-01-2026 10:00,ONRYT,71.2,73.35,71.0,73.0,391257.0,0.35,1.8,0.1,1700.0,1.8,121115.7,223.04,0.19,True,63.48,0.23,0.18,0.05,2026-01-15,71.2,2.53,0,,70.0,74.1,False,False
15-01-2026 10:00,CEMTS,11.05,11.24,11.0,11.22,837705.0,0.02,0.17,0.01,1207.69,0.17,377241.3,122.06,0.12,True,49.57,-0.06,-0.06,0.0,2026-01-15,11.1,1.08,0,,11.1,11.54,True,True
15-01-2026 10:00,GZNMI,43.4,46.84,43.04,46.22,4324131.0,0.62,2.82,0.11,2463.64,2.82,1087317.1,297.69,0.22,True,60.1,-0.4,-0.63,0.22,2026-01-15,42.86,7.84,0,,41.56,46.8,False,False
15-01-2026 10:00,PAHOL,1.52,1.54,1.52,1.54,91336481.0,0.0,0.02,0.0,1900.0,0.02,48684352.7,87.61,0.0,True,42.95,-0.01,-0.01,-0.0,2026-01-15,1.52,1.32,0,,ATL,1.57,False,False
15-01-2026 10:00,BURCE,73.2,79.6,73.1,78.85,1212681.0,0.75,5.65,0.47,1115.05,5.65,290877.0,316.91,0.13,True,57.36,-0.64,-0.35,-0.28,2026-01-15,73.5,7.28,0,,75.55,84.8,False,False
15-01-2026 10:00,PATEK,20.3,21.2,20.2,21.1,7281016.0,0.1,0.8,0.01,13233.33,0.8,2589984.2,181.12,0.12,True,45.43,-0.38,-0.34,-0.05,2026-01-15,20.28,4.04,0,,ATL,23.16,True,True
15-01-2026 10:00,QUAGR,2.49,2.68,2.49,2.64,92363950.0,0.04,0.15,0.01,1263.64,0.15,14979668.4,516.6,0.27,True,65.28,0.0,-0.0,0.01,2026-01-15,2.49,6.02,0,,2.42,3.13,False,False
15-01-2026 10:00,BSOKE,23.98,25.64,23.96,25.26,16349464.0,0.38,1.28,0.13,855.22,1.28,3765054.8,334.24,0.3,True,91.76,1.22,1.12,0.1,2026-01-15,23.5,7.49,0,,17.61,ATH,False,False
15-01-2026 10:00,BRKVY,99.6,101.1,99.0,100.7,220700.0,0.4,1.1,0.06,1733.33,1.1,89692.3,146.06,0.36,True,47.67,-0.85,-0.88,0.02,2026-01-15,99.7,1.0,0,,100.3,110.8,True,True
15-01-2026 10:00,BORLS,2.65,2.94,2.63,2.9,44001348.0,0.04,0.25,0.02,986.96,0.25,8456207.9,420.34,0.16,True,42.54,-0.15,-0.16,0.01,2026-01-15,2.82,2.84,0,,2.82,3.18,True,True
15-01-2026 10:00,SAMAT,5.64,5.71,5.63,5.7,139328.0,0.01,0.06,0.01,757.14,0.06,74631.2,86.69,0.17,True,51.25,-0.01,-0.01,0.0,2026-01-15,5.66,0.71,0,,5.6,5.76,False,False
15-01-2026 10:00,ODAS,5.11,5.19,5.11,5.19,12351175.0,0.0,0.08,0.01,471.43,0.08,5035333.0,145.29,0.0,True,60.14,-0.0,-0.01,0.01,2026-01-15,5.12,1.37,0,,5.04,5.21,False,False
15-01-2026 10:00,KRVGD,2.9,2.97,2.89,2.95,2226194.0,0.02,0.05,0.01,900.0,0.05,1145802.2,94.29,0.4,True,60.07,0.0,0.01,-0.0,2026-01-15,2.91,1.37,0,,2.88,3.0,False,False
15-01-2026 10:00,SANFM,7.06,7.2,7.06,7.17,776451.0,0.03,0.11,0.01,1733.33,0.11,350933.7,121.25,0.27,True,55.7,0.0,0.01,-0.0,2026-01-15,7.08,1.27,0,,6.96,7.38,False,False
15-01-2026 10:00,KONTR,10.01,10.25,9.98,10.2,25116557.0,0.05,0.19,0.01,1800.0,0.19,9958819.0,152.2,0.26,True,53.55,-0.06,-0.07,0.01,2026-01-15,9.96,2.41,0,,10.07,10.33,True,True
15-01-2026 10:00,GSDHO,4.52,4.6,4.5,4.59,1728029.0,0.01,0.07,0.01,775.0,0.07,1105817.9,56.27,0.14,True,57.78,0.0,0.0,-0.0,2026-01-15,4.53,1.32,0,,4.42,4.63,False,False
15-01-2026 10:00,HEKTS,2.89,2.95,2.88,2.95,29403817.0,0.0,0.06,0.0,1.351079888211149e+17,0.06,11164059.0,163.38,0.0,True,53.34,-0.02,-0.02,0.0,2026-01-15,2.89,2.08,0,,2.9,2.99,True,True
15-01-2026 10:00,GRTHO,245.1,252.5,244.0,251.75,147554.0,0.75,6.65,0.67,900.0,6.65,46675.3,216.13,0.11,True,62.47,0.33,-0.07,0.41,2026-01-15,244.9,2.8,0,,240.9,266.0,False,False
15-01-2026 10:00,HKTM,11.23,11.39,11.2,11.37,312342.0,0.02,0.14,0.0,4566.67,0.14,201043.7,55.36,0.14,True,54.43,-0.01,0.0,-0.01,2026-01-15,11.23,1.25,0,,11.25,11.49,False,False
15-01-2026 10:00,GLYHO,12.15,12.23,12.07,12.22,1113257.0,0.01,0.07,0.0,3.9406496739491896e+16,0.07,605461.7,83.87,0.14,True,49.16,-0.01,0.02,-0.02,2026-01-15,12.16,0.49,0,,11.69,12.49,False,False
15-01-2026 10:00,HTTBT,43.28,44.1,43.16,43.98,223696.0,0.12,0.7,0.04,1566.67,0.7,102708.4,117.8,0.17,True,60.75,0.21,0.23,-0.03,2026-01-15,43.1,2.04,0,,42.06,44.86,False,False
15-01-2026 10:00,GLRMK,182.4,186.3,181.0,185.7,487897.0,0.6,3.3,0.42,685.71,3.3,185149.1,163.52,0.18,True,73.66,1.78,1.5,0.28,2026-01-15,182.2,1.92,0,,170.7,ATH,False,False
15-01-2026 10:00,HUNER,3.17,3.2,3.12,3.2,6881158.0,0.0,0.03,0.01,275.0,0.03,2238784.7,207.36,0.0,True,60.59,0.01,0.01,0.0,2026-01-15,3.18,0.63,0,,3.09,3.23,False,False
15-01-2026 10:00,IHGZT,1.54,1.56,1.53,1.56,3072998.0,0.0,0.02,0.0,900.0,0.02,1757235.7,74.88,0.0,True,53.57,-0.0,-0.0,-0.0,2026-01-15,1.54,1.3,0,,1.54,1.57,False,False
15-01-2026 10:00,IHYAY,1.9,1.94,1.9,1.93,1248520.0,0.01,0.03,0.0,2900.0,0.03,524554.0,138.02,0.33,True,53.73,-0.0,-0.0,0.0,2026-01-15,1.91,1.05,0,,1.91,1.94,False,False
15-01-2026 10:00,INVEO,8.46,8.71,8.45,8.67,1433907.0,0.04,0.21,0.01,4100.0,0.21,561204.4,155.51,0.19,True,58.07,-0.01,-0.0,-0.01,2026-01-15,8.45,2.6,0,,8.43,8.78,False,False
15-01-2026 10:00,FORTE,94.3,97.1,93.95,96.95,706540.0,0.15,2.65,0.14,1862.96,2.65,304020.0,132.4,0.06,True,57.91,-0.31,-0.26,-0.05,2026-01-15,94.4,2.7,0,,93.0,102.0,False,False
15-01-2026 10:00,KATMR,2.98,3.06,2.97,3.04,39778641.0,0.02,0.06,0.0,5900.0,0.06,20383406.5,95.15,0.33,True,52.08,-0.01,-0.0,-0.0,2026-01-15,2.98,2.01,0,,2.99,3.11,False,False
15-01-2026 10:00,KBORU,14.54,14.99,14.52,14.91,1817592.0,0.08,0.37,0.04,900.0,0.37,717322.6,153.39,0.22,True,65.42,0.07,0.08,-0.0,2026-01-15,14.59,2.19,0,,14.46,15.01,False,False
15-01-2026 10:00,ETILR,3.82,3.86,3.8,3.85,1125765.0,0.01,0.03,0.01,500.0,0.03,457154.2,146.25,0.33,True,52.63,-0.01,-0.01,0.0,2026-01-15,3.82,0.79,0,,3.81,3.87,True,True
15-01-2026 10:00,KFEIN,8.53,8.77,8.52,8.73,799420.0,0.04,0.2,0.01,1328.57,0.2,401996.4,98.86,0.2,True,54.97,-0.03,-0.02,-0.01,2026-01-15,8.52,2.46,0,,8.59,8.78,False,False
15-01-2026 10:00,KLMSN,28.78,29.08,28.66,29.02,322672.0,0.06,0.24,0.0,11900.0,0.24,113055.6,185.41,0.25,True,53.28,-0.13,-0.19,0.06,2026-01-15,28.68,1.19,0,,28.54,29.16,True,False
15-01-2026 10:00,ENJSA,95.6,96.2,95.15,96.15,514000.0,0.05,0.55,0.02,2650.0,0.55,261683.4,96.42,0.09,True,58.59,0.26,0.36,-0.1,2026-01-15,95.65,0.52,0,,93.2,97.45,False,False
15-01-2026 10:00,KLRHO,370.0,392.0,365.5,386.0,371513.0,6.0,16.0,2.7,492.59,16.0,159014.5,133.63,0.38,True,53.51,-6.72,-10.61,3.89,2026-01-15,376.75,2.46,0,,336.0,ATH,False,False
15-01-2026 10:00,EMKEL,21.4,23.56,21.28,23.56,11918152.0,0.0,2.16,0.06,3624.14,2.16,2506445.7,375.5,0.0,True,51.12,-0.64,-0.69,0.05,2026-01-15,21.42,9.99,0,,22.2,24.08,True,True
15-01-2026 10:00,EKSUN,5.37,5.46,5.31,5.45,492408.0,0.01,0.08,0.01,700.0,0.08,247091.9,99.28,0.12,True,56.37,0.0,0.0,-0.0,2026-01-15,5.4,0.93,0,,5.22,5.47,False,False
15-01-2026 10:00,EKOS,5.84,6.29,5.81,6.25,10223615.0,0.04,0.41,0.0,8100.0,0.41,2702975.4,278.24,0.1,True,62.89,0.09,0.12,-0.03,2026-01-15,5.89,6.11,0,,5.39,6.47,False,False
15-01-2026 10:00,EGSER,2.94,2.99,2.93,2.98,534406.0,0.01,0.04,0.0,3900.0,0.04,349498.1,52.91,0.25,True,55.05,-0.01,-0.01,-0.0,2026-01-15,2.93,1.71,0,,2.95,3.0,False,False
15-01-2026 10:00,KMPUR,14.63,14.93,14.63,14.87,739150.0,0.06,0.24,0.0,11900.0,0.24,263280.6,180.75,0.25,True,46.85,-0.1,-0.1,-0.01,2026-01-15,14.63,1.64,0,,14.85,15.09,True,True
15-01-2026 10:00,KOCMT,2.59,2.66,2.56,2.65,7375142.0,0.01,0.06,0.0,5900.0,0.06,2799184.5,163.47,0.17,True,60.38,-0.01,-0.01,0.0,2026-01-15,2.59,2.32,0,,2.61,2.66,True,True
15-01-2026 10:00,BJKAS,1.59,1.63,1.59,1.62,11326444.0,0.01,0.03,0.0,1.351079888211149e+17,0.03,7543727.0,50.14,0.33,True,50.18,-0.01,-0.01,-0.0,2026-01-15,1.59,1.89,0,,1.61,1.67,False,False
15-01-2026 10:00,OSMEN,7.87,8.02,7.83,8.01,406187.0,0.01,0.14,0.0,6900.0,0.14,269782.3,50.56,0.07,True,50.96,-0.03,-0.02,-0.01,2026-01-15,7.89,1.52,0,,7.94,8.1,False,False
15-01-2026 10:00,GSRAY,1.16,1.18,1.15,1.18,59765466.0,0.0,0.02,0.0,1900.0,0.02,26796655.8,123.03,0.0,True,58.63,0.0,0.0,0.0,2026-01-15,1.16,1.72,0,,1.15,1.19,False,False
15-01-2026 10:00,TUCLK,4.43,4.52,4.42,4.51,2616401.0,0.01,0.08,0.0,7900.0,0.08,1445928.8,80.95,0.12,True,49.33,-0.03,-0.03,0.01,2026-01-15,4.44,1.58,0,,4.3,4.59,False,False
15-01-2026 10:00,AKFIS,20.8,21.14,20.74,21.08,349847.0,0.06,0.28,0.02,1300.0,0.28,189421.5,84.69,0.21,True,58.27,0.03,0.04,-0.01,2026-01-15,20.8,1.35,0,,20.58,21.3,False,False
15-01-2026 10:00,ATATP,147.3,155.9,146.3,154.3,1686624.0,1.6,7.0,1.78,293.26,7.0,561210.5,200.53,0.23,True,88.54,4.37,2.73,1.64,2026-01-15,144.6,6.71,0,,130.0,ATH,False,False
15-01-2026 10:00,ALKIM,20.4,20.94,20.2,20.8,780479.0,0.14,0.4,0.0,1.125899906842629e+17,0.4,451326.0,72.93,0.35,True,61.01,0.21,0.25,-0.04,2026-01-15,20.38,2.06,0,,19.7,21.28,False,False
15-01-2026 10:00,AKGRT,7.46,7.7,7.44,7.65,9700480.0,0.05,0.19,0.0,9400.0,0.19,2554876.7,279.68,0.26,True,69.68,0.09,0.1,-0.02,2026-01-15,7.46,2.55,0,,7.08,7.74,False,False
15-01-2026 10:00,ARZUM,2.28,2.34,2.28,2.33,1972279.0,0.01,0.05,0.0,1150.0,0.05,966974.2,103.96,0.2,True,64.69,0.01,0.01,0.0,2026-01-15,2.29,1.75,0,,2.18,2.41,False,False
15-01-2026 10:00,SOKM,55.25,56.45,55.05,56.25,1276910.0,0.2,1.0,0.06,1566.67,1.0,565757.7,125.7,0.2,True,65.03,0.29,0.33,-0.04,2026-01-15,55.5,1.35,0,,51.9,ATH,False,False
15-01-2026 10:00,TKFEN,69.5,70.75,69.5,70.45,420889.0,0.3,0.95,0.02,4650.0,0.95,268486.3,56.76,0.32,True,44.08,-0.45,-0.37,-0.08,2026-01-15,69.9,0.79,0,,ATL,72.95,False,False
15-01-2026 10:00,TKNSA,22.8,23.1,22.68,23.08,348804.0,0.02,0.28,0.01,4566.67,0.28,178946.7,94.92,0.07,True,56.15,0.02,0.05,-0.03,2026-01-15,22.8,1.23,0,,22.66,23.3,False,False
15-01-2026 10:00,AKSA,9.96,10.11,9.93,10.09,4769416.0,0.02,0.13,0.01,1525.0,0.13,2442916.9,95.23,0.15,True,57.6,-0.0,0.0,-0.01,2026-01-15,9.95,1.41,0,,9.88,10.16,False,False
15-01-2026 10:00,SILVR,2.7,2.75,2.68,2.75,363014.0,0.0,0.05,0.0,1150.0,0.05,216721.9,67.5,0.0,True,52.22,-0.01,-0.01,0.0,2026-01-15,2.73,0.73,0,,2.59,2.81,False,False
15-01-2026 10:00,ANSGR,25.5,25.9,24.4,25.82,2440476.0,0.08,0.32,0.1,220.0,0.32,1332413.8,83.16,0.25,True,75.79,0.31,0.24,0.07,2026-01-15,25.6,0.86,0,,24.2,ATH,False,False
15-01-2026 10:00,VBTYZ,15.58,16.25,15.48,16.06,1443530.0,0.19,0.48,0.04,1042.86,0.48,273548.7,427.7,0.4,True,75.49,0.06,0.01,0.06,2026-01-15,15.46,3.88,0,,15.19,17.4,False,False
15-01-2026 10:00,ANHYT,97.0,101.7,97.0,101.4,1764925.0,0.3,4.4,0.4,986.42,4.4,277996.5,534.87,0.07,True,75.18,-0.07,-0.39,0.32,2026-01-15,96.9,4.64,0,,96.6,103.5,True,True
15-01-2026 10:00,SARKY,33.62,35.44,33.6,35.08,20964123.0,0.36,1.46,0.21,608.74,1.46,3589002.4,484.12,0.25,True,92.06,1.74,1.58,0.17,2026-01-15,32.22,8.88,0,,26.92,ATH,False,False
15-01-2026 10:00,AKYHO,2.63,2.66,2.63,2.66,449385.0,0.0,0.03,0.01,500.0,0.03,212446.8,111.53,0.0,True,54.21,-0.01,-0.02,0.01,2026-01-15,2.63,1.14,0,,2.58,2.77,False,False
15-01-2026 10:00,ALVES,27.44,28.26,27.22,28.06,3073728.0,0.2,0.62,0.17,269.05,0.62,1245517.2,146.78,0.32,True,76.28,0.36,0.27,0.09,2026-01-15,27.42,2.33,0,,26.0,ATH,False,False
15-01-2026 10:00,ULUFA,3.67,3.72,3.67,3.71,2699424.0,0.01,0.04,0.0,1233.33,0.04,1118468.3,141.35,0.25,True,54.35,-0.01,-0.01,0.0,2026-01-15,3.67,1.09,0,,3.55,3.73,False,False
15-01-2026 10:00,TUREX,7.08,7.27,7.05,7.24,8583190.0,0.03,0.16,0.02,900.0,0.16,1996205.5,329.98,0.19,True,61.25,0.0,0.01,-0.0,2026-01-15,7.09,2.12,0,,7.08,7.29,False,False
15-01-2026 10:00,AVOD,3.79,3.87,3.77,3.85,2141252.0,0.02,0.06,0.0,1900.0,0.06,771712.9,177.47,0.33,True,47.59,-0.03,-0.02,-0.01,2026-01-15,3.78,1.85,0,,3.73,4.23,False,False
15-01-2026 10:00,ALKLC,214.0,219.1,210.0,218.1,223777.0,1.0,4.1,0.12,3316.67,4.1,61575.4,263.42,0.24,True,62.88,1.86,2.05,-0.19,2026-01-15,214.0,1.92,0,,172.6,219.3,False,False
15-01-2026 10:00,BESLR,12.53,13.22,12.51,13.09,2499252.0,0.13,0.56,0.05,1091.49,0.56,550437.0,354.05,0.23,True,75.09,0.03,0.01,0.02,2026-01-15,12.54,4.39,0,,12.52,ATH,False,False
15-01-2026 10:00,SELEC,78.6,80.45,78.6,80.15,119845.0,0.3,1.55,0.2,675.0,1.55,59587.1,101.13,0.19,True,50.73,-0.22,-0.15,-0.07,2026-01-15,79.9,0.31,0,,79.5,81.9,False,False
15-01-2026 10:00,SEGMN,25.06,26.28,24.72,26.2,5419743.0,0.08,1.14,0.24,383.05,1.14,972520.3,457.29,0.07,True,87.99,1.38,1.14,0.24,2026-01-15,23.94,9.44,0,,19.2,ATH,False,False
15-01-2026 10:00,YIGIT,22.98,23.58,22.88,23.52,880706.0,0.06,0.54,0.05,900.0,0.54,265415.8,231.82,0.11,True,60.64,0.01,0.02,-0.01,2026-01-15,23.12,1.73,0,,23.1,23.74,False,False
15-01-2026 10:00,BEGYO,4.71,4.75,4.69,4.74,1213755.0,0.01,0.03,0.0,2900.0,0.03,654274.5,85.51,0.33,True,46.5,-0.02,-0.02,0.0,2026-01-15,4.71,0.64,0,,4.73,4.79,False,False
15-01-2026 10:00,SDTTR,205.3,216.1,203.5,213.3,1094891.0,2.8,8.0,1.03,676.7,8.0,172324.0,535.37,0.35,True,76.09,1.34,0.42,0.91,2026-01-15,203.4,4.87,0,,198.7,ATH,False,False
15-01-2026 10:00,AGHOL,32.5,33.58,32.5,33.42,2296289.0,0.16,0.92,0.19,389.36,0.92,900532.5,154.99,0.17,True,73.78,0.49,0.41,0.08,2026-01-15,32.94,1.46,0,,30.86,ATH,False,False
15-01-2026 10:00,AFYON,13.54,13.72,13.5,13.69,605509.0,0.03,0.15,0.01,1150.0,0.15,320728.4,88.79,0.2,True,64.55,0.05,0.05,0.0,2026-01-15,13.55,1.03,0,,13.36,13.71,False,False
15-01-2026 10:00,BIENY,22.9,23.58,22.7,23.44,2362766.0,0.14,0.54,0.02,3275.0,0.54,425476.6,455.32,0.26,True,57.73,-0.09,-0.12,0.03,2026-01-15,22.74,3.08,0,,22.76,23.68,True,True
15-01-2026 10:00,YATAS,39.32,40.22,39.2,40.16,453358.0,0.06,0.84,0.04,2000.0,0.84,118153.2,283.7,0.07,True,55.44,-0.23,-0.25,0.02,2026-01-15,39.0,2.97,0,,39.2,41.0,True,True
15-01-2026 10:00,BALSU,16.31,16.5,16.2,16.47,1779819.0,0.03,0.16,0.02,900.0,0.16,910714.1,95.43,0.19,True,55.07,-0.01,-0.03,0.01,2026-01-15,16.31,0.98,0,,16.18,16.64,False,False
15-01-2026 10:00,VSNMD,89.7,93.95,89.45,93.75,643124.0,0.2,4.05,0.38,951.95,4.05,136824.3,370.04,0.05,True,71.01,0.27,0.18,0.09,2026-01-15,89.7,4.52,0,,88.35,93.85,False,False
15-01-2026 10:00,VRGYO,2.42,2.48,2.41,2.47,6896195.0,0.01,0.05,0.0,2400.0,0.05,3271234.7,110.81,0.2,True,59.96,-0.0,-0.0,-0.0,2026-01-15,2.41,2.49,0,,2.41,2.5,False,False
15-01-2026 10:00,YKSLN,3.12,3.16,3.12,3.15,1542947.0,0.01,0.03,0.0,650.0,0.03,706882.8,118.27,0.33,True,52.56,-0.0,0.0,-0.0,2026-01-15,3.14,0.32,0,,3.12,3.19,False,False
15-01-2026 10:00,YYLGD,10.72,11.03,10.71,11.0,2509047.0,0.03,0.28,0.02,1172.73,0.28,842583.6,197.78,0.11,True,70.75,0.07,0.08,-0.01,2026-01-15,10.71,2.71,0,,9.83,11.04,False,False
14-01-2026 17:00,ADGYO,55.7,60.7,55.2,60.7,3559907.0,0.0,5.0,0.54,834.58,5.0,452366.8,686.95,0.0,True,78.83,0.73,0.51,0.23,2026-01-14,55.2,9.96,0,,54.0,ATH,False,False
14-01-2026 17:00,RUBNS,29.04,32.0,29.02,31.6,4909496.0,0.4,2.56,0.21,1096.26,2.56,713977.5,587.63,0.16,True,72.42,0.31,0.13,0.19,2026-01-14,29.38,7.56,0,,27.42,ATH,False,False
14-01-2026 17:00,KRPLS,8.64,9.27,8.55,9.27,6188978.0,0.0,0.63,0.09,632.56,0.63,1491733.3,314.89,0.0,True,84.05,0.19,0.13,0.07,2026-01-14,8.43,9.96,0,,8.09,ATH,False,False
14-01-2026 17:00,ORGE,67.6,69.3,67.45,69.25,282231.0,0.05,1.65,0.07,2100.0,1.65,151726.2,86.01,0.03,True,59.14,0.27,0.4,-0.13,2026-01-14,68.4,1.24,0,,65.25,69.65,False,False
14-01-2026 17:00,PASEU,161.0,169.1,160.1,169.1,2530521.0,0.0,8.1,0.98,726.53,8.1,597172.5,323.75,0.0,True,69.45,3.19,2.71,0.48,2026-01-14,165.0,2.48,0,,147.5,ATH,False,False
14-01-2026 17:00,MEDTR,30.04,31.64,30.04,31.44,643970.0,0.2,1.4,0.05,2592.31,1.4,347469.6,85.33,0.14,True,68.49,0.48,0.45,0.03,2026-01-14,30.74,2.28,0,,28.52,31.82,False,False
14-01-2026 17:00,ADEL,32.38,35.2,32.3,35.2,1992507.0,0.0,2.82,0.32,775.78,2.82,391350.2,409.14,0.0,True,76.8,0.05,-0.22,0.27,2026-01-14,32.0,10.0,0,,31.82,37.5,True,False
14-01-2026 17:00,SKBNK,7.86,7.97,7.86,7.94,7886633.0,0.03,0.08,0.02,370.59,0.08,5223862.5,50.97,0.37,True,71.12,0.07,0.06,0.0,2026-01-14,7.76,2.32,0,,7.37,8.0,False,False
14-01-2026 16:00,ARFYE,34.12,41.0,34.12,39.54,23136753.0,1.46,5.42,0.29,1756.16,5.42,6546210.5,253.44,0.27,True,75.23,0.66,0.93,-0.27,2026-01-14,37.9,4.33,0,,34.12,ATH,False,False
14-01-2026 15:00,ALARK,101.0,102.6,100.2,102.5,2071804.0,0.1,1.5,0.1,1400.0,1.5,1186443.4,74.62,0.07,True,60.94,0.09,-0.14,0.23,2026-01-14,101.0,1.49,0,,99.8,104.1,False,False
14-01-2026 15:00,DITAS,39.28,40.58,38.92,40.48,1109186.0,0.1,1.2,0.06,1835.48,1.2,380742.0,191.32,0.08,True,65.16,0.48,0.54,-0.06,2026-01-14,39.0,3.79,0,,37.74,ATH,False,False
14-01-2026 15:00,MERCN,16.47,17.03,16.46,16.92,2793748.0,0.11,0.45,0.05,900.0,0.45,701016.6,298.53,0.24,True,70.06,0.08,0.02,0.05,2026-01-14,16.35,3.49,0,,16.0,ATH,False,False
14-01-2026 15:00,ESEN,5.75,5.86,5.73,5.83,18821490.0,0.03,0.08,0.0,3900.0,0.08,8463305.0,122.39,0.38,True,58.72,0.06,0.08,-0.03,2026-01-14,5.87,-0.68,0,,4.86,ATH,False,False
14-01-2026 15:00,ESCAR,27.66,28.24,27.64,28.12,1468024.0,0.12,0.46,0.14,223.94,0.46,881988.8,66.44,0.26,True,76.04,0.42,0.36,0.06,2026-01-14,27.56,2.03,0,,25.32,ATH,False,False
14-01-2026 15:00,ANGEN,11.05,11.19,10.99,11.18,491123.0,0.01,0.13,0.02,622.22,0.13,305597.6,60.71,0.08,True,67.68,0.03,0.01,0.02,2026-01-14,10.99,1.73,0,,10.81,11.19,False,False
14-01-2026 15:00,KIMMR,13.6,14.05,13.52,14.01,307644.0,0.04,0.41,0.04,951.28,0.41,119775.5,156.85,0.1,True,62.02,0.1,0.11,-0.01,2026-01-14,13.99,0.14,0,,13.41,ATH,False,False
14-01-2026 14:00,KAYSE,4.75,4.87,4.74,4.85,6791351.0,0.02,0.1,0.0,3233.33,0.1,1778125.0,281.94,0.2,True,58.08,0.0,0.0,-0.0,2026-01-14,4.74,2.32,0,,4.72,4.97,False,False
14-01-2026 13:00,FENER,3.26,3.42,3.26,3.39,103125982.0,0.03,0.13,0.01,1081.82,0.13,41660245.8,147.54,0.23,True,67.89,0.04,0.03,0.01,2026-01-14,3.29,3.04,0,,3.05,3.71,False,False
14-01-2026 12:00,FROTO,101.9,103.5,101.8,103.3,3449805.0,0.2,1.4,0.18,677.78,1.4,2222817.4,55.2,0.14,True,82.05,0.99,0.75,0.24,2026-01-14,100.9,2.38,0,,97.85,ATH,False,False
14-01-2026 12:00,KARSN,9.52,9.98,9.52,9.91,16506475.0,0.07,0.39,0.05,650.0,0.39,2920751.6,465.14,0.18,True,79.78,0.07,0.03,0.04,2026-01-14,9.32,6.33,1,9.98,9.27,9.98,False,False
14-01-2026 12:00,VESTL,28.94,29.36,28.86,29.28,1453585.0,0.08,0.34,0.02,1316.67,0.34,545211.8,166.61,0.24,True,62.9,-0.03,-0.07,0.04,2026-01-14,28.74,1.88,0,,28.56,29.38,False,False
14-01-2026 12:00,BINHO,9.26,9.66,9.24,9.6,36247925.0,0.06,0.34,0.05,655.56,0.34,7301949.3,396.41,0.18,True,73.1,0.1,0.05,0.04,2026-01-14,9.04,6.19,0,,8.89,ATH,False,False
14-01-2026 12:00,BORSK,6.0,6.14,5.99,6.11,4218269.0,0.03,0.11,0.01,685.71,0.11,1110807.5,279.75,0.27,True,66.94,0.03,0.01,0.01,2026-01-14,5.99,2.0,1,6.14,5.83,6.14,False,False
14-01-2026 12:00,CONSE,3.0,3.03,2.98,3.03,1881330.0,0.0,0.03,0.0,2900.0,0.03,806252.2,133.34,0.0,True,57.0,-0.0,-0.0,0.0,2026-01-14,3.01,0.66,1,3.03,2.97,3.05,False,False
14-01-2026 12:00,SMRTG,22.32,22.76,22.28,22.66,1589385.0,0.1,0.34,0.01,5566.67,0.34,489670.1,224.58,0.29,True,57.85,-0.02,-0.03,0.01,2026-01-14,22.52,0.62,0,,22.2,22.74,False,False
14-01-2026 11:00,ARCLK,111.9,114.2,111.9,114.1,1416854.0,0.1,2.2,0.16,1275.0,2.2,433649.1,226.73,0.05,True,72.21,0.85,0.66,0.19,2026-01-14,112.2,1.69,0,,111.4,ATH,False,False
14-01-2026 11:00,GOZDE,23.04,23.48,23.04,23.48,517929.0,0.0,0.44,0.04,947.62,0.44,257668.4,101.01,0.0,True,67.32,0.19,0.17,0.02,2026-01-14,23.16,1.38,0,,22.72,ATH,False,False
14-01-2026 11:00,GENIL,168.8,170.1,168.4,169.8,96790.0,0.3,1.0,0.03,3233.33,1.0,63457.1,52.53,0.3,True,42.85,-1.21,-1.48,0.27,2026-01-14,170.0,-0.12,0,,168.3,172.8,True,False
14-01-2026 11:00,ISKPL,11.42,11.6,11.41,11.58,2233736.0,0.02,0.16,0.03,370.59,0.16,1480689.4,50.86,0.12,True,66.54,0.03,-0.01,0.04,2026-01-14,11.4,1.58,0,,11.13,12.04,False,False
14-01-2026 11:00,ISMEN,41.62,42.12,41.6,42.04,1788324.0,0.08,0.42,0.04,950.0,0.42,1132113.7,57.96,0.19,True,60.7,0.18,0.13,0.05,2026-01-14,42.0,0.1,0,,41.34,42.5,False,False
14-01-2026 11:00,ELITE,28.28,29.72,28.24,29.38,1053659.0,0.34,1.1,0.13,746.15,1.1,324233.2,224.97,0.31,True,75.78,0.22,0.13,0.1,2026-01-14,28.44,3.31,1,29.72,27.6,29.72,False,False
14-01-2026 11:00,AVGYO,10.17,10.91,10.16,10.76,1867459.0,0.15,0.59,0.09,548.35,0.59,393777.6,374.24,0.25,True,84.28,0.14,0.08,0.06,2026-01-14,10.06,6.96,1,10.91,9.7,10.91,False,False
14-01-2026 11:00,ATAKP,52.8,55.65,52.8,55.65,590471.0,0.0,2.85,0.34,738.24,2.85,125580.8,370.19,0.0,True,84.36,0.35,0.15,0.2,2026-01-14,52.75,5.5,0,,51.75,ATH,False,False
14-01-2026 11:00,GOKNR,20.94,21.7,20.94,21.66,1561427.0,0.04,0.72,0.04,1614.29,0.72,391446.3,298.89,0.06,True,68.36,0.13,0.13,-0.0,2026-01-14,21.04,2.95,1,21.7,19.8,21.7,False,False
14-01-2026 11:00,BNTAS,6.54,6.65,6.54,6.63,1373912.0,0.02,0.09,0.0,4400.0,0.09,379206.2,262.31,0.22,True,69.99,0.03,0.03,0.01,2026-01-14,6.55,1.22,0,,6.44,6.65,False,False
14-01-2026 11:00,MHRGY,3.5,3.64,3.5,3.6,1324053.0,0.04,0.1,0.01,1150.0,0.1,391145.6,238.51,0.4,True,69.4,0.03,0.03,-0.0,2026-01-14,3.53,1.98,1,3.64,3.49,3.64,False,False
14-01-2026 11:00,BIGEN,8.92,9.04,8.9,9.01,1244241.0,0.03,0.09,0.0,2150.0,0.09,648813.2,91.77,0.33,True,54.19,-0.0,-0.02,0.02,2026-01-14,9.01,0.0,0,,8.81,9.09,False,False
14-01-2026 11:00,ALFAS,40.52,41.18,40.5,41.12,532251.0,0.06,0.6,0.06,867.74,0.6,197126.1,170.01,0.1,True,66.55,0.06,0.01,0.05,2026-01-14,40.54,1.43,0,,40.06,41.72,False,False
14-01-2026 11:00,DYOBY,13.11,13.31,13.11,13.27,515081.0,0.04,0.16,0.02,627.27,0.16,143198.7,259.7,0.25,True,75.11,0.02,-0.0,0.02,2026-01-14,13.07,1.53,0,,13.03,13.42,False,False
14-01-2026 11:00,EDIP,35.4,35.76,35.4,35.68,216739.0,0.08,0.28,0.03,723.53,0.28,139616.2,55.24,0.29,True,61.66,0.07,0.05,0.03,2026-01-14,35.36,0.9,0,,34.94,35.86,False,False
14-01-2026 11:00,KZGYO,24.72,25.18,24.72,25.16,237442.0,0.02,0.44,0.05,856.52,0.44,142628.1,66.48,0.05,True,61.75,0.07,0.05,0.02,2026-01-14,24.9,1.04,0,,24.42,25.56,False,False
14-01-2026 10:00,TUPRS,208.2,214.1,207.8,213.1,9642875.0,1.0,4.9,0.76,544.74,4.9,3233327.2,198.23,0.2,True,83.12,3.01,2.47,0.54,2026-01-14,208.4,2.26,0,,194.7,ATH,False,False
14-01-2026 10:00,AGROT,3.32,3.54,3.32,3.5,37002049.0,0.04,0.18,0.02,757.14,0.18,6950783.1,432.34,0.22,True,64.62,0.0,-0.0,0.01,2026-01-14,3.3,6.06,0,,3.25,3.64,False,False
14-01-2026 10:00,BRLSM,13.88,14.84,13.81,14.72,4640912.0,0.12,0.84,0.09,843.82,0.84,655629.6,607.86,0.14,True,80.57,0.08,0.02,0.06,2026-01-14,13.9,5.9,0,,13.65,ATH,False,False
14-01-2026 10:00,BRSAN,636.0,660.0,629.0,655.5,2024222.0,4.5,19.5,5.35,264.49,19.5,533281.4,279.58,0.23,True,91.91,18.62,13.37,5.24,2026-01-14,629.0,4.21,0,,568.0,ATH,False,False
14-01-2026 10:00,BAHKM,87.5,88.7,85.5,88.45,600119.0,0.25,0.95,0.01,9400.0,0.95,228269.8,162.9,0.26,True,57.66,0.22,0.24,-0.02,2026-01-14,86.9,1.78,0,,84.55,93.95,False,False
14-01-2026 10:00,OSTIM,3.11,3.26,3.06,3.25,12428326.0,0.01,0.14,0.02,723.53,0.14,2948511.8,321.51,0.07,True,75.75,0.03,0.02,0.01,2026-01-14,3.09,5.18,3,,2.97,ATH,False,False
14-01-2026 10:00,CCOLA,63.6,65.8,62.95,65.3,4469149.0,0.5,1.7,0.26,541.51,1.7,1100137.5,306.24,0.29,True,83.48,0.45,0.23,0.22,2026-01-14,63.2,3.32,0,,61.55,ATH,False,False
14-01-2026 10:00,KOTON,16.14,16.8,16.13,16.62,2111536.0,0.18,0.48,0.06,757.14,0.48,480473.7,339.47,0.37,True,76.9,0.08,0.05,0.04,2026-01-14,16.13,3.04,0,,15.9,ATH,False,False
14-01-2026 10:00,KRDMD,27.64,28.12,27.58,28.0,23174354.0,0.12,0.36,0.01,3500.0,0.36,6351518.6,264.86,0.33,True,68.29,0.16,0.15,0.01,2026-01-14,27.5,1.82,0,,26.66,ATH,False,False
14-01-2026 10:00,VAKFN,1.93,2.04,1.91,2.04,170740181.0,0.0,0.11,0.01,1122.22,0.11,31066248.5,449.6,0.0,True,71.73,0.01,0.01,0.01,2026-01-14,1.92,6.25,2,1.91,1.91,ATH,False,False
14-01-2026 10:00,EPLAS,5.35,5.44,5.28,5.43,1532285.0,0.01,0.08,0.01,1500.0,0.08,442248.0,246.48,0.13,True,72.54,0.05,0.05,0.01,2026-01-14,5.35,1.5,2,5.28,5.28,5.48,False,False
14-01-2026 10:00,EREGL,25.22,25.82,25.18,25.66,89364267.0,0.16,0.44,0.05,780.0,0.44,21584212.2,314.03,0.36,True,73.46,0.16,0.14,0.03,2026-01-14,25.14,2.07,0,,24.46,ATH,False,False
14-01-2026 10:00,KCHOL,188.7,191.9,188.6,191.5,10073010.0,0.4,2.8,0.13,2053.85,2.8,4597311.9,119.11,0.14,True,65.38,1.34,1.45,-0.11,2026-01-14,187.9,1.92,0,,187.7,ATH,False,False
14-01-2026 10:00,ULKER,122.3,127.4,121.9,126.1,3192359.0,1.3,3.8,0.67,467.16,3.8,1269030.3,151.56,0.34,True,77.9,2.04,1.66,0.38,2026-01-14,122.2,3.19,1,127.4,113.5,127.4,False,False
13-01-2026 17:00,RGYAS,144.4,148.0,144.3,147.5,485533.0,0.5,3.1,0.66,369.7,3.1,162557.1,198.68,0.16,True,83.44,1.31,0.86,0.45,2026-01-13,140.8,4.76,0,,138.2,ATH,False,False
13-01-2026 17:00,MOPAS,39.28,41.82,39.2,41.66,2257766.0,0.16,2.38,0.36,553.85,2.38,620493.8,263.87,0.07,True,82.88,0.55,0.27,0.28,2026-01-13,38.02,9.57,0,,37.9,ATH,False,False
13-01-2026 17:00,REEDR,6.92,7.1,6.92,7.05,12173650.0,0.05,0.13,0.03,381.48,0.13,4063102.0,199.61,0.38,True,68.01,0.04,0.02,0.01,2026-01-13,6.78,3.98,0,,6.72,7.1,False,False
13-01-2026 17:00,IEYHO,70.6,72.75,70.3,72.45,7557124.0,0.3,1.85,0.19,873.68,1.85,2283870.0,230.89,0.16,True,82.23,0.39,0.26,0.13,2026-01-13,69.75,3.87,1,72.75,69.55,72.75,False,False
13-01-2026 17:00,SOKE,11.12,11.15,11.05,11.15,305891.0,0.0,0.03,0.0,1400.0,0.03,114981.2,166.04,0.0,True,59.68,0.04,0.05,-0.01,2026-01-13,11.1,0.45,0,,11.03,11.36,False,False
13-01-2026 17:00,LIDER,74.25,77.65,74.15,77.65,361516.0,0.0,3.4,0.42,719.28,3.4,112130.2,222.41,0.0,True,77.23,1.15,0.95,0.2,2026-01-13,73.6,5.5,0,,70.75,ATH,False,False
13-01-2026 17:00,KRSTL,10.04,10.42,10.04,10.37,2760609.0,0.05,0.33,0.03,1220.0,0.33,655347.8,321.24,0.15,True,71.3,0.06,0.05,0.01,2026-01-13,10.12,2.47,0,,9.96,ATH,False,False
13-01-2026 17:00,INFO,3.95,4.02,3.93,4.02,11992620.0,0.0,0.07,0.01,677.78,0.07,5608581.2,113.83,0.0,True,61.09,0.02,0.02,0.0,2026-01-13,3.92,2.55,0,,3.84,4.07,False,False
13-01-2026 17:00,DNISI,19.43,19.89,19.43,19.89,507876.0,0.0,0.46,0.04,969.77,0.46,107377.3,372.98,0.0,True,67.02,0.0,-0.02,0.03,2026-01-13,19.48,2.1,0,,19.36,20.44,False,False
13-01-2026 17:00,GENTS,9.52,10.0,9.51,9.99,2626360.0,0.01,0.47,0.03,1416.13,0.47,698628.3,275.93,0.02,True,62.14,-0.07,-0.09,0.02,2026-01-13,9.67,3.31,0,,9.43,10.46,True,True
13-01-2026 17:00,DCTTR,8.3,8.92,8.28,8.92,4474273.0,0.0,0.62,0.08,694.87,0.62,1011091.6,342.52,0.0,True,78.24,0.03,-0.04,0.07,2026-01-13,8.11,9.99,0,,8.03,9.48,False,False
13-01-2026 17:00,BLCYT,39.84,41.34,39.6,41.2,789021.0,0.14,1.36,0.12,996.77,1.36,342303.6,130.5,0.1,True,80.21,1.35,1.33,0.03,2026-01-13,39.08,5.42,1,41.34,32.22,41.34,False,False
13-01-2026 16:00,TEKTU,8.27,8.55,8.27,8.53,5179417.0,0.02,0.26,0.02,1344.44,0.26,1581931.9,227.41,0.08,True,55.65,-0.04,-0.05,0.01,2026-01-13,8.31,2.65,0,,8.17,9.09,False,False
13-01-2026 16:00,LMKDC,29.7,30.38,29.7,30.38,1923761.0,0.0,0.68,0.07,930.3,0.68,534072.5,260.21,0.0,True,75.96,0.3,0.28,0.02,2026-01-13,29.6,2.64,0,,29.2,ATH,False,False
13-01-2026 16:00,BIOEN,16.67,17.27,16.67,17.17,1259090.0,0.1,0.5,0.05,986.96,0.5,255797.1,392.22,0.2,True,65.06,-0.01,-0.04,0.03,2026-01-13,16.75,2.51,0,,16.56,17.71,False,False
13-01-2026 16:00,PETUN,11.5,11.61,11.49,11.6,260735.0,0.01,0.1,0.0,9900.0,0.1,121815.4,114.04,0.1,True,61.23,0.04,0.05,-0.01,2026-01-13,11.6,0.0,0,,11.45,11.69,False,False
13-01-2026 15:00,TCELL,101.1,102.3,101.1,102.0,5907035.0,0.3,0.9,0.26,252.94,0.9,3652591.5,61.72,0.33,True,74.85,0.66,0.44,0.22,2026-01-13,99.55,2.46,0,,97.05,ATH,False,False
13-01-2026 15:00,AVHOL,40.38,42.22,40.16,41.84,1382056.0,0.38,1.46,0.28,428.99,1.46,389678.7,254.67,0.26,True,71.31,0.57,0.42,0.16,2026-01-13,39.16,6.84,0,,38.5,42.0,False,False
13-01-2026 15:00,MAVI,45.14,45.78,45.0,45.72,1557616.0,0.06,0.58,0.07,683.78,0.58,839527.4,85.53,0.1,True,74.76,0.37,0.34,0.03,2026-01-13,45.0,1.6,0,,44.46,ATH,False,False
13-01-2026 15:00,AKBNK,73.6,75.1,73.45,74.8,16478598.0,0.3,1.2,0.02,5900.0,1.2,9187475.8,79.36,0.25,True,63.75,0.08,0.1,-0.01,2026-01-13,73.5,1.77,1,75.1,72.9,75.1,False,False
13-01-2026 15:00,MOBTL,9.68,9.96,9.63,9.88,4014618.0,0.08,0.2,0.03,640.74,0.2,1283832.0,212.71,0.4,True,69.04,0.11,0.09,0.02,2026-01-13,9.65,2.38,0,,9.32,ATH,False,False
13-01-2026 15:00,ASTOR,137.8,140.2,137.5,140.0,7044077.0,0.2,2.2,0.58,279.31,2.2,4286716.9,64.32,0.09,True,77.91,3.62,3.55,0.07,2026-01-13,135.7,3.17,0,,115.1,ATH,False,False
13-01-2026 14:00,OBAMS,8.53,8.75,8.53,8.74,8954325.0,0.01,0.21,0.01,2233.33,0.21,4606883.1,94.37,0.05,True,64.82,0.08,0.09,-0.01,2026-01-13,8.65,1.04,0,,8.47,ATH,False,False
13-01-2026 14:00,BLUME,44.36,45.54,44.2,45.54,667092.0,0.0,1.18,0.11,1013.21,1.18,321965.5,107.19,0.0,True,56.51,-0.37,-0.49,0.11,2026-01-13,44.58,2.15,0,,43.84,ATH,True,False
13-01-2026 14:00,KCAER,10.78,11.2,10.76,11.14,5533662.0,0.06,0.36,0.04,737.21,0.36,1871733.3,195.64,0.17,True,78.08,0.11,0.08,0.03,2026-01-13,10.75,3.63,0,,10.36,ATH,False,False
13-01-2026 14:00,KLSYN,7.58,8.09,7.55,8.09,23014606.0,0.0,0.51,0.06,750.0,0.51,4422147.8,420.44,0.0,True,67.84,-0.05,-0.08,0.03,2026-01-13,7.36,9.92,0,,7.02,ATH,False,False
13-01-2026 13:00,SNICA,4.38,4.43,4.38,4.42,1354441.0,0.01,0.04,0.01,471.43,0.04,826742.7,63.83,0.25,True,57.39,-0.0,-0.01,0.01,2026-01-13,4.34,1.84,0,,4.29,4.45,False,False
13-01-2026 13:00,TRCAS,40.74,41.26,40.68,41.24,406971.0,0.02,0.5,0.09,481.4,0.5,139185.8,192.39,0.04,True,65.86,0.04,0.0,0.04,2026-01-13,40.2,2.59,0,,40.06,ATH,False,False
13-01-2026 13:00,FRIGO,14.34,14.64,14.33,14.61,2211340.0,0.03,0.27,0.07,280.28,0.27,1454412.0,52.04,0.11,True,71.46,0.21,0.17,0.03,2026-01-13,14.23,2.67,0,,13.54,ATH,False,False
13-01-2026 12:00,INDES,7.49,7.75,7.48,7.71,5308763.0,0.04,0.22,0.02,816.67,0.22,1069308.3,396.47,0.18,True,73.81,0.01,-0.02,0.02,2026-01-13,7.47,3.21,1,7.75,7.4,7.75,False,False
13-01-2026 12:00,KOPOL,5.25,5.32,5.25,5.32,1422353.0,0.0,0.07,0.01,1300.0,0.07,779165.6,82.55,0.0,True,52.57,-0.03,-0.04,0.01,2026-01-13,5.26,1.14,0,,5.2,5.69,True,False
13-01-2026 12:00,ALTNY,17.04,17.45,16.95,17.38,6912947.0,0.07,0.34,0.01,4150.0,0.34,4020341.4,71.95,0.21,True,69.5,0.36,0.38,-0.02,2026-01-13,17.16,1.28,0,,16.8,17.8,False,False
13-01-2026 12:00,METRO,4.63,4.83,4.58,4.79,8116844.0,0.04,0.16,0.0,3900.0,0.16,2348999.3,245.54,0.25,True,59.11,0.01,0.01,-0.01,2026-01-13,4.56,5.04,0,,4.55,4.95,False,False
13-01-2026 12:00,DOAS,216.5,218.5,216.3,218.0,521797.0,0.5,1.5,0.37,305.41,1.5,279941.9,86.39,0.33,True,70.3,2.61,2.72,-0.1,2026-01-13,217.2,0.37,0,,201.5,ATH,False,False
13-01-2026 11:00,ENERY,9.2,9.35,9.19,9.32,3228456.0,0.03,0.12,0.01,823.08,0.12,1100901.4,193.26,0.25,True,46.78,-0.07,-0.08,0.0,2026-01-13,9.19,1.41,1,9.35,9.16,9.35,True,True
13-01-2026 11:00,RALYH,220.8,223.3,220.8,223.1,245623.0,0.2,2.3,0.06,3733.33,2.3,114687.4,114.17,0.09,True,36.54,-1.94,-1.39,-0.55,2026-01-13,224.1,-0.45,0,,ATL,233.9,False,False
13-01-2026 11:00,PRKAB,32.32,33.84,32.24,33.84,1329392.0,0.0,1.52,0.25,508.0,1.52,343781.0,286.7,0.0,True,85.05,0.33,0.08,0.25,2026-01-13,30.78,9.94,0,,30.62,ATH,False,False
13-01-2026 11:00,DOKTA,24.18,24.68,24.08,24.54,146298.0,0.14,0.36,0.03,958.82,0.36,83343.6,75.54,0.39,True,57.46,-0.07,-0.08,0.01,2026-01-13,23.94,2.51,0,,23.72,25.56,False,False
13-01-2026 11:00,ZOREN,3.07,3.11,3.07,3.1,23919155.0,0.01,0.03,0.01,400.0,0.03,6660011.0,259.15,0.33,True,62.81,0.0,-0.0,0.0,2026-01-13,3.06,1.31,1,3.11,3.05,3.11,False,False
13-01-2026 11:00,ESCOM,3.67,3.76,3.66,3.75,5501706.0,0.01,0.08,0.0,2566.67,0.08,3086226.3,78.27,0.12,True,70.65,0.07,0.07,0.01,2026-01-13,3.66,2.46,0,,3.28,ATH,False,False
13-01-2026 11:00,SKTAS,3.77,3.96,3.77,3.93,5077944.0,0.03,0.16,0.02,595.65,0.16,1317072.6,285.55,0.19,True,73.89,0.01,-0.01,0.02,2026-01-13,3.71,5.93,0,,3.64,3.95,False,False
13-01-2026 11:00,AHGAZ,21.94,22.36,21.88,22.32,867338.0,0.04,0.38,0.04,804.76,0.38,329677.3,163.09,0.11,True,62.47,-0.05,-0.08,0.03,2026-01-13,21.72,2.76,0,,21.72,23.14,True,True
13-01-2026 11:00,HDFGS,3.99,4.2,3.98,4.16,48534496.0,0.04,0.17,0.02,580.0,0.17,22521655.2,115.5,0.24,True,67.9,0.07,0.07,-0.0,2026-01-13,4.04,2.97,1,4.2,3.56,4.2,False,False
13-01-2026 11:00,HATEK,15.06,15.58,15.03,15.57,938961.0,0.01,0.51,0.08,514.46,0.51,551163.9,70.36,0.02,True,67.08,0.12,0.07,0.05,2026-01-13,15.25,2.1,0,,14.73,15.96,False,False
13-01-2026 11:00,GEDIK,5.88,5.95,5.85,5.94,1100142.0,0.01,0.06,0.0,5900.0,0.06,392773.2,180.1,0.17,True,47.8,-0.02,-0.02,-0.0,2026-01-13,5.9,0.68,2,5.85,5.85,6.03,False,False
13-01-2026 10:00,DMSAS,9.15,9.19,9.14,9.19,476889.0,0.0,0.04,0.01,566.67,0.04,253654.4,88.01,0.0,True,60.71,0.01,0.01,0.0,2026-01-13,9.14,0.55,0,,9.09,9.2,False,False
13-01-2026 10:00,BIMAS,619.0,638.0,618.0,637.5,2066743.0,0.5,18.5,1.0,1750.0,18.5,743183.8,178.09,0.03,True,75.76,10.1,9.73,0.37,2026-01-13,619.0,2.99,0,,575.0,ATH,False,False
13-01-2026 10:00,AZTEK,4.2,4.28,4.19,4.26,1100485.0,0.02,0.06,0.0,1100.0,0.06,706444.2,55.78,0.33,True,65.35,0.02,0.01,0.01,2026-01-13,4.2,1.43,0,,4.12,4.3,False,False
13-01-2026 10:00,GARFA,27.8,29.82,27.74,29.68,1619878.0,0.14,1.88,0.21,803.85,1.88,212442.5,662.5,0.07,True,80.67,0.24,0.15,0.08,2026-01-13,27.74,6.99,0,,27.06,ATH,False,False
13-01-2026 10:00,POLHO,16.13,16.68,16.1,16.58,1565010.0,0.1,0.45,0.06,689.47,0.45,312060.3,401.51,0.22,True,66.79,0.04,0.0,0.04,2026-01-13,16.13,2.79,0,,15.9,16.65,False,False
13-01-2026 10:00,IMASM,4.86,5.04,4.79,5.0,30966345.0,0.04,0.14,0.02,600.0,0.14,6892645.8,349.27,0.29,True,71.48,0.03,0.02,0.01,2026-01-13,4.83,3.52,2,4.79,4.79,5.07,False,False
13-01-2026 10:00,NIBAS,3.42,3.64,3.42,3.58,5656658.0,0.06,0.16,0.02,841.18,0.16,908228.7,522.82,0.38,True,64.37,-0.03,-0.05,0.01,2026-01-13,3.4,5.29,0,,3.31,3.71,False,False
13-01-2026 10:00,YUNSA,7.69,7.82,7.65,7.82,1631568.0,0.0,0.13,0.02,664.71,0.13,883407.4,84.69,0.0,True,64.96,0.05,0.04,0.01,2026-01-13,7.75,0.9,2,7.65,7.65,ATH,False,False
13-01-2026 10:00,XU030,13386.17,13494.5,13380.94,13476.59,774838582.0,17.91,90.42,1.64,5403.35,90.42,449095361.8,72.53,0.2,True,68.24,85.78,87.54,-1.75,2026-01-13,13379.12,0.73,0,,12929.65,13507.33,False,False
13-01-2026 10:00,CELHA,10.85,11.24,10.6,11.23,1021559.0,0.01,0.38,0.02,2011.11,0.38,336130.4,203.92,0.03,True,63.18,0.18,0.15,0.02,2026-01-13,10.95,2.56,2,10.6,10.6,11.44,False,False
13-01-2026 10:00,CANTE,2.06,2.12,2.05,2.11,185725398.0,0.01,0.05,0.0,900.0,0.05,45368880.5,309.37,0.2,True,68.36,0.01,-0.0,0.01,2026-01-13,2.04,3.43,0,,2.01,2.13,False,False
13-01-2026 10:00,ECILC,101.5,107.0,101.0,106.3,5435096.0,0.7,4.8,0.94,410.64,4.8,1135753.2,378.55,0.15,True,91.08,3.55,2.84,0.71,2026-01-13,100.2,6.09,1,107.0,90.3,107.0,False,False
12-01-2026 17:00,HEDEF,58.15,59.65,55.3,59.65,4243433.0,0.0,1.5,0.37,310.96,1.5,1354064.7,213.38,0.0,True,80.03,2.38,2.16,0.22,2026-01-12,54.25,9.95,2,55.3,55.3,ATH,False,False
12-01-2026 17:00,CVKMD,29.1,29.66,29.08,29.62,3345292.0,0.04,0.52,0.09,477.78,0.52,1712157.1,95.38,0.08,True,57.92,0.03,0.06,-0.03,2026-01-12,28.86,2.63,0,,28.1,30.56,False,False
12-01-2026 17:00,BUCIM,7.02,7.12,7.02,7.11,6108733.0,0.01,0.09,0.0,2900.0,0.09,1380967.7,342.35,0.11,True,45.12,-0.06,-0.07,0.01,2026-01-12,7.08,0.42,0,,7.01,7.64,True,True
12-01-2026 17:00,ECOGR,24.34,24.74,24.26,24.68,3126801.0,0.06,0.34,0.08,304.76,0.34,1429140.9,118.79,0.18,True,69.9,0.11,0.08,0.03,2026-01-12,24.1,2.41,0,,23.66,ATH,False,False
12-01-2026 17:00,KRDMA,25.44,25.62,25.38,25.6,568664.0,0.02,0.16,0.01,1500.0,0.16,330010.1,72.32,0.12,True,63.46,0.17,0.18,-0.01,2026-01-12,25.34,1.03,0,,25.22,25.72,False,False
12-01-2026 17:00,BTCIM,3.79,4.0,3.77,3.95,137238036.0,0.05,0.16,0.02,900.0,0.16,28118862.8,388.06,0.31,True,76.04,0.03,0.02,0.01,2026-01-12,3.75,5.33,0,,3.7,ATH,False,False
12-01-2026 17:00,ISFIN,17.77,17.96,17.77,17.95,428163.0,0.01,0.18,0.0,17900.0,0.18,135413.9,216.19,0.06,True,59.94,0.13,0.16,-0.03,2026-01-12,17.91,0.22,0,,17.71,18.06,False,False
12-01-2026 17:00,TCKRC,78.75,81.45,78.55,80.75,1022242.0,0.7,2.0,0.31,545.16,2.0,360974.6,183.19,0.35,True,77.68,1.66,1.62,0.04,2026-01-12,76.25,5.9,0,,74.15,ATH,False,False
12-01-2026 16:00,EGPRO,26.08,27.04,25.96,26.88,413919.0,0.16,0.8,0.08,852.38,0.8,134354.7,208.08,0.2,True,71.64,0.16,0.11,0.05,2026-01-12,26.0,3.38,0,,25.82,ATH,False,False
12-01-2026 15:00,SAHOL,93.2,94.8,93.15,94.65,8507884.0,0.15,1.45,0.32,346.15,1.45,4094552.0,107.79,0.1,True,75.1,0.75,0.43,0.32,2026-01-12,91.3,3.67,1,94.8,89.1,94.8,False,False
12-01-2026 15:00,IZMDC,6.84,6.95,6.82,6.94,1336322.0,0.01,0.1,0.01,733.33,0.1,702805.1,90.14,0.1,True,63.41,-0.0,-0.02,0.01,2026-01-12,6.81,1.91,0,,6.74,7.16,False,False
12-01-2026 15:00,EGEGY,26.64,27.9,26.64,27.56,893304.0,0.34,0.92,0.1,838.78,0.92,443450.3,101.44,0.37,True,70.25,0.38,0.27,0.12,2026-01-12,26.66,3.38,1,27.9,24.96,27.9,False,False
12-01-2026 14:00,ICUGS,2.62,2.73,2.61,2.72,9136172.0,0.01,0.1,0.0,1900.0,0.1,1942596.6,370.31,0.1,True,66.09,-0.0,-0.01,0.0,2026-01-12,2.63,3.42,0,,2.59,2.74,False,False
12-01-2026 14:00,AHSGY,20.66,22.74,20.56,22.26,3946567.0,0.48,1.6,0.06,2757.14,1.6,1504680.3,162.29,0.3,True,62.64,0.42,0.6,-0.19,2026-01-12,21.74,2.39,0,,20.32,22.98,False,False
12-01-2026 14:00,HURGZ,5.19,5.25,5.18,5.24,473185.0,0.01,0.05,0.0,1566.67,0.05,268032.8,76.54,0.2,True,46.33,-0.03,-0.04,0.0,2026-01-12,5.24,0.0,0,,5.16,5.46,True,True
12-01-2026 13:00,RUZYE,10.95,11.5,10.95,11.44,4203574.0,0.06,0.49,0.02,1860.0,0.49,1009798.4,316.28,0.12,True,66.19,-0.01,-0.05,0.03,2026-01-12,10.98,4.19,1,11.5,10.88,11.5,False,False
12-01-2026 13:00,LRSHO,4.62,4.8,4.62,4.76,9607291.0,0.04,0.14,0.02,483.33,0.14,3423257.1,180.65,0.29,True,78.76,0.1,0.09,0.01,2026-01-12,4.51,5.54,0,,4.33,ATH,False,False
12-01-2026 12:00,AYDEM,21.82,22.18,21.8,22.14,827918.0,0.04,0.32,0.07,344.44,0.32,470166.2,76.09,0.12,True,65.63,0.02,-0.09,0.11,2026-01-12,21.48,3.07,0,,20.72,23.7,False,False
12-01-2026 12:00,KAREL,8.84,9.04,8.83,9.01,2406847.0,0.03,0.17,0.03,466.67,0.17,705931.7,240.95,0.18,True,72.78,0.04,0.02,0.02,2026-01-12,8.7,3.56,0,,8.65,ATH,False,False
12-01-2026 12:00,KNFRT,11.29,11.71,11.23,11.68,1401907.0,0.03,0.39,0.05,664.71,0.39,392670.1,257.02,0.08,True,70.11,-0.02,-0.08,0.07,2026-01-12,11.0,6.18,0,,10.94,11.77,True,False
12-01-2026 12:00,IHEVA,2.23,2.27,2.22,2.26,1054397.0,0.01,0.03,0.0,500.0,0.03,279574.1,277.14,0.33,True,65.03,-0.0,-0.01,0.01,2026-01-12,2.2,2.73,0,,2.17,2.28,False,False
12-01-2026 11:00,ARENA,29.56,30.62,29.56,30.36,621081.0,0.26,0.8,0.12,566.67,0.8,272349.4,128.05,0.33,True,74.86,0.34,0.21,0.14,2026-01-12,28.36,7.05,1,30.62,28.1,30.62,False,False
12-01-2026 11:00,TRENJ,100.8,102.8,100.6,102.8,571175.0,0.0,2.0,0.12,1500.0,2.0,308420.7,85.19,0.0,True,72.86,0.98,0.64,0.34,2026-01-12,99.0,3.84,0,,94.5,ATH,False,False
12-01-2026 11:00,BERA,18.27,18.8,18.26,18.65,3865447.0,0.15,0.38,0.02,1800.0,0.38,1160450.0,233.1,0.39,True,66.63,0.06,0.02,0.04,2026-01-12,17.98,3.73,1,18.8,17.9,18.8,False,False
12-01-2026 11:00,NTGAZ,9.99,10.12,9.98,10.12,952137.0,0.0,0.13,0.01,1525.0,0.13,443697.9,114.59,0.0,True,66.53,0.01,-0.0,0.01,2026-01-12,9.95,1.71,0,,9.87,10.16,False,False
12-01-2026 11:00,GWIND,24.44,24.9,24.4,24.88,1218722.0,0.02,0.44,0.08,464.1,0.44,471566.5,158.44,0.05,True,74.93,0.16,0.09,0.07,2026-01-12,23.9,4.1,0,,23.5,ATH,False,False
12-01-2026 11:00,ENSRI,17.91,19.25,17.85,19.05,2222139.0,0.2,1.14,0.08,1325.0,1.14,566459.4,292.29,0.18,True,69.02,0.07,0.02,0.06,2026-01-12,18.27,4.27,0,,17.6,ATH,False,False
12-01-2026 11:00,IHLAS,2.34,2.44,2.33,2.44,71674216.0,0.0,0.1,0.02,488.24,0.1,15691932.6,356.76,0.0,True,81.38,0.01,-0.01,0.02,2026-01-12,2.26,7.96,0,,2.25,2.49,False,False
12-01-2026 11:00,IHLGM,2.02,2.08,2.01,2.07,15445183.0,0.01,0.05,0.0,1566.67,0.05,2998746.9,415.05,0.2,True,68.95,-0.0,-0.01,0.01,2026-01-12,1.99,4.02,0,,1.98,2.2,False,False
12-01-2026 10:00,CATES,33.0,35.38,33.0,35.26,736601.0,0.12,2.26,0.19,1115.05,2.26,157961.2,366.32,0.05,True,76.73,0.06,-0.04,0.1,2026-01-12,33.0,6.85,0,,32.88,ATH,False,False
12-01-2026 10:00,OYAKC,24.32,24.58,24.28,24.54,6865889.0,0.04,0.22,0.02,900.0,0.22,2465149.5,178.52,0.18,True,70.13,0.19,0.13,0.06,2026-01-12,24.22,1.32,0,,23.1,ATH,False,False
12-01-2026 10:00,PENGD,7.79,7.91,7.78,7.91,1396932.0,0.0,0.12,0.01,700.0,0.12,424084.8,229.4,0.0,True,71.09,0.02,0.01,0.02,2026-01-12,7.75,2.06,0,,7.56,ATH,False,False
12-01-2026 10:00,ARDYZ,41.24,42.34,40.68,42.18,3530680.0,0.16,0.94,0.07,1205.56,0.94,812490.3,334.55,0.17,True,80.24,0.84,0.62,0.22,2026-01-12,40.04,5.34,0,,37.2,ATH,False,False
12-01-2026 10:00,GESAN,47.8,49.78,47.7,49.36,4211017.0,0.42,1.56,0.12,1158.06,1.56,654025.2,543.86,0.27,True,74.36,0.27,0.17,0.1,2026-01-12,47.78,3.31,0,,47.48,ATH,False,False
12-01-2026 10:00,KRONT,15.12,15.67,15.12,15.55,1529585.0,0.12,0.43,0.05,795.83,0.43,432104.5,253.98,0.28,True,71.3,0.27,0.25,0.02,2026-01-12,15.12,2.84,0,,14.78,ATH,False,False
12-01-2026 10:00,AKSUE,21.58,23.22,21.4,22.8,1482998.0,0.42,1.22,0.08,1352.38,1.22,264079.2,461.57,0.34,True,55.46,-0.32,-0.4,0.09,2026-01-12,21.7,5.07,3,,21.7,26.3,True,True
12-01-2026 10:00,VESBE,7.85,7.92,7.83,7.9,1435365.0,0.02,0.05,0.01,733.33,0.05,489927.9,192.97,0.4,True,55.9,-0.01,-0.02,0.01,2026-01-12,7.82,1.02,0,,7.75,7.91,False,False
12-01-2026 10:00,CWENE,27.72,28.5,27.6,28.28,6476111.0,0.22,0.56,0.02,3400.0,0.56,1466121.3,341.72,0.39,True,54.36,-0.09,-0.08,-0.01,2026-01-12,27.74,1.95,3,,27.96,28.92,True,True
12-01-2026 10:00,ISDMR,36.84,37.38,36.78,37.32,581376.0,0.06,0.48,0.0,11900.0,0.48,213986.0,171.69,0.13,True,67.1,0.14,0.14,0.0,2026-01-12,36.72,1.63,0,,36.62,ATH,False,False
12-01-2026 10:00,XBANK,17318.6,17469.17,17274.6,17435.39,232543146.0,33.78,116.79,2.97,3827.03,116.79,104198824.4,123.17,0.29,True,61.63,14.91,-2.86,17.77,2026-01-12,17245.26,1.1,0,,17143.76,17448.57,False,False
12-01-2026 10:00,SAFKR,24.6,25.14,24.48,25.08,2565275.0,0.06,0.48,0.09,445.45,0.48,547458.3,368.58,0.13,True,68.1,0.17,0.05,0.12,2026-01-12,24.04,4.33,0,,23.3,25.48,False,False
12-01-2026 10:00,ASELS,285.75,291.25,284.25,291.0,19262828.0,0.25,5.25,1.65,218.18,5.25,5761117.9,234.36,0.05,True,87.05,7.19,5.76,1.43,2026-01-12,280.0,3.93,0,,260.25,ATH,False,False
12-01-2026 10:00,XU100,12267.53,12349.94,12228.02,12340.83,1973892788.0,9.11,73.3,17.06,329.76,73.3,899505659.6,119.44,0.12,True,77.74,78.34,65.87,12.48,2026-01-12,12200.95,1.15,0,,11907.78,ATH,False,False
12-01-2026 10:00,YEOTK,36.16,36.72,36.12,36.66,1571855.0,0.06,0.5,0.02,2677.78,0.5,392972.4,299.99,0.12,True,59.28,-0.07,-0.12,0.06,2026-01-12,36.1,1.55,0,,35.92,36.74,False,False
12-01-2026 10:00,KLKIM,36.26,37.18,36.24,37.04,835404.0,0.14,0.78,0.12,550.0,0.78,248580.0,236.07,0.18,True,76.55,0.26,0.14,0.12,2026-01-12,36.24,2.21,1,37.18,35.0,37.18,False,False
12-01-2026 10:00,EUPWR,34.24,36.74,34.24,36.58,9588005.0,0.16,2.34,0.2,1093.88,2.34,1780004.1,438.65,0.07,True,76.89,0.35,0.19,0.16,2026-01-12,34.08,7.34,0,,32.4,ATH,False,False
12-01-2026 10:00,BULGS,43.06,44.24,42.78,44.1,2712399.0,0.14,1.04,0.02,5100.0,1.04,629060.4,331.18,0.13,True,57.0,-0.21,-0.28,0.07,2026-01-12,43.0,2.56,1,44.24,42.68,44.24,True,True
09-01-2026 17:00,TAVHL,322.25,325.5,321.5,324.75,502563.0,0.75,2.5,0.18,1328.57,2.5,228536.5,119.9,0.3,True,64.55,1.98,2.03,-0.04,2026-01-09,322.5,0.7,0,,318.25,ATH,False,False
09-01-2026 17:00,PRDGS,6.3,6.68,6.2,6.68,4488182.0,0.0,0.38,0.04,874.36,0.38,957976.9,368.51,0.0,True,75.75,0.04,0.02,0.02,2026-01-09,6.24,7.05,2,6.2,6.2,ATH,False,False
09-01-2026 17:00,TSKB,13.39,13.55,13.37,13.54,5260967.0,0.01,0.15,0.01,1775.0,0.15,2785655.2,88.86,0.07,True,58.35,0.01,0.02,-0.01,2026-01-09,13.47,0.52,0,,13.3,13.61,False,False
09-01-2026 17:00,SASA,2.32,2.36,2.31,2.36,865576492.0,0.0,0.04,0.0,9.00719925474099e+16,0.04,462311744.2,87.23,0.0,True,21.85,-0.12,-0.11,-0.0,2026-01-09,2.53,-6.72,0,,2.29,2.95,False,False
09-01-2026 17:00,DZGYO,7.83,7.92,7.82,7.91,975152.0,0.01,0.08,0.0,3900.0,0.08,588578.3,65.68,0.12,True,58.49,0.01,-0.01,0.02,2026-01-09,7.89,0.25,0,,7.46,8.03,False,False
09-01-2026 17:00,ALBRK,8.18,8.28,8.15,8.26,5272040.0,0.02,0.08,0.01,566.67,0.08,1790182.8,194.5,0.25,True,62.09,0.01,-0.0,0.01,2026-01-09,8.12,1.72,0,,8.04,8.33,False,False
09-01-2026 17:00,CEMZY,52.6,56.0,52.4,55.45,7848850.0,0.55,2.85,0.42,586.75,2.85,1165929.5,573.18,0.19,True,73.86,0.39,0.15,0.24,2026-01-09,51.15,8.41,0,,50.0,ATH,False,False
09-01-2026 15:00,GLRYH,3.94,3.98,3.94,3.98,1087085.0,0.0,0.04,0.0,700.0,0.04,637837.5,70.43,0.0,True,55.36,-0.0,-0.0,0.0,2026-01-09,3.93,1.27,0,,3.91,4.09,False,False
09-01-2026 14:00,MEKAG,3.82,3.86,3.82,3.86,1457223.0,0.0,0.04,0.01,400.0,0.04,871794.3,67.15,0.0,True,53.64,-0.02,-0.03,0.01,2026-01-09,3.8,1.58,0,,3.74,4.41,True,False
09-01-2026 14:00,SMRVA,106.1,114.6,105.8,114.6,2868985.0,0.0,8.5,1.33,539.1,8.5,1056956.1,171.44,0.0,True,69.73,1.71,0.42,1.28,2026-01-09,104.2,9.98,0,,91.85,ATH,False,False
09-01-2026 14:00,ZERGY,9.51,10.08,9.5,10.03,16458490.0,0.05,0.52,0.08,575.32,0.52,4174766.9,294.24,0.1,True,75.18,0.01,-0.06,0.07,2026-01-09,9.31,7.73,0,,9.24,10.24,False,False
09-01-2026 14:00,TRILC,16.38,17.48,16.31,17.37,2223175.0,0.11,0.99,0.09,942.11,0.99,418208.3,431.6,0.11,True,71.58,0.06,0.02,0.04,2026-01-09,16.58,4.76,2,16.31,16.31,ATH,False,False
09-01-2026 14:00,GEREL,18.5,19.17,18.49,19.04,2168718.0,0.13,0.54,0.09,527.91,0.54,740866.8,192.73,0.24,True,63.97,0.02,-0.03,0.05,2026-01-09,18.78,1.38,0,,18.06,19.35,False,False
09-01-2026 13:00,ARSAN,3.53,3.71,3.52,3.69,16402202.0,0.02,0.16,0.02,788.89,0.16,4419406.1,271.14,0.12,True,65.07,-0.02,-0.04,0.02,2026-01-09,3.47,6.34,0,,3.46,3.71,True,False
09-01-2026 13:00,MNDRS,13.69,14.05,13.69,14.04,2195449.0,0.01,0.35,0.07,430.3,0.35,426506.6,414.75,0.03,True,73.27,0.04,-0.0,0.04,2026-01-09,13.52,3.85,0,,13.33,ATH,False,False
09-01-2026 13:00,ANELE,16.68,17.7,16.66,17.61,2009133.0,0.09,0.93,0.09,933.33,0.93,310669.9,546.71,0.1,True,77.92,0.19,0.03,0.16,2026-01-09,15.61,12.81,0,,15.4,ATH,False,False
09-01-2026 12:00,KRDMB,25.18,25.62,25.06,25.54,1179120.0,0.08,0.36,0.04,900.0,0.36,556829.5,111.76,0.22,True,71.8,0.47,0.41,0.06,2026-01-09,25.0,2.16,0,,23.2,25.56,False,False
09-01-2026 12:00,ORCAY,3.79,3.87,3.77,3.87,1358160.0,0.0,0.08,0.0,2566.67,0.08,600213.1,126.28,0.0,True,69.04,0.04,0.01,0.03,2026-01-09,3.64,6.32,0,,3.58,3.99,False,False
09-01-2026 11:00,ALKA,11.93,12.58,11.91,12.5,6949581.0,0.08,0.57,0.07,702.82,0.57,1544284.5,350.02,0.14,True,69.89,0.13,0.09,0.04,2026-01-09,11.7,6.84,0,,11.06,ATH,False,False
09-01-2026 11:00,GUBRF,366.5,374.5,366.25,372.75,542880.0,1.75,6.25,1.08,481.4,6.25,228964.8,137.1,0.28,True,70.45,1.63,0.96,0.68,2026-01-09,365.0,2.12,0,,359.0,ATH,False,False
09-01-2026 10:00,FZLGY,14.75,15.72,14.75,15.64,8227178.0,0.08,0.89,0.12,647.9,0.89,1638719.0,402.05,0.09,True,82.97,0.29,0.24,0.05,2026-01-09,14.71,6.32,0,,12.85,ATH,False,False
09-01-2026 10:00,ADESE,1.57,1.6,1.56,1.6,45200001.0,0.0,0.03,0.01,500.0,0.03,19773413.3,128.59,0.0,True,66.98,0.01,0.0,0.0,2026-01-09,1.56,2.56,0,,1.52,ATH,False,False
09-01-2026 10:00,MARBL,12.31,13.47,12.23,13.47,4291023.0,0.0,1.16,0.13,792.31,1.16,510836.3,740.0,0.0,True,84.74,0.06,-0.03,0.09,2026-01-09,12.25,9.96,1,13.47,12.06,ATH,False,False
09-01-2026 10:00,DURKN,15.4,16.3,15.4,16.05,1517421.0,0.25,0.65,0.08,712.5,0.65,381376.1,297.88,0.38,True,66.94,-0.03,-0.09,0.06,2026-01-09,15.43,4.02,1,16.3,15.06,16.3,True,True
09-01-2026 10:00,DAGI,6.47,7.05,6.46,6.91,10161060.0,0.14,0.44,0.04,973.17,0.44,2018668.7,403.35,0.32,True,50.41,-0.24,-0.28,0.04,2026-01-09,6.41,7.8,1,7.05,6.32,7.05,True,True
09-01-2026 10:00,SUWEN,9.26,9.45,9.26,9.43,968721.0,0.02,0.17,0.03,448.39,0.17,489777.6,97.79,0.12,True,64.38,-0.0,-0.03,0.03,2026-01-09,9.24,2.06,0,,9.11,9.65,False,False
09-01-2026 10:00,BMSCH,19.77,21.8,19.77,21.8,17967456.0,0.0,2.03,0.2,900.0,2.03,1991311.8,802.29,0.0,True,34.45,-1.53,-1.57,0.04,2026-01-09,21.96,-0.73,2,19.77,19.77,27.22,True,True
09-01-2026 10:00,BOBET,20.34,20.6,20.26,20.6,494515.0,0.0,0.26,0.06,348.28,0.26,249530.3,98.18,0.0,True,61.04,0.05,0.05,-0.0,2026-01-09,20.26,1.68,0,,20.0,21.58,False,False
09-01-2026 10:00,USAK,2.93,2.98,2.9,2.98,8869042.0,0.0,0.05,0.01,525.0,0.05,2733170.4,224.5,0.0,True,56.64,-0.02,-0.02,0.01,2026-01-09,2.92,2.05,0,,2.87,3.07,True,False
08-01-2026 17:00,KONKA,14.98,15.38,14.98,15.32,656511.0,0.06,0.34,0.06,431.25,0.34,246730.2,166.08,0.18,True,54.9,-0.12,-0.16,0.03,2026-01-08,14.81,3.44,0,,14.65,15.79,False,False
08-01-2026 17:00,LIDFA,2.31,2.37,2.31,2.36,3225883.26,0.01,0.05,0.01,462.5,0.05,828737.35,289.25,0.22,True,67.65,0.0,0.0,0.0,2026-01-08,2.29,3.14,0,,2.27,2.39,False,False
08-01-2026 17:00,SEYKM,4.79,4.96,4.79,4.92,662629.0,0.04,0.13,0.01,1081.82,0.13,99775.4,564.12,0.31,True,58.13,-0.03,-0.04,0.01,2026-01-08,4.83,1.86,0,,4.72,5.03,True,True
08-01-2026 17:00,SEKUR,3.63,3.68,3.57,3.68,448025.0,0.0,0.05,0.0,1150.0,0.05,175573.7,155.18,0.0,True,49.58,-0.04,-0.04,-0.0,2026-01-08,3.65,0.82,0,,3.51,ATH,False,False
08-01-2026 16:00,AKFYE,16.92,17.07,16.91,17.05,357626.0,0.02,0.13,0.01,983.33,0.13,225819.1,58.37,0.15,True,61.25,0.0,0.01,-0.01,2026-01-08,16.92,0.77,0,,16.73,17.14,False,False
08-01-2026 16:00,GSDDE,10.14,10.27,10.14,10.26,187582.0,0.01,0.12,0.01,823.08,0.12,75662.5,147.92,0.08,True,53.04,-0.02,-0.02,-0.01,2026-01-08,10.22,0.39,0,,10.07,10.47,False,False
08-01-2026 16:00,THYAO,290.75,295.75,290.25,294.75,14633029.0,1.0,4.0,0.3,1233.33,4.0,5817089.9,151.55,0.25,True,68.0,1.88,2.28,-0.4,2026-01-08,290.75,1.38,0,,286.5,295.25,False,False
08-01-2026 16:00,MARTI,2.67,2.72,2.66,2.72,1644279.0,0.0,0.05,0.0,4900.0,0.05,1081714.9,52.01,0.0,True,49.74,-0.02,-0.01,-0.0,2026-01-08,2.72,0.0,1,2.72,2.65,2.81,False,False
08-01-2026 16:00,ENKAI,81.95,83.1,81.9,82.9,2138537.0,0.2,0.95,0.12,691.67,0.95,941551.3,127.13,0.21,True,69.34,0.15,0.1,0.05,2026-01-08,81.3,1.97,1,83.1,80.0,83.1,False,False
08-01-2026 16:00,PENTA,13.22,13.43,13.21,13.43,266678.0,0.0,0.21,0.01,4100.0,0.21,115788.1,130.32,0.0,True,54.67,-0.04,-0.02,-0.02,2026-01-08,13.39,0.3,0,,13.18,13.77,False,False
08-01-2026 16:00,OFSYM,70.9,71.55,70.75,71.4,129071.0,0.15,0.5,0.07,669.23,0.5,70881.3,82.09,0.3,True,62.46,0.35,0.41,-0.06,2026-01-08,71.0,0.56,0,,66.1,71.9,False,False
08-01-2026 16:00,PGSUS,203.6,207.2,203.3,206.4,3823641.0,0.8,2.8,0.1,2700.0,2.8,1789796.4,113.64,0.29,True,61.44,0.39,0.85,-0.46,2026-01-08,205.1,0.63,0,,201.2,209.3,False,False
08-01-2026 16:00,BEYAZ,28.7,30.38,28.66,30.3,601297.0,0.08,1.6,0.2,708.08,1.6,261941.0,129.55,0.05,True,63.48,0.01,-0.01,0.02,2026-01-08,28.92,4.77,0,,28.26,30.86,False,False
08-01-2026 16:00,ENTRA,10.27,10.38,10.26,10.38,1408372.0,0.0,0.11,0.0,3566.67,0.11,786830.1,78.99,0.0,True,54.47,-0.03,-0.03,0.0,2026-01-08,10.23,1.47,0,,10.18,10.49,True,True
08-01-2026 16:00,EGEPO,8.92,9.21,8.87,9.15,3315987.0,0.06,0.23,0.07,233.33,0.23,1016183.1,226.32,0.26,True,76.42,0.12,0.07,0.05,2026-01-08,8.45,8.28,0,,8.33,ATH,False,False
08-01-2026 15:00,EDATA,7.96,8.5,7.96,8.41,8806242.0,0.09,0.45,0.05,765.38,0.45,4158967.1,111.74,0.2,True,77.84,0.23,0.22,0.01,2026-01-08,7.75,8.52,0,,7.42,ATH,False,False
08-01-2026 14:00,SKYMD,12.04,12.45,12.01,12.35,464229.0,0.1,0.31,0.0,10233.33,0.31,244221.1,90.09,0.32,True,60.87,0.03,0.04,-0.01,2026-01-08,12.05,2.49,1,12.45,11.95,12.45,False,False
08-01-2026 14:00,DOHOL,17.73,18.2,17.73,18.14,2603594.0,0.06,0.41,0.01,6733.33,0.41,1310679.1,98.64,0.15,True,59.31,0.01,0.04,-0.04,2026-01-08,18.02,0.67,0,,17.65,18.48,False,False
08-01-2026 14:00,KLYPV,56.75,57.45,56.65,57.3,236335.0,0.15,0.55,0.06,746.15,0.55,143165.0,65.08,0.27,True,57.49,0.06,0.08,-0.02,2026-01-08,56.55,1.33,0,,56.2,57.8,False,False
08-01-2026 14:00,GMTAS,46.24,50.25,46.24,50.25,2207060.0,0.0,4.01,0.51,684.74,4.01,506239.1,335.97,0.0,True,87.96,0.61,0.26,0.35,2026-01-08,45.7,9.96,0,,44.38,ATH,False,False
08-01-2026 11:00,ARMGD,76.35,83.95,76.3,83.5,1367923.0,0.45,7.15,0.17,3985.71,7.15,550878.4,148.32,0.06,True,59.26,1.66,1.71,-0.05,2026-01-08,84.0,-0.6,2,76.3,76.3,87.0,False,False
08-01-2026 11:00,VAKBN,32.82,33.76,32.82,33.66,13628866.0,0.1,0.84,0.07,1100.0,0.84,5806583.8,134.71,0.12,True,67.71,0.16,0.19,-0.02,2026-01-08,32.96,2.12,0,,32.62,33.86,False,False
08-01-2026 10:00,VKING,29.66,32.02,29.58,32.02,626355.0,0.0,2.36,0.06,3968.97,2.36,109212.7,473.52,0.0,True,50.84,-0.52,-0.38,-0.14,2026-01-08,29.12,9.96,0,,29.12,33.78,True,True
08-01-2026 10:00,TNZTP,24.58,26.66,24.38,26.18,3697874.0,0.48,1.6,0.03,4900.0,1.6,851156.5,334.45,0.3,True,65.98,0.37,0.43,-0.07,2026-01-08,24.48,6.94,1,26.66,24.32,26.66,False,False
07-01-2026 17:00,TSPOR,1.1,1.11,1.1,1.11,30232882.0,0.0,0.01,0.0,900.0,0.01,13021337.7,132.18,0.0,True,57.19,0.0,0.0,0.0,2026-01-07,1.1,0.91,0,,1.08,1.12,False,False
07-01-2026 17:00,UNLU,15.44,15.55,15.35,15.55,314162.0,0.0,0.11,0.01,900.0,0.11,159703.2,96.72,0.0,True,54.52,0.01,-0.01,0.03,2026-01-07,15.44,0.71,0,,15.11,15.58,False,False
07-01-2026 17:00,AKSEN,68.25,69.9,68.0,69.75,1917400.0,0.15,1.5,0.08,1775.0,1.5,682825.1,180.8,0.1,True,60.17,0.02,-0.08,0.1,2026-01-07,68.55,1.75,1,69.9,67.35,69.9,False,False
07-01-2026 15:00,NATEN,9.09,9.55,9.04,9.52,6953185.0,0.03,0.43,0.06,582.54,0.43,1705850.1,307.61,0.07,True,83.57,0.11,0.05,0.05,2026-01-07,8.93,6.61,0,,8.68,ATH,False,False
07-01-2026 14:00,EFOR,21.86,22.36,21.5,22.3,3124462.0,0.06,0.44,0.06,658.62,0.44,1759906.8,77.54,0.14,True,52.96,-0.2,-0.31,0.11,2026-01-07,21.78,2.39,0,,21.0,26.06,False,False
07-01-2026 13:00,TRALT,44.36,45.6,44.3,45.52,46252019.0,0.08,1.16,0.21,463.11,1.16,21736720.0,112.78,0.07,True,82.57,0.54,0.45,0.08,2026-01-07,44.2,2.99,0,,ATL,ATH,False,False
07-01-2026 12:00,MAGEN,39.68,40.42,39.6,40.3,3239942.0,0.12,0.62,0.09,620.93,0.62,1277286.9,153.66,0.19,True,64.07,0.15,0.14,0.01,2026-01-07,39.58,1.82,0,,39.1,ATH,False,False
07-01-2026 11:00,AEFES,16.46,16.67,16.46,16.65,14960958.0,0.02,0.19,0.03,475.76,0.19,6961300.9,114.92,0.11,True,85.95,0.12,0.09,0.03,2026-01-07,16.4,1.52,0,,ATL,ATH,False,False
07-01-2026 10:00,RTALB,3.52,3.56,3.5,3.55,6378493.0,0.01,0.03,0.0,650.0,0.03,1888049.9,237.83,0.33,True,72.03,0.01,0.0,0.0,2026-01-07,3.51,1.14,0,,3.48,ATH,False,False
07-01-2026 10:00,PINSU,11.5,12.25,11.5,12.2,5992695.0,0.05,0.7,0.1,614.29,0.7,1252634.5,378.41,0.07,True,84.11,0.12,0.05,0.07,2026-01-07,11.46,6.46,0,,11.11,ATH,False,False
07-01-2026 10:00,DSTKF,634.5,666.5,630.0,660.0,735216.0,6.5,25.5,2.8,810.71,25.5,169125.7,334.72,0.25,True,86.03,14.17,12.68,1.48,2026-01-07,629.0,4.93,0,,552.0,ATH,False,False
07-01-2026 10:00,ALTIN,110.57,114.92,108.5,114.51,28653046.0,0.41,3.94,0.57,587.61,3.94,6899128.1,315.31,0.1,True,84.15,2.23,2.05,0.17,2026-01-07,111.59,2.62,0,,ATL,ATH,False,False
06-01-2026 17:00,GARAN,149.3,150.5,149.2,150.2,8665976.0,0.3,0.9,0.14,542.86,0.9,4806007.0,80.32,0.33,True,67.03,0.56,0.58,-0.02,2026-01-06,148.3,1.28,0,,147.2,150.9,False,False
06-01-2026 17:00,DOFER,52.25,54.0,51.55,54.0,240288.0,0.0,1.75,0.17,960.61,1.75,95097.6,152.68,0.0,True,64.56,-0.22,-0.4,0.18,2026-01-06,52.2,3.45,1,54.0,51.2,ATH,True,True
06-01-2026 16:00,SEGYO,4.82,5.22,4.81,5.13,18318435.0,0.09,0.31,0.03,900.0,0.31,2701203.0,578.16,0.29,True,69.58,-0.02,-0.05,0.03,2026-01-06,4.8,6.88,0,,4.74,ATH,True,True
06-01-2026 16:00,SERNT,8.16,8.35,8.16,8.33,2393469.0,0.02,0.17,0.01,1445.45,0.17,1048441.2,128.29,0.12,True,75.86,0.07,0.05,0.02,2026-01-06,8.03,3.74,0,,7.86,ATH,False,False
06-01-2026 15:00,TURSG,11.45,11.56,11.43,11.55,12938984.0,0.01,0.1,0.01,1566.67,0.1,6117184.7,111.52,0.1,True,54.14,-0.01,-0.02,0.01,2026-01-06,11.4,1.32,0,,11.29,11.86,False,False
06-01-2026 13:00,MERIT,17.86,18.25,17.86,18.22,1018278.0,0.03,0.36,0.07,445.45,0.36,526946.2,93.24,0.08,True,70.02,0.04,-0.01,0.05,2026-01-06,17.68,3.05,0,,17.4,ATH,False,False
06-01-2026 13:00,TRMET,108.8,111.7,108.6,111.0,1386003.0,0.7,2.2,0.12,1733.33,2.2,636619.9,117.71,0.32,True,66.76,0.65,0.66,-0.01,2026-01-06,109.8,1.09,2,108.6,108.6,113.7,False,False
06-01-2026 12:00,DURDO,3.67,3.82,3.66,3.79,3255412.0,0.03,0.12,0.02,605.88,0.12,934738.7,248.27,0.25,True,76.97,0.01,-0.0,0.01,2026-01-06,3.64,4.12,0,,3.6,ATH,False,False
06-01-2026 10:00,AKENR,11.3,11.47,11.29,11.43,1860070.0,0.04,0.13,0.02,550.0,0.13,842989.1,120.65,0.31,True,64.02,0.01,0.0,0.01,2026-01-06,11.31,1.06,0,,11.19,11.51,False,False
06-01-2026 10:00,YKBNK,38.26,38.62,37.92,38.56,61641208.0,0.06,0.3,0.07,316.67,0.3,19569403.7,214.99,0.2,True,75.3,0.27,0.26,0.01,2026-01-06,38.24,0.84,0,,ATL,38.6,False,False
06-01-2026 10:00,DMLKT,5.8,5.81,5.8,5.81,2762428.0,0.0,0.01,0.0,900.0,0.01,1327771.4,108.05,0.0,True,51.62,-0.0,-0.0,0.0,2026-01-06,5.8,0.17,1,5.81,5.79,5.84,False,False
06-01-2026 10:00,SISE,39.62,40.02,39.48,40.0,8722768.0,0.02,0.38,0.08,400.0,0.38,3330865.1,161.88,0.05,True,76.69,0.17,0.11,0.05,2026-01-06,39.48,1.32,0,,ATL,ATH,False,False
06-01-2026 10:00,ISCTR,14.42,14.6,14.34,14.58,200279194.0,0.02,0.16,0.02,966.67,0.16,59770852.9,235.08,0.12,True,78.64,0.06,0.06,0.0,2026-01-06,14.39,1.32,0,,ATL,ATH,False,False
06-01-2026 10:00,PETKM,16.73,16.82,16.7,16.81,11660909.0,0.01,0.08,0.02,280.95,0.08,4245317.4,174.68,0.13,True,78.3,0.07,0.05,0.01,2026-01-06,16.71,0.6,0,,ATL,ATH,False,False
06-01-2026 10:00,BOSSA,6.36,6.4,6.34,6.39,293048.0,0.01,0.03,0.0,650.0,0.03,184504.5,58.83,0.33,True,58.6,0.0,0.01,-0.0,2026-01-06,6.37,0.31,0,,6.33,6.45,False,False
05-01-2026 17:00,CIMSA,45.66,45.96,45.6,45.88,1683203.0,0.08,0.22,0.02,1122.22,0.22,1112019.0,51.36,0.36,True,65.27,0.04,0.02,0.02,2026-01-05,45.54,0.75,0,,45.4,ATH,False,False
05-01-2026 17:00,YYAPI,1.86,1.89,1.86,1.89,16864578.0,0.0,0.03,0.0,650.0,0.03,9257416.9,82.17,0.0,True,58.04,0.0,0.0,-0.0,2026-01-05,1.89,0.0,0,,1.85,1.92,False,False
05-01-2026 17:00,SUNTK,49.38,60.3,49.38,60.3,491695.0,0.0,10.92,0.92,1086.96,10.92,142533.1,244.97,0.0,True,69.17,-0.92,-1.34,0.42,2026-01-05,54.85,9.94,3,,49.38,ATH,False,False
05-01-2026 17:00,GIPTA,69.7,74.05,69.7,74.05,5051869.0,0.0,4.35,0.7,517.02,4.35,2299561.3,119.69,0.0,True,70.73,0.28,-0.28,0.56,2026-01-05,67.35,9.95,0,,64.35,ATH,False,False
05-01-2026 17:00,DAPGM,13.08,14.34,12.87,14.34,40142805.0,0.0,1.26,0.12,967.8,1.26,6609214.8,507.38,0.0,True,80.89,0.26,0.18,0.07,2026-01-05,13.04,9.97,0,,12.77,ATH,False,False
05-01-2026 15:00,DGNMO,4.85,4.99,4.85,4.97,660290.0,0.02,0.12,0.0,2300.0,0.12,271689.1,143.03,0.17,True,65.4,0.01,0.01,-0.0,2026-01-05,4.99,-0.4,1,4.99,4.84,4.99,False,False
05-01-2026 14:00,LKMNH,18.67,19.08,18.67,18.98,509119.0,0.1,0.31,0.0,10233.33,0.31,188684.7,169.83,0.32,True,54.95,-0.06,-0.05,-0.01,2026-01-05,18.75,1.23,0,,18.5,19.44,False,False
05-01-2026 14:00,ULUUN,6.67,6.75,6.65,6.75,362650.0,0.0,0.08,0.0,3900.0,0.08,236602.8,53.27,0.0,True,62.77,0.05,0.05,-0.01,2026-01-05,6.79,-0.59,0,,6.52,6.8,False,False
05-01-2026 11:00,IZENR,9.61,9.94,9.6,9.91,24134792.0,0.03,0.3,0.04,597.67,0.3,9705562.8,148.67,0.1,True,67.74,0.04,0.02,0.02,2026-01-05,9.71,2.06,0,,9.39,10.0,False,False
05-01-2026 11:00,IZFAS,56.75,57.9,56.75,57.85,1128560.0,0.05,1.1,0.03,3566.67,1.1,698915.9,61.47,0.05,True,67.58,0.31,0.23,0.08,2026-01-05,56.45,2.48,1,57.9,54.6,57.9,False,False
05-01-2026 10:00,TOASO,260.0,266.75,259.25,265.0,1579316.0,1.75,5.0,1.55,221.54,5.0,541849.6,191.47,0.35,True,93.3,2.25,1.29,0.96,2026-01-05,258.75,2.42,0,,ATL,ATH,False,False
05-01-2026 10:00,EUREN,6.62,6.92,6.6,6.91,42480338.0,0.01,0.29,0.05,530.43,0.29,10371226.3,309.6,0.03,True,88.56,0.05,0.03,0.02,2026-01-05,6.6,4.7,0,,ATL,ATH,False,False
05-01-2026 10:00,TERA,172.9,182.7,170.0,182.0,7979646.0,0.7,9.1,1.15,691.3,9.1,2560000.2,211.7,0.08,True,62.38,0.13,-0.5,0.64,2026-01-05,173.0,5.2,0,,165.7,ATH,False,False
05-01-2026 10:00,DENGE,3.28,3.49,3.24,3.47,12110951.0,0.02,0.19,0.04,413.51,0.19,5333669.8,127.07,0.11,True,94.98,0.05,0.03,0.02,2026-01-05,3.27,6.12,1,3.49,ATL,3.49,False,False
05-01-2026 10:00,MAKIM,15.2,15.4,15.13,15.4,278240.0,0.0,0.2,0.02,1076.47,0.2,73620.1,277.94,0.0,True,61.01,0.01,-0.0,0.01,2026-01-05,15.17,1.52,0,,ATL,ATH,False,False
02-01-2026 17:00,JANTS,18.84,20.46,18.82,20.46,2294233.0,0.0,1.62,0.18,800.0,1.62,331737.1,591.58,0.0,True,94.11,0.12,0.03,0.09,2026-01-02,18.61,9.94,0,,ATL,ATH,False,False
02-01-2026 17:00,TATEN,12.73,13.5,12.65,13.3,3097169.0,0.2,0.57,0.06,850.0,0.57,1791020.9,72.93,0.35,True,71.75,0.08,0.05,0.03,2026-01-02,12.8,3.91,0,,ATL,ATH,False,False
02-01-2026 15:00,PRKME,18.36,18.42,18.35,18.42,304800.0,0.0,0.06,0.0,1400.0,0.06,184686.8,65.04,0.0,True,52.85,-0.01,-0.01,0.0,2026-01-02,18.48,-0.32,0,,18.03,ATH,False,False
02-01-2026 10:00,FONET,2.81,2.93,2.81,2.93,23716216.0,0.0,0.12,0.02,650.0,0.12,4782923.1,395.85,0.0,True,75.52,0.03,0.02,0.01,2026-01-02,2.79,5.02,0,,2.65,ATH,False,False
02-01-2026 10:00,HALKB,36.9,37.88,36.9,37.74,18646182.0,0.14,0.84,0.03,2370.59,0.84,5641024.0,230.55,0.17,True,59.36,0.02,0.0,0.02,2026-01-02,36.78,2.61,0,,36.76,37.98,False,False
02-01-2026 10:00,VAKFA,11.29,11.43,11.28,11.43,3651121.0,0.0,0.14,0.01,976.92,0.14,1778180.8,105.33,0.0,True,56.91,-0.01,-0.03,0.02,2026-01-02,11.24,1.69,0,,11.11,11.44,False,False
31-12-2025 10:00,TATGD,11.8,11.95,11.8,11.92,355529.0,0.03,0.12,0.01,990.91,0.12,179958.2,97.56,0.25,True,53.3,-0.03,-0.04,0.01,2025-12-31,11.83,0.76,1,11.95,11.65,11.95,False,False
26-12-2025 16:00,SELVA,2.36,2.48,2.35,2.47,6953944.0,0.01,0.11,0.02,547.06,0.11,2627958.5,164.61,0.09,True,61.07,-0.01,-0.03,0.01,2025-12-26,2.3,7.39,0,,2.24,ATH,False,False
