Tarih,Hisse,open,high,low,close,volume,YuksekKapanis_Fark,AcilisKapanis_Fark,AcilisKapanisFark_Ort,AcilisKapanisFark_OrtalamayaGoreDegisim,AcilisKapanisFarkOrt_MaxSon10,HacimOrtalama,%Hacim_HacimOrtalama,Fark_Orani,Kosul,rsi,MACD_12_26_9,MACDs_12_26_9,MACDh_12_26_9,Tarih1,prev_close,%Deg,isPivot,pointpos,destek,direnc,Tsinyal_Banker_Dip,Tsinyal_Banker_DipKarar
09-02-2026 10:00,INVEO,9.21,9.33,9.2,9.33,808083.0,0.0,0.12,0.02,650.0,0.12,489651.1,65.03,0.0,True,59.8,-0.01,-0.03,0.01,2026-02-09,9.06,2.98,0,,8.95,9.65,False,False
09-02-2026 10:00,SERNT,8.22,8.29,8.21,8.27,825810.0,0.02,0.05,0.0,1150.0,0.05,486334.3,69.8,0.4,True,59.29,-0.02,-0.03,0.01,2026-02-09,8.14,1.6,0,,8.06,8.45,False,False
09-02-2026 10:00,CVKMD,43.46,45.98,43.3,45.3,6430835.0,0.68,1.84,0.09,1944.44,1.84,3052572.0,110.67,0.37,True,62.62,-0.09,-0.07,-0.02,2026-02-09,42.1,7.6,0,,37.5,46.48,False,False
09-02-2026 10:00,FORMT,3.68,3.85,3.67,3.81,31787720.0,0.04,0.13,0.02,550.0,0.13,20853299.9,52.43,0.31,True,68.42,0.08,0.08,-0.0,2026-02-09,3.71,2.7,0,,3.02,ATH,False,False
09-02-2026 10:00,GSDDE,9.92,10.05,9.92,10.03,185965.0,0.02,0.11,0.01,1275.0,0.11,101383.0,83.43,0.18,True,62.04,-0.02,-0.02,0.01,2026-02-09,9.89,1.42,0,,9.56,10.1,False,False
09-02-2026 10:00,IHGZT,1.55,1.57,1.55,1.57,1872397.0,0.0,0.02,0.0,400.0,0.02,966978.6,93.63,0.0,True,54.44,-0.01,-0.01,0.0,2026-02-09,1.54,1.95,0,,1.52,1.63,True,True
09-02-2026 10:00,IHYAY,1.9,1.92,1.89,1.92,1506865.0,0.0,0.02,0.0,566.67,0.02,787783.9,91.28,0.0,True,56.58,-0.01,-0.01,0.0,2026-02-09,1.89,1.59,0,,1.87,1.97,True,False
09-02-2026 10:00,KFEIN,9.24,9.57,9.24,9.48,682067.0,0.09,0.24,0.03,605.88,0.24,311301.5,119.1,0.37,True,64.8,-0.03,-0.06,0.03,2026-02-09,9.24,2.6,0,,9.32,9.66,True,False
09-02-2026 10:00,KLSER,28.34,28.64,28.34,28.6,346433.0,0.04,0.26,0.02,1081.82,0.26,160354.9,116.04,0.15,True,58.41,0.05,0.06,-0.01,2026-02-09,28.3,1.06,0,,27.82,29.36,False,False
09-02-2026 10:00,KTLEV,36.24,37.12,36.2,36.96,4629714.0,0.16,0.72,0.08,847.37,0.72,1896903.4,144.07,0.22,True,61.8,-0.04,-0.15,0.12,2026-02-09,36.12,2.33,0,,34.68,37.66,False,False
09-02-2026 10:00,BTCIM,4.87,4.99,4.87,4.99,16775723.0,0.0,0.12,0.02,700.0,0.12,8323012.7,101.56,0.0,True,65.26,0.0,-0.01,0.01,2026-02-09,4.83,3.31,0,,4.79,5.14,False,False
09-02-2026 10:00,MERIT,16.85,17.18,16.83,17.15,1271686.0,0.03,0.3,0.04,597.67,0.3,273866.1,364.35,0.1,True,69.51,0.04,-0.0,0.04,2026-02-09,16.72,2.57,0,,16.52,17.18,False,False
09-02-2026 10:00,NTGAZ,11.24,11.36,11.23,11.33,432794.0,0.03,0.09,0.0,2150.0,0.09,253117.8,70.99,0.33,True,53.48,-0.06,-0.07,0.01,2026-02-09,11.17,1.43,0,,10.8,11.81,True,False
09-02-2026 10:00,PATEK,19.76,20.44,19.75,20.26,5120744.0,0.18,0.5,0.06,733.33,0.5,2841124.8,80.24,0.36,True,68.82,0.1,0.03,0.06,2026-02-09,19.52,3.79,0,,19.11,20.98,False,False
09-02-2026 10:00,PETKM,17.92,18.32,17.91,18.27,17667203.0,0.05,0.35,0.04,797.44,0.35,6042328.4,192.39,0.14,True,64.5,-0.08,-0.14,0.05,2026-02-09,17.71,3.16,0,,17.51,18.56,False,False
09-02-2026 10:00,MARTI,2.76,2.81,2.76,2.8,3849641.0,0.01,0.04,0.01,471.43,0.04,1907163.6,101.85,0.25,True,56.49,-0.02,-0.03,0.01,2026-02-09,2.74,2.19,0,,2.7,2.93,True,False
09-02-2026 10:00,ZGYO,26.48,27.74,26.34,27.74,3086298.0,0.0,1.26,0.13,900.0,1.26,868391.7,255.4,0.0,True,86.64,1.07,0.83,0.24,2026-02-09,25.22,9.99,0,,19.19,ATH,False,False
09-02-2026 10:00,YYLGD,13.63,14.12,13.63,14.03,5127244.0,0.09,0.4,0.09,321.05,0.4,3147857.3,62.88,0.23,True,75.99,0.14,0.03,0.11,2026-02-09,13.54,3.62,0,,12.66,ATH,False,False
06-02-2026 17:00,KCHOL,202.1,206.2,202.0,205.1,6377980.0,1.1,3.0,0.08,3650.0,3.0,2338568.3,172.73,0.37,True,49.8,-1.09,-0.97,-0.12,2026-02-06,204.5,0.29,0,,201.6,211.7,False,False
06-02-2026 17:00,GMTAS,25.12,26.0,25.08,25.86,865913.0,0.14,0.74,0.06,1133.33,0.74,415311.4,108.5,0.19,True,57.98,0.04,0.08,-0.05,2026-02-06,25.58,1.09,0,,23.66,27.5,False,False
06-02-2026 17:00,KCAER,10.86,11.03,10.84,11.0,2894993.0,0.03,0.14,0.0,4566.67,0.14,1200540.0,141.14,0.21,True,42.94,-0.12,-0.12,0.0,2026-02-06,10.97,0.27,0,,10.8,11.52,True,True
06-02-2026 17:00,KATMR,2.81,2.85,2.8,2.84,16386090.0,0.01,0.03,0.0,1400.0,0.03,6004034.2,172.92,0.33,True,42.93,-0.02,-0.02,0.0,2026-02-06,2.82,0.71,0,,ATL,2.93,True,True
06-02-2026 17:00,ISDMR,42.8,43.5,42.64,43.42,1047593.0,0.08,0.62,0.12,416.67,0.62,502008.5,108.68,0.13,True,69.91,0.15,0.12,0.03,2026-02-06,42.3,2.65,0,,41.94,ATH,False,False
06-02-2026 17:00,INFO,4.12,4.18,4.1,4.17,5189719.0,0.01,0.05,0.0,4900.0,0.05,2464408.3,110.59,0.2,True,41.87,-0.06,-0.06,0.0,2026-02-06,4.15,0.48,0,,4.1,4.48,True,True
06-02-2026 17:00,BARMA,43.26,45.42,43.1,45.08,734800.0,0.34,1.82,0.2,819.19,1.82,278897.8,163.47,0.19,True,76.77,0.44,0.37,0.08,2026-02-06,43.02,4.79,0,,42.42,ATH,False,False
06-02-2026 17:00,AGROT,3.15,3.17,3.13,3.17,2497707.0,0.0,0.02,0.0,1900.0,0.02,1323288.7,88.75,0.0,True,46.68,-0.01,-0.01,-0.0,2026-02-06,3.18,-0.31,0,,3.16,3.3,False,False
06-02-2026 17:00,YAYLA,27.84,28.9,27.76,28.9,149101.0,0.0,1.06,0.06,1666.67,1.06,77898.6,91.4,0.0,True,59.93,-0.2,-0.23,0.03,2026-02-06,28.06,2.99,0,,28.46,29.76,True,True
06-02-2026 17:00,GUBRF,510.0,518.5,507.5,517.0,535037.0,1.5,7.0,0.85,723.53,7.0,205520.8,160.33,0.21,True,60.13,0.64,1.05,-0.4,2026-02-06,504.0,2.58,0,,435.0,527.0,False,False
06-02-2026 17:00,BIGCH,54.05,55.1,54.0,55.1,121328.0,0.0,1.05,0.0,20900.0,1.05,76277.7,59.06,0.0,True,54.63,0.23,0.27,-0.04,2026-02-06,55.0,0.18,0,,52.1,55.85,False,False
06-02-2026 17:00,VAKFN,2.03,2.05,2.01,2.05,13941472.0,0.0,0.02,0.0,900.0,0.02,6780356.1,105.62,0.0,True,48.26,-0.01,-0.01,-0.0,2026-02-06,2.04,0.49,0,,2.03,2.11,True,True
06-02-2026 17:00,GARFA,28.26,28.6,28.2,28.52,116815.0,0.08,0.26,0.01,4233.33,0.26,70881.3,64.8,0.31,True,39.39,-0.42,-0.43,0.01,2026-02-06,28.66,-0.49,0,,28.5,32.04,True,True
06-02-2026 17:00,FADE,15.55,15.84,15.53,15.79,168363.0,0.05,0.24,0.01,2566.67,0.24,98914.6,70.21,0.21,True,59.3,-0.02,-0.01,-0.0,2026-02-06,15.72,0.45,0,,15.37,15.9,False,False
06-02-2026 17:00,ESCAR,27.06,27.74,26.96,27.66,3217417.0,0.08,0.6,0.07,782.35,0.6,1268143.3,153.71,0.13,True,63.88,0.06,0.01,0.05,2026-02-06,26.9,2.83,0,,26.2,28.56,False,False
06-02-2026 17:00,ENDAE,14.45,14.7,14.45,14.68,491644.0,0.02,0.23,0.02,1177.78,0.23,183235.6,168.31,0.09,True,51.39,-0.1,-0.11,0.01,2026-02-06,14.45,1.59,0,,14.37,15.31,True,True
06-02-2026 17:00,EMKEL,20.82,22.04,20.76,22.04,9242499.0,0.0,1.22,0.2,513.07,1.22,3030555.5,204.98,0.0,True,79.72,0.07,-0.11,0.18,2026-02-06,20.04,9.98,0,,19.49,22.06,False,False
06-02-2026 17:00,EGPRO,24.88,25.28,24.88,25.22,126638.0,0.06,0.34,0.01,3300.0,0.34,68710.6,84.31,0.18,True,45.8,-0.18,-0.18,0.0,2026-02-06,25.2,0.08,0,,ATL,26.14,True,True
06-02-2026 17:00,DURDO,3.66,3.69,3.65,3.69,1060628.0,0.0,0.03,0.0,2900.0,0.03,434113.5,144.32,0.0,True,38.95,-0.03,-0.04,0.0,2026-02-06,3.7,-0.27,0,,ATL,3.88,True,True
06-02-2026 17:00,DOHOL,20.3,20.7,20.24,20.7,2721964.0,0.0,0.4,0.02,1718.18,0.4,937305.3,190.4,0.0,True,45.03,-0.28,-0.27,-0.0,2026-02-06,20.54,0.78,0,,20.16,21.84,True,True
06-02-2026 17:00,DOAS,225.9,230.5,225.8,230.4,734629.0,0.1,4.5,0.45,900.0,4.5,269550.9,172.54,0.02,True,63.83,0.25,0.06,0.19,2026-02-06,226.3,1.81,0,,224.0,230.7,False,False
06-02-2026 17:00,TABGD,250.25,253.0,250.25,253.0,210537.0,0.0,2.75,0.18,1471.43,2.75,61452.5,242.6,0.0,True,42.66,-2.9,-3.46,0.56,2026-02-06,251.5,0.6,0,,248.7,283.0,True,False
06-02-2026 17:00,CONSE,3.21,3.32,3.2,3.31,4353715.0,0.01,0.1,0.01,900.0,0.1,849411.0,412.56,0.1,True,65.36,-0.01,-0.02,0.01,2026-02-06,3.2,3.44,0,,3.14,3.34,False,False
06-02-2026 17:00,MOBTL,10.18,10.48,10.14,10.42,2416699.0,0.06,0.24,0.03,700.0,0.24,842017.4,187.01,0.25,True,63.83,0.01,-0.01,0.02,2026-02-06,10.13,2.86,0,,10.03,10.59,False,False
06-02-2026 17:00,MPARK,443.75,452.25,443.5,451.0,140733.0,1.25,7.25,0.48,1426.32,7.25,50790.4,177.09,0.17,True,53.62,-1.16,-1.36,0.2,2026-02-06,451.25,-0.06,0,,442.25,456.5,False,False
06-02-2026 17:00,PENTA,13.91,14.0,13.89,13.99,328319.0,0.01,0.08,0.0,7900.0,0.08,144020.9,127.97,0.12,True,41.5,-0.11,-0.11,-0.0,2026-02-06,14.0,-0.07,0,,13.85,14.61,False,False
06-02-2026 17:00,TAVHL,352.5,363.25,352.5,361.75,599169.0,1.5,9.25,0.9,927.78,9.25,255536.5,134.47,0.16,True,64.45,0.7,0.56,0.13,2026-02-06,353.25,2.41,0,,350.5,ATH,False,False
06-02-2026 17:00,THYAO,314.25,324.5,314.0,322.0,25331401.0,2.5,7.75,0.52,1376.19,7.75,6764876.0,274.45,0.32,True,64.14,0.24,0.49,-0.25,2026-02-06,317.0,1.58,0,,298.0,322.75,False,False
06-02-2026 17:00,PASEU,151.9,155.5,151.7,155.2,2649196.0,0.3,3.3,0.53,522.64,3.3,625032.0,323.85,0.09,True,64.72,1.92,1.77,0.15,2026-02-06,154.0,0.78,0,,146.7,164.9,False,False
06-02-2026 17:00,SOKE,12.82,13.04,12.72,13.04,1218450.0,0.0,0.22,0.01,1592.31,0.22,296587.5,310.82,0.0,True,59.6,-0.02,-0.02,0.0,2026-02-06,12.95,0.69,0,,12.66,13.44,False,False
06-02-2026 17:00,ALBRK,8.74,8.85,8.72,8.83,3546934.0,0.02,0.09,0.0,2900.0,0.09,1776749.3,99.63,0.22,True,43.43,-0.07,-0.07,-0.0,2026-02-06,8.81,0.23,0,,8.55,9.3,True,True
06-02-2026 17:00,ULUFA,3.99,4.07,3.99,4.07,2744917.0,0.0,0.08,0.0,2566.67,0.08,1388288.9,97.72,0.0,True,48.44,-0.02,-0.02,-0.0,2026-02-06,4.07,0.0,0,,4.0,4.12,False,False
06-02-2026 17:00,SAHOL,101.8,104.1,101.7,103.6,10451009.0,0.5,1.8,0.07,2471.43,1.8,3102666.3,236.84,0.28,True,42.38,-1.34,-1.37,0.03,2026-02-06,103.7,-0.1,0,,ATL,110.8,True,True
06-02-2026 17:00,PGSUS,201.7,207.7,201.6,206.8,11466628.0,0.9,5.1,0.17,2900.0,5.1,3335707.7,243.75,0.18,True,57.98,-0.76,-0.6,-0.16,2026-02-06,205.2,0.78,0,,198.8,211.4,True,True
06-02-2026 17:00,ULUUN,7.18,7.34,7.18,7.33,889331.0,0.01,0.15,0.01,1400.0,0.15,417940.5,112.79,0.07,True,54.18,-0.04,-0.04,0.0,2026-02-06,7.26,0.96,0,,7.1,7.5,False,False
06-02-2026 17:00,AKCNS,192.8,195.7,192.7,195.6,187805.0,0.1,2.8,0.11,2445.45,2.8,79044.0,137.6,0.04,True,57.32,0.24,0.23,0.0,2026-02-06,194.7,0.46,0,,191.0,197.3,False,False
06-02-2026 17:00,LILAK,32.64,33.34,32.48,33.2,1599568.0,0.14,0.56,0.07,677.78,0.56,713174.2,124.29,0.25,True,60.12,0.05,0.03,0.02,2026-02-06,32.56,1.97,0,,32.04,33.52,False,False
06-02-2026 17:00,UNLU,16.64,16.99,16.61,16.91,469245.0,0.08,0.27,0.02,1127.27,0.27,170084.0,175.89,0.3,True,58.51,-0.02,-0.04,0.02,2026-02-06,16.66,1.5,0,,16.25,16.93,False,False
06-02-2026 17:00,ALARK,109.4,111.7,109.2,111.4,1559504.0,0.3,2.0,0.04,4900.0,2.0,844953.3,84.57,0.15,True,56.22,0.03,0.29,-0.25,2026-02-06,110.9,0.45,0,,109.2,114.3,False,False
06-02-2026 17:00,KRONT,15.01,15.24,14.95,15.21,245199.0,0.03,0.2,0.01,1566.67,0.2,92542.3,164.96,0.15,True,48.51,-0.07,-0.06,-0.01,2026-02-06,15.18,0.2,0,,14.91,15.67,False,False
06-02-2026 17:00,KOPOL,5.78,5.98,5.77,5.98,1956920.0,0.0,0.2,0.01,2400.0,0.2,572077.5,242.07,0.0,True,61.15,-0.02,-0.01,-0.0,2026-02-06,5.9,1.36,0,,5.77,6.11,False,False
06-02-2026 16:00,AVOD,4.74,5.11,4.71,5.11,38414882.0,0.0,0.37,0.05,687.23,0.37,5419768.8,608.79,0.0,True,74.77,-0.02,-0.07,0.04,2026-02-06,4.65,9.89,0,,4.6,5.63,True,False
06-02-2026 16:00,GLCVY,71.75,74.95,71.65,74.7,573668.0,0.25,2.95,0.4,628.4,2.95,159488.0,259.69,0.08,True,70.88,0.17,-0.2,0.38,2026-02-06,70.25,6.33,0,,70.0,77.35,False,False
06-02-2026 16:00,VAKFA,12.71,13.26,12.71,13.19,11981613.0,0.07,0.48,0.04,1130.77,0.48,3546985.9,237.8,0.15,True,63.23,-0.1,-0.13,0.02,2026-02-06,12.75,3.45,0,,12.44,13.38,True,True
06-02-2026 16:00,IZMDC,7.53,7.64,7.5,7.64,1802818.0,0.0,0.11,0.0,5400.0,0.11,831347.0,116.86,0.0,True,48.89,-0.03,-0.01,-0.01,2026-02-06,7.67,-0.39,0,,7.45,7.95,False,False
06-02-2026 15:00,TEKTU,8.41,9.15,8.39,9.08,23874795.0,0.07,0.67,0.07,885.29,0.67,3099353.7,670.32,0.1,True,74.21,-0.03,-0.09,0.06,2026-02-06,8.32,9.13,0,,8.32,10.66,True,False
06-02-2026 15:00,ZEDUR,8.13,8.41,8.12,8.35,723279.0,0.06,0.22,0.01,2100.0,0.22,221059.3,227.19,0.27,True,54.2,-0.05,-0.05,-0.0,2026-02-06,8.23,1.46,0,,8.23,8.62,True,True
06-02-2026 14:00,SAMAT,5.74,5.83,5.74,5.83,209078.0,0.0,0.09,0.01,1185.71,0.09,59815.3,249.54,0.0,True,64.0,-0.0,-0.01,0.01,2026-02-06,5.71,2.1,0,,5.7,5.85,False,False
06-02-2026 14:00,OTKAR,433.0,437.25,431.75,437.0,242368.0,0.25,4.0,0.12,3100.0,4.0,74110.3,227.04,0.06,True,60.26,-0.17,-0.35,0.18,2026-02-06,432.25,1.1,0,,430.0,439.75,False,False
06-02-2026 14:00,TATEN,10.25,10.54,10.2,10.5,3652561.0,0.04,0.25,0.02,1462.5,0.25,1334869.9,173.63,0.16,True,50.62,-0.17,-0.2,0.03,2026-02-06,10.16,3.35,0,,10.08,11.99,True,True
06-02-2026 14:00,A1CAP,15.98,16.42,15.92,16.37,2494869.0,0.05,0.39,0.08,369.88,0.39,1649593.4,51.24,0.13,True,64.03,-0.04,-0.08,0.05,2026-02-06,15.5,5.61,0,,15.38,16.62,False,False
06-02-2026 14:00,ARSAN,4.3,4.47,4.29,4.46,15193275.0,0.01,0.16,0.02,566.67,0.16,8881838.0,71.06,0.06,True,60.83,-0.05,-0.08,0.03,2026-02-06,4.07,9.58,0,,3.92,4.7,False,False
06-02-2026 13:00,TRCAS,50.05,51.0,50.0,50.85,281850.0,0.15,0.8,0.01,7900.0,0.8,171241.5,64.59,0.19,True,53.03,0.25,0.47,-0.22,2026-02-06,50.95,-0.2,0,,49.94,52.9,False,False
06-02-2026 13:00,SILVR,2.82,2.9,2.82,2.88,354326.0,0.02,0.06,0.0,1900.0,0.06,204277.1,73.45,0.33,True,50.98,-0.01,-0.01,-0.0,2026-02-06,2.88,0.0,0,,2.8,2.92,False,False
06-02-2026 13:00,IZFAS,55.5,56.15,55.4,56.05,755011.0,0.1,0.55,0.09,547.06,0.55,457059.6,65.19,0.18,True,61.76,0.12,0.1,0.01,2026-02-06,55.4,1.17,0,,54.75,58.0,False,False
06-02-2026 13:00,GLRYH,4.69,4.76,4.69,4.75,3412067.0,0.01,0.06,0.01,650.0,0.06,1698491.6,100.89,0.17,True,65.26,0.04,0.05,-0.0,2026-02-06,4.67,1.71,0,,4.5,4.82,False,False
06-02-2026 13:00,SEGYO,4.57,4.77,4.55,4.75,2781000.0,0.02,0.18,0.02,1025.0,0.18,754698.8,268.49,0.11,True,67.54,0.01,0.01,-0.0,2026-02-06,4.52,5.09,0,,4.51,5.03,False,False
06-02-2026 13:00,ALVES,3.98,4.15,3.93,4.15,54028370.0,0.0,0.17,0.01,1114.29,0.17,29077237.6,85.81,0.0,True,55.86,-0.06,-0.06,0.01,2026-02-06,3.92,5.87,0,,3.79,4.59,True,True
06-02-2026 13:00,EGEGY,32.94,33.54,32.68,33.4,339199.0,0.14,0.46,0.08,447.62,0.46,193458.9,75.33,0.3,True,62.24,0.24,0.23,0.02,2026-02-06,32.96,1.33,0,,30.72,33.44,False,False
06-02-2026 13:00,BORLS,2.6,2.73,2.59,2.7,14512134.0,0.03,0.1,0.01,1150.0,0.1,5270218.6,175.36,0.3,True,57.63,-0.02,-0.02,0.0,2026-02-06,2.62,3.05,0,,2.59,2.74,True,True
06-02-2026 12:00,ARMGD,87.55,90.9,87.55,90.05,758815.0,0.85,2.5,0.38,566.67,2.5,185816.4,308.37,0.34,True,76.93,1.09,0.79,0.3,2026-02-06,85.65,5.14,0,,84.65,ATH,False,False
06-02-2026 12:00,ENSRI,26.02,27.2,26.0,27.16,1660479.0,0.04,1.14,0.13,750.75,1.14,328372.3,405.67,0.04,True,69.96,0.37,0.3,0.08,2026-02-06,25.4,6.93,0,,25.4,ATH,False,False
06-02-2026 12:00,SAFKR,28.44,29.32,28.38,29.08,2313945.0,0.24,0.64,0.1,540.0,0.64,943621.2,145.22,0.38,True,64.45,0.06,-0.05,0.11,2026-02-06,27.72,4.91,0,,27.5,30.04,False,False
06-02-2026 11:00,OZYSR,48.62,50.55,48.5,50.4,429466.0,0.15,1.78,0.04,4710.81,1.78,162388.8,164.47,0.08,True,68.15,0.8,0.86,-0.06,2026-02-06,49.26,2.31,0,,46.98,50.45,False,False
06-02-2026 11:00,HUBVC,3.38,3.64,3.37,3.58,1766549.0,0.06,0.2,0.02,852.38,0.2,533879.4,230.89,0.3,True,65.82,0.01,0.01,-0.0,2026-02-06,3.32,7.83,0,,3.29,ATH,False,False
06-02-2026 11:00,GZNMI,43.7,46.22,43.64,45.74,2788246.0,0.48,2.04,0.16,1159.26,2.04,453915.6,514.27,0.24,True,69.13,-0.22,-0.37,0.14,2026-02-06,43.48,5.2,0,,43.3,49.42,True,True
06-02-2026 11:00,AVHOL,37.98,38.68,37.8,38.58,142413.0,0.1,0.6,0.03,2207.69,0.6,66739.8,113.39,0.17,True,55.78,-0.14,-0.14,0.01,2026-02-06,37.98,1.58,1,38.68,37.72,38.68,False,False
06-02-2026 11:00,MERCN,16.41,16.97,16.37,16.82,1507148.0,0.15,0.41,0.0,10150.0,0.41,452402.3,233.14,0.37,True,56.28,-0.03,0.01,-0.04,2026-02-06,16.42,2.44,0,,16.35,17.25,False,False
06-02-2026 11:00,KONKA,15.35,15.5,15.32,15.49,386765.0,0.01,0.14,0.0,4566.67,0.14,229733.1,68.35,0.07,True,52.43,-0.02,-0.01,-0.01,2026-02-06,15.42,0.45,0,,15.19,15.8,False,False
06-02-2026 11:00,BSOKE,28.1,28.44,28.02,28.4,1202387.0,0.04,0.3,0.04,581.82,0.3,620573.1,93.75,0.13,True,56.96,-0.0,-0.02,0.02,2026-02-06,28.0,1.43,0,,27.46,30.14,False,False
06-02-2026 11:00,SMRVA,66.8,68.45,66.6,68.3,1183971.0,0.15,1.5,0.05,2900.0,1.5,424086.8,179.18,0.1,True,51.17,-0.59,-0.57,-0.02,2026-02-06,66.65,2.48,0,,67.05,70.95,True,True
06-02-2026 11:00,BERA,18.4,19.15,18.31,19.02,12323816.0,0.13,0.62,0.05,1219.15,0.62,2069811.4,495.41,0.21,True,69.45,0.03,-0.01,0.04,2026-02-06,18.29,3.99,0,,18.08,19.44,False,False
06-02-2026 11:00,BINHO,9.06,9.76,9.05,9.76,57664625.0,0.0,0.7,0.09,686.52,0.7,11943107.0,382.83,0.0,True,80.37,0.09,0.03,0.07,2026-02-06,8.88,9.91,0,,8.76,ATH,False,False
06-02-2026 11:00,PRDGS,6.75,6.89,6.75,6.87,1371073.0,0.02,0.12,0.02,700.0,0.12,611016.0,124.39,0.17,True,61.64,0.03,0.03,0.0,2026-02-06,6.7,2.54,0,,6.6,7.0,False,False
06-02-2026 11:00,QUAGR,2.63,2.73,2.63,2.71,44714776.0,0.02,0.08,0.01,1042.86,0.08,10892809.4,310.5,0.25,True,64.93,0.01,0.0,0.01,2026-02-06,2.66,1.88,0,,2.61,2.72,False,False
06-02-2026 11:00,VBTYZ,19.33,20.1,19.33,20.02,1094295.0,0.08,0.69,0.09,626.32,0.69,599074.1,82.66,0.12,True,64.6,0.29,0.28,0.01,2026-02-06,19.27,3.89,0,,18.99,ATH,False,False
06-02-2026 10:00,GENIL,118.7,121.5,118.2,120.7,469480.0,0.8,2.0,0.33,506.06,2.0,232063.4,102.31,0.4,True,53.65,-0.54,-0.84,0.3,2026-02-06,118.7,1.68,0,,116.6,126.0,False,False
06-02-2026 10:00,GEREL,16.43,17.66,16.32,17.54,4419792.0,0.12,1.11,0.06,1607.69,1.11,808438.6,446.71,0.11,True,63.96,-0.17,-0.22,0.06,2026-02-06,16.44,6.69,2,16.32,16.32,19.67,True,True
06-02-2026 10:00,OFSYM,70.55,71.25,70.15,71.1,147264.0,0.15,0.55,0.05,900.0,0.55,65165.3,125.99,0.27,True,51.61,-0.26,-0.31,0.04,2026-02-06,70.45,0.92,1,71.25,70.0,71.25,False,False
06-02-2026 10:00,TDGYO,23.14,27.3,23.14,27.22,2753963.0,0.08,4.08,0.41,900.0,4.08,340509.6,708.78,0.02,True,47.66,-1.42,-1.5,0.08,2026-02-06,25.7,5.91,2,23.14,23.14,32.82,True,True
06-02-2026 10:00,MEKAG,4.89,5.14,4.82,5.1,9435676.0,0.04,0.21,0.02,1135.29,0.21,2665708.9,253.96,0.19,True,66.96,0.06,0.04,0.01,2026-02-06,4.93,3.45,1,5.14,4.67,5.14,False,False
06-02-2026 10:00,LIDFA,2.97,3.12,2.92,3.09,6542067.0,0.03,0.12,0.01,900.0,0.12,2752770.9,137.65,0.25,True,58.95,-0.02,-0.03,0.01,2026-02-06,2.93,5.46,0,,2.87,3.41,False,False
06-02-2026 10:00,USAK,1.79,1.93,1.78,1.9,154416658.0,0.03,0.11,0.01,1275.0,0.11,23502607.3,557.02,0.27,True,57.8,-0.03,-0.04,0.0,2026-02-06,1.79,6.15,3,,1.78,2.13,True,True
06-02-2026 10:00,BRSAN,651.0,678.5,650.5,673.5,811784.0,5.0,22.5,2.15,946.51,22.5,164418.9,393.73,0.22,True,67.76,1.75,1.04,0.72,2026-02-06,649.0,3.78,0,,647.5,686.5,False,False
06-02-2026 10:00,RUBNS,28.9,30.8,28.88,30.58,1341645.0,0.22,1.68,0.16,924.39,1.68,596982.4,124.74,0.13,True,57.52,-0.31,-0.6,0.29,2026-02-06,29.4,4.01,0,,26.56,30.6,False,False
06-02-2026 10:00,PNSUT,12.58,13.5,12.5,13.28,3936183.0,0.22,0.7,0.04,1566.67,0.7,764201.4,415.07,0.31,True,56.25,-0.16,-0.15,-0.0,2026-02-06,12.64,5.06,3,,13.01,14.25,True,True
05-02-2026 17:00,BMSTL,102.0,112.0,101.9,109.6,2760505.0,2.4,7.6,0.72,955.56,7.6,381319.3,623.94,0.32,True,81.29,0.68,0.34,0.35,2026-02-05,102.5,6.93,0,,101.3,ATH,False,False
05-02-2026 17:00,IEYHO,77.35,79.7,77.1,79.55,9926372.0,0.15,2.2,0.29,658.62,2.2,2712050.2,266.01,0.07,True,82.58,0.34,0.19,0.14,2026-02-05,76.6,3.85,1,79.7,75.0,79.7,False,False
05-02-2026 17:00,IHEVA,2.32,2.35,2.31,2.35,305190.0,0.0,0.03,0.0,2900.0,0.03,190393.5,60.29,0.0,True,48.25,-0.01,-0.0,-0.0,2026-02-05,2.35,0.0,0,,2.34,2.39,False,False
05-02-2026 17:00,EDATA,9.05,9.28,9.04,9.28,2702796.0,0.0,0.23,0.02,1252.94,0.23,1042824.4,159.18,0.0,True,55.6,0.0,-0.0,0.0,2026-02-05,9.2,0.87,0,,9.01,9.39,False,False
05-02-2026 17:00,ARTMS,36.18,39.54,35.98,39.54,1343280.0,0.0,3.36,0.36,828.18,3.36,215654.8,522.88,0.0,True,81.16,0.07,-0.22,0.29,2026-02-05,35.96,9.96,0,,35.7,41.12,True,False
05-02-2026 16:00,HKTM,12.2,13.6,12.16,13.6,4939043.0,0.0,1.4,0.14,892.91,1.4,841942.7,486.62,0.0,True,83.03,0.18,0.11,0.07,2026-02-05,12.37,9.94,0,,11.51,ATH,False,False
05-02-2026 15:00,DEVA,73.75,74.9,73.65,74.8,372955.0,0.1,1.05,0.22,377.27,1.05,148985.0,150.33,0.1,True,86.28,1.19,1.11,0.08,2026-02-05,72.5,3.17,0,,65.65,ATH,False,False
05-02-2026 15:00,VSNMD,92.5,96.15,92.3,95.35,2187383.0,0.8,2.85,0.53,437.74,2.85,511952.7,327.26,0.28,True,77.51,0.81,0.39,0.42,2026-02-05,91.25,4.49,0,,89.6,ATH,False,False
05-02-2026 15:00,ARZUM,2.51,2.65,2.51,2.64,7144851.0,0.01,0.13,0.02,664.71,0.13,3494929.5,104.43,0.08,True,68.81,0.02,0.01,0.02,2026-02-05,2.48,6.45,0,,2.4,ATH,False,False
05-02-2026 14:00,PLTUR,22.08,22.7,21.92,22.54,1189865.0,0.16,0.46,0.1,369.39,0.46,348587.1,241.34,0.35,True,83.19,0.15,0.06,0.09,2026-02-05,21.58,4.45,1,22.7,21.36,22.7,False,False
05-02-2026 14:00,KRVGD,2.96,3.03,2.96,3.02,4928614.0,0.01,0.06,0.0,2900.0,0.06,1672940.2,194.61,0.17,True,52.21,-0.02,-0.02,0.0,2026-02-05,2.96,2.03,0,,2.91,3.09,True,True
05-02-2026 14:00,AKENR,11.14,11.4,11.12,11.35,3735203.0,0.05,0.21,0.02,950.0,0.21,1054360.9,254.26,0.24,True,65.1,0.04,0.03,0.01,2026-02-05,11.11,2.16,1,11.4,10.75,11.4,False,False
05-02-2026 13:00,ARDYZ,47.08,48.54,46.82,48.44,1097522.0,0.1,1.36,0.22,523.85,1.36,527878.0,107.91,0.07,True,66.68,0.26,0.11,0.15,2026-02-05,46.1,5.08,0,,46.0,48.5,False,False
05-02-2026 13:00,KNFRT,12.25,12.6,12.23,12.57,1216405.0,0.03,0.32,0.05,540.0,0.32,365294.7,232.99,0.09,True,64.5,0.07,0.06,0.01,2026-02-05,12.19,3.12,0,,12.09,ATH,False,False
05-02-2026 13:00,DMRGD,3.7,3.98,3.68,3.94,40803249.0,0.04,0.24,0.02,860.0,0.24,6824603.4,497.88,0.17,True,80.81,0.05,0.03,0.02,2026-02-05,3.62,8.84,0,,3.55,ATH,False,False
05-02-2026 13:00,VRGYO,2.44,2.5,2.43,2.49,9531506.0,0.01,0.05,0.0,2400.0,0.05,3062634.0,211.22,0.2,True,62.95,-0.0,-0.01,0.0,2026-02-05,2.43,2.47,1,2.5,2.41,2.5,False,False
05-02-2026 13:00,MAKIM,16.6,17.05,16.55,16.97,681719.0,0.08,0.37,0.01,2983.33,0.37,185856.8,266.8,0.22,True,61.36,0.04,0.03,0.01,2026-02-05,16.46,3.1,1,17.05,16.37,17.05,False,False
05-02-2026 12:00,BAHKM,119.9,125.9,119.9,125.0,996715.0,0.9,5.1,0.82,521.95,5.1,363197.5,174.43,0.18,True,79.26,4.75,4.36,0.39,2026-02-05,118.7,5.31,0,,113.0,ATH,False,False
05-02-2026 12:00,MHRGY,3.68,3.93,3.67,3.9,6598056.0,0.03,0.22,0.03,714.81,0.22,1535195.1,329.79,0.14,True,80.03,0.06,0.04,0.02,2026-02-05,3.6,8.33,1,3.93,3.48,3.93,False,False
05-02-2026 12:00,PETUN,13.0,13.24,13.0,13.2,408387.0,0.04,0.2,0.03,566.67,0.2,227920.4,79.18,0.2,True,61.04,0.03,0.02,0.01,2026-02-05,13.06,1.07,0,,12.74,13.61,False,False
05-02-2026 12:00,FRIGO,8.17,8.52,8.17,8.44,6939081.0,0.08,0.27,0.04,542.86,0.27,2552170.1,171.89,0.3,True,72.02,0.05,0.01,0.04,2026-02-05,8.08,4.46,0,,7.71,8.7,False,False
05-02-2026 12:00,DOFER,33.06,34.26,33.0,34.02,1143291.0,0.24,0.96,0.08,1042.86,0.96,341904.8,234.39,0.25,True,56.0,-0.23,-0.3,0.06,2026-02-05,32.9,3.4,1,34.26,32.52,34.26,True,True
05-02-2026 12:00,HEDEF,59.65,64.8,59.55,64.25,2917507.0,0.55,4.6,0.46,889.25,4.6,750937.1,288.52,0.12,True,78.52,2.08,1.76,0.32,2026-02-05,60.5,6.2,0,,50.7,ATH,False,False
05-02-2026 12:00,HDFGS,3.16,3.33,3.16,3.29,32886085.0,0.04,0.13,0.0,3150.0,0.13,10926865.9,200.97,0.31,True,63.48,0.05,0.05,-0.0,2026-02-05,3.24,1.54,1,3.33,3.14,3.33,False,False
05-02-2026 12:00,ESCOM,3.75,3.85,3.75,3.85,4819969.0,0.0,0.1,0.0,2400.0,0.1,2514816.2,91.66,0.0,True,67.41,0.04,0.03,0.01,2026-02-05,3.77,2.12,1,3.85,3.59,ATH,False,False
05-02-2026 11:00,MARBL,13.68,13.94,13.68,13.87,676103.0,0.07,0.19,0.0,3700.0,0.19,357345.0,89.2,0.37,True,48.11,-0.1,-0.1,0.01,2026-02-05,13.72,1.09,0,,13.5,14.19,False,False
05-02-2026 11:00,RYSAS,18.62,18.98,18.57,18.91,6822726.0,0.07,0.29,0.08,281.58,0.29,2202747.0,209.74,0.24,True,71.29,0.1,0.06,0.04,2026-02-05,18.5,2.22,0,,18.17,ATH,False,False
05-02-2026 11:00,ADESE,1.06,1.19,1.04,1.19,977621018.0,0.0,0.13,0.01,1757.14,0.13,265188654.8,268.65,0.0,True,45.3,-0.06,-0.05,-0.0,2026-02-05,1.14,4.39,2,1.04,1.04,1.45,True,True
05-02-2026 11:00,SUNTK,40.54,41.46,40.48,41.34,277530.0,0.12,0.8,0.07,1112.12,0.8,119860.4,131.54,0.15,True,58.66,-0.07,-0.1,0.03,2026-02-05,40.46,2.17,0,,40.08,41.86,True,True
05-02-2026 11:00,EFOR,21.02,22.22,21.02,21.98,6407067.0,0.24,0.96,0.11,772.73,0.96,2174027.7,194.71,0.25,True,62.99,-0.29,-0.43,0.15,2026-02-05,20.4,7.75,0,,20.16,22.66,True,False
05-02-2026 11:00,DAPGM,10.26,11.38,10.26,11.38,30359517.0,0.0,1.12,0.12,849.15,1.12,3848584.7,688.85,0.0,True,77.14,0.0,-0.09,0.09,2026-02-05,10.35,9.95,0,,10.2,11.9,True,False
05-02-2026 11:00,SELVA,2.63,2.76,2.63,2.73,12860713.0,0.03,0.1,0.01,669.23,0.1,7979220.2,61.18,0.3,True,55.03,-0.05,-0.06,0.02,2026-02-05,2.58,5.81,1,2.76,2.57,2.76,True,False
05-02-2026 10:00,XU100,13854.83,13955.77,13804.27,13955.74,1832916584.0,0.03,100.91,4.54,2122.2,100.91,824891132.9,122.2,0.0,True,60.98,49.43,54.5,-5.06,2026-02-05,13891.21,0.46,0,,13393.8,13998.18,False,False
05-02-2026 10:00,TTKOM,68.1,69.45,67.55,69.3,7103481.0,0.15,1.2,0.21,485.37,1.2,2598581.8,173.36,0.13,True,63.18,0.72,0.71,0.01,2026-02-05,68.6,1.02,0,,63.35,ATH,False,False
05-02-2026 10:00,SKBNK,8.91,9.12,8.82,9.1,15159930.0,0.02,0.19,0.01,1800.0,0.19,4416534.9,243.25,0.11,True,63.27,0.05,0.06,-0.01,2026-02-05,8.9,2.25,2,8.82,8.82,9.16,False,False
05-02-2026 10:00,ANELE,16.15,16.31,16.0,16.29,459813.0,0.02,0.14,0.01,1650.0,0.14,154710.4,197.21,0.14,True,49.84,-0.03,-0.03,0.0,2026-02-05,16.21,0.49,2,16.0,16.0,16.44,False,False
05-02-2026 10:00,KBORU,18.02,19.32,17.8,19.31,14583743.0,0.01,1.29,0.26,403.91,1.29,3949813.3,269.23,0.01,True,93.35,0.6,0.41,0.19,2026-02-05,18.01,7.22,1,19.32,15.23,19.32,False,False
05-02-2026 10:00,ARCLK,120.5,121.4,119.3,121.3,1074890.0,0.1,0.8,0.05,1500.0,0.8,639598.1,68.06,0.13,True,66.16,1.44,1.52,-0.07,2026-02-05,120.5,0.66,2,119.3,119.3,ATH,False,False
05-02-2026 10:00,ULKER,134.2,135.7,133.0,135.7,934977.0,0.0,1.5,0.12,1150.0,1.5,466008.6,100.64,0.0,True,51.12,0.26,0.56,-0.3,2026-02-05,135.6,0.07,2,133.0,133.0,139.5,False,False
05-02-2026 10:00,KLRHO,660.0,688.0,660.0,686.0,816182.0,2.0,26.0,5.55,368.47,26.0,297486.9,174.36,0.08,True,79.67,21.76,17.64,4.12,2026-02-05,658.5,4.18,0,,538.0,ATH,False,False
05-02-2026 10:00,AVGYO,11.89,13.06,11.85,13.06,3058135.0,0.0,1.17,0.13,793.13,1.17,425544.9,618.64,0.0,True,83.15,0.21,0.14,0.07,2026-02-05,11.88,9.93,1,13.06,11.61,ATH,False,False
05-02-2026 10:00,BNTAS,6.66,6.7,6.65,6.69,614242.0,0.01,0.03,0.0,2900.0,0.03,296772.3,106.97,0.33,True,45.54,-0.02,-0.03,0.01,2026-02-05,6.68,0.15,0,,6.56,6.76,False,False
05-02-2026 10:00,CEMAS,5.58,6.1,5.49,6.1,57198600.0,0.0,0.52,0.05,961.22,0.52,12065839.3,374.05,0.0,True,60.04,-0.06,-0.05,-0.01,2026-02-05,5.55,9.91,1,6.1,5.47,6.72,False,False
05-02-2026 10:00,SISE,46.18,48.04,45.88,47.52,46816233.0,0.52,1.34,0.07,1710.81,1.34,11771899.2,297.69,0.39,True,67.06,0.34,0.35,-0.01,2026-02-05,46.34,2.55,2,45.88,45.88,48.16,False,False
05-02-2026 10:00,DSTKF,849.5,876.5,849.0,871.0,219663.0,5.5,21.5,2.8,667.86,21.5,69065.9,218.05,0.26,True,75.03,10.52,9.04,1.47,2026-02-05,850.0,2.47,0,,825.0,ATH,False,False
05-02-2026 10:00,DYOBY,14.19,14.99,14.12,14.85,3615238.0,0.14,0.66,0.06,947.62,0.66,470380.3,668.58,0.21,True,81.89,0.11,0.06,0.05,2026-02-05,14.08,5.47,1,14.99,13.5,14.99,False,False
05-02-2026 10:00,KRDMB,32.96,34.44,32.96,34.06,738616.0,0.38,1.1,0.07,1427.78,1.1,263835.2,179.95,0.35,True,58.87,0.16,0.28,-0.11,2026-02-05,33.6,1.37,1,34.44,32.94,34.44,False,False
05-02-2026 10:00,HTTBT,45.9,47.24,45.9,47.22,598249.0,0.02,1.32,0.13,885.07,1.32,168951.0,254.1,0.02,True,81.03,0.14,0.08,0.06,2026-02-05,46.0,2.65,0,,45.88,ATH,False,False
05-02-2026 10:00,FROTO,115.8,117.8,114.7,117.7,5348076.0,0.1,1.9,0.11,1627.27,1.9,1832106.2,191.91,0.05,True,64.0,0.57,0.68,-0.11,2026-02-05,115.8,1.64,2,114.7,114.7,ATH,False,False
05-02-2026 10:00,AKYHO,2.89,2.98,2.88,2.97,1281261.0,0.01,0.08,0.01,471.43,0.08,347294.8,268.93,0.12,True,70.19,0.02,0.01,0.01,2026-02-05,2.89,2.77,1,2.98,2.75,2.98,False,False
05-02-2026 10:00,BIMAS,685.0,698.0,683.0,696.5,2027728.0,1.5,11.5,0.95,1110.53,11.5,644641.7,214.55,0.13,True,65.08,5.48,5.83,-0.35,2026-02-05,688.5,1.16,1,698.0,638.0,698.0,False,False
05-02-2026 10:00,MEGMT,67.45,69.4,66.65,68.85,4786820.0,0.55,1.4,0.02,6900.0,1.4,1914533.7,150.03,0.39,True,63.34,0.43,0.26,0.18,2026-02-05,67.5,2.0,0,,65.5,69.05,False,False
05-02-2026 10:00,MAVI,47.94,48.64,47.64,48.6,2113901.0,0.04,0.66,0.08,685.71,0.66,852200.4,148.05,0.06,True,60.61,0.17,0.14,0.03,2026-02-05,48.04,1.17,1,48.64,46.54,48.64,False,False
05-02-2026 10:00,MANAS,10.05,10.94,10.05,10.79,19171981.0,0.15,0.74,0.09,722.22,0.74,8923698.8,114.84,0.2,True,65.11,0.09,0.01,0.08,2026-02-05,10.05,7.36,1,10.94,9.02,10.94,False,False
05-02-2026 10:00,BAYRK,4.55,4.96,4.51,4.9,21547586.0,0.06,0.35,0.02,1421.74,0.35,2932094.0,634.89,0.17,True,71.86,-0.01,-0.03,0.02,2026-02-05,4.51,8.65,3,,4.51,5.0,True,True
05-02-2026 10:00,AGHOL,35.12,35.38,34.98,35.32,1409125.0,0.06,0.2,0.04,376.19,0.2,594968.9,136.84,0.3,True,58.0,0.16,0.18,-0.02,2026-02-05,35.02,0.86,0,,34.74,35.52,False,False
05-02-2026 10:00,TOASO,323.25,329.5,322.75,329.0,1246507.0,0.5,5.75,0.85,576.47,5.75,398114.0,213.1,0.09,True,61.26,0.94,0.89,0.06,2026-02-05,325.0,1.23,0,,321.75,ATH,False,False
04-02-2026 17:00,BEGYO,4.84,4.86,4.82,4.86,1438424.0,0.0,0.02,0.0,1900.0,0.02,913348.4,57.49,0.0,True,54.15,0.02,0.02,0.0,2026-02-04,4.86,0.0,0,,4.69,4.98,False,False
04-02-2026 17:00,GSRAY,1.18,1.19,1.18,1.19,44315669.0,0.0,0.01,0.0,233.33,0.01,27254342.1,62.6,0.0,True,45.35,-0.0,-0.0,-0.0,2026-02-04,1.19,0.0,0,,1.18,1.22,False,False
04-02-2026 17:00,KOTON,17.67,17.98,17.58,17.95,952684.0,0.03,0.28,0.02,1300.0,0.28,360557.5,164.23,0.11,True,57.32,0.05,-0.01,0.05,2026-02-04,17.76,1.07,2,17.58,17.58,18.23,False,False
04-02-2026 17:00,DAGI,6.0,6.08,5.99,6.08,1755768.0,0.0,0.08,0.01,700.0,0.08,668201.2,162.76,0.0,True,59.32,-0.01,-0.02,0.01,2026-02-04,6.02,1.0,0,,5.97,6.11,False,False
04-02-2026 17:00,DITAS,52.5,55.4,52.5,54.9,1059232.0,0.5,2.4,0.17,1271.43,2.4,371170.9,185.38,0.21,True,68.84,0.88,0.83,0.04,2026-02-04,52.7,4.17,0,,50.8,ATH,False,False
04-02-2026 17:00,SNICA,4.26,4.41,4.24,4.38,10345239.0,0.03,0.12,0.02,500.0,0.12,1849146.4,459.46,0.25,True,73.03,0.02,0.01,0.02,2026-02-04,4.19,4.53,1,4.41,4.05,4.41,False,False
04-02-2026 16:00,IZENR,9.89,10.05,9.87,10.04,6031207.0,0.01,0.15,0.03,476.92,0.15,2550201.3,136.5,0.07,True,69.08,0.09,0.08,0.02,2026-02-04,9.78,2.66,0,,9.16,ATH,False,False
04-02-2026 15:00,CCOLA,75.05,75.8,74.9,75.8,963331.0,0.0,0.75,0.08,900.0,0.75,534601.7,80.2,0.0,True,70.77,0.7,0.63,0.07,2026-02-04,74.5,1.74,0,,69.45,ATH,False,False
04-02-2026 15:00,BIOEN,19.25,19.85,19.21,19.85,1769933.0,0.0,0.6,0.01,8471.43,0.6,645416.4,174.23,0.0,True,67.59,0.11,0.08,0.03,2026-02-04,19.06,4.14,0,,19.02,ATH,False,False
04-02-2026 15:00,METRO,5.45,5.64,5.45,5.59,4505851.0,0.05,0.14,0.01,2233.33,0.14,1166346.2,286.32,0.36,True,61.42,0.01,0.01,0.0,2026-02-04,5.42,3.14,1,5.64,5.36,5.64,False,False
04-02-2026 15:00,KLKIM,41.14,42.12,41.02,41.86,1039086.0,0.26,0.72,0.14,407.04,0.72,320203.5,224.51,0.36,True,76.08,0.28,0.15,0.12,2026-02-04,40.34,3.77,1,42.12,38.4,42.12,False,False
04-02-2026 14:00,KIMMR,15.93,16.2,15.9,16.2,170658.0,0.0,0.27,0.03,800.0,0.27,107429.8,58.86,0.0,True,65.27,0.1,0.09,0.01,2026-02-04,15.9,1.89,0,,15.12,16.28,False,False
04-02-2026 14:00,MNDTR,6.87,7.03,6.84,6.99,894647.0,0.04,0.12,0.02,650.0,0.12,325940.9,174.48,0.33,True,60.06,-0.01,-0.03,0.02,2026-02-04,6.86,1.9,0,,6.75,7.09,False,False
04-02-2026 13:00,BALSU,16.5,17.42,16.47,17.25,8019916.0,0.17,0.75,0.1,642.57,0.75,3320464.8,141.53,0.23,True,76.28,0.24,0.17,0.07,2026-02-04,16.6,3.92,0,,15.67,ATH,False,False
04-02-2026 13:00,KAYSE,4.91,5.04,4.9,5.01,3753535.0,0.03,0.1,0.01,809.09,0.1,1659905.7,126.13,0.3,True,65.87,0.0,-0.01,0.01,2026-02-04,4.85,3.3,0,,4.85,5.12,False,False
04-02-2026 13:00,OBAMS,8.28,8.47,8.28,8.42,24457281.0,0.05,0.14,0.0,7.88129934789839e+16,0.14,8847418.9,176.43,0.36,True,42.44,-0.15,-0.16,0.01,2026-02-04,8.28,1.69,0,,8.08,9.29,True,True
04-02-2026 13:00,MOPAS,53.5,54.85,53.4,54.5,1047378.0,0.35,1.0,0.18,471.43,1.0,656221.6,59.61,0.35,True,71.89,0.5,0.31,0.19,2026-02-04,52.45,3.91,1,54.85,51.6,54.85,False,False
04-02-2026 12:00,DMLKT,5.84,5.88,5.83,5.88,4339171.0,0.0,0.04,0.0,700.0,0.04,1910600.1,127.11,0.0,True,64.38,0.0,-0.0,0.0,2026-02-04,5.84,0.68,1,5.88,5.78,5.92,False,False
04-02-2026 12:00,OZSUB,20.24,20.84,20.16,20.74,897357.0,0.1,0.5,0.04,1150.0,0.5,497549.8,80.36,0.2,True,69.05,0.11,0.03,0.08,2026-02-04,20.0,3.7,0,,19.5,20.8,False,False
04-02-2026 12:00,BVSAN,114.7,117.6,114.5,117.1,239848.0,0.5,2.4,0.27,788.89,2.4,73816.6,224.92,0.21,True,61.32,-0.3,-0.7,0.4,2026-02-04,114.3,2.45,0,,113.5,122.9,True,False
04-02-2026 12:00,EPLAS,7.1,7.2,7.1,7.19,969599.0,0.01,0.09,0.0,8900.0,0.09,506725.2,91.35,0.11,True,56.54,0.0,-0.01,0.01,2026-02-04,7.06,1.84,1,7.2,7.0,7.2,False,False
04-02-2026 12:00,TUREX,7.54,7.72,7.53,7.67,12196035.0,0.05,0.13,0.02,664.71,0.13,2546722.7,378.89,0.38,True,63.25,-0.0,-0.03,0.02,2026-02-04,7.5,2.27,1,7.72,7.43,7.72,False,False
04-02-2026 11:00,TKFEN,80.65,84.7,80.15,83.95,3177530.0,0.75,3.3,0.58,464.1,3.3,940143.6,237.98,0.23,True,76.1,1.31,0.89,0.43,2026-02-04,79.15,6.06,0,,75.05,ATH,False,False
04-02-2026 11:00,SEKFK,9.12,9.5,9.12,9.46,1239539.0,0.04,0.34,0.05,608.33,0.34,158661.3,681.25,0.12,True,68.23,0.06,0.04,0.03,2026-02-04,9.2,2.83,0,,8.65,ATH,False,False
04-02-2026 11:00,VESTL,32.74,33.54,32.64,33.4,2671640.0,0.14,0.66,0.13,400.0,0.66,712404.9,275.02,0.21,True,80.45,0.38,0.23,0.15,2026-02-04,32.14,3.92,1,33.54,30.12,33.54,False,False
04-02-2026 11:00,GWIND,26.96,28.18,26.92,28.0,5392232.0,0.18,1.04,0.09,1081.82,1.04,1645880.5,227.62,0.17,True,70.07,0.28,0.14,0.14,2026-02-04,26.92,4.01,0,,25.4,28.42,False,False
04-02-2026 11:00,IHLAS,2.34,2.38,2.33,2.38,33134217.0,0.0,0.04,0.0,3900.0,0.04,19822030.1,67.16,0.0,True,63.01,0.01,0.01,0.0,2026-02-04,2.33,2.15,0,,2.24,2.4,False,False
04-02-2026 11:00,AFYON,14.62,14.91,14.62,14.84,1202542.0,0.07,0.22,0.02,1000.0,0.22,302137.8,298.01,0.32,True,61.34,0.02,0.01,0.01,2026-02-04,14.71,0.88,3,,14.62,15.07,False,False
04-02-2026 11:00,IHAAS,57.95,59.8,57.45,59.6,772109.0,0.2,1.65,0.02,6500.0,1.65,266410.8,189.82,0.12,True,31.93,-1.57,-0.57,-1.0,2026-02-04,63.7,-6.44,0,,57.35,72.15,False,False
04-02-2026 11:00,HATSN,42.7,43.36,42.44,43.24,314887.0,0.12,0.54,0.09,500.0,0.54,186712.7,68.65,0.22,True,68.41,0.09,-0.07,0.16,2026-02-04,41.78,3.49,0,,41.18,45.8,True,False
04-02-2026 11:00,UCAYM,34.68,38.12,34.58,37.7,37755366.0,0.42,3.02,0.14,2088.41,3.02,12542049.2,201.03,0.14,True,59.64,0.12,0.47,-0.35,2026-02-04,34.66,8.77,0,,33.76,41.2,False,False
04-02-2026 10:00,ENJSA,108.9,112.6,108.8,112.5,1248090.0,0.1,3.6,0.37,872.97,3.6,261505.5,377.27,0.03,True,83.71,1.44,1.04,0.4,2026-02-04,107.1,5.04,1,112.6,101.9,112.6,False,False
04-02-2026 10:00,BIGEN,9.95,10.39,9.49,10.29,9937613.0,0.1,0.34,0.08,314.63,0.34,2972382.7,234.33,0.29,True,83.35,0.16,0.07,0.08,2026-02-04,9.87,4.26,1,10.39,9.32,10.39,False,False
04-02-2026 10:00,FONET,3.64,3.91,3.64,3.84,46377873.0,0.07,0.2,0.05,263.64,0.2,13527993.3,242.83,0.35,True,84.84,0.12,0.08,0.04,2026-02-04,3.6,6.67,1,3.91,3.16,3.91,False,False
04-02-2026 10:00,EUREN,5.14,5.28,5.13,5.27,33857303.0,0.01,0.13,0.01,1081.82,0.13,7336050.6,361.52,0.08,True,78.21,0.03,0.02,0.01,2026-02-04,5.07,3.94,0,,5.02,ATH,False,False
04-02-2026 10:00,ERCB,70.25,70.95,70.2,70.8,360438.0,0.15,0.55,0.01,5400.0,0.55,150273.8,139.85,0.27,True,56.86,0.04,-0.01,0.05,2026-02-04,70.1,1.0,0,,69.95,71.15,False,False
04-02-2026 10:00,MGROS,660.0,667.0,657.0,666.0,1164150.0,1.0,6.0,0.05,11900.0,6.0,547692.3,112.56,0.17,True,68.7,7.7,6.34,1.36,2026-02-04,654.0,1.83,0,,610.5,667.0,False,False
04-02-2026 10:00,SEKUR,3.87,4.26,3.81,4.26,3107836.0,0.0,0.39,0.07,420.0,0.39,833985.0,272.65,0.0,True,91.81,0.12,0.06,0.06,2026-02-04,3.88,9.79,1,4.26,3.45,ATH,False,False
04-02-2026 10:00,MNDRS,14.98,15.26,14.98,15.2,626054.0,0.06,0.22,0.02,1000.0,0.22,197071.0,217.68,0.27,True,59.65,-0.0,-0.03,0.03,2026-02-04,14.94,1.74,0,,14.71,15.41,False,False
04-02-2026 10:00,ALKA,13.1,13.6,13.08,13.55,5520844.0,0.05,0.45,0.05,900.0,0.45,1111258.4,396.81,0.11,True,67.17,-0.01,-0.06,0.04,2026-02-04,13.05,3.83,0,,12.96,14.43,False,False
04-02-2026 10:00,DGNMO,5.2,5.29,5.2,5.27,392849.0,0.02,0.07,0.01,775.0,0.07,248998.1,57.77,0.29,True,62.4,0.02,0.01,0.01,2026-02-04,5.18,1.74,1,5.29,4.95,5.29,False,False
04-02-2026 10:00,PNLSN,41.1,42.9,41.1,42.54,435404.0,0.36,1.44,0.15,860.0,1.44,79573.3,447.17,0.25,True,70.77,0.13,0.01,0.12,2026-02-04,40.88,4.06,0,,40.46,ATH,False,False
04-02-2026 10:00,PRKAB,55.4,58.0,55.05,58.0,4968684.0,0.0,2.6,0.26,900.0,2.6,542026.7,816.69,0.0,True,78.71,1.48,0.82,0.66,2026-02-04,52.75,9.95,1,58.0,44.88,ATH,False,False
04-02-2026 10:00,ALKIM,19.33,19.59,19.33,19.54,868842.0,0.05,0.21,0.03,556.25,0.21,224962.3,286.22,0.24,True,61.1,0.01,-0.03,0.04,2026-02-04,19.31,1.19,0,,18.92,19.77,False,False
04-02-2026 10:00,SARKY,47.8,50.55,47.76,50.55,23212617.0,0.0,2.75,0.39,606.94,2.75,4989636.4,365.22,0.0,True,78.79,0.7,-0.06,0.76,2026-02-04,45.98,9.94,1,50.55,41.8,51.6,False,False
04-02-2026 10:00,BIENY,23.94,24.4,23.94,24.32,295216.0,0.08,0.38,0.06,512.9,0.38,193934.2,52.22,0.21,True,62.0,0.01,-0.06,0.06,2026-02-04,24.0,1.33,1,24.4,23.46,24.4,False,False
04-02-2026 10:00,VESBE,8.33,8.51,8.32,8.47,3783090.0,0.04,0.14,0.02,723.53,0.14,1048594.1,260.78,0.29,True,69.53,0.04,0.02,0.02,2026-02-04,8.29,2.17,0,,7.99,ATH,False,False
04-02-2026 10:00,ZOREN,3.39,3.52,3.38,3.5,69754147.0,0.02,0.11,0.02,423.81,0.11,18727016.9,272.48,0.18,True,79.96,0.04,0.03,0.01,2026-02-04,3.38,3.55,0,,3.17,ATH,False,False
04-02-2026 10:00,ADEL,34.0,34.82,33.88,34.6,1057513.0,0.22,0.6,0.07,809.09,0.6,226293.1,367.32,0.37,True,66.58,0.04,0.01,0.03,2026-02-04,34.02,1.7,0,,33.86,35.14,False,False
04-02-2026 10:00,TUCLK,5.98,6.28,5.72,6.28,33738256.0,0.0,0.3,0.05,445.45,0.3,7287758.2,362.94,0.0,True,78.62,0.17,0.1,0.07,2026-02-04,5.8,8.28,1,6.28,5.15,ATH,False,False
04-02-2026 10:00,HATEK,15.26,15.55,15.23,15.55,526656.0,0.0,0.29,0.02,1218.18,0.29,194379.6,170.94,0.0,True,66.65,0.0,-0.04,0.04,2026-02-04,15.23,2.1,0,,15.0,15.86,False,False
04-02-2026 10:00,KLMSN,29.72,30.6,29.72,30.52,479329.0,0.08,0.8,0.07,1076.47,0.8,107022.1,347.88,0.1,True,70.57,0.01,-0.06,0.07,2026-02-04,29.66,2.9,0,,29.58,30.72,False,False
03-02-2026 17:00,TATGD,14.27,14.42,14.24,14.4,420879.0,0.02,0.13,0.03,364.29,0.13,170372.1,147.04,0.15,True,66.5,0.07,0.05,0.02,2026-02-03,14.19,1.48,0,,14.07,ATH,False,False
03-02-2026 17:00,SELEC,78.25,79.5,77.9,79.45,329375.0,0.05,1.2,0.08,1500.0,1.2,83288.9,295.46,0.04,True,51.18,-0.31,-0.38,0.06,2026-02-03,79.05,0.51,2,77.9,77.9,79.9,True,True
03-02-2026 17:00,BLCYT,42.76,44.54,42.68,44.54,1305393.0,0.0,1.78,0.4,347.24,1.78,259317.6,403.4,0.0,True,85.83,1.35,1.07,0.29,2026-02-03,39.8,11.91,0,,34.6,ATH,False,False
03-02-2026 17:00,EGEPO,10.49,10.95,10.45,10.87,1321523.0,0.08,0.38,0.03,985.71,0.38,315747.0,318.54,0.21,True,65.24,0.07,0.05,0.03,2026-02-03,10.52,3.33,0,,10.04,11.36,False,False
03-02-2026 17:00,BOSSA,7.08,7.16,7.05,7.14,968876.0,0.02,0.06,0.02,300.0,0.06,407293.5,137.88,0.33,True,73.37,0.07,0.04,0.02,2026-02-03,6.91,3.33,0,,6.67,ATH,False,False
03-02-2026 17:00,ICUGS,2.7,2.73,2.68,2.73,3671491.0,0.0,0.03,0.0,650.0,0.03,1274898.8,187.98,0.0,True,55.21,-0.0,-0.01,0.01,2026-02-03,2.69,1.49,2,2.68,2.68,2.75,False,False
03-02-2026 17:00,MARMR,2.98,3.14,2.94,3.14,114133816.0,0.0,0.16,0.02,841.18,0.16,50162482.8,127.53,0.0,True,69.92,0.06,0.04,0.02,2026-02-03,2.86,9.79,0,,2.86,3.15,False,False
03-02-2026 16:00,PAHOL,1.8,1.83,1.79,1.83,257911910.0,0.0,0.03,0.0,650.0,0.03,98775473.0,161.11,0.0,True,63.38,0.01,0.01,0.0,2026-02-03,1.77,3.39,0,,1.76,1.86,False,False
03-02-2026 16:00,FZLGY,12.17,12.47,12.16,12.4,3127884.0,0.07,0.23,0.02,820.0,0.23,1075316.2,190.88,0.3,True,53.8,-0.11,-0.15,0.03,2026-02-03,12.02,3.16,0,,11.94,12.97,True,False
03-02-2026 16:00,SKYMD,12.26,12.47,12.22,12.45,741260.0,0.02,0.19,0.02,726.09,0.19,294357.4,151.82,0.11,True,62.39,0.01,-0.01,0.02,2026-02-03,12.23,1.8,0,,11.99,12.64,False,False
03-02-2026 16:00,TSPOR,1.1,1.11,1.09,1.11,50617491.0,0.0,0.01,0.0,233.33,0.01,19591104.2,158.37,0.0,True,59.86,0.0,-0.0,0.0,2026-02-03,1.09,1.83,1,1.11,1.07,1.13,False,False
03-02-2026 16:00,KAREL,9.3,9.48,9.29,9.45,2609748.0,0.03,0.15,0.01,1053.85,0.15,991862.4,163.12,0.2,True,66.3,0.02,-0.01,0.02,2026-02-03,9.22,2.49,0,,9.07,9.59,False,False
03-02-2026 16:00,AYDEM,25.74,26.86,25.5,26.82,2744528.0,0.04,1.08,0.15,601.3,1.08,1200365.6,128.64,0.04,True,71.72,0.56,0.49,0.07,2026-02-03,25.82,3.87,0,,23.06,ATH,False,False
03-02-2026 16:00,MEYSU,13.96,15.0,13.88,14.93,33621101.0,0.07,0.97,0.08,1127.85,0.97,12389088.1,171.38,0.07,True,66.02,-0.01,-0.13,0.13,2026-02-03,14.18,5.29,2,13.88,13.88,17.99,False,False
03-02-2026 15:00,MAKTK,16.7,17.58,16.7,17.41,2331838.0,0.17,0.71,0.02,2986.96,0.71,1005080.2,132.01,0.24,True,57.61,0.06,0.13,-0.08,2026-02-03,17.32,0.52,0,,16.46,18.29,False,False
03-02-2026 15:00,TRMET,138.7,141.5,138.7,140.9,1412916.0,0.6,2.2,0.14,1471.43,2.2,876128.5,61.27,0.27,True,55.19,-0.99,-1.85,0.86,2026-02-03,132.1,6.66,0,,130.0,154.1,False,False
03-02-2026 15:00,SOKM,65.15,67.15,65.15,66.6,3208144.0,0.55,1.45,0.13,1015.38,1.45,1108410.7,189.44,0.38,True,65.7,0.39,0.31,0.09,2026-02-03,64.95,2.54,0,,64.55,ATH,False,False
03-02-2026 15:00,SURGY,49.18,52.55,49.06,52.55,5645654.0,0.0,3.37,0.41,719.95,3.37,1397529.4,303.97,0.0,True,73.11,0.11,-0.11,0.22,2026-02-03,47.8,9.94,0,,47.0,ATH,False,False
03-02-2026 14:00,EKSUN,5.91,5.98,5.9,5.97,958539.0,0.01,0.06,0.0,1400.0,0.06,440005.7,117.85,0.17,True,59.33,0.0,-0.0,0.01,2026-02-03,5.9,1.19,0,,5.86,6.05,False,False
03-02-2026 14:00,ASUZU,60.65,61.9,60.65,61.6,254154.0,0.3,0.95,0.08,1017.65,0.95,97316.0,161.16,0.32,True,65.04,0.19,0.05,0.15,2026-02-03,60.0,2.67,0,,58.15,ATH,False,False
03-02-2026 13:00,DURKN,17.82,18.18,17.82,18.12,536364.0,0.06,0.3,0.01,5900.0,0.3,253375.5,111.69,0.2,True,51.57,-0.05,-0.05,0.01,2026-02-03,18.0,0.67,1,18.18,17.79,18.18,True,True
03-02-2026 13:00,MERKO,16.19,16.76,16.16,16.64,1661689.0,0.12,0.45,0.06,689.47,0.45,612103.3,171.47,0.27,True,71.37,0.09,0.03,0.06,2026-02-03,16.1,3.35,0,,15.87,17.04,False,False
03-02-2026 13:00,BEYAZ,29.96,30.7,29.96,30.56,304912.0,0.14,0.6,0.02,2900.0,0.6,142958.4,113.29,0.23,True,57.03,-0.02,-0.02,0.0,2026-02-03,29.9,2.21,1,30.7,29.5,30.7,False,False
03-02-2026 13:00,BUCIM,6.87,6.89,6.86,6.89,1411006.0,0.0,0.02,0.0,1900.0,0.02,747506.5,88.76,0.0,True,35.71,-0.03,-0.02,-0.01,2026-02-03,6.98,-1.29,2,6.86,6.86,7.16,False,False
03-02-2026 13:00,RTALB,3.98,4.09,3.96,4.06,10539785.0,0.03,0.08,0.01,788.89,0.08,4461481.1,136.24,0.38,True,65.95,0.03,0.02,0.01,2026-02-03,3.92,3.57,0,,3.73,ATH,False,False
03-02-2026 12:00,ORCAY,3.78,3.9,3.77,3.88,851843.0,0.02,0.1,0.01,900.0,0.1,471301.3,80.74,0.2,True,64.14,0.01,0.01,0.0,2026-02-03,3.78,2.65,0,,3.73,4.0,False,False
03-02-2026 12:00,EDIP,36.72,38.62,36.7,38.46,756208.0,0.16,1.74,0.22,705.56,1.74,172685.5,337.91,0.09,True,72.87,0.02,-0.15,0.17,2026-02-03,36.42,5.6,0,,35.76,40.3,False,False
03-02-2026 12:00,NIBAS,3.74,4.0,3.71,4.0,7640879.0,0.0,0.26,0.03,712.5,0.26,1989673.0,284.03,0.0,True,72.34,0.06,0.04,0.02,2026-02-03,3.82,4.71,0,,3.54,ATH,False,False
03-02-2026 11:00,KRDMA,28.38,29.1,28.38,29.04,1876532.0,0.06,0.66,0.18,262.64,0.66,663876.4,182.66,0.09,True,67.51,0.01,-0.13,0.13,2026-02-03,28.0,3.71,0,,27.12,ATH,False,False
03-02-2026 11:00,EREGL,28.16,28.74,28.16,28.64,57392649.0,0.1,0.48,0.11,344.44,0.48,22981390.1,149.74,0.21,True,62.0,0.07,0.08,-0.01,2026-02-03,28.18,1.63,0,,27.64,28.72,False,False
03-02-2026 11:00,KRDMD,29.74,30.42,29.72,30.4,18493411.0,0.02,0.66,0.24,179.66,0.66,7487885.2,146.98,0.03,True,69.55,0.06,-0.13,0.2,2026-02-03,29.24,3.97,0,,27.7,30.5,False,False
03-02-2026 10:00,SMRTG,7.87,7.99,7.87,7.96,1855847.0,0.03,0.09,0.01,800.0,0.09,1229659.0,50.92,0.33,True,41.94,-0.12,-0.12,0.0,2026-02-03,7.86,1.27,0,,7.8,8.53,False,False
03-02-2026 10:00,CANTE,1.84,1.96,1.84,1.96,517237494.0,0.0,0.12,0.02,570.92,0.12,169211856.69,205.67,0.0,True,71.34,0.01,-0.01,0.02,2026-02-03,1.79,9.44,1,1.96,1.72,1.97,False,False
03-02-2026 10:00,ODAS,5.8,5.99,5.78,5.98,32242905.0,0.01,0.18,0.03,480.65,0.18,10981938.2,193.6,0.06,True,60.5,-0.01,-0.02,0.01,2026-02-03,5.68,5.28,0,,5.51,6.36,False,False
03-02-2026 10:00,SRVGY,3.37,3.46,3.36,3.45,8123991.0,0.01,0.08,0.01,471.43,0.08,2267310.7,258.31,0.12,True,59.52,-0.01,-0.02,0.01,2026-02-03,3.37,2.37,0,,3.31,3.49,False,False
03-02-2026 10:00,DESA,12.01,12.19,12.01,12.15,212164.0,0.04,0.14,0.03,418.52,0.14,86503.5,145.27,0.29,True,42.59,-0.07,-0.06,-0.01,2026-02-03,12.3,-1.22,0,,12.0,12.7,False,False
03-02-2026 10:00,SASA,2.54,2.61,2.53,2.6,708179328.0,0.01,0.06,0.01,400.0,0.06,254985433.8,177.73,0.17,True,62.46,-0.0,-0.01,0.01,2026-02-03,2.54,2.36,0,,2.45,2.66,False,False
03-02-2026 10:00,ECILC,115.9,122.3,115.9,121.6,2138687.0,0.7,5.7,0.32,1681.25,5.7,476884.5,348.47,0.12,True,60.23,-1.22,-1.61,0.4,2026-02-03,115.1,5.65,1,122.3,115.1,122.3,True,True
03-02-2026 10:00,BMSCH,18.83,20.06,18.83,19.88,3284308.0,0.18,1.05,0.1,939.6,1.05,563809.5,482.52,0.17,True,77.09,0.25,0.17,0.07,2026-02-03,18.74,6.08,0,,17.75,ATH,False,False
03-02-2026 10:00,BJKAS,1.58,1.62,1.58,1.62,19125941.0,0.0,0.04,0.0,900.0,0.04,8689025.5,120.12,0.0,True,66.76,-0.0,-0.01,0.0,2026-02-03,1.58,2.53,0,,1.56,1.63,False,False
03-02-2026 10:00,TCELL,114.5,116.8,113.3,116.6,11386139.0,0.2,2.1,0.35,500.0,2.1,5054204.8,125.28,0.1,True,57.88,-0.38,-0.52,0.14,2026-02-03,113.5,2.73,0,,110.9,118.8,False,False
03-02-2026 10:00,KOCMT,2.69,2.76,2.67,2.74,11229600.0,0.02,0.05,0.01,455.56,0.05,4329157.9,159.39,0.4,True,57.48,-0.01,-0.01,0.0,2026-02-03,2.68,2.24,0,,2.59,2.82,False,False
03-02-2026 10:00,HEKTS,3.3,3.36,3.28,3.36,24801524.0,0.0,0.06,0.01,500.0,0.06,9937807.6,149.57,0.0,True,60.41,-0.01,-0.01,0.0,2026-02-03,3.27,2.75,0,,3.21,3.46,False,False
03-02-2026 10:00,AYEN,27.92,28.22,27.92,28.2,129563.0,0.02,0.28,0.07,288.89,0.28,80526.2,60.9,0.07,True,59.24,-0.01,-0.06,0.04,2026-02-03,27.88,1.15,0,,27.26,28.48,False,False
03-02-2026 10:00,GESAN,54.6,56.1,54.6,55.7,1289042.0,0.4,1.1,0.15,609.68,1.1,510955.3,152.28,0.36,True,57.23,-0.18,-0.23,0.05,2026-02-03,54.25,2.67,0,,53.0,56.95,False,False
03-02-2026 10:00,FENER,3.31,3.36,3.3,3.36,38477610.0,0.0,0.05,0.01,455.56,0.05,12929188.8,197.6,0.0,True,61.86,-0.01,-0.01,0.01,2026-02-03,3.27,2.75,1,3.36,3.23,3.37,False,False
03-02-2026 10:00,FRMPL,40.6,42.72,40.44,42.72,7341550.0,0.0,2.12,0.22,872.48,2.12,2335526.6,214.34,0.0,True,65.13,-0.53,-0.97,0.44,2026-02-03,38.84,9.99,1,42.72,38.0,49.94,True,False
03-02-2026 10:00,TCKRC,89.15,94.5,89.15,94.2,1098220.0,0.3,5.05,0.22,2195.45,5.05,257051.0,327.24,0.06,True,58.45,-0.7,-0.79,0.09,2026-02-03,89.0,5.84,0,,88.6,97.3,False,False
03-02-2026 10:00,JANTS,19.46,19.65,19.46,19.6,649264.0,0.05,0.14,0.02,723.53,0.14,246012.3,163.92,0.36,True,45.0,-0.12,-0.13,0.01,2026-02-03,19.44,0.82,0,,19.32,20.26,True,True
02-02-2026 17:00,KLYPV,61.65,62.25,61.55,62.1,439112.0,0.15,0.45,0.15,200.0,0.45,277587.3,58.19,0.33,True,66.39,0.4,0.33,0.08,2026-02-02,60.6,2.48,0,,59.4,ATH,False,False
02-02-2026 17:00,RALYH,189.1,192.7,189.1,192.6,187551.0,0.1,3.5,0.45,677.78,3.5,64682.6,189.96,0.03,True,61.69,0.59,0.45,0.13,2026-02-02,187.7,2.61,1,192.7,184.8,192.7,False,False
02-02-2026 17:00,PRZMA,12.5,12.99,12.5,12.98,274188.0,0.01,0.48,0.03,1555.17,0.48,71871.4,281.5,0.02,True,61.6,-0.05,-0.06,0.01,2026-02-02,12.76,1.72,0,,12.2,ATH,False,False
02-02-2026 17:00,GOZDE,25.9,26.36,25.6,26.36,1167360.0,0.0,0.46,0.13,265.08,0.46,578775.9,101.69,0.0,True,68.44,0.09,0.0,0.08,2026-02-02,25.52,3.29,0,,24.48,26.8,False,False
02-02-2026 16:00,LRSHO,4.28,4.37,4.27,4.35,2749075.0,0.02,0.07,0.01,1066.67,0.07,1561889.7,76.01,0.29,True,56.68,-0.01,-0.01,0.0,2026-02-02,4.25,2.35,1,4.37,4.17,4.37,False,False
02-02-2026 16:00,ECOGR,25.92,27.1,25.92,26.94,8493893.0,0.16,1.02,0.23,335.9,1.02,3706215.3,129.18,0.16,True,78.48,0.35,0.17,0.18,2026-02-02,24.86,8.37,0,,24.18,ATH,False,False
02-02-2026 15:00,DERHL,14.12,15.19,14.12,15.17,3965886.0,0.02,1.05,0.09,1029.03,1.05,1484324.1,167.18,0.02,True,71.77,0.08,0.03,0.04,2026-02-02,14.27,6.31,0,,14.0,ATH,False,False
02-02-2026 15:00,AZTEK,4.63,4.86,4.62,4.85,6381707.0,0.01,0.22,0.04,464.1,0.22,1362795.8,368.28,0.05,True,73.22,0.03,0.0,0.03,2026-02-02,4.54,6.83,0,,4.43,ATH,False,False
02-02-2026 15:00,DOFRB,105.7,110.1,105.5,109.9,5409033.0,0.2,4.2,1.08,290.7,4.2,2480886.1,118.03,0.05,True,76.52,2.05,1.27,0.77,2026-02-02,100.1,9.79,0,,95.65,ATH,False,False
02-02-2026 15:00,AKFIS,22.2,22.66,22.2,22.66,1066826.0,0.0,0.46,0.03,1337.5,0.46,317618.5,235.88,0.0,True,60.83,-0.07,-0.07,0.01,2026-02-02,22.4,1.16,0,,21.9,22.76,False,False
02-02-2026 15:00,AKSEN,73.05,74.9,72.5,74.6,2140843.0,0.3,1.55,0.17,811.76,1.55,985266.3,117.29,0.19,True,60.73,0.19,0.2,-0.01,2026-02-02,73.7,1.22,1,74.9,71.1,74.9,False,False
02-02-2026 14:00,AKBNK,89.7,92.3,89.6,92.2,39732101.0,0.1,2.5,0.26,880.39,2.5,18368052.1,116.31,0.04,True,66.09,1.19,1.46,-0.27,2026-02-02,92.95,-0.81,0,,88.65,ATH,False,False
02-02-2026 14:00,YKBNK,39.46,40.7,39.44,40.4,55196180.0,0.3,0.94,0.12,658.06,0.94,32284350.3,70.97,0.32,True,57.91,0.21,0.38,-0.17,2026-02-02,41.08,-1.66,0,,38.92,41.42,False,False
02-02-2026 14:00,AKFYE,19.82,20.56,19.76,20.5,6595148.0,0.06,0.68,0.18,275.69,0.68,3130533.3,110.67,0.09,True,82.87,0.37,0.19,0.18,2026-02-02,18.7,9.63,0,,18.39,ATH,False,False
02-02-2026 14:00,ISCTR,16.4,16.96,16.38,16.86,163341137.0,0.1,0.46,0.1,355.45,0.46,89654703.4,82.19,0.22,True,66.44,0.17,0.19,-0.02,2026-02-02,16.66,1.2,0,,15.99,ATH,False,False
02-02-2026 14:00,XBANK,19379.86,19915.38,19367.94,19866.41,293381160.0,48.97,486.55,32.06,1417.72,486.55,176422665.1,66.29,0.1,True,63.6,156.6,210.26,-53.66,2026-02-02,20019.85,-0.77,0,,19148.51,20011.78,False,False
02-02-2026 14:00,XU030,14824.39,15065.29,14823.76,15038.71,1060731108.0,26.58,214.32,7.5,2755.7,214.32,512614379.1,106.93,0.12,True,56.69,6.69,41.95,-35.26,2026-02-02,15127.98,-0.59,0,,14532.93,15310.42,False,False
02-02-2026 14:00,ISKPL,11.43,11.72,11.43,11.71,2780885.0,0.01,0.28,0.03,833.33,0.28,1583419.1,75.63,0.04,True,61.94,-0.03,-0.06,0.02,2026-02-02,11.45,2.27,0,,11.34,12.01,True,True
02-02-2026 14:00,OSTIM,2.98,3.14,2.98,3.13,13870679.0,0.01,0.15,0.02,733.33,0.15,2545664.3,444.87,0.07,True,82.43,0.01,-0.0,0.01,2026-02-02,2.96,5.74,0,,2.94,ATH,False,False
02-02-2026 14:00,GARAN,155.5,159.1,155.4,159.1,10608040.0,0.0,3.6,0.7,414.29,3.6,5566907.1,90.56,0.0,True,58.73,0.66,1.13,-0.48,2026-02-02,161.3,-1.36,0,,153.0,161.9,False,False
02-02-2026 14:00,KLSYN,7.23,7.62,7.22,7.56,1589982.0,0.06,0.33,0.01,2100.0,0.33,495527.7,220.87,0.18,True,52.12,-0.11,-0.12,0.01,2026-02-02,7.36,2.72,0,,7.17,7.85,False,False
02-02-2026 14:00,PAPIL,19.08,19.49,19.07,19.42,4507195.0,0.07,0.34,0.04,729.27,0.34,1950708.6,131.05,0.21,True,57.24,-0.08,-0.09,0.0,2026-02-02,19.03,2.05,0,,18.5,20.0,False,False
02-02-2026 13:00,YEOTK,43.76,45.4,43.74,45.38,2160893.0,0.02,1.62,0.12,1272.88,1.62,1102790.5,95.95,0.01,True,65.56,0.03,-0.06,0.09,2026-02-02,43.5,4.32,0,,42.9,ATH,False,False
02-02-2026 13:00,HRKET,80.9,82.3,80.8,82.0,142295.0,0.3,1.1,0.07,1471.43,1.1,80084.2,77.68,0.27,True,56.56,-0.14,-0.12,-0.02,2026-02-02,81.4,0.74,0,,79.7,83.2,False,False
02-02-2026 12:00,YKSLN,3.41,3.58,3.41,3.57,18123379.0,0.01,0.16,0.03,384.85,0.16,3198378.1,466.64,0.06,True,68.62,0.03,0.02,0.01,2026-02-02,3.42,4.39,0,,3.26,ATH,False,False
02-02-2026 12:00,GOODY,15.58,15.79,15.58,15.78,256482.0,0.01,0.2,0.02,733.33,0.2,153396.6,67.2,0.05,True,50.99,-0.07,-0.07,-0.01,2026-02-02,15.65,0.83,0,,15.41,16.1,True,True
02-02-2026 12:00,AKGRT,8.2,8.44,8.19,8.42,3845520.0,0.02,0.22,0.02,900.0,0.22,2332413.6,64.87,0.09,True,55.39,-0.03,-0.03,-0.0,2026-02-02,8.28,1.69,0,,7.89,8.5,False,False
02-02-2026 12:00,ATLAS,8.76,9.75,8.76,9.72,2865742.0,0.03,0.96,0.09,954.95,0.96,718416.9,298.9,0.03,True,84.18,0.45,0.41,0.03,2026-02-02,8.87,9.58,1,9.75,8.62,9.75,False,False
02-02-2026 12:00,BRLSM,15.01,15.25,14.99,15.22,522249.0,0.03,0.21,0.02,813.04,0.21,345140.6,51.31,0.14,True,55.77,-0.06,-0.08,0.02,2026-02-02,15.01,1.4,0,,14.61,15.27,True,False
02-02-2026 12:00,GLRMK,195.1,200.8,195.1,200.4,481337.0,0.4,5.3,0.54,881.48,5.3,165642.4,190.59,0.08,True,69.44,0.65,0.17,0.49,2026-02-02,194.8,2.87,0,,190.4,ATH,False,False
02-02-2026 12:00,CEOEM,22.1,22.42,22.1,22.38,114910.0,0.04,0.28,0.03,976.92,0.28,69842.3,64.53,0.14,True,52.14,-0.11,-0.15,0.04,2026-02-02,22.14,1.08,0,,21.62,22.4,False,False
02-02-2026 12:00,PRKME,20.34,21.34,20.34,21.12,4022912.0,0.22,0.78,0.04,1757.14,0.78,649189.1,519.68,0.28,True,38.1,-0.5,-0.14,-0.36,2026-02-02,22.58,-6.47,2,20.34,20.34,25.08,False,False
02-02-2026 12:00,DARDL,2.46,2.49,2.46,2.49,7069613.0,0.0,0.03,0.01,275.0,0.03,4690414.5,50.72,0.0,True,60.92,0.01,0.0,0.0,2026-02-02,2.44,2.05,0,,2.38,2.5,False,False
02-02-2026 12:00,DMSAS,9.24,9.74,9.24,9.6,5652093.0,0.14,0.36,0.05,665.96,0.36,1564380.8,261.3,0.39,True,42.21,-0.25,-0.13,-0.11,2026-02-02,9.98,-3.81,0,,8.99,11.67,False,False
02-02-2026 12:00,ANGEN,11.47,11.68,11.47,11.67,421902.0,0.01,0.2,0.02,1150.0,0.2,239422.3,76.22,0.05,True,52.49,-0.03,-0.03,-0.0,2026-02-02,11.65,0.17,0,,11.32,12.0,False,False
02-02-2026 11:00,ZERGY,16.02,16.66,16.02,16.56,8179007.0,0.1,0.54,0.04,1185.71,0.54,4604272.1,77.64,0.19,True,77.92,0.38,0.39,-0.01,2026-02-02,15.66,5.75,0,,ATL,ATH,False,False
02-02-2026 11:00,BESLR,14.12,14.44,14.1,14.39,561534.0,0.05,0.27,0.02,1073.91,0.27,346295.5,62.15,0.19,True,49.17,-0.06,-0.06,-0.01,2026-02-02,14.34,0.35,0,,14.01,14.61,True,True
02-02-2026 11:00,BOBET,20.64,21.08,20.6,21.02,857170.0,0.06,0.38,0.02,2011.11,0.38,434899.6,97.1,0.16,True,46.23,-0.15,-0.14,-0.01,2026-02-02,20.92,0.48,0,,20.52,21.8,True,True
02-02-2026 11:00,MACKO,26.0,28.34,25.8,27.9,2315112.0,0.44,1.9,0.19,879.38,1.9,322874.3,617.03,0.23,True,78.24,0.05,-0.12,0.17,2026-02-02,25.78,8.22,0,,25.64,ATH,True,False
02-02-2026 10:00,BRKVY,116.4,123.9,114.6,121.8,730462.0,2.1,5.4,0.65,730.77,5.4,202630.9,260.49,0.39,True,69.85,0.54,-0.27,0.81,2026-02-02,116.0,5.0,1,123.9,111.7,123.9,False,False
02-02-2026 10:00,MAGEN,41.0,42.3,40.8,42.06,1597120.0,0.24,1.06,0.16,562.5,1.06,565640.5,182.36,0.23,True,64.87,0.19,0.07,0.12,2026-02-02,41.3,1.84,0,,39.12,ATH,False,False
02-02-2026 10:00,GOKNR,22.62,23.48,22.36,23.26,6246878.0,0.22,0.64,0.08,742.11,0.64,1525225.0,309.57,0.34,True,73.58,0.21,0.13,0.08,2026-02-02,22.68,2.56,1,23.48,21.68,23.48,False,False
30-01-2026 17:00,GIPTA,59.15,60.4,58.95,60.35,545270.0,0.05,1.2,0.02,5900.0,1.2,327853.5,66.32,0.04,True,50.83,-0.49,-0.49,0.0,2026-01-30,60.0,0.58,0,,58.7,63.8,True,True
30-01-2026 17:00,ANHYT,118.1,120.7,118.0,120.3,605359.0,0.4,2.2,0.32,587.5,2.2,200610.1,201.76,0.18,True,69.46,0.52,0.24,0.28,2026-01-30,116.6,3.17,0,,115.2,ATH,False,False
30-01-2026 17:00,GENTS,12.43,12.86,12.42,12.75,4533299.0,0.11,0.32,0.01,3900.0,0.32,1278205.0,254.66,0.34,True,57.34,-0.01,-0.03,0.02,2026-01-30,12.63,0.95,0,,12.2,13.01,False,False
30-01-2026 17:00,GSDHO,4.93,5.04,4.93,5.02,5450942.0,0.02,0.09,0.02,373.68,0.09,1564488.5,248.42,0.22,True,74.85,0.02,0.0,0.02,2026-01-30,4.8,4.58,0,,4.75,ATH,False,False
30-01-2026 17:00,AHSGY,22.82,24.0,22.76,24.0,411666.0,0.0,1.18,0.11,935.09,1.18,117103.9,251.54,0.0,True,66.08,0.02,-0.03,0.05,2026-01-30,23.0,4.35,0,,21.72,24.28,False,False
30-01-2026 16:00,BAGFS,28.3,30.44,28.08,30.42,2518077.0,0.02,2.12,0.26,703.03,2.12,364467.2,590.89,0.01,True,83.92,0.25,0.08,0.17,2026-01-30,27.72,9.74,0,,27.32,ATH,False,False
30-01-2026 16:00,HURGZ,5.55,5.76,5.55,5.74,5494779.0,0.02,0.19,0.03,578.57,0.19,1078996.7,409.25,0.11,True,76.56,0.06,0.04,0.02,2026-01-30,5.39,6.49,0,,5.33,ATH,False,False
30-01-2026 13:00,TERA,203.9,207.3,203.1,207.1,2298044.0,0.2,3.2,0.43,644.19,3.2,1181975.0,94.42,0.06,True,82.34,2.29,2.03,0.26,2026-01-30,202.0,2.52,0,,ATL,ATH,False,False
30-01-2026 13:00,ELITE,31.2,32.9,31.14,32.84,1914266.0,0.06,1.64,0.21,666.36,1.64,460358.9,315.82,0.04,True,83.74,0.27,0.09,0.18,2026-01-30,30.5,7.67,0,,30.38,ATH,False,False
30-01-2026 12:00,SEYKM,5.3,5.53,5.3,5.52,910771.0,0.01,0.22,0.03,547.06,0.22,280352.8,224.87,0.05,True,62.43,-0.0,-0.03,0.02,2026-01-30,5.26,4.94,0,,5.1,ATH,False,False
30-01-2026 11:00,ENKAI,95.3,98.2,95.15,97.65,5591353.0,0.55,2.35,0.5,365.35,2.35,2641769.7,111.65,0.23,True,82.18,2.04,1.88,0.16,2026-01-30,94.05,3.83,1,98.2,ATL,98.2,False,False
30-01-2026 11:00,GEDIK,5.93,5.97,5.89,5.96,949766.0,0.01,0.03,0.01,400.0,0.03,499342.7,90.2,0.33,True,55.5,-0.0,-0.01,0.0,2026-01-30,5.91,0.85,0,,5.88,5.98,False,False
30-01-2026 10:00,BURCE,59.7,63.4,59.0,63.35,3123563.0,0.05,3.65,0.95,284.21,3.65,777639.3,301.67,0.01,True,78.54,1.33,0.47,0.86,2026-01-30,58.0,9.22,0,,51.55,ATH,False,False
30-01-2026 10:00,YATAS,46.76,48.84,46.44,48.66,656818.0,0.18,1.9,0.19,889.58,1.9,169664.2,287.13,0.09,True,73.6,0.35,0.18,0.17,2026-01-30,46.76,4.06,1,48.84,43.82,48.84,False,False
30-01-2026 10:00,TMSN,112.6,118.3,112.0,117.0,1596296.0,1.3,4.4,0.7,528.57,4.4,322766.2,394.57,0.3,True,90.23,1.28,0.62,0.66,2026-01-30,111.1,5.31,1,118.3,107.2,118.3,False,False
30-01-2026 10:00,PINSU,11.24,11.99,11.24,11.92,8520661.0,0.07,0.68,0.08,783.12,0.68,1223349.9,596.5,0.1,True,85.02,0.03,-0.02,0.05,2026-01-30,11.24,6.05,0,,11.13,ATH,False,False
30-01-2026 10:00,ETILR,3.98,4.06,3.92,4.04,3904419.0,0.02,0.06,0.0,1900.0,0.06,1046770.7,273.0,0.33,True,67.97,0.01,0.01,0.0,2026-01-30,3.95,2.28,2,3.92,3.92,ATH,False,False
29-01-2026 17:00,TUPRS,244.5,248.3,244.5,247.8,4579257.0,0.5,3.3,0.35,842.86,3.3,3022745.2,51.49,0.15,True,77.66,3.58,3.36,0.22,2026-01-29,242.2,2.31,0,,223.1,ATH,False,False
29-01-2026 17:00,SANFM,7.47,7.68,7.45,7.68,2615907.0,0.0,0.21,0.01,3400.0,0.21,927976.5,181.89,0.0,True,62.43,-0.01,-0.01,0.0,2026-01-29,7.6,1.05,1,7.68,ATL,8.0,False,False
29-01-2026 17:00,BULGS,45.0,47.62,44.86,47.4,7337972.0,0.22,2.4,0.15,1478.95,2.4,1457448.9,403.48,0.09,True,68.36,0.06,-0.05,0.11,2026-01-29,45.4,4.41,0,,44.7,ATH,False,False
29-01-2026 17:00,ALKLC,240.7,269.75,240.5,262.0,241098.0,7.75,21.3,1.43,1389.51,21.3,126021.3,91.32,0.36,True,72.62,0.94,0.93,0.0,2026-01-29,247.7,5.77,0,,240.0,ATH,False,False
29-01-2026 17:00,CWENE,31.12,35.08,30.78,35.08,10472947.0,0.0,3.96,0.34,1078.57,3.96,2741872.5,281.96,0.0,True,81.81,0.16,-0.02,0.18,2026-01-29,31.9,9.97,2,30.78,30.78,ATH,False,False
29-01-2026 16:00,TRALT,57.6,59.5,57.55,59.35,30298848.0,0.15,1.75,0.21,733.33,1.75,15613350.5,94.06,0.09,True,73.7,0.96,0.71,0.25,2026-01-29,54.95,8.01,1,59.5,ATL,59.5,False,False
29-01-2026 16:00,MOGAN,8.93,8.99,8.9,8.99,1267425.0,0.0,0.06,0.02,300.0,0.06,740713.9,71.11,0.0,True,72.44,0.02,0.01,0.01,2026-01-29,8.87,1.35,0,,8.75,ATH,False,False
29-01-2026 16:00,POLHO,18.63,18.88,18.45,18.85,888272.0,0.03,0.22,0.02,900.0,0.22,373089.9,138.09,0.14,True,55.98,-0.03,-0.03,-0.0,2026-01-29,18.53,1.73,1,18.88,18.21,18.88,False,False
29-01-2026 15:00,KMPUR,15.78,16.21,15.77,16.14,1749333.0,0.07,0.36,0.04,718.18,0.36,456695.8,283.04,0.19,True,73.96,0.02,-0.0,0.03,2026-01-29,15.76,2.41,0,,15.63,ATH,False,False
29-01-2026 15:00,AKSA,10.7,10.89,10.67,10.84,11204219.0,0.05,0.14,0.03,337.5,0.14,3530732.1,217.33,0.36,True,74.05,0.04,0.01,0.02,2026-01-29,10.56,2.65,1,10.89,10.49,10.89,False,False
29-01-2026 14:00,TURSG,11.83,12.08,11.79,12.03,20884572.0,0.05,0.2,0.04,376.19,0.2,8956630.3,133.17,0.25,True,65.69,0.01,-0.04,0.05,2026-01-29,11.65,3.26,0,,11.4,12.23,False,False
29-01-2026 14:00,AEFES,18.64,19.02,18.61,18.99,15682235.0,0.03,0.35,0.04,733.33,0.35,7423941.6,111.24,0.09,True,78.86,0.14,0.1,0.03,2026-01-29,18.57,2.26,0,,17.8,ATH,False,False
29-01-2026 14:00,TSKB,13.8,14.01,13.78,13.99,11751971.0,0.02,0.19,0.06,222.03,0.19,6294070.7,86.71,0.11,True,85.39,0.16,0.1,0.06,2026-01-29,13.45,4.01,0,,12.99,ATH,False,False
29-01-2026 13:00,AHGAZ,26.04,26.96,26.02,26.84,3446086.0,0.12,0.8,0.07,1011.11,0.8,1065569.2,223.4,0.15,True,70.32,0.06,0.02,0.04,2026-01-29,25.56,5.01,0,,25.42,ATH,False,False
29-01-2026 13:00,OYAKC,27.34,27.84,27.32,27.76,7162064.0,0.08,0.42,0.04,900.0,0.42,4644223.5,54.21,0.19,True,63.15,0.03,0.01,0.02,2026-01-29,27.24,1.91,0,,26.84,27.8,False,False
29-01-2026 13:00,ANSGR,27.94,28.5,27.9,28.4,4581810.0,0.1,0.46,0.05,858.33,0.46,2305604.4,98.72,0.22,True,72.47,0.08,0.05,0.03,2026-01-29,27.7,2.53,0,,27.54,ATH,False,False
29-01-2026 11:00,SEGMN,34.34,36.32,34.22,36.32,2135660.0,0.0,1.98,0.12,1522.95,1.98,837781.4,154.92,0.0,True,70.25,0.45,0.32,0.13,2026-01-29,33.02,9.99,0,,30.3,ATH,False,False
29-01-2026 10:00,VAKBN,35.78,36.24,35.4,36.18,10048096.0,0.06,0.4,0.13,198.51,0.4,4209392.1,138.71,0.15,True,80.83,0.26,0.15,0.11,2026-01-29,35.5,1.92,0,,33.74,ATH,False,False
29-01-2026 10:00,ISMEN,46.5,47.64,46.24,47.36,4234324.0,0.28,0.86,0.15,473.33,0.86,1454170.8,191.18,0.33,True,78.53,0.23,0.06,0.17,2026-01-29,46.08,2.78,0,,44.76,ATH,False,False
29-01-2026 10:00,ENTRA,10.88,11.26,10.88,11.16,7828615.0,0.1,0.28,0.02,1373.68,0.28,2141573.5,265.55,0.36,True,64.41,-0.02,-0.03,0.01,2026-01-29,10.8,3.33,0,,10.79,11.3,False,False
28-01-2026 17:00,RGYAS,163.8,164.8,163.4,164.8,234096.0,0.0,1.0,0.36,177.78,1.0,109377.1,114.03,0.0,True,84.08,1.41,1.21,0.19,2026-01-28,161.3,2.17,0,,ATL,ATH,False,False
28-01-2026 17:00,ICBCT,14.0,14.07,13.99,14.06,247229.0,0.01,0.06,0.01,400.0,0.06,137253.7,80.13,0.17,True,57.88,-0.01,-0.02,0.01,2026-01-28,13.88,1.3,0,,13.85,ATH,False,False
28-01-2026 17:00,TEZOL,12.6,13.05,12.57,12.96,3827702.0,0.09,0.36,0.06,462.5,0.36,1021592.2,274.68,0.25,True,77.34,0.05,0.0,0.05,2026-01-28,12.28,5.54,1,13.05,12.2,13.05,False,False
28-01-2026 13:00,MTRKS,23.76,24.54,23.7,24.42,306073.0,0.12,0.66,0.06,1000.0,0.66,149811.9,104.3,0.18,True,65.17,0.03,-0.0,0.03,2026-01-28,23.66,3.21,0,,23.4,ATH,False,False
28-01-2026 13:00,NETAS,67.35,71.95,67.15,71.0,601144.0,0.95,3.65,0.43,739.08,3.65,366959.6,63.82,0.26,True,77.94,1.26,0.94,0.32,2026-01-28,68.4,3.8,0,,61.7,ATH,False,False
28-01-2026 10:00,EUPWR,41.28,41.86,40.8,41.7,2813909.0,0.16,0.42,0.01,6900.0,0.42,1154449.0,143.74,0.38,True,54.3,-0.01,-0.02,0.02,2026-01-28,41.2,1.21,2,40.8,40.8,ATH,False,False
28-01-2026 10:00,EKOS,6.05,6.19,6.04,6.16,3691001.0,0.03,0.11,0.0,1.2384898975268888e+17,0.11,1452649.1,154.09,0.27,True,62.23,-0.0,-0.0,0.0,2026-01-28,6.04,1.99,0,,6.0,6.23,False,False
28-01-2026 10:00,NATEN,8.7,9.18,8.66,9.17,10307493.0,0.01,0.47,0.03,1640.74,0.47,1929007.4,434.34,0.02,True,74.39,0.01,-0.0,0.01,2026-01-28,8.64,6.13,0,,8.64,ATH,False,False
28-01-2026 10:00,CUSAN,28.28,29.92,28.1,29.68,3276773.0,0.24,1.4,0.14,900.0,1.4,496900.2,559.44,0.17,True,96.22,0.69,0.49,0.2,2026-01-28,27.2,9.12,1,29.92,ATL,29.92,False,False
28-01-2026 10:00,DOKTA,25.16,27.5,25.16,27.2,1338316.0,0.3,2.04,0.2,920.0,2.04,208007.5,543.4,0.15,True,91.11,0.19,0.09,0.1,2026-01-28,25.18,8.02,0,,ATL,ATH,False,False
28-01-2026 10:00,LKMNH,18.0,18.28,17.99,18.28,632013.0,0.0,0.28,0.03,937.04,0.28,201247.4,214.05,0.0,True,87.61,0.11,0.04,0.07,2026-01-28,17.26,5.91,0,,17.18,ATH,False,False
28-01-2026 10:00,ISSEN,7.64,7.68,7.61,7.68,178229.0,0.0,0.04,0.0,3900.0,0.04,77466.5,130.07,0.0,True,66.71,0.0,-0.0,0.0,2026-01-28,7.61,0.92,0,,ATL,ATH,False,False
27-01-2026 17:00,IHLGM,2.09,2.1,2.08,2.1,5315980.0,0.0,0.01,0.0,900.0,0.01,2391726.5,122.27,0.0,True,39.74,-0.0,-0.0,-0.0,2026-01-27,2.1,0.0,2,2.08,2.08,ATH,False,False
27-01-2026 16:00,ARFYE,31.18,32.42,30.8,32.34,6320595.0,0.08,1.16,0.18,551.69,1.16,3300099.4,91.53,0.07,True,66.48,0.07,-0.03,0.11,2026-01-27,30.32,6.66,1,32.42,30.0,32.42,False,False
27-01-2026 16:00,TNZTP,26.92,28.22,26.92,27.94,1362234.0,0.28,1.02,0.1,920.0,1.02,453404.8,200.45,0.27,True,60.41,-0.02,-0.07,0.04,2026-01-27,27.32,2.27,0,,26.44,ATH,False,False
27-01-2026 15:00,CEMTS,11.75,12.4,11.73,12.27,6597186.0,0.13,0.52,0.05,940.0,0.52,1086016.7,507.47,0.25,True,84.32,0.03,0.01,0.02,2026-01-27,11.8,3.98,0,,11.65,ATH,False,False
27-01-2026 15:00,SKTAS,4.09,4.13,4.08,4.13,1692388.0,0.0,0.04,0.01,566.67,0.04,806564.3,109.83,0.0,True,62.25,0.0,0.0,0.0,2026-01-27,4.05,1.98,0,,ATL,ATH,False,False
27-01-2026 13:00,YIGIT,25.82,26.5,25.68,26.44,1954745.0,0.06,0.62,0.06,868.75,0.62,468167.2,317.53,0.1,True,83.58,0.05,0.02,0.03,2026-01-27,25.8,2.48,0,,ATL,ATH,False,False
27-01-2026 12:00,CELHA,12.1,12.48,12.04,12.39,2052525.0,0.09,0.29,0.03,866.67,0.29,709702.7,189.21,0.31,True,70.84,0.05,0.03,0.02,2026-01-27,11.96,3.6,1,12.48,ATL,12.48,False,False
27-01-2026 12:00,ENERY,10.24,10.7,10.21,10.59,14501743.0,0.11,0.35,0.04,797.44,0.35,4333985.5,234.61,0.31,True,91.56,0.04,0.01,0.02,2026-01-27,10.15,4.33,0,,10.01,ATH,False,False
27-01-2026 12:00,INDES,8.32,8.43,8.32,8.41,664214.0,0.02,0.09,0.01,1400.0,0.09,435532.5,52.51,0.22,True,62.04,-0.0,-0.0,0.0,2026-01-27,8.35,0.72,0,,8.23,ATH,False,False
27-01-2026 11:00,DCTTR,8.04,8.43,8.04,8.39,5710088.0,0.04,0.35,0.06,514.04,0.35,1396296.3,308.95,0.11,True,95.74,0.03,0.01,0.02,2026-01-27,8.01,4.74,0,,ATL,ATH,False,False
27-01-2026 11:00,MIATK,38.66,39.66,38.48,39.56,11717529.0,0.1,0.9,0.2,354.55,0.9,6200563.7,88.98,0.11,True,84.77,0.15,0.08,0.07,2026-01-27,38.08,3.89,0,,ATL,ATH,False,False
27-01-2026 11:00,KZGYO,26.42,27.2,26.2,27.12,487288.0,0.08,0.7,0.04,1650.0,0.7,222577.8,118.93,0.11,True,56.08,-0.02,-0.02,-0.0,2026-01-27,26.96,0.59,2,26.2,26.2,ATH,False,False
27-01-2026 10:00,BORSK,6.95,7.38,6.88,7.26,13217227.0,0.12,0.31,0.03,839.39,0.31,3944856.7,235.05,0.39,True,76.69,0.01,0.0,0.01,2026-01-27,6.97,4.16,0,,ATL,ATH,False,False
27-01-2026 10:00,KONTR,9.61,9.8,9.61,9.78,25561273.0,0.02,0.17,0.01,1600.0,0.17,7427340.4,244.15,0.12,True,80.71,0.01,0.0,0.01,2026-01-27,9.59,1.98,0,,ATL,ATH,False,False
27-01-2026 10:00,TRILC,18.82,19.96,18.64,19.87,3640078.0,0.09,1.05,0.12,813.04,1.05,1037783.5,250.76,0.09,True,94.17,0.07,0.03,0.04,2026-01-27,18.82,5.58,0,,ATL,ATH,False,False
27-01-2026 10:00,ATATP,161.3,168.8,160.2,166.7,983142.0,2.1,5.4,0.67,705.97,5.4,212590.0,362.46,0.39,True,83.43,0.42,0.16,0.26,2026-01-27,161.0,3.54,0,,ATL,ATH,False,False
26-01-2026 13:00,YESIL,2.02,2.1,2.01,2.09,17819234.0,0.01,0.07,0.0,2233.33,0.07,5717659.7,211.65,0.14,True,59.95,-0.0,-0.0,0.0,2026-01-26,2.03,2.96,0,,1.98,ATH,False,False
26-01-2026 11:00,PENGD,8.27,8.39,8.27,8.38,1597137.0,0.01,0.11,0.01,1122.22,0.11,617090.2,158.82,0.09,True,74.21,0.01,-0.0,0.01,2026-01-26,8.15,2.82,0,,8.1,ATH,False,False
26-01-2026 10:00,DENGE,3.07,3.12,3.06,3.12,12650486.0,0.0,0.05,0.01,525.0,0.05,2999759.1,321.72,0.0,True,75.79,0.0,-0.0,0.0,2026-01-26,3.05,2.3,0,,ATL,ATH,False,False
26-01-2026 10:00,ARENA,30.4,31.38,29.94,31.16,678304.0,0.22,0.76,0.1,630.77,0.76,221234.8,206.6,0.29,True,75.57,0.06,0.03,0.04,2026-01-26,30.26,2.97,1,31.38,ATL,31.38,False,False
23-01-2026 14:00,GLYHO,13.66,14.01,13.66,13.93,6507515.0,0.08,0.27,0.03,718.18,0.27,1695406.5,283.83,0.3,True,69.91,0.07,0.05,0.02,2026-01-23,13.67,1.9,0,,ATL,ATH,False,False
