Tarih,Hisse,open,high,low,close,volume,YuksekKapanis_Fark,AcilisKapanis_Fark,AcilisKapanisFark_Ort,AcilisKapanisFark_OrtalamayaGoreDegisim,AcilisKapanisFarkOrt_MaxSon10,HacimOrtalama,%Hacim_HacimOrtalama,Fark_Orani,Kosul,rsi,MACD_12_26_9,MACDs_12_26_9,MACDh_12_26_9,Tarih1,%Deg,isPivot,pointpos,destek,direnc,Tsinyal_Banker_Dip,Tsinyal_Banker_DipKarar
02-02-2026 09:00,HKTM,11.83,14.95,11.51,14.2,56845122.0,0.75,2.37,0.2,1085.0,2.37,17785505.7,219.61,0.32,True,62.06,-0.08,-0.26,0.17,2026-02-02,19.73,0,,11.4,16.85,False,False
02-02-2026 09:00,THYAO,300.25,324.5,298.0,322.5,378930590.0,2.0,22.25,5.05,340.59,22.25,229542418.5,65.08,0.09,True,63.7,0.63,-3.78,4.41,2026-02-02,6.09,0,,249.2,346.25,False,False
02-02-2026 09:00,EUYO,15.35,18.39,15.23,17.84,3929855.0,0.55,2.49,0.59,323.47,2.49,1880711.3,108.96,0.22,True,70.59,0.92,0.63,0.29,2026-02-02,14.43,0,,12.3,ATH,False,False
02-02-2026 09:00,FORMT,2.96,3.8,2.96,3.71,1366412264.0,0.09,0.75,0.01,12400.0,0.75,335644089.5,307.1,0.12,True,54.54,-0.15,-0.11,-0.04,2026-02-02,26.62,0,,2.66,4.61,False,False
02-02-2026 09:00,BLCYT,39.5,47.3,38.56,46.26,15156868.0,1.04,6.76,1.78,279.78,6.76,7768094.9,95.12,0.15,True,80.38,4.93,3.97,0.96,2026-02-02,16.23,0,,13.52,ATH,False,False
02-02-2026 09:00,DEVA,66.85,76.0,65.65,75.05,6728397.0,0.95,8.2,1.41,481.56,8.2,3195245.4,110.58,0.12,True,68.37,0.9,0.12,0.77,2026-02-02,12.27,0,,59.2,81.3,False,False
02-02-2026 09:00,OZYSR,42.38,51.45,41.28,50.2,11069149.0,1.25,7.82,0.19,4015.79,7.82,5877355.0,88.34,0.16,True,70.87,3.78,3.65,0.13,2026-02-02,17.95,0,,30.5,51.0,False,False
02-02-2026 09:00,ARCLK,113.5,124.1,111.1,123.0,39096251.0,1.1,9.5,1.2,691.67,9.5,20283766.1,92.75,0.12,True,57.29,-2.05,-3.95,1.9,2026-02-02,7.89,0,,103.1,147.5,True,False
02-02-2026 09:00,ISDMR,40.2,43.5,38.82,43.48,22559785.0,0.02,3.28,0.81,303.94,3.28,13076468.7,72.52,0.01,True,70.55,0.77,0.07,0.69,2026-02-02,6.78,0,,33.26,44.66,False,False
02-02-2026 09:00,BURVA,580.0,899.0,580.0,818.5,875482.0,80.5,238.5,48.18,395.07,238.5,477018.7,83.53,0.34,True,75.5,141.5,112.46,29.04,2026-02-02,42.22,0,,89.5,ATH,False,False
02-02-2026 09:00,AYES,18.16,22.14,18.03,22.14,881555.0,0.0,3.98,0.61,549.27,3.98,538548.9,63.69,0.0,True,75.25,1.47,1.16,0.31,2026-02-02,18.71,0,,13.66,ATH,False,False
02-02-2026 09:00,TEZOL,12.79,13.88,12.59,13.71,29014466.0,0.17,0.92,0.15,505.26,0.92,16843308.7,72.26,0.18,True,51.72,-0.74,-0.99,0.25,2026-02-02,7.11,0,,13.67,21.86,True,False
02-02-2026 09:00,SANEL,31.92,44.46,31.0,42.28,4159687.0,2.18,10.36,0.67,1455.56,10.36,2074097.7,100.55,0.21,True,59.41,2.45,2.56,-0.11,2026-02-02,32.12,0,,25.9,48.88,False,False
02-02-2026 09:00,HUBVC,3.04,3.67,3.01,3.63,41386586.0,0.04,0.59,0.11,422.12,0.59,24427631.3,69.43,0.07,True,65.15,0.15,0.12,0.02,2026-02-02,17.48,0,,1.53,4.07,False,False
02-02-2026 09:00,SEKUR,3.54,4.89,3.45,4.71,29589372.0,0.18,1.17,0.09,1229.55,1.17,10919851.3,170.97,0.15,True,57.21,-0.19,-0.22,0.03,2026-02-02,33.43,0,,4.05,5.74,True,True
02-02-2026 09:00,SEKFK,8.99,10.68,8.65,10.3,9554913.0,0.38,1.31,0.2,558.29,1.31,3650086.1,161.77,0.29,True,70.12,0.21,0.09,0.12,2026-02-02,14.32,0,,7.75,10.4,False,False
26-01-2026 09:00,SOKE,11.75,13.05,11.55,12.94,33226446.0,0.11,1.19,0.15,704.05,1.19,9180764.1,261.91,0.09,True,64.43,-0.04,-0.19,0.15,2026-01-26,11.46,0,,9.89,13.9,False,False
26-01-2026 09:00,ENKAI,84.0,98.2,82.35,97.85,107678738.0,0.35,13.85,1.86,644.62,13.85,57557803.3,87.08,0.03,True,80.14,5.29,4.17,1.12,2026-01-26,16.35,0,,46.52,ATH,False,False
26-01-2026 09:00,MEPET,19.57,24.78,18.91,24.1,5505041.0,0.68,4.53,0.87,418.31,4.53,2884553.6,90.85,0.15,True,75.32,1.98,1.46,0.51,2026-01-26,13.68,0,,7.3,ATH,False,False
26-01-2026 09:00,ATLAS,6.32,8.87,6.22,8.87,12109125.0,0.0,2.55,0.28,807.47,2.55,4675972.9,158.96,0.0,True,76.13,0.3,0.13,0.17,2026-01-26,42.15,0,,5.49,ATH,False,False
26-01-2026 09:00,TARKM,360.0,440.25,352.75,440.25,2463721.0,0.0,80.25,9.05,786.74,80.25,1068972.5,130.48,0.0,True,65.2,-2.71,-7.69,4.98,2026-01-26,21.95,0,,288.25,508.0,False,False
26-01-2026 09:00,SAHOL,96.4,110.8,95.65,109.5,275175805.0,1.3,13.1,2.82,365.36,13.1,180078169.8,52.81,0.1,True,71.39,3.04,0.34,2.7,2026-01-26,12.42,0,,73.9,109.9,False,False
26-01-2026 09:00,CVKMD,32.96,42.24,32.7,40.2,296809135.0,2.04,7.24,2.38,204.46,7.24,151447926.3,95.98,0.28,True,87.3,4.99,3.36,1.63,2026-01-26,21.97,0,,8.42,ATH,False,False
26-01-2026 09:00,PNSUT,11.7,12.96,11.18,12.96,26348438.0,0.0,1.26,0.15,751.35,1.26,9864208.8,167.11,0.0,True,61.02,0.13,0.17,-0.04,2026-01-26,10.77,0,,10.53,15.52,False,False
26-01-2026 09:00,TSKB,13.15,14.24,12.96,14.06,294486574.0,0.18,0.91,0.15,494.77,0.91,153959108.9,91.28,0.2,True,58.35,0.19,0.11,0.08,2026-01-26,6.35,0,,11.24,14.73,False,False
26-01-2026 09:00,CEMAS,4.4,5.95,4.34,5.82,442256272.0,0.13,1.42,0.05,2529.63,1.42,160984240.0,174.72,0.09,True,53.1,-0.59,-0.59,0.0,2026-01-26,32.27,0,,2.56,12.27,True,True
26-01-2026 09:00,AYGAZ,218.1,239.8,217.4,239.8,3336254.0,0.0,21.7,2.23,873.09,21.7,1843718.9,80.95,0.0,True,72.95,15.01,14.07,0.94,2026-01-26,9.95,0,,119.9,ATH,False,False
26-01-2026 09:00,ULUUN,7.12,7.5,7.08,7.46,38907558.0,0.04,0.34,0.02,1316.67,0.34,16274908.8,139.06,0.12,True,55.95,-0.05,-0.05,-0.0,2026-01-26,5.37,0,,5.3,8.9,False,False
26-01-2026 09:00,SKBNK,7.95,9.16,7.94,9.14,362665747.0,0.02,1.19,0.08,1465.79,1.19,206818325.0,75.35,0.02,True,67.34,0.5,0.52,-0.02,2026-01-26,14.97,0,,4.4,ATH,False,False
26-01-2026 09:00,XU030,14126.98,15310.42,14079.76,15127.98,33730439327.0,182.44,1001.0,294.49,239.91,1001.0,17781385506.6,89.7,0.18,True,77.42,686.52,406.23,280.29,2026-01-26,6.53,0,,10899.61,ATH,False,False
26-01-2026 09:00,EUHOL,12.0,15.0,12.0,14.5,7506861.0,0.5,2.5,0.27,812.41,2.5,3601393.3,108.44,0.2,True,65.67,0.31,0.06,0.25,2026-01-26,22.88,0,,9.27,15.86,False,False
26-01-2026 09:00,AKCNS,162.2,205.0,160.6,194.2,17851949.0,10.8,32.0,6.46,395.36,32.0,4804718.0,271.55,0.34,True,74.41,7.82,2.17,5.65,2026-01-26,19.58,0,,121.8,217.8,False,False
26-01-2026 09:00,AKSA,10.2,11.08,10.14,11.08,180605587.0,0.0,0.88,0.05,1625.49,0.88,86421190.9,108.98,0.0,True,56.54,-0.07,-0.04,-0.03,2026-01-26,8.63,0,,8.57,12.65,False,False
26-01-2026 09:00,ISFIN,19.11,21.96,19.07,21.58,25716894.0,0.38,2.47,0.16,1443.75,2.47,12841114.3,100.27,0.15,True,67.75,1.0,1.02,-0.02,2026-01-26,12.93,0,,15.84,ATH,False,False
26-01-2026 09:00,XU100,12929.33,13906.51,12886.22,13838.29,53612505120.0,68.22,908.96,265.4,242.48,908.96,30985620404.1,73.02,0.08,True,78.76,651.91,407.89,244.03,2026-01-26,6.51,0,,10053.74,ATH,False,False
26-01-2026 09:00,YATAS,43.4,48.84,43.24,48.06,9658121.0,0.78,4.66,1.22,281.34,4.66,6334072.3,52.48,0.17,True,80.22,3.42,2.62,0.8,2026-01-26,10.74,0,,30.48,ATH,False,False
26-01-2026 09:00,ALBRK,8.44,9.3,8.37,9.24,219868709.0,0.06,0.8,0.12,561.16,0.8,101370430.7,116.9,0.08,True,66.33,0.22,0.16,0.06,2026-01-26,9.48,0,,7.42,9.52,False,False
26-01-2026 09:00,KLYPV,56.8,61.75,56.55,60.6,14304048.0,1.15,3.8,0.22,1627.27,3.8,8618782.8,65.96,0.3,True,50.82,-1.48,-1.78,0.3,2026-01-26,6.69,0,,52.6,74.45,True,True
26-01-2026 09:00,GARAN,149.4,162.0,146.3,161.3,263800223.0,0.7,11.9,2.71,339.11,11.9,171599219.9,53.73,0.06,True,66.21,5.52,3.8,1.73,2026-01-26,6.61,0,,115.4,ATH,False,False
19-01-2026 09:00,KLKIM,37.64,41.7,36.86,41.26,20922544.0,0.44,3.62,0.91,296.06,3.62,10793626.5,93.84,0.12,True,70.51,1.5,0.78,0.72,2026-01-19,10.62,0,,29.98,ATH,False,False
19-01-2026 09:00,BVSAN,105.1,137.5,104.8,129.5,13797063.0,8.0,24.4,1.9,1184.21,24.4,4904313.9,181.33,0.33,True,64.09,0.8,0.96,-0.16,2026-01-19,24.04,0,,80.9,155.6,False,False
19-01-2026 09:00,GLRMK,185.6,203.5,176.1,198.6,12214332.0,4.9,13.0,2.13,510.33,13.0,6090834.7,100.54,0.38,True,62.97,5.66,5.28,0.38,2026-01-19,7.41,0,,160.8,204.7,False,False
19-01-2026 09:00,INTEM,291.0,337.0,285.75,337.0,898965.0,0.0,46.0,7.55,509.27,46.0,492585.5,82.5,0.0,True,67.98,17.79,16.32,1.47,2026-01-19,16.21,0,,162.7,342.0,False,False
19-01-2026 09:00,ISMEN,42.82,45.74,42.12,45.66,50879691.0,0.08,2.84,0.49,484.36,2.84,32858848.3,54.84,0.03,True,60.84,0.51,0.32,0.19,2026-01-19,6.88,0,,38.16,46.8,False,False
19-01-2026 09:00,ALCTL,109.7,126.8,109.2,126.3,5709345.0,0.5,16.6,1.17,1318.8,16.6,2392376.6,138.65,0.03,True,61.1,-0.2,-1.06,0.86,2026-01-19,15.24,0,,102.5,136.0,False,False
19-01-2026 09:00,AYEN,26.18,28.5,25.52,28.26,6163439.0,0.24,2.08,0.2,929.7,2.08,3138479.2,96.38,0.12,True,58.11,-0.22,-0.32,0.09,2026-01-19,9.2,0,,22.2,32.66,False,False
19-01-2026 09:00,GLYHO,12.45,14.2,12.41,14.05,74423409.0,0.15,1.6,0.26,510.69,1.6,44393703.4,67.64,0.09,True,78.93,1.14,1.06,0.08,2026-01-19,13.12,0,,8.11,ATH,False,False
19-01-2026 09:00,BRKSN,7.7,8.46,7.7,8.25,4754087.0,0.21,0.55,0.08,623.68,0.55,2968778.1,60.14,0.38,True,53.74,-0.1,-0.09,-0.01,2026-01-19,5.77,0,,6.34,11.39,False,False
19-01-2026 09:00,SARKY,28.72,35.28,28.52,35.28,303686094.0,0.0,6.56,2.23,194.7,6.56,70187883.2,332.68,0.0,True,92.28,3.95,2.04,1.91,2026-01-19,10.6,0,,10.28,ATH,False,False
19-01-2026 09:00,LMKDC,30.28,32.9,30.26,32.34,48647168.0,0.56,2.06,0.32,535.8,2.06,20300293.3,139.64,0.27,True,64.47,0.55,0.1,0.45,2026-01-19,8.6,0,,23.84,35.18,False,False
19-01-2026 09:00,BORSK,6.09,7.1,6.09,6.96,159804085.0,0.14,0.87,0.08,1060.0,0.87,71692781.7,122.9,0.16,True,64.98,0.17,0.11,0.06,2026-01-19,14.47,0,,5.35,8.26,False,False
19-01-2026 09:00,INDES,7.74,8.34,7.62,8.2,55412335.0,0.14,0.46,0.04,1021.95,0.46,33507223.6,65.37,0.3,True,58.18,0.03,0.02,0.01,2026-01-19,7.33,0,,5.88,8.87,False,False
19-01-2026 09:00,GOZDE,23.5,25.16,23.1,25.16,17493260.0,0.0,1.66,0.3,449.67,1.66,8628291.3,102.74,0.0,True,66.97,0.68,0.4,0.28,2026-01-19,7.61,0,,19.15,28.34,False,False
19-01-2026 09:00,EPLAS,6.08,7.78,5.84,7.63,128352623.0,0.15,1.55,0.13,1101.55,1.55,31518446.0,307.23,0.1,True,67.83,-0.03,-0.09,0.06,2026-01-19,37.73,0,,4.41,8.9,False,False
19-01-2026 09:00,IHAAS,42.5,58.85,41.52,57.7,14853080.0,1.15,15.2,1.6,848.81,15.2,4293029.2,245.98,0.08,True,73.88,3.76,2.88,0.88,2026-01-19,37.38,0,,29.04,ATH,False,False
19-01-2026 09:00,MERKO,14.35,16.24,14.16,15.72,53431345.0,0.52,1.37,0.16,772.61,1.37,23609907.7,126.31,0.38,True,60.61,-0.04,-0.25,0.2,2026-01-19,9.7,0,,12.38,16.87,False,False
12-01-2026 09:00,SEGMN,19.6,28.94,19.2,28.94,38802011.0,0.0,9.34,0.78,1094.37,9.34,13445264.6,188.59,0.0,True,69.47,-0.33,-0.83,0.5,2026-01-12,47.5,0,,18.0,ATH,False,False
12-01-2026 09:00,BRSAN,569.0,677.0,568.0,655.5,15894780.0,21.5,86.5,7.75,1016.13,86.5,8477208.3,87.5,0.25,True,73.46,48.41,33.11,15.3,2026-01-12,15.3,0,,297.5,ATH,False,False
12-01-2026 09:00,KRDMB,25.36,28.4,25.22,28.08,15867204.0,0.32,2.72,0.32,755.35,2.72,6771635.6,134.32,0.12,True,59.78,-0.06,-0.3,0.24,2026-01-12,10.99,0,,21.4,30.34,False,False
12-01-2026 09:00,BSOKE,17.74,27.62,17.61,26.98,222261675.0,0.64,9.24,1.1,743.07,9.24,79059818.6,181.13,0.07,True,81.87,1.24,0.44,0.8,2026-01-12,52.52,0,,14.31,ATH,False,False
12-01-2026 09:00,CATES,33.0,37.94,33.0,36.9,10680085.0,1.04,3.9,0.29,1244.83,3.9,4860024.1,119.75,0.27,True,58.7,0.58,0.45,0.13,2026-01-12,11.82,0,,29.46,40.6,False,False
12-01-2026 09:00,CCOLA,63.2,74.05,61.55,74.05,58571512.0,0.0,10.85,1.77,512.99,10.85,33417926.1,75.27,0.0,True,76.29,3.65,1.61,2.04,2026-01-12,18.57,0,,45.14,83.82,False,False
12-01-2026 09:00,ESCAR,25.6,29.5,25.32,28.5,49899255.0,1.0,2.9,0.86,237.6,2.9,27795515.2,79.52,0.34,True,49.34,-4.19,-6.23,2.04,2026-01-12,10.89,0,,18.46,78.5,True,False
12-01-2026 09:00,GESAN,47.78,53.45,47.7,53.0,40815568.0,0.45,5.22,0.28,1738.03,5.22,26058501.5,56.63,0.09,True,62.5,0.77,0.13,0.65,2026-01-12,10.93,0,,41.48,56.8,False,False
12-01-2026 09:00,EBEBK,56.8,62.95,56.75,62.95,5397005.0,0.0,6.15,0.92,568.48,6.15,2760914.8,95.48,0.0,True,68.86,2.02,1.66,0.36,2026-01-12,10.83,0,,49.98,ATH,False,False
12-01-2026 09:00,MEDTR,29.0,32.82,28.28,32.04,12714761.0,0.78,3.04,0.25,1106.35,3.04,3806454.9,234.03,0.26,True,55.7,-0.96,-1.43,0.48,2026-01-12,11.1,0,,26.54,37.96,False,False
12-01-2026 09:00,EGEGY,27.02,31.18,26.18,30.08,21663834.0,1.1,3.06,0.18,1563.04,3.06,10740164.3,101.71,0.36,True,67.19,0.88,0.79,0.09,2026-01-12,12.83,0,,ATL,ATH,False,False
12-01-2026 09:00,LILAK,30.38,34.3,30.38,33.18,65081070.0,1.12,2.8,0.1,2757.14,2.8,27018198.3,140.88,0.4,True,64.9,0.97,0.67,0.3,2026-01-12,10.38,0,,24.66,ATH,False,False
12-01-2026 09:00,FROTO,98.5,107.7,97.85,105.4,117796559.0,2.3,6.9,0.7,885.71,6.9,77856731.2,51.3,0.33,True,59.23,0.35,-0.11,0.46,2026-01-12,7.06,0,,89.7,118.3,False,False
12-01-2026 09:00,KOTON,16.02,17.59,15.9,17.59,25858674.0,0.0,1.57,0.04,3729.27,1.57,13546348.6,90.89,0.0,True,57.39,-0.21,-0.25,0.04,2026-01-12,9.94,0,,14.35,21.14,False,False
12-01-2026 09:00,EUPWR,34.24,40.24,34.24,39.24,104120231.0,1.0,5.0,0.92,444.66,5.0,50280897.5,107.08,0.2,True,68.39,1.55,0.52,1.04,2026-01-12,15.14,0,,25.5,40.18,False,False
12-01-2026 09:00,KRPLS,8.22,10.51,8.09,10.5,52590367.0,0.01,2.28,0.21,990.91,2.28,13864340.9,279.32,0.0,True,72.94,0.27,0.18,0.09,2026-01-12,29.63,0,,7.28,10.55,False,False
12-01-2026 09:00,LIDFA,2.33,2.86,2.31,2.72,206441986.35,0.14,0.39,0.05,608.64,0.39,102853161.76,100.72,0.36,True,71.03,0.13,0.1,0.03,2026-01-12,16.57,0,,1.84,ATH,False,False
12-01-2026 09:00,RNPOL,38.12,48.48,36.24,47.46,4189270.0,1.02,9.34,0.83,1028.02,9.34,2087563.1,100.68,0.11,True,59.92,2.59,2.9,-0.31,2026-01-12,21.88,0,,21.24,57.6,False,False
12-01-2026 09:00,ULKER,115.2,136.1,115.0,135.7,51897310.0,0.4,20.5,2.24,815.18,20.5,27635693.2,87.79,0.02,True,67.9,2.23,0.2,2.04,2026-01-12,18.41,0,,96.5,141.8,False,False
12-01-2026 09:00,ALVES,2.61,3.16,2.59,3.01,542276810.0,0.15,0.4,0.02,2213.95,0.4,304050493.0,78.35,0.37,True,54.99,-0.11,-0.14,0.03,2026-01-12,15.31,0,,2.35,4.23,True,True
12-01-2026 09:00,AKGRT,7.15,8.03,7.08,8.01,119482082.0,0.02,0.86,0.08,961.73,0.86,60143580.6,98.66,0.02,True,66.62,0.22,0.13,0.1,2026-01-12,12.98,0,,5.92,8.44,False,False
12-01-2026 09:00,YYLGD,10.59,12.7,10.55,12.31,89177213.0,0.39,1.72,0.08,2105.13,1.72,27566376.3,223.5,0.23,True,64.26,0.13,0.04,0.09,2026-01-12,17.02,0,,9.35,ATH,False,False
12-01-2026 09:00,TABGD,226.9,258.0,224.3,257.75,6039686.0,0.25,30.85,2.1,1365.56,30.85,3483826.1,73.36,0.01,True,64.58,9.17,9.89,-0.73,2026-01-12,13.55,0,,160.4,ATH,False,False
12-01-2026 09:00,AKFYE,17.28,18.46,17.25,18.46,26757543.0,0.0,1.18,0.08,1452.63,1.18,13587752.9,96.92,0.0,True,58.07,-0.02,-0.1,0.08,2026-01-12,7.58,0,,16.52,20.48,False,False
12-01-2026 09:00,VKFYO,35.68,50.85,35.68,50.2,5891362.0,0.65,14.52,2.74,429.93,14.52,2752564.6,114.03,0.04,True,77.41,5.87,3.68,2.2,2026-01-12,31.34,0,,15.62,ATH,False,False
12-01-2026 09:00,ATATP,131.9,169.9,130.0,165.1,15176296.0,4.8,33.2,1.31,2434.35,33.2,8092954.4,87.52,0.14,True,63.01,9.54,10.83,-1.29,2026-01-12,25.36,0,,123.1,180.6,False,False
12-01-2026 09:00,YEOTK,36.16,40.98,35.62,40.4,41711509.0,0.58,4.24,0.15,2804.11,4.24,27543030.7,51.44,0.14,True,55.41,-0.7,-1.33,0.63,2026-01-12,11.91,0,,32.3,61.1,False,False
12-01-2026 09:00,ASTOR,131.3,157.7,130.7,154.7,211391553.0,3.0,23.4,5.21,348.71,23.4,135231717.2,56.32,0.13,True,77.7,7.31,2.05,5.27,2026-01-12,20.11,0,,88.2,ATH,False,False
05-01-2026 09:00,ALTNY,15.12,16.67,15.11,16.4,154300454.0,0.27,1.28,0.0,361667.91,1.28,91353414.53,68.9,0.21,True,49.95,-0.81,-0.97,0.16,2026-01-05,9.99,0,,14.27,24.38,True,True
05-01-2026 09:00,MTRYO,8.7,11.5,8.51,11.11,7865559.0,0.39,2.41,0.25,864.0,2.41,3680259.7,113.72,0.16,True,68.97,0.5,0.36,0.13,2026-01-05,27.12,0,,7.8,17.5,False,False
05-01-2026 09:00,FORTE,85.5,97.4,84.2,96.25,23012868.0,1.15,10.75,1.43,651.75,10.75,9418239.9,144.34,0.11,True,70.72,4.21,2.85,1.36,2026-01-05,12.84,0,,64.55,ATH,False,False
05-01-2026 09:00,DOAS,193.0,213.8,192.6,212.6,15877990.0,1.2,19.6,2.95,564.41,19.6,10099239.9,57.22,0.06,True,63.66,1.8,-1.7,3.5,2026-01-05,10.16,0,,166.4,250.25,False,False
05-01-2026 09:00,EDATA,6.78,9.25,6.51,9.21,246789139.0,0.04,2.43,0.33,638.6,2.43,65726218.9,275.48,0.02,True,78.57,0.54,0.27,0.27,2026-01-05,38.29,0,,4.6,ATH,False,False
05-01-2026 09:00,ADGYO,44.8,55.75,44.26,55.75,11755676.0,0.0,10.95,0.4,2672.15,10.95,4686206.1,150.86,0.0,True,66.58,2.38,2.7,-0.32,2026-01-05,24.28,0,,43.5,60.1,False,False
05-01-2026 09:00,BURCE,59.2,77.55,59.2,77.55,9388547.0,0.0,18.35,4.19,337.74,18.35,5473651.8,71.52,0.0,True,87.31,12.1,8.3,3.79,2026-01-05,31.0,0,,13.57,ATH,False,False
05-01-2026 09:00,TMPOL,284.75,377.5,273.75,372.5,5787673.0,5.0,87.75,16.55,430.21,87.75,2350425.6,146.24,0.06,True,68.54,60.36,55.6,4.76,2026-01-05,33.15,0,,65.25,432.5,False,False
05-01-2026 09:00,AHSGY,16.38,22.98,16.21,21.74,49561934.0,1.24,5.36,1.02,425.49,5.36,24207867.89,104.73,0.23,True,88.54,2.48,1.98,0.49,2026-01-05,32.72,0,,5.25,ATH,False,False
05-01-2026 09:00,ASELS,233.0,280.0,233.0,280.0,222057060.0,0.0,47.0,6.4,634.38,47.0,145000378.0,53.14,0.0,True,79.3,20.57,16.01,4.56,2026-01-05,21.63,0,,171.5,ATH,False,False
05-01-2026 09:00,TCKRC,60.95,78.35,60.25,76.25,32528209.0,2.1,15.3,2.29,569.0,15.3,13565123.9,139.79,0.14,True,74.14,4.97,3.26,1.71,2026-01-05,25.72,0,,41.0,ATH,False,False
05-01-2026 09:00,PASEU,130.0,161.2,124.1,161.2,35240356.0,0.0,31.2,3.75,732.0,31.2,18575690.5,89.71,0.0,True,70.08,16.13,16.98,-0.85,2026-01-05,24.0,0,,13.6,ATH,False,False
05-01-2026 09:00,SDTTR,186.1,209.2,186.1,203.6,8076773.0,5.6,17.5,0.45,3788.89,17.5,3005214.2,168.76,0.32,True,56.86,-2.04,-3.47,1.44,2026-01-05,12.11,0,,173.3,242.5,True,True
05-01-2026 09:00,ANELE,16.14,17.9,15.4,17.5,12795059.0,0.4,1.36,0.03,4433.33,1.36,5701824.9,124.4,0.29,True,52.35,-0.41,-0.34,-0.06,2026-01-05,7.89,0,,14.99,26.44,False,False
05-01-2026 09:00,KTLEV,21.22,28.4,21.06,28.4,423846780.0,0.0,7.18,1.46,390.44,7.18,275798993.1,53.68,0.0,True,87.64,3.44,2.46,0.98,2026-01-05,33.84,0,,3.3,ATH,False,False
29-12-2025 09:00,RUBNS,19.55,25.46,19.1,25.46,25012688.0,0.0,5.91,0.53,1012.99,5.91,4851085.7,415.61,0.0,True,65.88,-0.28,-0.66,0.38,2025-12-29,30.77,0,,18.77,27.14,False,False
29-12-2025 09:00,ARSAN,3.27,3.89,3.16,3.79,259263889.0,0.1,0.52,0.07,612.33,0.52,144249771.1,79.73,0.19,True,71.61,0.22,0.16,0.06,2025-12-29,16.62,0,,2.56,ATH,False,False
29-12-2025 09:00,BMSCH,26.5,33.44,25.76,33.44,41441077.0,0.0,6.94,1.21,471.66,6.94,21262923.5,94.9,0.0,True,81.98,3.71,2.56,1.15,2025-12-29,27.44,0,,9.06,ATH,False,False
22-12-2025 09:00,PATEK,26.02,29.46,25.06,29.16,200205912.0,0.3,3.14,0.05,6726.09,3.14,115533082.8,73.29,0.1,True,55.58,0.8,1.4,-0.6,2025-12-22,12.76,0,,14.67,36.94,False,False
22-12-2025 09:00,KLSYN,5.97,7.12,5.71,6.86,43093981.0,0.26,0.89,0.07,1119.18,0.89,25699514.2,67.68,0.29,True,61.77,-0.0,-0.01,0.01,2025-12-22,13.76,0,,5.13,8.0,False,False
22-12-2025 09:00,KLMSN,30.06,37.36,29.28,36.5,18754057.0,0.86,6.44,0.28,2167.61,6.44,5068379.8,270.02,0.13,True,57.72,0.86,1.41,-0.55,2025-12-22,21.26,0,,21.54,55.25,False,False
22-12-2025 09:00,ATEKS,108.0,159.3,108.0,159.3,220439.0,0.0,51.3,7.74,562.36,51.3,75054.7,193.7,0.0,True,77.81,3.06,-4.21,7.27,2025-12-22,60.75,0,,70.0,200.5,False,False
15-12-2025 09:00,RYSAS,14.18,16.16,13.9,16.16,86675143.0,0.0,1.98,0.08,2540.0,1.98,28051293.3,208.99,0.0,True,52.82,-0.48,-0.47,-0.01,2025-12-15,14.61,0,,13.45,22.52,False,False
08-12-2025 09:00,MEGMT,45.26,58.45,45.26,55.35,88464622.0,3.1,10.09,1.77,469.09,10.09,36327110.3,143.52,0.31,True,76.68,4.51,2.7,1.81,2025-12-08,22.4,0,,24.32,ATH,False,False
08-12-2025 09:00,NIBAS,3.74,4.61,3.67,4.5,158271831.09,0.11,0.76,0.05,1409.93,0.76,61579084.52,157.02,0.14,True,61.06,0.1,0.14,-0.04,2025-12-08,20.97,0,,3.33,5.76,False,False
08-12-2025 09:00,OTTO,451.0,523.0,437.25,512.0,753909.0,11.0,61.0,3.5,1642.86,61.0,386840.0,94.89,0.18,True,61.52,9.09,11.18,-2.09,2025-12-08,13.9,0,,309.0,585.0,False,False
08-12-2025 09:00,BUCIM,6.46,6.93,6.41,6.9,54051208.0,0.03,0.44,0.06,671.93,0.44,29317843.1,84.36,0.07,True,52.08,-0.24,-0.28,0.04,2025-12-08,7.14,0,,5.99,7.76,True,True
08-12-2025 09:00,BRKVY,86.5,120.6,86.5,118.8,17096570.0,1.8,32.3,3.9,727.14,32.3,7652236.8,123.42,0.06,True,75.62,6.68,4.9,1.78,2025-12-08,38.14,0,,69.45,ATH,False,False
08-12-2025 09:00,MAVI,36.8,39.8,36.8,39.12,72933723.0,0.68,2.32,0.22,954.55,2.32,39213788.7,85.99,0.29,True,50.84,-0.09,0.19,-0.29,2025-12-08,6.54,0,,36.7,46.28,False,False
08-12-2025 09:00,ARMGD,42.6,61.9,42.44,58.2,32466979.0,3.7,15.6,2.35,564.96,15.6,16163604.6,100.86,0.24,True,86.71,3.11,1.33,1.78,2025-12-08,36.94,0,,31.38,ATH,False,False
08-12-2025 09:00,AKSUE,15.66,18.44,15.5,17.79,2046389.0,0.65,2.13,0.02,9581.82,2.13,1144530.6,78.8,0.31,True,51.7,-0.2,0.01,-0.21,2025-12-08,11.19,0,,14.88,22.1,False,False
01-12-2025 09:00,AYDEM,18.4,20.36,18.32,20.14,23675588.0,0.22,1.74,0.04,4871.43,1.74,15428010.2,53.46,0.13,True,56.07,0.04,-0.16,0.2,2025-12-01,9.75,0,,16.99,20.7,False,False
01-12-2025 09:00,BYDNR,23.1,28.2,22.0,27.44,3755472.0,0.76,4.34,0.35,1154.34,4.34,1847510.1,103.27,0.18,True,64.75,0.53,0.23,0.31,2025-12-01,19.3,0,,19.5,31.96,False,False
01-12-2025 09:00,EFOR,22.44,32.0,22.18,31.9,107215915.0,0.1,9.46,1.03,816.07,9.46,43134266.53,148.56,0.01,True,73.55,2.22,1.87,0.35,2025-12-01,42.41,0,,ATL,ATH,False,False
01-12-2025 09:00,LIDER,41.98,55.8,41.84,55.8,27146216.0,0.0,13.82,0.05,29304.26,13.82,9372005.4,189.65,0.0,True,50.37,4.0,5.82,-1.82,2025-12-01,32.86,0,,38.76,94.3,False,False
24-11-2025 09:00,OBAMS,6.49,7.64,6.39,7.64,250957363.83,0.0,1.15,0.0,28650.0,1.15,142447559.19,76.18,0.0,True,48.06,-0.54,-0.51,-0.02,2025-11-24,17.55,2,6.39,6.39,14.61,False,False
24-11-2025 09:00,ARDYZ,27.7,33.0,27.2,32.36,66099841.0,0.64,4.66,0.38,1113.54,4.66,26522143.7,149.23,0.14,True,59.52,-0.22,-0.71,0.49,2025-11-24,16.82,0,,24.42,34.16,False,False
17-11-2025 09:00,ALKLC,67.65,105.8,67.65,102.0,30614549.0,3.8,34.35,3.04,1028.08,34.35,17168119.7,78.32,0.11,True,63.74,10.24,11.21,-0.97,2025-11-17,51.22,0,,66.9,ATH,False,False
17-11-2025 09:00,TRALT,33.82,40.36,32.72,40.0,1353846606.0,0.36,6.18,1.65,275.46,6.18,589254893.9,129.76,0.06,True,79.47,2.14,0.72,1.42,2025-11-17,18.48,0,,21.66,ATH,False,False
17-11-2025 09:00,IHLAS,3.28,3.89,3.27,3.8,1354062251.0,0.09,0.52,0.02,2636.84,0.52,802602569.2,68.71,0.17,True,58.01,0.21,0.25,-0.03,2025-11-17,17.28,0,,1.98,4.59,False,False
17-11-2025 09:00,AKENR,10.08,12.45,10.05,12.29,151201006.0,0.16,2.21,0.1,2178.35,2.21,60367557.9,150.47,0.07,True,59.3,-0.17,-0.24,0.07,2025-11-17,22.29,0,,9.82,12.93,False,False
17-11-2025 09:00,HATEK,19.77,23.48,19.43,23.48,56283687.0,0.0,3.71,0.45,718.98,3.71,20136126.5,179.52,0.0,True,61.09,-0.55,-1.07,0.52,2025-11-17,19.25,0,,14.26,34.5,True,False
17-11-2025 09:00,ADEL,29.66,35.2,29.66,34.66,20130118.0,0.54,5.0,0.05,9900.0,5.0,10531776.6,91.14,0.11,True,55.02,-0.34,-0.33,-0.0,2025-11-17,17.09,0,,28.56,41.76,False,False
17-11-2025 09:00,BMSTL,97.6,122.9,97.6,122.9,27548091.0,0.0,25.3,4.67,441.76,25.3,14565253.9,89.14,0.0,True,86.29,12.6,8.3,4.3,2025-11-17,26.7,0,,39.94,ATH,False,False
10-11-2025 09:00,SKYLP,150.9,269.5,150.9,269.5,2164386.0,0.0,118.6,15.42,669.13,118.6,1372837.1,57.66,0.0,True,79.93,25.52,14.59,10.93,2025-11-10,60.8,0,,71.4,ATH,False,False
10-11-2025 09:00,OYAYO,45.2,56.1,41.8,56.1,2475973.0,0.0,10.9,2.01,442.83,10.9,1145135.2,116.22,0.0,True,76.4,4.43,3.07,1.36,2025-11-10,23.51,0,,19.4,ATH,False,False
03-11-2025 09:00,TDGYO,26.5,32.5,26.28,30.86,17198607.0,1.64,4.36,1.26,246.86,4.36,8158223.3,110.81,0.38,True,83.77,2.96,1.84,1.12,2025-11-03,17.07,0,,12.02,ATH,False,False
03-11-2025 09:00,GENTS,9.2,11.88,9.19,11.6,115224632.0,0.28,2.4,0.36,574.16,2.4,60724837.7,89.75,0.12,True,66.92,0.55,0.48,0.07,2025-11-03,26.09,0,,7.59,ATH,False,False
03-11-2025 09:00,ARASE,56.7,63.55,56.45,63.05,5740221.0,0.5,6.35,0.72,775.86,6.35,2481050.0,131.36,0.08,True,66.16,1.93,1.61,0.33,2025-11-03,11.79,0,,49.8,80.15,False,False
27-10-2025 09:00,DENGE,2.87,3.57,2.83,3.57,287599070.0,0.0,0.7,0.03,2158.06,0.7,159023766.6,80.85,0.0,True,67.23,0.21,0.18,0.04,2025-10-27,23.96,0,,2.57,5.16,False,False
27-10-2025 09:00,ONCSM,178.7,222.6,178.7,215.9,11288502.0,6.7,37.2,6.98,432.95,37.2,6700733.1,68.47,0.18,True,83.7,20.95,10.96,9.99,2025-10-27,20.82,0,,76.0,ATH,False,False
27-10-2025 09:00,MAGEN,23.5,30.28,22.7,29.58,65845058.0,0.7,6.08,0.93,553.76,6.08,41355657.65,59.22,0.12,True,78.64,3.44,2.85,0.59,2025-10-27,26.52,0,,7.29,ATH,False,False
27-10-2025 09:00,LYDHO,137.1,194.3,137.1,194.3,9284303.0,0.0,57.2,5.23,993.69,57.2,4743216.0,95.74,0.0,True,73.87,11.98,7.8,4.18,2025-10-27,46.2,0,,86.5,ATH,False,False
27-10-2025 09:00,BULGS,36.6,52.15,36.34,50.0,138387363.0,2.15,13.4,1.21,1005.61,13.4,44323923.0,212.22,0.16,True,77.54,2.62,1.79,0.83,2025-10-27,39.35,1,52.15,30.44,52.15,False,False
20-10-2025 09:00,UFUK,1074.0,1456.0,1015.0,1456.0,1360590.0,0.0,382.0,27.2,1304.41,382.0,325182.6,318.41,0.0,True,70.84,81.86,72.15,9.71,2025-10-20,48.19,0,,809.5,ATH,False,False
20-10-2025 09:00,ORCAY,3.51,4.36,3.34,4.22,21080063.17,0.15,0.71,0.03,2392.96,0.71,13413698.33,57.15,0.21,True,60.15,0.11,0.08,0.04,2025-10-20,17.56,0,,2.6,4.54,False,False
20-10-2025 09:00,ARTMS,47.7,58.0,46.1,56.4,25832547.0,1.6,8.7,1.76,394.88,8.7,15616789.0,65.42,0.18,True,80.18,4.24,1.95,2.28,2025-10-20,19.59,1,58.0,26.08,58.0,False,False
20-10-2025 09:00,DOGUB,33.62,49.18,33.62,49.18,6789504.0,0.0,15.56,3.06,408.33,15.56,2555579.4,165.67,0.0,True,90.48,3.85,1.57,2.29,2025-10-20,60.82,0,,14.89,ATH,False,False
20-10-2025 09:00,ANSGR,21.32,23.6,21.24,23.3,74338057.0,0.3,1.98,0.07,2650.0,1.98,47023276.7,58.09,0.15,True,53.91,-0.43,-0.48,0.06,2025-10-20,9.7,0,,20.28,25.58,True,True
20-10-2025 09:00,GRNYO,11.28,16.75,11.28,15.49,6690826.0,1.26,4.21,0.67,529.3,4.21,4368744.3,53.15,0.3,True,64.75,1.36,1.22,0.14,2025-10-20,37.32,0,,11.02,18.5,False,False
20-10-2025 09:00,TURSG,9.51,11.89,9.4,11.63,622085270.0,0.26,2.12,0.17,1147.06,2.12,133724051.5,365.2,0.12,True,68.89,0.4,0.31,0.09,2025-10-20,26.83,0,,7.5,ATH,False,False
20-10-2025 09:00,SEGYO,4.2,5.22,4.1,4.95,128442370.0,0.27,0.75,0.06,1193.1,0.75,60384512.2,112.71,0.36,True,57.46,0.07,0.06,0.01,2025-10-20,19.28,0,,4.07,5.28,False,False
20-10-2025 09:00,SOKM,40.12,45.18,39.54,44.48,65082811.0,0.7,4.36,0.55,689.86,4.36,40828547.8,59.41,0.16,True,64.53,0.5,-0.22,0.72,2025-10-20,12.27,0,,34.36,69.0,False,False
13-10-2025 09:00,PINSU,11.4,15.43,11.2,14.48,207472713.0,0.95,3.08,0.17,1701.17,3.08,61492139.7,237.4,0.31,True,72.71,1.66,1.37,0.29,2025-10-13,27.02,0,,5.2,14.75,False,False
13-10-2025 09:00,SMRVA,286.0,358.75,280.75,339.5,23626140.0,19.25,53.5,13.43,298.36,53.5,13299898.9,77.64,0.36,True,70.14,44.46,37.53,6.93,2025-10-13,14.6,0,,ATL,ATH,False,False
06-10-2025 09:00,AKSEN,37.64,45.16,36.96,44.18,78157673.0,0.98,6.54,0.22,2927.78,6.54,34309198.5,127.8,0.15,True,64.4,1.29,0.93,0.36,2025-10-06,17.38,0,,30.16,49.26,False,False
06-10-2025 09:00,GUNDG,93.5,115.1,89.6,111.1,11109629.0,4.0,17.6,4.49,291.55,17.6,6529111.0,70.16,0.23,True,74.32,12.57,9.51,3.06,2025-10-06,18.82,0,,41.6,ATH,False,False
06-10-2025 09:00,SAFKR,20.24,22.74,20.1,22.56,69382355.0,0.18,2.32,0.15,1439.35,2.32,42569673.2,62.99,0.08,True,67.73,1.45,1.51,-0.06,2025-10-06,13.6,0,,18.24,ATH,False,False
06-10-2025 09:00,TRHOL,194.0,281.75,194.0,281.75,5852106.0,0.0,87.75,17.11,412.86,87.75,3156744.1,85.38,0.0,True,65.38,45.76,44.91,0.85,2025-10-06,46.82,0,,14.3,ATH,False,False
06-10-2025 09:00,METRO,4.0,5.65,4.0,5.49,210146298.0,0.16,1.49,0.19,692.55,1.49,103632664.2,102.78,0.11,True,73.12,0.46,0.37,0.1,2025-10-06,39.69,0,,2.24,ATH,False,False
06-10-2025 09:00,CRFSA,93.0,121.0,92.85,113.1,15828755.0,7.9,20.1,2.33,762.66,20.1,3050181.1,418.94,0.39,True,73.45,1.89,-1.07,2.96,2025-10-06,24.35,0,,77.2,124.3,False,False
06-10-2025 09:00,KLNMA,12.0,15.75,12.0,15.75,3870361.0,0.0,3.75,0.26,1315.09,3.75,2340436.0,65.37,0.0,True,74.44,1.5,1.08,0.42,2025-10-06,30.17,1,15.75,6.22,ATH,False,False
06-10-2025 09:00,NUHCM,219.9,269.0,216.6,265.75,2388678.0,3.25,45.85,3.05,1400.82,45.85,720947.8,231.32,0.07,True,60.11,-3.96,-8.18,4.22,2025-10-06,21.46,0,,210.0,307.25,False,False
29-09-2025 09:00,ANGEN,12.23,14.22,12.09,13.84,78879053.0,0.38,1.61,0.23,612.39,1.61,29229410.7,169.86,0.24,True,62.72,0.25,-0.03,0.28,2025-09-29,16.79,0,,9.6,16.45,False,False
29-09-2025 09:00,GMTAS,15.42,20.74,15.31,19.91,105785467.8,0.83,4.5,1.08,317.94,4.5,27595917.17,283.34,0.18,True,88.87,2.18,1.42,0.77,2025-09-29,38.07,0,,4.85,ATH,False,False
29-09-2025 09:00,ALTIN,63.48,68.65,62.2,68.63,230424003.0,0.02,5.15,1.58,225.13,5.15,134401577.1,71.44,0.0,True,88.42,5.32,3.82,1.49,2025-09-29,11.14,0,,30.18,ATH,False,False
29-09-2025 09:00,A1CAP,11.2,13.61,10.16,13.61,240606879.0,0.0,2.41,0.35,592.53,2.41,138053101.1,74.29,0.0,True,74.33,1.36,1.16,0.2,2025-09-29,21.52,0,,4.28,ATH,False,False
29-09-2025 09:00,RTALB,3.85,4.52,3.69,4.52,1017194249.0,0.0,0.67,0.11,509.09,0.67,297403608.9,242.02,0.0,True,68.7,0.24,0.13,0.11,2025-09-29,23.84,0,,2.59,6.51,False,False
29-09-2025 09:00,ECZYT,284.0,335.25,270.25,335.0,7655549.0,0.25,51.0,13.43,279.75,51.0,3109877.0,146.17,0.0,True,75.77,23.44,11.98,11.47,2025-09-29,21.05,0,,163.5,ATH,False,False
29-09-2025 09:00,BASGZ,35.26,39.02,34.74,38.44,11704096.0,0.58,3.18,0.41,679.41,3.18,7317943.6,59.94,0.18,True,61.52,1.2,1.24,-0.05,2025-09-29,9.02,0,,31.3,ATH,False,False
29-09-2025 09:00,AVGYO,12.78,16.5,12.51,16.45,11653792.0,0.05,3.67,0.91,302.41,3.67,4278226.8,172.4,0.01,True,67.43,1.52,1.13,0.39,2025-09-29,28.52,0,,6.95,ATH,False,False
29-09-2025 09:00,SKTAS,4.19,5.64,4.1,5.64,285889660.0,0.0,1.45,0.28,417.57,1.45,186155746.74,53.58,0.0,True,79.43,0.45,0.23,0.23,2025-09-29,35.25,0,,2.37,ATH,False,False
22-09-2025 09:00,ALKA,12.04,17.1,11.66,15.84,211388499.0,1.26,3.8,0.82,360.61,3.8,60971996.2,246.7,0.33,True,87.42,1.17,0.41,0.76,2025-09-22,31.78,1,17.1,6.31,17.1,False,False
22-09-2025 09:00,ATSYH,58.0,75.0,58.0,71.1,1222363.0,3.9,13.1,2.05,539.02,13.1,453807.8,169.36,0.3,True,66.92,1.96,1.16,0.8,2025-09-22,27.08,0,,47.92,73.25,False,False
22-09-2025 09:00,VANGD,47.84,55.0,42.7,54.7,4454664.0,0.3,6.86,0.34,1894.19,6.86,2549525.2,74.73,0.04,True,67.93,4.43,4.32,0.1,2025-09-22,25.75,0,,36.0,ATH,False,False
22-09-2025 09:00,EUKYO,15.24,21.98,14.2,20.8,9185586.0,1.18,5.56,0.53,941.2,5.56,3009670.0,205.2,0.21,True,75.05,0.93,0.35,0.58,2025-09-22,49.43,1,21.98,11.99,21.98,False,False
22-09-2025 09:00,ETYAT,16.33,20.18,15.51,20.18,4498977.0,0.0,3.85,0.34,1039.05,3.85,2103611.2,113.87,0.0,True,74.01,1.59,1.25,0.34,2025-09-22,26.76,0,,8.7,ATH,False,False
22-09-2025 09:00,TATEN,14.75,18.76,14.25,18.0,140124756.0,0.76,3.25,0.66,389.09,3.25,77279150.4,81.32,0.23,True,77.13,1.4,0.93,0.47,2025-09-22,22.76,0,,7.89,ATH,False,False
15-09-2025 09:00,AZTEK,4.5,5.7,4.28,5.48,208531110.0,0.21,0.99,0.14,604.5,0.99,93569119.0,122.86,0.22,True,67.99,0.11,-0.04,0.15,2025-09-15,21.89,0,,3.51,ATH,False,False
15-09-2025 09:00,IHEVA,2.4,3.23,2.36,3.15,41554852.0,0.08,0.75,0.08,792.86,0.75,25853848.2,60.73,0.11,True,67.62,0.14,0.07,0.08,2025-09-15,31.25,0,,1.89,3.78,False,False
15-09-2025 09:00,QUAGR,9.34,11.89,9.32,11.21,797664809.0,0.68,1.87,0.45,318.34,1.87,268155169.5,197.46,0.36,True,94.84,1.28,0.94,0.33,2025-09-15,19.89,1,11.89,3.2,11.89,False,False
15-09-2025 09:00,COSMO,123.4,169.7,120.8,169.7,533757.0,0.0,46.3,6.26,639.62,46.3,315835.8,69.0,0.0,True,77.85,8.71,4.32,4.39,2025-09-15,37.52,0,,100.0,ATH,False,False
15-09-2025 09:00,CWENE,15.48,21.48,15.29,20.03,115034651.78,1.45,4.55,0.45,918.67,4.55,64362379.05,78.73,0.32,True,62.99,0.22,-0.35,0.57,2025-09-15,29.03,0,,12.34,25.24,False,False
15-09-2025 09:00,IEYHO,15.01,23.34,14.83,23.34,414173024.0,0.0,8.33,0.89,837.01,8.33,179832039.8,130.31,0.0,True,77.07,1.58,1.04,0.54,2025-09-15,55.29,0,,11.42,ATH,False,False
15-09-2025 09:00,OZRDN,8.62,11.01,8.62,10.56,9988976.0,0.45,1.94,0.28,587.94,1.94,4351840.8,129.53,0.23,True,67.28,0.18,-0.04,0.22,2025-09-15,20.82,0,,6.99,10.89,False,False
15-09-2025 09:00,OYYAT,38.4,48.48,38.2,48.48,4554064.0,0.0,10.08,1.1,814.7,10.08,2314707.7,96.74,0.0,True,72.58,3.12,1.87,1.25,2025-09-15,26.25,0,,25.56,52.65,False,False
15-09-2025 09:00,KAPLM,345.75,532.5,340.25,479.25,4735476.0,53.25,133.5,26.77,398.79,133.5,1999790.9,136.8,0.4,True,88.77,38.57,15.94,22.63,2025-09-15,38.51,0,,197.3,ATH,False,False
15-09-2025 09:00,KTSKR,65.9,82.85,64.95,82.85,4859588.0,0.0,16.95,1.84,823.71,16.95,2893767.5,67.93,0.0,True,71.17,3.45,1.85,1.6,2025-09-15,25.72,0,,54.5,90.0,False,False
15-09-2025 09:00,DNISI,20.42,24.68,20.22,24.1,18784858.0,0.58,3.68,0.19,1796.91,3.68,10093326.9,86.11,0.16,True,54.9,0.04,-0.07,0.11,2025-09-15,18.14,2,20.22,20.22,24.86,False,False
15-09-2025 09:00,KMPUR,16.88,19.43,16.56,19.15,30020847.0,0.28,2.27,0.48,370.95,2.27,15906743.1,88.73,0.12,True,62.34,0.17,-0.39,0.56,2025-09-15,13.45,0,,12.81,20.5,False,False
15-09-2025 09:00,KRDMD,25.58,30.0,25.02,30.0,475246397.0,0.0,4.42,0.39,1033.33,4.42,254618235.6,86.65,0.0,True,57.92,0.64,0.25,0.39,2025-09-15,17.28,0,,21.16,31.58,False,False
15-09-2025 09:00,ANHYT,81.55,95.0,80.2,92.4,8640815.0,2.6,10.85,0.99,995.96,10.85,5615395.5,53.88,0.24,True,56.81,-0.83,-2.31,1.48,2025-09-15,13.37,0,,68.05,114.1,False,False
15-09-2025 09:00,EGPRO,24.36,30.02,23.5,28.9,15942371.0,1.12,4.54,0.96,370.47,4.54,9185599.7,73.56,0.25,True,70.02,0.83,-0.06,0.89,2025-09-15,18.64,0,,17.2,36.34,False,False
15-09-2025 09:00,FADE,14.71,17.49,14.4,17.0,25322926.0,0.49,2.29,0.31,643.51,2.29,9419923.9,168.82,0.21,True,70.71,0.31,-0.03,0.34,2025-09-15,15.57,1,17.49,11.58,17.49,False,False
15-09-2025 09:00,KONTR,12.41,18.19,12.18,17.56,872400730.28,0.63,5.16,0.61,745.76,5.16,280989844.36,210.47,0.12,True,62.05,-0.51,-1.24,0.72,2025-09-15,41.55,0,,10.26,26.53,False,False
15-09-2025 09:00,KOCMT,2.72,3.21,2.71,3.16,292286384.62,0.05,0.45,0.09,402.05,0.45,179398346.15,62.93,0.11,True,61.29,0.11,0.02,0.08,2025-09-15,16.41,1,3.21,2.0,3.21,False,False
15-09-2025 09:00,MIATK,41.4,46.12,40.86,45.58,236282312.0,0.54,4.18,1.31,220.06,4.18,125875061.9,87.71,0.13,True,64.89,1.34,-0.32,1.66,2025-09-15,10.04,0,,26.78,48.5,False,False
15-09-2025 09:00,ALKIM,16.81,20.58,16.55,19.91,21492255.0,0.67,3.1,0.29,983.92,3.1,14025904.1,53.23,0.22,True,64.55,0.63,0.36,0.27,2025-09-15,18.37,0,,13.15,20.32,False,False
15-09-2025 09:00,SELVA,1.33,1.94,1.33,1.94,191443087.26,0.0,0.61,0.06,862.62,0.61,123411707.94,55.13,0.0,True,69.36,0.15,0.12,0.03,2025-09-15,40.77,2,1.33,1.33,ATH,False,False
08-09-2025 09:00,PENGD,8.6,10.37,8.48,10.27,101462632.0,0.1,1.67,0.06,2637.7,1.67,66459950.5,52.67,0.06,True,60.79,0.59,0.51,0.08,2025-09-08,18.18,0,,6.96,ATH,False,False
08-09-2025 09:00,KUTPO,95.95,111.2,93.55,108.0,6207249.0,3.2,12.05,2.59,365.25,12.05,3034652.7,104.55,0.27,True,72.53,5.59,3.69,1.89,2025-09-08,11.28,0,,68.0,ATH,False,False
08-09-2025 09:00,EKIZ,82.1,127.3,82.1,123.0,560738.0,4.3,40.9,6.98,485.96,40.9,225967.6,148.15,0.11,True,84.54,9.02,3.48,5.55,2025-09-08,46.43,1,127.3,50.3,127.3,False,False
08-09-2025 09:00,TOASO,220.9,246.4,220.4,240.5,43841446.0,5.9,19.6,3.12,529.21,19.6,29123109.7,50.54,0.3,True,59.16,10.62,6.28,4.34,2025-09-08,6.84,0,,150.1,353.75,False,False
08-09-2025 09:00,ARZUM,2.75,3.21,2.66,3.21,244304332.0,0.0,0.46,0.03,1515.4,0.46,117879839.26,107.25,0.0,True,59.46,0.16,0.14,0.02,2025-09-08,15.05,0,,1.88,3.49,False,False
08-09-2025 09:00,DESA,14.4,16.5,14.02,16.33,22341880.0,0.17,1.93,0.58,231.05,1.93,13584335.6,64.47,0.09,True,79.54,1.43,0.81,0.63,2025-09-08,12.39,0,,7.56,16.72,False,False
01-09-2025 09:00,PCILT,22.82,30.92,22.28,28.92,19692383.0,2.0,6.1,1.57,289.28,6.1,9442643.6,108.55,0.33,True,85.66,2.34,0.8,1.54,2025-09-01,26.07,0,,10.97,ATH,False,False
01-09-2025 09:00,MEKAG,4.6,5.44,4.21,5.38,152683029.0,0.06,0.78,0.21,271.37,0.78,84332282.38,81.05,0.08,True,77.96,0.31,0.11,0.2,2025-09-01,17.21,0,,2.85,5.63,False,False
01-09-2025 09:00,PENTA,16.6,18.95,16.4,18.5,45057938.0,0.45,1.9,0.52,261.9,1.9,25837083.8,74.39,0.24,True,68.54,0.85,0.3,0.54,2025-09-01,11.45,0,,12.11,ATH,False,False
01-09-2025 09:00,PKENT,220.0,244.9,210.6,238.2,1779713.0,6.7,18.2,1.37,1228.47,18.2,1178953.6,50.96,0.37,True,56.61,1.41,-1.04,2.44,2025-09-01,8.08,0,,187.1,248.9,False,False
01-09-2025 09:00,YBTAS,36.63,43.11,35.3,43.11,1645645.65,0.0,6.48,1.12,478.29,6.48,651651.65,152.53,0.0,True,53.57,-1.33,-1.9,0.57,2025-09-01,16.27,0,,28.72,75.27,True,True
01-09-2025 09:00,IZINV,68.75,93.3,65.7,91.6,2544812.0,1.7,22.85,5.24,335.65,22.85,1506548.1,68.92,0.07,True,82.2,8.52,4.65,3.88,2025-09-01,33.14,1,93.3,33.7,93.3,False,False
01-09-2025 09:00,MNDRS,15.2,18.9,14.95,18.9,51972562.0,0.0,3.7,0.84,338.39,3.7,24853920.9,109.11,0.0,True,84.58,1.47,0.75,0.72,2025-09-01,24.34,0,,8.35,ATH,False,False
01-09-2025 09:00,INVES,564.5,680.0,523.0,677.0,755714.0,3.0,112.5,41.38,171.9,112.5,496087.9,52.33,0.03,True,89.19,82.83,39.96,42.87,2025-09-01,19.93,0,,193.8,ATH,False,False
01-09-2025 09:00,DERIM,39.7,46.1,39.28,45.3,11210366.0,0.8,5.6,0.99,466.8,5.6,5904497.2,89.86,0.14,True,61.22,1.43,0.92,0.5,2025-09-01,14.11,0,,32.8,46.5,False,False
01-09-2025 09:00,BEYAZ,27.96,36.6,27.96,35.92,47071922.0,0.68,7.96,1.5,430.67,7.96,14543969.0,223.65,0.09,True,78.13,1.76,0.39,1.37,2025-09-01,28.56,0,,19.05,36.0,False,False
01-09-2025 09:00,BRKO,7.45,8.85,7.11,8.8,6943029.0,0.05,1.35,0.25,437.85,1.35,4162870.1,66.78,0.04,True,53.58,-0.57,-0.82,0.25,2025-09-01,18.12,0,,5.85,13.84,True,False
25-08-2025 09:00,KUVVA,90.0,104.8,89.0,104.0,942099.0,0.8,14.0,1.51,827.15,14.0,507817.5,85.52,0.06,True,71.06,8.25,8.56,-0.31,2025-08-25,15.62,0,,46.0,ATH,False,False
25-08-2025 09:00,YUNSA,7.47,9.1,7.37,9.1,160294998.0,0.0,1.63,0.41,294.67,1.63,62068486.3,158.26,0.0,True,83.49,0.32,-0.07,0.39,2025-08-25,22.15,0,,4.7,14.1,False,False
25-08-2025 09:00,TUCLK,6.32,7.38,6.1,7.23,316026071.67,0.15,0.91,0.16,452.19,0.91,77022674.12,310.3,0.16,True,74.49,0.21,-0.0,0.21,2025-08-25,18.45,0,,3.94,7.79,False,False
18-08-2025 09:00,FMIZP,315.25,350.25,313.0,349.0,1037682.0,1.25,33.75,7.48,351.51,33.75,515725.9,101.21,0.04,True,62.75,2.64,-2.38,5.02,2025-08-18,10.79,0,,264.75,406.75,False,False
18-08-2025 09:00,KONKA,12.6,14.32,12.3,13.86,31157733.22,0.46,1.26,0.24,417.81,1.26,12493259.52,149.4,0.37,True,66.81,0.07,-0.32,0.39,2025-08-18,12.68,0,,9.79,14.39,False,False
18-08-2025 09:00,KRVGD,2.3,2.53,2.28,2.47,130188901.0,0.06,0.17,0.05,246.94,0.17,83099027.7,56.67,0.35,True,64.17,0.02,-0.04,0.06,2025-08-18,8.81,0,,1.79,2.53,False,False
18-08-2025 09:00,SEYKM,4.74,6.7,4.7,6.3,48806753.0,0.4,1.56,0.34,361.54,1.56,20155003.8,142.16,0.26,True,85.77,0.39,0.06,0.33,2025-08-18,33.47,0,,2.73,ATH,False,False
18-08-2025 09:00,ATAKP,47.82,54.4,47.82,53.4,8108743.0,1.0,5.58,1.48,276.01,5.58,4931287.8,64.43,0.18,True,73.45,1.79,0.48,1.31,2025-08-18,11.76,0,,37.04,54.85,False,False
18-08-2025 09:00,RODRG,22.1,24.2,19.5,23.88,5536997.0,0.32,1.78,0.68,163.31,1.78,2026994.7,173.16,0.18,True,71.64,0.55,-0.32,0.87,2025-08-18,18.81,0,,15.1,40.25,False,False
18-08-2025 09:00,PETKM,18.33,20.92,18.33,20.82,512202383.0,0.1,2.49,0.45,458.3,2.49,234015402.8,118.88,0.04,True,68.84,0.26,-0.15,0.42,2025-08-18,13.83,0,,17.12,26.2,False,False
18-08-2025 09:00,KBORU,14.45,16.07,13.98,15.72,110950928.0,0.35,1.27,0.37,245.11,1.27,65079024.7,70.49,0.28,True,70.13,0.54,0.09,0.44,2025-08-18,9.7,0,,9.66,17.93,False,False
18-08-2025 09:00,SASA,4.13,4.78,3.89,4.78,12800179700.0,0.0,0.65,0.15,348.28,0.65,3522447151.5,263.39,0.0,True,68.83,-0.02,-0.17,0.15,2025-08-18,22.56,0,,2.76,6.48,False,False
18-08-2025 09:00,NETAS,62.0,84.9,62.0,84.5,19028088.0,0.4,22.5,3.39,564.11,22.5,4595293.4,314.08,0.02,True,76.06,1.15,-2.34,3.5,2025-08-18,41.42,0,,43.18,99.15,False,False
18-08-2025 09:00,IHYAY,2.55,3.2,2.54,3.03,310933272.0,0.17,0.48,0.09,445.45,0.48,201082967.9,54.63,0.35,True,64.04,-0.08,-0.23,0.15,2025-08-18,19.29,0,,1.89,6.02,True,False
18-08-2025 09:00,TBORG,159.2,194.0,159.2,191.3,6851405.0,2.7,32.1,1.55,1970.97,32.1,1887210.5,263.04,0.08,True,62.37,6.47,7.5,-1.03,2025-08-18,19.49,0,,158.5,194.7,False,False
18-08-2025 09:00,DCTTR,11.5,13.41,11.27,12.99,136647155.75,0.43,1.49,0.12,1092.51,1.49,85450077.11,59.91,0.29,True,54.01,0.12,0.22,-0.1,2025-08-18,14.25,0,,10.18,14.22,False,False
18-08-2025 09:00,CANTE,1.74,2.18,1.74,2.14,7486597893.71,0.04,0.4,0.09,327.27,0.4,4098991964.24,82.64,0.11,True,75.11,0.12,0.04,0.08,2025-08-18,23.9,0,,1.21,ATH,False,False
18-08-2025 09:00,GSRAY,1.36,1.7,1.36,1.63,7681122850.0,0.07,0.27,0.03,881.61,0.27,2847967565.01,169.71,0.26,True,60.7,-0.03,-0.06,0.03,2025-08-18,20.74,0,,1.14,1.67,False,False
18-08-2025 09:00,MZHLD,6.71,7.4,6.7,7.22,5096803.0,0.18,0.51,0.11,355.36,0.51,2849135.6,78.89,0.35,True,67.97,0.16,-0.01,0.17,2025-08-18,7.6,0,,5.5,8.39,False,False
11-08-2025 09:00,BRMEN,5.36,7.53,5.36,7.53,5702992.74,0.0,2.17,0.47,358.61,2.17,3031774.56,88.11,0.0,True,89.39,0.68,0.23,0.44,2025-08-11,28.57,0,,2.65,ATH,False,False
11-08-2025 09:00,BALAT,65.05,78.3,65.05,77.5,530813.0,0.8,12.45,2.3,442.01,12.45,335946.3,58.01,0.06,True,68.27,3.41,1.08,2.33,2025-08-11,19.14,0,,46.68,ATH,False,False
11-08-2025 09:00,JANTS,22.88,28.42,22.1,28.42,84522624.0,0.0,5.54,0.69,702.9,5.54,24403724.5,246.35,0.0,True,69.4,-0.16,-1.01,0.85,2025-08-11,24.1,0,,18.72,29.5,False,False
11-08-2025 09:00,CEMZY,16.29,20.9,15.67,20.52,76833290.0,0.38,4.23,0.41,941.87,4.23,30468775.3,152.17,0.09,True,74.82,0.82,0.55,0.27,2025-08-11,26.28,0,,12.98,ATH,False,False
11-08-2025 09:00,MMCAS,40.84,61.15,40.84,61.15,1895429.0,0.0,20.31,2.93,592.47,20.31,575425.2,229.4,0.0,True,81.16,5.85,3.06,2.79,2025-08-11,60.92,0,,17.82,ATH,False,False
11-08-2025 09:00,GLBMD,12.05,15.7,11.77,15.59,7405805.0,0.11,3.54,0.66,434.74,3.54,3660465.8,102.32,0.03,True,71.1,0.59,0.13,0.46,2025-08-11,28.52,0,,9.4,18.46,False,False
11-08-2025 09:00,BFREN,176.0,192.0,172.2,187.8,4065885.0,4.2,11.8,2.0,490.0,11.8,2114753.4,92.26,0.36,True,61.12,0.62,-2.31,2.93,2025-08-11,6.83,0,,147.0,217.9,False,False
11-08-2025 09:00,ISBIR,100.0,111.2,95.3,111.2,305196.0,0.0,11.2,4.08,174.51,11.2,161612.1,88.84,0.0,True,66.25,3.76,-0.49,4.25,2025-08-11,0.09,0,,71.5,167.0,False,False
11-08-2025 09:00,HEKTS,4.31,5.04,4.28,4.97,1725583068.0,0.07,0.66,0.18,268.72,0.66,769518664.1,124.24,0.11,True,76.89,0.18,-0.03,0.21,2025-08-11,15.85,0,,2.83,ATH,False,False
11-08-2025 09:00,HTTBT,45.8,49.76,44.2,48.66,10763034.0,1.1,2.86,0.75,279.31,2.86,4063438.1,164.88,0.38,True,65.27,1.22,0.54,0.68,2025-08-11,6.38,0,,35.82,49.8,False,False
11-08-2025 09:00,MERCN,38.5,48.56,37.62,48.2,60954790.0,0.36,9.7,3.02,221.62,9.7,37512598.1,62.49,0.04,True,86.15,5.67,2.94,2.72,2025-08-11,27.51,0,,14.36,ATH,False,False
11-08-2025 09:00,SMART,27.2,29.14,27.2,28.8,18356174.0,0.34,1.6,0.54,196.3,1.6,9684081.6,89.55,0.21,True,57.61,-0.56,-1.21,0.65,2025-08-11,6.19,0,,21.46,29.32,False,False
11-08-2025 09:00,KERVN,2.43,3.21,2.43,3.21,8020208.0,0.0,0.78,0.12,566.67,0.78,4622655.7,73.5,0.0,True,81.6,0.11,-0.0,0.11,2025-08-11,32.1,0,,1.67,ATH,False,False
11-08-2025 09:00,DOHOL,17.24,19.3,17.02,19.11,118250011.0,0.19,1.87,0.43,338.97,1.87,74909094.2,57.86,0.1,True,70.56,0.64,0.34,0.31,2025-08-11,12.02,0,,13.82,ATH,False,False
11-08-2025 09:00,ESEN,14.0,20.3,13.76,20.3,53419096.08,0.0,6.3,1.07,490.36,6.3,34755281.72,53.7,0.0,True,93.78,2.84,2.08,0.76,2025-08-11,45.0,1,20.3,2.61,ATH,False,False
11-08-2025 09:00,DIRIT,28.4,34.16,28.4,34.16,932994.0,0.0,5.76,0.96,497.51,5.76,587925.7,58.69,0.0,True,70.21,0.73,-0.7,1.43,2025-08-11,24.31,0,,19.13,71.2,False,False
04-08-2025 09:00,EKOS,5.62,6.64,5.56,6.4,241775256.0,0.25,0.77,0.11,588.89,0.77,102356914.8,136.21,0.32,True,57.57,-0.08,-0.2,0.12,2025-08-04,16.17,0,,4.31,6.85,False,False
04-08-2025 09:00,TLMAN,85.45,97.4,85.25,94.0,2153585.0,3.4,8.55,1.55,453.4,8.55,948879.7,126.96,0.4,True,59.02,-1.72,-3.45,1.73,2025-08-04,9.94,0,,71.7,100.8,False,False
04-08-2025 09:00,SRVGY,3.27,3.86,3.26,3.71,497759644.0,0.15,0.44,0.11,289.38,0.44,241455273.9,106.15,0.34,True,59.24,-0.11,-0.26,0.15,2025-08-04,14.15,0,,2.35,5.07,True,False
04-08-2025 09:00,TGSAS,154.0,211.1,147.6,198.0,2296481.0,13.1,44.0,11.5,282.78,44.0,908529.0,152.77,0.3,True,91.3,22.56,11.96,10.6,2025-08-04,35.52,0,,51.5,ATH,False,False
04-08-2025 09:00,SURGY,59.0,70.4,58.55,69.9,27549159.0,0.5,10.9,2.26,383.37,10.9,11830777.3,132.86,0.05,True,72.25,3.03,0.85,2.18,2025-08-04,18.47,0,,33.32,84.45,False,False
04-08-2025 09:00,BASCM,15.5,19.01,15.5,18.48,1618260.0,0.53,2.98,0.78,281.56,2.98,838195.9,93.06,0.18,True,82.52,0.94,0.06,0.88,2025-08-04,17.86,0,,8.86,ATH,False,False
04-08-2025 09:00,TATGD,12.51,13.69,12.47,13.51,14617397.0,0.18,1.0,0.2,397.51,1.0,9557775.3,52.94,0.18,True,61.17,-0.07,-0.31,0.25,2025-08-04,7.99,0,,10.41,14.31,False,False
04-08-2025 09:00,BERA,16.49,17.82,16.43,17.58,60414698.0,0.24,1.09,0.39,180.93,1.09,34230364.0,76.49,0.22,True,63.07,0.09,-0.2,0.29,2025-08-04,6.35,0,,13.4,18.68,False,False
04-08-2025 09:00,MAKIM,19.09,21.98,18.98,21.66,16303093.0,0.32,2.57,0.3,759.53,2.57,9509379.1,71.44,0.12,True,57.67,-0.05,-0.54,0.49,2025-08-04,13.46,0,,15.56,27.42,False,False
04-08-2025 09:00,FZLGY,9.42,11.2,9.39,10.86,131480184.75,0.34,1.44,0.18,697.75,1.44,61924516.9,112.32,0.24,True,68.91,0.56,0.56,-0.0,2025-08-04,17.96,0,,7.99,ATH,False,False
04-08-2025 09:00,AHGAZ,30.08,34.42,29.96,33.8,42059038.0,0.62,3.72,0.94,297.44,3.72,24535394.3,71.42,0.17,True,76.66,2.7,2.22,0.48,2025-08-04,12.67,0,,16.51,ATH,False,False
04-08-2025 09:00,QNBTR,370.94,542.09,370.94,542.09,467495.0,0.0,171.15,33.78,406.72,171.15,158136.47,195.63,0.0,True,92.15,42.94,10.88,32.05,2025-08-04,60.65,0,,151.18,ATH,False,False
04-08-2025 09:00,QNBFK,64.4,88.15,64.4,88.15,1490784.0,0.0,23.75,4.46,432.75,23.75,413341.8,260.67,0.0,True,85.92,3.93,-1.19,5.12,2025-08-04,50.56,0,,29.78,ATH,False,False
04-08-2025 09:00,PLTUR,26.52,28.86,26.52,28.52,21675225.0,0.34,2.0,0.21,870.87,2.0,13217354.1,63.99,0.17,True,55.42,-0.0,-0.26,0.26,2025-08-04,7.62,0,,22.16,33.32,False,False
04-08-2025 09:00,IHGZT,1.72,2.17,1.71,2.09,436710958.0,0.08,0.37,0.08,380.52,0.37,287264108.9,52.02,0.22,True,77.9,0.09,0.02,0.07,2025-08-04,22.22,0,,1.23,2.23,False,False
28-07-2025 09:00,OBASE,33.54,40.26,33.22,39.74,8800820.0,0.52,6.2,0.54,1052.42,6.2,3505871.1,151.03,0.08,True,68.87,0.65,-0.22,0.87,2025-07-28,18.49,0,,27.2,ATH,False,False
28-07-2025 09:00,DAPGM,10.8,13.5,10.49,13.27,419738381.0,0.23,2.47,0.36,591.88,2.47,121400790.5,245.75,0.09,True,79.0,0.95,0.66,0.3,2025-07-28,24.6,0,,4.36,ATH,False,False
28-07-2025 09:00,NTGAZ,10.0,11.75,9.99,11.48,63815276.0,0.27,1.48,0.22,569.68,1.48,31525839.9,102.42,0.18,True,71.63,0.89,0.77,0.11,2025-07-28,15.15,0,,5.28,ATH,False,False
28-07-2025 09:00,ENSRI,6.42,9.67,6.42,9.16,174662213.27,0.51,2.74,0.49,459.2,2.74,59829161.04,191.93,0.19,True,85.07,0.6,0.18,0.42,2025-07-28,48.27,0,,3.23,ATH,False,False
28-07-2025 09:00,PETUN,10.27,11.18,9.8,11.0,23879677.0,0.18,0.73,0.18,296.74,0.73,9389122.0,154.33,0.25,True,66.86,0.13,-0.13,0.27,2025-07-28,7.11,0,,7.52,11.45,False,False
28-07-2025 09:00,SILVR,2.26,3.09,2.23,3.08,65878775.15,0.01,0.82,0.11,626.96,0.82,14892199.64,342.37,0.01,True,75.91,0.02,-0.07,0.09,2025-07-28,36.37,0,,1.84,3.13,False,False
28-07-2025 09:00,BIOEN,20.8,23.38,20.42,23.38,30531901.0,0.0,2.58,0.18,1349.44,2.58,19247975.5,58.62,0.0,True,60.91,1.11,0.98,0.14,2025-07-28,12.3,0,,19.3,23.62,False,False
28-07-2025 09:00,PAMEL,101.0,112.8,98.6,112.1,2661326.0,0.7,11.1,2.54,337.87,11.1,920328.4,189.17,0.06,True,67.11,1.28,-1.85,3.13,2025-07-28,13.23,0,,74.85,155.8,False,False
28-07-2025 09:00,YAPRK,276.0,367.75,274.25,342.25,4984275.0,25.5,66.25,3.35,1877.61,66.25,2188730.6,127.72,0.38,True,43.81,-79.71,-78.67,-1.04,2025-07-28,24.23,1,367.75,244.0,367.75,False,False
28-07-2025 09:00,OTKAR,504.5,571.5,499.0,570.0,4236009.0,1.5,65.5,16.82,289.3,65.5,2142809.6,97.68,0.02,True,69.19,12.38,-6.09,18.47,2025-07-28,12.98,0,,358.0,675.5,False,False
28-07-2025 09:00,TURGG,30.82,41.67,30.82,39.12,15778495.44,2.54,8.31,1.46,468.42,8.31,5979998.76,163.85,0.31,True,76.3,1.42,0.09,1.33,2025-07-28,27.41,0,,22.62,42.48,False,False
28-07-2025 09:00,DURDO,3.73,4.59,3.67,4.35,138862482.0,0.24,0.62,0.1,526.26,0.62,40906664.9,239.46,0.39,True,67.35,0.02,-0.08,0.1,2025-07-28,17.57,0,,2.86,4.67,True,False
28-07-2025 09:00,VRGYO,2.97,4.08,2.96,3.81,447881140.0,0.27,0.84,0.13,546.15,0.84,210975540.5,112.29,0.32,True,68.47,0.06,-0.11,0.17,2025-07-28,28.72,0,,2.17,ATH,False,False
21-07-2025 09:00,MANAS,2.87,4.28,2.86,4.28,370280690.82,0.0,1.41,0.08,1693.33,1.41,114518672.27,223.34,0.0,True,54.8,-0.44,-0.45,0.01,2025-07-21,50.65,0,,2.57,6.79,True,True
21-07-2025 09:00,MTRKS,20.44,23.98,20.4,23.38,18084844.0,0.6,2.94,0.36,705.48,2.94,5772353.3,213.3,0.2,True,60.67,-0.1,-0.28,0.18,2025-07-21,14.38,0,,17.13,26.96,False,False
21-07-2025 09:00,PKART,68.0,78.05,67.8,76.7,4206938.0,1.35,8.7,0.76,1044.74,8.7,2145678.3,96.07,0.16,True,61.59,-0.07,-1.17,1.1,2025-07-21,14.39,0,,53.55,79.8,False,False
21-07-2025 09:00,AGESA,158.3,172.0,157.9,168.4,2266419.0,3.6,10.1,1.91,428.8,10.1,1343051.8,68.75,0.36,True,67.01,6.33,4.42,1.9,2025-07-21,7.6,0,,120.4,ATH,False,False
21-07-2025 09:00,DMSAS,6.97,7.71,6.97,7.64,29408812.0,0.07,0.67,0.02,2691.67,0.67,13146642.3,123.7,0.1,True,53.64,-0.12,-0.1,-0.01,2025-07-21,9.61,0,,6.55,8.24,False,False
21-07-2025 09:00,DOKTA,21.76,24.12,21.62,23.46,4013798.0,0.66,1.7,0.21,725.24,1.7,2457862.6,63.3,0.39,True,57.39,-0.32,-0.73,0.41,2025-07-21,7.81,0,,18.0,25.9,False,False
21-07-2025 09:00,MNDTR,5.77,6.43,5.77,6.29,21780474.0,0.14,0.52,0.04,1305.41,0.52,10529270.3,106.86,0.27,True,59.95,-0.01,-0.1,0.1,2025-07-21,8.64,0,,4.73,6.4,False,False
21-07-2025 09:00,EMKEL,51.5,70.9,51.25,69.95,83805802.0,0.95,18.45,3.18,480.01,18.45,55519417.9,50.95,0.05,True,84.04,9.31,6.59,2.72,2025-07-21,43.81,0,,9.95,ATH,False,False
21-07-2025 09:00,KRSTL,7.63,8.91,7.51,8.69,63167433.0,0.22,1.06,0.11,854.95,1.06,36666633.0,72.27,0.21,True,69.42,0.37,0.21,0.16,2025-07-21,14.64,0,,5.7,ATH,False,False
21-07-2025 09:00,MOBTL,6.7,8.36,6.7,8.17,190623975.0,0.19,1.47,0.02,6581.82,1.47,75068977.0,153.93,0.13,True,67.93,0.63,0.59,0.04,2025-07-21,22.12,0,,3.42,9.06,False,False
21-07-2025 09:00,GEDZA,23.34,25.66,22.98,25.66,11346148.0,0.0,2.32,0.0,46300.0,2.32,5259624.6,115.72,0.0,True,52.92,-1.21,-1.36,0.16,2025-07-21,10.41,0,,19.01,44.0,False,False
21-07-2025 09:00,KNFRT,15.22,18.07,14.87,17.63,41047585.0,0.44,2.41,0.67,260.24,2.41,17121938.2,139.74,0.18,True,73.18,0.89,0.24,0.65,2025-07-21,16.91,0,,9.51,ATH,False,False
21-07-2025 09:00,KIMMR,12.25,13.98,12.07,13.68,19986497.0,0.3,1.43,0.24,483.67,1.43,12304309.4,62.43,0.21,True,69.19,0.72,0.47,0.25,2025-07-21,11.67,0,,7.65,15.32,False,False
21-07-2025 09:00,DGNMO,6.64,7.34,6.64,7.29,40354442.0,0.05,0.65,0.08,744.16,0.65,13587413.2,197.0,0.08,True,52.77,-0.35,-0.52,0.17,2025-07-21,9.62,0,,5.62,10.41,True,False
21-07-2025 09:00,KATMR,2.26,2.74,2.2,2.7,2101745550.0,0.04,0.44,0.1,340.0,0.44,1188600053.3,76.83,0.09,True,78.38,0.16,0.06,0.09,2025-07-21,20.54,0,,1.44,2.9,False,False
21-07-2025 09:00,GEREL,21.2,27.36,20.8,26.12,160254618.0,1.24,4.92,1.54,220.52,4.92,80451288.9,99.19,0.25,True,88.69,2.76,1.19,1.56,2025-07-21,23.44,1,27.36,7.71,27.36,False,False
21-07-2025 09:00,SNPAM,23.99,34.77,23.99,34.6,3200898.06,0.17,10.61,1.27,734.66,10.61,566846.97,464.68,0.02,True,77.73,0.96,-0.16,1.12,2025-07-21,58.55,0,,18.16,40.96,False,False
21-07-2025 09:00,BAHKM,48.7,58.4,48.1,57.45,10662618.0,0.95,8.75,1.18,640.9,8.75,4694476.6,127.13,0.11,True,70.46,0.77,-0.52,1.29,2025-07-21,18.94,0,,39.68,ATH,False,False
21-07-2025 09:00,AKYHO,3.09,3.7,3.07,3.59,53309939.0,0.11,0.5,0.04,1036.36,0.5,21587209.6,146.95,0.22,True,57.73,-0.03,-0.05,0.03,2025-07-21,16.56,0,,2.67,4.62,False,False
21-07-2025 09:00,ONRYT,64.45,76.15,63.85,75.15,21305485.0,1.0,10.7,0.92,1063.04,10.7,12731019.1,67.35,0.09,True,58.61,-0.61,-1.71,1.1,2025-07-21,17.88,0,,56.1,120.7,False,False
14-07-2025 09:00,IMASM,3.23,4.16,3.23,4.16,550072882.0,0.0,0.93,0.13,620.93,0.93,313821515.9,75.28,0.0,True,70.27,0.18,0.06,0.12,2025-07-14,29.19,0,,2.23,ATH,False,False
14-07-2025 09:00,HDFGS,1.69,2.14,1.68,2.14,1061264229.0,0.0,0.45,0.08,429.41,0.45,602575692.7,76.12,0.0,True,77.78,0.09,0.01,0.07,2025-07-14,28.14,0,,1.13,ATH,False,False
14-07-2025 09:00,TNZTP,23.71,29.2,23.5,28.4,28372576.19,0.79,4.7,0.76,515.16,4.7,12344153.57,129.85,0.17,True,72.14,1.25,0.54,0.7,2025-07-14,19.82,0,,17.48,ATH,False,False
14-07-2025 09:00,BIZIM,26.18,28.54,26.18,28.34,3786480.0,0.2,2.16,0.28,682.61,2.16,1722692.5,119.8,0.09,True,56.96,-0.56,-1.02,0.47,2025-07-14,8.33,0,,22.38,30.5,False,False
14-07-2025 09:00,MERIT,14.52,17.7,14.37,17.67,48845745.0,0.03,3.15,0.49,538.95,3.15,23859507.3,104.72,0.01,True,68.5,0.3,-0.29,0.59,2025-07-14,21.78,0,,10.97,17.81,False,False
14-07-2025 09:00,VKING,31.66,35.58,30.64,35.58,3129565.0,0.0,3.92,0.74,429.73,3.92,1020416.0,206.7,0.0,True,64.97,-0.03,-1.1,1.07,2025-07-14,14.04,0,,24.98,39.86,False,False
14-07-2025 09:00,PRKME,17.59,19.9,17.56,19.6,9123643.0,0.3,2.01,0.11,1778.5,2.01,3739911.7,143.95,0.15,True,57.4,-0.48,-0.67,0.19,2025-07-14,11.43,0,,15.43,25.32,True,False
14-07-2025 09:00,DZGYO,6.66,8.61,6.64,8.15,107860553.0,0.46,1.49,0.17,761.27,1.49,41814096.3,157.95,0.31,True,59.91,-0.41,-0.6,0.19,2025-07-14,24.62,1,8.61,5.18,8.61,True,False
07-07-2025 09:00,HOROZ,50.0,59.9,49.3,59.65,21591680.0,0.25,9.65,0.92,944.37,9.65,7035796.6,206.88,0.03,True,58.38,-1.78,-2.52,0.74,2025-07-07,17.65,0,,43.44,76.25,True,True
07-07-2025 09:00,VAKFN,1.64,1.88,1.6,1.82,709944754.29,0.06,0.18,0.02,681.25,0.18,469149389.14,51.33,0.32,True,62.88,0.06,0.06,0.01,2025-07-07,9.24,0,,1.41,1.88,False,False
07-07-2025 09:00,DUNYH,61.75,84.0,61.75,78.0,3711156.0,6.0,16.25,2.48,556.57,16.25,1268833.5,192.49,0.37,True,77.5,3.61,1.48,2.13,2025-07-07,26.62,0,,41.2,ATH,False,False
07-07-2025 09:00,KRONT,9.44,11.66,9.3,11.41,62955199.0,0.25,1.97,0.18,1019.13,1.97,22796934.31,176.16,0.13,True,61.01,-0.3,-0.55,0.25,2025-07-07,18.36,0,,7.47,13.49,True,False
07-07-2025 09:00,BAKAB,32.4,39.72,31.7,39.64,8665816.0,0.08,7.24,0.63,1056.55,7.24,3260351.2,165.79,0.01,True,62.98,-0.42,-1.19,0.77,2025-07-07,21.97,0,,27.56,42.2,False,False
07-07-2025 09:00,OFSYM,43.6,54.25,42.86,53.0,14437259.0,1.25,9.4,1.41,567.61,9.4,8069448.7,78.91,0.13,True,68.43,1.41,0.46,0.95,2025-07-07,20.67,0,,34.48,ATH,False,False
30-06-2025 09:00,SISE,34.7,37.54,34.48,37.06,219448284.0,0.48,2.36,0.02,13011.11,2.36,132397069.7,65.75,0.2,True,51.12,-1.44,-1.68,0.24,2025-06-30,7.3,0,,31.94,41.56,True,True
30-06-2025 09:00,HALKB,23.48,27.34,23.46,26.76,427383608.0,0.58,3.28,0.57,479.51,3.28,215087596.2,98.7,0.18,True,71.6,1.29,0.88,0.41,2025-06-30,14.55,0,,14.12,ATH,False,False
30-06-2025 09:00,LINK,615.5,681.0,602.5,665.5,1048728.0,15.5,50.0,11.55,332.9,50.0,507710.2,106.56,0.31,True,65.55,24.55,11.45,13.1,2025-06-30,10.82,0,,497.25,745.0,False,False
30-06-2025 09:00,ISCTR,12.32,14.36,12.21,14.11,3659646770.0,0.25,1.79,0.26,588.46,1.79,1989518815.3,83.95,0.14,True,61.69,-0.36,-0.6,0.24,2025-06-30,16.13,0,,10.07,16.6,False,False
30-06-2025 09:00,MEGAP,3.42,4.99,3.42,4.99,35576336.0,0.0,1.57,0.2,701.02,1.57,8674324.3,310.13,0.0,True,71.45,0.05,-0.12,0.17,2025-06-30,60.45,0,,2.27,11.74,False,False
30-06-2025 09:00,HATSN,36.08,42.6,36.08,42.06,13055167.0,0.54,5.98,0.28,2066.67,5.98,7200650.9,81.31,0.09,True,53.0,-1.55,-1.81,0.26,2025-06-30,16.57,0,,34.5,51.5,True,True
30-06-2025 09:00,TCELL,89.9,100.2,89.9,98.95,142390613.0,1.25,9.05,0.34,2561.76,9.05,90022320.9,58.17,0.14,True,53.88,-0.83,-0.78,-0.05,2025-06-30,10.81,0,,84.55,100.3,False,False
30-06-2025 09:00,HUNER,3.33,3.8,3.28,3.75,178868917.0,0.05,0.42,0.01,3400.0,0.42,91059562.9,96.43,0.12,True,54.04,-0.03,-0.02,-0.01,2025-06-30,13.29,0,,3.11,4.55,False,False
30-06-2025 09:00,ULUSE,160.7,210.0,156.5,204.5,2602839.0,5.5,43.8,6.26,599.68,43.8,1266113.9,105.58,0.13,True,71.77,1.44,-5.51,6.95,2025-06-30,33.31,0,,122.0,216.5,False,False
30-06-2025 09:00,FENER,4.28,5.3,3.94,5.11,1377592548.94,0.2,0.82,0.14,485.15,0.82,625682298.26,120.17,0.24,True,63.09,0.09,0.01,0.08,2025-06-30,31.09,0,,3.3,6.84,False,False
30-06-2025 09:00,VAKBN,24.68,28.3,24.66,27.64,239682761.0,0.66,2.96,0.58,406.85,2.96,126067295.5,90.12,0.22,True,63.37,0.36,0.02,0.34,2025-06-30,12.91,0,,19.92,29.2,False,False
30-06-2025 09:00,BAGFS,24.64,30.34,24.44,29.8,25164146.0,0.54,5.16,0.42,1116.98,5.16,13061330.5,92.66,0.1,True,62.77,1.28,1.07,0.21,2025-06-30,21.34,0,,17.01,ATH,False,False
30-06-2025 09:00,XBANK,14195.14,16315.45,14151.83,15821.34,7443807426.0,494.11,1626.2,307.64,428.61,1626.2,4503797222.8,65.28,0.3,True,64.35,-9.47,-320.26,310.79,2025-06-30,12.87,0,,11272.13,17131.67,False,False
30-06-2025 09:00,ECILC,42.7,50.75,42.62,50.75,49496585.0,0.0,8.05,0.51,1487.77,8.05,13642013.6,262.82,0.0,True,59.27,-0.04,-0.32,0.29,2025-06-30,18.91,0,,40.4,51.1,False,False
23-06-2025 09:00,AYCES,386.25,491.75,369.75,491.75,852313.0,0.0,105.5,5.62,1775.56,105.5,246455.1,245.83,0.0,True,57.22,-17.98,-21.8,3.82,2025-06-23,27.31,2,369.75,369.75,539.5,True,True
23-06-2025 09:00,ENTRA,9.43,12.3,9.21,12.3,274752282.0,0.0,2.87,0.12,2291.67,2.87,95275697.5,188.38,0.0,True,68.55,0.38,0.3,0.08,2025-06-23,30.99,0,,8.43,ATH,False,False
23-06-2025 09:00,MOPAS,27.1,35.8,25.64,35.24,50085009.0,0.56,8.14,0.76,973.88,8.14,25011109.9,100.25,0.07,True,60.14,0.52,0.06,0.47,2025-06-23,29.56,0,,22.48,ATH,False,False
23-06-2025 09:00,MAALT,623.5,850.0,620.5,849.0,893061.0,1.0,225.5,10.75,1997.67,225.5,221386.4,303.39,0.0,True,57.86,-37.37,-44.38,7.0,2025-06-23,34.55,0,,616.0,924.0,True,True
23-06-2025 09:00,NTHOL,40.06,44.1,39.94,44.1,12690104.0,0.0,4.04,0.67,504.79,4.04,8452701.7,50.13,0.0,True,57.77,0.05,-0.34,0.39,2025-06-23,10.25,0,,34.18,50.9,False,False
23-06-2025 09:00,GRSEL,243.9,293.0,230.5,285.0,7207050.0,8.0,41.1,1.42,2804.59,41.1,4455500.5,61.76,0.19,True,60.0,19.46,23.76,-4.3,2025-06-23,16.66,2,230.5,230.5,317.5,False,False
16-06-2025 09:00,DITAS,8.92,12.32,8.92,11.84,34329459.0,0.48,2.92,0.51,471.71,2.92,22426800.43,53.07,0.16,True,69.02,0.51,-0.03,0.53,2025-06-16,32.69,0,,5.61,13.97,False,False
16-06-2025 09:00,INVEO,7.14,8.47,7.14,8.31,151342352.0,0.16,1.17,0.14,760.29,1.17,46000983.1,229.0,0.14,True,65.13,-0.11,-0.32,0.21,2025-06-16,18.71,0,,5.79,8.75,False,False
16-06-2025 09:00,IHLGM,1.78,2.45,1.77,2.33,518975836.0,0.12,0.55,0.06,773.02,0.55,315932757.3,64.27,0.22,True,64.45,0.06,0.02,0.04,2025-06-16,30.17,0,,1.45,2.87,False,False
16-06-2025 09:00,ICUGS,2.41,3.13,2.35,2.94,464264578.0,0.19,0.53,0.04,1104.55,0.53,271330851.8,71.11,0.36,True,46.16,-0.58,-0.63,0.06,2025-06-16,21.49,0,,2.08,6.62,False,False
16-06-2025 09:00,TUPRS,131.6,144.6,129.8,144.6,152023654.0,0.0,13.0,1.22,965.57,13.0,73111361.9,107.93,0.0,True,56.43,-3.33,-5.08,1.75,2025-06-16,10.13,0,,117.3,156.2,False,False
16-06-2025 09:00,GEDIK,5.94,7.46,5.62,7.46,176009066.0,0.0,1.52,0.3,401.65,1.52,33711260.8,422.11,0.0,True,86.77,0.46,0.18,0.28,2025-06-16,33.13,0,,3.32,ATH,False,False
10-06-2025 09:00,SNICA,3.91,4.5,3.9,4.47,87134676.0,0.03,0.56,0.05,998.04,0.56,48144648.5,80.99,0.05,True,49.78,-0.34,-0.41,0.08,2025-06-10,15.21,0,,3.56,6.26,True,True
02-06-2025 09:00,KLRHO,55.05,73.25,53.3,72.5,21291835.0,0.75,17.45,4.32,304.12,17.45,11634267.1,83.01,0.04,True,86.98,5.92,1.38,4.54,2025-06-02,29.35,0,,22.5,ATH,False,False
26-05-2025 09:00,AKFIS,20.66,24.2,20.5,23.58,170936360.0,0.62,2.92,0.52,458.32,2.92,43597947.6,292.07,0.21,True,49.55,-0.31,-0.57,0.26,2025-05-26,14.13,0,,17.66,ATH,False,False
26-05-2025 09:00,BIGCH,27.58,35.5,26.4,34.24,19860578.0,1.26,6.66,0.92,627.07,6.66,6777770.2,193.03,0.19,True,60.01,-0.16,-0.54,0.37,2025-05-26,26.35,0,,23.26,36.36,False,False
26-05-2025 09:00,KRDMA,35.0,39.6,35.0,38.9,34182357.0,0.7,3.9,0.08,5031.58,3.9,18623088.5,83.55,0.18,True,60.31,2.78,3.02,-0.24,2025-05-26,11.02,0,,30.76,41.42,False,False
26-05-2025 09:00,VSNMD,330.75,448.25,304.0,415.0,31699086.0,33.25,84.25,27.99,200.95,84.25,10826198.0,192.8,0.39,True,83.64,34.11,22.07,12.04,2025-05-26,25.47,0,,ATL,ATH,False,False
26-05-2025 09:00,TEKTU,5.32,6.49,5.11,6.43,171057088.0,0.06,1.11,0.25,351.22,1.11,76125488.1,124.7,0.05,True,69.83,0.17,-0.05,0.22,2025-05-26,20.41,0,,3.61,ATH,False,False
26-05-2025 09:00,FLAP,9.31,11.4,9.3,11.15,36498329.0,0.25,1.84,0.34,442.77,1.84,11591289.8,214.88,0.14,True,66.55,-0.1,-0.42,0.32,2025-05-26,21.06,1,11.4,6.81,11.4,True,False
20-05-2025 09:00,INFO,2.2,2.6,2.18,2.5,182769039.0,0.1,0.3,0.01,4185.71,0.3,57430079.5,218.25,0.33,True,57.93,-0.06,-0.07,0.02,2025-05-20,14.68,0,,1.85,2.9,False,False
20-05-2025 09:00,ICBCT,14.03,16.04,13.97,15.51,21545868.0,0.53,1.48,0.02,9150.0,1.48,10466446.8,105.86,0.36,True,62.94,-0.03,-0.26,0.23,2025-05-20,11.42,0,,11.55,15.92,False,False
20-05-2025 09:00,BALSU,18.42,25.02,18.3,24.6,147396307.0,0.42,6.18,0.64,870.17,6.18,58295289.9,152.84,0.07,True,74.78,0.54,0.1,0.44,2025-05-20,33.7,0,,ATL,ATH,False,False
12-05-2025 09:00,PSDTC,74.15,106.0,74.05,106.0,1814220.0,0.0,31.85,1.66,1818.67,31.85,977556.8,85.59,0.0,True,67.32,-0.81,-3.03,2.23,2025-05-12,42.95,0,,68.0,126.0,True,True
12-05-2025 09:00,IZFAS,29.36,34.32,29.06,34.18,56400714.32,0.13,4.82,1.06,356.28,4.82,37584975.98,50.06,0.03,True,75.89,2.56,1.87,0.7,2025-05-12,16.9,0,,20.07,ATH,False,False
12-05-2025 09:00,TERA,31.14,41.98,29.92,41.62,428307324.44,0.36,10.48,2.79,275.93,10.48,213538223.56,100.58,0.03,True,91.5,5.99,3.25,2.74,2025-05-12,46.94,0,,7.75,ATH,False,False
12-05-2025 09:00,ENDAE,17.58,21.62,17.16,20.6,59080890.0,1.02,3.02,0.5,506.43,3.02,35099828.4,68.32,0.34,True,74.39,0.46,0.05,0.42,2025-05-12,16.65,1,21.62,ATL,21.62,False,False
05-05-2025 09:00,PRDGS,5.49,6.45,5.31,6.45,161520700.0,0.0,0.96,0.11,772.73,0.96,29801124.2,442.0,0.0,True,65.84,-0.08,-0.21,0.13,2025-05-05,22.16,0,,4.26,7.47,False,False
05-05-2025 09:00,CASA,71.5,104.6,71.5,104.6,783110.0,0.0,33.1,2.7,1125.93,33.1,206354.7,279.5,0.0,True,73.19,-2.32,-4.45,2.13,2025-05-05,60.92,0,,58.35,108.7,True,True
05-05-2025 09:00,SAYAS,30.4,38.58,29.8,36.94,22140596.0,1.64,6.54,0.23,2694.87,6.54,7462594.8,196.69,0.25,True,45.76,-4.32,-4.79,0.47,2025-05-05,21.59,0,,27.6,52.5,True,False
05-05-2025 09:00,SELEC,65.2,70.35,64.8,69.5,12567774.0,0.85,4.3,0.23,1729.79,4.3,8135490.8,54.48,0.2,True,53.08,-0.84,-0.43,-0.41,2025-05-05,7.01,0,,58.95,85.25,False,False
05-05-2025 09:00,KZGYO,19.13,22.46,19.13,22.02,18513025.0,0.44,2.89,0.18,1470.65,2.89,6259834.8,195.74,0.15,True,54.86,-0.5,-0.58,0.08,2025-05-05,15.41,0,,17.25,22.6,False,False
28-04-2025 09:00,GOODY,15.33,17.95,14.76,17.46,36934712.0,0.49,2.13,0.23,806.38,2.13,9942998.8,271.46,0.23,True,54.48,-0.4,-0.47,0.07,2025-04-28,14.34,0,,13.65,20.52,False,False
28-04-2025 09:00,LRSHO,2.85,3.96,2.81,3.96,359056891.0,0.0,1.11,0.16,616.13,1.11,141706562.9,153.38,0.0,True,77.69,0.13,-0.03,0.16,2025-04-28,45.59,0,,2.0,4.57,False,False
28-04-2025 09:00,BNTAS,5.59,6.4,5.39,6.3,66778348.0,0.1,0.71,0.08,817.11,0.71,26763407.42,149.51,0.14,True,53.3,-0.14,-0.15,0.01,2025-04-28,12.7,0,,4.89,7.24,False,False
28-04-2025 09:00,DGATE,61.0,75.1,60.1,75.0,8551468.0,0.1,14.0,1.19,1073.51,14.0,2491671.5,243.2,0.01,True,71.7,4.21,3.1,1.1,2025-04-28,27.44,0,,43.6,ATH,False,False
28-04-2025 09:00,ADESE,0.42,0.53,0.42,0.53,2768903895.0,0.0,0.11,0.01,714.29,0.11,1180348884.5,134.58,0.0,True,69.48,0.0,-0.01,0.01,2025-04-28,27.88,0,,0.35,0.54,False,False
28-04-2025 09:00,EDIP,22.7,29.48,21.98,28.24,31522492.0,1.24,5.54,0.86,541.95,5.54,9861761.1,219.64,0.22,True,67.7,0.3,-0.35,0.65,2025-04-28,27.32,0,,17.38,31.62,False,False
21-04-2025 09:00,GARFA,20.88,28.96,20.44,28.96,40259394.0,0.0,8.08,1.03,686.76,8.08,8766736.3,359.23,0.0,True,72.46,-0.03,-0.87,0.84,2025-04-21,45.45,0,,14.83,ATH,False,False
14-04-2025 09:00,BOBET,18.73,23.58,18.73,23.32,83293646.0,0.26,4.59,0.03,15200.0,4.59,20411642.9,308.07,0.06,True,53.59,-0.86,-0.85,-0.01,2025-04-14,25.04,0,,17.52,25.86,True,True
14-04-2025 09:00,SUWEN,8.33,10.5,8.06,10.3,60553605.5,0.2,1.97,0.15,1214.67,1.97,17083998.8,254.45,0.1,True,52.54,-0.57,-0.59,0.02,2025-04-14,23.92,0,,7.84,12.68,True,True
14-04-2025 09:00,OZSUB,18.52,22.88,17.64,22.04,22403435.0,0.84,3.52,0.34,926.24,3.52,10691090.9,109.55,0.24,True,64.33,0.67,0.42,0.25,2025-04-14,19.14,0,,15.53,ATH,False,False
14-04-2025 09:00,KRTEK,27.32,32.0,26.94,31.7,5996885.0,0.3,4.38,0.06,7200.0,4.38,3222551.1,86.09,0.07,True,53.85,-1.15,-0.71,-0.43,2025-04-14,16.12,0,,22.16,42.0,False,False
14-04-2025 09:00,ENERY,3.84,4.74,3.76,4.57,594346372.0,0.17,0.73,0.1,625.27,0.73,246153559.86,141.45,0.23,True,65.46,0.03,0.0,0.02,2025-04-14,19.01,0,,3.08,4.8,False,False
07-04-2025 09:00,GZNMI,103.5,131.0,102.7,130.0,3982056.0,1.0,26.5,6.11,334.07,26.5,1930115.5,106.31,0.04,True,89.33,13.31,8.97,4.34,2025-04-07,23.34,0,,64.2,ATH,False,False
07-04-2025 09:00,BIENY,33.5,37.68,32.62,37.64,19549922.0,0.04,4.14,0.72,473.41,4.14,9303486.8,110.14,0.01,True,64.55,0.46,-0.13,0.59,2025-04-07,10.97,0,,28.18,38.42,False,False
07-04-2025 09:00,SONME,107.5,136.4,102.3,136.4,1080017.0,0.0,28.9,5.1,466.67,28.9,409254.7,163.9,0.0,True,73.53,5.85,2.23,3.62,2025-04-07,26.41,0,,77.9,ATH,False,False
07-04-2025 09:00,BLUME,15.15,18.79,14.82,18.79,45888264.0,0.0,3.64,0.17,2016.28,3.64,20894674.1,119.62,0.0,True,60.19,0.35,0.28,0.07,2025-04-07,21.54,0,,14.36,ATH,False,False
07-04-2025 09:00,DMRGD,1.75,2.3,1.7,2.3,319756384.0,0.0,0.55,0.06,751.06,0.55,162037528.0,97.33,0.0,True,74.55,0.08,0.02,0.06,2025-04-07,28.65,0,,1.48,ATH,False,False
07-04-2025 09:00,EGSER,3.17,3.53,3.12,3.53,41133170.0,0.0,0.36,0.0,17900.0,0.36,16139319.4,154.86,0.0,True,49.32,-0.11,-0.09,-0.02,2025-04-07,8.28,0,,2.92,4.29,False,False
07-04-2025 09:00,MACKO,29.25,36.48,28.38,34.52,8524020.0,1.95,5.27,0.64,721.01,5.27,4745744.8,79.61,0.37,True,65.99,1.92,1.59,0.33,2025-04-07,17.03,0,,23.25,ATH,False,False
07-04-2025 09:00,BINHO,8.49,10.93,8.07,10.8,212846797.88,0.13,2.31,0.03,8719.44,2.31,74818100.96,184.49,0.06,True,51.15,-0.95,-1.05,0.11,2025-04-07,26.71,0,,7.21,13.61,True,False
07-04-2025 09:00,TUREX,28.34,33.28,28.2,33.18,98469841.0,0.1,4.84,1.78,172.06,4.84,48479222.8,103.12,0.02,True,88.43,4.03,2.66,1.37,2025-04-07,17.33,0,,ATL,ATH,False,False
07-04-2025 09:00,GLCVY,51.4,59.0,48.86,58.65,7286044.0,0.35,7.25,0.65,1008.56,7.25,3702946.0,96.76,0.05,True,66.25,1.77,1.15,0.62,2025-04-07,13.11,0,,42.0,ATH,False,False
07-04-2025 09:00,YONGA,61.95,76.3,61.3,73.5,315039.0,2.8,11.55,2.14,438.46,11.55,134384.5,134.43,0.24,True,61.1,-2.37,-4.45,2.07,2025-04-07,21.49,0,,48.5,83.75,True,False
02-04-2025 09:00,ETILR,4.42,5.87,4.35,5.87,84741290.82,0.0,1.45,0.24,492.84,1.45,42321258.63,100.23,0.0,True,60.48,-0.26,-0.45,0.19,2025-04-02,32.84,0,,2.53,9.32,True,False
02-04-2025 09:00,RUZYE,7.3,9.63,7.3,9.63,26711218.0,0.0,2.33,0.12,1779.03,2.33,16466665.3,62.21,0.0,True,65.39,0.21,0.12,0.09,2025-04-02,32.83,0,,6.35,ATH,False,False
02-04-2025 09:00,CEMTS,10.0,13.03,10.0,13.03,67689815.0,0.0,3.03,0.32,861.9,3.03,25234004.3,168.25,0.0,True,71.27,0.33,0.04,0.29,2025-04-02,32.96,0,,8.5,13.29,False,False
24-03-2025 09:00,POLHO,8.28,11.1,8.28,11.1,52967167.85,0.0,2.83,0.25,1038.89,2.83,20366790.07,160.07,0.0,True,67.49,0.08,-0.09,0.17,2025-03-24,34.79,0,,7.81,ATH,False,False
24-03-2025 09:00,MHRGY,2.69,3.47,2.68,3.39,42949024.38,0.08,0.7,0.01,5733.33,0.7,25260076.5,70.03,0.11,True,56.47,-0.02,-0.01,-0.01,2025-03-24,25.74,0,,2.61,3.49,False,False
24-03-2025 09:00,HEDEF,5.05,6.79,5.05,6.33,136631888.0,0.46,1.28,0.15,747.68,1.28,89680443.8,52.35,0.36,True,70.76,0.49,0.29,0.21,2025-03-24,25.35,0,,2.86,ATH,False,False
24-03-2025 09:00,OZATD,109.0,128.3,106.0,127.5,24294042.0,0.8,18.5,3.35,452.24,18.5,15942674.8,52.38,0.04,True,66.08,6.48,3.38,3.1,2025-03-24,17.95,0,,ATL,ATH,False,False
17-03-2025 09:00,USAK,1.71,2.38,1.68,2.26,1981637701.59,0.12,0.54,0.03,1638.2,0.54,599106637.87,230.77,0.22,True,62.13,0.0,-0.03,0.03,2025-03-17,31.76,0,,1.35,5.58,True,True
17-03-2025 09:00,TKFEN,99.45,129.6,96.4,129.3,106643096.0,0.3,29.85,5.81,413.77,29.85,35869388.9,197.31,0.01,True,84.93,7.86,3.47,4.39,2025-03-17,33.57,0,,58.65,ATH,False,False
10-03-2025 09:00,DURKN,14.3,18.56,14.3,18.56,42978120.0,0.0,4.26,0.11,3844.44,4.26,21466360.2,100.21,0.0,True,59.72,0.27,0.21,0.06,2025-03-10,29.79,0,,14.17,18.6,False,False
10-03-2025 09:00,GOKNR,22.16,25.9,22.16,25.56,62281029.0,0.34,3.4,0.16,2051.9,3.4,21144337.7,194.55,0.1,True,53.42,-1.1,-1.14,0.04,2025-03-10,15.87,0,,23.1,29.94,True,True
10-03-2025 09:00,TRCAS,27.26,35.52,27.2,33.3,21794916.0,2.22,6.04,0.55,1002.19,6.04,10189931.3,113.89,0.37,True,69.11,0.95,0.48,0.47,2025-03-10,22.25,1,35.52,21.0,35.52,False,False
10-03-2025 09:00,BRLSM,14.18,18.04,13.71,17.06,34055556.0,0.98,2.88,0.14,1942.55,2.88,13513578.5,152.01,0.34,True,57.56,-0.6,-0.77,0.17,2025-03-10,24.16,0,,12.2,17.8,True,True
10-03-2025 09:00,TTRAK,745.0,841.5,732.5,829.0,2270605.0,12.5,84.0,9.9,748.48,84.0,1111295.5,104.32,0.15,True,63.88,-11.56,-23.45,11.89,2025-03-10,11.28,0,,672.0,1082.0,True,False
10-03-2025 09:00,GSDHO,3.67,4.1,3.63,4.05,90351867.0,0.05,0.38,0.0,12566.67,0.38,37808868.8,138.97,0.13,True,59.34,-0.03,-0.04,0.01,2025-03-10,10.35,0,,3.35,4.19,False,False
10-03-2025 09:00,CELHA,7.24,8.25,7.01,8.25,38107855.48,0.0,1.01,0.04,2395.58,1.01,22433125.98,69.87,0.0,True,47.26,-0.64,-0.7,0.06,2025-03-10,14.79,0,,6.65,9.5,False,False
10-03-2025 09:00,ORGE,84.3,97.15,83.45,95.75,13570047.0,1.4,11.45,1.06,985.31,11.45,4763425.6,184.88,0.12,True,65.87,2.94,2.84,0.1,2025-03-10,13.58,0,,73.0,ATH,False,False
10-03-2025 09:00,KFEIN,10.03,12.5,10.03,11.99,69031340.0,0.51,1.96,0.32,511.54,1.96,36244860.0,90.46,0.26,True,63.01,0.11,-0.14,0.25,2025-03-10,19.54,0,,8.29,ATH,False,False
10-03-2025 09:00,MAKTK,7.46,9.49,7.46,9.44,120653698.0,0.05,1.98,0.22,787.89,1.98,31437865.8,283.78,0.03,True,70.0,0.14,-0.08,0.22,2025-03-10,27.22,0,,5.97,9.74,False,False
10-03-2025 09:00,CLEBI,2245.0,2498.0,2137.0,2482.0,652452.0,16.0,237.0,45.2,424.34,237.0,341058.5,91.3,0.07,True,67.64,61.88,18.13,43.75,2025-03-10,11.45,0,,1660.0,2650.0,False,False
10-03-2025 09:00,BESLR,14.77,17.9,14.77,17.46,68848545.0,0.44,2.69,0.13,1907.46,2.69,22018235.0,212.69,0.16,True,65.94,-0.1,-0.31,0.21,2025-03-10,30.01,0,,11.91,20.98,False,False
10-03-2025 09:00,GOLTS,414.5,462.5,410.5,462.25,2927968.0,0.25,47.75,3.3,1346.97,47.75,1453137.5,101.49,0.01,True,56.52,-6.21,-7.44,1.23,2025-03-10,9.99,0,,376.75,526.0,False,False
03-03-2025 09:00,LOGO,113.9,133.6,112.3,128.0,5034275.0,5.6,14.1,1.0,1310.0,14.1,2687964.2,87.29,0.4,True,62.28,3.33,3.27,0.06,2025-03-03,12.38,0,,103.4,ATH,False,False
03-03-2025 09:00,EUREN,4.26,5.06,4.23,5.02,268868327.0,0.04,0.76,0.0,18900.0,0.76,102997071.4,161.04,0.05,True,58.6,-0.09,-0.14,0.05,2025-03-03,18.96,0,,3.71,5.1,False,False
03-03-2025 09:00,PAPIL,13.8,20.34,13.8,18.67,181825304.0,1.67,4.87,0.58,738.21,4.87,59995163.9,203.07,0.34,True,63.62,-0.31,-1.01,0.7,2025-03-03,35.98,0,,11.35,26.85,True,False
03-03-2025 09:00,INGRM,372.75,440.75,356.25,440.75,448622.0,0.0,68.0,0.42,15900.0,68.0,175715.7,155.31,0.0,True,49.29,-19.94,-19.38,-0.55,2025-03-03,18.01,2,356.25,356.25,486.75,True,True
17-02-2025 09:00,GENIL,113.9,146.6,111.5,141.7,9479637.0,4.9,27.8,2.62,961.07,27.8,3519854.8,169.32,0.18,True,73.68,10.13,8.85,1.29,2025-02-17,24.52,0,,79.95,ATH,False,False
17-02-2025 09:00,GRTHO,202.1,239.0,201.9,228.8,5631992.0,10.2,26.7,8.72,206.19,26.7,2677274.9,110.36,0.38,True,78.17,24.17,18.46,5.72,2025-02-17,13.32,0,,53.0,ATH,False,False
17-02-2025 09:00,ARENA,38.4,45.96,38.4,45.0,24532091.0,0.96,6.6,1.39,375.5,6.6,14080996.4,74.22,0.15,True,66.27,1.01,-0.57,1.58,2025-02-17,17.49,0,,24.9,49.86,False,False
10-02-2025 09:00,TRILC,18.59,22.3,17.93,21.78,86888469.0,0.52,3.19,0.34,835.48,3.19,56437169.1,53.96,0.16,True,57.84,-0.81,-1.32,0.51,2025-02-10,17.16,0,,15.96,30.58,True,False
03-02-2025 09:00,CEOEM,25.0,30.38,24.46,30.1,24359610.0,0.28,5.1,0.03,18114.29,5.1,16170081.2,50.65,0.05,True,44.15,-3.61,-1.99,-1.63,2025-02-03,20.4,2,24.46,24.46,67.0,False,False
27-01-2025 09:00,SMRTG,13.29,15.2,13.08,14.71,97475467.48,0.49,1.42,0.17,752.0,1.42,57292042.49,70.14,0.34,True,54.75,-0.28,-0.55,0.27,2025-01-27,10.9,1,15.2,11.11,15.2,False,False
20-01-2025 09:00,RALYH,58.18,78.23,58.18,75.49,46214949.07,2.74,17.31,2.21,682.05,17.31,13246707.79,248.88,0.16,True,73.52,4.13,2.75,1.38,2025-01-20,29.86,0,,37.19,ATH,False,False
20-01-2025 09:00,TTKOM,46.38,49.7,45.88,49.7,189148100.0,0.0,3.32,0.36,817.13,3.32,121321277.6,55.91,0.0,True,59.5,-0.03,-0.12,0.09,2025-01-20,7.53,0,,43.14,57.8,False,False
13-01-2025 09:00,DYOBY,25.4,29.52,25.14,29.18,33423017.0,0.34,3.78,0.57,567.84,3.78,13815212.5,141.93,0.09,True,71.33,1.54,1.06,0.47,2025-01-13,15.06,0,,17.91,ATH,False,False
13-01-2025 09:00,AVOD,3.11,3.58,3.09,3.51,111574401.0,0.07,0.4,0.07,515.38,0.4,37132257.7,200.48,0.18,True,64.96,-0.02,-0.09,0.07,2025-01-13,13.23,0,,2.66,4.23,True,False
13-01-2025 09:00,OSTIM,2.36,2.85,2.33,2.81,227452917.45,0.04,0.45,0.08,486.81,0.45,135420129.83,67.96,0.09,True,74.98,0.13,0.09,0.05,2025-01-13,19.12,0,,1.49,ATH,False,False
06-01-2025 09:00,KARTN,96.0,113.9,94.25,113.9,2982782.0,0.0,17.9,2.81,537.01,17.9,1517513.0,96.56,0.0,True,64.9,-1.01,-4.33,3.32,2025-01-06,19.08,0,,75.3,136.3,True,False
30-12-2024 09:00,TSPOR,0.94,1.21,0.93,1.21,2641014560.0,0.0,0.27,0.03,864.29,0.27,1287402020.8,105.14,0.0,True,54.92,-0.1,-0.12,0.02,2024-12-30,28.72,0,,0.88,2.03,True,True
23-12-2024 09:00,NATEN,11.0,12.61,10.64,12.6,77505940.0,0.01,1.6,0.15,970.95,1.6,30218365.5,156.49,0.01,True,65.35,0.2,0.14,0.06,2024-12-23,16.02,0,,9.75,13.5,False,False
23-12-2024 09:00,DAGI,4.8,5.61,4.28,5.42,46396153.96,0.19,0.62,0.17,260.53,0.62,30651477.44,51.37,0.3,True,80.6,0.49,0.33,0.15,2024-12-23,14.08,0,,2.51,ATH,False,False
23-12-2024 09:00,ZEDUR,7.9,9.38,7.7,8.97,58886613.0,0.41,1.07,0.11,846.9,1.07,13038237.2,351.65,0.38,True,49.57,-0.5,-0.67,0.17,2024-12-23,13.83,0,,7.03,19.26,True,False
16-12-2024 09:00,SKYMD,11.54,13.4,10.99,13.3,84466095.0,0.1,1.76,0.35,398.58,1.76,17871435.3,372.63,0.06,True,67.52,0.09,-0.25,0.34,2024-12-16,13.19,0,,9.14,19.17,True,False
16-12-2024 09:00,CUSAN,21.42,27.02,21.22,26.56,17883847.0,0.46,5.14,0.72,608.97,5.14,3841313.2,365.57,0.09,True,72.58,0.03,-0.56,0.58,2024-12-16,23.88,0,,18.1,ATH,False,False
09-12-2024 09:00,GWIND,27.48,30.36,27.46,30.28,27115597.0,0.08,2.8,0.58,386.11,2.8,15041069.2,80.28,0.03,True,60.98,-0.58,-0.95,0.37,2024-12-09,10.51,0,,22.48,34.4,False,False
09-12-2024 09:00,GSDDE,8.57,11.64,8.5,10.97,76204011.0,0.67,2.4,0.37,553.95,2.4,17455262.4,336.57,0.28,True,71.53,0.01,-0.33,0.34,2024-12-09,28.3,1,11.64,6.72,11.64,True,False
09-12-2024 09:00,ALFAS,51.7,60.45,51.5,59.9,35113416.0,0.55,8.2,0.68,1111.23,8.2,15971978.5,119.84,0.07,True,49.4,-3.81,-4.97,1.17,2024-12-09,16.54,0,,46.84,ATH,True,False
09-12-2024 09:00,DERHL,11.15,16.48,11.05,15.08,93087678.0,1.4,3.93,0.61,542.16,3.93,39877451.8,133.43,0.36,True,65.27,0.72,0.39,0.34,2024-12-09,37.34,0,,7.7,ATH,False,False
09-12-2024 09:00,BEGYO,4.39,5.59,4.36,5.51,382868469.0,0.08,1.12,0.21,435.89,1.12,130699631.5,192.94,0.07,True,73.17,0.2,0.0,0.2,2024-12-09,25.51,0,,3.07,ATH,False,False
02-12-2024 09:00,VESTL,63.3,73.15,62.0,71.1,37991408.0,2.05,7.8,0.52,1400.0,7.8,19889455.4,91.01,0.26,True,54.97,-3.37,-4.55,1.18,2024-12-02,11.35,0,,54.1,107.3,True,False
02-12-2024 09:00,BIGTK,179.6,230.4,177.5,230.4,3893608.0,0.0,50.8,0.76,6584.21,50.8,1301778.1,199.1,0.0,True,58.89,-6.84,-5.95,-0.89,2024-12-02,28.57,0,,155.9,277.0,False,False
02-12-2024 09:00,TKNSA,30.6,34.38,30.14,33.76,19218871.0,0.62,3.16,0.68,366.08,3.16,12252010.6,56.86,0.2,True,60.6,-0.78,-1.71,0.93,2024-12-02,10.33,0,,23.36,44.74,True,False
02-12-2024 09:00,YYAPI,1.41,1.86,1.41,1.75,973649932.77,0.11,0.34,0.05,527.19,0.34,376804715.56,158.4,0.34,True,72.61,0.01,-0.05,0.05,2024-12-02,24.57,1,1.86,0.91,1.86,False,False
02-12-2024 09:00,BORLS,12.59,13.98,12.51,13.88,44134834.02,0.1,1.29,0.47,171.85,1.29,27530181.33,60.31,0.07,True,81.17,0.94,0.57,0.37,2024-12-02,10.24,0,,ATL,ATH,False,False
02-12-2024 09:00,MARBL,12.78,13.47,12.63,13.32,21219732.0,0.15,0.54,0.08,620.0,0.54,12402144.0,71.1,0.28,True,45.1,-0.62,-0.77,0.15,2024-12-02,4.23,0,,11.51,17.6,True,False
25-11-2024 09:00,BRYAT,2030.0,2280.0,2019.0,2225.0,659884.0,55.0,195.0,9.3,1996.77,195.0,409370.0,61.2,0.28,True,50.67,-91.1,-139.47,48.38,2024-11-25,11.36,0,,1697.0,2480.0,True,False
25-11-2024 09:00,DARDL,2.12,2.46,2.1,2.46,60115278.43,0.0,0.34,0.01,2545.16,0.34,33833931.33,77.68,0.0,True,55.66,-0.1,-0.12,0.02,2024-11-25,17.22,0,,1.95,3.5,True,True
25-11-2024 09:00,YAYLA,13.3,18.12,13.18,18.12,58538286.0,0.0,4.82,0.21,2206.22,4.82,22223114.3,163.41,0.0,True,58.57,-0.6,-0.87,0.27,2024-11-25,36.65,0,,11.51,20.54,True,False
25-11-2024 09:00,YESIL,1.47,1.91,1.46,1.91,698562957.0,0.0,0.44,0.04,1000.0,0.44,234326222.8,198.12,0.0,True,56.55,-0.15,-0.18,0.03,2024-11-25,30.82,0,,1.22,2.75,True,False
18-11-2024 09:00,CRDFA,6.21,7.75,6.02,7.66,77081790.0,0.09,1.45,0.13,990.23,1.45,33239713.8,131.9,0.06,True,59.91,-0.32,-0.47,0.15,2024-11-18,25.57,0,,5.01,ATH,True,False
18-11-2024 09:00,TRENJ,37.68,49.6,36.78,49.6,64456255.0,0.0,11.92,0.61,1841.37,11.92,24573613.2,162.3,0.0,True,65.38,-0.56,-0.75,0.19,2024-11-18,32.41,0,,32.78,54.2,True,False
11-11-2024 09:00,AVHOL,34.96,44.5,33.26,43.64,24095128.0,0.86,8.68,0.68,1180.24,8.68,5169455.6,366.11,0.1,True,65.04,-0.12,-0.91,0.8,2024-11-11,25.76,0,,31.26,ATH,True,False
04-11-2024 09:00,DOFER,26.0,31.56,24.82,31.56,8843572.0,0.0,5.56,0.05,10196.3,5.56,4145248.6,113.34,0.0,True,44.07,-2.7,-2.54,-0.16,2024-11-04,18.56,0,,24.52,54.7,True,True
04-11-2024 09:00,ODINE,83.6,101.0,80.2,101.0,28293063.0,0.0,17.4,1.0,1640.0,17.4,15090434.2,87.49,0.0,True,61.7,2.24,1.97,0.27,2024-11-04,21.91,0,,75.3,121.1,False,False
04-11-2024 09:00,SUNTK,20.66,25.84,18.72,25.84,25653125.0,0.0,5.18,0.88,486.64,5.18,9986756.9,156.87,0.0,True,73.1,0.76,0.27,0.49,2024-11-04,25.19,0,,16.33,ATH,False,False
14-10-2024 09:00,MARKA,47.4,74.4,47.4,72.1,3989718.0,2.3,24.7,0.03,91379.45,24.7,1815901.1,119.71,0.09,True,48.43,-7.86,-7.74,-0.12,2024-10-14,54.26,0,,40.0,106.2,False,False
14-10-2024 09:00,MRSHL,1400.0,1977.0,1346.0,1977.0,454894.0,0.0,577.0,9.4,6038.3,577.0,159849.7,184.58,0.0,True,54.68,-91.63,-95.99,4.35,2024-10-14,41.21,2,1346.0,1346.0,2647.5,False,False
16-09-2024 09:00,ULAS,20.22,27.5,20.06,26.4,3530104.0,1.1,6.18,0.2,3053.06,6.18,1905337.3,85.27,0.18,True,55.51,-0.93,-0.94,0.0,2024-09-16,31.61,0,,19.2,ATH,False,False
16-09-2024 09:00,ELITE,28.4,36.42,28.3,34.2,26681133.0,2.22,5.8,0.46,1171.93,5.8,12594703.9,111.84,0.38,True,48.68,-1.61,-2.13,0.52,2024-09-16,23.91,0,,27.0,ATH,False,False
26-08-2024 09:00,VERUS,302.0,354.0,302.0,354.0,1080657.0,0.0,52.0,7.08,634.98,52.0,579500.1,86.48,0.0,True,69.21,12.0,8.26,3.73,2024-08-26,17.41,0,,ATL,ATH,False,False
19-08-2024 09:00,SAMAT,13.94,16.1,13.94,16.1,64577479.41,0.0,2.16,0.18,1107.27,2.16,23093125.46,179.64,0.0,True,51.98,-0.18,-0.23,0.05,2024-08-19,15.51,0,,ATL,ATH,False,False
12-08-2024 09:00,GLRYH,2.63,3.1,2.6,3.1,246251164.78,0.0,0.47,0.03,1474.8,0.47,77944405.82,215.93,0.0,True,58.81,0.02,0.01,0.01,2024-08-12,17.75,0,,2.56,ATH,False,False
12-08-2024 09:00,ULUFA,3.27,3.81,3.26,3.81,70690886.79,0.0,0.53,0.08,587.9,0.53,44520806.77,58.78,0.0,True,61.45,0.05,0.04,0.01,2024-08-12,16.93,0,,2.92,3.89,False,False
12-08-2024 09:00,PRZMA,11.68,14.19,11.68,14.02,30357292.27,0.17,2.34,0.2,1085.81,2.34,12491049.57,143.03,0.07,True,45.63,-0.74,-0.83,0.1,2024-08-12,20.24,0,,10.26,ATH,False,False
12-08-2024 09:00,PRKAB,32.6,39.2,31.08,39.06,11122366.0,0.14,6.46,0.36,1714.61,6.46,4591500.7,142.24,0.02,True,52.93,-0.43,-0.24,-0.19,2024-08-12,19.82,0,,ATL,53.5,False,False
12-08-2024 09:00,BANVT,310.0,387.25,303.75,378.0,3201556.0,9.25,68.0,13.9,389.21,68.0,1686452.0,89.84,0.14,True,71.59,23.71,21.3,2.41,2024-08-12,22.63,0,,ATL,ATH,False,False
05-08-2024 09:00,GIPTA,34.84,41.42,33.12,41.4,22990497.0,0.02,6.56,0.57,1050.88,6.56,10031816.0,129.18,0.0,True,52.41,-1.22,-1.73,0.51,2024-08-05,15.51,0,,29.46,ATH,False,False
05-08-2024 09:00,ERSU,18.15,29.32,17.08,29.32,55272821.0,0.0,11.17,0.54,1972.36,11.17,11937080.5,363.03,0.0,True,56.59,-2.52,-2.73,0.21,2024-08-05,60.92,0,,16.55,ATH,False,False
22-07-2024 09:00,KAREL,15.17,17.48,15.0,17.48,42651468.0,0.0,2.31,0.13,1623.88,2.31,25000372.8,70.6,0.0,True,61.42,0.18,0.11,0.08,2024-07-22,15.76,0,,ATL,ATH,False,False
22-07-2024 09:00,CIMSA,34.0,36.78,33.74,36.74,66255708.0,0.04,2.74,0.16,1634.18,2.74,42347461.2,56.46,0.01,True,65.7,0.45,0.11,0.34,2024-07-22,8.51,0,,29.1,ATH,False,False
16-07-2024 09:00,AFYON,13.3,15.0,13.17,14.93,65002599.0,0.07,1.63,0.01,27066.67,1.63,28122198.4,131.14,0.04,True,64.81,-0.01,-0.04,0.03,2024-07-16,13.19,0,,11.6,15.6,False,False
16-07-2024 09:00,EGGUB,41.82,57.45,41.3,57.45,15448008.0,0.0,15.63,0.65,2286.26,15.63,3286470.0,370.05,0.0,True,75.08,0.23,-0.4,0.62,2024-07-16,37.44,0,,37.04,ATH,False,False
16-07-2024 09:00,TUKAS,2.59,2.83,2.59,2.82,488889532.78,0.01,0.23,0.02,1292.16,0.23,249031216.58,96.32,0.03,True,59.88,-0.02,-0.03,0.01,2024-07-16,9.81,0,,2.25,ATH,False,False
08-07-2024 09:00,ISSEN,12.0,13.17,11.46,13.02,34785842.0,0.15,1.02,0.08,1100.0,1.02,14951789.1,132.65,0.15,True,72.29,0.2,0.05,0.15,2024-07-08,10.43,0,,9.91,ATH,False,False
08-07-2024 09:00,TRMET,57.5,63.05,56.9,62.5,86835993.0,0.55,5.0,0.62,706.45,5.0,54940313.7,58.06,0.11,True,79.72,1.43,0.62,0.81,2024-07-08,9.84,0,,ATL,ATH,False,False
01-07-2024 09:00,OYAKC,16.51,17.91,15.53,17.82,196298865.1,0.09,1.31,0.11,1086.05,1.31,129819193.48,51.21,0.07,True,67.89,0.19,0.07,0.12,2024-07-01,11.11,0,,ATL,ATH,False,False
01-07-2024 09:00,AGHOL,36.83,40.58,35.9,40.38,59956050.0,0.2,3.55,0.73,387.97,3.55,37003838.0,62.03,0.06,True,84.14,1.23,0.86,0.37,2024-07-01,11.0,0,,ATL,ATH,False,False
03-06-2024 09:00,ISKPL,1.41,1.6,1.39,1.59,201508521.01,0.01,0.18,0.04,323.73,0.18,122140620.11,64.98,0.06,True,83.44,0.04,0.01,0.02,2024-06-03,12.11,0,,ATL,ATH,False,False
20-05-2024 09:00,BOSSA,8.1,9.52,7.65,9.31,88783516.0,0.21,1.21,0.38,223.57,1.21,41820877.4,112.29,0.17,True,92.84,0.35,0.15,0.2,2024-05-20,17.91,0,,ATL,ATH,False,False
20-05-2024 09:00,EREGL,23.43,24.75,23.43,24.71,1840840262.0,0.04,1.28,0.2,540.0,1.28,932150041.6,97.48,0.03,True,77.16,0.3,0.1,0.2,2024-05-20,5.46,0,,ATL,ATH,False,False
